sentence,word,string,reversed_sentence,mod_np,reversed_mod,disambiguating_word,non_adjective,original_logprob,reversed_logprob,ratio,n_params,mpath,revision,seed_name,seed,step
It was a social function.,function,function,It was a function social., social function, function social,social,False,-14.747344970703125,-19.810104370117188,5.0627593994140625,14067712,EleutherAI/pythia-14m,step83000,seed7,7,83000
He was on the firm ground.,ground,ground,He was on the ground firm., firm ground, ground firm,firm,False,-16.849393844604492,-17.76742172241211,0.9180278778076172,14067712,EleutherAI/pythia-14m,step83000,seed7,7,83000
He was on the frozen ground.,ground,ground,He was on the ground frozen., frozen ground, ground frozen,frozen,False,-15.335084915161133,-17.668384552001953,2.3332996368408203,14067712,EleutherAI/pythia-14m,step83000,seed7,7,83000
He was on the camp ground.,ground,ground,He was on the ground camp., camp ground, ground camp,camp,True,-17.994224548339844,-16.69479751586914,-1.2994270324707031,14067712,EleutherAI/pythia-14m,step83000,seed7,7,83000
They liked the night guard.,guard,guard,They liked the guard night., night guard, guard night,night,True,-19.169498443603516,-19.321809768676758,0.1523113250732422,14067712,EleutherAI/pythia-14m,step83000,seed7,7,83000
They liked the security guard.,guard,guard,They liked the guard security., security guard, guard security,security,True,-17.02296257019043,-20.264009475708008,3.241046905517578,14067712,EleutherAI/pythia-14m,step83000,seed7,7,83000
They liked the coast guard.,guard,guard,They liked the guard coast., coast guard, guard coast,coast,True,-18.146656036376953,-22.81944465637207,4.672788619995117,14067712,EleutherAI/pythia-14m,step83000,seed7,7,83000
He had an assembly guide.,guide,guide,He had an guide assembly., assembly guide, guide assembly,assembly,True,-18.602102279663086,-24.740673065185547,6.138570785522461,14067712,EleutherAI/pythia-14m,step83000,seed7,7,83000
He had a TV guide.,guide,guide,He had a guide TV., TV guide, guide TV,TV,True,-18.77442169189453,-21.652896881103516,2.8784751892089844,14067712,EleutherAI/pythia-14m,step83000,seed7,7,83000
He had a talkative guide.,guide,guide,He had a guide talkative., talkative guide, guide talkative,talkative,False,-22.57331085205078,-25.41143798828125,2.8381271362304688,14067712,EleutherAI/pythia-14m,step83000,seed7,7,83000
It was a summer home.,home,home,It was a home summer., summer home, home summer,summer,True,-12.995784759521484,-18.57668113708496,5.580896377563477,14067712,EleutherAI/pythia-14m,step83000,seed7,7,83000
It was a childhood home.,home,home,It was a home childhood., childhood home, home childhood,childhood,True,-14.66867446899414,-19.90521812438965,5.236543655395508,14067712,EleutherAI/pythia-14m,step83000,seed7,7,83000
It was a funeral home.,home,home,It was a home funeral., funeral home, home funeral,funeral,False,-15.414628028869629,-19.268903732299805,3.854275703430176,14067712,EleutherAI/pythia-14m,step83000,seed7,7,83000
They had natural intelligence.,intelligence,intelligence,They had intelligence natural., natural intelligence, intelligence natural,natural,False,-16.80915641784668,-23.58220100402832,6.773044586181641,14067712,EleutherAI/pythia-14m,step83000,seed7,7,83000
They had innate intelligence.,intelligence,intelligence,They had intelligence innate., innate intelligence, intelligence innate,innate,False,-18.170013427734375,-25.32901954650879,7.159006118774414,14067712,EleutherAI/pythia-14m,step83000,seed7,7,83000
They had classified intelligence.,intelligence,intelligence,They had intelligence classified., classified intelligence, intelligence classified,classified,False,-19.257465362548828,-22.704111099243164,3.446645736694336,14067712,EleutherAI/pythia-14m,step83000,seed7,7,83000
It was a sensitive issue.,issue,issue,It was an issue sensitive., sensitive issue, issue sensitive,sensitive,False,-14.845823287963867,-17.074413299560547,2.2285900115966797,14067712,EleutherAI/pythia-14m,step83000,seed7,7,83000
It was a political issue.,issue,issue,It was an issue political., political issue, issue political,political,False,-10.806716918945312,-14.950687408447266,4.143970489501953,14067712,EleutherAI/pythia-14m,step83000,seed7,7,83000
It was a weekly issue.,issue,issue,It was an issue weekly., weekly issue, issue weekly,weekly,False,-17.45800018310547,-17.960132598876953,0.5021324157714844,14067712,EleutherAI/pythia-14m,step83000,seed7,7,83000
It was a blackberry jam.,jam,jam,It was a jam blackberry., blackberry jam, jam blackberry,blackberry,True,-18.885778427124023,-27.3876895904541,8.501911163330078,14067712,EleutherAI/pythia-14m,step83000,seed7,7,83000
It was a peach jam.,jam,jam,It was a jam peach., peach jam, jam peach,peach,False,-19.95354461669922,-24.840347290039062,4.886802673339844,14067712,EleutherAI/pythia-14m,step83000,seed7,7,83000
It was a traffic jam.,jam,jam,It was a jam traffic., traffic jam, jam traffic,traffic,True,-13.625234603881836,-19.742382049560547,6.117147445678711,14067712,EleutherAI/pythia-14m,step83000,seed7,7,83000
It was a duplicate key.,key,key,It was a key duplicate., duplicate key, key duplicate,duplicate,False,-18.496753692626953,-17.478771209716797,-1.0179824829101562,14067712,EleutherAI/pythia-14m,step83000,seed7,7,83000
It was a master key.,key,key,It was a key master., master key, key master,master,True,-18.253917694091797,-17.120861053466797,-1.133056640625,14067712,EleutherAI/pythia-14m,step83000,seed7,7,83000
It was a delete key.,key,key,It was a key delete., delete key, key delete,delete,False,-21.334774017333984,-18.481021881103516,-2.8537521362304688,14067712,EleutherAI/pythia-14m,step83000,seed7,7,83000
They liked the marinated lamb.,lamb,lamb,They liked the lamb marinated., marinated lamb, lamb marinated,marinated,True,-23.599281311035156,-26.702438354492188,3.1031570434570312,14067712,EleutherAI/pythia-14m,step83000,seed7,7,83000
They liked the grilled lamb.,lamb,lamb,They liked the lamb grilled., grilled lamb, lamb grilled,grilled,False,-16.88642120361328,-19.842422485351562,2.9560012817382812,14067712,EleutherAI/pythia-14m,step83000,seed7,7,83000
They liked the cute lamb.,lamb,lamb,They liked the lamb cute., cute lamb, lamb cute,cute,False,-18.58883285522461,-20.41431427001953,1.8254814147949219,14067712,EleutherAI/pythia-14m,step83000,seed7,7,83000
She had curly locks.,lock,locks,She had locks curly., curly locks, locks curly,curly,False,-20.305919647216797,-25.957969665527344,5.652050018310547,14067712,EleutherAI/pythia-14m,step83000,seed7,7,83000
She had brown locks.,lock,locks,She had locks brown., brown locks, locks brown,brown,False,-22.256092071533203,-23.975135803222656,1.7190437316894531,14067712,EleutherAI/pythia-14m,step83000,seed7,7,83000
She had window locks.,lock,locks,She had locks window., window locks, locks window,window,True,-23.045944213867188,-24.902114868164062,1.856170654296875,14067712,EleutherAI/pythia-14m,step83000,seed7,7,83000
They liked the hot lunch.,lunch,lunch,They liked the lunch hot., hot lunch, lunch hot,hot,False,-16.198856353759766,-17.99138641357422,1.7925300598144531,14067712,EleutherAI/pythia-14m,step83000,seed7,7,83000
They liked the sandwich lunch.,lunch,lunch,They liked the lunch sandwich., sandwich lunch, lunch sandwich,sandwich,True,-18.349334716796875,-17.202598571777344,-1.1467361450195312,14067712,EleutherAI/pythia-14m,step83000,seed7,7,83000
They liked the afternoon lunch.,lunch,lunch,They liked the lunch afternoon., afternoon lunch, lunch afternoon,afternoon,True,-16.349462509155273,-18.629776000976562,2.280313491821289,14067712,EleutherAI/pythia-14m,step83000,seed7,7,83000
He liked the flea market.,market,market,He liked the market flea., flea market, market flea,flea,True,-22.48543357849121,-22.701019287109375,0.21558570861816406,14067712,EleutherAI/pythia-14m,step83000,seed7,7,83000
He liked the fish market.,market,market,He liked the market fish., fish market, market fish,fish,True,-17.959888458251953,-16.63557243347168,-1.3243160247802734,14067712,EleutherAI/pythia-14m,step83000,seed7,7,83000
He liked the housing market.,market,market,He liked the market housing., housing market, market housing,housing,True,-13.911718368530273,-16.4697322845459,2.558013916015625,14067712,EleutherAI/pythia-14m,step83000,seed7,7,83000
It was a lit match.,match,match,It was a match lit., lit match, match lit,lit,False,-22.288711547851562,-21.387678146362305,-0.9010334014892578,14067712,EleutherAI/pythia-14m,step83000,seed7,7,83000
It was a burning match.,match,match,It was a match burning., burning match, match burning,burning,False,-18.750770568847656,-21.660306930541992,2.909536361694336,14067712,EleutherAI/pythia-14m,step83000,seed7,7,83000
It was a soccer match.,match,match,It was a match soccer., soccer match, match soccer,soccer,True,-14.317453384399414,-23.422101974487305,9.10464859008789,14067712,EleutherAI/pythia-14m,step83000,seed7,7,83000
It was cough medicine.,medicine,medicine,It was medicine cough., cough medicine, medicine cough,cough,True,-21.557151794433594,-24.99884033203125,3.4416885375976562,14067712,EleutherAI/pythia-14m,step83000,seed7,7,83000
It was prescription medicine.,medicine,medicine,It was medicine prescription., prescription medicine, medicine prescription,prescription,True,-19.43415641784668,-22.334365844726562,2.900209426879883,14067712,EleutherAI/pythia-14m,step83000,seed7,7,83000
It was orthopedic medicine.,medicine,medicine,It was medicine orthopedic., orthopedic medicine, medicine orthopedic,orthopedic,False,-22.74944496154785,-24.103242874145508,1.3537979125976562,14067712,EleutherAI/pythia-14m,step83000,seed7,7,83000
There was a phone message.,message,message,There was a message phone., phone message, message phone,phone,True,-14.140621185302734,-16.0013427734375,1.8607215881347656,14067712,EleutherAI/pythia-14m,step83000,seed7,7,83000
There was a computer message.,message,message,There was a message computer., computer message, message computer,computer,True,-17.931962966918945,-18.313194274902344,0.38123130798339844,14067712,EleutherAI/pythia-14m,step83000,seed7,7,83000
There was an urgent message.,message,message,There was an message urgent., urgent message, message urgent,urgent,False,-11.18145751953125,-22.525257110595703,11.343799591064453,14067712,EleutherAI/pythia-14m,step83000,seed7,7,83000
It was a fungal mold.,mold,mold,It was a mold fungal., fungal mold, mold fungal,fungal,False,-19.45846176147461,-24.01189422607422,4.553432464599609,14067712,EleutherAI/pythia-14m,step83000,seed7,7,83000
It was a harmful mold.,mold,mold,It was a mold harmful., harmful mold, mold harmful,harmful,False,-20.005584716796875,-22.664871215820312,2.6592864990234375,14067712,EleutherAI/pythia-14m,step83000,seed7,7,83000
It was a rubber mold.,mold,mold,It was a mold rubber., rubber mold, mold rubber,rubber,True,-17.750764846801758,-22.883590698242188,5.13282585144043,14067712,EleutherAI/pythia-14m,step83000,seed7,7,83000
She saw the cancerous mole.,mole,mole,She saw the mole cancerous., cancerous mole, mole cancerous,cancerous,False,-24.39459228515625,-28.835159301757812,4.4405670166015625,14067712,EleutherAI/pythia-14m,step83000,seed7,7,83000
She saw the raised mole.,mole,mole,She saw the mole raised., raised mole, mole raised,raised,False,-19.81816864013672,-18.867382049560547,-0.9507865905761719,14067712,EleutherAI/pythia-14m,step83000,seed7,7,83000
She saw the cute mole.,mole,mole,She saw the mole cute., cute mole, mole cute,cute,False,-19.819934844970703,-24.132152557373047,4.312217712402344,14067712,EleutherAI/pythia-14m,step83000,seed7,7,83000
He liked the rhythmic movement.,movement,movement,He liked the movement rhythmic., rhythmic movement, movement rhythmic,rhythmic,False,-16.541400909423828,-20.743228912353516,4.2018280029296875,14067712,EleutherAI/pythia-14m,step83000,seed7,7,83000
He liked the graceful movement.,movement,movement,He liked the movement graceful., graceful movement, movement graceful,graceful,False,-17.525049209594727,-20.672883987426758,3.1478347778320312,14067712,EleutherAI/pythia-14m,step83000,seed7,7,83000
He liked the feminist movement.,movement,movement,He liked the movement feminist., feminist movement, movement feminist,feminist,True,-14.830060005187988,-20.41038703918457,5.580327033996582,14067712,EleutherAI/pythia-14m,step83000,seed7,7,83000
It was a national newspaper.,newspaper,newspaper,It was a newspaper national., national newspaper, newspaper national,national,False,-14.868335723876953,-20.3671875,5.498851776123047,14067712,EleutherAI/pythia-14m,step83000,seed7,7,83000
It was a daily newspaper.,newspaper,newspaper,It was a newspaper daily., daily newspaper, newspaper daily,daily,False,-14.362417221069336,-17.257904052734375,2.895486831665039,14067712,EleutherAI/pythia-14m,step83000,seed7,7,83000
It was a faded newspaper.,newspaper,newspaper,It was a newspaper faded., faded newspaper, newspaper faded,faded,False,-19.27517318725586,-23.588638305664062,4.313465118408203,14067712,EleutherAI/pythia-14m,step83000,seed7,7,83000
It was a juicy orange.,orange,orange,It was an orange juicy., juicy orange, orange juicy,juicy,False,-20.091829299926758,-21.58962059020996,1.4977912902832031,14067712,EleutherAI/pythia-14m,step83000,seed7,7,83000
It was a ripe orange.,orange,orange,It was an orange ripe., ripe orange, orange ripe,ripe,False,-18.61591339111328,-17.03426170349121,-1.5816516876220703,14067712,EleutherAI/pythia-14m,step83000,seed7,7,83000
It was a bright orange.,orange,orange,It was an orange bright., bright orange, orange bright,bright,False,-11.791269302368164,-14.976171493530273,3.1849021911621094,14067712,EleutherAI/pythia-14m,step83000,seed7,7,83000
He saw the young page.,page,page,He saw the page young., young page, page young,young,False,-17.57101058959961,-19.917766571044922,2.3467559814453125,14067712,EleutherAI/pythia-14m,step83000,seed7,7,83000
He saw the loyal page.,page,page,He saw the page loyal., loyal page, page loyal,loyal,False,-21.88172149658203,-22.73568344116211,0.8539619445800781,14067712,EleutherAI/pythia-14m,step83000,seed7,7,83000
He saw the blank page.,page,page,He saw the page blank., blank page, page blank,blank,False,-14.571050643920898,-16.595561981201172,2.0245113372802734,14067712,EleutherAI/pythia-14m,step83000,seed7,7,83000
It was a calloused palm.,palm,palm,It was a palm calloused., calloused palm, palm calloused,calloused,False,-29.798980712890625,-34.77738952636719,4.9784088134765625,14067712,EleutherAI/pythia-14m,step83000,seed7,7,83000
It was a wrinkled palm.,palm,palm,It was a palm wrinkled., wrinkled palm, palm wrinkled,wrinkled,False,-21.381484985351562,-24.148778915405273,2.767293930053711,14067712,EleutherAI/pythia-14m,step83000,seed7,7,83000
It was a tropical palm.,palm,palm,It was a palm tropical., tropical palm, palm tropical,tropical,False,-21.133289337158203,-25.31624984741211,4.182960510253906,14067712,EleutherAI/pythia-14m,step83000,seed7,7,83000
It was a control panel.,panel,panel,It was a panel control., control panel, panel control,control,True,-16.891510009765625,-19.865985870361328,2.974475860595703,14067712,EleutherAI/pythia-14m,step83000,seed7,7,83000
It was an instrument panel.,panel,panel,It was an panel instrument., instrument panel, panel instrument,instrument,False,-19.983924865722656,-25.752212524414062,5.768287658691406,14067712,EleutherAI/pythia-14m,step83000,seed7,7,83000
It was an advisory panel.,panel,panel,It was an panel advisory., advisory panel, panel advisory,advisory,False,-19.727453231811523,-25.68047332763672,5.953020095825195,14067712,EleutherAI/pythia-14m,step83000,seed7,7,83000
It was a secret passage.,passage,passage,It was a passage secret., secret passage, passage secret,secret,False,-19.08393669128418,-21.766401290893555,2.682464599609375,14067712,EleutherAI/pythia-14m,step83000,seed7,7,83000
It was a narrow passage.,passage,passage,It was a passage narrow., narrow passage, passage narrow,narrow,False,-14.638800621032715,-21.83881187438965,7.200011253356934,14067712,EleutherAI/pythia-14m,step83000,seed7,7,83000
It was a literary passage.,passage,passage,It was a passage literary., literary passage, passage literary,literary,False,-18.667434692382812,-23.589696884155273,4.922262191772461,14067712,EleutherAI/pythia-14m,step83000,seed7,7,83000
It was a tasty perch.,perch,perch,It was a perch tasty., tasty perch, perch tasty,tasty,False,-22.009845733642578,-29.455726623535156,7.445880889892578,14067712,EleutherAI/pythia-14m,step83000,seed7,7,83000
It was a freshwater perch.,perch,perch,It was a perch freshwater., freshwater perch, perch freshwater,freshwater,True,-24.46681022644043,-29.81427001953125,5.34745979309082,14067712,EleutherAI/pythia-14m,step83000,seed7,7,83000
It was a lofty perch.,perch,perch,It was a perch lofty., lofty perch, perch lofty,lofty,False,-23.125732421875,-29.178817749023438,6.0530853271484375,14067712,EleutherAI/pythia-14m,step83000,seed7,7,83000
He saw the fast pitcher.,pitcher,pitcher,He saw the pitcher fast., fast pitcher, pitcher fast,fast,False,-22.268014907836914,-20.508495330810547,-1.7595195770263672,14067712,EleutherAI/pythia-14m,step83000,seed7,7,83000
He saw the right-handed pitcher.,pitcher,pitcher,He saw the pitcher right-handed., right-handed pitcher, pitcher right-handed,right-handed,False,-20.581912994384766,-24.635679244995117,4.053766250610352,14067712,EleutherAI/pythia-14m,step83000,seed7,7,83000
He saw the glass pitcher.,pitcher,pitcher,He saw the pitcher glass., glass pitcher, pitcher glass,glass,True,-20.608604431152344,-22.752483367919922,2.143878936767578,14067712,EleutherAI/pythia-14m,step83000,seed7,7,83000
It was a windy port.,port,port,It was a port windy., windy port, port windy,windy,False,-21.324962615966797,-25.88071060180664,4.555747985839844,14067712,EleutherAI/pythia-14m,step83000,seed7,7,83000
It was a seaside port.,port,port,It was a port seaside., seaside port, port seaside,seaside,True,-19.526092529296875,-27.362075805664062,7.8359832763671875,14067712,EleutherAI/pythia-14m,step83000,seed7,7,83000
It was a delicious port.,port,port,It was a port delicious., delicious port, port delicious,delicious,False,-18.454586029052734,-24.436622619628906,5.982036590576172,14067712,EleutherAI/pythia-14m,step83000,seed7,7,83000
He was in a distinguished position.,position,position,He was in a position distinguished., distinguished position, position distinguished,distinguished,False,-16.368099212646484,-18.900348663330078,2.5322494506835938,14067712,EleutherAI/pythia-14m,step83000,seed7,7,83000
He was in a prominent position.,position,position,He was in a position prominent., prominent position, position prominent,prominent,False,-11.817863464355469,-17.376354217529297,5.558490753173828,14067712,EleutherAI/pythia-14m,step83000,seed7,7,83000
He was in a fetal position.,position,position,He was in a position fetal., fetal position, position fetal,fetal,False,-15.275495529174805,-21.198625564575195,5.923130035400391,14067712,EleutherAI/pythia-14m,step83000,seed7,7,83000
It was a wooden post.,post,post,It was a post wooden., wooden post, post wooden,wooden,False,-17.062868118286133,-22.093448638916016,5.030580520629883,14067712,EleutherAI/pythia-14m,step83000,seed7,7,83000
It was a fence post.,post,post,It was a post fence., fence post, post fence,fence,True,-19.417217254638672,-22.623973846435547,3.206756591796875,14067712,EleutherAI/pythia-14m,step83000,seed7,7,83000
It was a teaching post.,post,post,It was a post teaching., teaching post, post teaching,teaching,True,-17.645706176757812,-18.263919830322266,0.6182136535644531,14067712,EleutherAI/pythia-14m,step83000,seed7,7,83000
He had the alcoholic punch.,punch,punch,He had the punch alcoholic., alcoholic punch, punch alcoholic,alcoholic,False,-21.526630401611328,-26.338233947753906,4.811603546142578,14067712,EleutherAI/pythia-14m,step83000,seed7,7,83000
He had the fruit punch.,punch,punch,He had the punch fruit., fruit punch, punch fruit,fruit,True,-21.82294464111328,-22.25513458251953,0.43218994140625,14067712,EleutherAI/pythia-14m,step83000,seed7,7,83000
He had the strongest punch.,punch,punch,He had the punch strongest., strongest punch, punch strongest,strongest,False,-18.40227508544922,-22.584983825683594,4.182708740234375,14067712,EleutherAI/pythia-14m,step83000,seed7,7,83000
She had a brilliant pupil.,pupil,pupil,She had a pupil brilliant., brilliant pupil, pupil brilliant,brilliant,False,-15.673770904541016,-25.160762786865234,9.486991882324219,14067712,EleutherAI/pythia-14m,step83000,seed7,7,83000
She had an interested pupil.,pupil,pupil,She had an pupil interested., interested pupil, pupil interested,interested,False,-18.68740463256836,-25.7672119140625,7.079807281494141,14067712,EleutherAI/pythia-14m,step83000,seed7,7,83000
She had a dilated pupil.,pupil,pupil,She had a pupil dilated., dilated pupil, pupil dilated,dilated,False,-18.917083740234375,-22.90981674194336,3.9927330017089844,14067712,EleutherAI/pythia-14m,step83000,seed7,7,83000
That was a loud racket.,racket,racket,That was a racket loud., loud racket, racket loud,loud,False,-17.23857879638672,-25.101831436157227,7.863252639770508,14067712,EleutherAI/pythia-14m,step83000,seed7,7,83000
That was an annoying racket.,racket,racket,That was an racket annoying., annoying racket, racket annoying,annoying,False,-16.728635787963867,-28.290008544921875,11.561372756958008,14067712,EleutherAI/pythia-14m,step83000,seed7,7,83000
That was a badminton racket.,racket,racket,That was a racket badminton., badminton racket, racket badminton,badminton,True,-25.66337013244629,-30.830415725708008,5.167045593261719,14067712,EleutherAI/pythia-14m,step83000,seed7,7,83000
He liked electronic rock.,rock,rock,He liked rock electronic., electronic rock, rock electronic,electronic,False,-21.016483306884766,-22.154132843017578,1.1376495361328125,14067712,EleutherAI/pythia-14m,step83000,seed7,7,83000
He liked alternative rock.,rock,rock,He liked rock alternative., alternative rock, rock alternative,alternative,False,-20.104225158691406,-23.20278549194336,3.098560333251953,14067712,EleutherAI/pythia-14m,step83000,seed7,7,83000
He liked limestone rock.,rock,rock,He liked rock limestone., limestone rock, rock limestone,limestone,True,-19.81004524230957,-21.013385772705078,1.2033405303955078,14067712,EleutherAI/pythia-14m,step83000,seed7,7,83000
He saw the wise sage.,sage,sage,He saw the sage wise., wise sage, sage wise,wise,False,-20.8167724609375,-21.86109161376953,1.0443191528320312,14067712,EleutherAI/pythia-14m,step83000,seed7,7,83000
He saw the renowned sage.,sage,sage,He saw the sage renowned., renowned sage, sage renowned,renowned,False,-21.939178466796875,-23.569107055664062,1.6299285888671875,14067712,EleutherAI/pythia-14m,step83000,seed7,7,83000
He saw the fragrant sage.,sage,sage,He saw the sage fragrant., fragrant sage, sage fragrant,fragrant,False,-22.938663482666016,-23.769515991210938,0.8308525085449219,14067712,EleutherAI/pythia-14m,step83000,seed7,7,83000
It was a fish scale.,scale,scale,It was a scale fish., fish scale, scale fish,fish,True,-20.672531127929688,-22.72289276123047,2.0503616333007812,14067712,EleutherAI/pythia-14m,step83000,seed7,7,83000
It was a lizard scale.,scale,scale,It was a scale lizard., lizard scale, scale lizard,lizard,True,-23.607906341552734,-26.054840087890625,2.4469337463378906,14067712,EleutherAI/pythia-14m,step83000,seed7,7,83000
It was a music scale.,scale,scale,It was a scale music., music scale, scale music,music,True,-17.8492431640625,-21.384300231933594,3.5350570678710938,14067712,EleutherAI/pythia-14m,step83000,seed7,7,83000
It was a touching scene.,scene,scene,It was a scene touching., touching scene, scene touching,touching,False,-15.906243324279785,-17.985525131225586,2.079281806945801,14067712,EleutherAI/pythia-14m,step83000,seed7,7,83000
It was a well-acted scene.,scene,scene,It was a scene well-acted., well-acted scene, scene well-acted,well-acted,False,-23.030323028564453,-26.301637649536133,3.2713146209716797,14067712,EleutherAI/pythia-14m,step83000,seed7,7,83000
It was a nature scene.,scene,scene,It was a scene nature., nature scene, scene nature,nature,True,-16.80724334716797,-20.201642990112305,3.394399642944336,14067712,EleutherAI/pythia-14m,step83000,seed7,7,83000
It was a gold seal.,seal,seal,It was a seal gold., gold seal, seal gold,gold,True,-16.66971206665039,-22.011154174804688,5.341442108154297,14067712,EleutherAI/pythia-14m,step83000,seed7,7,83000
It was a certified seal.,seal,seal,It was a seal certified., certified seal, seal certified,certified,False,-20.692134857177734,-22.793617248535156,2.101482391357422,14067712,EleutherAI/pythia-14m,step83000,seed7,7,83000
It was a circus seal.,seal,seal,It was a seal circus., circus seal, seal circus,circus,True,-24.55078887939453,-25.746292114257812,1.1955032348632812,14067712,EleutherAI/pythia-14m,step83000,seed7,7,83000
He used the scotch tape.,tape,tape,He used the tape scotch., scotch tape, tape scotch,scotch,True,-25.828521728515625,-28.128490447998047,2.299968719482422,14067712,EleutherAI/pythia-14m,step83000,seed7,7,83000
He used the double-sided tape.,tape,tape,He used the tape double-sided., double-sided tape, tape double-sided,double-sided,False,-21.431373596191406,-26.470914840698242,5.039541244506836,14067712,EleutherAI/pythia-14m,step83000,seed7,7,83000
He used the interview tape.,tape,tape,He used the tape interview., interview tape, tape interview,interview,True,-21.519895553588867,-21.227447509765625,-0.2924480438232422,14067712,EleutherAI/pythia-14m,step83000,seed7,7,83000
It was a winter term.,term,term,It was a term winter., winter term, term winter,winter,True,-17.518402099609375,-20.800094604492188,3.2816925048828125,14067712,EleutherAI/pythia-14m,step83000,seed7,7,83000
