sentence,word,string,reversed_sentence,mod_np,reversed_mod,disambiguating_word,non_adjective,original_logprob,reversed_logprob,ratio,n_params,mpath,revision,seed_name,seed,step
He used the interview tape.,tape,tape,He used the tape interview., interview tape, tape interview,interview,True,-16.609325408935547,-18.68453598022461,2.0752105712890625,14067712,EleutherAI/pythia-14m,step137000,seed3,3,137000
It was a winter term.,term,term,It was a term winter., winter term, term winter,winter,True,-17.09512710571289,-21.311511993408203,4.2163848876953125,14067712,EleutherAI/pythia-14m,step137000,seed3,3,137000
It was a fall term.,term,term,It was a term fall., fall term, term fall,fall,True,-17.940105438232422,-19.470813751220703,1.5307083129882812,14067712,EleutherAI/pythia-14m,step137000,seed3,3,137000
It was a legal term.,term,term,It was a term legal., legal term, term legal,legal,False,-14.509926795959473,-18.399158477783203,3.8892316818237305,14067712,EleutherAI/pythia-14m,step137000,seed3,3,137000
It was a clock tick.,tick,tick,It was a tick clock., clock tick, tick clock,clock,True,-16.241405487060547,-22.107797622680664,5.866392135620117,14067712,EleutherAI/pythia-14m,step137000,seed3,3,137000
It was an audible tick.,tick,tick,It was an tick audible., audible tick, tick audible,audible,False,-17.649694442749023,-26.980472564697266,9.330778121948242,14067712,EleutherAI/pythia-14m,step137000,seed3,3,137000
It was a parasitic tick.,tick,tick,It was a tick parasitic., parasitic tick, tick parasitic,parasitic,False,-20.79840850830078,-24.422250747680664,3.623842239379883,14067712,EleutherAI/pythia-14m,step137000,seed3,3,137000
It was a generous tip.,tip,tip,It was a tip generous., generous tip, tip generous,generous,False,-18.441650390625,-22.047399520874023,3.6057491302490234,14067712,EleutherAI/pythia-14m,step137000,seed3,3,137000
It was a stingy tip.,tip,tip,It was a tip stingy., stingy tip, tip stingy,stingy,False,-19.86111831665039,-24.55394172668457,4.69282341003418,14067712,EleutherAI/pythia-14m,step137000,seed3,3,137000
It was a pencil tip.,tip,tip,It was a tip pencil., pencil tip, tip pencil,pencil,True,-16.856470108032227,-17.885290145874023,1.0288200378417969,14067712,EleutherAI/pythia-14m,step137000,seed3,3,137000
She liked the essay title.,title,title,She liked the title essay., essay title, title essay,essay,True,-17.720714569091797,-16.887096405029297,-0.8336181640625,14067712,EleutherAI/pythia-14m,step137000,seed3,3,137000
She liked the poem title.,title,title,She liked the title poem., poem title, title poem,poem,True,-17.386993408203125,-15.112072944641113,-2.2749204635620117,14067712,EleutherAI/pythia-14m,step137000,seed3,3,137000
She liked the academic title.,title,title,She liked the title academic., academic title, title academic,academic,False,-18.150737762451172,-19.491588592529297,1.340850830078125,14067712,EleutherAI/pythia-14m,step137000,seed3,3,137000
It was a costly toll.,toll,toll,It was a toll costly., costly toll, toll costly,costly,False,-19.343053817749023,-21.633377075195312,2.290323257446289,14067712,EleutherAI/pythia-14m,step137000,seed3,3,137000
It was a road toll.,toll,toll,It was a toll road., road toll, toll road,road,True,-15.363138198852539,-16.222000122070312,0.8588619232177734,14067712,EleutherAI/pythia-14m,step137000,seed3,3,137000
It was a loud toll.,toll,toll,It was a toll loud., loud toll, toll loud,loud,False,-20.691932678222656,-21.482254028320312,0.7903213500976562,14067712,EleutherAI/pythia-14m,step137000,seed3,3,137000
She saw the train tracks.,track,tracks,She saw the tracks train., train tracks, tracks train,train,True,-15.003103256225586,-20.204723358154297,5.201620101928711,14067712,EleutherAI/pythia-14m,step137000,seed3,3,137000
She saw the trolley tracks.,track,tracks,She saw the tracks trolley., trolley tracks, tracks trolley,trolley,True,-25.564319610595703,-25.572994232177734,0.00867462158203125,14067712,EleutherAI/pythia-14m,step137000,seed3,3,137000
She saw the moose tracks.,track,tracks,She saw the tracks moose., moose tracks, tracks moose,moose,False,-25.170886993408203,-24.26776123046875,-0.9031257629394531,14067712,EleutherAI/pythia-14m,step137000,seed3,3,137000
It was five yards.,yard,yards,It was yards five., five yards, yards five,five,True,-15.462556838989258,-23.969783782958984,8.507226943969727,14067712,EleutherAI/pythia-14m,step137000,seed3,3,137000
It was ten yards.,yard,yards,It was yards ten., ten yards, yards ten,ten,True,-16.513458251953125,-25.490779876708984,8.97732162475586,14067712,EleutherAI/pythia-14m,step137000,seed3,3,137000
They were big yards.,yard,yards,They were yards big., big yards, yards big,big,False,-15.139699935913086,-18.905202865600586,3.7655029296875,14067712,EleutherAI/pythia-14m,step137000,seed3,3,137000
It was a comedic act.,act,act,It was an act comedic., comedic act, act comedic,comedic,False,-18.685955047607422,-21.56471824645996,2.878763198852539,14067712,EleutherAI/pythia-14m,step137000,seed3,3,137000
He had a pending appeal.,appeal,appeal,He had an appeal pending., pending appeal, appeal pending,pending,False,-17.112300872802734,-14.656633377075195,-2.455667495727539,14067712,EleutherAI/pythia-14m,step137000,seed3,3,137000
It was a polluted atmosphere.,atmosphere,atmosphere,It was an atmosphere polluted., polluted atmosphere, atmosphere polluted,polluted,False,-19.606884002685547,-22.22903823852539,2.6221542358398438,14067712,EleutherAI/pythia-14m,step137000,seed3,3,137000
It was a country band.,band,band,It was a band country., country band, band country,country,True,-17.162494659423828,-17.570938110351562,0.4084434509277344,14067712,EleutherAI/pythia-14m,step137000,seed3,3,137000
There was a religious barrier.,barrier,barrier,There was a barrier religious., religious barrier, barrier religious,religious,False,-20.004966735839844,-21.82020378112793,1.815237045288086,14067712,EleutherAI/pythia-14m,step137000,seed3,3,137000
He saw a baseball bat.,bat,bat,He saw a bat baseball., baseball bat, bat baseball,baseball,True,-11.105232238769531,-17.59775733947754,6.492525100708008,14067712,EleutherAI/pythia-14m,step137000,seed3,3,137000
He saw the balance beam.,beam,beam,He saw the beam balance., balance beam, beam balance,balance,True,-17.514982223510742,-19.16515350341797,1.6501712799072266,14067712,EleutherAI/pythia-14m,step137000,seed3,3,137000
She had a writer's block.,block,block,She had a block writer's., writer's block, block writer's,writer,True,-24.312286376953125,-25.58652114868164,1.2742347717285156,14067712,EleutherAI/pythia-14m,step137000,seed3,3,137000
He has royal blood.,blood,blood,He has blood royal., royal blood, blood royal,royal,False,-18.96726417541504,-21.072940826416016,2.1056766510009766,14067712,EleutherAI/pythia-14m,step137000,seed3,3,137000
It was the school board.,board,board,It was the board school., school board, board school,school,True,-12.592702865600586,-16.171463012695312,3.5787601470947266,14067712,EleutherAI/pythia-14m,step137000,seed3,3,137000
He had a leather-bound book.,book,book,He had a book leather-bound., leather-bound book, book leather-bound,leather-bound,False,-24.498414993286133,-28.79952621459961,4.301111221313477,14067712,EleutherAI/pythia-14m,step137000,seed3,3,137000
They ate a lonely breakfast.,breakfast,breakfast,They ate a breakfast lonely., lonely breakfast, breakfast lonely,lonely,False,-16.17311668395996,-19.92024803161621,3.74713134765625,14067712,EleutherAI/pythia-14m,step137000,seed3,3,137000
It was an island cape.,cape,cape,It was an cape island., island cape, cape island,island,True,-21.333065032958984,-24.30580711364746,2.9727420806884766,14067712,EleutherAI/pythia-14m,step137000,seed3,3,137000
It was a criminal case.,case,case,It was a case criminal., criminal case, case criminal,criminal,False,-9.453387260437012,-15.635331153869629,6.181943893432617,14067712,EleutherAI/pythia-14m,step137000,seed3,3,137000
It was a primary cause.,cause,cause,It was a cause primary., primary cause, cause primary,primary,False,-12.79679012298584,-22.7940673828125,9.99727725982666,14067712,EleutherAI/pythia-14m,step137000,seed3,3,137000
It was a jail cell.,cell,cell,It was a cell jail., jail cell, cell jail,jail,True,-16.47425651550293,-20.062658309936523,3.5884017944335938,14067712,EleutherAI/pythia-14m,step137000,seed3,3,137000
She had a good-luck charm.,charm,charm,She had a charm good-luck., good-luck charm, charm good-luck,good-luck,False,-24.0317325592041,-28.125097274780273,4.093364715576172,14067712,EleutherAI/pythia-14m,step137000,seed3,3,137000
They liked the pet chicken.,chicken,chicken,They liked the chicken pet., pet chicken, chicken pet,pet,True,-18.895679473876953,-17.472705841064453,-1.4229736328125,14067712,EleutherAI/pythia-14m,step137000,seed3,3,137000
It was a stimulating class.,class,class,It was a class stimulating., stimulating class, class stimulating,stimulating,False,-21.049198150634766,-22.17930030822754,1.1301021575927734,14067712,EleutherAI/pythia-14m,step137000,seed3,3,137000
It was a metal clip.,clip,clip,It was a clip metal., metal clip, clip metal,metal,True,-17.59835433959961,-20.677486419677734,3.079132080078125,14067712,EleutherAI/pythia-14m,step137000,seed3,3,137000
It was a common cold.,cold,cold,It was a cold common., common cold, cold common,common,False,-15.960932731628418,-16.75497817993164,0.7940454483032227,14067712,EleutherAI/pythia-14m,step137000,seed3,3,137000
It was a marble column.,column,column,It was a column marble., marble column, column marble,marble,True,-18.137950897216797,-22.4012451171875,4.263294219970703,14067712,EleutherAI/pythia-14m,step137000,seed3,3,137000
He liked the polite company.,company,company,He liked the company polite., polite company, company polite,polite,False,-17.574703216552734,-19.189668655395508,1.6149654388427734,14067712,EleutherAI/pythia-14m,step137000,seed3,3,137000
It was a traffic cone.,cone,cone,It was a cone traffic., traffic cone, cone traffic,traffic,True,-18.708038330078125,-23.91010284423828,5.202064514160156,14067712,EleutherAI/pythia-14m,step137000,seed3,3,137000
He made a well-written contribution.,contribution,contribution,He made a contribution well-written., well-written contribution, contribution well-written,well-written,False,-21.104167938232422,-26.791431427001953,5.687263488769531,14067712,EleutherAI/pythia-14m,step137000,seed3,3,137000
That was the correct count.,count,count,That was the count correct., correct count, count correct,correct,False,-14.660407066345215,-18.82646942138672,4.166062355041504,14067712,EleutherAI/pythia-14m,step137000,seed3,3,137000
It was a collision course.,course,course,It was a course collision., collision course, course collision,collision,True,-17.68337631225586,-22.02901840209961,4.34564208984375,14067712,EleutherAI/pythia-14m,step137000,seed3,3,137000
It was a historical date.,date,date,It was a date historical., historical date, date historical,historical,False,-16.186559677124023,-18.332218170166016,2.145658493041992,14067712,EleutherAI/pythia-14m,step137000,seed3,3,137000
It was about college degrees.,degree,degrees,It was about degrees college., college degrees, degrees college,college,True,-16.876052856445312,-23.99325942993164,7.117206573486328,14067712,EleutherAI/pythia-14m,step137000,seed3,3,137000
They liked the architectural design.,design,design,They liked the design architectural., architectural design, design architectural,architectural,False,-13.88081169128418,-17.790325164794922,3.909513473510742,14067712,EleutherAI/pythia-14m,step137000,seed3,3,137000
They liked the anniversary dinner.,dinner,dinner,They liked the dinner anniversary., anniversary dinner, dinner anniversary,anniversary,True,-20.340896606445312,-21.78155517578125,1.4406585693359375,14067712,EleutherAI/pythia-14m,step137000,seed3,3,137000
He had a career dream.,dream,dream,He had a dream career., career dream, dream career,career,True,-15.033897399902344,-14.31884765625,-0.7150497436523438,14067712,EleutherAI/pythia-14m,step137000,seed3,3,137000
It was a battery-powered drill.,drill,drill,It was a drill battery-powered., battery-powered drill, drill battery-powered,battery-powered,False,-21.383014678955078,-26.2674560546875,4.884441375732422,14067712,EleutherAI/pythia-14m,step137000,seed3,3,137000
It was a physical examination.,examination,examination,It was an examination physical., physical examination, examination physical,physical,False,-14.880584716796875,-20.08774185180664,5.207157135009766,14067712,EleutherAI/pythia-14m,step137000,seed3,3,137000
They had an enthusiastic fan.,fan,fan,They had an fan enthusiastic., enthusiastic fan, fan enthusiastic,enthusiastic,False,-14.520055770874023,-23.490489959716797,8.970434188842773,14067712,EleutherAI/pythia-14m,step137000,seed3,3,137000
She had a steel file.,file,file,She had a file steel., steel file, file steel,steel,True,-20.131559371948242,-23.964599609375,3.833040237426758,14067712,EleutherAI/pythia-14m,step137000,seed3,3,137000
It was a plastic film.,film,film,It was a film plastic., plastic film, film plastic,plastic,False,-15.089651107788086,-18.404151916503906,3.3145008087158203,14067712,EleutherAI/pythia-14m,step137000,seed3,3,137000
It was a concrete foundation.,foundation,foundation,It was a foundation concrete., concrete foundation, foundation concrete,concrete,False,-12.783615112304688,-20.774757385253906,7.991142272949219,14067712,EleutherAI/pythia-14m,step137000,seed3,3,137000
It was a business function.,function,function,It was a function business., business function, function business,business,True,-14.367873191833496,-19.692602157592773,5.324728965759277,14067712,EleutherAI/pythia-14m,step137000,seed3,3,137000
He was on the parade ground.,ground,ground,He was on the ground parade., parade ground, ground parade,parade,True,-19.058364868164062,-18.35516357421875,-0.7032012939453125,14067712,EleutherAI/pythia-14m,step137000,seed3,3,137000
They liked the national guard.,guard,guard,They liked the guard national., national guard, guard national,national,False,-17.888446807861328,-19.771648406982422,1.8832015991210938,14067712,EleutherAI/pythia-14m,step137000,seed3,3,137000
He had a friendly guide.,guide,guide,He had a guide friendly., friendly guide, guide friendly,friendly,False,-15.444694519042969,-20.20273780822754,4.75804328918457,14067712,EleutherAI/pythia-14m,step137000,seed3,3,137000
It was a nursing home.,home,home,It was a home nursing., nursing home, home nursing,nursing,True,-11.652379035949707,-15.794571876525879,4.142192840576172,14067712,EleutherAI/pythia-14m,step137000,seed3,3,137000
They had military intelligence.,intelligence,intelligence,They had intelligence military., military intelligence, intelligence military,military,False,-16.598556518554688,-20.735668182373047,4.137111663818359,14067712,EleutherAI/pythia-14m,step137000,seed3,3,137000
It was a special issue.,issue,issue,It was an issue special., special issue, issue special,special,False,-11.139198303222656,-15.246792793273926,4.1075944900512695,14067712,EleutherAI/pythia-14m,step137000,seed3,3,137000
It was a paper jam.,jam,jam,It was a jam paper., paper jam, jam paper,paper,True,-18.410804748535156,-19.36972427368164,0.9589195251464844,14067712,EleutherAI/pythia-14m,step137000,seed3,3,137000
It was a backspace key.,key,key,It was a key backspace., backspace key, key backspace,backspace,True,-24.72073745727539,-25.19437026977539,0.4736328125,14067712,EleutherAI/pythia-14m,step137000,seed3,3,137000
They liked the friendly lamb.,lamb,lamb,They liked the lamb friendly., friendly lamb, lamb friendly,friendly,False,-18.900663375854492,-21.971961975097656,3.071298599243164,14067712,EleutherAI/pythia-14m,step137000,seed3,3,137000
She had door locks.,lock,locks,She had locks door., door locks, locks door,door,True,-19.28820037841797,-20.84941864013672,1.56121826171875,14067712,EleutherAI/pythia-14m,step137000,seed3,3,137000
They liked the women's lunch.,lunch,lunch,They liked the lunch women's., women's lunch, lunch women's,women,True,-20.043193817138672,-24.6485652923584,4.605371475219727,14067712,EleutherAI/pythia-14m,step137000,seed3,3,137000
He liked the stock market.,market,market,He liked the market stock., stock market, market stock,stock,True,-12.353758811950684,-14.41535758972168,2.061598777770996,14067712,EleutherAI/pythia-14m,step137000,seed3,3,137000
It was a tennis match.,match,match,It was a match tennis., tennis match, match tennis,tennis,True,-14.363166809082031,-19.80990219116211,5.446735382080078,14067712,EleutherAI/pythia-14m,step137000,seed3,3,137000
It was veterinary medicine.,medicine,medicine,It was medicine veterinary., veterinary medicine, medicine veterinary,veterinary,False,-16.651020050048828,-23.28386688232422,6.632846832275391,14067712,EleutherAI/pythia-14m,step137000,seed3,3,137000
There was a clear message.,message,message,There was a message clear., clear message, message clear,clear,False,-13.231975555419922,-17.644317626953125,4.412342071533203,14067712,EleutherAI/pythia-14m,step137000,seed3,3,137000
It was a clay mold.,mold,mold,It was a mold clay., clay mold, mold clay,clay,True,-16.398571014404297,-19.639007568359375,3.240436553955078,14067712,EleutherAI/pythia-14m,step137000,seed3,3,137000
She saw the fast mole.,mole,mole,She saw the mole fast., fast mole, mole fast,fast,False,-20.431522369384766,-19.546785354614258,-0.8847370147705078,14067712,EleutherAI/pythia-14m,step137000,seed3,3,137000
He liked the civil-rights movement.,movement,movement,He liked the movement civil-rights., civil-rights movement, movement civil-rights,civil-rights,False,-21.557161331176758,-28.794538497924805,7.237377166748047,14067712,EleutherAI/pythia-14m,step137000,seed3,3,137000
It was a shredded newspaper.,newspaper,newspaper,It was a newspaper shredded., shredded newspaper, newspaper shredded,shredded,False,-22.29859161376953,-21.83041763305664,-0.4681739807128906,14067712,EleutherAI/pythia-14m,step137000,seed3,3,137000
It was a reddish orange.,orange,orange,It was an orange reddish., reddish orange, orange reddish,reddish,False,-16.832847595214844,-16.87066650390625,0.03781890869140625,14067712,EleutherAI/pythia-14m,step137000,seed3,3,137000
He saw the ripped page.,page,page,He saw the page ripped., ripped page, page ripped,ripped,False,-20.526813507080078,-18.69179344177246,-1.8350200653076172,14067712,EleutherAI/pythia-14m,step137000,seed3,3,137000
It was a tree palm.,palm,palm,It was a palm tree., tree palm, palm tree,tree,True,-20.37276268005371,-13.905720710754395,-6.467041969299316,14067712,EleutherAI/pythia-14m,step137000,seed3,3,137000
It was a consumer panel.,panel,panel,It was a panel consumer., consumer panel, panel consumer,consumer,True,-17.694181442260742,-20.26910972595215,2.5749282836914062,14067712,EleutherAI/pythia-14m,step137000,seed3,3,137000
It was a biblical passage.,passage,passage,It was a passage biblical., biblical passage, passage biblical,biblical,False,-16.980865478515625,-21.089921951293945,4.10905647277832,14067712,EleutherAI/pythia-14m,step137000,seed3,3,137000
It was a secure perch.,perch,perch,It was a perch secure., secure perch, perch secure,secure,False,-22.203033447265625,-24.513153076171875,2.31011962890625,14067712,EleutherAI/pythia-14m,step137000,seed3,3,137000
He saw the plastic pitcher.,pitcher,pitcher,He saw the pitcher plastic., plastic pitcher, pitcher plastic,plastic,True,-20.483993530273438,-21.426067352294922,0.9420738220214844,14067712,EleutherAI/pythia-14m,step137000,seed3,3,137000
It was a sweet port.,port,port,It was a port sweet., sweet port, port sweet,sweet,False,-17.116275787353516,-20.66248321533203,3.5462074279785156,14067712,EleutherAI/pythia-14m,step137000,seed3,3,137000
He was in a yoga position.,position,position,He was in a position yoga., yoga position, position yoga,yoga,True,-17.695693969726562,-19.045122146606445,1.3494281768798828,14067712,EleutherAI/pythia-14m,step137000,seed3,3,137000
It was a challenging post.,post,post,It was a post challenging., challenging post, post challenging,challenging,False,-16.901626586914062,-20.088397979736328,3.1867713928222656,14067712,EleutherAI/pythia-14m,step137000,seed3,3,137000
He had the quickest punch.,punch,punch,He had the punch quickest., quickest punch, punch quickest,quickest,False,-21.503662109375,-26.295207977294922,4.791545867919922,14067712,EleutherAI/pythia-14m,step137000,seed3,3,137000
She had a cloudy pupil.,pupil,pupil,She had a pupil cloudy., cloudy pupil, pupil cloudy,cloudy,False,-24.217533111572266,-26.75606918334961,2.5385360717773438,14067712,EleutherAI/pythia-14m,step137000,seed3,3,137000
That was a tennis racket.,racket,racket,That was a racket tennis., tennis racket, racket tennis,tennis,True,-17.261478424072266,-22.540939331054688,5.279460906982422,14067712,EleutherAI/pythia-14m,step137000,seed3,3,137000
He liked granite rock.,rock,rock,He liked rock granite., granite rock, rock granite,granite,True,-20.85580062866211,-21.489639282226562,0.6338386535644531,14067712,EleutherAI/pythia-14m,step137000,seed3,3,137000
He saw the bushy sage.,sage,sage,He saw the sage bushy., bushy sage, sage bushy,bushy,False,-27.39873504638672,-29.085708618164062,1.6869735717773438,14067712,EleutherAI/pythia-14m,step137000,seed3,3,137000
It was a major scale.,scale,scale,It was a scale major., major scale, scale major,major,False,-14.013723373413086,-20.148727416992188,6.135004043579102,14067712,EleutherAI/pythia-14m,step137000,seed3,3,137000
It was a panoramic scene.,scene,scene,It was a scene panoramic., panoramic scene, scene panoramic,panoramic,False,-18.437170028686523,-23.246572494506836,4.8094024658203125,14067712,EleutherAI/pythia-14m,step137000,seed3,3,137000
It was a trained seal.,seal,seal,It was a seal trained., trained seal, seal trained,trained,False,-22.846965789794922,-22.399646759033203,-0.44731903076171875,14067712,EleutherAI/pythia-14m,step137000,seed3,3,137000
He used the video tape.,tape,tape,He used the tape video., video tape, tape video,video,True,-13.667542457580566,-17.03731918334961,3.369776725769043,14067712,EleutherAI/pythia-14m,step137000,seed3,3,137000
It was a technical term.,term,term,It was a term technical., technical term, term technical,technical,False,-16.93686294555664,-19.356800079345703,2.4199371337890625,14067712,EleutherAI/pythia-14m,step137000,seed3,3,137000
It was a diseased tick.,tick,tick,It was a tick diseased., diseased tick, tick diseased,diseased,False,-23.088626861572266,-24.650156021118164,1.5615291595458984,14067712,EleutherAI/pythia-14m,step137000,seed3,3,137000
It was a finger tip.,tip,tip,It was a tip finger., finger tip, tip finger,finger,True,-18.23900604248047,-18.005529403686523,-0.2334766387939453,14067712,EleutherAI/pythia-14m,step137000,seed3,3,137000
She liked the professional title.,title,title,She liked the title professional., professional title, title professional,professional,False,-16.66725730895996,-18.406139373779297,1.738882064819336,14067712,EleutherAI/pythia-14m,step137000,seed3,3,137000
It was a bell toll.,toll,toll,It was a toll bell., bell toll, toll bell,bell,True,-21.793617248535156,-20.934524536132812,-0.8590927124023438,14067712,EleutherAI/pythia-14m,step137000,seed3,3,137000
She saw the snowshoe tracks.,track,tracks,She saw the tracks snowshoe., snowshoe tracks, tracks snowshoe,snowshoe,True,-26.687532424926758,-30.48628807067871,3.798755645751953,14067712,EleutherAI/pythia-14m,step137000,seed3,3,137000
They were cluttered yards.,yard,yards,They were yards cluttered., cluttered yards, yards cluttered,cluttered,False,-18.731796264648438,-23.957048416137695,5.225252151489258,14067712,EleutherAI/pythia-14m,step137000,seed3,3,137000
