sentence,word,string,reversed_sentence,mod_np,reversed_mod,disambiguating_word,non_adjective,original_logprob,reversed_logprob,ratio,n_params,mpath,revision,seed_name,seed,step
It was a fall term.,term,term,It was a term fall., fall term, term fall,fall,True,-18.91822052001953,-22.817882537841797,3.8996620178222656,14067712,EleutherAI/pythia-14m,step36000,seed5,5,36000
It was a legal term.,term,term,It was a term legal., legal term, term legal,legal,False,-17.681364059448242,-20.024755477905273,2.3433914184570312,14067712,EleutherAI/pythia-14m,step36000,seed5,5,36000
It was a clock tick.,tick,tick,It was a tick clock., clock tick, tick clock,clock,True,-16.816001892089844,-20.546897888183594,3.73089599609375,14067712,EleutherAI/pythia-14m,step36000,seed5,5,36000
It was an audible tick.,tick,tick,It was an tick audible., audible tick, tick audible,audible,False,-17.788780212402344,-27.96002197265625,10.171241760253906,14067712,EleutherAI/pythia-14m,step36000,seed5,5,36000
It was a parasitic tick.,tick,tick,It was a tick parasitic., parasitic tick, tick parasitic,parasitic,False,-20.920825958251953,-27.34032440185547,6.419498443603516,14067712,EleutherAI/pythia-14m,step36000,seed5,5,36000
It was a generous tip.,tip,tip,It was a tip generous., generous tip, tip generous,generous,False,-18.78022575378418,-26.770198822021484,7.989973068237305,14067712,EleutherAI/pythia-14m,step36000,seed5,5,36000
It was a stingy tip.,tip,tip,It was a tip stingy., stingy tip, tip stingy,stingy,False,-20.114294052124023,-28.397823333740234,8.283529281616211,14067712,EleutherAI/pythia-14m,step36000,seed5,5,36000
It was a pencil tip.,tip,tip,It was a tip pencil., pencil tip, tip pencil,pencil,True,-19.56218147277832,-21.67011260986328,2.107931137084961,14067712,EleutherAI/pythia-14m,step36000,seed5,5,36000
She liked the essay title.,title,title,She liked the title essay., essay title, title essay,essay,True,-21.118078231811523,-18.97472381591797,-2.1433544158935547,14067712,EleutherAI/pythia-14m,step36000,seed5,5,36000
She liked the poem title.,title,title,She liked the title poem., poem title, title poem,poem,True,-18.98467254638672,-17.50162124633789,-1.4830513000488281,14067712,EleutherAI/pythia-14m,step36000,seed5,5,36000
She liked the academic title.,title,title,She liked the title academic., academic title, title academic,academic,False,-17.611913681030273,-20.797893524169922,3.1859798431396484,14067712,EleutherAI/pythia-14m,step36000,seed5,5,36000
It was a costly toll.,toll,toll,It was a toll costly., costly toll, toll costly,costly,False,-18.933481216430664,-26.704814910888672,7.771333694458008,14067712,EleutherAI/pythia-14m,step36000,seed5,5,36000
It was a road toll.,toll,toll,It was a toll road., road toll, toll road,road,True,-18.324533462524414,-20.0095272064209,1.6849937438964844,14067712,EleutherAI/pythia-14m,step36000,seed5,5,36000
It was a loud toll.,toll,toll,It was a toll loud., loud toll, toll loud,loud,False,-22.554489135742188,-26.124168395996094,3.5696792602539062,14067712,EleutherAI/pythia-14m,step36000,seed5,5,36000
She saw the train tracks.,track,tracks,She saw the tracks train., train tracks, tracks train,train,True,-16.7845516204834,-21.807849884033203,5.023298263549805,14067712,EleutherAI/pythia-14m,step36000,seed5,5,36000
She saw the trolley tracks.,track,tracks,She saw the tracks trolley., trolley tracks, tracks trolley,trolley,True,-23.872600555419922,-27.00496482849121,3.132364273071289,14067712,EleutherAI/pythia-14m,step36000,seed5,5,36000
She saw the moose tracks.,track,tracks,She saw the tracks moose., moose tracks, tracks moose,moose,False,-26.657512664794922,-27.862274169921875,1.2047615051269531,14067712,EleutherAI/pythia-14m,step36000,seed5,5,36000
It was five yards.,yard,yards,It was yards five., five yards, yards five,five,True,-15.210587501525879,-23.322847366333008,8.112259864807129,14067712,EleutherAI/pythia-14m,step36000,seed5,5,36000
It was ten yards.,yard,yards,It was yards ten., ten yards, yards ten,ten,True,-14.824994087219238,-24.548809051513672,9.723814964294434,14067712,EleutherAI/pythia-14m,step36000,seed5,5,36000
They were big yards.,yard,yards,They were yards big., big yards, yards big,big,False,-17.870159149169922,-23.532676696777344,5.662517547607422,14067712,EleutherAI/pythia-14m,step36000,seed5,5,36000
It was a comedic act.,act,act,It was an act comedic., comedic act, act comedic,comedic,False,-19.900714874267578,-23.39249610900879,3.491781234741211,14067712,EleutherAI/pythia-14m,step36000,seed5,5,36000
He had a pending appeal.,appeal,appeal,He had an appeal pending., pending appeal, appeal pending,pending,False,-16.198705673217773,-16.473968505859375,0.27526283264160156,14067712,EleutherAI/pythia-14m,step36000,seed5,5,36000
It was a polluted atmosphere.,atmosphere,atmosphere,It was an atmosphere polluted., polluted atmosphere, atmosphere polluted,polluted,False,-23.93012809753418,-24.041160583496094,0.11103248596191406,14067712,EleutherAI/pythia-14m,step36000,seed5,5,36000
It was a country band.,band,band,It was a band country., country band, band country,country,True,-19.235097885131836,-20.189722061157227,0.9546241760253906,14067712,EleutherAI/pythia-14m,step36000,seed5,5,36000
There was a religious barrier.,barrier,barrier,There was a barrier religious., religious barrier, barrier religious,religious,False,-19.131277084350586,-24.62811279296875,5.496835708618164,14067712,EleutherAI/pythia-14m,step36000,seed5,5,36000
He saw a baseball bat.,bat,bat,He saw a bat baseball., baseball bat, bat baseball,baseball,True,-9.714702606201172,-18.739192962646484,9.024490356445312,14067712,EleutherAI/pythia-14m,step36000,seed5,5,36000
He saw the balance beam.,beam,beam,He saw the beam balance., balance beam, beam balance,balance,True,-20.312023162841797,-19.347545623779297,-0.9644775390625,14067712,EleutherAI/pythia-14m,step36000,seed5,5,36000
She had a writer's block.,block,block,She had a block writer's., writer's block, block writer's,writer,True,-22.206645965576172,-24.756954193115234,2.5503082275390625,14067712,EleutherAI/pythia-14m,step36000,seed5,5,36000
He has royal blood.,blood,blood,He has blood royal., royal blood, blood royal,royal,False,-21.390296936035156,-23.839630126953125,2.4493331909179688,14067712,EleutherAI/pythia-14m,step36000,seed5,5,36000
It was the school board.,board,board,It was the board school., school board, board school,school,True,-12.912449836730957,-17.196828842163086,4.284379005432129,14067712,EleutherAI/pythia-14m,step36000,seed5,5,36000
He had a leather-bound book.,book,book,He had a book leather-bound., leather-bound book, book leather-bound,leather-bound,False,-25.02800750732422,-31.157962799072266,6.129955291748047,14067712,EleutherAI/pythia-14m,step36000,seed5,5,36000
They ate a lonely breakfast.,breakfast,breakfast,They ate a breakfast lonely., lonely breakfast, breakfast lonely,lonely,False,-16.233009338378906,-22.086008071899414,5.852998733520508,14067712,EleutherAI/pythia-14m,step36000,seed5,5,36000
It was an island cape.,cape,cape,It was an cape island., island cape, cape island,island,True,-23.009654998779297,-24.476226806640625,1.4665718078613281,14067712,EleutherAI/pythia-14m,step36000,seed5,5,36000
It was a criminal case.,case,case,It was a case criminal., criminal case, case criminal,criminal,False,-11.493391990661621,-18.396747589111328,6.903355598449707,14067712,EleutherAI/pythia-14m,step36000,seed5,5,36000
It was a primary cause.,cause,cause,It was a cause primary., primary cause, cause primary,primary,False,-11.713560104370117,-24.885831832885742,13.172271728515625,14067712,EleutherAI/pythia-14m,step36000,seed5,5,36000
It was a jail cell.,cell,cell,It was a cell jail., jail cell, cell jail,jail,True,-16.117733001708984,-16.48949432373047,0.3717613220214844,14067712,EleutherAI/pythia-14m,step36000,seed5,5,36000
She had a good-luck charm.,charm,charm,She had a charm good-luck., good-luck charm, charm good-luck,good-luck,False,-26.41754150390625,-31.555431365966797,5.137889862060547,14067712,EleutherAI/pythia-14m,step36000,seed5,5,36000
They liked the pet chicken.,chicken,chicken,They liked the chicken pet., pet chicken, chicken pet,pet,True,-21.810562133789062,-17.991378784179688,-3.819183349609375,14067712,EleutherAI/pythia-14m,step36000,seed5,5,36000
It was a stimulating class.,class,class,It was a class stimulating., stimulating class, class stimulating,stimulating,False,-19.023054122924805,-20.58245086669922,1.559396743774414,14067712,EleutherAI/pythia-14m,step36000,seed5,5,36000
It was a metal clip.,clip,clip,It was a clip metal., metal clip, clip metal,metal,True,-18.20992088317871,-21.917402267456055,3.7074813842773438,14067712,EleutherAI/pythia-14m,step36000,seed5,5,36000
It was a common cold.,cold,cold,It was a cold common., common cold, cold common,common,False,-14.910857200622559,-18.626022338867188,3.715165138244629,14067712,EleutherAI/pythia-14m,step36000,seed5,5,36000
It was a marble column.,column,column,It was a column marble., marble column, column marble,marble,True,-18.156692504882812,-21.923641204833984,3.766948699951172,14067712,EleutherAI/pythia-14m,step36000,seed5,5,36000
He liked the polite company.,company,company,He liked the company polite., polite company, company polite,polite,False,-18.30733871459961,-20.636085510253906,2.328746795654297,14067712,EleutherAI/pythia-14m,step36000,seed5,5,36000
It was a traffic cone.,cone,cone,It was a cone traffic., traffic cone, cone traffic,traffic,True,-18.809616088867188,-23.438995361328125,4.6293792724609375,14067712,EleutherAI/pythia-14m,step36000,seed5,5,36000
He made a well-written contribution.,contribution,contribution,He made a contribution well-written., well-written contribution, contribution well-written,well-written,False,-22.355709075927734,-29.615482330322266,7.259773254394531,14067712,EleutherAI/pythia-14m,step36000,seed5,5,36000
That was the correct count.,count,count,That was the count correct., correct count, count correct,correct,False,-15.960142135620117,-20.607158660888672,4.647016525268555,14067712,EleutherAI/pythia-14m,step36000,seed5,5,36000
It was a collision course.,course,course,It was a course collision., collision course, course collision,collision,True,-16.283538818359375,-22.64057159423828,6.357032775878906,14067712,EleutherAI/pythia-14m,step36000,seed5,5,36000
It was a historical date.,date,date,It was a date historical., historical date, date historical,historical,False,-16.9490966796875,-21.232507705688477,4.283411026000977,14067712,EleutherAI/pythia-14m,step36000,seed5,5,36000
It was about college degrees.,degree,degrees,It was about degrees college., college degrees, degrees college,college,True,-20.73888397216797,-28.4718017578125,7.732917785644531,14067712,EleutherAI/pythia-14m,step36000,seed5,5,36000
They liked the architectural design.,design,design,They liked the design architectural., architectural design, design architectural,architectural,False,-15.748128890991211,-19.66936683654785,3.9212379455566406,14067712,EleutherAI/pythia-14m,step36000,seed5,5,36000
They liked the anniversary dinner.,dinner,dinner,They liked the dinner anniversary., anniversary dinner, dinner anniversary,anniversary,True,-18.72996711730957,-20.793960571289062,2.063993453979492,14067712,EleutherAI/pythia-14m,step36000,seed5,5,36000
He had a career dream.,dream,dream,He had a dream career., career dream, dream career,career,True,-17.2113037109375,-17.16960906982422,-0.04169464111328125,14067712,EleutherAI/pythia-14m,step36000,seed5,5,36000
It was a battery-powered drill.,drill,drill,It was a drill battery-powered., battery-powered drill, drill battery-powered,battery-powered,False,-25.218090057373047,-28.721460342407227,3.5033702850341797,14067712,EleutherAI/pythia-14m,step36000,seed5,5,36000
It was a physical examination.,examination,examination,It was an examination physical., physical examination, examination physical,physical,False,-13.121328353881836,-19.20075225830078,6.079423904418945,14067712,EleutherAI/pythia-14m,step36000,seed5,5,36000
They had an enthusiastic fan.,fan,fan,They had an fan enthusiastic., enthusiastic fan, fan enthusiastic,enthusiastic,False,-15.337505340576172,-25.81995964050293,10.482454299926758,14067712,EleutherAI/pythia-14m,step36000,seed5,5,36000
She had a steel file.,file,file,She had a file steel., steel file, file steel,steel,True,-18.60428810119629,-25.64875030517578,7.044462203979492,14067712,EleutherAI/pythia-14m,step36000,seed5,5,36000
It was a plastic film.,film,film,It was a film plastic., plastic film, film plastic,plastic,False,-15.006551742553711,-20.869176864624023,5.8626251220703125,14067712,EleutherAI/pythia-14m,step36000,seed5,5,36000
It was a concrete foundation.,foundation,foundation,It was a foundation concrete., concrete foundation, foundation concrete,concrete,False,-16.548351287841797,-21.63446617126465,5.086114883422852,14067712,EleutherAI/pythia-14m,step36000,seed5,5,36000
It was a business function.,function,function,It was a function business., business function, function business,business,True,-16.071821212768555,-20.21247673034668,4.140655517578125,14067712,EleutherAI/pythia-14m,step36000,seed5,5,36000
He was on the parade ground.,ground,ground,He was on the ground parade., parade ground, ground parade,parade,True,-16.347211837768555,-18.168182373046875,1.8209705352783203,14067712,EleutherAI/pythia-14m,step36000,seed5,5,36000
They liked the national guard.,guard,guard,They liked the guard national., national guard, guard national,national,False,-20.39754295349121,-25.401063919067383,5.003520965576172,14067712,EleutherAI/pythia-14m,step36000,seed5,5,36000
He had a friendly guide.,guide,guide,He had a guide friendly., friendly guide, guide friendly,friendly,False,-17.569393157958984,-22.373775482177734,4.80438232421875,14067712,EleutherAI/pythia-14m,step36000,seed5,5,36000
It was a nursing home.,home,home,It was a home nursing., nursing home, home nursing,nursing,True,-13.873882293701172,-19.856130599975586,5.982248306274414,14067712,EleutherAI/pythia-14m,step36000,seed5,5,36000
They had military intelligence.,intelligence,intelligence,They had intelligence military., military intelligence, intelligence military,military,False,-15.873090744018555,-21.550636291503906,5.677545547485352,14067712,EleutherAI/pythia-14m,step36000,seed5,5,36000
It was a special issue.,issue,issue,It was an issue special., special issue, issue special,special,False,-10.399898529052734,-16.394405364990234,5.9945068359375,14067712,EleutherAI/pythia-14m,step36000,seed5,5,36000
It was a paper jam.,jam,jam,It was a jam paper., paper jam, jam paper,paper,True,-18.945335388183594,-18.958724975585938,0.01338958740234375,14067712,EleutherAI/pythia-14m,step36000,seed5,5,36000
It was a backspace key.,key,key,It was a key backspace., backspace key, key backspace,backspace,True,-28.970216751098633,-24.073211669921875,-4.897005081176758,14067712,EleutherAI/pythia-14m,step36000,seed5,5,36000
They liked the friendly lamb.,lamb,lamb,They liked the lamb friendly., friendly lamb, lamb friendly,friendly,False,-21.728702545166016,-22.801494598388672,1.0727920532226562,14067712,EleutherAI/pythia-14m,step36000,seed5,5,36000
She had door locks.,lock,locks,She had locks door., door locks, locks door,door,True,-22.653566360473633,-25.212005615234375,2.558439254760742,14067712,EleutherAI/pythia-14m,step36000,seed5,5,36000
They liked the women's lunch.,lunch,lunch,They liked the lunch women's., women's lunch, lunch women's,women,True,-22.653076171875,-25.1197566986084,2.4666805267333984,14067712,EleutherAI/pythia-14m,step36000,seed5,5,36000
He liked the stock market.,market,market,He liked the market stock., stock market, market stock,stock,True,-12.235889434814453,-15.081013679504395,2.8451242446899414,14067712,EleutherAI/pythia-14m,step36000,seed5,5,36000
It was a tennis match.,match,match,It was a match tennis., tennis match, match tennis,tennis,True,-16.92047882080078,-21.711471557617188,4.790992736816406,14067712,EleutherAI/pythia-14m,step36000,seed5,5,36000
It was veterinary medicine.,medicine,medicine,It was medicine veterinary., veterinary medicine, medicine veterinary,veterinary,False,-19.635221481323242,-25.762943267822266,6.127721786499023,14067712,EleutherAI/pythia-14m,step36000,seed5,5,36000
There was a clear message.,message,message,There was a message clear., clear message, message clear,clear,False,-10.753702163696289,-15.612894058227539,4.85919189453125,14067712,EleutherAI/pythia-14m,step36000,seed5,5,36000
It was a clay mold.,mold,mold,It was a mold clay., clay mold, mold clay,clay,True,-18.562978744506836,-23.29308319091797,4.730104446411133,14067712,EleutherAI/pythia-14m,step36000,seed5,5,36000
She saw the fast mole.,mole,mole,She saw the mole fast., fast mole, mole fast,fast,False,-21.569934844970703,-23.08027458190918,1.5103397369384766,14067712,EleutherAI/pythia-14m,step36000,seed5,5,36000
He liked the civil-rights movement.,movement,movement,He liked the movement civil-rights., civil-rights movement, movement civil-rights,civil-rights,False,-20.61982536315918,-27.8201961517334,7.200370788574219,14067712,EleutherAI/pythia-14m,step36000,seed5,5,36000
It was a shredded newspaper.,newspaper,newspaper,It was a newspaper shredded., shredded newspaper, newspaper shredded,shredded,False,-21.359621047973633,-24.838680267333984,3.4790592193603516,14067712,EleutherAI/pythia-14m,step36000,seed5,5,36000
It was a reddish orange.,orange,orange,It was an orange reddish., reddish orange, orange reddish,reddish,False,-17.64805793762207,-16.582223892211914,-1.0658340454101562,14067712,EleutherAI/pythia-14m,step36000,seed5,5,36000
He saw the ripped page.,page,page,He saw the page ripped., ripped page, page ripped,ripped,False,-19.55610466003418,-21.113525390625,1.5574207305908203,14067712,EleutherAI/pythia-14m,step36000,seed5,5,36000
It was a tree palm.,palm,palm,It was a palm tree., tree palm, palm tree,tree,True,-21.58615493774414,-15.401098251342773,-6.185056686401367,14067712,EleutherAI/pythia-14m,step36000,seed5,5,36000
It was a consumer panel.,panel,panel,It was a panel consumer., consumer panel, panel consumer,consumer,True,-20.55083465576172,-24.91363525390625,4.362800598144531,14067712,EleutherAI/pythia-14m,step36000,seed5,5,36000
It was a biblical passage.,passage,passage,It was a passage biblical., biblical passage, passage biblical,biblical,False,-16.421463012695312,-24.089862823486328,7.668399810791016,14067712,EleutherAI/pythia-14m,step36000,seed5,5,36000
It was a secure perch.,perch,perch,It was a perch secure., secure perch, perch secure,secure,False,-24.107633590698242,-25.857402801513672,1.7497692108154297,14067712,EleutherAI/pythia-14m,step36000,seed5,5,36000
He saw the plastic pitcher.,pitcher,pitcher,He saw the pitcher plastic., plastic pitcher, pitcher plastic,plastic,True,-20.593650817871094,-23.62024688720703,3.0265960693359375,14067712,EleutherAI/pythia-14m,step36000,seed5,5,36000
It was a sweet port.,port,port,It was a port sweet., sweet port, port sweet,sweet,False,-17.787952423095703,-23.91433334350586,6.126380920410156,14067712,EleutherAI/pythia-14m,step36000,seed5,5,36000
He was in a yoga position.,position,position,He was in a position yoga., yoga position, position yoga,yoga,True,-17.021326065063477,-18.540645599365234,1.5193195343017578,14067712,EleutherAI/pythia-14m,step36000,seed5,5,36000
It was a challenging post.,post,post,It was a post challenging., challenging post, post challenging,challenging,False,-14.811267852783203,-20.734159469604492,5.922891616821289,14067712,EleutherAI/pythia-14m,step36000,seed5,5,36000
He had the quickest punch.,punch,punch,He had the punch quickest., quickest punch, punch quickest,quickest,False,-24.00140380859375,-32.68596649169922,8.684562683105469,14067712,EleutherAI/pythia-14m,step36000,seed5,5,36000
She had a cloudy pupil.,pupil,pupil,She had a pupil cloudy., cloudy pupil, pupil cloudy,cloudy,False,-21.035907745361328,-27.173646926879883,6.137739181518555,14067712,EleutherAI/pythia-14m,step36000,seed5,5,36000
That was a tennis racket.,racket,racket,That was a racket tennis., tennis racket, racket tennis,tennis,True,-15.560543060302734,-22.623455047607422,7.0629119873046875,14067712,EleutherAI/pythia-14m,step36000,seed5,5,36000
He liked granite rock.,rock,rock,He liked rock granite., granite rock, rock granite,granite,True,-20.593055725097656,-21.634113311767578,1.0410575866699219,14067712,EleutherAI/pythia-14m,step36000,seed5,5,36000
He saw the bushy sage.,sage,sage,He saw the sage bushy., bushy sage, sage bushy,bushy,False,-31.691116333007812,-34.25755310058594,2.566436767578125,14067712,EleutherAI/pythia-14m,step36000,seed5,5,36000
It was a major scale.,scale,scale,It was a scale major., major scale, scale major,major,False,-14.625299453735352,-21.540122985839844,6.914823532104492,14067712,EleutherAI/pythia-14m,step36000,seed5,5,36000
It was a panoramic scene.,scene,scene,It was a scene panoramic., panoramic scene, scene panoramic,panoramic,False,-21.608766555786133,-25.35194969177246,3.743183135986328,14067712,EleutherAI/pythia-14m,step36000,seed5,5,36000
It was a trained seal.,seal,seal,It was a seal trained., trained seal, seal trained,trained,False,-23.814653396606445,-24.104846954345703,0.2901935577392578,14067712,EleutherAI/pythia-14m,step36000,seed5,5,36000
He used the video tape.,tape,tape,He used the tape video., video tape, tape video,video,True,-15.631994247436523,-18.775035858154297,3.1430416107177734,14067712,EleutherAI/pythia-14m,step36000,seed5,5,36000
It was a technical term.,term,term,It was a term technical., technical term, term technical,technical,False,-17.153690338134766,-22.954753875732422,5.801063537597656,14067712,EleutherAI/pythia-14m,step36000,seed5,5,36000
It was a diseased tick.,tick,tick,It was a tick diseased., diseased tick, tick diseased,diseased,False,-24.240978240966797,-28.59056854248047,4.349590301513672,14067712,EleutherAI/pythia-14m,step36000,seed5,5,36000
It was a finger tip.,tip,tip,It was a tip finger., finger tip, tip finger,finger,True,-19.085994720458984,-21.350616455078125,2.2646217346191406,14067712,EleutherAI/pythia-14m,step36000,seed5,5,36000
She liked the professional title.,title,title,She liked the title professional., professional title, title professional,professional,False,-17.96503257751465,-19.91484832763672,1.9498157501220703,14067712,EleutherAI/pythia-14m,step36000,seed5,5,36000
It was a bell toll.,toll,toll,It was a toll bell., bell toll, toll bell,bell,True,-22.837631225585938,-23.579774856567383,0.7421436309814453,14067712,EleutherAI/pythia-14m,step36000,seed5,5,36000
She saw the snowshoe tracks.,track,tracks,She saw the tracks snowshoe., snowshoe tracks, tracks snowshoe,snowshoe,True,-28.148693084716797,-31.86554527282715,3.7168521881103516,14067712,EleutherAI/pythia-14m,step36000,seed5,5,36000
They were cluttered yards.,yard,yards,They were yards cluttered., cluttered yards, yards cluttered,cluttered,False,-23.84195327758789,-25.493331909179688,1.6513786315917969,14067712,EleutherAI/pythia-14m,step36000,seed5,5,36000
