sentence,word,string,reversed_sentence,mod_np,reversed_mod,disambiguating_word,non_adjective,original_logprob,reversed_logprob,ratio,n_params,mpath,revision,seed_name,seed,step
It was a fall term.,term,term,It was a term fall., fall term, term fall,fall,True,-18.18555450439453,-18.703651428222656,0.518096923828125,14067712,EleutherAI/pythia-14m,step83000,seed7,7,83000
It was a legal term.,term,term,It was a term legal., legal term, term legal,legal,False,-15.766096115112305,-17.173072814941406,1.4069766998291016,14067712,EleutherAI/pythia-14m,step83000,seed7,7,83000
It was a clock tick.,tick,tick,It was a tick clock., clock tick, tick clock,clock,True,-16.283178329467773,-21.147125244140625,4.863946914672852,14067712,EleutherAI/pythia-14m,step83000,seed7,7,83000
It was an audible tick.,tick,tick,It was an tick audible., audible tick, tick audible,audible,False,-16.64976692199707,-29.736936569213867,13.087169647216797,14067712,EleutherAI/pythia-14m,step83000,seed7,7,83000
It was a parasitic tick.,tick,tick,It was a tick parasitic., parasitic tick, tick parasitic,parasitic,False,-18.30265235900879,-24.972328186035156,6.669675827026367,14067712,EleutherAI/pythia-14m,step83000,seed7,7,83000
It was a generous tip.,tip,tip,It was a tip generous., generous tip, tip generous,generous,False,-19.25116729736328,-24.981563568115234,5.730396270751953,14067712,EleutherAI/pythia-14m,step83000,seed7,7,83000
It was a stingy tip.,tip,tip,It was a tip stingy., stingy tip, tip stingy,stingy,False,-18.535188674926758,-24.19353485107422,5.658346176147461,14067712,EleutherAI/pythia-14m,step83000,seed7,7,83000
It was a pencil tip.,tip,tip,It was a tip pencil., pencil tip, tip pencil,pencil,True,-21.96664047241211,-21.544261932373047,-0.4223785400390625,14067712,EleutherAI/pythia-14m,step83000,seed7,7,83000
She liked the essay title.,title,title,She liked the title essay., essay title, title essay,essay,True,-21.252845764160156,-18.50931739807129,-2.743528366088867,14067712,EleutherAI/pythia-14m,step83000,seed7,7,83000
She liked the poem title.,title,title,She liked the title poem., poem title, title poem,poem,True,-20.451263427734375,-19.036500930786133,-1.4147624969482422,14067712,EleutherAI/pythia-14m,step83000,seed7,7,83000
She liked the academic title.,title,title,She liked the title academic., academic title, title academic,academic,False,-16.48594856262207,-20.793725967407227,4.307777404785156,14067712,EleutherAI/pythia-14m,step83000,seed7,7,83000
It was a costly toll.,toll,toll,It was a toll costly., costly toll, toll costly,costly,False,-19.776451110839844,-24.62612533569336,4.849674224853516,14067712,EleutherAI/pythia-14m,step83000,seed7,7,83000
It was a road toll.,toll,toll,It was a toll road., road toll, toll road,road,True,-19.310522079467773,-18.229839324951172,-1.0806827545166016,14067712,EleutherAI/pythia-14m,step83000,seed7,7,83000
It was a loud toll.,toll,toll,It was a toll loud., loud toll, toll loud,loud,False,-20.17987823486328,-25.727275848388672,5.547397613525391,14067712,EleutherAI/pythia-14m,step83000,seed7,7,83000
She saw the train tracks.,track,tracks,She saw the tracks train., train tracks, tracks train,train,True,-16.41879653930664,-19.656936645507812,3.238140106201172,14067712,EleutherAI/pythia-14m,step83000,seed7,7,83000
She saw the trolley tracks.,track,tracks,She saw the tracks trolley., trolley tracks, tracks trolley,trolley,True,-25.105823516845703,-25.697731018066406,0.5919075012207031,14067712,EleutherAI/pythia-14m,step83000,seed7,7,83000
She saw the moose tracks.,track,tracks,She saw the tracks moose., moose tracks, tracks moose,moose,False,-21.180156707763672,-22.612926483154297,1.432769775390625,14067712,EleutherAI/pythia-14m,step83000,seed7,7,83000
It was five yards.,yard,yards,It was yards five., five yards, yards five,five,True,-18.230405807495117,-30.378883361816406,12.148477554321289,14067712,EleutherAI/pythia-14m,step83000,seed7,7,83000
It was ten yards.,yard,yards,It was yards ten., ten yards, yards ten,ten,True,-18.470230102539062,-29.19359588623047,10.723365783691406,14067712,EleutherAI/pythia-14m,step83000,seed7,7,83000
They were big yards.,yard,yards,They were yards big., big yards, yards big,big,False,-17.661693572998047,-25.540325164794922,7.878631591796875,14067712,EleutherAI/pythia-14m,step83000,seed7,7,83000
It was a comedic act.,act,act,It was an act comedic., comedic act, act comedic,comedic,False,-18.609149932861328,-22.65350341796875,4.044353485107422,14067712,EleutherAI/pythia-14m,step83000,seed7,7,83000
He had a pending appeal.,appeal,appeal,He had an appeal pending., pending appeal, appeal pending,pending,False,-15.554611206054688,-14.062812805175781,-1.4917984008789062,14067712,EleutherAI/pythia-14m,step83000,seed7,7,83000
It was a polluted atmosphere.,atmosphere,atmosphere,It was an atmosphere polluted., polluted atmosphere, atmosphere polluted,polluted,False,-28.433124542236328,-24.06789779663086,-4.365226745605469,14067712,EleutherAI/pythia-14m,step83000,seed7,7,83000
It was a country band.,band,band,It was a band country., country band, band country,country,True,-19.00920295715332,-17.966651916503906,-1.042551040649414,14067712,EleutherAI/pythia-14m,step83000,seed7,7,83000
There was a religious barrier.,barrier,barrier,There was a barrier religious., religious barrier, barrier religious,religious,False,-17.523815155029297,-23.27693748474121,5.753122329711914,14067712,EleutherAI/pythia-14m,step83000,seed7,7,83000
He saw a baseball bat.,bat,bat,He saw a bat baseball., baseball bat, bat baseball,baseball,True,-8.35538101196289,-16.7875919342041,8.432210922241211,14067712,EleutherAI/pythia-14m,step83000,seed7,7,83000
He saw the balance beam.,beam,beam,He saw the beam balance., balance beam, beam balance,balance,True,-21.635915756225586,-21.966793060302734,0.33087730407714844,14067712,EleutherAI/pythia-14m,step83000,seed7,7,83000
She had a writer's block.,block,block,She had a block writer's., writer's block, block writer's,writer,True,-23.301185607910156,-24.039106369018555,0.7379207611083984,14067712,EleutherAI/pythia-14m,step83000,seed7,7,83000
He has royal blood.,blood,blood,He has blood royal., royal blood, blood royal,royal,False,-22.278656005859375,-24.069843292236328,1.7911872863769531,14067712,EleutherAI/pythia-14m,step83000,seed7,7,83000
It was the school board.,board,board,It was the board school., school board, board school,school,True,-13.162073135375977,-17.218490600585938,4.056417465209961,14067712,EleutherAI/pythia-14m,step83000,seed7,7,83000
He had a leather-bound book.,book,book,He had a book leather-bound., leather-bound book, book leather-bound,leather-bound,False,-26.292936325073242,-30.252498626708984,3.959562301635742,14067712,EleutherAI/pythia-14m,step83000,seed7,7,83000
They ate a lonely breakfast.,breakfast,breakfast,They ate a breakfast lonely., lonely breakfast, breakfast lonely,lonely,False,-15.132136344909668,-20.832164764404297,5.700028419494629,14067712,EleutherAI/pythia-14m,step83000,seed7,7,83000
It was an island cape.,cape,cape,It was an cape island., island cape, cape island,island,True,-20.418991088867188,-28.686609268188477,8.267618179321289,14067712,EleutherAI/pythia-14m,step83000,seed7,7,83000
It was a criminal case.,case,case,It was a case criminal., criminal case, case criminal,criminal,False,-9.91515827178955,-15.774312973022461,5.85915470123291,14067712,EleutherAI/pythia-14m,step83000,seed7,7,83000
It was a primary cause.,cause,cause,It was a cause primary., primary cause, cause primary,primary,False,-12.305301666259766,-22.55974578857422,10.254444122314453,14067712,EleutherAI/pythia-14m,step83000,seed7,7,83000
It was a jail cell.,cell,cell,It was a cell jail., jail cell, cell jail,jail,True,-16.292160034179688,-18.417329788208008,2.1251697540283203,14067712,EleutherAI/pythia-14m,step83000,seed7,7,83000
She had a good-luck charm.,charm,charm,She had a charm good-luck., good-luck charm, charm good-luck,good-luck,False,-26.166933059692383,-30.21309471130371,4.046161651611328,14067712,EleutherAI/pythia-14m,step83000,seed7,7,83000
They liked the pet chicken.,chicken,chicken,They liked the chicken pet., pet chicken, chicken pet,pet,True,-20.161609649658203,-19.460582733154297,-0.7010269165039062,14067712,EleutherAI/pythia-14m,step83000,seed7,7,83000
It was a stimulating class.,class,class,It was a class stimulating., stimulating class, class stimulating,stimulating,False,-18.586414337158203,-22.005130767822266,3.4187164306640625,14067712,EleutherAI/pythia-14m,step83000,seed7,7,83000
It was a metal clip.,clip,clip,It was a clip metal., metal clip, clip metal,metal,True,-17.66246223449707,-19.796096801757812,2.133634567260742,14067712,EleutherAI/pythia-14m,step83000,seed7,7,83000
It was a common cold.,cold,cold,It was a cold common., common cold, cold common,common,False,-13.692316055297852,-17.57678985595703,3.8844738006591797,14067712,EleutherAI/pythia-14m,step83000,seed7,7,83000
It was a marble column.,column,column,It was a column marble., marble column, column marble,marble,True,-18.621559143066406,-21.38254165649414,2.7609825134277344,14067712,EleutherAI/pythia-14m,step83000,seed7,7,83000
He liked the polite company.,company,company,He liked the company polite., polite company, company polite,polite,False,-19.54085922241211,-21.378868103027344,1.8380088806152344,14067712,EleutherAI/pythia-14m,step83000,seed7,7,83000
It was a traffic cone.,cone,cone,It was a cone traffic., traffic cone, cone traffic,traffic,True,-17.7779598236084,-22.10590362548828,4.327943801879883,14067712,EleutherAI/pythia-14m,step83000,seed7,7,83000
He made a well-written contribution.,contribution,contribution,He made a contribution well-written., well-written contribution, contribution well-written,well-written,False,-20.41433334350586,-28.886367797851562,8.472034454345703,14067712,EleutherAI/pythia-14m,step83000,seed7,7,83000
That was the correct count.,count,count,That was the count correct., correct count, count correct,correct,False,-14.446184158325195,-21.647729873657227,7.201545715332031,14067712,EleutherAI/pythia-14m,step83000,seed7,7,83000
It was a collision course.,course,course,It was a course collision., collision course, course collision,collision,True,-14.54841423034668,-19.967811584472656,5.419397354125977,14067712,EleutherAI/pythia-14m,step83000,seed7,7,83000
It was a historical date.,date,date,It was a date historical., historical date, date historical,historical,False,-16.44591522216797,-21.159448623657227,4.713533401489258,14067712,EleutherAI/pythia-14m,step83000,seed7,7,83000
It was about college degrees.,degree,degrees,It was about degrees college., college degrees, degrees college,college,True,-15.956814765930176,-22.12773895263672,6.170924186706543,14067712,EleutherAI/pythia-14m,step83000,seed7,7,83000
They liked the architectural design.,design,design,They liked the design architectural., architectural design, design architectural,architectural,False,-15.657491683959961,-21.140369415283203,5.482877731323242,14067712,EleutherAI/pythia-14m,step83000,seed7,7,83000
They liked the anniversary dinner.,dinner,dinner,They liked the dinner anniversary., anniversary dinner, dinner anniversary,anniversary,True,-19.558395385742188,-21.650634765625,2.0922393798828125,14067712,EleutherAI/pythia-14m,step83000,seed7,7,83000
He had a career dream.,dream,dream,He had a dream career., career dream, dream career,career,True,-16.24968719482422,-14.061394691467285,-2.1882925033569336,14067712,EleutherAI/pythia-14m,step83000,seed7,7,83000
It was a battery-powered drill.,drill,drill,It was a drill battery-powered., battery-powered drill, drill battery-powered,battery-powered,False,-24.513402938842773,-28.769424438476562,4.256021499633789,14067712,EleutherAI/pythia-14m,step83000,seed7,7,83000
It was a physical examination.,examination,examination,It was an examination physical., physical examination, examination physical,physical,False,-10.810242652893066,-17.669296264648438,6.859053611755371,14067712,EleutherAI/pythia-14m,step83000,seed7,7,83000
They had an enthusiastic fan.,fan,fan,They had an fan enthusiastic., enthusiastic fan, fan enthusiastic,enthusiastic,False,-16.302343368530273,-28.927371978759766,12.625028610229492,14067712,EleutherAI/pythia-14m,step83000,seed7,7,83000
She had a steel file.,file,file,She had a file steel., steel file, file steel,steel,True,-19.0791015625,-24.212127685546875,5.133026123046875,14067712,EleutherAI/pythia-14m,step83000,seed7,7,83000
It was a plastic film.,film,film,It was a film plastic., plastic film, film plastic,plastic,False,-15.525569915771484,-19.433454513549805,3.9078845977783203,14067712,EleutherAI/pythia-14m,step83000,seed7,7,83000
It was a concrete foundation.,foundation,foundation,It was a foundation concrete., concrete foundation, foundation concrete,concrete,False,-14.886466979980469,-19.574146270751953,4.687679290771484,14067712,EleutherAI/pythia-14m,step83000,seed7,7,83000
It was a business function.,function,function,It was a function business., business function, function business,business,True,-16.695392608642578,-18.760162353515625,2.064769744873047,14067712,EleutherAI/pythia-14m,step83000,seed7,7,83000
He was on the parade ground.,ground,ground,He was on the ground parade., parade ground, ground parade,parade,True,-16.97863006591797,-17.77554702758789,0.7969169616699219,14067712,EleutherAI/pythia-14m,step83000,seed7,7,83000
They liked the national guard.,guard,guard,They liked the guard national., national guard, guard national,national,False,-17.091510772705078,-22.313928604125977,5.222417831420898,14067712,EleutherAI/pythia-14m,step83000,seed7,7,83000
He had a friendly guide.,guide,guide,He had a guide friendly., friendly guide, guide friendly,friendly,False,-14.988482475280762,-21.50857162475586,6.520089149475098,14067712,EleutherAI/pythia-14m,step83000,seed7,7,83000
It was a nursing home.,home,home,It was a home nursing., nursing home, home nursing,nursing,True,-10.59093189239502,-19.092870712280273,8.501938819885254,14067712,EleutherAI/pythia-14m,step83000,seed7,7,83000
They had military intelligence.,intelligence,intelligence,They had intelligence military., military intelligence, intelligence military,military,False,-17.076520919799805,-22.833581924438477,5.757061004638672,14067712,EleutherAI/pythia-14m,step83000,seed7,7,83000
It was a special issue.,issue,issue,It was an issue special., special issue, issue special,special,False,-11.41522216796875,-15.053890228271484,3.6386680603027344,14067712,EleutherAI/pythia-14m,step83000,seed7,7,83000
It was a paper jam.,jam,jam,It was a jam paper., paper jam, jam paper,paper,True,-18.739702224731445,-19.201648712158203,0.4619464874267578,14067712,EleutherAI/pythia-14m,step83000,seed7,7,83000
It was a backspace key.,key,key,It was a key backspace., backspace key, key backspace,backspace,True,-24.681686401367188,-20.345409393310547,-4.336277008056641,14067712,EleutherAI/pythia-14m,step83000,seed7,7,83000
They liked the friendly lamb.,lamb,lamb,They liked the lamb friendly., friendly lamb, lamb friendly,friendly,False,-19.884654998779297,-19.58782958984375,-0.2968254089355469,14067712,EleutherAI/pythia-14m,step83000,seed7,7,83000
She had door locks.,lock,locks,She had locks door., door locks, locks door,door,True,-19.097042083740234,-22.764305114746094,3.6672630310058594,14067712,EleutherAI/pythia-14m,step83000,seed7,7,83000
They liked the women's lunch.,lunch,lunch,They liked the lunch women's., women's lunch, lunch women's,women,True,-19.10814094543457,-22.798891067504883,3.6907501220703125,14067712,EleutherAI/pythia-14m,step83000,seed7,7,83000
He liked the stock market.,market,market,He liked the market stock., stock market, market stock,stock,True,-15.714864730834961,-15.006109237670898,-0.7087554931640625,14067712,EleutherAI/pythia-14m,step83000,seed7,7,83000
It was a tennis match.,match,match,It was a match tennis., tennis match, match tennis,tennis,True,-15.356745719909668,-20.55853843688965,5.2017927169799805,14067712,EleutherAI/pythia-14m,step83000,seed7,7,83000
It was veterinary medicine.,medicine,medicine,It was medicine veterinary., veterinary medicine, medicine veterinary,veterinary,False,-17.99226188659668,-23.262222290039062,5.269960403442383,14067712,EleutherAI/pythia-14m,step83000,seed7,7,83000
There was a clear message.,message,message,There was a message clear., clear message, message clear,clear,False,-10.219036102294922,-16.63721466064453,6.418178558349609,14067712,EleutherAI/pythia-14m,step83000,seed7,7,83000
It was a clay mold.,mold,mold,It was a mold clay., clay mold, mold clay,clay,True,-18.732030868530273,-21.309593200683594,2.5775623321533203,14067712,EleutherAI/pythia-14m,step83000,seed7,7,83000
She saw the fast mole.,mole,mole,She saw the mole fast., fast mole, mole fast,fast,False,-22.097976684570312,-22.192462921142578,0.09448623657226562,14067712,EleutherAI/pythia-14m,step83000,seed7,7,83000
He liked the civil-rights movement.,movement,movement,He liked the movement civil-rights., civil-rights movement, movement civil-rights,civil-rights,False,-20.945865631103516,-29.305526733398438,8.359661102294922,14067712,EleutherAI/pythia-14m,step83000,seed7,7,83000
It was a shredded newspaper.,newspaper,newspaper,It was a newspaper shredded., shredded newspaper, newspaper shredded,shredded,False,-22.821557998657227,-26.442245483398438,3.620687484741211,14067712,EleutherAI/pythia-14m,step83000,seed7,7,83000
It was a reddish orange.,orange,orange,It was an orange reddish., reddish orange, orange reddish,reddish,False,-16.253921508789062,-16.81327247619629,0.5593509674072266,14067712,EleutherAI/pythia-14m,step83000,seed7,7,83000
He saw the ripped page.,page,page,He saw the page ripped., ripped page, page ripped,ripped,False,-20.971553802490234,-20.226383209228516,-0.7451705932617188,14067712,EleutherAI/pythia-14m,step83000,seed7,7,83000
It was a tree palm.,palm,palm,It was a palm tree., tree palm, palm tree,tree,True,-20.837451934814453,-14.854596138000488,-5.982855796813965,14067712,EleutherAI/pythia-14m,step83000,seed7,7,83000
It was a consumer panel.,panel,panel,It was a panel consumer., consumer panel, panel consumer,consumer,True,-17.943458557128906,-21.60934066772461,3.665882110595703,14067712,EleutherAI/pythia-14m,step83000,seed7,7,83000
It was a biblical passage.,passage,passage,It was a passage biblical., biblical passage, passage biblical,biblical,False,-16.03334617614746,-23.70442008972168,7.671073913574219,14067712,EleutherAI/pythia-14m,step83000,seed7,7,83000
It was a secure perch.,perch,perch,It was a perch secure., secure perch, perch secure,secure,False,-24.3452205657959,-28.264244079589844,3.9190235137939453,14067712,EleutherAI/pythia-14m,step83000,seed7,7,83000
He saw the plastic pitcher.,pitcher,pitcher,He saw the pitcher plastic., plastic pitcher, pitcher plastic,plastic,True,-20.131072998046875,-24.867794036865234,4.736721038818359,14067712,EleutherAI/pythia-14m,step83000,seed7,7,83000
It was a sweet port.,port,port,It was a port sweet., sweet port, port sweet,sweet,False,-18.226760864257812,-22.154029846191406,3.9272689819335938,14067712,EleutherAI/pythia-14m,step83000,seed7,7,83000
He was in a yoga position.,position,position,He was in a position yoga., yoga position, position yoga,yoga,True,-14.85196590423584,-20.337566375732422,5.485600471496582,14067712,EleutherAI/pythia-14m,step83000,seed7,7,83000
It was a challenging post.,post,post,It was a post challenging., challenging post, post challenging,challenging,False,-15.39906120300293,-20.133060455322266,4.733999252319336,14067712,EleutherAI/pythia-14m,step83000,seed7,7,83000
He had the quickest punch.,punch,punch,He had the punch quickest., quickest punch, punch quickest,quickest,False,-20.630393981933594,-27.164289474487305,6.533895492553711,14067712,EleutherAI/pythia-14m,step83000,seed7,7,83000
She had a cloudy pupil.,pupil,pupil,She had a pupil cloudy., cloudy pupil, pupil cloudy,cloudy,False,-21.805912017822266,-27.69483757019043,5.888925552368164,14067712,EleutherAI/pythia-14m,step83000,seed7,7,83000
That was a tennis racket.,racket,racket,That was a racket tennis., tennis racket, racket tennis,tennis,True,-14.752506256103516,-23.020532608032227,8.268026351928711,14067712,EleutherAI/pythia-14m,step83000,seed7,7,83000
He liked granite rock.,rock,rock,He liked rock granite., granite rock, rock granite,granite,True,-19.540790557861328,-20.250606536865234,0.7098159790039062,14067712,EleutherAI/pythia-14m,step83000,seed7,7,83000
He saw the bushy sage.,sage,sage,He saw the sage bushy., bushy sage, sage bushy,bushy,False,-29.945499420166016,-30.457651138305664,0.5121517181396484,14067712,EleutherAI/pythia-14m,step83000,seed7,7,83000
It was a major scale.,scale,scale,It was a scale major., major scale, scale major,major,False,-14.339019775390625,-23.27911376953125,8.940093994140625,14067712,EleutherAI/pythia-14m,step83000,seed7,7,83000
It was a panoramic scene.,scene,scene,It was a scene panoramic., panoramic scene, scene panoramic,panoramic,False,-19.799903869628906,-22.119428634643555,2.3195247650146484,14067712,EleutherAI/pythia-14m,step83000,seed7,7,83000
It was a trained seal.,seal,seal,It was a seal trained., trained seal, seal trained,trained,False,-23.278179168701172,-24.62757110595703,1.3493919372558594,14067712,EleutherAI/pythia-14m,step83000,seed7,7,83000
He used the video tape.,tape,tape,He used the tape video., video tape, tape video,video,True,-14.690481185913086,-17.636077880859375,2.945596694946289,14067712,EleutherAI/pythia-14m,step83000,seed7,7,83000
It was a technical term.,term,term,It was a term technical., technical term, term technical,technical,False,-17.845041275024414,-19.075332641601562,1.2302913665771484,14067712,EleutherAI/pythia-14m,step83000,seed7,7,83000
It was a diseased tick.,tick,tick,It was a tick diseased., diseased tick, tick diseased,diseased,False,-21.44471549987793,-27.41724395751953,5.972528457641602,14067712,EleutherAI/pythia-14m,step83000,seed7,7,83000
It was a finger tip.,tip,tip,It was a tip finger., finger tip, tip finger,finger,True,-19.91171646118164,-18.559139251708984,-1.3525772094726562,14067712,EleutherAI/pythia-14m,step83000,seed7,7,83000
She liked the professional title.,title,title,She liked the title professional., professional title, title professional,professional,False,-16.887144088745117,-20.21770668029785,3.3305625915527344,14067712,EleutherAI/pythia-14m,step83000,seed7,7,83000
It was a bell toll.,toll,toll,It was a toll bell., bell toll, toll bell,bell,True,-22.582517623901367,-21.617839813232422,-0.9646778106689453,14067712,EleutherAI/pythia-14m,step83000,seed7,7,83000
She saw the snowshoe tracks.,track,tracks,She saw the tracks snowshoe., snowshoe tracks, tracks snowshoe,snowshoe,True,-30.290128707885742,-32.241180419921875,1.9510517120361328,14067712,EleutherAI/pythia-14m,step83000,seed7,7,83000
They were cluttered yards.,yard,yards,They were yards cluttered., cluttered yards, yards cluttered,cluttered,False,-26.733154296875,-30.69320297241211,3.9600486755371094,14067712,EleutherAI/pythia-14m,step83000,seed7,7,83000
