sentence,word,string,reversed_sentence,mod_np,reversed_mod,disambiguating_word,non_adjective,original_logprob,reversed_logprob,ratio,n_params,mpath,revision,seed_name,seed,step
They liked the night guard.,guard,guard,They liked the guard night., night guard, guard night,night,True,-19.885883331298828,-20.63484764099121,0.7489643096923828,14067712,EleutherAI/pythia-14m,step0,seed4,4,0
They liked the security guard.,guard,guard,They liked the guard security., security guard, guard security,security,True,-21.57599639892578,-22.439533233642578,0.8635368347167969,14067712,EleutherAI/pythia-14m,step0,seed4,4,0
They liked the coast guard.,guard,guard,They liked the guard coast., coast guard, guard coast,coast,True,-21.965179443359375,-20.910541534423828,-1.0546379089355469,14067712,EleutherAI/pythia-14m,step0,seed4,4,0
He had an assembly guide.,guide,guide,He had an guide assembly., assembly guide, guide assembly,assembly,True,-22.148387908935547,-22.862817764282227,0.7144298553466797,14067712,EleutherAI/pythia-14m,step0,seed4,4,0
He had a TV guide.,guide,guide,He had a guide TV., TV guide, guide TV,TV,True,-20.910499572753906,-20.186689376831055,-0.7238101959228516,14067712,EleutherAI/pythia-14m,step0,seed4,4,0
He had a talkative guide.,guide,guide,He had a guide talkative., talkative guide, guide talkative,talkative,False,-31.987070083618164,-33.66576385498047,1.6786937713623047,14067712,EleutherAI/pythia-14m,step0,seed4,4,0
It was a summer home.,home,home,It was a home summer., summer home, home summer,summer,True,-21.909862518310547,-21.513294219970703,-0.39656829833984375,14067712,EleutherAI/pythia-14m,step0,seed4,4,0
It was a childhood home.,home,home,It was a home childhood., childhood home, home childhood,childhood,True,-22.747364044189453,-21.48919105529785,-1.2581729888916016,14067712,EleutherAI/pythia-14m,step0,seed4,4,0
It was a funeral home.,home,home,It was a home funeral., funeral home, home funeral,funeral,False,-22.47464942932129,-21.926525115966797,-0.5481243133544922,14067712,EleutherAI/pythia-14m,step0,seed4,4,0
They had natural intelligence.,intelligence,intelligence,They had intelligence natural., natural intelligence, intelligence natural,natural,False,-21.298259735107422,-20.918907165527344,-0.3793525695800781,14067712,EleutherAI/pythia-14m,step0,seed4,4,0
They had innate intelligence.,intelligence,intelligence,They had intelligence innate., innate intelligence, intelligence innate,innate,False,-23.891433715820312,-22.484525680541992,-1.4069080352783203,14067712,EleutherAI/pythia-14m,step0,seed4,4,0
They had classified intelligence.,intelligence,intelligence,They had intelligence classified., classified intelligence, intelligence classified,classified,False,-23.053274154663086,-21.850749969482422,-1.202524185180664,14067712,EleutherAI/pythia-14m,step0,seed4,4,0
It was a sensitive issue.,issue,issue,It was an issue sensitive., sensitive issue, issue sensitive,sensitive,False,-20.80202865600586,-21.862537384033203,1.0605087280273438,14067712,EleutherAI/pythia-14m,step0,seed4,4,0
It was a political issue.,issue,issue,It was an issue political., political issue, issue political,political,False,-22.710765838623047,-22.913803100585938,0.20303726196289062,14067712,EleutherAI/pythia-14m,step0,seed4,4,0
It was a weekly issue.,issue,issue,It was an issue weekly., weekly issue, issue weekly,weekly,False,-21.537429809570312,-21.989416122436523,0.45198631286621094,14067712,EleutherAI/pythia-14m,step0,seed4,4,0
It was a blackberry jam.,jam,jam,It was a jam blackberry., blackberry jam, jam blackberry,blackberry,True,-33.638389587402344,-32.033912658691406,-1.6044769287109375,14067712,EleutherAI/pythia-14m,step0,seed4,4,0
It was a peach jam.,jam,jam,It was a jam peach., peach jam, jam peach,peach,False,-34.37718963623047,-32.014862060546875,-2.3623275756835938,14067712,EleutherAI/pythia-14m,step0,seed4,4,0
It was a traffic jam.,jam,jam,It was a jam traffic., traffic jam, jam traffic,traffic,True,-21.0927734375,-21.34698486328125,0.25421142578125,14067712,EleutherAI/pythia-14m,step0,seed4,4,0
It was a duplicate key.,key,key,It was a key duplicate., duplicate key, key duplicate,duplicate,False,-22.264684677124023,-21.281150817871094,-0.9835338592529297,14067712,EleutherAI/pythia-14m,step0,seed4,4,0
It was a master key.,key,key,It was a key master., master key, key master,master,True,-21.72142219543457,-20.661157608032227,-1.0602645874023438,14067712,EleutherAI/pythia-14m,step0,seed4,4,0
It was a delete key.,key,key,It was a key delete., delete key, key delete,delete,False,-21.056541442871094,-20.64235496520996,-0.4141864776611328,14067712,EleutherAI/pythia-14m,step0,seed4,4,0
They liked the marinated lamb.,lamb,lamb,They liked the lamb marinated., marinated lamb, lamb marinated,marinated,True,-32.8520622253418,-32.387882232666016,-0.46417999267578125,14067712,EleutherAI/pythia-14m,step0,seed4,4,0
They liked the grilled lamb.,lamb,lamb,They liked the lamb grilled., grilled lamb, lamb grilled,grilled,False,-20.750328063964844,-22.214115142822266,1.4637870788574219,14067712,EleutherAI/pythia-14m,step0,seed4,4,0
They liked the cute lamb.,lamb,lamb,They liked the lamb cute., cute lamb, lamb cute,cute,False,-22.2216739654541,-22.327533721923828,0.10585975646972656,14067712,EleutherAI/pythia-14m,step0,seed4,4,0
She had curly locks.,lock,locks,She had locks curly., curly locks, locks curly,curly,False,-22.27084732055664,-21.30513572692871,-0.9657115936279297,14067712,EleutherAI/pythia-14m,step0,seed4,4,0
She had brown locks.,lock,locks,She had locks brown., brown locks, locks brown,brown,False,-23.21036148071289,-21.90567970275879,-1.3046817779541016,14067712,EleutherAI/pythia-14m,step0,seed4,4,0
She had window locks.,lock,locks,She had locks window., window locks, locks window,window,True,-21.110876083374023,-21.127824783325195,0.016948699951171875,14067712,EleutherAI/pythia-14m,step0,seed4,4,0
They liked the hot lunch.,lunch,lunch,They liked the lunch hot., hot lunch, lunch hot,hot,False,-22.46430206298828,-23.059558868408203,0.5952568054199219,14067712,EleutherAI/pythia-14m,step0,seed4,4,0
They liked the sandwich lunch.,lunch,lunch,They liked the lunch sandwich., sandwich lunch, lunch sandwich,sandwich,True,-21.961273193359375,-22.96721649169922,1.0059432983398438,14067712,EleutherAI/pythia-14m,step0,seed4,4,0
They liked the afternoon lunch.,lunch,lunch,They liked the lunch afternoon., afternoon lunch, lunch afternoon,afternoon,True,-21.203798294067383,-21.468997955322266,0.2651996612548828,14067712,EleutherAI/pythia-14m,step0,seed4,4,0
He liked the flea market.,market,market,He liked the market flea., flea market, market flea,flea,True,-33.390113830566406,-34.236602783203125,0.8464889526367188,14067712,EleutherAI/pythia-14m,step0,seed4,4,0
He liked the fish market.,market,market,He liked the market fish., fish market, market fish,fish,True,-22.908416748046875,-22.97803497314453,0.06961822509765625,14067712,EleutherAI/pythia-14m,step0,seed4,4,0
He liked the housing market.,market,market,He liked the market housing., housing market, market housing,housing,True,-22.97393798828125,-22.620792388916016,-0.3531455993652344,14067712,EleutherAI/pythia-14m,step0,seed4,4,0
It was a lit match.,match,match,It was a match lit., lit match, match lit,lit,False,-21.624271392822266,-21.654132843017578,0.0298614501953125,14067712,EleutherAI/pythia-14m,step0,seed4,4,0
It was a burning match.,match,match,It was a match burning., burning match, match burning,burning,False,-21.217418670654297,-21.349945068359375,0.13252639770507812,14067712,EleutherAI/pythia-14m,step0,seed4,4,0
It was a soccer match.,match,match,It was a match soccer., soccer match, match soccer,soccer,True,-21.157176971435547,-21.48192596435547,0.3247489929199219,14067712,EleutherAI/pythia-14m,step0,seed4,4,0
It was cough medicine.,medicine,medicine,It was medicine cough., cough medicine, medicine cough,cough,True,-22.211204528808594,-20.741079330444336,-1.4701251983642578,14067712,EleutherAI/pythia-14m,step0,seed4,4,0
It was prescription medicine.,medicine,medicine,It was medicine prescription., prescription medicine, medicine prescription,prescription,True,-21.69285011291504,-22.19961929321289,0.5067691802978516,14067712,EleutherAI/pythia-14m,step0,seed4,4,0
It was orthopedic medicine.,medicine,medicine,It was medicine orthopedic., orthopedic medicine, medicine orthopedic,orthopedic,False,-33.34672546386719,-33.45811080932617,0.11138534545898438,14067712,EleutherAI/pythia-14m,step0,seed4,4,0
There was a phone message.,message,message,There was a message phone., phone message, message phone,phone,True,-22.232826232910156,-21.354713439941406,-0.87811279296875,14067712,EleutherAI/pythia-14m,step0,seed4,4,0
There was a computer message.,message,message,There was a message computer., computer message, message computer,computer,True,-21.683303833007812,-21.94436264038086,0.2610588073730469,14067712,EleutherAI/pythia-14m,step0,seed4,4,0
There was an urgent message.,message,message,There was an message urgent., urgent message, message urgent,urgent,False,-21.9072265625,-21.998022079467773,0.09079551696777344,14067712,EleutherAI/pythia-14m,step0,seed4,4,0
It was a fungal mold.,mold,mold,It was a mold fungal., fungal mold, mold fungal,fungal,False,-21.775020599365234,-21.465343475341797,-0.3096771240234375,14067712,EleutherAI/pythia-14m,step0,seed4,4,0
It was a harmful mold.,mold,mold,It was a mold harmful., harmful mold, mold harmful,harmful,False,-20.17473030090332,-21.851932525634766,1.6772022247314453,14067712,EleutherAI/pythia-14m,step0,seed4,4,0
It was a rubber mold.,mold,mold,It was a mold rubber., rubber mold, mold rubber,rubber,True,-20.68808364868164,-21.048358917236328,0.3602752685546875,14067712,EleutherAI/pythia-14m,step0,seed4,4,0
She saw the cancerous mole.,mole,mole,She saw the mole cancerous., cancerous mole, mole cancerous,cancerous,False,-31.223886489868164,-31.62991714477539,0.40603065490722656,14067712,EleutherAI/pythia-14m,step0,seed4,4,0
She saw the raised mole.,mole,mole,She saw the mole raised., raised mole, mole raised,raised,False,-22.078399658203125,-21.503620147705078,-0.5747795104980469,14067712,EleutherAI/pythia-14m,step0,seed4,4,0
She saw the cute mole.,mole,mole,She saw the mole cute., cute mole, mole cute,cute,False,-21.62157440185547,-21.14398956298828,-0.4775848388671875,14067712,EleutherAI/pythia-14m,step0,seed4,4,0
He liked the rhythmic movement.,movement,movement,He liked the movement rhythmic., rhythmic movement, movement rhythmic,rhythmic,False,-32.37322235107422,-32.248260498046875,-0.12496185302734375,14067712,EleutherAI/pythia-14m,step0,seed4,4,0
He liked the graceful movement.,movement,movement,He liked the movement graceful., graceful movement, movement graceful,graceful,False,-22.441667556762695,-22.545902252197266,0.10423469543457031,14067712,EleutherAI/pythia-14m,step0,seed4,4,0
He liked the feminist movement.,movement,movement,He liked the movement feminist., feminist movement, movement feminist,feminist,True,-21.598705291748047,-22.616376876831055,1.0176715850830078,14067712,EleutherAI/pythia-14m,step0,seed4,4,0
It was a national newspaper.,newspaper,newspaper,It was a newspaper national., national newspaper, newspaper national,national,False,-23.03863525390625,-23.86780548095703,0.8291702270507812,14067712,EleutherAI/pythia-14m,step0,seed4,4,0
It was a daily newspaper.,newspaper,newspaper,It was a newspaper daily., daily newspaper, newspaper daily,daily,False,-23.02376365661621,-22.373695373535156,-0.6500682830810547,14067712,EleutherAI/pythia-14m,step0,seed4,4,0
It was a faded newspaper.,newspaper,newspaper,It was a newspaper faded., faded newspaper, newspaper faded,faded,False,-22.121952056884766,-21.544719696044922,-0.5772323608398438,14067712,EleutherAI/pythia-14m,step0,seed4,4,0
It was a juicy orange.,orange,orange,It was an orange juicy., juicy orange, orange juicy,juicy,False,-33.21138381958008,-32.59379577636719,-0.6175880432128906,14067712,EleutherAI/pythia-14m,step0,seed4,4,0
It was a ripe orange.,orange,orange,It was an orange ripe., ripe orange, orange ripe,ripe,False,-21.987895965576172,-20.29796028137207,-1.6899356842041016,14067712,EleutherAI/pythia-14m,step0,seed4,4,0
It was a bright orange.,orange,orange,It was an orange bright., bright orange, orange bright,bright,False,-23.2808837890625,-22.273120880126953,-1.0077629089355469,14067712,EleutherAI/pythia-14m,step0,seed4,4,0
He saw the young page.,page,page,He saw the page young., young page, page young,young,False,-21.495006561279297,-21.223922729492188,-0.2710838317871094,14067712,EleutherAI/pythia-14m,step0,seed4,4,0
He saw the loyal page.,page,page,He saw the page loyal., loyal page, page loyal,loyal,False,-21.177703857421875,-19.95648765563965,-1.2212162017822266,14067712,EleutherAI/pythia-14m,step0,seed4,4,0
He saw the blank page.,page,page,He saw the page blank., blank page, page blank,blank,False,-21.067594528198242,-21.470264434814453,0.40266990661621094,14067712,EleutherAI/pythia-14m,step0,seed4,4,0
It was a calloused palm.,palm,palm,It was a palm calloused., calloused palm, palm calloused,calloused,False,-33.623634338378906,-33.07743835449219,-0.5461959838867188,14067712,EleutherAI/pythia-14m,step0,seed4,4,0
It was a wrinkled palm.,palm,palm,It was a palm wrinkled., wrinkled palm, palm wrinkled,wrinkled,False,-32.804656982421875,-32.02849197387695,-0.7761650085449219,14067712,EleutherAI/pythia-14m,step0,seed4,4,0
It was a tropical palm.,palm,palm,It was a palm tropical., tropical palm, palm tropical,tropical,False,-21.2854061126709,-22.492122650146484,1.206716537475586,14067712,EleutherAI/pythia-14m,step0,seed4,4,0
It was a control panel.,panel,panel,It was a panel control., control panel, panel control,control,True,-22.868968963623047,-22.96010971069336,0.0911407470703125,14067712,EleutherAI/pythia-14m,step0,seed4,4,0
It was an instrument panel.,panel,panel,It was an panel instrument., instrument panel, panel instrument,instrument,False,-22.652462005615234,-21.742324829101562,-0.9101371765136719,14067712,EleutherAI/pythia-14m,step0,seed4,4,0
It was an advisory panel.,panel,panel,It was an panel advisory., advisory panel, panel advisory,advisory,False,-21.809602737426758,-21.306835174560547,-0.5027675628662109,14067712,EleutherAI/pythia-14m,step0,seed4,4,0
It was a secret passage.,passage,passage,It was a passage secret., secret passage, passage secret,secret,False,-20.296308517456055,-21.680877685546875,1.3845691680908203,14067712,EleutherAI/pythia-14m,step0,seed4,4,0
It was a narrow passage.,passage,passage,It was a passage narrow., narrow passage, passage narrow,narrow,False,-21.348854064941406,-22.067899703979492,0.7190456390380859,14067712,EleutherAI/pythia-14m,step0,seed4,4,0
It was a literary passage.,passage,passage,It was a passage literary., literary passage, passage literary,literary,False,-23.07327651977539,-22.665510177612305,-0.40776634216308594,14067712,EleutherAI/pythia-14m,step0,seed4,4,0
It was a tasty perch.,perch,perch,It was a perch tasty., tasty perch, perch tasty,tasty,False,-32.91587829589844,-34.28594207763672,1.3700637817382812,14067712,EleutherAI/pythia-14m,step0,seed4,4,0
It was a freshwater perch.,perch,perch,It was a perch freshwater., freshwater perch, perch freshwater,freshwater,True,-33.30120086669922,-34.88452911376953,1.5833282470703125,14067712,EleutherAI/pythia-14m,step0,seed4,4,0
It was a lofty perch.,perch,perch,It was a perch lofty., lofty perch, perch lofty,lofty,False,-43.64274597167969,-45.50311279296875,1.8603668212890625,14067712,EleutherAI/pythia-14m,step0,seed4,4,0
He saw the fast pitcher.,pitcher,pitcher,He saw the pitcher fast., fast pitcher, pitcher fast,fast,False,-20.984092712402344,-19.712024688720703,-1.2720680236816406,14067712,EleutherAI/pythia-14m,step0,seed4,4,0
He saw the right-handed pitcher.,pitcher,pitcher,He saw the pitcher right-handed., right-handed pitcher, pitcher right-handed,right-handed,False,-45.62608337402344,-44.294612884521484,-1.3314704895019531,14067712,EleutherAI/pythia-14m,step0,seed4,4,0
He saw the glass pitcher.,pitcher,pitcher,He saw the pitcher glass., glass pitcher, pitcher glass,glass,True,-21.396732330322266,-21.460098266601562,0.06336593627929688,14067712,EleutherAI/pythia-14m,step0,seed4,4,0
It was a windy port.,port,port,It was a port windy., windy port, port windy,windy,False,-33.575416564941406,-32.90715408325195,-0.6682624816894531,14067712,EleutherAI/pythia-14m,step0,seed4,4,0
It was a seaside port.,port,port,It was a port seaside., seaside port, port seaside,seaside,True,-33.420631408691406,-34.070438385009766,0.6498069763183594,14067712,EleutherAI/pythia-14m,step0,seed4,4,0
It was a delicious port.,port,port,It was a port delicious., delicious port, port delicious,delicious,False,-21.412569046020508,-21.081300735473633,-0.331268310546875,14067712,EleutherAI/pythia-14m,step0,seed4,4,0
He was in a distinguished position.,position,position,He was in a position distinguished., distinguished position, position distinguished,distinguished,False,-21.11783218383789,-20.952661514282227,-0.16517066955566406,14067712,EleutherAI/pythia-14m,step0,seed4,4,0
He was in a prominent position.,position,position,He was in a position prominent., prominent position, position prominent,prominent,False,-23.19150161743164,-21.82624626159668,-1.365255355834961,14067712,EleutherAI/pythia-14m,step0,seed4,4,0
He was in a fetal position.,position,position,He was in a position fetal., fetal position, position fetal,fetal,False,-21.393692016601562,-19.22870635986328,-2.1649856567382812,14067712,EleutherAI/pythia-14m,step0,seed4,4,0
It was a wooden post.,post,post,It was a post wooden., wooden post, post wooden,wooden,False,-21.513940811157227,-20.934566497802734,-0.5793743133544922,14067712,EleutherAI/pythia-14m,step0,seed4,4,0
It was a fence post.,post,post,It was a post fence., fence post, post fence,fence,True,-22.57611846923828,-22.170207977294922,-0.4059104919433594,14067712,EleutherAI/pythia-14m,step0,seed4,4,0
It was a teaching post.,post,post,It was a post teaching., teaching post, post teaching,teaching,True,-21.07592010498047,-21.7200927734375,0.6441726684570312,14067712,EleutherAI/pythia-14m,step0,seed4,4,0
He had the alcoholic punch.,punch,punch,He had the punch alcoholic., alcoholic punch, punch alcoholic,alcoholic,False,-24.16973114013672,-23.29362678527832,-0.8761043548583984,14067712,EleutherAI/pythia-14m,step0,seed4,4,0
He had the fruit punch.,punch,punch,He had the punch fruit., fruit punch, punch fruit,fruit,True,-21.370161056518555,-22.040578842163086,0.6704177856445312,14067712,EleutherAI/pythia-14m,step0,seed4,4,0
He had the strongest punch.,punch,punch,He had the punch strongest., strongest punch, punch strongest,strongest,False,-24.10045623779297,-23.384883880615234,-0.7155723571777344,14067712,EleutherAI/pythia-14m,step0,seed4,4,0
She had a brilliant pupil.,pupil,pupil,She had a pupil brilliant., brilliant pupil, pupil brilliant,brilliant,False,-21.502361297607422,-21.243000030517578,-0.25936126708984375,14067712,EleutherAI/pythia-14m,step0,seed4,4,0
She had an interested pupil.,pupil,pupil,She had an pupil interested., interested pupil, pupil interested,interested,False,-20.488258361816406,-21.529022216796875,1.0407638549804688,14067712,EleutherAI/pythia-14m,step0,seed4,4,0
She had a dilated pupil.,pupil,pupil,She had a pupil dilated., dilated pupil, pupil dilated,dilated,False,-20.87505531311035,-20.47948455810547,-0.3955707550048828,14067712,EleutherAI/pythia-14m,step0,seed4,4,0
That was a loud racket.,racket,racket,That was a racket loud., loud racket, racket loud,loud,False,-22.62316131591797,-22.207080841064453,-0.4160804748535156,14067712,EleutherAI/pythia-14m,step0,seed4,4,0
That was an annoying racket.,racket,racket,That was an racket annoying., annoying racket, racket annoying,annoying,False,-22.264293670654297,-21.99500274658203,-0.2692909240722656,14067712,EleutherAI/pythia-14m,step0,seed4,4,0
That was a badminton racket.,racket,racket,That was a racket badminton., badminton racket, racket badminton,badminton,True,-44.19370651245117,-43.8681526184082,-0.32555389404296875,14067712,EleutherAI/pythia-14m,step0,seed4,4,0
He liked electronic rock.,rock,rock,He liked rock electronic., electronic rock, rock electronic,electronic,False,-21.297718048095703,-21.593265533447266,0.2955474853515625,14067712,EleutherAI/pythia-14m,step0,seed4,4,0
He liked alternative rock.,rock,rock,He liked rock alternative., alternative rock, rock alternative,alternative,False,-22.262874603271484,-22.469533920288086,0.20665931701660156,14067712,EleutherAI/pythia-14m,step0,seed4,4,0
He liked limestone rock.,rock,rock,He liked rock limestone., limestone rock, rock limestone,limestone,True,-22.155807495117188,-22.047422409057617,-0.10838508605957031,14067712,EleutherAI/pythia-14m,step0,seed4,4,0
He saw the wise sage.,sage,sage,He saw the sage wise., wise sage, sage wise,wise,False,-23.88360023498535,-24.150745391845703,0.26714515686035156,14067712,EleutherAI/pythia-14m,step0,seed4,4,0
He saw the renowned sage.,sage,sage,He saw the sage renowned., renowned sage, sage renowned,renowned,False,-23.236881256103516,-22.81610107421875,-0.4207801818847656,14067712,EleutherAI/pythia-14m,step0,seed4,4,0
He saw the fragrant sage.,sage,sage,He saw the sage fragrant., fragrant sage, sage fragrant,fragrant,False,-33.774078369140625,-33.892112731933594,0.11803436279296875,14067712,EleutherAI/pythia-14m,step0,seed4,4,0
It was a fish scale.,scale,scale,It was a scale fish., fish scale, scale fish,fish,True,-22.93523406982422,-23.734540939331055,0.7993068695068359,14067712,EleutherAI/pythia-14m,step0,seed4,4,0
It was a lizard scale.,scale,scale,It was a scale lizard., lizard scale, scale lizard,lizard,True,-32.76056671142578,-34.384525299072266,1.6239585876464844,14067712,EleutherAI/pythia-14m,step0,seed4,4,0
It was a music scale.,scale,scale,It was a scale music., music scale, scale music,music,True,-22.254505157470703,-22.475624084472656,0.22111892700195312,14067712,EleutherAI/pythia-14m,step0,seed4,4,0
It was a touching scene.,scene,scene,It was a scene touching., touching scene, scene touching,touching,False,-21.626873016357422,-21.01041030883789,-0.6164627075195312,14067712,EleutherAI/pythia-14m,step0,seed4,4,0
It was a well-acted scene.,scene,scene,It was a scene well-acted., well-acted scene, scene well-acted,well-acted,False,-44.524559020996094,-42.82741165161133,-1.6971473693847656,14067712,EleutherAI/pythia-14m,step0,seed4,4,0
It was a nature scene.,scene,scene,It was a scene nature., nature scene, scene nature,nature,True,-23.23478889465332,-21.767486572265625,-1.4673023223876953,14067712,EleutherAI/pythia-14m,step0,seed4,4,0
It was a gold seal.,seal,seal,It was a seal gold., gold seal, seal gold,gold,True,-22.30320167541504,-22.030059814453125,-0.27314186096191406,14067712,EleutherAI/pythia-14m,step0,seed4,4,0
It was a certified seal.,seal,seal,It was a seal certified., certified seal, seal certified,certified,False,-21.559101104736328,-22.402420043945312,0.8433189392089844,14067712,EleutherAI/pythia-14m,step0,seed4,4,0
It was a circus seal.,seal,seal,It was a seal circus., circus seal, seal circus,circus,True,-21.68872833251953,-23.09020233154297,1.4014739990234375,14067712,EleutherAI/pythia-14m,step0,seed4,4,0
He used the scotch tape.,tape,tape,He used the tape scotch., scotch tape, tape scotch,scotch,True,-45.81247329711914,-45.87510681152344,0.06263351440429688,14067712,EleutherAI/pythia-14m,step0,seed4,4,0
He used the double-sided tape.,tape,tape,He used the tape double-sided., double-sided tape, tape double-sided,double-sided,False,-43.099971771240234,-43.7512321472168,0.6512603759765625,14067712,EleutherAI/pythia-14m,step0,seed4,4,0
He used the interview tape.,tape,tape,He used the tape interview., interview tape, tape interview,interview,True,-21.766193389892578,-22.360383987426758,0.5941905975341797,14067712,EleutherAI/pythia-14m,step0,seed4,4,0
It was a winter term.,term,term,It was a term winter., winter term, term winter,winter,True,-20.57321548461914,-22.22406578063965,1.6508502960205078,14067712,EleutherAI/pythia-14m,step0,seed4,4,0
It was a fall term.,term,term,It was a term fall., fall term, term fall,fall,True,-22.225290298461914,-23.975372314453125,1.750082015991211,14067712,EleutherAI/pythia-14m,step0,seed4,4,0
It was a legal term.,term,term,It was a term legal., legal term, term legal,legal,False,-21.847440719604492,-21.34579849243164,-0.5016422271728516,14067712,EleutherAI/pythia-14m,step0,seed4,4,0
It was a clock tick.,tick,tick,It was a tick clock., clock tick, tick clock,clock,True,-22.090307235717773,-21.413917541503906,-0.6763896942138672,14067712,EleutherAI/pythia-14m,step0,seed4,4,0
It was an audible tick.,tick,tick,It was an tick audible., audible tick, tick audible,audible,False,-21.233829498291016,-22.72286605834961,1.4890365600585938,14067712,EleutherAI/pythia-14m,step0,seed4,4,0
It was a parasitic tick.,tick,tick,It was a tick parasitic., parasitic tick, tick parasitic,parasitic,False,-20.99264907836914,-22.507671356201172,1.5150222778320312,14067712,EleutherAI/pythia-14m,step0,seed4,4,0
It was a generous tip.,tip,tip,It was a tip generous., generous tip, tip generous,generous,False,-20.092742919921875,-19.984359741210938,-0.1083831787109375,14067712,EleutherAI/pythia-14m,step0,seed4,4,0
It was a stingy tip.,tip,tip,It was a tip stingy., stingy tip, tip stingy,stingy,False,-32.993587493896484,-32.89891815185547,-0.09466934204101562,14067712,EleutherAI/pythia-14m,step0,seed4,4,0
It was a pencil tip.,tip,tip,It was a tip pencil., pencil tip, tip pencil,pencil,True,-22.54015350341797,-21.430679321289062,-1.1094741821289062,14067712,EleutherAI/pythia-14m,step0,seed4,4,0
She liked the essay title.,title,title,She liked the title essay., essay title, title essay,essay,True,-23.020030975341797,-22.604183197021484,-0.4158477783203125,14067712,EleutherAI/pythia-14m,step0,seed4,4,0
