sentence,word,string,reversed_sentence,mod_np,reversed_mod,disambiguating_word,non_adjective,original_logprob,reversed_logprob,ratio,n_params,mpath,revision,seed_name,seed,step
It was a fall term.,term,term,It was a term fall., fall term, term fall,fall,True,-16.91800308227539,-20.534358978271484,3.6163558959960938,14067712,EleutherAI/pythia-14m,step52000,seed8,8,52000
It was a legal term.,term,term,It was a term legal., legal term, term legal,legal,False,-15.02706527709961,-18.952953338623047,3.9258880615234375,14067712,EleutherAI/pythia-14m,step52000,seed8,8,52000
It was a clock tick.,tick,tick,It was a tick clock., clock tick, tick clock,clock,True,-15.330697059631348,-16.716520309448242,1.3858232498168945,14067712,EleutherAI/pythia-14m,step52000,seed8,8,52000
It was an audible tick.,tick,tick,It was an tick audible., audible tick, tick audible,audible,False,-18.80722999572754,-24.650367736816406,5.843137741088867,14067712,EleutherAI/pythia-14m,step52000,seed8,8,52000
It was a parasitic tick.,tick,tick,It was a tick parasitic., parasitic tick, tick parasitic,parasitic,False,-22.206298828125,-22.060630798339844,-0.14566802978515625,14067712,EleutherAI/pythia-14m,step52000,seed8,8,52000
It was a generous tip.,tip,tip,It was a tip generous., generous tip, tip generous,generous,False,-18.647153854370117,-22.391910552978516,3.7447566986083984,14067712,EleutherAI/pythia-14m,step52000,seed8,8,52000
It was a stingy tip.,tip,tip,It was a tip stingy., stingy tip, tip stingy,stingy,False,-21.506633758544922,-25.82269859313965,4.316064834594727,14067712,EleutherAI/pythia-14m,step52000,seed8,8,52000
It was a pencil tip.,tip,tip,It was a tip pencil., pencil tip, tip pencil,pencil,True,-17.65205192565918,-18.298852920532227,0.6468009948730469,14067712,EleutherAI/pythia-14m,step52000,seed8,8,52000
She liked the essay title.,title,title,She liked the title essay., essay title, title essay,essay,True,-16.222244262695312,-13.853074073791504,-2.3691701889038086,14067712,EleutherAI/pythia-14m,step52000,seed8,8,52000
She liked the poem title.,title,title,She liked the title poem., poem title, title poem,poem,True,-14.845636367797852,-14.038515090942383,-0.8071212768554688,14067712,EleutherAI/pythia-14m,step52000,seed8,8,52000
She liked the academic title.,title,title,She liked the title academic., academic title, title academic,academic,False,-16.28075408935547,-18.624271392822266,2.343517303466797,14067712,EleutherAI/pythia-14m,step52000,seed8,8,52000
It was a costly toll.,toll,toll,It was a toll costly., costly toll, toll costly,costly,False,-18.31821060180664,-22.344940185546875,4.026729583740234,14067712,EleutherAI/pythia-14m,step52000,seed8,8,52000
It was a road toll.,toll,toll,It was a toll road., road toll, toll road,road,True,-19.79262924194336,-14.965078353881836,-4.827550888061523,14067712,EleutherAI/pythia-14m,step52000,seed8,8,52000
It was a loud toll.,toll,toll,It was a toll loud., loud toll, toll loud,loud,False,-19.148462295532227,-25.69500732421875,6.546545028686523,14067712,EleutherAI/pythia-14m,step52000,seed8,8,52000
She saw the train tracks.,track,tracks,She saw the tracks train., train tracks, tracks train,train,True,-14.062143325805664,-17.080509185791016,3.0183658599853516,14067712,EleutherAI/pythia-14m,step52000,seed8,8,52000
She saw the trolley tracks.,track,tracks,She saw the tracks trolley., trolley tracks, tracks trolley,trolley,True,-27.86899185180664,-27.57744789123535,-0.29154396057128906,14067712,EleutherAI/pythia-14m,step52000,seed8,8,52000
She saw the moose tracks.,track,tracks,She saw the tracks moose., moose tracks, tracks moose,moose,False,-23.935142517089844,-26.15406036376953,2.2189178466796875,14067712,EleutherAI/pythia-14m,step52000,seed8,8,52000
It was five yards.,yard,yards,It was yards five., five yards, yards five,five,True,-16.341678619384766,-26.064414978027344,9.722736358642578,14067712,EleutherAI/pythia-14m,step52000,seed8,8,52000
It was ten yards.,yard,yards,It was yards ten., ten yards, yards ten,ten,True,-15.928342819213867,-27.61423110961914,11.685888290405273,14067712,EleutherAI/pythia-14m,step52000,seed8,8,52000
They were big yards.,yard,yards,They were yards big., big yards, yards big,big,False,-16.784881591796875,-19.335674285888672,2.550792694091797,14067712,EleutherAI/pythia-14m,step52000,seed8,8,52000
It was a comedic act.,act,act,It was an act comedic., comedic act, act comedic,comedic,False,-17.24139404296875,-19.780982971191406,2.5395889282226562,14067712,EleutherAI/pythia-14m,step52000,seed8,8,52000
He had a pending appeal.,appeal,appeal,He had an appeal pending., pending appeal, appeal pending,pending,False,-18.031295776367188,-14.514015197753906,-3.5172805786132812,14067712,EleutherAI/pythia-14m,step52000,seed8,8,52000
It was a polluted atmosphere.,atmosphere,atmosphere,It was an atmosphere polluted., polluted atmosphere, atmosphere polluted,polluted,False,-23.45677947998047,-23.747806549072266,0.2910270690917969,14067712,EleutherAI/pythia-14m,step52000,seed8,8,52000
It was a country band.,band,band,It was a band country., country band, band country,country,True,-16.866605758666992,-19.13507080078125,2.268465042114258,14067712,EleutherAI/pythia-14m,step52000,seed8,8,52000
There was a religious barrier.,barrier,barrier,There was a barrier religious., religious barrier, barrier religious,religious,False,-21.287647247314453,-25.745601654052734,4.457954406738281,14067712,EleutherAI/pythia-14m,step52000,seed8,8,52000
He saw a baseball bat.,bat,bat,He saw a bat baseball., baseball bat, bat baseball,baseball,True,-12.091385841369629,-20.063400268554688,7.972014427185059,14067712,EleutherAI/pythia-14m,step52000,seed8,8,52000
He saw the balance beam.,beam,beam,He saw the beam balance., balance beam, beam balance,balance,True,-19.325210571289062,-18.971515655517578,-0.3536949157714844,14067712,EleutherAI/pythia-14m,step52000,seed8,8,52000
She had a writer's block.,block,block,She had a block writer's., writer's block, block writer's,writer,True,-26.838329315185547,-24.717220306396484,-2.1211090087890625,14067712,EleutherAI/pythia-14m,step52000,seed8,8,52000
He has royal blood.,blood,blood,He has blood royal., royal blood, blood royal,royal,False,-19.234386444091797,-23.38924789428711,4.1548614501953125,14067712,EleutherAI/pythia-14m,step52000,seed8,8,52000
It was the school board.,board,board,It was the board school., school board, board school,school,True,-12.865827560424805,-16.537935256958008,3.672107696533203,14067712,EleutherAI/pythia-14m,step52000,seed8,8,52000
He had a leather-bound book.,book,book,He had a book leather-bound., leather-bound book, book leather-bound,leather-bound,False,-25.797142028808594,-29.131790161132812,3.3346481323242188,14067712,EleutherAI/pythia-14m,step52000,seed8,8,52000
They ate a lonely breakfast.,breakfast,breakfast,They ate a breakfast lonely., lonely breakfast, breakfast lonely,lonely,False,-14.166915893554688,-19.055522918701172,4.888607025146484,14067712,EleutherAI/pythia-14m,step52000,seed8,8,52000
It was an island cape.,cape,cape,It was an cape island., island cape, cape island,island,True,-21.05283546447754,-23.094085693359375,2.041250228881836,14067712,EleutherAI/pythia-14m,step52000,seed8,8,52000
It was a criminal case.,case,case,It was a case criminal., criminal case, case criminal,criminal,False,-11.329044342041016,-16.942277908325195,5.61323356628418,14067712,EleutherAI/pythia-14m,step52000,seed8,8,52000
It was a primary cause.,cause,cause,It was a cause primary., primary cause, cause primary,primary,False,-15.095268249511719,-22.706134796142578,7.610866546630859,14067712,EleutherAI/pythia-14m,step52000,seed8,8,52000
It was a jail cell.,cell,cell,It was a cell jail., jail cell, cell jail,jail,True,-17.172096252441406,-20.48800277709961,3.315906524658203,14067712,EleutherAI/pythia-14m,step52000,seed8,8,52000
She had a good-luck charm.,charm,charm,She had a charm good-luck., good-luck charm, charm good-luck,good-luck,False,-25.724828720092773,-33.15499496459961,7.430166244506836,14067712,EleutherAI/pythia-14m,step52000,seed8,8,52000
They liked the pet chicken.,chicken,chicken,They liked the chicken pet., pet chicken, chicken pet,pet,True,-21.34033203125,-19.274707794189453,-2.065624237060547,14067712,EleutherAI/pythia-14m,step52000,seed8,8,52000
It was a stimulating class.,class,class,It was a class stimulating., stimulating class, class stimulating,stimulating,False,-18.544353485107422,-21.522035598754883,2.977682113647461,14067712,EleutherAI/pythia-14m,step52000,seed8,8,52000
It was a metal clip.,clip,clip,It was a clip metal., metal clip, clip metal,metal,True,-18.60077476501465,-19.203197479248047,0.6024227142333984,14067712,EleutherAI/pythia-14m,step52000,seed8,8,52000
It was a common cold.,cold,cold,It was a cold common., common cold, cold common,common,False,-15.746500015258789,-17.047086715698242,1.3005867004394531,14067712,EleutherAI/pythia-14m,step52000,seed8,8,52000
It was a marble column.,column,column,It was a column marble., marble column, column marble,marble,True,-15.625100135803223,-20.974559783935547,5.349459648132324,14067712,EleutherAI/pythia-14m,step52000,seed8,8,52000
He liked the polite company.,company,company,He liked the company polite., polite company, company polite,polite,False,-22.285507202148438,-21.915319442749023,-0.37018775939941406,14067712,EleutherAI/pythia-14m,step52000,seed8,8,52000
It was a traffic cone.,cone,cone,It was a cone traffic., traffic cone, cone traffic,traffic,True,-21.13043212890625,-24.318635940551758,3.188203811645508,14067712,EleutherAI/pythia-14m,step52000,seed8,8,52000
He made a well-written contribution.,contribution,contribution,He made a contribution well-written., well-written contribution, contribution well-written,well-written,False,-20.705242156982422,-26.94834327697754,6.243101119995117,14067712,EleutherAI/pythia-14m,step52000,seed8,8,52000
That was the correct count.,count,count,That was the count correct., correct count, count correct,correct,False,-15.157588958740234,-21.46226692199707,6.304677963256836,14067712,EleutherAI/pythia-14m,step52000,seed8,8,52000
It was a collision course.,course,course,It was a course collision., collision course, course collision,collision,True,-19.164216995239258,-22.48130989074707,3.3170928955078125,14067712,EleutherAI/pythia-14m,step52000,seed8,8,52000
It was a historical date.,date,date,It was a date historical., historical date, date historical,historical,False,-16.521493911743164,-18.02241325378418,1.5009193420410156,14067712,EleutherAI/pythia-14m,step52000,seed8,8,52000
It was about college degrees.,degree,degrees,It was about degrees college., college degrees, degrees college,college,True,-15.81672191619873,-20.441808700561523,4.625086784362793,14067712,EleutherAI/pythia-14m,step52000,seed8,8,52000
They liked the architectural design.,design,design,They liked the design architectural., architectural design, design architectural,architectural,False,-15.818143844604492,-20.0050048828125,4.186861038208008,14067712,EleutherAI/pythia-14m,step52000,seed8,8,52000
They liked the anniversary dinner.,dinner,dinner,They liked the dinner anniversary., anniversary dinner, dinner anniversary,anniversary,True,-18.085603713989258,-20.54271697998047,2.457113265991211,14067712,EleutherAI/pythia-14m,step52000,seed8,8,52000
He had a career dream.,dream,dream,He had a dream career., career dream, dream career,career,True,-15.590643882751465,-15.17011833190918,-0.42052555084228516,14067712,EleutherAI/pythia-14m,step52000,seed8,8,52000
It was a battery-powered drill.,drill,drill,It was a drill battery-powered., battery-powered drill, drill battery-powered,battery-powered,False,-27.099674224853516,-28.136924743652344,1.0372505187988281,14067712,EleutherAI/pythia-14m,step52000,seed8,8,52000
It was a physical examination.,examination,examination,It was an examination physical., physical examination, examination physical,physical,False,-14.885759353637695,-19.210466384887695,4.32470703125,14067712,EleutherAI/pythia-14m,step52000,seed8,8,52000
They had an enthusiastic fan.,fan,fan,They had an fan enthusiastic., enthusiastic fan, fan enthusiastic,enthusiastic,False,-14.668539047241211,-24.70849609375,10.039957046508789,14067712,EleutherAI/pythia-14m,step52000,seed8,8,52000
She had a steel file.,file,file,She had a file steel., steel file, file steel,steel,True,-19.669919967651367,-25.409198760986328,5.739278793334961,14067712,EleutherAI/pythia-14m,step52000,seed8,8,52000
It was a plastic film.,film,film,It was a film plastic., plastic film, film plastic,plastic,False,-17.383075714111328,-20.18651008605957,2.803434371948242,14067712,EleutherAI/pythia-14m,step52000,seed8,8,52000
It was a concrete foundation.,foundation,foundation,It was a foundation concrete., concrete foundation, foundation concrete,concrete,False,-16.261276245117188,-20.093467712402344,3.8321914672851562,14067712,EleutherAI/pythia-14m,step52000,seed8,8,52000
It was a business function.,function,function,It was a function business., business function, function business,business,True,-16.31125831604004,-18.33763885498047,2.0263805389404297,14067712,EleutherAI/pythia-14m,step52000,seed8,8,52000
He was on the parade ground.,ground,ground,He was on the ground parade., parade ground, ground parade,parade,True,-18.49536895751953,-17.934776306152344,-0.5605926513671875,14067712,EleutherAI/pythia-14m,step52000,seed8,8,52000
They liked the national guard.,guard,guard,They liked the guard national., national guard, guard national,national,False,-20.41750717163086,-22.686260223388672,2.2687530517578125,14067712,EleutherAI/pythia-14m,step52000,seed8,8,52000
He had a friendly guide.,guide,guide,He had a guide friendly., friendly guide, guide friendly,friendly,False,-15.085494041442871,-21.536216735839844,6.450722694396973,14067712,EleutherAI/pythia-14m,step52000,seed8,8,52000
It was a nursing home.,home,home,It was a home nursing., nursing home, home nursing,nursing,True,-13.740934371948242,-17.19921875,3.458284378051758,14067712,EleutherAI/pythia-14m,step52000,seed8,8,52000
They had military intelligence.,intelligence,intelligence,They had intelligence military., military intelligence, intelligence military,military,False,-16.176496505737305,-19.596237182617188,3.419740676879883,14067712,EleutherAI/pythia-14m,step52000,seed8,8,52000
It was a special issue.,issue,issue,It was an issue special., special issue, issue special,special,False,-14.298014640808105,-13.861675262451172,-0.4363393783569336,14067712,EleutherAI/pythia-14m,step52000,seed8,8,52000
It was a paper jam.,jam,jam,It was a jam paper., paper jam, jam paper,paper,True,-19.355894088745117,-18.787811279296875,-0.5680828094482422,14067712,EleutherAI/pythia-14m,step52000,seed8,8,52000
It was a backspace key.,key,key,It was a key backspace., backspace key, key backspace,backspace,True,-28.840259552001953,-26.66205596923828,-2.178203582763672,14067712,EleutherAI/pythia-14m,step52000,seed8,8,52000
They liked the friendly lamb.,lamb,lamb,They liked the lamb friendly., friendly lamb, lamb friendly,friendly,False,-18.446884155273438,-18.77129364013672,0.32440948486328125,14067712,EleutherAI/pythia-14m,step52000,seed8,8,52000
She had door locks.,lock,locks,She had locks door., door locks, locks door,door,True,-18.221359252929688,-20.992855072021484,2.771495819091797,14067712,EleutherAI/pythia-14m,step52000,seed8,8,52000
They liked the women's lunch.,lunch,lunch,They liked the lunch women's., women's lunch, lunch women's,women,True,-18.900283813476562,-21.71287727355957,2.812593460083008,14067712,EleutherAI/pythia-14m,step52000,seed8,8,52000
He liked the stock market.,market,market,He liked the market stock., stock market, market stock,stock,True,-11.887876510620117,-14.73971939086914,2.8518428802490234,14067712,EleutherAI/pythia-14m,step52000,seed8,8,52000
It was a tennis match.,match,match,It was a match tennis., tennis match, match tennis,tennis,True,-15.944169998168945,-19.88397216796875,3.9398021697998047,14067712,EleutherAI/pythia-14m,step52000,seed8,8,52000
It was veterinary medicine.,medicine,medicine,It was medicine veterinary., veterinary medicine, medicine veterinary,veterinary,False,-15.472290992736816,-21.66451644897461,6.192225456237793,14067712,EleutherAI/pythia-14m,step52000,seed8,8,52000
There was a clear message.,message,message,There was a message clear., clear message, message clear,clear,False,-12.021541595458984,-16.34537124633789,4.323829650878906,14067712,EleutherAI/pythia-14m,step52000,seed8,8,52000
It was a clay mold.,mold,mold,It was a mold clay., clay mold, mold clay,clay,True,-17.838586807250977,-21.685775756835938,3.847188949584961,14067712,EleutherAI/pythia-14m,step52000,seed8,8,52000
She saw the fast mole.,mole,mole,She saw the mole fast., fast mole, mole fast,fast,False,-20.305667877197266,-20.27043342590332,-0.03523445129394531,14067712,EleutherAI/pythia-14m,step52000,seed8,8,52000
He liked the civil-rights movement.,movement,movement,He liked the movement civil-rights., civil-rights movement, movement civil-rights,civil-rights,False,-22.02992057800293,-29.898151397705078,7.868230819702148,14067712,EleutherAI/pythia-14m,step52000,seed8,8,52000
It was a shredded newspaper.,newspaper,newspaper,It was a newspaper shredded., shredded newspaper, newspaper shredded,shredded,False,-26.036724090576172,-23.31698226928711,-2.7197418212890625,14067712,EleutherAI/pythia-14m,step52000,seed8,8,52000
It was a reddish orange.,orange,orange,It was an orange reddish., reddish orange, orange reddish,reddish,False,-15.81978988647461,-15.614655494689941,-0.20513439178466797,14067712,EleutherAI/pythia-14m,step52000,seed8,8,52000
He saw the ripped page.,page,page,He saw the page ripped., ripped page, page ripped,ripped,False,-20.865156173706055,-19.350561141967773,-1.5145950317382812,14067712,EleutherAI/pythia-14m,step52000,seed8,8,52000
It was a tree palm.,palm,palm,It was a palm tree., tree palm, palm tree,tree,True,-19.007492065429688,-12.5659761428833,-6.441515922546387,14067712,EleutherAI/pythia-14m,step52000,seed8,8,52000
It was a consumer panel.,panel,panel,It was a panel consumer., consumer panel, panel consumer,consumer,True,-20.12765121459961,-22.365081787109375,2.2374305725097656,14067712,EleutherAI/pythia-14m,step52000,seed8,8,52000
It was a biblical passage.,passage,passage,It was a passage biblical., biblical passage, passage biblical,biblical,False,-16.04875373840332,-21.55970001220703,5.510946273803711,14067712,EleutherAI/pythia-14m,step52000,seed8,8,52000
It was a secure perch.,perch,perch,It was a perch secure., secure perch, perch secure,secure,False,-23.01355743408203,-27.761131286621094,4.7475738525390625,14067712,EleutherAI/pythia-14m,step52000,seed8,8,52000
He saw the plastic pitcher.,pitcher,pitcher,He saw the pitcher plastic., plastic pitcher, pitcher plastic,plastic,True,-21.238731384277344,-23.766887664794922,2.528156280517578,14067712,EleutherAI/pythia-14m,step52000,seed8,8,52000
It was a sweet port.,port,port,It was a port sweet., sweet port, port sweet,sweet,False,-16.628206253051758,-22.09902572631836,5.470819473266602,14067712,EleutherAI/pythia-14m,step52000,seed8,8,52000
He was in a yoga position.,position,position,He was in a position yoga., yoga position, position yoga,yoga,True,-18.63473129272461,-20.691410064697266,2.0566787719726562,14067712,EleutherAI/pythia-14m,step52000,seed8,8,52000
It was a challenging post.,post,post,It was a post challenging., challenging post, post challenging,challenging,False,-18.235971450805664,-21.151397705078125,2.915426254272461,14067712,EleutherAI/pythia-14m,step52000,seed8,8,52000
He had the quickest punch.,punch,punch,He had the punch quickest., quickest punch, punch quickest,quickest,False,-20.416156768798828,-23.86447525024414,3.4483184814453125,14067712,EleutherAI/pythia-14m,step52000,seed8,8,52000
She had a cloudy pupil.,pupil,pupil,She had a pupil cloudy., cloudy pupil, pupil cloudy,cloudy,False,-26.203006744384766,-27.702312469482422,1.4993057250976562,14067712,EleutherAI/pythia-14m,step52000,seed8,8,52000
That was a tennis racket.,racket,racket,That was a racket tennis., tennis racket, racket tennis,tennis,True,-15.434921264648438,-20.245121002197266,4.810199737548828,14067712,EleutherAI/pythia-14m,step52000,seed8,8,52000
He liked granite rock.,rock,rock,He liked rock granite., granite rock, rock granite,granite,True,-17.837509155273438,-19.327775955200195,1.4902667999267578,14067712,EleutherAI/pythia-14m,step52000,seed8,8,52000
He saw the bushy sage.,sage,sage,He saw the sage bushy., bushy sage, sage bushy,bushy,False,-30.760343551635742,-31.46615219116211,0.7058086395263672,14067712,EleutherAI/pythia-14m,step52000,seed8,8,52000
It was a major scale.,scale,scale,It was a scale major., major scale, scale major,major,False,-13.094338417053223,-18.289396286010742,5.1950578689575195,14067712,EleutherAI/pythia-14m,step52000,seed8,8,52000
It was a panoramic scene.,scene,scene,It was a scene panoramic., panoramic scene, scene panoramic,panoramic,False,-20.921199798583984,-20.183618545532227,-0.7375812530517578,14067712,EleutherAI/pythia-14m,step52000,seed8,8,52000
It was a trained seal.,seal,seal,It was a seal trained., trained seal, seal trained,trained,False,-25.810970306396484,-25.043720245361328,-0.7672500610351562,14067712,EleutherAI/pythia-14m,step52000,seed8,8,52000
He used the video tape.,tape,tape,He used the tape video., video tape, tape video,video,True,-14.01632308959961,-16.145639419555664,2.1293163299560547,14067712,EleutherAI/pythia-14m,step52000,seed8,8,52000
It was a technical term.,term,term,It was a term technical., technical term, term technical,technical,False,-17.280155181884766,-20.52840232849121,3.2482471466064453,14067712,EleutherAI/pythia-14m,step52000,seed8,8,52000
It was a diseased tick.,tick,tick,It was a tick diseased., diseased tick, tick diseased,diseased,False,-24.178966522216797,-24.48259735107422,0.3036308288574219,14067712,EleutherAI/pythia-14m,step52000,seed8,8,52000
It was a finger tip.,tip,tip,It was a tip finger., finger tip, tip finger,finger,True,-18.54739761352539,-17.74431037902832,-0.8030872344970703,14067712,EleutherAI/pythia-14m,step52000,seed8,8,52000
She liked the professional title.,title,title,She liked the title professional., professional title, title professional,professional,False,-14.532024383544922,-18.126327514648438,3.5943031311035156,14067712,EleutherAI/pythia-14m,step52000,seed8,8,52000
It was a bell toll.,toll,toll,It was a toll bell., bell toll, toll bell,bell,True,-21.87481689453125,-19.909069061279297,-1.9657478332519531,14067712,EleutherAI/pythia-14m,step52000,seed8,8,52000
She saw the snowshoe tracks.,track,tracks,She saw the tracks snowshoe., snowshoe tracks, tracks snowshoe,snowshoe,True,-24.473936080932617,-27.70833969116211,3.234403610229492,14067712,EleutherAI/pythia-14m,step52000,seed8,8,52000
They were cluttered yards.,yard,yards,They were yards cluttered., cluttered yards, yards cluttered,cluttered,False,-27.002296447753906,-23.977148056030273,-3.025148391723633,14067712,EleutherAI/pythia-14m,step52000,seed8,8,52000
