sentence,word,string,reversed_sentence,mod_np,reversed_mod,disambiguating_word,non_adjective,original_logprob,reversed_logprob,ratio,n_params,mpath,revision,seed_name,seed,step
It was a social function.,function,function,It was a function social., social function, function social,social,False,-15.473123550415039,-21.560924530029297,6.087800979614258,14067712,EleutherAI/pythia-14m,step36000,seed5,5,36000
He was on the firm ground.,ground,ground,He was on the ground firm., firm ground, ground firm,firm,False,-15.939599990844727,-17.439884185791016,1.500284194946289,14067712,EleutherAI/pythia-14m,step36000,seed5,5,36000
He was on the frozen ground.,ground,ground,He was on the ground frozen., frozen ground, ground frozen,frozen,False,-13.631402015686035,-16.87181854248047,3.2404165267944336,14067712,EleutherAI/pythia-14m,step36000,seed5,5,36000
He was on the camp ground.,ground,ground,He was on the ground camp., camp ground, ground camp,camp,True,-16.219696044921875,-15.32381534576416,-0.8958806991577148,14067712,EleutherAI/pythia-14m,step36000,seed5,5,36000
They liked the night guard.,guard,guard,They liked the guard night., night guard, guard night,night,True,-18.40598487854004,-21.784860610961914,3.378875732421875,14067712,EleutherAI/pythia-14m,step36000,seed5,5,36000
They liked the security guard.,guard,guard,They liked the guard security., security guard, guard security,security,True,-15.022300720214844,-20.51714324951172,5.494842529296875,14067712,EleutherAI/pythia-14m,step36000,seed5,5,36000
They liked the coast guard.,guard,guard,They liked the guard coast., coast guard, guard coast,coast,True,-20.843608856201172,-25.711071014404297,4.867462158203125,14067712,EleutherAI/pythia-14m,step36000,seed5,5,36000
He had an assembly guide.,guide,guide,He had an guide assembly., assembly guide, guide assembly,assembly,True,-18.320444107055664,-26.994712829589844,8.67426872253418,14067712,EleutherAI/pythia-14m,step36000,seed5,5,36000
He had a TV guide.,guide,guide,He had a guide TV., TV guide, guide TV,TV,True,-16.8331298828125,-21.444072723388672,4.610942840576172,14067712,EleutherAI/pythia-14m,step36000,seed5,5,36000
He had a talkative guide.,guide,guide,He had a guide talkative., talkative guide, guide talkative,talkative,False,-26.759601593017578,-29.571517944335938,2.8119163513183594,14067712,EleutherAI/pythia-14m,step36000,seed5,5,36000
It was a summer home.,home,home,It was a home summer., summer home, home summer,summer,True,-13.338919639587402,-20.119375228881836,6.780455589294434,14067712,EleutherAI/pythia-14m,step36000,seed5,5,36000
It was a childhood home.,home,home,It was a home childhood., childhood home, home childhood,childhood,True,-15.106525421142578,-21.587677001953125,6.481151580810547,14067712,EleutherAI/pythia-14m,step36000,seed5,5,36000
It was a funeral home.,home,home,It was a home funeral., funeral home, home funeral,funeral,False,-13.59722900390625,-18.333433151245117,4.736204147338867,14067712,EleutherAI/pythia-14m,step36000,seed5,5,36000
They had natural intelligence.,intelligence,intelligence,They had intelligence natural., natural intelligence, intelligence natural,natural,False,-16.474323272705078,-22.567440032958984,6.093116760253906,14067712,EleutherAI/pythia-14m,step36000,seed5,5,36000
They had innate intelligence.,intelligence,intelligence,They had intelligence innate., innate intelligence, intelligence innate,innate,False,-18.193401336669922,-25.491485595703125,7.298084259033203,14067712,EleutherAI/pythia-14m,step36000,seed5,5,36000
They had classified intelligence.,intelligence,intelligence,They had intelligence classified., classified intelligence, intelligence classified,classified,False,-19.774471282958984,-20.651500701904297,0.8770294189453125,14067712,EleutherAI/pythia-14m,step36000,seed5,5,36000
It was a sensitive issue.,issue,issue,It was an issue sensitive., sensitive issue, issue sensitive,sensitive,False,-14.317108154296875,-16.425369262695312,2.1082611083984375,14067712,EleutherAI/pythia-14m,step36000,seed5,5,36000
It was a political issue.,issue,issue,It was an issue political., political issue, issue political,political,False,-11.774188995361328,-16.491456985473633,4.717267990112305,14067712,EleutherAI/pythia-14m,step36000,seed5,5,36000
It was a weekly issue.,issue,issue,It was an issue weekly., weekly issue, issue weekly,weekly,False,-16.281070709228516,-16.510591506958008,0.2295207977294922,14067712,EleutherAI/pythia-14m,step36000,seed5,5,36000
It was a blackberry jam.,jam,jam,It was a jam blackberry., blackberry jam, jam blackberry,blackberry,True,-22.58783721923828,-29.029312133789062,6.441474914550781,14067712,EleutherAI/pythia-14m,step36000,seed5,5,36000
It was a peach jam.,jam,jam,It was a jam peach., peach jam, jam peach,peach,False,-21.021709442138672,-22.980985641479492,1.9592761993408203,14067712,EleutherAI/pythia-14m,step36000,seed5,5,36000
It was a traffic jam.,jam,jam,It was a jam traffic., traffic jam, jam traffic,traffic,True,-15.853872299194336,-20.340429306030273,4.4865570068359375,14067712,EleutherAI/pythia-14m,step36000,seed5,5,36000
It was a duplicate key.,key,key,It was a key duplicate., duplicate key, key duplicate,duplicate,False,-19.435205459594727,-16.28662872314453,-3.1485767364501953,14067712,EleutherAI/pythia-14m,step36000,seed5,5,36000
It was a master key.,key,key,It was a key master., master key, key master,master,True,-19.517677307128906,-17.910259246826172,-1.6074180603027344,14067712,EleutherAI/pythia-14m,step36000,seed5,5,36000
It was a delete key.,key,key,It was a key delete., delete key, key delete,delete,False,-21.884239196777344,-19.234317779541016,-2.649921417236328,14067712,EleutherAI/pythia-14m,step36000,seed5,5,36000
They liked the marinated lamb.,lamb,lamb,They liked the lamb marinated., marinated lamb, lamb marinated,marinated,True,-22.569522857666016,-23.692895889282227,1.123373031616211,14067712,EleutherAI/pythia-14m,step36000,seed5,5,36000
They liked the grilled lamb.,lamb,lamb,They liked the lamb grilled., grilled lamb, lamb grilled,grilled,False,-19.429426193237305,-22.309242248535156,2.8798160552978516,14067712,EleutherAI/pythia-14m,step36000,seed5,5,36000
They liked the cute lamb.,lamb,lamb,They liked the lamb cute., cute lamb, lamb cute,cute,False,-18.178821563720703,-24.49118423461914,6.3123626708984375,14067712,EleutherAI/pythia-14m,step36000,seed5,5,36000
She had curly locks.,lock,locks,She had locks curly., curly locks, locks curly,curly,False,-20.927433013916016,-28.672603607177734,7.745170593261719,14067712,EleutherAI/pythia-14m,step36000,seed5,5,36000
She had brown locks.,lock,locks,She had locks brown., brown locks, locks brown,brown,False,-21.628360748291016,-25.49396324157715,3.865602493286133,14067712,EleutherAI/pythia-14m,step36000,seed5,5,36000
She had window locks.,lock,locks,She had locks window., window locks, locks window,window,True,-22.99681282043457,-24.611804962158203,1.6149921417236328,14067712,EleutherAI/pythia-14m,step36000,seed5,5,36000
They liked the hot lunch.,lunch,lunch,They liked the lunch hot., hot lunch, lunch hot,hot,False,-16.453998565673828,-19.695255279541016,3.2412567138671875,14067712,EleutherAI/pythia-14m,step36000,seed5,5,36000
They liked the sandwich lunch.,lunch,lunch,They liked the lunch sandwich., sandwich lunch, lunch sandwich,sandwich,True,-19.788908004760742,-18.91071319580078,-0.8781948089599609,14067712,EleutherAI/pythia-14m,step36000,seed5,5,36000
They liked the afternoon lunch.,lunch,lunch,They liked the lunch afternoon., afternoon lunch, lunch afternoon,afternoon,True,-16.603416442871094,-19.083162307739258,2.479745864868164,14067712,EleutherAI/pythia-14m,step36000,seed5,5,36000
He liked the flea market.,market,market,He liked the market flea., flea market, market flea,flea,True,-23.509685516357422,-24.625904083251953,1.1162185668945312,14067712,EleutherAI/pythia-14m,step36000,seed5,5,36000
He liked the fish market.,market,market,He liked the market fish., fish market, market fish,fish,True,-16.2608642578125,-19.589702606201172,3.328838348388672,14067712,EleutherAI/pythia-14m,step36000,seed5,5,36000
He liked the housing market.,market,market,He liked the market housing., housing market, market housing,housing,True,-12.921038627624512,-15.630960464477539,2.7099218368530273,14067712,EleutherAI/pythia-14m,step36000,seed5,5,36000
It was a lit match.,match,match,It was a match lit., lit match, match lit,lit,False,-21.42264175415039,-21.927345275878906,0.5047035217285156,14067712,EleutherAI/pythia-14m,step36000,seed5,5,36000
It was a burning match.,match,match,It was a match burning., burning match, match burning,burning,False,-19.100175857543945,-23.712486267089844,4.612310409545898,14067712,EleutherAI/pythia-14m,step36000,seed5,5,36000
It was a soccer match.,match,match,It was a match soccer., soccer match, match soccer,soccer,True,-18.04859733581543,-23.508636474609375,5.460039138793945,14067712,EleutherAI/pythia-14m,step36000,seed5,5,36000
It was cough medicine.,medicine,medicine,It was medicine cough., cough medicine, medicine cough,cough,True,-21.14795684814453,-24.486217498779297,3.3382606506347656,14067712,EleutherAI/pythia-14m,step36000,seed5,5,36000
It was prescription medicine.,medicine,medicine,It was medicine prescription., prescription medicine, medicine prescription,prescription,True,-19.32699966430664,-22.20849609375,2.8814964294433594,14067712,EleutherAI/pythia-14m,step36000,seed5,5,36000
It was orthopedic medicine.,medicine,medicine,It was medicine orthopedic., orthopedic medicine, medicine orthopedic,orthopedic,False,-23.2955322265625,-28.612274169921875,5.316741943359375,14067712,EleutherAI/pythia-14m,step36000,seed5,5,36000
There was a phone message.,message,message,There was a message phone., phone message, message phone,phone,True,-13.30815601348877,-15.651626586914062,2.343470573425293,14067712,EleutherAI/pythia-14m,step36000,seed5,5,36000
There was a computer message.,message,message,There was a message computer., computer message, message computer,computer,True,-17.337621688842773,-19.43226432800293,2.0946426391601562,14067712,EleutherAI/pythia-14m,step36000,seed5,5,36000
There was an urgent message.,message,message,There was an message urgent., urgent message, message urgent,urgent,False,-12.059359550476074,-25.435331344604492,13.375971794128418,14067712,EleutherAI/pythia-14m,step36000,seed5,5,36000
It was a fungal mold.,mold,mold,It was a mold fungal., fungal mold, mold fungal,fungal,False,-21.41843032836914,-26.660118103027344,5.241687774658203,14067712,EleutherAI/pythia-14m,step36000,seed5,5,36000
It was a harmful mold.,mold,mold,It was a mold harmful., harmful mold, mold harmful,harmful,False,-23.178028106689453,-26.510311126708984,3.3322830200195312,14067712,EleutherAI/pythia-14m,step36000,seed5,5,36000
It was a rubber mold.,mold,mold,It was a mold rubber., rubber mold, mold rubber,rubber,True,-19.281169891357422,-24.748703002929688,5.467533111572266,14067712,EleutherAI/pythia-14m,step36000,seed5,5,36000
She saw the cancerous mole.,mole,mole,She saw the mole cancerous., cancerous mole, mole cancerous,cancerous,False,-25.478940963745117,-27.373241424560547,1.8943004608154297,14067712,EleutherAI/pythia-14m,step36000,seed5,5,36000
She saw the raised mole.,mole,mole,She saw the mole raised., raised mole, mole raised,raised,False,-21.70672607421875,-19.717010498046875,-1.989715576171875,14067712,EleutherAI/pythia-14m,step36000,seed5,5,36000
She saw the cute mole.,mole,mole,She saw the mole cute., cute mole, mole cute,cute,False,-20.412708282470703,-26.114852905273438,5.702144622802734,14067712,EleutherAI/pythia-14m,step36000,seed5,5,36000
He liked the rhythmic movement.,movement,movement,He liked the movement rhythmic., rhythmic movement, movement rhythmic,rhythmic,False,-16.47607421875,-21.133142471313477,4.657068252563477,14067712,EleutherAI/pythia-14m,step36000,seed5,5,36000
He liked the graceful movement.,movement,movement,He liked the movement graceful., graceful movement, movement graceful,graceful,False,-18.229602813720703,-23.168371200561523,4.93876838684082,14067712,EleutherAI/pythia-14m,step36000,seed5,5,36000
He liked the feminist movement.,movement,movement,He liked the movement feminist., feminist movement, movement feminist,feminist,True,-15.55638313293457,-22.397615432739258,6.8412322998046875,14067712,EleutherAI/pythia-14m,step36000,seed5,5,36000
It was a national newspaper.,newspaper,newspaper,It was a newspaper national., national newspaper, newspaper national,national,False,-14.148418426513672,-21.82263946533203,7.674221038818359,14067712,EleutherAI/pythia-14m,step36000,seed5,5,36000
It was a daily newspaper.,newspaper,newspaper,It was a newspaper daily., daily newspaper, newspaper daily,daily,False,-15.936379432678223,-19.544666290283203,3.6082868576049805,14067712,EleutherAI/pythia-14m,step36000,seed5,5,36000
It was a faded newspaper.,newspaper,newspaper,It was a newspaper faded., faded newspaper, newspaper faded,faded,False,-19.54828643798828,-23.419456481933594,3.8711700439453125,14067712,EleutherAI/pythia-14m,step36000,seed5,5,36000
It was a juicy orange.,orange,orange,It was an orange juicy., juicy orange, orange juicy,juicy,False,-21.055221557617188,-20.318510055541992,-0.7367115020751953,14067712,EleutherAI/pythia-14m,step36000,seed5,5,36000
It was a ripe orange.,orange,orange,It was an orange ripe., ripe orange, orange ripe,ripe,False,-18.688989639282227,-19.731521606445312,1.042531967163086,14067712,EleutherAI/pythia-14m,step36000,seed5,5,36000
It was a bright orange.,orange,orange,It was an orange bright., bright orange, orange bright,bright,False,-12.288068771362305,-16.34923553466797,4.061166763305664,14067712,EleutherAI/pythia-14m,step36000,seed5,5,36000
He saw the young page.,page,page,He saw the page young., young page, page young,young,False,-16.89154624938965,-21.125263214111328,4.23371696472168,14067712,EleutherAI/pythia-14m,step36000,seed5,5,36000
He saw the loyal page.,page,page,He saw the page loyal., loyal page, page loyal,loyal,False,-23.617046356201172,-24.244857788085938,0.6278114318847656,14067712,EleutherAI/pythia-14m,step36000,seed5,5,36000
He saw the blank page.,page,page,He saw the page blank., blank page, page blank,blank,False,-15.16212272644043,-17.281246185302734,2.1191234588623047,14067712,EleutherAI/pythia-14m,step36000,seed5,5,36000
It was a calloused palm.,palm,palm,It was a palm calloused., calloused palm, palm calloused,calloused,False,-30.609241485595703,-32.4030647277832,1.7938232421875,14067712,EleutherAI/pythia-14m,step36000,seed5,5,36000
It was a wrinkled palm.,palm,palm,It was a palm wrinkled., wrinkled palm, palm wrinkled,wrinkled,False,-22.52886962890625,-21.97933578491211,-0.5495338439941406,14067712,EleutherAI/pythia-14m,step36000,seed5,5,36000
It was a tropical palm.,palm,palm,It was a palm tropical., tropical palm, palm tropical,tropical,False,-20.62075424194336,-23.984115600585938,3.363361358642578,14067712,EleutherAI/pythia-14m,step36000,seed5,5,36000
It was a control panel.,panel,panel,It was a panel control., control panel, panel control,control,True,-17.981843948364258,-19.664073944091797,1.682229995727539,14067712,EleutherAI/pythia-14m,step36000,seed5,5,36000
It was an instrument panel.,panel,panel,It was an panel instrument., instrument panel, panel instrument,instrument,False,-17.51329803466797,-28.52368927001953,11.010391235351562,14067712,EleutherAI/pythia-14m,step36000,seed5,5,36000
It was an advisory panel.,panel,panel,It was an panel advisory., advisory panel, panel advisory,advisory,False,-14.346596717834473,-29.91828155517578,15.571684837341309,14067712,EleutherAI/pythia-14m,step36000,seed5,5,36000
It was a secret passage.,passage,passage,It was a passage secret., secret passage, passage secret,secret,False,-16.271167755126953,-21.710561752319336,5.439393997192383,14067712,EleutherAI/pythia-14m,step36000,seed5,5,36000
It was a narrow passage.,passage,passage,It was a passage narrow., narrow passage, passage narrow,narrow,False,-14.225553512573242,-22.945140838623047,8.719587326049805,14067712,EleutherAI/pythia-14m,step36000,seed5,5,36000
It was a literary passage.,passage,passage,It was a passage literary., literary passage, passage literary,literary,False,-18.709388732910156,-25.50501251220703,6.795623779296875,14067712,EleutherAI/pythia-14m,step36000,seed5,5,36000
It was a tasty perch.,perch,perch,It was a perch tasty., tasty perch, perch tasty,tasty,False,-25.00170135498047,-28.214466094970703,3.2127647399902344,14067712,EleutherAI/pythia-14m,step36000,seed5,5,36000
It was a freshwater perch.,perch,perch,It was a perch freshwater., freshwater perch, perch freshwater,freshwater,True,-25.29561996459961,-27.65013885498047,2.3545188903808594,14067712,EleutherAI/pythia-14m,step36000,seed5,5,36000
It was a lofty perch.,perch,perch,It was a perch lofty., lofty perch, perch lofty,lofty,False,-28.053916931152344,-31.376602172851562,3.3226852416992188,14067712,EleutherAI/pythia-14m,step36000,seed5,5,36000
He saw the fast pitcher.,pitcher,pitcher,He saw the pitcher fast., fast pitcher, pitcher fast,fast,False,-19.377281188964844,-20.112716674804688,0.7354354858398438,14067712,EleutherAI/pythia-14m,step36000,seed5,5,36000
He saw the right-handed pitcher.,pitcher,pitcher,He saw the pitcher right-handed., right-handed pitcher, pitcher right-handed,right-handed,False,-19.341102600097656,-23.16360855102539,3.8225059509277344,14067712,EleutherAI/pythia-14m,step36000,seed5,5,36000
He saw the glass pitcher.,pitcher,pitcher,He saw the pitcher glass., glass pitcher, pitcher glass,glass,True,-18.336061477661133,-21.209613800048828,2.8735523223876953,14067712,EleutherAI/pythia-14m,step36000,seed5,5,36000
It was a windy port.,port,port,It was a port windy., windy port, port windy,windy,False,-22.473941802978516,-25.639488220214844,3.165546417236328,14067712,EleutherAI/pythia-14m,step36000,seed5,5,36000
It was a seaside port.,port,port,It was a port seaside., seaside port, port seaside,seaside,True,-24.648983001708984,-28.813182830810547,4.1641998291015625,14067712,EleutherAI/pythia-14m,step36000,seed5,5,36000
It was a delicious port.,port,port,It was a port delicious., delicious port, port delicious,delicious,False,-18.164398193359375,-28.027019500732422,9.862621307373047,14067712,EleutherAI/pythia-14m,step36000,seed5,5,36000
He was in a distinguished position.,position,position,He was in a position distinguished., distinguished position, position distinguished,distinguished,False,-12.950927734375,-18.665573120117188,5.7146453857421875,14067712,EleutherAI/pythia-14m,step36000,seed5,5,36000
He was in a prominent position.,position,position,He was in a position prominent., prominent position, position prominent,prominent,False,-12.348323822021484,-18.965988159179688,6.617664337158203,14067712,EleutherAI/pythia-14m,step36000,seed5,5,36000
He was in a fetal position.,position,position,He was in a position fetal., fetal position, position fetal,fetal,False,-14.634174346923828,-24.691516876220703,10.057342529296875,14067712,EleutherAI/pythia-14m,step36000,seed5,5,36000
It was a wooden post.,post,post,It was a post wooden., wooden post, post wooden,wooden,False,-17.201824188232422,-21.966672897338867,4.764848709106445,14067712,EleutherAI/pythia-14m,step36000,seed5,5,36000
It was a fence post.,post,post,It was a post fence., fence post, post fence,fence,True,-21.25408935546875,-19.318422317504883,-1.9356670379638672,14067712,EleutherAI/pythia-14m,step36000,seed5,5,36000
It was a teaching post.,post,post,It was a post teaching., teaching post, post teaching,teaching,True,-18.53017807006836,-18.306385040283203,-0.22379302978515625,14067712,EleutherAI/pythia-14m,step36000,seed5,5,36000
He had the alcoholic punch.,punch,punch,He had the punch alcoholic., alcoholic punch, punch alcoholic,alcoholic,False,-21.88065528869629,-28.622783660888672,6.742128372192383,14067712,EleutherAI/pythia-14m,step36000,seed5,5,36000
He had the fruit punch.,punch,punch,He had the punch fruit., fruit punch, punch fruit,fruit,True,-19.878753662109375,-23.882110595703125,4.00335693359375,14067712,EleutherAI/pythia-14m,step36000,seed5,5,36000
He had the strongest punch.,punch,punch,He had the punch strongest., strongest punch, punch strongest,strongest,False,-18.095890045166016,-24.943817138671875,6.847927093505859,14067712,EleutherAI/pythia-14m,step36000,seed5,5,36000
She had a brilliant pupil.,pupil,pupil,She had a pupil brilliant., brilliant pupil, pupil brilliant,brilliant,False,-15.994183540344238,-24.823036193847656,8.828852653503418,14067712,EleutherAI/pythia-14m,step36000,seed5,5,36000
She had an interested pupil.,pupil,pupil,She had an pupil interested., interested pupil, pupil interested,interested,False,-16.587766647338867,-22.397132873535156,5.809366226196289,14067712,EleutherAI/pythia-14m,step36000,seed5,5,36000
She had a dilated pupil.,pupil,pupil,She had a pupil dilated., dilated pupil, pupil dilated,dilated,False,-14.179882049560547,-20.94382095336914,6.763938903808594,14067712,EleutherAI/pythia-14m,step36000,seed5,5,36000
That was a loud racket.,racket,racket,That was a racket loud., loud racket, racket loud,loud,False,-19.112960815429688,-25.313413619995117,6.20045280456543,14067712,EleutherAI/pythia-14m,step36000,seed5,5,36000
That was an annoying racket.,racket,racket,That was an racket annoying., annoying racket, racket annoying,annoying,False,-20.844528198242188,-31.036441802978516,10.191913604736328,14067712,EleutherAI/pythia-14m,step36000,seed5,5,36000
That was a badminton racket.,racket,racket,That was a racket badminton., badminton racket, racket badminton,badminton,True,-30.648448944091797,-36.68486404418945,6.036415100097656,14067712,EleutherAI/pythia-14m,step36000,seed5,5,36000
He liked electronic rock.,rock,rock,He liked rock electronic., electronic rock, rock electronic,electronic,False,-21.76788902282715,-23.241724014282227,1.4738349914550781,14067712,EleutherAI/pythia-14m,step36000,seed5,5,36000
He liked alternative rock.,rock,rock,He liked rock alternative., alternative rock, rock alternative,alternative,False,-20.040807723999023,-23.96009063720703,3.919282913208008,14067712,EleutherAI/pythia-14m,step36000,seed5,5,36000
He liked limestone rock.,rock,rock,He liked rock limestone., limestone rock, rock limestone,limestone,True,-20.124488830566406,-22.755130767822266,2.6306419372558594,14067712,EleutherAI/pythia-14m,step36000,seed5,5,36000
He saw the wise sage.,sage,sage,He saw the sage wise., wise sage, sage wise,wise,False,-22.10639190673828,-22.605073928833008,0.49868202209472656,14067712,EleutherAI/pythia-14m,step36000,seed5,5,36000
He saw the renowned sage.,sage,sage,He saw the sage renowned., renowned sage, sage renowned,renowned,False,-22.621601104736328,-25.950603485107422,3.3290023803710938,14067712,EleutherAI/pythia-14m,step36000,seed5,5,36000
He saw the fragrant sage.,sage,sage,He saw the sage fragrant., fragrant sage, sage fragrant,fragrant,False,-23.270572662353516,-25.864137649536133,2.593564987182617,14067712,EleutherAI/pythia-14m,step36000,seed5,5,36000
It was a fish scale.,scale,scale,It was a scale fish., fish scale, scale fish,fish,True,-21.33656120300293,-23.405019760131836,2.0684585571289062,14067712,EleutherAI/pythia-14m,step36000,seed5,5,36000
It was a lizard scale.,scale,scale,It was a scale lizard., lizard scale, scale lizard,lizard,True,-23.880062103271484,-27.26894187927246,3.3888797760009766,14067712,EleutherAI/pythia-14m,step36000,seed5,5,36000
It was a music scale.,scale,scale,It was a scale music., music scale, scale music,music,True,-18.384654998779297,-20.13368034362793,1.7490253448486328,14067712,EleutherAI/pythia-14m,step36000,seed5,5,36000
It was a touching scene.,scene,scene,It was a scene touching., touching scene, scene touching,touching,False,-17.3807430267334,-19.05101776123047,1.6702747344970703,14067712,EleutherAI/pythia-14m,step36000,seed5,5,36000
It was a well-acted scene.,scene,scene,It was a scene well-acted., well-acted scene, scene well-acted,well-acted,False,-20.11043930053711,-29.467952728271484,9.357513427734375,14067712,EleutherAI/pythia-14m,step36000,seed5,5,36000
It was a nature scene.,scene,scene,It was a scene nature., nature scene, scene nature,nature,True,-19.499126434326172,-21.096786499023438,1.5976600646972656,14067712,EleutherAI/pythia-14m,step36000,seed5,5,36000
It was a gold seal.,seal,seal,It was a seal gold., gold seal, seal gold,gold,True,-15.806910514831543,-22.931955337524414,7.125044822692871,14067712,EleutherAI/pythia-14m,step36000,seed5,5,36000
It was a certified seal.,seal,seal,It was a seal certified., certified seal, seal certified,certified,False,-18.957950592041016,-21.4326171875,2.4746665954589844,14067712,EleutherAI/pythia-14m,step36000,seed5,5,36000
It was a circus seal.,seal,seal,It was a seal circus., circus seal, seal circus,circus,True,-22.825653076171875,-26.926395416259766,4.100742340087891,14067712,EleutherAI/pythia-14m,step36000,seed5,5,36000
He used the scotch tape.,tape,tape,He used the tape scotch., scotch tape, tape scotch,scotch,True,-27.751014709472656,-29.328182220458984,1.5771675109863281,14067712,EleutherAI/pythia-14m,step36000,seed5,5,36000
He used the double-sided tape.,tape,tape,He used the tape double-sided., double-sided tape, tape double-sided,double-sided,False,-22.07139015197754,-26.36895751953125,4.297567367553711,14067712,EleutherAI/pythia-14m,step36000,seed5,5,36000
He used the interview tape.,tape,tape,He used the tape interview., interview tape, tape interview,interview,True,-17.175090789794922,-22.13727569580078,4.962184906005859,14067712,EleutherAI/pythia-14m,step36000,seed5,5,36000
It was a winter term.,term,term,It was a term winter., winter term, term winter,winter,True,-17.85381317138672,-24.80862808227539,6.954814910888672,14067712,EleutherAI/pythia-14m,step36000,seed5,5,36000
