sentence,word,string,reversed_sentence,mod_np,reversed_mod,disambiguating_word,non_adjective,original_logprob,reversed_logprob,ratio,n_params,mpath,revision,seed_name,seed,step
He used the interview tape.,tape,tape,He used the tape interview., interview tape, tape interview,interview,True,-15.33757209777832,-18.945297241210938,3.607725143432617,14067712,EleutherAI/pythia-14m,step142000,seed1,1,142000
It was a winter term.,term,term,It was a term winter., winter term, term winter,winter,True,-16.79757308959961,-21.534910202026367,4.737337112426758,14067712,EleutherAI/pythia-14m,step142000,seed1,1,142000
It was a fall term.,term,term,It was a term fall., fall term, term fall,fall,True,-16.874103546142578,-19.749755859375,2.875652313232422,14067712,EleutherAI/pythia-14m,step142000,seed1,1,142000
It was a legal term.,term,term,It was a term legal., legal term, term legal,legal,False,-16.153894424438477,-17.7728271484375,1.6189327239990234,14067712,EleutherAI/pythia-14m,step142000,seed1,1,142000
It was a clock tick.,tick,tick,It was a tick clock., clock tick, tick clock,clock,True,-17.692129135131836,-22.257675170898438,4.565546035766602,14067712,EleutherAI/pythia-14m,step142000,seed1,1,142000
It was an audible tick.,tick,tick,It was an tick audible., audible tick, tick audible,audible,False,-17.098079681396484,-25.744461059570312,8.646381378173828,14067712,EleutherAI/pythia-14m,step142000,seed1,1,142000
It was a parasitic tick.,tick,tick,It was a tick parasitic., parasitic tick, tick parasitic,parasitic,False,-20.564876556396484,-24.401107788085938,3.836231231689453,14067712,EleutherAI/pythia-14m,step142000,seed1,1,142000
It was a generous tip.,tip,tip,It was a tip generous., generous tip, tip generous,generous,False,-18.27273941040039,-24.316972732543945,6.044233322143555,14067712,EleutherAI/pythia-14m,step142000,seed1,1,142000
It was a stingy tip.,tip,tip,It was a tip stingy., stingy tip, tip stingy,stingy,False,-20.87273406982422,-23.559402465820312,2.6866683959960938,14067712,EleutherAI/pythia-14m,step142000,seed1,1,142000
It was a pencil tip.,tip,tip,It was a tip pencil., pencil tip, tip pencil,pencil,True,-20.590574264526367,-21.277055740356445,0.6864814758300781,14067712,EleutherAI/pythia-14m,step142000,seed1,1,142000
She liked the essay title.,title,title,She liked the title essay., essay title, title essay,essay,True,-17.177875518798828,-16.09012222290039,-1.0877532958984375,14067712,EleutherAI/pythia-14m,step142000,seed1,1,142000
She liked the poem title.,title,title,She liked the title poem., poem title, title poem,poem,True,-14.769498825073242,-14.37918472290039,-0.39031410217285156,14067712,EleutherAI/pythia-14m,step142000,seed1,1,142000
She liked the academic title.,title,title,She liked the title academic., academic title, title academic,academic,False,-16.082096099853516,-16.75027847290039,0.668182373046875,14067712,EleutherAI/pythia-14m,step142000,seed1,1,142000
It was a costly toll.,toll,toll,It was a toll costly., costly toll, toll costly,costly,False,-18.71091079711914,-23.088253021240234,4.377342224121094,14067712,EleutherAI/pythia-14m,step142000,seed1,1,142000
It was a road toll.,toll,toll,It was a toll road., road toll, toll road,road,True,-17.0350284576416,-16.703243255615234,-0.3317852020263672,14067712,EleutherAI/pythia-14m,step142000,seed1,1,142000
It was a loud toll.,toll,toll,It was a toll loud., loud toll, toll loud,loud,False,-17.041650772094727,-21.955318450927734,4.913667678833008,14067712,EleutherAI/pythia-14m,step142000,seed1,1,142000
She saw the train tracks.,track,tracks,She saw the tracks train., train tracks, tracks train,train,True,-18.789634704589844,-19.61446762084961,0.8248329162597656,14067712,EleutherAI/pythia-14m,step142000,seed1,1,142000
She saw the trolley tracks.,track,tracks,She saw the tracks trolley., trolley tracks, tracks trolley,trolley,True,-26.040481567382812,-25.813579559326172,-0.22690200805664062,14067712,EleutherAI/pythia-14m,step142000,seed1,1,142000
She saw the moose tracks.,track,tracks,She saw the tracks moose., moose tracks, tracks moose,moose,False,-21.732805252075195,-22.604503631591797,0.8716983795166016,14067712,EleutherAI/pythia-14m,step142000,seed1,1,142000
It was five yards.,yard,yards,It was yards five., five yards, yards five,five,True,-15.635055541992188,-23.090547561645508,7.45549201965332,14067712,EleutherAI/pythia-14m,step142000,seed1,1,142000
It was ten yards.,yard,yards,It was yards ten., ten yards, yards ten,ten,True,-14.317007064819336,-23.899995803833008,9.582988739013672,14067712,EleutherAI/pythia-14m,step142000,seed1,1,142000
They were big yards.,yard,yards,They were yards big., big yards, yards big,big,False,-18.37028694152832,-22.694595336914062,4.324308395385742,14067712,EleutherAI/pythia-14m,step142000,seed1,1,142000
It was a comedic act.,act,act,It was an act comedic., comedic act, act comedic,comedic,False,-17.01940155029297,-20.537805557250977,3.518404006958008,14067712,EleutherAI/pythia-14m,step142000,seed1,1,142000
He had a pending appeal.,appeal,appeal,He had an appeal pending., pending appeal, appeal pending,pending,False,-15.014081954956055,-14.0941162109375,-0.9199657440185547,14067712,EleutherAI/pythia-14m,step142000,seed1,1,142000
It was a polluted atmosphere.,atmosphere,atmosphere,It was an atmosphere polluted., polluted atmosphere, atmosphere polluted,polluted,False,-29.487262725830078,-28.736644744873047,-0.7506179809570312,14067712,EleutherAI/pythia-14m,step142000,seed1,1,142000
It was a country band.,band,band,It was a band country., country band, band country,country,True,-15.144203186035156,-19.206268310546875,4.062065124511719,14067712,EleutherAI/pythia-14m,step142000,seed1,1,142000
There was a religious barrier.,barrier,barrier,There was a barrier religious., religious barrier, barrier religious,religious,False,-17.062740325927734,-20.762081146240234,3.6993408203125,14067712,EleutherAI/pythia-14m,step142000,seed1,1,142000
He saw a baseball bat.,bat,bat,He saw a bat baseball., baseball bat, bat baseball,baseball,True,-12.601978302001953,-18.996923446655273,6.39494514465332,14067712,EleutherAI/pythia-14m,step142000,seed1,1,142000
He saw the balance beam.,beam,beam,He saw the beam balance., balance beam, beam balance,balance,True,-18.988069534301758,-20.03782844543457,1.0497589111328125,14067712,EleutherAI/pythia-14m,step142000,seed1,1,142000
She had a writer's block.,block,block,She had a block writer's., writer's block, block writer's,writer,True,-24.826072692871094,-24.767812728881836,-0.05825996398925781,14067712,EleutherAI/pythia-14m,step142000,seed1,1,142000
He has royal blood.,blood,blood,He has blood royal., royal blood, blood royal,royal,False,-22.0128116607666,-25.45374298095703,3.4409313201904297,14067712,EleutherAI/pythia-14m,step142000,seed1,1,142000
It was the school board.,board,board,It was the board school., school board, board school,school,True,-14.873348236083984,-18.39746856689453,3.524120330810547,14067712,EleutherAI/pythia-14m,step142000,seed1,1,142000
He had a leather-bound book.,book,book,He had a book leather-bound., leather-bound book, book leather-bound,leather-bound,False,-24.556663513183594,-28.115028381347656,3.5583648681640625,14067712,EleutherAI/pythia-14m,step142000,seed1,1,142000
They ate a lonely breakfast.,breakfast,breakfast,They ate a breakfast lonely., lonely breakfast, breakfast lonely,lonely,False,-13.623994827270508,-18.293853759765625,4.669858932495117,14067712,EleutherAI/pythia-14m,step142000,seed1,1,142000
It was an island cape.,cape,cape,It was an cape island., island cape, cape island,island,True,-21.664493560791016,-27.19148063659668,5.526987075805664,14067712,EleutherAI/pythia-14m,step142000,seed1,1,142000
It was a criminal case.,case,case,It was a case criminal., criminal case, case criminal,criminal,False,-10.877402305603027,-16.278921127319336,5.401518821716309,14067712,EleutherAI/pythia-14m,step142000,seed1,1,142000
It was a primary cause.,cause,cause,It was a cause primary., primary cause, cause primary,primary,False,-13.486188888549805,-22.96274757385254,9.476558685302734,14067712,EleutherAI/pythia-14m,step142000,seed1,1,142000
It was a jail cell.,cell,cell,It was a cell jail., jail cell, cell jail,jail,True,-15.518285751342773,-19.403188705444336,3.8849029541015625,14067712,EleutherAI/pythia-14m,step142000,seed1,1,142000
She had a good-luck charm.,charm,charm,She had a charm good-luck., good-luck charm, charm good-luck,good-luck,False,-27.973297119140625,-30.444116592407227,2.4708194732666016,14067712,EleutherAI/pythia-14m,step142000,seed1,1,142000
They liked the pet chicken.,chicken,chicken,They liked the chicken pet., pet chicken, chicken pet,pet,True,-17.9488468170166,-17.806522369384766,-0.14232444763183594,14067712,EleutherAI/pythia-14m,step142000,seed1,1,142000
It was a stimulating class.,class,class,It was a class stimulating., stimulating class, class stimulating,stimulating,False,-21.62991714477539,-22.60914421081543,0.9792270660400391,14067712,EleutherAI/pythia-14m,step142000,seed1,1,142000
It was a metal clip.,clip,clip,It was a clip metal., metal clip, clip metal,metal,True,-17.514707565307617,-21.042137145996094,3.5274295806884766,14067712,EleutherAI/pythia-14m,step142000,seed1,1,142000
It was a common cold.,cold,cold,It was a cold common., common cold, cold common,common,False,-15.30286979675293,-17.39328384399414,2.090414047241211,14067712,EleutherAI/pythia-14m,step142000,seed1,1,142000
It was a marble column.,column,column,It was a column marble., marble column, column marble,marble,True,-20.238370895385742,-21.659746170043945,1.4213752746582031,14067712,EleutherAI/pythia-14m,step142000,seed1,1,142000
He liked the polite company.,company,company,He liked the company polite., polite company, company polite,polite,False,-18.35051918029785,-19.763423919677734,1.4129047393798828,14067712,EleutherAI/pythia-14m,step142000,seed1,1,142000
It was a traffic cone.,cone,cone,It was a cone traffic., traffic cone, cone traffic,traffic,True,-19.068357467651367,-23.430152893066406,4.361795425415039,14067712,EleutherAI/pythia-14m,step142000,seed1,1,142000
He made a well-written contribution.,contribution,contribution,He made a contribution well-written., well-written contribution, contribution well-written,well-written,False,-22.12118148803711,-28.633075714111328,6.511894226074219,14067712,EleutherAI/pythia-14m,step142000,seed1,1,142000
That was the correct count.,count,count,That was the count correct., correct count, count correct,correct,False,-15.708964347839355,-18.99474334716797,3.2857789993286133,14067712,EleutherAI/pythia-14m,step142000,seed1,1,142000
It was a collision course.,course,course,It was a course collision., collision course, course collision,collision,True,-18.402851104736328,-20.619157791137695,2.216306686401367,14067712,EleutherAI/pythia-14m,step142000,seed1,1,142000
It was a historical date.,date,date,It was a date historical., historical date, date historical,historical,False,-17.03649139404297,-22.16899871826172,5.13250732421875,14067712,EleutherAI/pythia-14m,step142000,seed1,1,142000
It was about college degrees.,degree,degrees,It was about degrees college., college degrees, degrees college,college,True,-18.370262145996094,-24.330598831176758,5.960336685180664,14067712,EleutherAI/pythia-14m,step142000,seed1,1,142000
They liked the architectural design.,design,design,They liked the design architectural., architectural design, design architectural,architectural,False,-16.640037536621094,-20.33056640625,3.6905288696289062,14067712,EleutherAI/pythia-14m,step142000,seed1,1,142000
They liked the anniversary dinner.,dinner,dinner,They liked the dinner anniversary., anniversary dinner, dinner anniversary,anniversary,True,-21.759109497070312,-18.428359985351562,-3.33074951171875,14067712,EleutherAI/pythia-14m,step142000,seed1,1,142000
He had a career dream.,dream,dream,He had a dream career., career dream, dream career,career,True,-14.768865585327148,-15.74044418334961,0.9715785980224609,14067712,EleutherAI/pythia-14m,step142000,seed1,1,142000
It was a battery-powered drill.,drill,drill,It was a drill battery-powered., battery-powered drill, drill battery-powered,battery-powered,False,-26.271015167236328,-27.537660598754883,1.2666454315185547,14067712,EleutherAI/pythia-14m,step142000,seed1,1,142000
It was a physical examination.,examination,examination,It was an examination physical., physical examination, examination physical,physical,False,-13.708106994628906,-22.428287506103516,8.72018051147461,14067712,EleutherAI/pythia-14m,step142000,seed1,1,142000
They had an enthusiastic fan.,fan,fan,They had an fan enthusiastic., enthusiastic fan, fan enthusiastic,enthusiastic,False,-16.168018341064453,-27.368642807006836,11.200624465942383,14067712,EleutherAI/pythia-14m,step142000,seed1,1,142000
She had a steel file.,file,file,She had a file steel., steel file, file steel,steel,True,-19.788297653198242,-24.832008361816406,5.043710708618164,14067712,EleutherAI/pythia-14m,step142000,seed1,1,142000
It was a plastic film.,film,film,It was a film plastic., plastic film, film plastic,plastic,False,-15.054841995239258,-18.951738357543945,3.8968963623046875,14067712,EleutherAI/pythia-14m,step142000,seed1,1,142000
It was a concrete foundation.,foundation,foundation,It was a foundation concrete., concrete foundation, foundation concrete,concrete,False,-15.155961990356445,-23.37103271484375,8.215070724487305,14067712,EleutherAI/pythia-14m,step142000,seed1,1,142000
It was a business function.,function,function,It was a function business., business function, function business,business,True,-15.280139923095703,-19.69756317138672,4.417423248291016,14067712,EleutherAI/pythia-14m,step142000,seed1,1,142000
He was on the parade ground.,ground,ground,He was on the ground parade., parade ground, ground parade,parade,True,-16.87904930114746,-19.47702407836914,2.5979747772216797,14067712,EleutherAI/pythia-14m,step142000,seed1,1,142000
They liked the national guard.,guard,guard,They liked the guard national., national guard, guard national,national,False,-19.17581558227539,-21.299999237060547,2.1241836547851562,14067712,EleutherAI/pythia-14m,step142000,seed1,1,142000
He had a friendly guide.,guide,guide,He had a guide friendly., friendly guide, guide friendly,friendly,False,-15.856642723083496,-19.822555541992188,3.9659128189086914,14067712,EleutherAI/pythia-14m,step142000,seed1,1,142000
It was a nursing home.,home,home,It was a home nursing., nursing home, home nursing,nursing,True,-13.26791000366211,-18.748807907104492,5.480897903442383,14067712,EleutherAI/pythia-14m,step142000,seed1,1,142000
They had military intelligence.,intelligence,intelligence,They had intelligence military., military intelligence, intelligence military,military,False,-17.281005859375,-22.179885864257812,4.8988800048828125,14067712,EleutherAI/pythia-14m,step142000,seed1,1,142000
It was a special issue.,issue,issue,It was an issue special., special issue, issue special,special,False,-11.698553085327148,-15.038328170776367,3.3397750854492188,14067712,EleutherAI/pythia-14m,step142000,seed1,1,142000
It was a paper jam.,jam,jam,It was a jam paper., paper jam, jam paper,paper,True,-19.87213897705078,-18.755279541015625,-1.1168594360351562,14067712,EleutherAI/pythia-14m,step142000,seed1,1,142000
It was a backspace key.,key,key,It was a key backspace., backspace key, key backspace,backspace,True,-27.9818058013916,-25.740896224975586,-2.2409095764160156,14067712,EleutherAI/pythia-14m,step142000,seed1,1,142000
They liked the friendly lamb.,lamb,lamb,They liked the lamb friendly., friendly lamb, lamb friendly,friendly,False,-19.515880584716797,-20.95037269592285,1.4344921112060547,14067712,EleutherAI/pythia-14m,step142000,seed1,1,142000
She had door locks.,lock,locks,She had locks door., door locks, locks door,door,True,-21.511680603027344,-17.75261688232422,-3.759063720703125,14067712,EleutherAI/pythia-14m,step142000,seed1,1,142000
They liked the women's lunch.,lunch,lunch,They liked the lunch women's., women's lunch, lunch women's,women,True,-18.26218032836914,-23.058191299438477,4.796010971069336,14067712,EleutherAI/pythia-14m,step142000,seed1,1,142000
He liked the stock market.,market,market,He liked the market stock., stock market, market stock,stock,True,-13.780887603759766,-16.41495704650879,2.6340694427490234,14067712,EleutherAI/pythia-14m,step142000,seed1,1,142000
It was a tennis match.,match,match,It was a match tennis., tennis match, match tennis,tennis,True,-14.922621726989746,-19.74639129638672,4.823769569396973,14067712,EleutherAI/pythia-14m,step142000,seed1,1,142000
It was veterinary medicine.,medicine,medicine,It was medicine veterinary., veterinary medicine, medicine veterinary,veterinary,False,-16.325542449951172,-23.67591094970703,7.350368499755859,14067712,EleutherAI/pythia-14m,step142000,seed1,1,142000
There was a clear message.,message,message,There was a message clear., clear message, message clear,clear,False,-14.438796997070312,-16.26213836669922,1.8233413696289062,14067712,EleutherAI/pythia-14m,step142000,seed1,1,142000
It was a clay mold.,mold,mold,It was a mold clay., clay mold, mold clay,clay,True,-17.701814651489258,-19.614431381225586,1.9126167297363281,14067712,EleutherAI/pythia-14m,step142000,seed1,1,142000
She saw the fast mole.,mole,mole,She saw the mole fast., fast mole, mole fast,fast,False,-21.79183578491211,-21.81515121459961,0.0233154296875,14067712,EleutherAI/pythia-14m,step142000,seed1,1,142000
He liked the civil-rights movement.,movement,movement,He liked the movement civil-rights., civil-rights movement, movement civil-rights,civil-rights,False,-22.986461639404297,-31.01759910583496,8.031137466430664,14067712,EleutherAI/pythia-14m,step142000,seed1,1,142000
It was a shredded newspaper.,newspaper,newspaper,It was a newspaper shredded., shredded newspaper, newspaper shredded,shredded,False,-21.239093780517578,-22.907352447509766,1.6682586669921875,14067712,EleutherAI/pythia-14m,step142000,seed1,1,142000
It was a reddish orange.,orange,orange,It was an orange reddish., reddish orange, orange reddish,reddish,False,-19.30353546142578,-17.94962501525879,-1.3539104461669922,14067712,EleutherAI/pythia-14m,step142000,seed1,1,142000
He saw the ripped page.,page,page,He saw the page ripped., ripped page, page ripped,ripped,False,-21.972591400146484,-21.3123836517334,-0.6602077484130859,14067712,EleutherAI/pythia-14m,step142000,seed1,1,142000
It was a tree palm.,palm,palm,It was a palm tree., tree palm, palm tree,tree,True,-19.200302124023438,-14.28501033782959,-4.915291786193848,14067712,EleutherAI/pythia-14m,step142000,seed1,1,142000
It was a consumer panel.,panel,panel,It was a panel consumer., consumer panel, panel consumer,consumer,True,-19.53057098388672,-24.082550048828125,4.551979064941406,14067712,EleutherAI/pythia-14m,step142000,seed1,1,142000
It was a biblical passage.,passage,passage,It was a passage biblical., biblical passage, passage biblical,biblical,False,-17.263492584228516,-22.746196746826172,5.482704162597656,14067712,EleutherAI/pythia-14m,step142000,seed1,1,142000
It was a secure perch.,perch,perch,It was a perch secure., secure perch, perch secure,secure,False,-25.62218475341797,-25.860809326171875,0.23862457275390625,14067712,EleutherAI/pythia-14m,step142000,seed1,1,142000
He saw the plastic pitcher.,pitcher,pitcher,He saw the pitcher plastic., plastic pitcher, pitcher plastic,plastic,True,-20.30396842956543,-22.497509002685547,2.193540573120117,14067712,EleutherAI/pythia-14m,step142000,seed1,1,142000
It was a sweet port.,port,port,It was a port sweet., sweet port, port sweet,sweet,False,-17.433523178100586,-21.699481964111328,4.265958786010742,14067712,EleutherAI/pythia-14m,step142000,seed1,1,142000
He was in a yoga position.,position,position,He was in a position yoga., yoga position, position yoga,yoga,True,-15.40466594696045,-18.008543014526367,2.603877067565918,14067712,EleutherAI/pythia-14m,step142000,seed1,1,142000
It was a challenging post.,post,post,It was a post challenging., challenging post, post challenging,challenging,False,-15.716197967529297,-17.611797332763672,1.895599365234375,14067712,EleutherAI/pythia-14m,step142000,seed1,1,142000
He had the quickest punch.,punch,punch,He had the punch quickest., quickest punch, punch quickest,quickest,False,-20.72414207458496,-26.09027671813965,5.3661346435546875,14067712,EleutherAI/pythia-14m,step142000,seed1,1,142000
She had a cloudy pupil.,pupil,pupil,She had a pupil cloudy., cloudy pupil, pupil cloudy,cloudy,False,-24.837051391601562,-26.165313720703125,1.3282623291015625,14067712,EleutherAI/pythia-14m,step142000,seed1,1,142000
That was a tennis racket.,racket,racket,That was a racket tennis., tennis racket, racket tennis,tennis,True,-16.758338928222656,-20.72572135925293,3.9673824310302734,14067712,EleutherAI/pythia-14m,step142000,seed1,1,142000
He liked granite rock.,rock,rock,He liked rock granite., granite rock, rock granite,granite,True,-19.8048095703125,-19.603755950927734,-0.20105361938476562,14067712,EleutherAI/pythia-14m,step142000,seed1,1,142000
He saw the bushy sage.,sage,sage,He saw the sage bushy., bushy sage, sage bushy,bushy,False,-28.633769989013672,-27.718978881835938,-0.9147911071777344,14067712,EleutherAI/pythia-14m,step142000,seed1,1,142000
It was a major scale.,scale,scale,It was a scale major., major scale, scale major,major,False,-15.877119064331055,-20.825847625732422,4.948728561401367,14067712,EleutherAI/pythia-14m,step142000,seed1,1,142000
It was a panoramic scene.,scene,scene,It was a scene panoramic., panoramic scene, scene panoramic,panoramic,False,-19.172529220581055,-23.21604347229004,4.043514251708984,14067712,EleutherAI/pythia-14m,step142000,seed1,1,142000
It was a trained seal.,seal,seal,It was a seal trained., trained seal, seal trained,trained,False,-23.718130111694336,-24.277198791503906,0.5590686798095703,14067712,EleutherAI/pythia-14m,step142000,seed1,1,142000
He used the video tape.,tape,tape,He used the tape video., video tape, tape video,video,True,-11.753955841064453,-15.107772827148438,3.3538169860839844,14067712,EleutherAI/pythia-14m,step142000,seed1,1,142000
It was a technical term.,term,term,It was a term technical., technical term, term technical,technical,False,-17.671958923339844,-20.3363037109375,2.6643447875976562,14067712,EleutherAI/pythia-14m,step142000,seed1,1,142000
It was a diseased tick.,tick,tick,It was a tick diseased., diseased tick, tick diseased,diseased,False,-23.0659236907959,-26.447982788085938,3.382059097290039,14067712,EleutherAI/pythia-14m,step142000,seed1,1,142000
It was a finger tip.,tip,tip,It was a tip finger., finger tip, tip finger,finger,True,-22.84356689453125,-19.356401443481445,-3.4871654510498047,14067712,EleutherAI/pythia-14m,step142000,seed1,1,142000
She liked the professional title.,title,title,She liked the title professional., professional title, title professional,professional,False,-15.011873245239258,-16.27676773071289,1.2648944854736328,14067712,EleutherAI/pythia-14m,step142000,seed1,1,142000
It was a bell toll.,toll,toll,It was a toll bell., bell toll, toll bell,bell,True,-21.625240325927734,-21.419429779052734,-0.205810546875,14067712,EleutherAI/pythia-14m,step142000,seed1,1,142000
She saw the snowshoe tracks.,track,tracks,She saw the tracks snowshoe., snowshoe tracks, tracks snowshoe,snowshoe,True,-29.375591278076172,-35.35348892211914,5.977897644042969,14067712,EleutherAI/pythia-14m,step142000,seed1,1,142000
They were cluttered yards.,yard,yards,They were yards cluttered., cluttered yards, yards cluttered,cluttered,False,-25.656558990478516,-24.61949920654297,-1.0370597839355469,14067712,EleutherAI/pythia-14m,step142000,seed1,1,142000
