sentence,word,string,reversed_sentence,mod_np,reversed_mod,disambiguating_word,non_adjective,original_logprob,reversed_logprob,ratio,n_params,mpath,revision,seed_name,seed,step
It was a desperate act.,act,act,It was an act desperate., desperate act, act desperate,desperate,False,-14.797600746154785,-18.72408103942871,3.926480293273926,14067712,EleutherAI/pythia-14m,step137000,seed3,3,137000
It was a humane act.,act,act,It was an act humane., humane act, act humane,humane,False,-18.280155181884766,-19.55908966064453,1.2789344787597656,14067712,EleutherAI/pythia-14m,step137000,seed3,3,137000
It was a magic act.,act,act,It was an act magic., magic act, act magic,magic,False,-17.730222702026367,-17.47859764099121,-0.25162506103515625,14067712,EleutherAI/pythia-14m,step137000,seed3,3,137000
He had a universal appeal.,appeal,appeal,He had an appeal universal., universal appeal, appeal universal,universal,False,-20.29094696044922,-20.199846267700195,-0.09110069274902344,14067712,EleutherAI/pythia-14m,step137000,seed3,3,137000
He had an undefinable appeal.,appeal,appeal,He had an appeal undefinable., undefinable appeal, appeal undefinable,undefinable,False,-25.83488655090332,-27.38920783996582,1.5543212890625,14067712,EleutherAI/pythia-14m,step137000,seed3,3,137000
He had a legal appeal.,appeal,appeal,He had an appeal legal., legal appeal, appeal legal,legal,False,-17.13433265686035,-17.094133377075195,-0.04019927978515625,14067712,EleutherAI/pythia-14m,step137000,seed3,3,137000
It was a tense atmosphere.,atmosphere,atmosphere,It was an atmosphere tense., tense atmosphere, atmosphere tense,tense,False,-17.758060455322266,-19.10706329345703,1.3490028381347656,14067712,EleutherAI/pythia-14m,step137000,seed3,3,137000
It was a hostile atmosphere.,atmosphere,atmosphere,It was an atmosphere hostile., hostile atmosphere, atmosphere hostile,hostile,False,-15.498557090759277,-20.54053497314453,5.041977882385254,14067712,EleutherAI/pythia-14m,step137000,seed3,3,137000
It was a gaseous atmosphere.,atmosphere,atmosphere,It was an atmosphere gaseous., gaseous atmosphere, atmosphere gaseous,gaseous,False,-16.780933380126953,-21.28870391845703,4.507770538330078,14067712,EleutherAI/pythia-14m,step137000,seed3,3,137000
It was a gold band.,band,band,It was a band gold., gold band, band gold,gold,True,-15.238875389099121,-19.445693969726562,4.206818580627441,14067712,EleutherAI/pythia-14m,step137000,seed3,3,137000
It was a rubber band.,band,band,It was a band rubber., rubber band, band rubber,rubber,True,-14.087257385253906,-17.941787719726562,3.8545303344726562,14067712,EleutherAI/pythia-14m,step137000,seed3,3,137000
It was a jazz band.,band,band,It was a band jazz., jazz band, band jazz,jazz,True,-13.474929809570312,-17.524673461914062,4.04974365234375,14067712,EleutherAI/pythia-14m,step137000,seed3,3,137000
There was a police barrier.,barrier,barrier,There was a barrier police., police barrier, barrier police,police,True,-19.37908935546875,-19.94581413269043,0.5667247772216797,14067712,EleutherAI/pythia-14m,step137000,seed3,3,137000
There was a concrete barrier.,barrier,barrier,There was a barrier concrete., concrete barrier, barrier concrete,concrete,False,-16.126733779907227,-18.79994010925293,2.673206329345703,14067712,EleutherAI/pythia-14m,step137000,seed3,3,137000
There was a language barrier.,barrier,barrier,There was a barrier language., language barrier, barrier language,language,True,-18.604167938232422,-21.57459831237793,2.970430374145508,14067712,EleutherAI/pythia-14m,step137000,seed3,3,137000
He saw a furry bat.,bat,bat,He saw a bat furry., furry bat, bat furry,furry,False,-18.427696228027344,-19.487674713134766,1.0599784851074219,14067712,EleutherAI/pythia-14m,step137000,seed3,3,137000
He saw a fruit bat.,bat,bat,He saw a bat fruit., fruit bat, bat fruit,fruit,True,-20.19805145263672,-22.76450538635254,2.5664539337158203,14067712,EleutherAI/pythia-14m,step137000,seed3,3,137000
He saw a wooden bat.,bat,bat,He saw a bat wooden., wooden bat, bat wooden,wooden,False,-15.478443145751953,-19.65952491760254,4.181081771850586,14067712,EleutherAI/pythia-14m,step137000,seed3,3,137000
He saw the laser beam.,beam,beam,He saw the beam laser., laser beam, beam laser,laser,True,-11.648630142211914,-17.32982635498047,5.681196212768555,14067712,EleutherAI/pythia-14m,step137000,seed3,3,137000
He saw the bright beam.,beam,beam,He saw the beam bright., bright beam, beam bright,bright,False,-16.188570022583008,-16.7125186920166,0.5239486694335938,14067712,EleutherAI/pythia-14m,step137000,seed3,3,137000
He saw the wood beam.,beam,beam,He saw the beam wood., wood beam, beam wood,wood,True,-17.048372268676758,-19.88646697998047,2.838094711303711,14067712,EleutherAI/pythia-14m,step137000,seed3,3,137000
She had a toy block.,block,block,She had a block toy., toy block, block toy,toy,True,-17.036540985107422,-20.356464385986328,3.3199234008789062,14067712,EleutherAI/pythia-14m,step137000,seed3,3,137000
She had a wooden block.,block,block,She had a block wooden., wooden block, block wooden,wooden,False,-14.438033103942871,-20.368793487548828,5.930760383605957,14067712,EleutherAI/pythia-14m,step137000,seed3,3,137000
She had a mental block.,block,block,She had a block mental., mental block, block mental,mental,False,-16.172998428344727,-22.085590362548828,5.912591934204102,14067712,EleutherAI/pythia-14m,step137000,seed3,3,137000
He has coagulated blood.,blood,blood,He has blood coagulated., coagulated blood, blood coagulated,coagulated,True,-29.003894805908203,-29.50810432434082,0.5042095184326172,14067712,EleutherAI/pythia-14m,step137000,seed3,3,137000
He has thin blood.,blood,blood,He has blood thin., thin blood, blood thin,thin,False,-18.44548797607422,-19.288394927978516,0.8429069519042969,14067712,EleutherAI/pythia-14m,step137000,seed3,3,137000
He has noble blood.,blood,blood,He has blood noble., noble blood, blood noble,noble,False,-19.2249755859375,-22.486392974853516,3.2614173889160156,14067712,EleutherAI/pythia-14m,step137000,seed3,3,137000
It was the ironing board.,board,board,It was the board ironing., ironing board, board ironing,ironing,False,-20.664554595947266,-20.707595825195312,0.043041229248046875,14067712,EleutherAI/pythia-14m,step137000,seed3,3,137000
It was the wooden board.,board,board,It was the board wooden., wooden board, board wooden,wooden,False,-14.132314682006836,-18.177566528320312,4.045251846313477,14067712,EleutherAI/pythia-14m,step137000,seed3,3,137000
It was the executive board.,board,board,It was the board executive., executive board, board executive,executive,True,-12.693647384643555,-16.523269653320312,3.829622268676758,14067712,EleutherAI/pythia-14m,step137000,seed3,3,137000
He had a best-selling book.,book,book,He had a book best-selling., best-selling book, book best-selling,best-selling,False,-14.11166000366211,-21.88432502746582,7.772665023803711,14067712,EleutherAI/pythia-14m,step137000,seed3,3,137000
He had a popular book.,book,book,He had a book popular., popular book, book popular,popular,False,-14.41150188446045,-18.5618839263916,4.150382041931152,14067712,EleutherAI/pythia-14m,step137000,seed3,3,137000
He had a heavy book.,book,book,He had a book heavy., heavy book, book heavy,heavy,False,-15.28938102722168,-19.7471866607666,4.457805633544922,14067712,EleutherAI/pythia-14m,step137000,seed3,3,137000
They ate a pancake breakfast.,breakfast,breakfast,They ate a breakfast pancake., pancake breakfast, breakfast pancake,pancake,True,-16.043792724609375,-17.348278045654297,1.3044853210449219,14067712,EleutherAI/pythia-14m,step137000,seed3,3,137000
They ate a nutritious breakfast.,breakfast,breakfast,They ate a breakfast nutritious., nutritious breakfast, breakfast nutritious,nutritious,False,-20.21432113647461,-22.590900421142578,2.3765792846679688,14067712,EleutherAI/pythia-14m,step137000,seed3,3,137000
They ate a family breakfast.,breakfast,breakfast,They ate a breakfast family., family breakfast, breakfast family,family,True,-13.919955253601074,-16.27461814880371,2.3546628952026367,14067712,EleutherAI/pythia-14m,step137000,seed3,3,137000
It was a red cape.,cape,cape,It was a cape red., red cape, cape red,red,False,-17.318286895751953,-20.87662696838379,3.558340072631836,14067712,EleutherAI/pythia-14m,step137000,seed3,3,137000
It was a flowing cape.,cape,cape,It was a cape flowing., flowing cape, cape flowing,flowing,False,-20.488637924194336,-22.24149513244629,1.7528572082519531,14067712,EleutherAI/pythia-14m,step137000,seed3,3,137000
It was a rocky cape.,cape,cape,It was a cape rocky., rocky cape, cape rocky,rocky,False,-19.565631866455078,-24.76468849182129,5.199056625366211,14067712,EleutherAI/pythia-14m,step137000,seed3,3,137000
It was a beer case.,case,case,It was a case beer., beer case, case beer,beer,True,-16.69497299194336,-20.104446411132812,3.409473419189453,14067712,EleutherAI/pythia-14m,step137000,seed3,3,137000
It was a display case.,case,case,It was a case display., display case, case display,display,True,-13.59957218170166,-15.351029396057129,1.7514572143554688,14067712,EleutherAI/pythia-14m,step137000,seed3,3,137000
It was a divorce case.,case,case,It was a case divorce., divorce case, case divorce,divorce,True,-13.90658187866211,-16.462234497070312,2.555652618408203,14067712,EleutherAI/pythia-14m,step137000,seed3,3,137000
It was a worthy cause.,cause,cause,It was a cause worthy., worthy cause, cause worthy,worthy,False,-15.425456047058105,-19.093505859375,3.6680498123168945,14067712,EleutherAI/pythia-14m,step137000,seed3,3,137000
It was a political cause.,cause,cause,It was a cause political., political cause, cause political,political,False,-17.27871322631836,-21.3187255859375,4.040012359619141,14067712,EleutherAI/pythia-14m,step137000,seed3,3,137000
It was a main cause.,cause,cause,It was a cause main., main cause, cause main,main,False,-11.413614273071289,-21.4019775390625,9.988363265991211,14067712,EleutherAI/pythia-14m,step137000,seed3,3,137000
It was a skin cell.,cell,cell,It was a cell skin., skin cell, cell skin,skin,True,-17.048852920532227,-17.605382919311523,0.5565299987792969,14067712,EleutherAI/pythia-14m,step137000,seed3,3,137000
It was a brain cell.,cell,cell,It was a cell brain., brain cell, cell brain,brain,True,-14.477224349975586,-16.874792098999023,2.3975677490234375,14067712,EleutherAI/pythia-14m,step137000,seed3,3,137000
It was a prison cell.,cell,cell,It was a cell prison., prison cell, cell prison,prison,True,-14.164665222167969,-17.331823348999023,3.1671581268310547,14067712,EleutherAI/pythia-14m,step137000,seed3,3,137000
She had a devilish charm.,charm,charm,She had a charm devilish., devilish charm, charm devilish,devilish,False,-19.585140228271484,-24.59160804748535,5.006467819213867,14067712,EleutherAI/pythia-14m,step137000,seed3,3,137000
She had a natural charm.,charm,charm,She had a charm natural., natural charm, charm natural,natural,False,-14.724586486816406,-19.245195388793945,4.520608901977539,14067712,EleutherAI/pythia-14m,step137000,seed3,3,137000
She had a gold charm.,charm,charm,She had a charm gold., gold charm, charm gold,gold,True,-14.939821243286133,-18.189653396606445,3.2498321533203125,14067712,EleutherAI/pythia-14m,step137000,seed3,3,137000
They liked the juicy chicken.,chicken,chicken,They liked the chicken juicy., juicy chicken, chicken juicy,juicy,False,-19.91143798828125,-21.336795806884766,1.4253578186035156,14067712,EleutherAI/pythia-14m,step137000,seed3,3,137000
They liked the roasted chicken.,chicken,chicken,They liked the chicken roasted., roasted chicken, chicken roasted,roasted,False,-16.422086715698242,-20.217700958251953,3.795614242553711,14067712,EleutherAI/pythia-14m,step137000,seed3,3,137000
They liked the clucking chicken.,chicken,chicken,They liked the chicken clucking., clucking chicken, chicken clucking,clucking,True,-23.48712921142578,-26.642438888549805,3.1553096771240234,14067712,EleutherAI/pythia-14m,step137000,seed3,3,137000
It was a perceptive class.,class,class,It was a class perceptive., perceptive class, class perceptive,perceptive,False,-21.936410903930664,-24.777559280395508,2.8411483764648438,14067712,EleutherAI/pythia-14m,step137000,seed3,3,137000
It was a misbehaving class.,class,class,It was a class misbehaving., misbehaving class, class misbehaving,misbehaving,False,-25.500572204589844,-28.854753494262695,3.3541812896728516,14067712,EleutherAI/pythia-14m,step137000,seed3,3,137000
It was a boring class.,class,class,It was a class boring., boring class, class boring,boring,False,-16.516315460205078,-19.90244483947754,3.386129379272461,14067712,EleutherAI/pythia-14m,step137000,seed3,3,137000
It was a film clip.,clip,clip,It was a clip film., film clip, clip film,film,True,-14.919899940490723,-17.962764739990234,3.0428647994995117,14067712,EleutherAI/pythia-14m,step137000,seed3,3,137000
It was a video clip.,clip,clip,It was a clip video., video clip, clip video,video,True,-10.916159629821777,-18.088619232177734,7.172459602355957,14067712,EleutherAI/pythia-14m,step137000,seed3,3,137000
It was a hair clip.,clip,clip,It was a clip hair., hair clip, clip hair,hair,True,-17.96541404724121,-23.954708099365234,5.989294052124023,14067712,EleutherAI/pythia-14m,step137000,seed3,3,137000
It was an icy cold.,cold,cold,It was an cold icy., icy cold, cold icy,icy,False,-12.79936695098877,-19.052370071411133,6.253003120422363,14067712,EleutherAI/pythia-14m,step137000,seed3,3,137000
It was a freezing cold.,cold,cold,It was a cold freezing., freezing cold, cold freezing,freezing,False,-12.545016288757324,-13.38937759399414,0.8443613052368164,14067712,EleutherAI/pythia-14m,step137000,seed3,3,137000
It was a chest cold.,cold,cold,It was a cold chest., chest cold, cold chest,chest,False,-15.410297393798828,-14.70004653930664,-0.7102508544921875,14067712,EleutherAI/pythia-14m,step137000,seed3,3,137000
It was a gossip column.,column,column,It was a column gossip., gossip column, column gossip,gossip,True,-18.2882080078125,-23.2755126953125,4.9873046875,14067712,EleutherAI/pythia-14m,step137000,seed3,3,137000
It was a sports column.,column,column,It was a column sports., sports column, column sports,sports,True,-19.37273406982422,-23.6973876953125,4.324653625488281,14067712,EleutherAI/pythia-14m,step137000,seed3,3,137000
It was a concrete column.,column,column,It was a column concrete., concrete column, column concrete,concrete,False,-17.574508666992188,-20.3052978515625,2.7307891845703125,14067712,EleutherAI/pythia-14m,step137000,seed3,3,137000
He liked the investment company.,company,company,He liked the company investment., investment company, company investment,investment,True,-14.043062210083008,-17.495088577270508,3.4520263671875,14067712,EleutherAI/pythia-14m,step137000,seed3,3,137000
He liked the pharmaceutical company.,company,company,He liked the company pharmaceutical., pharmaceutical company, company pharmaceutical,pharmaceutical,False,-14.92467212677002,-19.820039749145508,4.895367622375488,14067712,EleutherAI/pythia-14m,step137000,seed3,3,137000
He liked the pleasant company.,company,company,He liked the company pleasant., pleasant company, company pleasant,pleasant,False,-18.712051391601562,-18.851045608520508,0.1389942169189453,14067712,EleutherAI/pythia-14m,step137000,seed3,3,137000
It was a waffle cone.,cone,cone,It was a cone waffle., waffle cone, cone waffle,waffle,True,-25.3994140625,-26.665258407592773,1.2658443450927734,14067712,EleutherAI/pythia-14m,step137000,seed3,3,137000
It was a sugar cone.,cone,cone,It was a cone sugar., sugar cone, cone sugar,sugar,True,-19.448455810546875,-22.51190948486328,3.0634536743164062,14067712,EleutherAI/pythia-14m,step137000,seed3,3,137000
It was an orange cone.,cone,cone,It was an cone orange., orange cone, cone orange,orange,False,-15.814355850219727,-25.41488265991211,9.600526809692383,14067712,EleutherAI/pythia-14m,step137000,seed3,3,137000
He made a charitable contribution.,contribution,contribution,He made a contribution charitable., charitable contribution, contribution charitable,charitable,False,-15.042886734008789,-23.989961624145508,8.947074890136719,14067712,EleutherAI/pythia-14m,step137000,seed3,3,137000
He made a voluntary contribution.,contribution,contribution,He made a contribution voluntary., voluntary contribution, contribution voluntary,voluntary,False,-16.2265682220459,-23.593231201171875,7.366662979125977,14067712,EleutherAI/pythia-14m,step137000,seed3,3,137000
He made a scholarly contribution.,contribution,contribution,He made a contribution scholarly., scholarly contribution, contribution scholarly,scholarly,False,-18.25459098815918,-23.478853225708008,5.224262237548828,14067712,EleutherAI/pythia-14m,step137000,seed3,3,137000
That was the noble count.,count,count,That was the count noble., noble count, count noble,noble,False,-18.08650016784668,-21.72051239013672,3.634012222290039,14067712,EleutherAI/pythia-14m,step137000,seed3,3,137000
That was the vengeful count.,count,count,That was the count vengeful., vengeful count, count vengeful,vengeful,False,-22.342613220214844,-26.341285705566406,3.9986724853515625,14067712,EleutherAI/pythia-14m,step137000,seed3,3,137000
That was the final count.,count,count,That was the count final., final count, count final,final,False,-13.624786376953125,-17.53484344482422,3.9100570678710938,14067712,EleutherAI/pythia-14m,step137000,seed3,3,137000
It was an introductory course.,course,course,It was an course introductory., introductory course, course introductory,introductory,False,-11.506828308105469,-26.25257110595703,14.745742797851562,14067712,EleutherAI/pythia-14m,step137000,seed3,3,137000
It was a pass-fail course.,course,course,It was a course pass-fail., pass-fail course, course pass-fail,pass-fail,False,-30.549224853515625,-35.20390319824219,4.6546783447265625,14067712,EleutherAI/pythia-14m,step137000,seed3,3,137000
It was a charted course.,course,course,It was a course charted., charted course, course charted,charted,False,-20.675003051757812,-25.43950653076172,4.764503479003906,14067712,EleutherAI/pythia-14m,step137000,seed3,3,137000
It was a dinner date.,date,date,It was a date dinner., dinner date, date dinner,dinner,True,-16.616500854492188,-18.324771881103516,1.7082710266113281,14067712,EleutherAI/pythia-14m,step137000,seed3,3,137000
It was a blind date.,date,date,It was a date blind., blind date, date blind,blind,False,-16.95877456665039,-19.828433990478516,2.869659423828125,14067712,EleutherAI/pythia-14m,step137000,seed3,3,137000
It was an expiration date.,date,date,It was an date expiration., expiration date, date expiration,expiration,True,-11.041263580322266,-22.470853805541992,11.429590225219727,14067712,EleutherAI/pythia-14m,step137000,seed3,3,137000
It was about forty degrees.,degree,degrees,It was about degrees forty., forty degrees, degrees forty,forty,True,-14.991519927978516,-24.81528091430664,9.823760986328125,14067712,EleutherAI/pythia-14m,step137000,seed3,3,137000
It was about fifty degrees.,degree,degrees,It was about degrees fifty., fifty degrees, degrees fifty,fifty,True,-14.713785171508789,-24.34421157836914,9.630426406860352,14067712,EleutherAI/pythia-14m,step137000,seed3,3,137000
It was about associate degrees.,degree,degrees,It was about degrees associate., associate degrees, degrees associate,associate,False,-24.202545166015625,-26.82443618774414,2.6218910217285156,14067712,EleutherAI/pythia-14m,step137000,seed3,3,137000
They liked the floral design.,design,design,They liked the design floral., floral design, design floral,floral,False,-16.234621047973633,-20.018718719482422,3.784097671508789,14067712,EleutherAI/pythia-14m,step137000,seed3,3,137000
They liked the geometric design.,design,design,They liked the design geometric., geometric design, design geometric,geometric,False,-15.915122985839844,-18.923992156982422,3.008869171142578,14067712,EleutherAI/pythia-14m,step137000,seed3,3,137000
They liked the product design.,design,design,They liked the design product., product design, design product,product,True,-15.223855972290039,-15.634808540344238,0.4109525680541992,14067712,EleutherAI/pythia-14m,step137000,seed3,3,137000
They liked the turkey dinner.,dinner,dinner,They liked the dinner turkey., turkey dinner, dinner turkey,turkey,True,-19.76279067993164,-21.33367919921875,1.5708885192871094,14067712,EleutherAI/pythia-14m,step137000,seed3,3,137000
They liked the light dinner.,dinner,dinner,They liked the dinner light., light dinner, dinner light,light,False,-19.6342830657959,-20.78240966796875,1.1481266021728516,14067712,EleutherAI/pythia-14m,step137000,seed3,3,137000
They liked the formal dinner.,dinner,dinner,They liked the dinner formal., formal dinner, dinner formal,formal,False,-19.090970993041992,-22.83160400390625,3.740633010864258,14067712,EleutherAI/pythia-14m,step137000,seed3,3,137000
He had a recurring dream.,dream,dream,He had a dream recurring., recurring dream, dream recurring,recurring,False,-15.811415672302246,-18.2967529296875,2.485337257385254,14067712,EleutherAI/pythia-14m,step137000,seed3,3,137000
He had a bad dream.,dream,dream,He had a dream bad., bad dream, dream bad,bad,False,-11.638044357299805,-15.4349365234375,3.7968921661376953,14067712,EleutherAI/pythia-14m,step137000,seed3,3,137000
He had a childhood dream.,dream,dream,He had a dream childhood., childhood dream, dream childhood,childhood,True,-13.872419357299805,-16.2867431640625,2.4143238067626953,14067712,EleutherAI/pythia-14m,step137000,seed3,3,137000
It was a grueling drill.,drill,drill,It was a drill grueling., grueling drill, drill grueling,grueling,False,-20.26984405517578,-23.183452606201172,2.9136085510253906,14067712,EleutherAI/pythia-14m,step137000,seed3,3,137000
It was a challenging drill.,drill,drill,It was a drill challenging., challenging drill, drill challenging,challenging,False,-19.271377563476562,-21.486284255981445,2.214906692504883,14067712,EleutherAI/pythia-14m,step137000,seed3,3,137000
It was an electric drill.,drill,drill,It was an drill electric., electric drill, drill electric,electric,False,-14.011053085327148,-24.410478591918945,10.399425506591797,14067712,EleutherAI/pythia-14m,step137000,seed3,3,137000
It was a multiple-choice examination.,examination,examination,It was an examination multiple-choice., multiple-choice examination, examination multiple-choice,multiple-choice,False,-30.990379333496094,-33.26008987426758,2.2697105407714844,14067712,EleutherAI/pythia-14m,step137000,seed3,3,137000
It was a difficult examination.,examination,examination,It was an examination difficult., difficult examination, examination difficult,difficult,False,-17.036039352416992,-17.78842544555664,0.7523860931396484,14067712,EleutherAI/pythia-14m,step137000,seed3,3,137000
It was a prostate examination.,examination,examination,It was an examination prostate., prostate examination, examination prostate,prostate,True,-18.610328674316406,-20.87839126586914,2.2680625915527344,14067712,EleutherAI/pythia-14m,step137000,seed3,3,137000
They had an electric fan.,fan,fan,They had an fan electric., electric fan, fan electric,electric,False,-12.961173057556152,-21.066905975341797,8.105732917785645,14067712,EleutherAI/pythia-14m,step137000,seed3,3,137000
They had a ceiling fan.,fan,fan,They had a fan ceiling., ceiling fan, fan ceiling,ceiling,True,-17.75213050842285,-18.10944175720215,0.3573112487792969,14067712,EleutherAI/pythia-14m,step137000,seed3,3,137000
They had a zealous fan.,fan,fan,They had a fan zealous., zealous fan, fan zealous,zealous,False,-20.496646881103516,-24.316911697387695,3.8202648162841797,14067712,EleutherAI/pythia-14m,step137000,seed3,3,137000
She had a text file.,file,file,She had a file text., text file, file text,text,True,-13.671302795410156,-18.028318405151367,4.357015609741211,14067712,EleutherAI/pythia-14m,step137000,seed3,3,137000
She had a data file.,file,file,She had a file data., data file, file data,data,True,-15.772233009338379,-19.218505859375,3.446272850036621,14067712,EleutherAI/pythia-14m,step137000,seed3,3,137000
She had a nail file.,file,file,She had a file nail., nail file, file nail,nail,True,-18.54573631286621,-21.858642578125,3.312906265258789,14067712,EleutherAI/pythia-14m,step137000,seed3,3,137000
It was an action film.,film,film,It was an film action., action film, film action,action,True,-13.782384872436523,-17.366031646728516,3.583646774291992,14067712,EleutherAI/pythia-14m,step137000,seed3,3,137000
It was a censored film.,film,film,It was a film censored., censored film, film censored,censored,False,-18.523038864135742,-19.348960876464844,0.8259220123291016,14067712,EleutherAI/pythia-14m,step137000,seed3,3,137000
It was a transparent film.,film,film,It was a film transparent., transparent film, film transparent,transparent,False,-14.180548667907715,-17.833473205566406,3.6529245376586914,14067712,EleutherAI/pythia-14m,step137000,seed3,3,137000
It was a charitable foundation.,foundation,foundation,It was a foundation charitable., charitable foundation, foundation charitable,charitable,False,-15.50357723236084,-22.665382385253906,7.161805152893066,14067712,EleutherAI/pythia-14m,step137000,seed3,3,137000
It was an educational foundation.,foundation,foundation,It was an foundation educational., educational foundation, foundation educational,educational,False,-14.064970970153809,-23.264907836914062,9.199936866760254,14067712,EleutherAI/pythia-14m,step137000,seed3,3,137000
It was a wooden foundation.,foundation,foundation,It was a foundation wooden., wooden foundation, foundation wooden,wooden,False,-14.249717712402344,-21.461647033691406,7.2119293212890625,14067712,EleutherAI/pythia-14m,step137000,seed3,3,137000
It was a mathematical function.,function,function,It was a function mathematical., mathematical function, function mathematical,mathematical,False,-16.99415397644043,-19.716161727905273,2.7220077514648438,14067712,EleutherAI/pythia-14m,step137000,seed3,3,137000
