sentence,word,string,reversed_sentence,mod_np,reversed_mod,disambiguating_word,non_adjective,original_logprob,reversed_logprob,ratio,n_params,mpath,revision,seed_name,seed,step
It was a social function.,function,function,It was a function social., social function, function social,social,False,-15.63957405090332,-20.560998916625977,4.921424865722656,14067712,EleutherAI/pythia-14m,step90000,seed6,6,90000
He was on the firm ground.,ground,ground,He was on the ground firm., firm ground, ground firm,firm,False,-16.309059143066406,-15.917390823364258,-0.39166831970214844,14067712,EleutherAI/pythia-14m,step90000,seed6,6,90000
He was on the frozen ground.,ground,ground,He was on the ground frozen., frozen ground, ground frozen,frozen,False,-15.181743621826172,-17.377229690551758,2.195486068725586,14067712,EleutherAI/pythia-14m,step90000,seed6,6,90000
He was on the camp ground.,ground,ground,He was on the ground camp., camp ground, ground camp,camp,True,-16.678882598876953,-13.022005081176758,-3.6568775177001953,14067712,EleutherAI/pythia-14m,step90000,seed6,6,90000
They liked the night guard.,guard,guard,They liked the guard night., night guard, guard night,night,True,-17.205860137939453,-20.751224517822266,3.5453643798828125,14067712,EleutherAI/pythia-14m,step90000,seed6,6,90000
They liked the security guard.,guard,guard,They liked the guard security., security guard, guard security,security,True,-17.36957550048828,-21.468265533447266,4.098690032958984,14067712,EleutherAI/pythia-14m,step90000,seed6,6,90000
They liked the coast guard.,guard,guard,They liked the guard coast., coast guard, guard coast,coast,True,-18.368289947509766,-23.439823150634766,5.071533203125,14067712,EleutherAI/pythia-14m,step90000,seed6,6,90000
He had an assembly guide.,guide,guide,He had an guide assembly., assembly guide, guide assembly,assembly,True,-17.87881088256836,-22.34835433959961,4.46954345703125,14067712,EleutherAI/pythia-14m,step90000,seed6,6,90000
He had a TV guide.,guide,guide,He had a guide TV., TV guide, guide TV,TV,True,-19.00082015991211,-20.53882598876953,1.5380058288574219,14067712,EleutherAI/pythia-14m,step90000,seed6,6,90000
He had a talkative guide.,guide,guide,He had a guide talkative., talkative guide, guide talkative,talkative,False,-22.289901733398438,-29.430282592773438,7.140380859375,14067712,EleutherAI/pythia-14m,step90000,seed6,6,90000
It was a summer home.,home,home,It was a home summer., summer home, home summer,summer,True,-14.6650390625,-16.043724060058594,1.3786849975585938,14067712,EleutherAI/pythia-14m,step90000,seed6,6,90000
It was a childhood home.,home,home,It was a home childhood., childhood home, home childhood,childhood,True,-15.094486236572266,-17.622947692871094,2.528461456298828,14067712,EleutherAI/pythia-14m,step90000,seed6,6,90000
It was a funeral home.,home,home,It was a home funeral., funeral home, home funeral,funeral,False,-15.014904022216797,-18.382713317871094,3.367809295654297,14067712,EleutherAI/pythia-14m,step90000,seed6,6,90000
They had natural intelligence.,intelligence,intelligence,They had intelligence natural., natural intelligence, intelligence natural,natural,False,-18.53871726989746,-23.4251708984375,4.886453628540039,14067712,EleutherAI/pythia-14m,step90000,seed6,6,90000
They had innate intelligence.,intelligence,intelligence,They had intelligence innate., innate intelligence, intelligence innate,innate,False,-18.76643180847168,-24.6182861328125,5.85185432434082,14067712,EleutherAI/pythia-14m,step90000,seed6,6,90000
They had classified intelligence.,intelligence,intelligence,They had intelligence classified., classified intelligence, intelligence classified,classified,False,-18.193180084228516,-22.726806640625,4.533626556396484,14067712,EleutherAI/pythia-14m,step90000,seed6,6,90000
It was a sensitive issue.,issue,issue,It was an issue sensitive., sensitive issue, issue sensitive,sensitive,False,-16.915225982666016,-18.535263061523438,1.6200370788574219,14067712,EleutherAI/pythia-14m,step90000,seed6,6,90000
It was a political issue.,issue,issue,It was an issue political., political issue, issue political,political,False,-13.12997817993164,-17.522323608398438,4.392345428466797,14067712,EleutherAI/pythia-14m,step90000,seed6,6,90000
It was a weekly issue.,issue,issue,It was an issue weekly., weekly issue, issue weekly,weekly,False,-17.239797592163086,-20.556137084960938,3.3163394927978516,14067712,EleutherAI/pythia-14m,step90000,seed6,6,90000
It was a blackberry jam.,jam,jam,It was a jam blackberry., blackberry jam, jam blackberry,blackberry,True,-21.441162109375,-26.256357192993164,4.815195083618164,14067712,EleutherAI/pythia-14m,step90000,seed6,6,90000
It was a peach jam.,jam,jam,It was a jam peach., peach jam, jam peach,peach,False,-21.998031616210938,-23.865774154663086,1.8677425384521484,14067712,EleutherAI/pythia-14m,step90000,seed6,6,90000
It was a traffic jam.,jam,jam,It was a jam traffic., traffic jam, jam traffic,traffic,True,-15.958698272705078,-20.931594848632812,4.972896575927734,14067712,EleutherAI/pythia-14m,step90000,seed6,6,90000
It was a duplicate key.,key,key,It was a key duplicate., duplicate key, key duplicate,duplicate,False,-20.138072967529297,-20.13370132446289,-0.00437164306640625,14067712,EleutherAI/pythia-14m,step90000,seed6,6,90000
It was a master key.,key,key,It was a key master., master key, key master,master,True,-16.895450592041016,-18.18729019165039,1.291839599609375,14067712,EleutherAI/pythia-14m,step90000,seed6,6,90000
It was a delete key.,key,key,It was a key delete., delete key, key delete,delete,False,-22.127817153930664,-22.71084976196289,0.5830326080322266,14067712,EleutherAI/pythia-14m,step90000,seed6,6,90000
They liked the marinated lamb.,lamb,lamb,They liked the lamb marinated., marinated lamb, lamb marinated,marinated,True,-22.806621551513672,-24.594024658203125,1.7874031066894531,14067712,EleutherAI/pythia-14m,step90000,seed6,6,90000
They liked the grilled lamb.,lamb,lamb,They liked the lamb grilled., grilled lamb, lamb grilled,grilled,False,-16.044187545776367,-19.88825225830078,3.844064712524414,14067712,EleutherAI/pythia-14m,step90000,seed6,6,90000
They liked the cute lamb.,lamb,lamb,They liked the lamb cute., cute lamb, lamb cute,cute,False,-16.662166595458984,-20.24640655517578,3.584239959716797,14067712,EleutherAI/pythia-14m,step90000,seed6,6,90000
She had curly locks.,lock,locks,She had locks curly., curly locks, locks curly,curly,False,-18.428489685058594,-22.454910278320312,4.026420593261719,14067712,EleutherAI/pythia-14m,step90000,seed6,6,90000
She had brown locks.,lock,locks,She had locks brown., brown locks, locks brown,brown,False,-19.846607208251953,-21.902664184570312,2.0560569763183594,14067712,EleutherAI/pythia-14m,step90000,seed6,6,90000
She had window locks.,lock,locks,She had locks window., window locks, locks window,window,True,-20.481197357177734,-20.399246215820312,-0.08195114135742188,14067712,EleutherAI/pythia-14m,step90000,seed6,6,90000
They liked the hot lunch.,lunch,lunch,They liked the lunch hot., hot lunch, lunch hot,hot,False,-14.879268646240234,-18.496809005737305,3.6175403594970703,14067712,EleutherAI/pythia-14m,step90000,seed6,6,90000
They liked the sandwich lunch.,lunch,lunch,They liked the lunch sandwich., sandwich lunch, lunch sandwich,sandwich,True,-19.44406509399414,-19.020490646362305,-0.42357444763183594,14067712,EleutherAI/pythia-14m,step90000,seed6,6,90000
They liked the afternoon lunch.,lunch,lunch,They liked the lunch afternoon., afternoon lunch, lunch afternoon,afternoon,True,-15.631752014160156,-19.329206466674805,3.6974544525146484,14067712,EleutherAI/pythia-14m,step90000,seed6,6,90000
He liked the flea market.,market,market,He liked the market flea., flea market, market flea,flea,True,-24.42502212524414,-25.385440826416016,0.960418701171875,14067712,EleutherAI/pythia-14m,step90000,seed6,6,90000
He liked the fish market.,market,market,He liked the market fish., fish market, market fish,fish,True,-17.924503326416016,-21.584396362304688,3.659893035888672,14067712,EleutherAI/pythia-14m,step90000,seed6,6,90000
He liked the housing market.,market,market,He liked the market housing., housing market, market housing,housing,True,-15.648618698120117,-19.478927612304688,3.8303089141845703,14067712,EleutherAI/pythia-14m,step90000,seed6,6,90000
It was a lit match.,match,match,It was a match lit., lit match, match lit,lit,False,-27.584667205810547,-22.032188415527344,-5.552478790283203,14067712,EleutherAI/pythia-14m,step90000,seed6,6,90000
It was a burning match.,match,match,It was a match burning., burning match, match burning,burning,False,-21.63321304321289,-23.769859313964844,2.136646270751953,14067712,EleutherAI/pythia-14m,step90000,seed6,6,90000
It was a soccer match.,match,match,It was a match soccer., soccer match, match soccer,soccer,True,-13.514254570007324,-20.459312438964844,6.9450578689575195,14067712,EleutherAI/pythia-14m,step90000,seed6,6,90000
It was cough medicine.,medicine,medicine,It was medicine cough., cough medicine, medicine cough,cough,True,-23.524120330810547,-27.19965934753418,3.675539016723633,14067712,EleutherAI/pythia-14m,step90000,seed6,6,90000
It was prescription medicine.,medicine,medicine,It was medicine prescription., prescription medicine, medicine prescription,prescription,True,-19.185935974121094,-23.82172966003418,4.635793685913086,14067712,EleutherAI/pythia-14m,step90000,seed6,6,90000
It was orthopedic medicine.,medicine,medicine,It was medicine orthopedic., orthopedic medicine, medicine orthopedic,orthopedic,False,-23.702438354492188,-28.532291412353516,4.829853057861328,14067712,EleutherAI/pythia-14m,step90000,seed6,6,90000
There was a phone message.,message,message,There was a message phone., phone message, message phone,phone,True,-15.457112312316895,-18.93505096435547,3.477938652038574,14067712,EleutherAI/pythia-14m,step90000,seed6,6,90000
There was a computer message.,message,message,There was a message computer., computer message, message computer,computer,True,-19.04839324951172,-21.23729705810547,2.18890380859375,14067712,EleutherAI/pythia-14m,step90000,seed6,6,90000
There was an urgent message.,message,message,There was an message urgent., urgent message, message urgent,urgent,False,-14.059515953063965,-21.594554901123047,7.535038948059082,14067712,EleutherAI/pythia-14m,step90000,seed6,6,90000
It was a fungal mold.,mold,mold,It was a mold fungal., fungal mold, mold fungal,fungal,False,-20.47512435913086,-23.309024810791016,2.8339004516601562,14067712,EleutherAI/pythia-14m,step90000,seed6,6,90000
It was a harmful mold.,mold,mold,It was a mold harmful., harmful mold, mold harmful,harmful,False,-22.477317810058594,-23.565250396728516,1.0879325866699219,14067712,EleutherAI/pythia-14m,step90000,seed6,6,90000
It was a rubber mold.,mold,mold,It was a mold rubber., rubber mold, mold rubber,rubber,True,-17.771907806396484,-20.766666412353516,2.9947586059570312,14067712,EleutherAI/pythia-14m,step90000,seed6,6,90000
She saw the cancerous mole.,mole,mole,She saw the mole cancerous., cancerous mole, mole cancerous,cancerous,False,-23.8138427734375,-28.139650344848633,4.325807571411133,14067712,EleutherAI/pythia-14m,step90000,seed6,6,90000
She saw the raised mole.,mole,mole,She saw the mole raised., raised mole, mole raised,raised,False,-22.614810943603516,-18.437114715576172,-4.177696228027344,14067712,EleutherAI/pythia-14m,step90000,seed6,6,90000
She saw the cute mole.,mole,mole,She saw the mole cute., cute mole, mole cute,cute,False,-20.237152099609375,-21.687114715576172,1.4499626159667969,14067712,EleutherAI/pythia-14m,step90000,seed6,6,90000
He liked the rhythmic movement.,movement,movement,He liked the movement rhythmic., rhythmic movement, movement rhythmic,rhythmic,False,-16.7928409576416,-24.113422393798828,7.320581436157227,14067712,EleutherAI/pythia-14m,step90000,seed6,6,90000
He liked the graceful movement.,movement,movement,He liked the movement graceful., graceful movement, movement graceful,graceful,False,-18.33107566833496,-22.32084846496582,3.9897727966308594,14067712,EleutherAI/pythia-14m,step90000,seed6,6,90000
He liked the feminist movement.,movement,movement,He liked the movement feminist., feminist movement, movement feminist,feminist,True,-12.577714920043945,-20.81108283996582,8.233367919921875,14067712,EleutherAI/pythia-14m,step90000,seed6,6,90000
It was a national newspaper.,newspaper,newspaper,It was a newspaper national., national newspaper, newspaper national,national,False,-14.418160438537598,-20.58926010131836,6.171099662780762,14067712,EleutherAI/pythia-14m,step90000,seed6,6,90000
It was a daily newspaper.,newspaper,newspaper,It was a newspaper daily., daily newspaper, newspaper daily,daily,False,-15.511173248291016,-20.25344467163086,4.742271423339844,14067712,EleutherAI/pythia-14m,step90000,seed6,6,90000
It was a faded newspaper.,newspaper,newspaper,It was a newspaper faded., faded newspaper, newspaper faded,faded,False,-19.574966430664062,-22.48196029663086,2.906993865966797,14067712,EleutherAI/pythia-14m,step90000,seed6,6,90000
It was a juicy orange.,orange,orange,It was an orange juicy., juicy orange, orange juicy,juicy,False,-22.833036422729492,-22.78418731689453,-0.04884910583496094,14067712,EleutherAI/pythia-14m,step90000,seed6,6,90000
It was a ripe orange.,orange,orange,It was an orange ripe., ripe orange, orange ripe,ripe,False,-17.997093200683594,-18.3725528717041,0.3754596710205078,14067712,EleutherAI/pythia-14m,step90000,seed6,6,90000
It was a bright orange.,orange,orange,It was an orange bright., bright orange, orange bright,bright,False,-12.268712997436523,-15.736078262329102,3.467365264892578,14067712,EleutherAI/pythia-14m,step90000,seed6,6,90000
He saw the young page.,page,page,He saw the page young., young page, page young,young,False,-16.2584171295166,-19.370792388916016,3.112375259399414,14067712,EleutherAI/pythia-14m,step90000,seed6,6,90000
He saw the loyal page.,page,page,He saw the page loyal., loyal page, page loyal,loyal,False,-23.09283447265625,-21.727603912353516,-1.3652305603027344,14067712,EleutherAI/pythia-14m,step90000,seed6,6,90000
He saw the blank page.,page,page,He saw the page blank., blank page, page blank,blank,False,-14.736150741577148,-17.218204498291016,2.482053756713867,14067712,EleutherAI/pythia-14m,step90000,seed6,6,90000
It was a calloused palm.,palm,palm,It was a palm calloused., calloused palm, palm calloused,calloused,False,-30.47747039794922,-34.21177291870117,3.734302520751953,14067712,EleutherAI/pythia-14m,step90000,seed6,6,90000
It was a wrinkled palm.,palm,palm,It was a palm wrinkled., wrinkled palm, palm wrinkled,wrinkled,False,-22.201416015625,-23.675453186035156,1.4740371704101562,14067712,EleutherAI/pythia-14m,step90000,seed6,6,90000
It was a tropical palm.,palm,palm,It was a palm tropical., tropical palm, palm tropical,tropical,False,-20.831165313720703,-24.26783561706543,3.4366703033447266,14067712,EleutherAI/pythia-14m,step90000,seed6,6,90000
It was a control panel.,panel,panel,It was a panel control., control panel, panel control,control,True,-16.67787742614746,-20.460979461669922,3.783102035522461,14067712,EleutherAI/pythia-14m,step90000,seed6,6,90000
It was an instrument panel.,panel,panel,It was an panel instrument., instrument panel, panel instrument,instrument,False,-18.07928466796875,-22.893596649169922,4.814311981201172,14067712,EleutherAI/pythia-14m,step90000,seed6,6,90000
It was an advisory panel.,panel,panel,It was an panel advisory., advisory panel, panel advisory,advisory,False,-14.563128471374512,-22.799480438232422,8.23635196685791,14067712,EleutherAI/pythia-14m,step90000,seed6,6,90000
It was a secret passage.,passage,passage,It was a passage secret., secret passage, passage secret,secret,False,-16.23675537109375,-19.53744888305664,3.3006935119628906,14067712,EleutherAI/pythia-14m,step90000,seed6,6,90000
It was a narrow passage.,passage,passage,It was a passage narrow., narrow passage, passage narrow,narrow,False,-15.841533660888672,-20.84653091430664,5.004997253417969,14067712,EleutherAI/pythia-14m,step90000,seed6,6,90000
It was a literary passage.,passage,passage,It was a passage literary., literary passage, passage literary,literary,False,-17.412189483642578,-21.50033950805664,4.0881500244140625,14067712,EleutherAI/pythia-14m,step90000,seed6,6,90000
It was a tasty perch.,perch,perch,It was a perch tasty., tasty perch, perch tasty,tasty,False,-24.563369750976562,-26.625835418701172,2.0624656677246094,14067712,EleutherAI/pythia-14m,step90000,seed6,6,90000
It was a freshwater perch.,perch,perch,It was a perch freshwater., freshwater perch, perch freshwater,freshwater,True,-23.037662506103516,-26.161235809326172,3.1235733032226562,14067712,EleutherAI/pythia-14m,step90000,seed6,6,90000
It was a lofty perch.,perch,perch,It was a perch lofty., lofty perch, perch lofty,lofty,False,-24.678251266479492,-27.693151473999023,3.0149002075195312,14067712,EleutherAI/pythia-14m,step90000,seed6,6,90000
He saw the fast pitcher.,pitcher,pitcher,He saw the pitcher fast., fast pitcher, pitcher fast,fast,False,-21.03589630126953,-19.869705200195312,-1.1661911010742188,14067712,EleutherAI/pythia-14m,step90000,seed6,6,90000
He saw the right-handed pitcher.,pitcher,pitcher,He saw the pitcher right-handed., right-handed pitcher, pitcher right-handed,right-handed,False,-22.322799682617188,-23.34140968322754,1.0186100006103516,14067712,EleutherAI/pythia-14m,step90000,seed6,6,90000
He saw the glass pitcher.,pitcher,pitcher,He saw the pitcher glass., glass pitcher, pitcher glass,glass,True,-19.38243293762207,-20.791946411132812,1.4095134735107422,14067712,EleutherAI/pythia-14m,step90000,seed6,6,90000
It was a windy port.,port,port,It was a port windy., windy port, port windy,windy,False,-23.25727081298828,-26.717750549316406,3.460479736328125,14067712,EleutherAI/pythia-14m,step90000,seed6,6,90000
It was a seaside port.,port,port,It was a port seaside., seaside port, port seaside,seaside,True,-19.142330169677734,-22.944015502929688,3.801685333251953,14067712,EleutherAI/pythia-14m,step90000,seed6,6,90000
It was a delicious port.,port,port,It was a port delicious., delicious port, port delicious,delicious,False,-19.083576202392578,-23.32068634033203,4.237110137939453,14067712,EleutherAI/pythia-14m,step90000,seed6,6,90000
He was in a distinguished position.,position,position,He was in a position distinguished., distinguished position, position distinguished,distinguished,False,-13.501321792602539,-17.967418670654297,4.466096878051758,14067712,EleutherAI/pythia-14m,step90000,seed6,6,90000
He was in a prominent position.,position,position,He was in a position prominent., prominent position, position prominent,prominent,False,-13.083992004394531,-19.141002655029297,6.057010650634766,14067712,EleutherAI/pythia-14m,step90000,seed6,6,90000
He was in a fetal position.,position,position,He was in a position fetal., fetal position, position fetal,fetal,False,-19.482887268066406,-21.027477264404297,1.5445899963378906,14067712,EleutherAI/pythia-14m,step90000,seed6,6,90000
It was a wooden post.,post,post,It was a post wooden., wooden post, post wooden,wooden,False,-17.463871002197266,-21.616817474365234,4.152946472167969,14067712,EleutherAI/pythia-14m,step90000,seed6,6,90000
It was a fence post.,post,post,It was a post fence., fence post, post fence,fence,True,-20.213623046875,-22.952022552490234,2.7383995056152344,14067712,EleutherAI/pythia-14m,step90000,seed6,6,90000
It was a teaching post.,post,post,It was a post teaching., teaching post, post teaching,teaching,True,-17.464004516601562,-18.037960052490234,0.5739555358886719,14067712,EleutherAI/pythia-14m,step90000,seed6,6,90000
He had the alcoholic punch.,punch,punch,He had the punch alcoholic., alcoholic punch, punch alcoholic,alcoholic,False,-22.5925350189209,-24.35260772705078,1.7600727081298828,14067712,EleutherAI/pythia-14m,step90000,seed6,6,90000
He had the fruit punch.,punch,punch,He had the punch fruit., fruit punch, punch fruit,fruit,True,-19.902387619018555,-21.29608917236328,1.3937015533447266,14067712,EleutherAI/pythia-14m,step90000,seed6,6,90000
He had the strongest punch.,punch,punch,He had the punch strongest., strongest punch, punch strongest,strongest,False,-17.029781341552734,-22.79633331298828,5.766551971435547,14067712,EleutherAI/pythia-14m,step90000,seed6,6,90000
She had a brilliant pupil.,pupil,pupil,She had a pupil brilliant., brilliant pupil, pupil brilliant,brilliant,False,-16.38494873046875,-21.999126434326172,5.614177703857422,14067712,EleutherAI/pythia-14m,step90000,seed6,6,90000
She had an interested pupil.,pupil,pupil,She had an pupil interested., interested pupil, pupil interested,interested,False,-17.77656364440918,-22.365516662597656,4.588953018188477,14067712,EleutherAI/pythia-14m,step90000,seed6,6,90000
She had a dilated pupil.,pupil,pupil,She had a pupil dilated., dilated pupil, pupil dilated,dilated,False,-17.566518783569336,-20.945537567138672,3.379018783569336,14067712,EleutherAI/pythia-14m,step90000,seed6,6,90000
That was a loud racket.,racket,racket,That was a racket loud., loud racket, racket loud,loud,False,-18.54708480834961,-22.056304931640625,3.5092201232910156,14067712,EleutherAI/pythia-14m,step90000,seed6,6,90000
That was an annoying racket.,racket,racket,That was an racket annoying., annoying racket, racket annoying,annoying,False,-18.503894805908203,-25.439395904541016,6.9355010986328125,14067712,EleutherAI/pythia-14m,step90000,seed6,6,90000
That was a badminton racket.,racket,racket,That was a racket badminton., badminton racket, racket badminton,badminton,True,-28.244043350219727,-29.139144897460938,0.8951015472412109,14067712,EleutherAI/pythia-14m,step90000,seed6,6,90000
He liked electronic rock.,rock,rock,He liked rock electronic., electronic rock, rock electronic,electronic,False,-26.465543746948242,-23.31007957458496,-3.1554641723632812,14067712,EleutherAI/pythia-14m,step90000,seed6,6,90000
He liked alternative rock.,rock,rock,He liked rock alternative., alternative rock, rock alternative,alternative,False,-24.46695327758789,-23.79274559020996,-0.6742076873779297,14067712,EleutherAI/pythia-14m,step90000,seed6,6,90000
He liked limestone rock.,rock,rock,He liked rock limestone., limestone rock, rock limestone,limestone,True,-23.788904190063477,-23.41737937927246,-0.3715248107910156,14067712,EleutherAI/pythia-14m,step90000,seed6,6,90000
He saw the wise sage.,sage,sage,He saw the sage wise., wise sage, sage wise,wise,False,-19.757976531982422,-20.13302993774414,0.37505340576171875,14067712,EleutherAI/pythia-14m,step90000,seed6,6,90000
He saw the renowned sage.,sage,sage,He saw the sage renowned., renowned sage, sage renowned,renowned,False,-20.98462677001953,-22.79306411743164,1.8084373474121094,14067712,EleutherAI/pythia-14m,step90000,seed6,6,90000
He saw the fragrant sage.,sage,sage,He saw the sage fragrant., fragrant sage, sage fragrant,fragrant,False,-21.846933364868164,-24.22693634033203,2.380002975463867,14067712,EleutherAI/pythia-14m,step90000,seed6,6,90000
It was a fish scale.,scale,scale,It was a scale fish., fish scale, scale fish,fish,True,-21.637067794799805,-22.742938995361328,1.1058712005615234,14067712,EleutherAI/pythia-14m,step90000,seed6,6,90000
It was a lizard scale.,scale,scale,It was a scale lizard., lizard scale, scale lizard,lizard,True,-24.741104125976562,-26.47454833984375,1.7334442138671875,14067712,EleutherAI/pythia-14m,step90000,seed6,6,90000
It was a music scale.,scale,scale,It was a scale music., music scale, scale music,music,True,-18.914878845214844,-20.556171417236328,1.6412925720214844,14067712,EleutherAI/pythia-14m,step90000,seed6,6,90000
It was a touching scene.,scene,scene,It was a scene touching., touching scene, scene touching,touching,False,-14.761930465698242,-17.112266540527344,2.3503360748291016,14067712,EleutherAI/pythia-14m,step90000,seed6,6,90000
It was a well-acted scene.,scene,scene,It was a scene well-acted., well-acted scene, scene well-acted,well-acted,False,-22.57855796813965,-26.46518325805664,3.886625289916992,14067712,EleutherAI/pythia-14m,step90000,seed6,6,90000
It was a nature scene.,scene,scene,It was a scene nature., nature scene, scene nature,nature,True,-16.740415573120117,-19.072349548339844,2.3319339752197266,14067712,EleutherAI/pythia-14m,step90000,seed6,6,90000
It was a gold seal.,seal,seal,It was a seal gold., gold seal, seal gold,gold,True,-16.310501098632812,-22.073745727539062,5.76324462890625,14067712,EleutherAI/pythia-14m,step90000,seed6,6,90000
It was a certified seal.,seal,seal,It was a seal certified., certified seal, seal certified,certified,False,-20.151473999023438,-20.324844360351562,0.173370361328125,14067712,EleutherAI/pythia-14m,step90000,seed6,6,90000
It was a circus seal.,seal,seal,It was a seal circus., circus seal, seal circus,circus,True,-24.30563735961914,-26.838882446289062,2.533245086669922,14067712,EleutherAI/pythia-14m,step90000,seed6,6,90000
He used the scotch tape.,tape,tape,He used the tape scotch., scotch tape, tape scotch,scotch,True,-20.83674430847168,-23.07227325439453,2.2355289459228516,14067712,EleutherAI/pythia-14m,step90000,seed6,6,90000
He used the double-sided tape.,tape,tape,He used the tape double-sided., double-sided tape, tape double-sided,double-sided,False,-20.105987548828125,-24.187911987304688,4.0819244384765625,14067712,EleutherAI/pythia-14m,step90000,seed6,6,90000
He used the interview tape.,tape,tape,He used the tape interview., interview tape, tape interview,interview,True,-17.05679702758789,-17.556133270263672,0.49933624267578125,14067712,EleutherAI/pythia-14m,step90000,seed6,6,90000
It was a winter term.,term,term,It was a term winter., winter term, term winter,winter,True,-16.664348602294922,-21.930877685546875,5.266529083251953,14067712,EleutherAI/pythia-14m,step90000,seed6,6,90000
It was a fall term.,term,term,It was a term fall., fall term, term fall,fall,True,-18.06226348876953,-22.097259521484375,4.034996032714844,14067712,EleutherAI/pythia-14m,step90000,seed6,6,90000
