sentence,word,string,reversed_sentence,mod_np,reversed_mod,disambiguating_word,non_adjective,original_logprob,reversed_logprob,ratio,n_params,mpath,revision,seed_name,seed,step
It was a fall term.,term,term,It was a term fall., fall term, term fall,fall,True,-18.882278442382812,-20.574066162109375,1.6917877197265625,14067712,EleutherAI/pythia-14m,step98000,seed9,9,98000
It was a legal term.,term,term,It was a term legal., legal term, term legal,legal,False,-13.805807113647461,-17.4256591796875,3.619852066040039,14067712,EleutherAI/pythia-14m,step98000,seed9,9,98000
It was a clock tick.,tick,tick,It was a tick clock., clock tick, tick clock,clock,True,-13.679435729980469,-19.372730255126953,5.693294525146484,14067712,EleutherAI/pythia-14m,step98000,seed9,9,98000
It was an audible tick.,tick,tick,It was an tick audible., audible tick, tick audible,audible,False,-17.27957534790039,-26.070100784301758,8.790525436401367,14067712,EleutherAI/pythia-14m,step98000,seed9,9,98000
It was a parasitic tick.,tick,tick,It was a tick parasitic., parasitic tick, tick parasitic,parasitic,False,-19.277896881103516,-23.635639190673828,4.3577423095703125,14067712,EleutherAI/pythia-14m,step98000,seed9,9,98000
It was a generous tip.,tip,tip,It was a tip generous., generous tip, tip generous,generous,False,-19.559844970703125,-24.801565170288086,5.241720199584961,14067712,EleutherAI/pythia-14m,step98000,seed9,9,98000
It was a stingy tip.,tip,tip,It was a tip stingy., stingy tip, tip stingy,stingy,False,-19.76129150390625,-25.31443977355957,5.55314826965332,14067712,EleutherAI/pythia-14m,step98000,seed9,9,98000
It was a pencil tip.,tip,tip,It was a tip pencil., pencil tip, tip pencil,pencil,True,-17.59400177001953,-18.64833641052246,1.0543346405029297,14067712,EleutherAI/pythia-14m,step98000,seed9,9,98000
She liked the essay title.,title,title,She liked the title essay., essay title, title essay,essay,True,-17.95018196105957,-17.363855361938477,-0.5863265991210938,14067712,EleutherAI/pythia-14m,step98000,seed9,9,98000
She liked the poem title.,title,title,She liked the title poem., poem title, title poem,poem,True,-18.619792938232422,-16.95733070373535,-1.6624622344970703,14067712,EleutherAI/pythia-14m,step98000,seed9,9,98000
She liked the academic title.,title,title,She liked the title academic., academic title, title academic,academic,False,-17.37242889404297,-20.4924259185791,3.119997024536133,14067712,EleutherAI/pythia-14m,step98000,seed9,9,98000
It was a costly toll.,toll,toll,It was a toll costly., costly toll, toll costly,costly,False,-20.584884643554688,-25.52964973449707,4.944765090942383,14067712,EleutherAI/pythia-14m,step98000,seed9,9,98000
It was a road toll.,toll,toll,It was a toll road., road toll, toll road,road,True,-17.819795608520508,-18.68943977355957,0.8696441650390625,14067712,EleutherAI/pythia-14m,step98000,seed9,9,98000
It was a loud toll.,toll,toll,It was a toll loud., loud toll, toll loud,loud,False,-21.18232536315918,-23.43052864074707,2.2482032775878906,14067712,EleutherAI/pythia-14m,step98000,seed9,9,98000
She saw the train tracks.,track,tracks,She saw the tracks train., train tracks, tracks train,train,True,-14.101131439208984,-21.048355102539062,6.947223663330078,14067712,EleutherAI/pythia-14m,step98000,seed9,9,98000
She saw the trolley tracks.,track,tracks,She saw the tracks trolley., trolley tracks, tracks trolley,trolley,True,-26.157691955566406,-28.421966552734375,2.2642745971679688,14067712,EleutherAI/pythia-14m,step98000,seed9,9,98000
She saw the moose tracks.,track,tracks,She saw the tracks moose., moose tracks, tracks moose,moose,False,-24.267799377441406,-26.20339012145996,1.9355907440185547,14067712,EleutherAI/pythia-14m,step98000,seed9,9,98000
It was five yards.,yard,yards,It was yards five., five yards, yards five,five,True,-17.60003662109375,-24.743610382080078,7.143573760986328,14067712,EleutherAI/pythia-14m,step98000,seed9,9,98000
It was ten yards.,yard,yards,It was yards ten., ten yards, yards ten,ten,True,-15.607596397399902,-25.732105255126953,10.12450885772705,14067712,EleutherAI/pythia-14m,step98000,seed9,9,98000
They were big yards.,yard,yards,They were yards big., big yards, yards big,big,False,-19.848268508911133,-23.321975708007812,3.4737071990966797,14067712,EleutherAI/pythia-14m,step98000,seed9,9,98000
It was a comedic act.,act,act,It was an act comedic., comedic act, act comedic,comedic,False,-16.045108795166016,-21.795141220092773,5.750032424926758,14067712,EleutherAI/pythia-14m,step98000,seed9,9,98000
He had a pending appeal.,appeal,appeal,He had an appeal pending., pending appeal, appeal pending,pending,False,-15.711894035339355,-16.166576385498047,0.4546823501586914,14067712,EleutherAI/pythia-14m,step98000,seed9,9,98000
It was a polluted atmosphere.,atmosphere,atmosphere,It was an atmosphere polluted., polluted atmosphere, atmosphere polluted,polluted,False,-25.579559326171875,-26.043418884277344,0.46385955810546875,14067712,EleutherAI/pythia-14m,step98000,seed9,9,98000
It was a country band.,band,band,It was a band country., country band, band country,country,True,-16.25665855407715,-17.594083786010742,1.3374252319335938,14067712,EleutherAI/pythia-14m,step98000,seed9,9,98000
There was a religious barrier.,barrier,barrier,There was a barrier religious., religious barrier, barrier religious,religious,False,-18.922832489013672,-23.217092514038086,4.294260025024414,14067712,EleutherAI/pythia-14m,step98000,seed9,9,98000
He saw a baseball bat.,bat,bat,He saw a bat baseball., baseball bat, bat baseball,baseball,True,-10.37411117553711,-17.859737396240234,7.485626220703125,14067712,EleutherAI/pythia-14m,step98000,seed9,9,98000
He saw the balance beam.,beam,beam,He saw the beam balance., balance beam, beam balance,balance,True,-19.27605628967285,-18.41779327392578,-0.8582630157470703,14067712,EleutherAI/pythia-14m,step98000,seed9,9,98000
She had a writer's block.,block,block,She had a block writer's., writer's block, block writer's,writer,True,-23.661348342895508,-24.60260009765625,0.9412517547607422,14067712,EleutherAI/pythia-14m,step98000,seed9,9,98000
He has royal blood.,blood,blood,He has blood royal., royal blood, blood royal,royal,False,-19.309158325195312,-23.520580291748047,4.211421966552734,14067712,EleutherAI/pythia-14m,step98000,seed9,9,98000
It was the school board.,board,board,It was the board school., school board, board school,school,True,-12.659578323364258,-17.210702896118164,4.551124572753906,14067712,EleutherAI/pythia-14m,step98000,seed9,9,98000
He had a leather-bound book.,book,book,He had a book leather-bound., leather-bound book, book leather-bound,leather-bound,False,-23.282705307006836,-24.96359634399414,1.6808910369873047,14067712,EleutherAI/pythia-14m,step98000,seed9,9,98000
They ate a lonely breakfast.,breakfast,breakfast,They ate a breakfast lonely., lonely breakfast, breakfast lonely,lonely,False,-15.84073543548584,-21.801633834838867,5.960898399353027,14067712,EleutherAI/pythia-14m,step98000,seed9,9,98000
It was an island cape.,cape,cape,It was an cape island., island cape, cape island,island,True,-20.247047424316406,-20.726028442382812,0.47898101806640625,14067712,EleutherAI/pythia-14m,step98000,seed9,9,98000
It was a criminal case.,case,case,It was a case criminal., criminal case, case criminal,criminal,False,-11.502059936523438,-16.715930938720703,5.213871002197266,14067712,EleutherAI/pythia-14m,step98000,seed9,9,98000
It was a primary cause.,cause,cause,It was a cause primary., primary cause, cause primary,primary,False,-13.235154151916504,-21.847187042236328,8.612032890319824,14067712,EleutherAI/pythia-14m,step98000,seed9,9,98000
It was a jail cell.,cell,cell,It was a cell jail., jail cell, cell jail,jail,True,-14.732590675354004,-15.332951545715332,0.6003608703613281,14067712,EleutherAI/pythia-14m,step98000,seed9,9,98000
She had a good-luck charm.,charm,charm,She had a charm good-luck., good-luck charm, charm good-luck,good-luck,False,-26.745162963867188,-31.54721450805664,4.802051544189453,14067712,EleutherAI/pythia-14m,step98000,seed9,9,98000
They liked the pet chicken.,chicken,chicken,They liked the chicken pet., pet chicken, chicken pet,pet,True,-19.100849151611328,-19.15470314025879,0.05385398864746094,14067712,EleutherAI/pythia-14m,step98000,seed9,9,98000
It was a stimulating class.,class,class,It was a class stimulating., stimulating class, class stimulating,stimulating,False,-20.95391082763672,-22.13296127319336,1.1790504455566406,14067712,EleutherAI/pythia-14m,step98000,seed9,9,98000
It was a metal clip.,clip,clip,It was a clip metal., metal clip, clip metal,metal,True,-17.625774383544922,-20.456592559814453,2.8308181762695312,14067712,EleutherAI/pythia-14m,step98000,seed9,9,98000
It was a common cold.,cold,cold,It was a cold common., common cold, cold common,common,False,-14.499382972717285,-17.557716369628906,3.058333396911621,14067712,EleutherAI/pythia-14m,step98000,seed9,9,98000
It was a marble column.,column,column,It was a column marble., marble column, column marble,marble,True,-15.640703201293945,-20.590499877929688,4.949796676635742,14067712,EleutherAI/pythia-14m,step98000,seed9,9,98000
He liked the polite company.,company,company,He liked the company polite., polite company, company polite,polite,False,-18.021474838256836,-17.77996063232422,-0.2415142059326172,14067712,EleutherAI/pythia-14m,step98000,seed9,9,98000
It was a traffic cone.,cone,cone,It was a cone traffic., traffic cone, cone traffic,traffic,True,-19.84014892578125,-23.6408634185791,3.8007144927978516,14067712,EleutherAI/pythia-14m,step98000,seed9,9,98000
He made a well-written contribution.,contribution,contribution,He made a contribution well-written., well-written contribution, contribution well-written,well-written,False,-21.785621643066406,-26.87381362915039,5.088191986083984,14067712,EleutherAI/pythia-14m,step98000,seed9,9,98000
That was the correct count.,count,count,That was the count correct., correct count, count correct,correct,False,-15.458003997802734,-20.157630920410156,4.699626922607422,14067712,EleutherAI/pythia-14m,step98000,seed9,9,98000
It was a collision course.,course,course,It was a course collision., collision course, course collision,collision,True,-16.70387840270996,-22.138572692871094,5.434694290161133,14067712,EleutherAI/pythia-14m,step98000,seed9,9,98000
It was a historical date.,date,date,It was a date historical., historical date, date historical,historical,False,-15.715266227722168,-21.33858871459961,5.623322486877441,14067712,EleutherAI/pythia-14m,step98000,seed9,9,98000
It was about college degrees.,degree,degrees,It was about degrees college., college degrees, degrees college,college,True,-18.183259963989258,-20.826629638671875,2.643369674682617,14067712,EleutherAI/pythia-14m,step98000,seed9,9,98000
They liked the architectural design.,design,design,They liked the design architectural., architectural design, design architectural,architectural,False,-15.072286605834961,-19.391963958740234,4.319677352905273,14067712,EleutherAI/pythia-14m,step98000,seed9,9,98000
They liked the anniversary dinner.,dinner,dinner,They liked the dinner anniversary., anniversary dinner, dinner anniversary,anniversary,True,-18.049884796142578,-18.87493133544922,0.8250465393066406,14067712,EleutherAI/pythia-14m,step98000,seed9,9,98000
He had a career dream.,dream,dream,He had a dream career., career dream, dream career,career,True,-14.971954345703125,-15.914861679077148,0.9429073333740234,14067712,EleutherAI/pythia-14m,step98000,seed9,9,98000
It was a battery-powered drill.,drill,drill,It was a drill battery-powered., battery-powered drill, drill battery-powered,battery-powered,False,-24.598438262939453,-27.518844604492188,2.9204063415527344,14067712,EleutherAI/pythia-14m,step98000,seed9,9,98000
It was a physical examination.,examination,examination,It was an examination physical., physical examination, examination physical,physical,False,-14.097362518310547,-22.35466766357422,8.257305145263672,14067712,EleutherAI/pythia-14m,step98000,seed9,9,98000
They had an enthusiastic fan.,fan,fan,They had an fan enthusiastic., enthusiastic fan, fan enthusiastic,enthusiastic,False,-14.460640907287598,-26.433399200439453,11.972758293151855,14067712,EleutherAI/pythia-14m,step98000,seed9,9,98000
She had a steel file.,file,file,She had a file steel., steel file, file steel,steel,True,-17.708965301513672,-22.691150665283203,4.982185363769531,14067712,EleutherAI/pythia-14m,step98000,seed9,9,98000
It was a plastic film.,film,film,It was a film plastic., plastic film, film plastic,plastic,False,-13.754045486450195,-18.25333023071289,4.499284744262695,14067712,EleutherAI/pythia-14m,step98000,seed9,9,98000
It was a concrete foundation.,foundation,foundation,It was a foundation concrete., concrete foundation, foundation concrete,concrete,False,-15.016935348510742,-19.16103744506836,4.144102096557617,14067712,EleutherAI/pythia-14m,step98000,seed9,9,98000
It was a business function.,function,function,It was a function business., business function, function business,business,True,-15.730897903442383,-18.707168579101562,2.9762706756591797,14067712,EleutherAI/pythia-14m,step98000,seed9,9,98000
He was on the parade ground.,ground,ground,He was on the ground parade., parade ground, ground parade,parade,True,-16.74566078186035,-16.709636688232422,-0.03602409362792969,14067712,EleutherAI/pythia-14m,step98000,seed9,9,98000
They liked the national guard.,guard,guard,They liked the guard national., national guard, guard national,national,False,-17.89069938659668,-21.862394332885742,3.9716949462890625,14067712,EleutherAI/pythia-14m,step98000,seed9,9,98000
He had a friendly guide.,guide,guide,He had a guide friendly., friendly guide, guide friendly,friendly,False,-14.876365661621094,-22.43640899658203,7.5600433349609375,14067712,EleutherAI/pythia-14m,step98000,seed9,9,98000
It was a nursing home.,home,home,It was a home nursing., nursing home, home nursing,nursing,True,-10.349442481994629,-16.86856460571289,6.519122123718262,14067712,EleutherAI/pythia-14m,step98000,seed9,9,98000
They had military intelligence.,intelligence,intelligence,They had intelligence military., military intelligence, intelligence military,military,False,-16.957420349121094,-21.695117950439453,4.737697601318359,14067712,EleutherAI/pythia-14m,step98000,seed9,9,98000
It was a special issue.,issue,issue,It was an issue special., special issue, issue special,special,False,-11.774280548095703,-17.079792022705078,5.305511474609375,14067712,EleutherAI/pythia-14m,step98000,seed9,9,98000
It was a paper jam.,jam,jam,It was a jam paper., paper jam, jam paper,paper,True,-17.27893829345703,-17.71416473388672,0.4352264404296875,14067712,EleutherAI/pythia-14m,step98000,seed9,9,98000
It was a backspace key.,key,key,It was a key backspace., backspace key, key backspace,backspace,True,-27.73729705810547,-25.851438522338867,-1.8858585357666016,14067712,EleutherAI/pythia-14m,step98000,seed9,9,98000
They liked the friendly lamb.,lamb,lamb,They liked the lamb friendly., friendly lamb, lamb friendly,friendly,False,-19.21508026123047,-20.110816955566406,0.8957366943359375,14067712,EleutherAI/pythia-14m,step98000,seed9,9,98000
She had door locks.,lock,locks,She had locks door., door locks, locks door,door,True,-21.780925750732422,-23.132221221923828,1.3512954711914062,14067712,EleutherAI/pythia-14m,step98000,seed9,9,98000
They liked the women's lunch.,lunch,lunch,They liked the lunch women's., women's lunch, lunch women's,women,True,-20.47138023376465,-25.49880027770996,5.0274200439453125,14067712,EleutherAI/pythia-14m,step98000,seed9,9,98000
He liked the stock market.,market,market,He liked the market stock., stock market, market stock,stock,True,-13.704296112060547,-15.049444198608398,1.3451480865478516,14067712,EleutherAI/pythia-14m,step98000,seed9,9,98000
It was a tennis match.,match,match,It was a match tennis., tennis match, match tennis,tennis,True,-16.901336669921875,-19.380828857421875,2.4794921875,14067712,EleutherAI/pythia-14m,step98000,seed9,9,98000
It was veterinary medicine.,medicine,medicine,It was medicine veterinary., veterinary medicine, medicine veterinary,veterinary,False,-18.867923736572266,-22.5918025970459,3.723878860473633,14067712,EleutherAI/pythia-14m,step98000,seed9,9,98000
There was a clear message.,message,message,There was a message clear., clear message, message clear,clear,False,-14.071126937866211,-17.65178108215332,3.5806541442871094,14067712,EleutherAI/pythia-14m,step98000,seed9,9,98000
It was a clay mold.,mold,mold,It was a mold clay., clay mold, mold clay,clay,True,-15.860546112060547,-20.29855728149414,4.438011169433594,14067712,EleutherAI/pythia-14m,step98000,seed9,9,98000
She saw the fast mole.,mole,mole,She saw the mole fast., fast mole, mole fast,fast,False,-23.33283233642578,-22.023128509521484,-1.3097038269042969,14067712,EleutherAI/pythia-14m,step98000,seed9,9,98000
He liked the civil-rights movement.,movement,movement,He liked the movement civil-rights., civil-rights movement, movement civil-rights,civil-rights,False,-19.710277557373047,-28.44561004638672,8.735332489013672,14067712,EleutherAI/pythia-14m,step98000,seed9,9,98000
It was a shredded newspaper.,newspaper,newspaper,It was a newspaper shredded., shredded newspaper, newspaper shredded,shredded,False,-19.829235076904297,-21.93879508972168,2.109560012817383,14067712,EleutherAI/pythia-14m,step98000,seed9,9,98000
It was a reddish orange.,orange,orange,It was an orange reddish., reddish orange, orange reddish,reddish,False,-16.29563331604004,-16.335416793823242,0.039783477783203125,14067712,EleutherAI/pythia-14m,step98000,seed9,9,98000
He saw the ripped page.,page,page,He saw the page ripped., ripped page, page ripped,ripped,False,-23.059099197387695,-20.924301147460938,-2.134798049926758,14067712,EleutherAI/pythia-14m,step98000,seed9,9,98000
It was a tree palm.,palm,palm,It was a palm tree., tree palm, palm tree,tree,True,-18.588754653930664,-14.26236343383789,-4.326391220092773,14067712,EleutherAI/pythia-14m,step98000,seed9,9,98000
It was a consumer panel.,panel,panel,It was a panel consumer., consumer panel, panel consumer,consumer,True,-21.171010971069336,-23.332429885864258,2.161418914794922,14067712,EleutherAI/pythia-14m,step98000,seed9,9,98000
It was a biblical passage.,passage,passage,It was a passage biblical., biblical passage, passage biblical,biblical,False,-16.7674617767334,-23.144611358642578,6.37714958190918,14067712,EleutherAI/pythia-14m,step98000,seed9,9,98000
It was a secure perch.,perch,perch,It was a perch secure., secure perch, perch secure,secure,False,-24.488866806030273,-24.436588287353516,-0.05227851867675781,14067712,EleutherAI/pythia-14m,step98000,seed9,9,98000
He saw the plastic pitcher.,pitcher,pitcher,He saw the pitcher plastic., plastic pitcher, pitcher plastic,plastic,True,-20.188079833984375,-23.365365982055664,3.177286148071289,14067712,EleutherAI/pythia-14m,step98000,seed9,9,98000
It was a sweet port.,port,port,It was a port sweet., sweet port, port sweet,sweet,False,-17.11111068725586,-22.144062042236328,5.032951354980469,14067712,EleutherAI/pythia-14m,step98000,seed9,9,98000
He was in a yoga position.,position,position,He was in a position yoga., yoga position, position yoga,yoga,True,-16.284255981445312,-18.366594314575195,2.082338333129883,14067712,EleutherAI/pythia-14m,step98000,seed9,9,98000
It was a challenging post.,post,post,It was a post challenging., challenging post, post challenging,challenging,False,-16.268308639526367,-18.65892219543457,2.390613555908203,14067712,EleutherAI/pythia-14m,step98000,seed9,9,98000
He had the quickest punch.,punch,punch,He had the punch quickest., quickest punch, punch quickest,quickest,False,-19.877635955810547,-28.609622955322266,8.731986999511719,14067712,EleutherAI/pythia-14m,step98000,seed9,9,98000
She had a cloudy pupil.,pupil,pupil,She had a pupil cloudy., cloudy pupil, pupil cloudy,cloudy,False,-21.055950164794922,-23.11976432800293,2.063814163208008,14067712,EleutherAI/pythia-14m,step98000,seed9,9,98000
That was a tennis racket.,racket,racket,That was a racket tennis., tennis racket, racket tennis,tennis,True,-16.416351318359375,-19.35932159423828,2.9429702758789062,14067712,EleutherAI/pythia-14m,step98000,seed9,9,98000
He liked granite rock.,rock,rock,He liked rock granite., granite rock, rock granite,granite,True,-21.641576766967773,-24.572731018066406,2.931154251098633,14067712,EleutherAI/pythia-14m,step98000,seed9,9,98000
He saw the bushy sage.,sage,sage,He saw the sage bushy., bushy sage, sage bushy,bushy,False,-24.762104034423828,-30.507583618164062,5.745479583740234,14067712,EleutherAI/pythia-14m,step98000,seed9,9,98000
It was a major scale.,scale,scale,It was a scale major., major scale, scale major,major,False,-15.17330551147461,-22.866676330566406,7.693370819091797,14067712,EleutherAI/pythia-14m,step98000,seed9,9,98000
It was a panoramic scene.,scene,scene,It was a scene panoramic., panoramic scene, scene panoramic,panoramic,False,-18.425159454345703,-23.716350555419922,5.291191101074219,14067712,EleutherAI/pythia-14m,step98000,seed9,9,98000
It was a trained seal.,seal,seal,It was a seal trained., trained seal, seal trained,trained,False,-19.070405960083008,-21.151683807373047,2.081277847290039,14067712,EleutherAI/pythia-14m,step98000,seed9,9,98000
He used the video tape.,tape,tape,He used the tape video., video tape, tape video,video,True,-13.943675994873047,-16.552087783813477,2.6084117889404297,14067712,EleutherAI/pythia-14m,step98000,seed9,9,98000
It was a technical term.,term,term,It was a term technical., technical term, term technical,technical,False,-15.331245422363281,-20.40679931640625,5.075553894042969,14067712,EleutherAI/pythia-14m,step98000,seed9,9,98000
It was a diseased tick.,tick,tick,It was a tick diseased., diseased tick, tick diseased,diseased,False,-22.237743377685547,-27.203266143798828,4.965522766113281,14067712,EleutherAI/pythia-14m,step98000,seed9,9,98000
It was a finger tip.,tip,tip,It was a tip finger., finger tip, tip finger,finger,True,-18.49901580810547,-19.50758934020996,1.0085735321044922,14067712,EleutherAI/pythia-14m,step98000,seed9,9,98000
She liked the professional title.,title,title,She liked the title professional., professional title, title professional,professional,False,-17.363489151000977,-19.01275062561035,1.649261474609375,14067712,EleutherAI/pythia-14m,step98000,seed9,9,98000
It was a bell toll.,toll,toll,It was a toll bell., bell toll, toll bell,bell,True,-21.880538940429688,-22.37443733215332,0.4938983917236328,14067712,EleutherAI/pythia-14m,step98000,seed9,9,98000
She saw the snowshoe tracks.,track,tracks,She saw the tracks snowshoe., snowshoe tracks, tracks snowshoe,snowshoe,True,-30.19454574584961,-32.03681945800781,1.8422737121582031,14067712,EleutherAI/pythia-14m,step98000,seed9,9,98000
They were cluttered yards.,yard,yards,They were yards cluttered., cluttered yards, yards cluttered,cluttered,False,-28.67363739013672,-29.117586135864258,0.44394874572753906,14067712,EleutherAI/pythia-14m,step98000,seed9,9,98000
