sentence,word,string,reversed_sentence,mod_np,reversed_mod,disambiguating_word,non_adjective,original_logprob,reversed_logprob,ratio,n_params,mpath,revision,seed_name,seed,step
It was a linear function.,function,function,It was a function linear., linear function, function linear,linear,False,-13.817115783691406,-19.935256958007812,6.118141174316406,14067712,EleutherAI/pythia-14m,step118000,seed6,6,118000
It was a social function.,function,function,It was a function social., social function, function social,social,False,-14.311065673828125,-19.923049926757812,5.6119842529296875,14067712,EleutherAI/pythia-14m,step118000,seed6,6,118000
He was on the firm ground.,ground,ground,He was on the ground firm., firm ground, ground firm,firm,False,-16.784751892089844,-15.841670989990234,-0.9430809020996094,14067712,EleutherAI/pythia-14m,step118000,seed6,6,118000
He was on the frozen ground.,ground,ground,He was on the ground frozen., frozen ground, ground frozen,frozen,False,-14.986381530761719,-17.036251068115234,2.0498695373535156,14067712,EleutherAI/pythia-14m,step118000,seed6,6,118000
He was on the camp ground.,ground,ground,He was on the ground camp., camp ground, ground camp,camp,True,-15.712093353271484,-12.719844818115234,-2.99224853515625,14067712,EleutherAI/pythia-14m,step118000,seed6,6,118000
They liked the night guard.,guard,guard,They liked the guard night., night guard, guard night,night,True,-17.194175720214844,-19.266342163085938,2.0721664428710938,14067712,EleutherAI/pythia-14m,step118000,seed6,6,118000
They liked the security guard.,guard,guard,They liked the guard security., security guard, guard security,security,True,-17.093364715576172,-21.028549194335938,3.9351844787597656,14067712,EleutherAI/pythia-14m,step118000,seed6,6,118000
They liked the coast guard.,guard,guard,They liked the guard coast., coast guard, guard coast,coast,True,-18.529685974121094,-21.620590209960938,3.0909042358398438,14067712,EleutherAI/pythia-14m,step118000,seed6,6,118000
He had an assembly guide.,guide,guide,He had an guide assembly., assembly guide, guide assembly,assembly,True,-18.74102783203125,-23.299850463867188,4.5588226318359375,14067712,EleutherAI/pythia-14m,step118000,seed6,6,118000
He had a TV guide.,guide,guide,He had a guide TV., TV guide, guide TV,TV,True,-19.418800354003906,-20.81454849243164,1.3957481384277344,14067712,EleutherAI/pythia-14m,step118000,seed6,6,118000
He had a talkative guide.,guide,guide,He had a guide talkative., talkative guide, guide talkative,talkative,False,-23.15711212158203,-28.850994110107422,5.693881988525391,14067712,EleutherAI/pythia-14m,step118000,seed6,6,118000
It was a summer home.,home,home,It was a home summer., summer home, home summer,summer,True,-13.897599220275879,-15.970998764038086,2.073399543762207,14067712,EleutherAI/pythia-14m,step118000,seed6,6,118000
It was a childhood home.,home,home,It was a home childhood., childhood home, home childhood,childhood,True,-15.211164474487305,-16.609670639038086,1.3985061645507812,14067712,EleutherAI/pythia-14m,step118000,seed6,6,118000
It was a funeral home.,home,home,It was a home funeral., funeral home, home funeral,funeral,False,-13.46113395690918,-16.155324935913086,2.6941909790039062,14067712,EleutherAI/pythia-14m,step118000,seed6,6,118000
They had natural intelligence.,intelligence,intelligence,They had intelligence natural., natural intelligence, intelligence natural,natural,False,-16.919599533081055,-21.988189697265625,5.06859016418457,14067712,EleutherAI/pythia-14m,step118000,seed6,6,118000
They had innate intelligence.,intelligence,intelligence,They had intelligence innate., innate intelligence, intelligence innate,innate,False,-18.297143936157227,-24.367828369140625,6.070684432983398,14067712,EleutherAI/pythia-14m,step118000,seed6,6,118000
They had classified intelligence.,intelligence,intelligence,They had intelligence classified., classified intelligence, intelligence classified,classified,False,-18.994022369384766,-22.224517822265625,3.2304954528808594,14067712,EleutherAI/pythia-14m,step118000,seed6,6,118000
It was a sensitive issue.,issue,issue,It was an issue sensitive., sensitive issue, issue sensitive,sensitive,False,-15.922643661499023,-16.912220001220703,0.9895763397216797,14067712,EleutherAI/pythia-14m,step118000,seed6,6,118000
It was a political issue.,issue,issue,It was an issue political., political issue, issue political,political,False,-12.839229583740234,-16.674182891845703,3.8349533081054688,14067712,EleutherAI/pythia-14m,step118000,seed6,6,118000
It was a weekly issue.,issue,issue,It was an issue weekly., weekly issue, issue weekly,weekly,False,-18.394807815551758,-19.937366485595703,1.5425586700439453,14067712,EleutherAI/pythia-14m,step118000,seed6,6,118000
It was a blackberry jam.,jam,jam,It was a jam blackberry., blackberry jam, jam blackberry,blackberry,True,-20.963611602783203,-26.268360137939453,5.30474853515625,14067712,EleutherAI/pythia-14m,step118000,seed6,6,118000
It was a peach jam.,jam,jam,It was a jam peach., peach jam, jam peach,peach,False,-22.50141143798828,-22.80384063720703,0.30242919921875,14067712,EleutherAI/pythia-14m,step118000,seed6,6,118000
It was a traffic jam.,jam,jam,It was a jam traffic., traffic jam, jam traffic,traffic,True,-18.533782958984375,-22.372211456298828,3.838428497314453,14067712,EleutherAI/pythia-14m,step118000,seed6,6,118000
It was a duplicate key.,key,key,It was a key duplicate., duplicate key, key duplicate,duplicate,False,-20.548566818237305,-19.42531967163086,-1.1232471466064453,14067712,EleutherAI/pythia-14m,step118000,seed6,6,118000
It was a master key.,key,key,It was a key master., master key, key master,master,True,-18.23200225830078,-18.05813217163086,-0.17387008666992188,14067712,EleutherAI/pythia-14m,step118000,seed6,6,118000
It was a delete key.,key,key,It was a key delete., delete key, key delete,delete,False,-20.933433532714844,-21.48098373413086,0.5475502014160156,14067712,EleutherAI/pythia-14m,step118000,seed6,6,118000
They liked the marinated lamb.,lamb,lamb,They liked the lamb marinated., marinated lamb, lamb marinated,marinated,True,-23.00860023498535,-25.667011260986328,2.6584110260009766,14067712,EleutherAI/pythia-14m,step118000,seed6,6,118000
They liked the grilled lamb.,lamb,lamb,They liked the lamb grilled., grilled lamb, lamb grilled,grilled,False,-16.431976318359375,-20.729320526123047,4.297344207763672,14067712,EleutherAI/pythia-14m,step118000,seed6,6,118000
They liked the cute lamb.,lamb,lamb,They liked the lamb cute., cute lamb, lamb cute,cute,False,-18.175119400024414,-21.585277557373047,3.410158157348633,14067712,EleutherAI/pythia-14m,step118000,seed6,6,118000
She had curly locks.,lock,locks,She had locks curly., curly locks, locks curly,curly,False,-20.198102951049805,-24.580486297607422,4.382383346557617,14067712,EleutherAI/pythia-14m,step118000,seed6,6,118000
She had brown locks.,lock,locks,She had locks brown., brown locks, locks brown,brown,False,-21.574207305908203,-22.758220672607422,1.1840133666992188,14067712,EleutherAI/pythia-14m,step118000,seed6,6,118000
She had window locks.,lock,locks,She had locks window., window locks, locks window,window,True,-21.167766571044922,-22.350017547607422,1.1822509765625,14067712,EleutherAI/pythia-14m,step118000,seed6,6,118000
They liked the hot lunch.,lunch,lunch,They liked the lunch hot., hot lunch, lunch hot,hot,False,-14.98437213897705,-17.860870361328125,2.876498222351074,14067712,EleutherAI/pythia-14m,step118000,seed6,6,118000
They liked the sandwich lunch.,lunch,lunch,They liked the lunch sandwich., sandwich lunch, lunch sandwich,sandwich,True,-17.631328582763672,-17.046905517578125,-0.5844230651855469,14067712,EleutherAI/pythia-14m,step118000,seed6,6,118000
They liked the afternoon lunch.,lunch,lunch,They liked the lunch afternoon., afternoon lunch, lunch afternoon,afternoon,True,-15.093978881835938,-17.008819580078125,1.9148406982421875,14067712,EleutherAI/pythia-14m,step118000,seed6,6,118000
He liked the flea market.,market,market,He liked the market flea., flea market, market flea,flea,True,-22.846582412719727,-24.187278747558594,1.3406963348388672,14067712,EleutherAI/pythia-14m,step118000,seed6,6,118000
He liked the fish market.,market,market,He liked the market fish., fish market, market fish,fish,True,-18.002485275268555,-20.717487335205078,2.7150020599365234,14067712,EleutherAI/pythia-14m,step118000,seed6,6,118000
He liked the housing market.,market,market,He liked the market housing., housing market, market housing,housing,True,-16.448991775512695,-19.095172882080078,2.646181106567383,14067712,EleutherAI/pythia-14m,step118000,seed6,6,118000
It was a lit match.,match,match,It was a match lit., lit match, match lit,lit,False,-22.72665786743164,-20.56869888305664,-2.157958984375,14067712,EleutherAI/pythia-14m,step118000,seed6,6,118000
It was a burning match.,match,match,It was a match burning., burning match, match burning,burning,False,-21.084440231323242,-21.96518325805664,0.8807430267333984,14067712,EleutherAI/pythia-14m,step118000,seed6,6,118000
It was a soccer match.,match,match,It was a match soccer., soccer match, match soccer,soccer,True,-13.8883056640625,-20.47275161743164,6.584445953369141,14067712,EleutherAI/pythia-14m,step118000,seed6,6,118000
It was cough medicine.,medicine,medicine,It was medicine cough., cough medicine, medicine cough,cough,True,-22.76787567138672,-25.53984832763672,2.77197265625,14067712,EleutherAI/pythia-14m,step118000,seed6,6,118000
It was prescription medicine.,medicine,medicine,It was medicine prescription., prescription medicine, medicine prescription,prescription,True,-20.44432830810547,-23.05815887451172,2.61383056640625,14067712,EleutherAI/pythia-14m,step118000,seed6,6,118000
It was orthopedic medicine.,medicine,medicine,It was medicine orthopedic., orthopedic medicine, medicine orthopedic,orthopedic,False,-22.93231964111328,-25.692346572875977,2.7600269317626953,14067712,EleutherAI/pythia-14m,step118000,seed6,6,118000
There was a phone message.,message,message,There was a message phone., phone message, message phone,phone,True,-15.380464553833008,-19.961669921875,4.581205368041992,14067712,EleutherAI/pythia-14m,step118000,seed6,6,118000
There was a computer message.,message,message,There was a message computer., computer message, message computer,computer,True,-17.85651397705078,-20.91796875,3.0614547729492188,14067712,EleutherAI/pythia-14m,step118000,seed6,6,118000
There was an urgent message.,message,message,There was an message urgent., urgent message, message urgent,urgent,False,-14.50903034210205,-22.482131958007812,7.973101615905762,14067712,EleutherAI/pythia-14m,step118000,seed6,6,118000
It was a fungal mold.,mold,mold,It was a mold fungal., fungal mold, mold fungal,fungal,False,-22.712862014770508,-24.415681838989258,1.70281982421875,14067712,EleutherAI/pythia-14m,step118000,seed6,6,118000
It was a harmful mold.,mold,mold,It was a mold harmful., harmful mold, mold harmful,harmful,False,-21.228281021118164,-22.931306838989258,1.7030258178710938,14067712,EleutherAI/pythia-14m,step118000,seed6,6,118000
It was a rubber mold.,mold,mold,It was a mold rubber., rubber mold, mold rubber,rubber,True,-19.010435104370117,-22.007478713989258,2.9970436096191406,14067712,EleutherAI/pythia-14m,step118000,seed6,6,118000
She saw the cancerous mole.,mole,mole,She saw the mole cancerous., cancerous mole, mole cancerous,cancerous,False,-25.474586486816406,-29.16631317138672,3.6917266845703125,14067712,EleutherAI/pythia-14m,step118000,seed6,6,118000
She saw the raised mole.,mole,mole,She saw the mole raised., raised mole, mole raised,raised,False,-23.19471549987793,-20.6924991607666,-2.502216339111328,14067712,EleutherAI/pythia-14m,step118000,seed6,6,118000
She saw the cute mole.,mole,mole,She saw the mole cute., cute mole, mole cute,cute,False,-21.72994613647461,-22.0679874420166,0.3380413055419922,14067712,EleutherAI/pythia-14m,step118000,seed6,6,118000
He liked the rhythmic movement.,movement,movement,He liked the movement rhythmic., rhythmic movement, movement rhythmic,rhythmic,False,-17.62255859375,-23.472169876098633,5.849611282348633,14067712,EleutherAI/pythia-14m,step118000,seed6,6,118000
He liked the graceful movement.,movement,movement,He liked the movement graceful., graceful movement, movement graceful,graceful,False,-19.176883697509766,-23.181028366088867,4.004144668579102,14067712,EleutherAI/pythia-14m,step118000,seed6,6,118000
He liked the feminist movement.,movement,movement,He liked the movement feminist., feminist movement, movement feminist,feminist,True,-13.793023109436035,-21.323606491088867,7.530583381652832,14067712,EleutherAI/pythia-14m,step118000,seed6,6,118000
It was a national newspaper.,newspaper,newspaper,It was a newspaper national., national newspaper, newspaper national,national,False,-15.166900634765625,-20.05918312072754,4.892282485961914,14067712,EleutherAI/pythia-14m,step118000,seed6,6,118000
It was a daily newspaper.,newspaper,newspaper,It was a newspaper daily., daily newspaper, newspaper daily,daily,False,-16.738431930541992,-20.189308166503906,3.450876235961914,14067712,EleutherAI/pythia-14m,step118000,seed6,6,118000
It was a faded newspaper.,newspaper,newspaper,It was a newspaper faded., faded newspaper, newspaper faded,faded,False,-19.20600700378418,-21.59824562072754,2.3922386169433594,14067712,EleutherAI/pythia-14m,step118000,seed6,6,118000
It was a juicy orange.,orange,orange,It was an orange juicy., juicy orange, orange juicy,juicy,False,-23.911380767822266,-24.917734146118164,1.0063533782958984,14067712,EleutherAI/pythia-14m,step118000,seed6,6,118000
It was a ripe orange.,orange,orange,It was an orange ripe., ripe orange, orange ripe,ripe,False,-17.748870849609375,-17.70718765258789,-0.041683197021484375,14067712,EleutherAI/pythia-14m,step118000,seed6,6,118000
It was a bright orange.,orange,orange,It was an orange bright., bright orange, orange bright,bright,False,-13.029874801635742,-16.133211135864258,3.1033363342285156,14067712,EleutherAI/pythia-14m,step118000,seed6,6,118000
He saw the young page.,page,page,He saw the page young., young page, page young,young,False,-16.99150848388672,-18.818111419677734,1.8266029357910156,14067712,EleutherAI/pythia-14m,step118000,seed6,6,118000
He saw the loyal page.,page,page,He saw the page loyal., loyal page, page loyal,loyal,False,-22.851341247558594,-20.949214935302734,-1.9021263122558594,14067712,EleutherAI/pythia-14m,step118000,seed6,6,118000
He saw the blank page.,page,page,He saw the page blank., blank page, page blank,blank,False,-14.389665603637695,-17.403560638427734,3.013895034790039,14067712,EleutherAI/pythia-14m,step118000,seed6,6,118000
It was a calloused palm.,palm,palm,It was a palm calloused., calloused palm, palm calloused,calloused,False,-31.846561431884766,-34.69744110107422,2.850879669189453,14067712,EleutherAI/pythia-14m,step118000,seed6,6,118000
It was a wrinkled palm.,palm,palm,It was a palm wrinkled., wrinkled palm, palm wrinkled,wrinkled,False,-19.9642391204834,-22.325942993164062,2.361703872680664,14067712,EleutherAI/pythia-14m,step118000,seed6,6,118000
It was a tropical palm.,palm,palm,It was a palm tropical., tropical palm, palm tropical,tropical,False,-19.1748104095459,-21.964115142822266,2.789304733276367,14067712,EleutherAI/pythia-14m,step118000,seed6,6,118000
It was a control panel.,panel,panel,It was a panel control., control panel, panel control,control,True,-16.539344787597656,-19.871917724609375,3.3325729370117188,14067712,EleutherAI/pythia-14m,step118000,seed6,6,118000
It was an instrument panel.,panel,panel,It was an panel instrument., instrument panel, panel instrument,instrument,False,-16.867664337158203,-23.58637809753418,6.718713760375977,14067712,EleutherAI/pythia-14m,step118000,seed6,6,118000
It was an advisory panel.,panel,panel,It was an panel advisory., advisory panel, panel advisory,advisory,False,-14.908540725708008,-24.27143669128418,9.362895965576172,14067712,EleutherAI/pythia-14m,step118000,seed6,6,118000
It was a secret passage.,passage,passage,It was a passage secret., secret passage, passage secret,secret,False,-16.52064323425293,-19.965042114257812,3.444398880004883,14067712,EleutherAI/pythia-14m,step118000,seed6,6,118000
It was a narrow passage.,passage,passage,It was a passage narrow., narrow passage, passage narrow,narrow,False,-15.679205894470215,-20.362258911132812,4.683053016662598,14067712,EleutherAI/pythia-14m,step118000,seed6,6,118000
It was a literary passage.,passage,passage,It was a passage literary., literary passage, passage literary,literary,False,-18.22744369506836,-21.681350708007812,3.453907012939453,14067712,EleutherAI/pythia-14m,step118000,seed6,6,118000
It was a tasty perch.,perch,perch,It was a perch tasty., tasty perch, perch tasty,tasty,False,-22.570945739746094,-24.593372344970703,2.0224266052246094,14067712,EleutherAI/pythia-14m,step118000,seed6,6,118000
It was a freshwater perch.,perch,perch,It was a perch freshwater., freshwater perch, perch freshwater,freshwater,True,-23.48456382751465,-26.102893829345703,2.6183300018310547,14067712,EleutherAI/pythia-14m,step118000,seed6,6,118000
It was a lofty perch.,perch,perch,It was a perch lofty., lofty perch, perch lofty,lofty,False,-25.299135208129883,-26.849571228027344,1.550436019897461,14067712,EleutherAI/pythia-14m,step118000,seed6,6,118000
He saw the fast pitcher.,pitcher,pitcher,He saw the pitcher fast., fast pitcher, pitcher fast,fast,False,-21.74924659729004,-19.619983673095703,-2.129262924194336,14067712,EleutherAI/pythia-14m,step118000,seed6,6,118000
He saw the right-handed pitcher.,pitcher,pitcher,He saw the pitcher right-handed., right-handed pitcher, pitcher right-handed,right-handed,False,-21.377460479736328,-23.809741973876953,2.432281494140625,14067712,EleutherAI/pythia-14m,step118000,seed6,6,118000
He saw the glass pitcher.,pitcher,pitcher,He saw the pitcher glass., glass pitcher, pitcher glass,glass,True,-19.203113555908203,-21.245716094970703,2.0426025390625,14067712,EleutherAI/pythia-14m,step118000,seed6,6,118000
It was a windy port.,port,port,It was a port windy., windy port, port windy,windy,False,-23.80319595336914,-27.327369689941406,3.5241737365722656,14067712,EleutherAI/pythia-14m,step118000,seed6,6,118000
It was a seaside port.,port,port,It was a port seaside., seaside port, port seaside,seaside,True,-20.158615112304688,-23.324045181274414,3.1654300689697266,14067712,EleutherAI/pythia-14m,step118000,seed6,6,118000
It was a delicious port.,port,port,It was a port delicious., delicious port, port delicious,delicious,False,-19.160390853881836,-22.848079681396484,3.6876888275146484,14067712,EleutherAI/pythia-14m,step118000,seed6,6,118000
He was in a distinguished position.,position,position,He was in a position distinguished., distinguished position, position distinguished,distinguished,False,-14.220763206481934,-17.23105812072754,3.0102949142456055,14067712,EleutherAI/pythia-14m,step118000,seed6,6,118000
He was in a prominent position.,position,position,He was in a position prominent., prominent position, position prominent,prominent,False,-12.49416732788086,-17.33481788635254,4.84065055847168,14067712,EleutherAI/pythia-14m,step118000,seed6,6,118000
He was in a fetal position.,position,position,He was in a position fetal., fetal position, position fetal,fetal,False,-18.768325805664062,-19.60312843322754,0.8348026275634766,14067712,EleutherAI/pythia-14m,step118000,seed6,6,118000
It was a wooden post.,post,post,It was a post wooden., wooden post, post wooden,wooden,False,-18.449424743652344,-20.538251876831055,2.088827133178711,14067712,EleutherAI/pythia-14m,step118000,seed6,6,118000
It was a fence post.,post,post,It was a post fence., fence post, post fence,fence,True,-19.942415237426758,-20.602216720581055,0.6598014831542969,14067712,EleutherAI/pythia-14m,step118000,seed6,6,118000
It was a teaching post.,post,post,It was a post teaching., teaching post, post teaching,teaching,True,-17.643211364746094,-18.102705001831055,0.45949363708496094,14067712,EleutherAI/pythia-14m,step118000,seed6,6,118000
He had the alcoholic punch.,punch,punch,He had the punch alcoholic., alcoholic punch, punch alcoholic,alcoholic,False,-22.151456832885742,-23.12723159790039,0.9757747650146484,14067712,EleutherAI/pythia-14m,step118000,seed6,6,118000
He had the fruit punch.,punch,punch,He had the punch fruit., fruit punch, punch fruit,fruit,True,-20.02704429626465,-21.41946792602539,1.3924236297607422,14067712,EleutherAI/pythia-14m,step118000,seed6,6,118000
He had the strongest punch.,punch,punch,He had the punch strongest., strongest punch, punch strongest,strongest,False,-16.95947265625,-22.43069839477539,5.471225738525391,14067712,EleutherAI/pythia-14m,step118000,seed6,6,118000
She had a brilliant pupil.,pupil,pupil,She had a pupil brilliant., brilliant pupil, pupil brilliant,brilliant,False,-17.99888801574707,-22.554323196411133,4.5554351806640625,14067712,EleutherAI/pythia-14m,step118000,seed6,6,118000
She had an interested pupil.,pupil,pupil,She had an pupil interested., interested pupil, pupil interested,interested,False,-20.08968734741211,-22.040180206298828,1.9504928588867188,14067712,EleutherAI/pythia-14m,step118000,seed6,6,118000
She had a dilated pupil.,pupil,pupil,She had a pupil dilated., dilated pupil, pupil dilated,dilated,False,-19.38393783569336,-22.153200149536133,2.7692623138427734,14067712,EleutherAI/pythia-14m,step118000,seed6,6,118000
That was a loud racket.,racket,racket,That was a racket loud., loud racket, racket loud,loud,False,-17.76297378540039,-21.434955596923828,3.6719818115234375,14067712,EleutherAI/pythia-14m,step118000,seed6,6,118000
That was an annoying racket.,racket,racket,That was an racket annoying., annoying racket, racket annoying,annoying,False,-18.72998809814453,-26.105682373046875,7.375694274902344,14067712,EleutherAI/pythia-14m,step118000,seed6,6,118000
That was a badminton racket.,racket,racket,That was a racket badminton., badminton racket, racket badminton,badminton,True,-28.21402359008789,-30.835708618164062,2.621685028076172,14067712,EleutherAI/pythia-14m,step118000,seed6,6,118000
He liked electronic rock.,rock,rock,He liked rock electronic., electronic rock, rock electronic,electronic,False,-23.91501235961914,-22.044525146484375,-1.8704872131347656,14067712,EleutherAI/pythia-14m,step118000,seed6,6,118000
He liked alternative rock.,rock,rock,He liked rock alternative., alternative rock, rock alternative,alternative,False,-22.03131675720215,-23.293060302734375,1.2617435455322266,14067712,EleutherAI/pythia-14m,step118000,seed6,6,118000
He liked limestone rock.,rock,rock,He liked rock limestone., limestone rock, rock limestone,limestone,True,-24.66061782836914,-24.014007568359375,-0.6466102600097656,14067712,EleutherAI/pythia-14m,step118000,seed6,6,118000
He saw the wise sage.,sage,sage,He saw the sage wise., wise sage, sage wise,wise,False,-20.645051956176758,-20.31036376953125,-0.3346881866455078,14067712,EleutherAI/pythia-14m,step118000,seed6,6,118000
He saw the renowned sage.,sage,sage,He saw the sage renowned., renowned sage, sage renowned,renowned,False,-21.3233642578125,-22.46807861328125,1.14471435546875,14067712,EleutherAI/pythia-14m,step118000,seed6,6,118000
He saw the fragrant sage.,sage,sage,He saw the sage fragrant., fragrant sage, sage fragrant,fragrant,False,-23.071224212646484,-24.204818725585938,1.1335945129394531,14067712,EleutherAI/pythia-14m,step118000,seed6,6,118000
It was a fish scale.,scale,scale,It was a scale fish., fish scale, scale fish,fish,True,-20.079757690429688,-21.02167510986328,0.9419174194335938,14067712,EleutherAI/pythia-14m,step118000,seed6,6,118000
It was a lizard scale.,scale,scale,It was a scale lizard., lizard scale, scale lizard,lizard,True,-23.91192626953125,-23.93360137939453,0.02167510986328125,14067712,EleutherAI/pythia-14m,step118000,seed6,6,118000
It was a music scale.,scale,scale,It was a scale music., music scale, scale music,music,True,-16.99442481994629,-19.21332550048828,2.218900680541992,14067712,EleutherAI/pythia-14m,step118000,seed6,6,118000
It was a touching scene.,scene,scene,It was a scene touching., touching scene, scene touching,touching,False,-15.647049903869629,-17.987258911132812,2.3402090072631836,14067712,EleutherAI/pythia-14m,step118000,seed6,6,118000
It was a well-acted scene.,scene,scene,It was a scene well-acted., well-acted scene, scene well-acted,well-acted,False,-22.181785583496094,-27.5939998626709,5.412214279174805,14067712,EleutherAI/pythia-14m,step118000,seed6,6,118000
It was a nature scene.,scene,scene,It was a scene nature., nature scene, scene nature,nature,True,-16.20191192626953,-18.762161254882812,2.5602493286132812,14067712,EleutherAI/pythia-14m,step118000,seed6,6,118000
It was a gold seal.,seal,seal,It was a seal gold., gold seal, seal gold,gold,True,-17.30854034423828,-21.424631118774414,4.116090774536133,14067712,EleutherAI/pythia-14m,step118000,seed6,6,118000
It was a certified seal.,seal,seal,It was a seal certified., certified seal, seal certified,certified,False,-20.36199951171875,-21.666574478149414,1.304574966430664,14067712,EleutherAI/pythia-14m,step118000,seed6,6,118000
It was a circus seal.,seal,seal,It was a seal circus., circus seal, seal circus,circus,True,-23.417217254638672,-24.326974868774414,0.9097576141357422,14067712,EleutherAI/pythia-14m,step118000,seed6,6,118000
He used the scotch tape.,tape,tape,He used the tape scotch., scotch tape, tape scotch,scotch,True,-21.6894474029541,-23.487831115722656,1.7983837127685547,14067712,EleutherAI/pythia-14m,step118000,seed6,6,118000
He used the double-sided tape.,tape,tape,He used the tape double-sided., double-sided tape, tape double-sided,double-sided,False,-21.977924346923828,-26.20720100402832,4.229276657104492,14067712,EleutherAI/pythia-14m,step118000,seed6,6,118000
