sentence,word,string,reversed_sentence,mod_np,reversed_mod,disambiguating_word,non_adjective,original_logprob,reversed_logprob,ratio,n_params,mpath,revision,seed_name,seed,step
It was a social function.,function,function,It was a function social., social function, function social,social,False,-16.518423080444336,-22.515724182128906,5.99730110168457,14067712,EleutherAI/pythia-14m,step93000,seed8,8,93000
He was on the firm ground.,ground,ground,He was on the ground firm., firm ground, ground firm,firm,False,-17.80221176147461,-18.364351272583008,0.5621395111083984,14067712,EleutherAI/pythia-14m,step93000,seed8,8,93000
He was on the frozen ground.,ground,ground,He was on the ground frozen., frozen ground, ground frozen,frozen,False,-15.74374008178711,-18.285921096801758,2.5421810150146484,14067712,EleutherAI/pythia-14m,step93000,seed8,8,93000
He was on the camp ground.,ground,ground,He was on the ground camp., camp ground, ground camp,camp,True,-18.70041275024414,-18.004549026489258,-0.6958637237548828,14067712,EleutherAI/pythia-14m,step93000,seed8,8,93000
They liked the night guard.,guard,guard,They liked the guard night., night guard, guard night,night,True,-18.201778411865234,-18.351343154907227,0.1495647430419922,14067712,EleutherAI/pythia-14m,step93000,seed8,8,93000
They liked the security guard.,guard,guard,They liked the guard security., security guard, guard security,security,True,-12.829365730285645,-19.555200576782227,6.725834846496582,14067712,EleutherAI/pythia-14m,step93000,seed8,8,93000
They liked the coast guard.,guard,guard,They liked the guard coast., coast guard, guard coast,coast,True,-19.267581939697266,-22.694726943969727,3.427145004272461,14067712,EleutherAI/pythia-14m,step93000,seed8,8,93000
He had an assembly guide.,guide,guide,He had an guide assembly., assembly guide, guide assembly,assembly,True,-19.67788314819336,-25.704933166503906,6.027050018310547,14067712,EleutherAI/pythia-14m,step93000,seed8,8,93000
He had a TV guide.,guide,guide,He had a guide TV., TV guide, guide TV,TV,True,-18.802513122558594,-21.363264083862305,2.560750961303711,14067712,EleutherAI/pythia-14m,step93000,seed8,8,93000
He had a talkative guide.,guide,guide,He had a guide talkative., talkative guide, guide talkative,talkative,False,-24.13268280029297,-27.947526931762695,3.8148441314697266,14067712,EleutherAI/pythia-14m,step93000,seed8,8,93000
It was a summer home.,home,home,It was a home summer., summer home, home summer,summer,True,-13.765380859375,-17.537979125976562,3.7725982666015625,14067712,EleutherAI/pythia-14m,step93000,seed8,8,93000
It was a childhood home.,home,home,It was a home childhood., childhood home, home childhood,childhood,True,-14.2247314453125,-20.305740356445312,6.0810089111328125,14067712,EleutherAI/pythia-14m,step93000,seed8,8,93000
It was a funeral home.,home,home,It was a home funeral., funeral home, home funeral,funeral,False,-12.997337341308594,-17.761184692382812,4.763847351074219,14067712,EleutherAI/pythia-14m,step93000,seed8,8,93000
They had natural intelligence.,intelligence,intelligence,They had intelligence natural., natural intelligence, intelligence natural,natural,False,-17.784467697143555,-23.736146926879883,5.951679229736328,14067712,EleutherAI/pythia-14m,step93000,seed8,8,93000
They had innate intelligence.,intelligence,intelligence,They had intelligence innate., innate intelligence, intelligence innate,innate,False,-20.23666763305664,-26.731264114379883,6.494596481323242,14067712,EleutherAI/pythia-14m,step93000,seed8,8,93000
They had classified intelligence.,intelligence,intelligence,They had intelligence classified., classified intelligence, intelligence classified,classified,False,-22.110254287719727,-22.168458938598633,0.05820465087890625,14067712,EleutherAI/pythia-14m,step93000,seed8,8,93000
It was a sensitive issue.,issue,issue,It was an issue sensitive., sensitive issue, issue sensitive,sensitive,False,-13.10551929473877,-18.397199630737305,5.291680335998535,14067712,EleutherAI/pythia-14m,step93000,seed8,8,93000
It was a political issue.,issue,issue,It was an issue political., political issue, issue political,political,False,-13.11080551147461,-17.409467697143555,4.298662185668945,14067712,EleutherAI/pythia-14m,step93000,seed8,8,93000
It was a weekly issue.,issue,issue,It was an issue weekly., weekly issue, issue weekly,weekly,False,-18.009918212890625,-18.968183517456055,0.9582653045654297,14067712,EleutherAI/pythia-14m,step93000,seed8,8,93000
It was a blackberry jam.,jam,jam,It was a jam blackberry., blackberry jam, jam blackberry,blackberry,True,-20.52396011352539,-25.041818618774414,4.517858505249023,14067712,EleutherAI/pythia-14m,step93000,seed8,8,93000
It was a peach jam.,jam,jam,It was a jam peach., peach jam, jam peach,peach,False,-20.98588752746582,-24.7645206451416,3.7786331176757812,14067712,EleutherAI/pythia-14m,step93000,seed8,8,93000
It was a traffic jam.,jam,jam,It was a jam traffic., traffic jam, jam traffic,traffic,True,-17.318391799926758,-21.876211166381836,4.557819366455078,14067712,EleutherAI/pythia-14m,step93000,seed8,8,93000
It was a duplicate key.,key,key,It was a key duplicate., duplicate key, key duplicate,duplicate,False,-18.521757125854492,-18.321443557739258,-0.20031356811523438,14067712,EleutherAI/pythia-14m,step93000,seed8,8,93000
It was a master key.,key,key,It was a key master., master key, key master,master,True,-19.7247371673584,-18.138582229614258,-1.5861549377441406,14067712,EleutherAI/pythia-14m,step93000,seed8,8,93000
It was a delete key.,key,key,It was a key delete., delete key, key delete,delete,False,-22.2054386138916,-20.486604690551758,-1.7188339233398438,14067712,EleutherAI/pythia-14m,step93000,seed8,8,93000
They liked the marinated lamb.,lamb,lamb,They liked the lamb marinated., marinated lamb, lamb marinated,marinated,True,-25.33656883239746,-28.332050323486328,2.995481491088867,14067712,EleutherAI/pythia-14m,step93000,seed8,8,93000
They liked the grilled lamb.,lamb,lamb,They liked the lamb grilled., grilled lamb, lamb grilled,grilled,False,-20.160778045654297,-24.348968505859375,4.188190460205078,14067712,EleutherAI/pythia-14m,step93000,seed8,8,93000
They liked the cute lamb.,lamb,lamb,They liked the lamb cute., cute lamb, lamb cute,cute,False,-19.231826782226562,-23.124725341796875,3.8928985595703125,14067712,EleutherAI/pythia-14m,step93000,seed8,8,93000
She had curly locks.,lock,locks,She had locks curly., curly locks, locks curly,curly,False,-20.03628921508789,-23.789348602294922,3.7530593872070312,14067712,EleutherAI/pythia-14m,step93000,seed8,8,93000
She had brown locks.,lock,locks,She had locks brown., brown locks, locks brown,brown,False,-18.881887435913086,-23.723613739013672,4.841726303100586,14067712,EleutherAI/pythia-14m,step93000,seed8,8,93000
She had window locks.,lock,locks,She had locks window., window locks, locks window,window,True,-19.853897094726562,-21.464702606201172,1.6108055114746094,14067712,EleutherAI/pythia-14m,step93000,seed8,8,93000
They liked the hot lunch.,lunch,lunch,They liked the lunch hot., hot lunch, lunch hot,hot,False,-15.651582717895508,-19.595531463623047,3.943948745727539,14067712,EleutherAI/pythia-14m,step93000,seed8,8,93000
They liked the sandwich lunch.,lunch,lunch,They liked the lunch sandwich., sandwich lunch, lunch sandwich,sandwich,True,-19.814271926879883,-18.239147186279297,-1.575124740600586,14067712,EleutherAI/pythia-14m,step93000,seed8,8,93000
They liked the afternoon lunch.,lunch,lunch,They liked the lunch afternoon., afternoon lunch, lunch afternoon,afternoon,True,-16.21256446838379,-18.246044158935547,2.033479690551758,14067712,EleutherAI/pythia-14m,step93000,seed8,8,93000
He liked the flea market.,market,market,He liked the market flea., flea market, market flea,flea,True,-17.306974411010742,-21.176597595214844,3.8696231842041016,14067712,EleutherAI/pythia-14m,step93000,seed8,8,93000
He liked the fish market.,market,market,He liked the market fish., fish market, market fish,fish,True,-16.95138931274414,-18.681753158569336,1.7303638458251953,14067712,EleutherAI/pythia-14m,step93000,seed8,8,93000
He liked the housing market.,market,market,He liked the market housing., housing market, market housing,housing,True,-14.898449897766113,-17.895376205444336,2.9969263076782227,14067712,EleutherAI/pythia-14m,step93000,seed8,8,93000
It was a lit match.,match,match,It was a match lit., lit match, match lit,lit,False,-20.92728614807129,-18.729915618896484,-2.1973705291748047,14067712,EleutherAI/pythia-14m,step93000,seed8,8,93000
It was a burning match.,match,match,It was a match burning., burning match, match burning,burning,False,-20.459569931030273,-21.569881439208984,1.110311508178711,14067712,EleutherAI/pythia-14m,step93000,seed8,8,93000
It was a soccer match.,match,match,It was a match soccer., soccer match, match soccer,soccer,True,-13.957011222839355,-21.022457122802734,7.065445899963379,14067712,EleutherAI/pythia-14m,step93000,seed8,8,93000
It was cough medicine.,medicine,medicine,It was medicine cough., cough medicine, medicine cough,cough,True,-22.829423904418945,-24.118648529052734,1.289224624633789,14067712,EleutherAI/pythia-14m,step93000,seed8,8,93000
It was prescription medicine.,medicine,medicine,It was medicine prescription., prescription medicine, medicine prescription,prescription,True,-17.981109619140625,-21.969661712646484,3.9885520935058594,14067712,EleutherAI/pythia-14m,step93000,seed8,8,93000
It was orthopedic medicine.,medicine,medicine,It was medicine orthopedic., orthopedic medicine, medicine orthopedic,orthopedic,False,-19.891387939453125,-25.994327545166016,6.102939605712891,14067712,EleutherAI/pythia-14m,step93000,seed8,8,93000
There was a phone message.,message,message,There was a message phone., phone message, message phone,phone,True,-13.861710548400879,-17.243412017822266,3.3817014694213867,14067712,EleutherAI/pythia-14m,step93000,seed8,8,93000
There was a computer message.,message,message,There was a message computer., computer message, message computer,computer,True,-17.591318130493164,-18.587650299072266,0.9963321685791016,14067712,EleutherAI/pythia-14m,step93000,seed8,8,93000
There was an urgent message.,message,message,There was an message urgent., urgent message, message urgent,urgent,False,-13.072513580322266,-24.98322296142578,11.910709381103516,14067712,EleutherAI/pythia-14m,step93000,seed8,8,93000
It was a fungal mold.,mold,mold,It was a mold fungal., fungal mold, mold fungal,fungal,False,-21.539302825927734,-21.765228271484375,0.22592544555664062,14067712,EleutherAI/pythia-14m,step93000,seed8,8,93000
It was a harmful mold.,mold,mold,It was a mold harmful., harmful mold, mold harmful,harmful,False,-21.573232650756836,-22.483734130859375,0.9105014801025391,14067712,EleutherAI/pythia-14m,step93000,seed8,8,93000
It was a rubber mold.,mold,mold,It was a mold rubber., rubber mold, mold rubber,rubber,True,-18.03750991821289,-20.214996337890625,2.1774864196777344,14067712,EleutherAI/pythia-14m,step93000,seed8,8,93000
She saw the cancerous mole.,mole,mole,She saw the mole cancerous., cancerous mole, mole cancerous,cancerous,False,-23.293933868408203,-28.63094139099121,5.337007522583008,14067712,EleutherAI/pythia-14m,step93000,seed8,8,93000
She saw the raised mole.,mole,mole,She saw the mole raised., raised mole, mole raised,raised,False,-22.144256591796875,-21.171741485595703,-0.9725151062011719,14067712,EleutherAI/pythia-14m,step93000,seed8,8,93000
She saw the cute mole.,mole,mole,She saw the mole cute., cute mole, mole cute,cute,False,-19.066303253173828,-23.952564239501953,4.886260986328125,14067712,EleutherAI/pythia-14m,step93000,seed8,8,93000
He liked the rhythmic movement.,movement,movement,He liked the movement rhythmic., rhythmic movement, movement rhythmic,rhythmic,False,-18.523038864135742,-21.39805793762207,2.875019073486328,14067712,EleutherAI/pythia-14m,step93000,seed8,8,93000
He liked the graceful movement.,movement,movement,He liked the movement graceful., graceful movement, movement graceful,graceful,False,-18.156034469604492,-22.626079559326172,4.47004508972168,14067712,EleutherAI/pythia-14m,step93000,seed8,8,93000
He liked the feminist movement.,movement,movement,He liked the movement feminist., feminist movement, movement feminist,feminist,True,-15.622568130493164,-23.319438934326172,7.696870803833008,14067712,EleutherAI/pythia-14m,step93000,seed8,8,93000
It was a national newspaper.,newspaper,newspaper,It was a newspaper national., national newspaper, newspaper national,national,False,-13.682428359985352,-20.34441375732422,6.661985397338867,14067712,EleutherAI/pythia-14m,step93000,seed8,8,93000
It was a daily newspaper.,newspaper,newspaper,It was a newspaper daily., daily newspaper, newspaper daily,daily,False,-15.3977632522583,-19.03673553466797,3.638972282409668,14067712,EleutherAI/pythia-14m,step93000,seed8,8,93000
It was a faded newspaper.,newspaper,newspaper,It was a newspaper faded., faded newspaper, newspaper faded,faded,False,-20.47833251953125,-22.52312469482422,2.0447921752929688,14067712,EleutherAI/pythia-14m,step93000,seed8,8,93000
It was a juicy orange.,orange,orange,It was an orange juicy., juicy orange, orange juicy,juicy,False,-19.14120101928711,-20.944719314575195,1.803518295288086,14067712,EleutherAI/pythia-14m,step93000,seed8,8,93000
It was a ripe orange.,orange,orange,It was an orange ripe., ripe orange, orange ripe,ripe,False,-16.878498077392578,-17.94613265991211,1.0676345825195312,14067712,EleutherAI/pythia-14m,step93000,seed8,8,93000
It was a bright orange.,orange,orange,It was an orange bright., bright orange, orange bright,bright,False,-12.646441459655762,-15.67361068725586,3.0271692276000977,14067712,EleutherAI/pythia-14m,step93000,seed8,8,93000
He saw the young page.,page,page,He saw the page young., young page, page young,young,False,-17.459766387939453,-21.471439361572266,4.0116729736328125,14067712,EleutherAI/pythia-14m,step93000,seed8,8,93000
He saw the loyal page.,page,page,He saw the page loyal., loyal page, page loyal,loyal,False,-22.181610107421875,-23.267704010009766,1.0860939025878906,14067712,EleutherAI/pythia-14m,step93000,seed8,8,93000
He saw the blank page.,page,page,He saw the page blank., blank page, page blank,blank,False,-14.17086410522461,-18.483768463134766,4.312904357910156,14067712,EleutherAI/pythia-14m,step93000,seed8,8,93000
It was a calloused palm.,palm,palm,It was a palm calloused., calloused palm, palm calloused,calloused,False,-30.45062255859375,-34.06328582763672,3.6126632690429688,14067712,EleutherAI/pythia-14m,step93000,seed8,8,93000
It was a wrinkled palm.,palm,palm,It was a palm wrinkled., wrinkled palm, palm wrinkled,wrinkled,False,-22.850963592529297,-25.958297729492188,3.1073341369628906,14067712,EleutherAI/pythia-14m,step93000,seed8,8,93000
It was a tropical palm.,palm,palm,It was a palm tropical., tropical palm, palm tropical,tropical,False,-18.781173706054688,-23.935699462890625,5.1545257568359375,14067712,EleutherAI/pythia-14m,step93000,seed8,8,93000
It was a control panel.,panel,panel,It was a panel control., control panel, panel control,control,True,-14.168449401855469,-20.134105682373047,5.965656280517578,14067712,EleutherAI/pythia-14m,step93000,seed8,8,93000
It was an instrument panel.,panel,panel,It was an panel instrument., instrument panel, panel instrument,instrument,False,-16.810123443603516,-26.119340896606445,9.30921745300293,14067712,EleutherAI/pythia-14m,step93000,seed8,8,93000
It was an advisory panel.,panel,panel,It was an panel advisory., advisory panel, panel advisory,advisory,False,-15.420178413391113,-27.393144607543945,11.972966194152832,14067712,EleutherAI/pythia-14m,step93000,seed8,8,93000
It was a secret passage.,passage,passage,It was a passage secret., secret passage, passage secret,secret,False,-14.022857666015625,-21.165063858032227,7.142206192016602,14067712,EleutherAI/pythia-14m,step93000,seed8,8,93000
It was a narrow passage.,passage,passage,It was a passage narrow., narrow passage, passage narrow,narrow,False,-13.965190887451172,-21.461877822875977,7.496686935424805,14067712,EleutherAI/pythia-14m,step93000,seed8,8,93000
It was a literary passage.,passage,passage,It was a passage literary., literary passage, passage literary,literary,False,-17.416053771972656,-24.146387100219727,6.73033332824707,14067712,EleutherAI/pythia-14m,step93000,seed8,8,93000
It was a tasty perch.,perch,perch,It was a perch tasty., tasty perch, perch tasty,tasty,False,-23.569490432739258,-28.9601993560791,5.390708923339844,14067712,EleutherAI/pythia-14m,step93000,seed8,8,93000
It was a freshwater perch.,perch,perch,It was a perch freshwater., freshwater perch, perch freshwater,freshwater,True,-22.672893524169922,-29.19976234436035,6.52686882019043,14067712,EleutherAI/pythia-14m,step93000,seed8,8,93000
It was a lofty perch.,perch,perch,It was a perch lofty., lofty perch, perch lofty,lofty,False,-21.990009307861328,-28.36263656616211,6.372627258300781,14067712,EleutherAI/pythia-14m,step93000,seed8,8,93000
He saw the fast pitcher.,pitcher,pitcher,He saw the pitcher fast., fast pitcher, pitcher fast,fast,False,-19.323837280273438,-19.55235481262207,0.2285175323486328,14067712,EleutherAI/pythia-14m,step93000,seed8,8,93000
He saw the right-handed pitcher.,pitcher,pitcher,He saw the pitcher right-handed., right-handed pitcher, pitcher right-handed,right-handed,False,-22.96262550354004,-25.733047485351562,2.7704219818115234,14067712,EleutherAI/pythia-14m,step93000,seed8,8,93000
He saw the glass pitcher.,pitcher,pitcher,He saw the pitcher glass., glass pitcher, pitcher glass,glass,True,-20.751964569091797,-22.01738166809082,1.2654170989990234,14067712,EleutherAI/pythia-14m,step93000,seed8,8,93000
It was a windy port.,port,port,It was a port windy., windy port, port windy,windy,False,-23.103965759277344,-25.314266204833984,2.2103004455566406,14067712,EleutherAI/pythia-14m,step93000,seed8,8,93000
It was a seaside port.,port,port,It was a port seaside., seaside port, port seaside,seaside,True,-18.97355842590332,-27.385360717773438,8.411802291870117,14067712,EleutherAI/pythia-14m,step93000,seed8,8,93000
It was a delicious port.,port,port,It was a port delicious., delicious port, port delicious,delicious,False,-17.191120147705078,-23.943187713623047,6.752067565917969,14067712,EleutherAI/pythia-14m,step93000,seed8,8,93000
He was in a distinguished position.,position,position,He was in a position distinguished., distinguished position, position distinguished,distinguished,False,-12.797147750854492,-17.027904510498047,4.230756759643555,14067712,EleutherAI/pythia-14m,step93000,seed8,8,93000
He was in a prominent position.,position,position,He was in a position prominent., prominent position, position prominent,prominent,False,-12.006386756896973,-16.313913345336914,4.307526588439941,14067712,EleutherAI/pythia-14m,step93000,seed8,8,93000
He was in a fetal position.,position,position,He was in a position fetal., fetal position, position fetal,fetal,False,-18.647258758544922,-19.728649139404297,1.081390380859375,14067712,EleutherAI/pythia-14m,step93000,seed8,8,93000
It was a wooden post.,post,post,It was a post wooden., wooden post, post wooden,wooden,False,-18.214397430419922,-22.048978805541992,3.8345813751220703,14067712,EleutherAI/pythia-14m,step93000,seed8,8,93000
It was a fence post.,post,post,It was a post fence., fence post, post fence,fence,True,-21.475128173828125,-22.437223434448242,0.9620952606201172,14067712,EleutherAI/pythia-14m,step93000,seed8,8,93000
It was a teaching post.,post,post,It was a post teaching., teaching post, post teaching,teaching,True,-15.73426628112793,-19.320524215698242,3.5862579345703125,14067712,EleutherAI/pythia-14m,step93000,seed8,8,93000
He had the alcoholic punch.,punch,punch,He had the punch alcoholic., alcoholic punch, punch alcoholic,alcoholic,False,-21.963884353637695,-25.787277221679688,3.823392868041992,14067712,EleutherAI/pythia-14m,step93000,seed8,8,93000
He had the fruit punch.,punch,punch,He had the punch fruit., fruit punch, punch fruit,fruit,True,-22.215896606445312,-22.19670295715332,-0.019193649291992188,14067712,EleutherAI/pythia-14m,step93000,seed8,8,93000
He had the strongest punch.,punch,punch,He had the punch strongest., strongest punch, punch strongest,strongest,False,-15.21364974975586,-21.09007453918457,5.876424789428711,14067712,EleutherAI/pythia-14m,step93000,seed8,8,93000
She had a brilliant pupil.,pupil,pupil,She had a pupil brilliant., brilliant pupil, pupil brilliant,brilliant,False,-16.805355072021484,-22.46703338623047,5.661678314208984,14067712,EleutherAI/pythia-14m,step93000,seed8,8,93000
She had an interested pupil.,pupil,pupil,She had an pupil interested., interested pupil, pupil interested,interested,False,-17.30327033996582,-23.494651794433594,6.191381454467773,14067712,EleutherAI/pythia-14m,step93000,seed8,8,93000
She had a dilated pupil.,pupil,pupil,She had a pupil dilated., dilated pupil, pupil dilated,dilated,False,-17.765159606933594,-21.52519989013672,3.760040283203125,14067712,EleutherAI/pythia-14m,step93000,seed8,8,93000
That was a loud racket.,racket,racket,That was a racket loud., loud racket, racket loud,loud,False,-19.83392906188965,-24.564884185791016,4.730955123901367,14067712,EleutherAI/pythia-14m,step93000,seed8,8,93000
That was an annoying racket.,racket,racket,That was an racket annoying., annoying racket, racket annoying,annoying,False,-19.863113403320312,-26.31216049194336,6.449047088623047,14067712,EleutherAI/pythia-14m,step93000,seed8,8,93000
That was a badminton racket.,racket,racket,That was a racket badminton., badminton racket, racket badminton,badminton,True,-27.954303741455078,-31.475345611572266,3.5210418701171875,14067712,EleutherAI/pythia-14m,step93000,seed8,8,93000
He liked electronic rock.,rock,rock,He liked rock electronic., electronic rock, rock electronic,electronic,False,-20.50265121459961,-21.049095153808594,0.5464439392089844,14067712,EleutherAI/pythia-14m,step93000,seed8,8,93000
He liked alternative rock.,rock,rock,He liked rock alternative., alternative rock, rock alternative,alternative,False,-20.291015625,-21.918113708496094,1.6270980834960938,14067712,EleutherAI/pythia-14m,step93000,seed8,8,93000
He liked limestone rock.,rock,rock,He liked rock limestone., limestone rock, rock limestone,limestone,True,-18.535566329956055,-21.058921813964844,2.523355484008789,14067712,EleutherAI/pythia-14m,step93000,seed8,8,93000
He saw the wise sage.,sage,sage,He saw the sage wise., wise sage, sage wise,wise,False,-19.21312141418457,-23.500974655151367,4.287853240966797,14067712,EleutherAI/pythia-14m,step93000,seed8,8,93000
He saw the renowned sage.,sage,sage,He saw the sage renowned., renowned sage, sage renowned,renowned,False,-21.308887481689453,-23.933713912963867,2.624826431274414,14067712,EleutherAI/pythia-14m,step93000,seed8,8,93000
He saw the fragrant sage.,sage,sage,He saw the sage fragrant., fragrant sage, sage fragrant,fragrant,False,-21.697097778320312,-23.8421688079834,2.145071029663086,14067712,EleutherAI/pythia-14m,step93000,seed8,8,93000
It was a fish scale.,scale,scale,It was a scale fish., fish scale, scale fish,fish,True,-20.91954803466797,-22.460569381713867,1.5410213470458984,14067712,EleutherAI/pythia-14m,step93000,seed8,8,93000
It was a lizard scale.,scale,scale,It was a scale lizard., lizard scale, scale lizard,lizard,True,-21.138893127441406,-24.06960678100586,2.930713653564453,14067712,EleutherAI/pythia-14m,step93000,seed8,8,93000
It was a music scale.,scale,scale,It was a scale music., music scale, scale music,music,True,-19.262561798095703,-21.744016647338867,2.481454849243164,14067712,EleutherAI/pythia-14m,step93000,seed8,8,93000
It was a touching scene.,scene,scene,It was a scene touching., touching scene, scene touching,touching,False,-15.00541877746582,-17.14023780822754,2.1348190307617188,14067712,EleutherAI/pythia-14m,step93000,seed8,8,93000
It was a well-acted scene.,scene,scene,It was a scene well-acted., well-acted scene, scene well-acted,well-acted,False,-25.72907066345215,-29.791778564453125,4.062707901000977,14067712,EleutherAI/pythia-14m,step93000,seed8,8,93000
It was a nature scene.,scene,scene,It was a scene nature., nature scene, scene nature,nature,True,-17.300519943237305,-18.90415382385254,1.6036338806152344,14067712,EleutherAI/pythia-14m,step93000,seed8,8,93000
It was a gold seal.,seal,seal,It was a seal gold., gold seal, seal gold,gold,True,-16.850536346435547,-24.632869720458984,7.7823333740234375,14067712,EleutherAI/pythia-14m,step93000,seed8,8,93000
It was a certified seal.,seal,seal,It was a seal certified., certified seal, seal certified,certified,False,-20.692615509033203,-19.503047943115234,-1.1895675659179688,14067712,EleutherAI/pythia-14m,step93000,seed8,8,93000
It was a circus seal.,seal,seal,It was a seal circus., circus seal, seal circus,circus,True,-25.081954956054688,-25.955745697021484,0.8737907409667969,14067712,EleutherAI/pythia-14m,step93000,seed8,8,93000
He used the scotch tape.,tape,tape,He used the tape scotch., scotch tape, tape scotch,scotch,True,-21.667694091796875,-23.399578094482422,1.7318840026855469,14067712,EleutherAI/pythia-14m,step93000,seed8,8,93000
He used the double-sided tape.,tape,tape,He used the tape double-sided., double-sided tape, tape double-sided,double-sided,False,-21.64826011657715,-27.953397750854492,6.305137634277344,14067712,EleutherAI/pythia-14m,step93000,seed8,8,93000
He used the interview tape.,tape,tape,He used the tape interview., interview tape, tape interview,interview,True,-16.155649185180664,-18.967872619628906,2.812223434448242,14067712,EleutherAI/pythia-14m,step93000,seed8,8,93000
It was a winter term.,term,term,It was a term winter., winter term, term winter,winter,True,-16.29296875,-23.381561279296875,7.088592529296875,14067712,EleutherAI/pythia-14m,step93000,seed8,8,93000
