sentence,word,string,reversed_sentence,mod_np,reversed_mod,disambiguating_word,non_adjective,original_logprob,reversed_logprob,ratio,n_params,mpath,revision,seed_name,seed,step
It was a linear function.,function,function,It was a function linear., linear function, function linear,linear,False,-13.953232765197754,-18.93526840209961,4.9820356369018555,14067712,EleutherAI/pythia-14m,step135000,seed6,6,135000
It was a social function.,function,function,It was a function social., social function, function social,social,False,-15.128759384155273,-19.64156723022461,4.512807846069336,14067712,EleutherAI/pythia-14m,step135000,seed6,6,135000
He was on the firm ground.,ground,ground,He was on the ground firm., firm ground, ground firm,firm,False,-17.383514404296875,-15.258766174316406,-2.1247482299804688,14067712,EleutherAI/pythia-14m,step135000,seed6,6,135000
He was on the frozen ground.,ground,ground,He was on the ground frozen., frozen ground, ground frozen,frozen,False,-15.383172988891602,-18.198707580566406,2.8155345916748047,14067712,EleutherAI/pythia-14m,step135000,seed6,6,135000
He was on the camp ground.,ground,ground,He was on the ground camp., camp ground, ground camp,camp,True,-16.162858963012695,-13.684059143066406,-2.478799819946289,14067712,EleutherAI/pythia-14m,step135000,seed6,6,135000
They liked the night guard.,guard,guard,They liked the guard night., night guard, guard night,night,True,-17.02194595336914,-18.746374130249023,1.7244281768798828,14067712,EleutherAI/pythia-14m,step135000,seed6,6,135000
They liked the security guard.,guard,guard,They liked the guard security., security guard, guard security,security,True,-17.140840530395508,-21.382848739624023,4.242008209228516,14067712,EleutherAI/pythia-14m,step135000,seed6,6,135000
They liked the coast guard.,guard,guard,They liked the guard coast., coast guard, guard coast,coast,True,-17.53282356262207,-21.866979598999023,4.334156036376953,14067712,EleutherAI/pythia-14m,step135000,seed6,6,135000
He had an assembly guide.,guide,guide,He had an guide assembly., assembly guide, guide assembly,assembly,True,-18.168991088867188,-22.75283432006836,4.583843231201172,14067712,EleutherAI/pythia-14m,step135000,seed6,6,135000
He had a TV guide.,guide,guide,He had a guide TV., TV guide, guide TV,TV,True,-19.355873107910156,-19.966957092285156,0.611083984375,14067712,EleutherAI/pythia-14m,step135000,seed6,6,135000
He had a talkative guide.,guide,guide,He had a guide talkative., talkative guide, guide talkative,talkative,False,-22.377382278442383,-28.181629180908203,5.80424690246582,14067712,EleutherAI/pythia-14m,step135000,seed6,6,135000
It was a summer home.,home,home,It was a home summer., summer home, home summer,summer,True,-15.306476593017578,-16.551929473876953,1.245452880859375,14067712,EleutherAI/pythia-14m,step135000,seed6,6,135000
It was a childhood home.,home,home,It was a home childhood., childhood home, home childhood,childhood,True,-15.56670093536377,-17.284839630126953,1.7181386947631836,14067712,EleutherAI/pythia-14m,step135000,seed6,6,135000
It was a funeral home.,home,home,It was a home funeral., funeral home, home funeral,funeral,False,-16.040973663330078,-17.397632598876953,1.356658935546875,14067712,EleutherAI/pythia-14m,step135000,seed6,6,135000
They had natural intelligence.,intelligence,intelligence,They had intelligence natural., natural intelligence, intelligence natural,natural,False,-17.453384399414062,-23.36338996887207,5.910005569458008,14067712,EleutherAI/pythia-14m,step135000,seed6,6,135000
They had innate intelligence.,intelligence,intelligence,They had intelligence innate., innate intelligence, intelligence innate,innate,False,-17.94032096862793,-25.27769660949707,7.337375640869141,14067712,EleutherAI/pythia-14m,step135000,seed6,6,135000
They had classified intelligence.,intelligence,intelligence,They had intelligence classified., classified intelligence, intelligence classified,classified,False,-19.089874267578125,-21.87315559387207,2.7832813262939453,14067712,EleutherAI/pythia-14m,step135000,seed6,6,135000
It was a sensitive issue.,issue,issue,It was an issue sensitive., sensitive issue, issue sensitive,sensitive,False,-16.581533432006836,-19.127826690673828,2.546293258666992,14067712,EleutherAI/pythia-14m,step135000,seed6,6,135000
It was a political issue.,issue,issue,It was an issue political., political issue, issue political,political,False,-13.372282028198242,-18.618061065673828,5.245779037475586,14067712,EleutherAI/pythia-14m,step135000,seed6,6,135000
It was a weekly issue.,issue,issue,It was an issue weekly., weekly issue, issue weekly,weekly,False,-18.56356430053711,-21.166645050048828,2.6030807495117188,14067712,EleutherAI/pythia-14m,step135000,seed6,6,135000
It was a blackberry jam.,jam,jam,It was a jam blackberry., blackberry jam, jam blackberry,blackberry,True,-20.940303802490234,-27.114978790283203,6.174674987792969,14067712,EleutherAI/pythia-14m,step135000,seed6,6,135000
It was a peach jam.,jam,jam,It was a jam peach., peach jam, jam peach,peach,False,-23.717477798461914,-24.776525497436523,1.0590476989746094,14067712,EleutherAI/pythia-14m,step135000,seed6,6,135000
It was a traffic jam.,jam,jam,It was a jam traffic., traffic jam, jam traffic,traffic,True,-19.09783172607422,-22.94744300842285,3.849611282348633,14067712,EleutherAI/pythia-14m,step135000,seed6,6,135000
It was a duplicate key.,key,key,It was a key duplicate., duplicate key, key duplicate,duplicate,False,-20.307552337646484,-20.095504760742188,-0.21204757690429688,14067712,EleutherAI/pythia-14m,step135000,seed6,6,135000
It was a master key.,key,key,It was a key master., master key, key master,master,True,-16.27130126953125,-17.447799682617188,1.1764984130859375,14067712,EleutherAI/pythia-14m,step135000,seed6,6,135000
It was a delete key.,key,key,It was a key delete., delete key, key delete,delete,False,-21.082565307617188,-22.838668823242188,1.756103515625,14067712,EleutherAI/pythia-14m,step135000,seed6,6,135000
They liked the marinated lamb.,lamb,lamb,They liked the lamb marinated., marinated lamb, lamb marinated,marinated,True,-23.10883331298828,-26.16535758972168,3.0565242767333984,14067712,EleutherAI/pythia-14m,step135000,seed6,6,135000
They liked the grilled lamb.,lamb,lamb,They liked the lamb grilled., grilled lamb, lamb grilled,grilled,False,-16.766761779785156,-22.24816131591797,5.4813995361328125,14067712,EleutherAI/pythia-14m,step135000,seed6,6,135000
They liked the cute lamb.,lamb,lamb,They liked the lamb cute., cute lamb, lamb cute,cute,False,-18.36115264892578,-21.71105194091797,3.3498992919921875,14067712,EleutherAI/pythia-14m,step135000,seed6,6,135000
She had curly locks.,lock,locks,She had locks curly., curly locks, locks curly,curly,False,-19.956134796142578,-24.471755981445312,4.515621185302734,14067712,EleutherAI/pythia-14m,step135000,seed6,6,135000
She had brown locks.,lock,locks,She had locks brown., brown locks, locks brown,brown,False,-21.022064208984375,-22.197586059570312,1.1755218505859375,14067712,EleutherAI/pythia-14m,step135000,seed6,6,135000
She had window locks.,lock,locks,She had locks window., window locks, locks window,window,True,-20.073543548583984,-21.551345825195312,1.4778022766113281,14067712,EleutherAI/pythia-14m,step135000,seed6,6,135000
They liked the hot lunch.,lunch,lunch,They liked the lunch hot., hot lunch, lunch hot,hot,False,-15.658672332763672,-19.18191909790039,3.5232467651367188,14067712,EleutherAI/pythia-14m,step135000,seed6,6,135000
They liked the sandwich lunch.,lunch,lunch,They liked the lunch sandwich., sandwich lunch, lunch sandwich,sandwich,True,-19.794559478759766,-18.768587112426758,-1.0259723663330078,14067712,EleutherAI/pythia-14m,step135000,seed6,6,135000
They liked the afternoon lunch.,lunch,lunch,They liked the lunch afternoon., afternoon lunch, lunch afternoon,afternoon,True,-16.187915802001953,-18.06033706665039,1.8724212646484375,14067712,EleutherAI/pythia-14m,step135000,seed6,6,135000
He liked the flea market.,market,market,He liked the market flea., flea market, market flea,flea,True,-24.612751007080078,-26.58399200439453,1.9712409973144531,14067712,EleutherAI/pythia-14m,step135000,seed6,6,135000
He liked the fish market.,market,market,He liked the market fish., fish market, market fish,fish,True,-18.640716552734375,-21.660335540771484,3.0196189880371094,14067712,EleutherAI/pythia-14m,step135000,seed6,6,135000
He liked the housing market.,market,market,He liked the market housing., housing market, market housing,housing,True,-16.257368087768555,-19.644954681396484,3.3875865936279297,14067712,EleutherAI/pythia-14m,step135000,seed6,6,135000
It was a lit match.,match,match,It was a match lit., lit match, match lit,lit,False,-24.487037658691406,-20.34398651123047,-4.1430511474609375,14067712,EleutherAI/pythia-14m,step135000,seed6,6,135000
It was a burning match.,match,match,It was a match burning., burning match, match burning,burning,False,-21.791555404663086,-21.80614471435547,0.014589309692382812,14067712,EleutherAI/pythia-14m,step135000,seed6,6,135000
It was a soccer match.,match,match,It was a match soccer., soccer match, match soccer,soccer,True,-13.616338729858398,-21.16210174560547,7.54576301574707,14067712,EleutherAI/pythia-14m,step135000,seed6,6,135000
It was cough medicine.,medicine,medicine,It was medicine cough., cough medicine, medicine cough,cough,True,-24.67919921875,-26.660980224609375,1.981781005859375,14067712,EleutherAI/pythia-14m,step135000,seed6,6,135000
It was prescription medicine.,medicine,medicine,It was medicine prescription., prescription medicine, medicine prescription,prescription,True,-20.93500518798828,-24.137054443359375,3.2020492553710938,14067712,EleutherAI/pythia-14m,step135000,seed6,6,135000
It was orthopedic medicine.,medicine,medicine,It was medicine orthopedic., orthopedic medicine, medicine orthopedic,orthopedic,False,-23.98975372314453,-28.159767150878906,4.170013427734375,14067712,EleutherAI/pythia-14m,step135000,seed6,6,135000
There was a phone message.,message,message,There was a message phone., phone message, message phone,phone,True,-15.53442096710205,-20.18528175354004,4.650860786437988,14067712,EleutherAI/pythia-14m,step135000,seed6,6,135000
There was a computer message.,message,message,There was a message computer., computer message, message computer,computer,True,-18.105701446533203,-21.67478370666504,3.569082260131836,14067712,EleutherAI/pythia-14m,step135000,seed6,6,135000
There was an urgent message.,message,message,There was an message urgent., urgent message, message urgent,urgent,False,-14.239295959472656,-22.783260345458984,8.543964385986328,14067712,EleutherAI/pythia-14m,step135000,seed6,6,135000
It was a fungal mold.,mold,mold,It was a mold fungal., fungal mold, mold fungal,fungal,False,-21.595544815063477,-23.072484970092773,1.4769401550292969,14067712,EleutherAI/pythia-14m,step135000,seed6,6,135000
It was a harmful mold.,mold,mold,It was a mold harmful., harmful mold, mold harmful,harmful,False,-22.388713836669922,-22.827123641967773,0.43840980529785156,14067712,EleutherAI/pythia-14m,step135000,seed6,6,135000
It was a rubber mold.,mold,mold,It was a mold rubber., rubber mold, mold rubber,rubber,True,-17.86771011352539,-20.950658798217773,3.082948684692383,14067712,EleutherAI/pythia-14m,step135000,seed6,6,135000
She saw the cancerous mole.,mole,mole,She saw the mole cancerous., cancerous mole, mole cancerous,cancerous,False,-25.942184448242188,-29.945220947265625,4.0030364990234375,14067712,EleutherAI/pythia-14m,step135000,seed6,6,135000
She saw the raised mole.,mole,mole,She saw the mole raised., raised mole, mole raised,raised,False,-23.058395385742188,-20.366491317749023,-2.691904067993164,14067712,EleutherAI/pythia-14m,step135000,seed6,6,135000
She saw the cute mole.,mole,mole,She saw the mole cute., cute mole, mole cute,cute,False,-21.48232650756836,-22.872106552124023,1.389780044555664,14067712,EleutherAI/pythia-14m,step135000,seed6,6,135000
He liked the rhythmic movement.,movement,movement,He liked the movement rhythmic., rhythmic movement, movement rhythmic,rhythmic,False,-17.26416778564453,-23.574153900146484,6.309986114501953,14067712,EleutherAI/pythia-14m,step135000,seed6,6,135000
He liked the graceful movement.,movement,movement,He liked the movement graceful., graceful movement, movement graceful,graceful,False,-18.76729965209961,-23.021377563476562,4.254077911376953,14067712,EleutherAI/pythia-14m,step135000,seed6,6,135000
He liked the feminist movement.,movement,movement,He liked the movement feminist., feminist movement, movement feminist,feminist,True,-14.019063949584961,-21.653701782226562,7.634637832641602,14067712,EleutherAI/pythia-14m,step135000,seed6,6,135000
It was a national newspaper.,newspaper,newspaper,It was a newspaper national., national newspaper, newspaper national,national,False,-15.228250503540039,-19.47976303100586,4.25151252746582,14067712,EleutherAI/pythia-14m,step135000,seed6,6,135000
It was a daily newspaper.,newspaper,newspaper,It was a newspaper daily., daily newspaper, newspaper daily,daily,False,-16.600238800048828,-19.32790756225586,2.7276687622070312,14067712,EleutherAI/pythia-14m,step135000,seed6,6,135000
It was a faded newspaper.,newspaper,newspaper,It was a newspaper faded., faded newspaper, newspaper faded,faded,False,-19.0892276763916,-20.46804428100586,1.3788166046142578,14067712,EleutherAI/pythia-14m,step135000,seed6,6,135000
It was a juicy orange.,orange,orange,It was an orange juicy., juicy orange, orange juicy,juicy,False,-23.283103942871094,-25.439075469970703,2.1559715270996094,14067712,EleutherAI/pythia-14m,step135000,seed6,6,135000
It was a ripe orange.,orange,orange,It was an orange ripe., ripe orange, orange ripe,ripe,False,-18.2152042388916,-18.109580993652344,-0.10562324523925781,14067712,EleutherAI/pythia-14m,step135000,seed6,6,135000
It was a bright orange.,orange,orange,It was an orange bright., bright orange, orange bright,bright,False,-13.30721664428711,-15.83516788482666,2.527951240539551,14067712,EleutherAI/pythia-14m,step135000,seed6,6,135000
He saw the young page.,page,page,He saw the page young., young page, page young,young,False,-17.485309600830078,-19.246662139892578,1.7613525390625,14067712,EleutherAI/pythia-14m,step135000,seed6,6,135000
He saw the loyal page.,page,page,He saw the page loyal., loyal page, page loyal,loyal,False,-22.355255126953125,-20.905353546142578,-1.4499015808105469,14067712,EleutherAI/pythia-14m,step135000,seed6,6,135000
He saw the blank page.,page,page,He saw the page blank., blank page, page blank,blank,False,-14.744795799255371,-17.305744171142578,2.560948371887207,14067712,EleutherAI/pythia-14m,step135000,seed6,6,135000
It was a calloused palm.,palm,palm,It was a palm calloused., calloused palm, palm calloused,calloused,False,-32.874229431152344,-35.09212875366211,2.2178993225097656,14067712,EleutherAI/pythia-14m,step135000,seed6,6,135000
It was a wrinkled palm.,palm,palm,It was a palm wrinkled., wrinkled palm, palm wrinkled,wrinkled,False,-20.430892944335938,-22.318622589111328,1.8877296447753906,14067712,EleutherAI/pythia-14m,step135000,seed6,6,135000
It was a tropical palm.,palm,palm,It was a palm tropical., tropical palm, palm tropical,tropical,False,-20.361827850341797,-22.87125587463379,2.509428024291992,14067712,EleutherAI/pythia-14m,step135000,seed6,6,135000
It was a control panel.,panel,panel,It was a panel control., control panel, panel control,control,True,-17.046615600585938,-20.148801803588867,3.1021862030029297,14067712,EleutherAI/pythia-14m,step135000,seed6,6,135000
It was an instrument panel.,panel,panel,It was an panel instrument., instrument panel, panel instrument,instrument,False,-17.90648078918457,-21.228885650634766,3.3224048614501953,14067712,EleutherAI/pythia-14m,step135000,seed6,6,135000
It was an advisory panel.,panel,panel,It was an panel advisory., advisory panel, panel advisory,advisory,False,-15.352997779846191,-21.7637996673584,6.410801887512207,14067712,EleutherAI/pythia-14m,step135000,seed6,6,135000
It was a secret passage.,passage,passage,It was a passage secret., secret passage, passage secret,secret,False,-16.576826095581055,-19.711233139038086,3.1344070434570312,14067712,EleutherAI/pythia-14m,step135000,seed6,6,135000
It was a narrow passage.,passage,passage,It was a passage narrow., narrow passage, passage narrow,narrow,False,-15.448888778686523,-20.160207748413086,4.7113189697265625,14067712,EleutherAI/pythia-14m,step135000,seed6,6,135000
It was a literary passage.,passage,passage,It was a passage literary., literary passage, passage literary,literary,False,-18.27631187438965,-21.388479232788086,3.1121673583984375,14067712,EleutherAI/pythia-14m,step135000,seed6,6,135000
It was a tasty perch.,perch,perch,It was a perch tasty., tasty perch, perch tasty,tasty,False,-24.689136505126953,-25.304458618164062,0.6153221130371094,14067712,EleutherAI/pythia-14m,step135000,seed6,6,135000
It was a freshwater perch.,perch,perch,It was a perch freshwater., freshwater perch, perch freshwater,freshwater,True,-24.156787872314453,-26.402359008789062,2.2455711364746094,14067712,EleutherAI/pythia-14m,step135000,seed6,6,135000
It was a lofty perch.,perch,perch,It was a perch lofty., lofty perch, perch lofty,lofty,False,-24.656538009643555,-26.51390838623047,1.857370376586914,14067712,EleutherAI/pythia-14m,step135000,seed6,6,135000
He saw the fast pitcher.,pitcher,pitcher,He saw the pitcher fast., fast pitcher, pitcher fast,fast,False,-20.612834930419922,-18.788063049316406,-1.8247718811035156,14067712,EleutherAI/pythia-14m,step135000,seed6,6,135000
He saw the right-handed pitcher.,pitcher,pitcher,He saw the pitcher right-handed., right-handed pitcher, pitcher right-handed,right-handed,False,-20.977506637573242,-22.92367172241211,1.9461650848388672,14067712,EleutherAI/pythia-14m,step135000,seed6,6,135000
He saw the glass pitcher.,pitcher,pitcher,He saw the pitcher glass., glass pitcher, pitcher glass,glass,True,-18.754623413085938,-21.221412658691406,2.4667892456054688,14067712,EleutherAI/pythia-14m,step135000,seed6,6,135000
It was a windy port.,port,port,It was a port windy., windy port, port windy,windy,False,-23.065677642822266,-26.62869644165039,3.563018798828125,14067712,EleutherAI/pythia-14m,step135000,seed6,6,135000
It was a seaside port.,port,port,It was a port seaside., seaside port, port seaside,seaside,True,-19.442533493041992,-22.783039093017578,3.340505599975586,14067712,EleutherAI/pythia-14m,step135000,seed6,6,135000
It was a delicious port.,port,port,It was a port delicious., delicious port, port delicious,delicious,False,-20.19696044921875,-24.197368621826172,4.000408172607422,14067712,EleutherAI/pythia-14m,step135000,seed6,6,135000
He was in a distinguished position.,position,position,He was in a position distinguished., distinguished position, position distinguished,distinguished,False,-13.15794849395752,-17.179241180419922,4.021292686462402,14067712,EleutherAI/pythia-14m,step135000,seed6,6,135000
He was in a prominent position.,position,position,He was in a position prominent., prominent position, position prominent,prominent,False,-13.385968208312988,-18.076946258544922,4.690978050231934,14067712,EleutherAI/pythia-14m,step135000,seed6,6,135000
He was in a fetal position.,position,position,He was in a position fetal., fetal position, position fetal,fetal,False,-19.381210327148438,-20.560588836669922,1.1793785095214844,14067712,EleutherAI/pythia-14m,step135000,seed6,6,135000
It was a wooden post.,post,post,It was a post wooden., wooden post, post wooden,wooden,False,-18.160709381103516,-20.51416778564453,2.3534584045410156,14067712,EleutherAI/pythia-14m,step135000,seed6,6,135000
It was a fence post.,post,post,It was a post fence., fence post, post fence,fence,True,-20.84327507019043,-21.07691192626953,0.23363685607910156,14067712,EleutherAI/pythia-14m,step135000,seed6,6,135000
It was a teaching post.,post,post,It was a post teaching., teaching post, post teaching,teaching,True,-18.14566421508789,-18.30103302001953,0.15536880493164062,14067712,EleutherAI/pythia-14m,step135000,seed6,6,135000
He had the alcoholic punch.,punch,punch,He had the punch alcoholic., alcoholic punch, punch alcoholic,alcoholic,False,-22.02477264404297,-23.393203735351562,1.3684310913085938,14067712,EleutherAI/pythia-14m,step135000,seed6,6,135000
He had the fruit punch.,punch,punch,He had the punch fruit., fruit punch, punch fruit,fruit,True,-21.036922454833984,-21.957168579101562,0.9202461242675781,14067712,EleutherAI/pythia-14m,step135000,seed6,6,135000
He had the strongest punch.,punch,punch,He had the punch strongest., strongest punch, punch strongest,strongest,False,-16.572547912597656,-22.471328735351562,5.898780822753906,14067712,EleutherAI/pythia-14m,step135000,seed6,6,135000
She had a brilliant pupil.,pupil,pupil,She had a pupil brilliant., brilliant pupil, pupil brilliant,brilliant,False,-16.667797088623047,-21.92247772216797,5.254680633544922,14067712,EleutherAI/pythia-14m,step135000,seed6,6,135000
She had an interested pupil.,pupil,pupil,She had an pupil interested., interested pupil, pupil interested,interested,False,-17.903919219970703,-21.15985870361328,3.255939483642578,14067712,EleutherAI/pythia-14m,step135000,seed6,6,135000
She had a dilated pupil.,pupil,pupil,She had a pupil dilated., dilated pupil, pupil dilated,dilated,False,-20.08365249633789,-22.40196990966797,2.318317413330078,14067712,EleutherAI/pythia-14m,step135000,seed6,6,135000
That was a loud racket.,racket,racket,That was a racket loud., loud racket, racket loud,loud,False,-18.658000946044922,-22.25609588623047,3.598094940185547,14067712,EleutherAI/pythia-14m,step135000,seed6,6,135000
That was an annoying racket.,racket,racket,That was an racket annoying., annoying racket, racket annoying,annoying,False,-19.352567672729492,-26.260299682617188,6.907732009887695,14067712,EleutherAI/pythia-14m,step135000,seed6,6,135000
That was a badminton racket.,racket,racket,That was a racket badminton., badminton racket, racket badminton,badminton,True,-28.041118621826172,-30.5555419921875,2.514423370361328,14067712,EleutherAI/pythia-14m,step135000,seed6,6,135000
He liked electronic rock.,rock,rock,He liked rock electronic., electronic rock, rock electronic,electronic,False,-24.403064727783203,-21.713214874267578,-2.689849853515625,14067712,EleutherAI/pythia-14m,step135000,seed6,6,135000
He liked alternative rock.,rock,rock,He liked rock alternative., alternative rock, rock alternative,alternative,False,-22.056957244873047,-22.628498077392578,0.5715408325195312,14067712,EleutherAI/pythia-14m,step135000,seed6,6,135000
He liked limestone rock.,rock,rock,He liked rock limestone., limestone rock, rock limestone,limestone,True,-21.60555648803711,-23.260334014892578,1.6547775268554688,14067712,EleutherAI/pythia-14m,step135000,seed6,6,135000
He saw the wise sage.,sage,sage,He saw the sage wise., wise sage, sage wise,wise,False,-19.706180572509766,-19.78703498840332,0.08085441589355469,14067712,EleutherAI/pythia-14m,step135000,seed6,6,135000
He saw the renowned sage.,sage,sage,He saw the sage renowned., renowned sage, sage renowned,renowned,False,-20.256624221801758,-22.36296272277832,2.1063385009765625,14067712,EleutherAI/pythia-14m,step135000,seed6,6,135000
He saw the fragrant sage.,sage,sage,He saw the sage fragrant., fragrant sage, sage fragrant,fragrant,False,-21.958988189697266,-23.170175552368164,1.2111873626708984,14067712,EleutherAI/pythia-14m,step135000,seed6,6,135000
It was a fish scale.,scale,scale,It was a scale fish., fish scale, scale fish,fish,True,-19.871414184570312,-21.885574340820312,2.01416015625,14067712,EleutherAI/pythia-14m,step135000,seed6,6,135000
It was a lizard scale.,scale,scale,It was a scale lizard., lizard scale, scale lizard,lizard,True,-21.523807525634766,-22.777090072631836,1.2532825469970703,14067712,EleutherAI/pythia-14m,step135000,seed6,6,135000
It was a music scale.,scale,scale,It was a scale music., music scale, scale music,music,True,-17.673385620117188,-19.786453247070312,2.113067626953125,14067712,EleutherAI/pythia-14m,step135000,seed6,6,135000
It was a touching scene.,scene,scene,It was a scene touching., touching scene, scene touching,touching,False,-15.565117835998535,-17.79458999633789,2.2294721603393555,14067712,EleutherAI/pythia-14m,step135000,seed6,6,135000
It was a well-acted scene.,scene,scene,It was a scene well-acted., well-acted scene, scene well-acted,well-acted,False,-22.949026107788086,-28.556476593017578,5.607450485229492,14067712,EleutherAI/pythia-14m,step135000,seed6,6,135000
It was a nature scene.,scene,scene,It was a scene nature., nature scene, scene nature,nature,True,-16.499065399169922,-19.42935562133789,2.9302902221679688,14067712,EleutherAI/pythia-14m,step135000,seed6,6,135000
It was a gold seal.,seal,seal,It was a seal gold., gold seal, seal gold,gold,True,-16.64103889465332,-21.176982879638672,4.535943984985352,14067712,EleutherAI/pythia-14m,step135000,seed6,6,135000
It was a certified seal.,seal,seal,It was a seal certified., certified seal, seal certified,certified,False,-18.743350982666016,-20.826885223388672,2.0835342407226562,14067712,EleutherAI/pythia-14m,step135000,seed6,6,135000
It was a circus seal.,seal,seal,It was a seal circus., circus seal, seal circus,circus,True,-23.600875854492188,-23.764385223388672,0.16350936889648438,14067712,EleutherAI/pythia-14m,step135000,seed6,6,135000
He used the scotch tape.,tape,tape,He used the tape scotch., scotch tape, tape scotch,scotch,True,-21.60803985595703,-24.788082122802734,3.180042266845703,14067712,EleutherAI/pythia-14m,step135000,seed6,6,135000
He used the double-sided tape.,tape,tape,He used the tape double-sided., double-sided tape, tape double-sided,double-sided,False,-20.36928939819336,-24.828527450561523,4.459238052368164,14067712,EleutherAI/pythia-14m,step135000,seed6,6,135000
