sentence,word,string,reversed_sentence,mod_np,reversed_mod,disambiguating_word,non_adjective,original_logprob,reversed_logprob,ratio,n_params,mpath,revision,seed_name,seed,step
It was a social function.,function,function,It was a function social., social function, function social,social,False,-15.78619384765625,-20.253623962402344,4.467430114746094,14067712,EleutherAI/pythia-14m,step52000,seed8,8,52000
He was on the firm ground.,ground,ground,He was on the ground firm., firm ground, ground firm,firm,False,-19.000545501708984,-16.64751434326172,-2.3530311584472656,14067712,EleutherAI/pythia-14m,step52000,seed8,8,52000
He was on the frozen ground.,ground,ground,He was on the ground frozen., frozen ground, ground frozen,frozen,False,-17.142955780029297,-17.27387046813965,0.13091468811035156,14067712,EleutherAI/pythia-14m,step52000,seed8,8,52000
He was on the camp ground.,ground,ground,He was on the ground camp., camp ground, ground camp,camp,True,-18.548358917236328,-14.271224975585938,-4.277133941650391,14067712,EleutherAI/pythia-14m,step52000,seed8,8,52000
They liked the night guard.,guard,guard,They liked the guard night., night guard, guard night,night,True,-18.46512222290039,-19.940031051635742,1.4749088287353516,14067712,EleutherAI/pythia-14m,step52000,seed8,8,52000
They liked the security guard.,guard,guard,They liked the guard security., security guard, guard security,security,True,-16.160734176635742,-21.715681076049805,5.5549468994140625,14067712,EleutherAI/pythia-14m,step52000,seed8,8,52000
They liked the coast guard.,guard,guard,They liked the guard coast., coast guard, guard coast,coast,True,-17.90644073486328,-22.56891632080078,4.6624755859375,14067712,EleutherAI/pythia-14m,step52000,seed8,8,52000
He had an assembly guide.,guide,guide,He had an guide assembly., assembly guide, guide assembly,assembly,True,-16.898151397705078,-25.87504005432129,8.976888656616211,14067712,EleutherAI/pythia-14m,step52000,seed8,8,52000
He had a TV guide.,guide,guide,He had a guide TV., TV guide, guide TV,TV,True,-19.70733070373535,-22.261436462402344,2.554105758666992,14067712,EleutherAI/pythia-14m,step52000,seed8,8,52000
He had a talkative guide.,guide,guide,He had a guide talkative., talkative guide, guide talkative,talkative,False,-21.364736557006836,-25.43729019165039,4.072553634643555,14067712,EleutherAI/pythia-14m,step52000,seed8,8,52000
It was a summer home.,home,home,It was a home summer., summer home, home summer,summer,True,-13.780111312866211,-17.482139587402344,3.702028274536133,14067712,EleutherAI/pythia-14m,step52000,seed8,8,52000
It was a childhood home.,home,home,It was a home childhood., childhood home, home childhood,childhood,True,-12.944132804870605,-19.38715362548828,6.443020820617676,14067712,EleutherAI/pythia-14m,step52000,seed8,8,52000
It was a funeral home.,home,home,It was a home funeral., funeral home, home funeral,funeral,False,-14.053922653198242,-17.141948699951172,3.0880260467529297,14067712,EleutherAI/pythia-14m,step52000,seed8,8,52000
They had natural intelligence.,intelligence,intelligence,They had intelligence natural., natural intelligence, intelligence natural,natural,False,-18.307445526123047,-23.216205596923828,4.908760070800781,14067712,EleutherAI/pythia-14m,step52000,seed8,8,52000
They had innate intelligence.,intelligence,intelligence,They had intelligence innate., innate intelligence, intelligence innate,innate,False,-19.563003540039062,-25.141551971435547,5.578548431396484,14067712,EleutherAI/pythia-14m,step52000,seed8,8,52000
They had classified intelligence.,intelligence,intelligence,They had intelligence classified., classified intelligence, intelligence classified,classified,False,-20.010318756103516,-21.162996292114258,1.1526775360107422,14067712,EleutherAI/pythia-14m,step52000,seed8,8,52000
It was a sensitive issue.,issue,issue,It was an issue sensitive., sensitive issue, issue sensitive,sensitive,False,-14.348393440246582,-18.811973571777344,4.463580131530762,14067712,EleutherAI/pythia-14m,step52000,seed8,8,52000
It was a political issue.,issue,issue,It was an issue political., political issue, issue political,political,False,-13.399271965026855,-16.408065795898438,3.008793830871582,14067712,EleutherAI/pythia-14m,step52000,seed8,8,52000
It was a weekly issue.,issue,issue,It was an issue weekly., weekly issue, issue weekly,weekly,False,-17.55873680114746,-18.554122924804688,0.9953861236572266,14067712,EleutherAI/pythia-14m,step52000,seed8,8,52000
It was a blackberry jam.,jam,jam,It was a jam blackberry., blackberry jam, jam blackberry,blackberry,True,-18.278215408325195,-26.288652420043945,8.01043701171875,14067712,EleutherAI/pythia-14m,step52000,seed8,8,52000
It was a peach jam.,jam,jam,It was a jam peach., peach jam, jam peach,peach,False,-18.537158966064453,-22.071086883544922,3.5339279174804688,14067712,EleutherAI/pythia-14m,step52000,seed8,8,52000
It was a traffic jam.,jam,jam,It was a jam traffic., traffic jam, jam traffic,traffic,True,-16.834604263305664,-21.529714584350586,4.695110321044922,14067712,EleutherAI/pythia-14m,step52000,seed8,8,52000
It was a duplicate key.,key,key,It was a key duplicate., duplicate key, key duplicate,duplicate,False,-19.62844467163086,-18.692150115966797,-0.9362945556640625,14067712,EleutherAI/pythia-14m,step52000,seed8,8,52000
It was a master key.,key,key,It was a key master., master key, key master,master,True,-18.95016098022461,-17.88460922241211,-1.0655517578125,14067712,EleutherAI/pythia-14m,step52000,seed8,8,52000
It was a delete key.,key,key,It was a key delete., delete key, key delete,delete,False,-21.43017578125,-21.470172882080078,0.039997100830078125,14067712,EleutherAI/pythia-14m,step52000,seed8,8,52000
They liked the marinated lamb.,lamb,lamb,They liked the lamb marinated., marinated lamb, lamb marinated,marinated,True,-23.504573822021484,-25.381500244140625,1.8769264221191406,14067712,EleutherAI/pythia-14m,step52000,seed8,8,52000
They liked the grilled lamb.,lamb,lamb,They liked the lamb grilled., grilled lamb, lamb grilled,grilled,False,-17.215085983276367,-21.01129150390625,3.796205520629883,14067712,EleutherAI/pythia-14m,step52000,seed8,8,52000
They liked the cute lamb.,lamb,lamb,They liked the lamb cute., cute lamb, lamb cute,cute,False,-19.62590217590332,-20.640769958496094,1.0148677825927734,14067712,EleutherAI/pythia-14m,step52000,seed8,8,52000
She had curly locks.,lock,locks,She had locks curly., curly locks, locks curly,curly,False,-19.755016326904297,-22.428524017333984,2.6735076904296875,14067712,EleutherAI/pythia-14m,step52000,seed8,8,52000
She had brown locks.,lock,locks,She had locks brown., brown locks, locks brown,brown,False,-21.474117279052734,-23.650150299072266,2.1760330200195312,14067712,EleutherAI/pythia-14m,step52000,seed8,8,52000
She had window locks.,lock,locks,She had locks window., window locks, locks window,window,True,-21.20252227783203,-22.29962158203125,1.0970993041992188,14067712,EleutherAI/pythia-14m,step52000,seed8,8,52000
They liked the hot lunch.,lunch,lunch,They liked the lunch hot., hot lunch, lunch hot,hot,False,-15.053386688232422,-18.46345329284668,3.410066604614258,14067712,EleutherAI/pythia-14m,step52000,seed8,8,52000
They liked the sandwich lunch.,lunch,lunch,They liked the lunch sandwich., sandwich lunch, lunch sandwich,sandwich,True,-19.068830490112305,-17.121204376220703,-1.9476261138916016,14067712,EleutherAI/pythia-14m,step52000,seed8,8,52000
They liked the afternoon lunch.,lunch,lunch,They liked the lunch afternoon., afternoon lunch, lunch afternoon,afternoon,True,-14.998160362243652,-18.893451690673828,3.895291328430176,14067712,EleutherAI/pythia-14m,step52000,seed8,8,52000
He liked the flea market.,market,market,He liked the market flea., flea market, market flea,flea,True,-18.509750366210938,-21.61688232421875,3.1071319580078125,14067712,EleutherAI/pythia-14m,step52000,seed8,8,52000
He liked the fish market.,market,market,He liked the market fish., fish market, market fish,fish,True,-15.996307373046875,-19.077354431152344,3.0810470581054688,14067712,EleutherAI/pythia-14m,step52000,seed8,8,52000
He liked the housing market.,market,market,He liked the market housing., housing market, market housing,housing,True,-13.232552528381348,-17.355953216552734,4.123400688171387,14067712,EleutherAI/pythia-14m,step52000,seed8,8,52000
It was a lit match.,match,match,It was a match lit., lit match, match lit,lit,False,-21.346031188964844,-21.327808380126953,-0.018222808837890625,14067712,EleutherAI/pythia-14m,step52000,seed8,8,52000
It was a burning match.,match,match,It was a match burning., burning match, match burning,burning,False,-21.749774932861328,-23.695402145385742,1.945627212524414,14067712,EleutherAI/pythia-14m,step52000,seed8,8,52000
It was a soccer match.,match,match,It was a match soccer., soccer match, match soccer,soccer,True,-16.188631057739258,-21.02277374267578,4.834142684936523,14067712,EleutherAI/pythia-14m,step52000,seed8,8,52000
It was cough medicine.,medicine,medicine,It was medicine cough., cough medicine, medicine cough,cough,True,-17.47665786743164,-22.086334228515625,4.609676361083984,14067712,EleutherAI/pythia-14m,step52000,seed8,8,52000
It was prescription medicine.,medicine,medicine,It was medicine prescription., prescription medicine, medicine prescription,prescription,True,-16.23554801940918,-19.63016128540039,3.394613265991211,14067712,EleutherAI/pythia-14m,step52000,seed8,8,52000
It was orthopedic medicine.,medicine,medicine,It was medicine orthopedic., orthopedic medicine, medicine orthopedic,orthopedic,False,-21.484270095825195,-24.12018585205078,2.635915756225586,14067712,EleutherAI/pythia-14m,step52000,seed8,8,52000
There was a phone message.,message,message,There was a message phone., phone message, message phone,phone,True,-15.589052200317383,-17.82693862915039,2.237886428833008,14067712,EleutherAI/pythia-14m,step52000,seed8,8,52000
There was a computer message.,message,message,There was a message computer., computer message, message computer,computer,True,-19.331069946289062,-20.436424255371094,1.1053543090820312,14067712,EleutherAI/pythia-14m,step52000,seed8,8,52000
There was an urgent message.,message,message,There was an message urgent., urgent message, message urgent,urgent,False,-12.177724838256836,-24.28366470336914,12.105939865112305,14067712,EleutherAI/pythia-14m,step52000,seed8,8,52000
It was a fungal mold.,mold,mold,It was a mold fungal., fungal mold, mold fungal,fungal,False,-19.359846115112305,-22.65326499938965,3.2934188842773438,14067712,EleutherAI/pythia-14m,step52000,seed8,8,52000
It was a harmful mold.,mold,mold,It was a mold harmful., harmful mold, mold harmful,harmful,False,-21.458084106445312,-23.81308364868164,2.354999542236328,14067712,EleutherAI/pythia-14m,step52000,seed8,8,52000
It was a rubber mold.,mold,mold,It was a mold rubber., rubber mold, mold rubber,rubber,True,-15.293145179748535,-20.20865249633789,4.9155073165893555,14067712,EleutherAI/pythia-14m,step52000,seed8,8,52000
She saw the cancerous mole.,mole,mole,She saw the mole cancerous., cancerous mole, mole cancerous,cancerous,False,-23.390661239624023,-27.137208938598633,3.7465476989746094,14067712,EleutherAI/pythia-14m,step52000,seed8,8,52000
She saw the raised mole.,mole,mole,She saw the mole raised., raised mole, mole raised,raised,False,-22.593894958496094,-20.86565399169922,-1.728240966796875,14067712,EleutherAI/pythia-14m,step52000,seed8,8,52000
She saw the cute mole.,mole,mole,She saw the mole cute., cute mole, mole cute,cute,False,-20.150562286376953,-23.345767974853516,3.1952056884765625,14067712,EleutherAI/pythia-14m,step52000,seed8,8,52000
He liked the rhythmic movement.,movement,movement,He liked the movement rhythmic., rhythmic movement, movement rhythmic,rhythmic,False,-20.430917739868164,-22.47022819519043,2.0393104553222656,14067712,EleutherAI/pythia-14m,step52000,seed8,8,52000
He liked the graceful movement.,movement,movement,He liked the movement graceful., graceful movement, movement graceful,graceful,False,-19.225234985351562,-23.4456787109375,4.2204437255859375,14067712,EleutherAI/pythia-14m,step52000,seed8,8,52000
He liked the feminist movement.,movement,movement,He liked the movement feminist., feminist movement, movement feminist,feminist,True,-19.123538970947266,-22.34002685546875,3.2164878845214844,14067712,EleutherAI/pythia-14m,step52000,seed8,8,52000
It was a national newspaper.,newspaper,newspaper,It was a newspaper national., national newspaper, newspaper national,national,False,-15.08320426940918,-19.98922348022461,4.90601921081543,14067712,EleutherAI/pythia-14m,step52000,seed8,8,52000
It was a daily newspaper.,newspaper,newspaper,It was a newspaper daily., daily newspaper, newspaper daily,daily,False,-15.468021392822266,-18.144580841064453,2.6765594482421875,14067712,EleutherAI/pythia-14m,step52000,seed8,8,52000
It was a faded newspaper.,newspaper,newspaper,It was a newspaper faded., faded newspaper, newspaper faded,faded,False,-21.877025604248047,-22.515300750732422,0.638275146484375,14067712,EleutherAI/pythia-14m,step52000,seed8,8,52000
It was a juicy orange.,orange,orange,It was an orange juicy., juicy orange, orange juicy,juicy,False,-18.94112205505371,-16.293636322021484,-2.6474857330322266,14067712,EleutherAI/pythia-14m,step52000,seed8,8,52000
It was a ripe orange.,orange,orange,It was an orange ripe., ripe orange, orange ripe,ripe,False,-14.846283912658691,-14.906126976013184,0.05984306335449219,14067712,EleutherAI/pythia-14m,step52000,seed8,8,52000
It was a bright orange.,orange,orange,It was an orange bright., bright orange, orange bright,bright,False,-12.435995101928711,-14.374641418457031,1.9386463165283203,14067712,EleutherAI/pythia-14m,step52000,seed8,8,52000
He saw the young page.,page,page,He saw the page young., young page, page young,young,False,-18.62665557861328,-20.74531364440918,2.1186580657958984,14067712,EleutherAI/pythia-14m,step52000,seed8,8,52000
He saw the loyal page.,page,page,He saw the page loyal., loyal page, page loyal,loyal,False,-22.39950180053711,-22.06464195251465,-0.33485984802246094,14067712,EleutherAI/pythia-14m,step52000,seed8,8,52000
He saw the blank page.,page,page,He saw the page blank., blank page, page blank,blank,False,-15.075777053833008,-16.99645233154297,1.920675277709961,14067712,EleutherAI/pythia-14m,step52000,seed8,8,52000
It was a calloused palm.,palm,palm,It was a palm calloused., calloused palm, palm calloused,calloused,False,-28.00595474243164,-30.481918334960938,2.475963592529297,14067712,EleutherAI/pythia-14m,step52000,seed8,8,52000
It was a wrinkled palm.,palm,palm,It was a palm wrinkled., wrinkled palm, palm wrinkled,wrinkled,False,-21.21056365966797,-21.64815330505371,0.4375896453857422,14067712,EleutherAI/pythia-14m,step52000,seed8,8,52000
It was a tropical palm.,palm,palm,It was a palm tropical., tropical palm, palm tropical,tropical,False,-16.676820755004883,-21.549549102783203,4.87272834777832,14067712,EleutherAI/pythia-14m,step52000,seed8,8,52000
It was a control panel.,panel,panel,It was a panel control., control panel, panel control,control,True,-14.498527526855469,-18.193857192993164,3.6953296661376953,14067712,EleutherAI/pythia-14m,step52000,seed8,8,52000
It was an instrument panel.,panel,panel,It was an panel instrument., instrument panel, panel instrument,instrument,False,-15.8511962890625,-26.206079483032227,10.354883193969727,14067712,EleutherAI/pythia-14m,step52000,seed8,8,52000
It was an advisory panel.,panel,panel,It was an panel advisory., advisory panel, panel advisory,advisory,False,-15.914382934570312,-26.221519470214844,10.307136535644531,14067712,EleutherAI/pythia-14m,step52000,seed8,8,52000
It was a secret passage.,passage,passage,It was a passage secret., secret passage, passage secret,secret,False,-13.93065071105957,-20.452007293701172,6.521356582641602,14067712,EleutherAI/pythia-14m,step52000,seed8,8,52000
It was a narrow passage.,passage,passage,It was a passage narrow., narrow passage, passage narrow,narrow,False,-13.935848236083984,-19.57410430908203,5.638256072998047,14067712,EleutherAI/pythia-14m,step52000,seed8,8,52000
It was a literary passage.,passage,passage,It was a passage literary., literary passage, passage literary,literary,False,-17.408845901489258,-21.98138999938965,4.572544097900391,14067712,EleutherAI/pythia-14m,step52000,seed8,8,52000
It was a tasty perch.,perch,perch,It was a perch tasty., tasty perch, perch tasty,tasty,False,-21.949373245239258,-29.291690826416016,7.342317581176758,14067712,EleutherAI/pythia-14m,step52000,seed8,8,52000
It was a freshwater perch.,perch,perch,It was a perch freshwater., freshwater perch, perch freshwater,freshwater,True,-21.323333740234375,-27.79065704345703,6.467323303222656,14067712,EleutherAI/pythia-14m,step52000,seed8,8,52000
It was a lofty perch.,perch,perch,It was a perch lofty., lofty perch, perch lofty,lofty,False,-23.092920303344727,-27.863454818725586,4.770534515380859,14067712,EleutherAI/pythia-14m,step52000,seed8,8,52000
He saw the fast pitcher.,pitcher,pitcher,He saw the pitcher fast., fast pitcher, pitcher fast,fast,False,-19.325834274291992,-18.722822189331055,-0.6030120849609375,14067712,EleutherAI/pythia-14m,step52000,seed8,8,52000
He saw the right-handed pitcher.,pitcher,pitcher,He saw the pitcher right-handed., right-handed pitcher, pitcher right-handed,right-handed,False,-21.382530212402344,-23.96431541442871,2.581785202026367,14067712,EleutherAI/pythia-14m,step52000,seed8,8,52000
He saw the glass pitcher.,pitcher,pitcher,He saw the pitcher glass., glass pitcher, pitcher glass,glass,True,-21.134273529052734,-22.742271423339844,1.6079978942871094,14067712,EleutherAI/pythia-14m,step52000,seed8,8,52000
It was a windy port.,port,port,It was a port windy., windy port, port windy,windy,False,-22.114151000976562,-24.415939331054688,2.301788330078125,14067712,EleutherAI/pythia-14m,step52000,seed8,8,52000
It was a seaside port.,port,port,It was a port seaside., seaside port, port seaside,seaside,True,-21.129079818725586,-25.529674530029297,4.400594711303711,14067712,EleutherAI/pythia-14m,step52000,seed8,8,52000
It was a delicious port.,port,port,It was a port delicious., delicious port, port delicious,delicious,False,-17.378978729248047,-24.210575103759766,6.831596374511719,14067712,EleutherAI/pythia-14m,step52000,seed8,8,52000
He was in a distinguished position.,position,position,He was in a position distinguished., distinguished position, position distinguished,distinguished,False,-12.201695442199707,-17.982707977294922,5.781012535095215,14067712,EleutherAI/pythia-14m,step52000,seed8,8,52000
He was in a prominent position.,position,position,He was in a position prominent., prominent position, position prominent,prominent,False,-12.51602840423584,-17.63536834716797,5.119339942932129,14067712,EleutherAI/pythia-14m,step52000,seed8,8,52000
He was in a fetal position.,position,position,He was in a position fetal., fetal position, position fetal,fetal,False,-17.15907096862793,-22.717849731445312,5.558778762817383,14067712,EleutherAI/pythia-14m,step52000,seed8,8,52000
It was a wooden post.,post,post,It was a post wooden., wooden post, post wooden,wooden,False,-18.974761962890625,-21.10455322265625,2.129791259765625,14067712,EleutherAI/pythia-14m,step52000,seed8,8,52000
It was a fence post.,post,post,It was a post fence., fence post, post fence,fence,True,-20.87600326538086,-22.550931930541992,1.6749286651611328,14067712,EleutherAI/pythia-14m,step52000,seed8,8,52000
It was a teaching post.,post,post,It was a post teaching., teaching post, post teaching,teaching,True,-17.002056121826172,-17.362144470214844,0.3600883483886719,14067712,EleutherAI/pythia-14m,step52000,seed8,8,52000
He had the alcoholic punch.,punch,punch,He had the punch alcoholic., alcoholic punch, punch alcoholic,alcoholic,False,-20.396835327148438,-27.361347198486328,6.964511871337891,14067712,EleutherAI/pythia-14m,step52000,seed8,8,52000
He had the fruit punch.,punch,punch,He had the punch fruit., fruit punch, punch fruit,fruit,True,-23.52059555053711,-23.723705291748047,0.2031097412109375,14067712,EleutherAI/pythia-14m,step52000,seed8,8,52000
He had the strongest punch.,punch,punch,He had the punch strongest., strongest punch, punch strongest,strongest,False,-19.800243377685547,-23.230655670166016,3.4304122924804688,14067712,EleutherAI/pythia-14m,step52000,seed8,8,52000
She had a brilliant pupil.,pupil,pupil,She had a pupil brilliant., brilliant pupil, pupil brilliant,brilliant,False,-15.748992919921875,-22.674800872802734,6.925807952880859,14067712,EleutherAI/pythia-14m,step52000,seed8,8,52000
She had an interested pupil.,pupil,pupil,She had an pupil interested., interested pupil, pupil interested,interested,False,-20.810977935791016,-21.22679901123047,0.4158210754394531,14067712,EleutherAI/pythia-14m,step52000,seed8,8,52000
She had a dilated pupil.,pupil,pupil,She had a pupil dilated., dilated pupil, pupil dilated,dilated,False,-21.447895050048828,-22.989112854003906,1.5412178039550781,14067712,EleutherAI/pythia-14m,step52000,seed8,8,52000
That was a loud racket.,racket,racket,That was a racket loud., loud racket, racket loud,loud,False,-17.963117599487305,-23.137203216552734,5.17408561706543,14067712,EleutherAI/pythia-14m,step52000,seed8,8,52000
That was an annoying racket.,racket,racket,That was an racket annoying., annoying racket, racket annoying,annoying,False,-17.334644317626953,-26.378196716308594,9.04355239868164,14067712,EleutherAI/pythia-14m,step52000,seed8,8,52000
That was a badminton racket.,racket,racket,That was a racket badminton., badminton racket, racket badminton,badminton,True,-29.231775283813477,-32.697486877441406,3.4657115936279297,14067712,EleutherAI/pythia-14m,step52000,seed8,8,52000
He liked electronic rock.,rock,rock,He liked rock electronic., electronic rock, rock electronic,electronic,False,-20.414159774780273,-20.872661590576172,0.45850181579589844,14067712,EleutherAI/pythia-14m,step52000,seed8,8,52000
He liked alternative rock.,rock,rock,He liked rock alternative., alternative rock, rock alternative,alternative,False,-19.50836944580078,-22.63516616821289,3.1267967224121094,14067712,EleutherAI/pythia-14m,step52000,seed8,8,52000
He liked limestone rock.,rock,rock,He liked rock limestone., limestone rock, rock limestone,limestone,True,-17.327192306518555,-20.378673553466797,3.051481246948242,14067712,EleutherAI/pythia-14m,step52000,seed8,8,52000
He saw the wise sage.,sage,sage,He saw the sage wise., wise sage, sage wise,wise,False,-20.287921905517578,-21.704273223876953,1.416351318359375,14067712,EleutherAI/pythia-14m,step52000,seed8,8,52000
He saw the renowned sage.,sage,sage,He saw the sage renowned., renowned sage, sage renowned,renowned,False,-21.21263885498047,-24.098987579345703,2.8863487243652344,14067712,EleutherAI/pythia-14m,step52000,seed8,8,52000
He saw the fragrant sage.,sage,sage,He saw the sage fragrant., fragrant sage, sage fragrant,fragrant,False,-21.617177963256836,-22.93828773498535,1.3211097717285156,14067712,EleutherAI/pythia-14m,step52000,seed8,8,52000
It was a fish scale.,scale,scale,It was a scale fish., fish scale, scale fish,fish,True,-21.595870971679688,-21.17456817626953,-0.42130279541015625,14067712,EleutherAI/pythia-14m,step52000,seed8,8,52000
It was a lizard scale.,scale,scale,It was a scale lizard., lizard scale, scale lizard,lizard,True,-23.171932220458984,-23.727401733398438,0.5554695129394531,14067712,EleutherAI/pythia-14m,step52000,seed8,8,52000
It was a music scale.,scale,scale,It was a scale music., music scale, scale music,music,True,-16.03483772277832,-18.433748245239258,2.3989105224609375,14067712,EleutherAI/pythia-14m,step52000,seed8,8,52000
It was a touching scene.,scene,scene,It was a scene touching., touching scene, scene touching,touching,False,-15.063722610473633,-16.61132049560547,1.547597885131836,14067712,EleutherAI/pythia-14m,step52000,seed8,8,52000
It was a well-acted scene.,scene,scene,It was a scene well-acted., well-acted scene, scene well-acted,well-acted,False,-27.514057159423828,-27.642452239990234,0.12839508056640625,14067712,EleutherAI/pythia-14m,step52000,seed8,8,52000
It was a nature scene.,scene,scene,It was a scene nature., nature scene, scene nature,nature,True,-16.484283447265625,-18.996829986572266,2.5125465393066406,14067712,EleutherAI/pythia-14m,step52000,seed8,8,52000
It was a gold seal.,seal,seal,It was a seal gold., gold seal, seal gold,gold,True,-14.587202072143555,-22.352298736572266,7.765096664428711,14067712,EleutherAI/pythia-14m,step52000,seed8,8,52000
It was a certified seal.,seal,seal,It was a seal certified., certified seal, seal certified,certified,False,-19.615421295166016,-20.002689361572266,0.38726806640625,14067712,EleutherAI/pythia-14m,step52000,seed8,8,52000
It was a circus seal.,seal,seal,It was a seal circus., circus seal, seal circus,circus,True,-22.922977447509766,-23.974864959716797,1.0518875122070312,14067712,EleutherAI/pythia-14m,step52000,seed8,8,52000
He used the scotch tape.,tape,tape,He used the tape scotch., scotch tape, tape scotch,scotch,True,-25.27166748046875,-25.917184829711914,0.6455173492431641,14067712,EleutherAI/pythia-14m,step52000,seed8,8,52000
He used the double-sided tape.,tape,tape,He used the tape double-sided., double-sided tape, tape double-sided,double-sided,False,-22.112409591674805,-27.243858337402344,5.131448745727539,14067712,EleutherAI/pythia-14m,step52000,seed8,8,52000
He used the interview tape.,tape,tape,He used the tape interview., interview tape, tape interview,interview,True,-15.636137008666992,-18.600187301635742,2.96405029296875,14067712,EleutherAI/pythia-14m,step52000,seed8,8,52000
It was a winter term.,term,term,It was a term winter., winter term, term winter,winter,True,-16.962141036987305,-22.866527557373047,5.904386520385742,14067712,EleutherAI/pythia-14m,step52000,seed8,8,52000
