sentence,word,string,reversed_sentence,mod_np,reversed_mod,disambiguating_word,non_adjective,original_logprob,reversed_logprob,ratio,n_params,mpath,revision,seed_name,seed,step
It was a linear function.,function,function,It was a function linear., linear function, function linear,linear,False,-14.975570678710938,-18.229759216308594,3.2541885375976562,14067712,EleutherAI/pythia-14m,step104000,seed7,7,104000
It was a social function.,function,function,It was a function social., social function, function social,social,False,-15.69923210144043,-20.824607849121094,5.125375747680664,14067712,EleutherAI/pythia-14m,step104000,seed7,7,104000
He was on the firm ground.,ground,ground,He was on the ground firm., firm ground, ground firm,firm,False,-17.152511596679688,-17.520891189575195,0.3683795928955078,14067712,EleutherAI/pythia-14m,step104000,seed7,7,104000
He was on the frozen ground.,ground,ground,He was on the ground frozen., frozen ground, ground frozen,frozen,False,-15.063834190368652,-17.594865798950195,2.531031608581543,14067712,EleutherAI/pythia-14m,step104000,seed7,7,104000
He was on the camp ground.,ground,ground,He was on the ground camp., camp ground, ground camp,camp,True,-18.94632339477539,-15.952287673950195,-2.9940357208251953,14067712,EleutherAI/pythia-14m,step104000,seed7,7,104000
They liked the night guard.,guard,guard,They liked the guard night., night guard, guard night,night,True,-18.853565216064453,-18.885746002197266,0.0321807861328125,14067712,EleutherAI/pythia-14m,step104000,seed7,7,104000
They liked the security guard.,guard,guard,They liked the guard security., security guard, guard security,security,True,-14.717279434204102,-20.239017486572266,5.521738052368164,14067712,EleutherAI/pythia-14m,step104000,seed7,7,104000
They liked the coast guard.,guard,guard,They liked the guard coast., coast guard, guard coast,coast,True,-18.341949462890625,-24.436649322509766,6.094699859619141,14067712,EleutherAI/pythia-14m,step104000,seed7,7,104000
He had an assembly guide.,guide,guide,He had an guide assembly., assembly guide, guide assembly,assembly,True,-18.618364334106445,-25.927452087402344,7.309087753295898,14067712,EleutherAI/pythia-14m,step104000,seed7,7,104000
He had a TV guide.,guide,guide,He had a guide TV., TV guide, guide TV,TV,True,-17.820755004882812,-21.81279754638672,3.9920425415039062,14067712,EleutherAI/pythia-14m,step104000,seed7,7,104000
He had a talkative guide.,guide,guide,He had a guide talkative., talkative guide, guide talkative,talkative,False,-24.659435272216797,-28.989646911621094,4.330211639404297,14067712,EleutherAI/pythia-14m,step104000,seed7,7,104000
It was a summer home.,home,home,It was a home summer., summer home, home summer,summer,True,-11.736101150512695,-16.71040916442871,4.974308013916016,14067712,EleutherAI/pythia-14m,step104000,seed7,7,104000
It was a childhood home.,home,home,It was a home childhood., childhood home, home childhood,childhood,True,-12.130565643310547,-18.47530174255371,6.344736099243164,14067712,EleutherAI/pythia-14m,step104000,seed7,7,104000
It was a funeral home.,home,home,It was a home funeral., funeral home, home funeral,funeral,False,-12.527931213378906,-17.33870506286621,4.810773849487305,14067712,EleutherAI/pythia-14m,step104000,seed7,7,104000
They had natural intelligence.,intelligence,intelligence,They had intelligence natural., natural intelligence, intelligence natural,natural,False,-17.922752380371094,-24.000038146972656,6.0772857666015625,14067712,EleutherAI/pythia-14m,step104000,seed7,7,104000
They had innate intelligence.,intelligence,intelligence,They had intelligence innate., innate intelligence, intelligence innate,innate,False,-19.840482711791992,-24.566322326660156,4.725839614868164,14067712,EleutherAI/pythia-14m,step104000,seed7,7,104000
They had classified intelligence.,intelligence,intelligence,They had intelligence classified., classified intelligence, intelligence classified,classified,False,-20.80887222290039,-23.494544982910156,2.6856727600097656,14067712,EleutherAI/pythia-14m,step104000,seed7,7,104000
It was a sensitive issue.,issue,issue,It was an issue sensitive., sensitive issue, issue sensitive,sensitive,False,-14.522859573364258,-15.935678482055664,1.4128189086914062,14067712,EleutherAI/pythia-14m,step104000,seed7,7,104000
It was a political issue.,issue,issue,It was an issue political., political issue, issue political,political,False,-11.08773422241211,-16.592905044555664,5.505170822143555,14067712,EleutherAI/pythia-14m,step104000,seed7,7,104000
It was a weekly issue.,issue,issue,It was an issue weekly., weekly issue, issue weekly,weekly,False,-17.980907440185547,-18.234872817993164,0.2539653778076172,14067712,EleutherAI/pythia-14m,step104000,seed7,7,104000
It was a blackberry jam.,jam,jam,It was a jam blackberry., blackberry jam, jam blackberry,blackberry,True,-17.908960342407227,-26.790061950683594,8.881101608276367,14067712,EleutherAI/pythia-14m,step104000,seed7,7,104000
It was a peach jam.,jam,jam,It was a jam peach., peach jam, jam peach,peach,False,-19.460491180419922,-25.78900909423828,6.328517913818359,14067712,EleutherAI/pythia-14m,step104000,seed7,7,104000
It was a traffic jam.,jam,jam,It was a jam traffic., traffic jam, jam traffic,traffic,True,-16.87830352783203,-22.76631736755371,5.88801383972168,14067712,EleutherAI/pythia-14m,step104000,seed7,7,104000
It was a duplicate key.,key,key,It was a key duplicate., duplicate key, key duplicate,duplicate,False,-19.24420928955078,-17.90373992919922,-1.3404693603515625,14067712,EleutherAI/pythia-14m,step104000,seed7,7,104000
It was a master key.,key,key,It was a key master., master key, key master,master,True,-17.491241455078125,-16.79326629638672,-0.6979751586914062,14067712,EleutherAI/pythia-14m,step104000,seed7,7,104000
It was a delete key.,key,key,It was a key delete., delete key, key delete,delete,False,-22.29315948486328,-18.95586395263672,-3.3372955322265625,14067712,EleutherAI/pythia-14m,step104000,seed7,7,104000
They liked the marinated lamb.,lamb,lamb,They liked the lamb marinated., marinated lamb, lamb marinated,marinated,True,-24.111949920654297,-24.71607208251953,0.6041221618652344,14067712,EleutherAI/pythia-14m,step104000,seed7,7,104000
They liked the grilled lamb.,lamb,lamb,They liked the lamb grilled., grilled lamb, lamb grilled,grilled,False,-15.780386924743652,-17.651248931884766,1.8708620071411133,14067712,EleutherAI/pythia-14m,step104000,seed7,7,104000
They liked the cute lamb.,lamb,lamb,They liked the lamb cute., cute lamb, lamb cute,cute,False,-19.31311798095703,-21.315677642822266,2.0025596618652344,14067712,EleutherAI/pythia-14m,step104000,seed7,7,104000
She had curly locks.,lock,locks,She had locks curly., curly locks, locks curly,curly,False,-20.51497459411621,-26.010141372680664,5.495166778564453,14067712,EleutherAI/pythia-14m,step104000,seed7,7,104000
She had brown locks.,lock,locks,She had locks brown., brown locks, locks brown,brown,False,-21.51198387145996,-24.944711685180664,3.432727813720703,14067712,EleutherAI/pythia-14m,step104000,seed7,7,104000
She had window locks.,lock,locks,She had locks window., window locks, locks window,window,True,-22.6300048828125,-24.610116958618164,1.980112075805664,14067712,EleutherAI/pythia-14m,step104000,seed7,7,104000
They liked the hot lunch.,lunch,lunch,They liked the lunch hot., hot lunch, lunch hot,hot,False,-15.979394912719727,-18.540714263916016,2.561319351196289,14067712,EleutherAI/pythia-14m,step104000,seed7,7,104000
They liked the sandwich lunch.,lunch,lunch,They liked the lunch sandwich., sandwich lunch, lunch sandwich,sandwich,True,-17.39120864868164,-17.128971099853516,-0.262237548828125,14067712,EleutherAI/pythia-14m,step104000,seed7,7,104000
They liked the afternoon lunch.,lunch,lunch,They liked the lunch afternoon., afternoon lunch, lunch afternoon,afternoon,True,-15.796929359436035,-19.250308990478516,3.4533796310424805,14067712,EleutherAI/pythia-14m,step104000,seed7,7,104000
He liked the flea market.,market,market,He liked the market flea., flea market, market flea,flea,True,-24.268136978149414,-20.021961212158203,-4.246175765991211,14067712,EleutherAI/pythia-14m,step104000,seed7,7,104000
He liked the fish market.,market,market,He liked the market fish., fish market, market fish,fish,True,-18.588619232177734,-16.30462074279785,-2.283998489379883,14067712,EleutherAI/pythia-14m,step104000,seed7,7,104000
He liked the housing market.,market,market,He liked the market housing., housing market, market housing,housing,True,-17.02427864074707,-17.80437660217285,0.7800979614257812,14067712,EleutherAI/pythia-14m,step104000,seed7,7,104000
It was a lit match.,match,match,It was a match lit., lit match, match lit,lit,False,-22.18310546875,-20.671279907226562,-1.5118255615234375,14067712,EleutherAI/pythia-14m,step104000,seed7,7,104000
It was a burning match.,match,match,It was a match burning., burning match, match burning,burning,False,-18.20939064025879,-21.357681274414062,3.1482906341552734,14067712,EleutherAI/pythia-14m,step104000,seed7,7,104000
It was a soccer match.,match,match,It was a match soccer., soccer match, match soccer,soccer,True,-16.8197021484375,-23.590591430664062,6.7708892822265625,14067712,EleutherAI/pythia-14m,step104000,seed7,7,104000
It was cough medicine.,medicine,medicine,It was medicine cough., cough medicine, medicine cough,cough,True,-21.882888793945312,-23.493518829345703,1.6106300354003906,14067712,EleutherAI/pythia-14m,step104000,seed7,7,104000
It was prescription medicine.,medicine,medicine,It was medicine prescription., prescription medicine, medicine prescription,prescription,True,-18.76950454711914,-20.174915313720703,1.4054107666015625,14067712,EleutherAI/pythia-14m,step104000,seed7,7,104000
It was orthopedic medicine.,medicine,medicine,It was medicine orthopedic., orthopedic medicine, medicine orthopedic,orthopedic,False,-22.779922485351562,-22.7224063873291,-0.05751609802246094,14067712,EleutherAI/pythia-14m,step104000,seed7,7,104000
There was a phone message.,message,message,There was a message phone., phone message, message phone,phone,True,-13.925846099853516,-14.86366081237793,0.9378147125244141,14067712,EleutherAI/pythia-14m,step104000,seed7,7,104000
There was a computer message.,message,message,There was a message computer., computer message, message computer,computer,True,-18.06222915649414,-17.50587272644043,-0.5563564300537109,14067712,EleutherAI/pythia-14m,step104000,seed7,7,104000
There was an urgent message.,message,message,There was an message urgent., urgent message, message urgent,urgent,False,-12.349961280822754,-23.776424407958984,11.42646312713623,14067712,EleutherAI/pythia-14m,step104000,seed7,7,104000
It was a fungal mold.,mold,mold,It was a mold fungal., fungal mold, mold fungal,fungal,False,-21.11566162109375,-23.285865783691406,2.1702041625976562,14067712,EleutherAI/pythia-14m,step104000,seed7,7,104000
It was a harmful mold.,mold,mold,It was a mold harmful., harmful mold, mold harmful,harmful,False,-21.088882446289062,-22.217262268066406,1.1283798217773438,14067712,EleutherAI/pythia-14m,step104000,seed7,7,104000
It was a rubber mold.,mold,mold,It was a mold rubber., rubber mold, mold rubber,rubber,True,-16.130313873291016,-21.615577697753906,5.485263824462891,14067712,EleutherAI/pythia-14m,step104000,seed7,7,104000
She saw the cancerous mole.,mole,mole,She saw the mole cancerous., cancerous mole, mole cancerous,cancerous,False,-27.325965881347656,-27.948213577270508,0.6222476959228516,14067712,EleutherAI/pythia-14m,step104000,seed7,7,104000
She saw the raised mole.,mole,mole,She saw the mole raised., raised mole, mole raised,raised,False,-21.80925941467285,-20.640493392944336,-1.1687660217285156,14067712,EleutherAI/pythia-14m,step104000,seed7,7,104000
She saw the cute mole.,mole,mole,She saw the mole cute., cute mole, mole cute,cute,False,-21.387414932250977,-24.219228744506836,2.8318138122558594,14067712,EleutherAI/pythia-14m,step104000,seed7,7,104000
He liked the rhythmic movement.,movement,movement,He liked the movement rhythmic., rhythmic movement, movement rhythmic,rhythmic,False,-17.372743606567383,-20.94986343383789,3.577119827270508,14067712,EleutherAI/pythia-14m,step104000,seed7,7,104000
He liked the graceful movement.,movement,movement,He liked the movement graceful., graceful movement, movement graceful,graceful,False,-19.748933792114258,-21.70891571044922,1.959981918334961,14067712,EleutherAI/pythia-14m,step104000,seed7,7,104000
He liked the feminist movement.,movement,movement,He liked the movement feminist., feminist movement, movement feminist,feminist,True,-15.954328536987305,-21.59624481201172,5.641916275024414,14067712,EleutherAI/pythia-14m,step104000,seed7,7,104000
It was a national newspaper.,newspaper,newspaper,It was a newspaper national., national newspaper, newspaper national,national,False,-14.301982879638672,-19.118942260742188,4.816959381103516,14067712,EleutherAI/pythia-14m,step104000,seed7,7,104000
It was a daily newspaper.,newspaper,newspaper,It was a newspaper daily., daily newspaper, newspaper daily,daily,False,-15.7611083984375,-17.732345581054688,1.9712371826171875,14067712,EleutherAI/pythia-14m,step104000,seed7,7,104000
It was a faded newspaper.,newspaper,newspaper,It was a newspaper faded., faded newspaper, newspaper faded,faded,False,-18.919347763061523,-21.013473510742188,2.094125747680664,14067712,EleutherAI/pythia-14m,step104000,seed7,7,104000
It was a juicy orange.,orange,orange,It was an orange juicy., juicy orange, orange juicy,juicy,False,-18.12447166442871,-19.6070556640625,1.482583999633789,14067712,EleutherAI/pythia-14m,step104000,seed7,7,104000
It was a ripe orange.,orange,orange,It was an orange ripe., ripe orange, orange ripe,ripe,False,-16.613122940063477,-16.941781997680664,0.3286590576171875,14067712,EleutherAI/pythia-14m,step104000,seed7,7,104000
It was a bright orange.,orange,orange,It was an orange bright., bright orange, orange bright,bright,False,-12.209290504455566,-15.700082778930664,3.4907922744750977,14067712,EleutherAI/pythia-14m,step104000,seed7,7,104000
He saw the young page.,page,page,He saw the page young., young page, page young,young,False,-19.818246841430664,-18.664287567138672,-1.1539592742919922,14067712,EleutherAI/pythia-14m,step104000,seed7,7,104000
He saw the loyal page.,page,page,He saw the page loyal., loyal page, page loyal,loyal,False,-24.51703643798828,-21.146831512451172,-3.3702049255371094,14067712,EleutherAI/pythia-14m,step104000,seed7,7,104000
He saw the blank page.,page,page,He saw the page blank., blank page, page blank,blank,False,-16.341577529907227,-16.200786590576172,-0.1407909393310547,14067712,EleutherAI/pythia-14m,step104000,seed7,7,104000
It was a calloused palm.,palm,palm,It was a palm calloused., calloused palm, palm calloused,calloused,False,-27.066883087158203,-33.65214538574219,6.585262298583984,14067712,EleutherAI/pythia-14m,step104000,seed7,7,104000
It was a wrinkled palm.,palm,palm,It was a palm wrinkled., wrinkled palm, palm wrinkled,wrinkled,False,-20.7440185546875,-21.220781326293945,0.4767627716064453,14067712,EleutherAI/pythia-14m,step104000,seed7,7,104000
It was a tropical palm.,palm,palm,It was a palm tropical., tropical palm, palm tropical,tropical,False,-22.035768508911133,-25.710233688354492,3.6744651794433594,14067712,EleutherAI/pythia-14m,step104000,seed7,7,104000
It was a control panel.,panel,panel,It was a panel control., control panel, panel control,control,True,-15.921297073364258,-18.077091217041016,2.155794143676758,14067712,EleutherAI/pythia-14m,step104000,seed7,7,104000
It was an instrument panel.,panel,panel,It was an panel instrument., instrument panel, panel instrument,instrument,False,-18.64861297607422,-25.569826126098633,6.921213150024414,14067712,EleutherAI/pythia-14m,step104000,seed7,7,104000
It was an advisory panel.,panel,panel,It was an panel advisory., advisory panel, panel advisory,advisory,False,-18.91411590576172,-26.508913040161133,7.594797134399414,14067712,EleutherAI/pythia-14m,step104000,seed7,7,104000
It was a secret passage.,passage,passage,It was a passage secret., secret passage, passage secret,secret,False,-15.585774421691895,-20.037925720214844,4.452151298522949,14067712,EleutherAI/pythia-14m,step104000,seed7,7,104000
It was a narrow passage.,passage,passage,It was a passage narrow., narrow passage, passage narrow,narrow,False,-15.46084976196289,-21.460289001464844,5.999439239501953,14067712,EleutherAI/pythia-14m,step104000,seed7,7,104000
It was a literary passage.,passage,passage,It was a passage literary., literary passage, passage literary,literary,False,-18.67654037475586,-22.810997009277344,4.134456634521484,14067712,EleutherAI/pythia-14m,step104000,seed7,7,104000
It was a tasty perch.,perch,perch,It was a perch tasty., tasty perch, perch tasty,tasty,False,-21.513469696044922,-29.99239730834961,8.478927612304688,14067712,EleutherAI/pythia-14m,step104000,seed7,7,104000
It was a freshwater perch.,perch,perch,It was a perch freshwater., freshwater perch, perch freshwater,freshwater,True,-25.999469757080078,-32.26888656616211,6.269416809082031,14067712,EleutherAI/pythia-14m,step104000,seed7,7,104000
It was a lofty perch.,perch,perch,It was a perch lofty., lofty perch, perch lofty,lofty,False,-22.291362762451172,-30.44919204711914,8.157829284667969,14067712,EleutherAI/pythia-14m,step104000,seed7,7,104000
He saw the fast pitcher.,pitcher,pitcher,He saw the pitcher fast., fast pitcher, pitcher fast,fast,False,-20.719228744506836,-19.581707000732422,-1.137521743774414,14067712,EleutherAI/pythia-14m,step104000,seed7,7,104000
He saw the right-handed pitcher.,pitcher,pitcher,He saw the pitcher right-handed., right-handed pitcher, pitcher right-handed,right-handed,False,-19.98320198059082,-23.868167877197266,3.8849658966064453,14067712,EleutherAI/pythia-14m,step104000,seed7,7,104000
He saw the glass pitcher.,pitcher,pitcher,He saw the pitcher glass., glass pitcher, pitcher glass,glass,True,-18.500490188598633,-21.865154266357422,3.364664077758789,14067712,EleutherAI/pythia-14m,step104000,seed7,7,104000
It was a windy port.,port,port,It was a port windy., windy port, port windy,windy,False,-22.536989212036133,-24.71834373474121,2.181354522705078,14067712,EleutherAI/pythia-14m,step104000,seed7,7,104000
It was a seaside port.,port,port,It was a port seaside., seaside port, port seaside,seaside,True,-20.985057830810547,-24.76978302001953,3.7847251892089844,14067712,EleutherAI/pythia-14m,step104000,seed7,7,104000
It was a delicious port.,port,port,It was a port delicious., delicious port, port delicious,delicious,False,-17.70459747314453,-23.038469314575195,5.333871841430664,14067712,EleutherAI/pythia-14m,step104000,seed7,7,104000
He was in a distinguished position.,position,position,He was in a position distinguished., distinguished position, position distinguished,distinguished,False,-13.931636810302734,-16.55624008178711,2.624603271484375,14067712,EleutherAI/pythia-14m,step104000,seed7,7,104000
He was in a prominent position.,position,position,He was in a position prominent., prominent position, position prominent,prominent,False,-10.291927337646484,-15.994229316711426,5.702301979064941,14067712,EleutherAI/pythia-14m,step104000,seed7,7,104000
He was in a fetal position.,position,position,He was in a position fetal., fetal position, position fetal,fetal,False,-17.694847106933594,-20.03561019897461,2.3407630920410156,14067712,EleutherAI/pythia-14m,step104000,seed7,7,104000
It was a wooden post.,post,post,It was a post wooden., wooden post, post wooden,wooden,False,-17.510910034179688,-20.929500579833984,3.418590545654297,14067712,EleutherAI/pythia-14m,step104000,seed7,7,104000
It was a fence post.,post,post,It was a post fence., fence post, post fence,fence,True,-19.7950439453125,-20.702327728271484,0.9072837829589844,14067712,EleutherAI/pythia-14m,step104000,seed7,7,104000
It was a teaching post.,post,post,It was a post teaching., teaching post, post teaching,teaching,True,-15.704302787780762,-16.243465423583984,0.5391626358032227,14067712,EleutherAI/pythia-14m,step104000,seed7,7,104000
He had the alcoholic punch.,punch,punch,He had the punch alcoholic., alcoholic punch, punch alcoholic,alcoholic,False,-19.198226928710938,-24.026790618896484,4.828563690185547,14067712,EleutherAI/pythia-14m,step104000,seed7,7,104000
He had the fruit punch.,punch,punch,He had the punch fruit., fruit punch, punch fruit,fruit,True,-21.16358757019043,-21.187557220458984,0.023969650268554688,14067712,EleutherAI/pythia-14m,step104000,seed7,7,104000
He had the strongest punch.,punch,punch,He had the punch strongest., strongest punch, punch strongest,strongest,False,-17.938480377197266,-23.364070892333984,5.425590515136719,14067712,EleutherAI/pythia-14m,step104000,seed7,7,104000
She had a brilliant pupil.,pupil,pupil,She had a pupil brilliant., brilliant pupil, pupil brilliant,brilliant,False,-15.094647407531738,-23.197500228881836,8.102852821350098,14067712,EleutherAI/pythia-14m,step104000,seed7,7,104000
She had an interested pupil.,pupil,pupil,She had an pupil interested., interested pupil, pupil interested,interested,False,-20.865440368652344,-25.49940299987793,4.633962631225586,14067712,EleutherAI/pythia-14m,step104000,seed7,7,104000
She had a dilated pupil.,pupil,pupil,She had a pupil dilated., dilated pupil, pupil dilated,dilated,False,-18.318639755249023,-22.763174057006836,4.4445343017578125,14067712,EleutherAI/pythia-14m,step104000,seed7,7,104000
That was a loud racket.,racket,racket,That was a racket loud., loud racket, racket loud,loud,False,-19.188194274902344,-28.93954086303711,9.751346588134766,14067712,EleutherAI/pythia-14m,step104000,seed7,7,104000
That was an annoying racket.,racket,racket,That was an racket annoying., annoying racket, racket annoying,annoying,False,-18.889793395996094,-31.315364837646484,12.42557144165039,14067712,EleutherAI/pythia-14m,step104000,seed7,7,104000
That was a badminton racket.,racket,racket,That was a racket badminton., badminton racket, racket badminton,badminton,True,-27.210710525512695,-35.84068298339844,8.629972457885742,14067712,EleutherAI/pythia-14m,step104000,seed7,7,104000
He liked electronic rock.,rock,rock,He liked rock electronic., electronic rock, rock electronic,electronic,False,-21.772205352783203,-22.546066284179688,0.7738609313964844,14067712,EleutherAI/pythia-14m,step104000,seed7,7,104000
He liked alternative rock.,rock,rock,He liked rock alternative., alternative rock, rock alternative,alternative,False,-20.982864379882812,-22.494796752929688,1.511932373046875,14067712,EleutherAI/pythia-14m,step104000,seed7,7,104000
He liked limestone rock.,rock,rock,He liked rock limestone., limestone rock, rock limestone,limestone,True,-21.6707763671875,-22.292037963867188,0.6212615966796875,14067712,EleutherAI/pythia-14m,step104000,seed7,7,104000
He saw the wise sage.,sage,sage,He saw the sage wise., wise sage, sage wise,wise,False,-19.58312225341797,-20.345365524291992,0.7622432708740234,14067712,EleutherAI/pythia-14m,step104000,seed7,7,104000
He saw the renowned sage.,sage,sage,He saw the sage renowned., renowned sage, sage renowned,renowned,False,-21.71059799194336,-22.994047164916992,1.2834491729736328,14067712,EleutherAI/pythia-14m,step104000,seed7,7,104000
He saw the fragrant sage.,sage,sage,He saw the sage fragrant., fragrant sage, sage fragrant,fragrant,False,-20.822284698486328,-23.142623901367188,2.3203392028808594,14067712,EleutherAI/pythia-14m,step104000,seed7,7,104000
It was a fish scale.,scale,scale,It was a scale fish., fish scale, scale fish,fish,True,-19.699554443359375,-22.74359130859375,3.044036865234375,14067712,EleutherAI/pythia-14m,step104000,seed7,7,104000
It was a lizard scale.,scale,scale,It was a scale lizard., lizard scale, scale lizard,lizard,True,-23.97809600830078,-26.931640625,2.9535446166992188,14067712,EleutherAI/pythia-14m,step104000,seed7,7,104000
It was a music scale.,scale,scale,It was a scale music., music scale, scale music,music,True,-18.11557388305664,-20.70330810546875,2.5877342224121094,14067712,EleutherAI/pythia-14m,step104000,seed7,7,104000
It was a touching scene.,scene,scene,It was a scene touching., touching scene, scene touching,touching,False,-16.004444122314453,-17.57974624633789,1.5753021240234375,14067712,EleutherAI/pythia-14m,step104000,seed7,7,104000
It was a well-acted scene.,scene,scene,It was a scene well-acted., well-acted scene, scene well-acted,well-acted,False,-23.055164337158203,-29.256872177124023,6.20170783996582,14067712,EleutherAI/pythia-14m,step104000,seed7,7,104000
It was a nature scene.,scene,scene,It was a scene nature., nature scene, scene nature,nature,True,-17.038349151611328,-21.03702163696289,3.9986724853515625,14067712,EleutherAI/pythia-14m,step104000,seed7,7,104000
It was a gold seal.,seal,seal,It was a seal gold., gold seal, seal gold,gold,True,-15.299137115478516,-19.485794067382812,4.186656951904297,14067712,EleutherAI/pythia-14m,step104000,seed7,7,104000
It was a certified seal.,seal,seal,It was a seal certified., certified seal, seal certified,certified,False,-18.57598114013672,-20.981155395507812,2.4051742553710938,14067712,EleutherAI/pythia-14m,step104000,seed7,7,104000
It was a circus seal.,seal,seal,It was a seal circus., circus seal, seal circus,circus,True,-22.853282928466797,-25.928054809570312,3.0747718811035156,14067712,EleutherAI/pythia-14m,step104000,seed7,7,104000
He used the scotch tape.,tape,tape,He used the tape scotch., scotch tape, tape scotch,scotch,True,-26.94674301147461,-26.791217803955078,-0.15552520751953125,14067712,EleutherAI/pythia-14m,step104000,seed7,7,104000
He used the double-sided tape.,tape,tape,He used the tape double-sided., double-sided tape, tape double-sided,double-sided,False,-22.0683650970459,-25.94232940673828,3.873964309692383,14067712,EleutherAI/pythia-14m,step104000,seed7,7,104000
