sentence,word,string,reversed_sentence,mod_np,reversed_mod,disambiguating_word,non_adjective,original_logprob,reversed_logprob,ratio,n_params,mpath,revision,seed_name,seed,step
It was a desperate act.,act,act,It was an act desperate., desperate act, act desperate,desperate,False,-15.198015213012695,-19.968647003173828,4.770631790161133,14067712,EleutherAI/pythia-14m,step29000,seed7,7,29000
It was a humane act.,act,act,It was an act humane., humane act, act humane,humane,False,-20.043212890625,-18.986515045166016,-1.0566978454589844,14067712,EleutherAI/pythia-14m,step29000,seed7,7,29000
It was a magic act.,act,act,It was an act magic., magic act, act magic,magic,False,-17.37869644165039,-18.973876953125,1.5951805114746094,14067712,EleutherAI/pythia-14m,step29000,seed7,7,29000
He had a universal appeal.,appeal,appeal,He had an appeal universal., universal appeal, appeal universal,universal,False,-19.85500717163086,-24.924175262451172,5.0691680908203125,14067712,EleutherAI/pythia-14m,step29000,seed7,7,29000
He had an undefinable appeal.,appeal,appeal,He had an appeal undefinable., undefinable appeal, appeal undefinable,undefinable,False,-22.17589569091797,-31.60219955444336,9.42630386352539,14067712,EleutherAI/pythia-14m,step29000,seed7,7,29000
He had a legal appeal.,appeal,appeal,He had an appeal legal., legal appeal, appeal legal,legal,False,-13.76289176940918,-18.262548446655273,4.499656677246094,14067712,EleutherAI/pythia-14m,step29000,seed7,7,29000
It was a tense atmosphere.,atmosphere,atmosphere,It was an atmosphere tense., tense atmosphere, atmosphere tense,tense,False,-18.00739288330078,-23.217912673950195,5.210519790649414,14067712,EleutherAI/pythia-14m,step29000,seed7,7,29000
It was a hostile atmosphere.,atmosphere,atmosphere,It was an atmosphere hostile., hostile atmosphere, atmosphere hostile,hostile,False,-16.002344131469727,-19.54294204711914,3.540597915649414,14067712,EleutherAI/pythia-14m,step29000,seed7,7,29000
It was a gaseous atmosphere.,atmosphere,atmosphere,It was an atmosphere gaseous., gaseous atmosphere, atmosphere gaseous,gaseous,False,-18.111373901367188,-24.381786346435547,6.270412445068359,14067712,EleutherAI/pythia-14m,step29000,seed7,7,29000
It was a gold band.,band,band,It was a band gold., gold band, band gold,gold,True,-16.055776596069336,-18.121990203857422,2.066213607788086,14067712,EleutherAI/pythia-14m,step29000,seed7,7,29000
It was a rubber band.,band,band,It was a band rubber., rubber band, band rubber,rubber,True,-14.907901763916016,-20.651775360107422,5.743873596191406,14067712,EleutherAI/pythia-14m,step29000,seed7,7,29000
It was a jazz band.,band,band,It was a band jazz., jazz band, band jazz,jazz,True,-13.623540878295898,-17.07428741455078,3.450746536254883,14067712,EleutherAI/pythia-14m,step29000,seed7,7,29000
There was a police barrier.,barrier,barrier,There was a barrier police., police barrier, barrier police,police,True,-18.2260799407959,-19.56110191345215,1.33502197265625,14067712,EleutherAI/pythia-14m,step29000,seed7,7,29000
There was a concrete barrier.,barrier,barrier,There was a barrier concrete., concrete barrier, barrier concrete,concrete,False,-14.780887603759766,-19.11902618408203,4.338138580322266,14067712,EleutherAI/pythia-14m,step29000,seed7,7,29000
There was a language barrier.,barrier,barrier,There was a barrier language., language barrier, barrier language,language,True,-19.367145538330078,-21.702392578125,2.335247039794922,14067712,EleutherAI/pythia-14m,step29000,seed7,7,29000
He saw a furry bat.,bat,bat,He saw a bat furry., furry bat, bat furry,furry,False,-21.497676849365234,-24.196544647216797,2.6988677978515625,14067712,EleutherAI/pythia-14m,step29000,seed7,7,29000
He saw a fruit bat.,bat,bat,He saw a bat fruit., fruit bat, bat fruit,fruit,True,-18.238754272460938,-21.761844635009766,3.523090362548828,14067712,EleutherAI/pythia-14m,step29000,seed7,7,29000
He saw a wooden bat.,bat,bat,He saw a bat wooden., wooden bat, bat wooden,wooden,False,-15.196590423583984,-23.068374633789062,7.871784210205078,14067712,EleutherAI/pythia-14m,step29000,seed7,7,29000
He saw the laser beam.,beam,beam,He saw the beam laser., laser beam, beam laser,laser,True,-13.43023681640625,-18.249174118041992,4.818937301635742,14067712,EleutherAI/pythia-14m,step29000,seed7,7,29000
He saw the bright beam.,beam,beam,He saw the beam bright., bright beam, beam bright,bright,False,-18.013671875,-20.517292022705078,2.503620147705078,14067712,EleutherAI/pythia-14m,step29000,seed7,7,29000
He saw the wood beam.,beam,beam,He saw the beam wood., wood beam, beam wood,wood,True,-17.455080032348633,-22.13158416748047,4.676504135131836,14067712,EleutherAI/pythia-14m,step29000,seed7,7,29000
She had a toy block.,block,block,She had a block toy., toy block, block toy,toy,True,-17.847375869750977,-21.545291900634766,3.697916030883789,14067712,EleutherAI/pythia-14m,step29000,seed7,7,29000
She had a wooden block.,block,block,She had a block wooden., wooden block, block wooden,wooden,False,-14.995071411132812,-22.94582748413086,7.950756072998047,14067712,EleutherAI/pythia-14m,step29000,seed7,7,29000
She had a mental block.,block,block,She had a block mental., mental block, block mental,mental,False,-17.463790893554688,-23.94112777709961,6.477336883544922,14067712,EleutherAI/pythia-14m,step29000,seed7,7,29000
He has coagulated blood.,blood,blood,He has blood coagulated., coagulated blood, blood coagulated,coagulated,True,-28.438945770263672,-28.968608856201172,0.5296630859375,14067712,EleutherAI/pythia-14m,step29000,seed7,7,29000
He has thin blood.,blood,blood,He has blood thin., thin blood, blood thin,thin,False,-18.19765853881836,-21.26618194580078,3.068523406982422,14067712,EleutherAI/pythia-14m,step29000,seed7,7,29000
He has noble blood.,blood,blood,He has blood noble., noble blood, blood noble,noble,False,-21.827112197875977,-24.610862731933594,2.783750534057617,14067712,EleutherAI/pythia-14m,step29000,seed7,7,29000
It was the ironing board.,board,board,It was the board ironing., ironing board, board ironing,ironing,False,-20.9007511138916,-20.849109649658203,-0.05164146423339844,14067712,EleutherAI/pythia-14m,step29000,seed7,7,29000
It was the wooden board.,board,board,It was the board wooden., wooden board, board wooden,wooden,False,-16.164901733398438,-22.427663803100586,6.262762069702148,14067712,EleutherAI/pythia-14m,step29000,seed7,7,29000
It was the executive board.,board,board,It was the board executive., executive board, board executive,executive,True,-15.124970436096191,-16.939559936523438,1.814589500427246,14067712,EleutherAI/pythia-14m,step29000,seed7,7,29000
He had a best-selling book.,book,book,He had a book best-selling., best-selling book, book best-selling,best-selling,False,-15.517004013061523,-20.43804931640625,4.921045303344727,14067712,EleutherAI/pythia-14m,step29000,seed7,7,29000
He had a popular book.,book,book,He had a book popular., popular book, book popular,popular,False,-15.855344772338867,-20.256380081176758,4.401035308837891,14067712,EleutherAI/pythia-14m,step29000,seed7,7,29000
He had a heavy book.,book,book,He had a book heavy., heavy book, book heavy,heavy,False,-15.351058959960938,-18.931175231933594,3.5801162719726562,14067712,EleutherAI/pythia-14m,step29000,seed7,7,29000
They ate a pancake breakfast.,breakfast,breakfast,They ate a breakfast pancake., pancake breakfast, breakfast pancake,pancake,True,-12.089410781860352,-13.914199829101562,1.824789047241211,14067712,EleutherAI/pythia-14m,step29000,seed7,7,29000
They ate a nutritious breakfast.,breakfast,breakfast,They ate a breakfast nutritious., nutritious breakfast, breakfast nutritious,nutritious,False,-22.7498779296875,-27.524133682250977,4.774255752563477,14067712,EleutherAI/pythia-14m,step29000,seed7,7,29000
They ate a family breakfast.,breakfast,breakfast,They ate a breakfast family., family breakfast, breakfast family,family,True,-10.273085594177246,-13.196502685546875,2.923417091369629,14067712,EleutherAI/pythia-14m,step29000,seed7,7,29000
It was a red cape.,cape,cape,It was a cape red., red cape, cape red,red,False,-16.6763916015625,-23.654346466064453,6.977954864501953,14067712,EleutherAI/pythia-14m,step29000,seed7,7,29000
It was a flowing cape.,cape,cape,It was a cape flowing., flowing cape, cape flowing,flowing,False,-24.48072624206543,-25.215171813964844,0.7344455718994141,14067712,EleutherAI/pythia-14m,step29000,seed7,7,29000
It was a rocky cape.,cape,cape,It was a cape rocky., rocky cape, cape rocky,rocky,False,-20.175430297851562,-28.443828582763672,8.26839828491211,14067712,EleutherAI/pythia-14m,step29000,seed7,7,29000
It was a beer case.,case,case,It was a case beer., beer case, case beer,beer,True,-19.966495513916016,-20.263275146484375,0.2967796325683594,14067712,EleutherAI/pythia-14m,step29000,seed7,7,29000
It was a display case.,case,case,It was a case display., display case, case display,display,True,-15.058036804199219,-21.114620208740234,6.056583404541016,14067712,EleutherAI/pythia-14m,step29000,seed7,7,29000
It was a divorce case.,case,case,It was a case divorce., divorce case, case divorce,divorce,True,-14.627386093139648,-18.74242401123047,4.11503791809082,14067712,EleutherAI/pythia-14m,step29000,seed7,7,29000
It was a worthy cause.,cause,cause,It was a cause worthy., worthy cause, cause worthy,worthy,False,-15.471700668334961,-18.486114501953125,3.014413833618164,14067712,EleutherAI/pythia-14m,step29000,seed7,7,29000
It was a political cause.,cause,cause,It was a cause political., political cause, cause political,political,False,-14.609027862548828,-21.834699630737305,7.225671768188477,14067712,EleutherAI/pythia-14m,step29000,seed7,7,29000
It was a main cause.,cause,cause,It was a cause main., main cause, cause main,main,False,-12.827856063842773,-21.959632873535156,9.131776809692383,14067712,EleutherAI/pythia-14m,step29000,seed7,7,29000
It was a skin cell.,cell,cell,It was a cell skin., skin cell, cell skin,skin,True,-16.942405700683594,-17.072452545166016,0.13004684448242188,14067712,EleutherAI/pythia-14m,step29000,seed7,7,29000
It was a brain cell.,cell,cell,It was a cell brain., brain cell, cell brain,brain,True,-13.58064079284668,-14.200495719909668,0.6198549270629883,14067712,EleutherAI/pythia-14m,step29000,seed7,7,29000
It was a prison cell.,cell,cell,It was a cell prison., prison cell, cell prison,prison,True,-15.87164306640625,-16.708877563476562,0.8372344970703125,14067712,EleutherAI/pythia-14m,step29000,seed7,7,29000
She had a devilish charm.,charm,charm,She had a charm devilish., devilish charm, charm devilish,devilish,False,-18.950889587402344,-26.118148803710938,7.167259216308594,14067712,EleutherAI/pythia-14m,step29000,seed7,7,29000
She had a natural charm.,charm,charm,She had a charm natural., natural charm, charm natural,natural,False,-15.25709342956543,-19.408727645874023,4.151634216308594,14067712,EleutherAI/pythia-14m,step29000,seed7,7,29000
She had a gold charm.,charm,charm,She had a charm gold., gold charm, charm gold,gold,True,-16.774986267089844,-19.727197647094727,2.952211380004883,14067712,EleutherAI/pythia-14m,step29000,seed7,7,29000
They liked the juicy chicken.,chicken,chicken,They liked the chicken juicy., juicy chicken, chicken juicy,juicy,False,-18.841537475585938,-20.636396408081055,1.7948589324951172,14067712,EleutherAI/pythia-14m,step29000,seed7,7,29000
They liked the roasted chicken.,chicken,chicken,They liked the chicken roasted., roasted chicken, chicken roasted,roasted,False,-15.342802047729492,-18.026161193847656,2.683359146118164,14067712,EleutherAI/pythia-14m,step29000,seed7,7,29000
They liked the clucking chicken.,chicken,chicken,They liked the chicken clucking., clucking chicken, chicken clucking,clucking,True,-23.88323974609375,-22.975679397583008,-0.9075603485107422,14067712,EleutherAI/pythia-14m,step29000,seed7,7,29000
It was a perceptive class.,class,class,It was a class perceptive., perceptive class, class perceptive,perceptive,False,-18.612504959106445,-24.5847225189209,5.972217559814453,14067712,EleutherAI/pythia-14m,step29000,seed7,7,29000
It was a misbehaving class.,class,class,It was a class misbehaving., misbehaving class, class misbehaving,misbehaving,False,-24.26995086669922,-26.63155746459961,2.3616065979003906,14067712,EleutherAI/pythia-14m,step29000,seed7,7,29000
It was a boring class.,class,class,It was a class boring., boring class, class boring,boring,False,-15.92526626586914,-18.474456787109375,2.5491905212402344,14067712,EleutherAI/pythia-14m,step29000,seed7,7,29000
It was a film clip.,clip,clip,It was a clip film., film clip, clip film,film,True,-15.553665161132812,-18.374652862548828,2.8209877014160156,14067712,EleutherAI/pythia-14m,step29000,seed7,7,29000
It was a video clip.,clip,clip,It was a clip video., video clip, clip video,video,True,-12.395387649536133,-17.894506454467773,5.499118804931641,14067712,EleutherAI/pythia-14m,step29000,seed7,7,29000
It was a hair clip.,clip,clip,It was a clip hair., hair clip, clip hair,hair,True,-16.932220458984375,-20.193496704101562,3.2612762451171875,14067712,EleutherAI/pythia-14m,step29000,seed7,7,29000
It was an icy cold.,cold,cold,It was an cold icy., icy cold, cold icy,icy,False,-11.680976867675781,-19.518327713012695,7.837350845336914,14067712,EleutherAI/pythia-14m,step29000,seed7,7,29000
It was a freezing cold.,cold,cold,It was a cold freezing., freezing cold, cold freezing,freezing,False,-15.69502067565918,-15.40591049194336,-0.2891101837158203,14067712,EleutherAI/pythia-14m,step29000,seed7,7,29000
It was a chest cold.,cold,cold,It was a cold chest., chest cold, cold chest,chest,False,-17.449142456054688,-15.623560905456543,-1.8255815505981445,14067712,EleutherAI/pythia-14m,step29000,seed7,7,29000
It was a gossip column.,column,column,It was a column gossip., gossip column, column gossip,gossip,True,-18.94564437866211,-23.799251556396484,4.853607177734375,14067712,EleutherAI/pythia-14m,step29000,seed7,7,29000
It was a sports column.,column,column,It was a column sports., sports column, column sports,sports,True,-20.451770782470703,-23.0372314453125,2.585460662841797,14067712,EleutherAI/pythia-14m,step29000,seed7,7,29000
It was a concrete column.,column,column,It was a column concrete., concrete column, column concrete,concrete,False,-17.029743194580078,-19.070819854736328,2.04107666015625,14067712,EleutherAI/pythia-14m,step29000,seed7,7,29000
He liked the investment company.,company,company,He liked the company investment., investment company, company investment,investment,True,-15.512757301330566,-17.58477210998535,2.072014808654785,14067712,EleutherAI/pythia-14m,step29000,seed7,7,29000
He liked the pharmaceutical company.,company,company,He liked the company pharmaceutical., pharmaceutical company, company pharmaceutical,pharmaceutical,False,-15.971790313720703,-20.14963722229004,4.177846908569336,14067712,EleutherAI/pythia-14m,step29000,seed7,7,29000
He liked the pleasant company.,company,company,He liked the company pleasant., pleasant company, company pleasant,pleasant,False,-17.90215301513672,-19.29629135131836,1.3941383361816406,14067712,EleutherAI/pythia-14m,step29000,seed7,7,29000
It was a waffle cone.,cone,cone,It was a cone waffle., waffle cone, cone waffle,waffle,True,-27.76349639892578,-29.71531867980957,1.951822280883789,14067712,EleutherAI/pythia-14m,step29000,seed7,7,29000
It was a sugar cone.,cone,cone,It was a cone sugar., sugar cone, cone sugar,sugar,True,-20.201995849609375,-24.13167953491211,3.9296836853027344,14067712,EleutherAI/pythia-14m,step29000,seed7,7,29000
It was an orange cone.,cone,cone,It was an cone orange., orange cone, cone orange,orange,False,-14.353004455566406,-24.073476791381836,9.72047233581543,14067712,EleutherAI/pythia-14m,step29000,seed7,7,29000
He made a charitable contribution.,contribution,contribution,He made a contribution charitable., charitable contribution, contribution charitable,charitable,False,-15.041160583496094,-25.098186492919922,10.057025909423828,14067712,EleutherAI/pythia-14m,step29000,seed7,7,29000
He made a voluntary contribution.,contribution,contribution,He made a contribution voluntary., voluntary contribution, contribution voluntary,voluntary,False,-16.8251953125,-25.43727684020996,8.612081527709961,14067712,EleutherAI/pythia-14m,step29000,seed7,7,29000
He made a scholarly contribution.,contribution,contribution,He made a contribution scholarly., scholarly contribution, contribution scholarly,scholarly,False,-17.312618255615234,-24.89872932434082,7.586111068725586,14067712,EleutherAI/pythia-14m,step29000,seed7,7,29000
That was the noble count.,count,count,That was the count noble., noble count, count noble,noble,False,-18.05560302734375,-24.72146987915039,6.665866851806641,14067712,EleutherAI/pythia-14m,step29000,seed7,7,29000
That was the vengeful count.,count,count,That was the count vengeful., vengeful count, count vengeful,vengeful,False,-22.28168487548828,-28.001001358032227,5.719316482543945,14067712,EleutherAI/pythia-14m,step29000,seed7,7,29000
That was the final count.,count,count,That was the count final., final count, count final,final,False,-13.11713981628418,-20.498647689819336,7.381507873535156,14067712,EleutherAI/pythia-14m,step29000,seed7,7,29000
It was an introductory course.,course,course,It was an course introductory., introductory course, course introductory,introductory,False,-12.669134140014648,-22.44021224975586,9.771078109741211,14067712,EleutherAI/pythia-14m,step29000,seed7,7,29000
It was a pass-fail course.,course,course,It was a course pass-fail., pass-fail course, course pass-fail,pass-fail,False,-28.18387222290039,-31.9539794921875,3.7701072692871094,14067712,EleutherAI/pythia-14m,step29000,seed7,7,29000
It was a charted course.,course,course,It was a course charted., charted course, course charted,charted,False,-22.749555587768555,-25.275856018066406,2.5263004302978516,14067712,EleutherAI/pythia-14m,step29000,seed7,7,29000
It was a dinner date.,date,date,It was a date dinner., dinner date, date dinner,dinner,True,-19.155994415283203,-18.971923828125,-0.18407058715820312,14067712,EleutherAI/pythia-14m,step29000,seed7,7,29000
It was a blind date.,date,date,It was a date blind., blind date, date blind,blind,False,-19.301124572753906,-21.329517364501953,2.028392791748047,14067712,EleutherAI/pythia-14m,step29000,seed7,7,29000
It was an expiration date.,date,date,It was an date expiration., expiration date, date expiration,expiration,True,-13.783354759216309,-26.271900177001953,12.488545417785645,14067712,EleutherAI/pythia-14m,step29000,seed7,7,29000
It was about forty degrees.,degree,degrees,It was about degrees forty., forty degrees, degrees forty,forty,True,-10.746055603027344,-21.660083770751953,10.91402816772461,14067712,EleutherAI/pythia-14m,step29000,seed7,7,29000
It was about fifty degrees.,degree,degrees,It was about degrees fifty., fifty degrees, degrees fifty,fifty,True,-11.129507064819336,-20.72747802734375,9.597970962524414,14067712,EleutherAI/pythia-14m,step29000,seed7,7,29000
It was about associate degrees.,degree,degrees,It was about degrees associate., associate degrees, degrees associate,associate,False,-23.134260177612305,-26.310569763183594,3.176309585571289,14067712,EleutherAI/pythia-14m,step29000,seed7,7,29000
They liked the floral design.,design,design,They liked the design floral., floral design, design floral,floral,False,-16.09634780883789,-22.694988250732422,6.598640441894531,14067712,EleutherAI/pythia-14m,step29000,seed7,7,29000
They liked the geometric design.,design,design,They liked the design geometric., geometric design, design geometric,geometric,False,-17.22347640991211,-22.013408660888672,4.7899322509765625,14067712,EleutherAI/pythia-14m,step29000,seed7,7,29000
They liked the product design.,design,design,They liked the design product., product design, design product,product,True,-14.688061714172363,-16.929901123046875,2.2418394088745117,14067712,EleutherAI/pythia-14m,step29000,seed7,7,29000
They liked the turkey dinner.,dinner,dinner,They liked the dinner turkey., turkey dinner, dinner turkey,turkey,True,-17.234481811523438,-20.617023468017578,3.3825416564941406,14067712,EleutherAI/pythia-14m,step29000,seed7,7,29000
They liked the light dinner.,dinner,dinner,They liked the dinner light., light dinner, dinner light,light,False,-18.90957260131836,-20.965595245361328,2.0560226440429688,14067712,EleutherAI/pythia-14m,step29000,seed7,7,29000
They liked the formal dinner.,dinner,dinner,They liked the dinner formal., formal dinner, dinner formal,formal,False,-17.442550659179688,-21.927997589111328,4.485446929931641,14067712,EleutherAI/pythia-14m,step29000,seed7,7,29000
He had a recurring dream.,dream,dream,He had a dream recurring., recurring dream, dream recurring,recurring,False,-14.949169158935547,-21.863510131835938,6.914340972900391,14067712,EleutherAI/pythia-14m,step29000,seed7,7,29000
He had a bad dream.,dream,dream,He had a dream bad., bad dream, dream bad,bad,False,-11.747758865356445,-17.15733528137207,5.409576416015625,14067712,EleutherAI/pythia-14m,step29000,seed7,7,29000
He had a childhood dream.,dream,dream,He had a dream childhood., childhood dream, dream childhood,childhood,True,-12.110834121704102,-18.386335372924805,6.275501251220703,14067712,EleutherAI/pythia-14m,step29000,seed7,7,29000
It was a grueling drill.,drill,drill,It was a drill grueling., grueling drill, drill grueling,grueling,False,-22.200551986694336,-26.272737503051758,4.072185516357422,14067712,EleutherAI/pythia-14m,step29000,seed7,7,29000
It was a challenging drill.,drill,drill,It was a drill challenging., challenging drill, drill challenging,challenging,False,-19.90450668334961,-21.75286102294922,1.8483543395996094,14067712,EleutherAI/pythia-14m,step29000,seed7,7,29000
It was an electric drill.,drill,drill,It was an drill electric., electric drill, drill electric,electric,False,-15.387897491455078,-23.926057815551758,8.53816032409668,14067712,EleutherAI/pythia-14m,step29000,seed7,7,29000
It was a multiple-choice examination.,examination,examination,It was an examination multiple-choice., multiple-choice examination, examination multiple-choice,multiple-choice,False,-26.004119873046875,-27.743101119995117,1.7389812469482422,14067712,EleutherAI/pythia-14m,step29000,seed7,7,29000
It was a difficult examination.,examination,examination,It was an examination difficult., difficult examination, examination difficult,difficult,False,-16.073001861572266,-17.037429809570312,0.9644279479980469,14067712,EleutherAI/pythia-14m,step29000,seed7,7,29000
It was a prostate examination.,examination,examination,It was an examination prostate., prostate examination, examination prostate,prostate,True,-21.555253982543945,-21.945356369018555,0.3901023864746094,14067712,EleutherAI/pythia-14m,step29000,seed7,7,29000
They had an electric fan.,fan,fan,They had an fan electric., electric fan, fan electric,electric,False,-13.534013748168945,-24.899463653564453,11.365449905395508,14067712,EleutherAI/pythia-14m,step29000,seed7,7,29000
They had a ceiling fan.,fan,fan,They had a fan ceiling., ceiling fan, fan ceiling,ceiling,True,-18.280029296875,-23.55305290222168,5.27302360534668,14067712,EleutherAI/pythia-14m,step29000,seed7,7,29000
They had a zealous fan.,fan,fan,They had a fan zealous., zealous fan, fan zealous,zealous,False,-24.471803665161133,-29.446029663085938,4.974225997924805,14067712,EleutherAI/pythia-14m,step29000,seed7,7,29000
She had a text file.,file,file,She had a file text., text file, file text,text,True,-15.408162117004395,-20.38443946838379,4.9762773513793945,14067712,EleutherAI/pythia-14m,step29000,seed7,7,29000
She had a data file.,file,file,She had a file data., data file, file data,data,True,-18.364112854003906,-20.48196029663086,2.117847442626953,14067712,EleutherAI/pythia-14m,step29000,seed7,7,29000
She had a nail file.,file,file,She had a file nail., nail file, file nail,nail,True,-21.970661163330078,-23.120361328125,1.1497001647949219,14067712,EleutherAI/pythia-14m,step29000,seed7,7,29000
It was an action film.,film,film,It was an film action., action film, film action,action,True,-15.592987060546875,-17.635971069335938,2.0429840087890625,14067712,EleutherAI/pythia-14m,step29000,seed7,7,29000
It was a censored film.,film,film,It was a film censored., censored film, film censored,censored,False,-20.546409606933594,-21.783411026000977,1.2370014190673828,14067712,EleutherAI/pythia-14m,step29000,seed7,7,29000
It was a transparent film.,film,film,It was a film transparent., transparent film, film transparent,transparent,False,-16.58025550842285,-21.523164749145508,4.942909240722656,14067712,EleutherAI/pythia-14m,step29000,seed7,7,29000
It was a charitable foundation.,foundation,foundation,It was a foundation charitable., charitable foundation, foundation charitable,charitable,False,-15.372308731079102,-21.413253784179688,6.040945053100586,14067712,EleutherAI/pythia-14m,step29000,seed7,7,29000
It was an educational foundation.,foundation,foundation,It was an foundation educational., educational foundation, foundation educational,educational,False,-15.813843727111816,-25.093212127685547,9.27936840057373,14067712,EleutherAI/pythia-14m,step29000,seed7,7,29000
It was a wooden foundation.,foundation,foundation,It was a foundation wooden., wooden foundation, foundation wooden,wooden,False,-15.089889526367188,-23.211471557617188,8.12158203125,14067712,EleutherAI/pythia-14m,step29000,seed7,7,29000
It was a mathematical function.,function,function,It was a function mathematical., mathematical function, function mathematical,mathematical,False,-15.701811790466309,-20.294267654418945,4.592455863952637,14067712,EleutherAI/pythia-14m,step29000,seed7,7,29000
It was a linear function.,function,function,It was a function linear., linear function, function linear,linear,False,-16.550933837890625,-22.19155502319336,5.640621185302734,14067712,EleutherAI/pythia-14m,step29000,seed7,7,29000
