sentence,word,string,reversed_sentence,mod_np,reversed_mod,disambiguating_word,non_adjective,original_logprob,reversed_logprob,ratio,n_params,mpath,revision,seed_name,seed,step
It was a fall term.,term,term,It was a term fall., fall term, term fall,fall,True,-16.454917907714844,-17.988428115844727,1.5335102081298828,14067712,EleutherAI/pythia-14m,step62000,seed4,4,62000
It was a legal term.,term,term,It was a term legal., legal term, term legal,legal,False,-13.282194137573242,-18.066110610961914,4.783916473388672,14067712,EleutherAI/pythia-14m,step62000,seed4,4,62000
It was a clock tick.,tick,tick,It was a tick clock., clock tick, tick clock,clock,True,-14.945240020751953,-18.16680908203125,3.221569061279297,14067712,EleutherAI/pythia-14m,step62000,seed4,4,62000
It was an audible tick.,tick,tick,It was an tick audible., audible tick, tick audible,audible,False,-18.952045440673828,-25.316505432128906,6.364459991455078,14067712,EleutherAI/pythia-14m,step62000,seed4,4,62000
It was a parasitic tick.,tick,tick,It was a tick parasitic., parasitic tick, tick parasitic,parasitic,False,-21.225955963134766,-23.063011169433594,1.8370552062988281,14067712,EleutherAI/pythia-14m,step62000,seed4,4,62000
It was a generous tip.,tip,tip,It was a tip generous., generous tip, tip generous,generous,False,-18.852733612060547,-24.85866928100586,6.0059356689453125,14067712,EleutherAI/pythia-14m,step62000,seed4,4,62000
It was a stingy tip.,tip,tip,It was a tip stingy., stingy tip, tip stingy,stingy,False,-21.091079711914062,-27.759727478027344,6.668647766113281,14067712,EleutherAI/pythia-14m,step62000,seed4,4,62000
It was a pencil tip.,tip,tip,It was a tip pencil., pencil tip, tip pencil,pencil,True,-16.228187561035156,-19.862682342529297,3.6344947814941406,14067712,EleutherAI/pythia-14m,step62000,seed4,4,62000
She liked the essay title.,title,title,She liked the title essay., essay title, title essay,essay,True,-18.982765197753906,-16.107284545898438,-2.8754806518554688,14067712,EleutherAI/pythia-14m,step62000,seed4,4,62000
She liked the poem title.,title,title,She liked the title poem., poem title, title poem,poem,True,-19.29230499267578,-17.178993225097656,-2.113311767578125,14067712,EleutherAI/pythia-14m,step62000,seed4,4,62000
She liked the academic title.,title,title,She liked the title academic., academic title, title academic,academic,False,-17.80030059814453,-19.148643493652344,1.3483428955078125,14067712,EleutherAI/pythia-14m,step62000,seed4,4,62000
It was a costly toll.,toll,toll,It was a toll costly., costly toll, toll costly,costly,False,-20.39708137512207,-26.09656524658203,5.699483871459961,14067712,EleutherAI/pythia-14m,step62000,seed4,4,62000
It was a road toll.,toll,toll,It was a toll road., road toll, toll road,road,True,-18.187389373779297,-19.139652252197266,0.9522628784179688,14067712,EleutherAI/pythia-14m,step62000,seed4,4,62000
It was a loud toll.,toll,toll,It was a toll loud., loud toll, toll loud,loud,False,-22.49909210205078,-22.737686157226562,0.23859405517578125,14067712,EleutherAI/pythia-14m,step62000,seed4,4,62000
She saw the train tracks.,track,tracks,She saw the tracks train., train tracks, tracks train,train,True,-14.058131217956543,-18.89089584350586,4.832764625549316,14067712,EleutherAI/pythia-14m,step62000,seed4,4,62000
She saw the trolley tracks.,track,tracks,She saw the tracks trolley., trolley tracks, tracks trolley,trolley,True,-22.085634231567383,-25.63941192626953,3.5537776947021484,14067712,EleutherAI/pythia-14m,step62000,seed4,4,62000
She saw the moose tracks.,track,tracks,She saw the tracks moose., moose tracks, tracks moose,moose,False,-26.577178955078125,-26.400737762451172,-0.17644119262695312,14067712,EleutherAI/pythia-14m,step62000,seed4,4,62000
It was five yards.,yard,yards,It was yards five., five yards, yards five,five,True,-16.31218719482422,-21.821292877197266,5.509105682373047,14067712,EleutherAI/pythia-14m,step62000,seed4,4,62000
It was ten yards.,yard,yards,It was yards ten., ten yards, yards ten,ten,True,-14.98025131225586,-22.523696899414062,7.543445587158203,14067712,EleutherAI/pythia-14m,step62000,seed4,4,62000
They were big yards.,yard,yards,They were yards big., big yards, yards big,big,False,-19.11994743347168,-19.712743759155273,0.5927963256835938,14067712,EleutherAI/pythia-14m,step62000,seed4,4,62000
It was a comedic act.,act,act,It was an act comedic., comedic act, act comedic,comedic,False,-20.756723403930664,-23.486141204833984,2.7294178009033203,14067712,EleutherAI/pythia-14m,step62000,seed4,4,62000
He had a pending appeal.,appeal,appeal,He had an appeal pending., pending appeal, appeal pending,pending,False,-16.518028259277344,-13.016785621643066,-3.5012426376342773,14067712,EleutherAI/pythia-14m,step62000,seed4,4,62000
It was a polluted atmosphere.,atmosphere,atmosphere,It was an atmosphere polluted., polluted atmosphere, atmosphere polluted,polluted,False,-22.94963836669922,-24.66379165649414,1.7141532897949219,14067712,EleutherAI/pythia-14m,step62000,seed4,4,62000
It was a country band.,band,band,It was a band country., country band, band country,country,True,-16.972097396850586,-20.718727111816406,3.7466297149658203,14067712,EleutherAI/pythia-14m,step62000,seed4,4,62000
There was a religious barrier.,barrier,barrier,There was a barrier religious., religious barrier, barrier religious,religious,False,-19.8984375,-23.928340911865234,4.029903411865234,14067712,EleutherAI/pythia-14m,step62000,seed4,4,62000
He saw a baseball bat.,bat,bat,He saw a bat baseball., baseball bat, bat baseball,baseball,True,-8.699542999267578,-14.966947555541992,6.267404556274414,14067712,EleutherAI/pythia-14m,step62000,seed4,4,62000
He saw the balance beam.,beam,beam,He saw the beam balance., balance beam, beam balance,balance,True,-18.244449615478516,-20.394487380981445,2.1500377655029297,14067712,EleutherAI/pythia-14m,step62000,seed4,4,62000
She had a writer's block.,block,block,She had a block writer's., writer's block, block writer's,writer,True,-22.32733154296875,-23.453533172607422,1.1262016296386719,14067712,EleutherAI/pythia-14m,step62000,seed4,4,62000
He has royal blood.,blood,blood,He has blood royal., royal blood, blood royal,royal,False,-19.78635025024414,-28.45256805419922,8.666217803955078,14067712,EleutherAI/pythia-14m,step62000,seed4,4,62000
It was the school board.,board,board,It was the board school., school board, board school,school,True,-11.390945434570312,-16.601716995239258,5.210771560668945,14067712,EleutherAI/pythia-14m,step62000,seed4,4,62000
He had a leather-bound book.,book,book,He had a book leather-bound., leather-bound book, book leather-bound,leather-bound,False,-25.07280731201172,-28.728870391845703,3.6560630798339844,14067712,EleutherAI/pythia-14m,step62000,seed4,4,62000
They ate a lonely breakfast.,breakfast,breakfast,They ate a breakfast lonely., lonely breakfast, breakfast lonely,lonely,False,-16.241151809692383,-22.4196834564209,6.178531646728516,14067712,EleutherAI/pythia-14m,step62000,seed4,4,62000
It was an island cape.,cape,cape,It was an cape island., island cape, cape island,island,True,-21.196855545043945,-21.80902099609375,0.6121654510498047,14067712,EleutherAI/pythia-14m,step62000,seed4,4,62000
It was a criminal case.,case,case,It was a case criminal., criminal case, case criminal,criminal,False,-11.996295928955078,-17.43085289001465,5.43455696105957,14067712,EleutherAI/pythia-14m,step62000,seed4,4,62000
It was a primary cause.,cause,cause,It was a cause primary., primary cause, cause primary,primary,False,-13.276893615722656,-22.334442138671875,9.057548522949219,14067712,EleutherAI/pythia-14m,step62000,seed4,4,62000
It was a jail cell.,cell,cell,It was a cell jail., jail cell, cell jail,jail,True,-13.66043472290039,-20.620737075805664,6.960302352905273,14067712,EleutherAI/pythia-14m,step62000,seed4,4,62000
She had a good-luck charm.,charm,charm,She had a charm good-luck., good-luck charm, charm good-luck,good-luck,False,-30.27484130859375,-32.098514556884766,1.8236732482910156,14067712,EleutherAI/pythia-14m,step62000,seed4,4,62000
They liked the pet chicken.,chicken,chicken,They liked the chicken pet., pet chicken, chicken pet,pet,True,-18.52180290222168,-16.117069244384766,-2.404733657836914,14067712,EleutherAI/pythia-14m,step62000,seed4,4,62000
It was a stimulating class.,class,class,It was a class stimulating., stimulating class, class stimulating,stimulating,False,-17.76569175720215,-21.128795623779297,3.3631038665771484,14067712,EleutherAI/pythia-14m,step62000,seed4,4,62000
It was a metal clip.,clip,clip,It was a clip metal., metal clip, clip metal,metal,True,-18.73159408569336,-21.48419952392578,2.752605438232422,14067712,EleutherAI/pythia-14m,step62000,seed4,4,62000
It was a common cold.,cold,cold,It was a cold common., common cold, cold common,common,False,-17.796485900878906,-18.745994567871094,0.9495086669921875,14067712,EleutherAI/pythia-14m,step62000,seed4,4,62000
It was a marble column.,column,column,It was a column marble., marble column, column marble,marble,True,-18.867477416992188,-20.638912200927734,1.7714347839355469,14067712,EleutherAI/pythia-14m,step62000,seed4,4,62000
He liked the polite company.,company,company,He liked the company polite., polite company, company polite,polite,False,-18.219226837158203,-21.56574249267578,3.346515655517578,14067712,EleutherAI/pythia-14m,step62000,seed4,4,62000
It was a traffic cone.,cone,cone,It was a cone traffic., traffic cone, cone traffic,traffic,True,-18.231260299682617,-21.902177810668945,3.670917510986328,14067712,EleutherAI/pythia-14m,step62000,seed4,4,62000
He made a well-written contribution.,contribution,contribution,He made a contribution well-written., well-written contribution, contribution well-written,well-written,False,-24.329063415527344,-31.910701751708984,7.581638336181641,14067712,EleutherAI/pythia-14m,step62000,seed4,4,62000
That was the correct count.,count,count,That was the count correct., correct count, count correct,correct,False,-14.994014739990234,-17.835460662841797,2.8414459228515625,14067712,EleutherAI/pythia-14m,step62000,seed4,4,62000
It was a collision course.,course,course,It was a course collision., collision course, course collision,collision,True,-11.793741226196289,-21.752185821533203,9.958444595336914,14067712,EleutherAI/pythia-14m,step62000,seed4,4,62000
It was a historical date.,date,date,It was a date historical., historical date, date historical,historical,False,-15.41092300415039,-19.041841506958008,3.630918502807617,14067712,EleutherAI/pythia-14m,step62000,seed4,4,62000
It was about college degrees.,degree,degrees,It was about degrees college., college degrees, degrees college,college,True,-16.597259521484375,-21.353919982910156,4.756660461425781,14067712,EleutherAI/pythia-14m,step62000,seed4,4,62000
They liked the architectural design.,design,design,They liked the design architectural., architectural design, design architectural,architectural,False,-17.092731475830078,-22.15135955810547,5.058628082275391,14067712,EleutherAI/pythia-14m,step62000,seed4,4,62000
They liked the anniversary dinner.,dinner,dinner,They liked the dinner anniversary., anniversary dinner, dinner anniversary,anniversary,True,-22.87543487548828,-21.079242706298828,-1.7961921691894531,14067712,EleutherAI/pythia-14m,step62000,seed4,4,62000
He had a career dream.,dream,dream,He had a dream career., career dream, dream career,career,True,-16.11603546142578,-15.453533172607422,-0.6625022888183594,14067712,EleutherAI/pythia-14m,step62000,seed4,4,62000
It was a battery-powered drill.,drill,drill,It was a drill battery-powered., battery-powered drill, drill battery-powered,battery-powered,False,-24.2072811126709,-26.95254898071289,2.745267868041992,14067712,EleutherAI/pythia-14m,step62000,seed4,4,62000
It was a physical examination.,examination,examination,It was an examination physical., physical examination, examination physical,physical,False,-13.578189849853516,-21.510955810546875,7.932765960693359,14067712,EleutherAI/pythia-14m,step62000,seed4,4,62000
They had an enthusiastic fan.,fan,fan,They had an fan enthusiastic., enthusiastic fan, fan enthusiastic,enthusiastic,False,-15.217245101928711,-26.621566772460938,11.404321670532227,14067712,EleutherAI/pythia-14m,step62000,seed4,4,62000
She had a steel file.,file,file,She had a file steel., steel file, file steel,steel,True,-16.823577880859375,-22.91449737548828,6.090919494628906,14067712,EleutherAI/pythia-14m,step62000,seed4,4,62000
It was a plastic film.,film,film,It was a film plastic., plastic film, film plastic,plastic,False,-13.513167381286621,-20.561927795410156,7.048760414123535,14067712,EleutherAI/pythia-14m,step62000,seed4,4,62000
It was a concrete foundation.,foundation,foundation,It was a foundation concrete., concrete foundation, foundation concrete,concrete,False,-13.67132568359375,-19.763160705566406,6.091835021972656,14067712,EleutherAI/pythia-14m,step62000,seed4,4,62000
It was a business function.,function,function,It was a function business., business function, function business,business,True,-14.928838729858398,-18.852676391601562,3.923837661743164,14067712,EleutherAI/pythia-14m,step62000,seed4,4,62000
He was on the parade ground.,ground,ground,He was on the ground parade., parade ground, ground parade,parade,True,-17.467681884765625,-17.085487365722656,-0.38219451904296875,14067712,EleutherAI/pythia-14m,step62000,seed4,4,62000
They liked the national guard.,guard,guard,They liked the guard national., national guard, guard national,national,False,-18.158937454223633,-24.765052795410156,6.606115341186523,14067712,EleutherAI/pythia-14m,step62000,seed4,4,62000
He had a friendly guide.,guide,guide,He had a guide friendly., friendly guide, guide friendly,friendly,False,-15.504087448120117,-20.74982452392578,5.245737075805664,14067712,EleutherAI/pythia-14m,step62000,seed4,4,62000
It was a nursing home.,home,home,It was a home nursing., nursing home, home nursing,nursing,True,-13.21917724609375,-17.553104400634766,4.333927154541016,14067712,EleutherAI/pythia-14m,step62000,seed4,4,62000
They had military intelligence.,intelligence,intelligence,They had intelligence military., military intelligence, intelligence military,military,False,-17.418567657470703,-22.99114227294922,5.572574615478516,14067712,EleutherAI/pythia-14m,step62000,seed4,4,62000
It was a special issue.,issue,issue,It was an issue special., special issue, issue special,special,False,-11.2246675491333,-15.761185646057129,4.536518096923828,14067712,EleutherAI/pythia-14m,step62000,seed4,4,62000
It was a paper jam.,jam,jam,It was a jam paper., paper jam, jam paper,paper,True,-16.514951705932617,-20.267040252685547,3.7520885467529297,14067712,EleutherAI/pythia-14m,step62000,seed4,4,62000
It was a backspace key.,key,key,It was a key backspace., backspace key, key backspace,backspace,True,-26.173809051513672,-23.811492919921875,-2.362316131591797,14067712,EleutherAI/pythia-14m,step62000,seed4,4,62000
They liked the friendly lamb.,lamb,lamb,They liked the lamb friendly., friendly lamb, lamb friendly,friendly,False,-18.464611053466797,-23.409509658813477,4.94489860534668,14067712,EleutherAI/pythia-14m,step62000,seed4,4,62000
She had door locks.,lock,locks,She had locks door., door locks, locks door,door,True,-18.88448715209961,-22.105302810668945,3.220815658569336,14067712,EleutherAI/pythia-14m,step62000,seed4,4,62000
They liked the women's lunch.,lunch,lunch,They liked the lunch women's., women's lunch, lunch women's,women,True,-22.497426986694336,-22.133010864257812,-0.36441612243652344,14067712,EleutherAI/pythia-14m,step62000,seed4,4,62000
He liked the stock market.,market,market,He liked the market stock., stock market, market stock,stock,True,-11.223402976989746,-14.08749008178711,2.8640871047973633,14067712,EleutherAI/pythia-14m,step62000,seed4,4,62000
It was a tennis match.,match,match,It was a match tennis., tennis match, match tennis,tennis,True,-16.798843383789062,-19.90597915649414,3.107135772705078,14067712,EleutherAI/pythia-14m,step62000,seed4,4,62000
It was veterinary medicine.,medicine,medicine,It was medicine veterinary., veterinary medicine, medicine veterinary,veterinary,False,-17.368545532226562,-23.604999542236328,6.236454010009766,14067712,EleutherAI/pythia-14m,step62000,seed4,4,62000
There was a clear message.,message,message,There was a message clear., clear message, message clear,clear,False,-14.024499893188477,-20.301376342773438,6.276876449584961,14067712,EleutherAI/pythia-14m,step62000,seed4,4,62000
It was a clay mold.,mold,mold,It was a mold clay., clay mold, mold clay,clay,True,-16.018611907958984,-19.30339813232422,3.2847862243652344,14067712,EleutherAI/pythia-14m,step62000,seed4,4,62000
She saw the fast mole.,mole,mole,She saw the mole fast., fast mole, mole fast,fast,False,-21.828201293945312,-21.377769470214844,-0.45043182373046875,14067712,EleutherAI/pythia-14m,step62000,seed4,4,62000
He liked the civil-rights movement.,movement,movement,He liked the movement civil-rights., civil-rights movement, movement civil-rights,civil-rights,False,-22.560945510864258,-30.703166961669922,8.142221450805664,14067712,EleutherAI/pythia-14m,step62000,seed4,4,62000
It was a shredded newspaper.,newspaper,newspaper,It was a newspaper shredded., shredded newspaper, newspaper shredded,shredded,False,-21.15794563293457,-23.435388565063477,2.2774429321289062,14067712,EleutherAI/pythia-14m,step62000,seed4,4,62000
It was a reddish orange.,orange,orange,It was an orange reddish., reddish orange, orange reddish,reddish,False,-19.597244262695312,-14.861363410949707,-4.7358808517456055,14067712,EleutherAI/pythia-14m,step62000,seed4,4,62000
He saw the ripped page.,page,page,He saw the page ripped., ripped page, page ripped,ripped,False,-19.761892318725586,-18.6578369140625,-1.104055404663086,14067712,EleutherAI/pythia-14m,step62000,seed4,4,62000
It was a tree palm.,palm,palm,It was a palm tree., tree palm, palm tree,tree,True,-17.996095657348633,-12.550970077514648,-5.445125579833984,14067712,EleutherAI/pythia-14m,step62000,seed4,4,62000
It was a consumer panel.,panel,panel,It was a panel consumer., consumer panel, panel consumer,consumer,True,-18.091068267822266,-20.59678077697754,2.5057125091552734,14067712,EleutherAI/pythia-14m,step62000,seed4,4,62000
It was a biblical passage.,passage,passage,It was a passage biblical., biblical passage, passage biblical,biblical,False,-18.42845916748047,-25.013057708740234,6.584598541259766,14067712,EleutherAI/pythia-14m,step62000,seed4,4,62000
It was a secure perch.,perch,perch,It was a perch secure., secure perch, perch secure,secure,False,-26.319435119628906,-23.882709503173828,-2.436725616455078,14067712,EleutherAI/pythia-14m,step62000,seed4,4,62000
He saw the plastic pitcher.,pitcher,pitcher,He saw the pitcher plastic., plastic pitcher, pitcher plastic,plastic,True,-19.665122985839844,-25.889663696289062,6.224540710449219,14067712,EleutherAI/pythia-14m,step62000,seed4,4,62000
It was a sweet port.,port,port,It was a port sweet., sweet port, port sweet,sweet,False,-18.04879379272461,-23.347761154174805,5.298967361450195,14067712,EleutherAI/pythia-14m,step62000,seed4,4,62000
He was in a yoga position.,position,position,He was in a position yoga., yoga position, position yoga,yoga,True,-19.816585540771484,-19.43979263305664,-0.37679290771484375,14067712,EleutherAI/pythia-14m,step62000,seed4,4,62000
It was a challenging post.,post,post,It was a post challenging., challenging post, post challenging,challenging,False,-16.548465728759766,-20.67436981201172,4.125904083251953,14067712,EleutherAI/pythia-14m,step62000,seed4,4,62000
He had the quickest punch.,punch,punch,He had the punch quickest., quickest punch, punch quickest,quickest,False,-17.72625732421875,-23.685834884643555,5.959577560424805,14067712,EleutherAI/pythia-14m,step62000,seed4,4,62000
She had a cloudy pupil.,pupil,pupil,She had a pupil cloudy., cloudy pupil, pupil cloudy,cloudy,False,-24.972074508666992,-24.393325805664062,-0.5787487030029297,14067712,EleutherAI/pythia-14m,step62000,seed4,4,62000
That was a tennis racket.,racket,racket,That was a racket tennis., tennis racket, racket tennis,tennis,True,-13.402361869812012,-20.98370361328125,7.581341743469238,14067712,EleutherAI/pythia-14m,step62000,seed4,4,62000
He liked granite rock.,rock,rock,He liked rock granite., granite rock, rock granite,granite,True,-19.606409072875977,-21.547500610351562,1.941091537475586,14067712,EleutherAI/pythia-14m,step62000,seed4,4,62000
He saw the bushy sage.,sage,sage,He saw the sage bushy., bushy sage, sage bushy,bushy,False,-29.306781768798828,-31.68685531616211,2.3800735473632812,14067712,EleutherAI/pythia-14m,step62000,seed4,4,62000
It was a major scale.,scale,scale,It was a scale major., major scale, scale major,major,False,-13.845697402954102,-19.440351486206055,5.594654083251953,14067712,EleutherAI/pythia-14m,step62000,seed4,4,62000
It was a panoramic scene.,scene,scene,It was a scene panoramic., panoramic scene, scene panoramic,panoramic,False,-20.487388610839844,-20.378324508666992,-0.10906410217285156,14067712,EleutherAI/pythia-14m,step62000,seed4,4,62000
It was a trained seal.,seal,seal,It was a seal trained., trained seal, seal trained,trained,False,-20.40183448791504,-24.006196975708008,3.6043624877929688,14067712,EleutherAI/pythia-14m,step62000,seed4,4,62000
He used the video tape.,tape,tape,He used the tape video., video tape, tape video,video,True,-14.320418357849121,-17.668611526489258,3.3481931686401367,14067712,EleutherAI/pythia-14m,step62000,seed4,4,62000
It was a technical term.,term,term,It was a term technical., technical term, term technical,technical,False,-15.04261589050293,-19.543004989624023,4.500389099121094,14067712,EleutherAI/pythia-14m,step62000,seed4,4,62000
It was a diseased tick.,tick,tick,It was a tick diseased., diseased tick, tick diseased,diseased,False,-22.76894760131836,-25.101192474365234,2.332244873046875,14067712,EleutherAI/pythia-14m,step62000,seed4,4,62000
It was a finger tip.,tip,tip,It was a tip finger., finger tip, tip finger,finger,True,-17.03236198425293,-18.323650360107422,1.2912883758544922,14067712,EleutherAI/pythia-14m,step62000,seed4,4,62000
She liked the professional title.,title,title,She liked the title professional., professional title, title professional,professional,False,-17.76471710205078,-18.838008880615234,1.0732917785644531,14067712,EleutherAI/pythia-14m,step62000,seed4,4,62000
It was a bell toll.,toll,toll,It was a toll bell., bell toll, toll bell,bell,True,-22.97988510131836,-20.737049102783203,-2.2428359985351562,14067712,EleutherAI/pythia-14m,step62000,seed4,4,62000
She saw the snowshoe tracks.,track,tracks,She saw the tracks snowshoe., snowshoe tracks, tracks snowshoe,snowshoe,True,-28.799156188964844,-31.002073287963867,2.2029170989990234,14067712,EleutherAI/pythia-14m,step62000,seed4,4,62000
They were cluttered yards.,yard,yards,They were yards cluttered., cluttered yards, yards cluttered,cluttered,False,-26.56182098388672,-29.083303451538086,2.521482467651367,14067712,EleutherAI/pythia-14m,step62000,seed4,4,62000
