sentence,word,string,reversed_sentence,mod_np,reversed_mod,disambiguating_word,non_adjective,original_logprob,reversed_logprob,ratio,n_params,mpath,revision,seed_name,seed,step
It was a social function.,function,function,It was a function social., social function, function social,social,False,-15.059715270996094,-22.035873413085938,6.976158142089844,14067712,EleutherAI/pythia-14m,step45000,seed9,9,45000
He was on the firm ground.,ground,ground,He was on the ground firm., firm ground, ground firm,firm,False,-17.07046890258789,-15.402109146118164,-1.6683597564697266,14067712,EleutherAI/pythia-14m,step45000,seed9,9,45000
He was on the frozen ground.,ground,ground,He was on the ground frozen., frozen ground, ground frozen,frozen,False,-14.990265846252441,-15.61920166015625,0.6289358139038086,14067712,EleutherAI/pythia-14m,step45000,seed9,9,45000
He was on the camp ground.,ground,ground,He was on the ground camp., camp ground, ground camp,camp,True,-15.671140670776367,-16.125307083129883,0.4541664123535156,14067712,EleutherAI/pythia-14m,step45000,seed9,9,45000
They liked the night guard.,guard,guard,They liked the guard night., night guard, guard night,night,True,-15.892047882080078,-17.385704040527344,1.4936561584472656,14067712,EleutherAI/pythia-14m,step45000,seed9,9,45000
They liked the security guard.,guard,guard,They liked the guard security., security guard, guard security,security,True,-14.233426094055176,-19.470306396484375,5.236880302429199,14067712,EleutherAI/pythia-14m,step45000,seed9,9,45000
They liked the coast guard.,guard,guard,They liked the guard coast., coast guard, guard coast,coast,True,-16.64391326904297,-21.4342041015625,4.790290832519531,14067712,EleutherAI/pythia-14m,step45000,seed9,9,45000
He had an assembly guide.,guide,guide,He had an guide assembly., assembly guide, guide assembly,assembly,True,-19.19646453857422,-26.03325080871582,6.836786270141602,14067712,EleutherAI/pythia-14m,step45000,seed9,9,45000
He had a TV guide.,guide,guide,He had a guide TV., TV guide, guide TV,TV,True,-17.99530792236328,-22.54239273071289,4.547084808349609,14067712,EleutherAI/pythia-14m,step45000,seed9,9,45000
He had a talkative guide.,guide,guide,He had a guide talkative., talkative guide, guide talkative,talkative,False,-23.335662841796875,-26.818866729736328,3.483203887939453,14067712,EleutherAI/pythia-14m,step45000,seed9,9,45000
It was a summer home.,home,home,It was a home summer., summer home, home summer,summer,True,-16.122241973876953,-16.492891311645508,0.3706493377685547,14067712,EleutherAI/pythia-14m,step45000,seed9,9,45000
It was a childhood home.,home,home,It was a home childhood., childhood home, home childhood,childhood,True,-15.383533477783203,-19.698644638061523,4.31511116027832,14067712,EleutherAI/pythia-14m,step45000,seed9,9,45000
It was a funeral home.,home,home,It was a home funeral., funeral home, home funeral,funeral,False,-13.914363861083984,-17.581682205200195,3.667318344116211,14067712,EleutherAI/pythia-14m,step45000,seed9,9,45000
They had natural intelligence.,intelligence,intelligence,They had intelligence natural., natural intelligence, intelligence natural,natural,False,-16.611347198486328,-22.601200103759766,5.9898529052734375,14067712,EleutherAI/pythia-14m,step45000,seed9,9,45000
They had innate intelligence.,intelligence,intelligence,They had intelligence innate., innate intelligence, intelligence innate,innate,False,-20.154251098632812,-24.365985870361328,4.211734771728516,14067712,EleutherAI/pythia-14m,step45000,seed9,9,45000
They had classified intelligence.,intelligence,intelligence,They had intelligence classified., classified intelligence, intelligence classified,classified,False,-19.62946128845215,-19.850833892822266,0.2213726043701172,14067712,EleutherAI/pythia-14m,step45000,seed9,9,45000
It was a sensitive issue.,issue,issue,It was an issue sensitive., sensitive issue, issue sensitive,sensitive,False,-17.65770721435547,-17.793262481689453,0.13555526733398438,14067712,EleutherAI/pythia-14m,step45000,seed9,9,45000
It was a political issue.,issue,issue,It was an issue political., political issue, issue political,political,False,-12.366958618164062,-17.54020881652832,5.173250198364258,14067712,EleutherAI/pythia-14m,step45000,seed9,9,45000
It was a weekly issue.,issue,issue,It was an issue weekly., weekly issue, issue weekly,weekly,False,-15.747827529907227,-20.05571937561035,4.307891845703125,14067712,EleutherAI/pythia-14m,step45000,seed9,9,45000
It was a blackberry jam.,jam,jam,It was a jam blackberry., blackberry jam, jam blackberry,blackberry,True,-19.751794815063477,-26.42322540283203,6.671430587768555,14067712,EleutherAI/pythia-14m,step45000,seed9,9,45000
It was a peach jam.,jam,jam,It was a jam peach., peach jam, jam peach,peach,False,-18.272737503051758,-21.623779296875,3.351041793823242,14067712,EleutherAI/pythia-14m,step45000,seed9,9,45000
It was a traffic jam.,jam,jam,It was a jam traffic., traffic jam, jam traffic,traffic,True,-14.29419231414795,-20.561729431152344,6.2675371170043945,14067712,EleutherAI/pythia-14m,step45000,seed9,9,45000
It was a duplicate key.,key,key,It was a key duplicate., duplicate key, key duplicate,duplicate,False,-18.924850463867188,-19.648300170898438,0.72344970703125,14067712,EleutherAI/pythia-14m,step45000,seed9,9,45000
It was a master key.,key,key,It was a key master., master key, key master,master,True,-17.65610122680664,-16.79339599609375,-0.8627052307128906,14067712,EleutherAI/pythia-14m,step45000,seed9,9,45000
It was a delete key.,key,key,It was a key delete., delete key, key delete,delete,False,-20.49813461303711,-20.20581817626953,-0.2923164367675781,14067712,EleutherAI/pythia-14m,step45000,seed9,9,45000
They liked the marinated lamb.,lamb,lamb,They liked the lamb marinated., marinated lamb, lamb marinated,marinated,True,-26.22842788696289,-26.295574188232422,0.06714630126953125,14067712,EleutherAI/pythia-14m,step45000,seed9,9,45000
They liked the grilled lamb.,lamb,lamb,They liked the lamb grilled., grilled lamb, lamb grilled,grilled,False,-17.37689781188965,-21.03762435913086,3.660726547241211,14067712,EleutherAI/pythia-14m,step45000,seed9,9,45000
They liked the cute lamb.,lamb,lamb,They liked the lamb cute., cute lamb, lamb cute,cute,False,-19.170120239257812,-24.203393936157227,5.033273696899414,14067712,EleutherAI/pythia-14m,step45000,seed9,9,45000
She had curly locks.,lock,locks,She had locks curly., curly locks, locks curly,curly,False,-21.46122932434082,-24.949350357055664,3.4881210327148438,14067712,EleutherAI/pythia-14m,step45000,seed9,9,45000
She had brown locks.,lock,locks,She had locks brown., brown locks, locks brown,brown,False,-20.764375686645508,-21.176315307617188,0.4119396209716797,14067712,EleutherAI/pythia-14m,step45000,seed9,9,45000
She had window locks.,lock,locks,She had locks window., window locks, locks window,window,True,-18.9727840423584,-21.617877960205078,2.6450939178466797,14067712,EleutherAI/pythia-14m,step45000,seed9,9,45000
They liked the hot lunch.,lunch,lunch,They liked the lunch hot., hot lunch, lunch hot,hot,False,-15.181110382080078,-17.410701751708984,2.2295913696289062,14067712,EleutherAI/pythia-14m,step45000,seed9,9,45000
They liked the sandwich lunch.,lunch,lunch,They liked the lunch sandwich., sandwich lunch, lunch sandwich,sandwich,True,-19.217918395996094,-18.307119369506836,-0.9107990264892578,14067712,EleutherAI/pythia-14m,step45000,seed9,9,45000
They liked the afternoon lunch.,lunch,lunch,They liked the lunch afternoon., afternoon lunch, lunch afternoon,afternoon,True,-16.032377243041992,-16.304689407348633,0.2723121643066406,14067712,EleutherAI/pythia-14m,step45000,seed9,9,45000
He liked the flea market.,market,market,He liked the market flea., flea market, market flea,flea,True,-17.62419319152832,-20.811674118041992,3.187480926513672,14067712,EleutherAI/pythia-14m,step45000,seed9,9,45000
He liked the fish market.,market,market,He liked the market fish., fish market, market fish,fish,True,-15.905556678771973,-18.13086700439453,2.2253103256225586,14067712,EleutherAI/pythia-14m,step45000,seed9,9,45000
He liked the housing market.,market,market,He liked the market housing., housing market, market housing,housing,True,-11.956263542175293,-17.193002700805664,5.236739158630371,14067712,EleutherAI/pythia-14m,step45000,seed9,9,45000
It was a lit match.,match,match,It was a match lit., lit match, match lit,lit,False,-21.350204467773438,-19.49585723876953,-1.8543472290039062,14067712,EleutherAI/pythia-14m,step45000,seed9,9,45000
It was a burning match.,match,match,It was a match burning., burning match, match burning,burning,False,-20.88152313232422,-22.07373809814453,1.1922149658203125,14067712,EleutherAI/pythia-14m,step45000,seed9,9,45000
It was a soccer match.,match,match,It was a match soccer., soccer match, match soccer,soccer,True,-16.1469783782959,-21.14592742919922,4.99894905090332,14067712,EleutherAI/pythia-14m,step45000,seed9,9,45000
It was cough medicine.,medicine,medicine,It was medicine cough., cough medicine, medicine cough,cough,True,-21.130701065063477,-21.604419708251953,0.47371864318847656,14067712,EleutherAI/pythia-14m,step45000,seed9,9,45000
It was prescription medicine.,medicine,medicine,It was medicine prescription., prescription medicine, medicine prescription,prescription,True,-18.53362274169922,-21.405569076538086,2.871946334838867,14067712,EleutherAI/pythia-14m,step45000,seed9,9,45000
It was orthopedic medicine.,medicine,medicine,It was medicine orthopedic., orthopedic medicine, medicine orthopedic,orthopedic,False,-23.78664207458496,-26.01346206665039,2.2268199920654297,14067712,EleutherAI/pythia-14m,step45000,seed9,9,45000
There was a phone message.,message,message,There was a message phone., phone message, message phone,phone,True,-14.432279586791992,-16.254470825195312,1.8221912384033203,14067712,EleutherAI/pythia-14m,step45000,seed9,9,45000
There was a computer message.,message,message,There was a message computer., computer message, message computer,computer,True,-16.792984008789062,-18.993324279785156,2.2003402709960938,14067712,EleutherAI/pythia-14m,step45000,seed9,9,45000
There was an urgent message.,message,message,There was an message urgent., urgent message, message urgent,urgent,False,-13.283120155334473,-23.488998413085938,10.205878257751465,14067712,EleutherAI/pythia-14m,step45000,seed9,9,45000
It was a fungal mold.,mold,mold,It was a mold fungal., fungal mold, mold fungal,fungal,False,-19.266403198242188,-22.41177749633789,3.145374298095703,14067712,EleutherAI/pythia-14m,step45000,seed9,9,45000
It was a harmful mold.,mold,mold,It was a mold harmful., harmful mold, mold harmful,harmful,False,-21.327301025390625,-25.438968658447266,4.111667633056641,14067712,EleutherAI/pythia-14m,step45000,seed9,9,45000
It was a rubber mold.,mold,mold,It was a mold rubber., rubber mold, mold rubber,rubber,True,-18.272777557373047,-23.450159072875977,5.17738151550293,14067712,EleutherAI/pythia-14m,step45000,seed9,9,45000
She saw the cancerous mole.,mole,mole,She saw the mole cancerous., cancerous mole, mole cancerous,cancerous,False,-26.28076934814453,-25.318727493286133,-0.9620418548583984,14067712,EleutherAI/pythia-14m,step45000,seed9,9,45000
She saw the raised mole.,mole,mole,She saw the mole raised., raised mole, mole raised,raised,False,-23.711898803710938,-19.509521484375,-4.2023773193359375,14067712,EleutherAI/pythia-14m,step45000,seed9,9,45000
She saw the cute mole.,mole,mole,She saw the mole cute., cute mole, mole cute,cute,False,-20.011764526367188,-23.61574935913086,3.603984832763672,14067712,EleutherAI/pythia-14m,step45000,seed9,9,45000
He liked the rhythmic movement.,movement,movement,He liked the movement rhythmic., rhythmic movement, movement rhythmic,rhythmic,False,-16.942279815673828,-23.61930274963379,6.677022933959961,14067712,EleutherAI/pythia-14m,step45000,seed9,9,45000
He liked the graceful movement.,movement,movement,He liked the movement graceful., graceful movement, movement graceful,graceful,False,-18.064329147338867,-23.235870361328125,5.171541213989258,14067712,EleutherAI/pythia-14m,step45000,seed9,9,45000
He liked the feminist movement.,movement,movement,He liked the movement feminist., feminist movement, movement feminist,feminist,True,-16.20753288269043,-21.605548858642578,5.398015975952148,14067712,EleutherAI/pythia-14m,step45000,seed9,9,45000
It was a national newspaper.,newspaper,newspaper,It was a newspaper national., national newspaper, newspaper national,national,False,-13.422237396240234,-17.482765197753906,4.060527801513672,14067712,EleutherAI/pythia-14m,step45000,seed9,9,45000
It was a daily newspaper.,newspaper,newspaper,It was a newspaper daily., daily newspaper, newspaper daily,daily,False,-13.893918991088867,-17.50954818725586,3.615629196166992,14067712,EleutherAI/pythia-14m,step45000,seed9,9,45000
It was a faded newspaper.,newspaper,newspaper,It was a newspaper faded., faded newspaper, newspaper faded,faded,False,-19.542987823486328,-20.510639190673828,0.9676513671875,14067712,EleutherAI/pythia-14m,step45000,seed9,9,45000
It was a juicy orange.,orange,orange,It was an orange juicy., juicy orange, orange juicy,juicy,False,-22.285816192626953,-22.656116485595703,0.37030029296875,14067712,EleutherAI/pythia-14m,step45000,seed9,9,45000
It was a ripe orange.,orange,orange,It was an orange ripe., ripe orange, orange ripe,ripe,False,-18.33739471435547,-18.960411071777344,0.623016357421875,14067712,EleutherAI/pythia-14m,step45000,seed9,9,45000
It was a bright orange.,orange,orange,It was an orange bright., bright orange, orange bright,bright,False,-13.515726089477539,-16.53197479248047,3.0162487030029297,14067712,EleutherAI/pythia-14m,step45000,seed9,9,45000
He saw the young page.,page,page,He saw the page young., young page, page young,young,False,-17.332168579101562,-22.18896484375,4.8567962646484375,14067712,EleutherAI/pythia-14m,step45000,seed9,9,45000
He saw the loyal page.,page,page,He saw the page loyal., loyal page, page loyal,loyal,False,-21.252540588378906,-23.626880645751953,2.374340057373047,14067712,EleutherAI/pythia-14m,step45000,seed9,9,45000
He saw the blank page.,page,page,He saw the page blank., blank page, page blank,blank,False,-16.89109230041504,-16.74732208251953,-0.1437702178955078,14067712,EleutherAI/pythia-14m,step45000,seed9,9,45000
It was a calloused palm.,palm,palm,It was a palm calloused., calloused palm, palm calloused,calloused,False,-27.990055084228516,-32.42512512207031,4.435070037841797,14067712,EleutherAI/pythia-14m,step45000,seed9,9,45000
It was a wrinkled palm.,palm,palm,It was a palm wrinkled., wrinkled palm, palm wrinkled,wrinkled,False,-19.126670837402344,-23.85886001586914,4.732189178466797,14067712,EleutherAI/pythia-14m,step45000,seed9,9,45000
It was a tropical palm.,palm,palm,It was a palm tropical., tropical palm, palm tropical,tropical,False,-20.02410316467285,-23.065757751464844,3.041654586791992,14067712,EleutherAI/pythia-14m,step45000,seed9,9,45000
It was a control panel.,panel,panel,It was a panel control., control panel, panel control,control,True,-16.540010452270508,-20.12019920349121,3.580188751220703,14067712,EleutherAI/pythia-14m,step45000,seed9,9,45000
It was an instrument panel.,panel,panel,It was an panel instrument., instrument panel, panel instrument,instrument,False,-18.813398361206055,-23.435794830322266,4.622396469116211,14067712,EleutherAI/pythia-14m,step45000,seed9,9,45000
It was an advisory panel.,panel,panel,It was an panel advisory., advisory panel, panel advisory,advisory,False,-16.979175567626953,-27.996841430664062,11.01766586303711,14067712,EleutherAI/pythia-14m,step45000,seed9,9,45000
It was a secret passage.,passage,passage,It was a passage secret., secret passage, passage secret,secret,False,-17.037914276123047,-20.72235679626465,3.6844425201416016,14067712,EleutherAI/pythia-14m,step45000,seed9,9,45000
It was a narrow passage.,passage,passage,It was a passage narrow., narrow passage, passage narrow,narrow,False,-15.76445198059082,-22.396724700927734,6.632272720336914,14067712,EleutherAI/pythia-14m,step45000,seed9,9,45000
It was a literary passage.,passage,passage,It was a passage literary., literary passage, passage literary,literary,False,-17.232837677001953,-23.00782012939453,5.774982452392578,14067712,EleutherAI/pythia-14m,step45000,seed9,9,45000
It was a tasty perch.,perch,perch,It was a perch tasty., tasty perch, perch tasty,tasty,False,-22.209667205810547,-24.69051742553711,2.4808502197265625,14067712,EleutherAI/pythia-14m,step45000,seed9,9,45000
It was a freshwater perch.,perch,perch,It was a perch freshwater., freshwater perch, perch freshwater,freshwater,True,-21.352170944213867,-23.05359649658203,1.701425552368164,14067712,EleutherAI/pythia-14m,step45000,seed9,9,45000
It was a lofty perch.,perch,perch,It was a perch lofty., lofty perch, perch lofty,lofty,False,-23.860183715820312,-26.42233657836914,2.562152862548828,14067712,EleutherAI/pythia-14m,step45000,seed9,9,45000
He saw the fast pitcher.,pitcher,pitcher,He saw the pitcher fast., fast pitcher, pitcher fast,fast,False,-19.91891098022461,-20.475048065185547,0.5561370849609375,14067712,EleutherAI/pythia-14m,step45000,seed9,9,45000
He saw the right-handed pitcher.,pitcher,pitcher,He saw the pitcher right-handed., right-handed pitcher, pitcher right-handed,right-handed,False,-18.33125877380371,-23.937044143676758,5.605785369873047,14067712,EleutherAI/pythia-14m,step45000,seed9,9,45000
He saw the glass pitcher.,pitcher,pitcher,He saw the pitcher glass., glass pitcher, pitcher glass,glass,True,-18.808340072631836,-20.553112030029297,1.744771957397461,14067712,EleutherAI/pythia-14m,step45000,seed9,9,45000
It was a windy port.,port,port,It was a port windy., windy port, port windy,windy,False,-19.775466918945312,-22.887958526611328,3.1124916076660156,14067712,EleutherAI/pythia-14m,step45000,seed9,9,45000
It was a seaside port.,port,port,It was a port seaside., seaside port, port seaside,seaside,True,-17.46585464477539,-22.34934425354004,4.883489608764648,14067712,EleutherAI/pythia-14m,step45000,seed9,9,45000
It was a delicious port.,port,port,It was a port delicious., delicious port, port delicious,delicious,False,-17.44300651550293,-24.0753116607666,6.632305145263672,14067712,EleutherAI/pythia-14m,step45000,seed9,9,45000
He was in a distinguished position.,position,position,He was in a position distinguished., distinguished position, position distinguished,distinguished,False,-14.20920181274414,-15.873908042907715,1.6647062301635742,14067712,EleutherAI/pythia-14m,step45000,seed9,9,45000
He was in a prominent position.,position,position,He was in a position prominent., prominent position, position prominent,prominent,False,-10.549758911132812,-15.003507614135742,4.45374870300293,14067712,EleutherAI/pythia-14m,step45000,seed9,9,45000
He was in a fetal position.,position,position,He was in a position fetal., fetal position, position fetal,fetal,False,-16.016468048095703,-21.521617889404297,5.505149841308594,14067712,EleutherAI/pythia-14m,step45000,seed9,9,45000
It was a wooden post.,post,post,It was a post wooden., wooden post, post wooden,wooden,False,-17.507183074951172,-22.81966781616211,5.3124847412109375,14067712,EleutherAI/pythia-14m,step45000,seed9,9,45000
It was a fence post.,post,post,It was a post fence., fence post, post fence,fence,True,-19.735942840576172,-23.47679901123047,3.740856170654297,14067712,EleutherAI/pythia-14m,step45000,seed9,9,45000
It was a teaching post.,post,post,It was a post teaching., teaching post, post teaching,teaching,True,-18.76302146911621,-18.980464935302734,0.21744346618652344,14067712,EleutherAI/pythia-14m,step45000,seed9,9,45000
He had the alcoholic punch.,punch,punch,He had the punch alcoholic., alcoholic punch, punch alcoholic,alcoholic,False,-20.395845413208008,-24.715559005737305,4.319713592529297,14067712,EleutherAI/pythia-14m,step45000,seed9,9,45000
He had the fruit punch.,punch,punch,He had the punch fruit., fruit punch, punch fruit,fruit,True,-18.330894470214844,-20.606847763061523,2.2759532928466797,14067712,EleutherAI/pythia-14m,step45000,seed9,9,45000
He had the strongest punch.,punch,punch,He had the punch strongest., strongest punch, punch strongest,strongest,False,-17.30630111694336,-23.274837493896484,5.968536376953125,14067712,EleutherAI/pythia-14m,step45000,seed9,9,45000
She had a brilliant pupil.,pupil,pupil,She had a pupil brilliant., brilliant pupil, pupil brilliant,brilliant,False,-16.344478607177734,-24.477890014648438,8.133411407470703,14067712,EleutherAI/pythia-14m,step45000,seed9,9,45000
She had an interested pupil.,pupil,pupil,She had an pupil interested., interested pupil, pupil interested,interested,False,-18.38526725769043,-23.918312072753906,5.533044815063477,14067712,EleutherAI/pythia-14m,step45000,seed9,9,45000
She had a dilated pupil.,pupil,pupil,She had a pupil dilated., dilated pupil, pupil dilated,dilated,False,-19.89277458190918,-24.548828125,4.65605354309082,14067712,EleutherAI/pythia-14m,step45000,seed9,9,45000
That was a loud racket.,racket,racket,That was a racket loud., loud racket, racket loud,loud,False,-15.994365692138672,-21.764610290527344,5.770244598388672,14067712,EleutherAI/pythia-14m,step45000,seed9,9,45000
That was an annoying racket.,racket,racket,That was an racket annoying., annoying racket, racket annoying,annoying,False,-14.823190689086914,-23.197790145874023,8.37459945678711,14067712,EleutherAI/pythia-14m,step45000,seed9,9,45000
That was a badminton racket.,racket,racket,That was a racket badminton., badminton racket, racket badminton,badminton,True,-28.391582489013672,-35.02924728393555,6.637664794921875,14067712,EleutherAI/pythia-14m,step45000,seed9,9,45000
He liked electronic rock.,rock,rock,He liked rock electronic., electronic rock, rock electronic,electronic,False,-18.042980194091797,-21.853744506835938,3.8107643127441406,14067712,EleutherAI/pythia-14m,step45000,seed9,9,45000
He liked alternative rock.,rock,rock,He liked rock alternative., alternative rock, rock alternative,alternative,False,-20.297443389892578,-23.34851837158203,3.051074981689453,14067712,EleutherAI/pythia-14m,step45000,seed9,9,45000
He liked limestone rock.,rock,rock,He liked rock limestone., limestone rock, rock limestone,limestone,True,-22.731544494628906,-23.220556259155273,0.4890117645263672,14067712,EleutherAI/pythia-14m,step45000,seed9,9,45000
He saw the wise sage.,sage,sage,He saw the sage wise., wise sage, sage wise,wise,False,-20.792526245117188,-22.96840476989746,2.1758785247802734,14067712,EleutherAI/pythia-14m,step45000,seed9,9,45000
He saw the renowned sage.,sage,sage,He saw the sage renowned., renowned sage, sage renowned,renowned,False,-21.40570068359375,-24.10932159423828,2.7036209106445312,14067712,EleutherAI/pythia-14m,step45000,seed9,9,45000
He saw the fragrant sage.,sage,sage,He saw the sage fragrant., fragrant sage, sage fragrant,fragrant,False,-23.648555755615234,-24.969396591186523,1.320840835571289,14067712,EleutherAI/pythia-14m,step45000,seed9,9,45000
It was a fish scale.,scale,scale,It was a scale fish., fish scale, scale fish,fish,True,-17.9691162109375,-22.717653274536133,4.748537063598633,14067712,EleutherAI/pythia-14m,step45000,seed9,9,45000
It was a lizard scale.,scale,scale,It was a scale lizard., lizard scale, scale lizard,lizard,True,-21.103103637695312,-23.417247772216797,2.3141441345214844,14067712,EleutherAI/pythia-14m,step45000,seed9,9,45000
It was a music scale.,scale,scale,It was a scale music., music scale, scale music,music,True,-16.93747329711914,-18.401260375976562,1.4637870788574219,14067712,EleutherAI/pythia-14m,step45000,seed9,9,45000
It was a touching scene.,scene,scene,It was a scene touching., touching scene, scene touching,touching,False,-16.902000427246094,-18.80538558959961,1.9033851623535156,14067712,EleutherAI/pythia-14m,step45000,seed9,9,45000
It was a well-acted scene.,scene,scene,It was a scene well-acted., well-acted scene, scene well-acted,well-acted,False,-24.550024032592773,-30.82986831665039,6.279844284057617,14067712,EleutherAI/pythia-14m,step45000,seed9,9,45000
It was a nature scene.,scene,scene,It was a scene nature., nature scene, scene nature,nature,True,-17.40621566772461,-19.65230941772461,2.24609375,14067712,EleutherAI/pythia-14m,step45000,seed9,9,45000
It was a gold seal.,seal,seal,It was a seal gold., gold seal, seal gold,gold,True,-14.711833000183105,-22.33667755126953,7.624844551086426,14067712,EleutherAI/pythia-14m,step45000,seed9,9,45000
It was a certified seal.,seal,seal,It was a seal certified., certified seal, seal certified,certified,False,-19.954219818115234,-22.46245002746582,2.508230209350586,14067712,EleutherAI/pythia-14m,step45000,seed9,9,45000
It was a circus seal.,seal,seal,It was a seal circus., circus seal, seal circus,circus,True,-22.55050277709961,-25.17682647705078,2.626323699951172,14067712,EleutherAI/pythia-14m,step45000,seed9,9,45000
He used the scotch tape.,tape,tape,He used the tape scotch., scotch tape, tape scotch,scotch,True,-21.661178588867188,-25.41779327392578,3.7566146850585938,14067712,EleutherAI/pythia-14m,step45000,seed9,9,45000
He used the double-sided tape.,tape,tape,He used the tape double-sided., double-sided tape, tape double-sided,double-sided,False,-21.82636260986328,-28.522428512573242,6.696065902709961,14067712,EleutherAI/pythia-14m,step45000,seed9,9,45000
He used the interview tape.,tape,tape,He used the tape interview., interview tape, tape interview,interview,True,-17.096529006958008,-19.312084197998047,2.215555191040039,14067712,EleutherAI/pythia-14m,step45000,seed9,9,45000
It was a winter term.,term,term,It was a term winter., winter term, term winter,winter,True,-15.874068260192871,-21.30331802368164,5.4292497634887695,14067712,EleutherAI/pythia-14m,step45000,seed9,9,45000
It was a fall term.,term,term,It was a term fall., fall term, term fall,fall,True,-17.238786697387695,-19.603195190429688,2.364408493041992,14067712,EleutherAI/pythia-14m,step45000,seed9,9,45000
