sentence,word,string,reversed_sentence,mod_np,reversed_mod,disambiguating_word,non_adjective,original_logprob,reversed_logprob,ratio,n_params,mpath,revision,seed_name,seed,step
It was a desperate act.,act,act,It was an act desperate., desperate act, act desperate,desperate,False,-14.299638748168945,-19.374893188476562,5.075254440307617,14067712,EleutherAI/pythia-14m,step36000,seed5,5,36000
It was a humane act.,act,act,It was an act humane., humane act, act humane,humane,False,-19.73670196533203,-22.9467716217041,3.2100696563720703,14067712,EleutherAI/pythia-14m,step36000,seed5,5,36000
It was a magic act.,act,act,It was an act magic., magic act, act magic,magic,False,-16.507057189941406,-18.48491668701172,1.9778594970703125,14067712,EleutherAI/pythia-14m,step36000,seed5,5,36000
He had a universal appeal.,appeal,appeal,He had an appeal universal., universal appeal, appeal universal,universal,False,-19.051555633544922,-22.20943832397461,3.1578826904296875,14067712,EleutherAI/pythia-14m,step36000,seed5,5,36000
He had an undefinable appeal.,appeal,appeal,He had an appeal undefinable., undefinable appeal, appeal undefinable,undefinable,False,-23.02832794189453,-25.874292373657227,2.8459644317626953,14067712,EleutherAI/pythia-14m,step36000,seed5,5,36000
He had a legal appeal.,appeal,appeal,He had an appeal legal., legal appeal, appeal legal,legal,False,-16.632858276367188,-18.09912109375,1.4662628173828125,14067712,EleutherAI/pythia-14m,step36000,seed5,5,36000
It was a tense atmosphere.,atmosphere,atmosphere,It was an atmosphere tense., tense atmosphere, atmosphere tense,tense,False,-15.451417922973633,-21.746658325195312,6.29524040222168,14067712,EleutherAI/pythia-14m,step36000,seed5,5,36000
It was a hostile atmosphere.,atmosphere,atmosphere,It was an atmosphere hostile., hostile atmosphere, atmosphere hostile,hostile,False,-16.716463088989258,-20.575428009033203,3.8589649200439453,14067712,EleutherAI/pythia-14m,step36000,seed5,5,36000
It was a gaseous atmosphere.,atmosphere,atmosphere,It was an atmosphere gaseous., gaseous atmosphere, atmosphere gaseous,gaseous,False,-17.849695205688477,-23.450233459472656,5.60053825378418,14067712,EleutherAI/pythia-14m,step36000,seed5,5,36000
It was a gold band.,band,band,It was a band gold., gold band, band gold,gold,True,-14.53967571258545,-20.34922218322754,5.80954647064209,14067712,EleutherAI/pythia-14m,step36000,seed5,5,36000
It was a rubber band.,band,band,It was a band rubber., rubber band, band rubber,rubber,True,-13.90739631652832,-21.5185489654541,7.611152648925781,14067712,EleutherAI/pythia-14m,step36000,seed5,5,36000
It was a jazz band.,band,band,It was a band jazz., jazz band, band jazz,jazz,True,-15.359604835510254,-21.328784942626953,5.969180107116699,14067712,EleutherAI/pythia-14m,step36000,seed5,5,36000
There was a police barrier.,barrier,barrier,There was a barrier police., police barrier, barrier police,police,True,-21.721532821655273,-20.571300506591797,-1.1502323150634766,14067712,EleutherAI/pythia-14m,step36000,seed5,5,36000
There was a concrete barrier.,barrier,barrier,There was a barrier concrete., concrete barrier, barrier concrete,concrete,False,-16.88433074951172,-22.254100799560547,5.369770050048828,14067712,EleutherAI/pythia-14m,step36000,seed5,5,36000
There was a language barrier.,barrier,barrier,There was a barrier language., language barrier, barrier language,language,True,-19.774822235107422,-22.573989868164062,2.7991676330566406,14067712,EleutherAI/pythia-14m,step36000,seed5,5,36000
He saw a furry bat.,bat,bat,He saw a bat furry., furry bat, bat furry,furry,False,-20.121244430541992,-23.89884376525879,3.777599334716797,14067712,EleutherAI/pythia-14m,step36000,seed5,5,36000
He saw a fruit bat.,bat,bat,He saw a bat fruit., fruit bat, bat fruit,fruit,True,-18.928802490234375,-20.128780364990234,1.1999778747558594,14067712,EleutherAI/pythia-14m,step36000,seed5,5,36000
He saw a wooden bat.,bat,bat,He saw a bat wooden., wooden bat, bat wooden,wooden,False,-16.05937957763672,-23.798599243164062,7.739219665527344,14067712,EleutherAI/pythia-14m,step36000,seed5,5,36000
He saw the laser beam.,beam,beam,He saw the beam laser., laser beam, beam laser,laser,True,-10.17383098602295,-15.632295608520508,5.458464622497559,14067712,EleutherAI/pythia-14m,step36000,seed5,5,36000
He saw the bright beam.,beam,beam,He saw the beam bright., bright beam, beam bright,bright,False,-17.377887725830078,-18.679468154907227,1.3015804290771484,14067712,EleutherAI/pythia-14m,step36000,seed5,5,36000
He saw the wood beam.,beam,beam,He saw the beam wood., wood beam, beam wood,wood,True,-18.120515823364258,-20.92780113220215,2.8072853088378906,14067712,EleutherAI/pythia-14m,step36000,seed5,5,36000
She had a toy block.,block,block,She had a block toy., toy block, block toy,toy,True,-17.253772735595703,-20.111400604248047,2.8576278686523438,14067712,EleutherAI/pythia-14m,step36000,seed5,5,36000
She had a wooden block.,block,block,She had a block wooden., wooden block, block wooden,wooden,False,-15.646893501281738,-23.3034610748291,7.656567573547363,14067712,EleutherAI/pythia-14m,step36000,seed5,5,36000
She had a mental block.,block,block,She had a block mental., mental block, block mental,mental,False,-15.079795837402344,-22.85729217529297,7.777496337890625,14067712,EleutherAI/pythia-14m,step36000,seed5,5,36000
He has coagulated blood.,blood,blood,He has blood coagulated., coagulated blood, blood coagulated,coagulated,True,-28.398426055908203,-29.34422492980957,0.9457988739013672,14067712,EleutherAI/pythia-14m,step36000,seed5,5,36000
He has thin blood.,blood,blood,He has blood thin., thin blood, blood thin,thin,False,-18.26569175720215,-21.20467758178711,2.938985824584961,14067712,EleutherAI/pythia-14m,step36000,seed5,5,36000
He has noble blood.,blood,blood,He has blood noble., noble blood, blood noble,noble,False,-21.705663681030273,-23.73964500427246,2.0339813232421875,14067712,EleutherAI/pythia-14m,step36000,seed5,5,36000
It was the ironing board.,board,board,It was the board ironing., ironing board, board ironing,ironing,False,-21.281747817993164,-22.277488708496094,0.9957408905029297,14067712,EleutherAI/pythia-14m,step36000,seed5,5,36000
It was the wooden board.,board,board,It was the board wooden., wooden board, board wooden,wooden,False,-14.884615898132324,-21.632671356201172,6.748055458068848,14067712,EleutherAI/pythia-14m,step36000,seed5,5,36000
It was the executive board.,board,board,It was the board executive., executive board, board executive,executive,True,-15.093835830688477,-17.547260284423828,2.4534244537353516,14067712,EleutherAI/pythia-14m,step36000,seed5,5,36000
He had a best-selling book.,book,book,He had a book best-selling., best-selling book, book best-selling,best-selling,False,-18.71039581298828,-24.180402755737305,5.470006942749023,14067712,EleutherAI/pythia-14m,step36000,seed5,5,36000
He had a popular book.,book,book,He had a book popular., popular book, book popular,popular,False,-15.627510070800781,-19.445295333862305,3.8177852630615234,14067712,EleutherAI/pythia-14m,step36000,seed5,5,36000
He had a heavy book.,book,book,He had a book heavy., heavy book, book heavy,heavy,False,-14.940230369567871,-19.852066040039062,4.911835670471191,14067712,EleutherAI/pythia-14m,step36000,seed5,5,36000
They ate a pancake breakfast.,breakfast,breakfast,They ate a breakfast pancake., pancake breakfast, breakfast pancake,pancake,True,-15.122406005859375,-16.88898277282715,1.7665767669677734,14067712,EleutherAI/pythia-14m,step36000,seed5,5,36000
They ate a nutritious breakfast.,breakfast,breakfast,They ate a breakfast nutritious., nutritious breakfast, breakfast nutritious,nutritious,False,-20.675086975097656,-28.976343154907227,8.30125617980957,14067712,EleutherAI/pythia-14m,step36000,seed5,5,36000
They ate a family breakfast.,breakfast,breakfast,They ate a breakfast family., family breakfast, breakfast family,family,True,-13.859210968017578,-16.556116104125977,2.6969051361083984,14067712,EleutherAI/pythia-14m,step36000,seed5,5,36000
It was a red cape.,cape,cape,It was a cape red., red cape, cape red,red,False,-18.036441802978516,-20.993257522583008,2.956815719604492,14067712,EleutherAI/pythia-14m,step36000,seed5,5,36000
It was a flowing cape.,cape,cape,It was a cape flowing., flowing cape, cape flowing,flowing,False,-23.2601318359375,-24.081989288330078,0.8218574523925781,14067712,EleutherAI/pythia-14m,step36000,seed5,5,36000
It was a rocky cape.,cape,cape,It was a cape rocky., rocky cape, cape rocky,rocky,False,-20.497325897216797,-25.396724700927734,4.8993988037109375,14067712,EleutherAI/pythia-14m,step36000,seed5,5,36000
It was a beer case.,case,case,It was a case beer., beer case, case beer,beer,True,-19.225278854370117,-24.90189552307129,5.676616668701172,14067712,EleutherAI/pythia-14m,step36000,seed5,5,36000
It was a display case.,case,case,It was a case display., display case, case display,display,True,-17.79740333557129,-19.51934814453125,1.721944808959961,14067712,EleutherAI/pythia-14m,step36000,seed5,5,36000
It was a divorce case.,case,case,It was a case divorce., divorce case, case divorce,divorce,True,-13.900394439697266,-21.926654815673828,8.026260375976562,14067712,EleutherAI/pythia-14m,step36000,seed5,5,36000
It was a worthy cause.,cause,cause,It was a cause worthy., worthy cause, cause worthy,worthy,False,-14.86265754699707,-22.351787567138672,7.489130020141602,14067712,EleutherAI/pythia-14m,step36000,seed5,5,36000
It was a political cause.,cause,cause,It was a cause political., political cause, cause political,political,False,-16.93020248413086,-23.70307159423828,6.772869110107422,14067712,EleutherAI/pythia-14m,step36000,seed5,5,36000
It was a main cause.,cause,cause,It was a cause main., main cause, cause main,main,False,-12.487144470214844,-25.239253997802734,12.75210952758789,14067712,EleutherAI/pythia-14m,step36000,seed5,5,36000
It was a skin cell.,cell,cell,It was a cell skin., skin cell, cell skin,skin,True,-18.66143035888672,-20.211593627929688,1.5501632690429688,14067712,EleutherAI/pythia-14m,step36000,seed5,5,36000
It was a brain cell.,cell,cell,It was a cell brain., brain cell, cell brain,brain,True,-15.274072647094727,-19.331829071044922,4.057756423950195,14067712,EleutherAI/pythia-14m,step36000,seed5,5,36000
It was a prison cell.,cell,cell,It was a cell prison., prison cell, cell prison,prison,True,-15.828436851501465,-17.71772003173828,1.8892831802368164,14067712,EleutherAI/pythia-14m,step36000,seed5,5,36000
She had a devilish charm.,charm,charm,She had a charm devilish., devilish charm, charm devilish,devilish,False,-21.41168975830078,-29.068817138671875,7.657127380371094,14067712,EleutherAI/pythia-14m,step36000,seed5,5,36000
She had a natural charm.,charm,charm,She had a charm natural., natural charm, charm natural,natural,False,-16.133127212524414,-21.674232482910156,5.541105270385742,14067712,EleutherAI/pythia-14m,step36000,seed5,5,36000
She had a gold charm.,charm,charm,She had a charm gold., gold charm, charm gold,gold,True,-18.308990478515625,-21.791889190673828,3.482898712158203,14067712,EleutherAI/pythia-14m,step36000,seed5,5,36000
They liked the juicy chicken.,chicken,chicken,They liked the chicken juicy., juicy chicken, chicken juicy,juicy,False,-19.15303611755371,-21.2117977142334,2.0587615966796875,14067712,EleutherAI/pythia-14m,step36000,seed5,5,36000
They liked the roasted chicken.,chicken,chicken,They liked the chicken roasted., roasted chicken, chicken roasted,roasted,False,-15.47100830078125,-18.184337615966797,2.713329315185547,14067712,EleutherAI/pythia-14m,step36000,seed5,5,36000
They liked the clucking chicken.,chicken,chicken,They liked the chicken clucking., clucking chicken, chicken clucking,clucking,True,-27.083683013916016,-22.716903686523438,-4.366779327392578,14067712,EleutherAI/pythia-14m,step36000,seed5,5,36000
It was a perceptive class.,class,class,It was a class perceptive., perceptive class, class perceptive,perceptive,False,-21.43315887451172,-24.239669799804688,2.8065109252929688,14067712,EleutherAI/pythia-14m,step36000,seed5,5,36000
It was a misbehaving class.,class,class,It was a class misbehaving., misbehaving class, class misbehaving,misbehaving,False,-24.041667938232422,-24.74516487121582,0.7034969329833984,14067712,EleutherAI/pythia-14m,step36000,seed5,5,36000
It was a boring class.,class,class,It was a class boring., boring class, class boring,boring,False,-16.982746124267578,-19.723712921142578,2.740966796875,14067712,EleutherAI/pythia-14m,step36000,seed5,5,36000
It was a film clip.,clip,clip,It was a clip film., film clip, clip film,film,True,-18.632898330688477,-20.344694137573242,1.7117958068847656,14067712,EleutherAI/pythia-14m,step36000,seed5,5,36000
It was a video clip.,clip,clip,It was a clip video., video clip, clip video,video,True,-12.8284912109375,-17.910812377929688,5.0823211669921875,14067712,EleutherAI/pythia-14m,step36000,seed5,5,36000
It was a hair clip.,clip,clip,It was a clip hair., hair clip, clip hair,hair,True,-19.005321502685547,-25.513242721557617,6.50792121887207,14067712,EleutherAI/pythia-14m,step36000,seed5,5,36000
It was an icy cold.,cold,cold,It was an cold icy., icy cold, cold icy,icy,False,-13.882301330566406,-21.675647735595703,7.793346405029297,14067712,EleutherAI/pythia-14m,step36000,seed5,5,36000
It was a freezing cold.,cold,cold,It was a cold freezing., freezing cold, cold freezing,freezing,False,-15.755243301391602,-16.142066955566406,0.3868236541748047,14067712,EleutherAI/pythia-14m,step36000,seed5,5,36000
It was a chest cold.,cold,cold,It was a cold chest., chest cold, cold chest,chest,False,-19.8823299407959,-16.718015670776367,-3.1643142700195312,14067712,EleutherAI/pythia-14m,step36000,seed5,5,36000
It was a gossip column.,column,column,It was a column gossip., gossip column, column gossip,gossip,True,-21.35265350341797,-22.988920211791992,1.6362667083740234,14067712,EleutherAI/pythia-14m,step36000,seed5,5,36000
It was a sports column.,column,column,It was a column sports., sports column, column sports,sports,True,-18.640838623046875,-23.00265121459961,4.361812591552734,14067712,EleutherAI/pythia-14m,step36000,seed5,5,36000
It was a concrete column.,column,column,It was a column concrete., concrete column, column concrete,concrete,False,-17.500856399536133,-21.8089599609375,4.308103561401367,14067712,EleutherAI/pythia-14m,step36000,seed5,5,36000
He liked the investment company.,company,company,He liked the company investment., investment company, company investment,investment,True,-16.600238800048828,-16.640676498413086,0.04043769836425781,14067712,EleutherAI/pythia-14m,step36000,seed5,5,36000
He liked the pharmaceutical company.,company,company,He liked the company pharmaceutical., pharmaceutical company, company pharmaceutical,pharmaceutical,False,-13.583077430725098,-19.514965057373047,5.931887626647949,14067712,EleutherAI/pythia-14m,step36000,seed5,5,36000
He liked the pleasant company.,company,company,He liked the company pleasant., pleasant company, company pleasant,pleasant,False,-17.73351287841797,-19.620759963989258,1.887247085571289,14067712,EleutherAI/pythia-14m,step36000,seed5,5,36000
It was a waffle cone.,cone,cone,It was a cone waffle., waffle cone, cone waffle,waffle,True,-25.287933349609375,-30.201217651367188,4.9132843017578125,14067712,EleutherAI/pythia-14m,step36000,seed5,5,36000
It was a sugar cone.,cone,cone,It was a cone sugar., sugar cone, cone sugar,sugar,True,-21.758331298828125,-25.965068817138672,4.206737518310547,14067712,EleutherAI/pythia-14m,step36000,seed5,5,36000
It was an orange cone.,cone,cone,It was an cone orange., orange cone, cone orange,orange,False,-14.789542198181152,-28.93899154663086,14.149449348449707,14067712,EleutherAI/pythia-14m,step36000,seed5,5,36000
He made a charitable contribution.,contribution,contribution,He made a contribution charitable., charitable contribution, contribution charitable,charitable,False,-14.937675476074219,-25.591556549072266,10.653881072998047,14067712,EleutherAI/pythia-14m,step36000,seed5,5,36000
He made a voluntary contribution.,contribution,contribution,He made a contribution voluntary., voluntary contribution, contribution voluntary,voluntary,False,-17.187774658203125,-24.40155792236328,7.213783264160156,14067712,EleutherAI/pythia-14m,step36000,seed5,5,36000
He made a scholarly contribution.,contribution,contribution,He made a contribution scholarly., scholarly contribution, contribution scholarly,scholarly,False,-19.300979614257812,-26.684574127197266,7.383594512939453,14067712,EleutherAI/pythia-14m,step36000,seed5,5,36000
That was the noble count.,count,count,That was the count noble., noble count, count noble,noble,False,-19.2268009185791,-25.229459762573242,6.002658843994141,14067712,EleutherAI/pythia-14m,step36000,seed5,5,36000
That was the vengeful count.,count,count,That was the count vengeful., vengeful count, count vengeful,vengeful,False,-25.6284236907959,-30.516447067260742,4.888023376464844,14067712,EleutherAI/pythia-14m,step36000,seed5,5,36000
That was the final count.,count,count,That was the count final., final count, count final,final,False,-15.012796401977539,-20.21268081665039,5.199884414672852,14067712,EleutherAI/pythia-14m,step36000,seed5,5,36000
It was an introductory course.,course,course,It was an course introductory., introductory course, course introductory,introductory,False,-12.766989707946777,-29.496746063232422,16.729756355285645,14067712,EleutherAI/pythia-14m,step36000,seed5,5,36000
It was a pass-fail course.,course,course,It was a course pass-fail., pass-fail course, course pass-fail,pass-fail,False,-27.276323318481445,-31.474781036376953,4.198457717895508,14067712,EleutherAI/pythia-14m,step36000,seed5,5,36000
It was a charted course.,course,course,It was a course charted., charted course, course charted,charted,False,-20.391138076782227,-22.79477310180664,2.403635025024414,14067712,EleutherAI/pythia-14m,step36000,seed5,5,36000
It was a dinner date.,date,date,It was a date dinner., dinner date, date dinner,dinner,True,-16.548019409179688,-20.79441261291504,4.246393203735352,14067712,EleutherAI/pythia-14m,step36000,seed5,5,36000
It was a blind date.,date,date,It was a date blind., blind date, date blind,blind,False,-18.026935577392578,-21.900920867919922,3.8739852905273438,14067712,EleutherAI/pythia-14m,step36000,seed5,5,36000
It was an expiration date.,date,date,It was an date expiration., expiration date, date expiration,expiration,True,-13.106684684753418,-29.36997413635254,16.26328945159912,14067712,EleutherAI/pythia-14m,step36000,seed5,5,36000
It was about forty degrees.,degree,degrees,It was about degrees forty., forty degrees, degrees forty,forty,True,-17.269454956054688,-26.147842407226562,8.878387451171875,14067712,EleutherAI/pythia-14m,step36000,seed5,5,36000
It was about fifty degrees.,degree,degrees,It was about degrees fifty., fifty degrees, degrees fifty,fifty,True,-16.802654266357422,-25.089706420898438,8.287052154541016,14067712,EleutherAI/pythia-14m,step36000,seed5,5,36000
It was about associate degrees.,degree,degrees,It was about degrees associate., associate degrees, degrees associate,associate,False,-28.43646240234375,-33.02577209472656,4.5893096923828125,14067712,EleutherAI/pythia-14m,step36000,seed5,5,36000
They liked the floral design.,design,design,They liked the design floral., floral design, design floral,floral,False,-17.571067810058594,-22.972543716430664,5.40147590637207,14067712,EleutherAI/pythia-14m,step36000,seed5,5,36000
They liked the geometric design.,design,design,They liked the design geometric., geometric design, design geometric,geometric,False,-15.045714378356934,-20.655967712402344,5.61025333404541,14067712,EleutherAI/pythia-14m,step36000,seed5,5,36000
They liked the product design.,design,design,They liked the design product., product design, design product,product,True,-15.647783279418945,-16.699012756347656,1.051229476928711,14067712,EleutherAI/pythia-14m,step36000,seed5,5,36000
They liked the turkey dinner.,dinner,dinner,They liked the dinner turkey., turkey dinner, dinner turkey,turkey,True,-17.840913772583008,-20.139232635498047,2.298318862915039,14067712,EleutherAI/pythia-14m,step36000,seed5,5,36000
They liked the light dinner.,dinner,dinner,They liked the dinner light., light dinner, dinner light,light,False,-19.4011287689209,-20.04520034790039,0.6440715789794922,14067712,EleutherAI/pythia-14m,step36000,seed5,5,36000
They liked the formal dinner.,dinner,dinner,They liked the dinner formal., formal dinner, dinner formal,formal,False,-19.519550323486328,-22.735301971435547,3.2157516479492188,14067712,EleutherAI/pythia-14m,step36000,seed5,5,36000
He had a recurring dream.,dream,dream,He had a dream recurring., recurring dream, dream recurring,recurring,False,-16.415817260742188,-23.32099723815918,6.905179977416992,14067712,EleutherAI/pythia-14m,step36000,seed5,5,36000
He had a bad dream.,dream,dream,He had a dream bad., bad dream, dream bad,bad,False,-12.678027153015137,-17.787681579589844,5.109654426574707,14067712,EleutherAI/pythia-14m,step36000,seed5,5,36000
He had a childhood dream.,dream,dream,He had a dream childhood., childhood dream, dream childhood,childhood,True,-17.155906677246094,-20.31389808654785,3.157991409301758,14067712,EleutherAI/pythia-14m,step36000,seed5,5,36000
It was a grueling drill.,drill,drill,It was a drill grueling., grueling drill, drill grueling,grueling,False,-20.743839263916016,-24.321491241455078,3.5776519775390625,14067712,EleutherAI/pythia-14m,step36000,seed5,5,36000
It was a challenging drill.,drill,drill,It was a drill challenging., challenging drill, drill challenging,challenging,False,-18.796178817749023,-21.707515716552734,2.911336898803711,14067712,EleutherAI/pythia-14m,step36000,seed5,5,36000
It was an electric drill.,drill,drill,It was an drill electric., electric drill, drill electric,electric,False,-17.827926635742188,-26.73394775390625,8.906021118164062,14067712,EleutherAI/pythia-14m,step36000,seed5,5,36000
It was a multiple-choice examination.,examination,examination,It was an examination multiple-choice., multiple-choice examination, examination multiple-choice,multiple-choice,False,-27.630369186401367,-31.913394927978516,4.283025741577148,14067712,EleutherAI/pythia-14m,step36000,seed5,5,36000
It was a difficult examination.,examination,examination,It was an examination difficult., difficult examination, examination difficult,difficult,False,-16.486465454101562,-17.63800811767578,1.1515426635742188,14067712,EleutherAI/pythia-14m,step36000,seed5,5,36000
It was a prostate examination.,examination,examination,It was an examination prostate., prostate examination, examination prostate,prostate,True,-20.13909339904785,-22.43472671508789,2.295633316040039,14067712,EleutherAI/pythia-14m,step36000,seed5,5,36000
They had an electric fan.,fan,fan,They had an fan electric., electric fan, fan electric,electric,False,-15.743887901306152,-23.789627075195312,8.04573917388916,14067712,EleutherAI/pythia-14m,step36000,seed5,5,36000
They had a ceiling fan.,fan,fan,They had a fan ceiling., ceiling fan, fan ceiling,ceiling,True,-20.248950958251953,-21.791614532470703,1.54266357421875,14067712,EleutherAI/pythia-14m,step36000,seed5,5,36000
They had a zealous fan.,fan,fan,They had a fan zealous., zealous fan, fan zealous,zealous,False,-22.30874252319336,-30.440446853637695,8.131704330444336,14067712,EleutherAI/pythia-14m,step36000,seed5,5,36000
She had a text file.,file,file,She had a file text., text file, file text,text,True,-12.395509719848633,-17.456274032592773,5.060764312744141,14067712,EleutherAI/pythia-14m,step36000,seed5,5,36000
She had a data file.,file,file,She had a file data., data file, file data,data,True,-13.866308212280273,-16.6580810546875,2.7917728424072266,14067712,EleutherAI/pythia-14m,step36000,seed5,5,36000
She had a nail file.,file,file,She had a file nail., nail file, file nail,nail,True,-17.918169021606445,-23.229488372802734,5.311319351196289,14067712,EleutherAI/pythia-14m,step36000,seed5,5,36000
It was an action film.,film,film,It was an film action., action film, film action,action,True,-14.21753978729248,-21.684364318847656,7.466824531555176,14067712,EleutherAI/pythia-14m,step36000,seed5,5,36000
It was a censored film.,film,film,It was a film censored., censored film, film censored,censored,False,-20.656414031982422,-21.609268188476562,0.9528541564941406,14067712,EleutherAI/pythia-14m,step36000,seed5,5,36000
It was a transparent film.,film,film,It was a film transparent., transparent film, film transparent,transparent,False,-15.207009315490723,-20.13501739501953,4.928008079528809,14067712,EleutherAI/pythia-14m,step36000,seed5,5,36000
It was a charitable foundation.,foundation,foundation,It was a foundation charitable., charitable foundation, foundation charitable,charitable,False,-15.480270385742188,-23.144134521484375,7.6638641357421875,14067712,EleutherAI/pythia-14m,step36000,seed5,5,36000
It was an educational foundation.,foundation,foundation,It was an foundation educational., educational foundation, foundation educational,educational,False,-15.619243621826172,-25.8101806640625,10.190937042236328,14067712,EleutherAI/pythia-14m,step36000,seed5,5,36000
It was a wooden foundation.,foundation,foundation,It was a foundation wooden., wooden foundation, foundation wooden,wooden,False,-18.60931396484375,-23.58955192565918,4.98023796081543,14067712,EleutherAI/pythia-14m,step36000,seed5,5,36000
It was a mathematical function.,function,function,It was a function mathematical., mathematical function, function mathematical,mathematical,False,-15.335474014282227,-20.805431365966797,5.46995735168457,14067712,EleutherAI/pythia-14m,step36000,seed5,5,36000
It was a linear function.,function,function,It was a function linear., linear function, function linear,linear,False,-12.928520202636719,-19.859004974365234,6.930484771728516,14067712,EleutherAI/pythia-14m,step36000,seed5,5,36000
