sentence,word,string,reversed_sentence,mod_np,reversed_mod,disambiguating_word,non_adjective,original_logprob,reversed_logprob,ratio,n_params,mpath,revision,seed_name,seed,step
It was a fall term.,term,term,It was a term fall., fall term, term fall,fall,True,-16.518932342529297,-19.741378784179688,3.2224464416503906,14067712,EleutherAI/pythia-14m,step81000,seed1,1,81000
It was a legal term.,term,term,It was a term legal., legal term, term legal,legal,False,-14.829345703125,-18.4857177734375,3.6563720703125,14067712,EleutherAI/pythia-14m,step81000,seed1,1,81000
It was a clock tick.,tick,tick,It was a tick clock., clock tick, tick clock,clock,True,-16.29905891418457,-21.402957916259766,5.103899002075195,14067712,EleutherAI/pythia-14m,step81000,seed1,1,81000
It was an audible tick.,tick,tick,It was an tick audible., audible tick, tick audible,audible,False,-16.52107048034668,-24.340145111083984,7.819074630737305,14067712,EleutherAI/pythia-14m,step81000,seed1,1,81000
It was a parasitic tick.,tick,tick,It was a tick parasitic., parasitic tick, tick parasitic,parasitic,False,-20.735076904296875,-24.031848907470703,3.296772003173828,14067712,EleutherAI/pythia-14m,step81000,seed1,1,81000
It was a generous tip.,tip,tip,It was a tip generous., generous tip, tip generous,generous,False,-19.45207977294922,-26.03792381286621,6.585844039916992,14067712,EleutherAI/pythia-14m,step81000,seed1,1,81000
It was a stingy tip.,tip,tip,It was a tip stingy., stingy tip, tip stingy,stingy,False,-20.971921920776367,-25.03466796875,4.062746047973633,14067712,EleutherAI/pythia-14m,step81000,seed1,1,81000
It was a pencil tip.,tip,tip,It was a tip pencil., pencil tip, tip pencil,pencil,True,-19.157392501831055,-20.448461532592773,1.2910690307617188,14067712,EleutherAI/pythia-14m,step81000,seed1,1,81000
She liked the essay title.,title,title,She liked the title essay., essay title, title essay,essay,True,-17.37397575378418,-16.928974151611328,-0.44500160217285156,14067712,EleutherAI/pythia-14m,step81000,seed1,1,81000
She liked the poem title.,title,title,She liked the title poem., poem title, title poem,poem,True,-17.04361343383789,-16.210285186767578,-0.8333282470703125,14067712,EleutherAI/pythia-14m,step81000,seed1,1,81000
She liked the academic title.,title,title,She liked the title academic., academic title, title academic,academic,False,-16.0816650390625,-19.264225006103516,3.1825599670410156,14067712,EleutherAI/pythia-14m,step81000,seed1,1,81000
It was a costly toll.,toll,toll,It was a toll costly., costly toll, toll costly,costly,False,-17.588977813720703,-25.280269622802734,7.691291809082031,14067712,EleutherAI/pythia-14m,step81000,seed1,1,81000
It was a road toll.,toll,toll,It was a toll road., road toll, toll road,road,True,-20.243732452392578,-17.249706268310547,-2.9940261840820312,14067712,EleutherAI/pythia-14m,step81000,seed1,1,81000
It was a loud toll.,toll,toll,It was a toll loud., loud toll, toll loud,loud,False,-18.468645095825195,-26.590801239013672,8.122156143188477,14067712,EleutherAI/pythia-14m,step81000,seed1,1,81000
She saw the train tracks.,track,tracks,She saw the tracks train., train tracks, tracks train,train,True,-16.293670654296875,-20.167085647583008,3.873414993286133,14067712,EleutherAI/pythia-14m,step81000,seed1,1,81000
She saw the trolley tracks.,track,tracks,She saw the tracks trolley., trolley tracks, tracks trolley,trolley,True,-23.500043869018555,-26.103267669677734,2.6032238006591797,14067712,EleutherAI/pythia-14m,step81000,seed1,1,81000
She saw the moose tracks.,track,tracks,She saw the tracks moose., moose tracks, tracks moose,moose,False,-26.35245132446289,-25.95451545715332,-0.3979358673095703,14067712,EleutherAI/pythia-14m,step81000,seed1,1,81000
It was five yards.,yard,yards,It was yards five., five yards, yards five,five,True,-16.274553298950195,-22.119075775146484,5.844522476196289,14067712,EleutherAI/pythia-14m,step81000,seed1,1,81000
It was ten yards.,yard,yards,It was yards ten., ten yards, yards ten,ten,True,-15.649477005004883,-22.730937957763672,7.081460952758789,14067712,EleutherAI/pythia-14m,step81000,seed1,1,81000
They were big yards.,yard,yards,They were yards big., big yards, yards big,big,False,-18.496126174926758,-22.00206756591797,3.505941390991211,14067712,EleutherAI/pythia-14m,step81000,seed1,1,81000
It was a comedic act.,act,act,It was an act comedic., comedic act, act comedic,comedic,False,-17.60791015625,-21.325876235961914,3.717966079711914,14067712,EleutherAI/pythia-14m,step81000,seed1,1,81000
He had a pending appeal.,appeal,appeal,He had an appeal pending., pending appeal, appeal pending,pending,False,-14.181896209716797,-13.325044631958008,-0.8568515777587891,14067712,EleutherAI/pythia-14m,step81000,seed1,1,81000
It was a polluted atmosphere.,atmosphere,atmosphere,It was an atmosphere polluted., polluted atmosphere, atmosphere polluted,polluted,False,-20.153242111206055,-21.62489128112793,1.471649169921875,14067712,EleutherAI/pythia-14m,step81000,seed1,1,81000
It was a country band.,band,band,It was a band country., country band, band country,country,True,-15.288464546203613,-18.573997497558594,3.2855329513549805,14067712,EleutherAI/pythia-14m,step81000,seed1,1,81000
There was a religious barrier.,barrier,barrier,There was a barrier religious., religious barrier, barrier religious,religious,False,-16.300329208374023,-21.02539825439453,4.725069046020508,14067712,EleutherAI/pythia-14m,step81000,seed1,1,81000
He saw a baseball bat.,bat,bat,He saw a bat baseball., baseball bat, bat baseball,baseball,True,-13.089571952819824,-20.1077938079834,7.018221855163574,14067712,EleutherAI/pythia-14m,step81000,seed1,1,81000
He saw the balance beam.,beam,beam,He saw the beam balance., balance beam, beam balance,balance,True,-18.703157424926758,-19.222108840942383,0.518951416015625,14067712,EleutherAI/pythia-14m,step81000,seed1,1,81000
She had a writer's block.,block,block,She had a block writer's., writer's block, block writer's,writer,True,-24.301467895507812,-25.395931243896484,1.0944633483886719,14067712,EleutherAI/pythia-14m,step81000,seed1,1,81000
He has royal blood.,blood,blood,He has blood royal., royal blood, blood royal,royal,False,-20.759727478027344,-24.069625854492188,3.3098983764648438,14067712,EleutherAI/pythia-14m,step81000,seed1,1,81000
It was the school board.,board,board,It was the board school., school board, board school,school,True,-13.565252304077148,-18.556041717529297,4.990789413452148,14067712,EleutherAI/pythia-14m,step81000,seed1,1,81000
He had a leather-bound book.,book,book,He had a book leather-bound., leather-bound book, book leather-bound,leather-bound,False,-24.043760299682617,-29.34457015991211,5.300809860229492,14067712,EleutherAI/pythia-14m,step81000,seed1,1,81000
They ate a lonely breakfast.,breakfast,breakfast,They ate a breakfast lonely., lonely breakfast, breakfast lonely,lonely,False,-13.926203727722168,-19.54387664794922,5.617672920227051,14067712,EleutherAI/pythia-14m,step81000,seed1,1,81000
It was an island cape.,cape,cape,It was an cape island., island cape, cape island,island,True,-23.713863372802734,-26.119468688964844,2.4056053161621094,14067712,EleutherAI/pythia-14m,step81000,seed1,1,81000
It was a criminal case.,case,case,It was a case criminal., criminal case, case criminal,criminal,False,-11.300324440002441,-16.962364196777344,5.662039756774902,14067712,EleutherAI/pythia-14m,step81000,seed1,1,81000
It was a primary cause.,cause,cause,It was a cause primary., primary cause, cause primary,primary,False,-13.423114776611328,-23.169872283935547,9.746757507324219,14067712,EleutherAI/pythia-14m,step81000,seed1,1,81000
It was a jail cell.,cell,cell,It was a cell jail., jail cell, cell jail,jail,True,-14.708061218261719,-18.4918212890625,3.7837600708007812,14067712,EleutherAI/pythia-14m,step81000,seed1,1,81000
She had a good-luck charm.,charm,charm,She had a charm good-luck., good-luck charm, charm good-luck,good-luck,False,-28.129669189453125,-30.675094604492188,2.5454254150390625,14067712,EleutherAI/pythia-14m,step81000,seed1,1,81000
They liked the pet chicken.,chicken,chicken,They liked the chicken pet., pet chicken, chicken pet,pet,True,-18.936336517333984,-17.343685150146484,-1.5926513671875,14067712,EleutherAI/pythia-14m,step81000,seed1,1,81000
It was a stimulating class.,class,class,It was a class stimulating., stimulating class, class stimulating,stimulating,False,-20.722448348999023,-24.795391082763672,4.072942733764648,14067712,EleutherAI/pythia-14m,step81000,seed1,1,81000
It was a metal clip.,clip,clip,It was a clip metal., metal clip, clip metal,metal,True,-17.687458038330078,-20.25372886657715,2.5662708282470703,14067712,EleutherAI/pythia-14m,step81000,seed1,1,81000
It was a common cold.,cold,cold,It was a cold common., common cold, cold common,common,False,-15.061356544494629,-18.269939422607422,3.208582878112793,14067712,EleutherAI/pythia-14m,step81000,seed1,1,81000
It was a marble column.,column,column,It was a column marble., marble column, column marble,marble,True,-17.823448181152344,-21.31424331665039,3.490795135498047,14067712,EleutherAI/pythia-14m,step81000,seed1,1,81000
He liked the polite company.,company,company,He liked the company polite., polite company, company polite,polite,False,-18.11093521118164,-21.03252410888672,2.921588897705078,14067712,EleutherAI/pythia-14m,step81000,seed1,1,81000
It was a traffic cone.,cone,cone,It was a cone traffic., traffic cone, cone traffic,traffic,True,-18.319753646850586,-24.833759307861328,6.514005661010742,14067712,EleutherAI/pythia-14m,step81000,seed1,1,81000
He made a well-written contribution.,contribution,contribution,He made a contribution well-written., well-written contribution, contribution well-written,well-written,False,-21.43917465209961,-31.068037033081055,9.628862380981445,14067712,EleutherAI/pythia-14m,step81000,seed1,1,81000
That was the correct count.,count,count,That was the count correct., correct count, count correct,correct,False,-16.00324249267578,-18.955734252929688,2.9524917602539062,14067712,EleutherAI/pythia-14m,step81000,seed1,1,81000
It was a collision course.,course,course,It was a course collision., collision course, course collision,collision,True,-18.04784393310547,-21.690610885620117,3.6427669525146484,14067712,EleutherAI/pythia-14m,step81000,seed1,1,81000
It was a historical date.,date,date,It was a date historical., historical date, date historical,historical,False,-16.31928253173828,-22.165607452392578,5.846324920654297,14067712,EleutherAI/pythia-14m,step81000,seed1,1,81000
It was about college degrees.,degree,degrees,It was about degrees college., college degrees, degrees college,college,True,-15.900552749633789,-23.109827041625977,7.2092742919921875,14067712,EleutherAI/pythia-14m,step81000,seed1,1,81000
They liked the architectural design.,design,design,They liked the design architectural., architectural design, design architectural,architectural,False,-16.95276641845703,-21.369415283203125,4.416648864746094,14067712,EleutherAI/pythia-14m,step81000,seed1,1,81000
They liked the anniversary dinner.,dinner,dinner,They liked the dinner anniversary., anniversary dinner, dinner anniversary,anniversary,True,-16.333953857421875,-15.327768325805664,-1.006185531616211,14067712,EleutherAI/pythia-14m,step81000,seed1,1,81000
He had a career dream.,dream,dream,He had a dream career., career dream, dream career,career,True,-13.56931209564209,-16.99139404296875,3.42208194732666,14067712,EleutherAI/pythia-14m,step81000,seed1,1,81000
It was a battery-powered drill.,drill,drill,It was a drill battery-powered., battery-powered drill, drill battery-powered,battery-powered,False,-23.251251220703125,-26.37495231628418,3.1237010955810547,14067712,EleutherAI/pythia-14m,step81000,seed1,1,81000
It was a physical examination.,examination,examination,It was an examination physical., physical examination, examination physical,physical,False,-13.894091606140137,-22.054656982421875,8.160565376281738,14067712,EleutherAI/pythia-14m,step81000,seed1,1,81000
They had an enthusiastic fan.,fan,fan,They had an fan enthusiastic., enthusiastic fan, fan enthusiastic,enthusiastic,False,-14.911354064941406,-27.192493438720703,12.281139373779297,14067712,EleutherAI/pythia-14m,step81000,seed1,1,81000
She had a steel file.,file,file,She had a file steel., steel file, file steel,steel,True,-21.188514709472656,-27.062746047973633,5.874231338500977,14067712,EleutherAI/pythia-14m,step81000,seed1,1,81000
It was a plastic film.,film,film,It was a film plastic., plastic film, film plastic,plastic,False,-15.284500122070312,-20.761829376220703,5.477329254150391,14067712,EleutherAI/pythia-14m,step81000,seed1,1,81000
It was a concrete foundation.,foundation,foundation,It was a foundation concrete., concrete foundation, foundation concrete,concrete,False,-14.447688102722168,-20.26364517211914,5.815957069396973,14067712,EleutherAI/pythia-14m,step81000,seed1,1,81000
It was a business function.,function,function,It was a function business., business function, function business,business,True,-15.861321449279785,-20.22179412841797,4.360472679138184,14067712,EleutherAI/pythia-14m,step81000,seed1,1,81000
He was on the parade ground.,ground,ground,He was on the ground parade., parade ground, ground parade,parade,True,-20.205514907836914,-21.567005157470703,1.361490249633789,14067712,EleutherAI/pythia-14m,step81000,seed1,1,81000
They liked the national guard.,guard,guard,They liked the guard national., national guard, guard national,national,False,-17.641986846923828,-20.233909606933594,2.5919227600097656,14067712,EleutherAI/pythia-14m,step81000,seed1,1,81000
He had a friendly guide.,guide,guide,He had a guide friendly., friendly guide, guide friendly,friendly,False,-16.533203125,-22.004287719726562,5.4710845947265625,14067712,EleutherAI/pythia-14m,step81000,seed1,1,81000
It was a nursing home.,home,home,It was a home nursing., nursing home, home nursing,nursing,True,-13.845272064208984,-17.51717758178711,3.671905517578125,14067712,EleutherAI/pythia-14m,step81000,seed1,1,81000
They had military intelligence.,intelligence,intelligence,They had intelligence military., military intelligence, intelligence military,military,False,-17.32956314086914,-22.13750648498535,4.807943344116211,14067712,EleutherAI/pythia-14m,step81000,seed1,1,81000
It was a special issue.,issue,issue,It was an issue special., special issue, issue special,special,False,-9.943563461303711,-14.362200736999512,4.418637275695801,14067712,EleutherAI/pythia-14m,step81000,seed1,1,81000
It was a paper jam.,jam,jam,It was a jam paper., paper jam, jam paper,paper,True,-18.365976333618164,-20.4685001373291,2.1025238037109375,14067712,EleutherAI/pythia-14m,step81000,seed1,1,81000
It was a backspace key.,key,key,It was a key backspace., backspace key, key backspace,backspace,True,-27.985721588134766,-25.194055557250977,-2.791666030883789,14067712,EleutherAI/pythia-14m,step81000,seed1,1,81000
They liked the friendly lamb.,lamb,lamb,They liked the lamb friendly., friendly lamb, lamb friendly,friendly,False,-19.54705047607422,-22.955177307128906,3.4081268310546875,14067712,EleutherAI/pythia-14m,step81000,seed1,1,81000
She had door locks.,lock,locks,She had locks door., door locks, locks door,door,True,-22.459108352661133,-21.657520294189453,-0.8015880584716797,14067712,EleutherAI/pythia-14m,step81000,seed1,1,81000
They liked the women's lunch.,lunch,lunch,They liked the lunch women's., women's lunch, lunch women's,women,True,-17.03583526611328,-21.842708587646484,4.806873321533203,14067712,EleutherAI/pythia-14m,step81000,seed1,1,81000
He liked the stock market.,market,market,He liked the market stock., stock market, market stock,stock,True,-12.447626113891602,-15.765434265136719,3.317808151245117,14067712,EleutherAI/pythia-14m,step81000,seed1,1,81000
It was a tennis match.,match,match,It was a match tennis., tennis match, match tennis,tennis,True,-15.742232322692871,-20.321096420288086,4.578864097595215,14067712,EleutherAI/pythia-14m,step81000,seed1,1,81000
It was veterinary medicine.,medicine,medicine,It was medicine veterinary., veterinary medicine, medicine veterinary,veterinary,False,-18.807998657226562,-25.391273498535156,6.583274841308594,14067712,EleutherAI/pythia-14m,step81000,seed1,1,81000
There was a clear message.,message,message,There was a message clear., clear message, message clear,clear,False,-11.6681489944458,-15.946107864379883,4.277958869934082,14067712,EleutherAI/pythia-14m,step81000,seed1,1,81000
It was a clay mold.,mold,mold,It was a mold clay., clay mold, mold clay,clay,True,-16.974891662597656,-19.939712524414062,2.9648208618164062,14067712,EleutherAI/pythia-14m,step81000,seed1,1,81000
She saw the fast mole.,mole,mole,She saw the mole fast., fast mole, mole fast,fast,False,-21.553056716918945,-23.39328384399414,1.8402271270751953,14067712,EleutherAI/pythia-14m,step81000,seed1,1,81000
He liked the civil-rights movement.,movement,movement,He liked the movement civil-rights., civil-rights movement, movement civil-rights,civil-rights,False,-21.537818908691406,-31.314279556274414,9.776460647583008,14067712,EleutherAI/pythia-14m,step81000,seed1,1,81000
It was a shredded newspaper.,newspaper,newspaper,It was a newspaper shredded., shredded newspaper, newspaper shredded,shredded,False,-22.866451263427734,-21.50684356689453,-1.3596076965332031,14067712,EleutherAI/pythia-14m,step81000,seed1,1,81000
It was a reddish orange.,orange,orange,It was an orange reddish., reddish orange, orange reddish,reddish,False,-17.650638580322266,-16.846778869628906,-0.8038597106933594,14067712,EleutherAI/pythia-14m,step81000,seed1,1,81000
He saw the ripped page.,page,page,He saw the page ripped., ripped page, page ripped,ripped,False,-21.09281349182129,-19.32461166381836,-1.7682018280029297,14067712,EleutherAI/pythia-14m,step81000,seed1,1,81000
It was a tree palm.,palm,palm,It was a palm tree., tree palm, palm tree,tree,True,-19.126237869262695,-13.948768615722656,-5.177469253540039,14067712,EleutherAI/pythia-14m,step81000,seed1,1,81000
It was a consumer panel.,panel,panel,It was a panel consumer., consumer panel, panel consumer,consumer,True,-18.303112030029297,-22.80104637145996,4.497934341430664,14067712,EleutherAI/pythia-14m,step81000,seed1,1,81000
It was a biblical passage.,passage,passage,It was a passage biblical., biblical passage, passage biblical,biblical,False,-17.847442626953125,-24.556961059570312,6.7095184326171875,14067712,EleutherAI/pythia-14m,step81000,seed1,1,81000
It was a secure perch.,perch,perch,It was a perch secure., secure perch, perch secure,secure,False,-23.88254165649414,-25.948974609375,2.0664329528808594,14067712,EleutherAI/pythia-14m,step81000,seed1,1,81000
He saw the plastic pitcher.,pitcher,pitcher,He saw the pitcher plastic., plastic pitcher, pitcher plastic,plastic,True,-20.269859313964844,-24.03990936279297,3.770050048828125,14067712,EleutherAI/pythia-14m,step81000,seed1,1,81000
It was a sweet port.,port,port,It was a port sweet., sweet port, port sweet,sweet,False,-18.198230743408203,-23.70520782470703,5.506977081298828,14067712,EleutherAI/pythia-14m,step81000,seed1,1,81000
He was in a yoga position.,position,position,He was in a position yoga., yoga position, position yoga,yoga,True,-16.601491928100586,-19.481670379638672,2.880178451538086,14067712,EleutherAI/pythia-14m,step81000,seed1,1,81000
It was a challenging post.,post,post,It was a post challenging., challenging post, post challenging,challenging,False,-15.604256629943848,-19.397077560424805,3.792820930480957,14067712,EleutherAI/pythia-14m,step81000,seed1,1,81000
He had the quickest punch.,punch,punch,He had the punch quickest., quickest punch, punch quickest,quickest,False,-18.858455657958984,-26.765710830688477,7.907255172729492,14067712,EleutherAI/pythia-14m,step81000,seed1,1,81000
She had a cloudy pupil.,pupil,pupil,She had a pupil cloudy., cloudy pupil, pupil cloudy,cloudy,False,-25.166748046875,-27.63115882873535,2.4644107818603516,14067712,EleutherAI/pythia-14m,step81000,seed1,1,81000
That was a tennis racket.,racket,racket,That was a racket tennis., tennis racket, racket tennis,tennis,True,-17.674945831298828,-22.378177642822266,4.7032318115234375,14067712,EleutherAI/pythia-14m,step81000,seed1,1,81000
He liked granite rock.,rock,rock,He liked rock granite., granite rock, rock granite,granite,True,-19.22176742553711,-20.559486389160156,1.3377189636230469,14067712,EleutherAI/pythia-14m,step81000,seed1,1,81000
He saw the bushy sage.,sage,sage,He saw the sage bushy., bushy sage, sage bushy,bushy,False,-26.35361099243164,-27.78937339782715,1.4357624053955078,14067712,EleutherAI/pythia-14m,step81000,seed1,1,81000
It was a major scale.,scale,scale,It was a scale major., major scale, scale major,major,False,-15.701695442199707,-21.01226043701172,5.310564994812012,14067712,EleutherAI/pythia-14m,step81000,seed1,1,81000
It was a panoramic scene.,scene,scene,It was a scene panoramic., panoramic scene, scene panoramic,panoramic,False,-16.575664520263672,-20.81748390197754,4.241819381713867,14067712,EleutherAI/pythia-14m,step81000,seed1,1,81000
It was a trained seal.,seal,seal,It was a seal trained., trained seal, seal trained,trained,False,-21.857330322265625,-23.234458923339844,1.3771286010742188,14067712,EleutherAI/pythia-14m,step81000,seed1,1,81000
He used the video tape.,tape,tape,He used the tape video., video tape, tape video,video,True,-12.202948570251465,-17.280853271484375,5.07790470123291,14067712,EleutherAI/pythia-14m,step81000,seed1,1,81000
It was a technical term.,term,term,It was a term technical., technical term, term technical,technical,False,-15.798067092895508,-22.110519409179688,6.31245231628418,14067712,EleutherAI/pythia-14m,step81000,seed1,1,81000
It was a diseased tick.,tick,tick,It was a tick diseased., diseased tick, tick diseased,diseased,False,-22.37444305419922,-24.58505630493164,2.210613250732422,14067712,EleutherAI/pythia-14m,step81000,seed1,1,81000
It was a finger tip.,tip,tip,It was a tip finger., finger tip, tip finger,finger,True,-21.493356704711914,-17.320608139038086,-4.172748565673828,14067712,EleutherAI/pythia-14m,step81000,seed1,1,81000
She liked the professional title.,title,title,She liked the title professional., professional title, title professional,professional,False,-16.578838348388672,-18.409793853759766,1.8309555053710938,14067712,EleutherAI/pythia-14m,step81000,seed1,1,81000
It was a bell toll.,toll,toll,It was a toll bell., bell toll, toll bell,bell,True,-23.329484939575195,-23.15951156616211,-0.16997337341308594,14067712,EleutherAI/pythia-14m,step81000,seed1,1,81000
She saw the snowshoe tracks.,track,tracks,She saw the tracks snowshoe., snowshoe tracks, tracks snowshoe,snowshoe,True,-28.222145080566406,-31.831558227539062,3.6094131469726562,14067712,EleutherAI/pythia-14m,step81000,seed1,1,81000
They were cluttered yards.,yard,yards,They were yards cluttered., cluttered yards, yards cluttered,cluttered,False,-25.020809173583984,-24.79521942138672,-0.22558975219726562,14067712,EleutherAI/pythia-14m,step81000,seed1,1,81000
