sentence,word,string,reversed_sentence,mod_np,reversed_mod,disambiguating_word,non_adjective,original_logprob,reversed_logprob,ratio,n_params,mpath,revision,seed_name,seed,step
It was a linear function.,function,function,It was a function linear., linear function, function linear,linear,False,-15.880638122558594,-21.41973114013672,5.539093017578125,14067712,EleutherAI/pythia-14m,step142000,seed1,1,142000
It was a social function.,function,function,It was a function social., social function, function social,social,False,-16.52308464050293,-21.35503387451172,4.831949234008789,14067712,EleutherAI/pythia-14m,step142000,seed1,1,142000
He was on the firm ground.,ground,ground,He was on the ground firm., firm ground, ground firm,firm,False,-18.894847869873047,-16.38864517211914,-2.5062026977539062,14067712,EleutherAI/pythia-14m,step142000,seed1,1,142000
He was on the frozen ground.,ground,ground,He was on the ground frozen., frozen ground, ground frozen,frozen,False,-15.141563415527344,-18.89670181274414,3.755138397216797,14067712,EleutherAI/pythia-14m,step142000,seed1,1,142000
He was on the camp ground.,ground,ground,He was on the ground camp., camp ground, ground camp,camp,True,-18.712440490722656,-16.34518814086914,-2.3672523498535156,14067712,EleutherAI/pythia-14m,step142000,seed1,1,142000
They liked the night guard.,guard,guard,They liked the guard night., night guard, guard night,night,True,-18.539514541625977,-17.825145721435547,-0.7143688201904297,14067712,EleutherAI/pythia-14m,step142000,seed1,1,142000
They liked the security guard.,guard,guard,They liked the guard security., security guard, guard security,security,True,-16.624561309814453,-19.974193572998047,3.3496322631835938,14067712,EleutherAI/pythia-14m,step142000,seed1,1,142000
They liked the coast guard.,guard,guard,They liked the guard coast., coast guard, guard coast,coast,True,-21.22809600830078,-22.320140838623047,1.0920448303222656,14067712,EleutherAI/pythia-14m,step142000,seed1,1,142000
He had an assembly guide.,guide,guide,He had an guide assembly., assembly guide, guide assembly,assembly,True,-19.075382232666016,-24.672801971435547,5.597419738769531,14067712,EleutherAI/pythia-14m,step142000,seed1,1,142000
He had a TV guide.,guide,guide,He had a guide TV., TV guide, guide TV,TV,True,-18.342395782470703,-20.688766479492188,2.3463706970214844,14067712,EleutherAI/pythia-14m,step142000,seed1,1,142000
He had a talkative guide.,guide,guide,He had a guide talkative., talkative guide, guide talkative,talkative,False,-25.15744400024414,-27.313762664794922,2.1563186645507812,14067712,EleutherAI/pythia-14m,step142000,seed1,1,142000
It was a summer home.,home,home,It was a home summer., summer home, home summer,summer,True,-16.201475143432617,-16.044828414916992,-0.156646728515625,14067712,EleutherAI/pythia-14m,step142000,seed1,1,142000
It was a childhood home.,home,home,It was a home childhood., childhood home, home childhood,childhood,True,-15.076107025146484,-17.750761032104492,2.674654006958008,14067712,EleutherAI/pythia-14m,step142000,seed1,1,142000
It was a funeral home.,home,home,It was a home funeral., funeral home, home funeral,funeral,False,-13.424588203430176,-18.045804977416992,4.621216773986816,14067712,EleutherAI/pythia-14m,step142000,seed1,1,142000
They had natural intelligence.,intelligence,intelligence,They had intelligence natural., natural intelligence, intelligence natural,natural,False,-16.58858871459961,-22.162307739257812,5.573719024658203,14067712,EleutherAI/pythia-14m,step142000,seed1,1,142000
They had innate intelligence.,intelligence,intelligence,They had intelligence innate., innate intelligence, intelligence innate,innate,False,-20.353530883789062,-25.519973754882812,5.16644287109375,14067712,EleutherAI/pythia-14m,step142000,seed1,1,142000
They had classified intelligence.,intelligence,intelligence,They had intelligence classified., classified intelligence, intelligence classified,classified,False,-20.979812622070312,-22.571853637695312,1.592041015625,14067712,EleutherAI/pythia-14m,step142000,seed1,1,142000
It was a sensitive issue.,issue,issue,It was an issue sensitive., sensitive issue, issue sensitive,sensitive,False,-14.519205093383789,-16.413572311401367,1.8943672180175781,14067712,EleutherAI/pythia-14m,step142000,seed1,1,142000
It was a political issue.,issue,issue,It was an issue political., political issue, issue political,political,False,-12.170001983642578,-16.003904342651367,3.833902359008789,14067712,EleutherAI/pythia-14m,step142000,seed1,1,142000
It was a weekly issue.,issue,issue,It was an issue weekly., weekly issue, issue weekly,weekly,False,-16.67118263244629,-17.979368209838867,1.3081855773925781,14067712,EleutherAI/pythia-14m,step142000,seed1,1,142000
It was a blackberry jam.,jam,jam,It was a jam blackberry., blackberry jam, jam blackberry,blackberry,True,-21.313512802124023,-27.662508010864258,6.348995208740234,14067712,EleutherAI/pythia-14m,step142000,seed1,1,142000
It was a peach jam.,jam,jam,It was a jam peach., peach jam, jam peach,peach,False,-19.24749183654785,-22.125686645507812,2.878194808959961,14067712,EleutherAI/pythia-14m,step142000,seed1,1,142000
It was a traffic jam.,jam,jam,It was a jam traffic., traffic jam, jam traffic,traffic,True,-13.563596725463867,-20.812042236328125,7.248445510864258,14067712,EleutherAI/pythia-14m,step142000,seed1,1,142000
It was a duplicate key.,key,key,It was a key duplicate., duplicate key, key duplicate,duplicate,False,-19.18451690673828,-19.833044052124023,0.6485271453857422,14067712,EleutherAI/pythia-14m,step142000,seed1,1,142000
It was a master key.,key,key,It was a key master., master key, key master,master,True,-18.371139526367188,-19.338293075561523,0.9671535491943359,14067712,EleutherAI/pythia-14m,step142000,seed1,1,142000
It was a delete key.,key,key,It was a key delete., delete key, key delete,delete,False,-19.90297508239746,-19.975255966186523,0.0722808837890625,14067712,EleutherAI/pythia-14m,step142000,seed1,1,142000
They liked the marinated lamb.,lamb,lamb,They liked the lamb marinated., marinated lamb, lamb marinated,marinated,True,-28.04303550720215,-27.36810302734375,-0.6749324798583984,14067712,EleutherAI/pythia-14m,step142000,seed1,1,142000
They liked the grilled lamb.,lamb,lamb,They liked the lamb grilled., grilled lamb, lamb grilled,grilled,False,-17.040924072265625,-21.23638343811035,4.195459365844727,14067712,EleutherAI/pythia-14m,step142000,seed1,1,142000
They liked the cute lamb.,lamb,lamb,They liked the lamb cute., cute lamb, lamb cute,cute,False,-18.333786010742188,-21.01458168029785,2.680795669555664,14067712,EleutherAI/pythia-14m,step142000,seed1,1,142000
She had curly locks.,lock,locks,She had locks curly., curly locks, locks curly,curly,False,-19.084457397460938,-23.03887176513672,3.9544143676757812,14067712,EleutherAI/pythia-14m,step142000,seed1,1,142000
She had brown locks.,lock,locks,She had locks brown., brown locks, locks brown,brown,False,-21.824756622314453,-22.71721649169922,0.8924598693847656,14067712,EleutherAI/pythia-14m,step142000,seed1,1,142000
She had window locks.,lock,locks,She had locks window., window locks, locks window,window,True,-21.772512435913086,-20.39336395263672,-1.3791484832763672,14067712,EleutherAI/pythia-14m,step142000,seed1,1,142000
They liked the hot lunch.,lunch,lunch,They liked the lunch hot., hot lunch, lunch hot,hot,False,-15.774797439575195,-19.408405303955078,3.633607864379883,14067712,EleutherAI/pythia-14m,step142000,seed1,1,142000
They liked the sandwich lunch.,lunch,lunch,They liked the lunch sandwich., sandwich lunch, lunch sandwich,sandwich,True,-18.221675872802734,-18.234821319580078,0.01314544677734375,14067712,EleutherAI/pythia-14m,step142000,seed1,1,142000
They liked the afternoon lunch.,lunch,lunch,They liked the lunch afternoon., afternoon lunch, lunch afternoon,afternoon,True,-18.223773956298828,-18.339557647705078,0.11578369140625,14067712,EleutherAI/pythia-14m,step142000,seed1,1,142000
He liked the flea market.,market,market,He liked the market flea., flea market, market flea,flea,True,-23.90871810913086,-24.055660247802734,0.146942138671875,14067712,EleutherAI/pythia-14m,step142000,seed1,1,142000
He liked the fish market.,market,market,He liked the market fish., fish market, market fish,fish,True,-17.093358993530273,-18.95939064025879,1.8660316467285156,14067712,EleutherAI/pythia-14m,step142000,seed1,1,142000
He liked the housing market.,market,market,He liked the market housing., housing market, market housing,housing,True,-15.6253080368042,-19.40165138244629,3.77634334564209,14067712,EleutherAI/pythia-14m,step142000,seed1,1,142000
It was a lit match.,match,match,It was a match lit., lit match, match lit,lit,False,-19.435497283935547,-19.96746063232422,0.5319633483886719,14067712,EleutherAI/pythia-14m,step142000,seed1,1,142000
It was a burning match.,match,match,It was a match burning., burning match, match burning,burning,False,-18.29486083984375,-20.16582489013672,1.8709640502929688,14067712,EleutherAI/pythia-14m,step142000,seed1,1,142000
It was a soccer match.,match,match,It was a match soccer., soccer match, match soccer,soccer,True,-15.271528244018555,-20.71623992919922,5.444711685180664,14067712,EleutherAI/pythia-14m,step142000,seed1,1,142000
It was cough medicine.,medicine,medicine,It was medicine cough., cough medicine, medicine cough,cough,True,-22.370681762695312,-22.90967559814453,0.5389938354492188,14067712,EleutherAI/pythia-14m,step142000,seed1,1,142000
It was prescription medicine.,medicine,medicine,It was medicine prescription., prescription medicine, medicine prescription,prescription,True,-18.898822784423828,-21.06201934814453,2.163196563720703,14067712,EleutherAI/pythia-14m,step142000,seed1,1,142000
It was orthopedic medicine.,medicine,medicine,It was medicine orthopedic., orthopedic medicine, medicine orthopedic,orthopedic,False,-20.817228317260742,-25.337543487548828,4.520315170288086,14067712,EleutherAI/pythia-14m,step142000,seed1,1,142000
There was a phone message.,message,message,There was a message phone., phone message, message phone,phone,True,-13.08155632019043,-16.92913055419922,3.847574234008789,14067712,EleutherAI/pythia-14m,step142000,seed1,1,142000
There was a computer message.,message,message,There was a message computer., computer message, message computer,computer,True,-17.23746109008789,-19.42070770263672,2.183246612548828,14067712,EleutherAI/pythia-14m,step142000,seed1,1,142000
There was an urgent message.,message,message,There was an message urgent., urgent message, message urgent,urgent,False,-12.272978782653809,-22.610740661621094,10.337761878967285,14067712,EleutherAI/pythia-14m,step142000,seed1,1,142000
It was a fungal mold.,mold,mold,It was a mold fungal., fungal mold, mold fungal,fungal,False,-18.151487350463867,-19.779226303100586,1.6277389526367188,14067712,EleutherAI/pythia-14m,step142000,seed1,1,142000
It was a harmful mold.,mold,mold,It was a mold harmful., harmful mold, mold harmful,harmful,False,-20.806957244873047,-22.213064193725586,1.406106948852539,14067712,EleutherAI/pythia-14m,step142000,seed1,1,142000
It was a rubber mold.,mold,mold,It was a mold rubber., rubber mold, mold rubber,rubber,True,-16.90336036682129,-19.557668685913086,2.654308319091797,14067712,EleutherAI/pythia-14m,step142000,seed1,1,142000
She saw the cancerous mole.,mole,mole,She saw the mole cancerous., cancerous mole, mole cancerous,cancerous,False,-24.788774490356445,-28.993640899658203,4.204866409301758,14067712,EleutherAI/pythia-14m,step142000,seed1,1,142000
She saw the raised mole.,mole,mole,She saw the mole raised., raised mole, mole raised,raised,False,-19.581279754638672,-20.37447738647461,0.7931976318359375,14067712,EleutherAI/pythia-14m,step142000,seed1,1,142000
She saw the cute mole.,mole,mole,She saw the mole cute., cute mole, mole cute,cute,False,-20.444965362548828,-23.88119125366211,3.4362258911132812,14067712,EleutherAI/pythia-14m,step142000,seed1,1,142000
He liked the rhythmic movement.,movement,movement,He liked the movement rhythmic., rhythmic movement, movement rhythmic,rhythmic,False,-16.51729965209961,-23.04975128173828,6.532451629638672,14067712,EleutherAI/pythia-14m,step142000,seed1,1,142000
He liked the graceful movement.,movement,movement,He liked the movement graceful., graceful movement, movement graceful,graceful,False,-18.06970977783203,-22.465717315673828,4.396007537841797,14067712,EleutherAI/pythia-14m,step142000,seed1,1,142000
He liked the feminist movement.,movement,movement,He liked the movement feminist., feminist movement, movement feminist,feminist,True,-15.233043670654297,-22.635272979736328,7.402229309082031,14067712,EleutherAI/pythia-14m,step142000,seed1,1,142000
It was a national newspaper.,newspaper,newspaper,It was a newspaper national., national newspaper, newspaper national,national,False,-15.487190246582031,-20.597537994384766,5.110347747802734,14067712,EleutherAI/pythia-14m,step142000,seed1,1,142000
It was a daily newspaper.,newspaper,newspaper,It was a newspaper daily., daily newspaper, newspaper daily,daily,False,-15.904121398925781,-18.845706939697266,2.9415855407714844,14067712,EleutherAI/pythia-14m,step142000,seed1,1,142000
It was a faded newspaper.,newspaper,newspaper,It was a newspaper faded., faded newspaper, newspaper faded,faded,False,-19.454999923706055,-21.878787994384766,2.423788070678711,14067712,EleutherAI/pythia-14m,step142000,seed1,1,142000
It was a juicy orange.,orange,orange,It was an orange juicy., juicy orange, orange juicy,juicy,False,-21.008155822753906,-22.664817810058594,1.6566619873046875,14067712,EleutherAI/pythia-14m,step142000,seed1,1,142000
It was a ripe orange.,orange,orange,It was an orange ripe., ripe orange, orange ripe,ripe,False,-21.18410873413086,-17.894432067871094,-3.2896766662597656,14067712,EleutherAI/pythia-14m,step142000,seed1,1,142000
It was a bright orange.,orange,orange,It was an orange bright., bright orange, orange bright,bright,False,-14.927379608154297,-16.342063903808594,1.4146842956542969,14067712,EleutherAI/pythia-14m,step142000,seed1,1,142000
He saw the young page.,page,page,He saw the page young., young page, page young,young,False,-17.604015350341797,-20.7672176361084,3.1632022857666016,14067712,EleutherAI/pythia-14m,step142000,seed1,1,142000
He saw the loyal page.,page,page,He saw the page loyal., loyal page, page loyal,loyal,False,-22.99734115600586,-22.8868465423584,-0.11049461364746094,14067712,EleutherAI/pythia-14m,step142000,seed1,1,142000
He saw the blank page.,page,page,He saw the page blank., blank page, page blank,blank,False,-15.072324752807617,-18.3359432220459,3.2636184692382812,14067712,EleutherAI/pythia-14m,step142000,seed1,1,142000
It was a calloused palm.,palm,palm,It was a palm calloused., calloused palm, palm calloused,calloused,False,-29.605623245239258,-30.259305953979492,0.6536827087402344,14067712,EleutherAI/pythia-14m,step142000,seed1,1,142000
It was a wrinkled palm.,palm,palm,It was a palm wrinkled., wrinkled palm, palm wrinkled,wrinkled,False,-21.022018432617188,-24.513761520385742,3.4917430877685547,14067712,EleutherAI/pythia-14m,step142000,seed1,1,142000
It was a tropical palm.,palm,palm,It was a palm tropical., tropical palm, palm tropical,tropical,False,-19.747539520263672,-20.957252502441406,1.2097129821777344,14067712,EleutherAI/pythia-14m,step142000,seed1,1,142000
It was a control panel.,panel,panel,It was a panel control., control panel, panel control,control,True,-17.3641414642334,-21.580230712890625,4.216089248657227,14067712,EleutherAI/pythia-14m,step142000,seed1,1,142000
It was an instrument panel.,panel,panel,It was an panel instrument., instrument panel, panel instrument,instrument,False,-17.746002197265625,-27.593528747558594,9.847526550292969,14067712,EleutherAI/pythia-14m,step142000,seed1,1,142000
It was an advisory panel.,panel,panel,It was an panel advisory., advisory panel, panel advisory,advisory,False,-17.29473876953125,-30.517845153808594,13.223106384277344,14067712,EleutherAI/pythia-14m,step142000,seed1,1,142000
It was a secret passage.,passage,passage,It was a passage secret., secret passage, passage secret,secret,False,-17.859676361083984,-20.755718231201172,2.8960418701171875,14067712,EleutherAI/pythia-14m,step142000,seed1,1,142000
It was a narrow passage.,passage,passage,It was a passage narrow., narrow passage, passage narrow,narrow,False,-15.948930740356445,-21.906108856201172,5.957178115844727,14067712,EleutherAI/pythia-14m,step142000,seed1,1,142000
It was a literary passage.,passage,passage,It was a passage literary., literary passage, passage literary,literary,False,-17.7371826171875,-22.899639129638672,5.162456512451172,14067712,EleutherAI/pythia-14m,step142000,seed1,1,142000
It was a tasty perch.,perch,perch,It was a perch tasty., tasty perch, perch tasty,tasty,False,-23.752565383911133,-25.437591552734375,1.6850261688232422,14067712,EleutherAI/pythia-14m,step142000,seed1,1,142000
It was a freshwater perch.,perch,perch,It was a perch freshwater., freshwater perch, perch freshwater,freshwater,True,-25.255422592163086,-28.318695068359375,3.063272476196289,14067712,EleutherAI/pythia-14m,step142000,seed1,1,142000
It was a lofty perch.,perch,perch,It was a perch lofty., lofty perch, perch lofty,lofty,False,-27.141386032104492,-28.253158569335938,1.1117725372314453,14067712,EleutherAI/pythia-14m,step142000,seed1,1,142000
He saw the fast pitcher.,pitcher,pitcher,He saw the pitcher fast., fast pitcher, pitcher fast,fast,False,-21.227008819580078,-20.348217010498047,-0.8787918090820312,14067712,EleutherAI/pythia-14m,step142000,seed1,1,142000
He saw the right-handed pitcher.,pitcher,pitcher,He saw the pitcher right-handed., right-handed pitcher, pitcher right-handed,right-handed,False,-20.816818237304688,-24.076797485351562,3.259979248046875,14067712,EleutherAI/pythia-14m,step142000,seed1,1,142000
He saw the glass pitcher.,pitcher,pitcher,He saw the pitcher glass., glass pitcher, pitcher glass,glass,True,-19.671924591064453,-22.389232635498047,2.7173080444335938,14067712,EleutherAI/pythia-14m,step142000,seed1,1,142000
It was a windy port.,port,port,It was a port windy., windy port, port windy,windy,False,-19.83678436279297,-21.568021774291992,1.7312374114990234,14067712,EleutherAI/pythia-14m,step142000,seed1,1,142000
It was a seaside port.,port,port,It was a port seaside., seaside port, port seaside,seaside,True,-18.316062927246094,-25.255847930908203,6.939785003662109,14067712,EleutherAI/pythia-14m,step142000,seed1,1,142000
It was a delicious port.,port,port,It was a port delicious., delicious port, port delicious,delicious,False,-18.611474990844727,-21.993915557861328,3.3824405670166016,14067712,EleutherAI/pythia-14m,step142000,seed1,1,142000
He was in a distinguished position.,position,position,He was in a position distinguished., distinguished position, position distinguished,distinguished,False,-13.48715591430664,-16.676755905151367,3.1895999908447266,14067712,EleutherAI/pythia-14m,step142000,seed1,1,142000
He was in a prominent position.,position,position,He was in a position prominent., prominent position, position prominent,prominent,False,-11.806079864501953,-17.366086959838867,5.560007095336914,14067712,EleutherAI/pythia-14m,step142000,seed1,1,142000
He was in a fetal position.,position,position,He was in a position fetal., fetal position, position fetal,fetal,False,-15.521395683288574,-20.219480514526367,4.698084831237793,14067712,EleutherAI/pythia-14m,step142000,seed1,1,142000
It was a wooden post.,post,post,It was a post wooden., wooden post, post wooden,wooden,False,-16.70973014831543,-19.265605926513672,2.555875778198242,14067712,EleutherAI/pythia-14m,step142000,seed1,1,142000
It was a fence post.,post,post,It was a post fence., fence post, post fence,fence,True,-17.942670822143555,-19.473125457763672,1.5304546356201172,14067712,EleutherAI/pythia-14m,step142000,seed1,1,142000
It was a teaching post.,post,post,It was a post teaching., teaching post, post teaching,teaching,True,-18.96731948852539,-17.726055145263672,-1.2412643432617188,14067712,EleutherAI/pythia-14m,step142000,seed1,1,142000
He had the alcoholic punch.,punch,punch,He had the punch alcoholic., alcoholic punch, punch alcoholic,alcoholic,False,-20.982067108154297,-25.585067749023438,4.603000640869141,14067712,EleutherAI/pythia-14m,step142000,seed1,1,142000
He had the fruit punch.,punch,punch,He had the punch fruit., fruit punch, punch fruit,fruit,True,-19.447891235351562,-22.49009895324707,3.042207717895508,14067712,EleutherAI/pythia-14m,step142000,seed1,1,142000
He had the strongest punch.,punch,punch,He had the punch strongest., strongest punch, punch strongest,strongest,False,-16.76274871826172,-21.18968391418457,4.426935195922852,14067712,EleutherAI/pythia-14m,step142000,seed1,1,142000
She had a brilliant pupil.,pupil,pupil,She had a pupil brilliant., brilliant pupil, pupil brilliant,brilliant,False,-16.353525161743164,-22.150455474853516,5.796930313110352,14067712,EleutherAI/pythia-14m,step142000,seed1,1,142000
She had an interested pupil.,pupil,pupil,She had an pupil interested., interested pupil, pupil interested,interested,False,-18.06247329711914,-22.299997329711914,4.237524032592773,14067712,EleutherAI/pythia-14m,step142000,seed1,1,142000
She had a dilated pupil.,pupil,pupil,She had a pupil dilated., dilated pupil, pupil dilated,dilated,False,-20.644453048706055,-24.149600982666016,3.505147933959961,14067712,EleutherAI/pythia-14m,step142000,seed1,1,142000
That was a loud racket.,racket,racket,That was a racket loud., loud racket, racket loud,loud,False,-17.528663635253906,-23.18848991394043,5.659826278686523,14067712,EleutherAI/pythia-14m,step142000,seed1,1,142000
That was an annoying racket.,racket,racket,That was an racket annoying., annoying racket, racket annoying,annoying,False,-17.320213317871094,-24.778728485107422,7.458515167236328,14067712,EleutherAI/pythia-14m,step142000,seed1,1,142000
That was a badminton racket.,racket,racket,That was a racket badminton., badminton racket, racket badminton,badminton,True,-29.63216781616211,-29.71173667907715,0.07956886291503906,14067712,EleutherAI/pythia-14m,step142000,seed1,1,142000
He liked electronic rock.,rock,rock,He liked rock electronic., electronic rock, rock electronic,electronic,False,-21.558963775634766,-22.725582122802734,1.1666183471679688,14067712,EleutherAI/pythia-14m,step142000,seed1,1,142000
He liked alternative rock.,rock,rock,He liked rock alternative., alternative rock, rock alternative,alternative,False,-21.17210578918457,-23.436031341552734,2.263925552368164,14067712,EleutherAI/pythia-14m,step142000,seed1,1,142000
He liked limestone rock.,rock,rock,He liked rock limestone., limestone rock, rock limestone,limestone,True,-21.620506286621094,-21.227535247802734,-0.3929710388183594,14067712,EleutherAI/pythia-14m,step142000,seed1,1,142000
He saw the wise sage.,sage,sage,He saw the sage wise., wise sage, sage wise,wise,False,-18.805152893066406,-19.121875762939453,0.3167228698730469,14067712,EleutherAI/pythia-14m,step142000,seed1,1,142000
He saw the renowned sage.,sage,sage,He saw the sage renowned., renowned sage, sage renowned,renowned,False,-19.983745574951172,-21.755176544189453,1.7714309692382812,14067712,EleutherAI/pythia-14m,step142000,seed1,1,142000
He saw the fragrant sage.,sage,sage,He saw the sage fragrant., fragrant sage, sage fragrant,fragrant,False,-22.632848739624023,-21.278141021728516,-1.3547077178955078,14067712,EleutherAI/pythia-14m,step142000,seed1,1,142000
It was a fish scale.,scale,scale,It was a scale fish., fish scale, scale fish,fish,True,-19.140125274658203,-20.625408172607422,1.4852828979492188,14067712,EleutherAI/pythia-14m,step142000,seed1,1,142000
It was a lizard scale.,scale,scale,It was a scale lizard., lizard scale, scale lizard,lizard,True,-24.407386779785156,-25.58681869506836,1.1794319152832031,14067712,EleutherAI/pythia-14m,step142000,seed1,1,142000
It was a music scale.,scale,scale,It was a scale music., music scale, scale music,music,True,-16.67601203918457,-17.72806739807129,1.0520553588867188,14067712,EleutherAI/pythia-14m,step142000,seed1,1,142000
It was a touching scene.,scene,scene,It was a scene touching., touching scene, scene touching,touching,False,-15.643083572387695,-17.584566116333008,1.9414825439453125,14067712,EleutherAI/pythia-14m,step142000,seed1,1,142000
It was a well-acted scene.,scene,scene,It was a scene well-acted., well-acted scene, scene well-acted,well-acted,False,-23.622343063354492,-28.804025650024414,5.181682586669922,14067712,EleutherAI/pythia-14m,step142000,seed1,1,142000
It was a nature scene.,scene,scene,It was a scene nature., nature scene, scene nature,nature,True,-17.647254943847656,-18.521333694458008,0.8740787506103516,14067712,EleutherAI/pythia-14m,step142000,seed1,1,142000
It was a gold seal.,seal,seal,It was a seal gold., gold seal, seal gold,gold,True,-15.91772747039795,-21.770484924316406,5.852757453918457,14067712,EleutherAI/pythia-14m,step142000,seed1,1,142000
It was a certified seal.,seal,seal,It was a seal certified., certified seal, seal certified,certified,False,-22.39799690246582,-21.824684143066406,-0.5733127593994141,14067712,EleutherAI/pythia-14m,step142000,seed1,1,142000
It was a circus seal.,seal,seal,It was a seal circus., circus seal, seal circus,circus,True,-22.185516357421875,-23.669288635253906,1.4837722778320312,14067712,EleutherAI/pythia-14m,step142000,seed1,1,142000
He used the scotch tape.,tape,tape,He used the tape scotch., scotch tape, tape scotch,scotch,True,-26.654932022094727,-24.705110549926758,-1.9498214721679688,14067712,EleutherAI/pythia-14m,step142000,seed1,1,142000
He used the double-sided tape.,tape,tape,He used the tape double-sided., double-sided tape, tape double-sided,double-sided,False,-19.946334838867188,-24.91790771484375,4.9715728759765625,14067712,EleutherAI/pythia-14m,step142000,seed1,1,142000
