sentence,word,string,reversed_sentence,mod_np,reversed_mod,disambiguating_word,non_adjective,original_logprob,reversed_logprob,ratio,n_params,mpath,revision,seed_name,seed,step
He used the interview tape.,tape,tape,He used the tape interview., interview tape, tape interview,interview,True,-16.67107391357422,-17.26358413696289,0.5925102233886719,14067712,EleutherAI/pythia-14m,step118000,seed6,6,118000
It was a winter term.,term,term,It was a term winter., winter term, term winter,winter,True,-17.329946517944336,-20.396520614624023,3.0665740966796875,14067712,EleutherAI/pythia-14m,step118000,seed6,6,118000
It was a fall term.,term,term,It was a term fall., fall term, term fall,fall,True,-16.829517364501953,-19.520788192749023,2.6912708282470703,14067712,EleutherAI/pythia-14m,step118000,seed6,6,118000
It was a legal term.,term,term,It was a term legal., legal term, term legal,legal,False,-16.25994873046875,-17.636266708374023,1.3763179779052734,14067712,EleutherAI/pythia-14m,step118000,seed6,6,118000
It was a clock tick.,tick,tick,It was a tick clock., clock tick, tick clock,clock,True,-18.623676300048828,-21.734031677246094,3.1103553771972656,14067712,EleutherAI/pythia-14m,step118000,seed6,6,118000
It was an audible tick.,tick,tick,It was an tick audible., audible tick, tick audible,audible,False,-18.885499954223633,-25.57790756225586,6.692407608032227,14067712,EleutherAI/pythia-14m,step118000,seed6,6,118000
It was a parasitic tick.,tick,tick,It was a tick parasitic., parasitic tick, tick parasitic,parasitic,False,-19.935298919677734,-24.905174255371094,4.969875335693359,14067712,EleutherAI/pythia-14m,step118000,seed6,6,118000
It was a generous tip.,tip,tip,It was a tip generous., generous tip, tip generous,generous,False,-18.0071964263916,-22.442670822143555,4.435474395751953,14067712,EleutherAI/pythia-14m,step118000,seed6,6,118000
It was a stingy tip.,tip,tip,It was a tip stingy., stingy tip, tip stingy,stingy,False,-22.698406219482422,-26.470762252807617,3.7723560333251953,14067712,EleutherAI/pythia-14m,step118000,seed6,6,118000
It was a pencil tip.,tip,tip,It was a tip pencil., pencil tip, tip pencil,pencil,True,-20.911563873291016,-20.976606369018555,0.06504249572753906,14067712,EleutherAI/pythia-14m,step118000,seed6,6,118000
She liked the essay title.,title,title,She liked the title essay., essay title, title essay,essay,True,-19.42884063720703,-17.05925178527832,-2.369588851928711,14067712,EleutherAI/pythia-14m,step118000,seed6,6,118000
She liked the poem title.,title,title,She liked the title poem., poem title, title poem,poem,True,-17.255615234375,-17.36418342590332,0.10856819152832031,14067712,EleutherAI/pythia-14m,step118000,seed6,6,118000
She liked the academic title.,title,title,She liked the title academic., academic title, title academic,academic,False,-16.90245819091797,-18.41667366027832,1.5142154693603516,14067712,EleutherAI/pythia-14m,step118000,seed6,6,118000
It was a costly toll.,toll,toll,It was a toll costly., costly toll, toll costly,costly,False,-19.368484497070312,-22.647144317626953,3.2786598205566406,14067712,EleutherAI/pythia-14m,step118000,seed6,6,118000
It was a road toll.,toll,toll,It was a toll road., road toll, toll road,road,True,-17.449054718017578,-19.702808380126953,2.253753662109375,14067712,EleutherAI/pythia-14m,step118000,seed6,6,118000
It was a loud toll.,toll,toll,It was a toll loud., loud toll, toll loud,loud,False,-20.01028823852539,-23.140552520751953,3.1302642822265625,14067712,EleutherAI/pythia-14m,step118000,seed6,6,118000
She saw the train tracks.,track,tracks,She saw the tracks train., train tracks, tracks train,train,True,-15.83341121673584,-19.019636154174805,3.186224937438965,14067712,EleutherAI/pythia-14m,step118000,seed6,6,118000
She saw the trolley tracks.,track,tracks,She saw the tracks trolley., trolley tracks, tracks trolley,trolley,True,-25.124359130859375,-25.576242446899414,0.45188331604003906,14067712,EleutherAI/pythia-14m,step118000,seed6,6,118000
She saw the moose tracks.,track,tracks,She saw the tracks moose., moose tracks, tracks moose,moose,False,-23.474687576293945,-22.989837646484375,-0.4848499298095703,14067712,EleutherAI/pythia-14m,step118000,seed6,6,118000
It was five yards.,yard,yards,It was yards five., five yards, yards five,five,True,-16.614377975463867,-23.914337158203125,7.299959182739258,14067712,EleutherAI/pythia-14m,step118000,seed6,6,118000
It was ten yards.,yard,yards,It was yards ten., ten yards, yards ten,ten,True,-19.799175262451172,-25.465362548828125,5.666187286376953,14067712,EleutherAI/pythia-14m,step118000,seed6,6,118000
They were big yards.,yard,yards,They were yards big., big yards, yards big,big,False,-17.656774520874023,-22.011966705322266,4.355192184448242,14067712,EleutherAI/pythia-14m,step118000,seed6,6,118000
It was a comedic act.,act,act,It was an act comedic., comedic act, act comedic,comedic,False,-16.039276123046875,-19.547903060913086,3.508626937866211,14067712,EleutherAI/pythia-14m,step118000,seed6,6,118000
He had a pending appeal.,appeal,appeal,He had an appeal pending., pending appeal, appeal pending,pending,False,-16.502225875854492,-13.773321151733398,-2.7289047241210938,14067712,EleutherAI/pythia-14m,step118000,seed6,6,118000
It was a polluted atmosphere.,atmosphere,atmosphere,It was an atmosphere polluted., polluted atmosphere, atmosphere polluted,polluted,False,-22.90457534790039,-23.595088958740234,0.6905136108398438,14067712,EleutherAI/pythia-14m,step118000,seed6,6,118000
It was a country band.,band,band,It was a band country., country band, band country,country,True,-16.610525131225586,-17.771499633789062,1.1609745025634766,14067712,EleutherAI/pythia-14m,step118000,seed6,6,118000
There was a religious barrier.,barrier,barrier,There was a barrier religious., religious barrier, barrier religious,religious,False,-18.174869537353516,-22.33804702758789,4.163177490234375,14067712,EleutherAI/pythia-14m,step118000,seed6,6,118000
He saw a baseball bat.,bat,bat,He saw a bat baseball., baseball bat, bat baseball,baseball,True,-12.684249877929688,-16.84531593322754,4.161066055297852,14067712,EleutherAI/pythia-14m,step118000,seed6,6,118000
He saw the balance beam.,beam,beam,He saw the beam balance., balance beam, beam balance,balance,True,-19.709747314453125,-19.891218185424805,0.1814708709716797,14067712,EleutherAI/pythia-14m,step118000,seed6,6,118000
She had a writer's block.,block,block,She had a block writer's., writer's block, block writer's,writer,True,-22.81026840209961,-24.79623031616211,1.9859619140625,14067712,EleutherAI/pythia-14m,step118000,seed6,6,118000
He has royal blood.,blood,blood,He has blood royal., royal blood, blood royal,royal,False,-19.428749084472656,-23.391151428222656,3.96240234375,14067712,EleutherAI/pythia-14m,step118000,seed6,6,118000
It was the school board.,board,board,It was the board school., school board, board school,school,True,-13.683977127075195,-18.237218856811523,4.553241729736328,14067712,EleutherAI/pythia-14m,step118000,seed6,6,118000
He had a leather-bound book.,book,book,He had a book leather-bound., leather-bound book, book leather-bound,leather-bound,False,-26.20559310913086,-27.778783798217773,1.573190689086914,14067712,EleutherAI/pythia-14m,step118000,seed6,6,118000
They ate a lonely breakfast.,breakfast,breakfast,They ate a breakfast lonely., lonely breakfast, breakfast lonely,lonely,False,-14.226045608520508,-19.072214126586914,4.846168518066406,14067712,EleutherAI/pythia-14m,step118000,seed6,6,118000
It was an island cape.,cape,cape,It was an cape island., island cape, cape island,island,True,-21.444448471069336,-25.11876678466797,3.674318313598633,14067712,EleutherAI/pythia-14m,step118000,seed6,6,118000
It was a criminal case.,case,case,It was a case criminal., criminal case, case criminal,criminal,False,-11.681706428527832,-17.231809616088867,5.550103187561035,14067712,EleutherAI/pythia-14m,step118000,seed6,6,118000
It was a primary cause.,cause,cause,It was a cause primary., primary cause, cause primary,primary,False,-12.803122520446777,-21.474105834960938,8.67098331451416,14067712,EleutherAI/pythia-14m,step118000,seed6,6,118000
It was a jail cell.,cell,cell,It was a cell jail., jail cell, cell jail,jail,True,-18.737693786621094,-19.663755416870117,0.9260616302490234,14067712,EleutherAI/pythia-14m,step118000,seed6,6,118000
She had a good-luck charm.,charm,charm,She had a charm good-luck., good-luck charm, charm good-luck,good-luck,False,-28.940269470214844,-29.735980987548828,0.7957115173339844,14067712,EleutherAI/pythia-14m,step118000,seed6,6,118000
They liked the pet chicken.,chicken,chicken,They liked the chicken pet., pet chicken, chicken pet,pet,True,-17.675018310546875,-17.381324768066406,-0.29369354248046875,14067712,EleutherAI/pythia-14m,step118000,seed6,6,118000
It was a stimulating class.,class,class,It was a class stimulating., stimulating class, class stimulating,stimulating,False,-18.408985137939453,-20.473432540893555,2.0644474029541016,14067712,EleutherAI/pythia-14m,step118000,seed6,6,118000
It was a metal clip.,clip,clip,It was a clip metal., metal clip, clip metal,metal,True,-18.893747329711914,-20.212726593017578,1.318979263305664,14067712,EleutherAI/pythia-14m,step118000,seed6,6,118000
It was a common cold.,cold,cold,It was a cold common., common cold, cold common,common,False,-15.737998962402344,-18.592975616455078,2.8549766540527344,14067712,EleutherAI/pythia-14m,step118000,seed6,6,118000
It was a marble column.,column,column,It was a column marble., marble column, column marble,marble,True,-19.524078369140625,-23.111854553222656,3.5877761840820312,14067712,EleutherAI/pythia-14m,step118000,seed6,6,118000
He liked the polite company.,company,company,He liked the company polite., polite company, company polite,polite,False,-17.25058937072754,-18.767589569091797,1.5170001983642578,14067712,EleutherAI/pythia-14m,step118000,seed6,6,118000
It was a traffic cone.,cone,cone,It was a cone traffic., traffic cone, cone traffic,traffic,True,-21.765716552734375,-25.61969757080078,3.8539810180664062,14067712,EleutherAI/pythia-14m,step118000,seed6,6,118000
He made a well-written contribution.,contribution,contribution,He made a contribution well-written., well-written contribution, contribution well-written,well-written,False,-22.174789428710938,-28.326854705810547,6.152065277099609,14067712,EleutherAI/pythia-14m,step118000,seed6,6,118000
That was the correct count.,count,count,That was the count correct., correct count, count correct,correct,False,-16.206832885742188,-20.58578872680664,4.378955841064453,14067712,EleutherAI/pythia-14m,step118000,seed6,6,118000
It was a collision course.,course,course,It was a course collision., collision course, course collision,collision,True,-18.49240493774414,-21.37801742553711,2.8856124877929688,14067712,EleutherAI/pythia-14m,step118000,seed6,6,118000
It was a historical date.,date,date,It was a date historical., historical date, date historical,historical,False,-15.863075256347656,-20.489582061767578,4.626506805419922,14067712,EleutherAI/pythia-14m,step118000,seed6,6,118000
It was about college degrees.,degree,degrees,It was about degrees college., college degrees, degrees college,college,True,-18.310588836669922,-22.166107177734375,3.855518341064453,14067712,EleutherAI/pythia-14m,step118000,seed6,6,118000
They liked the architectural design.,design,design,They liked the design architectural., architectural design, design architectural,architectural,False,-13.454072952270508,-19.066770553588867,5.612697601318359,14067712,EleutherAI/pythia-14m,step118000,seed6,6,118000
They liked the anniversary dinner.,dinner,dinner,They liked the dinner anniversary., anniversary dinner, dinner anniversary,anniversary,True,-18.08837890625,-18.28481101989746,0.19643211364746094,14067712,EleutherAI/pythia-14m,step118000,seed6,6,118000
He had a career dream.,dream,dream,He had a dream career., career dream, dream career,career,True,-16.267799377441406,-14.006429672241211,-2.2613697052001953,14067712,EleutherAI/pythia-14m,step118000,seed6,6,118000
It was a battery-powered drill.,drill,drill,It was a drill battery-powered., battery-powered drill, drill battery-powered,battery-powered,False,-26.097179412841797,-28.029312133789062,1.9321327209472656,14067712,EleutherAI/pythia-14m,step118000,seed6,6,118000
It was a physical examination.,examination,examination,It was an examination physical., physical examination, examination physical,physical,False,-13.668068885803223,-20.93899154663086,7.270922660827637,14067712,EleutherAI/pythia-14m,step118000,seed6,6,118000
They had an enthusiastic fan.,fan,fan,They had an fan enthusiastic., enthusiastic fan, fan enthusiastic,enthusiastic,False,-16.390182495117188,-24.254920959472656,7.864738464355469,14067712,EleutherAI/pythia-14m,step118000,seed6,6,118000
She had a steel file.,file,file,She had a file steel., steel file, file steel,steel,True,-17.74249839782715,-21.8322811126709,4.08978271484375,14067712,EleutherAI/pythia-14m,step118000,seed6,6,118000
It was a plastic film.,film,film,It was a film plastic., plastic film, film plastic,plastic,False,-14.739130020141602,-20.8824405670166,6.143310546875,14067712,EleutherAI/pythia-14m,step118000,seed6,6,118000
It was a concrete foundation.,foundation,foundation,It was a foundation concrete., concrete foundation, foundation concrete,concrete,False,-14.70424747467041,-19.851871490478516,5.1476240158081055,14067712,EleutherAI/pythia-14m,step118000,seed6,6,118000
It was a business function.,function,function,It was a function business., business function, function business,business,True,-13.494385719299316,-18.256301879882812,4.761916160583496,14067712,EleutherAI/pythia-14m,step118000,seed6,6,118000
He was on the parade ground.,ground,ground,He was on the ground parade., parade ground, ground parade,parade,True,-17.75432586669922,-17.057979583740234,-0.6963462829589844,14067712,EleutherAI/pythia-14m,step118000,seed6,6,118000
They liked the national guard.,guard,guard,They liked the guard national., national guard, guard national,national,False,-18.91083526611328,-21.493148803710938,2.5823135375976562,14067712,EleutherAI/pythia-14m,step118000,seed6,6,118000
He had a friendly guide.,guide,guide,He had a guide friendly., friendly guide, guide friendly,friendly,False,-15.617583274841309,-20.61191177368164,4.994328498840332,14067712,EleutherAI/pythia-14m,step118000,seed6,6,118000
It was a nursing home.,home,home,It was a home nursing., nursing home, home nursing,nursing,True,-12.726701736450195,-16.621633529663086,3.8949317932128906,14067712,EleutherAI/pythia-14m,step118000,seed6,6,118000
They had military intelligence.,intelligence,intelligence,They had intelligence military., military intelligence, intelligence military,military,False,-15.224596977233887,-22.305572509765625,7.080975532531738,14067712,EleutherAI/pythia-14m,step118000,seed6,6,118000
It was a special issue.,issue,issue,It was an issue special., special issue, issue special,special,False,-12.512893676757812,-15.303820610046387,2.790926933288574,14067712,EleutherAI/pythia-14m,step118000,seed6,6,118000
It was a paper jam.,jam,jam,It was a jam paper., paper jam, jam paper,paper,True,-19.92748260498047,-20.511859893798828,0.5843772888183594,14067712,EleutherAI/pythia-14m,step118000,seed6,6,118000
It was a backspace key.,key,key,It was a key backspace., backspace key, key backspace,backspace,True,-28.8155574798584,-26.28156280517578,-2.533994674682617,14067712,EleutherAI/pythia-14m,step118000,seed6,6,118000
They liked the friendly lamb.,lamb,lamb,They liked the lamb friendly., friendly lamb, lamb friendly,friendly,False,-18.364215850830078,-20.781810760498047,2.4175949096679688,14067712,EleutherAI/pythia-14m,step118000,seed6,6,118000
She had door locks.,lock,locks,She had locks door., door locks, locks door,door,True,-18.623836517333984,-20.118816375732422,1.4949798583984375,14067712,EleutherAI/pythia-14m,step118000,seed6,6,118000
They liked the women's lunch.,lunch,lunch,They liked the lunch women's., women's lunch, lunch women's,women,True,-16.54392433166504,-21.355501174926758,4.811576843261719,14067712,EleutherAI/pythia-14m,step118000,seed6,6,118000
He liked the stock market.,market,market,He liked the market stock., stock market, market stock,stock,True,-13.888238906860352,-17.661334991455078,3.7730960845947266,14067712,EleutherAI/pythia-14m,step118000,seed6,6,118000
It was a tennis match.,match,match,It was a match tennis., tennis match, match tennis,tennis,True,-14.30553150177002,-19.94076919555664,5.635237693786621,14067712,EleutherAI/pythia-14m,step118000,seed6,6,118000
It was veterinary medicine.,medicine,medicine,It was medicine veterinary., veterinary medicine, medicine veterinary,veterinary,False,-18.282737731933594,-25.67217254638672,7.389434814453125,14067712,EleutherAI/pythia-14m,step118000,seed6,6,118000
There was a clear message.,message,message,There was a message clear., clear message, message clear,clear,False,-14.52591323852539,-18.29052734375,3.7646141052246094,14067712,EleutherAI/pythia-14m,step118000,seed6,6,118000
It was a clay mold.,mold,mold,It was a mold clay., clay mold, mold clay,clay,True,-20.314353942871094,-22.525789260864258,2.211435317993164,14067712,EleutherAI/pythia-14m,step118000,seed6,6,118000
She saw the fast mole.,mole,mole,She saw the mole fast., fast mole, mole fast,fast,False,-22.763351440429688,-21.2347354888916,-1.528615951538086,14067712,EleutherAI/pythia-14m,step118000,seed6,6,118000
He liked the civil-rights movement.,movement,movement,He liked the movement civil-rights., civil-rights movement, movement civil-rights,civil-rights,False,-21.224239349365234,-29.104188919067383,7.879949569702148,14067712,EleutherAI/pythia-14m,step118000,seed6,6,118000
It was a shredded newspaper.,newspaper,newspaper,It was a newspaper shredded., shredded newspaper, newspaper shredded,shredded,False,-21.643712997436523,-22.99717140197754,1.3534584045410156,14067712,EleutherAI/pythia-14m,step118000,seed6,6,118000
It was a reddish orange.,orange,orange,It was an orange reddish., reddish orange, orange reddish,reddish,False,-18.973005294799805,-17.342805862426758,-1.6301994323730469,14067712,EleutherAI/pythia-14m,step118000,seed6,6,118000
He saw the ripped page.,page,page,He saw the page ripped., ripped page, page ripped,ripped,False,-21.675270080566406,-19.169673919677734,-2.505596160888672,14067712,EleutherAI/pythia-14m,step118000,seed6,6,118000
It was a tree palm.,palm,palm,It was a palm tree., tree palm, palm tree,tree,True,-20.260704040527344,-14.000001907348633,-6.260702133178711,14067712,EleutherAI/pythia-14m,step118000,seed6,6,118000
It was a consumer panel.,panel,panel,It was a panel consumer., consumer panel, panel consumer,consumer,True,-19.000934600830078,-21.817474365234375,2.816539764404297,14067712,EleutherAI/pythia-14m,step118000,seed6,6,118000
It was a biblical passage.,passage,passage,It was a passage biblical., biblical passage, passage biblical,biblical,False,-17.193252563476562,-22.379348754882812,5.18609619140625,14067712,EleutherAI/pythia-14m,step118000,seed6,6,118000
It was a secure perch.,perch,perch,It was a perch secure., secure perch, perch secure,secure,False,-23.569618225097656,-24.963001251220703,1.3933830261230469,14067712,EleutherAI/pythia-14m,step118000,seed6,6,118000
He saw the plastic pitcher.,pitcher,pitcher,He saw the pitcher plastic., plastic pitcher, pitcher plastic,plastic,True,-20.32837677001953,-23.275745391845703,2.947368621826172,14067712,EleutherAI/pythia-14m,step118000,seed6,6,118000
It was a sweet port.,port,port,It was a port sweet., sweet port, port sweet,sweet,False,-18.612529754638672,-21.607601165771484,2.9950714111328125,14067712,EleutherAI/pythia-14m,step118000,seed6,6,118000
He was in a yoga position.,position,position,He was in a position yoga., yoga position, position yoga,yoga,True,-18.856319427490234,-20.49717140197754,1.6408519744873047,14067712,EleutherAI/pythia-14m,step118000,seed6,6,118000
It was a challenging post.,post,post,It was a post challenging., challenging post, post challenging,challenging,False,-15.520069122314453,-17.993574142456055,2.4735050201416016,14067712,EleutherAI/pythia-14m,step118000,seed6,6,118000
He had the quickest punch.,punch,punch,He had the punch quickest., quickest punch, punch quickest,quickest,False,-21.154016494750977,-25.694822311401367,4.540805816650391,14067712,EleutherAI/pythia-14m,step118000,seed6,6,118000
She had a cloudy pupil.,pupil,pupil,She had a pupil cloudy., cloudy pupil, pupil cloudy,cloudy,False,-22.274860382080078,-24.024484634399414,1.749624252319336,14067712,EleutherAI/pythia-14m,step118000,seed6,6,118000
That was a tennis racket.,racket,racket,That was a racket tennis., tennis racket, racket tennis,tennis,True,-18.62517547607422,-22.644428253173828,4.019252777099609,14067712,EleutherAI/pythia-14m,step118000,seed6,6,118000
He liked granite rock.,rock,rock,He liked rock granite., granite rock, rock granite,granite,True,-19.476774215698242,-21.794281005859375,2.317506790161133,14067712,EleutherAI/pythia-14m,step118000,seed6,6,118000
He saw the bushy sage.,sage,sage,He saw the sage bushy., bushy sage, sage bushy,bushy,False,-28.411388397216797,-29.821208953857422,1.409820556640625,14067712,EleutherAI/pythia-14m,step118000,seed6,6,118000
It was a major scale.,scale,scale,It was a scale major., major scale, scale major,major,False,-14.019207000732422,-19.75189971923828,5.732692718505859,14067712,EleutherAI/pythia-14m,step118000,seed6,6,118000
It was a panoramic scene.,scene,scene,It was a scene panoramic., panoramic scene, scene panoramic,panoramic,False,-18.984561920166016,-25.201223373413086,6.21666145324707,14067712,EleutherAI/pythia-14m,step118000,seed6,6,118000
It was a trained seal.,seal,seal,It was a seal trained., trained seal, seal trained,trained,False,-22.997894287109375,-23.875070571899414,0.8771762847900391,14067712,EleutherAI/pythia-14m,step118000,seed6,6,118000
He used the video tape.,tape,tape,He used the tape video., video tape, tape video,video,True,-13.638410568237305,-14.897371292114258,1.2589607238769531,14067712,EleutherAI/pythia-14m,step118000,seed6,6,118000
It was a technical term.,term,term,It was a term technical., technical term, term technical,technical,False,-17.18067169189453,-19.698278427124023,2.517606735229492,14067712,EleutherAI/pythia-14m,step118000,seed6,6,118000
It was a diseased tick.,tick,tick,It was a tick diseased., diseased tick, tick diseased,diseased,False,-21.72979164123535,-25.105613708496094,3.375822067260742,14067712,EleutherAI/pythia-14m,step118000,seed6,6,118000
It was a finger tip.,tip,tip,It was a tip finger., finger tip, tip finger,finger,True,-22.355365753173828,-21.420942306518555,-0.9344234466552734,14067712,EleutherAI/pythia-14m,step118000,seed6,6,118000
She liked the professional title.,title,title,She liked the title professional., professional title, title professional,professional,False,-14.86075210571289,-17.14518928527832,2.2844371795654297,14067712,EleutherAI/pythia-14m,step118000,seed6,6,118000
It was a bell toll.,toll,toll,It was a toll bell., bell toll, toll bell,bell,True,-22.244735717773438,-23.102954864501953,0.8582191467285156,14067712,EleutherAI/pythia-14m,step118000,seed6,6,118000
She saw the snowshoe tracks.,track,tracks,She saw the tracks snowshoe., snowshoe tracks, tracks snowshoe,snowshoe,True,-29.5427303314209,-31.64178466796875,2.0990543365478516,14067712,EleutherAI/pythia-14m,step118000,seed6,6,118000
They were cluttered yards.,yard,yards,They were yards cluttered., cluttered yards, yards cluttered,cluttered,False,-23.03312110900879,-25.87367057800293,2.8405494689941406,14067712,EleutherAI/pythia-14m,step118000,seed6,6,118000
