sentence,word,string,reversed_sentence,mod_np,reversed_mod,disambiguating_word,non_adjective,original_logprob,reversed_logprob,ratio,n_params,mpath,revision,seed_name,seed,step
It was a social function.,function,function,It was a function social., social function, function social,social,False,-15.962685585021973,-22.044479370117188,6.081793785095215,14067712,EleutherAI/pythia-14m,step98000,seed9,9,98000
He was on the firm ground.,ground,ground,He was on the ground firm., firm ground, ground firm,firm,False,-16.551830291748047,-16.923290252685547,0.3714599609375,14067712,EleutherAI/pythia-14m,step98000,seed9,9,98000
He was on the frozen ground.,ground,ground,He was on the ground frozen., frozen ground, ground frozen,frozen,False,-16.976093292236328,-17.544170379638672,0.5680770874023438,14067712,EleutherAI/pythia-14m,step98000,seed9,9,98000
He was on the camp ground.,ground,ground,He was on the ground camp., camp ground, ground camp,camp,True,-17.05124282836914,-16.643535614013672,-0.40770721435546875,14067712,EleutherAI/pythia-14m,step98000,seed9,9,98000
They liked the night guard.,guard,guard,They liked the guard night., night guard, guard night,night,True,-15.494489669799805,-19.146759033203125,3.6522693634033203,14067712,EleutherAI/pythia-14m,step98000,seed9,9,98000
They liked the security guard.,guard,guard,They liked the guard security., security guard, guard security,security,True,-17.10604476928711,-20.755887985229492,3.649843215942383,14067712,EleutherAI/pythia-14m,step98000,seed9,9,98000
They liked the coast guard.,guard,guard,They liked the guard coast., coast guard, guard coast,coast,True,-16.023731231689453,-21.192625045776367,5.168893814086914,14067712,EleutherAI/pythia-14m,step98000,seed9,9,98000
He had an assembly guide.,guide,guide,He had an guide assembly., assembly guide, guide assembly,assembly,True,-18.997127532958984,-23.323453903198242,4.326326370239258,14067712,EleutherAI/pythia-14m,step98000,seed9,9,98000
He had a TV guide.,guide,guide,He had a guide TV., TV guide, guide TV,TV,True,-19.572986602783203,-22.529701232910156,2.956714630126953,14067712,EleutherAI/pythia-14m,step98000,seed9,9,98000
He had a talkative guide.,guide,guide,He had a guide talkative., talkative guide, guide talkative,talkative,False,-24.251476287841797,-28.356258392333984,4.1047821044921875,14067712,EleutherAI/pythia-14m,step98000,seed9,9,98000
It was a summer home.,home,home,It was a home summer., summer home, home summer,summer,True,-15.530000686645508,-15.68991470336914,0.1599140167236328,14067712,EleutherAI/pythia-14m,step98000,seed9,9,98000
It was a childhood home.,home,home,It was a home childhood., childhood home, home childhood,childhood,True,-14.5498685836792,-18.41409683227539,3.8642282485961914,14067712,EleutherAI/pythia-14m,step98000,seed9,9,98000
It was a funeral home.,home,home,It was a home funeral., funeral home, home funeral,funeral,False,-14.184814453125,-19.00070571899414,4.815891265869141,14067712,EleutherAI/pythia-14m,step98000,seed9,9,98000
They had natural intelligence.,intelligence,intelligence,They had intelligence natural., natural intelligence, intelligence natural,natural,False,-17.055349349975586,-22.317493438720703,5.262144088745117,14067712,EleutherAI/pythia-14m,step98000,seed9,9,98000
They had innate intelligence.,intelligence,intelligence,They had intelligence innate., innate intelligence, intelligence innate,innate,False,-17.76654815673828,-24.770557403564453,7.004009246826172,14067712,EleutherAI/pythia-14m,step98000,seed9,9,98000
They had classified intelligence.,intelligence,intelligence,They had intelligence classified., classified intelligence, intelligence classified,classified,False,-19.347564697265625,-20.837024688720703,1.4894599914550781,14067712,EleutherAI/pythia-14m,step98000,seed9,9,98000
It was a sensitive issue.,issue,issue,It was an issue sensitive., sensitive issue, issue sensitive,sensitive,False,-16.62812614440918,-18.358020782470703,1.7298946380615234,14067712,EleutherAI/pythia-14m,step98000,seed9,9,98000
It was a political issue.,issue,issue,It was an issue political., political issue, issue political,political,False,-13.407991409301758,-19.054065704345703,5.646074295043945,14067712,EleutherAI/pythia-14m,step98000,seed9,9,98000
It was a weekly issue.,issue,issue,It was an issue weekly., weekly issue, issue weekly,weekly,False,-17.986698150634766,-21.205097198486328,3.2183990478515625,14067712,EleutherAI/pythia-14m,step98000,seed9,9,98000
It was a blackberry jam.,jam,jam,It was a jam blackberry., blackberry jam, jam blackberry,blackberry,True,-18.31623649597168,-24.713611602783203,6.397375106811523,14067712,EleutherAI/pythia-14m,step98000,seed9,9,98000
It was a peach jam.,jam,jam,It was a jam peach., peach jam, jam peach,peach,False,-19.93350601196289,-22.05677032470703,2.1232643127441406,14067712,EleutherAI/pythia-14m,step98000,seed9,9,98000
It was a traffic jam.,jam,jam,It was a jam traffic., traffic jam, jam traffic,traffic,True,-15.76971435546875,-20.76628875732422,4.996574401855469,14067712,EleutherAI/pythia-14m,step98000,seed9,9,98000
It was a duplicate key.,key,key,It was a key duplicate., duplicate key, key duplicate,duplicate,False,-20.270404815673828,-19.383607864379883,-0.8867969512939453,14067712,EleutherAI/pythia-14m,step98000,seed9,9,98000
It was a master key.,key,key,It was a key master., master key, key master,master,True,-17.64759635925293,-16.272615432739258,-1.3749809265136719,14067712,EleutherAI/pythia-14m,step98000,seed9,9,98000
It was a delete key.,key,key,It was a key delete., delete key, key delete,delete,False,-21.10122299194336,-20.493013381958008,-0.6082096099853516,14067712,EleutherAI/pythia-14m,step98000,seed9,9,98000
They liked the marinated lamb.,lamb,lamb,They liked the lamb marinated., marinated lamb, lamb marinated,marinated,True,-22.46602439880371,-22.618896484375,0.15287208557128906,14067712,EleutherAI/pythia-14m,step98000,seed9,9,98000
They liked the grilled lamb.,lamb,lamb,They liked the lamb grilled., grilled lamb, lamb grilled,grilled,False,-17.771013259887695,-20.67816925048828,2.907155990600586,14067712,EleutherAI/pythia-14m,step98000,seed9,9,98000
They liked the cute lamb.,lamb,lamb,They liked the lamb cute., cute lamb, lamb cute,cute,False,-19.106552124023438,-23.81916046142578,4.712608337402344,14067712,EleutherAI/pythia-14m,step98000,seed9,9,98000
She had curly locks.,lock,locks,She had locks curly., curly locks, locks curly,curly,False,-20.340221405029297,-24.367084503173828,4.026863098144531,14067712,EleutherAI/pythia-14m,step98000,seed9,9,98000
She had brown locks.,lock,locks,She had locks brown., brown locks, locks brown,brown,False,-22.954734802246094,-22.905597686767578,-0.049137115478515625,14067712,EleutherAI/pythia-14m,step98000,seed9,9,98000
She had window locks.,lock,locks,She had locks window., window locks, locks window,window,True,-20.83102798461914,-23.621814727783203,2.7907867431640625,14067712,EleutherAI/pythia-14m,step98000,seed9,9,98000
They liked the hot lunch.,lunch,lunch,They liked the lunch hot., hot lunch, lunch hot,hot,False,-15.182790756225586,-18.648813247680664,3.466022491455078,14067712,EleutherAI/pythia-14m,step98000,seed9,9,98000
They liked the sandwich lunch.,lunch,lunch,They liked the lunch sandwich., sandwich lunch, lunch sandwich,sandwich,True,-19.772296905517578,-18.177255630493164,-1.595041275024414,14067712,EleutherAI/pythia-14m,step98000,seed9,9,98000
They liked the afternoon lunch.,lunch,lunch,They liked the lunch afternoon., afternoon lunch, lunch afternoon,afternoon,True,-17.195728302001953,-15.982919692993164,-1.212808609008789,14067712,EleutherAI/pythia-14m,step98000,seed9,9,98000
He liked the flea market.,market,market,He liked the market flea., flea market, market flea,flea,True,-19.158037185668945,-21.887386322021484,2.729349136352539,14067712,EleutherAI/pythia-14m,step98000,seed9,9,98000
He liked the fish market.,market,market,He liked the market fish., fish market, market fish,fish,True,-16.823715209960938,-17.545690536499023,0.7219753265380859,14067712,EleutherAI/pythia-14m,step98000,seed9,9,98000
He liked the housing market.,market,market,He liked the market housing., housing market, market housing,housing,True,-12.927124977111816,-16.758825302124023,3.831700325012207,14067712,EleutherAI/pythia-14m,step98000,seed9,9,98000
It was a lit match.,match,match,It was a match lit., lit match, match lit,lit,False,-23.014259338378906,-19.48223876953125,-3.5320205688476562,14067712,EleutherAI/pythia-14m,step98000,seed9,9,98000
It was a burning match.,match,match,It was a match burning., burning match, match burning,burning,False,-18.525402069091797,-20.459686279296875,1.9342842102050781,14067712,EleutherAI/pythia-14m,step98000,seed9,9,98000
It was a soccer match.,match,match,It was a match soccer., soccer match, match soccer,soccer,True,-15.878625869750977,-22.1348876953125,6.256261825561523,14067712,EleutherAI/pythia-14m,step98000,seed9,9,98000
It was cough medicine.,medicine,medicine,It was medicine cough., cough medicine, medicine cough,cough,True,-25.09113121032715,-23.874792098999023,-1.216339111328125,14067712,EleutherAI/pythia-14m,step98000,seed9,9,98000
It was prescription medicine.,medicine,medicine,It was medicine prescription., prescription medicine, medicine prescription,prescription,True,-19.36983871459961,-23.593969345092773,4.224130630493164,14067712,EleutherAI/pythia-14m,step98000,seed9,9,98000
It was orthopedic medicine.,medicine,medicine,It was medicine orthopedic., orthopedic medicine, medicine orthopedic,orthopedic,False,-24.49852752685547,-28.393835067749023,3.8953075408935547,14067712,EleutherAI/pythia-14m,step98000,seed9,9,98000
There was a phone message.,message,message,There was a message phone., phone message, message phone,phone,True,-14.794170379638672,-18.10258674621582,3.3084163665771484,14067712,EleutherAI/pythia-14m,step98000,seed9,9,98000
There was a computer message.,message,message,There was a message computer., computer message, message computer,computer,True,-18.565624237060547,-21.158037185668945,2.5924129486083984,14067712,EleutherAI/pythia-14m,step98000,seed9,9,98000
There was an urgent message.,message,message,There was an message urgent., urgent message, message urgent,urgent,False,-13.88406753540039,-23.908720016479492,10.024652481079102,14067712,EleutherAI/pythia-14m,step98000,seed9,9,98000
It was a fungal mold.,mold,mold,It was a mold fungal., fungal mold, mold fungal,fungal,False,-20.309986114501953,-24.14322280883789,3.8332366943359375,14067712,EleutherAI/pythia-14m,step98000,seed9,9,98000
It was a harmful mold.,mold,mold,It was a mold harmful., harmful mold, mold harmful,harmful,False,-21.767101287841797,-25.093814849853516,3.3267135620117188,14067712,EleutherAI/pythia-14m,step98000,seed9,9,98000
It was a rubber mold.,mold,mold,It was a mold rubber., rubber mold, mold rubber,rubber,True,-17.199264526367188,-22.311161041259766,5.111896514892578,14067712,EleutherAI/pythia-14m,step98000,seed9,9,98000
She saw the cancerous mole.,mole,mole,She saw the mole cancerous., cancerous mole, mole cancerous,cancerous,False,-26.14841079711914,-27.117050170898438,0.9686393737792969,14067712,EleutherAI/pythia-14m,step98000,seed9,9,98000
She saw the raised mole.,mole,mole,She saw the mole raised., raised mole, mole raised,raised,False,-23.031587600708008,-20.41445541381836,-2.6171321868896484,14067712,EleutherAI/pythia-14m,step98000,seed9,9,98000
She saw the cute mole.,mole,mole,She saw the mole cute., cute mole, mole cute,cute,False,-20.846826553344727,-23.674495697021484,2.827669143676758,14067712,EleutherAI/pythia-14m,step98000,seed9,9,98000
He liked the rhythmic movement.,movement,movement,He liked the movement rhythmic., rhythmic movement, movement rhythmic,rhythmic,False,-16.772741317749023,-22.27718734741211,5.504446029663086,14067712,EleutherAI/pythia-14m,step98000,seed9,9,98000
He liked the graceful movement.,movement,movement,He liked the movement graceful., graceful movement, movement graceful,graceful,False,-17.005733489990234,-21.7952938079834,4.789560317993164,14067712,EleutherAI/pythia-14m,step98000,seed9,9,98000
He liked the feminist movement.,movement,movement,He liked the movement feminist., feminist movement, movement feminist,feminist,True,-17.371423721313477,-23.030981063842773,5.659557342529297,14067712,EleutherAI/pythia-14m,step98000,seed9,9,98000
It was a national newspaper.,newspaper,newspaper,It was a newspaper national., national newspaper, newspaper national,national,False,-13.832256317138672,-18.700239181518555,4.867982864379883,14067712,EleutherAI/pythia-14m,step98000,seed9,9,98000
It was a daily newspaper.,newspaper,newspaper,It was a newspaper daily., daily newspaper, newspaper daily,daily,False,-13.618810653686523,-18.017194747924805,4.398384094238281,14067712,EleutherAI/pythia-14m,step98000,seed9,9,98000
It was a faded newspaper.,newspaper,newspaper,It was a newspaper faded., faded newspaper, newspaper faded,faded,False,-18.618370056152344,-20.76331901550293,2.144948959350586,14067712,EleutherAI/pythia-14m,step98000,seed9,9,98000
It was a juicy orange.,orange,orange,It was an orange juicy., juicy orange, orange juicy,juicy,False,-21.872018814086914,-23.177343368530273,1.3053245544433594,14067712,EleutherAI/pythia-14m,step98000,seed9,9,98000
It was a ripe orange.,orange,orange,It was an orange ripe., ripe orange, orange ripe,ripe,False,-17.502830505371094,-17.616283416748047,0.11345291137695312,14067712,EleutherAI/pythia-14m,step98000,seed9,9,98000
It was a bright orange.,orange,orange,It was an orange bright., bright orange, orange bright,bright,False,-13.761283874511719,-15.543163299560547,1.7818794250488281,14067712,EleutherAI/pythia-14m,step98000,seed9,9,98000
He saw the young page.,page,page,He saw the page young., young page, page young,young,False,-19.673629760742188,-21.194931030273438,1.52130126953125,14067712,EleutherAI/pythia-14m,step98000,seed9,9,98000
He saw the loyal page.,page,page,He saw the page loyal., loyal page, page loyal,loyal,False,-20.645549774169922,-22.527297973632812,1.8817481994628906,14067712,EleutherAI/pythia-14m,step98000,seed9,9,98000
He saw the blank page.,page,page,He saw the page blank., blank page, page blank,blank,False,-15.744200706481934,-17.242141723632812,1.497941017150879,14067712,EleutherAI/pythia-14m,step98000,seed9,9,98000
It was a calloused palm.,palm,palm,It was a palm calloused., calloused palm, palm calloused,calloused,False,-26.345054626464844,-28.13966941833496,1.7946147918701172,14067712,EleutherAI/pythia-14m,step98000,seed9,9,98000
It was a wrinkled palm.,palm,palm,It was a palm wrinkled., wrinkled palm, palm wrinkled,wrinkled,False,-19.28583526611328,-22.153797149658203,2.867961883544922,14067712,EleutherAI/pythia-14m,step98000,seed9,9,98000
It was a tropical palm.,palm,palm,It was a palm tropical., tropical palm, palm tropical,tropical,False,-19.627025604248047,-21.517398834228516,1.8903732299804688,14067712,EleutherAI/pythia-14m,step98000,seed9,9,98000
It was a control panel.,panel,panel,It was a panel control., control panel, panel control,control,True,-17.055768966674805,-19.665742874145508,2.609973907470703,14067712,EleutherAI/pythia-14m,step98000,seed9,9,98000
It was an instrument panel.,panel,panel,It was an panel instrument., instrument panel, panel instrument,instrument,False,-20.449127197265625,-24.70488166809082,4.255754470825195,14067712,EleutherAI/pythia-14m,step98000,seed9,9,98000
It was an advisory panel.,panel,panel,It was an panel advisory., advisory panel, panel advisory,advisory,False,-16.174898147583008,-27.123584747314453,10.948686599731445,14067712,EleutherAI/pythia-14m,step98000,seed9,9,98000
It was a secret passage.,passage,passage,It was a passage secret., secret passage, passage secret,secret,False,-15.874277114868164,-20.287189483642578,4.412912368774414,14067712,EleutherAI/pythia-14m,step98000,seed9,9,98000
It was a narrow passage.,passage,passage,It was a passage narrow., narrow passage, passage narrow,narrow,False,-15.704959869384766,-22.344165802001953,6.6392059326171875,14067712,EleutherAI/pythia-14m,step98000,seed9,9,98000
It was a literary passage.,passage,passage,It was a passage literary., literary passage, passage literary,literary,False,-17.360294342041016,-24.404651641845703,7.0443572998046875,14067712,EleutherAI/pythia-14m,step98000,seed9,9,98000
It was a tasty perch.,perch,perch,It was a perch tasty., tasty perch, perch tasty,tasty,False,-24.616941452026367,-25.633731842041016,1.0167903900146484,14067712,EleutherAI/pythia-14m,step98000,seed9,9,98000
It was a freshwater perch.,perch,perch,It was a perch freshwater., freshwater perch, perch freshwater,freshwater,True,-24.84149932861328,-25.022769927978516,0.18127059936523438,14067712,EleutherAI/pythia-14m,step98000,seed9,9,98000
It was a lofty perch.,perch,perch,It was a perch lofty., lofty perch, perch lofty,lofty,False,-22.754640579223633,-27.22935676574707,4.4747161865234375,14067712,EleutherAI/pythia-14m,step98000,seed9,9,98000
He saw the fast pitcher.,pitcher,pitcher,He saw the pitcher fast., fast pitcher, pitcher fast,fast,False,-20.296249389648438,-20.690744400024414,0.39449501037597656,14067712,EleutherAI/pythia-14m,step98000,seed9,9,98000
He saw the right-handed pitcher.,pitcher,pitcher,He saw the pitcher right-handed., right-handed pitcher, pitcher right-handed,right-handed,False,-20.60024642944336,-26.168590545654297,5.5683441162109375,14067712,EleutherAI/pythia-14m,step98000,seed9,9,98000
He saw the glass pitcher.,pitcher,pitcher,He saw the pitcher glass., glass pitcher, pitcher glass,glass,True,-18.433242797851562,-21.40036964416504,2.9671268463134766,14067712,EleutherAI/pythia-14m,step98000,seed9,9,98000
It was a windy port.,port,port,It was a port windy., windy port, port windy,windy,False,-18.71982765197754,-24.122507095336914,5.402679443359375,14067712,EleutherAI/pythia-14m,step98000,seed9,9,98000
It was a seaside port.,port,port,It was a port seaside., seaside port, port seaside,seaside,True,-16.81865692138672,-21.880346298217773,5.061689376831055,14067712,EleutherAI/pythia-14m,step98000,seed9,9,98000
It was a delicious port.,port,port,It was a port delicious., delicious port, port delicious,delicious,False,-18.92414665222168,-24.135822296142578,5.211675643920898,14067712,EleutherAI/pythia-14m,step98000,seed9,9,98000
He was in a distinguished position.,position,position,He was in a position distinguished., distinguished position, position distinguished,distinguished,False,-13.319697380065918,-16.967241287231445,3.6475439071655273,14067712,EleutherAI/pythia-14m,step98000,seed9,9,98000
He was in a prominent position.,position,position,He was in a position prominent., prominent position, position prominent,prominent,False,-11.784199714660645,-17.189714431762695,5.405514717102051,14067712,EleutherAI/pythia-14m,step98000,seed9,9,98000
He was in a fetal position.,position,position,He was in a position fetal., fetal position, position fetal,fetal,False,-14.158791542053223,-21.021196365356445,6.862404823303223,14067712,EleutherAI/pythia-14m,step98000,seed9,9,98000
It was a wooden post.,post,post,It was a post wooden., wooden post, post wooden,wooden,False,-17.21186637878418,-19.94639778137207,2.7345314025878906,14067712,EleutherAI/pythia-14m,step98000,seed9,9,98000
It was a fence post.,post,post,It was a post fence., fence post, post fence,fence,True,-21.35137367248535,-20.669755935668945,-0.6816177368164062,14067712,EleutherAI/pythia-14m,step98000,seed9,9,98000
It was a teaching post.,post,post,It was a post teaching., teaching post, post teaching,teaching,True,-18.413848876953125,-18.41850471496582,0.0046558380126953125,14067712,EleutherAI/pythia-14m,step98000,seed9,9,98000
He had the alcoholic punch.,punch,punch,He had the punch alcoholic., alcoholic punch, punch alcoholic,alcoholic,False,-21.61168670654297,-26.351703643798828,4.740016937255859,14067712,EleutherAI/pythia-14m,step98000,seed9,9,98000
He had the fruit punch.,punch,punch,He had the punch fruit., fruit punch, punch fruit,fruit,True,-20.734655380249023,-22.834400177001953,2.0997447967529297,14067712,EleutherAI/pythia-14m,step98000,seed9,9,98000
He had the strongest punch.,punch,punch,He had the punch strongest., strongest punch, punch strongest,strongest,False,-16.734603881835938,-24.546741485595703,7.812137603759766,14067712,EleutherAI/pythia-14m,step98000,seed9,9,98000
She had a brilliant pupil.,pupil,pupil,She had a pupil brilliant., brilliant pupil, pupil brilliant,brilliant,False,-16.653226852416992,-23.435192108154297,6.781965255737305,14067712,EleutherAI/pythia-14m,step98000,seed9,9,98000
She had an interested pupil.,pupil,pupil,She had an pupil interested., interested pupil, pupil interested,interested,False,-17.145828247070312,-22.0313777923584,4.885549545288086,14067712,EleutherAI/pythia-14m,step98000,seed9,9,98000
She had a dilated pupil.,pupil,pupil,She had a pupil dilated., dilated pupil, pupil dilated,dilated,False,-18.758392333984375,-24.793376922607422,6.034984588623047,14067712,EleutherAI/pythia-14m,step98000,seed9,9,98000
That was a loud racket.,racket,racket,That was a racket loud., loud racket, racket loud,loud,False,-13.679830551147461,-20.928443908691406,7.248613357543945,14067712,EleutherAI/pythia-14m,step98000,seed9,9,98000
That was an annoying racket.,racket,racket,That was an racket annoying., annoying racket, racket annoying,annoying,False,-15.959426879882812,-23.725971221923828,7.766544342041016,14067712,EleutherAI/pythia-14m,step98000,seed9,9,98000
That was a badminton racket.,racket,racket,That was a racket badminton., badminton racket, racket badminton,badminton,True,-24.659452438354492,-27.02472686767578,2.365274429321289,14067712,EleutherAI/pythia-14m,step98000,seed9,9,98000
He liked electronic rock.,rock,rock,He liked rock electronic., electronic rock, rock electronic,electronic,False,-19.824188232421875,-23.374366760253906,3.5501785278320312,14067712,EleutherAI/pythia-14m,step98000,seed9,9,98000
He liked alternative rock.,rock,rock,He liked rock alternative., alternative rock, rock alternative,alternative,False,-21.734580993652344,-25.32990264892578,3.5953216552734375,14067712,EleutherAI/pythia-14m,step98000,seed9,9,98000
He liked limestone rock.,rock,rock,He liked rock limestone., limestone rock, rock limestone,limestone,True,-24.02737045288086,-24.63062286376953,0.6032524108886719,14067712,EleutherAI/pythia-14m,step98000,seed9,9,98000
He saw the wise sage.,sage,sage,He saw the sage wise., wise sage, sage wise,wise,False,-19.689781188964844,-21.113628387451172,1.4238471984863281,14067712,EleutherAI/pythia-14m,step98000,seed9,9,98000
He saw the renowned sage.,sage,sage,He saw the sage renowned., renowned sage, sage renowned,renowned,False,-19.03104019165039,-21.715648651123047,2.6846084594726562,14067712,EleutherAI/pythia-14m,step98000,seed9,9,98000
He saw the fragrant sage.,sage,sage,He saw the sage fragrant., fragrant sage, sage fragrant,fragrant,False,-24.60704231262207,-24.53425407409668,-0.07278823852539062,14067712,EleutherAI/pythia-14m,step98000,seed9,9,98000
It was a fish scale.,scale,scale,It was a scale fish., fish scale, scale fish,fish,True,-18.169219970703125,-23.475502014160156,5.306282043457031,14067712,EleutherAI/pythia-14m,step98000,seed9,9,98000
It was a lizard scale.,scale,scale,It was a scale lizard., lizard scale, scale lizard,lizard,True,-23.113697052001953,-24.29607582092285,1.1823787689208984,14067712,EleutherAI/pythia-14m,step98000,seed9,9,98000
It was a music scale.,scale,scale,It was a scale music., music scale, scale music,music,True,-18.261091232299805,-20.33277130126953,2.0716800689697266,14067712,EleutherAI/pythia-14m,step98000,seed9,9,98000
It was a touching scene.,scene,scene,It was a scene touching., touching scene, scene touching,touching,False,-16.74927520751953,-17.581180572509766,0.8319053649902344,14067712,EleutherAI/pythia-14m,step98000,seed9,9,98000
It was a well-acted scene.,scene,scene,It was a scene well-acted., well-acted scene, scene well-acted,well-acted,False,-22.636362075805664,-30.26043701171875,7.624074935913086,14067712,EleutherAI/pythia-14m,step98000,seed9,9,98000
It was a nature scene.,scene,scene,It was a scene nature., nature scene, scene nature,nature,True,-18.928024291992188,-19.319889068603516,0.3918647766113281,14067712,EleutherAI/pythia-14m,step98000,seed9,9,98000
It was a gold seal.,seal,seal,It was a seal gold., gold seal, seal gold,gold,True,-13.782418251037598,-20.452404022216797,6.669985771179199,14067712,EleutherAI/pythia-14m,step98000,seed9,9,98000
It was a certified seal.,seal,seal,It was a seal certified., certified seal, seal certified,certified,False,-18.583694458007812,-21.833843231201172,3.2501487731933594,14067712,EleutherAI/pythia-14m,step98000,seed9,9,98000
It was a circus seal.,seal,seal,It was a seal circus., circus seal, seal circus,circus,True,-20.13126564025879,-23.542003631591797,3.410737991333008,14067712,EleutherAI/pythia-14m,step98000,seed9,9,98000
He used the scotch tape.,tape,tape,He used the tape scotch., scotch tape, tape scotch,scotch,True,-21.744020462036133,-26.197547912597656,4.453527450561523,14067712,EleutherAI/pythia-14m,step98000,seed9,9,98000
He used the double-sided tape.,tape,tape,He used the tape double-sided., double-sided tape, tape double-sided,double-sided,False,-22.977615356445312,-29.458709716796875,6.4810943603515625,14067712,EleutherAI/pythia-14m,step98000,seed9,9,98000
He used the interview tape.,tape,tape,He used the tape interview., interview tape, tape interview,interview,True,-16.791322708129883,-21.05437469482422,4.263051986694336,14067712,EleutherAI/pythia-14m,step98000,seed9,9,98000
It was a winter term.,term,term,It was a term winter., winter term, term winter,winter,True,-16.489988327026367,-20.583953857421875,4.093965530395508,14067712,EleutherAI/pythia-14m,step98000,seed9,9,98000
