sentence,word,string,reversed_sentence,mod_np,reversed_mod,disambiguating_word,non_adjective,original_logprob,reversed_logprob,ratio,n_params,mpath,revision,seed_name,seed,step
It was a linear function.,function,function,It was a function linear., linear function, function linear,linear,False,-15.064584732055664,-18.71884536743164,3.6542606353759766,14067712,EleutherAI/pythia-14m,step136000,seed5,5,136000
It was a social function.,function,function,It was a function social., social function, function social,social,False,-16.332216262817383,-19.432958602905273,3.1007423400878906,14067712,EleutherAI/pythia-14m,step136000,seed5,5,136000
He was on the firm ground.,ground,ground,He was on the ground firm., firm ground, ground firm,firm,False,-16.662080764770508,-16.167707443237305,-0.4943733215332031,14067712,EleutherAI/pythia-14m,step136000,seed5,5,136000
He was on the frozen ground.,ground,ground,He was on the ground frozen., frozen ground, ground frozen,frozen,False,-15.19343376159668,-15.902082443237305,0.708648681640625,14067712,EleutherAI/pythia-14m,step136000,seed5,5,136000
He was on the camp ground.,ground,ground,He was on the ground camp., camp ground, ground camp,camp,True,-17.364490509033203,-15.079572677612305,-2.2849178314208984,14067712,EleutherAI/pythia-14m,step136000,seed5,5,136000
They liked the night guard.,guard,guard,They liked the guard night., night guard, guard night,night,True,-17.645572662353516,-19.038822174072266,1.39324951171875,14067712,EleutherAI/pythia-14m,step136000,seed5,5,136000
They liked the security guard.,guard,guard,They liked the guard security., security guard, guard security,security,True,-14.865547180175781,-19.574710845947266,4.709163665771484,14067712,EleutherAI/pythia-14m,step136000,seed5,5,136000
They liked the coast guard.,guard,guard,They liked the guard coast., coast guard, guard coast,coast,True,-18.883806228637695,-22.577640533447266,3.6938343048095703,14067712,EleutherAI/pythia-14m,step136000,seed5,5,136000
He had an assembly guide.,guide,guide,He had an guide assembly., assembly guide, guide assembly,assembly,True,-19.137147903442383,-25.767362594604492,6.630214691162109,14067712,EleutherAI/pythia-14m,step136000,seed5,5,136000
He had a TV guide.,guide,guide,He had a guide TV., TV guide, guide TV,TV,True,-18.095661163330078,-21.177082061767578,3.0814208984375,14067712,EleutherAI/pythia-14m,step136000,seed5,5,136000
He had a talkative guide.,guide,guide,He had a guide talkative., talkative guide, guide talkative,talkative,False,-26.136432647705078,-30.002119064331055,3.8656864166259766,14067712,EleutherAI/pythia-14m,step136000,seed5,5,136000
It was a summer home.,home,home,It was a home summer., summer home, home summer,summer,True,-14.611715316772461,-18.212533950805664,3.600818634033203,14067712,EleutherAI/pythia-14m,step136000,seed5,5,136000
It was a childhood home.,home,home,It was a home childhood., childhood home, home childhood,childhood,True,-15.268209457397461,-19.563119888305664,4.294910430908203,14067712,EleutherAI/pythia-14m,step136000,seed5,5,136000
It was a funeral home.,home,home,It was a home funeral., funeral home, home funeral,funeral,False,-16.153043746948242,-18.461557388305664,2.308513641357422,14067712,EleutherAI/pythia-14m,step136000,seed5,5,136000
They had natural intelligence.,intelligence,intelligence,They had intelligence natural., natural intelligence, intelligence natural,natural,False,-18.665611267089844,-22.93741226196289,4.271800994873047,14067712,EleutherAI/pythia-14m,step136000,seed5,5,136000
They had innate intelligence.,intelligence,intelligence,They had intelligence innate., innate intelligence, intelligence innate,innate,False,-19.066444396972656,-25.56607437133789,6.499629974365234,14067712,EleutherAI/pythia-14m,step136000,seed5,5,136000
They had classified intelligence.,intelligence,intelligence,They had intelligence classified., classified intelligence, intelligence classified,classified,False,-19.327373504638672,-21.42911148071289,2.1017379760742188,14067712,EleutherAI/pythia-14m,step136000,seed5,5,136000
It was a sensitive issue.,issue,issue,It was an issue sensitive., sensitive issue, issue sensitive,sensitive,False,-15.365840911865234,-16.610931396484375,1.2450904846191406,14067712,EleutherAI/pythia-14m,step136000,seed5,5,136000
It was a political issue.,issue,issue,It was an issue political., political issue, issue political,political,False,-12.504575729370117,-16.759368896484375,4.254793167114258,14067712,EleutherAI/pythia-14m,step136000,seed5,5,136000
It was a weekly issue.,issue,issue,It was an issue weekly., weekly issue, issue weekly,weekly,False,-18.639619827270508,-18.325531005859375,-0.3140888214111328,14067712,EleutherAI/pythia-14m,step136000,seed5,5,136000
It was a blackberry jam.,jam,jam,It was a jam blackberry., blackberry jam, jam blackberry,blackberry,True,-21.81124496459961,-25.030773162841797,3.2195281982421875,14067712,EleutherAI/pythia-14m,step136000,seed5,5,136000
It was a peach jam.,jam,jam,It was a jam peach., peach jam, jam peach,peach,False,-22.79665184020996,-23.139198303222656,0.3425464630126953,14067712,EleutherAI/pythia-14m,step136000,seed5,5,136000
It was a traffic jam.,jam,jam,It was a jam traffic., traffic jam, jam traffic,traffic,True,-17.42873764038086,-20.01511001586914,2.5863723754882812,14067712,EleutherAI/pythia-14m,step136000,seed5,5,136000
It was a duplicate key.,key,key,It was a key duplicate., duplicate key, key duplicate,duplicate,False,-19.50118064880371,-20.053173065185547,0.5519924163818359,14067712,EleutherAI/pythia-14m,step136000,seed5,5,136000
It was a master key.,key,key,It was a key master., master key, key master,master,True,-18.90300941467285,-17.622997283935547,-1.2800121307373047,14067712,EleutherAI/pythia-14m,step136000,seed5,5,136000
It was a delete key.,key,key,It was a key delete., delete key, key delete,delete,False,-21.27013397216797,-20.598094940185547,-0.6720390319824219,14067712,EleutherAI/pythia-14m,step136000,seed5,5,136000
They liked the marinated lamb.,lamb,lamb,They liked the lamb marinated., marinated lamb, lamb marinated,marinated,True,-22.85406494140625,-25.361297607421875,2.507232666015625,14067712,EleutherAI/pythia-14m,step136000,seed5,5,136000
They liked the grilled lamb.,lamb,lamb,They liked the lamb grilled., grilled lamb, lamb grilled,grilled,False,-18.46395492553711,-21.64592742919922,3.1819725036621094,14067712,EleutherAI/pythia-14m,step136000,seed5,5,136000
They liked the cute lamb.,lamb,lamb,They liked the lamb cute., cute lamb, lamb cute,cute,False,-19.113636016845703,-21.63005828857422,2.5164222717285156,14067712,EleutherAI/pythia-14m,step136000,seed5,5,136000
She had curly locks.,lock,locks,She had locks curly., curly locks, locks curly,curly,False,-22.74588394165039,-25.50113296508789,2.7552490234375,14067712,EleutherAI/pythia-14m,step136000,seed5,5,136000
She had brown locks.,lock,locks,She had locks brown., brown locks, locks brown,brown,False,-21.42047119140625,-22.50918960571289,1.0887184143066406,14067712,EleutherAI/pythia-14m,step136000,seed5,5,136000
She had window locks.,lock,locks,She had locks window., window locks, locks window,window,True,-20.57491683959961,-22.72134780883789,2.1464309692382812,14067712,EleutherAI/pythia-14m,step136000,seed5,5,136000
They liked the hot lunch.,lunch,lunch,They liked the lunch hot., hot lunch, lunch hot,hot,False,-17.942214965820312,-19.939117431640625,1.9969024658203125,14067712,EleutherAI/pythia-14m,step136000,seed5,5,136000
They liked the sandwich lunch.,lunch,lunch,They liked the lunch sandwich., sandwich lunch, lunch sandwich,sandwich,True,-20.131614685058594,-19.851715087890625,-0.27989959716796875,14067712,EleutherAI/pythia-14m,step136000,seed5,5,136000
They liked the afternoon lunch.,lunch,lunch,They liked the lunch afternoon., afternoon lunch, lunch afternoon,afternoon,True,-18.197513580322266,-19.382476806640625,1.1849632263183594,14067712,EleutherAI/pythia-14m,step136000,seed5,5,136000
He liked the flea market.,market,market,He liked the market flea., flea market, market flea,flea,True,-22.990245819091797,-21.963619232177734,-1.0266265869140625,14067712,EleutherAI/pythia-14m,step136000,seed5,5,136000
He liked the fish market.,market,market,He liked the market fish., fish market, market fish,fish,True,-17.17084503173828,-18.815204620361328,1.6443595886230469,14067712,EleutherAI/pythia-14m,step136000,seed5,5,136000
He liked the housing market.,market,market,He liked the market housing., housing market, market housing,housing,True,-14.248628616333008,-18.029804229736328,3.7811756134033203,14067712,EleutherAI/pythia-14m,step136000,seed5,5,136000
It was a lit match.,match,match,It was a match lit., lit match, match lit,lit,False,-22.636962890625,-20.21074676513672,-2.4262161254882812,14067712,EleutherAI/pythia-14m,step136000,seed5,5,136000
It was a burning match.,match,match,It was a match burning., burning match, match burning,burning,False,-17.252166748046875,-19.86479949951172,2.6126327514648438,14067712,EleutherAI/pythia-14m,step136000,seed5,5,136000
It was a soccer match.,match,match,It was a match soccer., soccer match, match soccer,soccer,True,-17.06090545654297,-22.48174285888672,5.42083740234375,14067712,EleutherAI/pythia-14m,step136000,seed5,5,136000
It was cough medicine.,medicine,medicine,It was medicine cough., cough medicine, medicine cough,cough,True,-23.07837677001953,-22.975778579711914,-0.10259819030761719,14067712,EleutherAI/pythia-14m,step136000,seed5,5,136000
It was prescription medicine.,medicine,medicine,It was medicine prescription., prescription medicine, medicine prescription,prescription,True,-17.985239028930664,-21.126413345336914,3.14117431640625,14067712,EleutherAI/pythia-14m,step136000,seed5,5,136000
It was orthopedic medicine.,medicine,medicine,It was medicine orthopedic., orthopedic medicine, medicine orthopedic,orthopedic,False,-20.290498733520508,-23.9060001373291,3.6155014038085938,14067712,EleutherAI/pythia-14m,step136000,seed5,5,136000
There was a phone message.,message,message,There was a message phone., phone message, message phone,phone,True,-12.758831024169922,-16.4326171875,3.673786163330078,14067712,EleutherAI/pythia-14m,step136000,seed5,5,136000
There was a computer message.,message,message,There was a message computer., computer message, message computer,computer,True,-14.708128929138184,-18.41357421875,3.7054452896118164,14067712,EleutherAI/pythia-14m,step136000,seed5,5,136000
There was an urgent message.,message,message,There was an message urgent., urgent message, message urgent,urgent,False,-13.003568649291992,-22.802322387695312,9.79875373840332,14067712,EleutherAI/pythia-14m,step136000,seed5,5,136000
It was a fungal mold.,mold,mold,It was a mold fungal., fungal mold, mold fungal,fungal,False,-20.034595489501953,-22.729907989501953,2.6953125,14067712,EleutherAI/pythia-14m,step136000,seed5,5,136000
It was a harmful mold.,mold,mold,It was a mold harmful., harmful mold, mold harmful,harmful,False,-20.722801208496094,-23.516040802001953,2.7932395935058594,14067712,EleutherAI/pythia-14m,step136000,seed5,5,136000
It was a rubber mold.,mold,mold,It was a mold rubber., rubber mold, mold rubber,rubber,True,-17.038406372070312,-20.797534942626953,3.7591285705566406,14067712,EleutherAI/pythia-14m,step136000,seed5,5,136000
She saw the cancerous mole.,mole,mole,She saw the mole cancerous., cancerous mole, mole cancerous,cancerous,False,-24.062026977539062,-26.68305206298828,2.6210250854492188,14067712,EleutherAI/pythia-14m,step136000,seed5,5,136000
She saw the raised mole.,mole,mole,She saw the mole raised., raised mole, mole raised,raised,False,-21.090343475341797,-20.03907585144043,-1.0512676239013672,14067712,EleutherAI/pythia-14m,step136000,seed5,5,136000
She saw the cute mole.,mole,mole,She saw the mole cute., cute mole, mole cute,cute,False,-20.777202606201172,-22.49903678894043,1.7218341827392578,14067712,EleutherAI/pythia-14m,step136000,seed5,5,136000
He liked the rhythmic movement.,movement,movement,He liked the movement rhythmic., rhythmic movement, movement rhythmic,rhythmic,False,-18.248592376708984,-22.240034103393555,3.9914417266845703,14067712,EleutherAI/pythia-14m,step136000,seed5,5,136000
He liked the graceful movement.,movement,movement,He liked the movement graceful., graceful movement, movement graceful,graceful,False,-18.303890228271484,-21.70148277282715,3.397592544555664,14067712,EleutherAI/pythia-14m,step136000,seed5,5,136000
He liked the feminist movement.,movement,movement,He liked the movement feminist., feminist movement, movement feminist,feminist,True,-15.604015350341797,-21.73688316345215,6.132867813110352,14067712,EleutherAI/pythia-14m,step136000,seed5,5,136000
It was a national newspaper.,newspaper,newspaper,It was a newspaper national., national newspaper, newspaper national,national,False,-15.597334861755371,-18.927974700927734,3.3306398391723633,14067712,EleutherAI/pythia-14m,step136000,seed5,5,136000
It was a daily newspaper.,newspaper,newspaper,It was a newspaper daily., daily newspaper, newspaper daily,daily,False,-16.198318481445312,-18.220943450927734,2.022624969482422,14067712,EleutherAI/pythia-14m,step136000,seed5,5,136000
It was a faded newspaper.,newspaper,newspaper,It was a newspaper faded., faded newspaper, newspaper faded,faded,False,-18.429126739501953,-20.188228607177734,1.7591018676757812,14067712,EleutherAI/pythia-14m,step136000,seed5,5,136000
It was a juicy orange.,orange,orange,It was an orange juicy., juicy orange, orange juicy,juicy,False,-18.01016616821289,-17.46335792541504,-0.5468082427978516,14067712,EleutherAI/pythia-14m,step136000,seed5,5,136000
It was a ripe orange.,orange,orange,It was an orange ripe., ripe orange, orange ripe,ripe,False,-18.163877487182617,-18.128435134887695,-0.035442352294921875,14067712,EleutherAI/pythia-14m,step136000,seed5,5,136000
It was a bright orange.,orange,orange,It was an orange bright., bright orange, orange bright,bright,False,-12.770920753479004,-15.573503494262695,2.8025827407836914,14067712,EleutherAI/pythia-14m,step136000,seed5,5,136000
He saw the young page.,page,page,He saw the page young., young page, page young,young,False,-17.959144592285156,-18.92569351196289,0.9665489196777344,14067712,EleutherAI/pythia-14m,step136000,seed5,5,136000
He saw the loyal page.,page,page,He saw the page loyal., loyal page, page loyal,loyal,False,-20.766159057617188,-20.75284194946289,-0.013317108154296875,14067712,EleutherAI/pythia-14m,step136000,seed5,5,136000
He saw the blank page.,page,page,He saw the page blank., blank page, page blank,blank,False,-16.004064559936523,-18.58340835571289,2.579343795776367,14067712,EleutherAI/pythia-14m,step136000,seed5,5,136000
It was a calloused palm.,palm,palm,It was a palm calloused., calloused palm, palm calloused,calloused,False,-29.90814971923828,-31.82724380493164,1.9190940856933594,14067712,EleutherAI/pythia-14m,step136000,seed5,5,136000
It was a wrinkled palm.,palm,palm,It was a palm wrinkled., wrinkled palm, palm wrinkled,wrinkled,False,-20.131271362304688,-22.958847045898438,2.82757568359375,14067712,EleutherAI/pythia-14m,step136000,seed5,5,136000
It was a tropical palm.,palm,palm,It was a palm tropical., tropical palm, palm tropical,tropical,False,-21.130046844482422,-23.73828125,2.608234405517578,14067712,EleutherAI/pythia-14m,step136000,seed5,5,136000
It was a control panel.,panel,panel,It was a panel control., control panel, panel control,control,True,-14.644792556762695,-19.854843139648438,5.210050582885742,14067712,EleutherAI/pythia-14m,step136000,seed5,5,136000
It was an instrument panel.,panel,panel,It was an panel instrument., instrument panel, panel instrument,instrument,False,-17.314231872558594,-25.130475997924805,7.816244125366211,14067712,EleutherAI/pythia-14m,step136000,seed5,5,136000
It was an advisory panel.,panel,panel,It was an panel advisory., advisory panel, panel advisory,advisory,False,-13.825990676879883,-26.297712326049805,12.471721649169922,14067712,EleutherAI/pythia-14m,step136000,seed5,5,136000
It was a secret passage.,passage,passage,It was a passage secret., secret passage, passage secret,secret,False,-16.061054229736328,-19.881689071655273,3.8206348419189453,14067712,EleutherAI/pythia-14m,step136000,seed5,5,136000
It was a narrow passage.,passage,passage,It was a passage narrow., narrow passage, passage narrow,narrow,False,-15.110037803649902,-20.783300399780273,5.673262596130371,14067712,EleutherAI/pythia-14m,step136000,seed5,5,136000
It was a literary passage.,passage,passage,It was a passage literary., literary passage, passage literary,literary,False,-17.26601791381836,-21.924169540405273,4.658151626586914,14067712,EleutherAI/pythia-14m,step136000,seed5,5,136000
It was a tasty perch.,perch,perch,It was a perch tasty., tasty perch, perch tasty,tasty,False,-20.754703521728516,-26.574256896972656,5.819553375244141,14067712,EleutherAI/pythia-14m,step136000,seed5,5,136000
It was a freshwater perch.,perch,perch,It was a perch freshwater., freshwater perch, perch freshwater,freshwater,True,-23.429889678955078,-26.492225646972656,3.062335968017578,14067712,EleutherAI/pythia-14m,step136000,seed5,5,136000
It was a lofty perch.,perch,perch,It was a perch lofty., lofty perch, perch lofty,lofty,False,-24.48470115661621,-28.866201400756836,4.381500244140625,14067712,EleutherAI/pythia-14m,step136000,seed5,5,136000
He saw the fast pitcher.,pitcher,pitcher,He saw the pitcher fast., fast pitcher, pitcher fast,fast,False,-20.08247184753418,-19.922225952148438,-0.1602458953857422,14067712,EleutherAI/pythia-14m,step136000,seed5,5,136000
He saw the right-handed pitcher.,pitcher,pitcher,He saw the pitcher right-handed., right-handed pitcher, pitcher right-handed,right-handed,False,-21.74651527404785,-25.513158798217773,3.766643524169922,14067712,EleutherAI/pythia-14m,step136000,seed5,5,136000
He saw the glass pitcher.,pitcher,pitcher,He saw the pitcher glass., glass pitcher, pitcher glass,glass,True,-18.704193115234375,-20.544296264648438,1.8401031494140625,14067712,EleutherAI/pythia-14m,step136000,seed5,5,136000
It was a windy port.,port,port,It was a port windy., windy port, port windy,windy,False,-21.552974700927734,-23.606060028076172,2.0530853271484375,14067712,EleutherAI/pythia-14m,step136000,seed5,5,136000
It was a seaside port.,port,port,It was a port seaside., seaside port, port seaside,seaside,True,-22.02178955078125,-26.73001480102539,4.708225250244141,14067712,EleutherAI/pythia-14m,step136000,seed5,5,136000
It was a delicious port.,port,port,It was a port delicious., delicious port, port delicious,delicious,False,-17.856006622314453,-21.043575286865234,3.1875686645507812,14067712,EleutherAI/pythia-14m,step136000,seed5,5,136000
He was in a distinguished position.,position,position,He was in a position distinguished., distinguished position, position distinguished,distinguished,False,-16.318824768066406,-19.176300048828125,2.8574752807617188,14067712,EleutherAI/pythia-14m,step136000,seed5,5,136000
He was in a prominent position.,position,position,He was in a position prominent., prominent position, position prominent,prominent,False,-13.67703914642334,-19.022003173828125,5.344964027404785,14067712,EleutherAI/pythia-14m,step136000,seed5,5,136000
He was in a fetal position.,position,position,He was in a position fetal., fetal position, position fetal,fetal,False,-18.481792449951172,-21.406524658203125,2.924732208251953,14067712,EleutherAI/pythia-14m,step136000,seed5,5,136000
It was a wooden post.,post,post,It was a post wooden., wooden post, post wooden,wooden,False,-17.811851501464844,-20.080726623535156,2.2688751220703125,14067712,EleutherAI/pythia-14m,step136000,seed5,5,136000
It was a fence post.,post,post,It was a post fence., fence post, post fence,fence,True,-19.812490463256836,-19.596107482910156,-0.2163829803466797,14067712,EleutherAI/pythia-14m,step136000,seed5,5,136000
It was a teaching post.,post,post,It was a post teaching., teaching post, post teaching,teaching,True,-17.03697967529297,-18.371742248535156,1.3347625732421875,14067712,EleutherAI/pythia-14m,step136000,seed5,5,136000
He had the alcoholic punch.,punch,punch,He had the punch alcoholic., alcoholic punch, punch alcoholic,alcoholic,False,-21.4927978515625,-23.124427795410156,1.6316299438476562,14067712,EleutherAI/pythia-14m,step136000,seed5,5,136000
He had the fruit punch.,punch,punch,He had the punch fruit., fruit punch, punch fruit,fruit,True,-20.272031784057617,-20.761146545410156,0.48911476135253906,14067712,EleutherAI/pythia-14m,step136000,seed5,5,136000
He had the strongest punch.,punch,punch,He had the punch strongest., strongest punch, punch strongest,strongest,False,-18.72934913635254,-23.360267639160156,4.630918502807617,14067712,EleutherAI/pythia-14m,step136000,seed5,5,136000
She had a brilliant pupil.,pupil,pupil,She had a pupil brilliant., brilliant pupil, pupil brilliant,brilliant,False,-18.126693725585938,-23.7633113861084,5.636617660522461,14067712,EleutherAI/pythia-14m,step136000,seed5,5,136000
She had an interested pupil.,pupil,pupil,She had an pupil interested., interested pupil, pupil interested,interested,False,-17.342533111572266,-20.437728881835938,3.095195770263672,14067712,EleutherAI/pythia-14m,step136000,seed5,5,136000
She had a dilated pupil.,pupil,pupil,She had a pupil dilated., dilated pupil, pupil dilated,dilated,False,-19.475738525390625,-24.7669734954834,5.291234970092773,14067712,EleutherAI/pythia-14m,step136000,seed5,5,136000
That was a loud racket.,racket,racket,That was a racket loud., loud racket, racket loud,loud,False,-19.157304763793945,-23.270631790161133,4.1133270263671875,14067712,EleutherAI/pythia-14m,step136000,seed5,5,136000
That was an annoying racket.,racket,racket,That was an racket annoying., annoying racket, racket annoying,annoying,False,-20.503026962280273,-24.321420669555664,3.8183937072753906,14067712,EleutherAI/pythia-14m,step136000,seed5,5,136000
That was a badminton racket.,racket,racket,That was a racket badminton., badminton racket, racket badminton,badminton,True,-28.275672912597656,-32.66189193725586,4.386219024658203,14067712,EleutherAI/pythia-14m,step136000,seed5,5,136000
He liked electronic rock.,rock,rock,He liked rock electronic., electronic rock, rock electronic,electronic,False,-20.1632080078125,-22.400754928588867,2.237546920776367,14067712,EleutherAI/pythia-14m,step136000,seed5,5,136000
He liked alternative rock.,rock,rock,He liked rock alternative., alternative rock, rock alternative,alternative,False,-21.683801651000977,-23.008174896240234,1.3243732452392578,14067712,EleutherAI/pythia-14m,step136000,seed5,5,136000
He liked limestone rock.,rock,rock,He liked rock limestone., limestone rock, rock limestone,limestone,True,-20.52376937866211,-23.230098724365234,2.706329345703125,14067712,EleutherAI/pythia-14m,step136000,seed5,5,136000
He saw the wise sage.,sage,sage,He saw the sage wise., wise sage, sage wise,wise,False,-20.331680297851562,-20.766155242919922,0.4344749450683594,14067712,EleutherAI/pythia-14m,step136000,seed5,5,136000
He saw the renowned sage.,sage,sage,He saw the sage renowned., renowned sage, sage renowned,renowned,False,-21.792049407958984,-24.295207977294922,2.5031585693359375,14067712,EleutherAI/pythia-14m,step136000,seed5,5,136000
He saw the fragrant sage.,sage,sage,He saw the sage fragrant., fragrant sage, sage fragrant,fragrant,False,-22.459983825683594,-22.449661254882812,-0.01032257080078125,14067712,EleutherAI/pythia-14m,step136000,seed5,5,136000
It was a fish scale.,scale,scale,It was a scale fish., fish scale, scale fish,fish,True,-20.059967041015625,-21.5625057220459,1.5025386810302734,14067712,EleutherAI/pythia-14m,step136000,seed5,5,136000
It was a lizard scale.,scale,scale,It was a scale lizard., lizard scale, scale lizard,lizard,True,-23.203739166259766,-26.643081665039062,3.439342498779297,14067712,EleutherAI/pythia-14m,step136000,seed5,5,136000
It was a music scale.,scale,scale,It was a scale music., music scale, scale music,music,True,-17.62232208251953,-19.9948787689209,2.372556686401367,14067712,EleutherAI/pythia-14m,step136000,seed5,5,136000
It was a touching scene.,scene,scene,It was a scene touching., touching scene, scene touching,touching,False,-15.17508316040039,-17.392559051513672,2.2174758911132812,14067712,EleutherAI/pythia-14m,step136000,seed5,5,136000
It was a well-acted scene.,scene,scene,It was a scene well-acted., well-acted scene, scene well-acted,well-acted,False,-22.497352600097656,-26.96523666381836,4.467884063720703,14067712,EleutherAI/pythia-14m,step136000,seed5,5,136000
It was a nature scene.,scene,scene,It was a scene nature., nature scene, scene nature,nature,True,-17.345458984375,-18.473857879638672,1.1283988952636719,14067712,EleutherAI/pythia-14m,step136000,seed5,5,136000
It was a gold seal.,seal,seal,It was a seal gold., gold seal, seal gold,gold,True,-17.11084747314453,-21.015338897705078,3.904491424560547,14067712,EleutherAI/pythia-14m,step136000,seed5,5,136000
It was a certified seal.,seal,seal,It was a seal certified., certified seal, seal certified,certified,False,-21.337221145629883,-21.746784210205078,0.4095630645751953,14067712,EleutherAI/pythia-14m,step136000,seed5,5,136000
It was a circus seal.,seal,seal,It was a seal circus., circus seal, seal circus,circus,True,-21.311298370361328,-23.025592803955078,1.71429443359375,14067712,EleutherAI/pythia-14m,step136000,seed5,5,136000
He used the scotch tape.,tape,tape,He used the tape scotch., scotch tape, tape scotch,scotch,True,-22.559200286865234,-27.067625045776367,4.508424758911133,14067712,EleutherAI/pythia-14m,step136000,seed5,5,136000
He used the double-sided tape.,tape,tape,He used the tape double-sided., double-sided tape, tape double-sided,double-sided,False,-22.2689151763916,-26.91442108154297,4.645505905151367,14067712,EleutherAI/pythia-14m,step136000,seed5,5,136000
