sentence,word,string,reversed_sentence,mod_np,reversed_mod,disambiguating_word,non_adjective,original_logprob,reversed_logprob,ratio,n_params,mpath,revision,seed_name,seed,step
It was a desperate act.,act,act,It was an act desperate., desperate act, act desperate,desperate,False,-16.063968658447266,-19.078208923339844,3.014240264892578,14067712,EleutherAI/pythia-14m,step109000,seed7,7,109000
It was a humane act.,act,act,It was an act humane., humane act, act humane,humane,False,-19.756093978881836,-22.04469871520996,2.288604736328125,14067712,EleutherAI/pythia-14m,step109000,seed7,7,109000
It was a magic act.,act,act,It was an act magic., magic act, act magic,magic,False,-17.870258331298828,-18.619468688964844,0.7492103576660156,14067712,EleutherAI/pythia-14m,step109000,seed7,7,109000
He had a universal appeal.,appeal,appeal,He had an appeal universal., universal appeal, appeal universal,universal,False,-20.202106475830078,-22.812210083007812,2.6101036071777344,14067712,EleutherAI/pythia-14m,step109000,seed7,7,109000
He had an undefinable appeal.,appeal,appeal,He had an appeal undefinable., undefinable appeal, appeal undefinable,undefinable,False,-19.966472625732422,-25.249683380126953,5.283210754394531,14067712,EleutherAI/pythia-14m,step109000,seed7,7,109000
He had a legal appeal.,appeal,appeal,He had an appeal legal., legal appeal, appeal legal,legal,False,-13.379449844360352,-17.467849731445312,4.088399887084961,14067712,EleutherAI/pythia-14m,step109000,seed7,7,109000
It was a tense atmosphere.,atmosphere,atmosphere,It was an atmosphere tense., tense atmosphere, atmosphere tense,tense,False,-18.088245391845703,-19.153717041015625,1.0654716491699219,14067712,EleutherAI/pythia-14m,step109000,seed7,7,109000
It was a hostile atmosphere.,atmosphere,atmosphere,It was an atmosphere hostile., hostile atmosphere, atmosphere hostile,hostile,False,-16.51347541809082,-20.549468994140625,4.035993576049805,14067712,EleutherAI/pythia-14m,step109000,seed7,7,109000
It was a gaseous atmosphere.,atmosphere,atmosphere,It was an atmosphere gaseous., gaseous atmosphere, atmosphere gaseous,gaseous,False,-16.10383415222168,-21.556793212890625,5.452959060668945,14067712,EleutherAI/pythia-14m,step109000,seed7,7,109000
It was a gold band.,band,band,It was a band gold., gold band, band gold,gold,True,-14.910453796386719,-19.002330780029297,4.091876983642578,14067712,EleutherAI/pythia-14m,step109000,seed7,7,109000
It was a rubber band.,band,band,It was a band rubber., rubber band, band rubber,rubber,True,-15.691383361816406,-21.478160858154297,5.786777496337891,14067712,EleutherAI/pythia-14m,step109000,seed7,7,109000
It was a jazz band.,band,band,It was a band jazz., jazz band, band jazz,jazz,True,-13.764138221740723,-20.476451873779297,6.712313652038574,14067712,EleutherAI/pythia-14m,step109000,seed7,7,109000
There was a police barrier.,barrier,barrier,There was a barrier police., police barrier, barrier police,police,True,-20.467708587646484,-21.7171630859375,1.2494544982910156,14067712,EleutherAI/pythia-14m,step109000,seed7,7,109000
There was a concrete barrier.,barrier,barrier,There was a barrier concrete., concrete barrier, barrier concrete,concrete,False,-15.947700500488281,-21.3486328125,5.400932312011719,14067712,EleutherAI/pythia-14m,step109000,seed7,7,109000
There was a language barrier.,barrier,barrier,There was a barrier language., language barrier, barrier language,language,True,-18.64391326904297,-23.09765625,4.453742980957031,14067712,EleutherAI/pythia-14m,step109000,seed7,7,109000
He saw a furry bat.,bat,bat,He saw a bat furry., furry bat, bat furry,furry,False,-21.358633041381836,-23.941587448120117,2.5829544067382812,14067712,EleutherAI/pythia-14m,step109000,seed7,7,109000
He saw a fruit bat.,bat,bat,He saw a bat fruit., fruit bat, bat fruit,fruit,True,-18.506858825683594,-19.919858932495117,1.4130001068115234,14067712,EleutherAI/pythia-14m,step109000,seed7,7,109000
He saw a wooden bat.,bat,bat,He saw a bat wooden., wooden bat, bat wooden,wooden,False,-15.395333290100098,-21.426328659057617,6.0309953689575195,14067712,EleutherAI/pythia-14m,step109000,seed7,7,109000
He saw the laser beam.,beam,beam,He saw the beam laser., laser beam, beam laser,laser,True,-13.871419906616211,-16.62787628173828,2.7564563751220703,14067712,EleutherAI/pythia-14m,step109000,seed7,7,109000
He saw the bright beam.,beam,beam,He saw the beam bright., bright beam, beam bright,bright,False,-18.9148006439209,-16.66205596923828,-2.252744674682617,14067712,EleutherAI/pythia-14m,step109000,seed7,7,109000
He saw the wood beam.,beam,beam,He saw the beam wood., wood beam, beam wood,wood,True,-18.436199188232422,-19.20771026611328,0.7715110778808594,14067712,EleutherAI/pythia-14m,step109000,seed7,7,109000
She had a toy block.,block,block,She had a block toy., toy block, block toy,toy,True,-19.36947250366211,-21.289522171020508,1.9200496673583984,14067712,EleutherAI/pythia-14m,step109000,seed7,7,109000
She had a wooden block.,block,block,She had a block wooden., wooden block, block wooden,wooden,False,-15.679123878479004,-21.897432327270508,6.218308448791504,14067712,EleutherAI/pythia-14m,step109000,seed7,7,109000
She had a mental block.,block,block,She had a block mental., mental block, block mental,mental,False,-18.910755157470703,-22.929170608520508,4.018415451049805,14067712,EleutherAI/pythia-14m,step109000,seed7,7,109000
He has coagulated blood.,blood,blood,He has blood coagulated., coagulated blood, blood coagulated,coagulated,True,-25.875411987304688,-30.762025833129883,4.886613845825195,14067712,EleutherAI/pythia-14m,step109000,seed7,7,109000
He has thin blood.,blood,blood,He has blood thin., thin blood, blood thin,thin,False,-18.6357364654541,-19.692506790161133,1.0567703247070312,14067712,EleutherAI/pythia-14m,step109000,seed7,7,109000
He has noble blood.,blood,blood,He has blood noble., noble blood, blood noble,noble,False,-20.94507598876953,-23.547975540161133,2.6028995513916016,14067712,EleutherAI/pythia-14m,step109000,seed7,7,109000
It was the ironing board.,board,board,It was the board ironing., ironing board, board ironing,ironing,False,-21.534229278564453,-22.040576934814453,0.50634765625,14067712,EleutherAI/pythia-14m,step109000,seed7,7,109000
It was the wooden board.,board,board,It was the board wooden., wooden board, board wooden,wooden,False,-15.66463851928711,-19.427066802978516,3.7624282836914062,14067712,EleutherAI/pythia-14m,step109000,seed7,7,109000
It was the executive board.,board,board,It was the board executive., executive board, board executive,executive,True,-15.715677261352539,-17.081851959228516,1.3661746978759766,14067712,EleutherAI/pythia-14m,step109000,seed7,7,109000
He had a best-selling book.,book,book,He had a book best-selling., best-selling book, book best-selling,best-selling,False,-14.220685005187988,-21.04202651977539,6.821341514587402,14067712,EleutherAI/pythia-14m,step109000,seed7,7,109000
He had a popular book.,book,book,He had a book popular., popular book, book popular,popular,False,-14.451745986938477,-20.124961853027344,5.673215866088867,14067712,EleutherAI/pythia-14m,step109000,seed7,7,109000
He had a heavy book.,book,book,He had a book heavy., heavy book, book heavy,heavy,False,-17.724830627441406,-20.822959899902344,3.0981292724609375,14067712,EleutherAI/pythia-14m,step109000,seed7,7,109000
They ate a pancake breakfast.,breakfast,breakfast,They ate a breakfast pancake., pancake breakfast, breakfast pancake,pancake,True,-13.320602416992188,-14.697554588317871,1.3769521713256836,14067712,EleutherAI/pythia-14m,step109000,seed7,7,109000
They ate a nutritious breakfast.,breakfast,breakfast,They ate a breakfast nutritious., nutritious breakfast, breakfast nutritious,nutritious,False,-18.059017181396484,-22.81825828552246,4.759241104125977,14067712,EleutherAI/pythia-14m,step109000,seed7,7,109000
They ate a family breakfast.,breakfast,breakfast,They ate a breakfast family., family breakfast, breakfast family,family,True,-11.259720802307129,-15.240789413452148,3.9810686111450195,14067712,EleutherAI/pythia-14m,step109000,seed7,7,109000
It was a red cape.,cape,cape,It was a cape red., red cape, cape red,red,False,-19.303787231445312,-25.102249145507812,5.7984619140625,14067712,EleutherAI/pythia-14m,step109000,seed7,7,109000
It was a flowing cape.,cape,cape,It was a cape flowing., flowing cape, cape flowing,flowing,False,-22.94144058227539,-26.956497192382812,4.015056610107422,14067712,EleutherAI/pythia-14m,step109000,seed7,7,109000
It was a rocky cape.,cape,cape,It was a cape rocky., rocky cape, cape rocky,rocky,False,-20.513141632080078,-29.631423950195312,9.118282318115234,14067712,EleutherAI/pythia-14m,step109000,seed7,7,109000
It was a beer case.,case,case,It was a case beer., beer case, case beer,beer,True,-17.633769989013672,-20.108116149902344,2.474346160888672,14067712,EleutherAI/pythia-14m,step109000,seed7,7,109000
It was a display case.,case,case,It was a case display., display case, case display,display,True,-16.46858024597168,-19.994712829589844,3.526132583618164,14067712,EleutherAI/pythia-14m,step109000,seed7,7,109000
It was a divorce case.,case,case,It was a case divorce., divorce case, case divorce,divorce,True,-13.756816864013672,-20.754722595214844,6.997905731201172,14067712,EleutherAI/pythia-14m,step109000,seed7,7,109000
It was a worthy cause.,cause,cause,It was a cause worthy., worthy cause, cause worthy,worthy,False,-14.728607177734375,-20.582090377807617,5.853483200073242,14067712,EleutherAI/pythia-14m,step109000,seed7,7,109000
It was a political cause.,cause,cause,It was a cause political., political cause, cause political,political,False,-13.771514892578125,-21.455747604370117,7.684232711791992,14067712,EleutherAI/pythia-14m,step109000,seed7,7,109000
It was a main cause.,cause,cause,It was a cause main., main cause, cause main,main,False,-14.356739044189453,-21.557676315307617,7.200937271118164,14067712,EleutherAI/pythia-14m,step109000,seed7,7,109000
It was a skin cell.,cell,cell,It was a cell skin., skin cell, cell skin,skin,True,-17.21571922302246,-16.89350128173828,-0.3222179412841797,14067712,EleutherAI/pythia-14m,step109000,seed7,7,109000
It was a brain cell.,cell,cell,It was a cell brain., brain cell, cell brain,brain,True,-14.076150894165039,-16.00653839111328,1.9303874969482422,14067712,EleutherAI/pythia-14m,step109000,seed7,7,109000
It was a prison cell.,cell,cell,It was a cell prison., prison cell, cell prison,prison,True,-17.616134643554688,-18.60004425048828,0.9839096069335938,14067712,EleutherAI/pythia-14m,step109000,seed7,7,109000
She had a devilish charm.,charm,charm,She had a charm devilish., devilish charm, charm devilish,devilish,False,-21.043119430541992,-27.028301239013672,5.98518180847168,14067712,EleutherAI/pythia-14m,step109000,seed7,7,109000
She had a natural charm.,charm,charm,She had a charm natural., natural charm, charm natural,natural,False,-15.663222312927246,-21.051713943481445,5.388491630554199,14067712,EleutherAI/pythia-14m,step109000,seed7,7,109000
She had a gold charm.,charm,charm,She had a charm gold., gold charm, charm gold,gold,True,-16.66952133178711,-19.888992309570312,3.219470977783203,14067712,EleutherAI/pythia-14m,step109000,seed7,7,109000
They liked the juicy chicken.,chicken,chicken,They liked the chicken juicy., juicy chicken, chicken juicy,juicy,False,-19.143173217773438,-20.053003311157227,0.9098300933837891,14067712,EleutherAI/pythia-14m,step109000,seed7,7,109000
They liked the roasted chicken.,chicken,chicken,They liked the chicken roasted., roasted chicken, chicken roasted,roasted,False,-15.232540130615234,-17.65247917175293,2.4199390411376953,14067712,EleutherAI/pythia-14m,step109000,seed7,7,109000
They liked the clucking chicken.,chicken,chicken,They liked the chicken clucking., clucking chicken, chicken clucking,clucking,True,-24.582592010498047,-23.094974517822266,-1.4876174926757812,14067712,EleutherAI/pythia-14m,step109000,seed7,7,109000
It was a perceptive class.,class,class,It was a class perceptive., perceptive class, class perceptive,perceptive,False,-26.85113525390625,-26.966716766357422,0.11558151245117188,14067712,EleutherAI/pythia-14m,step109000,seed7,7,109000
It was a misbehaving class.,class,class,It was a class misbehaving., misbehaving class, class misbehaving,misbehaving,False,-29.08049964904785,-26.123804092407227,-2.956695556640625,14067712,EleutherAI/pythia-14m,step109000,seed7,7,109000
It was a boring class.,class,class,It was a class boring., boring class, class boring,boring,False,-15.099581718444824,-17.427217483520508,2.3276357650756836,14067712,EleutherAI/pythia-14m,step109000,seed7,7,109000
It was a film clip.,clip,clip,It was a clip film., film clip, clip film,film,True,-17.87527084350586,-18.66370391845703,0.7884330749511719,14067712,EleutherAI/pythia-14m,step109000,seed7,7,109000
It was a video clip.,clip,clip,It was a clip video., video clip, clip video,video,True,-12.360416412353516,-17.40418243408203,5.043766021728516,14067712,EleutherAI/pythia-14m,step109000,seed7,7,109000
It was a hair clip.,clip,clip,It was a clip hair., hair clip, clip hair,hair,True,-18.720962524414062,-19.07166290283203,0.35070037841796875,14067712,EleutherAI/pythia-14m,step109000,seed7,7,109000
It was an icy cold.,cold,cold,It was an cold icy., icy cold, cold icy,icy,False,-12.257539749145508,-19.046585083007812,6.789045333862305,14067712,EleutherAI/pythia-14m,step109000,seed7,7,109000
It was a freezing cold.,cold,cold,It was a cold freezing., freezing cold, cold freezing,freezing,False,-14.232407569885254,-15.333816528320312,1.1014089584350586,14067712,EleutherAI/pythia-14m,step109000,seed7,7,109000
It was a chest cold.,cold,cold,It was a cold chest., chest cold, cold chest,chest,False,-15.488941192626953,-16.485794067382812,0.9968528747558594,14067712,EleutherAI/pythia-14m,step109000,seed7,7,109000
It was a gossip column.,column,column,It was a column gossip., gossip column, column gossip,gossip,True,-19.002031326293945,-22.94831085205078,3.946279525756836,14067712,EleutherAI/pythia-14m,step109000,seed7,7,109000
It was a sports column.,column,column,It was a column sports., sports column, column sports,sports,True,-19.206146240234375,-21.10749053955078,1.9013442993164062,14067712,EleutherAI/pythia-14m,step109000,seed7,7,109000
It was a concrete column.,column,column,It was a column concrete., concrete column, column concrete,concrete,False,-16.311870574951172,-18.04328155517578,1.7314109802246094,14067712,EleutherAI/pythia-14m,step109000,seed7,7,109000
He liked the investment company.,company,company,He liked the company investment., investment company, company investment,investment,True,-18.995620727539062,-17.033546447753906,-1.9620742797851562,14067712,EleutherAI/pythia-14m,step109000,seed7,7,109000
He liked the pharmaceutical company.,company,company,He liked the company pharmaceutical., pharmaceutical company, company pharmaceutical,pharmaceutical,False,-15.660002708435059,-19.414772033691406,3.7547693252563477,14067712,EleutherAI/pythia-14m,step109000,seed7,7,109000
He liked the pleasant company.,company,company,He liked the company pleasant., pleasant company, company pleasant,pleasant,False,-20.115577697753906,-18.153297424316406,-1.9622802734375,14067712,EleutherAI/pythia-14m,step109000,seed7,7,109000
It was a waffle cone.,cone,cone,It was a cone waffle., waffle cone, cone waffle,waffle,True,-25.725217819213867,-30.091920852661133,4.366703033447266,14067712,EleutherAI/pythia-14m,step109000,seed7,7,109000
It was a sugar cone.,cone,cone,It was a cone sugar., sugar cone, cone sugar,sugar,True,-20.85882568359375,-24.490161895751953,3.631336212158203,14067712,EleutherAI/pythia-14m,step109000,seed7,7,109000
It was an orange cone.,cone,cone,It was an cone orange., orange cone, cone orange,orange,False,-16.833106994628906,-24.551179885864258,7.718072891235352,14067712,EleutherAI/pythia-14m,step109000,seed7,7,109000
He made a charitable contribution.,contribution,contribution,He made a contribution charitable., charitable contribution, contribution charitable,charitable,False,-15.027024269104004,-22.536361694335938,7.509337425231934,14067712,EleutherAI/pythia-14m,step109000,seed7,7,109000
He made a voluntary contribution.,contribution,contribution,He made a contribution voluntary., voluntary contribution, contribution voluntary,voluntary,False,-14.073554039001465,-22.073104858398438,7.999550819396973,14067712,EleutherAI/pythia-14m,step109000,seed7,7,109000
He made a scholarly contribution.,contribution,contribution,He made a contribution scholarly., scholarly contribution, contribution scholarly,scholarly,False,-16.305644989013672,-22.924301147460938,6.618656158447266,14067712,EleutherAI/pythia-14m,step109000,seed7,7,109000
That was the noble count.,count,count,That was the count noble., noble count, count noble,noble,False,-18.280750274658203,-24.990781784057617,6.710031509399414,14067712,EleutherAI/pythia-14m,step109000,seed7,7,109000
That was the vengeful count.,count,count,That was the count vengeful., vengeful count, count vengeful,vengeful,False,-23.851430892944336,-32.95254135131836,9.101110458374023,14067712,EleutherAI/pythia-14m,step109000,seed7,7,109000
That was the final count.,count,count,That was the count final., final count, count final,final,False,-13.139542579650879,-20.798154830932617,7.658612251281738,14067712,EleutherAI/pythia-14m,step109000,seed7,7,109000
It was an introductory course.,course,course,It was an course introductory., introductory course, course introductory,introductory,False,-11.446026802062988,-24.45761489868164,13.011588096618652,14067712,EleutherAI/pythia-14m,step109000,seed7,7,109000
It was a pass-fail course.,course,course,It was a course pass-fail., pass-fail course, course pass-fail,pass-fail,False,-27.207332611083984,-32.248443603515625,5.041110992431641,14067712,EleutherAI/pythia-14m,step109000,seed7,7,109000
It was a charted course.,course,course,It was a course charted., charted course, course charted,charted,False,-22.259033203125,-25.11391258239746,2.854879379272461,14067712,EleutherAI/pythia-14m,step109000,seed7,7,109000
It was a dinner date.,date,date,It was a date dinner., dinner date, date dinner,dinner,True,-16.994709014892578,-19.937253952026367,2.942544937133789,14067712,EleutherAI/pythia-14m,step109000,seed7,7,109000
It was a blind date.,date,date,It was a date blind., blind date, date blind,blind,False,-17.61041259765625,-20.873167037963867,3.262754440307617,14067712,EleutherAI/pythia-14m,step109000,seed7,7,109000
It was an expiration date.,date,date,It was an date expiration., expiration date, date expiration,expiration,True,-15.112890243530273,-22.023353576660156,6.910463333129883,14067712,EleutherAI/pythia-14m,step109000,seed7,7,109000
It was about forty degrees.,degree,degrees,It was about degrees forty., forty degrees, degrees forty,forty,True,-14.609271049499512,-20.011112213134766,5.401841163635254,14067712,EleutherAI/pythia-14m,step109000,seed7,7,109000
It was about fifty degrees.,degree,degrees,It was about degrees fifty., fifty degrees, degrees fifty,fifty,True,-14.078575134277344,-19.599246978759766,5.520671844482422,14067712,EleutherAI/pythia-14m,step109000,seed7,7,109000
It was about associate degrees.,degree,degrees,It was about degrees associate., associate degrees, degrees associate,associate,False,-22.158437728881836,-24.472537994384766,2.3141002655029297,14067712,EleutherAI/pythia-14m,step109000,seed7,7,109000
They liked the floral design.,design,design,They liked the design floral., floral design, design floral,floral,False,-15.168379783630371,-18.37293243408203,3.20455265045166,14067712,EleutherAI/pythia-14m,step109000,seed7,7,109000
They liked the geometric design.,design,design,They liked the design geometric., geometric design, design geometric,geometric,False,-14.566051483154297,-18.59168243408203,4.025630950927734,14067712,EleutherAI/pythia-14m,step109000,seed7,7,109000
They liked the product design.,design,design,They liked the design product., product design, design product,product,True,-14.34069538116455,-15.020515441894531,0.6798200607299805,14067712,EleutherAI/pythia-14m,step109000,seed7,7,109000
They liked the turkey dinner.,dinner,dinner,They liked the dinner turkey., turkey dinner, dinner turkey,turkey,True,-15.640968322753906,-18.983600616455078,3.342632293701172,14067712,EleutherAI/pythia-14m,step109000,seed7,7,109000
They liked the light dinner.,dinner,dinner,They liked the dinner light., light dinner, dinner light,light,False,-16.48379135131836,-18.953571319580078,2.4697799682617188,14067712,EleutherAI/pythia-14m,step109000,seed7,7,109000
They liked the formal dinner.,dinner,dinner,They liked the dinner formal., formal dinner, dinner formal,formal,False,-16.92765235900879,-20.460895538330078,3.533243179321289,14067712,EleutherAI/pythia-14m,step109000,seed7,7,109000
He had a recurring dream.,dream,dream,He had a dream recurring., recurring dream, dream recurring,recurring,False,-15.694618225097656,-22.504520416259766,6.809902191162109,14067712,EleutherAI/pythia-14m,step109000,seed7,7,109000
He had a bad dream.,dream,dream,He had a dream bad., bad dream, dream bad,bad,False,-13.102489471435547,-18.096683502197266,4.994194030761719,14067712,EleutherAI/pythia-14m,step109000,seed7,7,109000
He had a childhood dream.,dream,dream,He had a dream childhood., childhood dream, dream childhood,childhood,True,-17.139801025390625,-21.272830963134766,4.133029937744141,14067712,EleutherAI/pythia-14m,step109000,seed7,7,109000
It was a grueling drill.,drill,drill,It was a drill grueling., grueling drill, drill grueling,grueling,False,-23.207752227783203,-26.936614990234375,3.728862762451172,14067712,EleutherAI/pythia-14m,step109000,seed7,7,109000
It was a challenging drill.,drill,drill,It was a drill challenging., challenging drill, drill challenging,challenging,False,-20.031661987304688,-21.726505279541016,1.6948432922363281,14067712,EleutherAI/pythia-14m,step109000,seed7,7,109000
It was an electric drill.,drill,drill,It was an drill electric., electric drill, drill electric,electric,False,-16.223102569580078,-23.3658447265625,7.142742156982422,14067712,EleutherAI/pythia-14m,step109000,seed7,7,109000
It was a multiple-choice examination.,examination,examination,It was an examination multiple-choice., multiple-choice examination, examination multiple-choice,multiple-choice,False,-26.741119384765625,-29.538259506225586,2.797140121459961,14067712,EleutherAI/pythia-14m,step109000,seed7,7,109000
It was a difficult examination.,examination,examination,It was an examination difficult., difficult examination, examination difficult,difficult,False,-14.347258567810059,-15.087542533874512,0.7402839660644531,14067712,EleutherAI/pythia-14m,step109000,seed7,7,109000
It was a prostate examination.,examination,examination,It was an examination prostate., prostate examination, examination prostate,prostate,True,-17.21245574951172,-20.370502471923828,3.1580467224121094,14067712,EleutherAI/pythia-14m,step109000,seed7,7,109000
They had an electric fan.,fan,fan,They had an fan electric., electric fan, fan electric,electric,False,-16.731721878051758,-26.699745178222656,9.968023300170898,14067712,EleutherAI/pythia-14m,step109000,seed7,7,109000
They had a ceiling fan.,fan,fan,They had a fan ceiling., ceiling fan, fan ceiling,ceiling,True,-18.763263702392578,-22.988040924072266,4.2247772216796875,14067712,EleutherAI/pythia-14m,step109000,seed7,7,109000
They had a zealous fan.,fan,fan,They had a fan zealous., zealous fan, fan zealous,zealous,False,-23.78005599975586,-27.908775329589844,4.128719329833984,14067712,EleutherAI/pythia-14m,step109000,seed7,7,109000
She had a text file.,file,file,She had a file text., text file, file text,text,True,-12.31280517578125,-16.46828842163086,4.155483245849609,14067712,EleutherAI/pythia-14m,step109000,seed7,7,109000
She had a data file.,file,file,She had a file data., data file, file data,data,True,-14.661922454833984,-17.18508529663086,2.523162841796875,14067712,EleutherAI/pythia-14m,step109000,seed7,7,109000
She had a nail file.,file,file,She had a file nail., nail file, file nail,nail,True,-19.78791618347168,-21.94961166381836,2.1616954803466797,14067712,EleutherAI/pythia-14m,step109000,seed7,7,109000
It was an action film.,film,film,It was an film action., action film, film action,action,True,-15.610042572021484,-16.6119441986084,1.001901626586914,14067712,EleutherAI/pythia-14m,step109000,seed7,7,109000
It was a censored film.,film,film,It was a film censored., censored film, film censored,censored,False,-18.802961349487305,-21.007862091064453,2.2049007415771484,14067712,EleutherAI/pythia-14m,step109000,seed7,7,109000
It was a transparent film.,film,film,It was a film transparent., transparent film, film transparent,transparent,False,-15.067405700683594,-20.00661849975586,4.939212799072266,14067712,EleutherAI/pythia-14m,step109000,seed7,7,109000
It was a charitable foundation.,foundation,foundation,It was a foundation charitable., charitable foundation, foundation charitable,charitable,False,-13.867115020751953,-20.918947219848633,7.05183219909668,14067712,EleutherAI/pythia-14m,step109000,seed7,7,109000
It was an educational foundation.,foundation,foundation,It was an foundation educational., educational foundation, foundation educational,educational,False,-13.439194679260254,-21.87130355834961,8.432108879089355,14067712,EleutherAI/pythia-14m,step109000,seed7,7,109000
It was a wooden foundation.,foundation,foundation,It was a foundation wooden., wooden foundation, foundation wooden,wooden,False,-17.088455200195312,-20.056764602661133,2.9683094024658203,14067712,EleutherAI/pythia-14m,step109000,seed7,7,109000
It was a mathematical function.,function,function,It was a function mathematical., mathematical function, function mathematical,mathematical,False,-14.788084030151367,-18.32363510131836,3.535551071166992,14067712,EleutherAI/pythia-14m,step109000,seed7,7,109000
