sentence,word,string,reversed_sentence,mod_np,reversed_mod,disambiguating_word,non_adjective,original_logprob,reversed_logprob,ratio,n_params,mpath,revision,seed_name,seed,step
It was a fall term.,term,term,It was a term fall., fall term, term fall,fall,True,-17.962242126464844,-19.941102981567383,1.978860855102539,14067712,EleutherAI/pythia-14m,step68000,seed5,5,68000
It was a legal term.,term,term,It was a term legal., legal term, term legal,legal,False,-15.938671112060547,-18.12407112121582,2.1854000091552734,14067712,EleutherAI/pythia-14m,step68000,seed5,5,68000
It was a clock tick.,tick,tick,It was a tick clock., clock tick, tick clock,clock,True,-17.048309326171875,-20.568143844604492,3.519834518432617,14067712,EleutherAI/pythia-14m,step68000,seed5,5,68000
It was an audible tick.,tick,tick,It was an tick audible., audible tick, tick audible,audible,False,-16.841697692871094,-24.532512664794922,7.690814971923828,14067712,EleutherAI/pythia-14m,step68000,seed5,5,68000
It was a parasitic tick.,tick,tick,It was a tick parasitic., parasitic tick, tick parasitic,parasitic,False,-19.304424285888672,-22.71943473815918,3.415010452270508,14067712,EleutherAI/pythia-14m,step68000,seed5,5,68000
It was a generous tip.,tip,tip,It was a tip generous., generous tip, tip generous,generous,False,-19.376705169677734,-24.0456600189209,4.668954849243164,14067712,EleutherAI/pythia-14m,step68000,seed5,5,68000
It was a stingy tip.,tip,tip,It was a tip stingy., stingy tip, tip stingy,stingy,False,-19.616899490356445,-23.50100326538086,3.884103775024414,14067712,EleutherAI/pythia-14m,step68000,seed5,5,68000
It was a pencil tip.,tip,tip,It was a tip pencil., pencil tip, tip pencil,pencil,True,-19.94994354248047,-22.226980209350586,2.277036666870117,14067712,EleutherAI/pythia-14m,step68000,seed5,5,68000
She liked the essay title.,title,title,She liked the title essay., essay title, title essay,essay,True,-19.37271499633789,-16.82187843322754,-2.5508365631103516,14067712,EleutherAI/pythia-14m,step68000,seed5,5,68000
She liked the poem title.,title,title,She liked the title poem., poem title, title poem,poem,True,-18.657196044921875,-16.435068130493164,-2.222127914428711,14067712,EleutherAI/pythia-14m,step68000,seed5,5,68000
She liked the academic title.,title,title,She liked the title academic., academic title, title academic,academic,False,-17.57509422302246,-19.30570411682129,1.7306098937988281,14067712,EleutherAI/pythia-14m,step68000,seed5,5,68000
It was a costly toll.,toll,toll,It was a toll costly., costly toll, toll costly,costly,False,-17.61538314819336,-25.16030502319336,7.544921875,14067712,EleutherAI/pythia-14m,step68000,seed5,5,68000
It was a road toll.,toll,toll,It was a toll road., road toll, toll road,road,True,-17.562461853027344,-18.470317840576172,0.9078559875488281,14067712,EleutherAI/pythia-14m,step68000,seed5,5,68000
It was a loud toll.,toll,toll,It was a toll loud., loud toll, toll loud,loud,False,-19.681350708007812,-22.513973236083984,2.832622528076172,14067712,EleutherAI/pythia-14m,step68000,seed5,5,68000
She saw the train tracks.,track,tracks,She saw the tracks train., train tracks, tracks train,train,True,-14.815957069396973,-19.34192657470703,4.525969505310059,14067712,EleutherAI/pythia-14m,step68000,seed5,5,68000
She saw the trolley tracks.,track,tracks,She saw the tracks trolley., trolley tracks, tracks trolley,trolley,True,-23.43962860107422,-26.943756103515625,3.5041275024414062,14067712,EleutherAI/pythia-14m,step68000,seed5,5,68000
She saw the moose tracks.,track,tracks,She saw the tracks moose., moose tracks, tracks moose,moose,False,-24.967514038085938,-24.28823471069336,-0.6792793273925781,14067712,EleutherAI/pythia-14m,step68000,seed5,5,68000
It was five yards.,yard,yards,It was yards five., five yards, yards five,five,True,-15.57307243347168,-26.81920623779297,11.246133804321289,14067712,EleutherAI/pythia-14m,step68000,seed5,5,68000
It was ten yards.,yard,yards,It was yards ten., ten yards, yards ten,ten,True,-16.36028480529785,-27.087730407714844,10.727445602416992,14067712,EleutherAI/pythia-14m,step68000,seed5,5,68000
They were big yards.,yard,yards,They were yards big., big yards, yards big,big,False,-18.680355072021484,-22.31545639038086,3.635101318359375,14067712,EleutherAI/pythia-14m,step68000,seed5,5,68000
It was a comedic act.,act,act,It was an act comedic., comedic act, act comedic,comedic,False,-16.20947265625,-18.898509979248047,2.689037322998047,14067712,EleutherAI/pythia-14m,step68000,seed5,5,68000
He had a pending appeal.,appeal,appeal,He had an appeal pending., pending appeal, appeal pending,pending,False,-15.785003662109375,-13.81375503540039,-1.9712486267089844,14067712,EleutherAI/pythia-14m,step68000,seed5,5,68000
It was a polluted atmosphere.,atmosphere,atmosphere,It was an atmosphere polluted., polluted atmosphere, atmosphere polluted,polluted,False,-24.70889663696289,-23.60814666748047,-1.1007499694824219,14067712,EleutherAI/pythia-14m,step68000,seed5,5,68000
It was a country band.,band,band,It was a band country., country band, band country,country,True,-17.185897827148438,-17.385028839111328,0.19913101196289062,14067712,EleutherAI/pythia-14m,step68000,seed5,5,68000
There was a religious barrier.,barrier,barrier,There was a barrier religious., religious barrier, barrier religious,religious,False,-19.048871994018555,-22.513839721679688,3.464967727661133,14067712,EleutherAI/pythia-14m,step68000,seed5,5,68000
He saw a baseball bat.,bat,bat,He saw a bat baseball., baseball bat, bat baseball,baseball,True,-9.15067195892334,-19.03484344482422,9.884171485900879,14067712,EleutherAI/pythia-14m,step68000,seed5,5,68000
He saw the balance beam.,beam,beam,He saw the beam balance., balance beam, beam balance,balance,True,-19.976119995117188,-18.801082611083984,-1.1750373840332031,14067712,EleutherAI/pythia-14m,step68000,seed5,5,68000
She had a writer's block.,block,block,She had a block writer's., writer's block, block writer's,writer,True,-22.005992889404297,-24.119890213012695,2.1138973236083984,14067712,EleutherAI/pythia-14m,step68000,seed5,5,68000
He has royal blood.,blood,blood,He has blood royal., royal blood, blood royal,royal,False,-20.14642333984375,-22.831201553344727,2.6847782135009766,14067712,EleutherAI/pythia-14m,step68000,seed5,5,68000
It was the school board.,board,board,It was the board school., school board, board school,school,True,-12.0467529296875,-17.814022064208984,5.767269134521484,14067712,EleutherAI/pythia-14m,step68000,seed5,5,68000
He had a leather-bound book.,book,book,He had a book leather-bound., leather-bound book, book leather-bound,leather-bound,False,-26.195255279541016,-30.24291229248047,4.047657012939453,14067712,EleutherAI/pythia-14m,step68000,seed5,5,68000
They ate a lonely breakfast.,breakfast,breakfast,They ate a breakfast lonely., lonely breakfast, breakfast lonely,lonely,False,-17.6650390625,-22.997966766357422,5.332927703857422,14067712,EleutherAI/pythia-14m,step68000,seed5,5,68000
It was an island cape.,cape,cape,It was an cape island., island cape, cape island,island,True,-23.269643783569336,-23.968276977539062,0.6986331939697266,14067712,EleutherAI/pythia-14m,step68000,seed5,5,68000
It was a criminal case.,case,case,It was a case criminal., criminal case, case criminal,criminal,False,-10.244304656982422,-17.809850692749023,7.565546035766602,14067712,EleutherAI/pythia-14m,step68000,seed5,5,68000
It was a primary cause.,cause,cause,It was a cause primary., primary cause, cause primary,primary,False,-13.323678970336914,-22.0106258392334,8.686946868896484,14067712,EleutherAI/pythia-14m,step68000,seed5,5,68000
It was a jail cell.,cell,cell,It was a cell jail., jail cell, cell jail,jail,True,-14.031607627868652,-16.005836486816406,1.974228858947754,14067712,EleutherAI/pythia-14m,step68000,seed5,5,68000
She had a good-luck charm.,charm,charm,She had a charm good-luck., good-luck charm, charm good-luck,good-luck,False,-26.44527816772461,-31.215656280517578,4.770378112792969,14067712,EleutherAI/pythia-14m,step68000,seed5,5,68000
They liked the pet chicken.,chicken,chicken,They liked the chicken pet., pet chicken, chicken pet,pet,True,-21.715316772460938,-19.927623748779297,-1.7876930236816406,14067712,EleutherAI/pythia-14m,step68000,seed5,5,68000
It was a stimulating class.,class,class,It was a class stimulating., stimulating class, class stimulating,stimulating,False,-19.580678939819336,-19.918960571289062,0.33828163146972656,14067712,EleutherAI/pythia-14m,step68000,seed5,5,68000
It was a metal clip.,clip,clip,It was a clip metal., metal clip, clip metal,metal,True,-18.359745025634766,-20.319597244262695,1.9598522186279297,14067712,EleutherAI/pythia-14m,step68000,seed5,5,68000
It was a common cold.,cold,cold,It was a cold common., common cold, cold common,common,False,-15.197223663330078,-17.911590576171875,2.714366912841797,14067712,EleutherAI/pythia-14m,step68000,seed5,5,68000
It was a marble column.,column,column,It was a column marble., marble column, column marble,marble,True,-18.3934268951416,-21.810161590576172,3.4167346954345703,14067712,EleutherAI/pythia-14m,step68000,seed5,5,68000
He liked the polite company.,company,company,He liked the company polite., polite company, company polite,polite,False,-19.162662506103516,-19.173458099365234,0.01079559326171875,14067712,EleutherAI/pythia-14m,step68000,seed5,5,68000
It was a traffic cone.,cone,cone,It was a cone traffic., traffic cone, cone traffic,traffic,True,-18.117284774780273,-21.31022071838379,3.1929359436035156,14067712,EleutherAI/pythia-14m,step68000,seed5,5,68000
He made a well-written contribution.,contribution,contribution,He made a contribution well-written., well-written contribution, contribution well-written,well-written,False,-20.8240909576416,-28.495683670043945,7.671592712402344,14067712,EleutherAI/pythia-14m,step68000,seed5,5,68000
That was the correct count.,count,count,That was the count correct., correct count, count correct,correct,False,-17.18231964111328,-22.1320858001709,4.949766159057617,14067712,EleutherAI/pythia-14m,step68000,seed5,5,68000
It was a collision course.,course,course,It was a course collision., collision course, course collision,collision,True,-14.121646881103516,-19.030954360961914,4.909307479858398,14067712,EleutherAI/pythia-14m,step68000,seed5,5,68000
It was a historical date.,date,date,It was a date historical., historical date, date historical,historical,False,-17.36871910095215,-20.518783569335938,3.150064468383789,14067712,EleutherAI/pythia-14m,step68000,seed5,5,68000
It was about college degrees.,degree,degrees,It was about degrees college., college degrees, degrees college,college,True,-19.190719604492188,-23.804431915283203,4.613712310791016,14067712,EleutherAI/pythia-14m,step68000,seed5,5,68000
They liked the architectural design.,design,design,They liked the design architectural., architectural design, design architectural,architectural,False,-14.299774169921875,-17.244064331054688,2.9442901611328125,14067712,EleutherAI/pythia-14m,step68000,seed5,5,68000
They liked the anniversary dinner.,dinner,dinner,They liked the dinner anniversary., anniversary dinner, dinner anniversary,anniversary,True,-18.445030212402344,-20.93816375732422,2.493133544921875,14067712,EleutherAI/pythia-14m,step68000,seed5,5,68000
He had a career dream.,dream,dream,He had a dream career., career dream, dream career,career,True,-15.120765686035156,-15.979337692260742,0.8585720062255859,14067712,EleutherAI/pythia-14m,step68000,seed5,5,68000
It was a battery-powered drill.,drill,drill,It was a drill battery-powered., battery-powered drill, drill battery-powered,battery-powered,False,-22.883548736572266,-27.51909828186035,4.635549545288086,14067712,EleutherAI/pythia-14m,step68000,seed5,5,68000
It was a physical examination.,examination,examination,It was an examination physical., physical examination, examination physical,physical,False,-13.078363418579102,-21.562477111816406,8.484113693237305,14067712,EleutherAI/pythia-14m,step68000,seed5,5,68000
They had an enthusiastic fan.,fan,fan,They had an fan enthusiastic., enthusiastic fan, fan enthusiastic,enthusiastic,False,-13.844608306884766,-27.456369400024414,13.611761093139648,14067712,EleutherAI/pythia-14m,step68000,seed5,5,68000
She had a steel file.,file,file,She had a file steel., steel file, file steel,steel,True,-19.698406219482422,-23.011615753173828,3.3132095336914062,14067712,EleutherAI/pythia-14m,step68000,seed5,5,68000
It was a plastic film.,film,film,It was a film plastic., plastic film, film plastic,plastic,False,-13.838052749633789,-20.598848342895508,6.760795593261719,14067712,EleutherAI/pythia-14m,step68000,seed5,5,68000
It was a concrete foundation.,foundation,foundation,It was a foundation concrete., concrete foundation, foundation concrete,concrete,False,-16.109407424926758,-20.277957916259766,4.168550491333008,14067712,EleutherAI/pythia-14m,step68000,seed5,5,68000
It was a business function.,function,function,It was a function business., business function, function business,business,True,-15.0690279006958,-18.65570068359375,3.586672782897949,14067712,EleutherAI/pythia-14m,step68000,seed5,5,68000
He was on the parade ground.,ground,ground,He was on the ground parade., parade ground, ground parade,parade,True,-18.278125762939453,-16.88558006286621,-1.3925457000732422,14067712,EleutherAI/pythia-14m,step68000,seed5,5,68000
They liked the national guard.,guard,guard,They liked the guard national., national guard, guard national,national,False,-20.920562744140625,-25.278610229492188,4.3580474853515625,14067712,EleutherAI/pythia-14m,step68000,seed5,5,68000
He had a friendly guide.,guide,guide,He had a guide friendly., friendly guide, guide friendly,friendly,False,-16.009891510009766,-22.3203067779541,6.310415267944336,14067712,EleutherAI/pythia-14m,step68000,seed5,5,68000
It was a nursing home.,home,home,It was a home nursing., nursing home, home nursing,nursing,True,-12.497488021850586,-17.54810333251953,5.050615310668945,14067712,EleutherAI/pythia-14m,step68000,seed5,5,68000
They had military intelligence.,intelligence,intelligence,They had intelligence military., military intelligence, intelligence military,military,False,-16.101877212524414,-21.64571762084961,5.543840408325195,14067712,EleutherAI/pythia-14m,step68000,seed5,5,68000
It was a special issue.,issue,issue,It was an issue special., special issue, issue special,special,False,-11.448151588439941,-15.969961166381836,4.5218095779418945,14067712,EleutherAI/pythia-14m,step68000,seed5,5,68000
It was a paper jam.,jam,jam,It was a jam paper., paper jam, jam paper,paper,True,-18.331993103027344,-17.586883544921875,-0.7451095581054688,14067712,EleutherAI/pythia-14m,step68000,seed5,5,68000
It was a backspace key.,key,key,It was a key backspace., backspace key, key backspace,backspace,True,-25.908634185791016,-22.506025314331055,-3.402608871459961,14067712,EleutherAI/pythia-14m,step68000,seed5,5,68000
They liked the friendly lamb.,lamb,lamb,They liked the lamb friendly., friendly lamb, lamb friendly,friendly,False,-21.499507904052734,-21.35248374938965,-0.14702415466308594,14067712,EleutherAI/pythia-14m,step68000,seed5,5,68000
She had door locks.,lock,locks,She had locks door., door locks, locks door,door,True,-20.483661651611328,-23.78493309020996,3.301271438598633,14067712,EleutherAI/pythia-14m,step68000,seed5,5,68000
They liked the women's lunch.,lunch,lunch,They liked the lunch women's., women's lunch, lunch women's,women,True,-18.85262680053711,-23.474163055419922,4.6215362548828125,14067712,EleutherAI/pythia-14m,step68000,seed5,5,68000
He liked the stock market.,market,market,He liked the market stock., stock market, market stock,stock,True,-11.27834415435791,-12.994619369506836,1.7162752151489258,14067712,EleutherAI/pythia-14m,step68000,seed5,5,68000
It was a tennis match.,match,match,It was a match tennis., tennis match, match tennis,tennis,True,-14.099132537841797,-19.001190185546875,4.902057647705078,14067712,EleutherAI/pythia-14m,step68000,seed5,5,68000
It was veterinary medicine.,medicine,medicine,It was medicine veterinary., veterinary medicine, medicine veterinary,veterinary,False,-17.433259963989258,-23.89449691772461,6.461236953735352,14067712,EleutherAI/pythia-14m,step68000,seed5,5,68000
There was a clear message.,message,message,There was a message clear., clear message, message clear,clear,False,-11.863637924194336,-14.880395889282227,3.0167579650878906,14067712,EleutherAI/pythia-14m,step68000,seed5,5,68000
It was a clay mold.,mold,mold,It was a mold clay., clay mold, mold clay,clay,True,-18.119121551513672,-21.272640228271484,3.1535186767578125,14067712,EleutherAI/pythia-14m,step68000,seed5,5,68000
She saw the fast mole.,mole,mole,She saw the mole fast., fast mole, mole fast,fast,False,-21.315231323242188,-21.603496551513672,0.2882652282714844,14067712,EleutherAI/pythia-14m,step68000,seed5,5,68000
He liked the civil-rights movement.,movement,movement,He liked the movement civil-rights., civil-rights movement, movement civil-rights,civil-rights,False,-22.097482681274414,-29.115863800048828,7.018381118774414,14067712,EleutherAI/pythia-14m,step68000,seed5,5,68000
It was a shredded newspaper.,newspaper,newspaper,It was a newspaper shredded., shredded newspaper, newspaper shredded,shredded,False,-22.149858474731445,-23.203453063964844,1.0535945892333984,14067712,EleutherAI/pythia-14m,step68000,seed5,5,68000
It was a reddish orange.,orange,orange,It was an orange reddish., reddish orange, orange reddish,reddish,False,-17.426469802856445,-17.771791458129883,0.3453216552734375,14067712,EleutherAI/pythia-14m,step68000,seed5,5,68000
He saw the ripped page.,page,page,He saw the page ripped., ripped page, page ripped,ripped,False,-20.757732391357422,-20.531288146972656,-0.22644424438476562,14067712,EleutherAI/pythia-14m,step68000,seed5,5,68000
It was a tree palm.,palm,palm,It was a palm tree., tree palm, palm tree,tree,True,-20.196025848388672,-15.15851879119873,-5.037507057189941,14067712,EleutherAI/pythia-14m,step68000,seed5,5,68000
It was a consumer panel.,panel,panel,It was a panel consumer., consumer panel, panel consumer,consumer,True,-18.86278533935547,-23.304014205932617,4.441228866577148,14067712,EleutherAI/pythia-14m,step68000,seed5,5,68000
It was a biblical passage.,passage,passage,It was a passage biblical., biblical passage, passage biblical,biblical,False,-18.43419075012207,-25.249553680419922,6.815362930297852,14067712,EleutherAI/pythia-14m,step68000,seed5,5,68000
It was a secure perch.,perch,perch,It was a perch secure., secure perch, perch secure,secure,False,-22.91161346435547,-23.942821502685547,1.0312080383300781,14067712,EleutherAI/pythia-14m,step68000,seed5,5,68000
He saw the plastic pitcher.,pitcher,pitcher,He saw the pitcher plastic., plastic pitcher, pitcher plastic,plastic,True,-20.498973846435547,-21.517005920410156,1.0180320739746094,14067712,EleutherAI/pythia-14m,step68000,seed5,5,68000
It was a sweet port.,port,port,It was a port sweet., sweet port, port sweet,sweet,False,-17.536998748779297,-21.35851287841797,3.821514129638672,14067712,EleutherAI/pythia-14m,step68000,seed5,5,68000
He was in a yoga position.,position,position,He was in a position yoga., yoga position, position yoga,yoga,True,-14.101044654846191,-17.985475540161133,3.8844308853149414,14067712,EleutherAI/pythia-14m,step68000,seed5,5,68000
It was a challenging post.,post,post,It was a post challenging., challenging post, post challenging,challenging,False,-15.076799392700195,-19.89969253540039,4.822893142700195,14067712,EleutherAI/pythia-14m,step68000,seed5,5,68000
He had the quickest punch.,punch,punch,He had the punch quickest., quickest punch, punch quickest,quickest,False,-22.981433868408203,-28.593643188476562,5.612209320068359,14067712,EleutherAI/pythia-14m,step68000,seed5,5,68000
She had a cloudy pupil.,pupil,pupil,She had a pupil cloudy., cloudy pupil, pupil cloudy,cloudy,False,-21.309127807617188,-24.393611907958984,3.084484100341797,14067712,EleutherAI/pythia-14m,step68000,seed5,5,68000
That was a tennis racket.,racket,racket,That was a racket tennis., tennis racket, racket tennis,tennis,True,-14.421394348144531,-18.597599029541016,4.176204681396484,14067712,EleutherAI/pythia-14m,step68000,seed5,5,68000
He liked granite rock.,rock,rock,He liked rock granite., granite rock, rock granite,granite,True,-19.694517135620117,-22.24932098388672,2.5548038482666016,14067712,EleutherAI/pythia-14m,step68000,seed5,5,68000
He saw the bushy sage.,sage,sage,He saw the sage bushy., bushy sage, sage bushy,bushy,False,-30.61981201171875,-29.130834579467773,-1.4889774322509766,14067712,EleutherAI/pythia-14m,step68000,seed5,5,68000
It was a major scale.,scale,scale,It was a scale major., major scale, scale major,major,False,-14.375785827636719,-20.633502960205078,6.257717132568359,14067712,EleutherAI/pythia-14m,step68000,seed5,5,68000
It was a panoramic scene.,scene,scene,It was a scene panoramic., panoramic scene, scene panoramic,panoramic,False,-21.147258758544922,-24.053380966186523,2.9061222076416016,14067712,EleutherAI/pythia-14m,step68000,seed5,5,68000
It was a trained seal.,seal,seal,It was a seal trained., trained seal, seal trained,trained,False,-23.612884521484375,-23.527469635009766,-0.08541488647460938,14067712,EleutherAI/pythia-14m,step68000,seed5,5,68000
He used the video tape.,tape,tape,He used the tape video., video tape, tape video,video,True,-15.080166816711426,-17.587421417236328,2.5072546005249023,14067712,EleutherAI/pythia-14m,step68000,seed5,5,68000
It was a technical term.,term,term,It was a term technical., technical term, term technical,technical,False,-16.470027923583984,-20.94059944152832,4.470571517944336,14067712,EleutherAI/pythia-14m,step68000,seed5,5,68000
It was a diseased tick.,tick,tick,It was a tick diseased., diseased tick, tick diseased,diseased,False,-22.29767608642578,-24.973478317260742,2.675802230834961,14067712,EleutherAI/pythia-14m,step68000,seed5,5,68000
It was a finger tip.,tip,tip,It was a tip finger., finger tip, tip finger,finger,True,-19.653078079223633,-20.34157371520996,0.6884956359863281,14067712,EleutherAI/pythia-14m,step68000,seed5,5,68000
She liked the professional title.,title,title,She liked the title professional., professional title, title professional,professional,False,-16.174091339111328,-18.16436195373535,1.9902706146240234,14067712,EleutherAI/pythia-14m,step68000,seed5,5,68000
It was a bell toll.,toll,toll,It was a toll bell., bell toll, toll bell,bell,True,-21.241657257080078,-23.741161346435547,2.4995040893554688,14067712,EleutherAI/pythia-14m,step68000,seed5,5,68000
She saw the snowshoe tracks.,track,tracks,She saw the tracks snowshoe., snowshoe tracks, tracks snowshoe,snowshoe,True,-26.87877655029297,-27.658113479614258,0.7793369293212891,14067712,EleutherAI/pythia-14m,step68000,seed5,5,68000
They were cluttered yards.,yard,yards,They were yards cluttered., cluttered yards, yards cluttered,cluttered,False,-25.303306579589844,-27.647748947143555,2.344442367553711,14067712,EleutherAI/pythia-14m,step68000,seed5,5,68000
