sentence,word,string,reversed_sentence,mod_np,reversed_mod,disambiguating_word,non_adjective,original_logprob,reversed_logprob,ratio,n_params,mpath,revision,seed_name,seed,step
He used the interview tape.,tape,tape,He used the tape interview., interview tape, tape interview,interview,True,-17.533388137817383,-21.25844383239746,3.725055694580078,14067712,EleutherAI/pythia-14m,step136000,seed5,5,136000
It was a winter term.,term,term,It was a term winter., winter term, term winter,winter,True,-17.330368041992188,-21.490543365478516,4.160175323486328,14067712,EleutherAI/pythia-14m,step136000,seed5,5,136000
It was a fall term.,term,term,It was a term fall., fall term, term fall,fall,True,-18.157302856445312,-19.968082427978516,1.8107795715332031,14067712,EleutherAI/pythia-14m,step136000,seed5,5,136000
It was a legal term.,term,term,It was a term legal., legal term, term legal,legal,False,-16.280250549316406,-20.052066802978516,3.7718162536621094,14067712,EleutherAI/pythia-14m,step136000,seed5,5,136000
It was a clock tick.,tick,tick,It was a tick clock., clock tick, tick clock,clock,True,-18.40568733215332,-20.246475219726562,1.8407878875732422,14067712,EleutherAI/pythia-14m,step136000,seed5,5,136000
It was an audible tick.,tick,tick,It was an tick audible., audible tick, tick audible,audible,False,-18.53458023071289,-24.676464080810547,6.141883850097656,14067712,EleutherAI/pythia-14m,step136000,seed5,5,136000
It was a parasitic tick.,tick,tick,It was a tick parasitic., parasitic tick, tick parasitic,parasitic,False,-21.292701721191406,-23.452041625976562,2.1593399047851562,14067712,EleutherAI/pythia-14m,step136000,seed5,5,136000
It was a generous tip.,tip,tip,It was a tip generous., generous tip, tip generous,generous,False,-19.064884185791016,-22.594425201416016,3.529541015625,14067712,EleutherAI/pythia-14m,step136000,seed5,5,136000
It was a stingy tip.,tip,tip,It was a tip stingy., stingy tip, tip stingy,stingy,False,-21.352256774902344,-27.488826751708984,6.136569976806641,14067712,EleutherAI/pythia-14m,step136000,seed5,5,136000
It was a pencil tip.,tip,tip,It was a tip pencil., pencil tip, tip pencil,pencil,True,-20.61969757080078,-22.788516998291016,2.1688194274902344,14067712,EleutherAI/pythia-14m,step136000,seed5,5,136000
She liked the essay title.,title,title,She liked the title essay., essay title, title essay,essay,True,-19.82196044921875,-17.640655517578125,-2.181304931640625,14067712,EleutherAI/pythia-14m,step136000,seed5,5,136000
She liked the poem title.,title,title,She liked the title poem., poem title, title poem,poem,True,-19.022197723388672,-17.617218017578125,-1.4049797058105469,14067712,EleutherAI/pythia-14m,step136000,seed5,5,136000
She liked the academic title.,title,title,She liked the title academic., academic title, title academic,academic,False,-18.067554473876953,-19.335968017578125,1.2684135437011719,14067712,EleutherAI/pythia-14m,step136000,seed5,5,136000
It was a costly toll.,toll,toll,It was a toll costly., costly toll, toll costly,costly,False,-17.65874481201172,-23.71788215637207,6.059137344360352,14067712,EleutherAI/pythia-14m,step136000,seed5,5,136000
It was a road toll.,toll,toll,It was a toll road., road toll, toll road,road,True,-19.219867706298828,-19.85045051574707,0.6305828094482422,14067712,EleutherAI/pythia-14m,step136000,seed5,5,136000
It was a loud toll.,toll,toll,It was a toll loud., loud toll, toll loud,loud,False,-19.545459747314453,-20.31236457824707,0.7669048309326172,14067712,EleutherAI/pythia-14m,step136000,seed5,5,136000
She saw the train tracks.,track,tracks,She saw the tracks train., train tracks, tracks train,train,True,-16.038232803344727,-19.780231475830078,3.7419986724853516,14067712,EleutherAI/pythia-14m,step136000,seed5,5,136000
She saw the trolley tracks.,track,tracks,She saw the tracks trolley., trolley tracks, tracks trolley,trolley,True,-23.98625946044922,-25.603172302246094,1.616912841796875,14067712,EleutherAI/pythia-14m,step136000,seed5,5,136000
She saw the moose tracks.,track,tracks,She saw the tracks moose., moose tracks, tracks moose,moose,False,-24.068836212158203,-24.384809494018555,0.31597328186035156,14067712,EleutherAI/pythia-14m,step136000,seed5,5,136000
It was five yards.,yard,yards,It was yards five., five yards, yards five,five,True,-16.498214721679688,-23.76643943786621,7.268224716186523,14067712,EleutherAI/pythia-14m,step136000,seed5,5,136000
It was ten yards.,yard,yards,It was yards ten., ten yards, yards ten,ten,True,-17.572660446166992,-24.68440818786621,7.111747741699219,14067712,EleutherAI/pythia-14m,step136000,seed5,5,136000
They were big yards.,yard,yards,They were yards big., big yards, yards big,big,False,-18.050752639770508,-22.177940368652344,4.127187728881836,14067712,EleutherAI/pythia-14m,step136000,seed5,5,136000
It was a comedic act.,act,act,It was an act comedic., comedic act, act comedic,comedic,False,-17.449737548828125,-20.489152908325195,3.0394153594970703,14067712,EleutherAI/pythia-14m,step136000,seed5,5,136000
He had a pending appeal.,appeal,appeal,He had an appeal pending., pending appeal, appeal pending,pending,False,-16.88525390625,-16.465360641479492,-0.4198932647705078,14067712,EleutherAI/pythia-14m,step136000,seed5,5,136000
It was a polluted atmosphere.,atmosphere,atmosphere,It was an atmosphere polluted., polluted atmosphere, atmosphere polluted,polluted,False,-24.286277770996094,-24.46873664855957,0.18245887756347656,14067712,EleutherAI/pythia-14m,step136000,seed5,5,136000
It was a country band.,band,band,It was a band country., country band, band country,country,True,-17.397750854492188,-18.471689224243164,1.0739383697509766,14067712,EleutherAI/pythia-14m,step136000,seed5,5,136000
There was a religious barrier.,barrier,barrier,There was a barrier religious., religious barrier, barrier religious,religious,False,-18.05783462524414,-21.96965980529785,3.911825180053711,14067712,EleutherAI/pythia-14m,step136000,seed5,5,136000
He saw a baseball bat.,bat,bat,He saw a bat baseball., baseball bat, bat baseball,baseball,True,-11.16552734375,-18.12958335876465,6.964056015014648,14067712,EleutherAI/pythia-14m,step136000,seed5,5,136000
He saw the balance beam.,beam,beam,He saw the beam balance., balance beam, beam balance,balance,True,-19.920429229736328,-18.02936363220215,-1.8910655975341797,14067712,EleutherAI/pythia-14m,step136000,seed5,5,136000
She had a writer's block.,block,block,She had a block writer's., writer's block, block writer's,writer,True,-22.936370849609375,-24.983381271362305,2.0470104217529297,14067712,EleutherAI/pythia-14m,step136000,seed5,5,136000
He has royal blood.,blood,blood,He has blood royal., royal blood, blood royal,royal,False,-19.822513580322266,-21.492473602294922,1.6699600219726562,14067712,EleutherAI/pythia-14m,step136000,seed5,5,136000
It was the school board.,board,board,It was the board school., school board, board school,school,True,-13.098304748535156,-18.484161376953125,5.385856628417969,14067712,EleutherAI/pythia-14m,step136000,seed5,5,136000
He had a leather-bound book.,book,book,He had a book leather-bound., leather-bound book, book leather-bound,leather-bound,False,-26.475299835205078,-28.698108673095703,2.222808837890625,14067712,EleutherAI/pythia-14m,step136000,seed5,5,136000
They ate a lonely breakfast.,breakfast,breakfast,They ate a breakfast lonely., lonely breakfast, breakfast lonely,lonely,False,-16.56863784790039,-20.662250518798828,4.0936126708984375,14067712,EleutherAI/pythia-14m,step136000,seed5,5,136000
It was an island cape.,cape,cape,It was an cape island., island cape, cape island,island,True,-20.95296287536621,-22.387474060058594,1.4345111846923828,14067712,EleutherAI/pythia-14m,step136000,seed5,5,136000
It was a criminal case.,case,case,It was a case criminal., criminal case, case criminal,criminal,False,-11.757742881774902,-18.80210304260254,7.044360160827637,14067712,EleutherAI/pythia-14m,step136000,seed5,5,136000
It was a primary cause.,cause,cause,It was a cause primary., primary cause, cause primary,primary,False,-14.480188369750977,-23.237342834472656,8.75715446472168,14067712,EleutherAI/pythia-14m,step136000,seed5,5,136000
It was a jail cell.,cell,cell,It was a cell jail., jail cell, cell jail,jail,True,-14.918477058410645,-18.269535064697266,3.351058006286621,14067712,EleutherAI/pythia-14m,step136000,seed5,5,136000
She had a good-luck charm.,charm,charm,She had a charm good-luck., good-luck charm, charm good-luck,good-luck,False,-25.595043182373047,-29.747987747192383,4.152944564819336,14067712,EleutherAI/pythia-14m,step136000,seed5,5,136000
They liked the pet chicken.,chicken,chicken,They liked the chicken pet., pet chicken, chicken pet,pet,True,-19.15945816040039,-17.472671508789062,-1.6867866516113281,14067712,EleutherAI/pythia-14m,step136000,seed5,5,136000
It was a stimulating class.,class,class,It was a class stimulating., stimulating class, class stimulating,stimulating,False,-17.697750091552734,-19.395862579345703,1.6981124877929688,14067712,EleutherAI/pythia-14m,step136000,seed5,5,136000
It was a metal clip.,clip,clip,It was a clip metal., metal clip, clip metal,metal,True,-17.933523178100586,-19.591190338134766,1.6576671600341797,14067712,EleutherAI/pythia-14m,step136000,seed5,5,136000
It was a common cold.,cold,cold,It was a cold common., common cold, cold common,common,False,-15.489500999450684,-17.63420867919922,2.144707679748535,14067712,EleutherAI/pythia-14m,step136000,seed5,5,136000
It was a marble column.,column,column,It was a column marble., marble column, column marble,marble,True,-18.258541107177734,-20.91320037841797,2.6546592712402344,14067712,EleutherAI/pythia-14m,step136000,seed5,5,136000
He liked the polite company.,company,company,He liked the company polite., polite company, company polite,polite,False,-17.918445587158203,-19.14902114868164,1.2305755615234375,14067712,EleutherAI/pythia-14m,step136000,seed5,5,136000
It was a traffic cone.,cone,cone,It was a cone traffic., traffic cone, cone traffic,traffic,True,-20.53225326538086,-22.340557098388672,1.8083038330078125,14067712,EleutherAI/pythia-14m,step136000,seed5,5,136000
He made a well-written contribution.,contribution,contribution,He made a contribution well-written., well-written contribution, contribution well-written,well-written,False,-21.839879989624023,-26.3987979888916,4.558917999267578,14067712,EleutherAI/pythia-14m,step136000,seed5,5,136000
That was the correct count.,count,count,That was the count correct., correct count, count correct,correct,False,-16.25971221923828,-22.300949096679688,6.041236877441406,14067712,EleutherAI/pythia-14m,step136000,seed5,5,136000
It was a collision course.,course,course,It was a course collision., collision course, course collision,collision,True,-17.343067169189453,-19.556365966796875,2.213298797607422,14067712,EleutherAI/pythia-14m,step136000,seed5,5,136000
It was a historical date.,date,date,It was a date historical., historical date, date historical,historical,False,-18.276561737060547,-21.69717788696289,3.4206161499023438,14067712,EleutherAI/pythia-14m,step136000,seed5,5,136000
It was about college degrees.,degree,degrees,It was about degrees college., college degrees, degrees college,college,True,-19.618032455444336,-23.676565170288086,4.05853271484375,14067712,EleutherAI/pythia-14m,step136000,seed5,5,136000
They liked the architectural design.,design,design,They liked the design architectural., architectural design, design architectural,architectural,False,-15.40258502960205,-19.96546745300293,4.562882423400879,14067712,EleutherAI/pythia-14m,step136000,seed5,5,136000
They liked the anniversary dinner.,dinner,dinner,They liked the dinner anniversary., anniversary dinner, dinner anniversary,anniversary,True,-18.109594345092773,-19.537853240966797,1.4282588958740234,14067712,EleutherAI/pythia-14m,step136000,seed5,5,136000
He had a career dream.,dream,dream,He had a dream career., career dream, dream career,career,True,-17.498733520507812,-16.87295913696289,-0.6257743835449219,14067712,EleutherAI/pythia-14m,step136000,seed5,5,136000
It was a battery-powered drill.,drill,drill,It was a drill battery-powered., battery-powered drill, drill battery-powered,battery-powered,False,-24.049646377563477,-27.38361358642578,3.3339672088623047,14067712,EleutherAI/pythia-14m,step136000,seed5,5,136000
It was a physical examination.,examination,examination,It was an examination physical., physical examination, examination physical,physical,False,-14.319724082946777,-20.640159606933594,6.320435523986816,14067712,EleutherAI/pythia-14m,step136000,seed5,5,136000
They had an enthusiastic fan.,fan,fan,They had an fan enthusiastic., enthusiastic fan, fan enthusiastic,enthusiastic,False,-14.13321304321289,-23.208751678466797,9.075538635253906,14067712,EleutherAI/pythia-14m,step136000,seed5,5,136000
She had a steel file.,file,file,She had a file steel., steel file, file steel,steel,True,-18.92084503173828,-24.1815185546875,5.260673522949219,14067712,EleutherAI/pythia-14m,step136000,seed5,5,136000
It was a plastic film.,film,film,It was a film plastic., plastic film, film plastic,plastic,False,-14.29516887664795,-18.891653060913086,4.596484184265137,14067712,EleutherAI/pythia-14m,step136000,seed5,5,136000
It was a concrete foundation.,foundation,foundation,It was a foundation concrete., concrete foundation, foundation concrete,concrete,False,-16.27366065979004,-20.986467361450195,4.712806701660156,14067712,EleutherAI/pythia-14m,step136000,seed5,5,136000
It was a business function.,function,function,It was a function business., business function, function business,business,True,-16.374408721923828,-17.51840591430664,1.1439971923828125,14067712,EleutherAI/pythia-14m,step136000,seed5,5,136000
He was on the parade ground.,ground,ground,He was on the ground parade., parade ground, ground parade,parade,True,-19.55345916748047,-17.074201583862305,-2.479257583618164,14067712,EleutherAI/pythia-14m,step136000,seed5,5,136000
They liked the national guard.,guard,guard,They liked the guard national., national guard, guard national,national,False,-18.815921783447266,-21.818607330322266,3.002685546875,14067712,EleutherAI/pythia-14m,step136000,seed5,5,136000
He had a friendly guide.,guide,guide,He had a guide friendly., friendly guide, guide friendly,friendly,False,-15.973928451538086,-22.324542999267578,6.350614547729492,14067712,EleutherAI/pythia-14m,step136000,seed5,5,136000
It was a nursing home.,home,home,It was a home nursing., nursing home, home nursing,nursing,True,-12.463193893432617,-18.899301528930664,6.436107635498047,14067712,EleutherAI/pythia-14m,step136000,seed5,5,136000
They had military intelligence.,intelligence,intelligence,They had intelligence military., military intelligence, intelligence military,military,False,-16.344118118286133,-20.94180679321289,4.597688674926758,14067712,EleutherAI/pythia-14m,step136000,seed5,5,136000
It was a special issue.,issue,issue,It was an issue special., special issue, issue special,special,False,-11.910623550415039,-15.966888427734375,4.056264877319336,14067712,EleutherAI/pythia-14m,step136000,seed5,5,136000
It was a paper jam.,jam,jam,It was a jam paper., paper jam, jam paper,paper,True,-18.83517837524414,-17.93576431274414,-0.8994140625,14067712,EleutherAI/pythia-14m,step136000,seed5,5,136000
It was a backspace key.,key,key,It was a key backspace., backspace key, key backspace,backspace,True,-26.870397567749023,-24.725194931030273,-2.14520263671875,14067712,EleutherAI/pythia-14m,step136000,seed5,5,136000
They liked the friendly lamb.,lamb,lamb,They liked the lamb friendly., friendly lamb, lamb friendly,friendly,False,-21.665180206298828,-21.80217742919922,0.13699722290039062,14067712,EleutherAI/pythia-14m,step136000,seed5,5,136000
She had door locks.,lock,locks,She had locks door., door locks, locks door,door,True,-18.733720779418945,-22.52676773071289,3.7930469512939453,14067712,EleutherAI/pythia-14m,step136000,seed5,5,136000
They liked the women's lunch.,lunch,lunch,They liked the lunch women's., women's lunch, lunch women's,women,True,-20.61151123046875,-23.37247657775879,2.760965347290039,14067712,EleutherAI/pythia-14m,step136000,seed5,5,136000
He liked the stock market.,market,market,He liked the market stock., stock market, market stock,stock,True,-13.504646301269531,-15.358661651611328,1.8540153503417969,14067712,EleutherAI/pythia-14m,step136000,seed5,5,136000
It was a tennis match.,match,match,It was a match tennis., tennis match, match tennis,tennis,True,-17.831140518188477,-21.14971160888672,3.318571090698242,14067712,EleutherAI/pythia-14m,step136000,seed5,5,136000
It was veterinary medicine.,medicine,medicine,It was medicine veterinary., veterinary medicine, medicine veterinary,veterinary,False,-15.60486888885498,-23.219919204711914,7.615050315856934,14067712,EleutherAI/pythia-14m,step136000,seed5,5,136000
There was a clear message.,message,message,There was a message clear., clear message, message clear,clear,False,-11.287933349609375,-15.242919921875,3.954986572265625,14067712,EleutherAI/pythia-14m,step136000,seed5,5,136000
It was a clay mold.,mold,mold,It was a mold clay., clay mold, mold clay,clay,True,-18.92206573486328,-21.819995880126953,2.897930145263672,14067712,EleutherAI/pythia-14m,step136000,seed5,5,136000
She saw the fast mole.,mole,mole,She saw the mole fast., fast mole, mole fast,fast,False,-21.169435501098633,-21.18971061706543,0.020275115966796875,14067712,EleutherAI/pythia-14m,step136000,seed5,5,136000
He liked the civil-rights movement.,movement,movement,He liked the movement civil-rights., civil-rights movement, movement civil-rights,civil-rights,False,-22.40641212463379,-30.18678092956543,7.780368804931641,14067712,EleutherAI/pythia-14m,step136000,seed5,5,136000
It was a shredded newspaper.,newspaper,newspaper,It was a newspaper shredded., shredded newspaper, newspaper shredded,shredded,False,-22.32225799560547,-22.846431732177734,0.5241737365722656,14067712,EleutherAI/pythia-14m,step136000,seed5,5,136000
It was a reddish orange.,orange,orange,It was an orange reddish., reddish orange, orange reddish,reddish,False,-16.697708129882812,-16.99549674987793,0.2977886199951172,14067712,EleutherAI/pythia-14m,step136000,seed5,5,136000
He saw the ripped page.,page,page,He saw the page ripped., ripped page, page ripped,ripped,False,-21.319618225097656,-19.63394546508789,-1.6856727600097656,14067712,EleutherAI/pythia-14m,step136000,seed5,5,136000
It was a tree palm.,palm,palm,It was a palm tree., tree palm, palm tree,tree,True,-20.783748626708984,-17.01171875,-3.7720298767089844,14067712,EleutherAI/pythia-14m,step136000,seed5,5,136000
It was a consumer panel.,panel,panel,It was a panel consumer., consumer panel, panel consumer,consumer,True,-19.703125,-23.261337280273438,3.5582122802734375,14067712,EleutherAI/pythia-14m,step136000,seed5,5,136000
It was a biblical passage.,passage,passage,It was a passage biblical., biblical passage, passage biblical,biblical,False,-16.505855560302734,-22.198583602905273,5.692728042602539,14067712,EleutherAI/pythia-14m,step136000,seed5,5,136000
It was a secure perch.,perch,perch,It was a perch secure., secure perch, perch secure,secure,False,-23.035036087036133,-25.452674865722656,2.4176387786865234,14067712,EleutherAI/pythia-14m,step136000,seed5,5,136000
He saw the plastic pitcher.,pitcher,pitcher,He saw the pitcher plastic., plastic pitcher, pitcher plastic,plastic,True,-20.363994598388672,-22.556015014648438,2.1920204162597656,14067712,EleutherAI/pythia-14m,step136000,seed5,5,136000
It was a sweet port.,port,port,It was a port sweet., sweet port, port sweet,sweet,False,-17.601661682128906,-20.817989349365234,3.216327667236328,14067712,EleutherAI/pythia-14m,step136000,seed5,5,136000
He was in a yoga position.,position,position,He was in a position yoga., yoga position, position yoga,yoga,True,-17.435518264770508,-19.912872314453125,2.477354049682617,14067712,EleutherAI/pythia-14m,step136000,seed5,5,136000
It was a challenging post.,post,post,It was a post challenging., challenging post, post challenging,challenging,False,-15.690298080444336,-19.083656311035156,3.3933582305908203,14067712,EleutherAI/pythia-14m,step136000,seed5,5,136000
He had the quickest punch.,punch,punch,He had the punch quickest., quickest punch, punch quickest,quickest,False,-23.3004207611084,-29.623273849487305,6.322853088378906,14067712,EleutherAI/pythia-14m,step136000,seed5,5,136000
She had a cloudy pupil.,pupil,pupil,She had a pupil cloudy., cloudy pupil, pupil cloudy,cloudy,False,-25.09775161743164,-26.492725372314453,1.3949737548828125,14067712,EleutherAI/pythia-14m,step136000,seed5,5,136000
That was a tennis racket.,racket,racket,That was a racket tennis., tennis racket, racket tennis,tennis,True,-17.18431282043457,-23.913454055786133,6.7291412353515625,14067712,EleutherAI/pythia-14m,step136000,seed5,5,136000
He liked granite rock.,rock,rock,He liked rock granite., granite rock, rock granite,granite,True,-20.347980499267578,-22.495237350463867,2.147256851196289,14067712,EleutherAI/pythia-14m,step136000,seed5,5,136000
He saw the bushy sage.,sage,sage,He saw the sage bushy., bushy sage, sage bushy,bushy,False,-29.0338134765625,-30.94879150390625,1.91497802734375,14067712,EleutherAI/pythia-14m,step136000,seed5,5,136000
It was a major scale.,scale,scale,It was a scale major., major scale, scale major,major,False,-15.356806755065918,-20.9965877532959,5.6397809982299805,14067712,EleutherAI/pythia-14m,step136000,seed5,5,136000
It was a panoramic scene.,scene,scene,It was a scene panoramic., panoramic scene, scene panoramic,panoramic,False,-20.871967315673828,-23.444965362548828,2.572998046875,14067712,EleutherAI/pythia-14m,step136000,seed5,5,136000
It was a trained seal.,seal,seal,It was a seal trained., trained seal, seal trained,trained,False,-22.68145751953125,-22.614459991455078,-0.06699752807617188,14067712,EleutherAI/pythia-14m,step136000,seed5,5,136000
He used the video tape.,tape,tape,He used the tape video., video tape, tape video,video,True,-15.925836563110352,-19.65614891052246,3.7303123474121094,14067712,EleutherAI/pythia-14m,step136000,seed5,5,136000
It was a technical term.,term,term,It was a term technical., technical term, term technical,technical,False,-16.060428619384766,-21.348209381103516,5.28778076171875,14067712,EleutherAI/pythia-14m,step136000,seed5,5,136000
It was a diseased tick.,tick,tick,It was a tick diseased., diseased tick, tick diseased,diseased,False,-21.458314895629883,-22.881240844726562,1.4229259490966797,14067712,EleutherAI/pythia-14m,step136000,seed5,5,136000
It was a finger tip.,tip,tip,It was a tip finger., finger tip, tip finger,finger,True,-20.20254898071289,-21.511661529541016,1.309112548828125,14067712,EleutherAI/pythia-14m,step136000,seed5,5,136000
She liked the professional title.,title,title,She liked the title professional., professional title, title professional,professional,False,-16.789159774780273,-17.958282470703125,1.1691226959228516,14067712,EleutherAI/pythia-14m,step136000,seed5,5,136000
It was a bell toll.,toll,toll,It was a toll bell., bell toll, toll bell,bell,True,-21.823787689208984,-22.36192512512207,0.5381374359130859,14067712,EleutherAI/pythia-14m,step136000,seed5,5,136000
She saw the snowshoe tracks.,track,tracks,She saw the tracks snowshoe., snowshoe tracks, tracks snowshoe,snowshoe,True,-29.99972152709961,-30.588184356689453,0.5884628295898438,14067712,EleutherAI/pythia-14m,step136000,seed5,5,136000
They were cluttered yards.,yard,yards,They were yards cluttered., cluttered yards, yards cluttered,cluttered,False,-26.289100646972656,-24.07416343688965,-2.214937210083008,14067712,EleutherAI/pythia-14m,step136000,seed5,5,136000
