sentence,word,string,reversed_sentence,mod_np,reversed_mod,disambiguating_word,non_adjective,original_logprob,reversed_logprob,ratio,n_params,mpath,revision,seed_name,seed,step
He used the interview tape.,tape,tape,He used the tape interview., interview tape, tape interview,interview,True,-16.706096649169922,-19.436832427978516,2.7307357788085938,14067712,EleutherAI/pythia-14m,step104000,seed8,8,104000
It was a winter term.,term,term,It was a term winter., winter term, term winter,winter,True,-15.673662185668945,-22.477951049804688,6.804288864135742,14067712,EleutherAI/pythia-14m,step104000,seed8,8,104000
It was a fall term.,term,term,It was a term fall., fall term, term fall,fall,True,-17.848052978515625,-21.574020385742188,3.7259674072265625,14067712,EleutherAI/pythia-14m,step104000,seed8,8,104000
It was a legal term.,term,term,It was a term legal., legal term, term legal,legal,False,-16.129878997802734,-20.116622924804688,3.986743927001953,14067712,EleutherAI/pythia-14m,step104000,seed8,8,104000
It was a clock tick.,tick,tick,It was a tick clock., clock tick, tick clock,clock,True,-18.259309768676758,-20.044178009033203,1.7848682403564453,14067712,EleutherAI/pythia-14m,step104000,seed8,8,104000
It was an audible tick.,tick,tick,It was an tick audible., audible tick, tick audible,audible,False,-16.614229202270508,-27.54480743408203,10.930578231811523,14067712,EleutherAI/pythia-14m,step104000,seed8,8,104000
It was a parasitic tick.,tick,tick,It was a tick parasitic., parasitic tick, tick parasitic,parasitic,False,-21.83197021484375,-24.143299102783203,2.311328887939453,14067712,EleutherAI/pythia-14m,step104000,seed8,8,104000
It was a generous tip.,tip,tip,It was a tip generous., generous tip, tip generous,generous,False,-18.05145263671875,-23.068883895874023,5.017431259155273,14067712,EleutherAI/pythia-14m,step104000,seed8,8,104000
It was a stingy tip.,tip,tip,It was a tip stingy., stingy tip, tip stingy,stingy,False,-22.477436065673828,-26.289854049682617,3.812417984008789,14067712,EleutherAI/pythia-14m,step104000,seed8,8,104000
It was a pencil tip.,tip,tip,It was a tip pencil., pencil tip, tip pencil,pencil,True,-19.227577209472656,-20.751073837280273,1.5234966278076172,14067712,EleutherAI/pythia-14m,step104000,seed8,8,104000
She liked the essay title.,title,title,She liked the title essay., essay title, title essay,essay,True,-19.4488525390625,-17.014625549316406,-2.4342269897460938,14067712,EleutherAI/pythia-14m,step104000,seed8,8,104000
She liked the poem title.,title,title,She liked the title poem., poem title, title poem,poem,True,-16.754060745239258,-14.306312561035156,-2.4477481842041016,14067712,EleutherAI/pythia-14m,step104000,seed8,8,104000
She liked the academic title.,title,title,She liked the title academic., academic title, title academic,academic,False,-17.4152889251709,-19.282752990722656,1.8674640655517578,14067712,EleutherAI/pythia-14m,step104000,seed8,8,104000
It was a costly toll.,toll,toll,It was a toll costly., costly toll, toll costly,costly,False,-19.064119338989258,-24.175872802734375,5.111753463745117,14067712,EleutherAI/pythia-14m,step104000,seed8,8,104000
It was a road toll.,toll,toll,It was a toll road., road toll, toll road,road,True,-18.99818229675293,-17.082794189453125,-1.9153881072998047,14067712,EleutherAI/pythia-14m,step104000,seed8,8,104000
It was a loud toll.,toll,toll,It was a toll loud., loud toll, toll loud,loud,False,-19.034992218017578,-23.050567626953125,4.015575408935547,14067712,EleutherAI/pythia-14m,step104000,seed8,8,104000
She saw the train tracks.,track,tracks,She saw the tracks train., train tracks, tracks train,train,True,-14.199224472045898,-17.225923538208008,3.0266990661621094,14067712,EleutherAI/pythia-14m,step104000,seed8,8,104000
She saw the trolley tracks.,track,tracks,She saw the tracks trolley., trolley tracks, tracks trolley,trolley,True,-21.14316177368164,-23.017738342285156,1.8745765686035156,14067712,EleutherAI/pythia-14m,step104000,seed8,8,104000
She saw the moose tracks.,track,tracks,She saw the tracks moose., moose tracks, tracks moose,moose,False,-20.695804595947266,-21.614274978637695,0.9184703826904297,14067712,EleutherAI/pythia-14m,step104000,seed8,8,104000
It was five yards.,yard,yards,It was yards five., five yards, yards five,five,True,-14.765226364135742,-25.374988555908203,10.609762191772461,14067712,EleutherAI/pythia-14m,step104000,seed8,8,104000
It was ten yards.,yard,yards,It was yards ten., ten yards, yards ten,ten,True,-15.495843887329102,-26.487049102783203,10.991205215454102,14067712,EleutherAI/pythia-14m,step104000,seed8,8,104000
They were big yards.,yard,yards,They were yards big., big yards, yards big,big,False,-16.962919235229492,-20.572017669677734,3.609098434448242,14067712,EleutherAI/pythia-14m,step104000,seed8,8,104000
It was a comedic act.,act,act,It was an act comedic., comedic act, act comedic,comedic,False,-19.297786712646484,-22.774858474731445,3.477071762084961,14067712,EleutherAI/pythia-14m,step104000,seed8,8,104000
He had a pending appeal.,appeal,appeal,He had an appeal pending., pending appeal, appeal pending,pending,False,-14.855055809020996,-13.951990127563477,-0.9030656814575195,14067712,EleutherAI/pythia-14m,step104000,seed8,8,104000
It was a polluted atmosphere.,atmosphere,atmosphere,It was an atmosphere polluted., polluted atmosphere, atmosphere polluted,polluted,False,-25.321958541870117,-23.420543670654297,-1.9014148712158203,14067712,EleutherAI/pythia-14m,step104000,seed8,8,104000
It was a country band.,band,band,It was a band country., country band, band country,country,True,-17.21097183227539,-19.195585250854492,1.9846134185791016,14067712,EleutherAI/pythia-14m,step104000,seed8,8,104000
There was a religious barrier.,barrier,barrier,There was a barrier religious., religious barrier, barrier religious,religious,False,-16.59688949584961,-23.943584442138672,7.3466949462890625,14067712,EleutherAI/pythia-14m,step104000,seed8,8,104000
He saw a baseball bat.,bat,bat,He saw a bat baseball., baseball bat, bat baseball,baseball,True,-12.418949127197266,-21.34398651123047,8.925037384033203,14067712,EleutherAI/pythia-14m,step104000,seed8,8,104000
He saw the balance beam.,beam,beam,He saw the beam balance., balance beam, beam balance,balance,True,-19.920459747314453,-18.773780822753906,-1.1466789245605469,14067712,EleutherAI/pythia-14m,step104000,seed8,8,104000
She had a writer's block.,block,block,She had a block writer's., writer's block, block writer's,writer,True,-22.24685287475586,-24.745723724365234,2.498870849609375,14067712,EleutherAI/pythia-14m,step104000,seed8,8,104000
He has royal blood.,blood,blood,He has blood royal., royal blood, blood royal,royal,False,-20.595930099487305,-25.31937599182129,4.723445892333984,14067712,EleutherAI/pythia-14m,step104000,seed8,8,104000
It was the school board.,board,board,It was the board school., school board, board school,school,True,-13.606637954711914,-17.981979370117188,4.375341415405273,14067712,EleutherAI/pythia-14m,step104000,seed8,8,104000
He had a leather-bound book.,book,book,He had a book leather-bound., leather-bound book, book leather-bound,leather-bound,False,-23.708702087402344,-28.799087524414062,5.090385437011719,14067712,EleutherAI/pythia-14m,step104000,seed8,8,104000
They ate a lonely breakfast.,breakfast,breakfast,They ate a breakfast lonely., lonely breakfast, breakfast lonely,lonely,False,-15.176292419433594,-20.437456130981445,5.261163711547852,14067712,EleutherAI/pythia-14m,step104000,seed8,8,104000
It was an island cape.,cape,cape,It was an cape island., island cape, cape island,island,True,-21.995464324951172,-25.16197967529297,3.166515350341797,14067712,EleutherAI/pythia-14m,step104000,seed8,8,104000
It was a criminal case.,case,case,It was a case criminal., criminal case, case criminal,criminal,False,-9.731287002563477,-14.575891494750977,4.8446044921875,14067712,EleutherAI/pythia-14m,step104000,seed8,8,104000
It was a primary cause.,cause,cause,It was a cause primary., primary cause, cause primary,primary,False,-12.89959716796875,-22.171615600585938,9.272018432617188,14067712,EleutherAI/pythia-14m,step104000,seed8,8,104000
It was a jail cell.,cell,cell,It was a cell jail., jail cell, cell jail,jail,True,-18.16530990600586,-22.791851043701172,4.6265411376953125,14067712,EleutherAI/pythia-14m,step104000,seed8,8,104000
She had a good-luck charm.,charm,charm,She had a charm good-luck., good-luck charm, charm good-luck,good-luck,False,-26.37679672241211,-31.068622589111328,4.691825866699219,14067712,EleutherAI/pythia-14m,step104000,seed8,8,104000
They liked the pet chicken.,chicken,chicken,They liked the chicken pet., pet chicken, chicken pet,pet,True,-17.91106605529785,-16.904376983642578,-1.0066890716552734,14067712,EleutherAI/pythia-14m,step104000,seed8,8,104000
It was a stimulating class.,class,class,It was a class stimulating., stimulating class, class stimulating,stimulating,False,-18.85851287841797,-21.215251922607422,2.356739044189453,14067712,EleutherAI/pythia-14m,step104000,seed8,8,104000
It was a metal clip.,clip,clip,It was a clip metal., metal clip, clip metal,metal,True,-18.484189987182617,-20.390949249267578,1.906759262084961,14067712,EleutherAI/pythia-14m,step104000,seed8,8,104000
It was a common cold.,cold,cold,It was a cold common., common cold, cold common,common,False,-15.201187133789062,-17.58741569519043,2.386228561401367,14067712,EleutherAI/pythia-14m,step104000,seed8,8,104000
It was a marble column.,column,column,It was a column marble., marble column, column marble,marble,True,-18.00747299194336,-23.6749324798584,5.667459487915039,14067712,EleutherAI/pythia-14m,step104000,seed8,8,104000
He liked the polite company.,company,company,He liked the company polite., polite company, company polite,polite,False,-18.439895629882812,-20.57512855529785,2.135232925415039,14067712,EleutherAI/pythia-14m,step104000,seed8,8,104000
It was a traffic cone.,cone,cone,It was a cone traffic., traffic cone, cone traffic,traffic,True,-18.399023056030273,-24.916669845581055,6.517646789550781,14067712,EleutherAI/pythia-14m,step104000,seed8,8,104000
He made a well-written contribution.,contribution,contribution,He made a contribution well-written., well-written contribution, contribution well-written,well-written,False,-20.007720947265625,-24.550960540771484,4.543239593505859,14067712,EleutherAI/pythia-14m,step104000,seed8,8,104000
That was the correct count.,count,count,That was the count correct., correct count, count correct,correct,False,-15.577165603637695,-20.663394927978516,5.08622932434082,14067712,EleutherAI/pythia-14m,step104000,seed8,8,104000
It was a collision course.,course,course,It was a course collision., collision course, course collision,collision,True,-15.223688125610352,-20.955984115600586,5.732295989990234,14067712,EleutherAI/pythia-14m,step104000,seed8,8,104000
It was a historical date.,date,date,It was a date historical., historical date, date historical,historical,False,-15.835058212280273,-19.48554801940918,3.6504898071289062,14067712,EleutherAI/pythia-14m,step104000,seed8,8,104000
It was about college degrees.,degree,degrees,It was about degrees college., college degrees, degrees college,college,True,-15.486804962158203,-23.05420684814453,7.567401885986328,14067712,EleutherAI/pythia-14m,step104000,seed8,8,104000
They liked the architectural design.,design,design,They liked the design architectural., architectural design, design architectural,architectural,False,-15.630660057067871,-19.373687744140625,3.743027687072754,14067712,EleutherAI/pythia-14m,step104000,seed8,8,104000
They liked the anniversary dinner.,dinner,dinner,They liked the dinner anniversary., anniversary dinner, dinner anniversary,anniversary,True,-19.47833251953125,-18.10053062438965,-1.3778018951416016,14067712,EleutherAI/pythia-14m,step104000,seed8,8,104000
He had a career dream.,dream,dream,He had a dream career., career dream, dream career,career,True,-14.556221961975098,-16.749910354614258,2.19368839263916,14067712,EleutherAI/pythia-14m,step104000,seed8,8,104000
It was a battery-powered drill.,drill,drill,It was a drill battery-powered., battery-powered drill, drill battery-powered,battery-powered,False,-23.70259666442871,-28.251691818237305,4.549095153808594,14067712,EleutherAI/pythia-14m,step104000,seed8,8,104000
It was a physical examination.,examination,examination,It was an examination physical., physical examination, examination physical,physical,False,-12.468497276306152,-20.288578033447266,7.820080757141113,14067712,EleutherAI/pythia-14m,step104000,seed8,8,104000
They had an enthusiastic fan.,fan,fan,They had an fan enthusiastic., enthusiastic fan, fan enthusiastic,enthusiastic,False,-14.140332221984863,-26.097576141357422,11.957243919372559,14067712,EleutherAI/pythia-14m,step104000,seed8,8,104000
She had a steel file.,file,file,She had a file steel., steel file, file steel,steel,True,-17.142452239990234,-24.98160171508789,7.839149475097656,14067712,EleutherAI/pythia-14m,step104000,seed8,8,104000
It was a plastic film.,film,film,It was a film plastic., plastic film, film plastic,plastic,False,-14.870296478271484,-21.505136489868164,6.63484001159668,14067712,EleutherAI/pythia-14m,step104000,seed8,8,104000
It was a concrete foundation.,foundation,foundation,It was a foundation concrete., concrete foundation, foundation concrete,concrete,False,-16.05716323852539,-23.567907333374023,7.510744094848633,14067712,EleutherAI/pythia-14m,step104000,seed8,8,104000
It was a business function.,function,function,It was a function business., business function, function business,business,True,-16.639528274536133,-19.678546905517578,3.0390186309814453,14067712,EleutherAI/pythia-14m,step104000,seed8,8,104000
He was on the parade ground.,ground,ground,He was on the ground parade., parade ground, ground parade,parade,True,-18.42389488220215,-18.892995834350586,0.4691009521484375,14067712,EleutherAI/pythia-14m,step104000,seed8,8,104000
They liked the national guard.,guard,guard,They liked the guard national., national guard, guard national,national,False,-17.638233184814453,-21.366992950439453,3.728759765625,14067712,EleutherAI/pythia-14m,step104000,seed8,8,104000
He had a friendly guide.,guide,guide,He had a guide friendly., friendly guide, guide friendly,friendly,False,-14.492904663085938,-22.578514099121094,8.085609436035156,14067712,EleutherAI/pythia-14m,step104000,seed8,8,104000
It was a nursing home.,home,home,It was a home nursing., nursing home, home nursing,nursing,True,-12.362356185913086,-18.066295623779297,5.703939437866211,14067712,EleutherAI/pythia-14m,step104000,seed8,8,104000
They had military intelligence.,intelligence,intelligence,They had intelligence military., military intelligence, intelligence military,military,False,-17.297077178955078,-22.01186752319336,4.714790344238281,14067712,EleutherAI/pythia-14m,step104000,seed8,8,104000
It was a special issue.,issue,issue,It was an issue special., special issue, issue special,special,False,-11.187013626098633,-15.955873489379883,4.76885986328125,14067712,EleutherAI/pythia-14m,step104000,seed8,8,104000
It was a paper jam.,jam,jam,It was a jam paper., paper jam, jam paper,paper,True,-19.945161819458008,-20.77079963684082,0.8256378173828125,14067712,EleutherAI/pythia-14m,step104000,seed8,8,104000
It was a backspace key.,key,key,It was a key backspace., backspace key, key backspace,backspace,True,-25.174800872802734,-23.76534652709961,-1.409454345703125,14067712,EleutherAI/pythia-14m,step104000,seed8,8,104000
They liked the friendly lamb.,lamb,lamb,They liked the lamb friendly., friendly lamb, lamb friendly,friendly,False,-21.36806869506836,-22.097599029541016,0.7295303344726562,14067712,EleutherAI/pythia-14m,step104000,seed8,8,104000
She had door locks.,lock,locks,She had locks door., door locks, locks door,door,True,-17.477582931518555,-20.361711502075195,2.8841285705566406,14067712,EleutherAI/pythia-14m,step104000,seed8,8,104000
They liked the women's lunch.,lunch,lunch,They liked the lunch women's., women's lunch, lunch women's,women,True,-18.319690704345703,-23.30443000793457,4.984739303588867,14067712,EleutherAI/pythia-14m,step104000,seed8,8,104000
He liked the stock market.,market,market,He liked the market stock., stock market, market stock,stock,True,-12.352012634277344,-16.12436866760254,3.7723560333251953,14067712,EleutherAI/pythia-14m,step104000,seed8,8,104000
It was a tennis match.,match,match,It was a match tennis., tennis match, match tennis,tennis,True,-15.255924224853516,-20.810863494873047,5.554939270019531,14067712,EleutherAI/pythia-14m,step104000,seed8,8,104000
It was veterinary medicine.,medicine,medicine,It was medicine veterinary., veterinary medicine, medicine veterinary,veterinary,False,-18.630970001220703,-24.350868225097656,5.719898223876953,14067712,EleutherAI/pythia-14m,step104000,seed8,8,104000
There was a clear message.,message,message,There was a message clear., clear message, message clear,clear,False,-10.771440505981445,-16.99291229248047,6.221471786499023,14067712,EleutherAI/pythia-14m,step104000,seed8,8,104000
It was a clay mold.,mold,mold,It was a mold clay., clay mold, mold clay,clay,True,-19.47016716003418,-21.82074737548828,2.3505802154541016,14067712,EleutherAI/pythia-14m,step104000,seed8,8,104000
She saw the fast mole.,mole,mole,She saw the mole fast., fast mole, mole fast,fast,False,-21.722158432006836,-21.25187110900879,-0.4702873229980469,14067712,EleutherAI/pythia-14m,step104000,seed8,8,104000
He liked the civil-rights movement.,movement,movement,He liked the movement civil-rights., civil-rights movement, movement civil-rights,civil-rights,False,-21.537843704223633,-29.849069595336914,8.311225891113281,14067712,EleutherAI/pythia-14m,step104000,seed8,8,104000
It was a shredded newspaper.,newspaper,newspaper,It was a newspaper shredded., shredded newspaper, newspaper shredded,shredded,False,-23.92104148864746,-23.08202362060547,-0.8390178680419922,14067712,EleutherAI/pythia-14m,step104000,seed8,8,104000
It was a reddish orange.,orange,orange,It was an orange reddish., reddish orange, orange reddish,reddish,False,-19.450754165649414,-17.58809471130371,-1.8626594543457031,14067712,EleutherAI/pythia-14m,step104000,seed8,8,104000
He saw the ripped page.,page,page,He saw the page ripped., ripped page, page ripped,ripped,False,-17.60260581970215,-20.314788818359375,2.7121829986572266,14067712,EleutherAI/pythia-14m,step104000,seed8,8,104000
It was a tree palm.,palm,palm,It was a palm tree., tree palm, palm tree,tree,True,-21.003150939941406,-14.326091766357422,-6.677059173583984,14067712,EleutherAI/pythia-14m,step104000,seed8,8,104000
It was a consumer panel.,panel,panel,It was a panel consumer., consumer panel, panel consumer,consumer,True,-19.381893157958984,-21.627685546875,2.2457923889160156,14067712,EleutherAI/pythia-14m,step104000,seed8,8,104000
It was a biblical passage.,passage,passage,It was a passage biblical., biblical passage, passage biblical,biblical,False,-15.287753105163574,-24.273963928222656,8.986210823059082,14067712,EleutherAI/pythia-14m,step104000,seed8,8,104000
It was a secure perch.,perch,perch,It was a perch secure., secure perch, perch secure,secure,False,-22.27872657775879,-25.839832305908203,3.561105728149414,14067712,EleutherAI/pythia-14m,step104000,seed8,8,104000
He saw the plastic pitcher.,pitcher,pitcher,He saw the pitcher plastic., plastic pitcher, pitcher plastic,plastic,True,-18.201921463012695,-21.90314483642578,3.701223373413086,14067712,EleutherAI/pythia-14m,step104000,seed8,8,104000
It was a sweet port.,port,port,It was a port sweet., sweet port, port sweet,sweet,False,-15.777862548828125,-20.84713363647461,5.069271087646484,14067712,EleutherAI/pythia-14m,step104000,seed8,8,104000
He was in a yoga position.,position,position,He was in a position yoga., yoga position, position yoga,yoga,True,-17.092145919799805,-18.343564987182617,1.2514190673828125,14067712,EleutherAI/pythia-14m,step104000,seed8,8,104000
It was a challenging post.,post,post,It was a post challenging., challenging post, post challenging,challenging,False,-14.84618854522705,-17.18522071838379,2.3390321731567383,14067712,EleutherAI/pythia-14m,step104000,seed8,8,104000
He had the quickest punch.,punch,punch,He had the punch quickest., quickest punch, punch quickest,quickest,False,-19.445322036743164,-24.847631454467773,5.402309417724609,14067712,EleutherAI/pythia-14m,step104000,seed8,8,104000
She had a cloudy pupil.,pupil,pupil,She had a pupil cloudy., cloudy pupil, pupil cloudy,cloudy,False,-24.806921005249023,-26.635765075683594,1.8288440704345703,14067712,EleutherAI/pythia-14m,step104000,seed8,8,104000
That was a tennis racket.,racket,racket,That was a racket tennis., tennis racket, racket tennis,tennis,True,-16.861492156982422,-20.42852020263672,3.567028045654297,14067712,EleutherAI/pythia-14m,step104000,seed8,8,104000
He liked granite rock.,rock,rock,He liked rock granite., granite rock, rock granite,granite,True,-18.931121826171875,-20.298931121826172,1.3678092956542969,14067712,EleutherAI/pythia-14m,step104000,seed8,8,104000
He saw the bushy sage.,sage,sage,He saw the sage bushy., bushy sage, sage bushy,bushy,False,-28.95868492126465,-30.54078483581543,1.5820999145507812,14067712,EleutherAI/pythia-14m,step104000,seed8,8,104000
It was a major scale.,scale,scale,It was a scale major., major scale, scale major,major,False,-14.768970489501953,-22.019634246826172,7.250663757324219,14067712,EleutherAI/pythia-14m,step104000,seed8,8,104000
It was a panoramic scene.,scene,scene,It was a scene panoramic., panoramic scene, scene panoramic,panoramic,False,-21.163311004638672,-24.88758087158203,3.7242698669433594,14067712,EleutherAI/pythia-14m,step104000,seed8,8,104000
It was a trained seal.,seal,seal,It was a seal trained., trained seal, seal trained,trained,False,-23.325305938720703,-23.29558563232422,-0.029720306396484375,14067712,EleutherAI/pythia-14m,step104000,seed8,8,104000
He used the video tape.,tape,tape,He used the tape video., video tape, tape video,video,True,-14.1390380859375,-16.184879302978516,2.0458412170410156,14067712,EleutherAI/pythia-14m,step104000,seed8,8,104000
It was a technical term.,term,term,It was a term technical., technical term, term technical,technical,False,-18.027263641357422,-22.113876342773438,4.086612701416016,14067712,EleutherAI/pythia-14m,step104000,seed8,8,104000
It was a diseased tick.,tick,tick,It was a tick diseased., diseased tick, tick diseased,diseased,False,-22.008134841918945,-26.398670196533203,4.390535354614258,14067712,EleutherAI/pythia-14m,step104000,seed8,8,104000
It was a finger tip.,tip,tip,It was a tip finger., finger tip, tip finger,finger,True,-19.081069946289062,-18.839574813842773,-0.24149513244628906,14067712,EleutherAI/pythia-14m,step104000,seed8,8,104000
She liked the professional title.,title,title,She liked the title professional., professional title, title professional,professional,False,-16.04839324951172,-19.033851623535156,2.9854583740234375,14067712,EleutherAI/pythia-14m,step104000,seed8,8,104000
It was a bell toll.,toll,toll,It was a toll bell., bell toll, toll bell,bell,True,-21.49010467529297,-20.496002197265625,-0.9941024780273438,14067712,EleutherAI/pythia-14m,step104000,seed8,8,104000
She saw the snowshoe tracks.,track,tracks,She saw the tracks snowshoe., snowshoe tracks, tracks snowshoe,snowshoe,True,-26.41165542602539,-27.167728424072266,0.756072998046875,14067712,EleutherAI/pythia-14m,step104000,seed8,8,104000
They were cluttered yards.,yard,yards,They were yards cluttered., cluttered yards, yards cluttered,cluttered,False,-25.670246124267578,-25.658935546875,-0.011310577392578125,14067712,EleutherAI/pythia-14m,step104000,seed8,8,104000
