sentence,word,string,reversed_sentence,mod_np,reversed_mod,disambiguating_word,non_adjective,original_logprob,reversed_logprob,ratio,n_params,mpath,revision,seed_name,seed,step
It was a desperate act.,act,act,It was an act desperate., desperate act, act desperate,desperate,False,-15.505058288574219,-17.463489532470703,1.9584312438964844,14067712,EleutherAI/pythia-14m,step52000,seed8,8,52000
It was a humane act.,act,act,It was an act humane., humane act, act humane,humane,False,-19.66626739501953,-17.720611572265625,-1.9456558227539062,14067712,EleutherAI/pythia-14m,step52000,seed8,8,52000
It was a magic act.,act,act,It was an act magic., magic act, act magic,magic,False,-15.771963119506836,-17.311687469482422,1.539724349975586,14067712,EleutherAI/pythia-14m,step52000,seed8,8,52000
He had a universal appeal.,appeal,appeal,He had an appeal universal., universal appeal, appeal universal,universal,False,-19.39841079711914,-21.013195037841797,1.6147842407226562,14067712,EleutherAI/pythia-14m,step52000,seed8,8,52000
He had an undefinable appeal.,appeal,appeal,He had an appeal undefinable., undefinable appeal, appeal undefinable,undefinable,False,-27.749784469604492,-31.872480392456055,4.1226959228515625,14067712,EleutherAI/pythia-14m,step52000,seed8,8,52000
He had a legal appeal.,appeal,appeal,He had an appeal legal., legal appeal, appeal legal,legal,False,-16.41901206970215,-17.867034912109375,1.4480228424072266,14067712,EleutherAI/pythia-14m,step52000,seed8,8,52000
It was a tense atmosphere.,atmosphere,atmosphere,It was an atmosphere tense., tense atmosphere, atmosphere tense,tense,False,-18.229822158813477,-19.543975830078125,1.3141536712646484,14067712,EleutherAI/pythia-14m,step52000,seed8,8,52000
It was a hostile atmosphere.,atmosphere,atmosphere,It was an atmosphere hostile., hostile atmosphere, atmosphere hostile,hostile,False,-14.713983535766602,-18.452608108520508,3.7386245727539062,14067712,EleutherAI/pythia-14m,step52000,seed8,8,52000
It was a gaseous atmosphere.,atmosphere,atmosphere,It was an atmosphere gaseous., gaseous atmosphere, atmosphere gaseous,gaseous,False,-15.95867919921875,-19.986968994140625,4.028289794921875,14067712,EleutherAI/pythia-14m,step52000,seed8,8,52000
It was a gold band.,band,band,It was a band gold., gold band, band gold,gold,True,-15.032577514648438,-20.185794830322266,5.153217315673828,14067712,EleutherAI/pythia-14m,step52000,seed8,8,52000
It was a rubber band.,band,band,It was a band rubber., rubber band, band rubber,rubber,True,-15.494285583496094,-22.40304946899414,6.908763885498047,14067712,EleutherAI/pythia-14m,step52000,seed8,8,52000
It was a jazz band.,band,band,It was a band jazz., jazz band, band jazz,jazz,True,-13.314723014831543,-17.270267486572266,3.9555444717407227,14067712,EleutherAI/pythia-14m,step52000,seed8,8,52000
There was a police barrier.,barrier,barrier,There was a barrier police., police barrier, barrier police,police,True,-22.24026870727539,-21.636985778808594,-0.6032829284667969,14067712,EleutherAI/pythia-14m,step52000,seed8,8,52000
There was a concrete barrier.,barrier,barrier,There was a barrier concrete., concrete barrier, barrier concrete,concrete,False,-16.960025787353516,-21.216110229492188,4.256084442138672,14067712,EleutherAI/pythia-14m,step52000,seed8,8,52000
There was a language barrier.,barrier,barrier,There was a barrier language., language barrier, barrier language,language,True,-21.359832763671875,-26.043724060058594,4.683891296386719,14067712,EleutherAI/pythia-14m,step52000,seed8,8,52000
He saw a furry bat.,bat,bat,He saw a bat furry., furry bat, bat furry,furry,False,-19.485000610351562,-21.68747901916504,2.2024784088134766,14067712,EleutherAI/pythia-14m,step52000,seed8,8,52000
He saw a fruit bat.,bat,bat,He saw a bat fruit., fruit bat, bat fruit,fruit,True,-19.20159912109375,-20.53390884399414,1.3323097229003906,14067712,EleutherAI/pythia-14m,step52000,seed8,8,52000
He saw a wooden bat.,bat,bat,He saw a bat wooden., wooden bat, bat wooden,wooden,False,-15.54741382598877,-22.25678253173828,6.709368705749512,14067712,EleutherAI/pythia-14m,step52000,seed8,8,52000
He saw the laser beam.,beam,beam,He saw the beam laser., laser beam, beam laser,laser,True,-10.897610664367676,-15.28077507019043,4.383164405822754,14067712,EleutherAI/pythia-14m,step52000,seed8,8,52000
He saw the bright beam.,beam,beam,He saw the beam bright., bright beam, beam bright,bright,False,-17.476364135742188,-16.374492645263672,-1.1018714904785156,14067712,EleutherAI/pythia-14m,step52000,seed8,8,52000
He saw the wood beam.,beam,beam,He saw the beam wood., wood beam, beam wood,wood,True,-16.376792907714844,-18.170259475708008,1.793466567993164,14067712,EleutherAI/pythia-14m,step52000,seed8,8,52000
She had a toy block.,block,block,She had a block toy., toy block, block toy,toy,True,-16.980289459228516,-19.0382137298584,2.057924270629883,14067712,EleutherAI/pythia-14m,step52000,seed8,8,52000
She had a wooden block.,block,block,She had a block wooden., wooden block, block wooden,wooden,False,-15.884309768676758,-23.69499397277832,7.8106842041015625,14067712,EleutherAI/pythia-14m,step52000,seed8,8,52000
She had a mental block.,block,block,She had a block mental., mental block, block mental,mental,False,-16.498708724975586,-23.689685821533203,7.190977096557617,14067712,EleutherAI/pythia-14m,step52000,seed8,8,52000
He has coagulated blood.,blood,blood,He has blood coagulated., coagulated blood, blood coagulated,coagulated,True,-34.73817825317383,-34.289390563964844,-0.4487876892089844,14067712,EleutherAI/pythia-14m,step52000,seed8,8,52000
He has thin blood.,blood,blood,He has blood thin., thin blood, blood thin,thin,False,-16.808473587036133,-19.96753692626953,3.1590633392333984,14067712,EleutherAI/pythia-14m,step52000,seed8,8,52000
He has noble blood.,blood,blood,He has blood noble., noble blood, blood noble,noble,False,-18.436389923095703,-23.543743133544922,5.107353210449219,14067712,EleutherAI/pythia-14m,step52000,seed8,8,52000
It was the ironing board.,board,board,It was the board ironing., ironing board, board ironing,ironing,False,-24.097225189208984,-24.860820770263672,0.7635955810546875,14067712,EleutherAI/pythia-14m,step52000,seed8,8,52000
It was the wooden board.,board,board,It was the board wooden., wooden board, board wooden,wooden,False,-17.21414566040039,-21.76657485961914,4.55242919921875,14067712,EleutherAI/pythia-14m,step52000,seed8,8,52000
It was the executive board.,board,board,It was the board executive., executive board, board executive,executive,True,-14.376106262207031,-15.896577835083008,1.5204715728759766,14067712,EleutherAI/pythia-14m,step52000,seed8,8,52000
He had a best-selling book.,book,book,He had a book best-selling., best-selling book, book best-selling,best-selling,False,-17.411197662353516,-20.320520401000977,2.909322738647461,14067712,EleutherAI/pythia-14m,step52000,seed8,8,52000
He had a popular book.,book,book,He had a book popular., popular book, book popular,popular,False,-16.991931915283203,-18.270389556884766,1.2784576416015625,14067712,EleutherAI/pythia-14m,step52000,seed8,8,52000
He had a heavy book.,book,book,He had a book heavy., heavy book, book heavy,heavy,False,-18.02971076965332,-19.709999084472656,1.680288314819336,14067712,EleutherAI/pythia-14m,step52000,seed8,8,52000
They ate a pancake breakfast.,breakfast,breakfast,They ate a breakfast pancake., pancake breakfast, breakfast pancake,pancake,True,-13.810966491699219,-14.699785232543945,0.8888187408447266,14067712,EleutherAI/pythia-14m,step52000,seed8,8,52000
They ate a nutritious breakfast.,breakfast,breakfast,They ate a breakfast nutritious., nutritious breakfast, breakfast nutritious,nutritious,False,-17.14359474182129,-22.04404067993164,4.900445938110352,14067712,EleutherAI/pythia-14m,step52000,seed8,8,52000
They ate a family breakfast.,breakfast,breakfast,They ate a breakfast family., family breakfast, breakfast family,family,True,-13.639760971069336,-15.318059921264648,1.6782989501953125,14067712,EleutherAI/pythia-14m,step52000,seed8,8,52000
It was a red cape.,cape,cape,It was a cape red., red cape, cape red,red,False,-18.715740203857422,-20.999774932861328,2.2840347290039062,14067712,EleutherAI/pythia-14m,step52000,seed8,8,52000
It was a flowing cape.,cape,cape,It was a cape flowing., flowing cape, cape flowing,flowing,False,-22.957189559936523,-23.260040283203125,0.30285072326660156,14067712,EleutherAI/pythia-14m,step52000,seed8,8,52000
It was a rocky cape.,cape,cape,It was a cape rocky., rocky cape, cape rocky,rocky,False,-21.362689971923828,-25.505672454833984,4.142982482910156,14067712,EleutherAI/pythia-14m,step52000,seed8,8,52000
It was a beer case.,case,case,It was a case beer., beer case, case beer,beer,True,-16.030221939086914,-20.992673873901367,4.962451934814453,14067712,EleutherAI/pythia-14m,step52000,seed8,8,52000
It was a display case.,case,case,It was a case display., display case, case display,display,True,-16.029701232910156,-19.62046241760254,3.590761184692383,14067712,EleutherAI/pythia-14m,step52000,seed8,8,52000
It was a divorce case.,case,case,It was a case divorce., divorce case, case divorce,divorce,True,-13.353133201599121,-19.716211318969727,6.3630781173706055,14067712,EleutherAI/pythia-14m,step52000,seed8,8,52000
It was a worthy cause.,cause,cause,It was a cause worthy., worthy cause, cause worthy,worthy,False,-15.784668922424316,-19.657230377197266,3.872561454772949,14067712,EleutherAI/pythia-14m,step52000,seed8,8,52000
It was a political cause.,cause,cause,It was a cause political., political cause, cause political,political,False,-16.431461334228516,-21.390655517578125,4.959194183349609,14067712,EleutherAI/pythia-14m,step52000,seed8,8,52000
It was a main cause.,cause,cause,It was a cause main., main cause, cause main,main,False,-15.377059936523438,-20.66596221923828,5.288902282714844,14067712,EleutherAI/pythia-14m,step52000,seed8,8,52000
It was a skin cell.,cell,cell,It was a cell skin., skin cell, cell skin,skin,True,-17.617881774902344,-18.35588836669922,0.738006591796875,14067712,EleutherAI/pythia-14m,step52000,seed8,8,52000
It was a brain cell.,cell,cell,It was a cell brain., brain cell, cell brain,brain,True,-14.727764129638672,-19.546947479248047,4.819183349609375,14067712,EleutherAI/pythia-14m,step52000,seed8,8,52000
It was a prison cell.,cell,cell,It was a cell prison., prison cell, cell prison,prison,True,-17.210145950317383,-20.267826080322266,3.057680130004883,14067712,EleutherAI/pythia-14m,step52000,seed8,8,52000
She had a devilish charm.,charm,charm,She had a charm devilish., devilish charm, charm devilish,devilish,False,-15.61865520477295,-25.606069564819336,9.987414360046387,14067712,EleutherAI/pythia-14m,step52000,seed8,8,52000
She had a natural charm.,charm,charm,She had a charm natural., natural charm, charm natural,natural,False,-17.20421600341797,-21.329204559326172,4.124988555908203,14067712,EleutherAI/pythia-14m,step52000,seed8,8,52000
She had a gold charm.,charm,charm,She had a charm gold., gold charm, charm gold,gold,True,-16.894258499145508,-19.321956634521484,2.4276981353759766,14067712,EleutherAI/pythia-14m,step52000,seed8,8,52000
They liked the juicy chicken.,chicken,chicken,They liked the chicken juicy., juicy chicken, chicken juicy,juicy,False,-20.76188850402832,-21.82237434387207,1.06048583984375,14067712,EleutherAI/pythia-14m,step52000,seed8,8,52000
They liked the roasted chicken.,chicken,chicken,They liked the chicken roasted., roasted chicken, chicken roasted,roasted,False,-16.93161964416504,-18.918212890625,1.986593246459961,14067712,EleutherAI/pythia-14m,step52000,seed8,8,52000
They liked the clucking chicken.,chicken,chicken,They liked the chicken clucking., clucking chicken, chicken clucking,clucking,True,-26.690868377685547,-26.412050247192383,-0.27881813049316406,14067712,EleutherAI/pythia-14m,step52000,seed8,8,52000
It was a perceptive class.,class,class,It was a class perceptive., perceptive class, class perceptive,perceptive,False,-22.455646514892578,-25.03034782409668,2.5747013092041016,14067712,EleutherAI/pythia-14m,step52000,seed8,8,52000
It was a misbehaving class.,class,class,It was a class misbehaving., misbehaving class, class misbehaving,misbehaving,False,-22.130817413330078,-28.209333419799805,6.078516006469727,14067712,EleutherAI/pythia-14m,step52000,seed8,8,52000
It was a boring class.,class,class,It was a class boring., boring class, class boring,boring,False,-17.678913116455078,-19.652591705322266,1.9736785888671875,14067712,EleutherAI/pythia-14m,step52000,seed8,8,52000
It was a film clip.,clip,clip,It was a clip film., film clip, clip film,film,True,-16.66421890258789,-16.72970199584961,0.06548309326171875,14067712,EleutherAI/pythia-14m,step52000,seed8,8,52000
It was a video clip.,clip,clip,It was a clip video., video clip, clip video,video,True,-12.890547752380371,-16.57082176208496,3.68027400970459,14067712,EleutherAI/pythia-14m,step52000,seed8,8,52000
It was a hair clip.,clip,clip,It was a clip hair., hair clip, clip hair,hair,True,-19.453845977783203,-21.220367431640625,1.7665214538574219,14067712,EleutherAI/pythia-14m,step52000,seed8,8,52000
It was an icy cold.,cold,cold,It was an cold icy., icy cold, cold icy,icy,False,-10.975406646728516,-18.411697387695312,7.436290740966797,14067712,EleutherAI/pythia-14m,step52000,seed8,8,52000
It was a freezing cold.,cold,cold,It was a cold freezing., freezing cold, cold freezing,freezing,False,-13.467859268188477,-13.176465034484863,-0.2913942337036133,14067712,EleutherAI/pythia-14m,step52000,seed8,8,52000
It was a chest cold.,cold,cold,It was a cold chest., chest cold, cold chest,chest,False,-18.157339096069336,-15.948127746582031,-2.2092113494873047,14067712,EleutherAI/pythia-14m,step52000,seed8,8,52000
It was a gossip column.,column,column,It was a column gossip., gossip column, column gossip,gossip,True,-17.75208282470703,-22.96160125732422,5.2095184326171875,14067712,EleutherAI/pythia-14m,step52000,seed8,8,52000
It was a sports column.,column,column,It was a column sports., sports column, column sports,sports,True,-20.217498779296875,-23.788042068481445,3.5705432891845703,14067712,EleutherAI/pythia-14m,step52000,seed8,8,52000
It was a concrete column.,column,column,It was a column concrete., concrete column, column concrete,concrete,False,-19.045791625976562,-21.343074798583984,2.297283172607422,14067712,EleutherAI/pythia-14m,step52000,seed8,8,52000
He liked the investment company.,company,company,He liked the company investment., investment company, company investment,investment,True,-12.408236503601074,-17.43255615234375,5.024319648742676,14067712,EleutherAI/pythia-14m,step52000,seed8,8,52000
He liked the pharmaceutical company.,company,company,He liked the company pharmaceutical., pharmaceutical company, company pharmaceutical,pharmaceutical,False,-13.18210506439209,-21.157550811767578,7.975445747375488,14067712,EleutherAI/pythia-14m,step52000,seed8,8,52000
He liked the pleasant company.,company,company,He liked the company pleasant., pleasant company, company pleasant,pleasant,False,-19.94550895690918,-20.064285278320312,0.11877632141113281,14067712,EleutherAI/pythia-14m,step52000,seed8,8,52000
It was a waffle cone.,cone,cone,It was a cone waffle., waffle cone, cone waffle,waffle,True,-26.715761184692383,-29.494680404663086,2.778919219970703,14067712,EleutherAI/pythia-14m,step52000,seed8,8,52000
It was a sugar cone.,cone,cone,It was a cone sugar., sugar cone, cone sugar,sugar,True,-20.81667137145996,-23.306598663330078,2.489927291870117,14067712,EleutherAI/pythia-14m,step52000,seed8,8,52000
It was an orange cone.,cone,cone,It was an cone orange., orange cone, cone orange,orange,False,-15.062480926513672,-25.469554901123047,10.407073974609375,14067712,EleutherAI/pythia-14m,step52000,seed8,8,52000
He made a charitable contribution.,contribution,contribution,He made a contribution charitable., charitable contribution, contribution charitable,charitable,False,-14.84610366821289,-21.16388702392578,6.317783355712891,14067712,EleutherAI/pythia-14m,step52000,seed8,8,52000
He made a voluntary contribution.,contribution,contribution,He made a contribution voluntary., voluntary contribution, contribution voluntary,voluntary,False,-17.3858699798584,-21.942657470703125,4.556787490844727,14067712,EleutherAI/pythia-14m,step52000,seed8,8,52000
He made a scholarly contribution.,contribution,contribution,He made a contribution scholarly., scholarly contribution, contribution scholarly,scholarly,False,-15.77529239654541,-21.153274536132812,5.377982139587402,14067712,EleutherAI/pythia-14m,step52000,seed8,8,52000
That was the noble count.,count,count,That was the count noble., noble count, count noble,noble,False,-18.956327438354492,-22.71363067626953,3.757303237915039,14067712,EleutherAI/pythia-14m,step52000,seed8,8,52000
That was the vengeful count.,count,count,That was the count vengeful., vengeful count, count vengeful,vengeful,False,-25.386211395263672,-24.981597900390625,-0.4046134948730469,14067712,EleutherAI/pythia-14m,step52000,seed8,8,52000
That was the final count.,count,count,That was the count final., final count, count final,final,False,-13.801368713378906,-20.045547485351562,6.244178771972656,14067712,EleutherAI/pythia-14m,step52000,seed8,8,52000
It was an introductory course.,course,course,It was an course introductory., introductory course, course introductory,introductory,False,-12.029828071594238,-24.79513931274414,12.765311241149902,14067712,EleutherAI/pythia-14m,step52000,seed8,8,52000
It was a pass-fail course.,course,course,It was a course pass-fail., pass-fail course, course pass-fail,pass-fail,False,-27.449901580810547,-33.12638854980469,5.676486968994141,14067712,EleutherAI/pythia-14m,step52000,seed8,8,52000
It was a charted course.,course,course,It was a course charted., charted course, course charted,charted,False,-22.63744354248047,-22.097780227661133,-0.5396633148193359,14067712,EleutherAI/pythia-14m,step52000,seed8,8,52000
It was a dinner date.,date,date,It was a date dinner., dinner date, date dinner,dinner,True,-17.228113174438477,-17.468063354492188,0.23995018005371094,14067712,EleutherAI/pythia-14m,step52000,seed8,8,52000
It was a blind date.,date,date,It was a date blind., blind date, date blind,blind,False,-16.655590057373047,-19.333206176757812,2.6776161193847656,14067712,EleutherAI/pythia-14m,step52000,seed8,8,52000
It was an expiration date.,date,date,It was an date expiration., expiration date, date expiration,expiration,True,-10.356795310974121,-19.932796478271484,9.576001167297363,14067712,EleutherAI/pythia-14m,step52000,seed8,8,52000
It was about forty degrees.,degree,degrees,It was about degrees forty., forty degrees, degrees forty,forty,True,-12.361705780029297,-21.793107986450195,9.431402206420898,14067712,EleutherAI/pythia-14m,step52000,seed8,8,52000
It was about fifty degrees.,degree,degrees,It was about degrees fifty., fifty degrees, degrees fifty,fifty,True,-12.290260314941406,-21.370458602905273,9.080198287963867,14067712,EleutherAI/pythia-14m,step52000,seed8,8,52000
It was about associate degrees.,degree,degrees,It was about degrees associate., associate degrees, degrees associate,associate,False,-20.917573928833008,-23.76797866821289,2.850404739379883,14067712,EleutherAI/pythia-14m,step52000,seed8,8,52000
They liked the floral design.,design,design,They liked the design floral., floral design, design floral,floral,False,-16.401935577392578,-20.67441177368164,4.2724761962890625,14067712,EleutherAI/pythia-14m,step52000,seed8,8,52000
They liked the geometric design.,design,design,They liked the design geometric., geometric design, design geometric,geometric,False,-17.549583435058594,-21.930580139160156,4.3809967041015625,14067712,EleutherAI/pythia-14m,step52000,seed8,8,52000
They liked the product design.,design,design,They liked the design product., product design, design product,product,True,-14.907432556152344,-15.664871215820312,0.7574386596679688,14067712,EleutherAI/pythia-14m,step52000,seed8,8,52000
They liked the turkey dinner.,dinner,dinner,They liked the dinner turkey., turkey dinner, dinner turkey,turkey,True,-19.927644729614258,-18.544361114501953,-1.3832836151123047,14067712,EleutherAI/pythia-14m,step52000,seed8,8,52000
They liked the light dinner.,dinner,dinner,They liked the dinner light., light dinner, dinner light,light,False,-19.157466888427734,-18.094703674316406,-1.0627632141113281,14067712,EleutherAI/pythia-14m,step52000,seed8,8,52000
They liked the formal dinner.,dinner,dinner,They liked the dinner formal., formal dinner, dinner formal,formal,False,-17.056835174560547,-20.968154907226562,3.9113197326660156,14067712,EleutherAI/pythia-14m,step52000,seed8,8,52000
He had a recurring dream.,dream,dream,He had a dream recurring., recurring dream, dream recurring,recurring,False,-14.723041534423828,-19.44834327697754,4.725301742553711,14067712,EleutherAI/pythia-14m,step52000,seed8,8,52000
He had a bad dream.,dream,dream,He had a dream bad., bad dream, dream bad,bad,False,-12.127730369567871,-15.706474304199219,3.5787439346313477,14067712,EleutherAI/pythia-14m,step52000,seed8,8,52000
He had a childhood dream.,dream,dream,He had a dream childhood., childhood dream, dream childhood,childhood,True,-13.154492378234863,-17.052452087402344,3.8979597091674805,14067712,EleutherAI/pythia-14m,step52000,seed8,8,52000
It was a grueling drill.,drill,drill,It was a drill grueling., grueling drill, drill grueling,grueling,False,-20.912124633789062,-26.08759307861328,5.175468444824219,14067712,EleutherAI/pythia-14m,step52000,seed8,8,52000
It was a challenging drill.,drill,drill,It was a drill challenging., challenging drill, drill challenging,challenging,False,-20.96262550354004,-22.965988159179688,2.0033626556396484,14067712,EleutherAI/pythia-14m,step52000,seed8,8,52000
It was an electric drill.,drill,drill,It was an drill electric., electric drill, drill electric,electric,False,-18.56247329711914,-26.27841567993164,7.7159423828125,14067712,EleutherAI/pythia-14m,step52000,seed8,8,52000
It was a multiple-choice examination.,examination,examination,It was an examination multiple-choice., multiple-choice examination, examination multiple-choice,multiple-choice,False,-27.95960807800293,-30.92253875732422,2.962930679321289,14067712,EleutherAI/pythia-14m,step52000,seed8,8,52000
It was a difficult examination.,examination,examination,It was an examination difficult., difficult examination, examination difficult,difficult,False,-17.799091339111328,-19.107078552246094,1.3079872131347656,14067712,EleutherAI/pythia-14m,step52000,seed8,8,52000
It was a prostate examination.,examination,examination,It was an examination prostate., prostate examination, examination prostate,prostate,True,-20.42200469970703,-21.234371185302734,0.8123664855957031,14067712,EleutherAI/pythia-14m,step52000,seed8,8,52000
They had an electric fan.,fan,fan,They had an fan electric., electric fan, fan electric,electric,False,-13.857595443725586,-27.015323638916016,13.15772819519043,14067712,EleutherAI/pythia-14m,step52000,seed8,8,52000
They had a ceiling fan.,fan,fan,They had a fan ceiling., ceiling fan, fan ceiling,ceiling,True,-18.2849063873291,-21.801898956298828,3.5169925689697266,14067712,EleutherAI/pythia-14m,step52000,seed8,8,52000
They had a zealous fan.,fan,fan,They had a fan zealous., zealous fan, fan zealous,zealous,False,-15.817377090454102,-22.87138557434082,7.054008483886719,14067712,EleutherAI/pythia-14m,step52000,seed8,8,52000
She had a text file.,file,file,She had a file text., text file, file text,text,True,-15.064878463745117,-19.794837951660156,4.729959487915039,14067712,EleutherAI/pythia-14m,step52000,seed8,8,52000
She had a data file.,file,file,She had a file data., data file, file data,data,True,-16.934307098388672,-20.211044311523438,3.2767372131347656,14067712,EleutherAI/pythia-14m,step52000,seed8,8,52000
She had a nail file.,file,file,She had a file nail., nail file, file nail,nail,True,-22.922378540039062,-25.26767349243164,2.345294952392578,14067712,EleutherAI/pythia-14m,step52000,seed8,8,52000
It was an action film.,film,film,It was an film action., action film, film action,action,True,-15.477252960205078,-17.378456115722656,1.9012031555175781,14067712,EleutherAI/pythia-14m,step52000,seed8,8,52000
It was a censored film.,film,film,It was a film censored., censored film, film censored,censored,False,-19.669471740722656,-19.959800720214844,0.2903289794921875,14067712,EleutherAI/pythia-14m,step52000,seed8,8,52000
It was a transparent film.,film,film,It was a film transparent., transparent film, film transparent,transparent,False,-15.699701309204102,-20.779617309570312,5.079916000366211,14067712,EleutherAI/pythia-14m,step52000,seed8,8,52000
It was a charitable foundation.,foundation,foundation,It was a foundation charitable., charitable foundation, foundation charitable,charitable,False,-13.456853866577148,-21.732112884521484,8.275259017944336,14067712,EleutherAI/pythia-14m,step52000,seed8,8,52000
It was an educational foundation.,foundation,foundation,It was an foundation educational., educational foundation, foundation educational,educational,False,-14.334124565124512,-24.314315795898438,9.980191230773926,14067712,EleutherAI/pythia-14m,step52000,seed8,8,52000
It was a wooden foundation.,foundation,foundation,It was a foundation wooden., wooden foundation, foundation wooden,wooden,False,-16.809999465942383,-21.001619338989258,4.191619873046875,14067712,EleutherAI/pythia-14m,step52000,seed8,8,52000
It was a mathematical function.,function,function,It was a function mathematical., mathematical function, function mathematical,mathematical,False,-15.502714157104492,-17.591411590576172,2.0886974334716797,14067712,EleutherAI/pythia-14m,step52000,seed8,8,52000
It was a linear function.,function,function,It was a function linear., linear function, function linear,linear,False,-15.11264419555664,-18.641109466552734,3.5284652709960938,14067712,EleutherAI/pythia-14m,step52000,seed8,8,52000
