sentence,word,string,reversed_sentence,mod_np,reversed_mod,disambiguating_word,non_adjective,original_logprob,reversed_logprob,ratio,n_params,mpath,revision,seed_name,seed,step
It was a linear function.,function,function,It was a function linear., linear function, function linear,linear,False,-13.74582576751709,-19.501605987548828,5.755780220031738,14067712,EleutherAI/pythia-14m,step121000,seed6,6,121000
It was a social function.,function,function,It was a function social., social function, function social,social,False,-14.438961029052734,-19.438129425048828,4.999168395996094,14067712,EleutherAI/pythia-14m,step121000,seed6,6,121000
He was on the firm ground.,ground,ground,He was on the ground firm., firm ground, ground firm,firm,False,-17.28122901916504,-15.763450622558594,-1.5177783966064453,14067712,EleutherAI/pythia-14m,step121000,seed6,6,121000
He was on the frozen ground.,ground,ground,He was on the ground frozen., frozen ground, ground frozen,frozen,False,-15.088232040405273,-17.503196716308594,2.4149646759033203,14067712,EleutherAI/pythia-14m,step121000,seed6,6,121000
He was on the camp ground.,ground,ground,He was on the ground camp., camp ground, ground camp,camp,True,-15.282376289367676,-13.028343200683594,-2.254033088684082,14067712,EleutherAI/pythia-14m,step121000,seed6,6,121000
They liked the night guard.,guard,guard,They liked the guard night., night guard, guard night,night,True,-16.070964813232422,-18.35439682006836,2.2834320068359375,14067712,EleutherAI/pythia-14m,step121000,seed6,6,121000
They liked the security guard.,guard,guard,They liked the guard security., security guard, guard security,security,True,-16.24692726135254,-20.04384994506836,3.7969226837158203,14067712,EleutherAI/pythia-14m,step121000,seed6,6,121000
They liked the coast guard.,guard,guard,They liked the guard coast., coast guard, guard coast,coast,True,-18.303369522094727,-21.76992416381836,3.466554641723633,14067712,EleutherAI/pythia-14m,step121000,seed6,6,121000
He had an assembly guide.,guide,guide,He had an guide assembly., assembly guide, guide assembly,assembly,True,-18.546215057373047,-23.543121337890625,4.996906280517578,14067712,EleutherAI/pythia-14m,step121000,seed6,6,121000
He had a TV guide.,guide,guide,He had a guide TV., TV guide, guide TV,TV,True,-19.45242691040039,-20.297874450683594,0.8454475402832031,14067712,EleutherAI/pythia-14m,step121000,seed6,6,121000
He had a talkative guide.,guide,guide,He had a guide talkative., talkative guide, guide talkative,talkative,False,-22.70331573486328,-28.440616607666016,5.737300872802734,14067712,EleutherAI/pythia-14m,step121000,seed6,6,121000
It was a summer home.,home,home,It was a home summer., summer home, home summer,summer,True,-14.586200714111328,-16.886777877807617,2.300577163696289,14067712,EleutherAI/pythia-14m,step121000,seed6,6,121000
It was a childhood home.,home,home,It was a home childhood., childhood home, home childhood,childhood,True,-15.61526870727539,-18.262022018432617,2.6467533111572266,14067712,EleutherAI/pythia-14m,step121000,seed6,6,121000
It was a funeral home.,home,home,It was a home funeral., funeral home, home funeral,funeral,False,-14.527556419372559,-17.267637252807617,2.7400808334350586,14067712,EleutherAI/pythia-14m,step121000,seed6,6,121000
They had natural intelligence.,intelligence,intelligence,They had intelligence natural., natural intelligence, intelligence natural,natural,False,-17.8748779296875,-23.250953674316406,5.376075744628906,14067712,EleutherAI/pythia-14m,step121000,seed6,6,121000
They had innate intelligence.,intelligence,intelligence,They had intelligence innate., innate intelligence, intelligence innate,innate,False,-18.595247268676758,-24.563697814941406,5.968450546264648,14067712,EleutherAI/pythia-14m,step121000,seed6,6,121000
They had classified intelligence.,intelligence,intelligence,They had intelligence classified., classified intelligence, intelligence classified,classified,False,-18.3900146484375,-21.382057189941406,2.9920425415039062,14067712,EleutherAI/pythia-14m,step121000,seed6,6,121000
It was a sensitive issue.,issue,issue,It was an issue sensitive., sensitive issue, issue sensitive,sensitive,False,-15.889066696166992,-17.153287887573242,1.26422119140625,14067712,EleutherAI/pythia-14m,step121000,seed6,6,121000
It was a political issue.,issue,issue,It was an issue political., political issue, issue political,political,False,-12.31660270690918,-16.819547653198242,4.5029449462890625,14067712,EleutherAI/pythia-14m,step121000,seed6,6,121000
It was a weekly issue.,issue,issue,It was an issue weekly., weekly issue, issue weekly,weekly,False,-17.152158737182617,-19.152067184448242,1.999908447265625,14067712,EleutherAI/pythia-14m,step121000,seed6,6,121000
It was a blackberry jam.,jam,jam,It was a jam blackberry., blackberry jam, jam blackberry,blackberry,True,-21.779640197753906,-26.985504150390625,5.205863952636719,14067712,EleutherAI/pythia-14m,step121000,seed6,6,121000
It was a peach jam.,jam,jam,It was a jam peach., peach jam, jam peach,peach,False,-22.476144790649414,-24.267866134643555,1.7917213439941406,14067712,EleutherAI/pythia-14m,step121000,seed6,6,121000
It was a traffic jam.,jam,jam,It was a jam traffic., traffic jam, jam traffic,traffic,True,-18.133220672607422,-22.568099975585938,4.434879302978516,14067712,EleutherAI/pythia-14m,step121000,seed6,6,121000
It was a duplicate key.,key,key,It was a key duplicate., duplicate key, key duplicate,duplicate,False,-19.662376403808594,-19.475927352905273,-0.1864490509033203,14067712,EleutherAI/pythia-14m,step121000,seed6,6,121000
It was a master key.,key,key,It was a key master., master key, key master,master,True,-17.148401260375977,-17.418554306030273,0.2701530456542969,14067712,EleutherAI/pythia-14m,step121000,seed6,6,121000
It was a delete key.,key,key,It was a key delete., delete key, key delete,delete,False,-19.910858154296875,-20.797460556030273,0.8866024017333984,14067712,EleutherAI/pythia-14m,step121000,seed6,6,121000
They liked the marinated lamb.,lamb,lamb,They liked the lamb marinated., marinated lamb, lamb marinated,marinated,True,-26.642013549804688,-29.513303756713867,2.8712902069091797,14067712,EleutherAI/pythia-14m,step121000,seed6,6,121000
They liked the grilled lamb.,lamb,lamb,They liked the lamb grilled., grilled lamb, lamb grilled,grilled,False,-17.92896270751953,-23.196598052978516,5.267635345458984,14067712,EleutherAI/pythia-14m,step121000,seed6,6,121000
They liked the cute lamb.,lamb,lamb,They liked the lamb cute., cute lamb, lamb cute,cute,False,-19.06368637084961,-22.161685943603516,3.0979995727539062,14067712,EleutherAI/pythia-14m,step121000,seed6,6,121000
She had curly locks.,lock,locks,She had locks curly., curly locks, locks curly,curly,False,-20.64529800415039,-23.991600036621094,3.346302032470703,14067712,EleutherAI/pythia-14m,step121000,seed6,6,121000
She had brown locks.,lock,locks,She had locks brown., brown locks, locks brown,brown,False,-21.750890731811523,-22.535301208496094,0.7844104766845703,14067712,EleutherAI/pythia-14m,step121000,seed6,6,121000
She had window locks.,lock,locks,She had locks window., window locks, locks window,window,True,-20.33360481262207,-21.597068786621094,1.2634639739990234,14067712,EleutherAI/pythia-14m,step121000,seed6,6,121000
They liked the hot lunch.,lunch,lunch,They liked the lunch hot., hot lunch, lunch hot,hot,False,-15.061386108398438,-18.556686401367188,3.49530029296875,14067712,EleutherAI/pythia-14m,step121000,seed6,6,121000
They liked the sandwich lunch.,lunch,lunch,They liked the lunch sandwich., sandwich lunch, lunch sandwich,sandwich,True,-18.080867767333984,-17.818405151367188,-0.2624626159667969,14067712,EleutherAI/pythia-14m,step121000,seed6,6,121000
They liked the afternoon lunch.,lunch,lunch,They liked the lunch afternoon., afternoon lunch, lunch afternoon,afternoon,True,-15.250581741333008,-17.340866088867188,2.0902843475341797,14067712,EleutherAI/pythia-14m,step121000,seed6,6,121000
He liked the flea market.,market,market,He liked the market flea., flea market, market flea,flea,True,-23.871929168701172,-25.05377960205078,1.1818504333496094,14067712,EleutherAI/pythia-14m,step121000,seed6,6,121000
He liked the fish market.,market,market,He liked the market fish., fish market, market fish,fish,True,-17.421382904052734,-21.236305236816406,3.814922332763672,14067712,EleutherAI/pythia-14m,step121000,seed6,6,121000
He liked the housing market.,market,market,He liked the market housing., housing market, market housing,housing,True,-15.952179908752441,-19.270729064941406,3.318549156188965,14067712,EleutherAI/pythia-14m,step121000,seed6,6,121000
It was a lit match.,match,match,It was a match lit., lit match, match lit,lit,False,-22.924673080444336,-20.16207504272461,-2.7625980377197266,14067712,EleutherAI/pythia-14m,step121000,seed6,6,121000
It was a burning match.,match,match,It was a match burning., burning match, match burning,burning,False,-20.67147445678711,-22.01119613647461,1.3397216796875,14067712,EleutherAI/pythia-14m,step121000,seed6,6,121000
It was a soccer match.,match,match,It was a match soccer., soccer match, match soccer,soccer,True,-15.189691543579102,-21.49410629272461,6.304414749145508,14067712,EleutherAI/pythia-14m,step121000,seed6,6,121000
It was cough medicine.,medicine,medicine,It was medicine cough., cough medicine, medicine cough,cough,True,-23.715068817138672,-26.047727584838867,2.3326587677001953,14067712,EleutherAI/pythia-14m,step121000,seed6,6,121000
It was prescription medicine.,medicine,medicine,It was medicine prescription., prescription medicine, medicine prescription,prescription,True,-20.06587028503418,-23.603635787963867,3.5377655029296875,14067712,EleutherAI/pythia-14m,step121000,seed6,6,121000
It was orthopedic medicine.,medicine,medicine,It was medicine orthopedic., orthopedic medicine, medicine orthopedic,orthopedic,False,-23.882041931152344,-27.309492111206055,3.427450180053711,14067712,EleutherAI/pythia-14m,step121000,seed6,6,121000
There was a phone message.,message,message,There was a message phone., phone message, message phone,phone,True,-15.423206329345703,-20.220211029052734,4.797004699707031,14067712,EleutherAI/pythia-14m,step121000,seed6,6,121000
There was a computer message.,message,message,There was a message computer., computer message, message computer,computer,True,-18.175416946411133,-21.247066497802734,3.0716495513916016,14067712,EleutherAI/pythia-14m,step121000,seed6,6,121000
There was an urgent message.,message,message,There was an message urgent., urgent message, message urgent,urgent,False,-15.45397663116455,-23.081552505493164,7.627575874328613,14067712,EleutherAI/pythia-14m,step121000,seed6,6,121000
It was a fungal mold.,mold,mold,It was a mold fungal., fungal mold, mold fungal,fungal,False,-21.79883575439453,-23.419734954833984,1.6208992004394531,14067712,EleutherAI/pythia-14m,step121000,seed6,6,121000
It was a harmful mold.,mold,mold,It was a mold harmful., harmful mold, mold harmful,harmful,False,-22.405975341796875,-22.533016204833984,0.12704086303710938,14067712,EleutherAI/pythia-14m,step121000,seed6,6,121000
It was a rubber mold.,mold,mold,It was a mold rubber., rubber mold, mold rubber,rubber,True,-19.014543533325195,-22.113826751708984,3.099283218383789,14067712,EleutherAI/pythia-14m,step121000,seed6,6,121000
She saw the cancerous mole.,mole,mole,She saw the mole cancerous., cancerous mole, mole cancerous,cancerous,False,-24.4649658203125,-28.169755935668945,3.7047901153564453,14067712,EleutherAI/pythia-14m,step121000,seed6,6,121000
She saw the raised mole.,mole,mole,She saw the mole raised., raised mole, mole raised,raised,False,-23.017417907714844,-19.955350875854492,-3.0620670318603516,14067712,EleutherAI/pythia-14m,step121000,seed6,6,121000
She saw the cute mole.,mole,mole,She saw the mole cute., cute mole, mole cute,cute,False,-21.202667236328125,-21.705106735229492,0.5024394989013672,14067712,EleutherAI/pythia-14m,step121000,seed6,6,121000
He liked the rhythmic movement.,movement,movement,He liked the movement rhythmic., rhythmic movement, movement rhythmic,rhythmic,False,-16.526411056518555,-22.731746673583984,6.20533561706543,14067712,EleutherAI/pythia-14m,step121000,seed6,6,121000
He liked the graceful movement.,movement,movement,He liked the movement graceful., graceful movement, movement graceful,graceful,False,-18.78106689453125,-22.821012496948242,4.039945602416992,14067712,EleutherAI/pythia-14m,step121000,seed6,6,121000
He liked the feminist movement.,movement,movement,He liked the movement feminist., feminist movement, movement feminist,feminist,True,-14.771574020385742,-22.358854293823242,7.5872802734375,14067712,EleutherAI/pythia-14m,step121000,seed6,6,121000
It was a national newspaper.,newspaper,newspaper,It was a newspaper national., national newspaper, newspaper national,national,False,-15.37652587890625,-20.59465789794922,5.218132019042969,14067712,EleutherAI/pythia-14m,step121000,seed6,6,121000
It was a daily newspaper.,newspaper,newspaper,It was a newspaper daily., daily newspaper, newspaper daily,daily,False,-16.504777908325195,-20.65837860107422,4.153600692749023,14067712,EleutherAI/pythia-14m,step121000,seed6,6,121000
It was a faded newspaper.,newspaper,newspaper,It was a newspaper faded., faded newspaper, newspaper faded,faded,False,-19.394418716430664,-22.42253875732422,3.0281200408935547,14067712,EleutherAI/pythia-14m,step121000,seed6,6,121000
It was a juicy orange.,orange,orange,It was an orange juicy., juicy orange, orange juicy,juicy,False,-21.697904586791992,-22.555023193359375,0.8571186065673828,14067712,EleutherAI/pythia-14m,step121000,seed6,6,121000
It was a ripe orange.,orange,orange,It was an orange ripe., ripe orange, orange ripe,ripe,False,-18.22460174560547,-17.984956741333008,-0.23964500427246094,14067712,EleutherAI/pythia-14m,step121000,seed6,6,121000
It was a bright orange.,orange,orange,It was an orange bright., bright orange, orange bright,bright,False,-13.242891311645508,-15.936616897583008,2.6937255859375,14067712,EleutherAI/pythia-14m,step121000,seed6,6,121000
He saw the young page.,page,page,He saw the page young., young page, page young,young,False,-17.028596878051758,-19.324872970581055,2.296276092529297,14067712,EleutherAI/pythia-14m,step121000,seed6,6,121000
He saw the loyal page.,page,page,He saw the page loyal., loyal page, page loyal,loyal,False,-22.406408309936523,-21.023359298706055,-1.3830490112304688,14067712,EleutherAI/pythia-14m,step121000,seed6,6,121000
He saw the blank page.,page,page,He saw the page blank., blank page, page blank,blank,False,-14.552988052368164,-17.114912033081055,2.5619239807128906,14067712,EleutherAI/pythia-14m,step121000,seed6,6,121000
It was a calloused palm.,palm,palm,It was a palm calloused., calloused palm, palm calloused,calloused,False,-31.221582412719727,-34.650169372558594,3.428586959838867,14067712,EleutherAI/pythia-14m,step121000,seed6,6,121000
It was a wrinkled palm.,palm,palm,It was a palm wrinkled., wrinkled palm, palm wrinkled,wrinkled,False,-21.942617416381836,-23.67567253112793,1.7330551147460938,14067712,EleutherAI/pythia-14m,step121000,seed6,6,121000
It was a tropical palm.,palm,palm,It was a palm tropical., tropical palm, palm tropical,tropical,False,-20.459896087646484,-23.442951202392578,2.9830551147460938,14067712,EleutherAI/pythia-14m,step121000,seed6,6,121000
It was a control panel.,panel,panel,It was a panel control., control panel, panel control,control,True,-17.022785186767578,-19.742237091064453,2.719451904296875,14067712,EleutherAI/pythia-14m,step121000,seed6,6,121000
It was an instrument panel.,panel,panel,It was an panel instrument., instrument panel, panel instrument,instrument,False,-17.307861328125,-23.78398895263672,6.476127624511719,14067712,EleutherAI/pythia-14m,step121000,seed6,6,121000
It was an advisory panel.,panel,panel,It was an panel advisory., advisory panel, panel advisory,advisory,False,-14.512205123901367,-23.93120574951172,9.419000625610352,14067712,EleutherAI/pythia-14m,step121000,seed6,6,121000
It was a secret passage.,passage,passage,It was a passage secret., secret passage, passage secret,secret,False,-15.610932350158691,-19.135459899902344,3.5245275497436523,14067712,EleutherAI/pythia-14m,step121000,seed6,6,121000
It was a narrow passage.,passage,passage,It was a passage narrow., narrow passage, passage narrow,narrow,False,-14.631486892700195,-19.200401306152344,4.568914413452148,14067712,EleutherAI/pythia-14m,step121000,seed6,6,121000
It was a literary passage.,passage,passage,It was a passage literary., literary passage, passage literary,literary,False,-18.2113037109375,-20.997764587402344,2.7864608764648438,14067712,EleutherAI/pythia-14m,step121000,seed6,6,121000
It was a tasty perch.,perch,perch,It was a perch tasty., tasty perch, perch tasty,tasty,False,-22.729915618896484,-24.15381622314453,1.4239006042480469,14067712,EleutherAI/pythia-14m,step121000,seed6,6,121000
It was a freshwater perch.,perch,perch,It was a perch freshwater., freshwater perch, perch freshwater,freshwater,True,-23.80864906311035,-25.56446075439453,1.7558116912841797,14067712,EleutherAI/pythia-14m,step121000,seed6,6,121000
It was a lofty perch.,perch,perch,It was a perch lofty., lofty perch, perch lofty,lofty,False,-24.572736740112305,-25.962364196777344,1.389627456665039,14067712,EleutherAI/pythia-14m,step121000,seed6,6,121000
He saw the fast pitcher.,pitcher,pitcher,He saw the pitcher fast., fast pitcher, pitcher fast,fast,False,-21.184080123901367,-19.494016647338867,-1.6900634765625,14067712,EleutherAI/pythia-14m,step121000,seed6,6,121000
He saw the right-handed pitcher.,pitcher,pitcher,He saw the pitcher right-handed., right-handed pitcher, pitcher right-handed,right-handed,False,-21.433908462524414,-23.229881286621094,1.7959728240966797,14067712,EleutherAI/pythia-14m,step121000,seed6,6,121000
He saw the glass pitcher.,pitcher,pitcher,He saw the pitcher glass., glass pitcher, pitcher glass,glass,True,-19.573184967041016,-21.610227584838867,2.0370426177978516,14067712,EleutherAI/pythia-14m,step121000,seed6,6,121000
It was a windy port.,port,port,It was a port windy., windy port, port windy,windy,False,-24.272647857666016,-27.83390998840332,3.5612621307373047,14067712,EleutherAI/pythia-14m,step121000,seed6,6,121000
It was a seaside port.,port,port,It was a port seaside., seaside port, port seaside,seaside,True,-19.77566146850586,-23.68313980102539,3.9074783325195312,14067712,EleutherAI/pythia-14m,step121000,seed6,6,121000
It was a delicious port.,port,port,It was a port delicious., delicious port, port delicious,delicious,False,-19.146255493164062,-22.893733978271484,3.747478485107422,14067712,EleutherAI/pythia-14m,step121000,seed6,6,121000
He was in a distinguished position.,position,position,He was in a position distinguished., distinguished position, position distinguished,distinguished,False,-14.486154556274414,-18.004106521606445,3.5179519653320312,14067712,EleutherAI/pythia-14m,step121000,seed6,6,121000
He was in a prominent position.,position,position,He was in a position prominent., prominent position, position prominent,prominent,False,-13.834709167480469,-18.454057693481445,4.619348526000977,14067712,EleutherAI/pythia-14m,step121000,seed6,6,121000
He was in a fetal position.,position,position,He was in a position fetal., fetal position, position fetal,fetal,False,-19.700050354003906,-19.988481521606445,0.28843116760253906,14067712,EleutherAI/pythia-14m,step121000,seed6,6,121000
It was a wooden post.,post,post,It was a post wooden., wooden post, post wooden,wooden,False,-18.759815216064453,-20.731016159057617,1.971200942993164,14067712,EleutherAI/pythia-14m,step121000,seed6,6,121000
It was a fence post.,post,post,It was a post fence., fence post, post fence,fence,True,-20.031461715698242,-21.061094284057617,1.029632568359375,14067712,EleutherAI/pythia-14m,step121000,seed6,6,121000
It was a teaching post.,post,post,It was a post teaching., teaching post, post teaching,teaching,True,-18.040634155273438,-18.263731002807617,0.2230968475341797,14067712,EleutherAI/pythia-14m,step121000,seed6,6,121000
He had the alcoholic punch.,punch,punch,He had the punch alcoholic., alcoholic punch, punch alcoholic,alcoholic,False,-21.855953216552734,-23.752952575683594,1.8969993591308594,14067712,EleutherAI/pythia-14m,step121000,seed6,6,121000
He had the fruit punch.,punch,punch,He had the punch fruit., fruit punch, punch fruit,fruit,True,-20.565975189208984,-22.010032653808594,1.4440574645996094,14067712,EleutherAI/pythia-14m,step121000,seed6,6,121000
He had the strongest punch.,punch,punch,He had the punch strongest., strongest punch, punch strongest,strongest,False,-16.89653205871582,-22.439476013183594,5.542943954467773,14067712,EleutherAI/pythia-14m,step121000,seed6,6,121000
She had a brilliant pupil.,pupil,pupil,She had a pupil brilliant., brilliant pupil, pupil brilliant,brilliant,False,-17.314958572387695,-22.74334716796875,5.428388595581055,14067712,EleutherAI/pythia-14m,step121000,seed6,6,121000
She had an interested pupil.,pupil,pupil,She had an pupil interested., interested pupil, pupil interested,interested,False,-19.518783569335938,-22.48806381225586,2.969280242919922,14067712,EleutherAI/pythia-14m,step121000,seed6,6,121000
She had a dilated pupil.,pupil,pupil,She had a pupil dilated., dilated pupil, pupil dilated,dilated,False,-19.559925079345703,-22.99090576171875,3.430980682373047,14067712,EleutherAI/pythia-14m,step121000,seed6,6,121000
That was a loud racket.,racket,racket,That was a racket loud., loud racket, racket loud,loud,False,-19.921363830566406,-23.216602325439453,3.295238494873047,14067712,EleutherAI/pythia-14m,step121000,seed6,6,121000
That was an annoying racket.,racket,racket,That was an racket annoying., annoying racket, racket annoying,annoying,False,-19.328567504882812,-26.27981185913086,6.951244354248047,14067712,EleutherAI/pythia-14m,step121000,seed6,6,121000
That was a badminton racket.,racket,racket,That was a racket badminton., badminton racket, racket badminton,badminton,True,-28.662187576293945,-30.861783981323242,2.199596405029297,14067712,EleutherAI/pythia-14m,step121000,seed6,6,121000
He liked electronic rock.,rock,rock,He liked rock electronic., electronic rock, rock electronic,electronic,False,-25.38546371459961,-22.28254508972168,-3.1029186248779297,14067712,EleutherAI/pythia-14m,step121000,seed6,6,121000
He liked alternative rock.,rock,rock,He liked rock alternative., alternative rock, rock alternative,alternative,False,-23.557762145996094,-23.85261344909668,0.29485130310058594,14067712,EleutherAI/pythia-14m,step121000,seed6,6,121000
He liked limestone rock.,rock,rock,He liked rock limestone., limestone rock, rock limestone,limestone,True,-24.24603271484375,-24.02790641784668,-0.2181262969970703,14067712,EleutherAI/pythia-14m,step121000,seed6,6,121000
He saw the wise sage.,sage,sage,He saw the sage wise., wise sage, sage wise,wise,False,-20.713497161865234,-20.267269134521484,-0.44622802734375,14067712,EleutherAI/pythia-14m,step121000,seed6,6,121000
He saw the renowned sage.,sage,sage,He saw the sage renowned., renowned sage, sage renowned,renowned,False,-21.137901306152344,-23.007991790771484,1.8700904846191406,14067712,EleutherAI/pythia-14m,step121000,seed6,6,121000
He saw the fragrant sage.,sage,sage,He saw the sage fragrant., fragrant sage, sage fragrant,fragrant,False,-23.97264862060547,-24.440608978271484,0.4679603576660156,14067712,EleutherAI/pythia-14m,step121000,seed6,6,121000
It was a fish scale.,scale,scale,It was a scale fish., fish scale, scale fish,fish,True,-20.217182159423828,-21.45705795288086,1.2398757934570312,14067712,EleutherAI/pythia-14m,step121000,seed6,6,121000
It was a lizard scale.,scale,scale,It was a scale lizard., lizard scale, scale lizard,lizard,True,-23.912181854248047,-23.971561431884766,0.05937957763671875,14067712,EleutherAI/pythia-14m,step121000,seed6,6,121000
It was a music scale.,scale,scale,It was a scale music., music scale, scale music,music,True,-18.298065185546875,-20.14382553100586,1.8457603454589844,14067712,EleutherAI/pythia-14m,step121000,seed6,6,121000
It was a touching scene.,scene,scene,It was a scene touching., touching scene, scene touching,touching,False,-15.138177871704102,-17.383800506591797,2.2456226348876953,14067712,EleutherAI/pythia-14m,step121000,seed6,6,121000
It was a well-acted scene.,scene,scene,It was a scene well-acted., well-acted scene, scene well-acted,well-acted,False,-22.827579498291016,-27.26708984375,4.439510345458984,14067712,EleutherAI/pythia-14m,step121000,seed6,6,121000
It was a nature scene.,scene,scene,It was a scene nature., nature scene, scene nature,nature,True,-15.469157218933105,-18.619640350341797,3.1504831314086914,14067712,EleutherAI/pythia-14m,step121000,seed6,6,121000
It was a gold seal.,seal,seal,It was a seal gold., gold seal, seal gold,gold,True,-16.45447540283203,-21.14944076538086,4.694965362548828,14067712,EleutherAI/pythia-14m,step121000,seed6,6,121000
It was a certified seal.,seal,seal,It was a seal certified., certified seal, seal certified,certified,False,-19.386253356933594,-19.93703842163086,0.5507850646972656,14067712,EleutherAI/pythia-14m,step121000,seed6,6,121000
It was a circus seal.,seal,seal,It was a seal circus., circus seal, seal circus,circus,True,-21.697181701660156,-21.95217514038086,0.2549934387207031,14067712,EleutherAI/pythia-14m,step121000,seed6,6,121000
He used the scotch tape.,tape,tape,He used the tape scotch., scotch tape, tape scotch,scotch,True,-20.79595947265625,-22.661161422729492,1.8652019500732422,14067712,EleutherAI/pythia-14m,step121000,seed6,6,121000
He used the double-sided tape.,tape,tape,He used the tape double-sided., double-sided tape, tape double-sided,double-sided,False,-20.252681732177734,-24.960384368896484,4.70770263671875,14067712,EleutherAI/pythia-14m,step121000,seed6,6,121000
