sentence,word,string,reversed_sentence,mod_np,reversed_mod,disambiguating_word,non_adjective,original_logprob,reversed_logprob,ratio,n_params,mpath,revision,seed_name,seed,step
It was a desperate act.,act,act,It was an act desperate., desperate act, act desperate,desperate,False,-14.136651992797852,-19.352861404418945,5.216209411621094,14067712,EleutherAI/pythia-14m,step121000,seed6,6,121000
It was a humane act.,act,act,It was an act humane., humane act, act humane,humane,False,-19.193645477294922,-19.839723587036133,0.6460781097412109,14067712,EleutherAI/pythia-14m,step121000,seed6,6,121000
It was a magic act.,act,act,It was an act magic., magic act, act magic,magic,False,-18.409202575683594,-19.682695388793945,1.2734928131103516,14067712,EleutherAI/pythia-14m,step121000,seed6,6,121000
He had a universal appeal.,appeal,appeal,He had an appeal universal., universal appeal, appeal universal,universal,False,-18.388763427734375,-20.000965118408203,1.6122016906738281,14067712,EleutherAI/pythia-14m,step121000,seed6,6,121000
He had an undefinable appeal.,appeal,appeal,He had an appeal undefinable., undefinable appeal, appeal undefinable,undefinable,False,-22.425106048583984,-23.99358558654785,1.5684795379638672,14067712,EleutherAI/pythia-14m,step121000,seed6,6,121000
He had a legal appeal.,appeal,appeal,He had an appeal legal., legal appeal, appeal legal,legal,False,-15.099074363708496,-17.270008087158203,2.170933723449707,14067712,EleutherAI/pythia-14m,step121000,seed6,6,121000
It was a tense atmosphere.,atmosphere,atmosphere,It was an atmosphere tense., tense atmosphere, atmosphere tense,tense,False,-16.474884033203125,-19.9720458984375,3.497161865234375,14067712,EleutherAI/pythia-14m,step121000,seed6,6,121000
It was a hostile atmosphere.,atmosphere,atmosphere,It was an atmosphere hostile., hostile atmosphere, atmosphere hostile,hostile,False,-15.870945930480957,-19.7388916015625,3.867945671081543,14067712,EleutherAI/pythia-14m,step121000,seed6,6,121000
It was a gaseous atmosphere.,atmosphere,atmosphere,It was an atmosphere gaseous., gaseous atmosphere, atmosphere gaseous,gaseous,False,-16.410560607910156,-22.1280517578125,5.717491149902344,14067712,EleutherAI/pythia-14m,step121000,seed6,6,121000
It was a gold band.,band,band,It was a band gold., gold band, band gold,gold,True,-16.50965118408203,-19.229888916015625,2.7202377319335938,14067712,EleutherAI/pythia-14m,step121000,seed6,6,121000
It was a rubber band.,band,band,It was a band rubber., rubber band, band rubber,rubber,True,-17.070207595825195,-22.298980712890625,5.22877311706543,14067712,EleutherAI/pythia-14m,step121000,seed6,6,121000
It was a jazz band.,band,band,It was a band jazz., jazz band, band jazz,jazz,True,-13.230511665344238,-18.838775634765625,5.608263969421387,14067712,EleutherAI/pythia-14m,step121000,seed6,6,121000
There was a police barrier.,barrier,barrier,There was a barrier police., police barrier, barrier police,police,True,-18.99609375,-20.756261825561523,1.7601680755615234,14067712,EleutherAI/pythia-14m,step121000,seed6,6,121000
There was a concrete barrier.,barrier,barrier,There was a barrier concrete., concrete barrier, barrier concrete,concrete,False,-14.716025352478027,-18.865880966186523,4.149855613708496,14067712,EleutherAI/pythia-14m,step121000,seed6,6,121000
There was a language barrier.,barrier,barrier,There was a barrier language., language barrier, barrier language,language,True,-22.052370071411133,-22.310705184936523,0.2583351135253906,14067712,EleutherAI/pythia-14m,step121000,seed6,6,121000
He saw a furry bat.,bat,bat,He saw a bat furry., furry bat, bat furry,furry,False,-20.226749420166016,-23.078853607177734,2.8521041870117188,14067712,EleutherAI/pythia-14m,step121000,seed6,6,121000
He saw a fruit bat.,bat,bat,He saw a bat fruit., fruit bat, bat fruit,fruit,True,-19.342525482177734,-21.50908660888672,2.1665611267089844,14067712,EleutherAI/pythia-14m,step121000,seed6,6,121000
He saw a wooden bat.,bat,bat,He saw a bat wooden., wooden bat, bat wooden,wooden,False,-16.071941375732422,-21.48955535888672,5.417613983154297,14067712,EleutherAI/pythia-14m,step121000,seed6,6,121000
He saw the laser beam.,beam,beam,He saw the beam laser., laser beam, beam laser,laser,True,-13.621631622314453,-18.667804718017578,5.046173095703125,14067712,EleutherAI/pythia-14m,step121000,seed6,6,121000
He saw the bright beam.,beam,beam,He saw the beam bright., bright beam, beam bright,bright,False,-16.435182571411133,-18.444904327392578,2.0097217559814453,14067712,EleutherAI/pythia-14m,step121000,seed6,6,121000
He saw the wood beam.,beam,beam,He saw the beam wood., wood beam, beam wood,wood,True,-17.305862426757812,-20.352863311767578,3.0470008850097656,14067712,EleutherAI/pythia-14m,step121000,seed6,6,121000
She had a toy block.,block,block,She had a block toy., toy block, block toy,toy,True,-16.939651489257812,-19.357669830322266,2.418018341064453,14067712,EleutherAI/pythia-14m,step121000,seed6,6,121000
She had a wooden block.,block,block,She had a block wooden., wooden block, block wooden,wooden,False,-14.000958442687988,-20.486331939697266,6.485373497009277,14067712,EleutherAI/pythia-14m,step121000,seed6,6,121000
She had a mental block.,block,block,She had a block mental., mental block, block mental,mental,False,-14.716907501220703,-20.577884674072266,5.8609771728515625,14067712,EleutherAI/pythia-14m,step121000,seed6,6,121000
He has coagulated blood.,blood,blood,He has blood coagulated., coagulated blood, blood coagulated,coagulated,True,-27.06444549560547,-25.085121154785156,-1.9793243408203125,14067712,EleutherAI/pythia-14m,step121000,seed6,6,121000
He has thin blood.,blood,blood,He has blood thin., thin blood, blood thin,thin,False,-18.467453002929688,-19.83041000366211,1.3629570007324219,14067712,EleutherAI/pythia-14m,step121000,seed6,6,121000
He has noble blood.,blood,blood,He has blood noble., noble blood, blood noble,noble,False,-19.1580867767334,-22.24422836303711,3.086141586303711,14067712,EleutherAI/pythia-14m,step121000,seed6,6,121000
It was the ironing board.,board,board,It was the board ironing., ironing board, board ironing,ironing,False,-24.44476890563965,-26.547746658325195,2.102977752685547,14067712,EleutherAI/pythia-14m,step121000,seed6,6,121000
It was the wooden board.,board,board,It was the board wooden., wooden board, board wooden,wooden,False,-16.44420623779297,-22.797487258911133,6.353281021118164,14067712,EleutherAI/pythia-14m,step121000,seed6,6,121000
It was the executive board.,board,board,It was the board executive., executive board, board executive,executive,True,-16.262283325195312,-18.460817337036133,2.1985340118408203,14067712,EleutherAI/pythia-14m,step121000,seed6,6,121000
He had a best-selling book.,book,book,He had a book best-selling., best-selling book, book best-selling,best-selling,False,-13.05777359008789,-22.124771118164062,9.066997528076172,14067712,EleutherAI/pythia-14m,step121000,seed6,6,121000
He had a popular book.,book,book,He had a book popular., popular book, book popular,popular,False,-14.454455375671387,-18.895545959472656,4.4410905838012695,14067712,EleutherAI/pythia-14m,step121000,seed6,6,121000
He had a heavy book.,book,book,He had a book heavy., heavy book, book heavy,heavy,False,-17.410110473632812,-19.225868225097656,1.8157577514648438,14067712,EleutherAI/pythia-14m,step121000,seed6,6,121000
They ate a pancake breakfast.,breakfast,breakfast,They ate a breakfast pancake., pancake breakfast, breakfast pancake,pancake,True,-16.671123504638672,-17.806873321533203,1.1357498168945312,14067712,EleutherAI/pythia-14m,step121000,seed6,6,121000
They ate a nutritious breakfast.,breakfast,breakfast,They ate a breakfast nutritious., nutritious breakfast, breakfast nutritious,nutritious,False,-20.112958908081055,-23.95819091796875,3.8452320098876953,14067712,EleutherAI/pythia-14m,step121000,seed6,6,121000
They ate a family breakfast.,breakfast,breakfast,They ate a breakfast family., family breakfast, breakfast family,family,True,-12.404058456420898,-14.765792846679688,2.361734390258789,14067712,EleutherAI/pythia-14m,step121000,seed6,6,121000
It was a red cape.,cape,cape,It was a cape red., red cape, cape red,red,False,-17.683258056640625,-22.069454193115234,4.386196136474609,14067712,EleutherAI/pythia-14m,step121000,seed6,6,121000
It was a flowing cape.,cape,cape,It was a cape flowing., flowing cape, cape flowing,flowing,False,-21.904390335083008,-22.927120208740234,1.0227298736572266,14067712,EleutherAI/pythia-14m,step121000,seed6,6,121000
It was a rocky cape.,cape,cape,It was a cape rocky., rocky cape, cape rocky,rocky,False,-24.081893920898438,-26.195430755615234,2.113536834716797,14067712,EleutherAI/pythia-14m,step121000,seed6,6,121000
It was a beer case.,case,case,It was a case beer., beer case, case beer,beer,True,-17.737335205078125,-18.592666625976562,0.8553314208984375,14067712,EleutherAI/pythia-14m,step121000,seed6,6,121000
It was a display case.,case,case,It was a case display., display case, case display,display,True,-16.217174530029297,-18.316055297851562,2.0988807678222656,14067712,EleutherAI/pythia-14m,step121000,seed6,6,121000
It was a divorce case.,case,case,It was a case divorce., divorce case, case divorce,divorce,True,-13.18891429901123,-18.456924438476562,5.268010139465332,14067712,EleutherAI/pythia-14m,step121000,seed6,6,121000
It was a worthy cause.,cause,cause,It was a cause worthy., worthy cause, cause worthy,worthy,False,-14.567329406738281,-18.21111297607422,3.6437835693359375,14067712,EleutherAI/pythia-14m,step121000,seed6,6,121000
It was a political cause.,cause,cause,It was a cause political., political cause, cause political,political,False,-15.70673942565918,-19.78557586669922,4.078836441040039,14067712,EleutherAI/pythia-14m,step121000,seed6,6,121000
It was a main cause.,cause,cause,It was a cause main., main cause, cause main,main,False,-15.161787033081055,-20.00090789794922,4.839120864868164,14067712,EleutherAI/pythia-14m,step121000,seed6,6,121000
It was a skin cell.,cell,cell,It was a cell skin., skin cell, cell skin,skin,True,-19.336442947387695,-18.363033294677734,-0.9734096527099609,14067712,EleutherAI/pythia-14m,step121000,seed6,6,121000
It was a brain cell.,cell,cell,It was a cell brain., brain cell, cell brain,brain,True,-16.804256439208984,-17.798091888427734,0.99383544921875,14067712,EleutherAI/pythia-14m,step121000,seed6,6,121000
It was a prison cell.,cell,cell,It was a cell prison., prison cell, cell prison,prison,True,-17.23713493347168,-19.976314544677734,2.7391796112060547,14067712,EleutherAI/pythia-14m,step121000,seed6,6,121000
She had a devilish charm.,charm,charm,She had a charm devilish., devilish charm, charm devilish,devilish,False,-20.369873046875,-26.551517486572266,6.181644439697266,14067712,EleutherAI/pythia-14m,step121000,seed6,6,121000
She had a natural charm.,charm,charm,She had a charm natural., natural charm, charm natural,natural,False,-14.792991638183594,-19.957120895385742,5.164129257202148,14067712,EleutherAI/pythia-14m,step121000,seed6,6,121000
She had a gold charm.,charm,charm,She had a charm gold., gold charm, charm gold,gold,True,-17.24359893798828,-19.599210739135742,2.355611801147461,14067712,EleutherAI/pythia-14m,step121000,seed6,6,121000
They liked the juicy chicken.,chicken,chicken,They liked the chicken juicy., juicy chicken, chicken juicy,juicy,False,-22.428897857666016,-23.607791900634766,1.17889404296875,14067712,EleutherAI/pythia-14m,step121000,seed6,6,121000
They liked the roasted chicken.,chicken,chicken,They liked the chicken roasted., roasted chicken, chicken roasted,roasted,False,-16.281005859375,-19.16785430908203,2.8868484497070312,14067712,EleutherAI/pythia-14m,step121000,seed6,6,121000
They liked the clucking chicken.,chicken,chicken,They liked the chicken clucking., clucking chicken, chicken clucking,clucking,True,-24.262903213500977,-22.581113815307617,-1.6817893981933594,14067712,EleutherAI/pythia-14m,step121000,seed6,6,121000
It was a perceptive class.,class,class,It was a class perceptive., perceptive class, class perceptive,perceptive,False,-19.619197845458984,-25.846220016479492,6.227022171020508,14067712,EleutherAI/pythia-14m,step121000,seed6,6,121000
It was a misbehaving class.,class,class,It was a class misbehaving., misbehaving class, class misbehaving,misbehaving,False,-23.854660034179688,-25.927391052246094,2.0727310180664062,14067712,EleutherAI/pythia-14m,step121000,seed6,6,121000
It was a boring class.,class,class,It was a class boring., boring class, class boring,boring,False,-16.57276153564453,-20.308448791503906,3.735687255859375,14067712,EleutherAI/pythia-14m,step121000,seed6,6,121000
It was a film clip.,clip,clip,It was a clip film., film clip, clip film,film,True,-17.285400390625,-18.061973571777344,0.7765731811523438,14067712,EleutherAI/pythia-14m,step121000,seed6,6,121000
It was a video clip.,clip,clip,It was a clip video., video clip, clip video,video,True,-15.888774871826172,-19.408897399902344,3.520122528076172,14067712,EleutherAI/pythia-14m,step121000,seed6,6,121000
It was a hair clip.,clip,clip,It was a clip hair., hair clip, clip hair,hair,True,-19.15945053100586,-22.321250915527344,3.1618003845214844,14067712,EleutherAI/pythia-14m,step121000,seed6,6,121000
It was an icy cold.,cold,cold,It was an cold icy., icy cold, cold icy,icy,False,-12.271280288696289,-19.494388580322266,7.223108291625977,14067712,EleutherAI/pythia-14m,step121000,seed6,6,121000
It was a freezing cold.,cold,cold,It was a cold freezing., freezing cold, cold freezing,freezing,False,-14.232032775878906,-16.111427307128906,1.87939453125,14067712,EleutherAI/pythia-14m,step121000,seed6,6,121000
It was a chest cold.,cold,cold,It was a cold chest., chest cold, cold chest,chest,False,-18.272565841674805,-16.113136291503906,-2.1594295501708984,14067712,EleutherAI/pythia-14m,step121000,seed6,6,121000
It was a gossip column.,column,column,It was a column gossip., gossip column, column gossip,gossip,True,-19.737060546875,-21.286029815673828,1.5489692687988281,14067712,EleutherAI/pythia-14m,step121000,seed6,6,121000
It was a sports column.,column,column,It was a column sports., sports column, column sports,sports,True,-21.037883758544922,-22.204242706298828,1.1663589477539062,14067712,EleutherAI/pythia-14m,step121000,seed6,6,121000
It was a concrete column.,column,column,It was a column concrete., concrete column, column concrete,concrete,False,-17.381298065185547,-20.646381378173828,3.2650833129882812,14067712,EleutherAI/pythia-14m,step121000,seed6,6,121000
He liked the investment company.,company,company,He liked the company investment., investment company, company investment,investment,True,-14.724270820617676,-18.082263946533203,3.3579931259155273,14067712,EleutherAI/pythia-14m,step121000,seed6,6,121000
He liked the pharmaceutical company.,company,company,He liked the company pharmaceutical., pharmaceutical company, company pharmaceutical,pharmaceutical,False,-15.191078186035156,-20.725818634033203,5.534740447998047,14067712,EleutherAI/pythia-14m,step121000,seed6,6,121000
He liked the pleasant company.,company,company,He liked the company pleasant., pleasant company, company pleasant,pleasant,False,-18.42620849609375,-19.015613555908203,0.5894050598144531,14067712,EleutherAI/pythia-14m,step121000,seed6,6,121000
It was a waffle cone.,cone,cone,It was a cone waffle., waffle cone, cone waffle,waffle,True,-25.553348541259766,-28.795673370361328,3.2423248291015625,14067712,EleutherAI/pythia-14m,step121000,seed6,6,121000
It was a sugar cone.,cone,cone,It was a cone sugar., sugar cone, cone sugar,sugar,True,-21.302047729492188,-24.41903305053711,3.116985321044922,14067712,EleutherAI/pythia-14m,step121000,seed6,6,121000
It was an orange cone.,cone,cone,It was an cone orange., orange cone, cone orange,orange,False,-16.427095413208008,-23.98426628112793,7.557170867919922,14067712,EleutherAI/pythia-14m,step121000,seed6,6,121000
He made a charitable contribution.,contribution,contribution,He made a contribution charitable., charitable contribution, contribution charitable,charitable,False,-16.236452102661133,-24.678943634033203,8.44249153137207,14067712,EleutherAI/pythia-14m,step121000,seed6,6,121000
He made a voluntary contribution.,contribution,contribution,He made a contribution voluntary., voluntary contribution, contribution voluntary,voluntary,False,-15.856748580932617,-22.525379180908203,6.668630599975586,14067712,EleutherAI/pythia-14m,step121000,seed6,6,121000
He made a scholarly contribution.,contribution,contribution,He made a contribution scholarly., scholarly contribution, contribution scholarly,scholarly,False,-20.48504066467285,-23.968006134033203,3.4829654693603516,14067712,EleutherAI/pythia-14m,step121000,seed6,6,121000
That was the noble count.,count,count,That was the count noble., noble count, count noble,noble,False,-19.16834259033203,-23.446535110473633,4.278192520141602,14067712,EleutherAI/pythia-14m,step121000,seed6,6,121000
That was the vengeful count.,count,count,That was the count vengeful., vengeful count, count vengeful,vengeful,False,-27.12232208251953,-30.999841690063477,3.8775196075439453,14067712,EleutherAI/pythia-14m,step121000,seed6,6,121000
That was the final count.,count,count,That was the count final., final count, count final,final,False,-12.852241516113281,-19.520021438598633,6.667779922485352,14067712,EleutherAI/pythia-14m,step121000,seed6,6,121000
It was an introductory course.,course,course,It was an course introductory., introductory course, course introductory,introductory,False,-13.226089477539062,-21.573692321777344,8.347602844238281,14067712,EleutherAI/pythia-14m,step121000,seed6,6,121000
It was a pass-fail course.,course,course,It was a course pass-fail., pass-fail course, course pass-fail,pass-fail,False,-30.192378997802734,-32.66290283203125,2.4705238342285156,14067712,EleutherAI/pythia-14m,step121000,seed6,6,121000
It was a charted course.,course,course,It was a course charted., charted course, course charted,charted,False,-25.05664825439453,-24.694904327392578,-0.3617439270019531,14067712,EleutherAI/pythia-14m,step121000,seed6,6,121000
It was a dinner date.,date,date,It was a date dinner., dinner date, date dinner,dinner,True,-18.165977478027344,-20.439319610595703,2.2733421325683594,14067712,EleutherAI/pythia-14m,step121000,seed6,6,121000
It was a blind date.,date,date,It was a date blind., blind date, date blind,blind,False,-19.121435165405273,-20.806262969970703,1.6848278045654297,14067712,EleutherAI/pythia-14m,step121000,seed6,6,121000
It was an expiration date.,date,date,It was an date expiration., expiration date, date expiration,expiration,True,-11.130281448364258,-23.40786361694336,12.277582168579102,14067712,EleutherAI/pythia-14m,step121000,seed6,6,121000
It was about forty degrees.,degree,degrees,It was about degrees forty., forty degrees, degrees forty,forty,True,-17.051403045654297,-23.525753021240234,6.4743499755859375,14067712,EleutherAI/pythia-14m,step121000,seed6,6,121000
It was about fifty degrees.,degree,degrees,It was about degrees fifty., fifty degrees, degrees fifty,fifty,True,-17.009326934814453,-23.273311614990234,6.263984680175781,14067712,EleutherAI/pythia-14m,step121000,seed6,6,121000
It was about associate degrees.,degree,degrees,It was about degrees associate., associate degrees, degrees associate,associate,False,-22.105897903442383,-24.534542083740234,2.4286441802978516,14067712,EleutherAI/pythia-14m,step121000,seed6,6,121000
They liked the floral design.,design,design,They liked the design floral., floral design, design floral,floral,False,-14.91867446899414,-20.096214294433594,5.177539825439453,14067712,EleutherAI/pythia-14m,step121000,seed6,6,121000
They liked the geometric design.,design,design,They liked the design geometric., geometric design, design geometric,geometric,False,-16.710031509399414,-20.106956481933594,3.3969249725341797,14067712,EleutherAI/pythia-14m,step121000,seed6,6,121000
They liked the product design.,design,design,They liked the design product., product design, design product,product,True,-16.09345245361328,-15.745628356933594,-0.3478240966796875,14067712,EleutherAI/pythia-14m,step121000,seed6,6,121000
They liked the turkey dinner.,dinner,dinner,They liked the dinner turkey., turkey dinner, dinner turkey,turkey,True,-17.201473236083984,-18.566173553466797,1.3647003173828125,14067712,EleutherAI/pythia-14m,step121000,seed6,6,121000
They liked the light dinner.,dinner,dinner,They liked the dinner light., light dinner, dinner light,light,False,-15.767040252685547,-17.164806365966797,1.39776611328125,14067712,EleutherAI/pythia-14m,step121000,seed6,6,121000
They liked the formal dinner.,dinner,dinner,They liked the dinner formal., formal dinner, dinner formal,formal,False,-18.609928131103516,-18.955333709716797,0.34540557861328125,14067712,EleutherAI/pythia-14m,step121000,seed6,6,121000
He had a recurring dream.,dream,dream,He had a dream recurring., recurring dream, dream recurring,recurring,False,-16.438182830810547,-21.17312240600586,4.7349395751953125,14067712,EleutherAI/pythia-14m,step121000,seed6,6,121000
He had a bad dream.,dream,dream,He had a dream bad., bad dream, dream bad,bad,False,-13.051668167114258,-17.18679428100586,4.135126113891602,14067712,EleutherAI/pythia-14m,step121000,seed6,6,121000
He had a childhood dream.,dream,dream,He had a dream childhood., childhood dream, dream childhood,childhood,True,-15.345918655395508,-15.938746452331543,0.5928277969360352,14067712,EleutherAI/pythia-14m,step121000,seed6,6,121000
It was a grueling drill.,drill,drill,It was a drill grueling., grueling drill, drill grueling,grueling,False,-25.04659652709961,-27.917638778686523,2.871042251586914,14067712,EleutherAI/pythia-14m,step121000,seed6,6,121000
It was a challenging drill.,drill,drill,It was a drill challenging., challenging drill, drill challenging,challenging,False,-19.255298614501953,-21.918827056884766,2.6635284423828125,14067712,EleutherAI/pythia-14m,step121000,seed6,6,121000
It was an electric drill.,drill,drill,It was an drill electric., electric drill, drill electric,electric,False,-19.096263885498047,-24.702638626098633,5.606374740600586,14067712,EleutherAI/pythia-14m,step121000,seed6,6,121000
It was a multiple-choice examination.,examination,examination,It was an examination multiple-choice., multiple-choice examination, examination multiple-choice,multiple-choice,False,-29.51150894165039,-32.749114990234375,3.2376060485839844,14067712,EleutherAI/pythia-14m,step121000,seed6,6,121000
It was a difficult examination.,examination,examination,It was an examination difficult., difficult examination, examination difficult,difficult,False,-15.111227989196777,-16.646289825439453,1.5350618362426758,14067712,EleutherAI/pythia-14m,step121000,seed6,6,121000
It was a prostate examination.,examination,examination,It was an examination prostate., prostate examination, examination prostate,prostate,True,-23.068817138671875,-23.482715606689453,0.4138984680175781,14067712,EleutherAI/pythia-14m,step121000,seed6,6,121000
They had an electric fan.,fan,fan,They had an fan electric., electric fan, fan electric,electric,False,-17.08967399597168,-23.251056671142578,6.161382675170898,14067712,EleutherAI/pythia-14m,step121000,seed6,6,121000
They had a ceiling fan.,fan,fan,They had a fan ceiling., ceiling fan, fan ceiling,ceiling,True,-18.73470687866211,-21.172603607177734,2.437896728515625,14067712,EleutherAI/pythia-14m,step121000,seed6,6,121000
They had a zealous fan.,fan,fan,They had a fan zealous., zealous fan, fan zealous,zealous,False,-21.7772159576416,-27.13633918762207,5.359123229980469,14067712,EleutherAI/pythia-14m,step121000,seed6,6,121000
She had a text file.,file,file,She had a file text., text file, file text,text,True,-13.167972564697266,-17.597801208496094,4.429828643798828,14067712,EleutherAI/pythia-14m,step121000,seed6,6,121000
She had a data file.,file,file,She had a file data., data file, file data,data,True,-13.023249626159668,-17.142967224121094,4.119717597961426,14067712,EleutherAI/pythia-14m,step121000,seed6,6,121000
She had a nail file.,file,file,She had a file nail., nail file, file nail,nail,True,-18.49687957763672,-21.710594177246094,3.213714599609375,14067712,EleutherAI/pythia-14m,step121000,seed6,6,121000
It was an action film.,film,film,It was an film action., action film, film action,action,True,-14.866964340209961,-15.30613899230957,0.4391746520996094,14067712,EleutherAI/pythia-14m,step121000,seed6,6,121000
It was a censored film.,film,film,It was a film censored., censored film, film censored,censored,False,-18.843149185180664,-20.77619743347168,1.9330482482910156,14067712,EleutherAI/pythia-14m,step121000,seed6,6,121000
It was a transparent film.,film,film,It was a film transparent., transparent film, film transparent,transparent,False,-15.087669372558594,-19.529541015625,4.441871643066406,14067712,EleutherAI/pythia-14m,step121000,seed6,6,121000
It was a charitable foundation.,foundation,foundation,It was a foundation charitable., charitable foundation, foundation charitable,charitable,False,-15.529413223266602,-20.734596252441406,5.205183029174805,14067712,EleutherAI/pythia-14m,step121000,seed6,6,121000
It was an educational foundation.,foundation,foundation,It was an foundation educational., educational foundation, foundation educational,educational,False,-15.396939277648926,-22.738582611083984,7.341643333435059,14067712,EleutherAI/pythia-14m,step121000,seed6,6,121000
It was a wooden foundation.,foundation,foundation,It was a foundation wooden., wooden foundation, foundation wooden,wooden,False,-17.033252716064453,-20.947731018066406,3.914478302001953,14067712,EleutherAI/pythia-14m,step121000,seed6,6,121000
It was a mathematical function.,function,function,It was a function mathematical., mathematical function, function mathematical,mathematical,False,-15.602974891662598,-20.038959503173828,4.4359846115112305,14067712,EleutherAI/pythia-14m,step121000,seed6,6,121000
