sentence,word,string,reversed_sentence,mod_np,reversed_mod,disambiguating_word,non_adjective,original_logprob,reversed_logprob,ratio,n_params,mpath,revision,seed_name,seed,step
It was a desperate act.,act,act,It was an act desperate., desperate act, act desperate,desperate,False,-14.898392677307129,-20.56658172607422,5.66818904876709,14067712,EleutherAI/pythia-14m,step90000,seed6,6,90000
It was a humane act.,act,act,It was an act humane., humane act, act humane,humane,False,-20.042369842529297,-21.268943786621094,1.2265739440917969,14067712,EleutherAI/pythia-14m,step90000,seed6,6,90000
It was a magic act.,act,act,It was an act magic., magic act, act magic,magic,False,-18.832653045654297,-20.77495574951172,1.9423027038574219,14067712,EleutherAI/pythia-14m,step90000,seed6,6,90000
He had a universal appeal.,appeal,appeal,He had an appeal universal., universal appeal, appeal universal,universal,False,-18.748046875,-20.53231430053711,1.7842674255371094,14067712,EleutherAI/pythia-14m,step90000,seed6,6,90000
He had an undefinable appeal.,appeal,appeal,He had an appeal undefinable., undefinable appeal, appeal undefinable,undefinable,False,-26.93472671508789,-29.235292434692383,2.300565719604492,14067712,EleutherAI/pythia-14m,step90000,seed6,6,90000
He had a legal appeal.,appeal,appeal,He had an appeal legal., legal appeal, appeal legal,legal,False,-14.247777938842773,-16.66268539428711,2.414907455444336,14067712,EleutherAI/pythia-14m,step90000,seed6,6,90000
It was a tense atmosphere.,atmosphere,atmosphere,It was an atmosphere tense., tense atmosphere, atmosphere tense,tense,False,-16.477489471435547,-19.500568389892578,3.0230789184570312,14067712,EleutherAI/pythia-14m,step90000,seed6,6,90000
It was a hostile atmosphere.,atmosphere,atmosphere,It was an atmosphere hostile., hostile atmosphere, atmosphere hostile,hostile,False,-15.969703674316406,-18.133502960205078,2.163799285888672,14067712,EleutherAI/pythia-14m,step90000,seed6,6,90000
It was a gaseous atmosphere.,atmosphere,atmosphere,It was an atmosphere gaseous., gaseous atmosphere, atmosphere gaseous,gaseous,False,-17.820940017700195,-20.361530303955078,2.540590286254883,14067712,EleutherAI/pythia-14m,step90000,seed6,6,90000
It was a gold band.,band,band,It was a band gold., gold band, band gold,gold,True,-15.507888793945312,-19.718860626220703,4.210971832275391,14067712,EleutherAI/pythia-14m,step90000,seed6,6,90000
It was a rubber band.,band,band,It was a band rubber., rubber band, band rubber,rubber,True,-15.663875579833984,-22.040760040283203,6.376884460449219,14067712,EleutherAI/pythia-14m,step90000,seed6,6,90000
It was a jazz band.,band,band,It was a band jazz., jazz band, band jazz,jazz,True,-12.77918815612793,-19.000965118408203,6.221776962280273,14067712,EleutherAI/pythia-14m,step90000,seed6,6,90000
There was a police barrier.,barrier,barrier,There was a barrier police., police barrier, barrier police,police,True,-18.774280548095703,-20.49390411376953,1.7196235656738281,14067712,EleutherAI/pythia-14m,step90000,seed6,6,90000
There was a concrete barrier.,barrier,barrier,There was a barrier concrete., concrete barrier, barrier concrete,concrete,False,-16.50656509399414,-20.41309356689453,3.9065284729003906,14067712,EleutherAI/pythia-14m,step90000,seed6,6,90000
There was a language barrier.,barrier,barrier,There was a barrier language., language barrier, barrier language,language,True,-22.27060890197754,-22.63904571533203,0.3684368133544922,14067712,EleutherAI/pythia-14m,step90000,seed6,6,90000
He saw a furry bat.,bat,bat,He saw a bat furry., furry bat, bat furry,furry,False,-18.394651412963867,-22.637374877929688,4.24272346496582,14067712,EleutherAI/pythia-14m,step90000,seed6,6,90000
He saw a fruit bat.,bat,bat,He saw a bat fruit., fruit bat, bat fruit,fruit,True,-18.895145416259766,-20.909412384033203,2.0142669677734375,14067712,EleutherAI/pythia-14m,step90000,seed6,6,90000
He saw a wooden bat.,bat,bat,He saw a bat wooden., wooden bat, bat wooden,wooden,False,-14.738265991210938,-20.371936798095703,5.633670806884766,14067712,EleutherAI/pythia-14m,step90000,seed6,6,90000
He saw the laser beam.,beam,beam,He saw the beam laser., laser beam, beam laser,laser,True,-13.870648384094238,-17.5003719329834,3.62972354888916,14067712,EleutherAI/pythia-14m,step90000,seed6,6,90000
He saw the bright beam.,beam,beam,He saw the beam bright., bright beam, beam bright,bright,False,-17.713865280151367,-18.9021053314209,1.1882400512695312,14067712,EleutherAI/pythia-14m,step90000,seed6,6,90000
He saw the wood beam.,beam,beam,He saw the beam wood., wood beam, beam wood,wood,True,-18.323101043701172,-21.0773983001709,2.7542972564697266,14067712,EleutherAI/pythia-14m,step90000,seed6,6,90000
She had a toy block.,block,block,She had a block toy., toy block, block toy,toy,True,-16.977100372314453,-20.892070770263672,3.9149703979492188,14067712,EleutherAI/pythia-14m,step90000,seed6,6,90000
She had a wooden block.,block,block,She had a block wooden., wooden block, block wooden,wooden,False,-13.773354530334473,-21.702251434326172,7.928896903991699,14067712,EleutherAI/pythia-14m,step90000,seed6,6,90000
She had a mental block.,block,block,She had a block mental., mental block, block mental,mental,False,-16.32610321044922,-22.627544403076172,6.301441192626953,14067712,EleutherAI/pythia-14m,step90000,seed6,6,90000
He has coagulated blood.,blood,blood,He has blood coagulated., coagulated blood, blood coagulated,coagulated,True,-28.73131561279297,-28.91849136352539,0.18717575073242188,14067712,EleutherAI/pythia-14m,step90000,seed6,6,90000
He has thin blood.,blood,blood,He has blood thin., thin blood, blood thin,thin,False,-18.05779266357422,-20.297861099243164,2.2400684356689453,14067712,EleutherAI/pythia-14m,step90000,seed6,6,90000
He has noble blood.,blood,blood,He has blood noble., noble blood, blood noble,noble,False,-18.334611892700195,-22.252084732055664,3.9174728393554688,14067712,EleutherAI/pythia-14m,step90000,seed6,6,90000
It was the ironing board.,board,board,It was the board ironing., ironing board, board ironing,ironing,False,-26.156736373901367,-27.209487915039062,1.0527515411376953,14067712,EleutherAI/pythia-14m,step90000,seed6,6,90000
It was the wooden board.,board,board,It was the board wooden., wooden board, board wooden,wooden,False,-15.83155345916748,-21.86347007751465,6.031916618347168,14067712,EleutherAI/pythia-14m,step90000,seed6,6,90000
It was the executive board.,board,board,It was the board executive., executive board, board executive,executive,True,-16.377422332763672,-17.67523765563965,1.2978153228759766,14067712,EleutherAI/pythia-14m,step90000,seed6,6,90000
He had a best-selling book.,book,book,He had a book best-selling., best-selling book, book best-selling,best-selling,False,-15.322729110717773,-22.676538467407227,7.353809356689453,14067712,EleutherAI/pythia-14m,step90000,seed6,6,90000
He had a popular book.,book,book,He had a book popular., popular book, book popular,popular,False,-14.847278594970703,-20.009281158447266,5.1620025634765625,14067712,EleutherAI/pythia-14m,step90000,seed6,6,90000
He had a heavy book.,book,book,He had a book heavy., heavy book, book heavy,heavy,False,-16.907690048217773,-18.861331939697266,1.9536418914794922,14067712,EleutherAI/pythia-14m,step90000,seed6,6,90000
They ate a pancake breakfast.,breakfast,breakfast,They ate a breakfast pancake., pancake breakfast, breakfast pancake,pancake,True,-17.6329288482666,-17.676223754882812,0.04329490661621094,14067712,EleutherAI/pythia-14m,step90000,seed6,6,90000
They ate a nutritious breakfast.,breakfast,breakfast,They ate a breakfast nutritious., nutritious breakfast, breakfast nutritious,nutritious,False,-17.971572875976562,-21.011133193969727,3.039560317993164,14067712,EleutherAI/pythia-14m,step90000,seed6,6,90000
They ate a family breakfast.,breakfast,breakfast,They ate a breakfast family., family breakfast, breakfast family,family,True,-13.207788467407227,-14.154278755187988,0.9464902877807617,14067712,EleutherAI/pythia-14m,step90000,seed6,6,90000
It was a red cape.,cape,cape,It was a cape red., red cape, cape red,red,False,-18.01971435546875,-22.933151245117188,4.9134368896484375,14067712,EleutherAI/pythia-14m,step90000,seed6,6,90000
It was a flowing cape.,cape,cape,It was a cape flowing., flowing cape, cape flowing,flowing,False,-22.972137451171875,-23.677658081054688,0.7055206298828125,14067712,EleutherAI/pythia-14m,step90000,seed6,6,90000
It was a rocky cape.,cape,cape,It was a cape rocky., rocky cape, cape rocky,rocky,False,-23.254966735839844,-27.306564331054688,4.051597595214844,14067712,EleutherAI/pythia-14m,step90000,seed6,6,90000
It was a beer case.,case,case,It was a case beer., beer case, case beer,beer,True,-18.129621505737305,-20.137889862060547,2.008268356323242,14067712,EleutherAI/pythia-14m,step90000,seed6,6,90000
It was a display case.,case,case,It was a case display., display case, case display,display,True,-17.557401657104492,-20.591136932373047,3.0337352752685547,14067712,EleutherAI/pythia-14m,step90000,seed6,6,90000
It was a divorce case.,case,case,It was a case divorce., divorce case, case divorce,divorce,True,-12.687568664550781,-20.641307830810547,7.953739166259766,14067712,EleutherAI/pythia-14m,step90000,seed6,6,90000
It was a worthy cause.,cause,cause,It was a cause worthy., worthy cause, cause worthy,worthy,False,-13.982585906982422,-18.668575286865234,4.6859893798828125,14067712,EleutherAI/pythia-14m,step90000,seed6,6,90000
It was a political cause.,cause,cause,It was a cause political., political cause, cause political,political,False,-15.993016242980957,-20.890865325927734,4.897849082946777,14067712,EleutherAI/pythia-14m,step90000,seed6,6,90000
It was a main cause.,cause,cause,It was a cause main., main cause, cause main,main,False,-15.125980377197266,-21.423458099365234,6.297477722167969,14067712,EleutherAI/pythia-14m,step90000,seed6,6,90000
It was a skin cell.,cell,cell,It was a cell skin., skin cell, cell skin,skin,True,-18.745141983032227,-18.11526870727539,-0.6298732757568359,14067712,EleutherAI/pythia-14m,step90000,seed6,6,90000
It was a brain cell.,cell,cell,It was a cell brain., brain cell, cell brain,brain,True,-15.554679870605469,-17.73514175415039,2.180461883544922,14067712,EleutherAI/pythia-14m,step90000,seed6,6,90000
It was a prison cell.,cell,cell,It was a cell prison., prison cell, cell prison,prison,True,-16.640426635742188,-18.88724136352539,2.246814727783203,14067712,EleutherAI/pythia-14m,step90000,seed6,6,90000
She had a devilish charm.,charm,charm,She had a charm devilish., devilish charm, charm devilish,devilish,False,-19.18268394470215,-25.34638023376465,6.1636962890625,14067712,EleutherAI/pythia-14m,step90000,seed6,6,90000
She had a natural charm.,charm,charm,She had a charm natural., natural charm, charm natural,natural,False,-14.649184226989746,-20.50564193725586,5.856457710266113,14067712,EleutherAI/pythia-14m,step90000,seed6,6,90000
She had a gold charm.,charm,charm,She had a charm gold., gold charm, charm gold,gold,True,-16.990371704101562,-19.19973373413086,2.209362030029297,14067712,EleutherAI/pythia-14m,step90000,seed6,6,90000
They liked the juicy chicken.,chicken,chicken,They liked the chicken juicy., juicy chicken, chicken juicy,juicy,False,-24.019315719604492,-25.1810302734375,1.1617145538330078,14067712,EleutherAI/pythia-14m,step90000,seed6,6,90000
They liked the roasted chicken.,chicken,chicken,They liked the chicken roasted., roasted chicken, chicken roasted,roasted,False,-15.587909698486328,-18.508831024169922,2.9209213256835938,14067712,EleutherAI/pythia-14m,step90000,seed6,6,90000
They liked the clucking chicken.,chicken,chicken,They liked the chicken clucking., clucking chicken, chicken clucking,clucking,True,-22.589759826660156,-21.25595474243164,-1.3338050842285156,14067712,EleutherAI/pythia-14m,step90000,seed6,6,90000
It was a perceptive class.,class,class,It was a class perceptive., perceptive class, class perceptive,perceptive,False,-19.355682373046875,-24.878040313720703,5.522357940673828,14067712,EleutherAI/pythia-14m,step90000,seed6,6,90000
It was a misbehaving class.,class,class,It was a class misbehaving., misbehaving class, class misbehaving,misbehaving,False,-22.971036911010742,-24.467472076416016,1.4964351654052734,14067712,EleutherAI/pythia-14m,step90000,seed6,6,90000
It was a boring class.,class,class,It was a class boring., boring class, class boring,boring,False,-16.586515426635742,-21.097469329833984,4.510953903198242,14067712,EleutherAI/pythia-14m,step90000,seed6,6,90000
It was a film clip.,clip,clip,It was a clip film., film clip, clip film,film,True,-17.634183883666992,-18.304729461669922,0.6705455780029297,14067712,EleutherAI/pythia-14m,step90000,seed6,6,90000
It was a video clip.,clip,clip,It was a clip video., video clip, clip video,video,True,-15.725016593933105,-19.113689422607422,3.3886728286743164,14067712,EleutherAI/pythia-14m,step90000,seed6,6,90000
It was a hair clip.,clip,clip,It was a clip hair., hair clip, clip hair,hair,True,-19.730812072753906,-22.955730438232422,3.2249183654785156,14067712,EleutherAI/pythia-14m,step90000,seed6,6,90000
It was an icy cold.,cold,cold,It was an cold icy., icy cold, cold icy,icy,False,-12.004247665405273,-18.62691307067871,6.6226654052734375,14067712,EleutherAI/pythia-14m,step90000,seed6,6,90000
It was a freezing cold.,cold,cold,It was a cold freezing., freezing cold, cold freezing,freezing,False,-16.145532608032227,-15.585142135620117,-0.5603904724121094,14067712,EleutherAI/pythia-14m,step90000,seed6,6,90000
It was a chest cold.,cold,cold,It was a cold chest., chest cold, cold chest,chest,False,-16.5965576171875,-14.271055221557617,-2.325502395629883,14067712,EleutherAI/pythia-14m,step90000,seed6,6,90000
It was a gossip column.,column,column,It was a column gossip., gossip column, column gossip,gossip,True,-18.79596710205078,-21.73206329345703,2.93609619140625,14067712,EleutherAI/pythia-14m,step90000,seed6,6,90000
It was a sports column.,column,column,It was a column sports., sports column, column sports,sports,True,-20.682510375976562,-23.35059356689453,2.6680831909179688,14067712,EleutherAI/pythia-14m,step90000,seed6,6,90000
It was a concrete column.,column,column,It was a column concrete., concrete column, column concrete,concrete,False,-18.912494659423828,-21.75867462158203,2.846179962158203,14067712,EleutherAI/pythia-14m,step90000,seed6,6,90000
He liked the investment company.,company,company,He liked the company investment., investment company, company investment,investment,True,-14.524009704589844,-17.248863220214844,2.724853515625,14067712,EleutherAI/pythia-14m,step90000,seed6,6,90000
He liked the pharmaceutical company.,company,company,He liked the company pharmaceutical., pharmaceutical company, company pharmaceutical,pharmaceutical,False,-16.478090286254883,-21.451988220214844,4.973897933959961,14067712,EleutherAI/pythia-14m,step90000,seed6,6,90000
He liked the pleasant company.,company,company,He liked the company pleasant., pleasant company, company pleasant,pleasant,False,-19.542083740234375,-20.510581970214844,0.9684982299804688,14067712,EleutherAI/pythia-14m,step90000,seed6,6,90000
It was a waffle cone.,cone,cone,It was a cone waffle., waffle cone, cone waffle,waffle,True,-23.815834045410156,-28.35041618347168,4.534582138061523,14067712,EleutherAI/pythia-14m,step90000,seed6,6,90000
It was a sugar cone.,cone,cone,It was a cone sugar., sugar cone, cone sugar,sugar,True,-22.307376861572266,-25.308368682861328,3.0009918212890625,14067712,EleutherAI/pythia-14m,step90000,seed6,6,90000
It was an orange cone.,cone,cone,It was an cone orange., orange cone, cone orange,orange,False,-15.479120254516602,-23.090368270874023,7.611248016357422,14067712,EleutherAI/pythia-14m,step90000,seed6,6,90000
He made a charitable contribution.,contribution,contribution,He made a contribution charitable., charitable contribution, contribution charitable,charitable,False,-15.51980209350586,-24.641155242919922,9.121353149414062,14067712,EleutherAI/pythia-14m,step90000,seed6,6,90000
He made a voluntary contribution.,contribution,contribution,He made a contribution voluntary., voluntary contribution, contribution voluntary,voluntary,False,-15.793062210083008,-23.648479461669922,7.855417251586914,14067712,EleutherAI/pythia-14m,step90000,seed6,6,90000
He made a scholarly contribution.,contribution,contribution,He made a contribution scholarly., scholarly contribution, contribution scholarly,scholarly,False,-20.223323822021484,-24.803020477294922,4.5796966552734375,14067712,EleutherAI/pythia-14m,step90000,seed6,6,90000
That was the noble count.,count,count,That was the count noble., noble count, count noble,noble,False,-19.046436309814453,-23.870037078857422,4.823600769042969,14067712,EleutherAI/pythia-14m,step90000,seed6,6,90000
That was the vengeful count.,count,count,That was the count vengeful., vengeful count, count vengeful,vengeful,False,-26.68730926513672,-29.13668441772461,2.4493751525878906,14067712,EleutherAI/pythia-14m,step90000,seed6,6,90000
That was the final count.,count,count,That was the count final., final count, count final,final,False,-13.36260986328125,-20.469036102294922,7.106426239013672,14067712,EleutherAI/pythia-14m,step90000,seed6,6,90000
It was an introductory course.,course,course,It was an course introductory., introductory course, course introductory,introductory,False,-10.921669006347656,-19.647235870361328,8.725566864013672,14067712,EleutherAI/pythia-14m,step90000,seed6,6,90000
It was a pass-fail course.,course,course,It was a course pass-fail., pass-fail course, course pass-fail,pass-fail,False,-29.842479705810547,-31.71590805053711,1.8734283447265625,14067712,EleutherAI/pythia-14m,step90000,seed6,6,90000
It was a charted course.,course,course,It was a course charted., charted course, course charted,charted,False,-22.911373138427734,-22.265853881835938,-0.6455192565917969,14067712,EleutherAI/pythia-14m,step90000,seed6,6,90000
It was a dinner date.,date,date,It was a date dinner., dinner date, date dinner,dinner,True,-19.660076141357422,-20.495685577392578,0.8356094360351562,14067712,EleutherAI/pythia-14m,step90000,seed6,6,90000
It was a blind date.,date,date,It was a date blind., blind date, date blind,blind,False,-18.499740600585938,-20.542560577392578,2.0428199768066406,14067712,EleutherAI/pythia-14m,step90000,seed6,6,90000
It was an expiration date.,date,date,It was an date expiration., expiration date, date expiration,expiration,True,-11.906266212463379,-22.248607635498047,10.342341423034668,14067712,EleutherAI/pythia-14m,step90000,seed6,6,90000
It was about forty degrees.,degree,degrees,It was about degrees forty., forty degrees, degrees forty,forty,True,-16.528308868408203,-22.984722137451172,6.456413269042969,14067712,EleutherAI/pythia-14m,step90000,seed6,6,90000
It was about fifty degrees.,degree,degrees,It was about degrees fifty., fifty degrees, degrees fifty,fifty,True,-16.37832260131836,-22.584575653076172,6.2062530517578125,14067712,EleutherAI/pythia-14m,step90000,seed6,6,90000
It was about associate degrees.,degree,degrees,It was about degrees associate., associate degrees, degrees associate,associate,False,-20.99006462097168,-23.964702606201172,2.974637985229492,14067712,EleutherAI/pythia-14m,step90000,seed6,6,90000
They liked the floral design.,design,design,They liked the design floral., floral design, design floral,floral,False,-15.47871208190918,-19.29790496826172,3.819192886352539,14067712,EleutherAI/pythia-14m,step90000,seed6,6,90000
They liked the geometric design.,design,design,They liked the design geometric., geometric design, design geometric,geometric,False,-16.789955139160156,-19.77239227294922,2.9824371337890625,14067712,EleutherAI/pythia-14m,step90000,seed6,6,90000
They liked the product design.,design,design,They liked the design product., product design, design product,product,True,-15.232419967651367,-14.145072937011719,-1.0873470306396484,14067712,EleutherAI/pythia-14m,step90000,seed6,6,90000
They liked the turkey dinner.,dinner,dinner,They liked the dinner turkey., turkey dinner, dinner turkey,turkey,True,-17.45943832397461,-19.026538848876953,1.5671005249023438,14067712,EleutherAI/pythia-14m,step90000,seed6,6,90000
They liked the light dinner.,dinner,dinner,They liked the dinner light., light dinner, dinner light,light,False,-17.799928665161133,-17.937427520751953,0.1374988555908203,14067712,EleutherAI/pythia-14m,step90000,seed6,6,90000
They liked the formal dinner.,dinner,dinner,They liked the dinner formal., formal dinner, dinner formal,formal,False,-18.277008056640625,-20.048755645751953,1.7717475891113281,14067712,EleutherAI/pythia-14m,step90000,seed6,6,90000
He had a recurring dream.,dream,dream,He had a dream recurring., recurring dream, dream recurring,recurring,False,-15.28524112701416,-20.77996063232422,5.494719505310059,14067712,EleutherAI/pythia-14m,step90000,seed6,6,90000
He had a bad dream.,dream,dream,He had a dream bad., bad dream, dream bad,bad,False,-12.880470275878906,-17.49187469482422,4.6114044189453125,14067712,EleutherAI/pythia-14m,step90000,seed6,6,90000
He had a childhood dream.,dream,dream,He had a dream childhood., childhood dream, dream childhood,childhood,True,-14.980587005615234,-15.465630531311035,0.4850435256958008,14067712,EleutherAI/pythia-14m,step90000,seed6,6,90000
It was a grueling drill.,drill,drill,It was a drill grueling., grueling drill, drill grueling,grueling,False,-22.91592788696289,-26.56302833557129,3.6471004486083984,14067712,EleutherAI/pythia-14m,step90000,seed6,6,90000
It was a challenging drill.,drill,drill,It was a drill challenging., challenging drill, drill challenging,challenging,False,-17.797210693359375,-22.860769271850586,5.063558578491211,14067712,EleutherAI/pythia-14m,step90000,seed6,6,90000
It was an electric drill.,drill,drill,It was an drill electric., electric drill, drill electric,electric,False,-19.8358211517334,-25.32583236694336,5.490011215209961,14067712,EleutherAI/pythia-14m,step90000,seed6,6,90000
It was a multiple-choice examination.,examination,examination,It was an examination multiple-choice., multiple-choice examination, examination multiple-choice,multiple-choice,False,-28.204021453857422,-32.89453887939453,4.690517425537109,14067712,EleutherAI/pythia-14m,step90000,seed6,6,90000
It was a difficult examination.,examination,examination,It was an examination difficult., difficult examination, examination difficult,difficult,False,-14.616002082824707,-16.623645782470703,2.007643699645996,14067712,EleutherAI/pythia-14m,step90000,seed6,6,90000
It was a prostate examination.,examination,examination,It was an examination prostate., prostate examination, examination prostate,prostate,True,-21.003358840942383,-21.997913360595703,0.9945545196533203,14067712,EleutherAI/pythia-14m,step90000,seed6,6,90000
They had an electric fan.,fan,fan,They had an fan electric., electric fan, fan electric,electric,False,-16.962074279785156,-23.444427490234375,6.482353210449219,14067712,EleutherAI/pythia-14m,step90000,seed6,6,90000
They had a ceiling fan.,fan,fan,They had a fan ceiling., ceiling fan, fan ceiling,ceiling,True,-18.944381713867188,-20.653350830078125,1.7089691162109375,14067712,EleutherAI/pythia-14m,step90000,seed6,6,90000
They had a zealous fan.,fan,fan,They had a fan zealous., zealous fan, fan zealous,zealous,False,-22.05006980895996,-26.43430519104004,4.384235382080078,14067712,EleutherAI/pythia-14m,step90000,seed6,6,90000
She had a text file.,file,file,She had a file text., text file, file text,text,True,-13.429885864257812,-19.25334930419922,5.823463439941406,14067712,EleutherAI/pythia-14m,step90000,seed6,6,90000
She had a data file.,file,file,She had a file data., data file, file data,data,True,-14.067354202270508,-18.40850067138672,4.341146469116211,14067712,EleutherAI/pythia-14m,step90000,seed6,6,90000
She had a nail file.,file,file,She had a file nail., nail file, file nail,nail,True,-20.797706604003906,-24.19255828857422,3.3948516845703125,14067712,EleutherAI/pythia-14m,step90000,seed6,6,90000
It was an action film.,film,film,It was an film action., action film, film action,action,True,-14.341506004333496,-15.188665390014648,0.8471593856811523,14067712,EleutherAI/pythia-14m,step90000,seed6,6,90000
It was a censored film.,film,film,It was a film censored., censored film, film censored,censored,False,-20.366294860839844,-21.24118423461914,0.8748893737792969,14067712,EleutherAI/pythia-14m,step90000,seed6,6,90000
It was a transparent film.,film,film,It was a film transparent., transparent film, film transparent,transparent,False,-15.85053539276123,-20.317411422729492,4.466876029968262,14067712,EleutherAI/pythia-14m,step90000,seed6,6,90000
It was a charitable foundation.,foundation,foundation,It was a foundation charitable., charitable foundation, foundation charitable,charitable,False,-13.927450180053711,-18.9360294342041,5.008579254150391,14067712,EleutherAI/pythia-14m,step90000,seed6,6,90000
It was an educational foundation.,foundation,foundation,It was an foundation educational., educational foundation, foundation educational,educational,False,-15.905405044555664,-21.99372673034668,6.088321685791016,14067712,EleutherAI/pythia-14m,step90000,seed6,6,90000
It was a wooden foundation.,foundation,foundation,It was a foundation wooden., wooden foundation, foundation wooden,wooden,False,-17.066287994384766,-20.3957462310791,3.329458236694336,14067712,EleutherAI/pythia-14m,step90000,seed6,6,90000
It was a mathematical function.,function,function,It was a function mathematical., mathematical function, function mathematical,mathematical,False,-15.310084342956543,-19.665369033813477,4.355284690856934,14067712,EleutherAI/pythia-14m,step90000,seed6,6,90000
It was a linear function.,function,function,It was a function linear., linear function, function linear,linear,False,-14.404850006103516,-19.607629776000977,5.202779769897461,14067712,EleutherAI/pythia-14m,step90000,seed6,6,90000
