sentence,word,string,reversed_sentence,mod_np,reversed_mod,disambiguating_word,non_adjective,original_logprob,reversed_logprob,ratio,n_params,mpath,revision,seed_name,seed,step
It was a legal term.,term,term,It was a term legal., legal term, term legal,legal,False,-16.006107330322266,-16.754756927490234,0.7486495971679688,14067712,EleutherAI/pythia-14m,step45000,seed9,9,45000
It was a clock tick.,tick,tick,It was a tick clock., clock tick, tick clock,clock,True,-14.314353942871094,-19.09700584411621,4.782651901245117,14067712,EleutherAI/pythia-14m,step45000,seed9,9,45000
It was an audible tick.,tick,tick,It was an tick audible., audible tick, tick audible,audible,False,-18.485820770263672,-25.944263458251953,7.458442687988281,14067712,EleutherAI/pythia-14m,step45000,seed9,9,45000
It was a parasitic tick.,tick,tick,It was a tick parasitic., parasitic tick, tick parasitic,parasitic,False,-18.021263122558594,-21.468189239501953,3.4469261169433594,14067712,EleutherAI/pythia-14m,step45000,seed9,9,45000
It was a generous tip.,tip,tip,It was a tip generous., generous tip, tip generous,generous,False,-18.900646209716797,-25.20124053955078,6.300594329833984,14067712,EleutherAI/pythia-14m,step45000,seed9,9,45000
It was a stingy tip.,tip,tip,It was a tip stingy., stingy tip, tip stingy,stingy,False,-21.55575942993164,-23.79352378845215,2.237764358520508,14067712,EleutherAI/pythia-14m,step45000,seed9,9,45000
It was a pencil tip.,tip,tip,It was a tip pencil., pencil tip, tip pencil,pencil,True,-18.409252166748047,-19.54048728942871,1.131235122680664,14067712,EleutherAI/pythia-14m,step45000,seed9,9,45000
She liked the essay title.,title,title,She liked the title essay., essay title, title essay,essay,True,-21.1457576751709,-19.329038619995117,-1.8167190551757812,14067712,EleutherAI/pythia-14m,step45000,seed9,9,45000
She liked the poem title.,title,title,She liked the title poem., poem title, title poem,poem,True,-19.159107208251953,-18.460628509521484,-0.6984786987304688,14067712,EleutherAI/pythia-14m,step45000,seed9,9,45000
She liked the academic title.,title,title,She liked the title academic., academic title, title academic,academic,False,-16.937543869018555,-21.212608337402344,4.275064468383789,14067712,EleutherAI/pythia-14m,step45000,seed9,9,45000
It was a costly toll.,toll,toll,It was a toll costly., costly toll, toll costly,costly,False,-19.573486328125,-24.97133445739746,5.397848129272461,14067712,EleutherAI/pythia-14m,step45000,seed9,9,45000
It was a road toll.,toll,toll,It was a toll road., road toll, toll road,road,True,-17.37038803100586,-18.788593292236328,1.4182052612304688,14067712,EleutherAI/pythia-14m,step45000,seed9,9,45000
It was a loud toll.,toll,toll,It was a toll loud., loud toll, toll loud,loud,False,-21.173248291015625,-25.896512985229492,4.723264694213867,14067712,EleutherAI/pythia-14m,step45000,seed9,9,45000
She saw the train tracks.,track,tracks,She saw the tracks train., train tracks, tracks train,train,True,-16.48257827758789,-21.72165298461914,5.23907470703125,14067712,EleutherAI/pythia-14m,step45000,seed9,9,45000
She saw the trolley tracks.,track,tracks,She saw the tracks trolley., trolley tracks, tracks trolley,trolley,True,-22.972442626953125,-26.60077667236328,3.6283340454101562,14067712,EleutherAI/pythia-14m,step45000,seed9,9,45000
She saw the moose tracks.,track,tracks,She saw the tracks moose., moose tracks, tracks moose,moose,False,-22.434738159179688,-26.78841209411621,4.353673934936523,14067712,EleutherAI/pythia-14m,step45000,seed9,9,45000
It was five yards.,yard,yards,It was yards five., five yards, yards five,five,True,-18.278127670288086,-24.717105865478516,6.43897819519043,14067712,EleutherAI/pythia-14m,step45000,seed9,9,45000
It was ten yards.,yard,yards,It was yards ten., ten yards, yards ten,ten,True,-15.971733093261719,-25.037677764892578,9.06594467163086,14067712,EleutherAI/pythia-14m,step45000,seed9,9,45000
They were big yards.,yard,yards,They were yards big., big yards, yards big,big,False,-23.059255599975586,-24.001323699951172,0.9420680999755859,14067712,EleutherAI/pythia-14m,step45000,seed9,9,45000
It was a comedic act.,act,act,It was an act comedic., comedic act, act comedic,comedic,False,-17.7823486328125,-20.910823822021484,3.1284751892089844,14067712,EleutherAI/pythia-14m,step45000,seed9,9,45000
He had a pending appeal.,appeal,appeal,He had an appeal pending., pending appeal, appeal pending,pending,False,-17.579877853393555,-16.035968780517578,-1.5439090728759766,14067712,EleutherAI/pythia-14m,step45000,seed9,9,45000
It was a polluted atmosphere.,atmosphere,atmosphere,It was an atmosphere polluted., polluted atmosphere, atmosphere polluted,polluted,False,-24.157398223876953,-22.801477432250977,-1.3559207916259766,14067712,EleutherAI/pythia-14m,step45000,seed9,9,45000
It was a country band.,band,band,It was a band country., country band, band country,country,True,-15.434722900390625,-19.966381072998047,4.531658172607422,14067712,EleutherAI/pythia-14m,step45000,seed9,9,45000
There was a religious barrier.,barrier,barrier,There was a barrier religious., religious barrier, barrier religious,religious,False,-18.671554565429688,-23.63158416748047,4.960029602050781,14067712,EleutherAI/pythia-14m,step45000,seed9,9,45000
He saw a baseball bat.,bat,bat,He saw a bat baseball., baseball bat, bat baseball,baseball,True,-10.677141189575195,-18.218746185302734,7.541604995727539,14067712,EleutherAI/pythia-14m,step45000,seed9,9,45000
He saw the balance beam.,beam,beam,He saw the beam balance., balance beam, beam balance,balance,True,-18.02362823486328,-19.234394073486328,1.2107658386230469,14067712,EleutherAI/pythia-14m,step45000,seed9,9,45000
She had a writer's block.,block,block,She had a block writer's., writer's block, block writer's,writer,True,-26.251220703125,-29.036773681640625,2.785552978515625,14067712,EleutherAI/pythia-14m,step45000,seed9,9,45000
He has royal blood.,blood,blood,He has blood royal., royal blood, blood royal,royal,False,-19.449785232543945,-25.41193199157715,5.962146759033203,14067712,EleutherAI/pythia-14m,step45000,seed9,9,45000
It was the school board.,board,board,It was the board school., school board, board school,school,True,-13.631126403808594,-18.992321014404297,5.361194610595703,14067712,EleutherAI/pythia-14m,step45000,seed9,9,45000
He had a leather-bound book.,book,book,He had a book leather-bound., leather-bound book, book leather-bound,leather-bound,False,-23.810556411743164,-26.19222640991211,2.3816699981689453,14067712,EleutherAI/pythia-14m,step45000,seed9,9,45000
They ate a lonely breakfast.,breakfast,breakfast,They ate a breakfast lonely., lonely breakfast, breakfast lonely,lonely,False,-15.707944869995117,-20.167558670043945,4.459613800048828,14067712,EleutherAI/pythia-14m,step45000,seed9,9,45000
It was an island cape.,cape,cape,It was an cape island., island cape, cape island,island,True,-19.850624084472656,-21.007080078125,1.1564559936523438,14067712,EleutherAI/pythia-14m,step45000,seed9,9,45000
It was a criminal case.,case,case,It was a case criminal., criminal case, case criminal,criminal,False,-12.297402381896973,-16.876956939697266,4.579554557800293,14067712,EleutherAI/pythia-14m,step45000,seed9,9,45000
It was a primary cause.,cause,cause,It was a cause primary., primary cause, cause primary,primary,False,-14.333763122558594,-23.272480010986328,8.938716888427734,14067712,EleutherAI/pythia-14m,step45000,seed9,9,45000
It was a jail cell.,cell,cell,It was a cell jail., jail cell, cell jail,jail,True,-12.038787841796875,-16.35010528564453,4.311317443847656,14067712,EleutherAI/pythia-14m,step45000,seed9,9,45000
She had a good-luck charm.,charm,charm,She had a charm good-luck., good-luck charm, charm good-luck,good-luck,False,-28.170120239257812,-32.229793548583984,4.059673309326172,14067712,EleutherAI/pythia-14m,step45000,seed9,9,45000
They liked the pet chicken.,chicken,chicken,They liked the chicken pet., pet chicken, chicken pet,pet,True,-17.994373321533203,-17.420066833496094,-0.5743064880371094,14067712,EleutherAI/pythia-14m,step45000,seed9,9,45000
It was a stimulating class.,class,class,It was a class stimulating., stimulating class, class stimulating,stimulating,False,-18.417591094970703,-20.839584350585938,2.4219932556152344,14067712,EleutherAI/pythia-14m,step45000,seed9,9,45000
It was a metal clip.,clip,clip,It was a clip metal., metal clip, clip metal,metal,True,-16.392051696777344,-18.969192504882812,2.5771408081054688,14067712,EleutherAI/pythia-14m,step45000,seed9,9,45000
It was a common cold.,cold,cold,It was a cold common., common cold, cold common,common,False,-15.881048202514648,-17.169822692871094,1.2887744903564453,14067712,EleutherAI/pythia-14m,step45000,seed9,9,45000
It was a marble column.,column,column,It was a column marble., marble column, column marble,marble,True,-16.553218841552734,-21.433372497558594,4.880153656005859,14067712,EleutherAI/pythia-14m,step45000,seed9,9,45000
He liked the polite company.,company,company,He liked the company polite., polite company, company polite,polite,False,-17.627323150634766,-19.299774169921875,1.6724510192871094,14067712,EleutherAI/pythia-14m,step45000,seed9,9,45000
It was a traffic cone.,cone,cone,It was a cone traffic., traffic cone, cone traffic,traffic,True,-17.230045318603516,-22.873977661132812,5.643932342529297,14067712,EleutherAI/pythia-14m,step45000,seed9,9,45000
He made a well-written contribution.,contribution,contribution,He made a contribution well-written., well-written contribution, contribution well-written,well-written,False,-21.868911743164062,-27.70882225036621,5.839910507202148,14067712,EleutherAI/pythia-14m,step45000,seed9,9,45000
That was the correct count.,count,count,That was the count correct., correct count, count correct,correct,False,-15.594192504882812,-19.60552215576172,4.011329650878906,14067712,EleutherAI/pythia-14m,step45000,seed9,9,45000
It was a collision course.,course,course,It was a course collision., collision course, course collision,collision,True,-15.530193328857422,-23.10149383544922,7.571300506591797,14067712,EleutherAI/pythia-14m,step45000,seed9,9,45000
It was a historical date.,date,date,It was a date historical., historical date, date historical,historical,False,-15.1014404296875,-19.07642364501953,3.9749832153320312,14067712,EleutherAI/pythia-14m,step45000,seed9,9,45000
It was about college degrees.,degree,degrees,It was about degrees college., college degrees, degrees college,college,True,-19.56010627746582,-22.228891372680664,2.6687850952148438,14067712,EleutherAI/pythia-14m,step45000,seed9,9,45000
They liked the architectural design.,design,design,They liked the design architectural., architectural design, design architectural,architectural,False,-16.22382354736328,-20.122360229492188,3.8985366821289062,14067712,EleutherAI/pythia-14m,step45000,seed9,9,45000
They liked the anniversary dinner.,dinner,dinner,They liked the dinner anniversary., anniversary dinner, dinner anniversary,anniversary,True,-18.063764572143555,-18.72919273376465,0.6654281616210938,14067712,EleutherAI/pythia-14m,step45000,seed9,9,45000
He had a career dream.,dream,dream,He had a dream career., career dream, dream career,career,True,-14.427396774291992,-15.802054405212402,1.3746576309204102,14067712,EleutherAI/pythia-14m,step45000,seed9,9,45000
It was a battery-powered drill.,drill,drill,It was a drill battery-powered., battery-powered drill, drill battery-powered,battery-powered,False,-22.91193389892578,-27.183740615844727,4.271806716918945,14067712,EleutherAI/pythia-14m,step45000,seed9,9,45000
It was a physical examination.,examination,examination,It was an examination physical., physical examination, examination physical,physical,False,-14.801072120666504,-23.17197608947754,8.370903968811035,14067712,EleutherAI/pythia-14m,step45000,seed9,9,45000
They had an enthusiastic fan.,fan,fan,They had an fan enthusiastic., enthusiastic fan, fan enthusiastic,enthusiastic,False,-15.097153663635254,-29.82655143737793,14.729397773742676,14067712,EleutherAI/pythia-14m,step45000,seed9,9,45000
She had a steel file.,file,file,She had a file steel., steel file, file steel,steel,True,-20.579139709472656,-24.550214767456055,3.9710750579833984,14067712,EleutherAI/pythia-14m,step45000,seed9,9,45000
It was a plastic film.,film,film,It was a film plastic., plastic film, film plastic,plastic,False,-13.269583702087402,-18.432941436767578,5.163357734680176,14067712,EleutherAI/pythia-14m,step45000,seed9,9,45000
It was a concrete foundation.,foundation,foundation,It was a foundation concrete., concrete foundation, foundation concrete,concrete,False,-16.11747169494629,-21.03103256225586,4.91356086730957,14067712,EleutherAI/pythia-14m,step45000,seed9,9,45000
It was a business function.,function,function,It was a function business., business function, function business,business,True,-15.983917236328125,-20.19499969482422,4.211082458496094,14067712,EleutherAI/pythia-14m,step45000,seed9,9,45000
He was on the parade ground.,ground,ground,He was on the ground parade., parade ground, ground parade,parade,True,-14.643476486206055,-16.227352142333984,1.5838756561279297,14067712,EleutherAI/pythia-14m,step45000,seed9,9,45000
They liked the national guard.,guard,guard,They liked the guard national., national guard, guard national,national,False,-18.733253479003906,-22.038776397705078,3.305522918701172,14067712,EleutherAI/pythia-14m,step45000,seed9,9,45000
He had a friendly guide.,guide,guide,He had a guide friendly., friendly guide, guide friendly,friendly,False,-13.479736328125,-21.031530380249023,7.551794052124023,14067712,EleutherAI/pythia-14m,step45000,seed9,9,45000
It was a nursing home.,home,home,It was a home nursing., nursing home, home nursing,nursing,True,-12.391422271728516,-16.63622283935547,4.244800567626953,14067712,EleutherAI/pythia-14m,step45000,seed9,9,45000
They had military intelligence.,intelligence,intelligence,They had intelligence military., military intelligence, intelligence military,military,False,-14.68168830871582,-20.865158081054688,6.183469772338867,14067712,EleutherAI/pythia-14m,step45000,seed9,9,45000
It was a special issue.,issue,issue,It was an issue special., special issue, issue special,special,False,-11.197821617126465,-15.759349822998047,4.561528205871582,14067712,EleutherAI/pythia-14m,step45000,seed9,9,45000
It was a paper jam.,jam,jam,It was a jam paper., paper jam, jam paper,paper,True,-17.34153938293457,-18.372371673583984,1.030832290649414,14067712,EleutherAI/pythia-14m,step45000,seed9,9,45000
It was a backspace key.,key,key,It was a key backspace., backspace key, key backspace,backspace,True,-26.166282653808594,-23.972551345825195,-2.1937313079833984,14067712,EleutherAI/pythia-14m,step45000,seed9,9,45000
They liked the friendly lamb.,lamb,lamb,They liked the lamb friendly., friendly lamb, lamb friendly,friendly,False,-20.055809020996094,-22.066675186157227,2.010866165161133,14067712,EleutherAI/pythia-14m,step45000,seed9,9,45000
She had door locks.,lock,locks,She had locks door., door locks, locks door,door,True,-19.27099609375,-20.649471282958984,1.3784751892089844,14067712,EleutherAI/pythia-14m,step45000,seed9,9,45000
They liked the women's lunch.,lunch,lunch,They liked the lunch women's., women's lunch, lunch women's,women,True,-20.206844329833984,-23.83076286315918,3.6239185333251953,14067712,EleutherAI/pythia-14m,step45000,seed9,9,45000
He liked the stock market.,market,market,He liked the market stock., stock market, market stock,stock,True,-13.22821044921875,-14.919572830200195,1.6913623809814453,14067712,EleutherAI/pythia-14m,step45000,seed9,9,45000
It was a tennis match.,match,match,It was a match tennis., tennis match, match tennis,tennis,True,-15.964753150939941,-18.94924545288086,2.984492301940918,14067712,EleutherAI/pythia-14m,step45000,seed9,9,45000
It was veterinary medicine.,medicine,medicine,It was medicine veterinary., veterinary medicine, medicine veterinary,veterinary,False,-21.046554565429688,-22.835927963256836,1.7893733978271484,14067712,EleutherAI/pythia-14m,step45000,seed9,9,45000
There was a clear message.,message,message,There was a message clear., clear message, message clear,clear,False,-13.510002136230469,-17.38013458251953,3.8701324462890625,14067712,EleutherAI/pythia-14m,step45000,seed9,9,45000
It was a clay mold.,mold,mold,It was a mold clay., clay mold, mold clay,clay,True,-17.416927337646484,-21.611034393310547,4.1941070556640625,14067712,EleutherAI/pythia-14m,step45000,seed9,9,45000
She saw the fast mole.,mole,mole,She saw the mole fast., fast mole, mole fast,fast,False,-22.525741577148438,-21.68093490600586,-0.8448066711425781,14067712,EleutherAI/pythia-14m,step45000,seed9,9,45000
He liked the civil-rights movement.,movement,movement,He liked the movement civil-rights., civil-rights movement, movement civil-rights,civil-rights,False,-20.130340576171875,-28.086265563964844,7.955924987792969,14067712,EleutherAI/pythia-14m,step45000,seed9,9,45000
It was a shredded newspaper.,newspaper,newspaper,It was a newspaper shredded., shredded newspaper, newspaper shredded,shredded,False,-20.403133392333984,-21.044452667236328,0.6413192749023438,14067712,EleutherAI/pythia-14m,step45000,seed9,9,45000
It was a reddish orange.,orange,orange,It was an orange reddish., reddish orange, orange reddish,reddish,False,-16.496028900146484,-17.600385665893555,1.1043567657470703,14067712,EleutherAI/pythia-14m,step45000,seed9,9,45000
He saw the ripped page.,page,page,He saw the page ripped., ripped page, page ripped,ripped,False,-23.788070678710938,-20.813858032226562,-2.974212646484375,14067712,EleutherAI/pythia-14m,step45000,seed9,9,45000
It was a tree palm.,palm,palm,It was a palm tree., tree palm, palm tree,tree,True,-20.06393051147461,-14.678927421569824,-5.385003089904785,14067712,EleutherAI/pythia-14m,step45000,seed9,9,45000
It was a consumer panel.,panel,panel,It was a panel consumer., consumer panel, panel consumer,consumer,True,-20.321311950683594,-23.641651153564453,3.3203392028808594,14067712,EleutherAI/pythia-14m,step45000,seed9,9,45000
It was a biblical passage.,passage,passage,It was a passage biblical., biblical passage, passage biblical,biblical,False,-17.611459732055664,-23.584102630615234,5.97264289855957,14067712,EleutherAI/pythia-14m,step45000,seed9,9,45000
It was a secure perch.,perch,perch,It was a perch secure., secure perch, perch secure,secure,False,-23.862932205200195,-23.998432159423828,0.1354999542236328,14067712,EleutherAI/pythia-14m,step45000,seed9,9,45000
He saw the plastic pitcher.,pitcher,pitcher,He saw the pitcher plastic., plastic pitcher, pitcher plastic,plastic,True,-18.603408813476562,-23.17278289794922,4.569374084472656,14067712,EleutherAI/pythia-14m,step45000,seed9,9,45000
It was a sweet port.,port,port,It was a port sweet., sweet port, port sweet,sweet,False,-16.109188079833984,-22.506763458251953,6.397575378417969,14067712,EleutherAI/pythia-14m,step45000,seed9,9,45000
He was in a yoga position.,position,position,He was in a position yoga., yoga position, position yoga,yoga,True,-14.344917297363281,-18.616039276123047,4.271121978759766,14067712,EleutherAI/pythia-14m,step45000,seed9,9,45000
It was a challenging post.,post,post,It was a post challenging., challenging post, post challenging,challenging,False,-16.842700958251953,-19.42025375366211,2.5775527954101562,14067712,EleutherAI/pythia-14m,step45000,seed9,9,45000
He had the quickest punch.,punch,punch,He had the punch quickest., quickest punch, punch quickest,quickest,False,-19.260234832763672,-26.99441146850586,7.7341766357421875,14067712,EleutherAI/pythia-14m,step45000,seed9,9,45000
She had a cloudy pupil.,pupil,pupil,She had a pupil cloudy., cloudy pupil, pupil cloudy,cloudy,False,-20.5,-25.46344757080078,4.963447570800781,14067712,EleutherAI/pythia-14m,step45000,seed9,9,45000
That was a tennis racket.,racket,racket,That was a racket tennis., tennis racket, racket tennis,tennis,True,-15.404043197631836,-19.998476028442383,4.594432830810547,14067712,EleutherAI/pythia-14m,step45000,seed9,9,45000
He liked granite rock.,rock,rock,He liked rock granite., granite rock, rock granite,granite,True,-20.69532012939453,-24.333786010742188,3.6384658813476562,14067712,EleutherAI/pythia-14m,step45000,seed9,9,45000
He saw the bushy sage.,sage,sage,He saw the sage bushy., bushy sage, sage bushy,bushy,False,-26.605846405029297,-28.31293296813965,1.7070865631103516,14067712,EleutherAI/pythia-14m,step45000,seed9,9,45000
It was a major scale.,scale,scale,It was a scale major., major scale, scale major,major,False,-15.02391242980957,-22.268098831176758,7.2441864013671875,14067712,EleutherAI/pythia-14m,step45000,seed9,9,45000
It was a panoramic scene.,scene,scene,It was a scene panoramic., panoramic scene, scene panoramic,panoramic,False,-17.475116729736328,-23.42949104309082,5.954374313354492,14067712,EleutherAI/pythia-14m,step45000,seed9,9,45000
It was a trained seal.,seal,seal,It was a seal trained., trained seal, seal trained,trained,False,-21.758953094482422,-23.020370483398438,1.2614173889160156,14067712,EleutherAI/pythia-14m,step45000,seed9,9,45000
He used the video tape.,tape,tape,He used the tape video., video tape, tape video,video,True,-12.649042129516602,-14.850198745727539,2.2011566162109375,14067712,EleutherAI/pythia-14m,step45000,seed9,9,45000
It was a technical term.,term,term,It was a term technical., technical term, term technical,technical,False,-15.97169303894043,-18.97789764404297,3.006204605102539,14067712,EleutherAI/pythia-14m,step45000,seed9,9,45000
It was a diseased tick.,tick,tick,It was a tick diseased., diseased tick, tick diseased,diseased,False,-21.06532859802246,-24.331401824951172,3.266073226928711,14067712,EleutherAI/pythia-14m,step45000,seed9,9,45000
It was a finger tip.,tip,tip,It was a tip finger., finger tip, tip finger,finger,True,-19.126245498657227,-20.463932037353516,1.337686538696289,14067712,EleutherAI/pythia-14m,step45000,seed9,9,45000
She liked the professional title.,title,title,She liked the title professional., professional title, title professional,professional,False,-17.502338409423828,-19.952268600463867,2.449930191040039,14067712,EleutherAI/pythia-14m,step45000,seed9,9,45000
It was a bell toll.,toll,toll,It was a toll bell., bell toll, toll bell,bell,True,-20.6693115234375,-21.123401641845703,0.4540901184082031,14067712,EleutherAI/pythia-14m,step45000,seed9,9,45000
She saw the snowshoe tracks.,track,tracks,She saw the tracks snowshoe., snowshoe tracks, tracks snowshoe,snowshoe,True,-27.294002532958984,-32.27334213256836,4.979339599609375,14067712,EleutherAI/pythia-14m,step45000,seed9,9,45000
They were cluttered yards.,yard,yards,They were yards cluttered., cluttered yards, yards cluttered,cluttered,False,-27.551387786865234,-27.84005355834961,0.288665771484375,14067712,EleutherAI/pythia-14m,step45000,seed9,9,45000
