sentence,word,string,reversed_sentence,mod_np,reversed_mod,disambiguating_word,non_adjective,original_logprob,reversed_logprob,ratio,n_params,mpath,revision,seed_name,seed,step
He used the interview tape.,tape,tape,He used the tape interview., interview tape, tape interview,interview,True,-16.987651824951172,-16.71816635131836,-0.2694854736328125,14067712,EleutherAI/pythia-14m,step121000,seed6,6,121000
It was a winter term.,term,term,It was a term winter., winter term, term winter,winter,True,-16.971694946289062,-21.199371337890625,4.2276763916015625,14067712,EleutherAI/pythia-14m,step121000,seed6,6,121000
It was a fall term.,term,term,It was a term fall., fall term, term fall,fall,True,-17.03988265991211,-20.716705322265625,3.6768226623535156,14067712,EleutherAI/pythia-14m,step121000,seed6,6,121000
It was a legal term.,term,term,It was a term legal., legal term, term legal,legal,False,-17.070117950439453,-18.275787353515625,1.2056694030761719,14067712,EleutherAI/pythia-14m,step121000,seed6,6,121000
It was a clock tick.,tick,tick,It was a tick clock., clock tick, tick clock,clock,True,-19.051990509033203,-22.70766830444336,3.6556777954101562,14067712,EleutherAI/pythia-14m,step121000,seed6,6,121000
It was an audible tick.,tick,tick,It was an tick audible., audible tick, tick audible,audible,False,-19.527353286743164,-25.79486083984375,6.267507553100586,14067712,EleutherAI/pythia-14m,step121000,seed6,6,121000
It was a parasitic tick.,tick,tick,It was a tick parasitic., parasitic tick, tick parasitic,parasitic,False,-21.412147521972656,-25.66250228881836,4.250354766845703,14067712,EleutherAI/pythia-14m,step121000,seed6,6,121000
It was a generous tip.,tip,tip,It was a tip generous., generous tip, tip generous,generous,False,-19.1862850189209,-23.39490509033203,4.208620071411133,14067712,EleutherAI/pythia-14m,step121000,seed6,6,121000
It was a stingy tip.,tip,tip,It was a tip stingy., stingy tip, tip stingy,stingy,False,-24.14242172241211,-26.863224029541016,2.7208023071289062,14067712,EleutherAI/pythia-14m,step121000,seed6,6,121000
It was a pencil tip.,tip,tip,It was a tip pencil., pencil tip, tip pencil,pencil,True,-21.866622924804688,-22.24720001220703,0.38057708740234375,14067712,EleutherAI/pythia-14m,step121000,seed6,6,121000
She liked the essay title.,title,title,She liked the title essay., essay title, title essay,essay,True,-18.726604461669922,-16.828292846679688,-1.8983116149902344,14067712,EleutherAI/pythia-14m,step121000,seed6,6,121000
She liked the poem title.,title,title,She liked the title poem., poem title, title poem,poem,True,-17.789505004882812,-17.424728393554688,-0.364776611328125,14067712,EleutherAI/pythia-14m,step121000,seed6,6,121000
She liked the academic title.,title,title,She liked the title academic., academic title, title academic,academic,False,-16.718347549438477,-18.692794799804688,1.974447250366211,14067712,EleutherAI/pythia-14m,step121000,seed6,6,121000
It was a costly toll.,toll,toll,It was a toll costly., costly toll, toll costly,costly,False,-19.597003936767578,-22.209476470947266,2.6124725341796875,14067712,EleutherAI/pythia-14m,step121000,seed6,6,121000
It was a road toll.,toll,toll,It was a toll road., road toll, toll road,road,True,-17.22716522216797,-18.482913970947266,1.2557487487792969,14067712,EleutherAI/pythia-14m,step121000,seed6,6,121000
It was a loud toll.,toll,toll,It was a toll loud., loud toll, toll loud,loud,False,-21.49120330810547,-23.638675689697266,2.147472381591797,14067712,EleutherAI/pythia-14m,step121000,seed6,6,121000
She saw the train tracks.,track,tracks,She saw the tracks train., train tracks, tracks train,train,True,-16.334962844848633,-19.16570472717285,2.8307418823242188,14067712,EleutherAI/pythia-14m,step121000,seed6,6,121000
She saw the trolley tracks.,track,tracks,She saw the tracks trolley., trolley tracks, tracks trolley,trolley,True,-25.72360610961914,-26.44210433959961,0.7184982299804688,14067712,EleutherAI/pythia-14m,step121000,seed6,6,121000
She saw the moose tracks.,track,tracks,She saw the tracks moose., moose tracks, tracks moose,moose,False,-24.208051681518555,-24.15618133544922,-0.05187034606933594,14067712,EleutherAI/pythia-14m,step121000,seed6,6,121000
It was five yards.,yard,yards,It was yards five., five yards, yards five,five,True,-17.39482879638672,-24.713382720947266,7.318553924560547,14067712,EleutherAI/pythia-14m,step121000,seed6,6,121000
It was ten yards.,yard,yards,It was yards ten., ten yards, yards ten,ten,True,-19.017709732055664,-25.566898345947266,6.549188613891602,14067712,EleutherAI/pythia-14m,step121000,seed6,6,121000
They were big yards.,yard,yards,They were yards big., big yards, yards big,big,False,-17.81439208984375,-21.981884002685547,4.167491912841797,14067712,EleutherAI/pythia-14m,step121000,seed6,6,121000
It was a comedic act.,act,act,It was an act comedic., comedic act, act comedic,comedic,False,-17.608179092407227,-21.384199142456055,3.776020050048828,14067712,EleutherAI/pythia-14m,step121000,seed6,6,121000
He had a pending appeal.,appeal,appeal,He had an appeal pending., pending appeal, appeal pending,pending,False,-17.548847198486328,-13.797595977783203,-3.751251220703125,14067712,EleutherAI/pythia-14m,step121000,seed6,6,121000
It was a polluted atmosphere.,atmosphere,atmosphere,It was an atmosphere polluted., polluted atmosphere, atmosphere polluted,polluted,False,-24.880430221557617,-25.78622817993164,0.9057979583740234,14067712,EleutherAI/pythia-14m,step121000,seed6,6,121000
It was a country band.,band,band,It was a band country., country band, band country,country,True,-16.810626983642578,-17.935699462890625,1.1250724792480469,14067712,EleutherAI/pythia-14m,step121000,seed6,6,121000
There was a religious barrier.,barrier,barrier,There was a barrier religious., religious barrier, barrier religious,religious,False,-18.268962860107422,-22.768468856811523,4.499505996704102,14067712,EleutherAI/pythia-14m,step121000,seed6,6,121000
He saw a baseball bat.,bat,bat,He saw a bat baseball., baseball bat, bat baseball,baseball,True,-11.791894912719727,-15.999564170837402,4.207669258117676,14067712,EleutherAI/pythia-14m,step121000,seed6,6,121000
He saw the balance beam.,beam,beam,He saw the beam balance., balance beam, beam balance,balance,True,-20.840839385986328,-21.082111358642578,0.24127197265625,14067712,EleutherAI/pythia-14m,step121000,seed6,6,121000
She had a writer's block.,block,block,She had a block writer's., writer's block, block writer's,writer,True,-21.73343276977539,-23.54862403869629,1.8151912689208984,14067712,EleutherAI/pythia-14m,step121000,seed6,6,121000
He has royal blood.,blood,blood,He has blood royal., royal blood, blood royal,royal,False,-19.765846252441406,-22.84115219116211,3.075305938720703,14067712,EleutherAI/pythia-14m,step121000,seed6,6,121000
It was the school board.,board,board,It was the board school., school board, board school,school,True,-13.722517013549805,-19.032350540161133,5.309833526611328,14067712,EleutherAI/pythia-14m,step121000,seed6,6,121000
He had a leather-bound book.,book,book,He had a book leather-bound., leather-bound book, book leather-bound,leather-bound,False,-25.330793380737305,-27.02617645263672,1.695383071899414,14067712,EleutherAI/pythia-14m,step121000,seed6,6,121000
They ate a lonely breakfast.,breakfast,breakfast,They ate a breakfast lonely., lonely breakfast, breakfast lonely,lonely,False,-14.443107604980469,-19.840499877929688,5.397392272949219,14067712,EleutherAI/pythia-14m,step121000,seed6,6,121000
It was an island cape.,cape,cape,It was an cape island., island cape, cape island,island,True,-20.89883041381836,-24.68552017211914,3.7866897583007812,14067712,EleutherAI/pythia-14m,step121000,seed6,6,121000
It was a criminal case.,case,case,It was a case criminal., criminal case, case criminal,criminal,False,-11.241182327270508,-15.985244750976562,4.744062423706055,14067712,EleutherAI/pythia-14m,step121000,seed6,6,121000
It was a primary cause.,cause,cause,It was a cause primary., primary cause, cause primary,primary,False,-12.824685096740723,-21.29705047607422,8.472365379333496,14067712,EleutherAI/pythia-14m,step121000,seed6,6,121000
It was a jail cell.,cell,cell,It was a cell jail., jail cell, cell jail,jail,True,-19.096242904663086,-19.763423919677734,0.6671810150146484,14067712,EleutherAI/pythia-14m,step121000,seed6,6,121000
She had a good-luck charm.,charm,charm,She had a charm good-luck., good-luck charm, charm good-luck,good-luck,False,-28.69575309753418,-29.729751586914062,1.0339984893798828,14067712,EleutherAI/pythia-14m,step121000,seed6,6,121000
They liked the pet chicken.,chicken,chicken,They liked the chicken pet., pet chicken, chicken pet,pet,True,-18.745922088623047,-17.03870391845703,-1.7072181701660156,14067712,EleutherAI/pythia-14m,step121000,seed6,6,121000
It was a stimulating class.,class,class,It was a class stimulating., stimulating class, class stimulating,stimulating,False,-19.016895294189453,-20.940284729003906,1.9233894348144531,14067712,EleutherAI/pythia-14m,step121000,seed6,6,121000
It was a metal clip.,clip,clip,It was a clip metal., metal clip, clip metal,metal,True,-18.903316497802734,-20.325157165527344,1.4218406677246094,14067712,EleutherAI/pythia-14m,step121000,seed6,6,121000
It was a common cold.,cold,cold,It was a cold common., common cold, cold common,common,False,-16.025943756103516,-18.781349182128906,2.7554054260253906,14067712,EleutherAI/pythia-14m,step121000,seed6,6,121000
It was a marble column.,column,column,It was a column marble., marble column, column marble,marble,True,-17.9580078125,-21.519672393798828,3.561664581298828,14067712,EleutherAI/pythia-14m,step121000,seed6,6,121000
He liked the polite company.,company,company,He liked the company polite., polite company, company polite,polite,False,-18.007455825805664,-19.605701446533203,1.598245620727539,14067712,EleutherAI/pythia-14m,step121000,seed6,6,121000
It was a traffic cone.,cone,cone,It was a cone traffic., traffic cone, cone traffic,traffic,True,-20.310710906982422,-24.47274398803711,4.1620330810546875,14067712,EleutherAI/pythia-14m,step121000,seed6,6,121000
He made a well-written contribution.,contribution,contribution,He made a contribution well-written., well-written contribution, contribution well-written,well-written,False,-23.127182006835938,-28.126636505126953,4.999454498291016,14067712,EleutherAI/pythia-14m,step121000,seed6,6,121000
That was the correct count.,count,count,That was the count correct., correct count, count correct,correct,False,-16.222339630126953,-20.486574172973633,4.26423454284668,14067712,EleutherAI/pythia-14m,step121000,seed6,6,121000
It was a collision course.,course,course,It was a course collision., collision course, course collision,collision,True,-17.714298248291016,-19.951583862304688,2.237285614013672,14067712,EleutherAI/pythia-14m,step121000,seed6,6,121000
It was a historical date.,date,date,It was a date historical., historical date, date historical,historical,False,-15.384822845458984,-19.479358673095703,4.094535827636719,14067712,EleutherAI/pythia-14m,step121000,seed6,6,121000
It was about college degrees.,degree,degrees,It was about degrees college., college degrees, degrees college,college,True,-18.34490966796875,-22.584590911865234,4.239681243896484,14067712,EleutherAI/pythia-14m,step121000,seed6,6,121000
They liked the architectural design.,design,design,They liked the design architectural., architectural design, design architectural,architectural,False,-13.348577499389648,-18.284690856933594,4.936113357543945,14067712,EleutherAI/pythia-14m,step121000,seed6,6,121000
They liked the anniversary dinner.,dinner,dinner,They liked the dinner anniversary., anniversary dinner, dinner anniversary,anniversary,True,-16.532546997070312,-17.301036834716797,0.7684898376464844,14067712,EleutherAI/pythia-14m,step121000,seed6,6,121000
He had a career dream.,dream,dream,He had a dream career., career dream, dream career,career,True,-16.170211791992188,-14.632838249206543,-1.5373735427856445,14067712,EleutherAI/pythia-14m,step121000,seed6,6,121000
It was a battery-powered drill.,drill,drill,It was a drill battery-powered., battery-powered drill, drill battery-powered,battery-powered,False,-26.846660614013672,-26.74261474609375,-0.10404586791992188,14067712,EleutherAI/pythia-14m,step121000,seed6,6,121000
It was a physical examination.,examination,examination,It was an examination physical., physical examination, examination physical,physical,False,-13.85552978515625,-19.890674591064453,6.035144805908203,14067712,EleutherAI/pythia-14m,step121000,seed6,6,121000
They had an enthusiastic fan.,fan,fan,They had an fan enthusiastic., enthusiastic fan, fan enthusiastic,enthusiastic,False,-16.24734878540039,-24.187335968017578,7.9399871826171875,14067712,EleutherAI/pythia-14m,step121000,seed6,6,121000
She had a steel file.,file,file,She had a file steel., steel file, file steel,steel,True,-17.843219757080078,-22.028465270996094,4.185245513916016,14067712,EleutherAI/pythia-14m,step121000,seed6,6,121000
It was a plastic film.,film,film,It was a film plastic., plastic film, film plastic,plastic,False,-14.089603424072266,-20.87646484375,6.786861419677734,14067712,EleutherAI/pythia-14m,step121000,seed6,6,121000
It was a concrete foundation.,foundation,foundation,It was a foundation concrete., concrete foundation, foundation concrete,concrete,False,-14.197214126586914,-18.547584533691406,4.350370407104492,14067712,EleutherAI/pythia-14m,step121000,seed6,6,121000
It was a business function.,function,function,It was a function business., business function, function business,business,True,-14.045171737670898,-18.075580596923828,4.03040885925293,14067712,EleutherAI/pythia-14m,step121000,seed6,6,121000
He was on the parade ground.,ground,ground,He was on the ground parade., parade ground, ground parade,parade,True,-16.991695404052734,-16.245872497558594,-0.7458229064941406,14067712,EleutherAI/pythia-14m,step121000,seed6,6,121000
They liked the national guard.,guard,guard,They liked the guard national., national guard, guard national,national,False,-18.869550704956055,-21.21889877319336,2.3493480682373047,14067712,EleutherAI/pythia-14m,step121000,seed6,6,121000
He had a friendly guide.,guide,guide,He had a guide friendly., friendly guide, guide friendly,friendly,False,-15.363548278808594,-20.303245544433594,4.939697265625,14067712,EleutherAI/pythia-14m,step121000,seed6,6,121000
It was a nursing home.,home,home,It was a home nursing., nursing home, home nursing,nursing,True,-13.559638977050781,-17.628232955932617,4.068593978881836,14067712,EleutherAI/pythia-14m,step121000,seed6,6,121000
They had military intelligence.,intelligence,intelligence,They had intelligence military., military intelligence, intelligence military,military,False,-15.314269065856934,-21.921363830566406,6.607094764709473,14067712,EleutherAI/pythia-14m,step121000,seed6,6,121000
It was a special issue.,issue,issue,It was an issue special., special issue, issue special,special,False,-11.90591812133789,-14.772428512573242,2.8665103912353516,14067712,EleutherAI/pythia-14m,step121000,seed6,6,121000
It was a paper jam.,jam,jam,It was a jam paper., paper jam, jam paper,paper,True,-19.983625411987305,-21.600326538085938,1.6167011260986328,14067712,EleutherAI/pythia-14m,step121000,seed6,6,121000
It was a backspace key.,key,key,It was a key backspace., backspace key, key backspace,backspace,True,-28.631729125976562,-26.61822509765625,-2.0135040283203125,14067712,EleutherAI/pythia-14m,step121000,seed6,6,121000
They liked the friendly lamb.,lamb,lamb,They liked the lamb friendly., friendly lamb, lamb friendly,friendly,False,-18.973968505859375,-21.437808990478516,2.4638404846191406,14067712,EleutherAI/pythia-14m,step121000,seed6,6,121000
She had door locks.,lock,locks,She had locks door., door locks, locks door,door,True,-18.610851287841797,-19.478172302246094,0.8673210144042969,14067712,EleutherAI/pythia-14m,step121000,seed6,6,121000
They liked the women's lunch.,lunch,lunch,They liked the lunch women's., women's lunch, lunch women's,women,True,-16.32256507873535,-21.415346145629883,5.092781066894531,14067712,EleutherAI/pythia-14m,step121000,seed6,6,121000
He liked the stock market.,market,market,He liked the market stock., stock market, market stock,stock,True,-13.97640609741211,-16.118629455566406,2.142223358154297,14067712,EleutherAI/pythia-14m,step121000,seed6,6,121000
It was a tennis match.,match,match,It was a match tennis., tennis match, match tennis,tennis,True,-14.833707809448242,-20.59371566772461,5.760007858276367,14067712,EleutherAI/pythia-14m,step121000,seed6,6,121000
It was veterinary medicine.,medicine,medicine,It was medicine veterinary., veterinary medicine, medicine veterinary,veterinary,False,-16.6807861328125,-24.100706100463867,7.419919967651367,14067712,EleutherAI/pythia-14m,step121000,seed6,6,121000
There was a clear message.,message,message,There was a message clear., clear message, message clear,clear,False,-14.107234954833984,-18.144771575927734,4.03753662109375,14067712,EleutherAI/pythia-14m,step121000,seed6,6,121000
It was a clay mold.,mold,mold,It was a mold clay., clay mold, mold clay,clay,True,-19.339025497436523,-21.872127532958984,2.533102035522461,14067712,EleutherAI/pythia-14m,step121000,seed6,6,121000
She saw the fast mole.,mole,mole,She saw the mole fast., fast mole, mole fast,fast,False,-22.01150131225586,-20.648954391479492,-1.3625469207763672,14067712,EleutherAI/pythia-14m,step121000,seed6,6,121000
He liked the civil-rights movement.,movement,movement,He liked the movement civil-rights., civil-rights movement, movement civil-rights,civil-rights,False,-21.799468994140625,-29.50015640258789,7.700687408447266,14067712,EleutherAI/pythia-14m,step121000,seed6,6,121000
It was a shredded newspaper.,newspaper,newspaper,It was a newspaper shredded., shredded newspaper, newspaper shredded,shredded,False,-22.035158157348633,-23.00090789794922,0.9657497406005859,14067712,EleutherAI/pythia-14m,step121000,seed6,6,121000
It was a reddish orange.,orange,orange,It was an orange reddish., reddish orange, orange reddish,reddish,False,-18.000215530395508,-17.17782211303711,-0.8223934173583984,14067712,EleutherAI/pythia-14m,step121000,seed6,6,121000
He saw the ripped page.,page,page,He saw the page ripped., ripped page, page ripped,ripped,False,-21.66063690185547,-19.249189376831055,-2.411447525024414,14067712,EleutherAI/pythia-14m,step121000,seed6,6,121000
It was a tree palm.,palm,palm,It was a palm tree., tree palm, palm tree,tree,True,-20.610599517822266,-15.498617172241211,-5.111982345581055,14067712,EleutherAI/pythia-14m,step121000,seed6,6,121000
It was a consumer panel.,panel,panel,It was a panel consumer., consumer panel, panel consumer,consumer,True,-18.983238220214844,-21.784473419189453,2.8012351989746094,14067712,EleutherAI/pythia-14m,step121000,seed6,6,121000
It was a biblical passage.,passage,passage,It was a passage biblical., biblical passage, passage biblical,biblical,False,-17.028879165649414,-21.515830993652344,4.48695182800293,14067712,EleutherAI/pythia-14m,step121000,seed6,6,121000
It was a secure perch.,perch,perch,It was a perch secure., secure perch, perch secure,secure,False,-24.60889434814453,-24.86890411376953,0.260009765625,14067712,EleutherAI/pythia-14m,step121000,seed6,6,121000
He saw the plastic pitcher.,pitcher,pitcher,He saw the pitcher plastic., plastic pitcher, pitcher plastic,plastic,True,-21.125415802001953,-23.733518600463867,2.608102798461914,14067712,EleutherAI/pythia-14m,step121000,seed6,6,121000
It was a sweet port.,port,port,It was a port sweet., sweet port, port sweet,sweet,False,-18.577171325683594,-21.709407806396484,3.1322364807128906,14067712,EleutherAI/pythia-14m,step121000,seed6,6,121000
He was in a yoga position.,position,position,He was in a position yoga., yoga position, position yoga,yoga,True,-18.919776916503906,-19.904008865356445,0.9842319488525391,14067712,EleutherAI/pythia-14m,step121000,seed6,6,121000
It was a challenging post.,post,post,It was a post challenging., challenging post, post challenging,challenging,False,-15.741872787475586,-17.615781784057617,1.8739089965820312,14067712,EleutherAI/pythia-14m,step121000,seed6,6,121000
He had the quickest punch.,punch,punch,He had the punch quickest., quickest punch, punch quickest,quickest,False,-21.48885726928711,-26.206296920776367,4.717439651489258,14067712,EleutherAI/pythia-14m,step121000,seed6,6,121000
She had a cloudy pupil.,pupil,pupil,She had a pupil cloudy., cloudy pupil, pupil cloudy,cloudy,False,-22.518203735351562,-25.186630249023438,2.668426513671875,14067712,EleutherAI/pythia-14m,step121000,seed6,6,121000
That was a tennis racket.,racket,racket,That was a racket tennis., tennis racket, racket tennis,tennis,True,-19.770523071289062,-22.780811309814453,3.0102882385253906,14067712,EleutherAI/pythia-14m,step121000,seed6,6,121000
He liked granite rock.,rock,rock,He liked rock granite., granite rock, rock granite,granite,True,-21.360055923461914,-22.57575798034668,1.2157020568847656,14067712,EleutherAI/pythia-14m,step121000,seed6,6,121000
He saw the bushy sage.,sage,sage,He saw the sage bushy., bushy sage, sage bushy,bushy,False,-29.00796890258789,-30.853139877319336,1.8451709747314453,14067712,EleutherAI/pythia-14m,step121000,seed6,6,121000
It was a major scale.,scale,scale,It was a scale major., major scale, scale major,major,False,-14.497966766357422,-20.33376693725586,5.8358001708984375,14067712,EleutherAI/pythia-14m,step121000,seed6,6,121000
It was a panoramic scene.,scene,scene,It was a scene panoramic., panoramic scene, scene panoramic,panoramic,False,-18.57975959777832,-24.550209045410156,5.970449447631836,14067712,EleutherAI/pythia-14m,step121000,seed6,6,121000
It was a trained seal.,seal,seal,It was a seal trained., trained seal, seal trained,trained,False,-22.895992279052734,-22.72927474975586,-0.166717529296875,14067712,EleutherAI/pythia-14m,step121000,seed6,6,121000
He used the video tape.,tape,tape,He used the tape video., video tape, tape video,video,True,-12.443351745605469,-13.40761947631836,0.9642677307128906,14067712,EleutherAI/pythia-14m,step121000,seed6,6,121000
It was a technical term.,term,term,It was a term technical., technical term, term technical,technical,False,-17.436365127563477,-20.059722900390625,2.6233577728271484,14067712,EleutherAI/pythia-14m,step121000,seed6,6,121000
It was a diseased tick.,tick,tick,It was a tick diseased., diseased tick, tick diseased,diseased,False,-23.16164779663086,-26.39907455444336,3.2374267578125,14067712,EleutherAI/pythia-14m,step121000,seed6,6,121000
It was a finger tip.,tip,tip,It was a tip finger., finger tip, tip finger,finger,True,-22.192569732666016,-21.43470001220703,-0.7578697204589844,14067712,EleutherAI/pythia-14m,step121000,seed6,6,121000
She liked the professional title.,title,title,She liked the title professional., professional title, title professional,professional,False,-15.343070030212402,-17.804367065429688,2.461297035217285,14067712,EleutherAI/pythia-14m,step121000,seed6,6,121000
It was a bell toll.,toll,toll,It was a toll bell., bell toll, toll bell,bell,True,-22.69306755065918,-23.457523345947266,0.7644557952880859,14067712,EleutherAI/pythia-14m,step121000,seed6,6,121000
She saw the snowshoe tracks.,track,tracks,She saw the tracks snowshoe., snowshoe tracks, tracks snowshoe,snowshoe,True,-29.732980728149414,-31.3234806060791,1.5904998779296875,14067712,EleutherAI/pythia-14m,step121000,seed6,6,121000
They were cluttered yards.,yard,yards,They were yards cluttered., cluttered yards, yards cluttered,cluttered,False,-24.48888397216797,-27.480772018432617,2.9918880462646484,14067712,EleutherAI/pythia-14m,step121000,seed6,6,121000
