sentence,word,string,reversed_sentence,mod_np,reversed_mod,disambiguating_word,non_adjective,original_logprob,reversed_logprob,ratio,n_params,mpath,revision,seed_name,seed,step
It was a desperate act.,act,act,It was an act desperate., desperate act, act desperate,desperate,False,-14.999431610107422,-19.999229431152344,4.999797821044922,14067712,EleutherAI/pythia-14m,step15000,seed1,1,15000
It was a humane act.,act,act,It was an act humane., humane act, act humane,humane,False,-19.381467819213867,-19.3572998046875,-0.024168014526367188,14067712,EleutherAI/pythia-14m,step15000,seed1,1,15000
It was a magic act.,act,act,It was an act magic., magic act, act magic,magic,False,-15.570704460144043,-19.72431182861328,4.153607368469238,14067712,EleutherAI/pythia-14m,step15000,seed1,1,15000
He had a universal appeal.,appeal,appeal,He had an appeal universal., universal appeal, appeal universal,universal,False,-19.15386199951172,-21.61526870727539,2.461406707763672,14067712,EleutherAI/pythia-14m,step15000,seed1,1,15000
He had an undefinable appeal.,appeal,appeal,He had an appeal undefinable., undefinable appeal, appeal undefinable,undefinable,False,-25.000391006469727,-32.099735260009766,7.099344253540039,14067712,EleutherAI/pythia-14m,step15000,seed1,1,15000
He had a legal appeal.,appeal,appeal,He had an appeal legal., legal appeal, appeal legal,legal,False,-15.414247512817383,-18.767061233520508,3.352813720703125,14067712,EleutherAI/pythia-14m,step15000,seed1,1,15000
It was a tense atmosphere.,atmosphere,atmosphere,It was an atmosphere tense., tense atmosphere, atmosphere tense,tense,False,-14.939245223999023,-19.787403106689453,4.84815788269043,14067712,EleutherAI/pythia-14m,step15000,seed1,1,15000
It was a hostile atmosphere.,atmosphere,atmosphere,It was an atmosphere hostile., hostile atmosphere, atmosphere hostile,hostile,False,-15.625425338745117,-20.49095916748047,4.865533828735352,14067712,EleutherAI/pythia-14m,step15000,seed1,1,15000
It was a gaseous atmosphere.,atmosphere,atmosphere,It was an atmosphere gaseous., gaseous atmosphere, atmosphere gaseous,gaseous,False,-16.993267059326172,-20.274703979492188,3.2814369201660156,14067712,EleutherAI/pythia-14m,step15000,seed1,1,15000
It was a gold band.,band,band,It was a band gold., gold band, band gold,gold,True,-13.625492095947266,-19.72216796875,6.096675872802734,14067712,EleutherAI/pythia-14m,step15000,seed1,1,15000
It was a rubber band.,band,band,It was a band rubber., rubber band, band rubber,rubber,True,-13.878580093383789,-25.493328094482422,11.614748001098633,14067712,EleutherAI/pythia-14m,step15000,seed1,1,15000
It was a jazz band.,band,band,It was a band jazz., jazz band, band jazz,jazz,True,-12.269580841064453,-20.039098739624023,7.76951789855957,14067712,EleutherAI/pythia-14m,step15000,seed1,1,15000
There was a police barrier.,barrier,barrier,There was a barrier police., police barrier, barrier police,police,True,-21.07184600830078,-20.8536319732666,-0.2182140350341797,14067712,EleutherAI/pythia-14m,step15000,seed1,1,15000
There was a concrete barrier.,barrier,barrier,There was a barrier concrete., concrete barrier, barrier concrete,concrete,False,-15.8019437789917,-17.415605545043945,1.613661766052246,14067712,EleutherAI/pythia-14m,step15000,seed1,1,15000
There was a language barrier.,barrier,barrier,There was a barrier language., language barrier, barrier language,language,True,-17.85267448425293,-21.811845779418945,3.9591712951660156,14067712,EleutherAI/pythia-14m,step15000,seed1,1,15000
He saw a furry bat.,bat,bat,He saw a bat furry., furry bat, bat furry,furry,False,-19.67658233642578,-22.88470458984375,3.2081222534179688,14067712,EleutherAI/pythia-14m,step15000,seed1,1,15000
He saw a fruit bat.,bat,bat,He saw a bat fruit., fruit bat, bat fruit,fruit,True,-15.927009582519531,-19.054927825927734,3.127918243408203,14067712,EleutherAI/pythia-14m,step15000,seed1,1,15000
He saw a wooden bat.,bat,bat,He saw a bat wooden., wooden bat, bat wooden,wooden,False,-16.427764892578125,-18.741252899169922,2.313488006591797,14067712,EleutherAI/pythia-14m,step15000,seed1,1,15000
He saw the laser beam.,beam,beam,He saw the beam laser., laser beam, beam laser,laser,True,-13.346034049987793,-18.409088134765625,5.063054084777832,14067712,EleutherAI/pythia-14m,step15000,seed1,1,15000
He saw the bright beam.,beam,beam,He saw the beam bright., bright beam, beam bright,bright,False,-17.90648651123047,-19.456485748291016,1.5499992370605469,14067712,EleutherAI/pythia-14m,step15000,seed1,1,15000
He saw the wood beam.,beam,beam,He saw the beam wood., wood beam, beam wood,wood,True,-18.625038146972656,-22.024856567382812,3.3998184204101562,14067712,EleutherAI/pythia-14m,step15000,seed1,1,15000
She had a toy block.,block,block,She had a block toy., toy block, block toy,toy,True,-18.59281349182129,-23.88332748413086,5.29051399230957,14067712,EleutherAI/pythia-14m,step15000,seed1,1,15000
She had a wooden block.,block,block,She had a block wooden., wooden block, block wooden,wooden,False,-15.60969352722168,-22.644563674926758,7.034870147705078,14067712,EleutherAI/pythia-14m,step15000,seed1,1,15000
She had a mental block.,block,block,She had a block mental., mental block, block mental,mental,False,-15.726280212402344,-22.45407485961914,6.727794647216797,14067712,EleutherAI/pythia-14m,step15000,seed1,1,15000
He has coagulated blood.,blood,blood,He has blood coagulated., coagulated blood, blood coagulated,coagulated,True,-31.261491775512695,-32.1956787109375,0.9341869354248047,14067712,EleutherAI/pythia-14m,step15000,seed1,1,15000
He has thin blood.,blood,blood,He has blood thin., thin blood, blood thin,thin,False,-19.57746124267578,-23.51963233947754,3.942171096801758,14067712,EleutherAI/pythia-14m,step15000,seed1,1,15000
He has noble blood.,blood,blood,He has blood noble., noble blood, blood noble,noble,False,-19.34726905822754,-25.922168731689453,6.574899673461914,14067712,EleutherAI/pythia-14m,step15000,seed1,1,15000
It was the ironing board.,board,board,It was the board ironing., ironing board, board ironing,ironing,False,-22.266685485839844,-24.978130340576172,2.711444854736328,14067712,EleutherAI/pythia-14m,step15000,seed1,1,15000
It was the wooden board.,board,board,It was the board wooden., wooden board, board wooden,wooden,False,-15.700401306152344,-22.538114547729492,6.837713241577148,14067712,EleutherAI/pythia-14m,step15000,seed1,1,15000
It was the executive board.,board,board,It was the board executive., executive board, board executive,executive,True,-16.935434341430664,-19.228622436523438,2.2931880950927734,14067712,EleutherAI/pythia-14m,step15000,seed1,1,15000
He had a best-selling book.,book,book,He had a book best-selling., best-selling book, book best-selling,best-selling,False,-15.466357231140137,-24.168306350708008,8.701949119567871,14067712,EleutherAI/pythia-14m,step15000,seed1,1,15000
He had a popular book.,book,book,He had a book popular., popular book, book popular,popular,False,-15.727577209472656,-20.04646110534668,4.318883895874023,14067712,EleutherAI/pythia-14m,step15000,seed1,1,15000
He had a heavy book.,book,book,He had a book heavy., heavy book, book heavy,heavy,False,-17.023500442504883,-20.76335334777832,3.7398529052734375,14067712,EleutherAI/pythia-14m,step15000,seed1,1,15000
They ate a pancake breakfast.,breakfast,breakfast,They ate a breakfast pancake., pancake breakfast, breakfast pancake,pancake,True,-13.538812637329102,-16.961021423339844,3.422208786010742,14067712,EleutherAI/pythia-14m,step15000,seed1,1,15000
They ate a nutritious breakfast.,breakfast,breakfast,They ate a breakfast nutritious., nutritious breakfast, breakfast nutritious,nutritious,False,-21.05191421508789,-24.67229461669922,3.620380401611328,14067712,EleutherAI/pythia-14m,step15000,seed1,1,15000
They ate a family breakfast.,breakfast,breakfast,They ate a breakfast family., family breakfast, breakfast family,family,True,-16.23611831665039,-15.500161170959473,-0.735957145690918,14067712,EleutherAI/pythia-14m,step15000,seed1,1,15000
It was a red cape.,cape,cape,It was a cape red., red cape, cape red,red,False,-18.506906509399414,-23.038623809814453,4.531717300415039,14067712,EleutherAI/pythia-14m,step15000,seed1,1,15000
It was a flowing cape.,cape,cape,It was a cape flowing., flowing cape, cape flowing,flowing,False,-21.409151077270508,-23.591266632080078,2.1821155548095703,14067712,EleutherAI/pythia-14m,step15000,seed1,1,15000
It was a rocky cape.,cape,cape,It was a cape rocky., rocky cape, cape rocky,rocky,False,-19.88068199157715,-24.935203552246094,5.054521560668945,14067712,EleutherAI/pythia-14m,step15000,seed1,1,15000
It was a beer case.,case,case,It was a case beer., beer case, case beer,beer,True,-16.134666442871094,-22.632741928100586,6.498075485229492,14067712,EleutherAI/pythia-14m,step15000,seed1,1,15000
It was a display case.,case,case,It was a case display., display case, case display,display,True,-16.053245544433594,-19.522432327270508,3.469186782836914,14067712,EleutherAI/pythia-14m,step15000,seed1,1,15000
It was a divorce case.,case,case,It was a case divorce., divorce case, case divorce,divorce,True,-12.03316879272461,-20.627593994140625,8.594425201416016,14067712,EleutherAI/pythia-14m,step15000,seed1,1,15000
It was a worthy cause.,cause,cause,It was a cause worthy., worthy cause, cause worthy,worthy,False,-16.09023666381836,-21.839584350585938,5.749347686767578,14067712,EleutherAI/pythia-14m,step15000,seed1,1,15000
It was a political cause.,cause,cause,It was a cause political., political cause, cause political,political,False,-16.899444580078125,-20.071102142333984,3.1716575622558594,14067712,EleutherAI/pythia-14m,step15000,seed1,1,15000
It was a main cause.,cause,cause,It was a cause main., main cause, cause main,main,False,-14.149690628051758,-23.597000122070312,9.447309494018555,14067712,EleutherAI/pythia-14m,step15000,seed1,1,15000
It was a skin cell.,cell,cell,It was a cell skin., skin cell, cell skin,skin,True,-19.149133682250977,-20.937931060791016,1.788797378540039,14067712,EleutherAI/pythia-14m,step15000,seed1,1,15000
It was a brain cell.,cell,cell,It was a cell brain., brain cell, cell brain,brain,True,-15.24679183959961,-20.378780364990234,5.131988525390625,14067712,EleutherAI/pythia-14m,step15000,seed1,1,15000
It was a prison cell.,cell,cell,It was a cell prison., prison cell, cell prison,prison,True,-15.169126510620117,-20.0406494140625,4.871522903442383,14067712,EleutherAI/pythia-14m,step15000,seed1,1,15000
She had a devilish charm.,charm,charm,She had a charm devilish., devilish charm, charm devilish,devilish,False,-21.987741470336914,-28.010135650634766,6.022394180297852,14067712,EleutherAI/pythia-14m,step15000,seed1,1,15000
She had a natural charm.,charm,charm,She had a charm natural., natural charm, charm natural,natural,False,-16.072071075439453,-21.562047958374023,5.48997688293457,14067712,EleutherAI/pythia-14m,step15000,seed1,1,15000
She had a gold charm.,charm,charm,She had a charm gold., gold charm, charm gold,gold,True,-19.893436431884766,-20.845054626464844,0.9516181945800781,14067712,EleutherAI/pythia-14m,step15000,seed1,1,15000
They liked the juicy chicken.,chicken,chicken,They liked the chicken juicy., juicy chicken, chicken juicy,juicy,False,-18.91600227355957,-20.65191078186035,1.7359085083007812,14067712,EleutherAI/pythia-14m,step15000,seed1,1,15000
They liked the roasted chicken.,chicken,chicken,They liked the chicken roasted., roasted chicken, chicken roasted,roasted,False,-15.792060852050781,-16.505386352539062,0.7133255004882812,14067712,EleutherAI/pythia-14m,step15000,seed1,1,15000
They liked the clucking chicken.,chicken,chicken,They liked the chicken clucking., clucking chicken, chicken clucking,clucking,True,-20.924341201782227,-19.977388381958008,-0.9469528198242188,14067712,EleutherAI/pythia-14m,step15000,seed1,1,15000
It was a perceptive class.,class,class,It was a class perceptive., perceptive class, class perceptive,perceptive,False,-23.379581451416016,-26.784765243530273,3.405183792114258,14067712,EleutherAI/pythia-14m,step15000,seed1,1,15000
It was a misbehaving class.,class,class,It was a class misbehaving., misbehaving class, class misbehaving,misbehaving,False,-26.0809383392334,-31.8127384185791,5.731800079345703,14067712,EleutherAI/pythia-14m,step15000,seed1,1,15000
It was a boring class.,class,class,It was a class boring., boring class, class boring,boring,False,-18.322948455810547,-21.324384689331055,3.001436233520508,14067712,EleutherAI/pythia-14m,step15000,seed1,1,15000
It was a film clip.,clip,clip,It was a clip film., film clip, clip film,film,True,-16.68523406982422,-17.89264678955078,1.2074127197265625,14067712,EleutherAI/pythia-14m,step15000,seed1,1,15000
It was a video clip.,clip,clip,It was a clip video., video clip, clip video,video,True,-13.256209373474121,-19.11587905883789,5.8596696853637695,14067712,EleutherAI/pythia-14m,step15000,seed1,1,15000
It was a hair clip.,clip,clip,It was a clip hair., hair clip, clip hair,hair,True,-20.039348602294922,-23.342174530029297,3.302825927734375,14067712,EleutherAI/pythia-14m,step15000,seed1,1,15000
It was an icy cold.,cold,cold,It was an cold icy., icy cold, cold icy,icy,False,-11.779756546020508,-19.490341186523438,7.71058464050293,14067712,EleutherAI/pythia-14m,step15000,seed1,1,15000
It was a freezing cold.,cold,cold,It was a cold freezing., freezing cold, cold freezing,freezing,False,-13.661539077758789,-14.73798942565918,1.0764503479003906,14067712,EleutherAI/pythia-14m,step15000,seed1,1,15000
It was a chest cold.,cold,cold,It was a cold chest., chest cold, cold chest,chest,False,-17.468387603759766,-13.34565544128418,-4.122732162475586,14067712,EleutherAI/pythia-14m,step15000,seed1,1,15000
It was a gossip column.,column,column,It was a column gossip., gossip column, column gossip,gossip,True,-20.371047973632812,-27.505126953125,7.1340789794921875,14067712,EleutherAI/pythia-14m,step15000,seed1,1,15000
It was a sports column.,column,column,It was a column sports., sports column, column sports,sports,True,-20.555580139160156,-25.739253997802734,5.183673858642578,14067712,EleutherAI/pythia-14m,step15000,seed1,1,15000
It was a concrete column.,column,column,It was a column concrete., concrete column, column concrete,concrete,False,-19.12812614440918,-20.43946075439453,1.3113346099853516,14067712,EleutherAI/pythia-14m,step15000,seed1,1,15000
He liked the investment company.,company,company,He liked the company investment., investment company, company investment,investment,True,-16.034706115722656,-18.541751861572266,2.5070457458496094,14067712,EleutherAI/pythia-14m,step15000,seed1,1,15000
He liked the pharmaceutical company.,company,company,He liked the company pharmaceutical., pharmaceutical company, company pharmaceutical,pharmaceutical,False,-15.997429847717285,-21.380573272705078,5.383143424987793,14067712,EleutherAI/pythia-14m,step15000,seed1,1,15000
He liked the pleasant company.,company,company,He liked the company pleasant., pleasant company, company pleasant,pleasant,False,-20.71255874633789,-21.447751998901367,0.7351932525634766,14067712,EleutherAI/pythia-14m,step15000,seed1,1,15000
It was a waffle cone.,cone,cone,It was a cone waffle., waffle cone, cone waffle,waffle,True,-29.723739624023438,-30.379173278808594,0.6554336547851562,14067712,EleutherAI/pythia-14m,step15000,seed1,1,15000
It was a sugar cone.,cone,cone,It was a cone sugar., sugar cone, cone sugar,sugar,True,-19.673072814941406,-23.13507843017578,3.462005615234375,14067712,EleutherAI/pythia-14m,step15000,seed1,1,15000
It was an orange cone.,cone,cone,It was an cone orange., orange cone, cone orange,orange,False,-16.625747680664062,-25.396011352539062,8.770263671875,14067712,EleutherAI/pythia-14m,step15000,seed1,1,15000
He made a charitable contribution.,contribution,contribution,He made a contribution charitable., charitable contribution, contribution charitable,charitable,False,-18.279199600219727,-24.17784881591797,5.898649215698242,14067712,EleutherAI/pythia-14m,step15000,seed1,1,15000
He made a voluntary contribution.,contribution,contribution,He made a contribution voluntary., voluntary contribution, contribution voluntary,voluntary,False,-17.929824829101562,-23.643123626708984,5.713298797607422,14067712,EleutherAI/pythia-14m,step15000,seed1,1,15000
He made a scholarly contribution.,contribution,contribution,He made a contribution scholarly., scholarly contribution, contribution scholarly,scholarly,False,-18.95197105407715,-26.93856430053711,7.986593246459961,14067712,EleutherAI/pythia-14m,step15000,seed1,1,15000
That was the noble count.,count,count,That was the count noble., noble count, count noble,noble,False,-19.509218215942383,-25.694055557250977,6.184837341308594,14067712,EleutherAI/pythia-14m,step15000,seed1,1,15000
That was the vengeful count.,count,count,That was the count vengeful., vengeful count, count vengeful,vengeful,False,-24.224552154541016,-30.358394622802734,6.133842468261719,14067712,EleutherAI/pythia-14m,step15000,seed1,1,15000
That was the final count.,count,count,That was the count final., final count, count final,final,False,-14.435796737670898,-19.85936737060547,5.42357063293457,14067712,EleutherAI/pythia-14m,step15000,seed1,1,15000
It was an introductory course.,course,course,It was an course introductory., introductory course, course introductory,introductory,False,-10.650398254394531,-26.46560287475586,15.815204620361328,14067712,EleutherAI/pythia-14m,step15000,seed1,1,15000
It was a pass-fail course.,course,course,It was a course pass-fail., pass-fail course, course pass-fail,pass-fail,False,-28.232467651367188,-31.263107299804688,3.0306396484375,14067712,EleutherAI/pythia-14m,step15000,seed1,1,15000
It was a charted course.,course,course,It was a course charted., charted course, course charted,charted,False,-21.942411422729492,-23.338918685913086,1.3965072631835938,14067712,EleutherAI/pythia-14m,step15000,seed1,1,15000
It was a dinner date.,date,date,It was a date dinner., dinner date, date dinner,dinner,True,-18.03314208984375,-19.051353454589844,1.0182113647460938,14067712,EleutherAI/pythia-14m,step15000,seed1,1,15000
It was a blind date.,date,date,It was a date blind., blind date, date blind,blind,False,-19.657543182373047,-22.34537124633789,2.6878280639648438,14067712,EleutherAI/pythia-14m,step15000,seed1,1,15000
It was an expiration date.,date,date,It was an date expiration., expiration date, date expiration,expiration,True,-10.962550163269043,-22.948516845703125,11.985966682434082,14067712,EleutherAI/pythia-14m,step15000,seed1,1,15000
It was about forty degrees.,degree,degrees,It was about degrees forty., forty degrees, degrees forty,forty,True,-17.938899993896484,-21.590784072875977,3.651884078979492,14067712,EleutherAI/pythia-14m,step15000,seed1,1,15000
It was about fifty degrees.,degree,degrees,It was about degrees fifty., fifty degrees, degrees fifty,fifty,True,-17.00731658935547,-21.719451904296875,4.712135314941406,14067712,EleutherAI/pythia-14m,step15000,seed1,1,15000
It was about associate degrees.,degree,degrees,It was about degrees associate., associate degrees, degrees associate,associate,False,-22.096235275268555,-27.762062072753906,5.665826797485352,14067712,EleutherAI/pythia-14m,step15000,seed1,1,15000
They liked the floral design.,design,design,They liked the design floral., floral design, design floral,floral,False,-14.113717079162598,-19.84528160095215,5.731564521789551,14067712,EleutherAI/pythia-14m,step15000,seed1,1,15000
They liked the geometric design.,design,design,They liked the design geometric., geometric design, design geometric,geometric,False,-14.537520408630371,-20.308937072753906,5.771416664123535,14067712,EleutherAI/pythia-14m,step15000,seed1,1,15000
They liked the product design.,design,design,They liked the design product., product design, design product,product,True,-16.629981994628906,-16.285842895507812,-0.34413909912109375,14067712,EleutherAI/pythia-14m,step15000,seed1,1,15000
They liked the turkey dinner.,dinner,dinner,They liked the dinner turkey., turkey dinner, dinner turkey,turkey,True,-15.806650161743164,-17.333328247070312,1.5266780853271484,14067712,EleutherAI/pythia-14m,step15000,seed1,1,15000
They liked the light dinner.,dinner,dinner,They liked the dinner light., light dinner, dinner light,light,False,-18.981807708740234,-17.660430908203125,-1.3213768005371094,14067712,EleutherAI/pythia-14m,step15000,seed1,1,15000
They liked the formal dinner.,dinner,dinner,They liked the dinner formal., formal dinner, dinner formal,formal,False,-16.825298309326172,-20.548809051513672,3.7235107421875,14067712,EleutherAI/pythia-14m,step15000,seed1,1,15000
He had a recurring dream.,dream,dream,He had a dream recurring., recurring dream, dream recurring,recurring,False,-17.06195068359375,-22.737640380859375,5.675689697265625,14067712,EleutherAI/pythia-14m,step15000,seed1,1,15000
He had a bad dream.,dream,dream,He had a dream bad., bad dream, dream bad,bad,False,-13.032133102416992,-19.85470199584961,6.822568893432617,14067712,EleutherAI/pythia-14m,step15000,seed1,1,15000
He had a childhood dream.,dream,dream,He had a dream childhood., childhood dream, dream childhood,childhood,True,-18.384626388549805,-23.773181915283203,5.388555526733398,14067712,EleutherAI/pythia-14m,step15000,seed1,1,15000
It was a grueling drill.,drill,drill,It was a drill grueling., grueling drill, drill grueling,grueling,False,-22.649457931518555,-28.153675079345703,5.504217147827148,14067712,EleutherAI/pythia-14m,step15000,seed1,1,15000
It was a challenging drill.,drill,drill,It was a drill challenging., challenging drill, drill challenging,challenging,False,-20.146085739135742,-23.803897857666016,3.6578121185302734,14067712,EleutherAI/pythia-14m,step15000,seed1,1,15000
It was an electric drill.,drill,drill,It was an drill electric., electric drill, drill electric,electric,False,-15.243642807006836,-24.36886215209961,9.125219345092773,14067712,EleutherAI/pythia-14m,step15000,seed1,1,15000
It was a multiple-choice examination.,examination,examination,It was an examination multiple-choice., multiple-choice examination, examination multiple-choice,multiple-choice,False,-29.333728790283203,-36.39506912231445,7.06134033203125,14067712,EleutherAI/pythia-14m,step15000,seed1,1,15000
It was a difficult examination.,examination,examination,It was an examination difficult., difficult examination, examination difficult,difficult,False,-16.391942977905273,-21.650148391723633,5.258205413818359,14067712,EleutherAI/pythia-14m,step15000,seed1,1,15000
It was a prostate examination.,examination,examination,It was an examination prostate., prostate examination, examination prostate,prostate,True,-23.859752655029297,-24.93029022216797,1.0705375671386719,14067712,EleutherAI/pythia-14m,step15000,seed1,1,15000
They had an electric fan.,fan,fan,They had an fan electric., electric fan, fan electric,electric,False,-13.801567077636719,-26.320220947265625,12.518653869628906,14067712,EleutherAI/pythia-14m,step15000,seed1,1,15000
They had a ceiling fan.,fan,fan,They had a fan ceiling., ceiling fan, fan ceiling,ceiling,True,-15.639019012451172,-19.444419860839844,3.805400848388672,14067712,EleutherAI/pythia-14m,step15000,seed1,1,15000
They had a zealous fan.,fan,fan,They had a fan zealous., zealous fan, fan zealous,zealous,False,-21.369321823120117,-27.83395767211914,6.464635848999023,14067712,EleutherAI/pythia-14m,step15000,seed1,1,15000
She had a text file.,file,file,She had a file text., text file, file text,text,True,-14.930326461791992,-17.33592987060547,2.4056034088134766,14067712,EleutherAI/pythia-14m,step15000,seed1,1,15000
She had a data file.,file,file,She had a file data., data file, file data,data,True,-16.01028060913086,-17.524444580078125,1.5141639709472656,14067712,EleutherAI/pythia-14m,step15000,seed1,1,15000
She had a nail file.,file,file,She had a file nail., nail file, file nail,nail,True,-18.094993591308594,-21.54793930053711,3.4529457092285156,14067712,EleutherAI/pythia-14m,step15000,seed1,1,15000
It was an action film.,film,film,It was an film action., action film, film action,action,True,-13.210043907165527,-19.021141052246094,5.811097145080566,14067712,EleutherAI/pythia-14m,step15000,seed1,1,15000
It was a censored film.,film,film,It was a film censored., censored film, film censored,censored,False,-21.26211929321289,-21.27020263671875,0.008083343505859375,14067712,EleutherAI/pythia-14m,step15000,seed1,1,15000
It was a transparent film.,film,film,It was a film transparent., transparent film, film transparent,transparent,False,-17.081058502197266,-21.647716522216797,4.566658020019531,14067712,EleutherAI/pythia-14m,step15000,seed1,1,15000
It was a charitable foundation.,foundation,foundation,It was a foundation charitable., charitable foundation, foundation charitable,charitable,False,-14.113983154296875,-21.891647338867188,7.7776641845703125,14067712,EleutherAI/pythia-14m,step15000,seed1,1,15000
It was an educational foundation.,foundation,foundation,It was an foundation educational., educational foundation, foundation educational,educational,False,-15.048891067504883,-25.322681427001953,10.27379035949707,14067712,EleutherAI/pythia-14m,step15000,seed1,1,15000
It was a wooden foundation.,foundation,foundation,It was a foundation wooden., wooden foundation, foundation wooden,wooden,False,-14.520782470703125,-21.447635650634766,6.926853179931641,14067712,EleutherAI/pythia-14m,step15000,seed1,1,15000
It was a mathematical function.,function,function,It was a function mathematical., mathematical function, function mathematical,mathematical,False,-15.978089332580566,-21.4468936920166,5.468804359436035,14067712,EleutherAI/pythia-14m,step15000,seed1,1,15000
It was a linear function.,function,function,It was a function linear., linear function, function linear,linear,False,-16.414194107055664,-22.012348175048828,5.598154067993164,14067712,EleutherAI/pythia-14m,step15000,seed1,1,15000
