sentence,word,string,reversed_sentence,mod_np,reversed_mod,disambiguating_word,non_adjective,original_logprob,reversed_logprob,ratio,n_params,mpath,revision,seed_name,seed,step
It was a fall term.,term,term,It was a term fall., fall term, term fall,fall,True,-17.158634185791016,-21.233612060546875,4.074977874755859,14067712,EleutherAI/pythia-14m,step93000,seed8,8,93000
It was a legal term.,term,term,It was a term legal., legal term, term legal,legal,False,-16.558792114257812,-20.363861083984375,3.8050689697265625,14067712,EleutherAI/pythia-14m,step93000,seed8,8,93000
It was a clock tick.,tick,tick,It was a tick clock., clock tick, tick clock,clock,True,-17.912052154541016,-19.54534149169922,1.6332893371582031,14067712,EleutherAI/pythia-14m,step93000,seed8,8,93000
It was an audible tick.,tick,tick,It was an tick audible., audible tick, tick audible,audible,False,-16.724761962890625,-27.85079574584961,11.126033782958984,14067712,EleutherAI/pythia-14m,step93000,seed8,8,93000
It was a parasitic tick.,tick,tick,It was a tick parasitic., parasitic tick, tick parasitic,parasitic,False,-22.05213737487793,-25.47307586669922,3.420938491821289,14067712,EleutherAI/pythia-14m,step93000,seed8,8,93000
It was a generous tip.,tip,tip,It was a tip generous., generous tip, tip generous,generous,False,-19.143918991088867,-23.87042808532715,4.726509094238281,14067712,EleutherAI/pythia-14m,step93000,seed8,8,93000
It was a stingy tip.,tip,tip,It was a tip stingy., stingy tip, tip stingy,stingy,False,-23.44466209411621,-25.886425018310547,2.441762924194336,14067712,EleutherAI/pythia-14m,step93000,seed8,8,93000
It was a pencil tip.,tip,tip,It was a tip pencil., pencil tip, tip pencil,pencil,True,-18.85974884033203,-20.5333309173584,1.6735820770263672,14067712,EleutherAI/pythia-14m,step93000,seed8,8,93000
She liked the essay title.,title,title,She liked the title essay., essay title, title essay,essay,True,-19.724538803100586,-17.565898895263672,-2.158639907836914,14067712,EleutherAI/pythia-14m,step93000,seed8,8,93000
She liked the poem title.,title,title,She liked the title poem., poem title, title poem,poem,True,-18.562427520751953,-15.172224044799805,-3.3902034759521484,14067712,EleutherAI/pythia-14m,step93000,seed8,8,93000
She liked the academic title.,title,title,She liked the title academic., academic title, title academic,academic,False,-17.326459884643555,-19.722820281982422,2.396360397338867,14067712,EleutherAI/pythia-14m,step93000,seed8,8,93000
It was a costly toll.,toll,toll,It was a toll costly., costly toll, toll costly,costly,False,-16.961965560913086,-21.45484161376953,4.492876052856445,14067712,EleutherAI/pythia-14m,step93000,seed8,8,93000
It was a road toll.,toll,toll,It was a toll road., road toll, toll road,road,True,-19.064285278320312,-17.68073272705078,-1.3835525512695312,14067712,EleutherAI/pythia-14m,step93000,seed8,8,93000
It was a loud toll.,toll,toll,It was a toll loud., loud toll, toll loud,loud,False,-19.211570739746094,-22.94001007080078,3.7284393310546875,14067712,EleutherAI/pythia-14m,step93000,seed8,8,93000
She saw the train tracks.,track,tracks,She saw the tracks train., train tracks, tracks train,train,True,-16.798248291015625,-18.688499450683594,1.8902511596679688,14067712,EleutherAI/pythia-14m,step93000,seed8,8,93000
She saw the trolley tracks.,track,tracks,She saw the tracks trolley., trolley tracks, tracks trolley,trolley,True,-23.126296997070312,-25.17339324951172,2.0470962524414062,14067712,EleutherAI/pythia-14m,step93000,seed8,8,93000
She saw the moose tracks.,track,tracks,She saw the tracks moose., moose tracks, tracks moose,moose,False,-22.834564208984375,-23.540584564208984,0.7060203552246094,14067712,EleutherAI/pythia-14m,step93000,seed8,8,93000
It was five yards.,yard,yards,It was yards five., five yards, yards five,five,True,-15.123869895935059,-25.676939010620117,10.553069114685059,14067712,EleutherAI/pythia-14m,step93000,seed8,8,93000
It was ten yards.,yard,yards,It was yards ten., ten yards, yards ten,ten,True,-16.10504913330078,-26.219968795776367,10.114919662475586,14067712,EleutherAI/pythia-14m,step93000,seed8,8,93000
They were big yards.,yard,yards,They were yards big., big yards, yards big,big,False,-16.90196990966797,-20.522781372070312,3.6208114624023438,14067712,EleutherAI/pythia-14m,step93000,seed8,8,93000
It was a comedic act.,act,act,It was an act comedic., comedic act, act comedic,comedic,False,-18.19318389892578,-22.025651931762695,3.832468032836914,14067712,EleutherAI/pythia-14m,step93000,seed8,8,93000
He had a pending appeal.,appeal,appeal,He had an appeal pending., pending appeal, appeal pending,pending,False,-16.650911331176758,-14.520187377929688,-2.1307239532470703,14067712,EleutherAI/pythia-14m,step93000,seed8,8,93000
It was a polluted atmosphere.,atmosphere,atmosphere,It was an atmosphere polluted., polluted atmosphere, atmosphere polluted,polluted,False,-21.74669075012207,-20.754440307617188,-0.9922504425048828,14067712,EleutherAI/pythia-14m,step93000,seed8,8,93000
It was a country band.,band,band,It was a band country., country band, band country,country,True,-16.87861442565918,-18.76264190673828,1.8840274810791016,14067712,EleutherAI/pythia-14m,step93000,seed8,8,93000
There was a religious barrier.,barrier,barrier,There was a barrier religious., religious barrier, barrier religious,religious,False,-16.986007690429688,-24.11883544921875,7.1328277587890625,14067712,EleutherAI/pythia-14m,step93000,seed8,8,93000
He saw a baseball bat.,bat,bat,He saw a bat baseball., baseball bat, bat baseball,baseball,True,-10.980109214782715,-20.29401397705078,9.313904762268066,14067712,EleutherAI/pythia-14m,step93000,seed8,8,93000
He saw the balance beam.,beam,beam,He saw the beam balance., balance beam, beam balance,balance,True,-20.571441650390625,-20.46837615966797,-0.10306549072265625,14067712,EleutherAI/pythia-14m,step93000,seed8,8,93000
She had a writer's block.,block,block,She had a block writer's., writer's block, block writer's,writer,True,-24.263328552246094,-26.102203369140625,1.8388748168945312,14067712,EleutherAI/pythia-14m,step93000,seed8,8,93000
He has royal blood.,blood,blood,He has blood royal., royal blood, blood royal,royal,False,-20.7850399017334,-26.011093139648438,5.226053237915039,14067712,EleutherAI/pythia-14m,step93000,seed8,8,93000
It was the school board.,board,board,It was the board school., school board, board school,school,True,-12.6607666015625,-14.83039665222168,2.1696300506591797,14067712,EleutherAI/pythia-14m,step93000,seed8,8,93000
He had a leather-bound book.,book,book,He had a book leather-bound., leather-bound book, book leather-bound,leather-bound,False,-25.86663055419922,-30.527347564697266,4.660717010498047,14067712,EleutherAI/pythia-14m,step93000,seed8,8,93000
They ate a lonely breakfast.,breakfast,breakfast,They ate a breakfast lonely., lonely breakfast, breakfast lonely,lonely,False,-15.455181121826172,-20.091768264770508,4.636587142944336,14067712,EleutherAI/pythia-14m,step93000,seed8,8,93000
It was an island cape.,cape,cape,It was an cape island., island cape, cape island,island,True,-20.931514739990234,-25.265289306640625,4.333774566650391,14067712,EleutherAI/pythia-14m,step93000,seed8,8,93000
It was a criminal case.,case,case,It was a case criminal., criminal case, case criminal,criminal,False,-10.17662239074707,-15.496498107910156,5.319875717163086,14067712,EleutherAI/pythia-14m,step93000,seed8,8,93000
It was a primary cause.,cause,cause,It was a cause primary., primary cause, cause primary,primary,False,-12.673971176147461,-22.713821411132812,10.039850234985352,14067712,EleutherAI/pythia-14m,step93000,seed8,8,93000
It was a jail cell.,cell,cell,It was a cell jail., jail cell, cell jail,jail,True,-17.90567398071289,-22.275894165039062,4.370220184326172,14067712,EleutherAI/pythia-14m,step93000,seed8,8,93000
She had a good-luck charm.,charm,charm,She had a charm good-luck., good-luck charm, charm good-luck,good-luck,False,-28.52853775024414,-32.69560623168945,4.1670684814453125,14067712,EleutherAI/pythia-14m,step93000,seed8,8,93000
They liked the pet chicken.,chicken,chicken,They liked the chicken pet., pet chicken, chicken pet,pet,True,-18.519947052001953,-16.879623413085938,-1.6403236389160156,14067712,EleutherAI/pythia-14m,step93000,seed8,8,93000
It was a stimulating class.,class,class,It was a class stimulating., stimulating class, class stimulating,stimulating,False,-20.046977996826172,-22.330888748168945,2.2839107513427734,14067712,EleutherAI/pythia-14m,step93000,seed8,8,93000
It was a metal clip.,clip,clip,It was a clip metal., metal clip, clip metal,metal,True,-19.840200424194336,-22.002395629882812,2.1621952056884766,14067712,EleutherAI/pythia-14m,step93000,seed8,8,93000
It was a common cold.,cold,cold,It was a cold common., common cold, cold common,common,False,-14.980131149291992,-17.25861358642578,2.278482437133789,14067712,EleutherAI/pythia-14m,step93000,seed8,8,93000
It was a marble column.,column,column,It was a column marble., marble column, column marble,marble,True,-17.94396209716797,-24.035675048828125,6.091712951660156,14067712,EleutherAI/pythia-14m,step93000,seed8,8,93000
He liked the polite company.,company,company,He liked the company polite., polite company, company polite,polite,False,-17.341365814208984,-18.98724937438965,1.645883560180664,14067712,EleutherAI/pythia-14m,step93000,seed8,8,93000
It was a traffic cone.,cone,cone,It was a cone traffic., traffic cone, cone traffic,traffic,True,-18.25912857055664,-24.10525131225586,5.846122741699219,14067712,EleutherAI/pythia-14m,step93000,seed8,8,93000
He made a well-written contribution.,contribution,contribution,He made a contribution well-written., well-written contribution, contribution well-written,well-written,False,-20.246440887451172,-24.909530639648438,4.663089752197266,14067712,EleutherAI/pythia-14m,step93000,seed8,8,93000
That was the correct count.,count,count,That was the count correct., correct count, count correct,correct,False,-15.67640209197998,-20.705059051513672,5.028656959533691,14067712,EleutherAI/pythia-14m,step93000,seed8,8,93000
It was a collision course.,course,course,It was a course collision., collision course, course collision,collision,True,-13.834966659545898,-20.96112823486328,7.126161575317383,14067712,EleutherAI/pythia-14m,step93000,seed8,8,93000
It was a historical date.,date,date,It was a date historical., historical date, date historical,historical,False,-15.612354278564453,-18.819852828979492,3.207498550415039,14067712,EleutherAI/pythia-14m,step93000,seed8,8,93000
It was about college degrees.,degree,degrees,It was about degrees college., college degrees, degrees college,college,True,-16.539583206176758,-24.383853912353516,7.844270706176758,14067712,EleutherAI/pythia-14m,step93000,seed8,8,93000
They liked the architectural design.,design,design,They liked the design architectural., architectural design, design architectural,architectural,False,-15.488565444946289,-20.884681701660156,5.396116256713867,14067712,EleutherAI/pythia-14m,step93000,seed8,8,93000
They liked the anniversary dinner.,dinner,dinner,They liked the dinner anniversary., anniversary dinner, dinner anniversary,anniversary,True,-18.234466552734375,-18.523418426513672,0.2889518737792969,14067712,EleutherAI/pythia-14m,step93000,seed8,8,93000
He had a career dream.,dream,dream,He had a dream career., career dream, dream career,career,True,-14.564809799194336,-17.27849769592285,2.7136878967285156,14067712,EleutherAI/pythia-14m,step93000,seed8,8,93000
It was a battery-powered drill.,drill,drill,It was a drill battery-powered., battery-powered drill, drill battery-powered,battery-powered,False,-24.52060317993164,-28.22948455810547,3.708881378173828,14067712,EleutherAI/pythia-14m,step93000,seed8,8,93000
It was a physical examination.,examination,examination,It was an examination physical., physical examination, examination physical,physical,False,-12.136247634887695,-19.501995086669922,7.365747451782227,14067712,EleutherAI/pythia-14m,step93000,seed8,8,93000
They had an enthusiastic fan.,fan,fan,They had an fan enthusiastic., enthusiastic fan, fan enthusiastic,enthusiastic,False,-14.997718811035156,-26.48883628845215,11.491117477416992,14067712,EleutherAI/pythia-14m,step93000,seed8,8,93000
She had a steel file.,file,file,She had a file steel., steel file, file steel,steel,True,-16.691181182861328,-23.82903289794922,7.137851715087891,14067712,EleutherAI/pythia-14m,step93000,seed8,8,93000
It was a plastic film.,film,film,It was a film plastic., plastic film, film plastic,plastic,False,-14.84753131866455,-21.13043975830078,6.2829084396362305,14067712,EleutherAI/pythia-14m,step93000,seed8,8,93000
It was a concrete foundation.,foundation,foundation,It was a foundation concrete., concrete foundation, foundation concrete,concrete,False,-14.789385795593262,-22.864673614501953,8.075287818908691,14067712,EleutherAI/pythia-14m,step93000,seed8,8,93000
It was a business function.,function,function,It was a function business., business function, function business,business,True,-16.63918685913086,-19.716712951660156,3.077526092529297,14067712,EleutherAI/pythia-14m,step93000,seed8,8,93000
He was on the parade ground.,ground,ground,He was on the ground parade., parade ground, ground parade,parade,True,-18.747968673706055,-20.739290237426758,1.9913215637207031,14067712,EleutherAI/pythia-14m,step93000,seed8,8,93000
They liked the national guard.,guard,guard,They liked the guard national., national guard, guard national,national,False,-15.68971061706543,-21.572717666625977,5.883007049560547,14067712,EleutherAI/pythia-14m,step93000,seed8,8,93000
He had a friendly guide.,guide,guide,He had a guide friendly., friendly guide, guide friendly,friendly,False,-14.185081481933594,-21.632184982299805,7.447103500366211,14067712,EleutherAI/pythia-14m,step93000,seed8,8,93000
It was a nursing home.,home,home,It was a home nursing., nursing home, home nursing,nursing,True,-12.16274356842041,-18.622817993164062,6.460074424743652,14067712,EleutherAI/pythia-14m,step93000,seed8,8,93000
They had military intelligence.,intelligence,intelligence,They had intelligence military., military intelligence, intelligence military,military,False,-17.3310489654541,-21.310855865478516,3.979806900024414,14067712,EleutherAI/pythia-14m,step93000,seed8,8,93000
It was a special issue.,issue,issue,It was an issue special., special issue, issue special,special,False,-11.804826736450195,-16.344953536987305,4.540126800537109,14067712,EleutherAI/pythia-14m,step93000,seed8,8,93000
It was a paper jam.,jam,jam,It was a jam paper., paper jam, jam paper,paper,True,-20.569324493408203,-19.617666244506836,-0.9516582489013672,14067712,EleutherAI/pythia-14m,step93000,seed8,8,93000
It was a backspace key.,key,key,It was a key backspace., backspace key, key backspace,backspace,True,-27.108020782470703,-25.120346069335938,-1.9876747131347656,14067712,EleutherAI/pythia-14m,step93000,seed8,8,93000
They liked the friendly lamb.,lamb,lamb,They liked the lamb friendly., friendly lamb, lamb friendly,friendly,False,-21.85460090637207,-24.431365966796875,2.5767650604248047,14067712,EleutherAI/pythia-14m,step93000,seed8,8,93000
She had door locks.,lock,locks,She had locks door., door locks, locks door,door,True,-17.958316802978516,-20.212444305419922,2.2541275024414062,14067712,EleutherAI/pythia-14m,step93000,seed8,8,93000
They liked the women's lunch.,lunch,lunch,They liked the lunch women's., women's lunch, lunch women's,women,True,-16.939945220947266,-24.091482162475586,7.15153694152832,14067712,EleutherAI/pythia-14m,step93000,seed8,8,93000
He liked the stock market.,market,market,He liked the market stock., stock market, market stock,stock,True,-13.870314598083496,-16.346426010131836,2.47611141204834,14067712,EleutherAI/pythia-14m,step93000,seed8,8,93000
It was a tennis match.,match,match,It was a match tennis., tennis match, match tennis,tennis,True,-14.559466361999512,-19.300411224365234,4.740944862365723,14067712,EleutherAI/pythia-14m,step93000,seed8,8,93000
It was veterinary medicine.,medicine,medicine,It was medicine veterinary., veterinary medicine, medicine veterinary,veterinary,False,-18.224021911621094,-23.606258392333984,5.382236480712891,14067712,EleutherAI/pythia-14m,step93000,seed8,8,93000
There was a clear message.,message,message,There was a message clear., clear message, message clear,clear,False,-12.166427612304688,-18.457828521728516,6.291400909423828,14067712,EleutherAI/pythia-14m,step93000,seed8,8,93000
It was a clay mold.,mold,mold,It was a mold clay., clay mold, mold clay,clay,True,-18.94582748413086,-20.601470947265625,1.6556434631347656,14067712,EleutherAI/pythia-14m,step93000,seed8,8,93000
She saw the fast mole.,mole,mole,She saw the mole fast., fast mole, mole fast,fast,False,-19.01186752319336,-21.361927032470703,2.3500595092773438,14067712,EleutherAI/pythia-14m,step93000,seed8,8,93000
He liked the civil-rights movement.,movement,movement,He liked the movement civil-rights., civil-rights movement, movement civil-rights,civil-rights,False,-20.613807678222656,-28.537019729614258,7.923212051391602,14067712,EleutherAI/pythia-14m,step93000,seed8,8,93000
It was a shredded newspaper.,newspaper,newspaper,It was a newspaper shredded., shredded newspaper, newspaper shredded,shredded,False,-25.534313201904297,-23.33916473388672,-2.195148468017578,14067712,EleutherAI/pythia-14m,step93000,seed8,8,93000
It was a reddish orange.,orange,orange,It was an orange reddish., reddish orange, orange reddish,reddish,False,-19.036081314086914,-16.318883895874023,-2.7171974182128906,14067712,EleutherAI/pythia-14m,step93000,seed8,8,93000
He saw the ripped page.,page,page,He saw the page ripped., ripped page, page ripped,ripped,False,-18.100662231445312,-19.986942291259766,1.8862800598144531,14067712,EleutherAI/pythia-14m,step93000,seed8,8,93000
It was a tree palm.,palm,palm,It was a palm tree., tree palm, palm tree,tree,True,-21.503393173217773,-13.589631080627441,-7.913762092590332,14067712,EleutherAI/pythia-14m,step93000,seed8,8,93000
It was a consumer panel.,panel,panel,It was a panel consumer., consumer panel, panel consumer,consumer,True,-19.281627655029297,-22.258373260498047,2.97674560546875,14067712,EleutherAI/pythia-14m,step93000,seed8,8,93000
It was a biblical passage.,passage,passage,It was a passage biblical., biblical passage, passage biblical,biblical,False,-15.821413040161133,-24.801538467407227,8.980125427246094,14067712,EleutherAI/pythia-14m,step93000,seed8,8,93000
It was a secure perch.,perch,perch,It was a perch secure., secure perch, perch secure,secure,False,-21.957304000854492,-26.38396644592285,4.426662445068359,14067712,EleutherAI/pythia-14m,step93000,seed8,8,93000
He saw the plastic pitcher.,pitcher,pitcher,He saw the pitcher plastic., plastic pitcher, pitcher plastic,plastic,True,-19.462717056274414,-23.54521369934082,4.082496643066406,14067712,EleutherAI/pythia-14m,step93000,seed8,8,93000
It was a sweet port.,port,port,It was a port sweet., sweet port, port sweet,sweet,False,-16.973464965820312,-22.049327850341797,5.075862884521484,14067712,EleutherAI/pythia-14m,step93000,seed8,8,93000
He was in a yoga position.,position,position,He was in a position yoga., yoga position, position yoga,yoga,True,-17.903676986694336,-18.956493377685547,1.052816390991211,14067712,EleutherAI/pythia-14m,step93000,seed8,8,93000
It was a challenging post.,post,post,It was a post challenging., challenging post, post challenging,challenging,False,-16.451717376708984,-19.699857711791992,3.248140335083008,14067712,EleutherAI/pythia-14m,step93000,seed8,8,93000
He had the quickest punch.,punch,punch,He had the punch quickest., quickest punch, punch quickest,quickest,False,-19.73012924194336,-23.29145622253418,3.5613269805908203,14067712,EleutherAI/pythia-14m,step93000,seed8,8,93000
She had a cloudy pupil.,pupil,pupil,She had a pupil cloudy., cloudy pupil, pupil cloudy,cloudy,False,-23.608882904052734,-24.919282913208008,1.3104000091552734,14067712,EleutherAI/pythia-14m,step93000,seed8,8,93000
That was a tennis racket.,racket,racket,That was a racket tennis., tennis racket, racket tennis,tennis,True,-17.211341857910156,-21.932376861572266,4.721035003662109,14067712,EleutherAI/pythia-14m,step93000,seed8,8,93000
He liked granite rock.,rock,rock,He liked rock granite., granite rock, rock granite,granite,True,-16.610322952270508,-19.180137634277344,2.569814682006836,14067712,EleutherAI/pythia-14m,step93000,seed8,8,93000
He saw the bushy sage.,sage,sage,He saw the sage bushy., bushy sage, sage bushy,bushy,False,-31.077571868896484,-28.57213592529297,-2.5054359436035156,14067712,EleutherAI/pythia-14m,step93000,seed8,8,93000
It was a major scale.,scale,scale,It was a scale major., major scale, scale major,major,False,-13.515811920166016,-20.520872116088867,7.005060195922852,14067712,EleutherAI/pythia-14m,step93000,seed8,8,93000
It was a panoramic scene.,scene,scene,It was a scene panoramic., panoramic scene, scene panoramic,panoramic,False,-19.766653060913086,-24.35466957092285,4.588016510009766,14067712,EleutherAI/pythia-14m,step93000,seed8,8,93000
It was a trained seal.,seal,seal,It was a seal trained., trained seal, seal trained,trained,False,-23.644617080688477,-23.525936126708984,-0.11868095397949219,14067712,EleutherAI/pythia-14m,step93000,seed8,8,93000
He used the video tape.,tape,tape,He used the tape video., video tape, tape video,video,True,-12.905660629272461,-15.58389949798584,2.678238868713379,14067712,EleutherAI/pythia-14m,step93000,seed8,8,93000
It was a technical term.,term,term,It was a term technical., technical term, term technical,technical,False,-17.50027847290039,-22.146270751953125,4.645992279052734,14067712,EleutherAI/pythia-14m,step93000,seed8,8,93000
It was a diseased tick.,tick,tick,It was a tick diseased., diseased tick, tick diseased,diseased,False,-21.046775817871094,-25.62267303466797,4.575897216796875,14067712,EleutherAI/pythia-14m,step93000,seed8,8,93000
It was a finger tip.,tip,tip,It was a tip finger., finger tip, tip finger,finger,True,-19.974193572998047,-19.5426082611084,-0.43158531188964844,14067712,EleutherAI/pythia-14m,step93000,seed8,8,93000
She liked the professional title.,title,title,She liked the title professional., professional title, title professional,professional,False,-14.346038818359375,-19.174053192138672,4.828014373779297,14067712,EleutherAI/pythia-14m,step93000,seed8,8,93000
It was a bell toll.,toll,toll,It was a toll bell., bell toll, toll bell,bell,True,-21.145626068115234,-19.94300079345703,-1.2026252746582031,14067712,EleutherAI/pythia-14m,step93000,seed8,8,93000
She saw the snowshoe tracks.,track,tracks,She saw the tracks snowshoe., snowshoe tracks, tracks snowshoe,snowshoe,True,-27.232158660888672,-27.506046295166016,0.27388763427734375,14067712,EleutherAI/pythia-14m,step93000,seed8,8,93000
They were cluttered yards.,yard,yards,They were yards cluttered., cluttered yards, yards cluttered,cluttered,False,-24.455974578857422,-23.770971298217773,-0.6850032806396484,14067712,EleutherAI/pythia-14m,step93000,seed8,8,93000
