sentence,word,string,reversed_sentence,mod_np,reversed_mod,disambiguating_word,non_adjective,original_logprob,reversed_logprob,ratio,n_params,mpath,revision,seed_name,seed,step
It was a desperate act.,act,act,It was an act desperate., desperate act, act desperate,desperate,False,-13.97738265991211,-18.543983459472656,4.566600799560547,14067712,EleutherAI/pythia-14m,step136000,seed5,5,136000
It was a humane act.,act,act,It was an act humane., humane act, act humane,humane,False,-20.270896911621094,-22.576635360717773,2.3057384490966797,14067712,EleutherAI/pythia-14m,step136000,seed5,5,136000
It was a magic act.,act,act,It was an act magic., magic act, act magic,magic,False,-15.302419662475586,-18.786170959472656,3.4837512969970703,14067712,EleutherAI/pythia-14m,step136000,seed5,5,136000
He had a universal appeal.,appeal,appeal,He had an appeal universal., universal appeal, appeal universal,universal,False,-17.839548110961914,-20.227811813354492,2.388263702392578,14067712,EleutherAI/pythia-14m,step136000,seed5,5,136000
He had an undefinable appeal.,appeal,appeal,He had an appeal undefinable., undefinable appeal, appeal undefinable,undefinable,False,-25.31374740600586,-27.679889678955078,2.3661422729492188,14067712,EleutherAI/pythia-14m,step136000,seed5,5,136000
He had a legal appeal.,appeal,appeal,He had an appeal legal., legal appeal, appeal legal,legal,False,-14.89797592163086,-17.730741500854492,2.832765579223633,14067712,EleutherAI/pythia-14m,step136000,seed5,5,136000
It was a tense atmosphere.,atmosphere,atmosphere,It was an atmosphere tense., tense atmosphere, atmosphere tense,tense,False,-17.517271041870117,-19.625431060791016,2.1081600189208984,14067712,EleutherAI/pythia-14m,step136000,seed5,5,136000
It was a hostile atmosphere.,atmosphere,atmosphere,It was an atmosphere hostile., hostile atmosphere, atmosphere hostile,hostile,False,-16.309396743774414,-20.710880279541016,4.401483535766602,14067712,EleutherAI/pythia-14m,step136000,seed5,5,136000
It was a gaseous atmosphere.,atmosphere,atmosphere,It was an atmosphere gaseous., gaseous atmosphere, atmosphere gaseous,gaseous,False,-17.328767776489258,-22.971866607666016,5.643098831176758,14067712,EleutherAI/pythia-14m,step136000,seed5,5,136000
It was a gold band.,band,band,It was a band gold., gold band, band gold,gold,True,-14.922860145568848,-18.899179458618164,3.9763193130493164,14067712,EleutherAI/pythia-14m,step136000,seed5,5,136000
It was a rubber band.,band,band,It was a band rubber., rubber band, band rubber,rubber,True,-13.60651969909668,-19.482187271118164,5.875667572021484,14067712,EleutherAI/pythia-14m,step136000,seed5,5,136000
It was a jazz band.,band,band,It was a band jazz., jazz band, band jazz,jazz,True,-12.869979858398438,-18.107431411743164,5.237451553344727,14067712,EleutherAI/pythia-14m,step136000,seed5,5,136000
There was a police barrier.,barrier,barrier,There was a barrier police., police barrier, barrier police,police,True,-19.388587951660156,-20.78313636779785,1.3945484161376953,14067712,EleutherAI/pythia-14m,step136000,seed5,5,136000
There was a concrete barrier.,barrier,barrier,There was a barrier concrete., concrete barrier, barrier concrete,concrete,False,-14.604379653930664,-20.34954261779785,5.7451629638671875,14067712,EleutherAI/pythia-14m,step136000,seed5,5,136000
There was a language barrier.,barrier,barrier,There was a barrier language., language barrier, barrier language,language,True,-19.79447364807129,-19.91643714904785,0.1219635009765625,14067712,EleutherAI/pythia-14m,step136000,seed5,5,136000
He saw a furry bat.,bat,bat,He saw a bat furry., furry bat, bat furry,furry,False,-20.19791603088379,-25.679424285888672,5.481508255004883,14067712,EleutherAI/pythia-14m,step136000,seed5,5,136000
He saw a fruit bat.,bat,bat,He saw a bat fruit., fruit bat, bat fruit,fruit,True,-18.613536834716797,-20.82343101501465,2.2098941802978516,14067712,EleutherAI/pythia-14m,step136000,seed5,5,136000
He saw a wooden bat.,bat,bat,He saw a bat wooden., wooden bat, bat wooden,wooden,False,-14.900409698486328,-20.53412437438965,5.63371467590332,14067712,EleutherAI/pythia-14m,step136000,seed5,5,136000
He saw the laser beam.,beam,beam,He saw the beam laser., laser beam, beam laser,laser,True,-12.115443229675293,-17.41339683532715,5.2979536056518555,14067712,EleutherAI/pythia-14m,step136000,seed5,5,136000
He saw the bright beam.,beam,beam,He saw the beam bright., bright beam, beam bright,bright,False,-16.70614242553711,-17.36432456970215,0.6581821441650391,14067712,EleutherAI/pythia-14m,step136000,seed5,5,136000
He saw the wood beam.,beam,beam,He saw the beam wood., wood beam, beam wood,wood,True,-18.35959243774414,-19.94855308532715,1.5889606475830078,14067712,EleutherAI/pythia-14m,step136000,seed5,5,136000
She had a toy block.,block,block,She had a block toy., toy block, block toy,toy,True,-17.935245513916016,-20.05912971496582,2.1238842010498047,14067712,EleutherAI/pythia-14m,step136000,seed5,5,136000
She had a wooden block.,block,block,She had a block wooden., wooden block, block wooden,wooden,False,-15.37253189086914,-20.62553596496582,5.25300407409668,14067712,EleutherAI/pythia-14m,step136000,seed5,5,136000
She had a mental block.,block,block,She had a block mental., mental block, block mental,mental,False,-14.673696517944336,-20.68559455871582,6.011898040771484,14067712,EleutherAI/pythia-14m,step136000,seed5,5,136000
He has coagulated blood.,blood,blood,He has blood coagulated., coagulated blood, blood coagulated,coagulated,True,-26.373001098632812,-28.75947380065918,2.386472702026367,14067712,EleutherAI/pythia-14m,step136000,seed5,5,136000
He has thin blood.,blood,blood,He has blood thin., thin blood, blood thin,thin,False,-17.96407699584961,-19.770061492919922,1.8059844970703125,14067712,EleutherAI/pythia-14m,step136000,seed5,5,136000
He has noble blood.,blood,blood,He has blood noble., noble blood, blood noble,noble,False,-19.730243682861328,-19.951946258544922,0.22170257568359375,14067712,EleutherAI/pythia-14m,step136000,seed5,5,136000
It was the ironing board.,board,board,It was the board ironing., ironing board, board ironing,ironing,False,-24.11301612854004,-23.612123489379883,-0.5008926391601562,14067712,EleutherAI/pythia-14m,step136000,seed5,5,136000
It was the wooden board.,board,board,It was the board wooden., wooden board, board wooden,wooden,False,-14.435558319091797,-19.865509033203125,5.429950714111328,14067712,EleutherAI/pythia-14m,step136000,seed5,5,136000
It was the executive board.,board,board,It was the board executive., executive board, board executive,executive,True,-15.659464836120605,-19.975128173828125,4.3156633377075195,14067712,EleutherAI/pythia-14m,step136000,seed5,5,136000
He had a best-selling book.,book,book,He had a book best-selling., best-selling book, book best-selling,best-selling,False,-16.61357307434082,-21.04207420349121,4.428501129150391,14067712,EleutherAI/pythia-14m,step136000,seed5,5,136000
He had a popular book.,book,book,He had a book popular., popular book, book popular,popular,False,-15.013179779052734,-17.698383331298828,2.6852035522460938,14067712,EleutherAI/pythia-14m,step136000,seed5,5,136000
He had a heavy book.,book,book,He had a book heavy., heavy book, book heavy,heavy,False,-15.954401016235352,-18.558490753173828,2.6040897369384766,14067712,EleutherAI/pythia-14m,step136000,seed5,5,136000
They ate a pancake breakfast.,breakfast,breakfast,They ate a breakfast pancake., pancake breakfast, breakfast pancake,pancake,True,-16.481544494628906,-16.82143211364746,0.3398876190185547,14067712,EleutherAI/pythia-14m,step136000,seed5,5,136000
They ate a nutritious breakfast.,breakfast,breakfast,They ate a breakfast nutritious., nutritious breakfast, breakfast nutritious,nutritious,False,-18.66050148010254,-23.995304107666016,5.334802627563477,14067712,EleutherAI/pythia-14m,step136000,seed5,5,136000
They ate a family breakfast.,breakfast,breakfast,They ate a breakfast family., family breakfast, breakfast family,family,True,-14.165914535522461,-14.519428253173828,0.3535137176513672,14067712,EleutherAI/pythia-14m,step136000,seed5,5,136000
It was a red cape.,cape,cape,It was a cape red., red cape, cape red,red,False,-18.0417423248291,-20.989479064941406,2.9477367401123047,14067712,EleutherAI/pythia-14m,step136000,seed5,5,136000
It was a flowing cape.,cape,cape,It was a cape flowing., flowing cape, cape flowing,flowing,False,-22.715667724609375,-23.051002502441406,0.33533477783203125,14067712,EleutherAI/pythia-14m,step136000,seed5,5,136000
It was a rocky cape.,cape,cape,It was a cape rocky., rocky cape, cape rocky,rocky,False,-20.085926055908203,-24.124977111816406,4.039051055908203,14067712,EleutherAI/pythia-14m,step136000,seed5,5,136000
It was a beer case.,case,case,It was a case beer., beer case, case beer,beer,True,-17.516277313232422,-19.57456398010254,2.058286666870117,14067712,EleutherAI/pythia-14m,step136000,seed5,5,136000
It was a display case.,case,case,It was a case display., display case, case display,display,True,-17.81853485107422,-17.72690773010254,-0.09162712097167969,14067712,EleutherAI/pythia-14m,step136000,seed5,5,136000
It was a divorce case.,case,case,It was a case divorce., divorce case, case divorce,divorce,True,-14.776884078979492,-19.14805030822754,4.371166229248047,14067712,EleutherAI/pythia-14m,step136000,seed5,5,136000
It was a worthy cause.,cause,cause,It was a cause worthy., worthy cause, cause worthy,worthy,False,-17.20873260498047,-19.467323303222656,2.2585906982421875,14067712,EleutherAI/pythia-14m,step136000,seed5,5,136000
It was a political cause.,cause,cause,It was a cause political., political cause, cause political,political,False,-15.374204635620117,-21.343299865722656,5.969095230102539,14067712,EleutherAI/pythia-14m,step136000,seed5,5,136000
It was a main cause.,cause,cause,It was a cause main., main cause, cause main,main,False,-13.800263404846191,-21.631141662597656,7.830878257751465,14067712,EleutherAI/pythia-14m,step136000,seed5,5,136000
It was a skin cell.,cell,cell,It was a cell skin., skin cell, cell skin,skin,True,-18.03995132446289,-18.670658111572266,0.630706787109375,14067712,EleutherAI/pythia-14m,step136000,seed5,5,136000
It was a brain cell.,cell,cell,It was a cell brain., brain cell, cell brain,brain,True,-14.93781566619873,-17.408695220947266,2.470879554748535,14067712,EleutherAI/pythia-14m,step136000,seed5,5,136000
It was a prison cell.,cell,cell,It was a cell prison., prison cell, cell prison,prison,True,-14.555914878845215,-18.239261627197266,3.683346748352051,14067712,EleutherAI/pythia-14m,step136000,seed5,5,136000
She had a devilish charm.,charm,charm,She had a charm devilish., devilish charm, charm devilish,devilish,False,-19.70806312561035,-28.843215942382812,9.135152816772461,14067712,EleutherAI/pythia-14m,step136000,seed5,5,136000
She had a natural charm.,charm,charm,She had a charm natural., natural charm, charm natural,natural,False,-15.300016403198242,-20.099321365356445,4.799304962158203,14067712,EleutherAI/pythia-14m,step136000,seed5,5,136000
She had a gold charm.,charm,charm,She had a charm gold., gold charm, charm gold,gold,True,-18.099281311035156,-20.406450271606445,2.307168960571289,14067712,EleutherAI/pythia-14m,step136000,seed5,5,136000
They liked the juicy chicken.,chicken,chicken,They liked the chicken juicy., juicy chicken, chicken juicy,juicy,False,-16.576820373535156,-18.322105407714844,1.7452850341796875,14067712,EleutherAI/pythia-14m,step136000,seed5,5,136000
They liked the roasted chicken.,chicken,chicken,They liked the chicken roasted., roasted chicken, chicken roasted,roasted,False,-15.795428276062012,-18.351333618164062,2.555905342102051,14067712,EleutherAI/pythia-14m,step136000,seed5,5,136000
They liked the clucking chicken.,chicken,chicken,They liked the chicken clucking., clucking chicken, chicken clucking,clucking,True,-23.515308380126953,-26.40587615966797,2.8905677795410156,14067712,EleutherAI/pythia-14m,step136000,seed5,5,136000
It was a perceptive class.,class,class,It was a class perceptive., perceptive class, class perceptive,perceptive,False,-21.716079711914062,-23.459077835083008,1.7429981231689453,14067712,EleutherAI/pythia-14m,step136000,seed5,5,136000
It was a misbehaving class.,class,class,It was a class misbehaving., misbehaving class, class misbehaving,misbehaving,False,-23.988739013671875,-27.43128204345703,3.4425430297851562,14067712,EleutherAI/pythia-14m,step136000,seed5,5,136000
It was a boring class.,class,class,It was a class boring., boring class, class boring,boring,False,-14.861578941345215,-18.259876251220703,3.3982973098754883,14067712,EleutherAI/pythia-14m,step136000,seed5,5,136000
It was a film clip.,clip,clip,It was a clip film., film clip, clip film,film,True,-16.051565170288086,-17.523075103759766,1.4715099334716797,14067712,EleutherAI/pythia-14m,step136000,seed5,5,136000
It was a video clip.,clip,clip,It was a clip video., video clip, clip video,video,True,-12.717998504638672,-17.599979400634766,4.881980895996094,14067712,EleutherAI/pythia-14m,step136000,seed5,5,136000
It was a hair clip.,clip,clip,It was a clip hair., hair clip, clip hair,hair,True,-17.12799072265625,-20.539676666259766,3.4116859436035156,14067712,EleutherAI/pythia-14m,step136000,seed5,5,136000
It was an icy cold.,cold,cold,It was an cold icy., icy cold, cold icy,icy,False,-12.424257278442383,-19.00359344482422,6.579336166381836,14067712,EleutherAI/pythia-14m,step136000,seed5,5,136000
It was a freezing cold.,cold,cold,It was a cold freezing., freezing cold, cold freezing,freezing,False,-14.987077713012695,-15.634696006774902,0.647618293762207,14067712,EleutherAI/pythia-14m,step136000,seed5,5,136000
It was a chest cold.,cold,cold,It was a cold chest., chest cold, cold chest,chest,False,-17.763538360595703,-16.12346649169922,-1.6400718688964844,14067712,EleutherAI/pythia-14m,step136000,seed5,5,136000
It was a gossip column.,column,column,It was a column gossip., gossip column, column gossip,gossip,True,-18.958646774291992,-22.00719451904297,3.0485477447509766,14067712,EleutherAI/pythia-14m,step136000,seed5,5,136000
It was a sports column.,column,column,It was a column sports., sports column, column sports,sports,True,-18.507041931152344,-21.80040740966797,3.293365478515625,14067712,EleutherAI/pythia-14m,step136000,seed5,5,136000
It was a concrete column.,column,column,It was a column concrete., concrete column, column concrete,concrete,False,-16.31589698791504,-20.41002655029297,4.09412956237793,14067712,EleutherAI/pythia-14m,step136000,seed5,5,136000
He liked the investment company.,company,company,He liked the company investment., investment company, company investment,investment,True,-15.689994812011719,-17.27719497680664,1.5872001647949219,14067712,EleutherAI/pythia-14m,step136000,seed5,5,136000
He liked the pharmaceutical company.,company,company,He liked the company pharmaceutical., pharmaceutical company, company pharmaceutical,pharmaceutical,False,-14.416358947753906,-18.37729263305664,3.9609336853027344,14067712,EleutherAI/pythia-14m,step136000,seed5,5,136000
He liked the pleasant company.,company,company,He liked the company pleasant., pleasant company, company pleasant,pleasant,False,-17.23301124572754,-18.56991958618164,1.3369083404541016,14067712,EleutherAI/pythia-14m,step136000,seed5,5,136000
It was a waffle cone.,cone,cone,It was a cone waffle., waffle cone, cone waffle,waffle,True,-27.20709228515625,-28.85733985900879,1.650247573852539,14067712,EleutherAI/pythia-14m,step136000,seed5,5,136000
It was a sugar cone.,cone,cone,It was a cone sugar., sugar cone, cone sugar,sugar,True,-21.220584869384766,-23.186504364013672,1.9659194946289062,14067712,EleutherAI/pythia-14m,step136000,seed5,5,136000
It was an orange cone.,cone,cone,It was an cone orange., orange cone, cone orange,orange,False,-16.498064041137695,-24.42917251586914,7.931108474731445,14067712,EleutherAI/pythia-14m,step136000,seed5,5,136000
He made a charitable contribution.,contribution,contribution,He made a contribution charitable., charitable contribution, contribution charitable,charitable,False,-15.842135429382324,-22.898082733154297,7.055947303771973,14067712,EleutherAI/pythia-14m,step136000,seed5,5,136000
He made a voluntary contribution.,contribution,contribution,He made a contribution voluntary., voluntary contribution, contribution voluntary,voluntary,False,-16.212478637695312,-21.854625701904297,5.642147064208984,14067712,EleutherAI/pythia-14m,step136000,seed5,5,136000
He made a scholarly contribution.,contribution,contribution,He made a contribution scholarly., scholarly contribution, contribution scholarly,scholarly,False,-19.38445472717285,-23.313365936279297,3.9289112091064453,14067712,EleutherAI/pythia-14m,step136000,seed5,5,136000
That was the noble count.,count,count,That was the count noble., noble count, count noble,noble,False,-17.997882843017578,-22.976730346679688,4.978847503662109,14067712,EleutherAI/pythia-14m,step136000,seed5,5,136000
That was the vengeful count.,count,count,That was the count vengeful., vengeful count, count vengeful,vengeful,False,-20.426063537597656,-30.269813537597656,9.84375,14067712,EleutherAI/pythia-14m,step136000,seed5,5,136000
That was the final count.,count,count,That was the count final., final count, count final,final,False,-12.89872932434082,-20.841720581054688,7.942991256713867,14067712,EleutherAI/pythia-14m,step136000,seed5,5,136000
It was an introductory course.,course,course,It was an course introductory., introductory course, course introductory,introductory,False,-12.51634407043457,-22.197734832763672,9.681390762329102,14067712,EleutherAI/pythia-14m,step136000,seed5,5,136000
It was a pass-fail course.,course,course,It was a course pass-fail., pass-fail course, course pass-fail,pass-fail,False,-28.436477661132812,-32.72920227050781,4.292724609375,14067712,EleutherAI/pythia-14m,step136000,seed5,5,136000
It was a charted course.,course,course,It was a course charted., charted course, course charted,charted,False,-22.719253540039062,-23.462665557861328,0.7434120178222656,14067712,EleutherAI/pythia-14m,step136000,seed5,5,136000
It was a dinner date.,date,date,It was a date dinner., dinner date, date dinner,dinner,True,-18.306285858154297,-19.50967788696289,1.2033920288085938,14067712,EleutherAI/pythia-14m,step136000,seed5,5,136000
It was a blind date.,date,date,It was a date blind., blind date, date blind,blind,False,-17.748538970947266,-20.46939468383789,2.720855712890625,14067712,EleutherAI/pythia-14m,step136000,seed5,5,136000
It was an expiration date.,date,date,It was an date expiration., expiration date, date expiration,expiration,True,-13.466358184814453,-24.59773826599121,11.131380081176758,14067712,EleutherAI/pythia-14m,step136000,seed5,5,136000
It was about forty degrees.,degree,degrees,It was about degrees forty., forty degrees, degrees forty,forty,True,-16.17059326171875,-22.967336654663086,6.796743392944336,14067712,EleutherAI/pythia-14m,step136000,seed5,5,136000
It was about fifty degrees.,degree,degrees,It was about degrees fifty., fifty degrees, degrees fifty,fifty,True,-15.411911010742188,-22.921194076538086,7.509283065795898,14067712,EleutherAI/pythia-14m,step136000,seed5,5,136000
It was about associate degrees.,degree,degrees,It was about degrees associate., associate degrees, degrees associate,associate,False,-24.6802978515625,-25.438772201538086,0.7584743499755859,14067712,EleutherAI/pythia-14m,step136000,seed5,5,136000
They liked the floral design.,design,design,They liked the design floral., floral design, design floral,floral,False,-16.05080223083496,-20.19202995300293,4.141227722167969,14067712,EleutherAI/pythia-14m,step136000,seed5,5,136000
They liked the geometric design.,design,design,They liked the design geometric., geometric design, design geometric,geometric,False,-15.908982276916504,-20.33167839050293,4.422696113586426,14067712,EleutherAI/pythia-14m,step136000,seed5,5,136000
They liked the product design.,design,design,They liked the design product., product design, design product,product,True,-15.67220687866211,-16.31532096862793,0.6431140899658203,14067712,EleutherAI/pythia-14m,step136000,seed5,5,136000
They liked the turkey dinner.,dinner,dinner,They liked the dinner turkey., turkey dinner, dinner turkey,turkey,True,-16.685340881347656,-18.332775115966797,1.6474342346191406,14067712,EleutherAI/pythia-14m,step136000,seed5,5,136000
They liked the light dinner.,dinner,dinner,They liked the dinner light., light dinner, dinner light,light,False,-17.909595489501953,-17.555919647216797,-0.35367584228515625,14067712,EleutherAI/pythia-14m,step136000,seed5,5,136000
They liked the formal dinner.,dinner,dinner,They liked the dinner formal., formal dinner, dinner formal,formal,False,-18.26898193359375,-20.010021209716797,1.7410392761230469,14067712,EleutherAI/pythia-14m,step136000,seed5,5,136000
He had a recurring dream.,dream,dream,He had a dream recurring., recurring dream, dream recurring,recurring,False,-15.90500259399414,-19.95376968383789,4.04876708984375,14067712,EleutherAI/pythia-14m,step136000,seed5,5,136000
He had a bad dream.,dream,dream,He had a dream bad., bad dream, dream bad,bad,False,-11.162832260131836,-15.60464859008789,4.441816329956055,14067712,EleutherAI/pythia-14m,step136000,seed5,5,136000
He had a childhood dream.,dream,dream,He had a dream childhood., childhood dream, dream childhood,childhood,True,-15.216935157775879,-18.40689468383789,3.1899595260620117,14067712,EleutherAI/pythia-14m,step136000,seed5,5,136000
It was a grueling drill.,drill,drill,It was a drill grueling., grueling drill, drill grueling,grueling,False,-22.95647430419922,-24.97022819519043,2.013753890991211,14067712,EleutherAI/pythia-14m,step136000,seed5,5,136000
It was a challenging drill.,drill,drill,It was a drill challenging., challenging drill, drill challenging,challenging,False,-20.511587142944336,-21.461959838867188,0.9503726959228516,14067712,EleutherAI/pythia-14m,step136000,seed5,5,136000
It was an electric drill.,drill,drill,It was an drill electric., electric drill, drill electric,electric,False,-16.978492736816406,-23.259498596191406,6.281005859375,14067712,EleutherAI/pythia-14m,step136000,seed5,5,136000
It was a multiple-choice examination.,examination,examination,It was an examination multiple-choice., multiple-choice examination, examination multiple-choice,multiple-choice,False,-25.257423400878906,-29.094432830810547,3.8370094299316406,14067712,EleutherAI/pythia-14m,step136000,seed5,5,136000
It was a difficult examination.,examination,examination,It was an examination difficult., difficult examination, examination difficult,difficult,False,-16.088420867919922,-18.778343200683594,2.689922332763672,14067712,EleutherAI/pythia-14m,step136000,seed5,5,136000
It was a prostate examination.,examination,examination,It was an examination prostate., prostate examination, examination prostate,prostate,True,-21.79903793334961,-21.922386169433594,0.12334823608398438,14067712,EleutherAI/pythia-14m,step136000,seed5,5,136000
They had an electric fan.,fan,fan,They had an fan electric., electric fan, fan electric,electric,False,-14.091207504272461,-22.581798553466797,8.490591049194336,14067712,EleutherAI/pythia-14m,step136000,seed5,5,136000
They had a ceiling fan.,fan,fan,They had a fan ceiling., ceiling fan, fan ceiling,ceiling,True,-19.33739471435547,-18.546875,-0.7905197143554688,14067712,EleutherAI/pythia-14m,step136000,seed5,5,136000
They had a zealous fan.,fan,fan,They had a fan zealous., zealous fan, fan zealous,zealous,False,-26.48786163330078,-24.41189956665039,-2.0759620666503906,14067712,EleutherAI/pythia-14m,step136000,seed5,5,136000
She had a text file.,file,file,She had a file text., text file, file text,text,True,-12.939798355102539,-18.5997314453125,5.659933090209961,14067712,EleutherAI/pythia-14m,step136000,seed5,5,136000
She had a data file.,file,file,She had a file data., data file, file data,data,True,-14.623632431030273,-17.6026611328125,2.9790287017822266,14067712,EleutherAI/pythia-14m,step136000,seed5,5,136000
She had a nail file.,file,file,She had a file nail., nail file, file nail,nail,True,-18.43157386779785,-23.2059326171875,4.774358749389648,14067712,EleutherAI/pythia-14m,step136000,seed5,5,136000
It was an action film.,film,film,It was an film action., action film, film action,action,True,-14.802101135253906,-17.301176071166992,2.499074935913086,14067712,EleutherAI/pythia-14m,step136000,seed5,5,136000
It was a censored film.,film,film,It was a film censored., censored film, film censored,censored,False,-19.557106018066406,-20.271507263183594,0.7144012451171875,14067712,EleutherAI/pythia-14m,step136000,seed5,5,136000
It was a transparent film.,film,film,It was a film transparent., transparent film, film transparent,transparent,False,-15.891671180725098,-18.237600326538086,2.3459291458129883,14067712,EleutherAI/pythia-14m,step136000,seed5,5,136000
It was a charitable foundation.,foundation,foundation,It was a foundation charitable., charitable foundation, foundation charitable,charitable,False,-16.061044692993164,-22.297990798950195,6.236946105957031,14067712,EleutherAI/pythia-14m,step136000,seed5,5,136000
It was an educational foundation.,foundation,foundation,It was an foundation educational., educational foundation, foundation educational,educational,False,-15.251565933227539,-24.326065063476562,9.074499130249023,14067712,EleutherAI/pythia-14m,step136000,seed5,5,136000
It was a wooden foundation.,foundation,foundation,It was a foundation wooden., wooden foundation, foundation wooden,wooden,False,-17.473472595214844,-21.815568923950195,4.342096328735352,14067712,EleutherAI/pythia-14m,step136000,seed5,5,136000
It was a mathematical function.,function,function,It was a function mathematical., mathematical function, function mathematical,mathematical,False,-14.579572677612305,-19.28940200805664,4.709829330444336,14067712,EleutherAI/pythia-14m,step136000,seed5,5,136000
