sentence,word,string,reversed_sentence,mod_np,reversed_mod,disambiguating_word,non_adjective,original_logprob,reversed_logprob,ratio,n_params,mpath,revision,seed_name,seed,step
It was a desperate act.,act,act,It was an act desperate., desperate act, act desperate,desperate,False,-14.432300567626953,-19.122575759887695,4.690275192260742,14067712,EleutherAI/pythia-14m,step83000,seed7,7,83000
It was a humane act.,act,act,It was an act humane., humane act, act humane,humane,False,-21.031776428222656,-21.805828094482422,0.7740516662597656,14067712,EleutherAI/pythia-14m,step83000,seed7,7,83000
It was a magic act.,act,act,It was an act magic., magic act, act magic,magic,False,-16.448884963989258,-19.256853103637695,2.8079681396484375,14067712,EleutherAI/pythia-14m,step83000,seed7,7,83000
He had a universal appeal.,appeal,appeal,He had an appeal universal., universal appeal, appeal universal,universal,False,-19.606159210205078,-21.419174194335938,1.8130149841308594,14067712,EleutherAI/pythia-14m,step83000,seed7,7,83000
He had an undefinable appeal.,appeal,appeal,He had an appeal undefinable., undefinable appeal, appeal undefinable,undefinable,False,-19.78080177307129,-27.032041549682617,7.251239776611328,14067712,EleutherAI/pythia-14m,step83000,seed7,7,83000
He had a legal appeal.,appeal,appeal,He had an appeal legal., legal appeal, appeal legal,legal,False,-13.861303329467773,-18.70075225830078,4.839448928833008,14067712,EleutherAI/pythia-14m,step83000,seed7,7,83000
It was a tense atmosphere.,atmosphere,atmosphere,It was an atmosphere tense., tense atmosphere, atmosphere tense,tense,False,-18.566722869873047,-21.41168975830078,2.8449668884277344,14067712,EleutherAI/pythia-14m,step83000,seed7,7,83000
It was a hostile atmosphere.,atmosphere,atmosphere,It was an atmosphere hostile., hostile atmosphere, atmosphere hostile,hostile,False,-16.73672103881836,-20.547958374023438,3.811237335205078,14067712,EleutherAI/pythia-14m,step83000,seed7,7,83000
It was a gaseous atmosphere.,atmosphere,atmosphere,It was an atmosphere gaseous., gaseous atmosphere, atmosphere gaseous,gaseous,False,-17.823291778564453,-24.371070861816406,6.547779083251953,14067712,EleutherAI/pythia-14m,step83000,seed7,7,83000
It was a gold band.,band,band,It was a band gold., gold band, band gold,gold,True,-15.18708610534668,-18.94390106201172,3.756814956665039,14067712,EleutherAI/pythia-14m,step83000,seed7,7,83000
It was a rubber band.,band,band,It was a band rubber., rubber band, band rubber,rubber,True,-14.724252700805664,-21.91522216796875,7.190969467163086,14067712,EleutherAI/pythia-14m,step83000,seed7,7,83000
It was a jazz band.,band,band,It was a band jazz., jazz band, band jazz,jazz,True,-13.45516300201416,-21.275009155273438,7.819846153259277,14067712,EleutherAI/pythia-14m,step83000,seed7,7,83000
There was a police barrier.,barrier,barrier,There was a barrier police., police barrier, barrier police,police,True,-20.10517692565918,-20.42951774597168,0.3243408203125,14067712,EleutherAI/pythia-14m,step83000,seed7,7,83000
There was a concrete barrier.,barrier,barrier,There was a barrier concrete., concrete barrier, barrier concrete,concrete,False,-14.72494888305664,-21.07484245300293,6.349893569946289,14067712,EleutherAI/pythia-14m,step83000,seed7,7,83000
There was a language barrier.,barrier,barrier,There was a barrier language., language barrier, barrier language,language,True,-18.31446647644043,-23.316877365112305,5.002410888671875,14067712,EleutherAI/pythia-14m,step83000,seed7,7,83000
He saw a furry bat.,bat,bat,He saw a bat furry., furry bat, bat furry,furry,False,-21.62254524230957,-24.650508880615234,3.027963638305664,14067712,EleutherAI/pythia-14m,step83000,seed7,7,83000
He saw a fruit bat.,bat,bat,He saw a bat fruit., fruit bat, bat fruit,fruit,True,-19.75955581665039,-20.859201431274414,1.0996456146240234,14067712,EleutherAI/pythia-14m,step83000,seed7,7,83000
He saw a wooden bat.,bat,bat,He saw a bat wooden., wooden bat, bat wooden,wooden,False,-16.050811767578125,-20.830774307250977,4.779962539672852,14067712,EleutherAI/pythia-14m,step83000,seed7,7,83000
He saw the laser beam.,beam,beam,He saw the beam laser., laser beam, beam laser,laser,True,-12.269317626953125,-16.702800750732422,4.433483123779297,14067712,EleutherAI/pythia-14m,step83000,seed7,7,83000
He saw the bright beam.,beam,beam,He saw the beam bright., bright beam, beam bright,bright,False,-19.733631134033203,-18.078868865966797,-1.6547622680664062,14067712,EleutherAI/pythia-14m,step83000,seed7,7,83000
He saw the wood beam.,beam,beam,He saw the beam wood., wood beam, beam wood,wood,True,-17.500736236572266,-18.932849884033203,1.4321136474609375,14067712,EleutherAI/pythia-14m,step83000,seed7,7,83000
She had a toy block.,block,block,She had a block toy., toy block, block toy,toy,True,-17.74292755126953,-19.99212646484375,2.2491989135742188,14067712,EleutherAI/pythia-14m,step83000,seed7,7,83000
She had a wooden block.,block,block,She had a block wooden., wooden block, block wooden,wooden,False,-14.801368713378906,-22.174270629882812,7.372901916503906,14067712,EleutherAI/pythia-14m,step83000,seed7,7,83000
She had a mental block.,block,block,She had a block mental., mental block, block mental,mental,False,-16.87334632873535,-23.36933135986328,6.49598503112793,14067712,EleutherAI/pythia-14m,step83000,seed7,7,83000
He has coagulated blood.,blood,blood,He has blood coagulated., coagulated blood, blood coagulated,coagulated,True,-24.828336715698242,-26.966747283935547,2.1384105682373047,14067712,EleutherAI/pythia-14m,step83000,seed7,7,83000
He has thin blood.,blood,blood,He has blood thin., thin blood, blood thin,thin,False,-16.491735458374023,-18.804180145263672,2.3124446868896484,14067712,EleutherAI/pythia-14m,step83000,seed7,7,83000
He has noble blood.,blood,blood,He has blood noble., noble blood, blood noble,noble,False,-21.503559112548828,-24.38790512084961,2.8843460083007812,14067712,EleutherAI/pythia-14m,step83000,seed7,7,83000
It was the ironing board.,board,board,It was the board ironing., ironing board, board ironing,ironing,False,-23.824962615966797,-23.562471389770508,-0.26249122619628906,14067712,EleutherAI/pythia-14m,step83000,seed7,7,83000
It was the wooden board.,board,board,It was the board wooden., wooden board, board wooden,wooden,False,-15.096540451049805,-21.11138153076172,6.014841079711914,14067712,EleutherAI/pythia-14m,step83000,seed7,7,83000
It was the executive board.,board,board,It was the board executive., executive board, board executive,executive,True,-16.441864013671875,-18.430702209472656,1.9888381958007812,14067712,EleutherAI/pythia-14m,step83000,seed7,7,83000
He had a best-selling book.,book,book,He had a book best-selling., best-selling book, book best-selling,best-selling,False,-14.791189193725586,-23.484418869018555,8.693229675292969,14067712,EleutherAI/pythia-14m,step83000,seed7,7,83000
He had a popular book.,book,book,He had a book popular., popular book, book popular,popular,False,-14.566574096679688,-20.49001693725586,5.923442840576172,14067712,EleutherAI/pythia-14m,step83000,seed7,7,83000
He had a heavy book.,book,book,He had a book heavy., heavy book, book heavy,heavy,False,-16.643638610839844,-20.30105209350586,3.6574134826660156,14067712,EleutherAI/pythia-14m,step83000,seed7,7,83000
They ate a pancake breakfast.,breakfast,breakfast,They ate a breakfast pancake., pancake breakfast, breakfast pancake,pancake,True,-14.017563819885254,-15.378589630126953,1.3610258102416992,14067712,EleutherAI/pythia-14m,step83000,seed7,7,83000
They ate a nutritious breakfast.,breakfast,breakfast,They ate a breakfast nutritious., nutritious breakfast, breakfast nutritious,nutritious,False,-21.72522735595703,-25.092248916625977,3.3670215606689453,14067712,EleutherAI/pythia-14m,step83000,seed7,7,83000
They ate a family breakfast.,breakfast,breakfast,They ate a breakfast family., family breakfast, breakfast family,family,True,-13.40150260925293,-16.651607513427734,3.2501049041748047,14067712,EleutherAI/pythia-14m,step83000,seed7,7,83000
It was a red cape.,cape,cape,It was a cape red., red cape, cape red,red,False,-18.271251678466797,-24.845088958740234,6.5738372802734375,14067712,EleutherAI/pythia-14m,step83000,seed7,7,83000
It was a flowing cape.,cape,cape,It was a cape flowing., flowing cape, cape flowing,flowing,False,-24.336978912353516,-25.71871566772461,1.3817367553710938,14067712,EleutherAI/pythia-14m,step83000,seed7,7,83000
It was a rocky cape.,cape,cape,It was a cape rocky., rocky cape, cape rocky,rocky,False,-19.54022789001465,-30.30008316040039,10.759855270385742,14067712,EleutherAI/pythia-14m,step83000,seed7,7,83000
It was a beer case.,case,case,It was a case beer., beer case, case beer,beer,True,-17.502193450927734,-21.03804588317871,3.5358524322509766,14067712,EleutherAI/pythia-14m,step83000,seed7,7,83000
It was a display case.,case,case,It was a case display., display case, case display,display,True,-15.387006759643555,-18.507871627807617,3.1208648681640625,14067712,EleutherAI/pythia-14m,step83000,seed7,7,83000
It was a divorce case.,case,case,It was a case divorce., divorce case, case divorce,divorce,True,-13.895196914672852,-21.851606369018555,7.956409454345703,14067712,EleutherAI/pythia-14m,step83000,seed7,7,83000
It was a worthy cause.,cause,cause,It was a cause worthy., worthy cause, cause worthy,worthy,False,-15.394786834716797,-19.710220336914062,4.315433502197266,14067712,EleutherAI/pythia-14m,step83000,seed7,7,83000
It was a political cause.,cause,cause,It was a cause political., political cause, cause political,political,False,-14.243667602539062,-20.216209411621094,5.972541809082031,14067712,EleutherAI/pythia-14m,step83000,seed7,7,83000
It was a main cause.,cause,cause,It was a cause main., main cause, cause main,main,False,-13.72796630859375,-20.534034729003906,6.806068420410156,14067712,EleutherAI/pythia-14m,step83000,seed7,7,83000
It was a skin cell.,cell,cell,It was a cell skin., skin cell, cell skin,skin,True,-18.12626075744629,-16.940980911254883,-1.1852798461914062,14067712,EleutherAI/pythia-14m,step83000,seed7,7,83000
It was a brain cell.,cell,cell,It was a cell brain., brain cell, cell brain,brain,True,-15.392233848571777,-16.088762283325195,0.696528434753418,14067712,EleutherAI/pythia-14m,step83000,seed7,7,83000
It was a prison cell.,cell,cell,It was a cell prison., prison cell, cell prison,prison,True,-17.799880981445312,-18.596071243286133,0.7961902618408203,14067712,EleutherAI/pythia-14m,step83000,seed7,7,83000
She had a devilish charm.,charm,charm,She had a charm devilish., devilish charm, charm devilish,devilish,False,-19.968181610107422,-28.376121520996094,8.407939910888672,14067712,EleutherAI/pythia-14m,step83000,seed7,7,83000
She had a natural charm.,charm,charm,She had a charm natural., natural charm, charm natural,natural,False,-13.740716934204102,-20.62698745727539,6.886270523071289,14067712,EleutherAI/pythia-14m,step83000,seed7,7,83000
She had a gold charm.,charm,charm,She had a charm gold., gold charm, charm gold,gold,True,-16.249792098999023,-20.07296371459961,3.823171615600586,14067712,EleutherAI/pythia-14m,step83000,seed7,7,83000
They liked the juicy chicken.,chicken,chicken,They liked the chicken juicy., juicy chicken, chicken juicy,juicy,False,-20.816383361816406,-23.09524917602539,2.2788658142089844,14067712,EleutherAI/pythia-14m,step83000,seed7,7,83000
They liked the roasted chicken.,chicken,chicken,They liked the chicken roasted., roasted chicken, chicken roasted,roasted,False,-16.795310974121094,-19.258304595947266,2.462993621826172,14067712,EleutherAI/pythia-14m,step83000,seed7,7,83000
They liked the clucking chicken.,chicken,chicken,They liked the chicken clucking., clucking chicken, chicken clucking,clucking,True,-25.44391632080078,-22.4595890045166,-2.9843273162841797,14067712,EleutherAI/pythia-14m,step83000,seed7,7,83000
It was a perceptive class.,class,class,It was a class perceptive., perceptive class, class perceptive,perceptive,False,-20.61423110961914,-27.77478790283203,7.160556793212891,14067712,EleutherAI/pythia-14m,step83000,seed7,7,83000
It was a misbehaving class.,class,class,It was a class misbehaving., misbehaving class, class misbehaving,misbehaving,False,-21.45086669921875,-25.906694412231445,4.455827713012695,14067712,EleutherAI/pythia-14m,step83000,seed7,7,83000
It was a boring class.,class,class,It was a class boring., boring class, class boring,boring,False,-16.154882431030273,-17.551837921142578,1.3969554901123047,14067712,EleutherAI/pythia-14m,step83000,seed7,7,83000
It was a film clip.,clip,clip,It was a clip film., film clip, clip film,film,True,-17.53291130065918,-19.69165802001953,2.1587467193603516,14067712,EleutherAI/pythia-14m,step83000,seed7,7,83000
It was a video clip.,clip,clip,It was a clip video., video clip, clip video,video,True,-12.533441543579102,-18.67034912109375,6.136907577514648,14067712,EleutherAI/pythia-14m,step83000,seed7,7,83000
It was a hair clip.,clip,clip,It was a clip hair., hair clip, clip hair,hair,True,-19.05954360961914,-21.52356719970703,2.4640235900878906,14067712,EleutherAI/pythia-14m,step83000,seed7,7,83000
It was an icy cold.,cold,cold,It was an cold icy., icy cold, cold icy,icy,False,-12.207023620605469,-19.11772346496582,6.910699844360352,14067712,EleutherAI/pythia-14m,step83000,seed7,7,83000
It was a freezing cold.,cold,cold,It was a cold freezing., freezing cold, cold freezing,freezing,False,-13.998908042907715,-14.013092041015625,0.014183998107910156,14067712,EleutherAI/pythia-14m,step83000,seed7,7,83000
It was a chest cold.,cold,cold,It was a cold chest., chest cold, cold chest,chest,False,-16.449142456054688,-15.508842468261719,-0.9402999877929688,14067712,EleutherAI/pythia-14m,step83000,seed7,7,83000
It was a gossip column.,column,column,It was a column gossip., gossip column, column gossip,gossip,True,-17.600366592407227,-21.943973541259766,4.343606948852539,14067712,EleutherAI/pythia-14m,step83000,seed7,7,83000
It was a sports column.,column,column,It was a column sports., sports column, column sports,sports,True,-19.375308990478516,-21.152217864990234,1.7769088745117188,14067712,EleutherAI/pythia-14m,step83000,seed7,7,83000
It was a concrete column.,column,column,It was a column concrete., concrete column, column concrete,concrete,False,-16.2215576171875,-19.216495513916016,2.9949378967285156,14067712,EleutherAI/pythia-14m,step83000,seed7,7,83000
He liked the investment company.,company,company,He liked the company investment., investment company, company investment,investment,True,-18.09083366394043,-18.458175659179688,0.3673419952392578,14067712,EleutherAI/pythia-14m,step83000,seed7,7,83000
He liked the pharmaceutical company.,company,company,He liked the company pharmaceutical., pharmaceutical company, company pharmaceutical,pharmaceutical,False,-13.773147583007812,-20.55573272705078,6.782585144042969,14067712,EleutherAI/pythia-14m,step83000,seed7,7,83000
He liked the pleasant company.,company,company,He liked the company pleasant., pleasant company, company pleasant,pleasant,False,-20.107208251953125,-18.562255859375,-1.544952392578125,14067712,EleutherAI/pythia-14m,step83000,seed7,7,83000
It was a waffle cone.,cone,cone,It was a cone waffle., waffle cone, cone waffle,waffle,True,-25.57088851928711,-29.260330200195312,3.689441680908203,14067712,EleutherAI/pythia-14m,step83000,seed7,7,83000
It was a sugar cone.,cone,cone,It was a cone sugar., sugar cone, cone sugar,sugar,True,-18.82039451599121,-22.93578338623047,4.115388870239258,14067712,EleutherAI/pythia-14m,step83000,seed7,7,83000
It was an orange cone.,cone,cone,It was an cone orange., orange cone, cone orange,orange,False,-15.425458908081055,-25.214277267456055,9.788818359375,14067712,EleutherAI/pythia-14m,step83000,seed7,7,83000
He made a charitable contribution.,contribution,contribution,He made a contribution charitable., charitable contribution, contribution charitable,charitable,False,-16.85934829711914,-25.887508392333984,9.028160095214844,14067712,EleutherAI/pythia-14m,step83000,seed7,7,83000
He made a voluntary contribution.,contribution,contribution,He made a contribution voluntary., voluntary contribution, contribution voluntary,voluntary,False,-16.70258140563965,-26.059192657470703,9.356611251831055,14067712,EleutherAI/pythia-14m,step83000,seed7,7,83000
He made a scholarly contribution.,contribution,contribution,He made a contribution scholarly., scholarly contribution, contribution scholarly,scholarly,False,-18.162364959716797,-26.37607192993164,8.213706970214844,14067712,EleutherAI/pythia-14m,step83000,seed7,7,83000
That was the noble count.,count,count,That was the count noble., noble count, count noble,noble,False,-17.891700744628906,-25.855716705322266,7.964015960693359,14067712,EleutherAI/pythia-14m,step83000,seed7,7,83000
That was the vengeful count.,count,count,That was the count vengeful., vengeful count, count vengeful,vengeful,False,-21.589277267456055,-29.085899353027344,7.496622085571289,14067712,EleutherAI/pythia-14m,step83000,seed7,7,83000
That was the final count.,count,count,That was the count final., final count, count final,final,False,-13.699089050292969,-21.432758331298828,7.733669281005859,14067712,EleutherAI/pythia-14m,step83000,seed7,7,83000
It was an introductory course.,course,course,It was an course introductory., introductory course, course introductory,introductory,False,-14.678011894226074,-27.049602508544922,12.371590614318848,14067712,EleutherAI/pythia-14m,step83000,seed7,7,83000
It was a pass-fail course.,course,course,It was a course pass-fail., pass-fail course, course pass-fail,pass-fail,False,-27.754911422729492,-31.54006576538086,3.785154342651367,14067712,EleutherAI/pythia-14m,step83000,seed7,7,83000
It was a charted course.,course,course,It was a course charted., charted course, course charted,charted,False,-23.851713180541992,-25.175064086914062,1.3233509063720703,14067712,EleutherAI/pythia-14m,step83000,seed7,7,83000
It was a dinner date.,date,date,It was a date dinner., dinner date, date dinner,dinner,True,-19.150447845458984,-20.864580154418945,1.714132308959961,14067712,EleutherAI/pythia-14m,step83000,seed7,7,83000
It was a blind date.,date,date,It was a date blind., blind date, date blind,blind,False,-19.308074951171875,-20.223878860473633,0.9158039093017578,14067712,EleutherAI/pythia-14m,step83000,seed7,7,83000
It was an expiration date.,date,date,It was an date expiration., expiration date, date expiration,expiration,True,-17.3832950592041,-27.15819549560547,9.774900436401367,14067712,EleutherAI/pythia-14m,step83000,seed7,7,83000
It was about forty degrees.,degree,degrees,It was about degrees forty., forty degrees, degrees forty,forty,True,-13.836441993713379,-21.961509704589844,8.125067710876465,14067712,EleutherAI/pythia-14m,step83000,seed7,7,83000
It was about fifty degrees.,degree,degrees,It was about degrees fifty., fifty degrees, degrees fifty,fifty,True,-13.35940170288086,-21.441184997558594,8.081783294677734,14067712,EleutherAI/pythia-14m,step83000,seed7,7,83000
It was about associate degrees.,degree,degrees,It was about degrees associate., associate degrees, degrees associate,associate,False,-23.2285099029541,-24.778099060058594,1.5495891571044922,14067712,EleutherAI/pythia-14m,step83000,seed7,7,83000
They liked the floral design.,design,design,They liked the design floral., floral design, design floral,floral,False,-16.964252471923828,-21.842212677001953,4.877960205078125,14067712,EleutherAI/pythia-14m,step83000,seed7,7,83000
They liked the geometric design.,design,design,They liked the design geometric., geometric design, design geometric,geometric,False,-15.583551406860352,-21.05074691772461,5.467195510864258,14067712,EleutherAI/pythia-14m,step83000,seed7,7,83000
They liked the product design.,design,design,They liked the design product., product design, design product,product,True,-15.730189323425293,-17.112483978271484,1.3822946548461914,14067712,EleutherAI/pythia-14m,step83000,seed7,7,83000
They liked the turkey dinner.,dinner,dinner,They liked the dinner turkey., turkey dinner, dinner turkey,turkey,True,-18.535266876220703,-20.680862426757812,2.1455955505371094,14067712,EleutherAI/pythia-14m,step83000,seed7,7,83000
They liked the light dinner.,dinner,dinner,They liked the dinner light., light dinner, dinner light,light,False,-19.641582489013672,-20.705238342285156,1.0636558532714844,14067712,EleutherAI/pythia-14m,step83000,seed7,7,83000
They liked the formal dinner.,dinner,dinner,They liked the dinner formal., formal dinner, dinner formal,formal,False,-17.872106552124023,-21.30132293701172,3.4292163848876953,14067712,EleutherAI/pythia-14m,step83000,seed7,7,83000
He had a recurring dream.,dream,dream,He had a dream recurring., recurring dream, dream recurring,recurring,False,-13.756755828857422,-20.15398406982422,6.397228240966797,14067712,EleutherAI/pythia-14m,step83000,seed7,7,83000
He had a bad dream.,dream,dream,He had a dream bad., bad dream, dream bad,bad,False,-13.00584602355957,-16.09912872314453,3.093282699584961,14067712,EleutherAI/pythia-14m,step83000,seed7,7,83000
He had a childhood dream.,dream,dream,He had a dream childhood., childhood dream, dream childhood,childhood,True,-14.493212699890137,-19.122848510742188,4.629635810852051,14067712,EleutherAI/pythia-14m,step83000,seed7,7,83000
It was a grueling drill.,drill,drill,It was a drill grueling., grueling drill, drill grueling,grueling,False,-22.173049926757812,-28.069551467895508,5.896501541137695,14067712,EleutherAI/pythia-14m,step83000,seed7,7,83000
It was a challenging drill.,drill,drill,It was a drill challenging., challenging drill, drill challenging,challenging,False,-19.19036102294922,-22.5157527923584,3.3253917694091797,14067712,EleutherAI/pythia-14m,step83000,seed7,7,83000
It was an electric drill.,drill,drill,It was an drill electric., electric drill, drill electric,electric,False,-17.716659545898438,-24.802186965942383,7.085527420043945,14067712,EleutherAI/pythia-14m,step83000,seed7,7,83000
It was a multiple-choice examination.,examination,examination,It was an examination multiple-choice., multiple-choice examination, examination multiple-choice,multiple-choice,False,-25.87257957458496,-27.88645362854004,2.013874053955078,14067712,EleutherAI/pythia-14m,step83000,seed7,7,83000
It was a difficult examination.,examination,examination,It was an examination difficult., difficult examination, examination difficult,difficult,False,-13.581352233886719,-14.914497375488281,1.3331451416015625,14067712,EleutherAI/pythia-14m,step83000,seed7,7,83000
It was a prostate examination.,examination,examination,It was an examination prostate., prostate examination, examination prostate,prostate,True,-20.7927303314209,-21.219449996948242,0.42671966552734375,14067712,EleutherAI/pythia-14m,step83000,seed7,7,83000
They had an electric fan.,fan,fan,They had an fan electric., electric fan, fan electric,electric,False,-16.496597290039062,-27.905467987060547,11.408870697021484,14067712,EleutherAI/pythia-14m,step83000,seed7,7,83000
They had a ceiling fan.,fan,fan,They had a fan ceiling., ceiling fan, fan ceiling,ceiling,True,-19.79147720336914,-26.4778995513916,6.686422348022461,14067712,EleutherAI/pythia-14m,step83000,seed7,7,83000
They had a zealous fan.,fan,fan,They had a fan zealous., zealous fan, fan zealous,zealous,False,-30.121234893798828,-28.750091552734375,-1.3711433410644531,14067712,EleutherAI/pythia-14m,step83000,seed7,7,83000
She had a text file.,file,file,She had a file text., text file, file text,text,True,-15.701692581176758,-19.264129638671875,3.562437057495117,14067712,EleutherAI/pythia-14m,step83000,seed7,7,83000
She had a data file.,file,file,She had a file data., data file, file data,data,True,-17.47857093811035,-18.837120056152344,1.3585491180419922,14067712,EleutherAI/pythia-14m,step83000,seed7,7,83000
She had a nail file.,file,file,She had a file nail., nail file, file nail,nail,True,-22.331974029541016,-24.673431396484375,2.3414573669433594,14067712,EleutherAI/pythia-14m,step83000,seed7,7,83000
It was an action film.,film,film,It was an film action., action film, film action,action,True,-14.762960433959961,-15.738990783691406,0.9760303497314453,14067712,EleutherAI/pythia-14m,step83000,seed7,7,83000
It was a censored film.,film,film,It was a film censored., censored film, film censored,censored,False,-21.054210662841797,-22.869081497192383,1.814870834350586,14067712,EleutherAI/pythia-14m,step83000,seed7,7,83000
It was a transparent film.,film,film,It was a film transparent., transparent film, film transparent,transparent,False,-16.958003997802734,-21.655637741088867,4.697633743286133,14067712,EleutherAI/pythia-14m,step83000,seed7,7,83000
It was a charitable foundation.,foundation,foundation,It was a foundation charitable., charitable foundation, foundation charitable,charitable,False,-15.18553638458252,-22.120014190673828,6.934477806091309,14067712,EleutherAI/pythia-14m,step83000,seed7,7,83000
It was an educational foundation.,foundation,foundation,It was an foundation educational., educational foundation, foundation educational,educational,False,-13.913309097290039,-23.882843017578125,9.969533920288086,14067712,EleutherAI/pythia-14m,step83000,seed7,7,83000
It was a wooden foundation.,foundation,foundation,It was a foundation wooden., wooden foundation, foundation wooden,wooden,False,-16.61411476135254,-21.626483917236328,5.012369155883789,14067712,EleutherAI/pythia-14m,step83000,seed7,7,83000
It was a mathematical function.,function,function,It was a function mathematical., mathematical function, function mathematical,mathematical,False,-15.90363597869873,-18.89691925048828,2.993283271789551,14067712,EleutherAI/pythia-14m,step83000,seed7,7,83000
It was a linear function.,function,function,It was a function linear., linear function, function linear,linear,False,-15.35374641418457,-19.018661499023438,3.664915084838867,14067712,EleutherAI/pythia-14m,step83000,seed7,7,83000
