sentence,word,string,reversed_sentence,mod_np,reversed_mod,disambiguating_word,non_adjective,original_logprob,reversed_logprob,ratio,n_params,mpath,revision,seed_name,seed,step
It was a desperate act.,act,act,It was an act desperate., desperate act, act desperate,desperate,False,-15.589115142822266,-20.178489685058594,4.589374542236328,14067712,EleutherAI/pythia-14m,step58000,seed2,2,58000
It was a humane act.,act,act,It was an act humane., humane act, act humane,humane,False,-22.932472229003906,-23.98655891418457,1.054086685180664,14067712,EleutherAI/pythia-14m,step58000,seed2,2,58000
It was a magic act.,act,act,It was an act magic., magic act, act magic,magic,False,-17.37637710571289,-20.18657684326172,2.810199737548828,14067712,EleutherAI/pythia-14m,step58000,seed2,2,58000
He had a universal appeal.,appeal,appeal,He had an appeal universal., universal appeal, appeal universal,universal,False,-19.597150802612305,-21.183082580566406,1.5859317779541016,14067712,EleutherAI/pythia-14m,step58000,seed2,2,58000
He had an undefinable appeal.,appeal,appeal,He had an appeal undefinable., undefinable appeal, appeal undefinable,undefinable,False,-25.18797492980957,-32.381675720214844,7.193700790405273,14067712,EleutherAI/pythia-14m,step58000,seed2,2,58000
He had a legal appeal.,appeal,appeal,He had an appeal legal., legal appeal, appeal legal,legal,False,-17.1883544921875,-19.88280487060547,2.6944503784179688,14067712,EleutherAI/pythia-14m,step58000,seed2,2,58000
It was a tense atmosphere.,atmosphere,atmosphere,It was an atmosphere tense., tense atmosphere, atmosphere tense,tense,False,-18.282358169555664,-20.10507583618164,1.8227176666259766,14067712,EleutherAI/pythia-14m,step58000,seed2,2,58000
It was a hostile atmosphere.,atmosphere,atmosphere,It was an atmosphere hostile., hostile atmosphere, atmosphere hostile,hostile,False,-16.049495697021484,-20.339725494384766,4.290229797363281,14067712,EleutherAI/pythia-14m,step58000,seed2,2,58000
It was a gaseous atmosphere.,atmosphere,atmosphere,It was an atmosphere gaseous., gaseous atmosphere, atmosphere gaseous,gaseous,False,-15.357622146606445,-22.074848175048828,6.717226028442383,14067712,EleutherAI/pythia-14m,step58000,seed2,2,58000
It was a gold band.,band,band,It was a band gold., gold band, band gold,gold,True,-14.214784622192383,-22.579551696777344,8.364767074584961,14067712,EleutherAI/pythia-14m,step58000,seed2,2,58000
It was a rubber band.,band,band,It was a band rubber., rubber band, band rubber,rubber,True,-14.488462448120117,-23.191932678222656,8.703470230102539,14067712,EleutherAI/pythia-14m,step58000,seed2,2,58000
It was a jazz band.,band,band,It was a band jazz., jazz band, band jazz,jazz,True,-13.000175476074219,-21.586219787597656,8.586044311523438,14067712,EleutherAI/pythia-14m,step58000,seed2,2,58000
There was a police barrier.,barrier,barrier,There was a barrier police., police barrier, barrier police,police,True,-21.44607162475586,-21.10871124267578,-0.3373603820800781,14067712,EleutherAI/pythia-14m,step58000,seed2,2,58000
There was a concrete barrier.,barrier,barrier,There was a barrier concrete., concrete barrier, barrier concrete,concrete,False,-16.7977237701416,-20.232505798339844,3.434782028198242,14067712,EleutherAI/pythia-14m,step58000,seed2,2,58000
There was a language barrier.,barrier,barrier,There was a barrier language., language barrier, barrier language,language,True,-21.872055053710938,-22.147743225097656,0.27568817138671875,14067712,EleutherAI/pythia-14m,step58000,seed2,2,58000
He saw a furry bat.,bat,bat,He saw a bat furry., furry bat, bat furry,furry,False,-20.937042236328125,-22.112857818603516,1.1758155822753906,14067712,EleutherAI/pythia-14m,step58000,seed2,2,58000
He saw a fruit bat.,bat,bat,He saw a bat fruit., fruit bat, bat fruit,fruit,True,-18.973003387451172,-20.959266662597656,1.9862632751464844,14067712,EleutherAI/pythia-14m,step58000,seed2,2,58000
He saw a wooden bat.,bat,bat,He saw a bat wooden., wooden bat, bat wooden,wooden,False,-16.521329879760742,-21.799949645996094,5.278619766235352,14067712,EleutherAI/pythia-14m,step58000,seed2,2,58000
He saw the laser beam.,beam,beam,He saw the beam laser., laser beam, beam laser,laser,True,-12.46041488647461,-17.977148056030273,5.516733169555664,14067712,EleutherAI/pythia-14m,step58000,seed2,2,58000
He saw the bright beam.,beam,beam,He saw the beam bright., bright beam, beam bright,bright,False,-15.948338508605957,-18.31070327758789,2.3623647689819336,14067712,EleutherAI/pythia-14m,step58000,seed2,2,58000
He saw the wood beam.,beam,beam,He saw the beam wood., wood beam, beam wood,wood,True,-18.28435516357422,-21.680301666259766,3.395946502685547,14067712,EleutherAI/pythia-14m,step58000,seed2,2,58000
She had a toy block.,block,block,She had a block toy., toy block, block toy,toy,True,-17.99791145324707,-20.885154724121094,2.8872432708740234,14067712,EleutherAI/pythia-14m,step58000,seed2,2,58000
She had a wooden block.,block,block,She had a block wooden., wooden block, block wooden,wooden,False,-14.467384338378906,-20.50505828857422,6.0376739501953125,14067712,EleutherAI/pythia-14m,step58000,seed2,2,58000
She had a mental block.,block,block,She had a block mental., mental block, block mental,mental,False,-17.468338012695312,-22.576332092285156,5.107994079589844,14067712,EleutherAI/pythia-14m,step58000,seed2,2,58000
He has coagulated blood.,blood,blood,He has blood coagulated., coagulated blood, blood coagulated,coagulated,True,-29.005599975585938,-27.410337448120117,-1.5952625274658203,14067712,EleutherAI/pythia-14m,step58000,seed2,2,58000
He has thin blood.,blood,blood,He has blood thin., thin blood, blood thin,thin,False,-18.269943237304688,-19.531871795654297,1.2619285583496094,14067712,EleutherAI/pythia-14m,step58000,seed2,2,58000
He has noble blood.,blood,blood,He has blood noble., noble blood, blood noble,noble,False,-18.573322296142578,-21.499736785888672,2.9264144897460938,14067712,EleutherAI/pythia-14m,step58000,seed2,2,58000
It was the ironing board.,board,board,It was the board ironing., ironing board, board ironing,ironing,False,-24.25859260559082,-23.10865592956543,-1.1499366760253906,14067712,EleutherAI/pythia-14m,step58000,seed2,2,58000
It was the wooden board.,board,board,It was the board wooden., wooden board, board wooden,wooden,False,-15.358963012695312,-19.11937141418457,3.760408401489258,14067712,EleutherAI/pythia-14m,step58000,seed2,2,58000
It was the executive board.,board,board,It was the board executive., executive board, board executive,executive,True,-13.477479934692383,-16.861223220825195,3.3837432861328125,14067712,EleutherAI/pythia-14m,step58000,seed2,2,58000
He had a best-selling book.,book,book,He had a book best-selling., best-selling book, book best-selling,best-selling,False,-16.31351661682129,-23.148433685302734,6.834917068481445,14067712,EleutherAI/pythia-14m,step58000,seed2,2,58000
He had a popular book.,book,book,He had a book popular., popular book, book popular,popular,False,-15.209396362304688,-18.01554298400879,2.8061466217041016,14067712,EleutherAI/pythia-14m,step58000,seed2,2,58000
He had a heavy book.,book,book,He had a book heavy., heavy book, book heavy,heavy,False,-17.024383544921875,-17.84800148010254,0.8236179351806641,14067712,EleutherAI/pythia-14m,step58000,seed2,2,58000
They ate a pancake breakfast.,breakfast,breakfast,They ate a breakfast pancake., pancake breakfast, breakfast pancake,pancake,True,-15.395842552185059,-12.851165771484375,-2.5446767807006836,14067712,EleutherAI/pythia-14m,step58000,seed2,2,58000
They ate a nutritious breakfast.,breakfast,breakfast,They ate a breakfast nutritious., nutritious breakfast, breakfast nutritious,nutritious,False,-18.060636520385742,-20.035778045654297,1.9751415252685547,14067712,EleutherAI/pythia-14m,step58000,seed2,2,58000
They ate a family breakfast.,breakfast,breakfast,They ate a breakfast family., family breakfast, breakfast family,family,True,-13.122875213623047,-14.159543991088867,1.0366687774658203,14067712,EleutherAI/pythia-14m,step58000,seed2,2,58000
It was a red cape.,cape,cape,It was a cape red., red cape, cape red,red,False,-18.99597930908203,-21.957595825195312,2.9616165161132812,14067712,EleutherAI/pythia-14m,step58000,seed2,2,58000
It was a flowing cape.,cape,cape,It was a cape flowing., flowing cape, cape flowing,flowing,False,-23.052005767822266,-25.1256103515625,2.0736045837402344,14067712,EleutherAI/pythia-14m,step58000,seed2,2,58000
It was a rocky cape.,cape,cape,It was a cape rocky., rocky cape, cape rocky,rocky,False,-23.96782684326172,-28.172348022460938,4.204521179199219,14067712,EleutherAI/pythia-14m,step58000,seed2,2,58000
It was a beer case.,case,case,It was a case beer., beer case, case beer,beer,True,-17.037574768066406,-17.63634490966797,0.5987701416015625,14067712,EleutherAI/pythia-14m,step58000,seed2,2,58000
It was a display case.,case,case,It was a case display., display case, case display,display,True,-15.295499801635742,-16.04230499267578,0.7468051910400391,14067712,EleutherAI/pythia-14m,step58000,seed2,2,58000
It was a divorce case.,case,case,It was a case divorce., divorce case, case divorce,divorce,True,-14.919391632080078,-18.78211212158203,3.862720489501953,14067712,EleutherAI/pythia-14m,step58000,seed2,2,58000
It was a worthy cause.,cause,cause,It was a cause worthy., worthy cause, cause worthy,worthy,False,-16.821866989135742,-20.21040153503418,3.3885345458984375,14067712,EleutherAI/pythia-14m,step58000,seed2,2,58000
It was a political cause.,cause,cause,It was a cause political., political cause, cause political,political,False,-14.861799240112305,-20.417585372924805,5.5557861328125,14067712,EleutherAI/pythia-14m,step58000,seed2,2,58000
It was a main cause.,cause,cause,It was a cause main., main cause, cause main,main,False,-13.18491268157959,-20.412748336791992,7.227835655212402,14067712,EleutherAI/pythia-14m,step58000,seed2,2,58000
It was a skin cell.,cell,cell,It was a cell skin., skin cell, cell skin,skin,True,-14.429510116577148,-15.95584487915039,1.5263347625732422,14067712,EleutherAI/pythia-14m,step58000,seed2,2,58000
It was a brain cell.,cell,cell,It was a cell brain., brain cell, cell brain,brain,True,-12.878676414489746,-15.409274101257324,2.530597686767578,14067712,EleutherAI/pythia-14m,step58000,seed2,2,58000
It was a prison cell.,cell,cell,It was a cell prison., prison cell, cell prison,prison,True,-17.371591567993164,-18.282657623291016,0.9110660552978516,14067712,EleutherAI/pythia-14m,step58000,seed2,2,58000
She had a devilish charm.,charm,charm,She had a charm devilish., devilish charm, charm devilish,devilish,False,-17.781383514404297,-23.68336296081543,5.901979446411133,14067712,EleutherAI/pythia-14m,step58000,seed2,2,58000
She had a natural charm.,charm,charm,She had a charm natural., natural charm, charm natural,natural,False,-14.603994369506836,-19.513023376464844,4.909029006958008,14067712,EleutherAI/pythia-14m,step58000,seed2,2,58000
She had a gold charm.,charm,charm,She had a charm gold., gold charm, charm gold,gold,True,-16.25873565673828,-18.38011932373047,2.1213836669921875,14067712,EleutherAI/pythia-14m,step58000,seed2,2,58000
They liked the juicy chicken.,chicken,chicken,They liked the chicken juicy., juicy chicken, chicken juicy,juicy,False,-20.19071388244629,-19.692401885986328,-0.49831199645996094,14067712,EleutherAI/pythia-14m,step58000,seed2,2,58000
They liked the roasted chicken.,chicken,chicken,They liked the chicken roasted., roasted chicken, chicken roasted,roasted,False,-15.244098663330078,-17.47948455810547,2.2353858947753906,14067712,EleutherAI/pythia-14m,step58000,seed2,2,58000
They liked the clucking chicken.,chicken,chicken,They liked the chicken clucking., clucking chicken, chicken clucking,clucking,True,-21.76706314086914,-20.450679779052734,-1.3163833618164062,14067712,EleutherAI/pythia-14m,step58000,seed2,2,58000
It was a perceptive class.,class,class,It was a class perceptive., perceptive class, class perceptive,perceptive,False,-19.869348526000977,-25.907684326171875,6.038335800170898,14067712,EleutherAI/pythia-14m,step58000,seed2,2,58000
It was a misbehaving class.,class,class,It was a class misbehaving., misbehaving class, class misbehaving,misbehaving,False,-30.458152770996094,-28.403579711914062,-2.0545730590820312,14067712,EleutherAI/pythia-14m,step58000,seed2,2,58000
It was a boring class.,class,class,It was a class boring., boring class, class boring,boring,False,-17.677059173583984,-20.783782958984375,3.1067237854003906,14067712,EleutherAI/pythia-14m,step58000,seed2,2,58000
It was a film clip.,clip,clip,It was a clip film., film clip, clip film,film,True,-17.40195655822754,-19.27877426147461,1.8768177032470703,14067712,EleutherAI/pythia-14m,step58000,seed2,2,58000
It was a video clip.,clip,clip,It was a clip video., video clip, clip video,video,True,-11.958574295043945,-19.657161712646484,7.698587417602539,14067712,EleutherAI/pythia-14m,step58000,seed2,2,58000
It was a hair clip.,clip,clip,It was a clip hair., hair clip, clip hair,hair,True,-18.22951316833496,-24.626338958740234,6.396825790405273,14067712,EleutherAI/pythia-14m,step58000,seed2,2,58000
It was an icy cold.,cold,cold,It was an cold icy., icy cold, cold icy,icy,False,-13.197247505187988,-18.35820770263672,5.1609601974487305,14067712,EleutherAI/pythia-14m,step58000,seed2,2,58000
It was a freezing cold.,cold,cold,It was a cold freezing., freezing cold, cold freezing,freezing,False,-15.543167114257812,-16.474281311035156,0.9311141967773438,14067712,EleutherAI/pythia-14m,step58000,seed2,2,58000
It was a chest cold.,cold,cold,It was a cold chest., chest cold, cold chest,chest,False,-19.866405487060547,-15.31191349029541,-4.554491996765137,14067712,EleutherAI/pythia-14m,step58000,seed2,2,58000
It was a gossip column.,column,column,It was a column gossip., gossip column, column gossip,gossip,True,-17.964492797851562,-23.417194366455078,5.452701568603516,14067712,EleutherAI/pythia-14m,step58000,seed2,2,58000
It was a sports column.,column,column,It was a column sports., sports column, column sports,sports,True,-18.484291076660156,-21.919010162353516,3.4347190856933594,14067712,EleutherAI/pythia-14m,step58000,seed2,2,58000
It was a concrete column.,column,column,It was a column concrete., concrete column, column concrete,concrete,False,-15.396270751953125,-19.144397735595703,3.748126983642578,14067712,EleutherAI/pythia-14m,step58000,seed2,2,58000
He liked the investment company.,company,company,He liked the company investment., investment company, company investment,investment,True,-15.732574462890625,-16.28404998779297,0.5514755249023438,14067712,EleutherAI/pythia-14m,step58000,seed2,2,58000
He liked the pharmaceutical company.,company,company,He liked the company pharmaceutical., pharmaceutical company, company pharmaceutical,pharmaceutical,False,-14.31920337677002,-18.67620086669922,4.356997489929199,14067712,EleutherAI/pythia-14m,step58000,seed2,2,58000
He liked the pleasant company.,company,company,He liked the company pleasant., pleasant company, company pleasant,pleasant,False,-17.38677215576172,-18.041099548339844,0.654327392578125,14067712,EleutherAI/pythia-14m,step58000,seed2,2,58000
It was a waffle cone.,cone,cone,It was a cone waffle., waffle cone, cone waffle,waffle,True,-28.333053588867188,-31.628862380981445,3.295808792114258,14067712,EleutherAI/pythia-14m,step58000,seed2,2,58000
It was a sugar cone.,cone,cone,It was a cone sugar., sugar cone, cone sugar,sugar,True,-18.988357543945312,-21.981990814208984,2.993633270263672,14067712,EleutherAI/pythia-14m,step58000,seed2,2,58000
It was an orange cone.,cone,cone,It was an cone orange., orange cone, cone orange,orange,False,-16.379013061523438,-23.1761531829834,6.797140121459961,14067712,EleutherAI/pythia-14m,step58000,seed2,2,58000
He made a charitable contribution.,contribution,contribution,He made a contribution charitable., charitable contribution, contribution charitable,charitable,False,-16.493728637695312,-22.872228622436523,6.378499984741211,14067712,EleutherAI/pythia-14m,step58000,seed2,2,58000
He made a voluntary contribution.,contribution,contribution,He made a contribution voluntary., voluntary contribution, contribution voluntary,voluntary,False,-16.809680938720703,-22.194616317749023,5.38493537902832,14067712,EleutherAI/pythia-14m,step58000,seed2,2,58000
He made a scholarly contribution.,contribution,contribution,He made a contribution scholarly., scholarly contribution, contribution scholarly,scholarly,False,-19.509382247924805,-24.55743980407715,5.048057556152344,14067712,EleutherAI/pythia-14m,step58000,seed2,2,58000
That was the noble count.,count,count,That was the count noble., noble count, count noble,noble,False,-18.956979751586914,-23.519746780395508,4.562767028808594,14067712,EleutherAI/pythia-14m,step58000,seed2,2,58000
That was the vengeful count.,count,count,That was the count vengeful., vengeful count, count vengeful,vengeful,False,-28.97765350341797,-32.795387268066406,3.8177337646484375,14067712,EleutherAI/pythia-14m,step58000,seed2,2,58000
That was the final count.,count,count,That was the count final., final count, count final,final,False,-14.288063049316406,-20.120258331298828,5.832195281982422,14067712,EleutherAI/pythia-14m,step58000,seed2,2,58000
It was an introductory course.,course,course,It was an course introductory., introductory course, course introductory,introductory,False,-12.909517288208008,-20.014448165893555,7.104930877685547,14067712,EleutherAI/pythia-14m,step58000,seed2,2,58000
It was a pass-fail course.,course,course,It was a course pass-fail., pass-fail course, course pass-fail,pass-fail,False,-32.09616470336914,-31.679229736328125,-0.4169349670410156,14067712,EleutherAI/pythia-14m,step58000,seed2,2,58000
It was a charted course.,course,course,It was a course charted., charted course, course charted,charted,False,-19.583515167236328,-21.15165138244629,1.568136215209961,14067712,EleutherAI/pythia-14m,step58000,seed2,2,58000
It was a dinner date.,date,date,It was a date dinner., dinner date, date dinner,dinner,True,-15.460000038146973,-18.95574188232422,3.495741844177246,14067712,EleutherAI/pythia-14m,step58000,seed2,2,58000
It was a blind date.,date,date,It was a date blind., blind date, date blind,blind,False,-18.622291564941406,-18.850242614746094,0.2279510498046875,14067712,EleutherAI/pythia-14m,step58000,seed2,2,58000
It was an expiration date.,date,date,It was an date expiration., expiration date, date expiration,expiration,True,-10.223384857177734,-19.751047134399414,9.52766227722168,14067712,EleutherAI/pythia-14m,step58000,seed2,2,58000
It was about forty degrees.,degree,degrees,It was about degrees forty., forty degrees, degrees forty,forty,True,-12.610105514526367,-24.147197723388672,11.537092208862305,14067712,EleutherAI/pythia-14m,step58000,seed2,2,58000
It was about fifty degrees.,degree,degrees,It was about degrees fifty., fifty degrees, degrees fifty,fifty,True,-13.152048110961914,-23.762828826904297,10.610780715942383,14067712,EleutherAI/pythia-14m,step58000,seed2,2,58000
It was about associate degrees.,degree,degrees,It was about degrees associate., associate degrees, degrees associate,associate,False,-24.883056640625,-26.083675384521484,1.2006187438964844,14067712,EleutherAI/pythia-14m,step58000,seed2,2,58000
They liked the floral design.,design,design,They liked the design floral., floral design, design floral,floral,False,-15.513090133666992,-20.63184356689453,5.118753433227539,14067712,EleutherAI/pythia-14m,step58000,seed2,2,58000
They liked the geometric design.,design,design,They liked the design geometric., geometric design, design geometric,geometric,False,-14.505117416381836,-20.03990936279297,5.534791946411133,14067712,EleutherAI/pythia-14m,step58000,seed2,2,58000
They liked the product design.,design,design,They liked the design product., product design, design product,product,True,-14.884967803955078,-16.37860870361328,1.4936408996582031,14067712,EleutherAI/pythia-14m,step58000,seed2,2,58000
They liked the turkey dinner.,dinner,dinner,They liked the dinner turkey., turkey dinner, dinner turkey,turkey,True,-17.340808868408203,-18.62640380859375,1.2855949401855469,14067712,EleutherAI/pythia-14m,step58000,seed2,2,58000
They liked the light dinner.,dinner,dinner,They liked the dinner light., light dinner, dinner light,light,False,-18.086345672607422,-18.276458740234375,0.19011306762695312,14067712,EleutherAI/pythia-14m,step58000,seed2,2,58000
They liked the formal dinner.,dinner,dinner,They liked the dinner formal., formal dinner, dinner formal,formal,False,-19.485172271728516,-20.742111206054688,1.2569389343261719,14067712,EleutherAI/pythia-14m,step58000,seed2,2,58000
He had a recurring dream.,dream,dream,He had a dream recurring., recurring dream, dream recurring,recurring,False,-16.853361129760742,-21.394128799438477,4.540767669677734,14067712,EleutherAI/pythia-14m,step58000,seed2,2,58000
He had a bad dream.,dream,dream,He had a dream bad., bad dream, dream bad,bad,False,-12.857734680175781,-17.09092140197754,4.233186721801758,14067712,EleutherAI/pythia-14m,step58000,seed2,2,58000
He had a childhood dream.,dream,dream,He had a dream childhood., childhood dream, dream childhood,childhood,True,-13.813408851623535,-18.116418838500977,4.303009986877441,14067712,EleutherAI/pythia-14m,step58000,seed2,2,58000
It was a grueling drill.,drill,drill,It was a drill grueling., grueling drill, drill grueling,grueling,False,-20.140090942382812,-23.058950424194336,2.9188594818115234,14067712,EleutherAI/pythia-14m,step58000,seed2,2,58000
It was a challenging drill.,drill,drill,It was a drill challenging., challenging drill, drill challenging,challenging,False,-20.299509048461914,-23.98995590209961,3.6904468536376953,14067712,EleutherAI/pythia-14m,step58000,seed2,2,58000
It was an electric drill.,drill,drill,It was an drill electric., electric drill, drill electric,electric,False,-17.25099754333496,-22.17963409423828,4.92863655090332,14067712,EleutherAI/pythia-14m,step58000,seed2,2,58000
It was a multiple-choice examination.,examination,examination,It was an examination multiple-choice., multiple-choice examination, examination multiple-choice,multiple-choice,False,-27.626426696777344,-29.932941436767578,2.3065147399902344,14067712,EleutherAI/pythia-14m,step58000,seed2,2,58000
It was a difficult examination.,examination,examination,It was an examination difficult., difficult examination, examination difficult,difficult,False,-14.511587142944336,-16.726638793945312,2.2150516510009766,14067712,EleutherAI/pythia-14m,step58000,seed2,2,58000
It was a prostate examination.,examination,examination,It was an examination prostate., prostate examination, examination prostate,prostate,True,-21.872657775878906,-19.549179077148438,-2.3234786987304688,14067712,EleutherAI/pythia-14m,step58000,seed2,2,58000
They had an electric fan.,fan,fan,They had an fan electric., electric fan, fan electric,electric,False,-13.473187446594238,-21.20960235595703,7.736414909362793,14067712,EleutherAI/pythia-14m,step58000,seed2,2,58000
They had a ceiling fan.,fan,fan,They had a fan ceiling., ceiling fan, fan ceiling,ceiling,True,-20.715078353881836,-23.566577911376953,2.851499557495117,14067712,EleutherAI/pythia-14m,step58000,seed2,2,58000
They had a zealous fan.,fan,fan,They had a fan zealous., zealous fan, fan zealous,zealous,False,-21.625839233398438,-24.50833511352539,2.882495880126953,14067712,EleutherAI/pythia-14m,step58000,seed2,2,58000
She had a text file.,file,file,She had a file text., text file, file text,text,True,-16.098033905029297,-19.592025756835938,3.4939918518066406,14067712,EleutherAI/pythia-14m,step58000,seed2,2,58000
She had a data file.,file,file,She had a file data., data file, file data,data,True,-17.46607780456543,-18.804840087890625,1.3387622833251953,14067712,EleutherAI/pythia-14m,step58000,seed2,2,58000
She had a nail file.,file,file,She had a file nail., nail file, file nail,nail,True,-18.9095401763916,-22.781448364257812,3.871908187866211,14067712,EleutherAI/pythia-14m,step58000,seed2,2,58000
It was an action film.,film,film,It was an film action., action film, film action,action,True,-12.803092956542969,-15.074485778808594,2.271392822265625,14067712,EleutherAI/pythia-14m,step58000,seed2,2,58000
It was a censored film.,film,film,It was a film censored., censored film, film censored,censored,False,-26.747360229492188,-21.374439239501953,-5.372920989990234,14067712,EleutherAI/pythia-14m,step58000,seed2,2,58000
It was a transparent film.,film,film,It was a film transparent., transparent film, film transparent,transparent,False,-15.24124526977539,-20.175867080688477,4.934621810913086,14067712,EleutherAI/pythia-14m,step58000,seed2,2,58000
It was a charitable foundation.,foundation,foundation,It was a foundation charitable., charitable foundation, foundation charitable,charitable,False,-16.022409439086914,-21.25688934326172,5.234479904174805,14067712,EleutherAI/pythia-14m,step58000,seed2,2,58000
It was an educational foundation.,foundation,foundation,It was an foundation educational., educational foundation, foundation educational,educational,False,-15.77417278289795,-21.884302139282227,6.110129356384277,14067712,EleutherAI/pythia-14m,step58000,seed2,2,58000
It was a wooden foundation.,foundation,foundation,It was a foundation wooden., wooden foundation, foundation wooden,wooden,False,-18.125507354736328,-18.33879852294922,0.21329116821289062,14067712,EleutherAI/pythia-14m,step58000,seed2,2,58000
It was a mathematical function.,function,function,It was a function mathematical., mathematical function, function mathematical,mathematical,False,-15.844131469726562,-18.164833068847656,2.3207015991210938,14067712,EleutherAI/pythia-14m,step58000,seed2,2,58000
It was a linear function.,function,function,It was a function linear., linear function, function linear,linear,False,-14.53600025177002,-18.10596466064453,3.5699644088745117,14067712,EleutherAI/pythia-14m,step58000,seed2,2,58000
