sentence,word,string,reversed_sentence,mod_np,reversed_mod,disambiguating_word,non_adjective,original_logprob,reversed_logprob,ratio,n_params,mpath,revision,seed_name,seed,step
It was a desperate act.,act,act,It was an act desperate., desperate act, act desperate,desperate,False,-15.379074096679688,-20.141122817993164,4.762048721313477,14067712,EleutherAI/pythia-14m,step104000,seed7,7,104000
It was a humane act.,act,act,It was an act humane., humane act, act humane,humane,False,-20.262676239013672,-22.238086700439453,1.9754104614257812,14067712,EleutherAI/pythia-14m,step104000,seed7,7,104000
It was a magic act.,act,act,It was an act magic., magic act, act magic,magic,False,-17.331222534179688,-18.759408950805664,1.4281864166259766,14067712,EleutherAI/pythia-14m,step104000,seed7,7,104000
He had a universal appeal.,appeal,appeal,He had an appeal universal., universal appeal, appeal universal,universal,False,-20.017162322998047,-24.105424880981445,4.088262557983398,14067712,EleutherAI/pythia-14m,step104000,seed7,7,104000
He had an undefinable appeal.,appeal,appeal,He had an appeal undefinable., undefinable appeal, appeal undefinable,undefinable,False,-20.525577545166016,-27.038923263549805,6.513345718383789,14067712,EleutherAI/pythia-14m,step104000,seed7,7,104000
He had a legal appeal.,appeal,appeal,He had an appeal legal., legal appeal, appeal legal,legal,False,-13.090015411376953,-18.880205154418945,5.790189743041992,14067712,EleutherAI/pythia-14m,step104000,seed7,7,104000
It was a tense atmosphere.,atmosphere,atmosphere,It was an atmosphere tense., tense atmosphere, atmosphere tense,tense,False,-18.10274887084961,-19.04376220703125,0.9410133361816406,14067712,EleutherAI/pythia-14m,step104000,seed7,7,104000
It was a hostile atmosphere.,atmosphere,atmosphere,It was an atmosphere hostile., hostile atmosphere, atmosphere hostile,hostile,False,-16.56061553955078,-20.26324462890625,3.7026290893554688,14067712,EleutherAI/pythia-14m,step104000,seed7,7,104000
It was a gaseous atmosphere.,atmosphere,atmosphere,It was an atmosphere gaseous., gaseous atmosphere, atmosphere gaseous,gaseous,False,-17.070337295532227,-22.20758056640625,5.137243270874023,14067712,EleutherAI/pythia-14m,step104000,seed7,7,104000
It was a gold band.,band,band,It was a band gold., gold band, band gold,gold,True,-15.133609771728516,-18.481048583984375,3.3474388122558594,14067712,EleutherAI/pythia-14m,step104000,seed7,7,104000
It was a rubber band.,band,band,It was a band rubber., rubber band, band rubber,rubber,True,-15.935611724853516,-21.852996826171875,5.917385101318359,14067712,EleutherAI/pythia-14m,step104000,seed7,7,104000
It was a jazz band.,band,band,It was a band jazz., jazz band, band jazz,jazz,True,-14.141958236694336,-20.470062255859375,6.328104019165039,14067712,EleutherAI/pythia-14m,step104000,seed7,7,104000
There was a police barrier.,barrier,barrier,There was a barrier police., police barrier, barrier police,police,True,-18.930252075195312,-20.723121643066406,1.7928695678710938,14067712,EleutherAI/pythia-14m,step104000,seed7,7,104000
There was a concrete barrier.,barrier,barrier,There was a barrier concrete., concrete barrier, barrier concrete,concrete,False,-14.354219436645508,-20.243507385253906,5.889287948608398,14067712,EleutherAI/pythia-14m,step104000,seed7,7,104000
There was a language barrier.,barrier,barrier,There was a barrier language., language barrier, barrier language,language,True,-17.704463958740234,-22.866188049316406,5.161724090576172,14067712,EleutherAI/pythia-14m,step104000,seed7,7,104000
He saw a furry bat.,bat,bat,He saw a bat furry., furry bat, bat furry,furry,False,-20.939842224121094,-24.169658660888672,3.229816436767578,14067712,EleutherAI/pythia-14m,step104000,seed7,7,104000
He saw a fruit bat.,bat,bat,He saw a bat fruit., fruit bat, bat fruit,fruit,True,-18.684303283691406,-19.734600067138672,1.0502967834472656,14067712,EleutherAI/pythia-14m,step104000,seed7,7,104000
He saw a wooden bat.,bat,bat,He saw a bat wooden., wooden bat, bat wooden,wooden,False,-14.751008987426758,-21.381938934326172,6.630929946899414,14067712,EleutherAI/pythia-14m,step104000,seed7,7,104000
He saw the laser beam.,beam,beam,He saw the beam laser., laser beam, beam laser,laser,True,-13.566330909729004,-16.20045280456543,2.634121894836426,14067712,EleutherAI/pythia-14m,step104000,seed7,7,104000
He saw the bright beam.,beam,beam,He saw the beam bright., bright beam, beam bright,bright,False,-19.91029167175293,-17.36427116394043,-2.5460205078125,14067712,EleutherAI/pythia-14m,step104000,seed7,7,104000
He saw the wood beam.,beam,beam,He saw the beam wood., wood beam, beam wood,wood,True,-17.884868621826172,-19.38734245300293,1.5024738311767578,14067712,EleutherAI/pythia-14m,step104000,seed7,7,104000
She had a toy block.,block,block,She had a block toy., toy block, block toy,toy,True,-19.423038482666016,-20.342994689941406,0.9199562072753906,14067712,EleutherAI/pythia-14m,step104000,seed7,7,104000
She had a wooden block.,block,block,She had a block wooden., wooden block, block wooden,wooden,False,-14.43320083618164,-21.391822814941406,6.958621978759766,14067712,EleutherAI/pythia-14m,step104000,seed7,7,104000
She had a mental block.,block,block,She had a block mental., mental block, block mental,mental,False,-19.462024688720703,-22.774635314941406,3.312610626220703,14067712,EleutherAI/pythia-14m,step104000,seed7,7,104000
He has coagulated blood.,blood,blood,He has blood coagulated., coagulated blood, blood coagulated,coagulated,True,-26.153352737426758,-30.6718807220459,4.518527984619141,14067712,EleutherAI/pythia-14m,step104000,seed7,7,104000
He has thin blood.,blood,blood,He has blood thin., thin blood, blood thin,thin,False,-18.161113739013672,-20.5836181640625,2.422504425048828,14067712,EleutherAI/pythia-14m,step104000,seed7,7,104000
He has noble blood.,blood,blood,He has blood noble., noble blood, blood noble,noble,False,-20.82939910888672,-23.843017578125,3.0136184692382812,14067712,EleutherAI/pythia-14m,step104000,seed7,7,104000
It was the ironing board.,board,board,It was the board ironing., ironing board, board ironing,ironing,False,-22.599210739135742,-22.548917770385742,-0.05029296875,14067712,EleutherAI/pythia-14m,step104000,seed7,7,104000
It was the wooden board.,board,board,It was the board wooden., wooden board, board wooden,wooden,False,-16.270479202270508,-20.078899383544922,3.808420181274414,14067712,EleutherAI/pythia-14m,step104000,seed7,7,104000
It was the executive board.,board,board,It was the board executive., executive board, board executive,executive,True,-15.7836332321167,-17.754680633544922,1.9710474014282227,14067712,EleutherAI/pythia-14m,step104000,seed7,7,104000
He had a best-selling book.,book,book,He had a book best-selling., best-selling book, book best-selling,best-selling,False,-14.21330451965332,-21.705766677856445,7.492462158203125,14067712,EleutherAI/pythia-14m,step104000,seed7,7,104000
He had a popular book.,book,book,He had a book popular., popular book, book popular,popular,False,-13.353195190429688,-20.247272491455078,6.894077301025391,14067712,EleutherAI/pythia-14m,step104000,seed7,7,104000
He had a heavy book.,book,book,He had a book heavy., heavy book, book heavy,heavy,False,-17.945880889892578,-20.628009796142578,2.68212890625,14067712,EleutherAI/pythia-14m,step104000,seed7,7,104000
They ate a pancake breakfast.,breakfast,breakfast,They ate a breakfast pancake., pancake breakfast, breakfast pancake,pancake,True,-12.74625301361084,-15.104732513427734,2.3584794998168945,14067712,EleutherAI/pythia-14m,step104000,seed7,7,104000
They ate a nutritious breakfast.,breakfast,breakfast,They ate a breakfast nutritious., nutritious breakfast, breakfast nutritious,nutritious,False,-19.035282135009766,-24.080810546875,5.045528411865234,14067712,EleutherAI/pythia-14m,step104000,seed7,7,104000
They ate a family breakfast.,breakfast,breakfast,They ate a breakfast family., family breakfast, breakfast family,family,True,-11.155467987060547,-16.121910095214844,4.966442108154297,14067712,EleutherAI/pythia-14m,step104000,seed7,7,104000
It was a red cape.,cape,cape,It was a cape red., red cape, cape red,red,False,-18.28774642944336,-24.158248901367188,5.870502471923828,14067712,EleutherAI/pythia-14m,step104000,seed7,7,104000
It was a flowing cape.,cape,cape,It was a cape flowing., flowing cape, cape flowing,flowing,False,-25.213367462158203,-26.385665893554688,1.1722984313964844,14067712,EleutherAI/pythia-14m,step104000,seed7,7,104000
It was a rocky cape.,cape,cape,It was a cape rocky., rocky cape, cape rocky,rocky,False,-20.449295043945312,-28.750289916992188,8.300994873046875,14067712,EleutherAI/pythia-14m,step104000,seed7,7,104000
It was a beer case.,case,case,It was a case beer., beer case, case beer,beer,True,-17.310440063476562,-19.6208553314209,2.310415267944336,14067712,EleutherAI/pythia-14m,step104000,seed7,7,104000
It was a display case.,case,case,It was a case display., display case, case display,display,True,-16.16211700439453,-19.4290828704834,3.266965866088867,14067712,EleutherAI/pythia-14m,step104000,seed7,7,104000
It was a divorce case.,case,case,It was a case divorce., divorce case, case divorce,divorce,True,-13.058038711547852,-20.0885066986084,7.030467987060547,14067712,EleutherAI/pythia-14m,step104000,seed7,7,104000
It was a worthy cause.,cause,cause,It was a cause worthy., worthy cause, cause worthy,worthy,False,-15.720340728759766,-19.71407699584961,3.9937362670898438,14067712,EleutherAI/pythia-14m,step104000,seed7,7,104000
It was a political cause.,cause,cause,It was a cause political., political cause, cause political,political,False,-13.90194320678711,-20.49642562866211,6.594482421875,14067712,EleutherAI/pythia-14m,step104000,seed7,7,104000
It was a main cause.,cause,cause,It was a cause main., main cause, cause main,main,False,-14.349039077758789,-21.26803207397461,6.91899299621582,14067712,EleutherAI/pythia-14m,step104000,seed7,7,104000
It was a skin cell.,cell,cell,It was a cell skin., skin cell, cell skin,skin,True,-18.177841186523438,-16.393596649169922,-1.7842445373535156,14067712,EleutherAI/pythia-14m,step104000,seed7,7,104000
It was a brain cell.,cell,cell,It was a cell brain., brain cell, cell brain,brain,True,-14.97545051574707,-15.995037078857422,1.0195865631103516,14067712,EleutherAI/pythia-14m,step104000,seed7,7,104000
It was a prison cell.,cell,cell,It was a cell prison., prison cell, cell prison,prison,True,-16.84222412109375,-18.615764617919922,1.7735404968261719,14067712,EleutherAI/pythia-14m,step104000,seed7,7,104000
She had a devilish charm.,charm,charm,She had a charm devilish., devilish charm, charm devilish,devilish,False,-19.829463958740234,-26.548627853393555,6.71916389465332,14067712,EleutherAI/pythia-14m,step104000,seed7,7,104000
She had a natural charm.,charm,charm,She had a charm natural., natural charm, charm natural,natural,False,-14.373420715332031,-20.698787689208984,6.325366973876953,14067712,EleutherAI/pythia-14m,step104000,seed7,7,104000
She had a gold charm.,charm,charm,She had a charm gold., gold charm, charm gold,gold,True,-14.79786205291748,-18.909358978271484,4.111496925354004,14067712,EleutherAI/pythia-14m,step104000,seed7,7,104000
They liked the juicy chicken.,chicken,chicken,They liked the chicken juicy., juicy chicken, chicken juicy,juicy,False,-18.93968391418457,-19.77751922607422,0.8378353118896484,14067712,EleutherAI/pythia-14m,step104000,seed7,7,104000
They liked the roasted chicken.,chicken,chicken,They liked the chicken roasted., roasted chicken, chicken roasted,roasted,False,-14.037786483764648,-15.82838249206543,1.7905960083007812,14067712,EleutherAI/pythia-14m,step104000,seed7,7,104000
They liked the clucking chicken.,chicken,chicken,They liked the chicken clucking., clucking chicken, chicken clucking,clucking,True,-23.441356658935547,-22.853084564208984,-0.5882720947265625,14067712,EleutherAI/pythia-14m,step104000,seed7,7,104000
It was a perceptive class.,class,class,It was a class perceptive., perceptive class, class perceptive,perceptive,False,-27.57859230041504,-26.421306610107422,-1.1572856903076172,14067712,EleutherAI/pythia-14m,step104000,seed7,7,104000
It was a misbehaving class.,class,class,It was a class misbehaving., misbehaving class, class misbehaving,misbehaving,False,-24.059288024902344,-23.839052200317383,-0.22023582458496094,14067712,EleutherAI/pythia-14m,step104000,seed7,7,104000
It was a boring class.,class,class,It was a class boring., boring class, class boring,boring,False,-15.704963684082031,-17.07556915283203,1.37060546875,14067712,EleutherAI/pythia-14m,step104000,seed7,7,104000
It was a film clip.,clip,clip,It was a clip film., film clip, clip film,film,True,-17.234241485595703,-19.067813873291016,1.8335723876953125,14067712,EleutherAI/pythia-14m,step104000,seed7,7,104000
It was a video clip.,clip,clip,It was a clip video., video clip, clip video,video,True,-12.423656463623047,-17.725772857666016,5.302116394042969,14067712,EleutherAI/pythia-14m,step104000,seed7,7,104000
It was a hair clip.,clip,clip,It was a clip hair., hair clip, clip hair,hair,True,-19.510177612304688,-19.598697662353516,0.08852005004882812,14067712,EleutherAI/pythia-14m,step104000,seed7,7,104000
It was an icy cold.,cold,cold,It was an cold icy., icy cold, cold icy,icy,False,-10.930657386779785,-18.96023941040039,8.029582023620605,14067712,EleutherAI/pythia-14m,step104000,seed7,7,104000
It was a freezing cold.,cold,cold,It was a cold freezing., freezing cold, cold freezing,freezing,False,-14.075639724731445,-13.829864501953125,-0.2457752227783203,14067712,EleutherAI/pythia-14m,step104000,seed7,7,104000
It was a chest cold.,cold,cold,It was a cold chest., chest cold, cold chest,chest,False,-16.19342803955078,-14.757232666015625,-1.4361953735351562,14067712,EleutherAI/pythia-14m,step104000,seed7,7,104000
It was a gossip column.,column,column,It was a column gossip., gossip column, column gossip,gossip,True,-19.543127059936523,-23.270769119262695,3.727642059326172,14067712,EleutherAI/pythia-14m,step104000,seed7,7,104000
It was a sports column.,column,column,It was a column sports., sports column, column sports,sports,True,-19.014564514160156,-21.555803298950195,2.541238784790039,14067712,EleutherAI/pythia-14m,step104000,seed7,7,104000
It was a concrete column.,column,column,It was a column concrete., concrete column, column concrete,concrete,False,-16.602046966552734,-18.128801345825195,1.526754379272461,14067712,EleutherAI/pythia-14m,step104000,seed7,7,104000
He liked the investment company.,company,company,He liked the company investment., investment company, company investment,investment,True,-18.8526668548584,-18.084930419921875,-0.7677364349365234,14067712,EleutherAI/pythia-14m,step104000,seed7,7,104000
He liked the pharmaceutical company.,company,company,He liked the company pharmaceutical., pharmaceutical company, company pharmaceutical,pharmaceutical,False,-16.023630142211914,-21.488006591796875,5.464376449584961,14067712,EleutherAI/pythia-14m,step104000,seed7,7,104000
He liked the pleasant company.,company,company,He liked the company pleasant., pleasant company, company pleasant,pleasant,False,-20.94485855102539,-18.710662841796875,-2.2341957092285156,14067712,EleutherAI/pythia-14m,step104000,seed7,7,104000
It was a waffle cone.,cone,cone,It was a cone waffle., waffle cone, cone waffle,waffle,True,-26.58942985534668,-30.008159637451172,3.418729782104492,14067712,EleutherAI/pythia-14m,step104000,seed7,7,104000
It was a sugar cone.,cone,cone,It was a cone sugar., sugar cone, cone sugar,sugar,True,-21.146970748901367,-24.37382698059082,3.226856231689453,14067712,EleutherAI/pythia-14m,step104000,seed7,7,104000
It was an orange cone.,cone,cone,It was an cone orange., orange cone, cone orange,orange,False,-17.352060317993164,-24.490562438964844,7.13850212097168,14067712,EleutherAI/pythia-14m,step104000,seed7,7,104000
He made a charitable contribution.,contribution,contribution,He made a contribution charitable., charitable contribution, contribution charitable,charitable,False,-15.271800994873047,-24.365863800048828,9.094062805175781,14067712,EleutherAI/pythia-14m,step104000,seed7,7,104000
He made a voluntary contribution.,contribution,contribution,He made a contribution voluntary., voluntary contribution, contribution voluntary,voluntary,False,-14.117196083068848,-23.562641143798828,9.44544506072998,14067712,EleutherAI/pythia-14m,step104000,seed7,7,104000
He made a scholarly contribution.,contribution,contribution,He made a contribution scholarly., scholarly contribution, contribution scholarly,scholarly,False,-17.546375274658203,-25.183979034423828,7.637603759765625,14067712,EleutherAI/pythia-14m,step104000,seed7,7,104000
That was the noble count.,count,count,That was the count noble., noble count, count noble,noble,False,-17.491037368774414,-24.179969787597656,6.688932418823242,14067712,EleutherAI/pythia-14m,step104000,seed7,7,104000
That was the vengeful count.,count,count,That was the count vengeful., vengeful count, count vengeful,vengeful,False,-24.398975372314453,-34.446510314941406,10.047534942626953,14067712,EleutherAI/pythia-14m,step104000,seed7,7,104000
That was the final count.,count,count,That was the count final., final count, count final,final,False,-12.356472969055176,-20.471961975097656,8.11548900604248,14067712,EleutherAI/pythia-14m,step104000,seed7,7,104000
It was an introductory course.,course,course,It was an course introductory., introductory course, course introductory,introductory,False,-13.543859481811523,-26.644271850585938,13.100412368774414,14067712,EleutherAI/pythia-14m,step104000,seed7,7,104000
It was a pass-fail course.,course,course,It was a course pass-fail., pass-fail course, course pass-fail,pass-fail,False,-28.317699432373047,-33.08810806274414,4.770408630371094,14067712,EleutherAI/pythia-14m,step104000,seed7,7,104000
It was a charted course.,course,course,It was a course charted., charted course, course charted,charted,False,-25.59978485107422,-25.73394012451172,0.1341552734375,14067712,EleutherAI/pythia-14m,step104000,seed7,7,104000
It was a dinner date.,date,date,It was a date dinner., dinner date, date dinner,dinner,True,-16.58198356628418,-19.02318000793457,2.4411964416503906,14067712,EleutherAI/pythia-14m,step104000,seed7,7,104000
It was a blind date.,date,date,It was a date blind., blind date, date blind,blind,False,-18.75340461730957,-19.60435676574707,0.8509521484375,14067712,EleutherAI/pythia-14m,step104000,seed7,7,104000
It was an expiration date.,date,date,It was an date expiration., expiration date, date expiration,expiration,True,-14.088746070861816,-22.76448631286621,8.675740242004395,14067712,EleutherAI/pythia-14m,step104000,seed7,7,104000
It was about forty degrees.,degree,degrees,It was about degrees forty., forty degrees, degrees forty,forty,True,-14.01438045501709,-20.07632827758789,6.061947822570801,14067712,EleutherAI/pythia-14m,step104000,seed7,7,104000
It was about fifty degrees.,degree,degrees,It was about degrees fifty., fifty degrees, degrees fifty,fifty,True,-14.126470565795898,-20.24734878540039,6.120878219604492,14067712,EleutherAI/pythia-14m,step104000,seed7,7,104000
It was about associate degrees.,degree,degrees,It was about degrees associate., associate degrees, degrees associate,associate,False,-22.963014602661133,-25.72842788696289,2.765413284301758,14067712,EleutherAI/pythia-14m,step104000,seed7,7,104000
They liked the floral design.,design,design,They liked the design floral., floral design, design floral,floral,False,-16.557228088378906,-20.060138702392578,3.502910614013672,14067712,EleutherAI/pythia-14m,step104000,seed7,7,104000
They liked the geometric design.,design,design,They liked the design geometric., geometric design, design geometric,geometric,False,-15.814607620239258,-20.439899444580078,4.62529182434082,14067712,EleutherAI/pythia-14m,step104000,seed7,7,104000
They liked the product design.,design,design,They liked the design product., product design, design product,product,True,-15.349462509155273,-15.871172904968262,0.5217103958129883,14067712,EleutherAI/pythia-14m,step104000,seed7,7,104000
They liked the turkey dinner.,dinner,dinner,They liked the dinner turkey., turkey dinner, dinner turkey,turkey,True,-16.084999084472656,-19.54315185546875,3.4581527709960938,14067712,EleutherAI/pythia-14m,step104000,seed7,7,104000
They liked the light dinner.,dinner,dinner,They liked the dinner light., light dinner, dinner light,light,False,-16.392074584960938,-20.01605224609375,3.6239776611328125,14067712,EleutherAI/pythia-14m,step104000,seed7,7,104000
They liked the formal dinner.,dinner,dinner,They liked the dinner formal., formal dinner, dinner formal,formal,False,-16.244199752807617,-21.34820556640625,5.104005813598633,14067712,EleutherAI/pythia-14m,step104000,seed7,7,104000
He had a recurring dream.,dream,dream,He had a dream recurring., recurring dream, dream recurring,recurring,False,-15.307458877563477,-21.694053649902344,6.386594772338867,14067712,EleutherAI/pythia-14m,step104000,seed7,7,104000
He had a bad dream.,dream,dream,He had a dream bad., bad dream, dream bad,bad,False,-11.826543807983398,-17.350059509277344,5.523515701293945,14067712,EleutherAI/pythia-14m,step104000,seed7,7,104000
He had a childhood dream.,dream,dream,He had a dream childhood., childhood dream, dream childhood,childhood,True,-15.771722793579102,-21.670249938964844,5.898527145385742,14067712,EleutherAI/pythia-14m,step104000,seed7,7,104000
It was a grueling drill.,drill,drill,It was a drill grueling., grueling drill, drill grueling,grueling,False,-24.942100524902344,-28.272891998291016,3.330791473388672,14067712,EleutherAI/pythia-14m,step104000,seed7,7,104000
It was a challenging drill.,drill,drill,It was a drill challenging., challenging drill, drill challenging,challenging,False,-20.456363677978516,-23.582115173339844,3.125751495361328,14067712,EleutherAI/pythia-14m,step104000,seed7,7,104000
It was an electric drill.,drill,drill,It was an drill electric., electric drill, drill electric,electric,False,-17.92243766784668,-25.786842346191406,7.864404678344727,14067712,EleutherAI/pythia-14m,step104000,seed7,7,104000
It was a multiple-choice examination.,examination,examination,It was an examination multiple-choice., multiple-choice examination, examination multiple-choice,multiple-choice,False,-28.517017364501953,-29.779590606689453,1.2625732421875,14067712,EleutherAI/pythia-14m,step104000,seed7,7,104000
It was a difficult examination.,examination,examination,It was an examination difficult., difficult examination, examination difficult,difficult,False,-12.88409423828125,-15.334512710571289,2.450418472290039,14067712,EleutherAI/pythia-14m,step104000,seed7,7,104000
It was a prostate examination.,examination,examination,It was an examination prostate., prostate examination, examination prostate,prostate,True,-18.22799301147461,-19.87967872619629,1.6516857147216797,14067712,EleutherAI/pythia-14m,step104000,seed7,7,104000
They had an electric fan.,fan,fan,They had an fan electric., electric fan, fan electric,electric,False,-16.82770347595215,-28.851539611816406,12.023836135864258,14067712,EleutherAI/pythia-14m,step104000,seed7,7,104000
They had a ceiling fan.,fan,fan,They had a fan ceiling., ceiling fan, fan ceiling,ceiling,True,-19.817276000976562,-24.828067779541016,5.010791778564453,14067712,EleutherAI/pythia-14m,step104000,seed7,7,104000
They had a zealous fan.,fan,fan,They had a fan zealous., zealous fan, fan zealous,zealous,False,-23.383533477783203,-29.316123962402344,5.932590484619141,14067712,EleutherAI/pythia-14m,step104000,seed7,7,104000
She had a text file.,file,file,She had a file text., text file, file text,text,True,-13.825712203979492,-18.552776336669922,4.72706413269043,14067712,EleutherAI/pythia-14m,step104000,seed7,7,104000
She had a data file.,file,file,She had a file data., data file, file data,data,True,-17.35110092163086,-19.407390594482422,2.0562896728515625,14067712,EleutherAI/pythia-14m,step104000,seed7,7,104000
She had a nail file.,file,file,She had a file nail., nail file, file nail,nail,True,-20.904964447021484,-23.22709083557129,2.3221263885498047,14067712,EleutherAI/pythia-14m,step104000,seed7,7,104000
It was an action film.,film,film,It was an film action., action film, film action,action,True,-16.43252944946289,-17.47787094116211,1.0453414916992188,14067712,EleutherAI/pythia-14m,step104000,seed7,7,104000
It was a censored film.,film,film,It was a film censored., censored film, film censored,censored,False,-21.471771240234375,-22.27174949645996,0.7999782562255859,14067712,EleutherAI/pythia-14m,step104000,seed7,7,104000
It was a transparent film.,film,film,It was a film transparent., transparent film, film transparent,transparent,False,-16.728713989257812,-20.516468048095703,3.7877540588378906,14067712,EleutherAI/pythia-14m,step104000,seed7,7,104000
It was a charitable foundation.,foundation,foundation,It was a foundation charitable., charitable foundation, foundation charitable,charitable,False,-13.500401496887207,-21.9166202545166,8.416218757629395,14067712,EleutherAI/pythia-14m,step104000,seed7,7,104000
It was an educational foundation.,foundation,foundation,It was an foundation educational., educational foundation, foundation educational,educational,False,-13.656942367553711,-23.68935775756836,10.032415390014648,14067712,EleutherAI/pythia-14m,step104000,seed7,7,104000
It was a wooden foundation.,foundation,foundation,It was a foundation wooden., wooden foundation, foundation wooden,wooden,False,-16.477460861206055,-21.4622745513916,4.984813690185547,14067712,EleutherAI/pythia-14m,step104000,seed7,7,104000
It was a mathematical function.,function,function,It was a function mathematical., mathematical function, function mathematical,mathematical,False,-15.694021224975586,-18.633201599121094,2.939180374145508,14067712,EleutherAI/pythia-14m,step104000,seed7,7,104000
