sentence,word,string,reversed_sentence,mod_np,reversed_mod,disambiguating_word,non_adjective,original_logprob,reversed_logprob,ratio,n_params,mpath,revision,seed_name,seed,step
It was a legal term.,term,term,It was a term legal., legal term, term legal,legal,False,-17.349536895751953,-18.320770263671875,0.9712333679199219,14067712,EleutherAI/pythia-14m,step90000,seed6,6,90000
It was a clock tick.,tick,tick,It was a tick clock., clock tick, tick clock,clock,True,-16.470760345458984,-22.668418884277344,6.197658538818359,14067712,EleutherAI/pythia-14m,step90000,seed6,6,90000
It was an audible tick.,tick,tick,It was an tick audible., audible tick, tick audible,audible,False,-18.636573791503906,-26.44659996032715,7.810026168823242,14067712,EleutherAI/pythia-14m,step90000,seed6,6,90000
It was a parasitic tick.,tick,tick,It was a tick parasitic., parasitic tick, tick parasitic,parasitic,False,-22.37619400024414,-27.753257751464844,5.377063751220703,14067712,EleutherAI/pythia-14m,step90000,seed6,6,90000
It was a generous tip.,tip,tip,It was a tip generous., generous tip, tip generous,generous,False,-17.421817779541016,-22.86945915222168,5.447641372680664,14067712,EleutherAI/pythia-14m,step90000,seed6,6,90000
It was a stingy tip.,tip,tip,It was a tip stingy., stingy tip, tip stingy,stingy,False,-22.504241943359375,-25.51764678955078,3.0134048461914062,14067712,EleutherAI/pythia-14m,step90000,seed6,6,90000
It was a pencil tip.,tip,tip,It was a tip pencil., pencil tip, tip pencil,pencil,True,-20.089988708496094,-19.87946891784668,-0.21051979064941406,14067712,EleutherAI/pythia-14m,step90000,seed6,6,90000
She liked the essay title.,title,title,She liked the title essay., essay title, title essay,essay,True,-19.80109405517578,-17.130571365356445,-2.670522689819336,14067712,EleutherAI/pythia-14m,step90000,seed6,6,90000
She liked the poem title.,title,title,She liked the title poem., poem title, title poem,poem,True,-19.99618911743164,-19.340898513793945,-0.6552906036376953,14067712,EleutherAI/pythia-14m,step90000,seed6,6,90000
She liked the academic title.,title,title,She liked the title academic., academic title, title academic,academic,False,-17.350509643554688,-19.900346755981445,2.549837112426758,14067712,EleutherAI/pythia-14m,step90000,seed6,6,90000
It was a costly toll.,toll,toll,It was a toll costly., costly toll, toll costly,costly,False,-17.795106887817383,-21.173948287963867,3.3788414001464844,14067712,EleutherAI/pythia-14m,step90000,seed6,6,90000
It was a road toll.,toll,toll,It was a toll road., road toll, toll road,road,True,-16.741138458251953,-18.087400436401367,1.346261978149414,14067712,EleutherAI/pythia-14m,step90000,seed6,6,90000
It was a loud toll.,toll,toll,It was a toll loud., loud toll, toll loud,loud,False,-20.432907104492188,-23.561887741088867,3.1289806365966797,14067712,EleutherAI/pythia-14m,step90000,seed6,6,90000
She saw the train tracks.,track,tracks,She saw the tracks train., train tracks, tracks train,train,True,-14.53283405303955,-19.742412567138672,5.209578514099121,14067712,EleutherAI/pythia-14m,step90000,seed6,6,90000
She saw the trolley tracks.,track,tracks,She saw the tracks trolley., trolley tracks, tracks trolley,trolley,True,-24.279890060424805,-25.834270477294922,1.5543804168701172,14067712,EleutherAI/pythia-14m,step90000,seed6,6,90000
She saw the moose tracks.,track,tracks,She saw the tracks moose., moose tracks, tracks moose,moose,False,-24.248106002807617,-25.212509155273438,0.9644031524658203,14067712,EleutherAI/pythia-14m,step90000,seed6,6,90000
It was five yards.,yard,yards,It was yards five., five yards, yards five,five,True,-16.70599365234375,-24.863059997558594,8.157066345214844,14067712,EleutherAI/pythia-14m,step90000,seed6,6,90000
It was ten yards.,yard,yards,It was yards ten., ten yards, yards ten,ten,True,-17.47976303100586,-25.899314880371094,8.419551849365234,14067712,EleutherAI/pythia-14m,step90000,seed6,6,90000
They were big yards.,yard,yards,They were yards big., big yards, yards big,big,False,-17.38498306274414,-21.935272216796875,4.550289154052734,14067712,EleutherAI/pythia-14m,step90000,seed6,6,90000
It was a comedic act.,act,act,It was an act comedic., comedic act, act comedic,comedic,False,-18.943449020385742,-23.340593338012695,4.397144317626953,14067712,EleutherAI/pythia-14m,step90000,seed6,6,90000
He had a pending appeal.,appeal,appeal,He had an appeal pending., pending appeal, appeal pending,pending,False,-16.79022216796875,-12.95614242553711,-3.8340797424316406,14067712,EleutherAI/pythia-14m,step90000,seed6,6,90000
It was a polluted atmosphere.,atmosphere,atmosphere,It was an atmosphere polluted., polluted atmosphere, atmosphere polluted,polluted,False,-23.813066482543945,-21.414960861206055,-2.3981056213378906,14067712,EleutherAI/pythia-14m,step90000,seed6,6,90000
It was a country band.,band,band,It was a band country., country band, band country,country,True,-17.065813064575195,-18.868885040283203,1.8030719757080078,14067712,EleutherAI/pythia-14m,step90000,seed6,6,90000
There was a religious barrier.,barrier,barrier,There was a barrier religious., religious barrier, barrier religious,religious,False,-19.16233253479004,-23.32276153564453,4.160429000854492,14067712,EleutherAI/pythia-14m,step90000,seed6,6,90000
He saw a baseball bat.,bat,bat,He saw a bat baseball., baseball bat, bat baseball,baseball,True,-12.334028244018555,-18.028186798095703,5.694158554077148,14067712,EleutherAI/pythia-14m,step90000,seed6,6,90000
He saw the balance beam.,beam,beam,He saw the beam balance., balance beam, beam balance,balance,True,-20.882549285888672,-21.4171199798584,0.5345706939697266,14067712,EleutherAI/pythia-14m,step90000,seed6,6,90000
She had a writer's block.,block,block,She had a block writer's., writer's block, block writer's,writer,True,-22.331628799438477,-23.492671966552734,1.1610431671142578,14067712,EleutherAI/pythia-14m,step90000,seed6,6,90000
He has royal blood.,blood,blood,He has blood royal., royal blood, blood royal,royal,False,-18.173023223876953,-21.979623794555664,3.806600570678711,14067712,EleutherAI/pythia-14m,step90000,seed6,6,90000
It was the school board.,board,board,It was the board school., school board, board school,school,True,-13.554441452026367,-18.33966636657715,4.785224914550781,14067712,EleutherAI/pythia-14m,step90000,seed6,6,90000
He had a leather-bound book.,book,book,He had a book leather-bound., leather-bound book, book leather-bound,leather-bound,False,-25.04176139831543,-27.691280364990234,2.6495189666748047,14067712,EleutherAI/pythia-14m,step90000,seed6,6,90000
They ate a lonely breakfast.,breakfast,breakfast,They ate a breakfast lonely., lonely breakfast, breakfast lonely,lonely,False,-16.173118591308594,-21.124980926513672,4.951862335205078,14067712,EleutherAI/pythia-14m,step90000,seed6,6,90000
It was an island cape.,cape,cape,It was an cape island., island cape, cape island,island,True,-22.732881546020508,-24.760150909423828,2.0272693634033203,14067712,EleutherAI/pythia-14m,step90000,seed6,6,90000
It was a criminal case.,case,case,It was a case criminal., criminal case, case criminal,criminal,False,-12.359888076782227,-17.732494354248047,5.37260627746582,14067712,EleutherAI/pythia-14m,step90000,seed6,6,90000
It was a primary cause.,cause,cause,It was a cause primary., primary cause, cause primary,primary,False,-13.410935401916504,-22.691890716552734,9.28095531463623,14067712,EleutherAI/pythia-14m,step90000,seed6,6,90000
It was a jail cell.,cell,cell,It was a cell jail., jail cell, cell jail,jail,True,-19.11725616455078,-19.97806167602539,0.8608055114746094,14067712,EleutherAI/pythia-14m,step90000,seed6,6,90000
She had a good-luck charm.,charm,charm,She had a charm good-luck., good-luck charm, charm good-luck,good-luck,False,-29.02695083618164,-30.729673385620117,1.7027225494384766,14067712,EleutherAI/pythia-14m,step90000,seed6,6,90000
They liked the pet chicken.,chicken,chicken,They liked the chicken pet., pet chicken, chicken pet,pet,True,-18.49498748779297,-17.680095672607422,-0.8148918151855469,14067712,EleutherAI/pythia-14m,step90000,seed6,6,90000
It was a stimulating class.,class,class,It was a class stimulating., stimulating class, class stimulating,stimulating,False,-18.011341094970703,-20.175472259521484,2.1641311645507812,14067712,EleutherAI/pythia-14m,step90000,seed6,6,90000
It was a metal clip.,clip,clip,It was a clip metal., metal clip, clip metal,metal,True,-19.148025512695312,-20.340618133544922,1.1925926208496094,14067712,EleutherAI/pythia-14m,step90000,seed6,6,90000
It was a common cold.,cold,cold,It was a cold common., common cold, cold common,common,False,-15.688323020935059,-18.457456588745117,2.7691335678100586,14067712,EleutherAI/pythia-14m,step90000,seed6,6,90000
It was a marble column.,column,column,It was a column marble., marble column, column marble,marble,True,-17.691129684448242,-21.56128692626953,3.870157241821289,14067712,EleutherAI/pythia-14m,step90000,seed6,6,90000
He liked the polite company.,company,company,He liked the company polite., polite company, company polite,polite,False,-17.546607971191406,-20.259605407714844,2.7129974365234375,14067712,EleutherAI/pythia-14m,step90000,seed6,6,90000
It was a traffic cone.,cone,cone,It was a cone traffic., traffic cone, cone traffic,traffic,True,-20.290485382080078,-25.414813995361328,5.12432861328125,14067712,EleutherAI/pythia-14m,step90000,seed6,6,90000
He made a well-written contribution.,contribution,contribution,He made a contribution well-written., well-written contribution, contribution well-written,well-written,False,-22.113784790039062,-26.64682388305664,4.533039093017578,14067712,EleutherAI/pythia-14m,step90000,seed6,6,90000
That was the correct count.,count,count,That was the count correct., correct count, count correct,correct,False,-17.286975860595703,-22.038616180419922,4.751640319824219,14067712,EleutherAI/pythia-14m,step90000,seed6,6,90000
It was a collision course.,course,course,It was a course collision., collision course, course collision,collision,True,-15.007360458374023,-18.57545280456543,3.5680923461914062,14067712,EleutherAI/pythia-14m,step90000,seed6,6,90000
It was a historical date.,date,date,It was a date historical., historical date, date historical,historical,False,-16.58362579345703,-20.865680694580078,4.282054901123047,14067712,EleutherAI/pythia-14m,step90000,seed6,6,90000
It was about college degrees.,degree,degrees,It was about degrees college., college degrees, degrees college,college,True,-20.22802734375,-23.333477020263672,3.105449676513672,14067712,EleutherAI/pythia-14m,step90000,seed6,6,90000
They liked the architectural design.,design,design,They liked the design architectural., architectural design, design architectural,architectural,False,-12.937328338623047,-17.18450164794922,4.247173309326172,14067712,EleutherAI/pythia-14m,step90000,seed6,6,90000
They liked the anniversary dinner.,dinner,dinner,They liked the dinner anniversary., anniversary dinner, dinner anniversary,anniversary,True,-18.107341766357422,-18.817188262939453,0.7098464965820312,14067712,EleutherAI/pythia-14m,step90000,seed6,6,90000
He had a career dream.,dream,dream,He had a dream career., career dream, dream career,career,True,-15.96738052368164,-13.613335609436035,-2.3540449142456055,14067712,EleutherAI/pythia-14m,step90000,seed6,6,90000
It was a battery-powered drill.,drill,drill,It was a drill battery-powered., battery-powered drill, drill battery-powered,battery-powered,False,-27.03165054321289,-28.686737060546875,1.6550865173339844,14067712,EleutherAI/pythia-14m,step90000,seed6,6,90000
It was a physical examination.,examination,examination,It was an examination physical., physical examination, examination physical,physical,False,-12.620243072509766,-19.137561798095703,6.5173187255859375,14067712,EleutherAI/pythia-14m,step90000,seed6,6,90000
They had an enthusiastic fan.,fan,fan,They had an fan enthusiastic., enthusiastic fan, fan enthusiastic,enthusiastic,False,-15.032054901123047,-23.124237060546875,8.092182159423828,14067712,EleutherAI/pythia-14m,step90000,seed6,6,90000
She had a steel file.,file,file,She had a file steel., steel file, file steel,steel,True,-19.152820587158203,-25.18352508544922,6.030704498291016,14067712,EleutherAI/pythia-14m,step90000,seed6,6,90000
It was a plastic film.,film,film,It was a film plastic., plastic film, film plastic,plastic,False,-13.393882751464844,-20.678007125854492,7.284124374389648,14067712,EleutherAI/pythia-14m,step90000,seed6,6,90000
It was a concrete foundation.,foundation,foundation,It was a foundation concrete., concrete foundation, foundation concrete,concrete,False,-14.388813018798828,-18.5678653717041,4.179052352905273,14067712,EleutherAI/pythia-14m,step90000,seed6,6,90000
It was a business function.,function,function,It was a function business., business function, function business,business,True,-13.857382774353027,-18.970788955688477,5.113406181335449,14067712,EleutherAI/pythia-14m,step90000,seed6,6,90000
He was on the parade ground.,ground,ground,He was on the ground parade., parade ground, ground parade,parade,True,-16.5282039642334,-16.258089065551758,-0.2701148986816406,14067712,EleutherAI/pythia-14m,step90000,seed6,6,90000
They liked the national guard.,guard,guard,They liked the guard national., national guard, guard national,national,False,-20.321470260620117,-23.237552642822266,2.9160823822021484,14067712,EleutherAI/pythia-14m,step90000,seed6,6,90000
He had a friendly guide.,guide,guide,He had a guide friendly., friendly guide, guide friendly,friendly,False,-14.716123580932617,-20.11573028564453,5.399606704711914,14067712,EleutherAI/pythia-14m,step90000,seed6,6,90000
It was a nursing home.,home,home,It was a home nursing., nursing home, home nursing,nursing,True,-12.011073112487793,-16.952171325683594,4.941098213195801,14067712,EleutherAI/pythia-14m,step90000,seed6,6,90000
They had military intelligence.,intelligence,intelligence,They had intelligence military., military intelligence, intelligence military,military,False,-17.253860473632812,-23.1988525390625,5.9449920654296875,14067712,EleutherAI/pythia-14m,step90000,seed6,6,90000
It was a special issue.,issue,issue,It was an issue special., special issue, issue special,special,False,-11.913145065307617,-15.397566795349121,3.484421730041504,14067712,EleutherAI/pythia-14m,step90000,seed6,6,90000
It was a paper jam.,jam,jam,It was a jam paper., paper jam, jam paper,paper,True,-18.092823028564453,-18.843582153320312,0.7507591247558594,14067712,EleutherAI/pythia-14m,step90000,seed6,6,90000
It was a backspace key.,key,key,It was a key backspace., backspace key, key backspace,backspace,True,-28.9407901763916,-25.628116607666016,-3.312673568725586,14067712,EleutherAI/pythia-14m,step90000,seed6,6,90000
They liked the friendly lamb.,lamb,lamb,They liked the lamb friendly., friendly lamb, lamb friendly,friendly,False,-17.668777465820312,-20.72870635986328,3.0599288940429688,14067712,EleutherAI/pythia-14m,step90000,seed6,6,90000
She had door locks.,lock,locks,She had locks door., door locks, locks door,door,True,-19.032440185546875,-19.539016723632812,0.5065765380859375,14067712,EleutherAI/pythia-14m,step90000,seed6,6,90000
They liked the women's lunch.,lunch,lunch,They liked the lunch women's., women's lunch, lunch women's,women,True,-17.646150588989258,-21.94380760192871,4.297657012939453,14067712,EleutherAI/pythia-14m,step90000,seed6,6,90000
He liked the stock market.,market,market,He liked the market stock., stock market, market stock,stock,True,-14.907112121582031,-15.954391479492188,1.0472793579101562,14067712,EleutherAI/pythia-14m,step90000,seed6,6,90000
It was a tennis match.,match,match,It was a match tennis., tennis match, match tennis,tennis,True,-14.243610382080078,-20.090415954589844,5.846805572509766,14067712,EleutherAI/pythia-14m,step90000,seed6,6,90000
It was veterinary medicine.,medicine,medicine,It was medicine veterinary., veterinary medicine, medicine veterinary,veterinary,False,-20.627342224121094,-28.43952751159668,7.812185287475586,14067712,EleutherAI/pythia-14m,step90000,seed6,6,90000
There was a clear message.,message,message,There was a message clear., clear message, message clear,clear,False,-14.366531372070312,-18.28331756591797,3.9167861938476562,14067712,EleutherAI/pythia-14m,step90000,seed6,6,90000
It was a clay mold.,mold,mold,It was a mold clay., clay mold, mold clay,clay,True,-19.554183959960938,-22.664371490478516,3.110187530517578,14067712,EleutherAI/pythia-14m,step90000,seed6,6,90000
She saw the fast mole.,mole,mole,She saw the mole fast., fast mole, mole fast,fast,False,-21.06685447692871,-20.242656707763672,-0.8241977691650391,14067712,EleutherAI/pythia-14m,step90000,seed6,6,90000
He liked the civil-rights movement.,movement,movement,He liked the movement civil-rights., civil-rights movement, movement civil-rights,civil-rights,False,-19.698339462280273,-29.565589904785156,9.867250442504883,14067712,EleutherAI/pythia-14m,step90000,seed6,6,90000
It was a shredded newspaper.,newspaper,newspaper,It was a newspaper shredded., shredded newspaper, newspaper shredded,shredded,False,-21.897838592529297,-23.30532455444336,1.4074859619140625,14067712,EleutherAI/pythia-14m,step90000,seed6,6,90000
It was a reddish orange.,orange,orange,It was an orange reddish., reddish orange, orange reddish,reddish,False,-19.6925106048584,-17.550363540649414,-2.1421470642089844,14067712,EleutherAI/pythia-14m,step90000,seed6,6,90000
He saw the ripped page.,page,page,He saw the page ripped., ripped page, page ripped,ripped,False,-22.264127731323242,-19.040348052978516,-3.2237796783447266,14067712,EleutherAI/pythia-14m,step90000,seed6,6,90000
It was a tree palm.,palm,palm,It was a palm tree., tree palm, palm tree,tree,True,-20.83971405029297,-15.21595573425293,-5.623758316040039,14067712,EleutherAI/pythia-14m,step90000,seed6,6,90000
It was a consumer panel.,panel,panel,It was a panel consumer., consumer panel, panel consumer,consumer,True,-20.221343994140625,-23.210124969482422,2.988780975341797,14067712,EleutherAI/pythia-14m,step90000,seed6,6,90000
It was a biblical passage.,passage,passage,It was a passage biblical., biblical passage, passage biblical,biblical,False,-18.55168914794922,-23.66366958618164,5.111980438232422,14067712,EleutherAI/pythia-14m,step90000,seed6,6,90000
It was a secure perch.,perch,perch,It was a perch secure., secure perch, perch secure,secure,False,-22.990280151367188,-24.475322723388672,1.4850425720214844,14067712,EleutherAI/pythia-14m,step90000,seed6,6,90000
He saw the plastic pitcher.,pitcher,pitcher,He saw the pitcher plastic., plastic pitcher, pitcher plastic,plastic,True,-20.227561950683594,-22.330154418945312,2.1025924682617188,14067712,EleutherAI/pythia-14m,step90000,seed6,6,90000
It was a sweet port.,port,port,It was a port sweet., sweet port, port sweet,sweet,False,-18.21501922607422,-21.31678009033203,3.1017608642578125,14067712,EleutherAI/pythia-14m,step90000,seed6,6,90000
He was in a yoga position.,position,position,He was in a position yoga., yoga position, position yoga,yoga,True,-17.50556182861328,-19.734630584716797,2.2290687561035156,14067712,EleutherAI/pythia-14m,step90000,seed6,6,90000
It was a challenging post.,post,post,It was a post challenging., challenging post, post challenging,challenging,False,-14.486420631408691,-17.899044036865234,3.412623405456543,14067712,EleutherAI/pythia-14m,step90000,seed6,6,90000
He had the quickest punch.,punch,punch,He had the punch quickest., quickest punch, punch quickest,quickest,False,-21.795063018798828,-25.329362869262695,3.534299850463867,14067712,EleutherAI/pythia-14m,step90000,seed6,6,90000
She had a cloudy pupil.,pupil,pupil,She had a pupil cloudy., cloudy pupil, pupil cloudy,cloudy,False,-23.18515968322754,-24.521297454833984,1.3361377716064453,14067712,EleutherAI/pythia-14m,step90000,seed6,6,90000
That was a tennis racket.,racket,racket,That was a racket tennis., tennis racket, racket tennis,tennis,True,-18.719112396240234,-23.390289306640625,4.671176910400391,14067712,EleutherAI/pythia-14m,step90000,seed6,6,90000
He liked granite rock.,rock,rock,He liked rock granite., granite rock, rock granite,granite,True,-22.750877380371094,-23.61830711364746,0.8674297332763672,14067712,EleutherAI/pythia-14m,step90000,seed6,6,90000
He saw the bushy sage.,sage,sage,He saw the sage bushy., bushy sage, sage bushy,bushy,False,-27.106292724609375,-28.465923309326172,1.3596305847167969,14067712,EleutherAI/pythia-14m,step90000,seed6,6,90000
It was a major scale.,scale,scale,It was a scale major., major scale, scale major,major,False,-14.024707794189453,-20.367816925048828,6.343109130859375,14067712,EleutherAI/pythia-14m,step90000,seed6,6,90000
It was a panoramic scene.,scene,scene,It was a scene panoramic., panoramic scene, scene panoramic,panoramic,False,-17.486421585083008,-24.482505798339844,6.996084213256836,14067712,EleutherAI/pythia-14m,step90000,seed6,6,90000
It was a trained seal.,seal,seal,It was a seal trained., trained seal, seal trained,trained,False,-21.832263946533203,-24.592300415039062,2.7600364685058594,14067712,EleutherAI/pythia-14m,step90000,seed6,6,90000
He used the video tape.,tape,tape,He used the tape video., video tape, tape video,video,True,-10.904073715209961,-13.074444770812988,2.1703710556030273,14067712,EleutherAI/pythia-14m,step90000,seed6,6,90000
It was a technical term.,term,term,It was a term technical., technical term, term technical,technical,False,-18.48661994934082,-19.251434326171875,0.7648143768310547,14067712,EleutherAI/pythia-14m,step90000,seed6,6,90000
It was a diseased tick.,tick,tick,It was a tick diseased., diseased tick, tick diseased,diseased,False,-22.270858764648438,-26.355064392089844,4.084205627441406,14067712,EleutherAI/pythia-14m,step90000,seed6,6,90000
It was a finger tip.,tip,tip,It was a tip finger., finger tip, tip finger,finger,True,-21.17331314086914,-19.89411735534668,-1.279195785522461,14067712,EleutherAI/pythia-14m,step90000,seed6,6,90000
She liked the professional title.,title,title,She liked the title professional., professional title, title professional,professional,False,-14.981271743774414,-17.793779373168945,2.8125076293945312,14067712,EleutherAI/pythia-14m,step90000,seed6,6,90000
It was a bell toll.,toll,toll,It was a toll bell., bell toll, toll bell,bell,True,-21.219261169433594,-22.866941452026367,1.6476802825927734,14067712,EleutherAI/pythia-14m,step90000,seed6,6,90000
She saw the snowshoe tracks.,track,tracks,She saw the tracks snowshoe., snowshoe tracks, tracks snowshoe,snowshoe,True,-29.34402084350586,-32.517982482910156,3.173961639404297,14067712,EleutherAI/pythia-14m,step90000,seed6,6,90000
They were cluttered yards.,yard,yards,They were yards cluttered., cluttered yards, yards cluttered,cluttered,False,-23.870441436767578,-25.227664947509766,1.3572235107421875,14067712,EleutherAI/pythia-14m,step90000,seed6,6,90000
