sentence,word,string,reversed_sentence,mod_np,reversed_mod,disambiguating_word,non_adjective,original_logprob,reversed_logprob,ratio,n_params,mpath,revision,seed_name,seed,step
It was a desperate act.,act,act,It was an act desperate., desperate act, act desperate,desperate,False,-14.488038063049316,-19.851255416870117,5.363217353820801,14067712,EleutherAI/pythia-14m,step28000,seed2,2,28000
It was a humane act.,act,act,It was an act humane., humane act, act humane,humane,False,-17.617029190063477,-22.229820251464844,4.612791061401367,14067712,EleutherAI/pythia-14m,step28000,seed2,2,28000
It was a magic act.,act,act,It was an act magic., magic act, act magic,magic,False,-17.185317993164062,-19.793046951293945,2.607728958129883,14067712,EleutherAI/pythia-14m,step28000,seed2,2,28000
He had a universal appeal.,appeal,appeal,He had an appeal universal., universal appeal, appeal universal,universal,False,-18.927669525146484,-24.26308822631836,5.335418701171875,14067712,EleutherAI/pythia-14m,step28000,seed2,2,28000
He had an undefinable appeal.,appeal,appeal,He had an appeal undefinable., undefinable appeal, appeal undefinable,undefinable,False,-26.949764251708984,-32.555049896240234,5.60528564453125,14067712,EleutherAI/pythia-14m,step28000,seed2,2,28000
He had a legal appeal.,appeal,appeal,He had an appeal legal., legal appeal, appeal legal,legal,False,-14.7454833984375,-21.430862426757812,6.6853790283203125,14067712,EleutherAI/pythia-14m,step28000,seed2,2,28000
It was a tense atmosphere.,atmosphere,atmosphere,It was an atmosphere tense., tense atmosphere, atmosphere tense,tense,False,-16.798873901367188,-21.84766387939453,5.048789978027344,14067712,EleutherAI/pythia-14m,step28000,seed2,2,28000
It was a hostile atmosphere.,atmosphere,atmosphere,It was an atmosphere hostile., hostile atmosphere, atmosphere hostile,hostile,False,-18.244583129882812,-19.971145629882812,1.7265625,14067712,EleutherAI/pythia-14m,step28000,seed2,2,28000
It was a gaseous atmosphere.,atmosphere,atmosphere,It was an atmosphere gaseous., gaseous atmosphere, atmosphere gaseous,gaseous,False,-17.082828521728516,-23.0881290435791,6.005300521850586,14067712,EleutherAI/pythia-14m,step28000,seed2,2,28000
It was a gold band.,band,band,It was a band gold., gold band, band gold,gold,True,-13.736795425415039,-21.007787704467773,7.270992279052734,14067712,EleutherAI/pythia-14m,step28000,seed2,2,28000
It was a rubber band.,band,band,It was a band rubber., rubber band, band rubber,rubber,True,-14.5966796875,-25.00873565673828,10.412055969238281,14067712,EleutherAI/pythia-14m,step28000,seed2,2,28000
It was a jazz band.,band,band,It was a band jazz., jazz band, band jazz,jazz,True,-16.60198402404785,-24.30716323852539,7.705179214477539,14067712,EleutherAI/pythia-14m,step28000,seed2,2,28000
There was a police barrier.,barrier,barrier,There was a barrier police., police barrier, barrier police,police,True,-19.140771865844727,-19.840473175048828,0.6997013092041016,14067712,EleutherAI/pythia-14m,step28000,seed2,2,28000
There was a concrete barrier.,barrier,barrier,There was a barrier concrete., concrete barrier, barrier concrete,concrete,False,-16.079551696777344,-19.437992095947266,3.358440399169922,14067712,EleutherAI/pythia-14m,step28000,seed2,2,28000
There was a language barrier.,barrier,barrier,There was a barrier language., language barrier, barrier language,language,True,-17.74747085571289,-20.79375648498535,3.046285629272461,14067712,EleutherAI/pythia-14m,step28000,seed2,2,28000
He saw a furry bat.,bat,bat,He saw a bat furry., furry bat, bat furry,furry,False,-19.414569854736328,-24.788307189941406,5.373737335205078,14067712,EleutherAI/pythia-14m,step28000,seed2,2,28000
He saw a fruit bat.,bat,bat,He saw a bat fruit., fruit bat, bat fruit,fruit,True,-18.803302764892578,-24.095190048217773,5.291887283325195,14067712,EleutherAI/pythia-14m,step28000,seed2,2,28000
He saw a wooden bat.,bat,bat,He saw a bat wooden., wooden bat, bat wooden,wooden,False,-17.568815231323242,-26.456764221191406,8.887948989868164,14067712,EleutherAI/pythia-14m,step28000,seed2,2,28000
He saw the laser beam.,beam,beam,He saw the beam laser., laser beam, beam laser,laser,True,-10.441339492797852,-16.952362060546875,6.511022567749023,14067712,EleutherAI/pythia-14m,step28000,seed2,2,28000
He saw the bright beam.,beam,beam,He saw the beam bright., bright beam, beam bright,bright,False,-16.900249481201172,-19.334184646606445,2.4339351654052734,14067712,EleutherAI/pythia-14m,step28000,seed2,2,28000
He saw the wood beam.,beam,beam,He saw the beam wood., wood beam, beam wood,wood,True,-20.141510009765625,-21.27657699584961,1.1350669860839844,14067712,EleutherAI/pythia-14m,step28000,seed2,2,28000
She had a toy block.,block,block,She had a block toy., toy block, block toy,toy,True,-17.241487503051758,-23.649206161499023,6.407718658447266,14067712,EleutherAI/pythia-14m,step28000,seed2,2,28000
She had a wooden block.,block,block,She had a block wooden., wooden block, block wooden,wooden,False,-15.171524047851562,-23.820274353027344,8.648750305175781,14067712,EleutherAI/pythia-14m,step28000,seed2,2,28000
She had a mental block.,block,block,She had a block mental., mental block, block mental,mental,False,-16.348756790161133,-23.39635467529297,7.047597885131836,14067712,EleutherAI/pythia-14m,step28000,seed2,2,28000
He has coagulated blood.,blood,blood,He has blood coagulated., coagulated blood, blood coagulated,coagulated,True,-30.09036636352539,-25.215381622314453,-4.8749847412109375,14067712,EleutherAI/pythia-14m,step28000,seed2,2,28000
He has thin blood.,blood,blood,He has blood thin., thin blood, blood thin,thin,False,-19.869064331054688,-19.52099609375,-0.3480682373046875,14067712,EleutherAI/pythia-14m,step28000,seed2,2,28000
He has noble blood.,blood,blood,He has blood noble., noble blood, blood noble,noble,False,-19.097164154052734,-23.33523941040039,4.238075256347656,14067712,EleutherAI/pythia-14m,step28000,seed2,2,28000
It was the ironing board.,board,board,It was the board ironing., ironing board, board ironing,ironing,False,-23.234588623046875,-25.63862419128418,2.4040355682373047,14067712,EleutherAI/pythia-14m,step28000,seed2,2,28000
It was the wooden board.,board,board,It was the board wooden., wooden board, board wooden,wooden,False,-15.990617752075195,-21.847618103027344,5.857000350952148,14067712,EleutherAI/pythia-14m,step28000,seed2,2,28000
It was the executive board.,board,board,It was the board executive., executive board, board executive,executive,True,-13.924592018127441,-17.73412322998047,3.8095312118530273,14067712,EleutherAI/pythia-14m,step28000,seed2,2,28000
He had a best-selling book.,book,book,He had a book best-selling., best-selling book, book best-selling,best-selling,False,-18.319496154785156,-21.668739318847656,3.3492431640625,14067712,EleutherAI/pythia-14m,step28000,seed2,2,28000
He had a popular book.,book,book,He had a book popular., popular book, book popular,popular,False,-14.949684143066406,-18.235733032226562,3.2860488891601562,14067712,EleutherAI/pythia-14m,step28000,seed2,2,28000
He had a heavy book.,book,book,He had a book heavy., heavy book, book heavy,heavy,False,-17.4949951171875,-18.416553497314453,0.9215583801269531,14067712,EleutherAI/pythia-14m,step28000,seed2,2,28000
They ate a pancake breakfast.,breakfast,breakfast,They ate a breakfast pancake., pancake breakfast, breakfast pancake,pancake,True,-17.727418899536133,-16.80242919921875,-0.9249897003173828,14067712,EleutherAI/pythia-14m,step28000,seed2,2,28000
They ate a nutritious breakfast.,breakfast,breakfast,They ate a breakfast nutritious., nutritious breakfast, breakfast nutritious,nutritious,False,-16.2076473236084,-23.801673889160156,7.594026565551758,14067712,EleutherAI/pythia-14m,step28000,seed2,2,28000
They ate a family breakfast.,breakfast,breakfast,They ate a breakfast family., family breakfast, breakfast family,family,True,-15.657819747924805,-15.897637367248535,0.23981761932373047,14067712,EleutherAI/pythia-14m,step28000,seed2,2,28000
It was a red cape.,cape,cape,It was a cape red., red cape, cape red,red,False,-18.380329132080078,-22.144092559814453,3.763763427734375,14067712,EleutherAI/pythia-14m,step28000,seed2,2,28000
It was a flowing cape.,cape,cape,It was a cape flowing., flowing cape, cape flowing,flowing,False,-21.823474884033203,-23.896114349365234,2.0726394653320312,14067712,EleutherAI/pythia-14m,step28000,seed2,2,28000
It was a rocky cape.,cape,cape,It was a cape rocky., rocky cape, cape rocky,rocky,False,-20.496742248535156,-26.29315185546875,5.796409606933594,14067712,EleutherAI/pythia-14m,step28000,seed2,2,28000
It was a beer case.,case,case,It was a case beer., beer case, case beer,beer,True,-17.214126586914062,-18.428268432617188,1.214141845703125,14067712,EleutherAI/pythia-14m,step28000,seed2,2,28000
It was a display case.,case,case,It was a case display., display case, case display,display,True,-17.3651180267334,-17.171154022216797,-0.19396400451660156,14067712,EleutherAI/pythia-14m,step28000,seed2,2,28000
It was a divorce case.,case,case,It was a case divorce., divorce case, case divorce,divorce,True,-14.60034465789795,-18.067184448242188,3.4668397903442383,14067712,EleutherAI/pythia-14m,step28000,seed2,2,28000
It was a worthy cause.,cause,cause,It was a cause worthy., worthy cause, cause worthy,worthy,False,-15.785073280334473,-20.626323699951172,4.841250419616699,14067712,EleutherAI/pythia-14m,step28000,seed2,2,28000
It was a political cause.,cause,cause,It was a cause political., political cause, cause political,political,False,-15.030410766601562,-21.746501922607422,6.716091156005859,14067712,EleutherAI/pythia-14m,step28000,seed2,2,28000
It was a main cause.,cause,cause,It was a cause main., main cause, cause main,main,False,-14.533191680908203,-23.69708251953125,9.163890838623047,14067712,EleutherAI/pythia-14m,step28000,seed2,2,28000
It was a skin cell.,cell,cell,It was a cell skin., skin cell, cell skin,skin,True,-17.256513595581055,-17.770164489746094,0.5136508941650391,14067712,EleutherAI/pythia-14m,step28000,seed2,2,28000
It was a brain cell.,cell,cell,It was a cell brain., brain cell, cell brain,brain,True,-14.75153923034668,-17.13908576965332,2.3875465393066406,14067712,EleutherAI/pythia-14m,step28000,seed2,2,28000
It was a prison cell.,cell,cell,It was a cell prison., prison cell, cell prison,prison,True,-13.992057800292969,-19.493106842041016,5.501049041748047,14067712,EleutherAI/pythia-14m,step28000,seed2,2,28000
She had a devilish charm.,charm,charm,She had a charm devilish., devilish charm, charm devilish,devilish,False,-18.784290313720703,-26.808250427246094,8.02396011352539,14067712,EleutherAI/pythia-14m,step28000,seed2,2,28000
She had a natural charm.,charm,charm,She had a charm natural., natural charm, charm natural,natural,False,-15.300679206848145,-21.50381851196289,6.203139305114746,14067712,EleutherAI/pythia-14m,step28000,seed2,2,28000
She had a gold charm.,charm,charm,She had a charm gold., gold charm, charm gold,gold,True,-18.01674461364746,-20.814064025878906,2.7973194122314453,14067712,EleutherAI/pythia-14m,step28000,seed2,2,28000
They liked the juicy chicken.,chicken,chicken,They liked the chicken juicy., juicy chicken, chicken juicy,juicy,False,-20.99742889404297,-21.209762573242188,0.21233367919921875,14067712,EleutherAI/pythia-14m,step28000,seed2,2,28000
They liked the roasted chicken.,chicken,chicken,They liked the chicken roasted., roasted chicken, chicken roasted,roasted,False,-15.550765991210938,-18.682525634765625,3.1317596435546875,14067712,EleutherAI/pythia-14m,step28000,seed2,2,28000
They liked the clucking chicken.,chicken,chicken,They liked the chicken clucking., clucking chicken, chicken clucking,clucking,True,-25.403928756713867,-23.728334426879883,-1.6755943298339844,14067712,EleutherAI/pythia-14m,step28000,seed2,2,28000
It was a perceptive class.,class,class,It was a class perceptive., perceptive class, class perceptive,perceptive,False,-20.634654998779297,-23.415491104125977,2.7808361053466797,14067712,EleutherAI/pythia-14m,step28000,seed2,2,28000
It was a misbehaving class.,class,class,It was a class misbehaving., misbehaving class, class misbehaving,misbehaving,False,-24.694198608398438,-27.94488525390625,3.2506866455078125,14067712,EleutherAI/pythia-14m,step28000,seed2,2,28000
It was a boring class.,class,class,It was a class boring., boring class, class boring,boring,False,-17.53852081298828,-19.576087951660156,2.037567138671875,14067712,EleutherAI/pythia-14m,step28000,seed2,2,28000
It was a film clip.,clip,clip,It was a clip film., film clip, clip film,film,True,-18.543973922729492,-20.152673721313477,1.6086997985839844,14067712,EleutherAI/pythia-14m,step28000,seed2,2,28000
It was a video clip.,clip,clip,It was a clip video., video clip, clip video,video,True,-14.001214027404785,-20.111072540283203,6.109858512878418,14067712,EleutherAI/pythia-14m,step28000,seed2,2,28000
It was a hair clip.,clip,clip,It was a clip hair., hair clip, clip hair,hair,True,-18.82904052734375,-24.2373046875,5.40826416015625,14067712,EleutherAI/pythia-14m,step28000,seed2,2,28000
It was an icy cold.,cold,cold,It was an cold icy., icy cold, cold icy,icy,False,-12.262090682983398,-17.207115173339844,4.945024490356445,14067712,EleutherAI/pythia-14m,step28000,seed2,2,28000
It was a freezing cold.,cold,cold,It was a cold freezing., freezing cold, cold freezing,freezing,False,-16.1551570892334,-15.945146560668945,-0.21001052856445312,14067712,EleutherAI/pythia-14m,step28000,seed2,2,28000
It was a chest cold.,cold,cold,It was a cold chest., chest cold, cold chest,chest,False,-17.900142669677734,-15.517911911010742,-2.382230758666992,14067712,EleutherAI/pythia-14m,step28000,seed2,2,28000
It was a gossip column.,column,column,It was a column gossip., gossip column, column gossip,gossip,True,-19.374370574951172,-25.54806137084961,6.1736907958984375,14067712,EleutherAI/pythia-14m,step28000,seed2,2,28000
It was a sports column.,column,column,It was a column sports., sports column, column sports,sports,True,-18.343900680541992,-22.16710662841797,3.8232059478759766,14067712,EleutherAI/pythia-14m,step28000,seed2,2,28000
It was a concrete column.,column,column,It was a column concrete., concrete column, column concrete,concrete,False,-15.624227523803711,-20.062278747558594,4.438051223754883,14067712,EleutherAI/pythia-14m,step28000,seed2,2,28000
He liked the investment company.,company,company,He liked the company investment., investment company, company investment,investment,True,-14.643119812011719,-15.822633743286133,1.179513931274414,14067712,EleutherAI/pythia-14m,step28000,seed2,2,28000
He liked the pharmaceutical company.,company,company,He liked the company pharmaceutical., pharmaceutical company, company pharmaceutical,pharmaceutical,False,-12.638382911682129,-19.02888298034668,6.390500068664551,14067712,EleutherAI/pythia-14m,step28000,seed2,2,28000
He liked the pleasant company.,company,company,He liked the company pleasant., pleasant company, company pleasant,pleasant,False,-18.774871826171875,-19.701562881469727,0.9266910552978516,14067712,EleutherAI/pythia-14m,step28000,seed2,2,28000
It was a waffle cone.,cone,cone,It was a cone waffle., waffle cone, cone waffle,waffle,True,-28.807546615600586,-29.430889129638672,0.6233425140380859,14067712,EleutherAI/pythia-14m,step28000,seed2,2,28000
It was a sugar cone.,cone,cone,It was a cone sugar., sugar cone, cone sugar,sugar,True,-20.944866180419922,-23.472679138183594,2.527812957763672,14067712,EleutherAI/pythia-14m,step28000,seed2,2,28000
It was an orange cone.,cone,cone,It was an cone orange., orange cone, cone orange,orange,False,-16.27927017211914,-27.016952514648438,10.737682342529297,14067712,EleutherAI/pythia-14m,step28000,seed2,2,28000
He made a charitable contribution.,contribution,contribution,He made a contribution charitable., charitable contribution, contribution charitable,charitable,False,-14.537371635437012,-23.352252960205078,8.814881324768066,14067712,EleutherAI/pythia-14m,step28000,seed2,2,28000
He made a voluntary contribution.,contribution,contribution,He made a contribution voluntary., voluntary contribution, contribution voluntary,voluntary,False,-15.388406753540039,-21.926755905151367,6.538349151611328,14067712,EleutherAI/pythia-14m,step28000,seed2,2,28000
He made a scholarly contribution.,contribution,contribution,He made a contribution scholarly., scholarly contribution, contribution scholarly,scholarly,False,-16.839324951171875,-23.449525833129883,6.610200881958008,14067712,EleutherAI/pythia-14m,step28000,seed2,2,28000
That was the noble count.,count,count,That was the count noble., noble count, count noble,noble,False,-17.390663146972656,-24.779254913330078,7.388591766357422,14067712,EleutherAI/pythia-14m,step28000,seed2,2,28000
That was the vengeful count.,count,count,That was the count vengeful., vengeful count, count vengeful,vengeful,False,-23.144113540649414,-26.960315704345703,3.816202163696289,14067712,EleutherAI/pythia-14m,step28000,seed2,2,28000
That was the final count.,count,count,That was the count final., final count, count final,final,False,-14.463342666625977,-20.496261596679688,6.032918930053711,14067712,EleutherAI/pythia-14m,step28000,seed2,2,28000
It was an introductory course.,course,course,It was an course introductory., introductory course, course introductory,introductory,False,-12.065999984741211,-19.924423217773438,7.858423233032227,14067712,EleutherAI/pythia-14m,step28000,seed2,2,28000
It was a pass-fail course.,course,course,It was a course pass-fail., pass-fail course, course pass-fail,pass-fail,False,-28.65877914428711,-30.210662841796875,1.5518836975097656,14067712,EleutherAI/pythia-14m,step28000,seed2,2,28000
It was a charted course.,course,course,It was a course charted., charted course, course charted,charted,False,-21.257625579833984,-21.81029510498047,0.5526695251464844,14067712,EleutherAI/pythia-14m,step28000,seed2,2,28000
It was a dinner date.,date,date,It was a date dinner., dinner date, date dinner,dinner,True,-14.46208381652832,-20.04144287109375,5.57935905456543,14067712,EleutherAI/pythia-14m,step28000,seed2,2,28000
It was a blind date.,date,date,It was a date blind., blind date, date blind,blind,False,-18.880403518676758,-19.991718292236328,1.1113147735595703,14067712,EleutherAI/pythia-14m,step28000,seed2,2,28000
It was an expiration date.,date,date,It was an date expiration., expiration date, date expiration,expiration,True,-11.606661796569824,-22.814788818359375,11.20812702178955,14067712,EleutherAI/pythia-14m,step28000,seed2,2,28000
It was about forty degrees.,degree,degrees,It was about degrees forty., forty degrees, degrees forty,forty,True,-13.819841384887695,-24.210559844970703,10.390718460083008,14067712,EleutherAI/pythia-14m,step28000,seed2,2,28000
It was about fifty degrees.,degree,degrees,It was about degrees fifty., fifty degrees, degrees fifty,fifty,True,-13.009851455688477,-23.610065460205078,10.600214004516602,14067712,EleutherAI/pythia-14m,step28000,seed2,2,28000
It was about associate degrees.,degree,degrees,It was about degrees associate., associate degrees, degrees associate,associate,False,-23.361526489257812,-28.00613784790039,4.644611358642578,14067712,EleutherAI/pythia-14m,step28000,seed2,2,28000
They liked the floral design.,design,design,They liked the design floral., floral design, design floral,floral,False,-16.020172119140625,-21.23583221435547,5.215660095214844,14067712,EleutherAI/pythia-14m,step28000,seed2,2,28000
They liked the geometric design.,design,design,They liked the design geometric., geometric design, design geometric,geometric,False,-14.633729934692383,-21.833894729614258,7.200164794921875,14067712,EleutherAI/pythia-14m,step28000,seed2,2,28000
They liked the product design.,design,design,They liked the design product., product design, design product,product,True,-15.027657508850098,-15.977066040039062,0.9494085311889648,14067712,EleutherAI/pythia-14m,step28000,seed2,2,28000
They liked the turkey dinner.,dinner,dinner,They liked the dinner turkey., turkey dinner, dinner turkey,turkey,True,-16.022205352783203,-18.051883697509766,2.0296783447265625,14067712,EleutherAI/pythia-14m,step28000,seed2,2,28000
They liked the light dinner.,dinner,dinner,They liked the dinner light., light dinner, dinner light,light,False,-18.258827209472656,-17.6214599609375,-0.6373672485351562,14067712,EleutherAI/pythia-14m,step28000,seed2,2,28000
They liked the formal dinner.,dinner,dinner,They liked the dinner formal., formal dinner, dinner formal,formal,False,-18.785449981689453,-20.08634376525879,1.300893783569336,14067712,EleutherAI/pythia-14m,step28000,seed2,2,28000
He had a recurring dream.,dream,dream,He had a dream recurring., recurring dream, dream recurring,recurring,False,-14.012733459472656,-23.13650894165039,9.123775482177734,14067712,EleutherAI/pythia-14m,step28000,seed2,2,28000
He had a bad dream.,dream,dream,He had a dream bad., bad dream, dream bad,bad,False,-12.704809188842773,-16.789430618286133,4.084621429443359,14067712,EleutherAI/pythia-14m,step28000,seed2,2,28000
He had a childhood dream.,dream,dream,He had a dream childhood., childhood dream, dream childhood,childhood,True,-17.056982040405273,-17.15947723388672,0.10249519348144531,14067712,EleutherAI/pythia-14m,step28000,seed2,2,28000
It was a grueling drill.,drill,drill,It was a drill grueling., grueling drill, drill grueling,grueling,False,-23.076326370239258,-23.563941955566406,0.48761558532714844,14067712,EleutherAI/pythia-14m,step28000,seed2,2,28000
It was a challenging drill.,drill,drill,It was a drill challenging., challenging drill, drill challenging,challenging,False,-21.07080841064453,-23.755125045776367,2.684316635131836,14067712,EleutherAI/pythia-14m,step28000,seed2,2,28000
It was an electric drill.,drill,drill,It was an drill electric., electric drill, drill electric,electric,False,-17.12198257446289,-25.848663330078125,8.726680755615234,14067712,EleutherAI/pythia-14m,step28000,seed2,2,28000
It was a multiple-choice examination.,examination,examination,It was an examination multiple-choice., multiple-choice examination, examination multiple-choice,multiple-choice,False,-26.735151290893555,-32.217124938964844,5.481973648071289,14067712,EleutherAI/pythia-14m,step28000,seed2,2,28000
It was a difficult examination.,examination,examination,It was an examination difficult., difficult examination, examination difficult,difficult,False,-14.876160621643066,-18.608850479125977,3.73268985748291,14067712,EleutherAI/pythia-14m,step28000,seed2,2,28000
It was a prostate examination.,examination,examination,It was an examination prostate., prostate examination, examination prostate,prostate,True,-20.43972396850586,-24.399532318115234,3.959808349609375,14067712,EleutherAI/pythia-14m,step28000,seed2,2,28000
They had an electric fan.,fan,fan,They had an fan electric., electric fan, fan electric,electric,False,-13.327903747558594,-26.294605255126953,12.96670150756836,14067712,EleutherAI/pythia-14m,step28000,seed2,2,28000
They had a ceiling fan.,fan,fan,They had a fan ceiling., ceiling fan, fan ceiling,ceiling,True,-17.866788864135742,-23.40383529663086,5.537046432495117,14067712,EleutherAI/pythia-14m,step28000,seed2,2,28000
They had a zealous fan.,fan,fan,They had a fan zealous., zealous fan, fan zealous,zealous,False,-21.317758560180664,-24.40306282043457,3.0853042602539062,14067712,EleutherAI/pythia-14m,step28000,seed2,2,28000
She had a text file.,file,file,She had a file text., text file, file text,text,True,-14.945952415466309,-19.44554901123047,4.49959659576416,14067712,EleutherAI/pythia-14m,step28000,seed2,2,28000
She had a data file.,file,file,She had a file data., data file, file data,data,True,-14.371551513671875,-17.00200653076172,2.6304550170898438,14067712,EleutherAI/pythia-14m,step28000,seed2,2,28000
She had a nail file.,file,file,She had a file nail., nail file, file nail,nail,True,-18.486736297607422,-23.850936889648438,5.364200592041016,14067712,EleutherAI/pythia-14m,step28000,seed2,2,28000
It was an action film.,film,film,It was an film action., action film, film action,action,True,-15.27376651763916,-17.58455467224121,2.310788154602051,14067712,EleutherAI/pythia-14m,step28000,seed2,2,28000
It was a censored film.,film,film,It was a film censored., censored film, film censored,censored,False,-22.454452514648438,-21.926836013793945,-0.5276165008544922,14067712,EleutherAI/pythia-14m,step28000,seed2,2,28000
It was a transparent film.,film,film,It was a film transparent., transparent film, film transparent,transparent,False,-17.297365188598633,-22.217529296875,4.920164108276367,14067712,EleutherAI/pythia-14m,step28000,seed2,2,28000
It was a charitable foundation.,foundation,foundation,It was a foundation charitable., charitable foundation, foundation charitable,charitable,False,-15.370138168334961,-24.09521484375,8.725076675415039,14067712,EleutherAI/pythia-14m,step28000,seed2,2,28000
It was an educational foundation.,foundation,foundation,It was an foundation educational., educational foundation, foundation educational,educational,False,-15.044553756713867,-22.794958114624023,7.750404357910156,14067712,EleutherAI/pythia-14m,step28000,seed2,2,28000
It was a wooden foundation.,foundation,foundation,It was a foundation wooden., wooden foundation, foundation wooden,wooden,False,-15.965412139892578,-21.231168746948242,5.265756607055664,14067712,EleutherAI/pythia-14m,step28000,seed2,2,28000
It was a mathematical function.,function,function,It was a function mathematical., mathematical function, function mathematical,mathematical,False,-13.15208625793457,-20.599411010742188,7.447324752807617,14067712,EleutherAI/pythia-14m,step28000,seed2,2,28000
It was a linear function.,function,function,It was a function linear., linear function, function linear,linear,False,-15.426112174987793,-21.086761474609375,5.660649299621582,14067712,EleutherAI/pythia-14m,step28000,seed2,2,28000
