sentence,word,string,reversed_sentence,mod_np,reversed_mod,disambiguating_word,non_adjective,original_logprob,reversed_logprob,ratio,n_params,mpath,revision,seed_name,seed,step
It was a fall term.,term,term,It was a term fall., fall term, term fall,fall,True,-17.037944793701172,-18.90044593811035,1.8625011444091797,14067712,EleutherAI/pythia-14m,step15000,seed1,1,15000
It was a legal term.,term,term,It was a term legal., legal term, term legal,legal,False,-15.644515991210938,-18.289226531982422,2.6447105407714844,14067712,EleutherAI/pythia-14m,step15000,seed1,1,15000
It was a clock tick.,tick,tick,It was a tick clock., clock tick, tick clock,clock,True,-17.048614501953125,-20.166677474975586,3.118062973022461,14067712,EleutherAI/pythia-14m,step15000,seed1,1,15000
It was an audible tick.,tick,tick,It was an tick audible., audible tick, tick audible,audible,False,-19.058048248291016,-27.7919921875,8.733943939208984,14067712,EleutherAI/pythia-14m,step15000,seed1,1,15000
It was a parasitic tick.,tick,tick,It was a tick parasitic., parasitic tick, tick parasitic,parasitic,False,-20.418840408325195,-23.518707275390625,3.0998668670654297,14067712,EleutherAI/pythia-14m,step15000,seed1,1,15000
It was a generous tip.,tip,tip,It was a tip generous., generous tip, tip generous,generous,False,-19.831695556640625,-25.707733154296875,5.87603759765625,14067712,EleutherAI/pythia-14m,step15000,seed1,1,15000
It was a stingy tip.,tip,tip,It was a tip stingy., stingy tip, tip stingy,stingy,False,-22.683822631835938,-26.173995971679688,3.49017333984375,14067712,EleutherAI/pythia-14m,step15000,seed1,1,15000
It was a pencil tip.,tip,tip,It was a tip pencil., pencil tip, tip pencil,pencil,True,-20.455242156982422,-19.023632049560547,-1.431610107421875,14067712,EleutherAI/pythia-14m,step15000,seed1,1,15000
She liked the essay title.,title,title,She liked the title essay., essay title, title essay,essay,True,-17.884647369384766,-18.54111099243164,0.656463623046875,14067712,EleutherAI/pythia-14m,step15000,seed1,1,15000
She liked the poem title.,title,title,She liked the title poem., poem title, title poem,poem,True,-18.350208282470703,-18.32650375366211,-0.02370452880859375,14067712,EleutherAI/pythia-14m,step15000,seed1,1,15000
She liked the academic title.,title,title,She liked the title academic., academic title, title academic,academic,False,-16.381357192993164,-21.666282653808594,5.28492546081543,14067712,EleutherAI/pythia-14m,step15000,seed1,1,15000
It was a costly toll.,toll,toll,It was a toll costly., costly toll, toll costly,costly,False,-16.32047462463379,-24.537628173828125,8.217153549194336,14067712,EleutherAI/pythia-14m,step15000,seed1,1,15000
It was a road toll.,toll,toll,It was a toll road., road toll, toll road,road,True,-18.944211959838867,-17.553970336914062,-1.3902416229248047,14067712,EleutherAI/pythia-14m,step15000,seed1,1,15000
It was a loud toll.,toll,toll,It was a toll loud., loud toll, toll loud,loud,False,-18.44791030883789,-26.139575958251953,7.6916656494140625,14067712,EleutherAI/pythia-14m,step15000,seed1,1,15000
She saw the train tracks.,track,tracks,She saw the tracks train., train tracks, tracks train,train,True,-18.09100341796875,-22.105863571166992,4.014860153198242,14067712,EleutherAI/pythia-14m,step15000,seed1,1,15000
She saw the trolley tracks.,track,tracks,She saw the tracks trolley., trolley tracks, tracks trolley,trolley,True,-22.106468200683594,-25.57838249206543,3.471914291381836,14067712,EleutherAI/pythia-14m,step15000,seed1,1,15000
She saw the moose tracks.,track,tracks,She saw the tracks moose., moose tracks, tracks moose,moose,False,-21.58285140991211,-23.585878372192383,2.0030269622802734,14067712,EleutherAI/pythia-14m,step15000,seed1,1,15000
It was five yards.,yard,yards,It was yards five., five yards, yards five,five,True,-19.03690528869629,-27.10299301147461,8.06608772277832,14067712,EleutherAI/pythia-14m,step15000,seed1,1,15000
It was ten yards.,yard,yards,It was yards ten., ten yards, yards ten,ten,True,-17.82526397705078,-28.212265014648438,10.387001037597656,14067712,EleutherAI/pythia-14m,step15000,seed1,1,15000
They were big yards.,yard,yards,They were yards big., big yards, yards big,big,False,-19.119356155395508,-27.80573272705078,8.686376571655273,14067712,EleutherAI/pythia-14m,step15000,seed1,1,15000
It was a comedic act.,act,act,It was an act comedic., comedic act, act comedic,comedic,False,-18.520357131958008,-23.66318702697754,5.142829895019531,14067712,EleutherAI/pythia-14m,step15000,seed1,1,15000
He had a pending appeal.,appeal,appeal,He had an appeal pending., pending appeal, appeal pending,pending,False,-14.361598014831543,-15.592118263244629,1.230520248413086,14067712,EleutherAI/pythia-14m,step15000,seed1,1,15000
It was a polluted atmosphere.,atmosphere,atmosphere,It was an atmosphere polluted., polluted atmosphere, atmosphere polluted,polluted,False,-21.635637283325195,-23.290019989013672,1.6543827056884766,14067712,EleutherAI/pythia-14m,step15000,seed1,1,15000
It was a country band.,band,band,It was a band country., country band, band country,country,True,-18.02872085571289,-17.51369285583496,-0.5150279998779297,14067712,EleutherAI/pythia-14m,step15000,seed1,1,15000
There was a religious barrier.,barrier,barrier,There was a barrier religious., religious barrier, barrier religious,religious,False,-20.086345672607422,-23.540573120117188,3.4542274475097656,14067712,EleutherAI/pythia-14m,step15000,seed1,1,15000
He saw a baseball bat.,bat,bat,He saw a bat baseball., baseball bat, bat baseball,baseball,True,-11.03476619720459,-18.63863754272461,7.6038713455200195,14067712,EleutherAI/pythia-14m,step15000,seed1,1,15000
He saw the balance beam.,beam,beam,He saw the beam balance., balance beam, beam balance,balance,True,-21.658489227294922,-21.678218841552734,0.0197296142578125,14067712,EleutherAI/pythia-14m,step15000,seed1,1,15000
She had a writer's block.,block,block,She had a block writer's., writer's block, block writer's,writer,True,-22.68079376220703,-24.288856506347656,1.608062744140625,14067712,EleutherAI/pythia-14m,step15000,seed1,1,15000
He has royal blood.,blood,blood,He has blood royal., royal blood, blood royal,royal,False,-21.02699089050293,-22.462255477905273,1.4352645874023438,14067712,EleutherAI/pythia-14m,step15000,seed1,1,15000
It was the school board.,board,board,It was the board school., school board, board school,school,True,-13.934362411499023,-18.327791213989258,4.393428802490234,14067712,EleutherAI/pythia-14m,step15000,seed1,1,15000
He had a leather-bound book.,book,book,He had a book leather-bound., leather-bound book, book leather-bound,leather-bound,False,-27.430030822753906,-31.354785919189453,3.924755096435547,14067712,EleutherAI/pythia-14m,step15000,seed1,1,15000
They ate a lonely breakfast.,breakfast,breakfast,They ate a breakfast lonely., lonely breakfast, breakfast lonely,lonely,False,-17.452125549316406,-20.408605575561523,2.956480026245117,14067712,EleutherAI/pythia-14m,step15000,seed1,1,15000
It was an island cape.,cape,cape,It was an cape island., island cape, cape island,island,True,-20.536977767944336,-23.442779541015625,2.905801773071289,14067712,EleutherAI/pythia-14m,step15000,seed1,1,15000
It was a criminal case.,case,case,It was a case criminal., criminal case, case criminal,criminal,False,-9.641948699951172,-17.761011123657227,8.119062423706055,14067712,EleutherAI/pythia-14m,step15000,seed1,1,15000
It was a primary cause.,cause,cause,It was a cause primary., primary cause, cause primary,primary,False,-15.275691986083984,-24.11117172241211,8.835479736328125,14067712,EleutherAI/pythia-14m,step15000,seed1,1,15000
It was a jail cell.,cell,cell,It was a cell jail., jail cell, cell jail,jail,True,-14.727054595947266,-20.738740921020508,6.011686325073242,14067712,EleutherAI/pythia-14m,step15000,seed1,1,15000
She had a good-luck charm.,charm,charm,She had a charm good-luck., good-luck charm, charm good-luck,good-luck,False,-26.964824676513672,-30.931365966796875,3.966541290283203,14067712,EleutherAI/pythia-14m,step15000,seed1,1,15000
They liked the pet chicken.,chicken,chicken,They liked the chicken pet., pet chicken, chicken pet,pet,True,-16.36447525024414,-16.932531356811523,0.5680561065673828,14067712,EleutherAI/pythia-14m,step15000,seed1,1,15000
It was a stimulating class.,class,class,It was a class stimulating., stimulating class, class stimulating,stimulating,False,-22.930660247802734,-26.027366638183594,3.0967063903808594,14067712,EleutherAI/pythia-14m,step15000,seed1,1,15000
It was a metal clip.,clip,clip,It was a clip metal., metal clip, clip metal,metal,True,-17.1087646484375,-20.325448989868164,3.216684341430664,14067712,EleutherAI/pythia-14m,step15000,seed1,1,15000
It was a common cold.,cold,cold,It was a cold common., common cold, cold common,common,False,-14.189947128295898,-19.421829223632812,5.231882095336914,14067712,EleutherAI/pythia-14m,step15000,seed1,1,15000
It was a marble column.,column,column,It was a column marble., marble column, column marble,marble,True,-16.988475799560547,-20.685762405395508,3.697286605834961,14067712,EleutherAI/pythia-14m,step15000,seed1,1,15000
He liked the polite company.,company,company,He liked the company polite., polite company, company polite,polite,False,-19.408939361572266,-21.689861297607422,2.2809219360351562,14067712,EleutherAI/pythia-14m,step15000,seed1,1,15000
It was a traffic cone.,cone,cone,It was a cone traffic., traffic cone, cone traffic,traffic,True,-19.699453353881836,-23.649795532226562,3.9503421783447266,14067712,EleutherAI/pythia-14m,step15000,seed1,1,15000
He made a well-written contribution.,contribution,contribution,He made a contribution well-written., well-written contribution, contribution well-written,well-written,False,-22.40644073486328,-30.607885360717773,8.201444625854492,14067712,EleutherAI/pythia-14m,step15000,seed1,1,15000
That was the correct count.,count,count,That was the count correct., correct count, count correct,correct,False,-16.301288604736328,-19.72416114807129,3.422872543334961,14067712,EleutherAI/pythia-14m,step15000,seed1,1,15000
It was a collision course.,course,course,It was a course collision., collision course, course collision,collision,True,-16.022781372070312,-21.600292205810547,5.577510833740234,14067712,EleutherAI/pythia-14m,step15000,seed1,1,15000
It was a historical date.,date,date,It was a date historical., historical date, date historical,historical,False,-14.661766052246094,-19.498886108398438,4.837120056152344,14067712,EleutherAI/pythia-14m,step15000,seed1,1,15000
It was about college degrees.,degree,degrees,It was about degrees college., college degrees, degrees college,college,True,-16.369895935058594,-25.03162384033203,8.661727905273438,14067712,EleutherAI/pythia-14m,step15000,seed1,1,15000
They liked the architectural design.,design,design,They liked the design architectural., architectural design, design architectural,architectural,False,-15.154297828674316,-19.595829010009766,4.441531181335449,14067712,EleutherAI/pythia-14m,step15000,seed1,1,15000
They liked the anniversary dinner.,dinner,dinner,They liked the dinner anniversary., anniversary dinner, dinner anniversary,anniversary,True,-19.05610466003418,-19.912689208984375,0.8565845489501953,14067712,EleutherAI/pythia-14m,step15000,seed1,1,15000
He had a career dream.,dream,dream,He had a dream career., career dream, dream career,career,True,-17.32687759399414,-20.241331100463867,2.9144535064697266,14067712,EleutherAI/pythia-14m,step15000,seed1,1,15000
It was a battery-powered drill.,drill,drill,It was a drill battery-powered., battery-powered drill, drill battery-powered,battery-powered,False,-22.69198226928711,-26.87548828125,4.183506011962891,14067712,EleutherAI/pythia-14m,step15000,seed1,1,15000
It was a physical examination.,examination,examination,It was an examination physical., physical examination, examination physical,physical,False,-15.97494125366211,-23.61130142211914,7.636360168457031,14067712,EleutherAI/pythia-14m,step15000,seed1,1,15000
They had an enthusiastic fan.,fan,fan,They had an fan enthusiastic., enthusiastic fan, fan enthusiastic,enthusiastic,False,-16.110538482666016,-30.9232177734375,14.812679290771484,14067712,EleutherAI/pythia-14m,step15000,seed1,1,15000
She had a steel file.,file,file,She had a file steel., steel file, file steel,steel,True,-19.554147720336914,-22.446582794189453,2.892435073852539,14067712,EleutherAI/pythia-14m,step15000,seed1,1,15000
It was a plastic film.,film,film,It was a film plastic., plastic film, film plastic,plastic,False,-14.260316848754883,-19.242137908935547,4.981821060180664,14067712,EleutherAI/pythia-14m,step15000,seed1,1,15000
It was a concrete foundation.,foundation,foundation,It was a foundation concrete., concrete foundation, foundation concrete,concrete,False,-14.915611267089844,-18.69908905029297,3.783477783203125,14067712,EleutherAI/pythia-14m,step15000,seed1,1,15000
It was a business function.,function,function,It was a function business., business function, function business,business,True,-16.57016372680664,-21.326984405517578,4.7568206787109375,14067712,EleutherAI/pythia-14m,step15000,seed1,1,15000
He was on the parade ground.,ground,ground,He was on the ground parade., parade ground, ground parade,parade,True,-15.252166748046875,-16.636959075927734,1.3847923278808594,14067712,EleutherAI/pythia-14m,step15000,seed1,1,15000
They liked the national guard.,guard,guard,They liked the guard national., national guard, guard national,national,False,-18.380504608154297,-23.29978370666504,4.919279098510742,14067712,EleutherAI/pythia-14m,step15000,seed1,1,15000
He had a friendly guide.,guide,guide,He had a guide friendly., friendly guide, guide friendly,friendly,False,-15.364713668823242,-23.88408660888672,8.519372940063477,14067712,EleutherAI/pythia-14m,step15000,seed1,1,15000
It was a nursing home.,home,home,It was a home nursing., nursing home, home nursing,nursing,True,-12.92916202545166,-18.214820861816406,5.285658836364746,14067712,EleutherAI/pythia-14m,step15000,seed1,1,15000
They had military intelligence.,intelligence,intelligence,They had intelligence military., military intelligence, intelligence military,military,False,-15.924356460571289,-21.54022979736328,5.615873336791992,14067712,EleutherAI/pythia-14m,step15000,seed1,1,15000
It was a special issue.,issue,issue,It was an issue special., special issue, issue special,special,False,-11.806818008422852,-14.926576614379883,3.1197586059570312,14067712,EleutherAI/pythia-14m,step15000,seed1,1,15000
It was a paper jam.,jam,jam,It was a jam paper., paper jam, jam paper,paper,True,-18.967323303222656,-19.144880294799805,0.17755699157714844,14067712,EleutherAI/pythia-14m,step15000,seed1,1,15000
It was a backspace key.,key,key,It was a key backspace., backspace key, key backspace,backspace,True,-27.932777404785156,-26.202966690063477,-1.7298107147216797,14067712,EleutherAI/pythia-14m,step15000,seed1,1,15000
They liked the friendly lamb.,lamb,lamb,They liked the lamb friendly., friendly lamb, lamb friendly,friendly,False,-20.249805450439453,-21.633380889892578,1.383575439453125,14067712,EleutherAI/pythia-14m,step15000,seed1,1,15000
She had door locks.,lock,locks,She had locks door., door locks, locks door,door,True,-18.29866600036621,-19.46822738647461,1.1695613861083984,14067712,EleutherAI/pythia-14m,step15000,seed1,1,15000
They liked the women's lunch.,lunch,lunch,They liked the lunch women's., women's lunch, lunch women's,women,True,-16.361392974853516,-23.392724990844727,7.031332015991211,14067712,EleutherAI/pythia-14m,step15000,seed1,1,15000
He liked the stock market.,market,market,He liked the market stock., stock market, market stock,stock,True,-15.830595016479492,-16.952579498291016,1.1219844818115234,14067712,EleutherAI/pythia-14m,step15000,seed1,1,15000
It was a tennis match.,match,match,It was a match tennis., tennis match, match tennis,tennis,True,-15.711841583251953,-18.692115783691406,2.980274200439453,14067712,EleutherAI/pythia-14m,step15000,seed1,1,15000
It was veterinary medicine.,medicine,medicine,It was medicine veterinary., veterinary medicine, medicine veterinary,veterinary,False,-19.914051055908203,-22.896190643310547,2.9821395874023438,14067712,EleutherAI/pythia-14m,step15000,seed1,1,15000
There was a clear message.,message,message,There was a message clear., clear message, message clear,clear,False,-15.648845672607422,-18.961654663085938,3.3128089904785156,14067712,EleutherAI/pythia-14m,step15000,seed1,1,15000
It was a clay mold.,mold,mold,It was a mold clay., clay mold, mold clay,clay,True,-16.916362762451172,-19.086673736572266,2.1703109741210938,14067712,EleutherAI/pythia-14m,step15000,seed1,1,15000
She saw the fast mole.,mole,mole,She saw the mole fast., fast mole, mole fast,fast,False,-22.46708869934082,-23.78290557861328,1.315816879272461,14067712,EleutherAI/pythia-14m,step15000,seed1,1,15000
He liked the civil-rights movement.,movement,movement,He liked the movement civil-rights., civil-rights movement, movement civil-rights,civil-rights,False,-21.48642921447754,-30.55500602722168,9.06857681274414,14067712,EleutherAI/pythia-14m,step15000,seed1,1,15000
It was a shredded newspaper.,newspaper,newspaper,It was a newspaper shredded., shredded newspaper, newspaper shredded,shredded,False,-21.8856201171875,-22.991844177246094,1.1062240600585938,14067712,EleutherAI/pythia-14m,step15000,seed1,1,15000
It was a reddish orange.,orange,orange,It was an orange reddish., reddish orange, orange reddish,reddish,False,-19.756900787353516,-16.51746368408203,-3.2394371032714844,14067712,EleutherAI/pythia-14m,step15000,seed1,1,15000
He saw the ripped page.,page,page,He saw the page ripped., ripped page, page ripped,ripped,False,-22.084888458251953,-20.81420135498047,-1.2706871032714844,14067712,EleutherAI/pythia-14m,step15000,seed1,1,15000
It was a tree palm.,palm,palm,It was a palm tree., tree palm, palm tree,tree,True,-19.96216583251953,-12.451055526733398,-7.511110305786133,14067712,EleutherAI/pythia-14m,step15000,seed1,1,15000
It was a consumer panel.,panel,panel,It was a panel consumer., consumer panel, panel consumer,consumer,True,-19.469478607177734,-23.561079025268555,4.09160041809082,14067712,EleutherAI/pythia-14m,step15000,seed1,1,15000
It was a biblical passage.,passage,passage,It was a passage biblical., biblical passage, passage biblical,biblical,False,-16.494108200073242,-23.605022430419922,7.11091423034668,14067712,EleutherAI/pythia-14m,step15000,seed1,1,15000
It was a secure perch.,perch,perch,It was a perch secure., secure perch, perch secure,secure,False,-25.93892478942871,-26.039737701416016,0.10081291198730469,14067712,EleutherAI/pythia-14m,step15000,seed1,1,15000
He saw the plastic pitcher.,pitcher,pitcher,He saw the pitcher plastic., plastic pitcher, pitcher plastic,plastic,True,-20.89959716796875,-24.130352020263672,3.230754852294922,14067712,EleutherAI/pythia-14m,step15000,seed1,1,15000
It was a sweet port.,port,port,It was a port sweet., sweet port, port sweet,sweet,False,-17.559478759765625,-22.904878616333008,5.345399856567383,14067712,EleutherAI/pythia-14m,step15000,seed1,1,15000
He was in a yoga position.,position,position,He was in a position yoga., yoga position, position yoga,yoga,True,-14.524139404296875,-18.58175277709961,4.057613372802734,14067712,EleutherAI/pythia-14m,step15000,seed1,1,15000
It was a challenging post.,post,post,It was a post challenging., challenging post, post challenging,challenging,False,-16.48486328125,-18.18204116821289,1.6971778869628906,14067712,EleutherAI/pythia-14m,step15000,seed1,1,15000
He had the quickest punch.,punch,punch,He had the punch quickest., quickest punch, punch quickest,quickest,False,-20.777673721313477,-27.743133544921875,6.965459823608398,14067712,EleutherAI/pythia-14m,step15000,seed1,1,15000
She had a cloudy pupil.,pupil,pupil,She had a pupil cloudy., cloudy pupil, pupil cloudy,cloudy,False,-23.061607360839844,-26.666181564331055,3.604574203491211,14067712,EleutherAI/pythia-14m,step15000,seed1,1,15000
That was a tennis racket.,racket,racket,That was a racket tennis., tennis racket, racket tennis,tennis,True,-15.754794120788574,-23.116962432861328,7.362168312072754,14067712,EleutherAI/pythia-14m,step15000,seed1,1,15000
He liked granite rock.,rock,rock,He liked rock granite., granite rock, rock granite,granite,True,-18.019149780273438,-18.587053298950195,0.5679035186767578,14067712,EleutherAI/pythia-14m,step15000,seed1,1,15000
He saw the bushy sage.,sage,sage,He saw the sage bushy., bushy sage, sage bushy,bushy,False,-28.50031280517578,-27.904865264892578,-0.5954475402832031,14067712,EleutherAI/pythia-14m,step15000,seed1,1,15000
It was a major scale.,scale,scale,It was a scale major., major scale, scale major,major,False,-15.280406951904297,-23.553478240966797,8.2730712890625,14067712,EleutherAI/pythia-14m,step15000,seed1,1,15000
It was a panoramic scene.,scene,scene,It was a scene panoramic., panoramic scene, scene panoramic,panoramic,False,-20.953821182250977,-24.796764373779297,3.8429431915283203,14067712,EleutherAI/pythia-14m,step15000,seed1,1,15000
It was a trained seal.,seal,seal,It was a seal trained., trained seal, seal trained,trained,False,-24.778236389160156,-24.004684448242188,-0.7735519409179688,14067712,EleutherAI/pythia-14m,step15000,seed1,1,15000
He used the video tape.,tape,tape,He used the tape video., video tape, tape video,video,True,-13.85378646850586,-15.792806625366211,1.9390201568603516,14067712,EleutherAI/pythia-14m,step15000,seed1,1,15000
It was a technical term.,term,term,It was a term technical., technical term, term technical,technical,False,-17.183536529541016,-21.486547470092773,4.303010940551758,14067712,EleutherAI/pythia-14m,step15000,seed1,1,15000
It was a diseased tick.,tick,tick,It was a tick diseased., diseased tick, tick diseased,diseased,False,-24.0497989654541,-24.39459228515625,0.34479331970214844,14067712,EleutherAI/pythia-14m,step15000,seed1,1,15000
It was a finger tip.,tip,tip,It was a tip finger., finger tip, tip finger,finger,True,-19.447736740112305,-17.747024536132812,-1.7007122039794922,14067712,EleutherAI/pythia-14m,step15000,seed1,1,15000
She liked the professional title.,title,title,She liked the title professional., professional title, title professional,professional,False,-16.199840545654297,-19.53590965270996,3.336069107055664,14067712,EleutherAI/pythia-14m,step15000,seed1,1,15000
It was a bell toll.,toll,toll,It was a toll bell., bell toll, toll bell,bell,True,-21.004261016845703,-18.312480926513672,-2.6917800903320312,14067712,EleutherAI/pythia-14m,step15000,seed1,1,15000
She saw the snowshoe tracks.,track,tracks,She saw the tracks snowshoe., snowshoe tracks, tracks snowshoe,snowshoe,True,-27.884065628051758,-33.014976501464844,5.130910873413086,14067712,EleutherAI/pythia-14m,step15000,seed1,1,15000
They were cluttered yards.,yard,yards,They were yards cluttered., cluttered yards, yards cluttered,cluttered,False,-30.884559631347656,-36.97114944458008,6.086589813232422,14067712,EleutherAI/pythia-14m,step15000,seed1,1,15000
