sentence,word,string,reversed_sentence,mod_np,reversed_mod,disambiguating_word,non_adjective,original_logprob,reversed_logprob,ratio,n_params,mpath,revision,seed_name,seed,step
It was a desperate act.,act,act,It was an act desperate., desperate act, act desperate,desperate,False,-14.309661865234375,-20.573984146118164,6.264322280883789,14067712,EleutherAI/pythia-14m,step135000,seed6,6,135000
It was a humane act.,act,act,It was an act humane., humane act, act humane,humane,False,-18.352218627929688,-21.443923950195312,3.091705322265625,14067712,EleutherAI/pythia-14m,step135000,seed6,6,135000
It was a magic act.,act,act,It was an act magic., magic act, act magic,magic,False,-16.83533477783203,-20.601572036743164,3.766237258911133,14067712,EleutherAI/pythia-14m,step135000,seed6,6,135000
He had a universal appeal.,appeal,appeal,He had an appeal universal., universal appeal, appeal universal,universal,False,-18.452280044555664,-19.83622932434082,1.3839492797851562,14067712,EleutherAI/pythia-14m,step135000,seed6,6,135000
He had an undefinable appeal.,appeal,appeal,He had an appeal undefinable., undefinable appeal, appeal undefinable,undefinable,False,-22.33972930908203,-22.68735122680664,0.3476219177246094,14067712,EleutherAI/pythia-14m,step135000,seed6,6,135000
He had a legal appeal.,appeal,appeal,He had an appeal legal., legal appeal, appeal legal,legal,False,-15.833168029785156,-17.36039924621582,1.527231216430664,14067712,EleutherAI/pythia-14m,step135000,seed6,6,135000
It was a tense atmosphere.,atmosphere,atmosphere,It was an atmosphere tense., tense atmosphere, atmosphere tense,tense,False,-17.928119659423828,-21.57223892211914,3.6441192626953125,14067712,EleutherAI/pythia-14m,step135000,seed6,6,135000
It was a hostile atmosphere.,atmosphere,atmosphere,It was an atmosphere hostile., hostile atmosphere, atmosphere hostile,hostile,False,-16.007469177246094,-20.46945571899414,4.461986541748047,14067712,EleutherAI/pythia-14m,step135000,seed6,6,135000
It was a gaseous atmosphere.,atmosphere,atmosphere,It was an atmosphere gaseous., gaseous atmosphere, atmosphere gaseous,gaseous,False,-17.111013412475586,-23.67844009399414,6.567426681518555,14067712,EleutherAI/pythia-14m,step135000,seed6,6,135000
It was a gold band.,band,band,It was a band gold., gold band, band gold,gold,True,-15.78752326965332,-19.34298324584961,3.555459976196289,14067712,EleutherAI/pythia-14m,step135000,seed6,6,135000
It was a rubber band.,band,band,It was a band rubber., rubber band, band rubber,rubber,True,-15.71780776977539,-21.69820785522461,5.980400085449219,14067712,EleutherAI/pythia-14m,step135000,seed6,6,135000
It was a jazz band.,band,band,It was a band jazz., jazz band, band jazz,jazz,True,-13.802276611328125,-19.35738754272461,5.555110931396484,14067712,EleutherAI/pythia-14m,step135000,seed6,6,135000
There was a police barrier.,barrier,barrier,There was a barrier police., police barrier, barrier police,police,True,-19.200912475585938,-21.07049560546875,1.8695831298828125,14067712,EleutherAI/pythia-14m,step135000,seed6,6,135000
There was a concrete barrier.,barrier,barrier,There was a barrier concrete., concrete barrier, barrier concrete,concrete,False,-14.464447021484375,-18.50457763671875,4.040130615234375,14067712,EleutherAI/pythia-14m,step135000,seed6,6,135000
There was a language barrier.,barrier,barrier,There was a barrier language., language barrier, barrier language,language,True,-21.77118682861328,-21.80218505859375,0.03099822998046875,14067712,EleutherAI/pythia-14m,step135000,seed6,6,135000
He saw a furry bat.,bat,bat,He saw a bat furry., furry bat, bat furry,furry,False,-19.65972900390625,-22.88543701171875,3.2257080078125,14067712,EleutherAI/pythia-14m,step135000,seed6,6,135000
He saw a fruit bat.,bat,bat,He saw a bat fruit., fruit bat, bat fruit,fruit,True,-19.52597427368164,-20.466236114501953,0.9402618408203125,14067712,EleutherAI/pythia-14m,step135000,seed6,6,135000
He saw a wooden bat.,bat,bat,He saw a bat wooden., wooden bat, bat wooden,wooden,False,-15.296238899230957,-20.474781036376953,5.178542137145996,14067712,EleutherAI/pythia-14m,step135000,seed6,6,135000
He saw the laser beam.,beam,beam,He saw the beam laser., laser beam, beam laser,laser,True,-15.34153938293457,-19.343975067138672,4.002435684204102,14067712,EleutherAI/pythia-14m,step135000,seed6,6,135000
He saw the bright beam.,beam,beam,He saw the beam bright., bright beam, beam bright,bright,False,-17.591392517089844,-19.368144989013672,1.7767524719238281,14067712,EleutherAI/pythia-14m,step135000,seed6,6,135000
He saw the wood beam.,beam,beam,He saw the beam wood., wood beam, beam wood,wood,True,-18.22127914428711,-20.919902801513672,2.6986236572265625,14067712,EleutherAI/pythia-14m,step135000,seed6,6,135000
She had a toy block.,block,block,She had a block toy., toy block, block toy,toy,True,-15.842876434326172,-18.48964500427246,2.646768569946289,14067712,EleutherAI/pythia-14m,step135000,seed6,6,135000
She had a wooden block.,block,block,She had a block wooden., wooden block, block wooden,wooden,False,-13.122302055358887,-19.51747703552246,6.395174980163574,14067712,EleutherAI/pythia-14m,step135000,seed6,6,135000
She had a mental block.,block,block,She had a block mental., mental block, block mental,mental,False,-14.109381675720215,-21.49867820739746,7.389296531677246,14067712,EleutherAI/pythia-14m,step135000,seed6,6,135000
He has coagulated blood.,blood,blood,He has blood coagulated., coagulated blood, blood coagulated,coagulated,True,-28.28441047668457,-26.209735870361328,-2.074674606323242,14067712,EleutherAI/pythia-14m,step135000,seed6,6,135000
He has thin blood.,blood,blood,He has blood thin., thin blood, blood thin,thin,False,-18.798328399658203,-20.130752563476562,1.3324241638183594,14067712,EleutherAI/pythia-14m,step135000,seed6,6,135000
He has noble blood.,blood,blood,He has blood noble., noble blood, blood noble,noble,False,-19.08958625793457,-22.912734985351562,3.823148727416992,14067712,EleutherAI/pythia-14m,step135000,seed6,6,135000
It was the ironing board.,board,board,It was the board ironing., ironing board, board ironing,ironing,False,-23.243114471435547,-24.818500518798828,1.5753860473632812,14067712,EleutherAI/pythia-14m,step135000,seed6,6,135000
It was the wooden board.,board,board,It was the board wooden., wooden board, board wooden,wooden,False,-15.572067260742188,-21.99169158935547,6.419624328613281,14067712,EleutherAI/pythia-14m,step135000,seed6,6,135000
It was the executive board.,board,board,It was the board executive., executive board, board executive,executive,True,-14.930744171142578,-18.42504119873047,3.4942970275878906,14067712,EleutherAI/pythia-14m,step135000,seed6,6,135000
He had a best-selling book.,book,book,He had a book best-selling., best-selling book, book best-selling,best-selling,False,-11.671663284301758,-21.726634979248047,10.054971694946289,14067712,EleutherAI/pythia-14m,step135000,seed6,6,135000
He had a popular book.,book,book,He had a book popular., popular book, book popular,popular,False,-14.850638389587402,-19.628955841064453,4.778317451477051,14067712,EleutherAI/pythia-14m,step135000,seed6,6,135000
He had a heavy book.,book,book,He had a book heavy., heavy book, book heavy,heavy,False,-17.432415008544922,-19.232227325439453,1.7998123168945312,14067712,EleutherAI/pythia-14m,step135000,seed6,6,135000
They ate a pancake breakfast.,breakfast,breakfast,They ate a breakfast pancake., pancake breakfast, breakfast pancake,pancake,True,-16.77629280090332,-17.03376579284668,0.2574729919433594,14067712,EleutherAI/pythia-14m,step135000,seed6,6,135000
They ate a nutritious breakfast.,breakfast,breakfast,They ate a breakfast nutritious., nutritious breakfast, breakfast nutritious,nutritious,False,-17.67043685913086,-22.164628982543945,4.494192123413086,14067712,EleutherAI/pythia-14m,step135000,seed6,6,135000
They ate a family breakfast.,breakfast,breakfast,They ate a breakfast family., family breakfast, breakfast family,family,True,-11.176085472106934,-14.615299224853516,3.439213752746582,14067712,EleutherAI/pythia-14m,step135000,seed6,6,135000
It was a red cape.,cape,cape,It was a cape red., red cape, cape red,red,False,-16.86240577697754,-21.17488670349121,4.312480926513672,14067712,EleutherAI/pythia-14m,step135000,seed6,6,135000
It was a flowing cape.,cape,cape,It was a cape flowing., flowing cape, cape flowing,flowing,False,-21.63875961303711,-21.56892967224121,-0.06982994079589844,14067712,EleutherAI/pythia-14m,step135000,seed6,6,135000
It was a rocky cape.,cape,cape,It was a cape rocky., rocky cape, cape rocky,rocky,False,-22.275815963745117,-24.66951560974121,2.3936996459960938,14067712,EleutherAI/pythia-14m,step135000,seed6,6,135000
It was a beer case.,case,case,It was a case beer., beer case, case beer,beer,True,-16.649314880371094,-17.582571029663086,0.9332561492919922,14067712,EleutherAI/pythia-14m,step135000,seed6,6,135000
It was a display case.,case,case,It was a case display., display case, case display,display,True,-16.323204040527344,-17.547903060913086,1.2246990203857422,14067712,EleutherAI/pythia-14m,step135000,seed6,6,135000
It was a divorce case.,case,case,It was a case divorce., divorce case, case divorce,divorce,True,-13.138528823852539,-17.487356185913086,4.348827362060547,14067712,EleutherAI/pythia-14m,step135000,seed6,6,135000
It was a worthy cause.,cause,cause,It was a cause worthy., worthy cause, cause worthy,worthy,False,-14.359350204467773,-18.32448959350586,3.965139389038086,14067712,EleutherAI/pythia-14m,step135000,seed6,6,135000
It was a political cause.,cause,cause,It was a cause political., political cause, cause political,political,False,-16.175748825073242,-19.92776107788086,3.752012252807617,14067712,EleutherAI/pythia-14m,step135000,seed6,6,135000
It was a main cause.,cause,cause,It was a cause main., main cause, cause main,main,False,-15.235479354858398,-20.43191146850586,5.196432113647461,14067712,EleutherAI/pythia-14m,step135000,seed6,6,135000
It was a skin cell.,cell,cell,It was a cell skin., skin cell, cell skin,skin,True,-18.69001579284668,-18.242586135864258,-0.4474296569824219,14067712,EleutherAI/pythia-14m,step135000,seed6,6,135000
It was a brain cell.,cell,cell,It was a cell brain., brain cell, cell brain,brain,True,-16.039268493652344,-17.236970901489258,1.197702407836914,14067712,EleutherAI/pythia-14m,step135000,seed6,6,135000
It was a prison cell.,cell,cell,It was a cell prison., prison cell, cell prison,prison,True,-16.287384033203125,-19.239900588989258,2.952516555786133,14067712,EleutherAI/pythia-14m,step135000,seed6,6,135000
She had a devilish charm.,charm,charm,She had a charm devilish., devilish charm, charm devilish,devilish,False,-18.70378303527832,-24.872310638427734,6.168527603149414,14067712,EleutherAI/pythia-14m,step135000,seed6,6,135000
She had a natural charm.,charm,charm,She had a charm natural., natural charm, charm natural,natural,False,-14.716836929321289,-20.464706420898438,5.747869491577148,14067712,EleutherAI/pythia-14m,step135000,seed6,6,135000
She had a gold charm.,charm,charm,She had a charm gold., gold charm, charm gold,gold,True,-16.557323455810547,-19.651962280273438,3.0946388244628906,14067712,EleutherAI/pythia-14m,step135000,seed6,6,135000
They liked the juicy chicken.,chicken,chicken,They liked the chicken juicy., juicy chicken, chicken juicy,juicy,False,-23.62386131286621,-24.264339447021484,0.6404781341552734,14067712,EleutherAI/pythia-14m,step135000,seed6,6,135000
They liked the roasted chicken.,chicken,chicken,They liked the chicken roasted., roasted chicken, chicken roasted,roasted,False,-14.252531051635742,-17.695098876953125,3.442567825317383,14067712,EleutherAI/pythia-14m,step135000,seed6,6,135000
They liked the clucking chicken.,chicken,chicken,They liked the chicken clucking., clucking chicken, chicken clucking,clucking,True,-23.42642593383789,-21.763694763183594,-1.6627311706542969,14067712,EleutherAI/pythia-14m,step135000,seed6,6,135000
It was a perceptive class.,class,class,It was a class perceptive., perceptive class, class perceptive,perceptive,False,-20.38458251953125,-26.197914123535156,5.813331604003906,14067712,EleutherAI/pythia-14m,step135000,seed6,6,135000
It was a misbehaving class.,class,class,It was a class misbehaving., misbehaving class, class misbehaving,misbehaving,False,-23.858116149902344,-26.552982330322266,2.694866180419922,14067712,EleutherAI/pythia-14m,step135000,seed6,6,135000
It was a boring class.,class,class,It was a class boring., boring class, class boring,boring,False,-16.965272903442383,-20.035415649414062,3.0701427459716797,14067712,EleutherAI/pythia-14m,step135000,seed6,6,135000
It was a film clip.,clip,clip,It was a clip film., film clip, clip film,film,True,-17.74868392944336,-18.174495697021484,0.425811767578125,14067712,EleutherAI/pythia-14m,step135000,seed6,6,135000
It was a video clip.,clip,clip,It was a clip video., video clip, clip video,video,True,-15.728645324707031,-19.185970306396484,3.457324981689453,14067712,EleutherAI/pythia-14m,step135000,seed6,6,135000
It was a hair clip.,clip,clip,It was a clip hair., hair clip, clip hair,hair,True,-18.422439575195312,-21.708675384521484,3.286235809326172,14067712,EleutherAI/pythia-14m,step135000,seed6,6,135000
It was an icy cold.,cold,cold,It was an cold icy., icy cold, cold icy,icy,False,-13.654236793518066,-18.361576080322266,4.707339286804199,14067712,EleutherAI/pythia-14m,step135000,seed6,6,135000
It was a freezing cold.,cold,cold,It was a cold freezing., freezing cold, cold freezing,freezing,False,-14.414407730102539,-15.463150024414062,1.0487422943115234,14067712,EleutherAI/pythia-14m,step135000,seed6,6,135000
It was a chest cold.,cold,cold,It was a cold chest., chest cold, cold chest,chest,False,-16.351619720458984,-14.967300415039062,-1.3843193054199219,14067712,EleutherAI/pythia-14m,step135000,seed6,6,135000
It was a gossip column.,column,column,It was a column gossip., gossip column, column gossip,gossip,True,-18.614303588867188,-21.210147857666016,2.595844268798828,14067712,EleutherAI/pythia-14m,step135000,seed6,6,135000
It was a sports column.,column,column,It was a column sports., sports column, column sports,sports,True,-20.632183074951172,-21.969913482666016,1.3377304077148438,14067712,EleutherAI/pythia-14m,step135000,seed6,6,135000
It was a concrete column.,column,column,It was a column concrete., concrete column, column concrete,concrete,False,-16.95476531982422,-19.841251373291016,2.886486053466797,14067712,EleutherAI/pythia-14m,step135000,seed6,6,135000
He liked the investment company.,company,company,He liked the company investment., investment company, company investment,investment,True,-15.260522842407227,-18.222854614257812,2.962331771850586,14067712,EleutherAI/pythia-14m,step135000,seed6,6,135000
He liked the pharmaceutical company.,company,company,He liked the company pharmaceutical., pharmaceutical company, company pharmaceutical,pharmaceutical,False,-14.636407852172852,-19.512893676757812,4.876485824584961,14067712,EleutherAI/pythia-14m,step135000,seed6,6,135000
He liked the pleasant company.,company,company,He liked the company pleasant., pleasant company, company pleasant,pleasant,False,-19.499914169311523,-20.069290161132812,0.5693759918212891,14067712,EleutherAI/pythia-14m,step135000,seed6,6,135000
It was a waffle cone.,cone,cone,It was a cone waffle., waffle cone, cone waffle,waffle,True,-24.43960189819336,-27.258739471435547,2.8191375732421875,14067712,EleutherAI/pythia-14m,step135000,seed6,6,135000
It was a sugar cone.,cone,cone,It was a cone sugar., sugar cone, cone sugar,sugar,True,-20.704853057861328,-23.01009750366211,2.3052444458007812,14067712,EleutherAI/pythia-14m,step135000,seed6,6,135000
It was an orange cone.,cone,cone,It was an cone orange., orange cone, cone orange,orange,False,-15.78072452545166,-22.220874786376953,6.440150260925293,14067712,EleutherAI/pythia-14m,step135000,seed6,6,135000
He made a charitable contribution.,contribution,contribution,He made a contribution charitable., charitable contribution, contribution charitable,charitable,False,-14.859512329101562,-23.814842224121094,8.955329895019531,14067712,EleutherAI/pythia-14m,step135000,seed6,6,135000
He made a voluntary contribution.,contribution,contribution,He made a contribution voluntary., voluntary contribution, contribution voluntary,voluntary,False,-14.970361709594727,-22.189109802246094,7.218748092651367,14067712,EleutherAI/pythia-14m,step135000,seed6,6,135000
He made a scholarly contribution.,contribution,contribution,He made a contribution scholarly., scholarly contribution, contribution scholarly,scholarly,False,-19.239973068237305,-23.235252380371094,3.995279312133789,14067712,EleutherAI/pythia-14m,step135000,seed6,6,135000
That was the noble count.,count,count,That was the count noble., noble count, count noble,noble,False,-18.837291717529297,-24.036617279052734,5.1993255615234375,14067712,EleutherAI/pythia-14m,step135000,seed6,6,135000
That was the vengeful count.,count,count,That was the count vengeful., vengeful count, count vengeful,vengeful,False,-28.264869689941406,-32.39662170410156,4.131752014160156,14067712,EleutherAI/pythia-14m,step135000,seed6,6,135000
That was the final count.,count,count,That was the count final., final count, count final,final,False,-13.927724838256836,-20.904537200927734,6.976812362670898,14067712,EleutherAI/pythia-14m,step135000,seed6,6,135000
It was an introductory course.,course,course,It was an course introductory., introductory course, course introductory,introductory,False,-13.53645133972168,-20.347576141357422,6.811124801635742,14067712,EleutherAI/pythia-14m,step135000,seed6,6,135000
It was a pass-fail course.,course,course,It was a course pass-fail., pass-fail course, course pass-fail,pass-fail,False,-31.117233276367188,-32.1539306640625,1.0366973876953125,14067712,EleutherAI/pythia-14m,step135000,seed6,6,135000
It was a charted course.,course,course,It was a course charted., charted course, course charted,charted,False,-23.616683959960938,-23.058185577392578,-0.5584983825683594,14067712,EleutherAI/pythia-14m,step135000,seed6,6,135000
It was a dinner date.,date,date,It was a date dinner., dinner date, date dinner,dinner,True,-19.16619110107422,-21.240076065063477,2.073884963989258,14067712,EleutherAI/pythia-14m,step135000,seed6,6,135000
It was a blind date.,date,date,It was a date blind., blind date, date blind,blind,False,-19.27768898010254,-21.012781143188477,1.7350921630859375,14067712,EleutherAI/pythia-14m,step135000,seed6,6,135000
It was an expiration date.,date,date,It was an date expiration., expiration date, date expiration,expiration,True,-12.154413223266602,-23.08502769470215,10.930614471435547,14067712,EleutherAI/pythia-14m,step135000,seed6,6,135000
It was about forty degrees.,degree,degrees,It was about degrees forty., forty degrees, degrees forty,forty,True,-16.829452514648438,-22.64740562438965,5.817953109741211,14067712,EleutherAI/pythia-14m,step135000,seed6,6,135000
It was about fifty degrees.,degree,degrees,It was about degrees fifty., fifty degrees, degrees fifty,fifty,True,-16.382057189941406,-22.29193687438965,5.909879684448242,14067712,EleutherAI/pythia-14m,step135000,seed6,6,135000
It was about associate degrees.,degree,degrees,It was about degrees associate., associate degrees, degrees associate,associate,False,-20.916492462158203,-23.76849937438965,2.8520069122314453,14067712,EleutherAI/pythia-14m,step135000,seed6,6,135000
They liked the floral design.,design,design,They liked the design floral., floral design, design floral,floral,False,-15.305463790893555,-19.829402923583984,4.52393913269043,14067712,EleutherAI/pythia-14m,step135000,seed6,6,135000
They liked the geometric design.,design,design,They liked the design geometric., geometric design, design geometric,geometric,False,-16.9981632232666,-20.293025970458984,3.294862747192383,14067712,EleutherAI/pythia-14m,step135000,seed6,6,135000
They liked the product design.,design,design,They liked the design product., product design, design product,product,True,-16.162471771240234,-14.763240814208984,-1.39923095703125,14067712,EleutherAI/pythia-14m,step135000,seed6,6,135000
They liked the turkey dinner.,dinner,dinner,They liked the dinner turkey., turkey dinner, dinner turkey,turkey,True,-18.235931396484375,-19.474075317382812,1.2381439208984375,14067712,EleutherAI/pythia-14m,step135000,seed6,6,135000
They liked the light dinner.,dinner,dinner,They liked the dinner light., light dinner, dinner light,light,False,-17.33846664428711,-18.912551879882812,1.5740852355957031,14067712,EleutherAI/pythia-14m,step135000,seed6,6,135000
They liked the formal dinner.,dinner,dinner,They liked the dinner formal., formal dinner, dinner formal,formal,False,-18.90387725830078,-19.828811645507812,0.9249343872070312,14067712,EleutherAI/pythia-14m,step135000,seed6,6,135000
He had a recurring dream.,dream,dream,He had a dream recurring., recurring dream, dream recurring,recurring,False,-16.51795768737793,-20.730144500732422,4.212186813354492,14067712,EleutherAI/pythia-14m,step135000,seed6,6,135000
He had a bad dream.,dream,dream,He had a dream bad., bad dream, dream bad,bad,False,-13.481069564819336,-17.554119110107422,4.073049545288086,14067712,EleutherAI/pythia-14m,step135000,seed6,6,135000
He had a childhood dream.,dream,dream,He had a dream childhood., childhood dream, dream childhood,childhood,True,-15.594541549682617,-16.027751922607422,0.4332103729248047,14067712,EleutherAI/pythia-14m,step135000,seed6,6,135000
It was a grueling drill.,drill,drill,It was a drill grueling., grueling drill, drill grueling,grueling,False,-24.50287628173828,-27.079551696777344,2.5766754150390625,14067712,EleutherAI/pythia-14m,step135000,seed6,6,135000
It was a challenging drill.,drill,drill,It was a drill challenging., challenging drill, drill challenging,challenging,False,-20.878889083862305,-23.112407684326172,2.233518600463867,14067712,EleutherAI/pythia-14m,step135000,seed6,6,135000
It was an electric drill.,drill,drill,It was an drill electric., electric drill, drill electric,electric,False,-21.507564544677734,-24.14474105834961,2.637176513671875,14067712,EleutherAI/pythia-14m,step135000,seed6,6,135000
It was a multiple-choice examination.,examination,examination,It was an examination multiple-choice., multiple-choice examination, examination multiple-choice,multiple-choice,False,-29.138935089111328,-31.948993682861328,2.81005859375,14067712,EleutherAI/pythia-14m,step135000,seed6,6,135000
It was a difficult examination.,examination,examination,It was an examination difficult., difficult examination, examination difficult,difficult,False,-16.172727584838867,-16.495555877685547,0.3228282928466797,14067712,EleutherAI/pythia-14m,step135000,seed6,6,135000
It was a prostate examination.,examination,examination,It was an examination prostate., prostate examination, examination prostate,prostate,True,-20.82988739013672,-21.836864471435547,1.0069770812988281,14067712,EleutherAI/pythia-14m,step135000,seed6,6,135000
They had an electric fan.,fan,fan,They had an fan electric., electric fan, fan electric,electric,False,-16.47361946105957,-21.195329666137695,4.721710205078125,14067712,EleutherAI/pythia-14m,step135000,seed6,6,135000
They had a ceiling fan.,fan,fan,They had a fan ceiling., ceiling fan, fan ceiling,ceiling,True,-17.78622817993164,-19.952945709228516,2.166717529296875,14067712,EleutherAI/pythia-14m,step135000,seed6,6,135000
They had a zealous fan.,fan,fan,They had a fan zealous., zealous fan, fan zealous,zealous,False,-22.72536849975586,-27.045034408569336,4.319665908813477,14067712,EleutherAI/pythia-14m,step135000,seed6,6,135000
She had a text file.,file,file,She had a file text., text file, file text,text,True,-13.535811424255371,-18.09313201904297,4.557320594787598,14067712,EleutherAI/pythia-14m,step135000,seed6,6,135000
She had a data file.,file,file,She had a file data., data file, file data,data,True,-14.224599838256836,-17.78624725341797,3.561647415161133,14067712,EleutherAI/pythia-14m,step135000,seed6,6,135000
She had a nail file.,file,file,She had a file nail., nail file, file nail,nail,True,-18.112266540527344,-21.75133514404297,3.639068603515625,14067712,EleutherAI/pythia-14m,step135000,seed6,6,135000
It was an action film.,film,film,It was an film action., action film, film action,action,True,-16.4461669921875,-15.224522590637207,-1.221644401550293,14067712,EleutherAI/pythia-14m,step135000,seed6,6,135000
It was a censored film.,film,film,It was a film censored., censored film, film censored,censored,False,-19.7270450592041,-21.07316017150879,1.3461151123046875,14067712,EleutherAI/pythia-14m,step135000,seed6,6,135000
It was a transparent film.,film,film,It was a film transparent., transparent film, film transparent,transparent,False,-15.796318054199219,-20.30752182006836,4.511203765869141,14067712,EleutherAI/pythia-14m,step135000,seed6,6,135000
It was a charitable foundation.,foundation,foundation,It was a foundation charitable., charitable foundation, foundation charitable,charitable,False,-15.625767707824707,-20.71304702758789,5.087279319763184,14067712,EleutherAI/pythia-14m,step135000,seed6,6,135000
It was an educational foundation.,foundation,foundation,It was an foundation educational., educational foundation, foundation educational,educational,False,-16.565811157226562,-22.063804626464844,5.497993469238281,14067712,EleutherAI/pythia-14m,step135000,seed6,6,135000
It was a wooden foundation.,foundation,foundation,It was a foundation wooden., wooden foundation, foundation wooden,wooden,False,-17.129945755004883,-20.74258804321289,3.612642288208008,14067712,EleutherAI/pythia-14m,step135000,seed6,6,135000
It was a mathematical function.,function,function,It was a function mathematical., mathematical function, function mathematical,mathematical,False,-14.282154083251953,-18.57076644897461,4.288612365722656,14067712,EleutherAI/pythia-14m,step135000,seed6,6,135000
