sentence,word,string,reversed_sentence,mod_np,reversed_mod,disambiguating_word,non_adjective,original_logprob,reversed_logprob,ratio,n_params,mpath,revision,seed_name,seed,step
It was a social function.,function,function,It was a function social., social function, function social,social,False,-13.727760314941406,-19.307878494262695,5.580118179321289,14067712,EleutherAI/pythia-14m,step95000,seed4,4,95000
He was on the firm ground.,ground,ground,He was on the ground firm., firm ground, ground firm,firm,False,-18.484024047851562,-14.5357084274292,-3.9483156204223633,14067712,EleutherAI/pythia-14m,step95000,seed4,4,95000
He was on the frozen ground.,ground,ground,He was on the ground frozen., frozen ground, ground frozen,frozen,False,-16.447242736816406,-17.026676177978516,0.5794334411621094,14067712,EleutherAI/pythia-14m,step95000,seed4,4,95000
He was on the camp ground.,ground,ground,He was on the ground camp., camp ground, ground camp,camp,True,-18.964275360107422,-14.679430961608887,-4.284844398498535,14067712,EleutherAI/pythia-14m,step95000,seed4,4,95000
They liked the night guard.,guard,guard,They liked the guard night., night guard, guard night,night,True,-17.795560836791992,-21.79827880859375,4.002717971801758,14067712,EleutherAI/pythia-14m,step95000,seed4,4,95000
They liked the security guard.,guard,guard,They liked the guard security., security guard, guard security,security,True,-15.977694511413574,-20.683921813964844,4.7062273025512695,14067712,EleutherAI/pythia-14m,step95000,seed4,4,95000
They liked the coast guard.,guard,guard,They liked the guard coast., coast guard, guard coast,coast,True,-19.069873809814453,-24.558685302734375,5.488811492919922,14067712,EleutherAI/pythia-14m,step95000,seed4,4,95000
He had an assembly guide.,guide,guide,He had an guide assembly., assembly guide, guide assembly,assembly,True,-17.42938804626465,-22.801830291748047,5.372442245483398,14067712,EleutherAI/pythia-14m,step95000,seed4,4,95000
He had a TV guide.,guide,guide,He had a guide TV., TV guide, guide TV,TV,True,-18.083335876464844,-21.474882125854492,3.3915462493896484,14067712,EleutherAI/pythia-14m,step95000,seed4,4,95000
He had a talkative guide.,guide,guide,He had a guide talkative., talkative guide, guide talkative,talkative,False,-25.458003997802734,-28.033605575561523,2.575601577758789,14067712,EleutherAI/pythia-14m,step95000,seed4,4,95000
It was a summer home.,home,home,It was a home summer., summer home, home summer,summer,True,-14.98760986328125,-17.444982528686523,2.4573726654052734,14067712,EleutherAI/pythia-14m,step95000,seed4,4,95000
It was a childhood home.,home,home,It was a home childhood., childhood home, home childhood,childhood,True,-15.833332061767578,-18.856840133666992,3.023508071899414,14067712,EleutherAI/pythia-14m,step95000,seed4,4,95000
It was a funeral home.,home,home,It was a home funeral., funeral home, home funeral,funeral,False,-13.930956840515137,-17.293928146362305,3.362971305847168,14067712,EleutherAI/pythia-14m,step95000,seed4,4,95000
They had natural intelligence.,intelligence,intelligence,They had intelligence natural., natural intelligence, intelligence natural,natural,False,-17.10541534423828,-23.596874237060547,6.491458892822266,14067712,EleutherAI/pythia-14m,step95000,seed4,4,95000
They had innate intelligence.,intelligence,intelligence,They had intelligence innate., innate intelligence, intelligence innate,innate,False,-20.490209579467773,-25.297687530517578,4.807477951049805,14067712,EleutherAI/pythia-14m,step95000,seed4,4,95000
They had classified intelligence.,intelligence,intelligence,They had intelligence classified., classified intelligence, intelligence classified,classified,False,-19.795848846435547,-20.823688507080078,1.0278396606445312,14067712,EleutherAI/pythia-14m,step95000,seed4,4,95000
It was a sensitive issue.,issue,issue,It was an issue sensitive., sensitive issue, issue sensitive,sensitive,False,-16.030372619628906,-16.62822723388672,0.5978546142578125,14067712,EleutherAI/pythia-14m,step95000,seed4,4,95000
It was a political issue.,issue,issue,It was an issue political., political issue, issue political,political,False,-13.868681907653809,-17.743392944335938,3.874711036682129,14067712,EleutherAI/pythia-14m,step95000,seed4,4,95000
It was a weekly issue.,issue,issue,It was an issue weekly., weekly issue, issue weekly,weekly,False,-16.921350479125977,-18.92346954345703,2.0021190643310547,14067712,EleutherAI/pythia-14m,step95000,seed4,4,95000
It was a blackberry jam.,jam,jam,It was a jam blackberry., blackberry jam, jam blackberry,blackberry,True,-19.97559356689453,-27.302093505859375,7.326499938964844,14067712,EleutherAI/pythia-14m,step95000,seed4,4,95000
It was a peach jam.,jam,jam,It was a jam peach., peach jam, jam peach,peach,False,-20.646015167236328,-22.267677307128906,1.6216621398925781,14067712,EleutherAI/pythia-14m,step95000,seed4,4,95000
It was a traffic jam.,jam,jam,It was a jam traffic., traffic jam, jam traffic,traffic,True,-13.657821655273438,-22.132102966308594,8.474281311035156,14067712,EleutherAI/pythia-14m,step95000,seed4,4,95000
It was a duplicate key.,key,key,It was a key duplicate., duplicate key, key duplicate,duplicate,False,-18.881980895996094,-19.182043075561523,0.3000621795654297,14067712,EleutherAI/pythia-14m,step95000,seed4,4,95000
It was a master key.,key,key,It was a key master., master key, key master,master,True,-17.88571548461914,-17.238332748413086,-0.6473827362060547,14067712,EleutherAI/pythia-14m,step95000,seed4,4,95000
It was a delete key.,key,key,It was a key delete., delete key, key delete,delete,False,-19.666873931884766,-20.075223922729492,0.40834999084472656,14067712,EleutherAI/pythia-14m,step95000,seed4,4,95000
They liked the marinated lamb.,lamb,lamb,They liked the lamb marinated., marinated lamb, lamb marinated,marinated,True,-24.07333755493164,-25.066993713378906,0.9936561584472656,14067712,EleutherAI/pythia-14m,step95000,seed4,4,95000
They liked the grilled lamb.,lamb,lamb,They liked the lamb grilled., grilled lamb, lamb grilled,grilled,False,-18.59889030456543,-23.362300872802734,4.763410568237305,14067712,EleutherAI/pythia-14m,step95000,seed4,4,95000
They liked the cute lamb.,lamb,lamb,They liked the lamb cute., cute lamb, lamb cute,cute,False,-19.966772079467773,-24.512317657470703,4.54554557800293,14067712,EleutherAI/pythia-14m,step95000,seed4,4,95000
She had curly locks.,lock,locks,She had locks curly., curly locks, locks curly,curly,False,-21.782875061035156,-25.086734771728516,3.3038597106933594,14067712,EleutherAI/pythia-14m,step95000,seed4,4,95000
She had brown locks.,lock,locks,She had locks brown., brown locks, locks brown,brown,False,-24.061565399169922,-23.845012664794922,-0.216552734375,14067712,EleutherAI/pythia-14m,step95000,seed4,4,95000
She had window locks.,lock,locks,She had locks window., window locks, locks window,window,True,-20.003555297851562,-23.728626251220703,3.7250709533691406,14067712,EleutherAI/pythia-14m,step95000,seed4,4,95000
They liked the hot lunch.,lunch,lunch,They liked the lunch hot., hot lunch, lunch hot,hot,False,-16.99152183532715,-19.81375503540039,2.822233200073242,14067712,EleutherAI/pythia-14m,step95000,seed4,4,95000
They liked the sandwich lunch.,lunch,lunch,They liked the lunch sandwich., sandwich lunch, lunch sandwich,sandwich,True,-18.669692993164062,-20.940303802490234,2.270610809326172,14067712,EleutherAI/pythia-14m,step95000,seed4,4,95000
They liked the afternoon lunch.,lunch,lunch,They liked the lunch afternoon., afternoon lunch, lunch afternoon,afternoon,True,-18.1787166595459,-18.364673614501953,0.1859569549560547,14067712,EleutherAI/pythia-14m,step95000,seed4,4,95000
He liked the flea market.,market,market,He liked the market flea., flea market, market flea,flea,True,-21.62224769592285,-20.995574951171875,-0.6266727447509766,14067712,EleutherAI/pythia-14m,step95000,seed4,4,95000
He liked the fish market.,market,market,He liked the market fish., fish market, market fish,fish,True,-17.095191955566406,-19.45639991760254,2.361207962036133,14067712,EleutherAI/pythia-14m,step95000,seed4,4,95000
He liked the housing market.,market,market,He liked the market housing., housing market, market housing,housing,True,-14.92284107208252,-17.368234634399414,2.4453935623168945,14067712,EleutherAI/pythia-14m,step95000,seed4,4,95000
It was a lit match.,match,match,It was a match lit., lit match, match lit,lit,False,-26.507183074951172,-20.087146759033203,-6.420036315917969,14067712,EleutherAI/pythia-14m,step95000,seed4,4,95000
It was a burning match.,match,match,It was a match burning., burning match, match burning,burning,False,-21.233661651611328,-20.60268783569336,-0.6309738159179688,14067712,EleutherAI/pythia-14m,step95000,seed4,4,95000
It was a soccer match.,match,match,It was a match soccer., soccer match, match soccer,soccer,True,-15.41624641418457,-20.77503776550293,5.358791351318359,14067712,EleutherAI/pythia-14m,step95000,seed4,4,95000
It was cough medicine.,medicine,medicine,It was medicine cough., cough medicine, medicine cough,cough,True,-22.931453704833984,-24.15737533569336,1.225921630859375,14067712,EleutherAI/pythia-14m,step95000,seed4,4,95000
It was prescription medicine.,medicine,medicine,It was medicine prescription., prescription medicine, medicine prescription,prescription,True,-18.230283737182617,-20.93288803100586,2.702604293823242,14067712,EleutherAI/pythia-14m,step95000,seed4,4,95000
It was orthopedic medicine.,medicine,medicine,It was medicine orthopedic., orthopedic medicine, medicine orthopedic,orthopedic,False,-22.11854362487793,-29.352685928344727,7.234142303466797,14067712,EleutherAI/pythia-14m,step95000,seed4,4,95000
There was a phone message.,message,message,There was a message phone., phone message, message phone,phone,True,-15.474714279174805,-18.10947036743164,2.634756088256836,14067712,EleutherAI/pythia-14m,step95000,seed4,4,95000
There was a computer message.,message,message,There was a message computer., computer message, message computer,computer,True,-16.572307586669922,-19.479106903076172,2.90679931640625,14067712,EleutherAI/pythia-14m,step95000,seed4,4,95000
There was an urgent message.,message,message,There was an message urgent., urgent message, message urgent,urgent,False,-12.964597702026367,-23.7333984375,10.768800735473633,14067712,EleutherAI/pythia-14m,step95000,seed4,4,95000
It was a fungal mold.,mold,mold,It was a mold fungal., fungal mold, mold fungal,fungal,False,-19.578529357910156,-24.00988006591797,4.4313507080078125,14067712,EleutherAI/pythia-14m,step95000,seed4,4,95000
It was a harmful mold.,mold,mold,It was a mold harmful., harmful mold, mold harmful,harmful,False,-20.795589447021484,-23.29375457763672,2.4981651306152344,14067712,EleutherAI/pythia-14m,step95000,seed4,4,95000
It was a rubber mold.,mold,mold,It was a mold rubber., rubber mold, mold rubber,rubber,True,-19.12911605834961,-22.26195526123047,3.1328392028808594,14067712,EleutherAI/pythia-14m,step95000,seed4,4,95000
She saw the cancerous mole.,mole,mole,She saw the mole cancerous., cancerous mole, mole cancerous,cancerous,False,-23.07868003845215,-25.773990631103516,2.695310592651367,14067712,EleutherAI/pythia-14m,step95000,seed4,4,95000
She saw the raised mole.,mole,mole,She saw the mole raised., raised mole, mole raised,raised,False,-20.49562644958496,-21.185726165771484,0.6900997161865234,14067712,EleutherAI/pythia-14m,step95000,seed4,4,95000
She saw the cute mole.,mole,mole,She saw the mole cute., cute mole, mole cute,cute,False,-20.124481201171875,-21.80898666381836,1.6845054626464844,14067712,EleutherAI/pythia-14m,step95000,seed4,4,95000
He liked the rhythmic movement.,movement,movement,He liked the movement rhythmic., rhythmic movement, movement rhythmic,rhythmic,False,-17.09223175048828,-23.119699478149414,6.027467727661133,14067712,EleutherAI/pythia-14m,step95000,seed4,4,95000
He liked the graceful movement.,movement,movement,He liked the movement graceful., graceful movement, movement graceful,graceful,False,-18.022180557250977,-23.79285430908203,5.770673751831055,14067712,EleutherAI/pythia-14m,step95000,seed4,4,95000
He liked the feminist movement.,movement,movement,He liked the movement feminist., feminist movement, movement feminist,feminist,True,-15.550029754638672,-22.88494110107422,7.334911346435547,14067712,EleutherAI/pythia-14m,step95000,seed4,4,95000
It was a national newspaper.,newspaper,newspaper,It was a newspaper national., national newspaper, newspaper national,national,False,-14.295135498046875,-18.222732543945312,3.9275970458984375,14067712,EleutherAI/pythia-14m,step95000,seed4,4,95000
It was a daily newspaper.,newspaper,newspaper,It was a newspaper daily., daily newspaper, newspaper daily,daily,False,-14.596866607666016,-17.897125244140625,3.3002586364746094,14067712,EleutherAI/pythia-14m,step95000,seed4,4,95000
It was a faded newspaper.,newspaper,newspaper,It was a newspaper faded., faded newspaper, newspaper faded,faded,False,-20.09596061706543,-21.12334442138672,1.027383804321289,14067712,EleutherAI/pythia-14m,step95000,seed4,4,95000
It was a juicy orange.,orange,orange,It was an orange juicy., juicy orange, orange juicy,juicy,False,-21.033187866210938,-17.428028106689453,-3.6051597595214844,14067712,EleutherAI/pythia-14m,step95000,seed4,4,95000
It was a ripe orange.,orange,orange,It was an orange ripe., ripe orange, orange ripe,ripe,False,-17.950984954833984,-16.290340423583984,-1.66064453125,14067712,EleutherAI/pythia-14m,step95000,seed4,4,95000
It was a bright orange.,orange,orange,It was an orange bright., bright orange, orange bright,bright,False,-15.197525024414062,-15.154415130615234,-0.043109893798828125,14067712,EleutherAI/pythia-14m,step95000,seed4,4,95000
He saw the young page.,page,page,He saw the page young., young page, page young,young,False,-20.363868713378906,-20.17861557006836,-0.18525314331054688,14067712,EleutherAI/pythia-14m,step95000,seed4,4,95000
He saw the loyal page.,page,page,He saw the page loyal., loyal page, page loyal,loyal,False,-24.828899383544922,-23.68282699584961,-1.1460723876953125,14067712,EleutherAI/pythia-14m,step95000,seed4,4,95000
He saw the blank page.,page,page,He saw the page blank., blank page, page blank,blank,False,-15.307573318481445,-16.965023040771484,1.657449722290039,14067712,EleutherAI/pythia-14m,step95000,seed4,4,95000
It was a calloused palm.,palm,palm,It was a palm calloused., calloused palm, palm calloused,calloused,False,-27.494342803955078,-28.237136840820312,0.7427940368652344,14067712,EleutherAI/pythia-14m,step95000,seed4,4,95000
It was a wrinkled palm.,palm,palm,It was a palm wrinkled., wrinkled palm, palm wrinkled,wrinkled,False,-22.31796646118164,-23.0340576171875,0.7160911560058594,14067712,EleutherAI/pythia-14m,step95000,seed4,4,95000
It was a tropical palm.,palm,palm,It was a palm tropical., tropical palm, palm tropical,tropical,False,-22.08469581604004,-21.561737060546875,-0.5229587554931641,14067712,EleutherAI/pythia-14m,step95000,seed4,4,95000
It was a control panel.,panel,panel,It was a panel control., control panel, panel control,control,True,-14.534693717956543,-20.03989028930664,5.505196571350098,14067712,EleutherAI/pythia-14m,step95000,seed4,4,95000
It was an instrument panel.,panel,panel,It was an panel instrument., instrument panel, panel instrument,instrument,False,-16.43718719482422,-21.341045379638672,4.903858184814453,14067712,EleutherAI/pythia-14m,step95000,seed4,4,95000
It was an advisory panel.,panel,panel,It was an panel advisory., advisory panel, panel advisory,advisory,False,-12.850221633911133,-22.817577362060547,9.967355728149414,14067712,EleutherAI/pythia-14m,step95000,seed4,4,95000
It was a secret passage.,passage,passage,It was a passage secret., secret passage, passage secret,secret,False,-17.26239585876465,-22.700273513793945,5.437877655029297,14067712,EleutherAI/pythia-14m,step95000,seed4,4,95000
It was a narrow passage.,passage,passage,It was a passage narrow., narrow passage, passage narrow,narrow,False,-15.969210624694824,-21.45829200744629,5.489081382751465,14067712,EleutherAI/pythia-14m,step95000,seed4,4,95000
It was a literary passage.,passage,passage,It was a passage literary., literary passage, passage literary,literary,False,-18.86367416381836,-24.8630313873291,5.999357223510742,14067712,EleutherAI/pythia-14m,step95000,seed4,4,95000
It was a tasty perch.,perch,perch,It was a perch tasty., tasty perch, perch tasty,tasty,False,-21.942733764648438,-23.043331146240234,1.1005973815917969,14067712,EleutherAI/pythia-14m,step95000,seed4,4,95000
It was a freshwater perch.,perch,perch,It was a perch freshwater., freshwater perch, perch freshwater,freshwater,True,-22.0762996673584,-24.75009536743164,2.673795700073242,14067712,EleutherAI/pythia-14m,step95000,seed4,4,95000
It was a lofty perch.,perch,perch,It was a perch lofty., lofty perch, perch lofty,lofty,False,-23.607271194458008,-25.77798080444336,2.1707096099853516,14067712,EleutherAI/pythia-14m,step95000,seed4,4,95000
He saw the fast pitcher.,pitcher,pitcher,He saw the pitcher fast., fast pitcher, pitcher fast,fast,False,-18.978927612304688,-21.384201049804688,2.4052734375,14067712,EleutherAI/pythia-14m,step95000,seed4,4,95000
He saw the right-handed pitcher.,pitcher,pitcher,He saw the pitcher right-handed., right-handed pitcher, pitcher right-handed,right-handed,False,-21.970590591430664,-28.678956985473633,6.708366394042969,14067712,EleutherAI/pythia-14m,step95000,seed4,4,95000
He saw the glass pitcher.,pitcher,pitcher,He saw the pitcher glass., glass pitcher, pitcher glass,glass,True,-21.282325744628906,-24.226226806640625,2.9439010620117188,14067712,EleutherAI/pythia-14m,step95000,seed4,4,95000
It was a windy port.,port,port,It was a port windy., windy port, port windy,windy,False,-20.20875358581543,-25.481430053710938,5.272676467895508,14067712,EleutherAI/pythia-14m,step95000,seed4,4,95000
It was a seaside port.,port,port,It was a port seaside., seaside port, port seaside,seaside,True,-22.453567504882812,-26.33074378967285,3.877176284790039,14067712,EleutherAI/pythia-14m,step95000,seed4,4,95000
It was a delicious port.,port,port,It was a port delicious., delicious port, port delicious,delicious,False,-20.0953426361084,-24.915180206298828,4.81983757019043,14067712,EleutherAI/pythia-14m,step95000,seed4,4,95000
He was in a distinguished position.,position,position,He was in a position distinguished., distinguished position, position distinguished,distinguished,False,-15.868549346923828,-19.718137741088867,3.849588394165039,14067712,EleutherAI/pythia-14m,step95000,seed4,4,95000
He was in a prominent position.,position,position,He was in a position prominent., prominent position, position prominent,prominent,False,-15.532571792602539,-19.588285446166992,4.055713653564453,14067712,EleutherAI/pythia-14m,step95000,seed4,4,95000
He was in a fetal position.,position,position,He was in a position fetal., fetal position, position fetal,fetal,False,-16.424152374267578,-20.72175407409668,4.297601699829102,14067712,EleutherAI/pythia-14m,step95000,seed4,4,95000
It was a wooden post.,post,post,It was a post wooden., wooden post, post wooden,wooden,False,-17.22520637512207,-20.53166389465332,3.30645751953125,14067712,EleutherAI/pythia-14m,step95000,seed4,4,95000
It was a fence post.,post,post,It was a post fence., fence post, post fence,fence,True,-20.366649627685547,-21.840227127075195,1.4735774993896484,14067712,EleutherAI/pythia-14m,step95000,seed4,4,95000
It was a teaching post.,post,post,It was a post teaching., teaching post, post teaching,teaching,True,-17.207551956176758,-19.21843147277832,2.0108795166015625,14067712,EleutherAI/pythia-14m,step95000,seed4,4,95000
He had the alcoholic punch.,punch,punch,He had the punch alcoholic., alcoholic punch, punch alcoholic,alcoholic,False,-22.039268493652344,-25.16554832458496,3.126279830932617,14067712,EleutherAI/pythia-14m,step95000,seed4,4,95000
He had the fruit punch.,punch,punch,He had the punch fruit., fruit punch, punch fruit,fruit,True,-19.168838500976562,-21.502256393432617,2.3334178924560547,14067712,EleutherAI/pythia-14m,step95000,seed4,4,95000
He had the strongest punch.,punch,punch,He had the punch strongest., strongest punch, punch strongest,strongest,False,-16.404666900634766,-23.026594161987305,6.621927261352539,14067712,EleutherAI/pythia-14m,step95000,seed4,4,95000
She had a brilliant pupil.,pupil,pupil,She had a pupil brilliant., brilliant pupil, pupil brilliant,brilliant,False,-16.64138412475586,-22.2735538482666,5.632169723510742,14067712,EleutherAI/pythia-14m,step95000,seed4,4,95000
She had an interested pupil.,pupil,pupil,She had an pupil interested., interested pupil, pupil interested,interested,False,-17.579059600830078,-23.43044090270996,5.851381301879883,14067712,EleutherAI/pythia-14m,step95000,seed4,4,95000
She had a dilated pupil.,pupil,pupil,She had a pupil dilated., dilated pupil, pupil dilated,dilated,False,-20.974822998046875,-22.067689895629883,1.0928668975830078,14067712,EleutherAI/pythia-14m,step95000,seed4,4,95000
That was a loud racket.,racket,racket,That was a racket loud., loud racket, racket loud,loud,False,-18.491065979003906,-22.924030303955078,4.432964324951172,14067712,EleutherAI/pythia-14m,step95000,seed4,4,95000
That was an annoying racket.,racket,racket,That was an racket annoying., annoying racket, racket annoying,annoying,False,-16.480918884277344,-24.37606430053711,7.895145416259766,14067712,EleutherAI/pythia-14m,step95000,seed4,4,95000
That was a badminton racket.,racket,racket,That was a racket badminton., badminton racket, racket badminton,badminton,True,-24.817001342773438,-27.454944610595703,2.6379432678222656,14067712,EleutherAI/pythia-14m,step95000,seed4,4,95000
He liked electronic rock.,rock,rock,He liked rock electronic., electronic rock, rock electronic,electronic,False,-24.049039840698242,-23.154403686523438,-0.8946361541748047,14067712,EleutherAI/pythia-14m,step95000,seed4,4,95000
He liked alternative rock.,rock,rock,He liked rock alternative., alternative rock, rock alternative,alternative,False,-24.14423370361328,-23.870941162109375,-0.27329254150390625,14067712,EleutherAI/pythia-14m,step95000,seed4,4,95000
He liked limestone rock.,rock,rock,He liked rock limestone., limestone rock, rock limestone,limestone,True,-20.863880157470703,-24.07221221923828,3.208332061767578,14067712,EleutherAI/pythia-14m,step95000,seed4,4,95000
He saw the wise sage.,sage,sage,He saw the sage wise., wise sage, sage wise,wise,False,-20.632831573486328,-22.361370086669922,1.7285385131835938,14067712,EleutherAI/pythia-14m,step95000,seed4,4,95000
He saw the renowned sage.,sage,sage,He saw the sage renowned., renowned sage, sage renowned,renowned,False,-21.594036102294922,-25.702274322509766,4.108238220214844,14067712,EleutherAI/pythia-14m,step95000,seed4,4,95000
He saw the fragrant sage.,sage,sage,He saw the sage fragrant., fragrant sage, sage fragrant,fragrant,False,-21.275211334228516,-26.185344696044922,4.910133361816406,14067712,EleutherAI/pythia-14m,step95000,seed4,4,95000
It was a fish scale.,scale,scale,It was a scale fish., fish scale, scale fish,fish,True,-19.82394027709961,-19.486717224121094,-0.3372230529785156,14067712,EleutherAI/pythia-14m,step95000,seed4,4,95000
It was a lizard scale.,scale,scale,It was a scale lizard., lizard scale, scale lizard,lizard,True,-23.376419067382812,-24.12169647216797,0.7452774047851562,14067712,EleutherAI/pythia-14m,step95000,seed4,4,95000
It was a music scale.,scale,scale,It was a scale music., music scale, scale music,music,True,-17.395719528198242,-16.61699676513672,-0.7787227630615234,14067712,EleutherAI/pythia-14m,step95000,seed4,4,95000
It was a touching scene.,scene,scene,It was a scene touching., touching scene, scene touching,touching,False,-17.84647560119629,-20.258506774902344,2.4120311737060547,14067712,EleutherAI/pythia-14m,step95000,seed4,4,95000
It was a well-acted scene.,scene,scene,It was a scene well-acted., well-acted scene, scene well-acted,well-acted,False,-25.290616989135742,-27.88726806640625,2.596651077270508,14067712,EleutherAI/pythia-14m,step95000,seed4,4,95000
It was a nature scene.,scene,scene,It was a scene nature., nature scene, scene nature,nature,True,-18.278560638427734,-20.02674102783203,1.7481803894042969,14067712,EleutherAI/pythia-14m,step95000,seed4,4,95000
It was a gold seal.,seal,seal,It was a seal gold., gold seal, seal gold,gold,True,-15.191521644592285,-21.841815948486328,6.650294303894043,14067712,EleutherAI/pythia-14m,step95000,seed4,4,95000
It was a certified seal.,seal,seal,It was a seal certified., certified seal, seal certified,certified,False,-19.238636016845703,-23.12032699584961,3.8816909790039062,14067712,EleutherAI/pythia-14m,step95000,seed4,4,95000
It was a circus seal.,seal,seal,It was a seal circus., circus seal, seal circus,circus,True,-23.298282623291016,-24.24747085571289,0.949188232421875,14067712,EleutherAI/pythia-14m,step95000,seed4,4,95000
He used the scotch tape.,tape,tape,He used the tape scotch., scotch tape, tape scotch,scotch,True,-27.435636520385742,-26.69939422607422,-0.7362422943115234,14067712,EleutherAI/pythia-14m,step95000,seed4,4,95000
He used the double-sided tape.,tape,tape,He used the tape double-sided., double-sided tape, tape double-sided,double-sided,False,-21.84210205078125,-25.447229385375977,3.6051273345947266,14067712,EleutherAI/pythia-14m,step95000,seed4,4,95000
He used the interview tape.,tape,tape,He used the tape interview., interview tape, tape interview,interview,True,-17.96366310119629,-19.79328155517578,1.8296184539794922,14067712,EleutherAI/pythia-14m,step95000,seed4,4,95000
It was a winter term.,term,term,It was a term winter., winter term, term winter,winter,True,-18.090877532958984,-22.241287231445312,4.150409698486328,14067712,EleutherAI/pythia-14m,step95000,seed4,4,95000
