sentence,word,string,reversed_sentence,mod_np,reversed_mod,disambiguating_word,non_adjective,original_logprob,reversed_logprob,ratio,n_params,mpath,revision,seed_name,seed,step
It was a fall term.,term,term,It was a term fall., fall term, term fall,fall,True,-16.889305114746094,-18.948528289794922,2.059223175048828,14067712,EleutherAI/pythia-14m,step29000,seed7,7,29000
It was a legal term.,term,term,It was a term legal., legal term, term legal,legal,False,-16.486228942871094,-17.96509552001953,1.4788665771484375,14067712,EleutherAI/pythia-14m,step29000,seed7,7,29000
It was a clock tick.,tick,tick,It was a tick clock., clock tick, tick clock,clock,True,-15.868867874145508,-18.619327545166016,2.750459671020508,14067712,EleutherAI/pythia-14m,step29000,seed7,7,29000
It was an audible tick.,tick,tick,It was an tick audible., audible tick, tick audible,audible,False,-17.905094146728516,-26.24072265625,8.335628509521484,14067712,EleutherAI/pythia-14m,step29000,seed7,7,29000
It was a parasitic tick.,tick,tick,It was a tick parasitic., parasitic tick, tick parasitic,parasitic,False,-19.707664489746094,-24.29693603515625,4.589271545410156,14067712,EleutherAI/pythia-14m,step29000,seed7,7,29000
It was a generous tip.,tip,tip,It was a tip generous., generous tip, tip generous,generous,False,-18.37562370300293,-25.853511810302734,7.477888107299805,14067712,EleutherAI/pythia-14m,step29000,seed7,7,29000
It was a stingy tip.,tip,tip,It was a tip stingy., stingy tip, tip stingy,stingy,False,-18.950252532958984,-24.783695220947266,5.833442687988281,14067712,EleutherAI/pythia-14m,step29000,seed7,7,29000
It was a pencil tip.,tip,tip,It was a tip pencil., pencil tip, tip pencil,pencil,True,-18.009845733642578,-19.303598403930664,1.293752670288086,14067712,EleutherAI/pythia-14m,step29000,seed7,7,29000
She liked the essay title.,title,title,She liked the title essay., essay title, title essay,essay,True,-19.938018798828125,-17.972265243530273,-1.9657535552978516,14067712,EleutherAI/pythia-14m,step29000,seed7,7,29000
She liked the poem title.,title,title,She liked the title poem., poem title, title poem,poem,True,-19.80319595336914,-17.75115394592285,-2.052042007446289,14067712,EleutherAI/pythia-14m,step29000,seed7,7,29000
She liked the academic title.,title,title,She liked the title academic., academic title, title academic,academic,False,-17.492189407348633,-19.768949508666992,2.2767601013183594,14067712,EleutherAI/pythia-14m,step29000,seed7,7,29000
It was a costly toll.,toll,toll,It was a toll costly., costly toll, toll costly,costly,False,-20.407913208007812,-23.90847396850586,3.500560760498047,14067712,EleutherAI/pythia-14m,step29000,seed7,7,29000
It was a road toll.,toll,toll,It was a toll road., road toll, toll road,road,True,-18.446006774902344,-18.63273048400879,0.1867237091064453,14067712,EleutherAI/pythia-14m,step29000,seed7,7,29000
It was a loud toll.,toll,toll,It was a toll loud., loud toll, toll loud,loud,False,-23.234508514404297,-26.864662170410156,3.6301536560058594,14067712,EleutherAI/pythia-14m,step29000,seed7,7,29000
She saw the train tracks.,track,tracks,She saw the tracks train., train tracks, tracks train,train,True,-16.067529678344727,-20.67559242248535,4.608062744140625,14067712,EleutherAI/pythia-14m,step29000,seed7,7,29000
She saw the trolley tracks.,track,tracks,She saw the tracks trolley., trolley tracks, tracks trolley,trolley,True,-25.707557678222656,-27.78716278076172,2.0796051025390625,14067712,EleutherAI/pythia-14m,step29000,seed7,7,29000
She saw the moose tracks.,track,tracks,She saw the tracks moose., moose tracks, tracks moose,moose,False,-23.0413818359375,-24.93394660949707,1.8925647735595703,14067712,EleutherAI/pythia-14m,step29000,seed7,7,29000
It was five yards.,yard,yards,It was yards five., five yards, yards five,five,True,-19.133316040039062,-23.330841064453125,4.1975250244140625,14067712,EleutherAI/pythia-14m,step29000,seed7,7,29000
It was ten yards.,yard,yards,It was yards ten., ten yards, yards ten,ten,True,-15.440814018249512,-24.21051025390625,8.769696235656738,14067712,EleutherAI/pythia-14m,step29000,seed7,7,29000
They were big yards.,yard,yards,They were yards big., big yards, yards big,big,False,-16.059391021728516,-22.241310119628906,6.181919097900391,14067712,EleutherAI/pythia-14m,step29000,seed7,7,29000
It was a comedic act.,act,act,It was an act comedic., comedic act, act comedic,comedic,False,-18.01177406311035,-21.4714412689209,3.459667205810547,14067712,EleutherAI/pythia-14m,step29000,seed7,7,29000
He had a pending appeal.,appeal,appeal,He had an appeal pending., pending appeal, appeal pending,pending,False,-15.70272445678711,-12.595409393310547,-3.1073150634765625,14067712,EleutherAI/pythia-14m,step29000,seed7,7,29000
It was a polluted atmosphere.,atmosphere,atmosphere,It was an atmosphere polluted., polluted atmosphere, atmosphere polluted,polluted,False,-27.433408737182617,-26.810646057128906,-0.6227626800537109,14067712,EleutherAI/pythia-14m,step29000,seed7,7,29000
It was a country band.,band,band,It was a band country., country band, band country,country,True,-19.311723709106445,-17.818241119384766,-1.4934825897216797,14067712,EleutherAI/pythia-14m,step29000,seed7,7,29000
There was a religious barrier.,barrier,barrier,There was a barrier religious., religious barrier, barrier religious,religious,False,-18.383411407470703,-23.73592185974121,5.352510452270508,14067712,EleutherAI/pythia-14m,step29000,seed7,7,29000
He saw a baseball bat.,bat,bat,He saw a bat baseball., baseball bat, bat baseball,baseball,True,-10.209223747253418,-19.4012393951416,9.192015647888184,14067712,EleutherAI/pythia-14m,step29000,seed7,7,29000
He saw the balance beam.,beam,beam,He saw the beam balance., balance beam, beam balance,balance,True,-22.16982650756836,-20.680540084838867,-1.4892864227294922,14067712,EleutherAI/pythia-14m,step29000,seed7,7,29000
She had a writer's block.,block,block,She had a block writer's., writer's block, block writer's,writer,True,-23.301244735717773,-25.01803970336914,1.7167949676513672,14067712,EleutherAI/pythia-14m,step29000,seed7,7,29000
He has royal blood.,blood,blood,He has blood royal., royal blood, blood royal,royal,False,-20.399707794189453,-22.810571670532227,2.4108638763427734,14067712,EleutherAI/pythia-14m,step29000,seed7,7,29000
It was the school board.,board,board,It was the board school., school board, board school,school,True,-12.524356842041016,-16.889873504638672,4.365516662597656,14067712,EleutherAI/pythia-14m,step29000,seed7,7,29000
He had a leather-bound book.,book,book,He had a book leather-bound., leather-bound book, book leather-bound,leather-bound,False,-23.37875747680664,-27.48398780822754,4.105230331420898,14067712,EleutherAI/pythia-14m,step29000,seed7,7,29000
They ate a lonely breakfast.,breakfast,breakfast,They ate a breakfast lonely., lonely breakfast, breakfast lonely,lonely,False,-13.235542297363281,-20.176597595214844,6.9410552978515625,14067712,EleutherAI/pythia-14m,step29000,seed7,7,29000
It was an island cape.,cape,cape,It was an cape island., island cape, cape island,island,True,-20.912109375,-26.33076286315918,5.41865348815918,14067712,EleutherAI/pythia-14m,step29000,seed7,7,29000
It was a criminal case.,case,case,It was a case criminal., criminal case, case criminal,criminal,False,-10.304251670837402,-14.249074935913086,3.9448232650756836,14067712,EleutherAI/pythia-14m,step29000,seed7,7,29000
It was a primary cause.,cause,cause,It was a cause primary., primary cause, cause primary,primary,False,-13.038884162902832,-23.788467407226562,10.74958324432373,14067712,EleutherAI/pythia-14m,step29000,seed7,7,29000
It was a jail cell.,cell,cell,It was a cell jail., jail cell, cell jail,jail,True,-15.98786449432373,-16.713293075561523,0.725428581237793,14067712,EleutherAI/pythia-14m,step29000,seed7,7,29000
She had a good-luck charm.,charm,charm,She had a charm good-luck., good-luck charm, charm good-luck,good-luck,False,-27.62179946899414,-30.979843139648438,3.358043670654297,14067712,EleutherAI/pythia-14m,step29000,seed7,7,29000
They liked the pet chicken.,chicken,chicken,They liked the chicken pet., pet chicken, chicken pet,pet,True,-20.735628128051758,-18.6534423828125,-2.082185745239258,14067712,EleutherAI/pythia-14m,step29000,seed7,7,29000
It was a stimulating class.,class,class,It was a class stimulating., stimulating class, class stimulating,stimulating,False,-18.05447769165039,-22.411476135253906,4.356998443603516,14067712,EleutherAI/pythia-14m,step29000,seed7,7,29000
It was a metal clip.,clip,clip,It was a clip metal., metal clip, clip metal,metal,True,-18.43590545654297,-21.209896087646484,2.7739906311035156,14067712,EleutherAI/pythia-14m,step29000,seed7,7,29000
It was a common cold.,cold,cold,It was a cold common., common cold, cold common,common,False,-14.704166412353516,-18.086700439453125,3.3825340270996094,14067712,EleutherAI/pythia-14m,step29000,seed7,7,29000
It was a marble column.,column,column,It was a column marble., marble column, column marble,marble,True,-18.0384521484375,-21.328853607177734,3.2904014587402344,14067712,EleutherAI/pythia-14m,step29000,seed7,7,29000
He liked the polite company.,company,company,He liked the company polite., polite company, company polite,polite,False,-16.265869140625,-20.43035316467285,4.164484024047852,14067712,EleutherAI/pythia-14m,step29000,seed7,7,29000
It was a traffic cone.,cone,cone,It was a cone traffic., traffic cone, cone traffic,traffic,True,-18.064348220825195,-22.984203338623047,4.919855117797852,14067712,EleutherAI/pythia-14m,step29000,seed7,7,29000
He made a well-written contribution.,contribution,contribution,He made a contribution well-written., well-written contribution, contribution well-written,well-written,False,-20.197986602783203,-30.31574058532715,10.117753982543945,14067712,EleutherAI/pythia-14m,step29000,seed7,7,29000
That was the correct count.,count,count,That was the count correct., correct count, count correct,correct,False,-14.779953956604004,-19.973918914794922,5.193964958190918,14067712,EleutherAI/pythia-14m,step29000,seed7,7,29000
It was a collision course.,course,course,It was a course collision., collision course, course collision,collision,True,-15.405588150024414,-19.081710815429688,3.6761226654052734,14067712,EleutherAI/pythia-14m,step29000,seed7,7,29000
It was a historical date.,date,date,It was a date historical., historical date, date historical,historical,False,-18.341495513916016,-21.007949829101562,2.666454315185547,14067712,EleutherAI/pythia-14m,step29000,seed7,7,29000
It was about college degrees.,degree,degrees,It was about degrees college., college degrees, degrees college,college,True,-15.445756912231445,-20.994129180908203,5.548372268676758,14067712,EleutherAI/pythia-14m,step29000,seed7,7,29000
They liked the architectural design.,design,design,They liked the design architectural., architectural design, design architectural,architectural,False,-16.246103286743164,-21.374691009521484,5.12858772277832,14067712,EleutherAI/pythia-14m,step29000,seed7,7,29000
They liked the anniversary dinner.,dinner,dinner,They liked the dinner anniversary., anniversary dinner, dinner anniversary,anniversary,True,-21.059673309326172,-23.27058982849121,2.210916519165039,14067712,EleutherAI/pythia-14m,step29000,seed7,7,29000
He had a career dream.,dream,dream,He had a dream career., career dream, dream career,career,True,-15.41579532623291,-17.766786575317383,2.3509912490844727,14067712,EleutherAI/pythia-14m,step29000,seed7,7,29000
It was a battery-powered drill.,drill,drill,It was a drill battery-powered., battery-powered drill, drill battery-powered,battery-powered,False,-24.06319808959961,-29.944822311401367,5.881624221801758,14067712,EleutherAI/pythia-14m,step29000,seed7,7,29000
It was a physical examination.,examination,examination,It was an examination physical., physical examination, examination physical,physical,False,-12.61060905456543,-18.7822265625,6.17161750793457,14067712,EleutherAI/pythia-14m,step29000,seed7,7,29000
They had an enthusiastic fan.,fan,fan,They had an fan enthusiastic., enthusiastic fan, fan enthusiastic,enthusiastic,False,-16.30126953125,-27.628467559814453,11.327198028564453,14067712,EleutherAI/pythia-14m,step29000,seed7,7,29000
She had a steel file.,file,file,She had a file steel., steel file, file steel,steel,True,-19.300466537475586,-25.928741455078125,6.628274917602539,14067712,EleutherAI/pythia-14m,step29000,seed7,7,29000
It was a plastic film.,film,film,It was a film plastic., plastic film, film plastic,plastic,False,-14.30042839050293,-17.93187141418457,3.6314430236816406,14067712,EleutherAI/pythia-14m,step29000,seed7,7,29000
It was a concrete foundation.,foundation,foundation,It was a foundation concrete., concrete foundation, foundation concrete,concrete,False,-13.796514511108398,-19.581012725830078,5.78449821472168,14067712,EleutherAI/pythia-14m,step29000,seed7,7,29000
It was a business function.,function,function,It was a function business., business function, function business,business,True,-15.791951179504395,-20.253807067871094,4.461855888366699,14067712,EleutherAI/pythia-14m,step29000,seed7,7,29000
He was on the parade ground.,ground,ground,He was on the ground parade., parade ground, ground parade,parade,True,-17.71089744567871,-18.424678802490234,0.7137813568115234,14067712,EleutherAI/pythia-14m,step29000,seed7,7,29000
They liked the national guard.,guard,guard,They liked the guard national., national guard, guard national,national,False,-18.45287322998047,-23.34112548828125,4.888252258300781,14067712,EleutherAI/pythia-14m,step29000,seed7,7,29000
He had a friendly guide.,guide,guide,He had a guide friendly., friendly guide, guide friendly,friendly,False,-14.376194953918457,-20.43857192993164,6.062376976013184,14067712,EleutherAI/pythia-14m,step29000,seed7,7,29000
It was a nursing home.,home,home,It was a home nursing., nursing home, home nursing,nursing,True,-12.672708511352539,-17.872440338134766,5.199731826782227,14067712,EleutherAI/pythia-14m,step29000,seed7,7,29000
They had military intelligence.,intelligence,intelligence,They had intelligence military., military intelligence, intelligence military,military,False,-15.88768196105957,-20.09551429748535,4.207832336425781,14067712,EleutherAI/pythia-14m,step29000,seed7,7,29000
It was a special issue.,issue,issue,It was an issue special., special issue, issue special,special,False,-12.668535232543945,-16.655488967895508,3.9869537353515625,14067712,EleutherAI/pythia-14m,step29000,seed7,7,29000
It was a paper jam.,jam,jam,It was a jam paper., paper jam, jam paper,paper,True,-19.142837524414062,-20.92790985107422,1.7850723266601562,14067712,EleutherAI/pythia-14m,step29000,seed7,7,29000
It was a backspace key.,key,key,It was a key backspace., backspace key, key backspace,backspace,True,-26.521236419677734,-21.443954467773438,-5.077281951904297,14067712,EleutherAI/pythia-14m,step29000,seed7,7,29000
They liked the friendly lamb.,lamb,lamb,They liked the lamb friendly., friendly lamb, lamb friendly,friendly,False,-19.45037078857422,-22.822311401367188,3.3719406127929688,14067712,EleutherAI/pythia-14m,step29000,seed7,7,29000
She had door locks.,lock,locks,She had locks door., door locks, locks door,door,True,-20.542346954345703,-19.84221839904785,-0.7001285552978516,14067712,EleutherAI/pythia-14m,step29000,seed7,7,29000
They liked the women's lunch.,lunch,lunch,They liked the lunch women's., women's lunch, lunch women's,women,True,-16.456951141357422,-23.305818557739258,6.848867416381836,14067712,EleutherAI/pythia-14m,step29000,seed7,7,29000
He liked the stock market.,market,market,He liked the market stock., stock market, market stock,stock,True,-13.409897804260254,-14.859718322753906,1.4498205184936523,14067712,EleutherAI/pythia-14m,step29000,seed7,7,29000
It was a tennis match.,match,match,It was a match tennis., tennis match, match tennis,tennis,True,-14.903938293457031,-17.89232635498047,2.9883880615234375,14067712,EleutherAI/pythia-14m,step29000,seed7,7,29000
It was veterinary medicine.,medicine,medicine,It was medicine veterinary., veterinary medicine, medicine veterinary,veterinary,False,-16.680984497070312,-20.89651107788086,4.215526580810547,14067712,EleutherAI/pythia-14m,step29000,seed7,7,29000
There was a clear message.,message,message,There was a message clear., clear message, message clear,clear,False,-12.144798278808594,-18.815021514892578,6.670223236083984,14067712,EleutherAI/pythia-14m,step29000,seed7,7,29000
It was a clay mold.,mold,mold,It was a mold clay., clay mold, mold clay,clay,True,-17.40522003173828,-21.31298065185547,3.9077606201171875,14067712,EleutherAI/pythia-14m,step29000,seed7,7,29000
She saw the fast mole.,mole,mole,She saw the mole fast., fast mole, mole fast,fast,False,-20.589202880859375,-21.59467315673828,1.0054702758789062,14067712,EleutherAI/pythia-14m,step29000,seed7,7,29000
He liked the civil-rights movement.,movement,movement,He liked the movement civil-rights., civil-rights movement, movement civil-rights,civil-rights,False,-23.433889389038086,-33.68559646606445,10.251707077026367,14067712,EleutherAI/pythia-14m,step29000,seed7,7,29000
It was a shredded newspaper.,newspaper,newspaper,It was a newspaper shredded., shredded newspaper, newspaper shredded,shredded,False,-21.773475646972656,-22.552091598510742,0.7786159515380859,14067712,EleutherAI/pythia-14m,step29000,seed7,7,29000
It was a reddish orange.,orange,orange,It was an orange reddish., reddish orange, orange reddish,reddish,False,-19.509103775024414,-19.874521255493164,0.36541748046875,14067712,EleutherAI/pythia-14m,step29000,seed7,7,29000
He saw the ripped page.,page,page,He saw the page ripped., ripped page, page ripped,ripped,False,-21.791584014892578,-20.588516235351562,-1.2030677795410156,14067712,EleutherAI/pythia-14m,step29000,seed7,7,29000
It was a tree palm.,palm,palm,It was a palm tree., tree palm, palm tree,tree,True,-18.500459671020508,-12.218094825744629,-6.282364845275879,14067712,EleutherAI/pythia-14m,step29000,seed7,7,29000
It was a consumer panel.,panel,panel,It was a panel consumer., consumer panel, panel consumer,consumer,True,-19.490232467651367,-22.58116912841797,3.0909366607666016,14067712,EleutherAI/pythia-14m,step29000,seed7,7,29000
It was a biblical passage.,passage,passage,It was a passage biblical., biblical passage, passage biblical,biblical,False,-17.760765075683594,-24.141084671020508,6.380319595336914,14067712,EleutherAI/pythia-14m,step29000,seed7,7,29000
It was a secure perch.,perch,perch,It was a perch secure., secure perch, perch secure,secure,False,-24.296371459960938,-25.96072006225586,1.6643486022949219,14067712,EleutherAI/pythia-14m,step29000,seed7,7,29000
He saw the plastic pitcher.,pitcher,pitcher,He saw the pitcher plastic., plastic pitcher, pitcher plastic,plastic,True,-19.72245216369629,-24.981746673583984,5.259294509887695,14067712,EleutherAI/pythia-14m,step29000,seed7,7,29000
It was a sweet port.,port,port,It was a port sweet., sweet port, port sweet,sweet,False,-18.592811584472656,-23.061443328857422,4.468631744384766,14067712,EleutherAI/pythia-14m,step29000,seed7,7,29000
He was in a yoga position.,position,position,He was in a position yoga., yoga position, position yoga,yoga,True,-18.777774810791016,-20.537216186523438,1.7594413757324219,14067712,EleutherAI/pythia-14m,step29000,seed7,7,29000
It was a challenging post.,post,post,It was a post challenging., challenging post, post challenging,challenging,False,-18.364212036132812,-19.903026580810547,1.5388145446777344,14067712,EleutherAI/pythia-14m,step29000,seed7,7,29000
He had the quickest punch.,punch,punch,He had the punch quickest., quickest punch, punch quickest,quickest,False,-18.18218421936035,-25.692323684692383,7.510139465332031,14067712,EleutherAI/pythia-14m,step29000,seed7,7,29000
She had a cloudy pupil.,pupil,pupil,She had a pupil cloudy., cloudy pupil, pupil cloudy,cloudy,False,-24.84670639038086,-29.466951370239258,4.620244979858398,14067712,EleutherAI/pythia-14m,step29000,seed7,7,29000
That was a tennis racket.,racket,racket,That was a racket tennis., tennis racket, racket tennis,tennis,True,-16.6060791015625,-24.27374839782715,7.667669296264648,14067712,EleutherAI/pythia-14m,step29000,seed7,7,29000
He liked granite rock.,rock,rock,He liked rock granite., granite rock, rock granite,granite,True,-19.42603302001953,-22.416719436645508,2.9906864166259766,14067712,EleutherAI/pythia-14m,step29000,seed7,7,29000
He saw the bushy sage.,sage,sage,He saw the sage bushy., bushy sage, sage bushy,bushy,False,-28.86089324951172,-28.342741012573242,-0.5181522369384766,14067712,EleutherAI/pythia-14m,step29000,seed7,7,29000
It was a major scale.,scale,scale,It was a scale major., major scale, scale major,major,False,-14.603643417358398,-23.227176666259766,8.623533248901367,14067712,EleutherAI/pythia-14m,step29000,seed7,7,29000
It was a panoramic scene.,scene,scene,It was a scene panoramic., panoramic scene, scene panoramic,panoramic,False,-19.478954315185547,-22.773983001708984,3.2950286865234375,14067712,EleutherAI/pythia-14m,step29000,seed7,7,29000
It was a trained seal.,seal,seal,It was a seal trained., trained seal, seal trained,trained,False,-20.20618438720703,-24.81665802001953,4.6104736328125,14067712,EleutherAI/pythia-14m,step29000,seed7,7,29000
He used the video tape.,tape,tape,He used the tape video., video tape, tape video,video,True,-15.068225860595703,-17.915802001953125,2.847576141357422,14067712,EleutherAI/pythia-14m,step29000,seed7,7,29000
It was a technical term.,term,term,It was a term technical., technical term, term technical,technical,False,-18.03655242919922,-19.83036994934082,1.7938175201416016,14067712,EleutherAI/pythia-14m,step29000,seed7,7,29000
It was a diseased tick.,tick,tick,It was a tick diseased., diseased tick, tick diseased,diseased,False,-22.13625717163086,-26.652389526367188,4.516132354736328,14067712,EleutherAI/pythia-14m,step29000,seed7,7,29000
It was a finger tip.,tip,tip,It was a tip finger., finger tip, tip finger,finger,True,-19.914836883544922,-18.59079933166504,-1.3240375518798828,14067712,EleutherAI/pythia-14m,step29000,seed7,7,29000
She liked the professional title.,title,title,She liked the title professional., professional title, title professional,professional,False,-16.57268524169922,-18.606481552124023,2.0337963104248047,14067712,EleutherAI/pythia-14m,step29000,seed7,7,29000
It was a bell toll.,toll,toll,It was a toll bell., bell toll, toll bell,bell,True,-21.205142974853516,-21.782712936401367,0.5775699615478516,14067712,EleutherAI/pythia-14m,step29000,seed7,7,29000
She saw the snowshoe tracks.,track,tracks,She saw the tracks snowshoe., snowshoe tracks, tracks snowshoe,snowshoe,True,-30.93059539794922,-35.97770690917969,5.047111511230469,14067712,EleutherAI/pythia-14m,step29000,seed7,7,29000
They were cluttered yards.,yard,yards,They were yards cluttered., cluttered yards, yards cluttered,cluttered,False,-24.571922302246094,-28.0306339263916,3.458711624145508,14067712,EleutherAI/pythia-14m,step29000,seed7,7,29000
