sentence,word,string,reversed_sentence,mod_np,reversed_mod,disambiguating_word,non_adjective,original_logprob,reversed_logprob,ratio,n_params,mpath,revision,seed_name,seed,step
It was a social function.,function,function,It was a function social., social function, function social,social,False,-13.83476448059082,-19.7952880859375,5.96052360534668,14067712,EleutherAI/pythia-14m,step68000,seed5,5,68000
He was on the firm ground.,ground,ground,He was on the ground firm., firm ground, ground firm,firm,False,-15.732396125793457,-16.722265243530273,0.9898691177368164,14067712,EleutherAI/pythia-14m,step68000,seed5,5,68000
He was on the frozen ground.,ground,ground,He was on the ground frozen., frozen ground, ground frozen,frozen,False,-15.263633728027344,-16.008108139038086,0.7444744110107422,14067712,EleutherAI/pythia-14m,step68000,seed5,5,68000
He was on the camp ground.,ground,ground,He was on the ground camp., camp ground, ground camp,camp,True,-17.32089614868164,-14.800176620483398,-2.520719528198242,14067712,EleutherAI/pythia-14m,step68000,seed5,5,68000
They liked the night guard.,guard,guard,They liked the guard night., night guard, guard night,night,True,-18.89535140991211,-22.927291870117188,4.031940460205078,14067712,EleutherAI/pythia-14m,step68000,seed5,5,68000
They liked the security guard.,guard,guard,They liked the guard security., security guard, guard security,security,True,-15.615412712097168,-20.434158325195312,4.8187456130981445,14067712,EleutherAI/pythia-14m,step68000,seed5,5,68000
They liked the coast guard.,guard,guard,They liked the guard coast., coast guard, guard coast,coast,True,-18.43505096435547,-24.464141845703125,6.029090881347656,14067712,EleutherAI/pythia-14m,step68000,seed5,5,68000
He had an assembly guide.,guide,guide,He had an guide assembly., assembly guide, guide assembly,assembly,True,-19.206275939941406,-28.288890838623047,9.08261489868164,14067712,EleutherAI/pythia-14m,step68000,seed5,5,68000
He had a TV guide.,guide,guide,He had a guide TV., TV guide, guide TV,TV,True,-16.626476287841797,-21.0804386138916,4.453962326049805,14067712,EleutherAI/pythia-14m,step68000,seed5,5,68000
He had a talkative guide.,guide,guide,He had a guide talkative., talkative guide, guide talkative,talkative,False,-24.392736434936523,-28.664012908935547,4.271276473999023,14067712,EleutherAI/pythia-14m,step68000,seed5,5,68000
It was a summer home.,home,home,It was a home summer., summer home, home summer,summer,True,-13.835502624511719,-16.949180603027344,3.113677978515625,14067712,EleutherAI/pythia-14m,step68000,seed5,5,68000
It was a childhood home.,home,home,It was a home childhood., childhood home, home childhood,childhood,True,-13.437469482421875,-19.518043518066406,6.080574035644531,14067712,EleutherAI/pythia-14m,step68000,seed5,5,68000
It was a funeral home.,home,home,It was a home funeral., funeral home, home funeral,funeral,False,-13.039331436157227,-16.17768096923828,3.1383495330810547,14067712,EleutherAI/pythia-14m,step68000,seed5,5,68000
They had natural intelligence.,intelligence,intelligence,They had intelligence natural., natural intelligence, intelligence natural,natural,False,-16.41615104675293,-22.11562728881836,5.69947624206543,14067712,EleutherAI/pythia-14m,step68000,seed5,5,68000
They had innate intelligence.,intelligence,intelligence,They had intelligence innate., innate intelligence, intelligence innate,innate,False,-19.331926345825195,-25.940059661865234,6.608133316040039,14067712,EleutherAI/pythia-14m,step68000,seed5,5,68000
They had classified intelligence.,intelligence,intelligence,They had intelligence classified., classified intelligence, intelligence classified,classified,False,-18.852596282958984,-21.074932098388672,2.2223358154296875,14067712,EleutherAI/pythia-14m,step68000,seed5,5,68000
It was a sensitive issue.,issue,issue,It was an issue sensitive., sensitive issue, issue sensitive,sensitive,False,-14.640985488891602,-15.847372055053711,1.2063865661621094,14067712,EleutherAI/pythia-14m,step68000,seed5,5,68000
It was a political issue.,issue,issue,It was an issue political., political issue, issue political,political,False,-11.916764259338379,-17.386022567749023,5.4692583084106445,14067712,EleutherAI/pythia-14m,step68000,seed5,5,68000
It was a weekly issue.,issue,issue,It was an issue weekly., weekly issue, issue weekly,weekly,False,-16.215173721313477,-17.81288719177246,1.5977134704589844,14067712,EleutherAI/pythia-14m,step68000,seed5,5,68000
It was a blackberry jam.,jam,jam,It was a jam blackberry., blackberry jam, jam blackberry,blackberry,True,-20.907543182373047,-24.550342559814453,3.6427993774414062,14067712,EleutherAI/pythia-14m,step68000,seed5,5,68000
It was a peach jam.,jam,jam,It was a jam peach., peach jam, jam peach,peach,False,-21.66183853149414,-23.01272201538086,1.3508834838867188,14067712,EleutherAI/pythia-14m,step68000,seed5,5,68000
It was a traffic jam.,jam,jam,It was a jam traffic., traffic jam, jam traffic,traffic,True,-14.067190170288086,-19.886474609375,5.819284439086914,14067712,EleutherAI/pythia-14m,step68000,seed5,5,68000
It was a duplicate key.,key,key,It was a key duplicate., duplicate key, key duplicate,duplicate,False,-17.49327278137207,-17.681814193725586,0.18854141235351562,14067712,EleutherAI/pythia-14m,step68000,seed5,5,68000
It was a master key.,key,key,It was a key master., master key, key master,master,True,-18.011852264404297,-16.531774520874023,-1.4800777435302734,14067712,EleutherAI/pythia-14m,step68000,seed5,5,68000
It was a delete key.,key,key,It was a key delete., delete key, key delete,delete,False,-19.745845794677734,-18.9636287689209,-0.7822170257568359,14067712,EleutherAI/pythia-14m,step68000,seed5,5,68000
They liked the marinated lamb.,lamb,lamb,They liked the lamb marinated., marinated lamb, lamb marinated,marinated,True,-22.96982192993164,-25.835466384887695,2.8656444549560547,14067712,EleutherAI/pythia-14m,step68000,seed5,5,68000
They liked the grilled lamb.,lamb,lamb,They liked the lamb grilled., grilled lamb, lamb grilled,grilled,False,-20.015697479248047,-21.823843002319336,1.808145523071289,14067712,EleutherAI/pythia-14m,step68000,seed5,5,68000
They liked the cute lamb.,lamb,lamb,They liked the lamb cute., cute lamb, lamb cute,cute,False,-19.811511993408203,-24.552297592163086,4.740785598754883,14067712,EleutherAI/pythia-14m,step68000,seed5,5,68000
She had curly locks.,lock,locks,She had locks curly., curly locks, locks curly,curly,False,-23.280529022216797,-26.659093856811523,3.3785648345947266,14067712,EleutherAI/pythia-14m,step68000,seed5,5,68000
She had brown locks.,lock,locks,She had locks brown., brown locks, locks brown,brown,False,-22.756919860839844,-24.00189781188965,1.2449779510498047,14067712,EleutherAI/pythia-14m,step68000,seed5,5,68000
She had window locks.,lock,locks,She had locks window., window locks, locks window,window,True,-21.007732391357422,-23.6501522064209,2.6424198150634766,14067712,EleutherAI/pythia-14m,step68000,seed5,5,68000
They liked the hot lunch.,lunch,lunch,They liked the lunch hot., hot lunch, lunch hot,hot,False,-17.902427673339844,-19.418567657470703,1.5161399841308594,14067712,EleutherAI/pythia-14m,step68000,seed5,5,68000
They liked the sandwich lunch.,lunch,lunch,They liked the lunch sandwich., sandwich lunch, lunch sandwich,sandwich,True,-19.3279972076416,-18.804828643798828,-0.5231685638427734,14067712,EleutherAI/pythia-14m,step68000,seed5,5,68000
They liked the afternoon lunch.,lunch,lunch,They liked the lunch afternoon., afternoon lunch, lunch afternoon,afternoon,True,-15.010517120361328,-18.479084014892578,3.46856689453125,14067712,EleutherAI/pythia-14m,step68000,seed5,5,68000
He liked the flea market.,market,market,He liked the market flea., flea market, market flea,flea,True,-20.109466552734375,-19.374597549438477,-0.7348690032958984,14067712,EleutherAI/pythia-14m,step68000,seed5,5,68000
He liked the fish market.,market,market,He liked the market fish., fish market, market fish,fish,True,-15.231037139892578,-16.46434783935547,1.2333106994628906,14067712,EleutherAI/pythia-14m,step68000,seed5,5,68000
He liked the housing market.,market,market,He liked the market housing., housing market, market housing,housing,True,-11.696062088012695,-15.318228721618652,3.622166633605957,14067712,EleutherAI/pythia-14m,step68000,seed5,5,68000
It was a lit match.,match,match,It was a match lit., lit match, match lit,lit,False,-21.323219299316406,-19.4388427734375,-1.8843765258789062,14067712,EleutherAI/pythia-14m,step68000,seed5,5,68000
It was a burning match.,match,match,It was a match burning., burning match, match burning,burning,False,-18.822551727294922,-20.478530883789062,1.6559791564941406,14067712,EleutherAI/pythia-14m,step68000,seed5,5,68000
It was a soccer match.,match,match,It was a match soccer., soccer match, match soccer,soccer,True,-15.679423332214355,-22.125045776367188,6.445622444152832,14067712,EleutherAI/pythia-14m,step68000,seed5,5,68000
It was cough medicine.,medicine,medicine,It was medicine cough., cough medicine, medicine cough,cough,True,-21.10227394104004,-24.174238204956055,3.0719642639160156,14067712,EleutherAI/pythia-14m,step68000,seed5,5,68000
It was prescription medicine.,medicine,medicine,It was medicine prescription., prescription medicine, medicine prescription,prescription,True,-18.756229400634766,-21.465251922607422,2.7090225219726562,14067712,EleutherAI/pythia-14m,step68000,seed5,5,68000
It was orthopedic medicine.,medicine,medicine,It was medicine orthopedic., orthopedic medicine, medicine orthopedic,orthopedic,False,-22.79975128173828,-26.968029022216797,4.168277740478516,14067712,EleutherAI/pythia-14m,step68000,seed5,5,68000
There was a phone message.,message,message,There was a message phone., phone message, message phone,phone,True,-13.447765350341797,-16.070703506469727,2.6229381561279297,14067712,EleutherAI/pythia-14m,step68000,seed5,5,68000
There was a computer message.,message,message,There was a message computer., computer message, message computer,computer,True,-14.98983097076416,-18.57688331604004,3.587052345275879,14067712,EleutherAI/pythia-14m,step68000,seed5,5,68000
There was an urgent message.,message,message,There was an message urgent., urgent message, message urgent,urgent,False,-12.039665222167969,-23.394128799438477,11.354463577270508,14067712,EleutherAI/pythia-14m,step68000,seed5,5,68000
It was a fungal mold.,mold,mold,It was a mold fungal., fungal mold, mold fungal,fungal,False,-20.975858688354492,-22.685161590576172,1.7093029022216797,14067712,EleutherAI/pythia-14m,step68000,seed5,5,68000
It was a harmful mold.,mold,mold,It was a mold harmful., harmful mold, mold harmful,harmful,False,-21.909439086914062,-23.627452850341797,1.7180137634277344,14067712,EleutherAI/pythia-14m,step68000,seed5,5,68000
It was a rubber mold.,mold,mold,It was a mold rubber., rubber mold, mold rubber,rubber,True,-16.720993041992188,-20.771007537841797,4.050014495849609,14067712,EleutherAI/pythia-14m,step68000,seed5,5,68000
She saw the cancerous mole.,mole,mole,She saw the mole cancerous., cancerous mole, mole cancerous,cancerous,False,-26.033449172973633,-29.861133575439453,3.8276844024658203,14067712,EleutherAI/pythia-14m,step68000,seed5,5,68000
She saw the raised mole.,mole,mole,She saw the mole raised., raised mole, mole raised,raised,False,-21.693218231201172,-18.738887786865234,-2.9543304443359375,14067712,EleutherAI/pythia-14m,step68000,seed5,5,68000
She saw the cute mole.,mole,mole,She saw the mole cute., cute mole, mole cute,cute,False,-21.43045997619629,-26.17562484741211,4.74516487121582,14067712,EleutherAI/pythia-14m,step68000,seed5,5,68000
He liked the rhythmic movement.,movement,movement,He liked the movement rhythmic., rhythmic movement, movement rhythmic,rhythmic,False,-15.722647666931152,-18.972368240356445,3.249720573425293,14067712,EleutherAI/pythia-14m,step68000,seed5,5,68000
He liked the graceful movement.,movement,movement,He liked the movement graceful., graceful movement, movement graceful,graceful,False,-17.397096633911133,-20.581222534179688,3.1841259002685547,14067712,EleutherAI/pythia-14m,step68000,seed5,5,68000
He liked the feminist movement.,movement,movement,He liked the movement feminist., feminist movement, movement feminist,feminist,True,-16.56389808654785,-22.381683349609375,5.817785263061523,14067712,EleutherAI/pythia-14m,step68000,seed5,5,68000
It was a national newspaper.,newspaper,newspaper,It was a newspaper national., national newspaper, newspaper national,national,False,-15.456912994384766,-20.477928161621094,5.021015167236328,14067712,EleutherAI/pythia-14m,step68000,seed5,5,68000
It was a daily newspaper.,newspaper,newspaper,It was a newspaper daily., daily newspaper, newspaper daily,daily,False,-16.4658260345459,-19.43022918701172,2.9644031524658203,14067712,EleutherAI/pythia-14m,step68000,seed5,5,68000
It was a faded newspaper.,newspaper,newspaper,It was a newspaper faded., faded newspaper, newspaper faded,faded,False,-19.470569610595703,-21.80132293701172,2.3307533264160156,14067712,EleutherAI/pythia-14m,step68000,seed5,5,68000
It was a juicy orange.,orange,orange,It was an orange juicy., juicy orange, orange juicy,juicy,False,-20.185691833496094,-19.87474822998047,-0.310943603515625,14067712,EleutherAI/pythia-14m,step68000,seed5,5,68000
It was a ripe orange.,orange,orange,It was an orange ripe., ripe orange, orange ripe,ripe,False,-19.470447540283203,-18.90629005432129,-0.5641574859619141,14067712,EleutherAI/pythia-14m,step68000,seed5,5,68000
It was a bright orange.,orange,orange,It was an orange bright., bright orange, orange bright,bright,False,-13.929813385009766,-17.140451431274414,3.2106380462646484,14067712,EleutherAI/pythia-14m,step68000,seed5,5,68000
He saw the young page.,page,page,He saw the page young., young page, page young,young,False,-17.94561767578125,-17.66423797607422,-0.28137969970703125,14067712,EleutherAI/pythia-14m,step68000,seed5,5,68000
He saw the loyal page.,page,page,He saw the page loyal., loyal page, page loyal,loyal,False,-22.583168029785156,-21.354637145996094,-1.2285308837890625,14067712,EleutherAI/pythia-14m,step68000,seed5,5,68000
He saw the blank page.,page,page,He saw the page blank., blank page, page blank,blank,False,-15.119325637817383,-16.585243225097656,1.4659175872802734,14067712,EleutherAI/pythia-14m,step68000,seed5,5,68000
It was a calloused palm.,palm,palm,It was a palm calloused., calloused palm, palm calloused,calloused,False,-29.922483444213867,-32.200584411621094,2.2781009674072266,14067712,EleutherAI/pythia-14m,step68000,seed5,5,68000
It was a wrinkled palm.,palm,palm,It was a palm wrinkled., wrinkled palm, palm wrinkled,wrinkled,False,-21.107412338256836,-22.62713623046875,1.519723892211914,14067712,EleutherAI/pythia-14m,step68000,seed5,5,68000
It was a tropical palm.,palm,palm,It was a palm tropical., tropical palm, palm tropical,tropical,False,-20.731029510498047,-23.58388900756836,2.8528594970703125,14067712,EleutherAI/pythia-14m,step68000,seed5,5,68000
It was a control panel.,panel,panel,It was a panel control., control panel, panel control,control,True,-17.321592330932617,-19.23017692565918,1.9085845947265625,14067712,EleutherAI/pythia-14m,step68000,seed5,5,68000
It was an instrument panel.,panel,panel,It was an panel instrument., instrument panel, panel instrument,instrument,False,-18.56930160522461,-27.893959045410156,9.324657440185547,14067712,EleutherAI/pythia-14m,step68000,seed5,5,68000
It was an advisory panel.,panel,panel,It was an panel advisory., advisory panel, panel advisory,advisory,False,-14.128928184509277,-28.02552032470703,13.896592140197754,14067712,EleutherAI/pythia-14m,step68000,seed5,5,68000
It was a secret passage.,passage,passage,It was a passage secret., secret passage, passage secret,secret,False,-15.470664978027344,-21.566387176513672,6.095722198486328,14067712,EleutherAI/pythia-14m,step68000,seed5,5,68000
It was a narrow passage.,passage,passage,It was a passage narrow., narrow passage, passage narrow,narrow,False,-15.217132568359375,-22.838497161865234,7.621364593505859,14067712,EleutherAI/pythia-14m,step68000,seed5,5,68000
It was a literary passage.,passage,passage,It was a passage literary., literary passage, passage literary,literary,False,-18.75677490234375,-23.96853256225586,5.211757659912109,14067712,EleutherAI/pythia-14m,step68000,seed5,5,68000
It was a tasty perch.,perch,perch,It was a perch tasty., tasty perch, perch tasty,tasty,False,-21.74051284790039,-25.784587860107422,4.044075012207031,14067712,EleutherAI/pythia-14m,step68000,seed5,5,68000
It was a freshwater perch.,perch,perch,It was a perch freshwater., freshwater perch, perch freshwater,freshwater,True,-25.77312660217285,-26.355403900146484,0.5822772979736328,14067712,EleutherAI/pythia-14m,step68000,seed5,5,68000
It was a lofty perch.,perch,perch,It was a perch lofty., lofty perch, perch lofty,lofty,False,-25.722270965576172,-30.7105770111084,4.988306045532227,14067712,EleutherAI/pythia-14m,step68000,seed5,5,68000
He saw the fast pitcher.,pitcher,pitcher,He saw the pitcher fast., fast pitcher, pitcher fast,fast,False,-18.844200134277344,-17.660118103027344,-1.18408203125,14067712,EleutherAI/pythia-14m,step68000,seed5,5,68000
He saw the right-handed pitcher.,pitcher,pitcher,He saw the pitcher right-handed., right-handed pitcher, pitcher right-handed,right-handed,False,-18.624950408935547,-20.267398834228516,1.6424484252929688,14067712,EleutherAI/pythia-14m,step68000,seed5,5,68000
He saw the glass pitcher.,pitcher,pitcher,He saw the pitcher glass., glass pitcher, pitcher glass,glass,True,-18.229860305786133,-18.893409729003906,0.6635494232177734,14067712,EleutherAI/pythia-14m,step68000,seed5,5,68000
It was a windy port.,port,port,It was a port windy., windy port, port windy,windy,False,-19.932783126831055,-22.197006225585938,2.264223098754883,14067712,EleutherAI/pythia-14m,step68000,seed5,5,68000
It was a seaside port.,port,port,It was a port seaside., seaside port, port seaside,seaside,True,-24.06806755065918,-28.080366134643555,4.012298583984375,14067712,EleutherAI/pythia-14m,step68000,seed5,5,68000
It was a delicious port.,port,port,It was a port delicious., delicious port, port delicious,delicious,False,-19.212169647216797,-23.993919372558594,4.781749725341797,14067712,EleutherAI/pythia-14m,step68000,seed5,5,68000
He was in a distinguished position.,position,position,He was in a position distinguished., distinguished position, position distinguished,distinguished,False,-14.208877563476562,-18.610979080200195,4.402101516723633,14067712,EleutherAI/pythia-14m,step68000,seed5,5,68000
He was in a prominent position.,position,position,He was in a position prominent., prominent position, position prominent,prominent,False,-13.416882514953613,-19.265047073364258,5.8481645584106445,14067712,EleutherAI/pythia-14m,step68000,seed5,5,68000
He was in a fetal position.,position,position,He was in a position fetal., fetal position, position fetal,fetal,False,-17.221782684326172,-20.821001052856445,3.5992183685302734,14067712,EleutherAI/pythia-14m,step68000,seed5,5,68000
It was a wooden post.,post,post,It was a post wooden., wooden post, post wooden,wooden,False,-18.130783081054688,-21.72629165649414,3.595508575439453,14067712,EleutherAI/pythia-14m,step68000,seed5,5,68000
It was a fence post.,post,post,It was a post fence., fence post, post fence,fence,True,-20.000080108642578,-21.25467300415039,1.2545928955078125,14067712,EleutherAI/pythia-14m,step68000,seed5,5,68000
It was a teaching post.,post,post,It was a post teaching., teaching post, post teaching,teaching,True,-18.2381591796875,-18.412738800048828,0.17457962036132812,14067712,EleutherAI/pythia-14m,step68000,seed5,5,68000
He had the alcoholic punch.,punch,punch,He had the punch alcoholic., alcoholic punch, punch alcoholic,alcoholic,False,-22.502281188964844,-25.978395462036133,3.476114273071289,14067712,EleutherAI/pythia-14m,step68000,seed5,5,68000
He had the fruit punch.,punch,punch,He had the punch fruit., fruit punch, punch fruit,fruit,True,-20.86865997314453,-22.981325149536133,2.1126651763916016,14067712,EleutherAI/pythia-14m,step68000,seed5,5,68000
He had the strongest punch.,punch,punch,He had the punch strongest., strongest punch, punch strongest,strongest,False,-18.53729820251465,-23.21122932434082,4.673931121826172,14067712,EleutherAI/pythia-14m,step68000,seed5,5,68000
She had a brilliant pupil.,pupil,pupil,She had a pupil brilliant., brilliant pupil, pupil brilliant,brilliant,False,-15.065343856811523,-22.65079689025879,7.585453033447266,14067712,EleutherAI/pythia-14m,step68000,seed5,5,68000
She had an interested pupil.,pupil,pupil,She had an pupil interested., interested pupil, pupil interested,interested,False,-15.974838256835938,-22.06499481201172,6.090156555175781,14067712,EleutherAI/pythia-14m,step68000,seed5,5,68000
She had a dilated pupil.,pupil,pupil,She had a pupil dilated., dilated pupil, pupil dilated,dilated,False,-16.34079933166504,-21.27872657775879,4.93792724609375,14067712,EleutherAI/pythia-14m,step68000,seed5,5,68000
That was a loud racket.,racket,racket,That was a racket loud., loud racket, racket loud,loud,False,-18.665592193603516,-21.411396026611328,2.7458038330078125,14067712,EleutherAI/pythia-14m,step68000,seed5,5,68000
That was an annoying racket.,racket,racket,That was an racket annoying., annoying racket, racket annoying,annoying,False,-16.69202995300293,-23.826377868652344,7.134347915649414,14067712,EleutherAI/pythia-14m,step68000,seed5,5,68000
That was a badminton racket.,racket,racket,That was a racket badminton., badminton racket, racket badminton,badminton,True,-24.993915557861328,-25.02700424194336,0.03308868408203125,14067712,EleutherAI/pythia-14m,step68000,seed5,5,68000
He liked electronic rock.,rock,rock,He liked rock electronic., electronic rock, rock electronic,electronic,False,-23.183494567871094,-23.354148864746094,0.170654296875,14067712,EleutherAI/pythia-14m,step68000,seed5,5,68000
He liked alternative rock.,rock,rock,He liked rock alternative., alternative rock, rock alternative,alternative,False,-20.234769821166992,-24.56806182861328,4.333292007446289,14067712,EleutherAI/pythia-14m,step68000,seed5,5,68000
He liked limestone rock.,rock,rock,He liked rock limestone., limestone rock, rock limestone,limestone,True,-21.3456974029541,-22.70885467529297,1.3631572723388672,14067712,EleutherAI/pythia-14m,step68000,seed5,5,68000
He saw the wise sage.,sage,sage,He saw the sage wise., wise sage, sage wise,wise,False,-20.13394546508789,-21.909517288208008,1.7755718231201172,14067712,EleutherAI/pythia-14m,step68000,seed5,5,68000
He saw the renowned sage.,sage,sage,He saw the sage renowned., renowned sage, sage renowned,renowned,False,-22.282787322998047,-24.65287971496582,2.3700923919677734,14067712,EleutherAI/pythia-14m,step68000,seed5,5,68000
He saw the fragrant sage.,sage,sage,He saw the sage fragrant., fragrant sage, sage fragrant,fragrant,False,-21.03033447265625,-21.196842193603516,0.16650772094726562,14067712,EleutherAI/pythia-14m,step68000,seed5,5,68000
It was a fish scale.,scale,scale,It was a scale fish., fish scale, scale fish,fish,True,-19.66079330444336,-22.211490631103516,2.5506973266601562,14067712,EleutherAI/pythia-14m,step68000,seed5,5,68000
It was a lizard scale.,scale,scale,It was a scale lizard., lizard scale, scale lizard,lizard,True,-21.901931762695312,-27.17034149169922,5.268409729003906,14067712,EleutherAI/pythia-14m,step68000,seed5,5,68000
It was a music scale.,scale,scale,It was a scale music., music scale, scale music,music,True,-18.142375946044922,-19.418140411376953,1.2757644653320312,14067712,EleutherAI/pythia-14m,step68000,seed5,5,68000
It was a touching scene.,scene,scene,It was a scene touching., touching scene, scene touching,touching,False,-15.86685848236084,-17.795154571533203,1.9282960891723633,14067712,EleutherAI/pythia-14m,step68000,seed5,5,68000
It was a well-acted scene.,scene,scene,It was a scene well-acted., well-acted scene, scene well-acted,well-acted,False,-20.5430965423584,-26.260263442993164,5.717166900634766,14067712,EleutherAI/pythia-14m,step68000,seed5,5,68000
It was a nature scene.,scene,scene,It was a scene nature., nature scene, scene nature,nature,True,-17.86966323852539,-20.217426300048828,2.3477630615234375,14067712,EleutherAI/pythia-14m,step68000,seed5,5,68000
It was a gold seal.,seal,seal,It was a seal gold., gold seal, seal gold,gold,True,-16.98511505126953,-22.343631744384766,5.358516693115234,14067712,EleutherAI/pythia-14m,step68000,seed5,5,68000
It was a certified seal.,seal,seal,It was a seal certified., certified seal, seal certified,certified,False,-19.93878936767578,-22.774127960205078,2.835338592529297,14067712,EleutherAI/pythia-14m,step68000,seed5,5,68000
It was a circus seal.,seal,seal,It was a seal circus., circus seal, seal circus,circus,True,-22.452957153320312,-24.171314239501953,1.7183570861816406,14067712,EleutherAI/pythia-14m,step68000,seed5,5,68000
He used the scotch tape.,tape,tape,He used the tape scotch., scotch tape, tape scotch,scotch,True,-26.99859619140625,-27.828163146972656,0.8295669555664062,14067712,EleutherAI/pythia-14m,step68000,seed5,5,68000
He used the double-sided tape.,tape,tape,He used the tape double-sided., double-sided tape, tape double-sided,double-sided,False,-22.780550003051758,-28.123430252075195,5.3428802490234375,14067712,EleutherAI/pythia-14m,step68000,seed5,5,68000
He used the interview tape.,tape,tape,He used the tape interview., interview tape, tape interview,interview,True,-15.549056053161621,-20.16019058227539,4.6111345291137695,14067712,EleutherAI/pythia-14m,step68000,seed5,5,68000
It was a winter term.,term,term,It was a term winter., winter term, term winter,winter,True,-15.854473114013672,-21.377229690551758,5.522756576538086,14067712,EleutherAI/pythia-14m,step68000,seed5,5,68000
