sentence,word,string,reversed_sentence,mod_np,reversed_mod,disambiguating_word,non_adjective,original_logprob,reversed_logprob,ratio,n_params,mpath,revision,seed_name,seed,step
It was a linear function.,function,function,It was a function linear., linear function, function linear,linear,False,-13.508831977844238,-17.52529525756836,4.016463279724121,14067712,EleutherAI/pythia-14m,step109000,seed7,7,109000
It was a social function.,function,function,It was a function social., social function, function social,social,False,-14.266148567199707,-21.63967514038086,7.373526573181152,14067712,EleutherAI/pythia-14m,step109000,seed7,7,109000
He was on the firm ground.,ground,ground,He was on the ground firm., firm ground, ground firm,firm,False,-17.44042205810547,-17.109325408935547,-0.3310966491699219,14067712,EleutherAI/pythia-14m,step109000,seed7,7,109000
He was on the frozen ground.,ground,ground,He was on the ground frozen., frozen ground, ground frozen,frozen,False,-16.49884796142578,-18.259960174560547,1.7611122131347656,14067712,EleutherAI/pythia-14m,step109000,seed7,7,109000
He was on the camp ground.,ground,ground,He was on the ground camp., camp ground, ground camp,camp,True,-18.90254020690918,-15.693065643310547,-3.209474563598633,14067712,EleutherAI/pythia-14m,step109000,seed7,7,109000
They liked the night guard.,guard,guard,They liked the guard night., night guard, guard night,night,True,-17.827959060668945,-18.38115119934082,0.553192138671875,14067712,EleutherAI/pythia-14m,step109000,seed7,7,109000
They liked the security guard.,guard,guard,They liked the guard security., security guard, guard security,security,True,-14.412689208984375,-20.31816291809082,5.905473709106445,14067712,EleutherAI/pythia-14m,step109000,seed7,7,109000
They liked the coast guard.,guard,guard,They liked the guard coast., coast guard, guard coast,coast,True,-19.221195220947266,-24.07682991027832,4.855634689331055,14067712,EleutherAI/pythia-14m,step109000,seed7,7,109000
He had an assembly guide.,guide,guide,He had an guide assembly., assembly guide, guide assembly,assembly,True,-17.684585571289062,-22.65654754638672,4.971961975097656,14067712,EleutherAI/pythia-14m,step109000,seed7,7,109000
He had a TV guide.,guide,guide,He had a guide TV., TV guide, guide TV,TV,True,-18.094039916992188,-19.806175231933594,1.7121353149414062,14067712,EleutherAI/pythia-14m,step109000,seed7,7,109000
He had a talkative guide.,guide,guide,He had a guide talkative., talkative guide, guide talkative,talkative,False,-25.411712646484375,-27.8627872467041,2.4510746002197266,14067712,EleutherAI/pythia-14m,step109000,seed7,7,109000
It was a summer home.,home,home,It was a home summer., summer home, home summer,summer,True,-14.549140930175781,-17.668033599853516,3.1188926696777344,14067712,EleutherAI/pythia-14m,step109000,seed7,7,109000
It was a childhood home.,home,home,It was a home childhood., childhood home, home childhood,childhood,True,-13.715476989746094,-18.554508209228516,4.839031219482422,14067712,EleutherAI/pythia-14m,step109000,seed7,7,109000
It was a funeral home.,home,home,It was a home funeral., funeral home, home funeral,funeral,False,-14.450787544250488,-17.330875396728516,2.8800878524780273,14067712,EleutherAI/pythia-14m,step109000,seed7,7,109000
They had natural intelligence.,intelligence,intelligence,They had intelligence natural., natural intelligence, intelligence natural,natural,False,-18.32079315185547,-23.284242630004883,4.963449478149414,14067712,EleutherAI/pythia-14m,step109000,seed7,7,109000
They had innate intelligence.,intelligence,intelligence,They had intelligence innate., innate intelligence, intelligence innate,innate,False,-19.813613891601562,-24.422914505004883,4.60930061340332,14067712,EleutherAI/pythia-14m,step109000,seed7,7,109000
They had classified intelligence.,intelligence,intelligence,They had intelligence classified., classified intelligence, intelligence classified,classified,False,-20.96780776977539,-22.608217239379883,1.6404094696044922,14067712,EleutherAI/pythia-14m,step109000,seed7,7,109000
It was a sensitive issue.,issue,issue,It was an issue sensitive., sensitive issue, issue sensitive,sensitive,False,-13.867090225219727,-15.684876441955566,1.8177862167358398,14067712,EleutherAI/pythia-14m,step109000,seed7,7,109000
It was a political issue.,issue,issue,It was an issue political., political issue, issue political,political,False,-10.800689697265625,-15.951111793518066,5.150422096252441,14067712,EleutherAI/pythia-14m,step109000,seed7,7,109000
It was a weekly issue.,issue,issue,It was an issue weekly., weekly issue, issue weekly,weekly,False,-16.626235961914062,-18.08966064453125,1.4634246826171875,14067712,EleutherAI/pythia-14m,step109000,seed7,7,109000
It was a blackberry jam.,jam,jam,It was a jam blackberry., blackberry jam, jam blackberry,blackberry,True,-19.122026443481445,-27.07617950439453,7.954153060913086,14067712,EleutherAI/pythia-14m,step109000,seed7,7,109000
It was a peach jam.,jam,jam,It was a jam peach., peach jam, jam peach,peach,False,-21.08832550048828,-26.13231086730957,5.043985366821289,14067712,EleutherAI/pythia-14m,step109000,seed7,7,109000
It was a traffic jam.,jam,jam,It was a jam traffic., traffic jam, jam traffic,traffic,True,-17.751237869262695,-22.860065460205078,5.108827590942383,14067712,EleutherAI/pythia-14m,step109000,seed7,7,109000
It was a duplicate key.,key,key,It was a key duplicate., duplicate key, key duplicate,duplicate,False,-18.83993148803711,-18.691730499267578,-0.14820098876953125,14067712,EleutherAI/pythia-14m,step109000,seed7,7,109000
It was a master key.,key,key,It was a key master., master key, key master,master,True,-16.908945083618164,-17.388996124267578,0.48005104064941406,14067712,EleutherAI/pythia-14m,step109000,seed7,7,109000
It was a delete key.,key,key,It was a key delete., delete key, key delete,delete,False,-18.15289306640625,-18.507770538330078,0.3548774719238281,14067712,EleutherAI/pythia-14m,step109000,seed7,7,109000
They liked the marinated lamb.,lamb,lamb,They liked the lamb marinated., marinated lamb, lamb marinated,marinated,True,-24.558956146240234,-25.610322952270508,1.0513668060302734,14067712,EleutherAI/pythia-14m,step109000,seed7,7,109000
They liked the grilled lamb.,lamb,lamb,They liked the lamb grilled., grilled lamb, lamb grilled,grilled,False,-17.032150268554688,-18.750686645507812,1.718536376953125,14067712,EleutherAI/pythia-14m,step109000,seed7,7,109000
They liked the cute lamb.,lamb,lamb,They liked the lamb cute., cute lamb, lamb cute,cute,False,-18.796791076660156,-20.786087036132812,1.9892959594726562,14067712,EleutherAI/pythia-14m,step109000,seed7,7,109000
She had curly locks.,lock,locks,She had locks curly., curly locks, locks curly,curly,False,-20.870723724365234,-26.068115234375,5.197391510009766,14067712,EleutherAI/pythia-14m,step109000,seed7,7,109000
She had brown locks.,lock,locks,She had locks brown., brown locks, locks brown,brown,False,-22.403038024902344,-25.4825439453125,3.0795059204101562,14067712,EleutherAI/pythia-14m,step109000,seed7,7,109000
She had window locks.,lock,locks,She had locks window., window locks, locks window,window,True,-23.371496200561523,-24.704345703125,1.3328495025634766,14067712,EleutherAI/pythia-14m,step109000,seed7,7,109000
They liked the hot lunch.,lunch,lunch,They liked the lunch hot., hot lunch, lunch hot,hot,False,-15.525593757629395,-18.260299682617188,2.734705924987793,14067712,EleutherAI/pythia-14m,step109000,seed7,7,109000
They liked the sandwich lunch.,lunch,lunch,They liked the lunch sandwich., sandwich lunch, lunch sandwich,sandwich,True,-18.03485870361328,-16.626508712768555,-1.4083499908447266,14067712,EleutherAI/pythia-14m,step109000,seed7,7,109000
They liked the afternoon lunch.,lunch,lunch,They liked the lunch afternoon., afternoon lunch, lunch afternoon,afternoon,True,-15.981151580810547,-19.236251831054688,3.2551002502441406,14067712,EleutherAI/pythia-14m,step109000,seed7,7,109000
He liked the flea market.,market,market,He liked the market flea., flea market, market flea,flea,True,-21.752660751342773,-19.90406608581543,-1.8485946655273438,14067712,EleutherAI/pythia-14m,step109000,seed7,7,109000
He liked the fish market.,market,market,He liked the market fish., fish market, market fish,fish,True,-18.371124267578125,-16.441858291625977,-1.9292659759521484,14067712,EleutherAI/pythia-14m,step109000,seed7,7,109000
He liked the housing market.,market,market,He liked the market housing., housing market, market housing,housing,True,-15.395094871520996,-17.227991104125977,1.8328962326049805,14067712,EleutherAI/pythia-14m,step109000,seed7,7,109000
It was a lit match.,match,match,It was a match lit., lit match, match lit,lit,False,-22.172245025634766,-20.944957733154297,-1.2272872924804688,14067712,EleutherAI/pythia-14m,step109000,seed7,7,109000
It was a burning match.,match,match,It was a match burning., burning match, match burning,burning,False,-18.264972686767578,-21.414196014404297,3.1492233276367188,14067712,EleutherAI/pythia-14m,step109000,seed7,7,109000
It was a soccer match.,match,match,It was a match soccer., soccer match, match soccer,soccer,True,-15.344087600708008,-22.689464569091797,7.345376968383789,14067712,EleutherAI/pythia-14m,step109000,seed7,7,109000
It was cough medicine.,medicine,medicine,It was medicine cough., cough medicine, medicine cough,cough,True,-20.770973205566406,-22.952354431152344,2.1813812255859375,14067712,EleutherAI/pythia-14m,step109000,seed7,7,109000
It was prescription medicine.,medicine,medicine,It was medicine prescription., prescription medicine, medicine prescription,prescription,True,-17.797386169433594,-19.271446228027344,1.47406005859375,14067712,EleutherAI/pythia-14m,step109000,seed7,7,109000
It was orthopedic medicine.,medicine,medicine,It was medicine orthopedic., orthopedic medicine, medicine orthopedic,orthopedic,False,-22.223358154296875,-22.624221801757812,0.4008636474609375,14067712,EleutherAI/pythia-14m,step109000,seed7,7,109000
There was a phone message.,message,message,There was a message phone., phone message, message phone,phone,True,-14.38446044921875,-14.830547332763672,0.4460868835449219,14067712,EleutherAI/pythia-14m,step109000,seed7,7,109000
There was a computer message.,message,message,There was a message computer., computer message, message computer,computer,True,-17.199081420898438,-17.342388153076172,0.14330673217773438,14067712,EleutherAI/pythia-14m,step109000,seed7,7,109000
There was an urgent message.,message,message,There was an message urgent., urgent message, message urgent,urgent,False,-12.498119354248047,-22.722875595092773,10.224756240844727,14067712,EleutherAI/pythia-14m,step109000,seed7,7,109000
It was a fungal mold.,mold,mold,It was a mold fungal., fungal mold, mold fungal,fungal,False,-20.095794677734375,-22.264373779296875,2.1685791015625,14067712,EleutherAI/pythia-14m,step109000,seed7,7,109000
It was a harmful mold.,mold,mold,It was a mold harmful., harmful mold, mold harmful,harmful,False,-19.205047607421875,-21.045379638671875,1.84033203125,14067712,EleutherAI/pythia-14m,step109000,seed7,7,109000
It was a rubber mold.,mold,mold,It was a mold rubber., rubber mold, mold rubber,rubber,True,-16.601051330566406,-20.528289794921875,3.9272384643554688,14067712,EleutherAI/pythia-14m,step109000,seed7,7,109000
She saw the cancerous mole.,mole,mole,She saw the mole cancerous., cancerous mole, mole cancerous,cancerous,False,-26.346105575561523,-27.357946395874023,1.0118408203125,14067712,EleutherAI/pythia-14m,step109000,seed7,7,109000
She saw the raised mole.,mole,mole,She saw the mole raised., raised mole, mole raised,raised,False,-21.353195190429688,-20.30276870727539,-1.0504264831542969,14067712,EleutherAI/pythia-14m,step109000,seed7,7,109000
She saw the cute mole.,mole,mole,She saw the mole cute., cute mole, mole cute,cute,False,-20.320940017700195,-22.61709976196289,2.2961597442626953,14067712,EleutherAI/pythia-14m,step109000,seed7,7,109000
He liked the rhythmic movement.,movement,movement,He liked the movement rhythmic., rhythmic movement, movement rhythmic,rhythmic,False,-16.62665557861328,-19.12229347229004,2.495637893676758,14067712,EleutherAI/pythia-14m,step109000,seed7,7,109000
He liked the graceful movement.,movement,movement,He liked the movement graceful., graceful movement, movement graceful,graceful,False,-18.778648376464844,-20.451574325561523,1.6729259490966797,14067712,EleutherAI/pythia-14m,step109000,seed7,7,109000
He liked the feminist movement.,movement,movement,He liked the movement feminist., feminist movement, movement feminist,feminist,True,-15.84881591796875,-20.458898544311523,4.610082626342773,14067712,EleutherAI/pythia-14m,step109000,seed7,7,109000
It was a national newspaper.,newspaper,newspaper,It was a newspaper national., national newspaper, newspaper national,national,False,-14.729217529296875,-19.379791259765625,4.65057373046875,14067712,EleutherAI/pythia-14m,step109000,seed7,7,109000
It was a daily newspaper.,newspaper,newspaper,It was a newspaper daily., daily newspaper, newspaper daily,daily,False,-14.918083190917969,-18.125885009765625,3.2078018188476562,14067712,EleutherAI/pythia-14m,step109000,seed7,7,109000
It was a faded newspaper.,newspaper,newspaper,It was a newspaper faded., faded newspaper, newspaper faded,faded,False,-20.642826080322266,-22.055938720703125,1.4131126403808594,14067712,EleutherAI/pythia-14m,step109000,seed7,7,109000
It was a juicy orange.,orange,orange,It was an orange juicy., juicy orange, orange juicy,juicy,False,-18.21132469177246,-18.98515510559082,0.7738304138183594,14067712,EleutherAI/pythia-14m,step109000,seed7,7,109000
It was a ripe orange.,orange,orange,It was an orange ripe., ripe orange, orange ripe,ripe,False,-16.444377899169922,-16.792091369628906,0.3477134704589844,14067712,EleutherAI/pythia-14m,step109000,seed7,7,109000
It was a bright orange.,orange,orange,It was an orange bright., bright orange, orange bright,bright,False,-12.975658416748047,-15.044288635253906,2.0686302185058594,14067712,EleutherAI/pythia-14m,step109000,seed7,7,109000
He saw the young page.,page,page,He saw the page young., young page, page young,young,False,-18.551109313964844,-17.677865982055664,-0.8732433319091797,14067712,EleutherAI/pythia-14m,step109000,seed7,7,109000
He saw the loyal page.,page,page,He saw the page loyal., loyal page, page loyal,loyal,False,-23.841419219970703,-20.33057403564453,-3.510845184326172,14067712,EleutherAI/pythia-14m,step109000,seed7,7,109000
He saw the blank page.,page,page,He saw the page blank., blank page, page blank,blank,False,-15.430919647216797,-15.293588638305664,-0.1373310089111328,14067712,EleutherAI/pythia-14m,step109000,seed7,7,109000
It was a calloused palm.,palm,palm,It was a palm calloused., calloused palm, palm calloused,calloused,False,-29.540245056152344,-34.08516311645508,4.544918060302734,14067712,EleutherAI/pythia-14m,step109000,seed7,7,109000
It was a wrinkled palm.,palm,palm,It was a palm wrinkled., wrinkled palm, palm wrinkled,wrinkled,False,-20.31406021118164,-22.26738739013672,1.9533271789550781,14067712,EleutherAI/pythia-14m,step109000,seed7,7,109000
It was a tropical palm.,palm,palm,It was a palm tropical., tropical palm, palm tropical,tropical,False,-22.292606353759766,-25.530261993408203,3.2376556396484375,14067712,EleutherAI/pythia-14m,step109000,seed7,7,109000
It was a control panel.,panel,panel,It was a panel control., control panel, panel control,control,True,-16.072219848632812,-17.898265838623047,1.8260459899902344,14067712,EleutherAI/pythia-14m,step109000,seed7,7,109000
It was an instrument panel.,panel,panel,It was an panel instrument., instrument panel, panel instrument,instrument,False,-18.747400283813477,-24.960147857666016,6.212747573852539,14067712,EleutherAI/pythia-14m,step109000,seed7,7,109000
It was an advisory panel.,panel,panel,It was an panel advisory., advisory panel, panel advisory,advisory,False,-18.282581329345703,-25.065860748291016,6.7832794189453125,14067712,EleutherAI/pythia-14m,step109000,seed7,7,109000
It was a secret passage.,passage,passage,It was a passage secret., secret passage, passage secret,secret,False,-16.560848236083984,-20.996681213378906,4.435832977294922,14067712,EleutherAI/pythia-14m,step109000,seed7,7,109000
It was a narrow passage.,passage,passage,It was a passage narrow., narrow passage, passage narrow,narrow,False,-16.23542594909668,-21.529762268066406,5.294336318969727,14067712,EleutherAI/pythia-14m,step109000,seed7,7,109000
It was a literary passage.,passage,passage,It was a passage literary., literary passage, passage literary,literary,False,-18.116436004638672,-23.449928283691406,5.333492279052734,14067712,EleutherAI/pythia-14m,step109000,seed7,7,109000
It was a tasty perch.,perch,perch,It was a perch tasty., tasty perch, perch tasty,tasty,False,-22.026363372802734,-28.515596389770508,6.489233016967773,14067712,EleutherAI/pythia-14m,step109000,seed7,7,109000
It was a freshwater perch.,perch,perch,It was a perch freshwater., freshwater perch, perch freshwater,freshwater,True,-25.8061466217041,-30.730318069458008,4.924171447753906,14067712,EleutherAI/pythia-14m,step109000,seed7,7,109000
It was a lofty perch.,perch,perch,It was a perch lofty., lofty perch, perch lofty,lofty,False,-22.644681930541992,-28.802791595458984,6.158109664916992,14067712,EleutherAI/pythia-14m,step109000,seed7,7,109000
He saw the fast pitcher.,pitcher,pitcher,He saw the pitcher fast., fast pitcher, pitcher fast,fast,False,-20.867576599121094,-18.88092041015625,-1.9866561889648438,14067712,EleutherAI/pythia-14m,step109000,seed7,7,109000
He saw the right-handed pitcher.,pitcher,pitcher,He saw the pitcher right-handed., right-handed pitcher, pitcher right-handed,right-handed,False,-20.229442596435547,-24.568580627441406,4.339138031005859,14067712,EleutherAI/pythia-14m,step109000,seed7,7,109000
He saw the glass pitcher.,pitcher,pitcher,He saw the pitcher glass., glass pitcher, pitcher glass,glass,True,-18.46646499633789,-21.52264404296875,3.0561790466308594,14067712,EleutherAI/pythia-14m,step109000,seed7,7,109000
It was a windy port.,port,port,It was a port windy., windy port, port windy,windy,False,-22.844436645507812,-24.77642250061035,1.931985855102539,14067712,EleutherAI/pythia-14m,step109000,seed7,7,109000
It was a seaside port.,port,port,It was a port seaside., seaside port, port seaside,seaside,True,-21.72565460205078,-25.411243438720703,3.685588836669922,14067712,EleutherAI/pythia-14m,step109000,seed7,7,109000
It was a delicious port.,port,port,It was a port delicious., delicious port, port delicious,delicious,False,-19.056621551513672,-24.51563262939453,5.459011077880859,14067712,EleutherAI/pythia-14m,step109000,seed7,7,109000
He was in a distinguished position.,position,position,He was in a position distinguished., distinguished position, position distinguished,distinguished,False,-14.875783920288086,-16.626323699951172,1.750539779663086,14067712,EleutherAI/pythia-14m,step109000,seed7,7,109000
He was in a prominent position.,position,position,He was in a position prominent., prominent position, position prominent,prominent,False,-10.131601333618164,-15.853252410888672,5.721651077270508,14067712,EleutherAI/pythia-14m,step109000,seed7,7,109000
He was in a fetal position.,position,position,He was in a position fetal., fetal position, position fetal,fetal,False,-16.141393661499023,-19.412212371826172,3.2708187103271484,14067712,EleutherAI/pythia-14m,step109000,seed7,7,109000
It was a wooden post.,post,post,It was a post wooden., wooden post, post wooden,wooden,False,-18.675613403320312,-20.292205810546875,1.6165924072265625,14067712,EleutherAI/pythia-14m,step109000,seed7,7,109000
It was a fence post.,post,post,It was a post fence., fence post, post fence,fence,True,-20.04241180419922,-19.534637451171875,-0.5077743530273438,14067712,EleutherAI/pythia-14m,step109000,seed7,7,109000
It was a teaching post.,post,post,It was a post teaching., teaching post, post teaching,teaching,True,-15.916875839233398,-16.439544677734375,0.5226688385009766,14067712,EleutherAI/pythia-14m,step109000,seed7,7,109000
He had the alcoholic punch.,punch,punch,He had the punch alcoholic., alcoholic punch, punch alcoholic,alcoholic,False,-20.536258697509766,-24.751480102539062,4.215221405029297,14067712,EleutherAI/pythia-14m,step109000,seed7,7,109000
He had the fruit punch.,punch,punch,He had the punch fruit., fruit punch, punch fruit,fruit,True,-20.454925537109375,-20.812881469726562,0.3579559326171875,14067712,EleutherAI/pythia-14m,step109000,seed7,7,109000
He had the strongest punch.,punch,punch,He had the punch strongest., strongest punch, punch strongest,strongest,False,-17.84515380859375,-22.994277954101562,5.1491241455078125,14067712,EleutherAI/pythia-14m,step109000,seed7,7,109000
She had a brilliant pupil.,pupil,pupil,She had a pupil brilliant., brilliant pupil, pupil brilliant,brilliant,False,-16.46123504638672,-22.474456787109375,6.013221740722656,14067712,EleutherAI/pythia-14m,step109000,seed7,7,109000
She had an interested pupil.,pupil,pupil,She had an pupil interested., interested pupil, pupil interested,interested,False,-19.279476165771484,-22.944625854492188,3.665149688720703,14067712,EleutherAI/pythia-14m,step109000,seed7,7,109000
She had a dilated pupil.,pupil,pupil,She had a pupil dilated., dilated pupil, pupil dilated,dilated,False,-18.20836067199707,-22.412078857421875,4.203718185424805,14067712,EleutherAI/pythia-14m,step109000,seed7,7,109000
That was a loud racket.,racket,racket,That was a racket loud., loud racket, racket loud,loud,False,-19.759483337402344,-26.771169662475586,7.011686325073242,14067712,EleutherAI/pythia-14m,step109000,seed7,7,109000
That was an annoying racket.,racket,racket,That was an racket annoying., annoying racket, racket annoying,annoying,False,-18.960439682006836,-29.10411834716797,10.143678665161133,14067712,EleutherAI/pythia-14m,step109000,seed7,7,109000
That was a badminton racket.,racket,racket,That was a racket badminton., badminton racket, racket badminton,badminton,True,-25.237565994262695,-32.979305267333984,7.741739273071289,14067712,EleutherAI/pythia-14m,step109000,seed7,7,109000
He liked electronic rock.,rock,rock,He liked rock electronic., electronic rock, rock electronic,electronic,False,-21.051687240600586,-21.248615264892578,0.1969280242919922,14067712,EleutherAI/pythia-14m,step109000,seed7,7,109000
He liked alternative rock.,rock,rock,He liked rock alternative., alternative rock, rock alternative,alternative,False,-19.451244354248047,-21.898761749267578,2.4475173950195312,14067712,EleutherAI/pythia-14m,step109000,seed7,7,109000
He liked limestone rock.,rock,rock,He liked rock limestone., limestone rock, rock limestone,limestone,True,-21.87333106994629,-22.301837921142578,0.42850685119628906,14067712,EleutherAI/pythia-14m,step109000,seed7,7,109000
He saw the wise sage.,sage,sage,He saw the sage wise., wise sage, sage wise,wise,False,-18.26514434814453,-18.866989135742188,0.6018447875976562,14067712,EleutherAI/pythia-14m,step109000,seed7,7,109000
He saw the renowned sage.,sage,sage,He saw the sage renowned., renowned sage, sage renowned,renowned,False,-21.576309204101562,-22.678512573242188,1.102203369140625,14067712,EleutherAI/pythia-14m,step109000,seed7,7,109000
He saw the fragrant sage.,sage,sage,He saw the sage fragrant., fragrant sage, sage fragrant,fragrant,False,-19.758407592773438,-21.750215530395508,1.9918079376220703,14067712,EleutherAI/pythia-14m,step109000,seed7,7,109000
It was a fish scale.,scale,scale,It was a scale fish., fish scale, scale fish,fish,True,-19.069995880126953,-22.9865665435791,3.9165706634521484,14067712,EleutherAI/pythia-14m,step109000,seed7,7,109000
It was a lizard scale.,scale,scale,It was a scale lizard., lizard scale, scale lizard,lizard,True,-24.297264099121094,-26.824356079101562,2.5270919799804688,14067712,EleutherAI/pythia-14m,step109000,seed7,7,109000
It was a music scale.,scale,scale,It was a scale music., music scale, scale music,music,True,-17.59890365600586,-19.7939395904541,2.195035934448242,14067712,EleutherAI/pythia-14m,step109000,seed7,7,109000
It was a touching scene.,scene,scene,It was a scene touching., touching scene, scene touching,touching,False,-17.136207580566406,-19.937522888183594,2.8013153076171875,14067712,EleutherAI/pythia-14m,step109000,seed7,7,109000
It was a well-acted scene.,scene,scene,It was a scene well-acted., well-acted scene, scene well-acted,well-acted,False,-22.539714813232422,-29.43731689453125,6.897602081298828,14067712,EleutherAI/pythia-14m,step109000,seed7,7,109000
It was a nature scene.,scene,scene,It was a scene nature., nature scene, scene nature,nature,True,-18.57830047607422,-22.546897888183594,3.968597412109375,14067712,EleutherAI/pythia-14m,step109000,seed7,7,109000
It was a gold seal.,seal,seal,It was a seal gold., gold seal, seal gold,gold,True,-15.532524108886719,-19.9598388671875,4.427314758300781,14067712,EleutherAI/pythia-14m,step109000,seed7,7,109000
It was a certified seal.,seal,seal,It was a seal certified., certified seal, seal certified,certified,False,-19.038028717041016,-22.2276611328125,3.1896324157714844,14067712,EleutherAI/pythia-14m,step109000,seed7,7,109000
It was a circus seal.,seal,seal,It was a seal circus., circus seal, seal circus,circus,True,-22.031856536865234,-24.348388671875,2.3165321350097656,14067712,EleutherAI/pythia-14m,step109000,seed7,7,109000
He used the scotch tape.,tape,tape,He used the tape scotch., scotch tape, tape scotch,scotch,True,-26.941024780273438,-27.57802963256836,0.6370048522949219,14067712,EleutherAI/pythia-14m,step109000,seed7,7,109000
He used the double-sided tape.,tape,tape,He used the tape double-sided., double-sided tape, tape double-sided,double-sided,False,-20.725244522094727,-26.497568130493164,5.7723236083984375,14067712,EleutherAI/pythia-14m,step109000,seed7,7,109000
