sentence,word,string,reversed_sentence,mod_np,reversed_mod,disambiguating_word,non_adjective,original_logprob,reversed_logprob,ratio,n_params,mpath,revision,seed_name,seed,step
It was a linear function.,function,function,It was a function linear., linear function, function linear,linear,False,-15.447671890258789,-20.262836456298828,4.815164566040039,14067712,EleutherAI/pythia-14m,step104000,seed8,8,104000
It was a social function.,function,function,It was a function social., social function, function social,social,False,-16.601516723632812,-22.828144073486328,6.226627349853516,14067712,EleutherAI/pythia-14m,step104000,seed8,8,104000
He was on the firm ground.,ground,ground,He was on the ground firm., firm ground, ground firm,firm,False,-18.028945922851562,-15.544668197631836,-2.4842777252197266,14067712,EleutherAI/pythia-14m,step104000,seed8,8,104000
He was on the frozen ground.,ground,ground,He was on the ground frozen., frozen ground, ground frozen,frozen,False,-15.166055679321289,-16.245351791381836,1.0792961120605469,14067712,EleutherAI/pythia-14m,step104000,seed8,8,104000
He was on the camp ground.,ground,ground,He was on the ground camp., camp ground, ground camp,camp,True,-16.639461517333984,-15.029226303100586,-1.6102352142333984,14067712,EleutherAI/pythia-14m,step104000,seed8,8,104000
They liked the night guard.,guard,guard,They liked the guard night., night guard, guard night,night,True,-16.37653923034668,-17.603078842163086,1.2265396118164062,14067712,EleutherAI/pythia-14m,step104000,seed8,8,104000
They liked the security guard.,guard,guard,They liked the guard security., security guard, guard security,security,True,-15.220742225646973,-18.246021270751953,3.0252790451049805,14067712,EleutherAI/pythia-14m,step104000,seed8,8,104000
They liked the coast guard.,guard,guard,They liked the guard coast., coast guard, guard coast,coast,True,-18.571882247924805,-22.809986114501953,4.238103866577148,14067712,EleutherAI/pythia-14m,step104000,seed8,8,104000
He had an assembly guide.,guide,guide,He had an guide assembly., assembly guide, guide assembly,assembly,True,-18.949684143066406,-24.875213623046875,5.925529479980469,14067712,EleutherAI/pythia-14m,step104000,seed8,8,104000
He had a TV guide.,guide,guide,He had a guide TV., TV guide, guide TV,TV,True,-18.79294204711914,-21.404869079589844,2.611927032470703,14067712,EleutherAI/pythia-14m,step104000,seed8,8,104000
He had a talkative guide.,guide,guide,He had a guide talkative., talkative guide, guide talkative,talkative,False,-24.385162353515625,-28.183879852294922,3.798717498779297,14067712,EleutherAI/pythia-14m,step104000,seed8,8,104000
It was a summer home.,home,home,It was a home summer., summer home, home summer,summer,True,-13.2587308883667,-17.483592987060547,4.224862098693848,14067712,EleutherAI/pythia-14m,step104000,seed8,8,104000
It was a childhood home.,home,home,It was a home childhood., childhood home, home childhood,childhood,True,-13.671443939208984,-19.785289764404297,6.1138458251953125,14067712,EleutherAI/pythia-14m,step104000,seed8,8,104000
It was a funeral home.,home,home,It was a home funeral., funeral home, home funeral,funeral,False,-12.929071426391602,-18.371471405029297,5.442399978637695,14067712,EleutherAI/pythia-14m,step104000,seed8,8,104000
They had natural intelligence.,intelligence,intelligence,They had intelligence natural., natural intelligence, intelligence natural,natural,False,-17.462244033813477,-23.81838607788086,6.356142044067383,14067712,EleutherAI/pythia-14m,step104000,seed8,8,104000
They had innate intelligence.,intelligence,intelligence,They had intelligence innate., innate intelligence, intelligence innate,innate,False,-18.99052619934082,-26.01009750366211,7.019571304321289,14067712,EleutherAI/pythia-14m,step104000,seed8,8,104000
They had classified intelligence.,intelligence,intelligence,They had intelligence classified., classified intelligence, intelligence classified,classified,False,-20.13672637939453,-21.69326400756836,1.5565376281738281,14067712,EleutherAI/pythia-14m,step104000,seed8,8,104000
It was a sensitive issue.,issue,issue,It was an issue sensitive., sensitive issue, issue sensitive,sensitive,False,-13.026829719543457,-17.643983840942383,4.617154121398926,14067712,EleutherAI/pythia-14m,step104000,seed8,8,104000
It was a political issue.,issue,issue,It was an issue political., political issue, issue political,political,False,-12.487407684326172,-16.734804153442383,4.247396469116211,14067712,EleutherAI/pythia-14m,step104000,seed8,8,104000
It was a weekly issue.,issue,issue,It was an issue weekly., weekly issue, issue weekly,weekly,False,-16.22030258178711,-17.501527786254883,1.2812252044677734,14067712,EleutherAI/pythia-14m,step104000,seed8,8,104000
It was a blackberry jam.,jam,jam,It was a jam blackberry., blackberry jam, jam blackberry,blackberry,True,-21.520679473876953,-27.03870391845703,5.518024444580078,14067712,EleutherAI/pythia-14m,step104000,seed8,8,104000
It was a peach jam.,jam,jam,It was a jam peach., peach jam, jam peach,peach,False,-21.452442169189453,-24.523714065551758,3.0712718963623047,14067712,EleutherAI/pythia-14m,step104000,seed8,8,104000
It was a traffic jam.,jam,jam,It was a jam traffic., traffic jam, jam traffic,traffic,True,-16.930822372436523,-22.31462287902832,5.383800506591797,14067712,EleutherAI/pythia-14m,step104000,seed8,8,104000
It was a duplicate key.,key,key,It was a key duplicate., duplicate key, key duplicate,duplicate,False,-19.822189331054688,-17.9908504486084,-1.831338882446289,14067712,EleutherAI/pythia-14m,step104000,seed8,8,104000
It was a master key.,key,key,It was a key master., master key, key master,master,True,-19.494234085083008,-17.63458824157715,-1.8596458435058594,14067712,EleutherAI/pythia-14m,step104000,seed8,8,104000
It was a delete key.,key,key,It was a key delete., delete key, key delete,delete,False,-22.382307052612305,-20.4962215423584,-1.8860855102539062,14067712,EleutherAI/pythia-14m,step104000,seed8,8,104000
They liked the marinated lamb.,lamb,lamb,They liked the lamb marinated., marinated lamb, lamb marinated,marinated,True,-22.751140594482422,-23.99551010131836,1.2443695068359375,14067712,EleutherAI/pythia-14m,step104000,seed8,8,104000
They liked the grilled lamb.,lamb,lamb,They liked the lamb grilled., grilled lamb, lamb grilled,grilled,False,-17.377641677856445,-22.103824615478516,4.72618293762207,14067712,EleutherAI/pythia-14m,step104000,seed8,8,104000
They liked the cute lamb.,lamb,lamb,They liked the lamb cute., cute lamb, lamb cute,cute,False,-18.581558227539062,-22.186649322509766,3.605091094970703,14067712,EleutherAI/pythia-14m,step104000,seed8,8,104000
She had curly locks.,lock,locks,She had locks curly., curly locks, locks curly,curly,False,-19.82874298095703,-22.779375076293945,2.950632095336914,14067712,EleutherAI/pythia-14m,step104000,seed8,8,104000
She had brown locks.,lock,locks,She had locks brown., brown locks, locks brown,brown,False,-19.764015197753906,-23.535783767700195,3.771768569946289,14067712,EleutherAI/pythia-14m,step104000,seed8,8,104000
She had window locks.,lock,locks,She had locks window., window locks, locks window,window,True,-19.30282211303711,-21.046648025512695,1.743825912475586,14067712,EleutherAI/pythia-14m,step104000,seed8,8,104000
They liked the hot lunch.,lunch,lunch,They liked the lunch hot., hot lunch, lunch hot,hot,False,-15.620035171508789,-18.255393981933594,2.6353588104248047,14067712,EleutherAI/pythia-14m,step104000,seed8,8,104000
They liked the sandwich lunch.,lunch,lunch,They liked the lunch sandwich., sandwich lunch, lunch sandwich,sandwich,True,-18.208051681518555,-17.217063903808594,-0.9909877777099609,14067712,EleutherAI/pythia-14m,step104000,seed8,8,104000
They liked the afternoon lunch.,lunch,lunch,They liked the lunch afternoon., afternoon lunch, lunch afternoon,afternoon,True,-15.224015235900879,-17.767723083496094,2.543707847595215,14067712,EleutherAI/pythia-14m,step104000,seed8,8,104000
He liked the flea market.,market,market,He liked the market flea., flea market, market flea,flea,True,-17.476566314697266,-23.005958557128906,5.529392242431641,14067712,EleutherAI/pythia-14m,step104000,seed8,8,104000
He liked the fish market.,market,market,He liked the market fish., fish market, market fish,fish,True,-15.867716789245605,-19.15915870666504,3.2914419174194336,14067712,EleutherAI/pythia-14m,step104000,seed8,8,104000
He liked the housing market.,market,market,He liked the market housing., housing market, market housing,housing,True,-14.46695327758789,-18.10978126525879,3.6428279876708984,14067712,EleutherAI/pythia-14m,step104000,seed8,8,104000
It was a lit match.,match,match,It was a match lit., lit match, match lit,lit,False,-20.25616455078125,-20.036510467529297,-0.21965408325195312,14067712,EleutherAI/pythia-14m,step104000,seed8,8,104000
It was a burning match.,match,match,It was a match burning., burning match, match burning,burning,False,-18.52291488647461,-20.786937713623047,2.2640228271484375,14067712,EleutherAI/pythia-14m,step104000,seed8,8,104000
It was a soccer match.,match,match,It was a match soccer., soccer match, match soccer,soccer,True,-15.849801063537598,-23.002330780029297,7.152529716491699,14067712,EleutherAI/pythia-14m,step104000,seed8,8,104000
It was cough medicine.,medicine,medicine,It was medicine cough., cough medicine, medicine cough,cough,True,-22.362300872802734,-23.491371154785156,1.1290702819824219,14067712,EleutherAI/pythia-14m,step104000,seed8,8,104000
It was prescription medicine.,medicine,medicine,It was medicine prescription., prescription medicine, medicine prescription,prescription,True,-18.74641990661621,-22.232826232910156,3.4864063262939453,14067712,EleutherAI/pythia-14m,step104000,seed8,8,104000
It was orthopedic medicine.,medicine,medicine,It was medicine orthopedic., orthopedic medicine, medicine orthopedic,orthopedic,False,-19.14894676208496,-24.030017852783203,4.881071090698242,14067712,EleutherAI/pythia-14m,step104000,seed8,8,104000
There was a phone message.,message,message,There was a message phone., phone message, message phone,phone,True,-14.332313537597656,-16.61626434326172,2.2839508056640625,14067712,EleutherAI/pythia-14m,step104000,seed8,8,104000
There was a computer message.,message,message,There was a message computer., computer message, message computer,computer,True,-17.18552017211914,-18.24108123779297,1.0555610656738281,14067712,EleutherAI/pythia-14m,step104000,seed8,8,104000
There was an urgent message.,message,message,There was an message urgent., urgent message, message urgent,urgent,False,-13.144667625427246,-24.22549819946289,11.080830574035645,14067712,EleutherAI/pythia-14m,step104000,seed8,8,104000
It was a fungal mold.,mold,mold,It was a mold fungal., fungal mold, mold fungal,fungal,False,-21.733394622802734,-22.67157745361328,0.9381828308105469,14067712,EleutherAI/pythia-14m,step104000,seed8,8,104000
It was a harmful mold.,mold,mold,It was a mold harmful., harmful mold, mold harmful,harmful,False,-21.960811614990234,-23.40918731689453,1.4483757019042969,14067712,EleutherAI/pythia-14m,step104000,seed8,8,104000
It was a rubber mold.,mold,mold,It was a mold rubber., rubber mold, mold rubber,rubber,True,-19.10144805908203,-21.19074249267578,2.08929443359375,14067712,EleutherAI/pythia-14m,step104000,seed8,8,104000
She saw the cancerous mole.,mole,mole,She saw the mole cancerous., cancerous mole, mole cancerous,cancerous,False,-24.673145294189453,-30.33211326599121,5.658967971801758,14067712,EleutherAI/pythia-14m,step104000,seed8,8,104000
She saw the raised mole.,mole,mole,She saw the mole raised., raised mole, mole raised,raised,False,-23.457962036132812,-21.25834083557129,-2.1996212005615234,14067712,EleutherAI/pythia-14m,step104000,seed8,8,104000
She saw the cute mole.,mole,mole,She saw the mole cute., cute mole, mole cute,cute,False,-20.587894439697266,-25.50461769104004,4.916723251342773,14067712,EleutherAI/pythia-14m,step104000,seed8,8,104000
He liked the rhythmic movement.,movement,movement,He liked the movement rhythmic., rhythmic movement, movement rhythmic,rhythmic,False,-19.277420043945312,-24.637495040893555,5.360074996948242,14067712,EleutherAI/pythia-14m,step104000,seed8,8,104000
He liked the graceful movement.,movement,movement,He liked the movement graceful., graceful movement, movement graceful,graceful,False,-16.869056701660156,-23.865419387817383,6.996362686157227,14067712,EleutherAI/pythia-14m,step104000,seed8,8,104000
He liked the feminist movement.,movement,movement,He liked the movement feminist., feminist movement, movement feminist,feminist,True,-16.308917999267578,-23.700807571411133,7.391889572143555,14067712,EleutherAI/pythia-14m,step104000,seed8,8,104000
It was a national newspaper.,newspaper,newspaper,It was a newspaper national., national newspaper, newspaper national,national,False,-14.243391036987305,-20.44530487060547,6.201913833618164,14067712,EleutherAI/pythia-14m,step104000,seed8,8,104000
It was a daily newspaper.,newspaper,newspaper,It was a newspaper daily., daily newspaper, newspaper daily,daily,False,-15.674915313720703,-18.36876678466797,2.6938514709472656,14067712,EleutherAI/pythia-14m,step104000,seed8,8,104000
It was a faded newspaper.,newspaper,newspaper,It was a newspaper faded., faded newspaper, newspaper faded,faded,False,-20.216053009033203,-22.00933074951172,1.7932777404785156,14067712,EleutherAI/pythia-14m,step104000,seed8,8,104000
It was a juicy orange.,orange,orange,It was an orange juicy., juicy orange, orange juicy,juicy,False,-18.186187744140625,-20.825151443481445,2.6389636993408203,14067712,EleutherAI/pythia-14m,step104000,seed8,8,104000
It was a ripe orange.,orange,orange,It was an orange ripe., ripe orange, orange ripe,ripe,False,-18.025964736938477,-19.84137725830078,1.8154125213623047,14067712,EleutherAI/pythia-14m,step104000,seed8,8,104000
It was a bright orange.,orange,orange,It was an orange bright., bright orange, orange bright,bright,False,-13.34919548034668,-16.04138946533203,2.6921939849853516,14067712,EleutherAI/pythia-14m,step104000,seed8,8,104000
He saw the young page.,page,page,He saw the page young., young page, page young,young,False,-16.675607681274414,-21.308441162109375,4.632833480834961,14067712,EleutherAI/pythia-14m,step104000,seed8,8,104000
He saw the loyal page.,page,page,He saw the page loyal., loyal page, page loyal,loyal,False,-23.56670570373535,-23.507965087890625,-0.05874061584472656,14067712,EleutherAI/pythia-14m,step104000,seed8,8,104000
He saw the blank page.,page,page,He saw the page blank., blank page, page blank,blank,False,-13.800355911254883,-17.666839599609375,3.866483688354492,14067712,EleutherAI/pythia-14m,step104000,seed8,8,104000
It was a calloused palm.,palm,palm,It was a palm calloused., calloused palm, palm calloused,calloused,False,-30.027952194213867,-32.667694091796875,2.639741897583008,14067712,EleutherAI/pythia-14m,step104000,seed8,8,104000
It was a wrinkled palm.,palm,palm,It was a palm wrinkled., wrinkled palm, palm wrinkled,wrinkled,False,-21.754810333251953,-24.92215919494629,3.167348861694336,14067712,EleutherAI/pythia-14m,step104000,seed8,8,104000
It was a tropical palm.,palm,palm,It was a palm tropical., tropical palm, palm tropical,tropical,False,-18.826875686645508,-23.827922821044922,5.001047134399414,14067712,EleutherAI/pythia-14m,step104000,seed8,8,104000
It was a control panel.,panel,panel,It was a panel control., control panel, panel control,control,True,-14.00096321105957,-19.26885986328125,5.26789665222168,14067712,EleutherAI/pythia-14m,step104000,seed8,8,104000
It was an instrument panel.,panel,panel,It was an panel instrument., instrument panel, panel instrument,instrument,False,-16.81830406188965,-25.472721099853516,8.654417037963867,14067712,EleutherAI/pythia-14m,step104000,seed8,8,104000
It was an advisory panel.,panel,panel,It was an panel advisory., advisory panel, panel advisory,advisory,False,-15.658405303955078,-26.622318267822266,10.963912963867188,14067712,EleutherAI/pythia-14m,step104000,seed8,8,104000
It was a secret passage.,passage,passage,It was a passage secret., secret passage, passage secret,secret,False,-14.188077926635742,-22.170692443847656,7.982614517211914,14067712,EleutherAI/pythia-14m,step104000,seed8,8,104000
It was a narrow passage.,passage,passage,It was a passage narrow., narrow passage, passage narrow,narrow,False,-14.444003105163574,-22.629615783691406,8.185612678527832,14067712,EleutherAI/pythia-14m,step104000,seed8,8,104000
It was a literary passage.,passage,passage,It was a passage literary., literary passage, passage literary,literary,False,-18.0087833404541,-25.116432189941406,7.107648849487305,14067712,EleutherAI/pythia-14m,step104000,seed8,8,104000
It was a tasty perch.,perch,perch,It was a perch tasty., tasty perch, perch tasty,tasty,False,-22.7486629486084,-27.839099884033203,5.090436935424805,14067712,EleutherAI/pythia-14m,step104000,seed8,8,104000
It was a freshwater perch.,perch,perch,It was a perch freshwater., freshwater perch, perch freshwater,freshwater,True,-22.132413864135742,-29.067249298095703,6.934835433959961,14067712,EleutherAI/pythia-14m,step104000,seed8,8,104000
It was a lofty perch.,perch,perch,It was a perch lofty., lofty perch, perch lofty,lofty,False,-22.067249298095703,-27.645742416381836,5.578493118286133,14067712,EleutherAI/pythia-14m,step104000,seed8,8,104000
He saw the fast pitcher.,pitcher,pitcher,He saw the pitcher fast., fast pitcher, pitcher fast,fast,False,-18.836544036865234,-18.43659210205078,-0.3999519348144531,14067712,EleutherAI/pythia-14m,step104000,seed8,8,104000
He saw the right-handed pitcher.,pitcher,pitcher,He saw the pitcher right-handed., right-handed pitcher, pitcher right-handed,right-handed,False,-22.765750885009766,-24.48223876953125,1.7164878845214844,14067712,EleutherAI/pythia-14m,step104000,seed8,8,104000
He saw the glass pitcher.,pitcher,pitcher,He saw the pitcher glass., glass pitcher, pitcher glass,glass,True,-19.522418975830078,-21.38367462158203,1.8612556457519531,14067712,EleutherAI/pythia-14m,step104000,seed8,8,104000
It was a windy port.,port,port,It was a port windy., windy port, port windy,windy,False,-22.624897003173828,-25.305217742919922,2.6803207397460938,14067712,EleutherAI/pythia-14m,step104000,seed8,8,104000
It was a seaside port.,port,port,It was a port seaside., seaside port, port seaside,seaside,True,-17.967260360717773,-25.182968139648438,7.215707778930664,14067712,EleutherAI/pythia-14m,step104000,seed8,8,104000
It was a delicious port.,port,port,It was a port delicious., delicious port, port delicious,delicious,False,-17.01084327697754,-23.45309066772461,6.44224739074707,14067712,EleutherAI/pythia-14m,step104000,seed8,8,104000
He was in a distinguished position.,position,position,He was in a position distinguished., distinguished position, position distinguished,distinguished,False,-12.469711303710938,-16.550962448120117,4.08125114440918,14067712,EleutherAI/pythia-14m,step104000,seed8,8,104000
He was in a prominent position.,position,position,He was in a position prominent., prominent position, position prominent,prominent,False,-12.149223327636719,-16.211912155151367,4.062688827514648,14067712,EleutherAI/pythia-14m,step104000,seed8,8,104000
He was in a fetal position.,position,position,He was in a position fetal., fetal position, position fetal,fetal,False,-16.051816940307617,-18.700986862182617,2.649169921875,14067712,EleutherAI/pythia-14m,step104000,seed8,8,104000
It was a wooden post.,post,post,It was a post wooden., wooden post, post wooden,wooden,False,-17.789966583251953,-21.40250587463379,3.612539291381836,14067712,EleutherAI/pythia-14m,step104000,seed8,8,104000
It was a fence post.,post,post,It was a post fence., fence post, post fence,fence,True,-21.207365036010742,-22.02616310119629,0.8187980651855469,14067712,EleutherAI/pythia-14m,step104000,seed8,8,104000
It was a teaching post.,post,post,It was a post teaching., teaching post, post teaching,teaching,True,-15.86144733428955,-19.18143653869629,3.3199892044067383,14067712,EleutherAI/pythia-14m,step104000,seed8,8,104000
He had the alcoholic punch.,punch,punch,He had the punch alcoholic., alcoholic punch, punch alcoholic,alcoholic,False,-22.162010192871094,-26.494731903076172,4.332721710205078,14067712,EleutherAI/pythia-14m,step104000,seed8,8,104000
He had the fruit punch.,punch,punch,He had the punch fruit., fruit punch, punch fruit,fruit,True,-21.026376724243164,-20.82627296447754,-0.200103759765625,14067712,EleutherAI/pythia-14m,step104000,seed8,8,104000
He had the strongest punch.,punch,punch,He had the punch strongest., strongest punch, punch strongest,strongest,False,-15.083307266235352,-21.48209571838379,6.3987884521484375,14067712,EleutherAI/pythia-14m,step104000,seed8,8,104000
She had a brilliant pupil.,pupil,pupil,She had a pupil brilliant., brilliant pupil, pupil brilliant,brilliant,False,-17.977710723876953,-23.68016815185547,5.702457427978516,14067712,EleutherAI/pythia-14m,step104000,seed8,8,104000
She had an interested pupil.,pupil,pupil,She had an pupil interested., interested pupil, pupil interested,interested,False,-18.276012420654297,-24.505361557006836,6.229349136352539,14067712,EleutherAI/pythia-14m,step104000,seed8,8,104000
She had a dilated pupil.,pupil,pupil,She had a pupil dilated., dilated pupil, pupil dilated,dilated,False,-20.05217742919922,-24.55840301513672,4.5062255859375,14067712,EleutherAI/pythia-14m,step104000,seed8,8,104000
That was a loud racket.,racket,racket,That was a racket loud., loud racket, racket loud,loud,False,-18.006715774536133,-23.03942108154297,5.032705307006836,14067712,EleutherAI/pythia-14m,step104000,seed8,8,104000
That was an annoying racket.,racket,racket,That was an racket annoying., annoying racket, racket annoying,annoying,False,-17.59792709350586,-25.659587860107422,8.061660766601562,14067712,EleutherAI/pythia-14m,step104000,seed8,8,104000
That was a badminton racket.,racket,racket,That was a racket badminton., badminton racket, racket badminton,badminton,True,-30.606054306030273,-33.235740661621094,2.6296863555908203,14067712,EleutherAI/pythia-14m,step104000,seed8,8,104000
He liked electronic rock.,rock,rock,He liked rock electronic., electronic rock, rock electronic,electronic,False,-20.89020538330078,-21.418193817138672,0.5279884338378906,14067712,EleutherAI/pythia-14m,step104000,seed8,8,104000
He liked alternative rock.,rock,rock,He liked rock alternative., alternative rock, rock alternative,alternative,False,-20.146163940429688,-21.749309539794922,1.6031455993652344,14067712,EleutherAI/pythia-14m,step104000,seed8,8,104000
He liked limestone rock.,rock,rock,He liked rock limestone., limestone rock, rock limestone,limestone,True,-17.70525550842285,-19.269756317138672,1.5645008087158203,14067712,EleutherAI/pythia-14m,step104000,seed8,8,104000
He saw the wise sage.,sage,sage,He saw the sage wise., wise sage, sage wise,wise,False,-21.122459411621094,-22.518314361572266,1.3958549499511719,14067712,EleutherAI/pythia-14m,step104000,seed8,8,104000
He saw the renowned sage.,sage,sage,He saw the sage renowned., renowned sage, sage renowned,renowned,False,-20.1851749420166,-22.725894927978516,2.540719985961914,14067712,EleutherAI/pythia-14m,step104000,seed8,8,104000
He saw the fragrant sage.,sage,sage,He saw the sage fragrant., fragrant sage, sage fragrant,fragrant,False,-22.782936096191406,-22.543121337890625,-0.23981475830078125,14067712,EleutherAI/pythia-14m,step104000,seed8,8,104000
It was a fish scale.,scale,scale,It was a scale fish., fish scale, scale fish,fish,True,-21.505565643310547,-22.617351531982422,1.111785888671875,14067712,EleutherAI/pythia-14m,step104000,seed8,8,104000
It was a lizard scale.,scale,scale,It was a scale lizard., lizard scale, scale lizard,lizard,True,-22.852968215942383,-27.222076416015625,4.369108200073242,14067712,EleutherAI/pythia-14m,step104000,seed8,8,104000
It was a music scale.,scale,scale,It was a scale music., music scale, scale music,music,True,-19.133899688720703,-21.540142059326172,2.4062423706054688,14067712,EleutherAI/pythia-14m,step104000,seed8,8,104000
It was a touching scene.,scene,scene,It was a scene touching., touching scene, scene touching,touching,False,-14.850266456604004,-16.93282699584961,2.0825605392456055,14067712,EleutherAI/pythia-14m,step104000,seed8,8,104000
It was a well-acted scene.,scene,scene,It was a scene well-acted., well-acted scene, scene well-acted,well-acted,False,-25.173799514770508,-27.767005920410156,2.5932064056396484,14067712,EleutherAI/pythia-14m,step104000,seed8,8,104000
It was a nature scene.,scene,scene,It was a scene nature., nature scene, scene nature,nature,True,-18.280921936035156,-18.57632064819336,0.2953987121582031,14067712,EleutherAI/pythia-14m,step104000,seed8,8,104000
It was a gold seal.,seal,seal,It was a seal gold., gold seal, seal gold,gold,True,-15.749332427978516,-24.28997039794922,8.540637969970703,14067712,EleutherAI/pythia-14m,step104000,seed8,8,104000
It was a certified seal.,seal,seal,It was a seal certified., certified seal, seal certified,certified,False,-18.387855529785156,-18.45964813232422,0.0717926025390625,14067712,EleutherAI/pythia-14m,step104000,seed8,8,104000
It was a circus seal.,seal,seal,It was a seal circus., circus seal, seal circus,circus,True,-22.97513198852539,-23.72789764404297,0.7527656555175781,14067712,EleutherAI/pythia-14m,step104000,seed8,8,104000
He used the scotch tape.,tape,tape,He used the tape scotch., scotch tape, tape scotch,scotch,True,-22.046443939208984,-25.08738136291504,3.0409374237060547,14067712,EleutherAI/pythia-14m,step104000,seed8,8,104000
He used the double-sided tape.,tape,tape,He used the tape double-sided., double-sided tape, tape double-sided,double-sided,False,-20.444313049316406,-27.250547409057617,6.806234359741211,14067712,EleutherAI/pythia-14m,step104000,seed8,8,104000
