sentence,word,string,reversed_sentence,mod_np,reversed_mod,disambiguating_word,non_adjective,original_logprob,reversed_logprob,ratio,n_params,mpath,revision,seed_name,seed,step
It was a desperate act.,act,act,It was an act desperate., desperate act, act desperate,desperate,False,-22.659297943115234,-22.923009872436523,0.26371192932128906,14067712,EleutherAI/pythia-14m,step0,seed4,4,0
It was a humane act.,act,act,It was an act humane., humane act, act humane,humane,False,-32.60059356689453,-32.01240539550781,-0.5881881713867188,14067712,EleutherAI/pythia-14m,step0,seed4,4,0
It was a magic act.,act,act,It was an act magic., magic act, act magic,magic,False,-22.602678298950195,-22.116580963134766,-0.4860973358154297,14067712,EleutherAI/pythia-14m,step0,seed4,4,0
He had a universal appeal.,appeal,appeal,He had an appeal universal., universal appeal, appeal universal,universal,False,-22.868724822998047,-23.252771377563477,0.3840465545654297,14067712,EleutherAI/pythia-14m,step0,seed4,4,0
He had an undefinable appeal.,appeal,appeal,He had an appeal undefinable., undefinable appeal, appeal undefinable,undefinable,False,-42.076683044433594,-42.433204650878906,0.3565216064453125,14067712,EleutherAI/pythia-14m,step0,seed4,4,0
He had a legal appeal.,appeal,appeal,He had an appeal legal., legal appeal, appeal legal,legal,False,-20.485713958740234,-21.976146697998047,1.4904327392578125,14067712,EleutherAI/pythia-14m,step0,seed4,4,0
It was a tense atmosphere.,atmosphere,atmosphere,It was an atmosphere tense., tense atmosphere, atmosphere tense,tense,False,-21.324630737304688,-20.984683990478516,-0.3399467468261719,14067712,EleutherAI/pythia-14m,step0,seed4,4,0
It was a hostile atmosphere.,atmosphere,atmosphere,It was an atmosphere hostile., hostile atmosphere, atmosphere hostile,hostile,False,-21.170555114746094,-20.416259765625,-0.7542953491210938,14067712,EleutherAI/pythia-14m,step0,seed4,4,0
It was a gaseous atmosphere.,atmosphere,atmosphere,It was an atmosphere gaseous., gaseous atmosphere, atmosphere gaseous,gaseous,False,-21.94663429260254,-21.003475189208984,-0.9431591033935547,14067712,EleutherAI/pythia-14m,step0,seed4,4,0
It was a gold band.,band,band,It was a band gold., gold band, band gold,gold,True,-23.18926239013672,-23.25741195678711,0.06814956665039062,14067712,EleutherAI/pythia-14m,step0,seed4,4,0
It was a rubber band.,band,band,It was a band rubber., rubber band, band rubber,rubber,True,-22.455699920654297,-22.323070526123047,-0.13262939453125,14067712,EleutherAI/pythia-14m,step0,seed4,4,0
It was a jazz band.,band,band,It was a band jazz., jazz band, band jazz,jazz,True,-23.502349853515625,-21.82268524169922,-1.6796646118164062,14067712,EleutherAI/pythia-14m,step0,seed4,4,0
There was a police barrier.,barrier,barrier,There was a barrier police., police barrier, barrier police,police,True,-21.747817993164062,-21.398845672607422,-0.3489723205566406,14067712,EleutherAI/pythia-14m,step0,seed4,4,0
There was a concrete barrier.,barrier,barrier,There was a barrier concrete., concrete barrier, barrier concrete,concrete,False,-22.374004364013672,-23.65991973876953,1.2859153747558594,14067712,EleutherAI/pythia-14m,step0,seed4,4,0
There was a language barrier.,barrier,barrier,There was a barrier language., language barrier, barrier language,language,True,-22.959985733032227,-22.138362884521484,-0.8216228485107422,14067712,EleutherAI/pythia-14m,step0,seed4,4,0
He saw a furry bat.,bat,bat,He saw a bat furry., furry bat, bat furry,furry,False,-33.950836181640625,-33.810890197753906,-0.13994598388671875,14067712,EleutherAI/pythia-14m,step0,seed4,4,0
He saw a fruit bat.,bat,bat,He saw a bat fruit., fruit bat, bat fruit,fruit,True,-22.733558654785156,-21.38143539428711,-1.3521232604980469,14067712,EleutherAI/pythia-14m,step0,seed4,4,0
He saw a wooden bat.,bat,bat,He saw a bat wooden., wooden bat, bat wooden,wooden,False,-21.966991424560547,-21.878490447998047,-0.0885009765625,14067712,EleutherAI/pythia-14m,step0,seed4,4,0
He saw the laser beam.,beam,beam,He saw the beam laser., laser beam, beam laser,laser,True,-20.54784393310547,-21.214805603027344,0.666961669921875,14067712,EleutherAI/pythia-14m,step0,seed4,4,0
He saw the bright beam.,beam,beam,He saw the beam bright., bright beam, beam bright,bright,False,-21.420806884765625,-21.474075317382812,0.0532684326171875,14067712,EleutherAI/pythia-14m,step0,seed4,4,0
He saw the wood beam.,beam,beam,He saw the beam wood., wood beam, beam wood,wood,True,-21.537662506103516,-20.46120834350586,-1.0764541625976562,14067712,EleutherAI/pythia-14m,step0,seed4,4,0
She had a toy block.,block,block,She had a block toy., toy block, block toy,toy,True,-20.752424240112305,-20.5440673828125,-0.2083568572998047,14067712,EleutherAI/pythia-14m,step0,seed4,4,0
She had a wooden block.,block,block,She had a block wooden., wooden block, block wooden,wooden,False,-22.193065643310547,-21.20226287841797,-0.9908027648925781,14067712,EleutherAI/pythia-14m,step0,seed4,4,0
She had a mental block.,block,block,She had a block mental., mental block, block mental,mental,False,-20.734359741210938,-21.661300659179688,0.92694091796875,14067712,EleutherAI/pythia-14m,step0,seed4,4,0
He has coagulated blood.,blood,blood,He has blood coagulated., coagulated blood, blood coagulated,coagulated,True,-46.82229995727539,-46.65993118286133,-0.1623687744140625,14067712,EleutherAI/pythia-14m,step0,seed4,4,0
He has thin blood.,blood,blood,He has blood thin., thin blood, blood thin,thin,False,-20.897197723388672,-21.547382354736328,0.6501846313476562,14067712,EleutherAI/pythia-14m,step0,seed4,4,0
He has noble blood.,blood,blood,He has blood noble., noble blood, blood noble,noble,False,-21.05803871154785,-21.556289672851562,0.49825096130371094,14067712,EleutherAI/pythia-14m,step0,seed4,4,0
It was the ironing board.,board,board,It was the board ironing., ironing board, board ironing,ironing,False,-33.25727844238281,-32.304656982421875,-0.9526214599609375,14067712,EleutherAI/pythia-14m,step0,seed4,4,0
It was the wooden board.,board,board,It was the board wooden., wooden board, board wooden,wooden,False,-20.539047241210938,-19.92923927307129,-0.6098079681396484,14067712,EleutherAI/pythia-14m,step0,seed4,4,0
It was the executive board.,board,board,It was the board executive., executive board, board executive,executive,True,-22.964553833007812,-21.962369918823242,-1.0021839141845703,14067712,EleutherAI/pythia-14m,step0,seed4,4,0
He had a best-selling book.,book,book,He had a book best-selling., best-selling book, book best-selling,best-selling,False,-44.35791015625,-44.52635955810547,0.16844940185546875,14067712,EleutherAI/pythia-14m,step0,seed4,4,0
He had a popular book.,book,book,He had a book popular., popular book, book popular,popular,False,-23.781587600708008,-22.580368041992188,-1.2012195587158203,14067712,EleutherAI/pythia-14m,step0,seed4,4,0
He had a heavy book.,book,book,He had a book heavy., heavy book, book heavy,heavy,False,-22.76849365234375,-22.486509323120117,-0.2819843292236328,14067712,EleutherAI/pythia-14m,step0,seed4,4,0
They ate a pancake breakfast.,breakfast,breakfast,They ate a breakfast pancake., pancake breakfast, breakfast pancake,pancake,True,-32.27451705932617,-31.13165283203125,-1.1428642272949219,14067712,EleutherAI/pythia-14m,step0,seed4,4,0
They ate a nutritious breakfast.,breakfast,breakfast,They ate a breakfast nutritious., nutritious breakfast, breakfast nutritious,nutritious,False,-44.57939147949219,-43.89868927001953,-0.6807022094726562,14067712,EleutherAI/pythia-14m,step0,seed4,4,0
They ate a family breakfast.,breakfast,breakfast,They ate a breakfast family., family breakfast, breakfast family,family,True,-21.661985397338867,-21.545364379882812,-0.11662101745605469,14067712,EleutherAI/pythia-14m,step0,seed4,4,0
It was a red cape.,cape,cape,It was a cape red., red cape, cape red,red,False,-35.70451354980469,-35.4198112487793,-0.2847023010253906,14067712,EleutherAI/pythia-14m,step0,seed4,4,0
It was a flowing cape.,cape,cape,It was a cape flowing., flowing cape, cape flowing,flowing,False,-35.104339599609375,-35.690921783447266,0.5865821838378906,14067712,EleutherAI/pythia-14m,step0,seed4,4,0
It was a rocky cape.,cape,cape,It was a cape rocky., rocky cape, cape rocky,rocky,False,-33.102996826171875,-34.31956481933594,1.2165679931640625,14067712,EleutherAI/pythia-14m,step0,seed4,4,0
It was a beer case.,case,case,It was a case beer., beer case, case beer,beer,True,-21.51396369934082,-21.70600128173828,0.19203758239746094,14067712,EleutherAI/pythia-14m,step0,seed4,4,0
It was a display case.,case,case,It was a case display., display case, case display,display,True,-22.727497100830078,-22.453773498535156,-0.2737236022949219,14067712,EleutherAI/pythia-14m,step0,seed4,4,0
It was a divorce case.,case,case,It was a case divorce., divorce case, case divorce,divorce,True,-23.413616180419922,-21.816112518310547,-1.597503662109375,14067712,EleutherAI/pythia-14m,step0,seed4,4,0
It was a worthy cause.,cause,cause,It was a cause worthy., worthy cause, cause worthy,worthy,False,-21.548261642456055,-23.361101150512695,1.8128395080566406,14067712,EleutherAI/pythia-14m,step0,seed4,4,0
It was a political cause.,cause,cause,It was a cause political., political cause, cause political,political,False,-22.942615509033203,-23.780256271362305,0.8376407623291016,14067712,EleutherAI/pythia-14m,step0,seed4,4,0
It was a main cause.,cause,cause,It was a cause main., main cause, cause main,main,False,-23.576927185058594,-23.135986328125,-0.44094085693359375,14067712,EleutherAI/pythia-14m,step0,seed4,4,0
It was a skin cell.,cell,cell,It was a cell skin., skin cell, cell skin,skin,True,-22.690258026123047,-20.89594268798828,-1.7943153381347656,14067712,EleutherAI/pythia-14m,step0,seed4,4,0
It was a brain cell.,cell,cell,It was a cell brain., brain cell, cell brain,brain,True,-21.887561798095703,-21.825130462646484,-0.06243133544921875,14067712,EleutherAI/pythia-14m,step0,seed4,4,0
It was a prison cell.,cell,cell,It was a cell prison., prison cell, cell prison,prison,True,-21.525447845458984,-22.185882568359375,0.6604347229003906,14067712,EleutherAI/pythia-14m,step0,seed4,4,0
She had a devilish charm.,charm,charm,She had a charm devilish., devilish charm, charm devilish,devilish,False,-32.13331604003906,-32.265235900878906,0.13191986083984375,14067712,EleutherAI/pythia-14m,step0,seed4,4,0
She had a natural charm.,charm,charm,She had a charm natural., natural charm, charm natural,natural,False,-21.89153289794922,-21.71468734741211,-0.17684555053710938,14067712,EleutherAI/pythia-14m,step0,seed4,4,0
She had a gold charm.,charm,charm,She had a charm gold., gold charm, charm gold,gold,True,-22.038509368896484,-22.174808502197266,0.13629913330078125,14067712,EleutherAI/pythia-14m,step0,seed4,4,0
They liked the juicy chicken.,chicken,chicken,They liked the chicken juicy., juicy chicken, chicken juicy,juicy,False,-33.527103424072266,-33.44825744628906,-0.07884597778320312,14067712,EleutherAI/pythia-14m,step0,seed4,4,0
They liked the roasted chicken.,chicken,chicken,They liked the chicken roasted., roasted chicken, chicken roasted,roasted,False,-21.776357650756836,-22.250667572021484,0.47430992126464844,14067712,EleutherAI/pythia-14m,step0,seed4,4,0
They liked the clucking chicken.,chicken,chicken,They liked the chicken clucking., clucking chicken, chicken clucking,clucking,True,-34.800392150878906,-33.23529815673828,-1.565093994140625,14067712,EleutherAI/pythia-14m,step0,seed4,4,0
It was a perceptive class.,class,class,It was a class perceptive., perceptive class, class perceptive,perceptive,False,-33.747554779052734,-32.650901794433594,-1.0966529846191406,14067712,EleutherAI/pythia-14m,step0,seed4,4,0
It was a misbehaving class.,class,class,It was a class misbehaving., misbehaving class, class misbehaving,misbehaving,False,-45.70790100097656,-44.6834602355957,-1.0244407653808594,14067712,EleutherAI/pythia-14m,step0,seed4,4,0
It was a boring class.,class,class,It was a class boring., boring class, class boring,boring,False,-22.564218521118164,-23.08765411376953,0.5234355926513672,14067712,EleutherAI/pythia-14m,step0,seed4,4,0
It was a film clip.,clip,clip,It was a clip film., film clip, clip film,film,True,-22.60357666015625,-22.324411392211914,-0.27916526794433594,14067712,EleutherAI/pythia-14m,step0,seed4,4,0
It was a video clip.,clip,clip,It was a clip video., video clip, clip video,video,True,-20.83008575439453,-22.17587661743164,1.3457908630371094,14067712,EleutherAI/pythia-14m,step0,seed4,4,0
It was a hair clip.,clip,clip,It was a clip hair., hair clip, clip hair,hair,True,-22.703941345214844,-22.162845611572266,-0.5410957336425781,14067712,EleutherAI/pythia-14m,step0,seed4,4,0
It was an icy cold.,cold,cold,It was an cold icy., icy cold, cold icy,icy,False,-21.520063400268555,-21.117416381835938,-0.4026470184326172,14067712,EleutherAI/pythia-14m,step0,seed4,4,0
It was a freezing cold.,cold,cold,It was a cold freezing., freezing cold, cold freezing,freezing,False,-21.12095069885254,-20.191558837890625,-0.9293918609619141,14067712,EleutherAI/pythia-14m,step0,seed4,4,0
It was a chest cold.,cold,cold,It was a cold chest., chest cold, cold chest,chest,False,-23.873538970947266,-21.283695220947266,-2.58984375,14067712,EleutherAI/pythia-14m,step0,seed4,4,0
It was a gossip column.,column,column,It was a column gossip., gossip column, column gossip,gossip,True,-21.649795532226562,-22.03577995300293,0.3859844207763672,14067712,EleutherAI/pythia-14m,step0,seed4,4,0
It was a sports column.,column,column,It was a column sports., sports column, column sports,sports,True,-21.9700927734375,-21.506845474243164,-0.46324729919433594,14067712,EleutherAI/pythia-14m,step0,seed4,4,0
It was a concrete column.,column,column,It was a column concrete., concrete column, column concrete,concrete,False,-22.735401153564453,-22.29930877685547,-0.4360923767089844,14067712,EleutherAI/pythia-14m,step0,seed4,4,0
He liked the investment company.,company,company,He liked the company investment., investment company, company investment,investment,True,-22.63955307006836,-22.15202522277832,-0.48752784729003906,14067712,EleutherAI/pythia-14m,step0,seed4,4,0
He liked the pharmaceutical company.,company,company,He liked the company pharmaceutical., pharmaceutical company, company pharmaceutical,pharmaceutical,False,-23.894329071044922,-23.68777847290039,-0.20655059814453125,14067712,EleutherAI/pythia-14m,step0,seed4,4,0
He liked the pleasant company.,company,company,He liked the company pleasant., pleasant company, company pleasant,pleasant,False,-22.34854507446289,-21.747386932373047,-0.6011581420898438,14067712,EleutherAI/pythia-14m,step0,seed4,4,0
It was a waffle cone.,cone,cone,It was a cone waffle., waffle cone, cone waffle,waffle,True,-43.654014587402344,-44.75031661987305,1.0963020324707031,14067712,EleutherAI/pythia-14m,step0,seed4,4,0
It was a sugar cone.,cone,cone,It was a cone sugar., sugar cone, cone sugar,sugar,True,-21.997222900390625,-23.075489044189453,1.0782661437988281,14067712,EleutherAI/pythia-14m,step0,seed4,4,0
It was an orange cone.,cone,cone,It was an cone orange., orange cone, cone orange,orange,False,-20.6516056060791,-22.138011932373047,1.4864063262939453,14067712,EleutherAI/pythia-14m,step0,seed4,4,0
He made a charitable contribution.,contribution,contribution,He made a contribution charitable., charitable contribution, contribution charitable,charitable,False,-22.158023834228516,-21.640583038330078,-0.5174407958984375,14067712,EleutherAI/pythia-14m,step0,seed4,4,0
He made a voluntary contribution.,contribution,contribution,He made a contribution voluntary., voluntary contribution, contribution voluntary,voluntary,False,-21.730022430419922,-21.90471649169922,0.17469406127929688,14067712,EleutherAI/pythia-14m,step0,seed4,4,0
He made a scholarly contribution.,contribution,contribution,He made a contribution scholarly., scholarly contribution, contribution scholarly,scholarly,False,-20.140352249145508,-21.372509002685547,1.232156753540039,14067712,EleutherAI/pythia-14m,step0,seed4,4,0
That was the noble count.,count,count,That was the count noble., noble count, count noble,noble,False,-21.26932716369629,-20.89594078063965,-0.3733863830566406,14067712,EleutherAI/pythia-14m,step0,seed4,4,0
That was the vengeful count.,count,count,That was the count vengeful., vengeful count, count vengeful,vengeful,False,-42.37637710571289,-41.93635559082031,-0.4400215148925781,14067712,EleutherAI/pythia-14m,step0,seed4,4,0
That was the final count.,count,count,That was the count final., final count, count final,final,False,-20.289670944213867,-20.57840347290039,0.28873252868652344,14067712,EleutherAI/pythia-14m,step0,seed4,4,0
It was an introductory course.,course,course,It was an course introductory., introductory course, course introductory,introductory,False,-22.034732818603516,-22.433677673339844,0.3989448547363281,14067712,EleutherAI/pythia-14m,step0,seed4,4,0
It was a pass-fail course.,course,course,It was a course pass-fail., pass-fail course, course pass-fail,pass-fail,False,-44.79517364501953,-43.324798583984375,-1.4703750610351562,14067712,EleutherAI/pythia-14m,step0,seed4,4,0
It was a charted course.,course,course,It was a course charted., charted course, course charted,charted,False,-33.27349853515625,-32.4023551940918,-0.8711433410644531,14067712,EleutherAI/pythia-14m,step0,seed4,4,0
It was a dinner date.,date,date,It was a date dinner., dinner date, date dinner,dinner,True,-22.810949325561523,-21.59466552734375,-1.2162837982177734,14067712,EleutherAI/pythia-14m,step0,seed4,4,0
It was a blind date.,date,date,It was a date blind., blind date, date blind,blind,False,-21.99650001525879,-21.66265296936035,-0.3338470458984375,14067712,EleutherAI/pythia-14m,step0,seed4,4,0
It was an expiration date.,date,date,It was an date expiration., expiration date, date expiration,expiration,True,-23.028488159179688,-22.440223693847656,-0.5882644653320312,14067712,EleutherAI/pythia-14m,step0,seed4,4,0
It was about forty degrees.,degree,degrees,It was about degrees forty., forty degrees, degrees forty,forty,True,-21.614376068115234,-21.725662231445312,0.11128616333007812,14067712,EleutherAI/pythia-14m,step0,seed4,4,0
It was about fifty degrees.,degree,degrees,It was about degrees fifty., fifty degrees, degrees fifty,fifty,True,-21.134479522705078,-20.30667495727539,-0.8278045654296875,14067712,EleutherAI/pythia-14m,step0,seed4,4,0
It was about associate degrees.,degree,degrees,It was about degrees associate., associate degrees, degrees associate,associate,False,-21.986421585083008,-21.081132888793945,-0.9052886962890625,14067712,EleutherAI/pythia-14m,step0,seed4,4,0
They liked the floral design.,design,design,They liked the design floral., floral design, design floral,floral,False,-21.323535919189453,-21.085594177246094,-0.23794174194335938,14067712,EleutherAI/pythia-14m,step0,seed4,4,0
They liked the geometric design.,design,design,They liked the design geometric., geometric design, design geometric,geometric,False,-20.852590560913086,-20.860610961914062,0.008020401000976562,14067712,EleutherAI/pythia-14m,step0,seed4,4,0
They liked the product design.,design,design,They liked the design product., product design, design product,product,True,-20.99199676513672,-20.615875244140625,-0.37612152099609375,14067712,EleutherAI/pythia-14m,step0,seed4,4,0
They liked the turkey dinner.,dinner,dinner,They liked the dinner turkey., turkey dinner, dinner turkey,turkey,True,-23.10781478881836,-21.436460494995117,-1.6713542938232422,14067712,EleutherAI/pythia-14m,step0,seed4,4,0
They liked the light dinner.,dinner,dinner,They liked the dinner light., light dinner, dinner light,light,False,-21.99147605895996,-22.22113800048828,0.2296619415283203,14067712,EleutherAI/pythia-14m,step0,seed4,4,0
They liked the formal dinner.,dinner,dinner,They liked the dinner formal., formal dinner, dinner formal,formal,False,-22.87409210205078,-22.52931022644043,-0.34478187561035156,14067712,EleutherAI/pythia-14m,step0,seed4,4,0
He had a recurring dream.,dream,dream,He had a dream recurring., recurring dream, dream recurring,recurring,False,-23.114036560058594,-23.602373123168945,0.48833656311035156,14067712,EleutherAI/pythia-14m,step0,seed4,4,0
He had a bad dream.,dream,dream,He had a dream bad., bad dream, dream bad,bad,False,-23.801422119140625,-22.827899932861328,-0.9735221862792969,14067712,EleutherAI/pythia-14m,step0,seed4,4,0
He had a childhood dream.,dream,dream,He had a dream childhood., childhood dream, dream childhood,childhood,True,-22.424610137939453,-22.899730682373047,0.47512054443359375,14067712,EleutherAI/pythia-14m,step0,seed4,4,0
It was a grueling drill.,drill,drill,It was a drill grueling., grueling drill, drill grueling,grueling,False,-33.65194320678711,-34.0799560546875,0.4280128479003906,14067712,EleutherAI/pythia-14m,step0,seed4,4,0
It was a challenging drill.,drill,drill,It was a drill challenging., challenging drill, drill challenging,challenging,False,-22.15625762939453,-22.606922149658203,0.4506645202636719,14067712,EleutherAI/pythia-14m,step0,seed4,4,0
It was an electric drill.,drill,drill,It was an drill electric., electric drill, drill electric,electric,False,-21.72216033935547,-21.67672348022461,-0.045436859130859375,14067712,EleutherAI/pythia-14m,step0,seed4,4,0
It was a multiple-choice examination.,examination,examination,It was an examination multiple-choice., multiple-choice examination, examination multiple-choice,multiple-choice,False,-43.2083740234375,-44.61188507080078,1.4035110473632812,14067712,EleutherAI/pythia-14m,step0,seed4,4,0
It was a difficult examination.,examination,examination,It was an examination difficult., difficult examination, examination difficult,difficult,False,-20.97719955444336,-21.96857452392578,0.9913749694824219,14067712,EleutherAI/pythia-14m,step0,seed4,4,0
It was a prostate examination.,examination,examination,It was an examination prostate., prostate examination, examination prostate,prostate,True,-21.648632049560547,-21.665626525878906,0.016994476318359375,14067712,EleutherAI/pythia-14m,step0,seed4,4,0
They had an electric fan.,fan,fan,They had an fan electric., electric fan, fan electric,electric,False,-20.95937728881836,-19.258699417114258,-1.7006778717041016,14067712,EleutherAI/pythia-14m,step0,seed4,4,0
They had a ceiling fan.,fan,fan,They had a fan ceiling., ceiling fan, fan ceiling,ceiling,True,-21.586231231689453,-23.684009552001953,2.0977783203125,14067712,EleutherAI/pythia-14m,step0,seed4,4,0
They had a zealous fan.,fan,fan,They had a fan zealous., zealous fan, fan zealous,zealous,False,-33.54936981201172,-33.121437072753906,-0.4279327392578125,14067712,EleutherAI/pythia-14m,step0,seed4,4,0
She had a text file.,file,file,She had a file text., text file, file text,text,True,-22.793315887451172,-22.836444854736328,0.04312896728515625,14067712,EleutherAI/pythia-14m,step0,seed4,4,0
She had a data file.,file,file,She had a file data., data file, file data,data,True,-21.197439193725586,-22.084964752197266,0.8875255584716797,14067712,EleutherAI/pythia-14m,step0,seed4,4,0
She had a nail file.,file,file,She had a file nail., nail file, file nail,nail,True,-21.911849975585938,-22.49517059326172,0.5833206176757812,14067712,EleutherAI/pythia-14m,step0,seed4,4,0
It was an action film.,film,film,It was an film action., action film, film action,action,True,-21.615386962890625,-22.178897857666016,0.5635108947753906,14067712,EleutherAI/pythia-14m,step0,seed4,4,0
It was a censored film.,film,film,It was a film censored., censored film, film censored,censored,False,-34.565975189208984,-34.137447357177734,-0.42852783203125,14067712,EleutherAI/pythia-14m,step0,seed4,4,0
It was a transparent film.,film,film,It was a film transparent., transparent film, film transparent,transparent,False,-22.734844207763672,-21.915790557861328,-0.8190536499023438,14067712,EleutherAI/pythia-14m,step0,seed4,4,0
It was a charitable foundation.,foundation,foundation,It was a foundation charitable., charitable foundation, foundation charitable,charitable,False,-22.590431213378906,-22.55933380126953,-0.031097412109375,14067712,EleutherAI/pythia-14m,step0,seed4,4,0
It was an educational foundation.,foundation,foundation,It was an foundation educational., educational foundation, foundation educational,educational,False,-20.811824798583984,-22.815223693847656,2.003398895263672,14067712,EleutherAI/pythia-14m,step0,seed4,4,0
It was a wooden foundation.,foundation,foundation,It was a foundation wooden., wooden foundation, foundation wooden,wooden,False,-21.359445571899414,-21.619834899902344,0.2603893280029297,14067712,EleutherAI/pythia-14m,step0,seed4,4,0
It was a mathematical function.,function,function,It was a function mathematical., mathematical function, function mathematical,mathematical,False,-22.572673797607422,-23.519481658935547,0.946807861328125,14067712,EleutherAI/pythia-14m,step0,seed4,4,0
It was a linear function.,function,function,It was a function linear., linear function, function linear,linear,False,-21.382572174072266,-22.943187713623047,1.5606155395507812,14067712,EleutherAI/pythia-14m,step0,seed4,4,0
It was a social function.,function,function,It was a function social., social function, function social,social,False,-22.024024963378906,-23.338481903076172,1.3144569396972656,14067712,EleutherAI/pythia-14m,step0,seed4,4,0
He was on the firm ground.,ground,ground,He was on the ground firm., firm ground, ground firm,firm,False,-22.126968383789062,-22.9346923828125,0.8077239990234375,14067712,EleutherAI/pythia-14m,step0,seed4,4,0
He was on the frozen ground.,ground,ground,He was on the ground frozen., frozen ground, ground frozen,frozen,False,-22.08983612060547,-22.407962799072266,0.3181266784667969,14067712,EleutherAI/pythia-14m,step0,seed4,4,0
He was on the camp ground.,ground,ground,He was on the ground camp., camp ground, ground camp,camp,True,-21.870365142822266,-21.766525268554688,-0.10383987426757812,14067712,EleutherAI/pythia-14m,step0,seed4,4,0
