sentence,word,string,reversed_sentence,mod_np,reversed_mod,disambiguating_word,non_adjective,original_logprob,reversed_logprob,ratio,n_params,mpath,revision,seed_name,seed,step
It was a social function.,function,function,It was a function social., social function, function social,social,False,-16.23208999633789,-21.72739601135254,5.495306015014648,14067712,EleutherAI/pythia-14m,step62000,seed4,4,62000
He was on the firm ground.,ground,ground,He was on the ground firm., firm ground, ground firm,firm,False,-19.312339782714844,-14.856915473937988,-4.4554243087768555,14067712,EleutherAI/pythia-14m,step62000,seed4,4,62000
He was on the frozen ground.,ground,ground,He was on the ground frozen., frozen ground, ground frozen,frozen,False,-15.167488098144531,-17.120025634765625,1.9525375366210938,14067712,EleutherAI/pythia-14m,step62000,seed4,4,62000
He was on the camp ground.,ground,ground,He was on the ground camp., camp ground, ground camp,camp,True,-16.35274887084961,-15.082551002502441,-1.270197868347168,14067712,EleutherAI/pythia-14m,step62000,seed4,4,62000
They liked the night guard.,guard,guard,They liked the guard night., night guard, guard night,night,True,-16.797801971435547,-22.605777740478516,5.807975769042969,14067712,EleutherAI/pythia-14m,step62000,seed4,4,62000
They liked the security guard.,guard,guard,They liked the guard security., security guard, guard security,security,True,-14.622322082519531,-21.42702865600586,6.804706573486328,14067712,EleutherAI/pythia-14m,step62000,seed4,4,62000
They liked the coast guard.,guard,guard,They liked the guard coast., coast guard, guard coast,coast,True,-18.937774658203125,-25.245616912841797,6.307842254638672,14067712,EleutherAI/pythia-14m,step62000,seed4,4,62000
He had an assembly guide.,guide,guide,He had an guide assembly., assembly guide, guide assembly,assembly,True,-16.954999923706055,-25.015735626220703,8.060735702514648,14067712,EleutherAI/pythia-14m,step62000,seed4,4,62000
He had a TV guide.,guide,guide,He had a guide TV., TV guide, guide TV,TV,True,-18.703109741210938,-20.135047912597656,1.4319381713867188,14067712,EleutherAI/pythia-14m,step62000,seed4,4,62000
He had a talkative guide.,guide,guide,He had a guide talkative., talkative guide, guide talkative,talkative,False,-24.596588134765625,-29.58391761779785,4.987329483032227,14067712,EleutherAI/pythia-14m,step62000,seed4,4,62000
It was a summer home.,home,home,It was a home summer., summer home, home summer,summer,True,-15.018364906311035,-17.93224334716797,2.9138784408569336,14067712,EleutherAI/pythia-14m,step62000,seed4,4,62000
It was a childhood home.,home,home,It was a home childhood., childhood home, home childhood,childhood,True,-14.931207656860352,-18.326236724853516,3.395029067993164,14067712,EleutherAI/pythia-14m,step62000,seed4,4,62000
It was a funeral home.,home,home,It was a home funeral., funeral home, home funeral,funeral,False,-13.291994094848633,-18.35704803466797,5.065053939819336,14067712,EleutherAI/pythia-14m,step62000,seed4,4,62000
They had natural intelligence.,intelligence,intelligence,They had intelligence natural., natural intelligence, intelligence natural,natural,False,-17.64225959777832,-23.959205627441406,6.316946029663086,14067712,EleutherAI/pythia-14m,step62000,seed4,4,62000
They had innate intelligence.,intelligence,intelligence,They had intelligence innate., innate intelligence, intelligence innate,innate,False,-21.236494064331055,-27.38855743408203,6.152063369750977,14067712,EleutherAI/pythia-14m,step62000,seed4,4,62000
They had classified intelligence.,intelligence,intelligence,They had intelligence classified., classified intelligence, intelligence classified,classified,False,-18.27556037902832,-21.85253143310547,3.5769710540771484,14067712,EleutherAI/pythia-14m,step62000,seed4,4,62000
It was a sensitive issue.,issue,issue,It was an issue sensitive., sensitive issue, issue sensitive,sensitive,False,-15.677820205688477,-18.24433135986328,2.5665111541748047,14067712,EleutherAI/pythia-14m,step62000,seed4,4,62000
It was a political issue.,issue,issue,It was an issue political., political issue, issue political,political,False,-14.4473876953125,-17.290950775146484,2.8435630798339844,14067712,EleutherAI/pythia-14m,step62000,seed4,4,62000
It was a weekly issue.,issue,issue,It was an issue weekly., weekly issue, issue weekly,weekly,False,-18.7081241607666,-18.201122283935547,-0.5070018768310547,14067712,EleutherAI/pythia-14m,step62000,seed4,4,62000
It was a blackberry jam.,jam,jam,It was a jam blackberry., blackberry jam, jam blackberry,blackberry,True,-22.512483596801758,-27.082029342651367,4.569545745849609,14067712,EleutherAI/pythia-14m,step62000,seed4,4,62000
It was a peach jam.,jam,jam,It was a jam peach., peach jam, jam peach,peach,False,-22.60413360595703,-23.385995864868164,0.7818622589111328,14067712,EleutherAI/pythia-14m,step62000,seed4,4,62000
It was a traffic jam.,jam,jam,It was a jam traffic., traffic jam, jam traffic,traffic,True,-13.927186965942383,-21.984798431396484,8.057611465454102,14067712,EleutherAI/pythia-14m,step62000,seed4,4,62000
It was a duplicate key.,key,key,It was a key duplicate., duplicate key, key duplicate,duplicate,False,-17.105329513549805,-18.906417846679688,1.8010883331298828,14067712,EleutherAI/pythia-14m,step62000,seed4,4,62000
It was a master key.,key,key,It was a key master., master key, key master,master,True,-17.470293045043945,-17.932193756103516,0.4619007110595703,14067712,EleutherAI/pythia-14m,step62000,seed4,4,62000
It was a delete key.,key,key,It was a key delete., delete key, key delete,delete,False,-18.955684661865234,-20.370357513427734,1.4146728515625,14067712,EleutherAI/pythia-14m,step62000,seed4,4,62000
They liked the marinated lamb.,lamb,lamb,They liked the lamb marinated., marinated lamb, lamb marinated,marinated,True,-23.808679580688477,-26.576152801513672,2.7674732208251953,14067712,EleutherAI/pythia-14m,step62000,seed4,4,62000
They liked the grilled lamb.,lamb,lamb,They liked the lamb grilled., grilled lamb, lamb grilled,grilled,False,-17.106678009033203,-22.347867965698242,5.241189956665039,14067712,EleutherAI/pythia-14m,step62000,seed4,4,62000
They liked the cute lamb.,lamb,lamb,They liked the lamb cute., cute lamb, lamb cute,cute,False,-17.066329956054688,-22.63279914855957,5.566469192504883,14067712,EleutherAI/pythia-14m,step62000,seed4,4,62000
She had curly locks.,lock,locks,She had locks curly., curly locks, locks curly,curly,False,-20.757835388183594,-26.221464157104492,5.463628768920898,14067712,EleutherAI/pythia-14m,step62000,seed4,4,62000
She had brown locks.,lock,locks,She had locks brown., brown locks, locks brown,brown,False,-24.54427146911621,-25.573755264282227,1.0294837951660156,14067712,EleutherAI/pythia-14m,step62000,seed4,4,62000
She had window locks.,lock,locks,She had locks window., window locks, locks window,window,True,-19.63984489440918,-23.7033748626709,4.063529968261719,14067712,EleutherAI/pythia-14m,step62000,seed4,4,62000
They liked the hot lunch.,lunch,lunch,They liked the lunch hot., hot lunch, lunch hot,hot,False,-16.250690460205078,-18.003246307373047,1.7525558471679688,14067712,EleutherAI/pythia-14m,step62000,seed4,4,62000
They liked the sandwich lunch.,lunch,lunch,They liked the lunch sandwich., sandwich lunch, lunch sandwich,sandwich,True,-18.60895538330078,-16.556917190551758,-2.0520381927490234,14067712,EleutherAI/pythia-14m,step62000,seed4,4,62000
They liked the afternoon lunch.,lunch,lunch,They liked the lunch afternoon., afternoon lunch, lunch afternoon,afternoon,True,-18.908863067626953,-16.349225997924805,-2.5596370697021484,14067712,EleutherAI/pythia-14m,step62000,seed4,4,62000
He liked the flea market.,market,market,He liked the market flea., flea market, market flea,flea,True,-22.463150024414062,-21.214065551757812,-1.24908447265625,14067712,EleutherAI/pythia-14m,step62000,seed4,4,62000
He liked the fish market.,market,market,He liked the market fish., fish market, market fish,fish,True,-15.401567459106445,-17.80148696899414,2.3999195098876953,14067712,EleutherAI/pythia-14m,step62000,seed4,4,62000
He liked the housing market.,market,market,He liked the market housing., housing market, market housing,housing,True,-14.227965354919434,-16.45806121826172,2.230095863342285,14067712,EleutherAI/pythia-14m,step62000,seed4,4,62000
It was a lit match.,match,match,It was a match lit., lit match, match lit,lit,False,-21.609294891357422,-21.239639282226562,-0.3696556091308594,14067712,EleutherAI/pythia-14m,step62000,seed4,4,62000
It was a burning match.,match,match,It was a match burning., burning match, match burning,burning,False,-21.18852996826172,-21.98910903930664,0.8005790710449219,14067712,EleutherAI/pythia-14m,step62000,seed4,4,62000
It was a soccer match.,match,match,It was a match soccer., soccer match, match soccer,soccer,True,-13.544495582580566,-20.097877502441406,6.55338191986084,14067712,EleutherAI/pythia-14m,step62000,seed4,4,62000
It was cough medicine.,medicine,medicine,It was medicine cough., cough medicine, medicine cough,cough,True,-23.774517059326172,-23.654037475585938,-0.12047958374023438,14067712,EleutherAI/pythia-14m,step62000,seed4,4,62000
It was prescription medicine.,medicine,medicine,It was medicine prescription., prescription medicine, medicine prescription,prescription,True,-17.94708824157715,-21.050926208496094,3.1038379669189453,14067712,EleutherAI/pythia-14m,step62000,seed4,4,62000
It was orthopedic medicine.,medicine,medicine,It was medicine orthopedic., orthopedic medicine, medicine orthopedic,orthopedic,False,-20.695480346679688,-25.741737365722656,5.046257019042969,14067712,EleutherAI/pythia-14m,step62000,seed4,4,62000
There was a phone message.,message,message,There was a message phone., phone message, message phone,phone,True,-16.22905921936035,-18.67324447631836,2.444185256958008,14067712,EleutherAI/pythia-14m,step62000,seed4,4,62000
There was a computer message.,message,message,There was a message computer., computer message, message computer,computer,True,-17.973026275634766,-20.52756118774414,2.554534912109375,14067712,EleutherAI/pythia-14m,step62000,seed4,4,62000
There was an urgent message.,message,message,There was an message urgent., urgent message, message urgent,urgent,False,-14.438995361328125,-25.65185546875,11.212860107421875,14067712,EleutherAI/pythia-14m,step62000,seed4,4,62000
It was a fungal mold.,mold,mold,It was a mold fungal., fungal mold, mold fungal,fungal,False,-19.803434371948242,-22.577110290527344,2.7736759185791016,14067712,EleutherAI/pythia-14m,step62000,seed4,4,62000
It was a harmful mold.,mold,mold,It was a mold harmful., harmful mold, mold harmful,harmful,False,-21.060348510742188,-22.176177978515625,1.1158294677734375,14067712,EleutherAI/pythia-14m,step62000,seed4,4,62000
It was a rubber mold.,mold,mold,It was a mold rubber., rubber mold, mold rubber,rubber,True,-17.794200897216797,-20.785118103027344,2.990917205810547,14067712,EleutherAI/pythia-14m,step62000,seed4,4,62000
She saw the cancerous mole.,mole,mole,She saw the mole cancerous., cancerous mole, mole cancerous,cancerous,False,-21.84001350402832,-27.026674270629883,5.1866607666015625,14067712,EleutherAI/pythia-14m,step62000,seed4,4,62000
She saw the raised mole.,mole,mole,She saw the mole raised., raised mole, mole raised,raised,False,-20.262916564941406,-20.524322509765625,0.26140594482421875,14067712,EleutherAI/pythia-14m,step62000,seed4,4,62000
She saw the cute mole.,mole,mole,She saw the mole cute., cute mole, mole cute,cute,False,-19.445024490356445,-22.880756378173828,3.435731887817383,14067712,EleutherAI/pythia-14m,step62000,seed4,4,62000
He liked the rhythmic movement.,movement,movement,He liked the movement rhythmic., rhythmic movement, movement rhythmic,rhythmic,False,-17.723098754882812,-22.501394271850586,4.778295516967773,14067712,EleutherAI/pythia-14m,step62000,seed4,4,62000
He liked the graceful movement.,movement,movement,He liked the movement graceful., graceful movement, movement graceful,graceful,False,-19.076847076416016,-23.704910278320312,4.628063201904297,14067712,EleutherAI/pythia-14m,step62000,seed4,4,62000
He liked the feminist movement.,movement,movement,He liked the movement feminist., feminist movement, movement feminist,feminist,True,-15.878095626831055,-21.773082733154297,5.894987106323242,14067712,EleutherAI/pythia-14m,step62000,seed4,4,62000
It was a national newspaper.,newspaper,newspaper,It was a newspaper national., national newspaper, newspaper national,national,False,-14.371973037719727,-20.00221824645996,5.630245208740234,14067712,EleutherAI/pythia-14m,step62000,seed4,4,62000
It was a daily newspaper.,newspaper,newspaper,It was a newspaper daily., daily newspaper, newspaper daily,daily,False,-13.633252143859863,-17.58003044128418,3.9467782974243164,14067712,EleutherAI/pythia-14m,step62000,seed4,4,62000
It was a faded newspaper.,newspaper,newspaper,It was a newspaper faded., faded newspaper, newspaper faded,faded,False,-18.98975372314453,-22.07133674621582,3.081583023071289,14067712,EleutherAI/pythia-14m,step62000,seed4,4,62000
It was a juicy orange.,orange,orange,It was an orange juicy., juicy orange, orange juicy,juicy,False,-21.583932876586914,-18.790119171142578,-2.793813705444336,14067712,EleutherAI/pythia-14m,step62000,seed4,4,62000
It was a ripe orange.,orange,orange,It was an orange ripe., ripe orange, orange ripe,ripe,False,-16.4484806060791,-15.937374114990234,-0.5111064910888672,14067712,EleutherAI/pythia-14m,step62000,seed4,4,62000
It was a bright orange.,orange,orange,It was an orange bright., bright orange, orange bright,bright,False,-13.862009048461914,-15.633441925048828,1.771432876586914,14067712,EleutherAI/pythia-14m,step62000,seed4,4,62000
He saw the young page.,page,page,He saw the page young., young page, page young,young,False,-18.703655242919922,-19.750717163085938,1.0470619201660156,14067712,EleutherAI/pythia-14m,step62000,seed4,4,62000
He saw the loyal page.,page,page,He saw the page loyal., loyal page, page loyal,loyal,False,-23.921661376953125,-23.92675018310547,0.00508880615234375,14067712,EleutherAI/pythia-14m,step62000,seed4,4,62000
He saw the blank page.,page,page,He saw the page blank., blank page, page blank,blank,False,-15.678345680236816,-17.17742156982422,1.4990758895874023,14067712,EleutherAI/pythia-14m,step62000,seed4,4,62000
It was a calloused palm.,palm,palm,It was a palm calloused., calloused palm, palm calloused,calloused,False,-24.978580474853516,-26.997169494628906,2.0185890197753906,14067712,EleutherAI/pythia-14m,step62000,seed4,4,62000
It was a wrinkled palm.,palm,palm,It was a palm wrinkled., wrinkled palm, palm wrinkled,wrinkled,False,-21.048702239990234,-21.504045486450195,0.45534324645996094,14067712,EleutherAI/pythia-14m,step62000,seed4,4,62000
It was a tropical palm.,palm,palm,It was a palm tropical., tropical palm, palm tropical,tropical,False,-22.26845932006836,-23.721574783325195,1.453115463256836,14067712,EleutherAI/pythia-14m,step62000,seed4,4,62000
It was a control panel.,panel,panel,It was a panel control., control panel, panel control,control,True,-12.672148704528809,-19.673677444458008,7.001528739929199,14067712,EleutherAI/pythia-14m,step62000,seed4,4,62000
It was an instrument panel.,panel,panel,It was an panel instrument., instrument panel, panel instrument,instrument,False,-15.797313690185547,-21.79849624633789,6.001182556152344,14067712,EleutherAI/pythia-14m,step62000,seed4,4,62000
It was an advisory panel.,panel,panel,It was an panel advisory., advisory panel, panel advisory,advisory,False,-14.4585599899292,-23.480907440185547,9.022347450256348,14067712,EleutherAI/pythia-14m,step62000,seed4,4,62000
It was a secret passage.,passage,passage,It was a passage secret., secret passage, passage secret,secret,False,-18.143051147460938,-21.195056915283203,3.0520057678222656,14067712,EleutherAI/pythia-14m,step62000,seed4,4,62000
It was a narrow passage.,passage,passage,It was a passage narrow., narrow passage, passage narrow,narrow,False,-16.29792022705078,-22.369293212890625,6.071372985839844,14067712,EleutherAI/pythia-14m,step62000,seed4,4,62000
It was a literary passage.,passage,passage,It was a passage literary., literary passage, passage literary,literary,False,-18.780330657958984,-24.856792449951172,6.0764617919921875,14067712,EleutherAI/pythia-14m,step62000,seed4,4,62000
It was a tasty perch.,perch,perch,It was a perch tasty., tasty perch, perch tasty,tasty,False,-23.864849090576172,-24.490528106689453,0.6256790161132812,14067712,EleutherAI/pythia-14m,step62000,seed4,4,62000
It was a freshwater perch.,perch,perch,It was a perch freshwater., freshwater perch, perch freshwater,freshwater,True,-26.31182098388672,-26.81070327758789,0.4988822937011719,14067712,EleutherAI/pythia-14m,step62000,seed4,4,62000
It was a lofty perch.,perch,perch,It was a perch lofty., lofty perch, perch lofty,lofty,False,-27.293315887451172,-28.155838012695312,0.8625221252441406,14067712,EleutherAI/pythia-14m,step62000,seed4,4,62000
He saw the fast pitcher.,pitcher,pitcher,He saw the pitcher fast., fast pitcher, pitcher fast,fast,False,-19.500064849853516,-20.81293487548828,1.3128700256347656,14067712,EleutherAI/pythia-14m,step62000,seed4,4,62000
He saw the right-handed pitcher.,pitcher,pitcher,He saw the pitcher right-handed., right-handed pitcher, pitcher right-handed,right-handed,False,-18.646987915039062,-29.90313720703125,11.256149291992188,14067712,EleutherAI/pythia-14m,step62000,seed4,4,62000
He saw the glass pitcher.,pitcher,pitcher,He saw the pitcher glass., glass pitcher, pitcher glass,glass,True,-22.954618453979492,-24.706066131591797,1.7514476776123047,14067712,EleutherAI/pythia-14m,step62000,seed4,4,62000
It was a windy port.,port,port,It was a port windy., windy port, port windy,windy,False,-21.32555389404297,-25.357223510742188,4.031669616699219,14067712,EleutherAI/pythia-14m,step62000,seed4,4,62000
It was a seaside port.,port,port,It was a port seaside., seaside port, port seaside,seaside,True,-22.502769470214844,-25.422325134277344,2.9195556640625,14067712,EleutherAI/pythia-14m,step62000,seed4,4,62000
It was a delicious port.,port,port,It was a port delicious., delicious port, port delicious,delicious,False,-17.847732543945312,-24.543092727661133,6.69536018371582,14067712,EleutherAI/pythia-14m,step62000,seed4,4,62000
He was in a distinguished position.,position,position,He was in a position distinguished., distinguished position, position distinguished,distinguished,False,-15.068368911743164,-18.02468490600586,2.9563159942626953,14067712,EleutherAI/pythia-14m,step62000,seed4,4,62000
He was in a prominent position.,position,position,He was in a position prominent., prominent position, position prominent,prominent,False,-16.12981414794922,-20.294178009033203,4.164363861083984,14067712,EleutherAI/pythia-14m,step62000,seed4,4,62000
He was in a fetal position.,position,position,He was in a position fetal., fetal position, position fetal,fetal,False,-18.408817291259766,-21.91274642944336,3.5039291381835938,14067712,EleutherAI/pythia-14m,step62000,seed4,4,62000
It was a wooden post.,post,post,It was a post wooden., wooden post, post wooden,wooden,False,-17.927188873291016,-20.060436248779297,2.1332473754882812,14067712,EleutherAI/pythia-14m,step62000,seed4,4,62000
It was a fence post.,post,post,It was a post fence., fence post, post fence,fence,True,-20.638301849365234,-20.737525939941406,0.09922409057617188,14067712,EleutherAI/pythia-14m,step62000,seed4,4,62000
It was a teaching post.,post,post,It was a post teaching., teaching post, post teaching,teaching,True,-17.41326904296875,-18.976112365722656,1.5628433227539062,14067712,EleutherAI/pythia-14m,step62000,seed4,4,62000
He had the alcoholic punch.,punch,punch,He had the punch alcoholic., alcoholic punch, punch alcoholic,alcoholic,False,-20.09664535522461,-27.280643463134766,7.183998107910156,14067712,EleutherAI/pythia-14m,step62000,seed4,4,62000
He had the fruit punch.,punch,punch,He had the punch fruit., fruit punch, punch fruit,fruit,True,-19.76956558227539,-22.785442352294922,3.0158767700195312,14067712,EleutherAI/pythia-14m,step62000,seed4,4,62000
He had the strongest punch.,punch,punch,He had the punch strongest., strongest punch, punch strongest,strongest,False,-15.702529907226562,-23.231536865234375,7.5290069580078125,14067712,EleutherAI/pythia-14m,step62000,seed4,4,62000
She had a brilliant pupil.,pupil,pupil,She had a pupil brilliant., brilliant pupil, pupil brilliant,brilliant,False,-17.13713836669922,-22.40182876586914,5.264690399169922,14067712,EleutherAI/pythia-14m,step62000,seed4,4,62000
She had an interested pupil.,pupil,pupil,She had an pupil interested., interested pupil, pupil interested,interested,False,-17.42562484741211,-23.202808380126953,5.777183532714844,14067712,EleutherAI/pythia-14m,step62000,seed4,4,62000
She had a dilated pupil.,pupil,pupil,She had a pupil dilated., dilated pupil, pupil dilated,dilated,False,-21.340049743652344,-21.3946533203125,0.05460357666015625,14067712,EleutherAI/pythia-14m,step62000,seed4,4,62000
That was a loud racket.,racket,racket,That was a racket loud., loud racket, racket loud,loud,False,-18.876117706298828,-25.06041717529297,6.184299468994141,14067712,EleutherAI/pythia-14m,step62000,seed4,4,62000
That was an annoying racket.,racket,racket,That was an racket annoying., annoying racket, racket annoying,annoying,False,-16.69210433959961,-25.018085479736328,8.325981140136719,14067712,EleutherAI/pythia-14m,step62000,seed4,4,62000
That was a badminton racket.,racket,racket,That was a racket badminton., badminton racket, racket badminton,badminton,True,-25.857030868530273,-28.59131622314453,2.734285354614258,14067712,EleutherAI/pythia-14m,step62000,seed4,4,62000
He liked electronic rock.,rock,rock,He liked rock electronic., electronic rock, rock electronic,electronic,False,-22.154281616210938,-23.541595458984375,1.3873138427734375,14067712,EleutherAI/pythia-14m,step62000,seed4,4,62000
He liked alternative rock.,rock,rock,He liked rock alternative., alternative rock, rock alternative,alternative,False,-22.364234924316406,-23.4180908203125,1.0538558959960938,14067712,EleutherAI/pythia-14m,step62000,seed4,4,62000
He liked limestone rock.,rock,rock,He liked rock limestone., limestone rock, rock limestone,limestone,True,-21.482074737548828,-23.680015563964844,2.1979408264160156,14067712,EleutherAI/pythia-14m,step62000,seed4,4,62000
He saw the wise sage.,sage,sage,He saw the sage wise., wise sage, sage wise,wise,False,-19.95625114440918,-23.630483627319336,3.6742324829101562,14067712,EleutherAI/pythia-14m,step62000,seed4,4,62000
He saw the renowned sage.,sage,sage,He saw the sage renowned., renowned sage, sage renowned,renowned,False,-21.97322654724121,-26.06284523010254,4.089618682861328,14067712,EleutherAI/pythia-14m,step62000,seed4,4,62000
He saw the fragrant sage.,sage,sage,He saw the sage fragrant., fragrant sage, sage fragrant,fragrant,False,-21.495258331298828,-23.751081466674805,2.2558231353759766,14067712,EleutherAI/pythia-14m,step62000,seed4,4,62000
It was a fish scale.,scale,scale,It was a scale fish., fish scale, scale fish,fish,True,-18.747936248779297,-19.889753341674805,1.1418170928955078,14067712,EleutherAI/pythia-14m,step62000,seed4,4,62000
It was a lizard scale.,scale,scale,It was a scale lizard., lizard scale, scale lizard,lizard,True,-21.98471450805664,-21.340007781982422,-0.6447067260742188,14067712,EleutherAI/pythia-14m,step62000,seed4,4,62000
It was a music scale.,scale,scale,It was a scale music., music scale, scale music,music,True,-17.466949462890625,-18.081453323364258,0.6145038604736328,14067712,EleutherAI/pythia-14m,step62000,seed4,4,62000
It was a touching scene.,scene,scene,It was a scene touching., touching scene, scene touching,touching,False,-17.292245864868164,-18.390316009521484,1.0980701446533203,14067712,EleutherAI/pythia-14m,step62000,seed4,4,62000
It was a well-acted scene.,scene,scene,It was a scene well-acted., well-acted scene, scene well-acted,well-acted,False,-25.034440994262695,-30.9951171875,5.960676193237305,14067712,EleutherAI/pythia-14m,step62000,seed4,4,62000
It was a nature scene.,scene,scene,It was a scene nature., nature scene, scene nature,nature,True,-16.506629943847656,-19.01605224609375,2.5094223022460938,14067712,EleutherAI/pythia-14m,step62000,seed4,4,62000
It was a gold seal.,seal,seal,It was a seal gold., gold seal, seal gold,gold,True,-15.112565994262695,-22.548799514770508,7.4362335205078125,14067712,EleutherAI/pythia-14m,step62000,seed4,4,62000
It was a certified seal.,seal,seal,It was a seal certified., certified seal, seal certified,certified,False,-20.075023651123047,-21.181116104125977,1.1060924530029297,14067712,EleutherAI/pythia-14m,step62000,seed4,4,62000
It was a circus seal.,seal,seal,It was a seal circus., circus seal, seal circus,circus,True,-22.866456985473633,-27.470447540283203,4.60399055480957,14067712,EleutherAI/pythia-14m,step62000,seed4,4,62000
He used the scotch tape.,tape,tape,He used the tape scotch., scotch tape, tape scotch,scotch,True,-26.666187286376953,-26.53211784362793,-0.13406944274902344,14067712,EleutherAI/pythia-14m,step62000,seed4,4,62000
He used the double-sided tape.,tape,tape,He used the tape double-sided., double-sided tape, tape double-sided,double-sided,False,-21.938508987426758,-27.123931884765625,5.185422897338867,14067712,EleutherAI/pythia-14m,step62000,seed4,4,62000
He used the interview tape.,tape,tape,He used the tape interview., interview tape, tape interview,interview,True,-17.22992706298828,-19.66026496887207,2.430337905883789,14067712,EleutherAI/pythia-14m,step62000,seed4,4,62000
It was a winter term.,term,term,It was a term winter., winter term, term winter,winter,True,-18.401660919189453,-22.691030502319336,4.289369583129883,14067712,EleutherAI/pythia-14m,step62000,seed4,4,62000
