sentence,word,string,reversed_sentence,mod_np,reversed_mod,disambiguating_word,non_adjective,original_logprob,reversed_logprob,ratio,n_params,mpath,revision,seed_name,seed,step
It was a desperate act.,act,act,It was an act desperate., desperate act, act desperate,desperate,False,-21.121076583862305,-21.350839614868164,0.22976303100585938,14067712,EleutherAI/pythia-14m,step128,seed9,9,128
It was a humane act.,act,act,It was an act humane., humane act, act humane,humane,False,-32.2573356628418,-31.882293701171875,-0.3750419616699219,14067712,EleutherAI/pythia-14m,step128,seed9,9,128
It was a magic act.,act,act,It was an act magic., magic act, act magic,magic,False,-20.433767318725586,-20.20587921142578,-0.2278881072998047,14067712,EleutherAI/pythia-14m,step128,seed9,9,128
He had a universal appeal.,appeal,appeal,He had an appeal universal., universal appeal, appeal universal,universal,False,-21.106414794921875,-20.811199188232422,-0.2952156066894531,14067712,EleutherAI/pythia-14m,step128,seed9,9,128
He had an undefinable appeal.,appeal,appeal,He had an appeal undefinable., undefinable appeal, appeal undefinable,undefinable,False,-41.67964172363281,-41.11103057861328,-0.5686111450195312,14067712,EleutherAI/pythia-14m,step128,seed9,9,128
He had a legal appeal.,appeal,appeal,He had an appeal legal., legal appeal, appeal legal,legal,False,-19.106441497802734,-19.55695915222168,0.4505176544189453,14067712,EleutherAI/pythia-14m,step128,seed9,9,128
It was a tense atmosphere.,atmosphere,atmosphere,It was an atmosphere tense., tense atmosphere, atmosphere tense,tense,False,-21.932811737060547,-22.690032958984375,0.7572212219238281,14067712,EleutherAI/pythia-14m,step128,seed9,9,128
It was a hostile atmosphere.,atmosphere,atmosphere,It was an atmosphere hostile., hostile atmosphere, atmosphere hostile,hostile,False,-21.287704467773438,-21.363014221191406,0.07530975341796875,14067712,EleutherAI/pythia-14m,step128,seed9,9,128
It was a gaseous atmosphere.,atmosphere,atmosphere,It was an atmosphere gaseous., gaseous atmosphere, atmosphere gaseous,gaseous,False,-20.96019744873047,-20.815242767333984,-0.14495468139648438,14067712,EleutherAI/pythia-14m,step128,seed9,9,128
It was a gold band.,band,band,It was a band gold., gold band, band gold,gold,True,-20.453445434570312,-20.458175659179688,0.004730224609375,14067712,EleutherAI/pythia-14m,step128,seed9,9,128
It was a rubber band.,band,band,It was a band rubber., rubber band, band rubber,rubber,True,-20.679718017578125,-20.83316993713379,0.15345191955566406,14067712,EleutherAI/pythia-14m,step128,seed9,9,128
It was a jazz band.,band,band,It was a band jazz., jazz band, band jazz,jazz,True,-21.191118240356445,-21.094402313232422,-0.09671592712402344,14067712,EleutherAI/pythia-14m,step128,seed9,9,128
There was a police barrier.,barrier,barrier,There was a barrier police., police barrier, barrier police,police,True,-21.572975158691406,-21.62398910522461,0.051013946533203125,14067712,EleutherAI/pythia-14m,step128,seed9,9,128
There was a concrete barrier.,barrier,barrier,There was a barrier concrete., concrete barrier, barrier concrete,concrete,False,-22.07642936706543,-21.995067596435547,-0.08136177062988281,14067712,EleutherAI/pythia-14m,step128,seed9,9,128
There was a language barrier.,barrier,barrier,There was a barrier language., language barrier, barrier language,language,True,-21.04671859741211,-21.419296264648438,0.3725776672363281,14067712,EleutherAI/pythia-14m,step128,seed9,9,128
He saw a furry bat.,bat,bat,He saw a bat furry., furry bat, bat furry,furry,False,-34.02216339111328,-33.182071685791016,-0.8400917053222656,14067712,EleutherAI/pythia-14m,step128,seed9,9,128
He saw a fruit bat.,bat,bat,He saw a bat fruit., fruit bat, bat fruit,fruit,True,-22.304157257080078,-22.25025177001953,-0.053905487060546875,14067712,EleutherAI/pythia-14m,step128,seed9,9,128
He saw a wooden bat.,bat,bat,He saw a bat wooden., wooden bat, bat wooden,wooden,False,-22.600250244140625,-22.484352111816406,-0.11589813232421875,14067712,EleutherAI/pythia-14m,step128,seed9,9,128
He saw the laser beam.,beam,beam,He saw the beam laser., laser beam, beam laser,laser,True,-22.924692153930664,-23.55914306640625,0.6344509124755859,14067712,EleutherAI/pythia-14m,step128,seed9,9,128
He saw the bright beam.,beam,beam,He saw the beam bright., bright beam, beam bright,bright,False,-21.131376266479492,-21.80950927734375,0.6781330108642578,14067712,EleutherAI/pythia-14m,step128,seed9,9,128
He saw the wood beam.,beam,beam,He saw the beam wood., wood beam, beam wood,wood,True,-22.80454444885254,-23.03997039794922,0.2354259490966797,14067712,EleutherAI/pythia-14m,step128,seed9,9,128
She had a toy block.,block,block,She had a block toy., toy block, block toy,toy,True,-22.42807388305664,-22.278844833374023,-0.1492290496826172,14067712,EleutherAI/pythia-14m,step128,seed9,9,128
She had a wooden block.,block,block,She had a block wooden., wooden block, block wooden,wooden,False,-21.927215576171875,-21.95153045654297,0.02431488037109375,14067712,EleutherAI/pythia-14m,step128,seed9,9,128
She had a mental block.,block,block,She had a block mental., mental block, block mental,mental,False,-21.263303756713867,-21.430635452270508,0.16733169555664062,14067712,EleutherAI/pythia-14m,step128,seed9,9,128
He has coagulated blood.,blood,blood,He has blood coagulated., coagulated blood, blood coagulated,coagulated,True,-41.9918212890625,-42.248329162597656,0.25650787353515625,14067712,EleutherAI/pythia-14m,step128,seed9,9,128
He has thin blood.,blood,blood,He has blood thin., thin blood, blood thin,thin,False,-20.77557373046875,-20.861846923828125,0.086273193359375,14067712,EleutherAI/pythia-14m,step128,seed9,9,128
He has noble blood.,blood,blood,He has blood noble., noble blood, blood noble,noble,False,-21.198558807373047,-21.102998733520508,-0.09556007385253906,14067712,EleutherAI/pythia-14m,step128,seed9,9,128
It was the ironing board.,board,board,It was the board ironing., ironing board, board ironing,ironing,False,-30.765710830688477,-31.23406982421875,0.46835899353027344,14067712,EleutherAI/pythia-14m,step128,seed9,9,128
It was the wooden board.,board,board,It was the board wooden., wooden board, board wooden,wooden,False,-22.165666580200195,-22.008663177490234,-0.15700340270996094,14067712,EleutherAI/pythia-14m,step128,seed9,9,128
It was the executive board.,board,board,It was the board executive., executive board, board executive,executive,True,-20.958942413330078,-21.447790145874023,0.4888477325439453,14067712,EleutherAI/pythia-14m,step128,seed9,9,128
He had a best-selling book.,book,book,He had a book best-selling., best-selling book, book best-selling,best-selling,False,-40.73651885986328,-41.03358459472656,0.29706573486328125,14067712,EleutherAI/pythia-14m,step128,seed9,9,128
He had a popular book.,book,book,He had a book popular., popular book, book popular,popular,False,-20.2191104888916,-20.058958053588867,-0.16015243530273438,14067712,EleutherAI/pythia-14m,step128,seed9,9,128
He had a heavy book.,book,book,He had a book heavy., heavy book, book heavy,heavy,False,-20.854278564453125,-20.61312484741211,-0.24115371704101562,14067712,EleutherAI/pythia-14m,step128,seed9,9,128
They ate a pancake breakfast.,breakfast,breakfast,They ate a breakfast pancake., pancake breakfast, breakfast pancake,pancake,True,-33.55723190307617,-33.54688262939453,-0.010349273681640625,14067712,EleutherAI/pythia-14m,step128,seed9,9,128
They ate a nutritious breakfast.,breakfast,breakfast,They ate a breakfast nutritious., nutritious breakfast, breakfast nutritious,nutritious,False,-43.52252197265625,-43.4499397277832,-0.07258224487304688,14067712,EleutherAI/pythia-14m,step128,seed9,9,128
They ate a family breakfast.,breakfast,breakfast,They ate a breakfast family., family breakfast, breakfast family,family,True,-21.29635238647461,-21.320751190185547,0.0243988037109375,14067712,EleutherAI/pythia-14m,step128,seed9,9,128
It was a red cape.,cape,cape,It was a cape red., red cape, cape red,red,False,-31.536928176879883,-31.47555923461914,-0.06136894226074219,14067712,EleutherAI/pythia-14m,step128,seed9,9,128
It was a flowing cape.,cape,cape,It was a cape flowing., flowing cape, cape flowing,flowing,False,-32.90198516845703,-32.659908294677734,-0.24207687377929688,14067712,EleutherAI/pythia-14m,step128,seed9,9,128
It was a rocky cape.,cape,cape,It was a cape rocky., rocky cape, cape rocky,rocky,False,-32.45153045654297,-32.613929748535156,0.1623992919921875,14067712,EleutherAI/pythia-14m,step128,seed9,9,128
It was a beer case.,case,case,It was a case beer., beer case, case beer,beer,True,-20.212432861328125,-20.253501892089844,0.04106903076171875,14067712,EleutherAI/pythia-14m,step128,seed9,9,128
It was a display case.,case,case,It was a case display., display case, case display,display,True,-20.090089797973633,-19.768428802490234,-0.32166099548339844,14067712,EleutherAI/pythia-14m,step128,seed9,9,128
It was a divorce case.,case,case,It was a case divorce., divorce case, case divorce,divorce,True,-21.01462745666504,-20.71438980102539,-0.30023765563964844,14067712,EleutherAI/pythia-14m,step128,seed9,9,128
It was a worthy cause.,cause,cause,It was a cause worthy., worthy cause, cause worthy,worthy,False,-22.233612060546875,-21.968978881835938,-0.2646331787109375,14067712,EleutherAI/pythia-14m,step128,seed9,9,128
It was a political cause.,cause,cause,It was a cause political., political cause, cause political,political,False,-20.46683120727539,-20.321670532226562,-0.14516067504882812,14067712,EleutherAI/pythia-14m,step128,seed9,9,128
It was a main cause.,cause,cause,It was a cause main., main cause, cause main,main,False,-20.7127685546875,-20.37448501586914,-0.3382835388183594,14067712,EleutherAI/pythia-14m,step128,seed9,9,128
It was a skin cell.,cell,cell,It was a cell skin., skin cell, cell skin,skin,True,-20.094030380249023,-19.992027282714844,-0.10200309753417969,14067712,EleutherAI/pythia-14m,step128,seed9,9,128
It was a brain cell.,cell,cell,It was a cell brain., brain cell, cell brain,brain,True,-20.728126525878906,-20.638734817504883,-0.08939170837402344,14067712,EleutherAI/pythia-14m,step128,seed9,9,128
It was a prison cell.,cell,cell,It was a cell prison., prison cell, cell prison,prison,True,-22.057762145996094,-21.741329193115234,-0.3164329528808594,14067712,EleutherAI/pythia-14m,step128,seed9,9,128
She had a devilish charm.,charm,charm,She had a charm devilish., devilish charm, charm devilish,devilish,False,-31.992141723632812,-31.968673706054688,-0.023468017578125,14067712,EleutherAI/pythia-14m,step128,seed9,9,128
She had a natural charm.,charm,charm,She had a charm natural., natural charm, charm natural,natural,False,-21.83647918701172,-21.69110107421875,-0.14537811279296875,14067712,EleutherAI/pythia-14m,step128,seed9,9,128
She had a gold charm.,charm,charm,She had a charm gold., gold charm, charm gold,gold,True,-21.646442413330078,-21.54587745666504,-0.10056495666503906,14067712,EleutherAI/pythia-14m,step128,seed9,9,128
They liked the juicy chicken.,chicken,chicken,They liked the chicken juicy., juicy chicken, chicken juicy,juicy,False,-33.99284362792969,-34.046852111816406,0.05400848388671875,14067712,EleutherAI/pythia-14m,step128,seed9,9,128
They liked the roasted chicken.,chicken,chicken,They liked the chicken roasted., roasted chicken, chicken roasted,roasted,False,-21.890710830688477,-22.385486602783203,0.49477577209472656,14067712,EleutherAI/pythia-14m,step128,seed9,9,128
They liked the clucking chicken.,chicken,chicken,They liked the chicken clucking., clucking chicken, chicken clucking,clucking,True,-33.52585983276367,-33.58720779418945,0.06134796142578125,14067712,EleutherAI/pythia-14m,step128,seed9,9,128
It was a perceptive class.,class,class,It was a class perceptive., perceptive class, class perceptive,perceptive,False,-32.22093963623047,-32.07608413696289,-0.14485549926757812,14067712,EleutherAI/pythia-14m,step128,seed9,9,128
It was a misbehaving class.,class,class,It was a class misbehaving., misbehaving class, class misbehaving,misbehaving,False,-43.954158782958984,-44.387413024902344,0.4332542419433594,14067712,EleutherAI/pythia-14m,step128,seed9,9,128
It was a boring class.,class,class,It was a class boring., boring class, class boring,boring,False,-20.954116821289062,-21.437576293945312,0.48345947265625,14067712,EleutherAI/pythia-14m,step128,seed9,9,128
It was a film clip.,clip,clip,It was a clip film., film clip, clip film,film,True,-22.269086837768555,-21.54759979248047,-0.7214870452880859,14067712,EleutherAI/pythia-14m,step128,seed9,9,128
It was a video clip.,clip,clip,It was a clip video., video clip, clip video,video,True,-22.293853759765625,-22.766733169555664,0.47287940979003906,14067712,EleutherAI/pythia-14m,step128,seed9,9,128
It was a hair clip.,clip,clip,It was a clip hair., hair clip, clip hair,hair,True,-20.656309127807617,-20.951519012451172,0.2952098846435547,14067712,EleutherAI/pythia-14m,step128,seed9,9,128
It was an icy cold.,cold,cold,It was an cold icy., icy cold, cold icy,icy,False,-21.275493621826172,-21.19298553466797,-0.08250808715820312,14067712,EleutherAI/pythia-14m,step128,seed9,9,128
It was a freezing cold.,cold,cold,It was a cold freezing., freezing cold, cold freezing,freezing,False,-21.01978302001953,-20.815185546875,-0.20459747314453125,14067712,EleutherAI/pythia-14m,step128,seed9,9,128
It was a chest cold.,cold,cold,It was a cold chest., chest cold, cold chest,chest,False,-20.84626579284668,-20.85436248779297,0.008096694946289062,14067712,EleutherAI/pythia-14m,step128,seed9,9,128
It was a gossip column.,column,column,It was a column gossip., gossip column, column gossip,gossip,True,-21.151567459106445,-21.091693878173828,-0.05987358093261719,14067712,EleutherAI/pythia-14m,step128,seed9,9,128
It was a sports column.,column,column,It was a column sports., sports column, column sports,sports,True,-20.69717025756836,-20.465070724487305,-0.2320995330810547,14067712,EleutherAI/pythia-14m,step128,seed9,9,128
It was a concrete column.,column,column,It was a column concrete., concrete column, column concrete,concrete,False,-20.9917049407959,-20.939254760742188,-0.05245018005371094,14067712,EleutherAI/pythia-14m,step128,seed9,9,128
He liked the investment company.,company,company,He liked the company investment., investment company, company investment,investment,True,-20.316890716552734,-20.07321548461914,-0.24367523193359375,14067712,EleutherAI/pythia-14m,step128,seed9,9,128
He liked the pharmaceutical company.,company,company,He liked the company pharmaceutical., pharmaceutical company, company pharmaceutical,pharmaceutical,False,-21.023784637451172,-21.659164428710938,0.6353797912597656,14067712,EleutherAI/pythia-14m,step128,seed9,9,128
He liked the pleasant company.,company,company,He liked the company pleasant., pleasant company, company pleasant,pleasant,False,-21.49765396118164,-21.59801483154297,0.10036087036132812,14067712,EleutherAI/pythia-14m,step128,seed9,9,128
It was a waffle cone.,cone,cone,It was a cone waffle., waffle cone, cone waffle,waffle,True,-41.818565368652344,-41.783302307128906,-0.0352630615234375,14067712,EleutherAI/pythia-14m,step128,seed9,9,128
It was a sugar cone.,cone,cone,It was a cone sugar., sugar cone, cone sugar,sugar,True,-21.603023529052734,-21.781343460083008,0.17831993103027344,14067712,EleutherAI/pythia-14m,step128,seed9,9,128
It was an orange cone.,cone,cone,It was an cone orange., orange cone, cone orange,orange,False,-21.90920639038086,-21.64842987060547,-0.2607765197753906,14067712,EleutherAI/pythia-14m,step128,seed9,9,128
He made a charitable contribution.,contribution,contribution,He made a contribution charitable., charitable contribution, contribution charitable,charitable,False,-21.2413330078125,-20.572925567626953,-0.6684074401855469,14067712,EleutherAI/pythia-14m,step128,seed9,9,128
He made a voluntary contribution.,contribution,contribution,He made a contribution voluntary., voluntary contribution, contribution voluntary,voluntary,False,-21.412063598632812,-21.231670379638672,-0.18039321899414062,14067712,EleutherAI/pythia-14m,step128,seed9,9,128
He made a scholarly contribution.,contribution,contribution,He made a contribution scholarly., scholarly contribution, contribution scholarly,scholarly,False,-21.976837158203125,-21.53449058532715,-0.44234657287597656,14067712,EleutherAI/pythia-14m,step128,seed9,9,128
That was the noble count.,count,count,That was the count noble., noble count, count noble,noble,False,-21.824207305908203,-22.075315475463867,0.25110816955566406,14067712,EleutherAI/pythia-14m,step128,seed9,9,128
That was the vengeful count.,count,count,That was the count vengeful., vengeful count, count vengeful,vengeful,False,-44.091773986816406,-44.50395202636719,0.41217803955078125,14067712,EleutherAI/pythia-14m,step128,seed9,9,128
That was the final count.,count,count,That was the count final., final count, count final,final,False,-21.454593658447266,-21.120647430419922,-0.33394622802734375,14067712,EleutherAI/pythia-14m,step128,seed9,9,128
It was an introductory course.,course,course,It was an course introductory., introductory course, course introductory,introductory,False,-21.3839111328125,-21.6090087890625,0.22509765625,14067712,EleutherAI/pythia-14m,step128,seed9,9,128
It was a pass-fail course.,course,course,It was a course pass-fail., pass-fail course, course pass-fail,pass-fail,False,-42.14910125732422,-42.44822692871094,0.29912567138671875,14067712,EleutherAI/pythia-14m,step128,seed9,9,128
It was a charted course.,course,course,It was a course charted., charted course, course charted,charted,False,-31.280113220214844,-31.746170043945312,0.46605682373046875,14067712,EleutherAI/pythia-14m,step128,seed9,9,128
It was a dinner date.,date,date,It was a date dinner., dinner date, date dinner,dinner,True,-21.297897338867188,-21.21880531311035,-0.07909202575683594,14067712,EleutherAI/pythia-14m,step128,seed9,9,128
It was a blind date.,date,date,It was a date blind., blind date, date blind,blind,False,-20.913436889648438,-20.909088134765625,-0.0043487548828125,14067712,EleutherAI/pythia-14m,step128,seed9,9,128
It was an expiration date.,date,date,It was an date expiration., expiration date, date expiration,expiration,True,-20.618911743164062,-20.56993865966797,-0.04897308349609375,14067712,EleutherAI/pythia-14m,step128,seed9,9,128
It was about forty degrees.,degree,degrees,It was about degrees forty., forty degrees, degrees forty,forty,True,-21.970569610595703,-21.75105857849121,-0.2195110321044922,14067712,EleutherAI/pythia-14m,step128,seed9,9,128
It was about fifty degrees.,degree,degrees,It was about degrees fifty., fifty degrees, degrees fifty,fifty,True,-21.984325408935547,-21.963712692260742,-0.020612716674804688,14067712,EleutherAI/pythia-14m,step128,seed9,9,128
It was about associate degrees.,degree,degrees,It was about degrees associate., associate degrees, degrees associate,associate,False,-22.903621673583984,-21.91521453857422,-0.9884071350097656,14067712,EleutherAI/pythia-14m,step128,seed9,9,128
They liked the floral design.,design,design,They liked the design floral., floral design, design floral,floral,False,-22.05931854248047,-22.30443572998047,0.2451171875,14067712,EleutherAI/pythia-14m,step128,seed9,9,128
They liked the geometric design.,design,design,They liked the design geometric., geometric design, design geometric,geometric,False,-21.987937927246094,-22.078521728515625,0.09058380126953125,14067712,EleutherAI/pythia-14m,step128,seed9,9,128
They liked the product design.,design,design,They liked the design product., product design, design product,product,True,-19.865806579589844,-19.992618560791016,0.12681198120117188,14067712,EleutherAI/pythia-14m,step128,seed9,9,128
They liked the turkey dinner.,dinner,dinner,They liked the dinner turkey., turkey dinner, dinner turkey,turkey,True,-20.84450340270996,-21.273967742919922,0.42946434020996094,14067712,EleutherAI/pythia-14m,step128,seed9,9,128
They liked the light dinner.,dinner,dinner,They liked the dinner light., light dinner, dinner light,light,False,-20.330921173095703,-20.57343864440918,0.24251747131347656,14067712,EleutherAI/pythia-14m,step128,seed9,9,128
They liked the formal dinner.,dinner,dinner,They liked the dinner formal., formal dinner, dinner formal,formal,False,-21.34442901611328,-21.37512969970703,0.03070068359375,14067712,EleutherAI/pythia-14m,step128,seed9,9,128
He had a recurring dream.,dream,dream,He had a dream recurring., recurring dream, dream recurring,recurring,False,-21.049964904785156,-20.658010482788086,-0.3919544219970703,14067712,EleutherAI/pythia-14m,step128,seed9,9,128
He had a bad dream.,dream,dream,He had a dream bad., bad dream, dream bad,bad,False,-21.169677734375,-20.882911682128906,-0.28676605224609375,14067712,EleutherAI/pythia-14m,step128,seed9,9,128
He had a childhood dream.,dream,dream,He had a dream childhood., childhood dream, dream childhood,childhood,True,-22.014968872070312,-21.374454498291016,-0.6405143737792969,14067712,EleutherAI/pythia-14m,step128,seed9,9,128
It was a grueling drill.,drill,drill,It was a drill grueling., grueling drill, drill grueling,grueling,False,-31.805587768554688,-31.945110321044922,0.13952255249023438,14067712,EleutherAI/pythia-14m,step128,seed9,9,128
It was a challenging drill.,drill,drill,It was a drill challenging., challenging drill, drill challenging,challenging,False,-21.772369384765625,-21.95467758178711,0.18230819702148438,14067712,EleutherAI/pythia-14m,step128,seed9,9,128
It was an electric drill.,drill,drill,It was an drill electric., electric drill, drill electric,electric,False,-21.056838989257812,-20.868316650390625,-0.1885223388671875,14067712,EleutherAI/pythia-14m,step128,seed9,9,128
It was a multiple-choice examination.,examination,examination,It was an examination multiple-choice., multiple-choice examination, examination multiple-choice,multiple-choice,False,-41.8879508972168,-42.51445007324219,0.6264991760253906,14067712,EleutherAI/pythia-14m,step128,seed9,9,128
It was a difficult examination.,examination,examination,It was an examination difficult., difficult examination, examination difficult,difficult,False,-20.848678588867188,-20.426897048950195,-0.4217815399169922,14067712,EleutherAI/pythia-14m,step128,seed9,9,128
It was a prostate examination.,examination,examination,It was an examination prostate., prostate examination, examination prostate,prostate,True,-20.990596771240234,-21.29633331298828,0.3057365417480469,14067712,EleutherAI/pythia-14m,step128,seed9,9,128
They had an electric fan.,fan,fan,They had an fan electric., electric fan, fan electric,electric,False,-21.140209197998047,-20.931453704833984,-0.2087554931640625,14067712,EleutherAI/pythia-14m,step128,seed9,9,128
They had a ceiling fan.,fan,fan,They had a fan ceiling., ceiling fan, fan ceiling,ceiling,True,-21.918912887573242,-21.837932586669922,-0.08098030090332031,14067712,EleutherAI/pythia-14m,step128,seed9,9,128
They had a zealous fan.,fan,fan,They had a fan zealous., zealous fan, fan zealous,zealous,False,-33.355567932128906,-32.87013244628906,-0.48543548583984375,14067712,EleutherAI/pythia-14m,step128,seed9,9,128
She had a text file.,file,file,She had a file text., text file, file text,text,True,-20.744182586669922,-21.2955379486084,0.5513553619384766,14067712,EleutherAI/pythia-14m,step128,seed9,9,128
She had a data file.,file,file,She had a file data., data file, file data,data,True,-19.080589294433594,-19.30886459350586,0.22827529907226562,14067712,EleutherAI/pythia-14m,step128,seed9,9,128
She had a nail file.,file,file,She had a file nail., nail file, file nail,nail,True,-19.570955276489258,-20.204994201660156,0.6340389251708984,14067712,EleutherAI/pythia-14m,step128,seed9,9,128
It was an action film.,film,film,It was an film action., action film, film action,action,True,-20.862754821777344,-21.21588134765625,0.35312652587890625,14067712,EleutherAI/pythia-14m,step128,seed9,9,128
It was a censored film.,film,film,It was a film censored., censored film, film censored,censored,False,-31.551227569580078,-31.76736068725586,0.21613311767578125,14067712,EleutherAI/pythia-14m,step128,seed9,9,128
It was a transparent film.,film,film,It was a film transparent., transparent film, film transparent,transparent,False,-21.824323654174805,-22.07947540283203,0.25515174865722656,14067712,EleutherAI/pythia-14m,step128,seed9,9,128
It was a charitable foundation.,foundation,foundation,It was a foundation charitable., charitable foundation, foundation charitable,charitable,False,-20.258153915405273,-19.844242095947266,-0.4139118194580078,14067712,EleutherAI/pythia-14m,step128,seed9,9,128
It was an educational foundation.,foundation,foundation,It was an foundation educational., educational foundation, foundation educational,educational,False,-20.527000427246094,-20.993118286132812,0.46611785888671875,14067712,EleutherAI/pythia-14m,step128,seed9,9,128
It was a wooden foundation.,foundation,foundation,It was a foundation wooden., wooden foundation, foundation wooden,wooden,False,-21.04590606689453,-20.87958526611328,-0.16632080078125,14067712,EleutherAI/pythia-14m,step128,seed9,9,128
It was a mathematical function.,function,function,It was a function mathematical., mathematical function, function mathematical,mathematical,False,-21.338043212890625,-21.538925170898438,0.2008819580078125,14067712,EleutherAI/pythia-14m,step128,seed9,9,128
It was a linear function.,function,function,It was a function linear., linear function, function linear,linear,False,-20.56662368774414,-20.4501953125,-0.11642837524414062,14067712,EleutherAI/pythia-14m,step128,seed9,9,128
It was a social function.,function,function,It was a function social., social function, function social,social,False,-20.631080627441406,-20.38253402709961,-0.24854660034179688,14067712,EleutherAI/pythia-14m,step128,seed9,9,128
