sentence,word,string,reversed_sentence,mod_np,reversed_mod,disambiguating_word,non_adjective,original_logprob,reversed_logprob,ratio,n_params,mpath,revision,seed_name,seed,step
He was on the firm ground.,ground,ground,He was on the ground firm., firm ground, ground firm,firm,False,-21.208084106445312,-21.201223373413086,-0.0068607330322265625,14067712,EleutherAI/pythia-14m,step128,seed9,9,128
He was on the frozen ground.,ground,ground,He was on the ground frozen., frozen ground, ground frozen,frozen,False,-21.330005645751953,-21.4869384765625,0.15693283081054688,14067712,EleutherAI/pythia-14m,step128,seed9,9,128
He was on the camp ground.,ground,ground,He was on the ground camp., camp ground, ground camp,camp,True,-20.66419219970703,-20.470043182373047,-0.19414901733398438,14067712,EleutherAI/pythia-14m,step128,seed9,9,128
They liked the night guard.,guard,guard,They liked the guard night., night guard, guard night,night,True,-20.8947696685791,-21.479225158691406,0.5844554901123047,14067712,EleutherAI/pythia-14m,step128,seed9,9,128
They liked the security guard.,guard,guard,They liked the guard security., security guard, guard security,security,True,-21.532981872558594,-21.54631805419922,0.013336181640625,14067712,EleutherAI/pythia-14m,step128,seed9,9,128
They liked the coast guard.,guard,guard,They liked the guard coast., coast guard, guard coast,coast,True,-21.646419525146484,-22.101341247558594,0.4549217224121094,14067712,EleutherAI/pythia-14m,step128,seed9,9,128
He had an assembly guide.,guide,guide,He had an guide assembly., assembly guide, guide assembly,assembly,True,-21.084062576293945,-20.497102737426758,-0.5869598388671875,14067712,EleutherAI/pythia-14m,step128,seed9,9,128
He had a TV guide.,guide,guide,He had a guide TV., TV guide, guide TV,TV,True,-21.462862014770508,-21.890380859375,0.4275188446044922,14067712,EleutherAI/pythia-14m,step128,seed9,9,128
He had a talkative guide.,guide,guide,He had a guide talkative., talkative guide, guide talkative,talkative,False,-30.679258346557617,-30.698471069335938,0.019212722778320312,14067712,EleutherAI/pythia-14m,step128,seed9,9,128
It was a summer home.,home,home,It was a home summer., summer home, home summer,summer,True,-20.137041091918945,-20.3966121673584,0.2595710754394531,14067712,EleutherAI/pythia-14m,step128,seed9,9,128
It was a childhood home.,home,home,It was a home childhood., childhood home, home childhood,childhood,True,-20.77004623413086,-20.62262725830078,-0.14741897583007812,14067712,EleutherAI/pythia-14m,step128,seed9,9,128
It was a funeral home.,home,home,It was a home funeral., funeral home, home funeral,funeral,False,-20.93154525756836,-20.97991943359375,0.048374176025390625,14067712,EleutherAI/pythia-14m,step128,seed9,9,128
They had natural intelligence.,intelligence,intelligence,They had intelligence natural., natural intelligence, intelligence natural,natural,False,-20.78459930419922,-21.07488250732422,0.290283203125,14067712,EleutherAI/pythia-14m,step128,seed9,9,128
They had innate intelligence.,intelligence,intelligence,They had intelligence innate., innate intelligence, intelligence innate,innate,False,-23.103816986083984,-23.065780639648438,-0.038036346435546875,14067712,EleutherAI/pythia-14m,step128,seed9,9,128
They had classified intelligence.,intelligence,intelligence,They had intelligence classified., classified intelligence, intelligence classified,classified,False,-21.730831146240234,-21.943056106567383,0.21222496032714844,14067712,EleutherAI/pythia-14m,step128,seed9,9,128
It was a sensitive issue.,issue,issue,It was an issue sensitive., sensitive issue, issue sensitive,sensitive,False,-20.56798553466797,-20.555347442626953,-0.012638092041015625,14067712,EleutherAI/pythia-14m,step128,seed9,9,128
It was a political issue.,issue,issue,It was an issue political., political issue, issue political,political,False,-18.916152954101562,-18.80527114868164,-0.11088180541992188,14067712,EleutherAI/pythia-14m,step128,seed9,9,128
It was a weekly issue.,issue,issue,It was an issue weekly., weekly issue, issue weekly,weekly,False,-20.368003845214844,-20.438465118408203,0.07046127319335938,14067712,EleutherAI/pythia-14m,step128,seed9,9,128
It was a blackberry jam.,jam,jam,It was a jam blackberry., blackberry jam, jam blackberry,blackberry,True,-32.964637756347656,-33.149444580078125,0.18480682373046875,14067712,EleutherAI/pythia-14m,step128,seed9,9,128
It was a peach jam.,jam,jam,It was a jam peach., peach jam, jam peach,peach,False,-32.747833251953125,-32.738197326660156,-0.00963592529296875,14067712,EleutherAI/pythia-14m,step128,seed9,9,128
It was a traffic jam.,jam,jam,It was a jam traffic., traffic jam, jam traffic,traffic,True,-21.63791275024414,-21.864246368408203,0.2263336181640625,14067712,EleutherAI/pythia-14m,step128,seed9,9,128
It was a duplicate key.,key,key,It was a key duplicate., duplicate key, key duplicate,duplicate,False,-21.405258178710938,-21.121809005737305,-0.2834491729736328,14067712,EleutherAI/pythia-14m,step128,seed9,9,128
It was a master key.,key,key,It was a key master., master key, key master,master,True,-20.494001388549805,-20.07430648803711,-0.4196949005126953,14067712,EleutherAI/pythia-14m,step128,seed9,9,128
It was a delete key.,key,key,It was a key delete., delete key, key delete,delete,False,-20.916011810302734,-21.160070419311523,0.24405860900878906,14067712,EleutherAI/pythia-14m,step128,seed9,9,128
They liked the marinated lamb.,lamb,lamb,They liked the lamb marinated., marinated lamb, lamb marinated,marinated,True,-32.962364196777344,-33.143375396728516,0.18101119995117188,14067712,EleutherAI/pythia-14m,step128,seed9,9,128
They liked the grilled lamb.,lamb,lamb,They liked the lamb grilled., grilled lamb, lamb grilled,grilled,False,-23.084957122802734,-23.4291934967041,0.3442363739013672,14067712,EleutherAI/pythia-14m,step128,seed9,9,128
They liked the cute lamb.,lamb,lamb,They liked the lamb cute., cute lamb, lamb cute,cute,False,-22.011619567871094,-22.732746124267578,0.7211265563964844,14067712,EleutherAI/pythia-14m,step128,seed9,9,128
She had curly locks.,lock,locks,She had locks curly., curly locks, locks curly,curly,False,-22.34528350830078,-22.09075927734375,-0.25452423095703125,14067712,EleutherAI/pythia-14m,step128,seed9,9,128
She had brown locks.,lock,locks,She had locks brown., brown locks, locks brown,brown,False,-21.56005096435547,-21.494504928588867,-0.06554603576660156,14067712,EleutherAI/pythia-14m,step128,seed9,9,128
She had window locks.,lock,locks,She had locks window., window locks, locks window,window,True,-20.535987854003906,-20.58418083190918,0.04819297790527344,14067712,EleutherAI/pythia-14m,step128,seed9,9,128
They liked the hot lunch.,lunch,lunch,They liked the lunch hot., hot lunch, lunch hot,hot,False,-20.656627655029297,-20.983154296875,0.3265266418457031,14067712,EleutherAI/pythia-14m,step128,seed9,9,128
They liked the sandwich lunch.,lunch,lunch,They liked the lunch sandwich., sandwich lunch, lunch sandwich,sandwich,True,-22.055763244628906,-22.928600311279297,0.8728370666503906,14067712,EleutherAI/pythia-14m,step128,seed9,9,128
They liked the afternoon lunch.,lunch,lunch,They liked the lunch afternoon., afternoon lunch, lunch afternoon,afternoon,True,-21.039560317993164,-21.53466033935547,0.4951000213623047,14067712,EleutherAI/pythia-14m,step128,seed9,9,128
He liked the flea market.,market,market,He liked the market flea., flea market, market flea,flea,True,-30.19675636291504,-30.114398956298828,-0.08235740661621094,14067712,EleutherAI/pythia-14m,step128,seed9,9,128
He liked the fish market.,market,market,He liked the market fish., fish market, market fish,fish,True,-19.466930389404297,-19.690208435058594,0.22327804565429688,14067712,EleutherAI/pythia-14m,step128,seed9,9,128
He liked the housing market.,market,market,He liked the market housing., housing market, market housing,housing,True,-19.818443298339844,-19.788467407226562,-0.02997589111328125,14067712,EleutherAI/pythia-14m,step128,seed9,9,128
It was a lit match.,match,match,It was a match lit., lit match, match lit,lit,False,-21.152002334594727,-20.975582122802734,-0.1764202117919922,14067712,EleutherAI/pythia-14m,step128,seed9,9,128
It was a burning match.,match,match,It was a match burning., burning match, match burning,burning,False,-21.395462036132812,-21.0490665435791,-0.34639549255371094,14067712,EleutherAI/pythia-14m,step128,seed9,9,128
It was a soccer match.,match,match,It was a match soccer., soccer match, match soccer,soccer,True,-20.392230987548828,-20.46976089477539,0.0775299072265625,14067712,EleutherAI/pythia-14m,step128,seed9,9,128
It was cough medicine.,medicine,medicine,It was medicine cough., cough medicine, medicine cough,cough,True,-21.119396209716797,-21.5533390045166,0.4339427947998047,14067712,EleutherAI/pythia-14m,step128,seed9,9,128
It was prescription medicine.,medicine,medicine,It was medicine prescription., prescription medicine, medicine prescription,prescription,True,-21.84346580505371,-21.75546646118164,-0.08799934387207031,14067712,EleutherAI/pythia-14m,step128,seed9,9,128
It was orthopedic medicine.,medicine,medicine,It was medicine orthopedic., orthopedic medicine, medicine orthopedic,orthopedic,False,-33.71803665161133,-34.40064239501953,0.6826057434082031,14067712,EleutherAI/pythia-14m,step128,seed9,9,128
There was a phone message.,message,message,There was a message phone., phone message, message phone,phone,True,-20.584373474121094,-20.665653228759766,0.08127975463867188,14067712,EleutherAI/pythia-14m,step128,seed9,9,128
There was a computer message.,message,message,There was a message computer., computer message, message computer,computer,True,-20.427059173583984,-20.01642417907715,-0.41063499450683594,14067712,EleutherAI/pythia-14m,step128,seed9,9,128
There was an urgent message.,message,message,There was an message urgent., urgent message, message urgent,urgent,False,-22.064289093017578,-22.55571746826172,0.4914283752441406,14067712,EleutherAI/pythia-14m,step128,seed9,9,128
It was a fungal mold.,mold,mold,It was a mold fungal., fungal mold, mold fungal,fungal,False,-21.826576232910156,-21.86855697631836,0.041980743408203125,14067712,EleutherAI/pythia-14m,step128,seed9,9,128
It was a harmful mold.,mold,mold,It was a mold harmful., harmful mold, mold harmful,harmful,False,-21.62110137939453,-21.263795852661133,-0.35730552673339844,14067712,EleutherAI/pythia-14m,step128,seed9,9,128
It was a rubber mold.,mold,mold,It was a mold rubber., rubber mold, mold rubber,rubber,True,-21.3194580078125,-21.119428634643555,-0.2000293731689453,14067712,EleutherAI/pythia-14m,step128,seed9,9,128
She saw the cancerous mole.,mole,mole,She saw the mole cancerous., cancerous mole, mole cancerous,cancerous,False,-32.95844268798828,-32.83649444580078,-0.1219482421875,14067712,EleutherAI/pythia-14m,step128,seed9,9,128
She saw the raised mole.,mole,mole,She saw the mole raised., raised mole, mole raised,raised,False,-22.104412078857422,-22.215126037597656,0.11071395874023438,14067712,EleutherAI/pythia-14m,step128,seed9,9,128
She saw the cute mole.,mole,mole,She saw the mole cute., cute mole, mole cute,cute,False,-22.640724182128906,-22.626474380493164,-0.014249801635742188,14067712,EleutherAI/pythia-14m,step128,seed9,9,128
He liked the rhythmic movement.,movement,movement,He liked the movement rhythmic., rhythmic movement, movement rhythmic,rhythmic,False,-30.871618270874023,-30.468364715576172,-0.40325355529785156,14067712,EleutherAI/pythia-14m,step128,seed9,9,128
He liked the graceful movement.,movement,movement,He liked the movement graceful., graceful movement, movement graceful,graceful,False,-21.771007537841797,-21.268817901611328,-0.5021896362304688,14067712,EleutherAI/pythia-14m,step128,seed9,9,128
He liked the feminist movement.,movement,movement,He liked the movement feminist., feminist movement, movement feminist,feminist,True,-21.370361328125,-20.471698760986328,-0.8986625671386719,14067712,EleutherAI/pythia-14m,step128,seed9,9,128
It was a national newspaper.,newspaper,newspaper,It was a newspaper national., national newspaper, newspaper national,national,False,-20.877395629882812,-21.046049118041992,0.1686534881591797,14067712,EleutherAI/pythia-14m,step128,seed9,9,128
It was a daily newspaper.,newspaper,newspaper,It was a newspaper daily., daily newspaper, newspaper daily,daily,False,-20.59842300415039,-20.544960021972656,-0.053462982177734375,14067712,EleutherAI/pythia-14m,step128,seed9,9,128
It was a faded newspaper.,newspaper,newspaper,It was a newspaper faded., faded newspaper, newspaper faded,faded,False,-21.56931495666504,-21.61302375793457,0.04370880126953125,14067712,EleutherAI/pythia-14m,step128,seed9,9,128
It was a juicy orange.,orange,orange,It was an orange juicy., juicy orange, orange juicy,juicy,False,-34.219791412353516,-34.150306701660156,-0.06948471069335938,14067712,EleutherAI/pythia-14m,step128,seed9,9,128
It was a ripe orange.,orange,orange,It was an orange ripe., ripe orange, orange ripe,ripe,False,-22.343772888183594,-22.30458641052246,-0.03918647766113281,14067712,EleutherAI/pythia-14m,step128,seed9,9,128
It was a bright orange.,orange,orange,It was an orange bright., bright orange, orange bright,bright,False,-20.823043823242188,-21.588083267211914,0.7650394439697266,14067712,EleutherAI/pythia-14m,step128,seed9,9,128
He saw the young page.,page,page,He saw the page young., young page, page young,young,False,-21.68585968017578,-21.93815040588379,0.2522907257080078,14067712,EleutherAI/pythia-14m,step128,seed9,9,128
He saw the loyal page.,page,page,He saw the page loyal., loyal page, page loyal,loyal,False,-20.813966751098633,-21.448482513427734,0.6345157623291016,14067712,EleutherAI/pythia-14m,step128,seed9,9,128
He saw the blank page.,page,page,He saw the page blank., blank page, page blank,blank,False,-21.008834838867188,-21.200580596923828,0.19174575805664062,14067712,EleutherAI/pythia-14m,step128,seed9,9,128
It was a calloused palm.,palm,palm,It was a palm calloused., calloused palm, palm calloused,calloused,False,-32.06374740600586,-32.11994171142578,0.056194305419921875,14067712,EleutherAI/pythia-14m,step128,seed9,9,128
It was a wrinkled palm.,palm,palm,It was a palm wrinkled., wrinkled palm, palm wrinkled,wrinkled,False,-31.82382583618164,-31.753185272216797,-0.07064056396484375,14067712,EleutherAI/pythia-14m,step128,seed9,9,128
It was a tropical palm.,palm,palm,It was a palm tropical., tropical palm, palm tropical,tropical,False,-22.587833404541016,-22.372879028320312,-0.21495437622070312,14067712,EleutherAI/pythia-14m,step128,seed9,9,128
It was a control panel.,panel,panel,It was a panel control., control panel, panel control,control,True,-19.979328155517578,-19.603445053100586,-0.3758831024169922,14067712,EleutherAI/pythia-14m,step128,seed9,9,128
It was an instrument panel.,panel,panel,It was an panel instrument., instrument panel, panel instrument,instrument,False,-20.823131561279297,-20.51244354248047,-0.3106880187988281,14067712,EleutherAI/pythia-14m,step128,seed9,9,128
It was an advisory panel.,panel,panel,It was an panel advisory., advisory panel, panel advisory,advisory,False,-21.708293914794922,-21.641990661621094,-0.06630325317382812,14067712,EleutherAI/pythia-14m,step128,seed9,9,128
It was a secret passage.,passage,passage,It was a passage secret., secret passage, passage secret,secret,False,-20.805320739746094,-20.976428985595703,0.17110824584960938,14067712,EleutherAI/pythia-14m,step128,seed9,9,128
It was a narrow passage.,passage,passage,It was a passage narrow., narrow passage, passage narrow,narrow,False,-21.3221378326416,-21.50725555419922,0.1851177215576172,14067712,EleutherAI/pythia-14m,step128,seed9,9,128
It was a literary passage.,passage,passage,It was a passage literary., literary passage, passage literary,literary,False,-21.668197631835938,-21.71724510192871,0.04904747009277344,14067712,EleutherAI/pythia-14m,step128,seed9,9,128
It was a tasty perch.,perch,perch,It was a perch tasty., tasty perch, perch tasty,tasty,False,-29.810665130615234,-29.769115447998047,-0.0415496826171875,14067712,EleutherAI/pythia-14m,step128,seed9,9,128
It was a freshwater perch.,perch,perch,It was a perch freshwater., freshwater perch, perch freshwater,freshwater,True,-30.595468521118164,-30.370849609375,-0.22461891174316406,14067712,EleutherAI/pythia-14m,step128,seed9,9,128
It was a lofty perch.,perch,perch,It was a perch lofty., lofty perch, perch lofty,lofty,False,-40.413719177246094,-40.44219207763672,0.028472900390625,14067712,EleutherAI/pythia-14m,step128,seed9,9,128
He saw the fast pitcher.,pitcher,pitcher,He saw the pitcher fast., fast pitcher, pitcher fast,fast,False,-21.72028350830078,-21.39853286743164,-0.3217506408691406,14067712,EleutherAI/pythia-14m,step128,seed9,9,128
He saw the right-handed pitcher.,pitcher,pitcher,He saw the pitcher right-handed., right-handed pitcher, pitcher right-handed,right-handed,False,-43.664005279541016,-43.776390075683594,0.11238479614257812,14067712,EleutherAI/pythia-14m,step128,seed9,9,128
He saw the glass pitcher.,pitcher,pitcher,He saw the pitcher glass., glass pitcher, pitcher glass,glass,True,-22.454559326171875,-22.40549087524414,-0.049068450927734375,14067712,EleutherAI/pythia-14m,step128,seed9,9,128
It was a windy port.,port,port,It was a port windy., windy port, port windy,windy,False,-30.285554885864258,-30.32463836669922,0.03908348083496094,14067712,EleutherAI/pythia-14m,step128,seed9,9,128
It was a seaside port.,port,port,It was a port seaside., seaside port, port seaside,seaside,True,-30.977807998657227,-31.08099365234375,0.10318565368652344,14067712,EleutherAI/pythia-14m,step128,seed9,9,128
It was a delicious port.,port,port,It was a port delicious., delicious port, port delicious,delicious,False,-22.050769805908203,-22.070449829101562,0.019680023193359375,14067712,EleutherAI/pythia-14m,step128,seed9,9,128
He was in a distinguished position.,position,position,He was in a position distinguished., distinguished position, position distinguished,distinguished,False,-20.07550811767578,-20.088151931762695,0.012643814086914062,14067712,EleutherAI/pythia-14m,step128,seed9,9,128
He was in a prominent position.,position,position,He was in a position prominent., prominent position, position prominent,prominent,False,-20.18802833557129,-20.512447357177734,0.3244190216064453,14067712,EleutherAI/pythia-14m,step128,seed9,9,128
He was in a fetal position.,position,position,He was in a position fetal., fetal position, position fetal,fetal,False,-20.52328872680664,-20.60074234008789,0.07745361328125,14067712,EleutherAI/pythia-14m,step128,seed9,9,128
It was a wooden post.,post,post,It was a post wooden., wooden post, post wooden,wooden,False,-21.571903228759766,-21.297203063964844,-0.2747001647949219,14067712,EleutherAI/pythia-14m,step128,seed9,9,128
It was a fence post.,post,post,It was a post fence., fence post, post fence,fence,True,-21.519729614257812,-21.42165756225586,-0.09807205200195312,14067712,EleutherAI/pythia-14m,step128,seed9,9,128
It was a teaching post.,post,post,It was a post teaching., teaching post, post teaching,teaching,True,-20.833690643310547,-20.734169006347656,-0.09952163696289062,14067712,EleutherAI/pythia-14m,step128,seed9,9,128
He had the alcoholic punch.,punch,punch,He had the punch alcoholic., alcoholic punch, punch alcoholic,alcoholic,False,-23.342388153076172,-22.776878356933594,-0.5655097961425781,14067712,EleutherAI/pythia-14m,step128,seed9,9,128
He had the fruit punch.,punch,punch,He had the punch fruit., fruit punch, punch fruit,fruit,True,-22.666866302490234,-22.345060348510742,-0.3218059539794922,14067712,EleutherAI/pythia-14m,step128,seed9,9,128
He had the strongest punch.,punch,punch,He had the punch strongest., strongest punch, punch strongest,strongest,False,-23.16436767578125,-22.639896392822266,-0.5244712829589844,14067712,EleutherAI/pythia-14m,step128,seed9,9,128
She had a brilliant pupil.,pupil,pupil,She had a pupil brilliant., brilliant pupil, pupil brilliant,brilliant,False,-22.870227813720703,-23.239734649658203,0.3695068359375,14067712,EleutherAI/pythia-14m,step128,seed9,9,128
She had an interested pupil.,pupil,pupil,She had an pupil interested., interested pupil, pupil interested,interested,False,-22.166160583496094,-22.182313919067383,0.016153335571289062,14067712,EleutherAI/pythia-14m,step128,seed9,9,128
She had a dilated pupil.,pupil,pupil,She had a pupil dilated., dilated pupil, pupil dilated,dilated,False,-22.48170280456543,-22.53194808959961,0.05024528503417969,14067712,EleutherAI/pythia-14m,step128,seed9,9,128
That was a loud racket.,racket,racket,That was a racket loud., loud racket, racket loud,loud,False,-21.414100646972656,-20.813907623291016,-0.6001930236816406,14067712,EleutherAI/pythia-14m,step128,seed9,9,128
That was an annoying racket.,racket,racket,That was an racket annoying., annoying racket, racket annoying,annoying,False,-21.18769073486328,-22.387409210205078,1.1997184753417969,14067712,EleutherAI/pythia-14m,step128,seed9,9,128
That was a badminton racket.,racket,racket,That was a racket badminton., badminton racket, racket badminton,badminton,True,-41.847354888916016,-42.194740295410156,0.3473854064941406,14067712,EleutherAI/pythia-14m,step128,seed9,9,128
He liked electronic rock.,rock,rock,He liked rock electronic., electronic rock, rock electronic,electronic,False,-22.61505699157715,-22.133039474487305,-0.48201751708984375,14067712,EleutherAI/pythia-14m,step128,seed9,9,128
He liked alternative rock.,rock,rock,He liked rock alternative., alternative rock, rock alternative,alternative,False,-21.469820022583008,-20.960018157958984,-0.5098018646240234,14067712,EleutherAI/pythia-14m,step128,seed9,9,128
He liked limestone rock.,rock,rock,He liked rock limestone., limestone rock, rock limestone,limestone,True,-23.01454734802246,-23.079059600830078,0.06451225280761719,14067712,EleutherAI/pythia-14m,step128,seed9,9,128
He saw the wise sage.,sage,sage,He saw the sage wise., wise sage, sage wise,wise,False,-22.54064178466797,-22.287403106689453,-0.2532386779785156,14067712,EleutherAI/pythia-14m,step128,seed9,9,128
He saw the renowned sage.,sage,sage,He saw the sage renowned., renowned sage, sage renowned,renowned,False,-23.148000717163086,-22.730388641357422,-0.41761207580566406,14067712,EleutherAI/pythia-14m,step128,seed9,9,128
He saw the fragrant sage.,sage,sage,He saw the sage fragrant., fragrant sage, sage fragrant,fragrant,False,-32.853782653808594,-32.533294677734375,-0.32048797607421875,14067712,EleutherAI/pythia-14m,step128,seed9,9,128
It was a fish scale.,scale,scale,It was a scale fish., fish scale, scale fish,fish,True,-20.583229064941406,-21.071176528930664,0.4879474639892578,14067712,EleutherAI/pythia-14m,step128,seed9,9,128
It was a lizard scale.,scale,scale,It was a scale lizard., lizard scale, scale lizard,lizard,True,-30.510425567626953,-30.700008392333984,0.18958282470703125,14067712,EleutherAI/pythia-14m,step128,seed9,9,128
It was a music scale.,scale,scale,It was a scale music., music scale, scale music,music,True,-20.605030059814453,-20.656158447265625,0.051128387451171875,14067712,EleutherAI/pythia-14m,step128,seed9,9,128
It was a touching scene.,scene,scene,It was a scene touching., touching scene, scene touching,touching,False,-21.325572967529297,-21.307052612304688,-0.018520355224609375,14067712,EleutherAI/pythia-14m,step128,seed9,9,128
It was a well-acted scene.,scene,scene,It was a scene well-acted., well-acted scene, scene well-acted,well-acted,False,-42.37823486328125,-42.80539321899414,0.4271583557128906,14067712,EleutherAI/pythia-14m,step128,seed9,9,128
It was a nature scene.,scene,scene,It was a scene nature., nature scene, scene nature,nature,True,-21.192638397216797,-21.126256942749023,-0.06638145446777344,14067712,EleutherAI/pythia-14m,step128,seed9,9,128
It was a gold seal.,seal,seal,It was a seal gold., gold seal, seal gold,gold,True,-21.128618240356445,-21.257164001464844,0.12854576110839844,14067712,EleutherAI/pythia-14m,step128,seed9,9,128
It was a certified seal.,seal,seal,It was a seal certified., certified seal, seal certified,certified,False,-22.330141067504883,-22.273576736450195,-0.0565643310546875,14067712,EleutherAI/pythia-14m,step128,seed9,9,128
It was a circus seal.,seal,seal,It was a seal circus., circus seal, seal circus,circus,True,-22.382808685302734,-22.582927703857422,0.2001190185546875,14067712,EleutherAI/pythia-14m,step128,seed9,9,128
He used the scotch tape.,tape,tape,He used the tape scotch., scotch tape, tape scotch,scotch,True,-39.76280212402344,-40.37738800048828,0.6145858764648438,14067712,EleutherAI/pythia-14m,step128,seed9,9,128
He used the double-sided tape.,tape,tape,He used the tape double-sided., double-sided tape, tape double-sided,double-sided,False,-41.808929443359375,-42.331302642822266,0.5223731994628906,14067712,EleutherAI/pythia-14m,step128,seed9,9,128
He used the interview tape.,tape,tape,He used the tape interview., interview tape, tape interview,interview,True,-20.916343688964844,-21.604454040527344,0.6881103515625,14067712,EleutherAI/pythia-14m,step128,seed9,9,128
It was a winter term.,term,term,It was a term winter., winter term, term winter,winter,True,-20.805347442626953,-20.877174377441406,0.07182693481445312,14067712,EleutherAI/pythia-14m,step128,seed9,9,128
It was a fall term.,term,term,It was a term fall., fall term, term fall,fall,True,-20.074838638305664,-20.284332275390625,0.20949363708496094,14067712,EleutherAI/pythia-14m,step128,seed9,9,128
It was a legal term.,term,term,It was a term legal., legal term, term legal,legal,False,-19.46586799621582,-19.466039657592773,0.000171661376953125,14067712,EleutherAI/pythia-14m,step128,seed9,9,128
It was a clock tick.,tick,tick,It was a tick clock., clock tick, tick clock,clock,True,-21.024761199951172,-21.1330509185791,0.10828971862792969,14067712,EleutherAI/pythia-14m,step128,seed9,9,128
