sentence,word,string,reversed_sentence,mod_np,reversed_mod,disambiguating_word,non_adjective,original_logprob,reversed_logprob,ratio,n_params,mpath,revision,seed_name,seed,step
It was a fall term.,term,term,It was a term fall., fall term, term fall,fall,True,-16.6927547454834,-17.766822814941406,1.0740680694580078,14067712,EleutherAI/pythia-14m,step58000,seed2,2,58000
It was a legal term.,term,term,It was a term legal., legal term, term legal,legal,False,-15.372209548950195,-18.400184631347656,3.027975082397461,14067712,EleutherAI/pythia-14m,step58000,seed2,2,58000
It was a clock tick.,tick,tick,It was a tick clock., clock tick, tick clock,clock,True,-17.142698287963867,-20.172523498535156,3.029825210571289,14067712,EleutherAI/pythia-14m,step58000,seed2,2,58000
It was an audible tick.,tick,tick,It was an tick audible., audible tick, tick audible,audible,False,-17.900375366210938,-20.97491455078125,3.0745391845703125,14067712,EleutherAI/pythia-14m,step58000,seed2,2,58000
It was a parasitic tick.,tick,tick,It was a tick parasitic., parasitic tick, tick parasitic,parasitic,False,-22.911518096923828,-24.691139221191406,1.7796211242675781,14067712,EleutherAI/pythia-14m,step58000,seed2,2,58000
It was a generous tip.,tip,tip,It was a tip generous., generous tip, tip generous,generous,False,-15.896750450134277,-23.527332305908203,7.630581855773926,14067712,EleutherAI/pythia-14m,step58000,seed2,2,58000
It was a stingy tip.,tip,tip,It was a tip stingy., stingy tip, tip stingy,stingy,False,-20.879215240478516,-27.118270874023438,6.239055633544922,14067712,EleutherAI/pythia-14m,step58000,seed2,2,58000
It was a pencil tip.,tip,tip,It was a tip pencil., pencil tip, tip pencil,pencil,True,-17.506507873535156,-19.85055923461914,2.3440513610839844,14067712,EleutherAI/pythia-14m,step58000,seed2,2,58000
She liked the essay title.,title,title,She liked the title essay., essay title, title essay,essay,True,-21.300430297851562,-18.55516242980957,-2.745267868041992,14067712,EleutherAI/pythia-14m,step58000,seed2,2,58000
She liked the poem title.,title,title,She liked the title poem., poem title, title poem,poem,True,-19.523929595947266,-17.72221565246582,-1.8017139434814453,14067712,EleutherAI/pythia-14m,step58000,seed2,2,58000
She liked the academic title.,title,title,She liked the title academic., academic title, title academic,academic,False,-18.23812484741211,-18.744722366333008,0.5065975189208984,14067712,EleutherAI/pythia-14m,step58000,seed2,2,58000
It was a costly toll.,toll,toll,It was a toll costly., costly toll, toll costly,costly,False,-17.72226333618164,-22.853193283081055,5.130929946899414,14067712,EleutherAI/pythia-14m,step58000,seed2,2,58000
It was a road toll.,toll,toll,It was a toll road., road toll, toll road,road,True,-16.8636474609375,-17.831037521362305,0.9673900604248047,14067712,EleutherAI/pythia-14m,step58000,seed2,2,58000
It was a loud toll.,toll,toll,It was a toll loud., loud toll, toll loud,loud,False,-21.016582489013672,-22.181119918823242,1.1645374298095703,14067712,EleutherAI/pythia-14m,step58000,seed2,2,58000
She saw the train tracks.,track,tracks,She saw the tracks train., train tracks, tracks train,train,True,-15.656534194946289,-20.68089485168457,5.024360656738281,14067712,EleutherAI/pythia-14m,step58000,seed2,2,58000
She saw the trolley tracks.,track,tracks,She saw the tracks trolley., trolley tracks, tracks trolley,trolley,True,-25.070724487304688,-27.88018798828125,2.8094635009765625,14067712,EleutherAI/pythia-14m,step58000,seed2,2,58000
She saw the moose tracks.,track,tracks,She saw the tracks moose., moose tracks, tracks moose,moose,False,-23.13707160949707,-25.53696060180664,2.3998889923095703,14067712,EleutherAI/pythia-14m,step58000,seed2,2,58000
It was five yards.,yard,yards,It was yards five., five yards, yards five,five,True,-15.183059692382812,-21.180875778198242,5.99781608581543,14067712,EleutherAI/pythia-14m,step58000,seed2,2,58000
It was ten yards.,yard,yards,It was yards ten., ten yards, yards ten,ten,True,-14.14583969116211,-22.21510124206543,8.06926155090332,14067712,EleutherAI/pythia-14m,step58000,seed2,2,58000
They were big yards.,yard,yards,They were yards big., big yards, yards big,big,False,-16.08306884765625,-22.83896827697754,6.755899429321289,14067712,EleutherAI/pythia-14m,step58000,seed2,2,58000
It was a comedic act.,act,act,It was an act comedic., comedic act, act comedic,comedic,False,-19.55942726135254,-21.893903732299805,2.3344764709472656,14067712,EleutherAI/pythia-14m,step58000,seed2,2,58000
He had a pending appeal.,appeal,appeal,He had an appeal pending., pending appeal, appeal pending,pending,False,-16.13227653503418,-17.109962463378906,0.9776859283447266,14067712,EleutherAI/pythia-14m,step58000,seed2,2,58000
It was a polluted atmosphere.,atmosphere,atmosphere,It was an atmosphere polluted., polluted atmosphere, atmosphere polluted,polluted,False,-21.73218536376953,-23.327392578125,1.5952072143554688,14067712,EleutherAI/pythia-14m,step58000,seed2,2,58000
It was a country band.,band,band,It was a band country., country band, band country,country,True,-15.785356521606445,-22.268455505371094,6.483098983764648,14067712,EleutherAI/pythia-14m,step58000,seed2,2,58000
There was a religious barrier.,barrier,barrier,There was a barrier religious., religious barrier, barrier religious,religious,False,-19.124900817871094,-22.77179718017578,3.6468963623046875,14067712,EleutherAI/pythia-14m,step58000,seed2,2,58000
He saw a baseball bat.,bat,bat,He saw a bat baseball., baseball bat, bat baseball,baseball,True,-12.650442123413086,-21.082908630371094,8.432466506958008,14067712,EleutherAI/pythia-14m,step58000,seed2,2,58000
He saw the balance beam.,beam,beam,He saw the beam balance., balance beam, beam balance,balance,True,-18.42350196838379,-19.639575958251953,1.216073989868164,14067712,EleutherAI/pythia-14m,step58000,seed2,2,58000
She had a writer's block.,block,block,She had a block writer's., writer's block, block writer's,writer,True,-25.860258102416992,-25.246444702148438,-0.6138134002685547,14067712,EleutherAI/pythia-14m,step58000,seed2,2,58000
He has royal blood.,blood,blood,He has blood royal., royal blood, blood royal,royal,False,-17.990896224975586,-20.980937957763672,2.990041732788086,14067712,EleutherAI/pythia-14m,step58000,seed2,2,58000
It was the school board.,board,board,It was the board school., school board, board school,school,True,-12.226251602172852,-16.153383255004883,3.9271316528320312,14067712,EleutherAI/pythia-14m,step58000,seed2,2,58000
He had a leather-bound book.,book,book,He had a book leather-bound., leather-bound book, book leather-bound,leather-bound,False,-27.409534454345703,-28.853172302246094,1.4436378479003906,14067712,EleutherAI/pythia-14m,step58000,seed2,2,58000
They ate a lonely breakfast.,breakfast,breakfast,They ate a breakfast lonely., lonely breakfast, breakfast lonely,lonely,False,-14.938920021057129,-17.974241256713867,3.0353212356567383,14067712,EleutherAI/pythia-14m,step58000,seed2,2,58000
It was an island cape.,cape,cape,It was an cape island., island cape, cape island,island,True,-21.905649185180664,-25.3074893951416,3.4018402099609375,14067712,EleutherAI/pythia-14m,step58000,seed2,2,58000
It was a criminal case.,case,case,It was a case criminal., criminal case, case criminal,criminal,False,-13.190950393676758,-17.175880432128906,3.9849300384521484,14067712,EleutherAI/pythia-14m,step58000,seed2,2,58000
It was a primary cause.,cause,cause,It was a cause primary., primary cause, cause primary,primary,False,-11.891387939453125,-20.818174362182617,8.926786422729492,14067712,EleutherAI/pythia-14m,step58000,seed2,2,58000
It was a jail cell.,cell,cell,It was a cell jail., jail cell, cell jail,jail,True,-17.03119659423828,-19.690006256103516,2.6588096618652344,14067712,EleutherAI/pythia-14m,step58000,seed2,2,58000
She had a good-luck charm.,charm,charm,She had a charm good-luck., good-luck charm, charm good-luck,good-luck,False,-26.209613800048828,-28.826698303222656,2.617084503173828,14067712,EleutherAI/pythia-14m,step58000,seed2,2,58000
They liked the pet chicken.,chicken,chicken,They liked the chicken pet., pet chicken, chicken pet,pet,True,-17.055112838745117,-16.59264373779297,-0.46246910095214844,14067712,EleutherAI/pythia-14m,step58000,seed2,2,58000
It was a stimulating class.,class,class,It was a class stimulating., stimulating class, class stimulating,stimulating,False,-19.123291015625,-21.869476318359375,2.746185302734375,14067712,EleutherAI/pythia-14m,step58000,seed2,2,58000
It was a metal clip.,clip,clip,It was a clip metal., metal clip, clip metal,metal,True,-19.600055694580078,-23.162761688232422,3.5627059936523438,14067712,EleutherAI/pythia-14m,step58000,seed2,2,58000
It was a common cold.,cold,cold,It was a cold common., common cold, cold common,common,False,-16.984161376953125,-19.212562561035156,2.2284011840820312,14067712,EleutherAI/pythia-14m,step58000,seed2,2,58000
It was a marble column.,column,column,It was a column marble., marble column, column marble,marble,True,-16.72130584716797,-22.41043472290039,5.689128875732422,14067712,EleutherAI/pythia-14m,step58000,seed2,2,58000
He liked the polite company.,company,company,He liked the company polite., polite company, company polite,polite,False,-16.622255325317383,-18.057579040527344,1.435323715209961,14067712,EleutherAI/pythia-14m,step58000,seed2,2,58000
It was a traffic cone.,cone,cone,It was a cone traffic., traffic cone, cone traffic,traffic,True,-17.69890594482422,-23.456218719482422,5.757312774658203,14067712,EleutherAI/pythia-14m,step58000,seed2,2,58000
He made a well-written contribution.,contribution,contribution,He made a contribution well-written., well-written contribution, contribution well-written,well-written,False,-21.887121200561523,-26.668012619018555,4.780891418457031,14067712,EleutherAI/pythia-14m,step58000,seed2,2,58000
That was the correct count.,count,count,That was the count correct., correct count, count correct,correct,False,-15.185004234313965,-18.98318862915039,3.798184394836426,14067712,EleutherAI/pythia-14m,step58000,seed2,2,58000
It was a collision course.,course,course,It was a course collision., collision course, course collision,collision,True,-18.93723487854004,-18.86650276184082,-0.07073211669921875,14067712,EleutherAI/pythia-14m,step58000,seed2,2,58000
It was a historical date.,date,date,It was a date historical., historical date, date historical,historical,False,-14.016962051391602,-18.763084411621094,4.746122360229492,14067712,EleutherAI/pythia-14m,step58000,seed2,2,58000
It was about college degrees.,degree,degrees,It was about degrees college., college degrees, degrees college,college,True,-19.568618774414062,-25.624568939208984,6.055950164794922,14067712,EleutherAI/pythia-14m,step58000,seed2,2,58000
They liked the architectural design.,design,design,They liked the design architectural., architectural design, design architectural,architectural,False,-16.862394332885742,-20.162376403808594,3.2999820709228516,14067712,EleutherAI/pythia-14m,step58000,seed2,2,58000
They liked the anniversary dinner.,dinner,dinner,They liked the dinner anniversary., anniversary dinner, dinner anniversary,anniversary,True,-19.810832977294922,-18.856979370117188,-0.9538536071777344,14067712,EleutherAI/pythia-14m,step58000,seed2,2,58000
He had a career dream.,dream,dream,He had a dream career., career dream, dream career,career,True,-16.815784454345703,-17.7963809967041,0.9805965423583984,14067712,EleutherAI/pythia-14m,step58000,seed2,2,58000
It was a battery-powered drill.,drill,drill,It was a drill battery-powered., battery-powered drill, drill battery-powered,battery-powered,False,-26.957618713378906,-29.4312686920166,2.4736499786376953,14067712,EleutherAI/pythia-14m,step58000,seed2,2,58000
It was a physical examination.,examination,examination,It was an examination physical., physical examination, examination physical,physical,False,-12.000728607177734,-18.413253784179688,6.412525177001953,14067712,EleutherAI/pythia-14m,step58000,seed2,2,58000
They had an enthusiastic fan.,fan,fan,They had an fan enthusiastic., enthusiastic fan, fan enthusiastic,enthusiastic,False,-14.630254745483398,-22.360374450683594,7.730119705200195,14067712,EleutherAI/pythia-14m,step58000,seed2,2,58000
She had a steel file.,file,file,She had a file steel., steel file, file steel,steel,True,-19.60403823852539,-23.908309936523438,4.304271697998047,14067712,EleutherAI/pythia-14m,step58000,seed2,2,58000
It was a plastic film.,film,film,It was a film plastic., plastic film, film plastic,plastic,False,-14.021148681640625,-19.71624183654785,5.695093154907227,14067712,EleutherAI/pythia-14m,step58000,seed2,2,58000
It was a concrete foundation.,foundation,foundation,It was a foundation concrete., concrete foundation, foundation concrete,concrete,False,-14.963150024414062,-17.40357208251953,2.4404220581054688,14067712,EleutherAI/pythia-14m,step58000,seed2,2,58000
It was a business function.,function,function,It was a function business., business function, function business,business,True,-14.874671936035156,-17.38739776611328,2.512725830078125,14067712,EleutherAI/pythia-14m,step58000,seed2,2,58000
He was on the parade ground.,ground,ground,He was on the ground parade., parade ground, ground parade,parade,True,-19.36404037475586,-20.34661293029785,0.9825725555419922,14067712,EleutherAI/pythia-14m,step58000,seed2,2,58000
They liked the national guard.,guard,guard,They liked the guard national., national guard, guard national,national,False,-21.616897583007812,-22.146621704101562,0.52972412109375,14067712,EleutherAI/pythia-14m,step58000,seed2,2,58000
He had a friendly guide.,guide,guide,He had a guide friendly., friendly guide, guide friendly,friendly,False,-15.241815567016602,-19.593799591064453,4.351984024047852,14067712,EleutherAI/pythia-14m,step58000,seed2,2,58000
It was a nursing home.,home,home,It was a home nursing., nursing home, home nursing,nursing,True,-12.61081314086914,-16.56464195251465,3.953828811645508,14067712,EleutherAI/pythia-14m,step58000,seed2,2,58000
They had military intelligence.,intelligence,intelligence,They had intelligence military., military intelligence, intelligence military,military,False,-18.705612182617188,-20.07693099975586,1.3713188171386719,14067712,EleutherAI/pythia-14m,step58000,seed2,2,58000
It was a special issue.,issue,issue,It was an issue special., special issue, issue special,special,False,-12.538168907165527,-15.817623138427734,3.279454231262207,14067712,EleutherAI/pythia-14m,step58000,seed2,2,58000
It was a paper jam.,jam,jam,It was a jam paper., paper jam, jam paper,paper,True,-17.966732025146484,-19.96396255493164,1.9972305297851562,14067712,EleutherAI/pythia-14m,step58000,seed2,2,58000
It was a backspace key.,key,key,It was a key backspace., backspace key, key backspace,backspace,True,-25.073429107666016,-21.79450225830078,-3.2789268493652344,14067712,EleutherAI/pythia-14m,step58000,seed2,2,58000
They liked the friendly lamb.,lamb,lamb,They liked the lamb friendly., friendly lamb, lamb friendly,friendly,False,-18.63629150390625,-21.050758361816406,2.4144668579101562,14067712,EleutherAI/pythia-14m,step58000,seed2,2,58000
She had door locks.,lock,locks,She had locks door., door locks, locks door,door,True,-20.196537017822266,-22.087722778320312,1.8911857604980469,14067712,EleutherAI/pythia-14m,step58000,seed2,2,58000
They liked the women's lunch.,lunch,lunch,They liked the lunch women's., women's lunch, lunch women's,women,True,-18.721935272216797,-23.672069549560547,4.95013427734375,14067712,EleutherAI/pythia-14m,step58000,seed2,2,58000
He liked the stock market.,market,market,He liked the market stock., stock market, market stock,stock,True,-13.094064712524414,-16.543725967407227,3.4496612548828125,14067712,EleutherAI/pythia-14m,step58000,seed2,2,58000
It was a tennis match.,match,match,It was a match tennis., tennis match, match tennis,tennis,True,-14.14660358428955,-18.679920196533203,4.533316612243652,14067712,EleutherAI/pythia-14m,step58000,seed2,2,58000
It was veterinary medicine.,medicine,medicine,It was medicine veterinary., veterinary medicine, medicine veterinary,veterinary,False,-15.488442420959473,-22.34305191040039,6.854609489440918,14067712,EleutherAI/pythia-14m,step58000,seed2,2,58000
There was a clear message.,message,message,There was a message clear., clear message, message clear,clear,False,-13.748443603515625,-18.441749572753906,4.693305969238281,14067712,EleutherAI/pythia-14m,step58000,seed2,2,58000
It was a clay mold.,mold,mold,It was a mold clay., clay mold, mold clay,clay,True,-17.137104034423828,-20.544086456298828,3.406982421875,14067712,EleutherAI/pythia-14m,step58000,seed2,2,58000
She saw the fast mole.,mole,mole,She saw the mole fast., fast mole, mole fast,fast,False,-22.508159637451172,-20.65388298034668,-1.8542766571044922,14067712,EleutherAI/pythia-14m,step58000,seed2,2,58000
He liked the civil-rights movement.,movement,movement,He liked the movement civil-rights., civil-rights movement, movement civil-rights,civil-rights,False,-25.082103729248047,-28.590023040771484,3.5079193115234375,14067712,EleutherAI/pythia-14m,step58000,seed2,2,58000
It was a shredded newspaper.,newspaper,newspaper,It was a newspaper shredded., shredded newspaper, newspaper shredded,shredded,False,-23.471698760986328,-21.007888793945312,-2.4638099670410156,14067712,EleutherAI/pythia-14m,step58000,seed2,2,58000
It was a reddish orange.,orange,orange,It was an orange reddish., reddish orange, orange reddish,reddish,False,-17.341821670532227,-16.948089599609375,-0.39373207092285156,14067712,EleutherAI/pythia-14m,step58000,seed2,2,58000
He saw the ripped page.,page,page,He saw the page ripped., ripped page, page ripped,ripped,False,-21.655277252197266,-20.71480369567871,-0.9404735565185547,14067712,EleutherAI/pythia-14m,step58000,seed2,2,58000
It was a tree palm.,palm,palm,It was a palm tree., tree palm, palm tree,tree,True,-18.741147994995117,-17.78541374206543,-0.9557342529296875,14067712,EleutherAI/pythia-14m,step58000,seed2,2,58000
It was a consumer panel.,panel,panel,It was a panel consumer., consumer panel, panel consumer,consumer,True,-16.369962692260742,-20.442298889160156,4.072336196899414,14067712,EleutherAI/pythia-14m,step58000,seed2,2,58000
It was a biblical passage.,passage,passage,It was a passage biblical., biblical passage, passage biblical,biblical,False,-19.689720153808594,-24.63478660583496,4.945066452026367,14067712,EleutherAI/pythia-14m,step58000,seed2,2,58000
It was a secure perch.,perch,perch,It was a perch secure., secure perch, perch secure,secure,False,-22.732818603515625,-23.549732208251953,0.8169136047363281,14067712,EleutherAI/pythia-14m,step58000,seed2,2,58000
He saw the plastic pitcher.,pitcher,pitcher,He saw the pitcher plastic., plastic pitcher, pitcher plastic,plastic,True,-20.576425552368164,-22.565282821655273,1.9888572692871094,14067712,EleutherAI/pythia-14m,step58000,seed2,2,58000
It was a sweet port.,port,port,It was a port sweet., sweet port, port sweet,sweet,False,-18.001562118530273,-22.32213592529297,4.320573806762695,14067712,EleutherAI/pythia-14m,step58000,seed2,2,58000
He was in a yoga position.,position,position,He was in a position yoga., yoga position, position yoga,yoga,True,-16.546051025390625,-19.430391311645508,2.884340286254883,14067712,EleutherAI/pythia-14m,step58000,seed2,2,58000
It was a challenging post.,post,post,It was a post challenging., challenging post, post challenging,challenging,False,-16.68052101135254,-19.700027465820312,3.0195064544677734,14067712,EleutherAI/pythia-14m,step58000,seed2,2,58000
He had the quickest punch.,punch,punch,He had the punch quickest., quickest punch, punch quickest,quickest,False,-20.506614685058594,-24.825092315673828,4.318477630615234,14067712,EleutherAI/pythia-14m,step58000,seed2,2,58000
She had a cloudy pupil.,pupil,pupil,She had a pupil cloudy., cloudy pupil, pupil cloudy,cloudy,False,-23.592544555664062,-22.938562393188477,-0.6539821624755859,14067712,EleutherAI/pythia-14m,step58000,seed2,2,58000
That was a tennis racket.,racket,racket,That was a racket tennis., tennis racket, racket tennis,tennis,True,-17.878650665283203,-21.218191146850586,3.339540481567383,14067712,EleutherAI/pythia-14m,step58000,seed2,2,58000
He liked granite rock.,rock,rock,He liked rock granite., granite rock, rock granite,granite,True,-20.072769165039062,-21.534778594970703,1.4620094299316406,14067712,EleutherAI/pythia-14m,step58000,seed2,2,58000
He saw the bushy sage.,sage,sage,He saw the sage bushy., bushy sage, sage bushy,bushy,False,-27.21857261657715,-27.675249099731445,0.4566764831542969,14067712,EleutherAI/pythia-14m,step58000,seed2,2,58000
It was a major scale.,scale,scale,It was a scale major., major scale, scale major,major,False,-13.249683380126953,-18.596296310424805,5.346612930297852,14067712,EleutherAI/pythia-14m,step58000,seed2,2,58000
It was a panoramic scene.,scene,scene,It was a scene panoramic., panoramic scene, scene panoramic,panoramic,False,-17.459518432617188,-21.88223648071289,4.422718048095703,14067712,EleutherAI/pythia-14m,step58000,seed2,2,58000
It was a trained seal.,seal,seal,It was a seal trained., trained seal, seal trained,trained,False,-24.70842742919922,-23.478551864624023,-1.2298755645751953,14067712,EleutherAI/pythia-14m,step58000,seed2,2,58000
He used the video tape.,tape,tape,He used the tape video., video tape, tape video,video,True,-15.78341007232666,-15.56041145324707,-0.22299861907958984,14067712,EleutherAI/pythia-14m,step58000,seed2,2,58000
It was a technical term.,term,term,It was a term technical., technical term, term technical,technical,False,-15.767793655395508,-18.82927703857422,3.061483383178711,14067712,EleutherAI/pythia-14m,step58000,seed2,2,58000
It was a diseased tick.,tick,tick,It was a tick diseased., diseased tick, tick diseased,diseased,False,-21.39700698852539,-25.167884826660156,3.7708778381347656,14067712,EleutherAI/pythia-14m,step58000,seed2,2,58000
It was a finger tip.,tip,tip,It was a tip finger., finger tip, tip finger,finger,True,-16.86170196533203,-17.547733306884766,0.6860313415527344,14067712,EleutherAI/pythia-14m,step58000,seed2,2,58000
She liked the professional title.,title,title,She liked the title professional., professional title, title professional,professional,False,-15.800507545471191,-17.021623611450195,1.221116065979004,14067712,EleutherAI/pythia-14m,step58000,seed2,2,58000
It was a bell toll.,toll,toll,It was a toll bell., bell toll, toll bell,bell,True,-18.076953887939453,-20.841779708862305,2.7648258209228516,14067712,EleutherAI/pythia-14m,step58000,seed2,2,58000
She saw the snowshoe tracks.,track,tracks,She saw the tracks snowshoe., snowshoe tracks, tracks snowshoe,snowshoe,True,-27.778915405273438,-30.611434936523438,2.83251953125,14067712,EleutherAI/pythia-14m,step58000,seed2,2,58000
They were cluttered yards.,yard,yards,They were yards cluttered., cluttered yards, yards cluttered,cluttered,False,-25.312969207763672,-31.228233337402344,5.915264129638672,14067712,EleutherAI/pythia-14m,step58000,seed2,2,58000
