sentence,word,string,reversed_sentence,mod_np,reversed_mod,disambiguating_word,non_adjective,original_logprob,reversed_logprob,ratio,n_params,mpath,revision,seed_name,seed,step
It was a fall term.,term,term,It was a term fall., fall term, term fall,fall,True,-17.61372947692871,-18.007801055908203,0.3940715789794922,14067712,EleutherAI/pythia-14m,step28000,seed2,2,28000
It was a legal term.,term,term,It was a term legal., legal term, term legal,legal,False,-14.488201141357422,-18.973087310791016,4.484886169433594,14067712,EleutherAI/pythia-14m,step28000,seed2,2,28000
It was a clock tick.,tick,tick,It was a tick clock., clock tick, tick clock,clock,True,-16.028905868530273,-18.149538040161133,2.1206321716308594,14067712,EleutherAI/pythia-14m,step28000,seed2,2,28000
It was an audible tick.,tick,tick,It was an tick audible., audible tick, tick audible,audible,False,-17.087467193603516,-24.75732421875,7.669857025146484,14067712,EleutherAI/pythia-14m,step28000,seed2,2,28000
It was a parasitic tick.,tick,tick,It was a tick parasitic., parasitic tick, tick parasitic,parasitic,False,-21.68370819091797,-22.551799774169922,0.8680915832519531,14067712,EleutherAI/pythia-14m,step28000,seed2,2,28000
It was a generous tip.,tip,tip,It was a tip generous., generous tip, tip generous,generous,False,-17.476011276245117,-24.54405975341797,7.068048477172852,14067712,EleutherAI/pythia-14m,step28000,seed2,2,28000
It was a stingy tip.,tip,tip,It was a tip stingy., stingy tip, tip stingy,stingy,False,-20.545307159423828,-25.688491821289062,5.143184661865234,14067712,EleutherAI/pythia-14m,step28000,seed2,2,28000
It was a pencil tip.,tip,tip,It was a tip pencil., pencil tip, tip pencil,pencil,True,-17.842853546142578,-18.656246185302734,0.8133926391601562,14067712,EleutherAI/pythia-14m,step28000,seed2,2,28000
She liked the essay title.,title,title,She liked the title essay., essay title, title essay,essay,True,-18.077167510986328,-17.21798324584961,-0.8591842651367188,14067712,EleutherAI/pythia-14m,step28000,seed2,2,28000
She liked the poem title.,title,title,She liked the title poem., poem title, title poem,poem,True,-15.864377975463867,-16.92034912109375,1.0559711456298828,14067712,EleutherAI/pythia-14m,step28000,seed2,2,28000
She liked the academic title.,title,title,She liked the title academic., academic title, title academic,academic,False,-16.204008102416992,-20.459442138671875,4.255434036254883,14067712,EleutherAI/pythia-14m,step28000,seed2,2,28000
It was a costly toll.,toll,toll,It was a toll costly., costly toll, toll costly,costly,False,-18.482982635498047,-25.000274658203125,6.517292022705078,14067712,EleutherAI/pythia-14m,step28000,seed2,2,28000
It was a road toll.,toll,toll,It was a toll road., road toll, toll road,road,True,-16.39059829711914,-19.08078384399414,2.690185546875,14067712,EleutherAI/pythia-14m,step28000,seed2,2,28000
It was a loud toll.,toll,toll,It was a toll loud., loud toll, toll loud,loud,False,-22.38614273071289,-23.001541137695312,0.6153984069824219,14067712,EleutherAI/pythia-14m,step28000,seed2,2,28000
She saw the train tracks.,track,tracks,She saw the tracks train., train tracks, tracks train,train,True,-16.047035217285156,-19.303796768188477,3.2567615509033203,14067712,EleutherAI/pythia-14m,step28000,seed2,2,28000
She saw the trolley tracks.,track,tracks,She saw the tracks trolley., trolley tracks, tracks trolley,trolley,True,-26.236230850219727,-25.335350036621094,-0.9008808135986328,14067712,EleutherAI/pythia-14m,step28000,seed2,2,28000
She saw the moose tracks.,track,tracks,She saw the tracks moose., moose tracks, tracks moose,moose,False,-26.77669906616211,-26.233211517333984,-0.543487548828125,14067712,EleutherAI/pythia-14m,step28000,seed2,2,28000
It was five yards.,yard,yards,It was yards five., five yards, yards five,five,True,-14.611176490783691,-24.611072540283203,9.999896049499512,14067712,EleutherAI/pythia-14m,step28000,seed2,2,28000
It was ten yards.,yard,yards,It was yards ten., ten yards, yards ten,ten,True,-16.435758590698242,-24.350141525268555,7.9143829345703125,14067712,EleutherAI/pythia-14m,step28000,seed2,2,28000
They were big yards.,yard,yards,They were yards big., big yards, yards big,big,False,-18.459362030029297,-20.378841400146484,1.9194793701171875,14067712,EleutherAI/pythia-14m,step28000,seed2,2,28000
It was a comedic act.,act,act,It was an act comedic., comedic act, act comedic,comedic,False,-19.47913360595703,-23.42051124572754,3.941377639770508,14067712,EleutherAI/pythia-14m,step28000,seed2,2,28000
He had a pending appeal.,appeal,appeal,He had an appeal pending., pending appeal, appeal pending,pending,False,-17.64803123474121,-16.665023803710938,-0.9830074310302734,14067712,EleutherAI/pythia-14m,step28000,seed2,2,28000
It was a polluted atmosphere.,atmosphere,atmosphere,It was an atmosphere polluted., polluted atmosphere, atmosphere polluted,polluted,False,-24.356216430664062,-27.66885757446289,3.312641143798828,14067712,EleutherAI/pythia-14m,step28000,seed2,2,28000
It was a country band.,band,band,It was a band country., country band, band country,country,True,-17.434337615966797,-19.818614959716797,2.38427734375,14067712,EleutherAI/pythia-14m,step28000,seed2,2,28000
There was a religious barrier.,barrier,barrier,There was a barrier religious., religious barrier, barrier religious,religious,False,-18.04721450805664,-23.418766021728516,5.371551513671875,14067712,EleutherAI/pythia-14m,step28000,seed2,2,28000
He saw a baseball bat.,bat,bat,He saw a bat baseball., baseball bat, bat baseball,baseball,True,-12.790184020996094,-22.950183868408203,10.15999984741211,14067712,EleutherAI/pythia-14m,step28000,seed2,2,28000
He saw the balance beam.,beam,beam,He saw the beam balance., balance beam, beam balance,balance,True,-21.958633422851562,-20.02674102783203,-1.9318923950195312,14067712,EleutherAI/pythia-14m,step28000,seed2,2,28000
She had a writer's block.,block,block,She had a block writer's., writer's block, block writer's,writer,True,-23.842700958251953,-25.943523406982422,2.1008224487304688,14067712,EleutherAI/pythia-14m,step28000,seed2,2,28000
He has royal blood.,blood,blood,He has blood royal., royal blood, blood royal,royal,False,-19.427587509155273,-21.186874389648438,1.759286880493164,14067712,EleutherAI/pythia-14m,step28000,seed2,2,28000
It was the school board.,board,board,It was the board school., school board, board school,school,True,-12.20138931274414,-16.50766944885254,4.306280136108398,14067712,EleutherAI/pythia-14m,step28000,seed2,2,28000
He had a leather-bound book.,book,book,He had a book leather-bound., leather-bound book, book leather-bound,leather-bound,False,-22.452648162841797,-25.77220344543457,3.3195552825927734,14067712,EleutherAI/pythia-14m,step28000,seed2,2,28000
They ate a lonely breakfast.,breakfast,breakfast,They ate a breakfast lonely., lonely breakfast, breakfast lonely,lonely,False,-16.9293270111084,-20.44106674194336,3.511739730834961,14067712,EleutherAI/pythia-14m,step28000,seed2,2,28000
It was an island cape.,cape,cape,It was an cape island., island cape, cape island,island,True,-19.371788024902344,-22.708271026611328,3.3364830017089844,14067712,EleutherAI/pythia-14m,step28000,seed2,2,28000
It was a criminal case.,case,case,It was a case criminal., criminal case, case criminal,criminal,False,-12.02051067352295,-16.532543182373047,4.512032508850098,14067712,EleutherAI/pythia-14m,step28000,seed2,2,28000
It was a primary cause.,cause,cause,It was a cause primary., primary cause, cause primary,primary,False,-13.423616409301758,-23.751941680908203,10.328325271606445,14067712,EleutherAI/pythia-14m,step28000,seed2,2,28000
It was a jail cell.,cell,cell,It was a cell jail., jail cell, cell jail,jail,True,-15.322127342224121,-21.18865966796875,5.866532325744629,14067712,EleutherAI/pythia-14m,step28000,seed2,2,28000
She had a good-luck charm.,charm,charm,She had a charm good-luck., good-luck charm, charm good-luck,good-luck,False,-28.044342041015625,-33.69698715209961,5.652645111083984,14067712,EleutherAI/pythia-14m,step28000,seed2,2,28000
They liked the pet chicken.,chicken,chicken,They liked the chicken pet., pet chicken, chicken pet,pet,True,-18.35980987548828,-17.312891006469727,-1.0469188690185547,14067712,EleutherAI/pythia-14m,step28000,seed2,2,28000
It was a stimulating class.,class,class,It was a class stimulating., stimulating class, class stimulating,stimulating,False,-20.24140167236328,-24.366832733154297,4.125431060791016,14067712,EleutherAI/pythia-14m,step28000,seed2,2,28000
It was a metal clip.,clip,clip,It was a clip metal., metal clip, clip metal,metal,True,-20.822301864624023,-22.160022735595703,1.3377208709716797,14067712,EleutherAI/pythia-14m,step28000,seed2,2,28000
It was a common cold.,cold,cold,It was a cold common., common cold, cold common,common,False,-15.121458053588867,-18.444181442260742,3.322723388671875,14067712,EleutherAI/pythia-14m,step28000,seed2,2,28000
It was a marble column.,column,column,It was a column marble., marble column, column marble,marble,True,-16.50634765625,-22.949249267578125,6.442901611328125,14067712,EleutherAI/pythia-14m,step28000,seed2,2,28000
He liked the polite company.,company,company,He liked the company polite., polite company, company polite,polite,False,-17.27564239501953,-21.321102142333984,4.045459747314453,14067712,EleutherAI/pythia-14m,step28000,seed2,2,28000
It was a traffic cone.,cone,cone,It was a cone traffic., traffic cone, cone traffic,traffic,True,-16.91380500793457,-21.023025512695312,4.109220504760742,14067712,EleutherAI/pythia-14m,step28000,seed2,2,28000
He made a well-written contribution.,contribution,contribution,He made a contribution well-written., well-written contribution, contribution well-written,well-written,False,-21.921409606933594,-28.698074340820312,6.776664733886719,14067712,EleutherAI/pythia-14m,step28000,seed2,2,28000
That was the correct count.,count,count,That was the count correct., correct count, count correct,correct,False,-15.117166519165039,-19.96276092529297,4.84559440612793,14067712,EleutherAI/pythia-14m,step28000,seed2,2,28000
It was a collision course.,course,course,It was a course collision., collision course, course collision,collision,True,-15.988330841064453,-19.899066925048828,3.910736083984375,14067712,EleutherAI/pythia-14m,step28000,seed2,2,28000
It was a historical date.,date,date,It was a date historical., historical date, date historical,historical,False,-14.187307357788086,-19.800443649291992,5.613136291503906,14067712,EleutherAI/pythia-14m,step28000,seed2,2,28000
It was about college degrees.,degree,degrees,It was about degrees college., college degrees, degrees college,college,True,-17.1223087310791,-23.501998901367188,6.379690170288086,14067712,EleutherAI/pythia-14m,step28000,seed2,2,28000
They liked the architectural design.,design,design,They liked the design architectural., architectural design, design architectural,architectural,False,-13.907691955566406,-19.443349838256836,5.53565788269043,14067712,EleutherAI/pythia-14m,step28000,seed2,2,28000
They liked the anniversary dinner.,dinner,dinner,They liked the dinner anniversary., anniversary dinner, dinner anniversary,anniversary,True,-20.48153305053711,-17.158647537231445,-3.322885513305664,14067712,EleutherAI/pythia-14m,step28000,seed2,2,28000
He had a career dream.,dream,dream,He had a dream career., career dream, dream career,career,True,-16.893680572509766,-15.998085021972656,-0.8955955505371094,14067712,EleutherAI/pythia-14m,step28000,seed2,2,28000
It was a battery-powered drill.,drill,drill,It was a drill battery-powered., battery-powered drill, drill battery-powered,battery-powered,False,-25.457393646240234,-29.57581901550293,4.118425369262695,14067712,EleutherAI/pythia-14m,step28000,seed2,2,28000
It was a physical examination.,examination,examination,It was an examination physical., physical examination, examination physical,physical,False,-12.457980155944824,-21.386241912841797,8.928261756896973,14067712,EleutherAI/pythia-14m,step28000,seed2,2,28000
They had an enthusiastic fan.,fan,fan,They had an fan enthusiastic., enthusiastic fan, fan enthusiastic,enthusiastic,False,-11.818467140197754,-26.622081756591797,14.803614616394043,14067712,EleutherAI/pythia-14m,step28000,seed2,2,28000
She had a steel file.,file,file,She had a file steel., steel file, file steel,steel,True,-20.06737518310547,-23.09967613220215,3.0323009490966797,14067712,EleutherAI/pythia-14m,step28000,seed2,2,28000
It was a plastic film.,film,film,It was a film plastic., plastic film, film plastic,plastic,False,-14.01417350769043,-22.19908905029297,8.184915542602539,14067712,EleutherAI/pythia-14m,step28000,seed2,2,28000
It was a concrete foundation.,foundation,foundation,It was a foundation concrete., concrete foundation, foundation concrete,concrete,False,-14.33757209777832,-19.589509963989258,5.2519378662109375,14067712,EleutherAI/pythia-14m,step28000,seed2,2,28000
It was a business function.,function,function,It was a function business., business function, function business,business,True,-16.252090454101562,-20.609153747558594,4.357063293457031,14067712,EleutherAI/pythia-14m,step28000,seed2,2,28000
He was on the parade ground.,ground,ground,He was on the ground parade., parade ground, ground parade,parade,True,-16.714649200439453,-18.21112632751465,1.4964771270751953,14067712,EleutherAI/pythia-14m,step28000,seed2,2,28000
They liked the national guard.,guard,guard,They liked the guard national., national guard, guard national,national,False,-20.83590316772461,-23.412899017333984,2.576995849609375,14067712,EleutherAI/pythia-14m,step28000,seed2,2,28000
He had a friendly guide.,guide,guide,He had a guide friendly., friendly guide, guide friendly,friendly,False,-18.277177810668945,-19.223115921020508,0.9459381103515625,14067712,EleutherAI/pythia-14m,step28000,seed2,2,28000
It was a nursing home.,home,home,It was a home nursing., nursing home, home nursing,nursing,True,-10.16960334777832,-17.32799530029297,7.158391952514648,14067712,EleutherAI/pythia-14m,step28000,seed2,2,28000
They had military intelligence.,intelligence,intelligence,They had intelligence military., military intelligence, intelligence military,military,False,-15.7174072265625,-21.579404830932617,5.861997604370117,14067712,EleutherAI/pythia-14m,step28000,seed2,2,28000
It was a special issue.,issue,issue,It was an issue special., special issue, issue special,special,False,-12.21292495727539,-16.927392959594727,4.714468002319336,14067712,EleutherAI/pythia-14m,step28000,seed2,2,28000
It was a paper jam.,jam,jam,It was a jam paper., paper jam, jam paper,paper,True,-17.175649642944336,-18.207965850830078,1.0323162078857422,14067712,EleutherAI/pythia-14m,step28000,seed2,2,28000
It was a backspace key.,key,key,It was a key backspace., backspace key, key backspace,backspace,True,-24.233394622802734,-22.499210357666016,-1.7341842651367188,14067712,EleutherAI/pythia-14m,step28000,seed2,2,28000
They liked the friendly lamb.,lamb,lamb,They liked the lamb friendly., friendly lamb, lamb friendly,friendly,False,-20.36231231689453,-22.892051696777344,2.5297393798828125,14067712,EleutherAI/pythia-14m,step28000,seed2,2,28000
She had door locks.,lock,locks,She had locks door., door locks, locks door,door,True,-23.168903350830078,-24.108917236328125,0.9400138854980469,14067712,EleutherAI/pythia-14m,step28000,seed2,2,28000
They liked the women's lunch.,lunch,lunch,They liked the lunch women's., women's lunch, lunch women's,women,True,-20.229022979736328,-23.5230770111084,3.2940540313720703,14067712,EleutherAI/pythia-14m,step28000,seed2,2,28000
He liked the stock market.,market,market,He liked the market stock., stock market, market stock,stock,True,-12.529057502746582,-15.111413955688477,2.5823564529418945,14067712,EleutherAI/pythia-14m,step28000,seed2,2,28000
It was a tennis match.,match,match,It was a match tennis., tennis match, match tennis,tennis,True,-11.662458419799805,-22.723648071289062,11.061189651489258,14067712,EleutherAI/pythia-14m,step28000,seed2,2,28000
It was veterinary medicine.,medicine,medicine,It was medicine veterinary., veterinary medicine, medicine veterinary,veterinary,False,-17.71384620666504,-23.067813873291016,5.353967666625977,14067712,EleutherAI/pythia-14m,step28000,seed2,2,28000
There was a clear message.,message,message,There was a message clear., clear message, message clear,clear,False,-13.271690368652344,-16.664697647094727,3.393007278442383,14067712,EleutherAI/pythia-14m,step28000,seed2,2,28000
It was a clay mold.,mold,mold,It was a mold clay., clay mold, mold clay,clay,True,-18.43324089050293,-21.775741577148438,3.342500686645508,14067712,EleutherAI/pythia-14m,step28000,seed2,2,28000
She saw the fast mole.,mole,mole,She saw the mole fast., fast mole, mole fast,fast,False,-21.020774841308594,-19.555238723754883,-1.465536117553711,14067712,EleutherAI/pythia-14m,step28000,seed2,2,28000
He liked the civil-rights movement.,movement,movement,He liked the movement civil-rights., civil-rights movement, movement civil-rights,civil-rights,False,-23.56039047241211,-30.690065383911133,7.129674911499023,14067712,EleutherAI/pythia-14m,step28000,seed2,2,28000
It was a shredded newspaper.,newspaper,newspaper,It was a newspaper shredded., shredded newspaper, newspaper shredded,shredded,False,-22.21969985961914,-20.06812858581543,-2.151571273803711,14067712,EleutherAI/pythia-14m,step28000,seed2,2,28000
It was a reddish orange.,orange,orange,It was an orange reddish., reddish orange, orange reddish,reddish,False,-16.622480392456055,-16.17875099182129,-0.4437294006347656,14067712,EleutherAI/pythia-14m,step28000,seed2,2,28000
He saw the ripped page.,page,page,He saw the page ripped., ripped page, page ripped,ripped,False,-21.606033325195312,-24.353553771972656,2.7475204467773438,14067712,EleutherAI/pythia-14m,step28000,seed2,2,28000
It was a tree palm.,palm,palm,It was a palm tree., tree palm, palm tree,tree,True,-17.641551971435547,-16.013946533203125,-1.6276054382324219,14067712,EleutherAI/pythia-14m,step28000,seed2,2,28000
It was a consumer panel.,panel,panel,It was a panel consumer., consumer panel, panel consumer,consumer,True,-18.33816909790039,-23.612022399902344,5.273853302001953,14067712,EleutherAI/pythia-14m,step28000,seed2,2,28000
It was a biblical passage.,passage,passage,It was a passage biblical., biblical passage, passage biblical,biblical,False,-16.758554458618164,-22.67080307006836,5.912248611450195,14067712,EleutherAI/pythia-14m,step28000,seed2,2,28000
It was a secure perch.,perch,perch,It was a perch secure., secure perch, perch secure,secure,False,-22.1189022064209,-24.044261932373047,1.9253597259521484,14067712,EleutherAI/pythia-14m,step28000,seed2,2,28000
He saw the plastic pitcher.,pitcher,pitcher,He saw the pitcher plastic., plastic pitcher, pitcher plastic,plastic,True,-19.326013565063477,-25.919574737548828,6.593561172485352,14067712,EleutherAI/pythia-14m,step28000,seed2,2,28000
It was a sweet port.,port,port,It was a port sweet., sweet port, port sweet,sweet,False,-17.903099060058594,-21.12248420715332,3.2193851470947266,14067712,EleutherAI/pythia-14m,step28000,seed2,2,28000
He was in a yoga position.,position,position,He was in a position yoga., yoga position, position yoga,yoga,True,-18.94425392150879,-21.79402732849121,2.849773406982422,14067712,EleutherAI/pythia-14m,step28000,seed2,2,28000
It was a challenging post.,post,post,It was a post challenging., challenging post, post challenging,challenging,False,-17.005483627319336,-18.873035430908203,1.8675518035888672,14067712,EleutherAI/pythia-14m,step28000,seed2,2,28000
He had the quickest punch.,punch,punch,He had the punch quickest., quickest punch, punch quickest,quickest,False,-21.605792999267578,-30.26883888244629,8.663045883178711,14067712,EleutherAI/pythia-14m,step28000,seed2,2,28000
She had a cloudy pupil.,pupil,pupil,She had a pupil cloudy., cloudy pupil, pupil cloudy,cloudy,False,-25.93093490600586,-24.57877540588379,-1.3521595001220703,14067712,EleutherAI/pythia-14m,step28000,seed2,2,28000
That was a tennis racket.,racket,racket,That was a racket tennis., tennis racket, racket tennis,tennis,True,-16.26255989074707,-22.77182960510254,6.509269714355469,14067712,EleutherAI/pythia-14m,step28000,seed2,2,28000
He liked granite rock.,rock,rock,He liked rock granite., granite rock, rock granite,granite,True,-21.3162841796875,-23.862037658691406,2.5457534790039062,14067712,EleutherAI/pythia-14m,step28000,seed2,2,28000
He saw the bushy sage.,sage,sage,He saw the sage bushy., bushy sage, sage bushy,bushy,False,-28.81221580505371,-31.05569839477539,2.2434825897216797,14067712,EleutherAI/pythia-14m,step28000,seed2,2,28000
It was a major scale.,scale,scale,It was a scale major., major scale, scale major,major,False,-14.758005142211914,-20.336585998535156,5.578580856323242,14067712,EleutherAI/pythia-14m,step28000,seed2,2,28000
It was a panoramic scene.,scene,scene,It was a scene panoramic., panoramic scene, scene panoramic,panoramic,False,-17.223852157592773,-24.2655086517334,7.041656494140625,14067712,EleutherAI/pythia-14m,step28000,seed2,2,28000
It was a trained seal.,seal,seal,It was a seal trained., trained seal, seal trained,trained,False,-22.895599365234375,-24.119049072265625,1.22344970703125,14067712,EleutherAI/pythia-14m,step28000,seed2,2,28000
He used the video tape.,tape,tape,He used the tape video., video tape, tape video,video,True,-15.718157768249512,-18.023300170898438,2.305142402648926,14067712,EleutherAI/pythia-14m,step28000,seed2,2,28000
It was a technical term.,term,term,It was a term technical., technical term, term technical,technical,False,-16.486452102661133,-19.15460968017578,2.6681575775146484,14067712,EleutherAI/pythia-14m,step28000,seed2,2,28000
It was a diseased tick.,tick,tick,It was a tick diseased., diseased tick, tick diseased,diseased,False,-20.806835174560547,-24.60753631591797,3.800701141357422,14067712,EleutherAI/pythia-14m,step28000,seed2,2,28000
It was a finger tip.,tip,tip,It was a tip finger., finger tip, tip finger,finger,True,-16.118560791015625,-16.96035385131836,0.8417930603027344,14067712,EleutherAI/pythia-14m,step28000,seed2,2,28000
She liked the professional title.,title,title,She liked the title professional., professional title, title professional,professional,False,-15.222625732421875,-18.15488052368164,2.9322547912597656,14067712,EleutherAI/pythia-14m,step28000,seed2,2,28000
It was a bell toll.,toll,toll,It was a toll bell., bell toll, toll bell,bell,True,-18.247028350830078,-21.747175216674805,3.5001468658447266,14067712,EleutherAI/pythia-14m,step28000,seed2,2,28000
She saw the snowshoe tracks.,track,tracks,She saw the tracks snowshoe., snowshoe tracks, tracks snowshoe,snowshoe,True,-30.10248565673828,-31.545433044433594,1.4429473876953125,14067712,EleutherAI/pythia-14m,step28000,seed2,2,28000
They were cluttered yards.,yard,yards,They were yards cluttered., cluttered yards, yards cluttered,cluttered,False,-24.24755096435547,-24.326642990112305,0.07909202575683594,14067712,EleutherAI/pythia-14m,step28000,seed2,2,28000
