sentence,word,string,reversed_sentence,mod_np,reversed_mod,disambiguating_word,non_adjective,original_logprob,reversed_logprob,ratio,n_params,mpath,revision,seed_name,seed,step
It was an audible tick.,tick,tick,It was an tick audible., audible tick, tick audible,audible,False,-20.875534057617188,-20.89309310913086,0.017559051513671875,14067712,EleutherAI/pythia-14m,step128,seed9,9,128
It was a parasitic tick.,tick,tick,It was a tick parasitic., parasitic tick, tick parasitic,parasitic,False,-22.130910873413086,-22.137407302856445,0.006496429443359375,14067712,EleutherAI/pythia-14m,step128,seed9,9,128
It was a generous tip.,tip,tip,It was a tip generous., generous tip, tip generous,generous,False,-21.84988784790039,-21.884143829345703,0.0342559814453125,14067712,EleutherAI/pythia-14m,step128,seed9,9,128
It was a stingy tip.,tip,tip,It was a tip stingy., stingy tip, tip stingy,stingy,False,-32.44125747680664,-32.29597091674805,-0.14528656005859375,14067712,EleutherAI/pythia-14m,step128,seed9,9,128
It was a pencil tip.,tip,tip,It was a tip pencil., pencil tip, tip pencil,pencil,True,-22.329723358154297,-22.03870391845703,-0.2910194396972656,14067712,EleutherAI/pythia-14m,step128,seed9,9,128
She liked the essay title.,title,title,She liked the title essay., essay title, title essay,essay,True,-20.397705078125,-20.462190628051758,0.06448554992675781,14067712,EleutherAI/pythia-14m,step128,seed9,9,128
She liked the poem title.,title,title,She liked the title poem., poem title, title poem,poem,True,-19.719619750976562,-19.63703155517578,-0.08258819580078125,14067712,EleutherAI/pythia-14m,step128,seed9,9,128
She liked the academic title.,title,title,She liked the title academic., academic title, title academic,academic,False,-20.118988037109375,-19.599550247192383,-0.5194377899169922,14067712,EleutherAI/pythia-14m,step128,seed9,9,128
It was a costly toll.,toll,toll,It was a toll costly., costly toll, toll costly,costly,False,-22.554351806640625,-22.667747497558594,0.11339569091796875,14067712,EleutherAI/pythia-14m,step128,seed9,9,128
It was a road toll.,toll,toll,It was a toll road., road toll, toll road,road,True,-21.946067810058594,-21.52643394470215,-0.4196338653564453,14067712,EleutherAI/pythia-14m,step128,seed9,9,128
It was a loud toll.,toll,toll,It was a toll loud., loud toll, toll loud,loud,False,-22.494993209838867,-22.282167434692383,-0.21282577514648438,14067712,EleutherAI/pythia-14m,step128,seed9,9,128
She saw the train tracks.,track,tracks,She saw the tracks train., train tracks, tracks train,train,True,-21.874971389770508,-21.629714965820312,-0.2452564239501953,14067712,EleutherAI/pythia-14m,step128,seed9,9,128
She saw the trolley tracks.,track,tracks,She saw the tracks trolley., trolley tracks, tracks trolley,trolley,True,-41.513694763183594,-41.32769775390625,-0.18599700927734375,14067712,EleutherAI/pythia-14m,step128,seed9,9,128
She saw the moose tracks.,track,tracks,She saw the tracks moose., moose tracks, tracks moose,moose,False,-32.3893928527832,-32.370426177978516,-0.0189666748046875,14067712,EleutherAI/pythia-14m,step128,seed9,9,128
It was five yards.,yard,yards,It was yards five., five yards, yards five,five,True,-19.387496948242188,-19.409015655517578,0.021518707275390625,14067712,EleutherAI/pythia-14m,step128,seed9,9,128
It was ten yards.,yard,yards,It was yards ten., ten yards, yards ten,ten,True,-20.78090476989746,-20.81036949157715,0.0294647216796875,14067712,EleutherAI/pythia-14m,step128,seed9,9,128
They were big yards.,yard,yards,They were yards big., big yards, yards big,big,False,-20.837528228759766,-20.198017120361328,-0.6395111083984375,14067712,EleutherAI/pythia-14m,step128,seed9,9,128
It was a comedic act.,act,act,It was an act comedic., comedic act, act comedic,comedic,False,-31.165178298950195,-31.235353469848633,0.0701751708984375,14067712,EleutherAI/pythia-14m,step128,seed9,9,128
He had a pending appeal.,appeal,appeal,He had an appeal pending., pending appeal, appeal pending,pending,False,-20.69255828857422,-20.788467407226562,0.09590911865234375,14067712,EleutherAI/pythia-14m,step128,seed9,9,128
It was a polluted atmosphere.,atmosphere,atmosphere,It was an atmosphere polluted., polluted atmosphere, atmosphere polluted,polluted,False,-31.688278198242188,-32.531776428222656,0.8434982299804688,14067712,EleutherAI/pythia-14m,step128,seed9,9,128
It was a country band.,band,band,It was a band country., country band, band country,country,True,-20.23680305480957,-20.374095916748047,0.13729286193847656,14067712,EleutherAI/pythia-14m,step128,seed9,9,128
There was a religious barrier.,barrier,barrier,There was a barrier religious., religious barrier, barrier religious,religious,False,-22.541717529296875,-22.313491821289062,-0.2282257080078125,14067712,EleutherAI/pythia-14m,step128,seed9,9,128
He saw a baseball bat.,bat,bat,He saw a bat baseball., baseball bat, bat baseball,baseball,True,-22.210407257080078,-22.21805191040039,0.0076446533203125,14067712,EleutherAI/pythia-14m,step128,seed9,9,128
He saw the balance beam.,beam,beam,He saw the beam balance., balance beam, beam balance,balance,True,-21.590579986572266,-21.50945472717285,-0.08112525939941406,14067712,EleutherAI/pythia-14m,step128,seed9,9,128
She had a writer's block.,block,block,She had a block writer's., writer's block, block writer's,writer,True,-31.050861358642578,-31.427387237548828,0.37652587890625,14067712,EleutherAI/pythia-14m,step128,seed9,9,128
He has royal blood.,blood,blood,He has blood royal., royal blood, blood royal,royal,False,-21.550342559814453,-21.551546096801758,0.0012035369873046875,14067712,EleutherAI/pythia-14m,step128,seed9,9,128
It was the school board.,board,board,It was the board school., school board, board school,school,True,-19.543184280395508,-20.098051071166992,0.5548667907714844,14067712,EleutherAI/pythia-14m,step128,seed9,9,128
He had a leather-bound book.,book,book,He had a book leather-bound., leather-bound book, book leather-bound,leather-bound,False,-41.279781341552734,-41.28602600097656,0.006244659423828125,14067712,EleutherAI/pythia-14m,step128,seed9,9,128
They ate a lonely breakfast.,breakfast,breakfast,They ate a breakfast lonely., lonely breakfast, breakfast lonely,lonely,False,-21.744125366210938,-21.3970947265625,-0.3470306396484375,14067712,EleutherAI/pythia-14m,step128,seed9,9,128
It was an island cape.,cape,cape,It was an cape island., island cape, cape island,island,True,-32.686092376708984,-32.63002014160156,-0.056072235107421875,14067712,EleutherAI/pythia-14m,step128,seed9,9,128
It was a criminal case.,case,case,It was a case criminal., criminal case, case criminal,criminal,False,-20.664255142211914,-20.49156951904297,-0.1726856231689453,14067712,EleutherAI/pythia-14m,step128,seed9,9,128
It was a primary cause.,cause,cause,It was a cause primary., primary cause, cause primary,primary,False,-20.744237899780273,-20.253475189208984,-0.49076271057128906,14067712,EleutherAI/pythia-14m,step128,seed9,9,128
It was a jail cell.,cell,cell,It was a cell jail., jail cell, cell jail,jail,True,-22.213951110839844,-22.04706573486328,-0.1668853759765625,14067712,EleutherAI/pythia-14m,step128,seed9,9,128
She had a good-luck charm.,charm,charm,She had a charm good-luck., good-luck charm, charm good-luck,good-luck,False,-49.756431579589844,-49.927772521972656,0.1713409423828125,14067712,EleutherAI/pythia-14m,step128,seed9,9,128
They liked the pet chicken.,chicken,chicken,They liked the chicken pet., pet chicken, chicken pet,pet,True,-21.087005615234375,-21.8094482421875,0.722442626953125,14067712,EleutherAI/pythia-14m,step128,seed9,9,128
It was a stimulating class.,class,class,It was a class stimulating., stimulating class, class stimulating,stimulating,False,-21.493980407714844,-21.69147491455078,0.1974945068359375,14067712,EleutherAI/pythia-14m,step128,seed9,9,128
It was a metal clip.,clip,clip,It was a clip metal., metal clip, clip metal,metal,True,-21.594640731811523,-21.603132247924805,0.00849151611328125,14067712,EleutherAI/pythia-14m,step128,seed9,9,128
It was a common cold.,cold,cold,It was a cold common., common cold, cold common,common,False,-19.744382858276367,-20.14822006225586,0.4038372039794922,14067712,EleutherAI/pythia-14m,step128,seed9,9,128
It was a marble column.,column,column,It was a column marble., marble column, column marble,marble,True,-20.566652297973633,-20.63180160522461,0.06514930725097656,14067712,EleutherAI/pythia-14m,step128,seed9,9,128
He liked the polite company.,company,company,He liked the company polite., polite company, company polite,polite,False,-21.463695526123047,-21.10614013671875,-0.3575553894042969,14067712,EleutherAI/pythia-14m,step128,seed9,9,128
It was a traffic cone.,cone,cone,It was a cone traffic., traffic cone, cone traffic,traffic,True,-20.72669219970703,-21.208904266357422,0.4822120666503906,14067712,EleutherAI/pythia-14m,step128,seed9,9,128
He made a well-written contribution.,contribution,contribution,He made a contribution well-written., well-written contribution, contribution well-written,well-written,False,-40.344444274902344,-40.23582077026367,-0.10862350463867188,14067712,EleutherAI/pythia-14m,step128,seed9,9,128
That was the correct count.,count,count,That was the count correct., correct count, count correct,correct,False,-21.561607360839844,-21.461158752441406,-0.1004486083984375,14067712,EleutherAI/pythia-14m,step128,seed9,9,128
It was a collision course.,course,course,It was a course collision., collision course, course collision,collision,True,-21.284276962280273,-21.217256546020508,-0.06702041625976562,14067712,EleutherAI/pythia-14m,step128,seed9,9,128
It was a historical date.,date,date,It was a date historical., historical date, date historical,historical,False,-20.780372619628906,-21.006126403808594,0.2257537841796875,14067712,EleutherAI/pythia-14m,step128,seed9,9,128
It was about college degrees.,degree,degrees,It was about degrees college., college degrees, degrees college,college,True,-21.153976440429688,-21.000812530517578,-0.15316390991210938,14067712,EleutherAI/pythia-14m,step128,seed9,9,128
They liked the architectural design.,design,design,They liked the design architectural., architectural design, design architectural,architectural,False,-22.82396697998047,-22.596172332763672,-0.22779464721679688,14067712,EleutherAI/pythia-14m,step128,seed9,9,128
They liked the anniversary dinner.,dinner,dinner,They liked the dinner anniversary., anniversary dinner, dinner anniversary,anniversary,True,-21.706443786621094,-21.26694107055664,-0.4395027160644531,14067712,EleutherAI/pythia-14m,step128,seed9,9,128
He had a career dream.,dream,dream,He had a dream career., career dream, dream career,career,True,-20.802492141723633,-20.87816619873047,0.07567405700683594,14067712,EleutherAI/pythia-14m,step128,seed9,9,128
It was a battery-powered drill.,drill,drill,It was a drill battery-powered., battery-powered drill, drill battery-powered,battery-powered,False,-42.70611572265625,-42.290985107421875,-0.415130615234375,14067712,EleutherAI/pythia-14m,step128,seed9,9,128
It was a physical examination.,examination,examination,It was an examination physical., physical examination, examination physical,physical,False,-20.89015769958496,-20.85927963256836,-0.030878067016601562,14067712,EleutherAI/pythia-14m,step128,seed9,9,128
They had an enthusiastic fan.,fan,fan,They had an fan enthusiastic., enthusiastic fan, fan enthusiastic,enthusiastic,False,-21.604248046875,-21.70346450805664,0.09921646118164062,14067712,EleutherAI/pythia-14m,step128,seed9,9,128
She had a steel file.,file,file,She had a file steel., steel file, file steel,steel,True,-20.164691925048828,-20.03956413269043,-0.12512779235839844,14067712,EleutherAI/pythia-14m,step128,seed9,9,128
It was a plastic film.,film,film,It was a film plastic., plastic film, film plastic,plastic,False,-20.83216094970703,-21.12014389038086,0.2879829406738281,14067712,EleutherAI/pythia-14m,step128,seed9,9,128
It was a concrete foundation.,foundation,foundation,It was a foundation concrete., concrete foundation, foundation concrete,concrete,False,-20.562885284423828,-20.802845001220703,0.239959716796875,14067712,EleutherAI/pythia-14m,step128,seed9,9,128
It was a business function.,function,function,It was a function business., business function, function business,business,True,-21.99272918701172,-22.50496482849121,0.5122356414794922,14067712,EleutherAI/pythia-14m,step128,seed9,9,128
He was on the parade ground.,ground,ground,He was on the ground parade., parade ground, ground parade,parade,True,-21.477046966552734,-21.51436996459961,0.037322998046875,14067712,EleutherAI/pythia-14m,step128,seed9,9,128
They liked the national guard.,guard,guard,They liked the guard national., national guard, guard national,national,False,-20.694290161132812,-20.886463165283203,0.19217300415039062,14067712,EleutherAI/pythia-14m,step128,seed9,9,128
He had a friendly guide.,guide,guide,He had a guide friendly., friendly guide, guide friendly,friendly,False,-20.994461059570312,-21.13776397705078,0.14330291748046875,14067712,EleutherAI/pythia-14m,step128,seed9,9,128
It was a nursing home.,home,home,It was a home nursing., nursing home, home nursing,nursing,True,-20.906780242919922,-20.661014556884766,-0.24576568603515625,14067712,EleutherAI/pythia-14m,step128,seed9,9,128
They had military intelligence.,intelligence,intelligence,They had intelligence military., military intelligence, intelligence military,military,False,-21.02373695373535,-21.83097267150879,0.8072357177734375,14067712,EleutherAI/pythia-14m,step128,seed9,9,128
It was a special issue.,issue,issue,It was an issue special., special issue, issue special,special,False,-19.413827896118164,-19.336383819580078,-0.07744407653808594,14067712,EleutherAI/pythia-14m,step128,seed9,9,128
It was a paper jam.,jam,jam,It was a jam paper., paper jam, jam paper,paper,True,-21.703317642211914,-21.529741287231445,-0.17357635498046875,14067712,EleutherAI/pythia-14m,step128,seed9,9,128
It was a backspace key.,key,key,It was a key backspace., backspace key, key backspace,backspace,True,-29.91802978515625,-30.391267776489258,0.4732379913330078,14067712,EleutherAI/pythia-14m,step128,seed9,9,128
They liked the friendly lamb.,lamb,lamb,They liked the lamb friendly., friendly lamb, lamb friendly,friendly,False,-21.237380981445312,-21.967634201049805,0.7302532196044922,14067712,EleutherAI/pythia-14m,step128,seed9,9,128
She had door locks.,lock,locks,She had locks door., door locks, locks door,door,True,-19.999704360961914,-19.784786224365234,-0.2149181365966797,14067712,EleutherAI/pythia-14m,step128,seed9,9,128
They liked the women's lunch.,lunch,lunch,They liked the lunch women's., women's lunch, lunch women's,women,True,-30.20645523071289,-30.36050033569336,0.15404510498046875,14067712,EleutherAI/pythia-14m,step128,seed9,9,128
He liked the stock market.,market,market,He liked the market stock., stock market, market stock,stock,True,-19.180400848388672,-18.982223510742188,-0.19817733764648438,14067712,EleutherAI/pythia-14m,step128,seed9,9,128
It was a tennis match.,match,match,It was a match tennis., tennis match, match tennis,tennis,True,-20.84415626525879,-20.565162658691406,-0.2789936065673828,14067712,EleutherAI/pythia-14m,step128,seed9,9,128
It was veterinary medicine.,medicine,medicine,It was medicine veterinary., veterinary medicine, medicine veterinary,veterinary,False,-20.865421295166016,-21.320343017578125,0.4549217224121094,14067712,EleutherAI/pythia-14m,step128,seed9,9,128
There was a clear message.,message,message,There was a message clear., clear message, message clear,clear,False,-20.59208106994629,-20.33102798461914,-0.26105308532714844,14067712,EleutherAI/pythia-14m,step128,seed9,9,128
It was a clay mold.,mold,mold,It was a mold clay., clay mold, mold clay,clay,True,-22.21481704711914,-22.33057975769043,0.11576271057128906,14067712,EleutherAI/pythia-14m,step128,seed9,9,128
She saw the fast mole.,mole,mole,She saw the mole fast., fast mole, mole fast,fast,False,-21.037765502929688,-20.918853759765625,-0.1189117431640625,14067712,EleutherAI/pythia-14m,step128,seed9,9,128
He liked the civil-rights movement.,movement,movement,He liked the movement civil-rights., civil-rights movement, movement civil-rights,civil-rights,False,-42.29912185668945,-42.38236999511719,0.08324813842773438,14067712,EleutherAI/pythia-14m,step128,seed9,9,128
It was a shredded newspaper.,newspaper,newspaper,It was a newspaper shredded., shredded newspaper, newspaper shredded,shredded,False,-21.193218231201172,-20.696496963500977,-0.4967212677001953,14067712,EleutherAI/pythia-14m,step128,seed9,9,128
It was a reddish orange.,orange,orange,It was an orange reddish., reddish orange, orange reddish,reddish,False,-31.571285247802734,-31.360244750976562,-0.21104049682617188,14067712,EleutherAI/pythia-14m,step128,seed9,9,128
He saw the ripped page.,page,page,He saw the page ripped., ripped page, page ripped,ripped,False,-21.189376831054688,-20.75503158569336,-0.4343452453613281,14067712,EleutherAI/pythia-14m,step128,seed9,9,128
It was a tree palm.,palm,palm,It was a palm tree., tree palm, palm tree,tree,True,-22.19325828552246,-21.923686981201172,-0.26957130432128906,14067712,EleutherAI/pythia-14m,step128,seed9,9,128
It was a consumer panel.,panel,panel,It was a panel consumer., consumer panel, panel consumer,consumer,True,-20.574451446533203,-20.198148727416992,-0.37630271911621094,14067712,EleutherAI/pythia-14m,step128,seed9,9,128
It was a biblical passage.,passage,passage,It was a passage biblical., biblical passage, passage biblical,biblical,False,-20.844669342041016,-20.909435272216797,0.06476593017578125,14067712,EleutherAI/pythia-14m,step128,seed9,9,128
It was a secure perch.,perch,perch,It was a perch secure., secure perch, perch secure,secure,False,-29.970073699951172,-29.925777435302734,-0.0442962646484375,14067712,EleutherAI/pythia-14m,step128,seed9,9,128
He saw the plastic pitcher.,pitcher,pitcher,He saw the pitcher plastic., plastic pitcher, pitcher plastic,plastic,True,-21.86899185180664,-21.778099060058594,-0.09089279174804688,14067712,EleutherAI/pythia-14m,step128,seed9,9,128
It was a sweet port.,port,port,It was a port sweet., sweet port, port sweet,sweet,False,-21.5345458984375,-21.87873649597168,0.3441905975341797,14067712,EleutherAI/pythia-14m,step128,seed9,9,128
He was in a yoga position.,position,position,He was in a position yoga., yoga position, position yoga,yoga,True,-20.473541259765625,-20.541656494140625,0.068115234375,14067712,EleutherAI/pythia-14m,step128,seed9,9,128
It was a challenging post.,post,post,It was a post challenging., challenging post, post challenging,challenging,False,-21.118865966796875,-21.23507308959961,0.11620712280273438,14067712,EleutherAI/pythia-14m,step128,seed9,9,128
He had the quickest punch.,punch,punch,He had the punch quickest., quickest punch, punch quickest,quickest,False,-31.6549072265625,-31.2576904296875,-0.397216796875,14067712,EleutherAI/pythia-14m,step128,seed9,9,128
She had a cloudy pupil.,pupil,pupil,She had a pupil cloudy., cloudy pupil, pupil cloudy,cloudy,False,-31.76762580871582,-31.529380798339844,-0.23824501037597656,14067712,EleutherAI/pythia-14m,step128,seed9,9,128
That was a tennis racket.,racket,racket,That was a racket tennis., tennis racket, racket tennis,tennis,True,-21.561012268066406,-21.064308166503906,-0.4967041015625,14067712,EleutherAI/pythia-14m,step128,seed9,9,128
He liked granite rock.,rock,rock,He liked rock granite., granite rock, rock granite,granite,True,-23.9030704498291,-23.030841827392578,-0.8722286224365234,14067712,EleutherAI/pythia-14m,step128,seed9,9,128
He saw the bushy sage.,sage,sage,He saw the sage bushy., bushy sage, sage bushy,bushy,False,-31.378578186035156,-31.986042022705078,0.6074638366699219,14067712,EleutherAI/pythia-14m,step128,seed9,9,128
It was a major scale.,scale,scale,It was a scale major., major scale, scale major,major,False,-19.747982025146484,-20.12932777404785,0.3813457489013672,14067712,EleutherAI/pythia-14m,step128,seed9,9,128
It was a panoramic scene.,scene,scene,It was a scene panoramic., panoramic scene, scene panoramic,panoramic,False,-31.956275939941406,-31.937015533447266,-0.019260406494140625,14067712,EleutherAI/pythia-14m,step128,seed9,9,128
It was a trained seal.,seal,seal,It was a seal trained., trained seal, seal trained,trained,False,-21.98938751220703,-22.152517318725586,0.1631298065185547,14067712,EleutherAI/pythia-14m,step128,seed9,9,128
He used the video tape.,tape,tape,He used the tape video., video tape, tape video,video,True,-21.311391830444336,-22.369041442871094,1.0576496124267578,14067712,EleutherAI/pythia-14m,step128,seed9,9,128
It was a technical term.,term,term,It was a term technical., technical term, term technical,technical,False,-20.526473999023438,-20.417219161987305,-0.10925483703613281,14067712,EleutherAI/pythia-14m,step128,seed9,9,128
It was a diseased tick.,tick,tick,It was a tick diseased., diseased tick, tick diseased,diseased,False,-22.08920669555664,-22.18968963623047,0.10048294067382812,14067712,EleutherAI/pythia-14m,step128,seed9,9,128
It was a finger tip.,tip,tip,It was a tip finger., finger tip, tip finger,finger,True,-22.12830352783203,-21.943822860717773,-0.1844806671142578,14067712,EleutherAI/pythia-14m,step128,seed9,9,128
She liked the professional title.,title,title,She liked the title professional., professional title, title professional,professional,False,-19.707965850830078,-19.375324249267578,-0.3326416015625,14067712,EleutherAI/pythia-14m,step128,seed9,9,128
It was a bell toll.,toll,toll,It was a toll bell., bell toll, toll bell,bell,True,-23.16407012939453,-23.137928009033203,-0.026142120361328125,14067712,EleutherAI/pythia-14m,step128,seed9,9,128
She saw the snowshoe tracks.,track,tracks,She saw the tracks snowshoe., snowshoe tracks, tracks snowshoe,snowshoe,True,-42.39834976196289,-42.21721649169922,-0.18113327026367188,14067712,EleutherAI/pythia-14m,step128,seed9,9,128
They were cluttered yards.,yard,yards,They were yards cluttered., cluttered yards, yards cluttered,cluttered,False,-32.6894645690918,-32.24626541137695,-0.44319915771484375,14067712,EleutherAI/pythia-14m,step128,seed9,9,128
