sentence,word,string,reversed_sentence,mod_np,reversed_mod,disambiguating_word,non_adjective,original_logprob,reversed_logprob,ratio,n_params,mpath,revision,seed_name,seed,step
It was a social function.,function,function,It was a function social., social function, function social,social,False,-18.685382843017578,-23.910099029541016,5.2247161865234375,14067712,EleutherAI/pythia-14m,step15000,seed1,1,15000
He was on the firm ground.,ground,ground,He was on the ground firm., firm ground, ground firm,firm,False,-17.114471435546875,-15.701412200927734,-1.4130592346191406,14067712,EleutherAI/pythia-14m,step15000,seed1,1,15000
He was on the frozen ground.,ground,ground,He was on the ground frozen., frozen ground, ground frozen,frozen,False,-13.833477973937988,-17.203468322753906,3.369990348815918,14067712,EleutherAI/pythia-14m,step15000,seed1,1,15000
He was on the camp ground.,ground,ground,He was on the ground camp., camp ground, ground camp,camp,True,-16.3724308013916,-12.874168395996094,-3.498262405395508,14067712,EleutherAI/pythia-14m,step15000,seed1,1,15000
They liked the night guard.,guard,guard,They liked the guard night., night guard, guard night,night,True,-16.719144821166992,-18.871295928955078,2.152151107788086,14067712,EleutherAI/pythia-14m,step15000,seed1,1,15000
They liked the security guard.,guard,guard,They liked the guard security., security guard, guard security,security,True,-16.015430450439453,-21.83349609375,5.818065643310547,14067712,EleutherAI/pythia-14m,step15000,seed1,1,15000
They liked the coast guard.,guard,guard,They liked the guard coast., coast guard, guard coast,coast,True,-18.804182052612305,-24.157962799072266,5.353780746459961,14067712,EleutherAI/pythia-14m,step15000,seed1,1,15000
He had an assembly guide.,guide,guide,He had an guide assembly., assembly guide, guide assembly,assembly,True,-17.487747192382812,-26.811429977416992,9.32368278503418,14067712,EleutherAI/pythia-14m,step15000,seed1,1,15000
He had a TV guide.,guide,guide,He had a guide TV., TV guide, guide TV,TV,True,-19.306734085083008,-23.61565399169922,4.308919906616211,14067712,EleutherAI/pythia-14m,step15000,seed1,1,15000
He had a talkative guide.,guide,guide,He had a guide talkative., talkative guide, guide talkative,talkative,False,-23.68991470336914,-25.932178497314453,2.2422637939453125,14067712,EleutherAI/pythia-14m,step15000,seed1,1,15000
It was a summer home.,home,home,It was a home summer., summer home, home summer,summer,True,-14.000736236572266,-16.709163665771484,2.7084274291992188,14067712,EleutherAI/pythia-14m,step15000,seed1,1,15000
It was a childhood home.,home,home,It was a home childhood., childhood home, home childhood,childhood,True,-13.46816349029541,-19.165529251098633,5.697365760803223,14067712,EleutherAI/pythia-14m,step15000,seed1,1,15000
It was a funeral home.,home,home,It was a home funeral., funeral home, home funeral,funeral,False,-12.898496627807617,-17.934249877929688,5.03575325012207,14067712,EleutherAI/pythia-14m,step15000,seed1,1,15000
They had natural intelligence.,intelligence,intelligence,They had intelligence natural., natural intelligence, intelligence natural,natural,False,-16.250144958496094,-22.31879997253418,6.068655014038086,14067712,EleutherAI/pythia-14m,step15000,seed1,1,15000
They had innate intelligence.,intelligence,intelligence,They had intelligence innate., innate intelligence, intelligence innate,innate,False,-16.808441162109375,-26.645980834960938,9.837539672851562,14067712,EleutherAI/pythia-14m,step15000,seed1,1,15000
They had classified intelligence.,intelligence,intelligence,They had intelligence classified., classified intelligence, intelligence classified,classified,False,-19.490829467773438,-20.821861267089844,1.3310317993164062,14067712,EleutherAI/pythia-14m,step15000,seed1,1,15000
It was a sensitive issue.,issue,issue,It was an issue sensitive., sensitive issue, issue sensitive,sensitive,False,-17.121410369873047,-21.05533790588379,3.933927536010742,14067712,EleutherAI/pythia-14m,step15000,seed1,1,15000
It was a political issue.,issue,issue,It was an issue political., political issue, issue political,political,False,-12.918560028076172,-17.540464401245117,4.621904373168945,14067712,EleutherAI/pythia-14m,step15000,seed1,1,15000
It was a weekly issue.,issue,issue,It was an issue weekly., weekly issue, issue weekly,weekly,False,-18.40040397644043,-18.74073028564453,0.34032630920410156,14067712,EleutherAI/pythia-14m,step15000,seed1,1,15000
It was a blackberry jam.,jam,jam,It was a jam blackberry., blackberry jam, jam blackberry,blackberry,True,-20.14305305480957,-23.838457107543945,3.695404052734375,14067712,EleutherAI/pythia-14m,step15000,seed1,1,15000
It was a peach jam.,jam,jam,It was a jam peach., peach jam, jam peach,peach,False,-20.09813690185547,-19.780319213867188,-0.31781768798828125,14067712,EleutherAI/pythia-14m,step15000,seed1,1,15000
It was a traffic jam.,jam,jam,It was a jam traffic., traffic jam, jam traffic,traffic,True,-12.455235481262207,-19.777376174926758,7.322140693664551,14067712,EleutherAI/pythia-14m,step15000,seed1,1,15000
It was a duplicate key.,key,key,It was a key duplicate., duplicate key, key duplicate,duplicate,False,-19.141403198242188,-20.66641616821289,1.5250129699707031,14067712,EleutherAI/pythia-14m,step15000,seed1,1,15000
It was a master key.,key,key,It was a key master., master key, key master,master,True,-20.09706687927246,-19.208362579345703,-0.8887042999267578,14067712,EleutherAI/pythia-14m,step15000,seed1,1,15000
It was a delete key.,key,key,It was a key delete., delete key, key delete,delete,False,-21.071870803833008,-22.940889358520508,1.8690185546875,14067712,EleutherAI/pythia-14m,step15000,seed1,1,15000
They liked the marinated lamb.,lamb,lamb,They liked the lamb marinated., marinated lamb, lamb marinated,marinated,True,-21.542320251464844,-21.645387649536133,0.10306739807128906,14067712,EleutherAI/pythia-14m,step15000,seed1,1,15000
They liked the grilled lamb.,lamb,lamb,They liked the lamb grilled., grilled lamb, lamb grilled,grilled,False,-15.433494567871094,-19.2609920501709,3.8274974822998047,14067712,EleutherAI/pythia-14m,step15000,seed1,1,15000
They liked the cute lamb.,lamb,lamb,They liked the lamb cute., cute lamb, lamb cute,cute,False,-19.136808395385742,-21.830738067626953,2.693929672241211,14067712,EleutherAI/pythia-14m,step15000,seed1,1,15000
She had curly locks.,lock,locks,She had locks curly., curly locks, locks curly,curly,False,-19.112133026123047,-25.205533981323242,6.093400955200195,14067712,EleutherAI/pythia-14m,step15000,seed1,1,15000
She had brown locks.,lock,locks,She had locks brown., brown locks, locks brown,brown,False,-20.545757293701172,-22.669483184814453,2.1237258911132812,14067712,EleutherAI/pythia-14m,step15000,seed1,1,15000
She had window locks.,lock,locks,She had locks window., window locks, locks window,window,True,-20.79844856262207,-21.498743057250977,0.7002944946289062,14067712,EleutherAI/pythia-14m,step15000,seed1,1,15000
They liked the hot lunch.,lunch,lunch,They liked the lunch hot., hot lunch, lunch hot,hot,False,-17.59479331970215,-17.909595489501953,0.3148021697998047,14067712,EleutherAI/pythia-14m,step15000,seed1,1,15000
They liked the sandwich lunch.,lunch,lunch,They liked the lunch sandwich., sandwich lunch, lunch sandwich,sandwich,True,-19.17913055419922,-17.905723571777344,-1.273406982421875,14067712,EleutherAI/pythia-14m,step15000,seed1,1,15000
They liked the afternoon lunch.,lunch,lunch,They liked the lunch afternoon., afternoon lunch, lunch afternoon,afternoon,True,-17.342933654785156,-19.558719635009766,2.2157859802246094,14067712,EleutherAI/pythia-14m,step15000,seed1,1,15000
He liked the flea market.,market,market,He liked the market flea., flea market, market flea,flea,True,-22.733184814453125,-24.656455993652344,1.9232711791992188,14067712,EleutherAI/pythia-14m,step15000,seed1,1,15000
He liked the fish market.,market,market,He liked the market fish., fish market, market fish,fish,True,-19.052345275878906,-19.816932678222656,0.76458740234375,14067712,EleutherAI/pythia-14m,step15000,seed1,1,15000
He liked the housing market.,market,market,He liked the market housing., housing market, market housing,housing,True,-17.789825439453125,-21.782276153564453,3.992450714111328,14067712,EleutherAI/pythia-14m,step15000,seed1,1,15000
It was a lit match.,match,match,It was a match lit., lit match, match lit,lit,False,-20.996809005737305,-19.45107650756836,-1.5457324981689453,14067712,EleutherAI/pythia-14m,step15000,seed1,1,15000
It was a burning match.,match,match,It was a match burning., burning match, match burning,burning,False,-18.1070499420166,-19.318973541259766,1.211923599243164,14067712,EleutherAI/pythia-14m,step15000,seed1,1,15000
It was a soccer match.,match,match,It was a match soccer., soccer match, match soccer,soccer,True,-16.156387329101562,-21.470947265625,5.3145599365234375,14067712,EleutherAI/pythia-14m,step15000,seed1,1,15000
It was cough medicine.,medicine,medicine,It was medicine cough., cough medicine, medicine cough,cough,True,-24.030454635620117,-23.818071365356445,-0.21238327026367188,14067712,EleutherAI/pythia-14m,step15000,seed1,1,15000
It was prescription medicine.,medicine,medicine,It was medicine prescription., prescription medicine, medicine prescription,prescription,True,-19.030166625976562,-20.92220687866211,1.8920402526855469,14067712,EleutherAI/pythia-14m,step15000,seed1,1,15000
It was orthopedic medicine.,medicine,medicine,It was medicine orthopedic., orthopedic medicine, medicine orthopedic,orthopedic,False,-18.14015007019043,-26.338315963745117,8.198165893554688,14067712,EleutherAI/pythia-14m,step15000,seed1,1,15000
There was a phone message.,message,message,There was a message phone., phone message, message phone,phone,True,-15.255687713623047,-20.785816192626953,5.530128479003906,14067712,EleutherAI/pythia-14m,step15000,seed1,1,15000
There was a computer message.,message,message,There was a message computer., computer message, message computer,computer,True,-20.268253326416016,-24.587200164794922,4.318946838378906,14067712,EleutherAI/pythia-14m,step15000,seed1,1,15000
There was an urgent message.,message,message,There was an message urgent., urgent message, message urgent,urgent,False,-18.8435001373291,-27.120201110839844,8.276700973510742,14067712,EleutherAI/pythia-14m,step15000,seed1,1,15000
It was a fungal mold.,mold,mold,It was a mold fungal., fungal mold, mold fungal,fungal,False,-19.52022361755371,-20.6090087890625,1.088785171508789,14067712,EleutherAI/pythia-14m,step15000,seed1,1,15000
It was a harmful mold.,mold,mold,It was a mold harmful., harmful mold, mold harmful,harmful,False,-21.991695404052734,-23.511302947998047,1.5196075439453125,14067712,EleutherAI/pythia-14m,step15000,seed1,1,15000
It was a rubber mold.,mold,mold,It was a mold rubber., rubber mold, mold rubber,rubber,True,-15.402276039123535,-20.675016403198242,5.272740364074707,14067712,EleutherAI/pythia-14m,step15000,seed1,1,15000
She saw the cancerous mole.,mole,mole,She saw the mole cancerous., cancerous mole, mole cancerous,cancerous,False,-25.828418731689453,-33.337955474853516,7.5095367431640625,14067712,EleutherAI/pythia-14m,step15000,seed1,1,15000
She saw the raised mole.,mole,mole,She saw the mole raised., raised mole, mole raised,raised,False,-19.76185417175293,-19.76357650756836,0.0017223358154296875,14067712,EleutherAI/pythia-14m,step15000,seed1,1,15000
She saw the cute mole.,mole,mole,She saw the mole cute., cute mole, mole cute,cute,False,-20.750675201416016,-25.874330520629883,5.123655319213867,14067712,EleutherAI/pythia-14m,step15000,seed1,1,15000
He liked the rhythmic movement.,movement,movement,He liked the movement rhythmic., rhythmic movement, movement rhythmic,rhythmic,False,-17.380001068115234,-21.997732162475586,4.617731094360352,14067712,EleutherAI/pythia-14m,step15000,seed1,1,15000
He liked the graceful movement.,movement,movement,He liked the movement graceful., graceful movement, movement graceful,graceful,False,-17.921890258789062,-21.838958740234375,3.9170684814453125,14067712,EleutherAI/pythia-14m,step15000,seed1,1,15000
He liked the feminist movement.,movement,movement,He liked the movement feminist., feminist movement, movement feminist,feminist,True,-14.049442291259766,-23.344860076904297,9.295417785644531,14067712,EleutherAI/pythia-14m,step15000,seed1,1,15000
It was a national newspaper.,newspaper,newspaper,It was a newspaper national., national newspaper, newspaper national,national,False,-14.56344985961914,-19.48465347290039,4.92120361328125,14067712,EleutherAI/pythia-14m,step15000,seed1,1,15000
It was a daily newspaper.,newspaper,newspaper,It was a newspaper daily., daily newspaper, newspaper daily,daily,False,-16.027816772460938,-18.72936248779297,2.7015457153320312,14067712,EleutherAI/pythia-14m,step15000,seed1,1,15000
It was a faded newspaper.,newspaper,newspaper,It was a newspaper faded., faded newspaper, newspaper faded,faded,False,-20.362831115722656,-22.326213836669922,1.9633827209472656,14067712,EleutherAI/pythia-14m,step15000,seed1,1,15000
It was a juicy orange.,orange,orange,It was an orange juicy., juicy orange, orange juicy,juicy,False,-20.673097610473633,-19.41097640991211,-1.2621212005615234,14067712,EleutherAI/pythia-14m,step15000,seed1,1,15000
It was a ripe orange.,orange,orange,It was an orange ripe., ripe orange, orange ripe,ripe,False,-18.926416397094727,-16.277793884277344,-2.648622512817383,14067712,EleutherAI/pythia-14m,step15000,seed1,1,15000
It was a bright orange.,orange,orange,It was an orange bright., bright orange, orange bright,bright,False,-14.094941139221191,-16.60921859741211,2.514277458190918,14067712,EleutherAI/pythia-14m,step15000,seed1,1,15000
He saw the young page.,page,page,He saw the page young., young page, page young,young,False,-16.891014099121094,-20.701969146728516,3.810955047607422,14067712,EleutherAI/pythia-14m,step15000,seed1,1,15000
He saw the loyal page.,page,page,He saw the page loyal., loyal page, page loyal,loyal,False,-24.902057647705078,-22.498504638671875,-2.403553009033203,14067712,EleutherAI/pythia-14m,step15000,seed1,1,15000
He saw the blank page.,page,page,He saw the page blank., blank page, page blank,blank,False,-17.708852767944336,-17.755027770996094,0.04617500305175781,14067712,EleutherAI/pythia-14m,step15000,seed1,1,15000
It was a calloused palm.,palm,palm,It was a palm calloused., calloused palm, palm calloused,calloused,False,-28.431167602539062,-29.429248809814453,0.9980812072753906,14067712,EleutherAI/pythia-14m,step15000,seed1,1,15000
It was a wrinkled palm.,palm,palm,It was a palm wrinkled., wrinkled palm, palm wrinkled,wrinkled,False,-19.719505310058594,-21.09565544128418,1.376150131225586,14067712,EleutherAI/pythia-14m,step15000,seed1,1,15000
It was a tropical palm.,palm,palm,It was a palm tropical., tropical palm, palm tropical,tropical,False,-20.400489807128906,-22.235519409179688,1.8350296020507812,14067712,EleutherAI/pythia-14m,step15000,seed1,1,15000
It was a control panel.,panel,panel,It was a panel control., control panel, panel control,control,True,-15.987040519714355,-21.02249526977539,5.035454750061035,14067712,EleutherAI/pythia-14m,step15000,seed1,1,15000
It was an instrument panel.,panel,panel,It was an panel instrument., instrument panel, panel instrument,instrument,False,-19.21172332763672,-27.638267517089844,8.426544189453125,14067712,EleutherAI/pythia-14m,step15000,seed1,1,15000
It was an advisory panel.,panel,panel,It was an panel advisory., advisory panel, panel advisory,advisory,False,-15.311895370483398,-27.556795120239258,12.24489974975586,14067712,EleutherAI/pythia-14m,step15000,seed1,1,15000
It was a secret passage.,passage,passage,It was a passage secret., secret passage, passage secret,secret,False,-13.175081253051758,-21.63888931274414,8.463808059692383,14067712,EleutherAI/pythia-14m,step15000,seed1,1,15000
It was a narrow passage.,passage,passage,It was a passage narrow., narrow passage, passage narrow,narrow,False,-16.074398040771484,-21.310333251953125,5.235935211181641,14067712,EleutherAI/pythia-14m,step15000,seed1,1,15000
It was a literary passage.,passage,passage,It was a passage literary., literary passage, passage literary,literary,False,-16.876785278320312,-26.08962631225586,9.212841033935547,14067712,EleutherAI/pythia-14m,step15000,seed1,1,15000
It was a tasty perch.,perch,perch,It was a perch tasty., tasty perch, perch tasty,tasty,False,-23.973163604736328,-25.349641799926758,1.3764781951904297,14067712,EleutherAI/pythia-14m,step15000,seed1,1,15000
It was a freshwater perch.,perch,perch,It was a perch freshwater., freshwater perch, perch freshwater,freshwater,True,-24.513826370239258,-24.24370574951172,-0.27012062072753906,14067712,EleutherAI/pythia-14m,step15000,seed1,1,15000
It was a lofty perch.,perch,perch,It was a perch lofty., lofty perch, perch lofty,lofty,False,-24.156837463378906,-25.4663143157959,1.3094768524169922,14067712,EleutherAI/pythia-14m,step15000,seed1,1,15000
He saw the fast pitcher.,pitcher,pitcher,He saw the pitcher fast., fast pitcher, pitcher fast,fast,False,-21.042587280273438,-20.319501876831055,-0.7230854034423828,14067712,EleutherAI/pythia-14m,step15000,seed1,1,15000
He saw the right-handed pitcher.,pitcher,pitcher,He saw the pitcher right-handed., right-handed pitcher, pitcher right-handed,right-handed,False,-20.471370697021484,-24.856029510498047,4.3846588134765625,14067712,EleutherAI/pythia-14m,step15000,seed1,1,15000
He saw the glass pitcher.,pitcher,pitcher,He saw the pitcher glass., glass pitcher, pitcher glass,glass,True,-18.054954528808594,-20.139793395996094,2.0848388671875,14067712,EleutherAI/pythia-14m,step15000,seed1,1,15000
It was a windy port.,port,port,It was a port windy., windy port, port windy,windy,False,-23.04136848449707,-25.456695556640625,2.4153270721435547,14067712,EleutherAI/pythia-14m,step15000,seed1,1,15000
It was a seaside port.,port,port,It was a port seaside., seaside port, port seaside,seaside,True,-18.03671646118164,-25.440927505493164,7.404211044311523,14067712,EleutherAI/pythia-14m,step15000,seed1,1,15000
It was a delicious port.,port,port,It was a port delicious., delicious port, port delicious,delicious,False,-19.137622833251953,-24.711345672607422,5.573722839355469,14067712,EleutherAI/pythia-14m,step15000,seed1,1,15000
He was in a distinguished position.,position,position,He was in a position distinguished., distinguished position, position distinguished,distinguished,False,-13.075632095336914,-18.913362503051758,5.837730407714844,14067712,EleutherAI/pythia-14m,step15000,seed1,1,15000
He was in a prominent position.,position,position,He was in a position prominent., prominent position, position prominent,prominent,False,-11.313919067382812,-18.531002044677734,7.217082977294922,14067712,EleutherAI/pythia-14m,step15000,seed1,1,15000
He was in a fetal position.,position,position,He was in a position fetal., fetal position, position fetal,fetal,False,-17.640104293823242,-21.866825103759766,4.226720809936523,14067712,EleutherAI/pythia-14m,step15000,seed1,1,15000
It was a wooden post.,post,post,It was a post wooden., wooden post, post wooden,wooden,False,-16.955867767333984,-22.145931243896484,5.1900634765625,14067712,EleutherAI/pythia-14m,step15000,seed1,1,15000
It was a fence post.,post,post,It was a post fence., fence post, post fence,fence,True,-18.634998321533203,-20.223915100097656,1.5889167785644531,14067712,EleutherAI/pythia-14m,step15000,seed1,1,15000
It was a teaching post.,post,post,It was a post teaching., teaching post, post teaching,teaching,True,-18.258907318115234,-16.499427795410156,-1.7594795227050781,14067712,EleutherAI/pythia-14m,step15000,seed1,1,15000
He had the alcoholic punch.,punch,punch,He had the punch alcoholic., alcoholic punch, punch alcoholic,alcoholic,False,-21.09377670288086,-26.16138458251953,5.067607879638672,14067712,EleutherAI/pythia-14m,step15000,seed1,1,15000
He had the fruit punch.,punch,punch,He had the punch fruit., fruit punch, punch fruit,fruit,True,-20.64898681640625,-22.902629852294922,2.253643035888672,14067712,EleutherAI/pythia-14m,step15000,seed1,1,15000
He had the strongest punch.,punch,punch,He had the punch strongest., strongest punch, punch strongest,strongest,False,-15.775208473205566,-25.803728103637695,10.028519630432129,14067712,EleutherAI/pythia-14m,step15000,seed1,1,15000
She had a brilliant pupil.,pupil,pupil,She had a pupil brilliant., brilliant pupil, pupil brilliant,brilliant,False,-17.717519760131836,-24.010879516601562,6.293359756469727,14067712,EleutherAI/pythia-14m,step15000,seed1,1,15000
She had an interested pupil.,pupil,pupil,She had an pupil interested., interested pupil, pupil interested,interested,False,-21.10419464111328,-22.017810821533203,0.9136161804199219,14067712,EleutherAI/pythia-14m,step15000,seed1,1,15000
She had a dilated pupil.,pupil,pupil,She had a pupil dilated., dilated pupil, pupil dilated,dilated,False,-19.599164962768555,-23.374774932861328,3.7756099700927734,14067712,EleutherAI/pythia-14m,step15000,seed1,1,15000
That was a loud racket.,racket,racket,That was a racket loud., loud racket, racket loud,loud,False,-20.321537017822266,-26.14803695678711,5.826499938964844,14067712,EleutherAI/pythia-14m,step15000,seed1,1,15000
That was an annoying racket.,racket,racket,That was an racket annoying., annoying racket, racket annoying,annoying,False,-14.939321517944336,-26.343557357788086,11.40423583984375,14067712,EleutherAI/pythia-14m,step15000,seed1,1,15000
That was a badminton racket.,racket,racket,That was a racket badminton., badminton racket, racket badminton,badminton,True,-31.657482147216797,-35.54022216796875,3.882740020751953,14067712,EleutherAI/pythia-14m,step15000,seed1,1,15000
He liked electronic rock.,rock,rock,He liked rock electronic., electronic rock, rock electronic,electronic,False,-23.563405990600586,-23.201313018798828,-0.3620929718017578,14067712,EleutherAI/pythia-14m,step15000,seed1,1,15000
He liked alternative rock.,rock,rock,He liked rock alternative., alternative rock, rock alternative,alternative,False,-20.90453338623047,-23.19945526123047,2.294921875,14067712,EleutherAI/pythia-14m,step15000,seed1,1,15000
He liked limestone rock.,rock,rock,He liked rock limestone., limestone rock, rock limestone,limestone,True,-16.657081604003906,-19.207786560058594,2.5507049560546875,14067712,EleutherAI/pythia-14m,step15000,seed1,1,15000
He saw the wise sage.,sage,sage,He saw the sage wise., wise sage, sage wise,wise,False,-21.607585906982422,-21.695537567138672,0.08795166015625,14067712,EleutherAI/pythia-14m,step15000,seed1,1,15000
He saw the renowned sage.,sage,sage,He saw the sage renowned., renowned sage, sage renowned,renowned,False,-19.14968490600586,-22.681373596191406,3.531688690185547,14067712,EleutherAI/pythia-14m,step15000,seed1,1,15000
He saw the fragrant sage.,sage,sage,He saw the sage fragrant., fragrant sage, sage fragrant,fragrant,False,-20.37799835205078,-22.13339614868164,1.7553977966308594,14067712,EleutherAI/pythia-14m,step15000,seed1,1,15000
It was a fish scale.,scale,scale,It was a scale fish., fish scale, scale fish,fish,True,-20.45466423034668,-23.411396026611328,2.9567317962646484,14067712,EleutherAI/pythia-14m,step15000,seed1,1,15000
It was a lizard scale.,scale,scale,It was a scale lizard., lizard scale, scale lizard,lizard,True,-24.860790252685547,-26.35580825805664,1.4950180053710938,14067712,EleutherAI/pythia-14m,step15000,seed1,1,15000
It was a music scale.,scale,scale,It was a scale music., music scale, scale music,music,True,-20.793659210205078,-20.88023567199707,0.08657646179199219,14067712,EleutherAI/pythia-14m,step15000,seed1,1,15000
It was a touching scene.,scene,scene,It was a scene touching., touching scene, scene touching,touching,False,-15.870604515075684,-18.50171661376953,2.6311120986938477,14067712,EleutherAI/pythia-14m,step15000,seed1,1,15000
It was a well-acted scene.,scene,scene,It was a scene well-acted., well-acted scene, scene well-acted,well-acted,False,-25.06085968017578,-30.756986618041992,5.696126937866211,14067712,EleutherAI/pythia-14m,step15000,seed1,1,15000
It was a nature scene.,scene,scene,It was a scene nature., nature scene, scene nature,nature,True,-16.23017692565918,-19.218656539916992,2.9884796142578125,14067712,EleutherAI/pythia-14m,step15000,seed1,1,15000
It was a gold seal.,seal,seal,It was a seal gold., gold seal, seal gold,gold,True,-13.724503517150879,-19.685028076171875,5.960524559020996,14067712,EleutherAI/pythia-14m,step15000,seed1,1,15000
It was a certified seal.,seal,seal,It was a seal certified., certified seal, seal certified,certified,False,-19.627559661865234,-21.031360626220703,1.4038009643554688,14067712,EleutherAI/pythia-14m,step15000,seed1,1,15000
It was a circus seal.,seal,seal,It was a seal circus., circus seal, seal circus,circus,True,-20.97162437438965,-24.679821014404297,3.7081966400146484,14067712,EleutherAI/pythia-14m,step15000,seed1,1,15000
He used the scotch tape.,tape,tape,He used the tape scotch., scotch tape, tape scotch,scotch,True,-23.833881378173828,-25.89864730834961,2.0647659301757812,14067712,EleutherAI/pythia-14m,step15000,seed1,1,15000
He used the double-sided tape.,tape,tape,He used the tape double-sided., double-sided tape, tape double-sided,double-sided,False,-19.815824508666992,-25.376693725585938,5.560869216918945,14067712,EleutherAI/pythia-14m,step15000,seed1,1,15000
He used the interview tape.,tape,tape,He used the tape interview., interview tape, tape interview,interview,True,-15.189184188842773,-19.889375686645508,4.700191497802734,14067712,EleutherAI/pythia-14m,step15000,seed1,1,15000
It was a winter term.,term,term,It was a term winter., winter term, term winter,winter,True,-17.18911361694336,-21.035480499267578,3.8463668823242188,14067712,EleutherAI/pythia-14m,step15000,seed1,1,15000
