sentence,word,string,reversed_sentence,mod_np,reversed_mod,disambiguating_word,non_adjective,original_logprob,reversed_logprob,ratio,n_params,mpath,revision,seed_name,seed,step
It was a social function.,function,function,It was a function social., social function, function social,social,False,-16.809062957763672,-21.15760040283203,4.348537445068359,14067712,EleutherAI/pythia-14m,step81000,seed1,1,81000
He was on the firm ground.,ground,ground,He was on the ground firm., firm ground, ground firm,firm,False,-19.86872100830078,-16.775104522705078,-3.093616485595703,14067712,EleutherAI/pythia-14m,step81000,seed1,1,81000
He was on the frozen ground.,ground,ground,He was on the ground frozen., frozen ground, ground frozen,frozen,False,-14.942493438720703,-19.96036148071289,5.0178680419921875,14067712,EleutherAI/pythia-14m,step81000,seed1,1,81000
He was on the camp ground.,ground,ground,He was on the ground camp., camp ground, ground camp,camp,True,-19.525619506835938,-18.49484634399414,-1.0307731628417969,14067712,EleutherAI/pythia-14m,step81000,seed1,1,81000
They liked the night guard.,guard,guard,They liked the guard night., night guard, guard night,night,True,-14.74154281616211,-18.256858825683594,3.5153160095214844,14067712,EleutherAI/pythia-14m,step81000,seed1,1,81000
They liked the security guard.,guard,guard,They liked the guard security., security guard, guard security,security,True,-14.866477966308594,-19.19506072998047,4.328582763671875,14067712,EleutherAI/pythia-14m,step81000,seed1,1,81000
They liked the coast guard.,guard,guard,They liked the guard coast., coast guard, guard coast,coast,True,-17.893585205078125,-21.060401916503906,3.1668167114257812,14067712,EleutherAI/pythia-14m,step81000,seed1,1,81000
He had an assembly guide.,guide,guide,He had an guide assembly., assembly guide, guide assembly,assembly,True,-20.098907470703125,-28.19591522216797,8.097007751464844,14067712,EleutherAI/pythia-14m,step81000,seed1,1,81000
He had a TV guide.,guide,guide,He had a guide TV., TV guide, guide TV,TV,True,-17.77846908569336,-22.892303466796875,5.113834381103516,14067712,EleutherAI/pythia-14m,step81000,seed1,1,81000
He had a talkative guide.,guide,guide,He had a guide talkative., talkative guide, guide talkative,talkative,False,-25.886451721191406,-28.374755859375,2.4883041381835938,14067712,EleutherAI/pythia-14m,step81000,seed1,1,81000
It was a summer home.,home,home,It was a home summer., summer home, home summer,summer,True,-15.096023559570312,-15.873790740966797,0.7777671813964844,14067712,EleutherAI/pythia-14m,step81000,seed1,1,81000
It was a childhood home.,home,home,It was a home childhood., childhood home, home childhood,childhood,True,-14.5712251663208,-17.665462493896484,3.0942373275756836,14067712,EleutherAI/pythia-14m,step81000,seed1,1,81000
It was a funeral home.,home,home,It was a home funeral., funeral home, home funeral,funeral,False,-14.639111518859863,-17.70339584350586,3.064284324645996,14067712,EleutherAI/pythia-14m,step81000,seed1,1,81000
They had natural intelligence.,intelligence,intelligence,They had intelligence natural., natural intelligence, intelligence natural,natural,False,-17.57467269897461,-22.7183780670166,5.143705368041992,14067712,EleutherAI/pythia-14m,step81000,seed1,1,81000
They had innate intelligence.,intelligence,intelligence,They had intelligence innate., innate intelligence, intelligence innate,innate,False,-18.779356002807617,-25.120981216430664,6.341625213623047,14067712,EleutherAI/pythia-14m,step81000,seed1,1,81000
They had classified intelligence.,intelligence,intelligence,They had intelligence classified., classified intelligence, intelligence classified,classified,False,-20.023513793945312,-22.40789222717285,2.384378433227539,14067712,EleutherAI/pythia-14m,step81000,seed1,1,81000
It was a sensitive issue.,issue,issue,It was an issue sensitive., sensitive issue, issue sensitive,sensitive,False,-14.197555541992188,-17.03610610961914,2.838550567626953,14067712,EleutherAI/pythia-14m,step81000,seed1,1,81000
It was a political issue.,issue,issue,It was an issue political., political issue, issue political,political,False,-11.734485626220703,-15.870776176452637,4.136290550231934,14067712,EleutherAI/pythia-14m,step81000,seed1,1,81000
It was a weekly issue.,issue,issue,It was an issue weekly., weekly issue, issue weekly,weekly,False,-16.49006462097168,-17.00589370727539,0.5158290863037109,14067712,EleutherAI/pythia-14m,step81000,seed1,1,81000
It was a blackberry jam.,jam,jam,It was a jam blackberry., blackberry jam, jam blackberry,blackberry,True,-21.029865264892578,-27.69268798828125,6.662822723388672,14067712,EleutherAI/pythia-14m,step81000,seed1,1,81000
It was a peach jam.,jam,jam,It was a jam peach., peach jam, jam peach,peach,False,-21.654449462890625,-22.47740364074707,0.8229541778564453,14067712,EleutherAI/pythia-14m,step81000,seed1,1,81000
It was a traffic jam.,jam,jam,It was a jam traffic., traffic jam, jam traffic,traffic,True,-14.540731430053711,-20.25162696838379,5.710895538330078,14067712,EleutherAI/pythia-14m,step81000,seed1,1,81000
It was a duplicate key.,key,key,It was a key duplicate., duplicate key, key duplicate,duplicate,False,-18.493825912475586,-19.63384246826172,1.1400165557861328,14067712,EleutherAI/pythia-14m,step81000,seed1,1,81000
It was a master key.,key,key,It was a key master., master key, key master,master,True,-17.717418670654297,-18.40045928955078,0.6830406188964844,14067712,EleutherAI/pythia-14m,step81000,seed1,1,81000
It was a delete key.,key,key,It was a key delete., delete key, key delete,delete,False,-19.622575759887695,-18.84442901611328,-0.7781467437744141,14067712,EleutherAI/pythia-14m,step81000,seed1,1,81000
They liked the marinated lamb.,lamb,lamb,They liked the lamb marinated., marinated lamb, lamb marinated,marinated,True,-23.67361068725586,-24.99081802368164,1.3172073364257812,14067712,EleutherAI/pythia-14m,step81000,seed1,1,81000
They liked the grilled lamb.,lamb,lamb,They liked the lamb grilled., grilled lamb, lamb grilled,grilled,False,-15.54702377319336,-21.36193084716797,5.814907073974609,14067712,EleutherAI/pythia-14m,step81000,seed1,1,81000
They liked the cute lamb.,lamb,lamb,They liked the lamb cute., cute lamb, lamb cute,cute,False,-17.746313095092773,-21.57463836669922,3.8283252716064453,14067712,EleutherAI/pythia-14m,step81000,seed1,1,81000
She had curly locks.,lock,locks,She had locks curly., curly locks, locks curly,curly,False,-20.38062858581543,-26.461414337158203,6.080785751342773,14067712,EleutherAI/pythia-14m,step81000,seed1,1,81000
She had brown locks.,lock,locks,She had locks brown., brown locks, locks brown,brown,False,-22.275440216064453,-25.30557632446289,3.0301361083984375,14067712,EleutherAI/pythia-14m,step81000,seed1,1,81000
She had window locks.,lock,locks,She had locks window., window locks, locks window,window,True,-22.138578414916992,-23.21091079711914,1.0723323822021484,14067712,EleutherAI/pythia-14m,step81000,seed1,1,81000
They liked the hot lunch.,lunch,lunch,They liked the lunch hot., hot lunch, lunch hot,hot,False,-14.01453685760498,-16.936473846435547,2.9219369888305664,14067712,EleutherAI/pythia-14m,step81000,seed1,1,81000
They liked the sandwich lunch.,lunch,lunch,They liked the lunch sandwich., sandwich lunch, lunch sandwich,sandwich,True,-18.835124969482422,-17.31606674194336,-1.5190582275390625,14067712,EleutherAI/pythia-14m,step81000,seed1,1,81000
They liked the afternoon lunch.,lunch,lunch,They liked the lunch afternoon., afternoon lunch, lunch afternoon,afternoon,True,-15.638689041137695,-18.15597152709961,2.517282485961914,14067712,EleutherAI/pythia-14m,step81000,seed1,1,81000
He liked the flea market.,market,market,He liked the market flea., flea market, market flea,flea,True,-20.665477752685547,-24.229095458984375,3.563617706298828,14067712,EleutherAI/pythia-14m,step81000,seed1,1,81000
He liked the fish market.,market,market,He liked the market fish., fish market, market fish,fish,True,-16.33479118347168,-19.11292266845703,2.7781314849853516,14067712,EleutherAI/pythia-14m,step81000,seed1,1,81000
He liked the housing market.,market,market,He liked the market housing., housing market, market housing,housing,True,-13.811599731445312,-18.27307891845703,4.461479187011719,14067712,EleutherAI/pythia-14m,step81000,seed1,1,81000
It was a lit match.,match,match,It was a match lit., lit match, match lit,lit,False,-22.34773063659668,-20.382741928100586,-1.9649887084960938,14067712,EleutherAI/pythia-14m,step81000,seed1,1,81000
It was a burning match.,match,match,It was a match burning., burning match, match burning,burning,False,-18.25326919555664,-19.881750106811523,1.6284809112548828,14067712,EleutherAI/pythia-14m,step81000,seed1,1,81000
It was a soccer match.,match,match,It was a match soccer., soccer match, match soccer,soccer,True,-15.608963012695312,-21.21321678161621,5.604253768920898,14067712,EleutherAI/pythia-14m,step81000,seed1,1,81000
It was cough medicine.,medicine,medicine,It was medicine cough., cough medicine, medicine cough,cough,True,-23.05017852783203,-22.039817810058594,-1.0103607177734375,14067712,EleutherAI/pythia-14m,step81000,seed1,1,81000
It was prescription medicine.,medicine,medicine,It was medicine prescription., prescription medicine, medicine prescription,prescription,True,-18.150503158569336,-21.243980407714844,3.093477249145508,14067712,EleutherAI/pythia-14m,step81000,seed1,1,81000
It was orthopedic medicine.,medicine,medicine,It was medicine orthopedic., orthopedic medicine, medicine orthopedic,orthopedic,False,-19.304866790771484,-23.840808868408203,4.535942077636719,14067712,EleutherAI/pythia-14m,step81000,seed1,1,81000
There was a phone message.,message,message,There was a message phone., phone message, message phone,phone,True,-15.417150497436523,-17.761674880981445,2.344524383544922,14067712,EleutherAI/pythia-14m,step81000,seed1,1,81000
There was a computer message.,message,message,There was a message computer., computer message, message computer,computer,True,-18.49968147277832,-20.523637771606445,2.023956298828125,14067712,EleutherAI/pythia-14m,step81000,seed1,1,81000
There was an urgent message.,message,message,There was an message urgent., urgent message, message urgent,urgent,False,-13.08433723449707,-24.60769271850586,11.523355484008789,14067712,EleutherAI/pythia-14m,step81000,seed1,1,81000
It was a fungal mold.,mold,mold,It was a mold fungal., fungal mold, mold fungal,fungal,False,-18.392398834228516,-23.254287719726562,4.861888885498047,14067712,EleutherAI/pythia-14m,step81000,seed1,1,81000
It was a harmful mold.,mold,mold,It was a mold harmful., harmful mold, mold harmful,harmful,False,-21.882328033447266,-25.575485229492188,3.693157196044922,14067712,EleutherAI/pythia-14m,step81000,seed1,1,81000
It was a rubber mold.,mold,mold,It was a mold rubber., rubber mold, mold rubber,rubber,True,-16.375789642333984,-21.244293212890625,4.868503570556641,14067712,EleutherAI/pythia-14m,step81000,seed1,1,81000
She saw the cancerous mole.,mole,mole,She saw the mole cancerous., cancerous mole, mole cancerous,cancerous,False,-25.266111373901367,-31.813316345214844,6.547204971313477,14067712,EleutherAI/pythia-14m,step81000,seed1,1,81000
She saw the raised mole.,mole,mole,She saw the mole raised., raised mole, mole raised,raised,False,-19.708595275878906,-21.519641876220703,1.8110466003417969,14067712,EleutherAI/pythia-14m,step81000,seed1,1,81000
She saw the cute mole.,mole,mole,She saw the mole cute., cute mole, mole cute,cute,False,-21.166278839111328,-25.006061553955078,3.83978271484375,14067712,EleutherAI/pythia-14m,step81000,seed1,1,81000
He liked the rhythmic movement.,movement,movement,He liked the movement rhythmic., rhythmic movement, movement rhythmic,rhythmic,False,-16.500097274780273,-23.1290340423584,6.628936767578125,14067712,EleutherAI/pythia-14m,step81000,seed1,1,81000
He liked the graceful movement.,movement,movement,He liked the movement graceful., graceful movement, movement graceful,graceful,False,-18.808074951171875,-23.86220932006836,5.054134368896484,14067712,EleutherAI/pythia-14m,step81000,seed1,1,81000
He liked the feminist movement.,movement,movement,He liked the movement feminist., feminist movement, movement feminist,feminist,True,-14.216634750366211,-22.576778411865234,8.360143661499023,14067712,EleutherAI/pythia-14m,step81000,seed1,1,81000
It was a national newspaper.,newspaper,newspaper,It was a newspaper national., national newspaper, newspaper national,national,False,-14.609506607055664,-19.751564025878906,5.142057418823242,14067712,EleutherAI/pythia-14m,step81000,seed1,1,81000
It was a daily newspaper.,newspaper,newspaper,It was a newspaper daily., daily newspaper, newspaper daily,daily,False,-15.285001754760742,-18.334129333496094,3.0491275787353516,14067712,EleutherAI/pythia-14m,step81000,seed1,1,81000
It was a faded newspaper.,newspaper,newspaper,It was a newspaper faded., faded newspaper, newspaper faded,faded,False,-21.644289016723633,-21.920921325683594,0.27663230895996094,14067712,EleutherAI/pythia-14m,step81000,seed1,1,81000
It was a juicy orange.,orange,orange,It was an orange juicy., juicy orange, orange juicy,juicy,False,-18.521194458007812,-18.71541404724121,0.19421958923339844,14067712,EleutherAI/pythia-14m,step81000,seed1,1,81000
It was a ripe orange.,orange,orange,It was an orange ripe., ripe orange, orange ripe,ripe,False,-18.556209564208984,-16.63427734375,-1.9219322204589844,14067712,EleutherAI/pythia-14m,step81000,seed1,1,81000
It was a bright orange.,orange,orange,It was an orange bright., bright orange, orange bright,bright,False,-12.986981391906738,-15.286696434020996,2.299715042114258,14067712,EleutherAI/pythia-14m,step81000,seed1,1,81000
He saw the young page.,page,page,He saw the page young., young page, page young,young,False,-15.848180770874023,-19.40163803100586,3.553457260131836,14067712,EleutherAI/pythia-14m,step81000,seed1,1,81000
He saw the loyal page.,page,page,He saw the page loyal., loyal page, page loyal,loyal,False,-22.281471252441406,-21.447811126708984,-0.8336601257324219,14067712,EleutherAI/pythia-14m,step81000,seed1,1,81000
He saw the blank page.,page,page,He saw the page blank., blank page, page blank,blank,False,-14.641733169555664,-16.82162094116211,2.1798877716064453,14067712,EleutherAI/pythia-14m,step81000,seed1,1,81000
It was a calloused palm.,palm,palm,It was a palm calloused., calloused palm, palm calloused,calloused,False,-29.115564346313477,-29.568378448486328,0.45281410217285156,14067712,EleutherAI/pythia-14m,step81000,seed1,1,81000
It was a wrinkled palm.,palm,palm,It was a palm wrinkled., wrinkled palm, palm wrinkled,wrinkled,False,-19.697072982788086,-23.51201057434082,3.8149375915527344,14067712,EleutherAI/pythia-14m,step81000,seed1,1,81000
It was a tropical palm.,palm,palm,It was a palm tropical., tropical palm, palm tropical,tropical,False,-19.002758026123047,-21.59436798095703,2.5916099548339844,14067712,EleutherAI/pythia-14m,step81000,seed1,1,81000
It was a control panel.,panel,panel,It was a panel control., control panel, panel control,control,True,-15.081997871398926,-19.68111228942871,4.599114418029785,14067712,EleutherAI/pythia-14m,step81000,seed1,1,81000
It was an instrument panel.,panel,panel,It was an panel instrument., instrument panel, panel instrument,instrument,False,-16.798748016357422,-27.096954345703125,10.298206329345703,14067712,EleutherAI/pythia-14m,step81000,seed1,1,81000
It was an advisory panel.,panel,panel,It was an panel advisory., advisory panel, panel advisory,advisory,False,-14.202665328979492,-28.353363037109375,14.150697708129883,14067712,EleutherAI/pythia-14m,step81000,seed1,1,81000
It was a secret passage.,passage,passage,It was a passage secret., secret passage, passage secret,secret,False,-17.2745361328125,-22.944259643554688,5.6697235107421875,14067712,EleutherAI/pythia-14m,step81000,seed1,1,81000
It was a narrow passage.,passage,passage,It was a passage narrow., narrow passage, passage narrow,narrow,False,-15.257820129394531,-22.21697998046875,6.959159851074219,14067712,EleutherAI/pythia-14m,step81000,seed1,1,81000
It was a literary passage.,passage,passage,It was a passage literary., literary passage, passage literary,literary,False,-16.764867782592773,-24.173385620117188,7.408517837524414,14067712,EleutherAI/pythia-14m,step81000,seed1,1,81000
It was a tasty perch.,perch,perch,It was a perch tasty., tasty perch, perch tasty,tasty,False,-22.75754165649414,-27.379104614257812,4.621562957763672,14067712,EleutherAI/pythia-14m,step81000,seed1,1,81000
It was a freshwater perch.,perch,perch,It was a perch freshwater., freshwater perch, perch freshwater,freshwater,True,-23.846538543701172,-29.328521728515625,5.481983184814453,14067712,EleutherAI/pythia-14m,step81000,seed1,1,81000
It was a lofty perch.,perch,perch,It was a perch lofty., lofty perch, perch lofty,lofty,False,-24.684480667114258,-27.444854736328125,2.760374069213867,14067712,EleutherAI/pythia-14m,step81000,seed1,1,81000
He saw the fast pitcher.,pitcher,pitcher,He saw the pitcher fast., fast pitcher, pitcher fast,fast,False,-21.438871383666992,-18.96131134033203,-2.477560043334961,14067712,EleutherAI/pythia-14m,step81000,seed1,1,81000
He saw the right-handed pitcher.,pitcher,pitcher,He saw the pitcher right-handed., right-handed pitcher, pitcher right-handed,right-handed,False,-18.550613403320312,-21.631427764892578,3.0808143615722656,14067712,EleutherAI/pythia-14m,step81000,seed1,1,81000
He saw the glass pitcher.,pitcher,pitcher,He saw the pitcher glass., glass pitcher, pitcher glass,glass,True,-18.44796371459961,-21.643590927124023,3.195627212524414,14067712,EleutherAI/pythia-14m,step81000,seed1,1,81000
It was a windy port.,port,port,It was a port windy., windy port, port windy,windy,False,-21.566144943237305,-22.485719680786133,0.9195747375488281,14067712,EleutherAI/pythia-14m,step81000,seed1,1,81000
It was a seaside port.,port,port,It was a port seaside., seaside port, port seaside,seaside,True,-21.70869255065918,-27.92853546142578,6.219842910766602,14067712,EleutherAI/pythia-14m,step81000,seed1,1,81000
It was a delicious port.,port,port,It was a port delicious., delicious port, port delicious,delicious,False,-19.851524353027344,-25.74835968017578,5.8968353271484375,14067712,EleutherAI/pythia-14m,step81000,seed1,1,81000
He was in a distinguished position.,position,position,He was in a position distinguished., distinguished position, position distinguished,distinguished,False,-13.244330406188965,-18.213741302490234,4.9694108963012695,14067712,EleutherAI/pythia-14m,step81000,seed1,1,81000
He was in a prominent position.,position,position,He was in a position prominent., prominent position, position prominent,prominent,False,-12.142669677734375,-19.175594329833984,7.032924652099609,14067712,EleutherAI/pythia-14m,step81000,seed1,1,81000
He was in a fetal position.,position,position,He was in a position fetal., fetal position, position fetal,fetal,False,-18.31162452697754,-22.87136459350586,4.55974006652832,14067712,EleutherAI/pythia-14m,step81000,seed1,1,81000
It was a wooden post.,post,post,It was a post wooden., wooden post, post wooden,wooden,False,-16.912845611572266,-22.08820915222168,5.175363540649414,14067712,EleutherAI/pythia-14m,step81000,seed1,1,81000
It was a fence post.,post,post,It was a post fence., fence post, post fence,fence,True,-18.65355110168457,-21.226346969604492,2.572795867919922,14067712,EleutherAI/pythia-14m,step81000,seed1,1,81000
It was a teaching post.,post,post,It was a post teaching., teaching post, post teaching,teaching,True,-17.261526107788086,-17.14954948425293,-0.11197662353515625,14067712,EleutherAI/pythia-14m,step81000,seed1,1,81000
He had the alcoholic punch.,punch,punch,He had the punch alcoholic., alcoholic punch, punch alcoholic,alcoholic,False,-20.635990142822266,-26.635021209716797,5.999031066894531,14067712,EleutherAI/pythia-14m,step81000,seed1,1,81000
He had the fruit punch.,punch,punch,He had the punch fruit., fruit punch, punch fruit,fruit,True,-18.966930389404297,-22.446697235107422,3.479766845703125,14067712,EleutherAI/pythia-14m,step81000,seed1,1,81000
He had the strongest punch.,punch,punch,He had the punch strongest., strongest punch, punch strongest,strongest,False,-16.717086791992188,-23.042308807373047,6.325222015380859,14067712,EleutherAI/pythia-14m,step81000,seed1,1,81000
She had a brilliant pupil.,pupil,pupil,She had a pupil brilliant., brilliant pupil, pupil brilliant,brilliant,False,-16.996225357055664,-23.765100479125977,6.7688751220703125,14067712,EleutherAI/pythia-14m,step81000,seed1,1,81000
She had an interested pupil.,pupil,pupil,She had an pupil interested., interested pupil, pupil interested,interested,False,-20.007802963256836,-23.94143295288086,3.9336299896240234,14067712,EleutherAI/pythia-14m,step81000,seed1,1,81000
She had a dilated pupil.,pupil,pupil,She had a pupil dilated., dilated pupil, pupil dilated,dilated,False,-20.432361602783203,-24.247156143188477,3.8147945404052734,14067712,EleutherAI/pythia-14m,step81000,seed1,1,81000
That was a loud racket.,racket,racket,That was a racket loud., loud racket, racket loud,loud,False,-18.012706756591797,-25.295475006103516,7.282768249511719,14067712,EleutherAI/pythia-14m,step81000,seed1,1,81000
That was an annoying racket.,racket,racket,That was an racket annoying., annoying racket, racket annoying,annoying,False,-17.002853393554688,-26.981033325195312,9.978179931640625,14067712,EleutherAI/pythia-14m,step81000,seed1,1,81000
That was a badminton racket.,racket,racket,That was a racket badminton., badminton racket, racket badminton,badminton,True,-30.040145874023438,-32.441497802734375,2.4013519287109375,14067712,EleutherAI/pythia-14m,step81000,seed1,1,81000
He liked electronic rock.,rock,rock,He liked rock electronic., electronic rock, rock electronic,electronic,False,-22.655925750732422,-23.800621032714844,1.1446952819824219,14067712,EleutherAI/pythia-14m,step81000,seed1,1,81000
He liked alternative rock.,rock,rock,He liked rock alternative., alternative rock, rock alternative,alternative,False,-21.541440963745117,-25.23914337158203,3.697702407836914,14067712,EleutherAI/pythia-14m,step81000,seed1,1,81000
He liked limestone rock.,rock,rock,He liked rock limestone., limestone rock, rock limestone,limestone,True,-21.22889518737793,-23.227622985839844,1.998727798461914,14067712,EleutherAI/pythia-14m,step81000,seed1,1,81000
He saw the wise sage.,sage,sage,He saw the sage wise., wise sage, sage wise,wise,False,-20.746177673339844,-20.622577667236328,-0.12360000610351562,14067712,EleutherAI/pythia-14m,step81000,seed1,1,81000
He saw the renowned sage.,sage,sage,He saw the sage renowned., renowned sage, sage renowned,renowned,False,-21.615184783935547,-22.08157730102539,0.46639251708984375,14067712,EleutherAI/pythia-14m,step81000,seed1,1,81000
He saw the fragrant sage.,sage,sage,He saw the sage fragrant., fragrant sage, sage fragrant,fragrant,False,-22.77703857421875,-22.395090103149414,-0.38194847106933594,14067712,EleutherAI/pythia-14m,step81000,seed1,1,81000
It was a fish scale.,scale,scale,It was a scale fish., fish scale, scale fish,fish,True,-19.299015045166016,-22.01531219482422,2.716297149658203,14067712,EleutherAI/pythia-14m,step81000,seed1,1,81000
It was a lizard scale.,scale,scale,It was a scale lizard., lizard scale, scale lizard,lizard,True,-23.393653869628906,-25.820186614990234,2.426532745361328,14067712,EleutherAI/pythia-14m,step81000,seed1,1,81000
It was a music scale.,scale,scale,It was a scale music., music scale, scale music,music,True,-16.287269592285156,-19.78185272216797,3.4945831298828125,14067712,EleutherAI/pythia-14m,step81000,seed1,1,81000
It was a touching scene.,scene,scene,It was a scene touching., touching scene, scene touching,touching,False,-14.092388153076172,-15.974004745483398,1.8816165924072266,14067712,EleutherAI/pythia-14m,step81000,seed1,1,81000
It was a well-acted scene.,scene,scene,It was a scene well-acted., well-acted scene, scene well-acted,well-acted,False,-23.57908821105957,-29.577428817749023,5.998340606689453,14067712,EleutherAI/pythia-14m,step81000,seed1,1,81000
It was a nature scene.,scene,scene,It was a scene nature., nature scene, scene nature,nature,True,-16.880712509155273,-19.02351951599121,2.1428070068359375,14067712,EleutherAI/pythia-14m,step81000,seed1,1,81000
It was a gold seal.,seal,seal,It was a seal gold., gold seal, seal gold,gold,True,-15.713083267211914,-22.43335723876953,6.720273971557617,14067712,EleutherAI/pythia-14m,step81000,seed1,1,81000
It was a certified seal.,seal,seal,It was a seal certified., certified seal, seal certified,certified,False,-18.034526824951172,-21.600059509277344,3.565532684326172,14067712,EleutherAI/pythia-14m,step81000,seed1,1,81000
It was a circus seal.,seal,seal,It was a seal circus., circus seal, seal circus,circus,True,-23.498493194580078,-23.980308532714844,0.4818153381347656,14067712,EleutherAI/pythia-14m,step81000,seed1,1,81000
He used the scotch tape.,tape,tape,He used the tape scotch., scotch tape, tape scotch,scotch,True,-25.197099685668945,-26.974042892456055,1.7769432067871094,14067712,EleutherAI/pythia-14m,step81000,seed1,1,81000
He used the double-sided tape.,tape,tape,He used the tape double-sided., double-sided tape, tape double-sided,double-sided,False,-18.303936004638672,-24.02004623413086,5.7161102294921875,14067712,EleutherAI/pythia-14m,step81000,seed1,1,81000
He used the interview tape.,tape,tape,He used the tape interview., interview tape, tape interview,interview,True,-16.55271339416504,-20.62066650390625,4.067953109741211,14067712,EleutherAI/pythia-14m,step81000,seed1,1,81000
It was a winter term.,term,term,It was a term winter., winter term, term winter,winter,True,-16.83186149597168,-23.99127197265625,7.15941047668457,14067712,EleutherAI/pythia-14m,step81000,seed1,1,81000
