sentence,word,string,reversed_sentence,mod_np,reversed_mod,disambiguating_word,non_adjective,original_logprob,reversed_logprob,ratio,n_params,mpath,revision,seed_name,seed,step
It was a fall term.,term,term,It was a term fall., fall term, term fall,fall,True,-15.980697631835938,-18.557106018066406,2.5764083862304688,14067712,EleutherAI/pythia-14m,step95000,seed4,4,95000
It was a legal term.,term,term,It was a term legal., legal term, term legal,legal,False,-14.027997016906738,-18.136817932128906,4.108820915222168,14067712,EleutherAI/pythia-14m,step95000,seed4,4,95000
It was a clock tick.,tick,tick,It was a tick clock., clock tick, tick clock,clock,True,-14.865682601928711,-18.99496841430664,4.12928581237793,14067712,EleutherAI/pythia-14m,step95000,seed4,4,95000
It was an audible tick.,tick,tick,It was an tick audible., audible tick, tick audible,audible,False,-18.980968475341797,-24.57266616821289,5.591697692871094,14067712,EleutherAI/pythia-14m,step95000,seed4,4,95000
It was a parasitic tick.,tick,tick,It was a tick parasitic., parasitic tick, tick parasitic,parasitic,False,-19.548885345458984,-23.21694564819336,3.668060302734375,14067712,EleutherAI/pythia-14m,step95000,seed4,4,95000
It was a generous tip.,tip,tip,It was a tip generous., generous tip, tip generous,generous,False,-19.213369369506836,-24.406381607055664,5.193012237548828,14067712,EleutherAI/pythia-14m,step95000,seed4,4,95000
It was a stingy tip.,tip,tip,It was a tip stingy., stingy tip, tip stingy,stingy,False,-23.115215301513672,-28.154443740844727,5.039228439331055,14067712,EleutherAI/pythia-14m,step95000,seed4,4,95000
It was a pencil tip.,tip,tip,It was a tip pencil., pencil tip, tip pencil,pencil,True,-18.762794494628906,-21.43034553527832,2.667551040649414,14067712,EleutherAI/pythia-14m,step95000,seed4,4,95000
She liked the essay title.,title,title,She liked the title essay., essay title, title essay,essay,True,-20.617862701416016,-18.447345733642578,-2.1705169677734375,14067712,EleutherAI/pythia-14m,step95000,seed4,4,95000
She liked the poem title.,title,title,She liked the title poem., poem title, title poem,poem,True,-20.0659236907959,-19.22817611694336,-0.8377475738525391,14067712,EleutherAI/pythia-14m,step95000,seed4,4,95000
She liked the academic title.,title,title,She liked the title academic., academic title, title academic,academic,False,-17.4766788482666,-21.603267669677734,4.126588821411133,14067712,EleutherAI/pythia-14m,step95000,seed4,4,95000
It was a costly toll.,toll,toll,It was a toll costly., costly toll, toll costly,costly,False,-20.348175048828125,-22.65312957763672,2.3049545288085938,14067712,EleutherAI/pythia-14m,step95000,seed4,4,95000
It was a road toll.,toll,toll,It was a toll road., road toll, toll road,road,True,-16.681934356689453,-18.334327697753906,1.6523933410644531,14067712,EleutherAI/pythia-14m,step95000,seed4,4,95000
It was a loud toll.,toll,toll,It was a toll loud., loud toll, toll loud,loud,False,-20.954570770263672,-20.729835510253906,-0.22473526000976562,14067712,EleutherAI/pythia-14m,step95000,seed4,4,95000
She saw the train tracks.,track,tracks,She saw the tracks train., train tracks, tracks train,train,True,-16.86720085144043,-21.511295318603516,4.644094467163086,14067712,EleutherAI/pythia-14m,step95000,seed4,4,95000
She saw the trolley tracks.,track,tracks,She saw the tracks trolley., trolley tracks, tracks trolley,trolley,True,-24.584754943847656,-24.070274353027344,-0.5144805908203125,14067712,EleutherAI/pythia-14m,step95000,seed4,4,95000
She saw the moose tracks.,track,tracks,She saw the tracks moose., moose tracks, tracks moose,moose,False,-27.401954650878906,-27.105682373046875,-0.29627227783203125,14067712,EleutherAI/pythia-14m,step95000,seed4,4,95000
It was five yards.,yard,yards,It was yards five., five yards, yards five,five,True,-17.00308609008789,-26.487232208251953,9.484146118164062,14067712,EleutherAI/pythia-14m,step95000,seed4,4,95000
It was ten yards.,yard,yards,It was yards ten., ten yards, yards ten,ten,True,-15.181424140930176,-27.736492156982422,12.555068016052246,14067712,EleutherAI/pythia-14m,step95000,seed4,4,95000
They were big yards.,yard,yards,They were yards big., big yards, yards big,big,False,-19.60578155517578,-24.358692169189453,4.752910614013672,14067712,EleutherAI/pythia-14m,step95000,seed4,4,95000
It was a comedic act.,act,act,It was an act comedic., comedic act, act comedic,comedic,False,-19.395538330078125,-22.646135330200195,3.2505970001220703,14067712,EleutherAI/pythia-14m,step95000,seed4,4,95000
He had a pending appeal.,appeal,appeal,He had an appeal pending., pending appeal, appeal pending,pending,False,-15.685654640197754,-16.45147132873535,0.7658166885375977,14067712,EleutherAI/pythia-14m,step95000,seed4,4,95000
It was a polluted atmosphere.,atmosphere,atmosphere,It was an atmosphere polluted., polluted atmosphere, atmosphere polluted,polluted,False,-23.436843872070312,-25.075607299804688,1.638763427734375,14067712,EleutherAI/pythia-14m,step95000,seed4,4,95000
It was a country band.,band,band,It was a band country., country band, band country,country,True,-16.444931030273438,-19.83810806274414,3.393177032470703,14067712,EleutherAI/pythia-14m,step95000,seed4,4,95000
There was a religious barrier.,barrier,barrier,There was a barrier religious., religious barrier, barrier religious,religious,False,-19.28899574279785,-23.10348892211914,3.814493179321289,14067712,EleutherAI/pythia-14m,step95000,seed4,4,95000
He saw a baseball bat.,bat,bat,He saw a bat baseball., baseball bat, bat baseball,baseball,True,-12.090009689331055,-17.678466796875,5.588457107543945,14067712,EleutherAI/pythia-14m,step95000,seed4,4,95000
He saw the balance beam.,beam,beam,He saw the beam balance., balance beam, beam balance,balance,True,-19.201404571533203,-22.44295310974121,3.241548538208008,14067712,EleutherAI/pythia-14m,step95000,seed4,4,95000
She had a writer's block.,block,block,She had a block writer's., writer's block, block writer's,writer,True,-22.311969757080078,-22.684358596801758,0.3723888397216797,14067712,EleutherAI/pythia-14m,step95000,seed4,4,95000
He has royal blood.,blood,blood,He has blood royal., royal blood, blood royal,royal,False,-20.101558685302734,-26.499418258666992,6.397859573364258,14067712,EleutherAI/pythia-14m,step95000,seed4,4,95000
It was the school board.,board,board,It was the board school., school board, board school,school,True,-13.115114212036133,-18.160951614379883,5.04583740234375,14067712,EleutherAI/pythia-14m,step95000,seed4,4,95000
He had a leather-bound book.,book,book,He had a book leather-bound., leather-bound book, book leather-bound,leather-bound,False,-26.345993041992188,-28.799455642700195,2.453462600708008,14067712,EleutherAI/pythia-14m,step95000,seed4,4,95000
They ate a lonely breakfast.,breakfast,breakfast,They ate a breakfast lonely., lonely breakfast, breakfast lonely,lonely,False,-15.589964866638184,-20.449262619018555,4.859297752380371,14067712,EleutherAI/pythia-14m,step95000,seed4,4,95000
It was an island cape.,cape,cape,It was an cape island., island cape, cape island,island,True,-21.963058471679688,-23.52639389038086,1.5633354187011719,14067712,EleutherAI/pythia-14m,step95000,seed4,4,95000
It was a criminal case.,case,case,It was a case criminal., criminal case, case criminal,criminal,False,-12.446615219116211,-18.58111572265625,6.134500503540039,14067712,EleutherAI/pythia-14m,step95000,seed4,4,95000
It was a primary cause.,cause,cause,It was a cause primary., primary cause, cause primary,primary,False,-13.152297973632812,-18.619874954223633,5.46757698059082,14067712,EleutherAI/pythia-14m,step95000,seed4,4,95000
It was a jail cell.,cell,cell,It was a cell jail., jail cell, cell jail,jail,True,-14.611505508422852,-20.107906341552734,5.496400833129883,14067712,EleutherAI/pythia-14m,step95000,seed4,4,95000
She had a good-luck charm.,charm,charm,She had a charm good-luck., good-luck charm, charm good-luck,good-luck,False,-28.308191299438477,-31.69910430908203,3.3909130096435547,14067712,EleutherAI/pythia-14m,step95000,seed4,4,95000
They liked the pet chicken.,chicken,chicken,They liked the chicken pet., pet chicken, chicken pet,pet,True,-19.923473358154297,-19.0670108795166,-0.8564624786376953,14067712,EleutherAI/pythia-14m,step95000,seed4,4,95000
It was a stimulating class.,class,class,It was a class stimulating., stimulating class, class stimulating,stimulating,False,-18.68692970275879,-19.70684242248535,1.0199127197265625,14067712,EleutherAI/pythia-14m,step95000,seed4,4,95000
It was a metal clip.,clip,clip,It was a clip metal., metal clip, clip metal,metal,True,-20.14175033569336,-21.986989974975586,1.8452396392822266,14067712,EleutherAI/pythia-14m,step95000,seed4,4,95000
It was a common cold.,cold,cold,It was a cold common., common cold, cold common,common,False,-17.37354278564453,-18.09023666381836,0.7166938781738281,14067712,EleutherAI/pythia-14m,step95000,seed4,4,95000
It was a marble column.,column,column,It was a column marble., marble column, column marble,marble,True,-18.376646041870117,-19.12348175048828,0.7468357086181641,14067712,EleutherAI/pythia-14m,step95000,seed4,4,95000
He liked the polite company.,company,company,He liked the company polite., polite company, company polite,polite,False,-18.81096649169922,-22.23311996459961,3.4221534729003906,14067712,EleutherAI/pythia-14m,step95000,seed4,4,95000
It was a traffic cone.,cone,cone,It was a cone traffic., traffic cone, cone traffic,traffic,True,-17.39764404296875,-20.984106063842773,3.5864620208740234,14067712,EleutherAI/pythia-14m,step95000,seed4,4,95000
He made a well-written contribution.,contribution,contribution,He made a contribution well-written., well-written contribution, contribution well-written,well-written,False,-24.018735885620117,-28.963579177856445,4.944843292236328,14067712,EleutherAI/pythia-14m,step95000,seed4,4,95000
That was the correct count.,count,count,That was the count correct., correct count, count correct,correct,False,-15.288708686828613,-17.465972900390625,2.1772642135620117,14067712,EleutherAI/pythia-14m,step95000,seed4,4,95000
It was a collision course.,course,course,It was a course collision., collision course, course collision,collision,True,-13.000545501708984,-20.125324249267578,7.124778747558594,14067712,EleutherAI/pythia-14m,step95000,seed4,4,95000
It was a historical date.,date,date,It was a date historical., historical date, date historical,historical,False,-14.14933967590332,-19.269535064697266,5.120195388793945,14067712,EleutherAI/pythia-14m,step95000,seed4,4,95000
It was about college degrees.,degree,degrees,It was about degrees college., college degrees, degrees college,college,True,-16.632762908935547,-22.745351791381836,6.112588882446289,14067712,EleutherAI/pythia-14m,step95000,seed4,4,95000
They liked the architectural design.,design,design,They liked the design architectural., architectural design, design architectural,architectural,False,-15.872556686401367,-19.788799285888672,3.9162425994873047,14067712,EleutherAI/pythia-14m,step95000,seed4,4,95000
They liked the anniversary dinner.,dinner,dinner,They liked the dinner anniversary., anniversary dinner, dinner anniversary,anniversary,True,-23.71872329711914,-22.034351348876953,-1.6843719482421875,14067712,EleutherAI/pythia-14m,step95000,seed4,4,95000
He had a career dream.,dream,dream,He had a dream career., career dream, dream career,career,True,-15.379446983337402,-14.5990629196167,-0.7803840637207031,14067712,EleutherAI/pythia-14m,step95000,seed4,4,95000
It was a battery-powered drill.,drill,drill,It was a drill battery-powered., battery-powered drill, drill battery-powered,battery-powered,False,-26.0357723236084,-29.418851852416992,3.3830795288085938,14067712,EleutherAI/pythia-14m,step95000,seed4,4,95000
It was a physical examination.,examination,examination,It was an examination physical., physical examination, examination physical,physical,False,-13.811698913574219,-20.872007369995117,7.060308456420898,14067712,EleutherAI/pythia-14m,step95000,seed4,4,95000
They had an enthusiastic fan.,fan,fan,They had an fan enthusiastic., enthusiastic fan, fan enthusiastic,enthusiastic,False,-14.649740219116211,-25.644332885742188,10.994592666625977,14067712,EleutherAI/pythia-14m,step95000,seed4,4,95000
She had a steel file.,file,file,She had a file steel., steel file, file steel,steel,True,-17.39959144592285,-24.532896041870117,7.133304595947266,14067712,EleutherAI/pythia-14m,step95000,seed4,4,95000
It was a plastic film.,film,film,It was a film plastic., plastic film, film plastic,plastic,False,-13.563802719116211,-19.344755172729492,5.780952453613281,14067712,EleutherAI/pythia-14m,step95000,seed4,4,95000
It was a concrete foundation.,foundation,foundation,It was a foundation concrete., concrete foundation, foundation concrete,concrete,False,-16.86227035522461,-19.84337615966797,2.9811058044433594,14067712,EleutherAI/pythia-14m,step95000,seed4,4,95000
It was a business function.,function,function,It was a function business., business function, function business,business,True,-15.012899398803711,-18.758363723754883,3.745464324951172,14067712,EleutherAI/pythia-14m,step95000,seed4,4,95000
He was on the parade ground.,ground,ground,He was on the ground parade., parade ground, ground parade,parade,True,-17.616065979003906,-16.046573638916016,-1.5694923400878906,14067712,EleutherAI/pythia-14m,step95000,seed4,4,95000
They liked the national guard.,guard,guard,They liked the guard national., national guard, guard national,national,False,-18.06578826904297,-23.821548461914062,5.755760192871094,14067712,EleutherAI/pythia-14m,step95000,seed4,4,95000
He had a friendly guide.,guide,guide,He had a guide friendly., friendly guide, guide friendly,friendly,False,-15.49295425415039,-21.55145835876465,6.058504104614258,14067712,EleutherAI/pythia-14m,step95000,seed4,4,95000
It was a nursing home.,home,home,It was a home nursing., nursing home, home nursing,nursing,True,-13.207113265991211,-18.54920768737793,5.342094421386719,14067712,EleutherAI/pythia-14m,step95000,seed4,4,95000
They had military intelligence.,intelligence,intelligence,They had intelligence military., military intelligence, intelligence military,military,False,-17.165863037109375,-21.375263214111328,4.209400177001953,14067712,EleutherAI/pythia-14m,step95000,seed4,4,95000
It was a special issue.,issue,issue,It was an issue special., special issue, issue special,special,False,-12.05910873413086,-16.311729431152344,4.252620697021484,14067712,EleutherAI/pythia-14m,step95000,seed4,4,95000
It was a paper jam.,jam,jam,It was a jam paper., paper jam, jam paper,paper,True,-15.099298477172852,-21.919937133789062,6.820638656616211,14067712,EleutherAI/pythia-14m,step95000,seed4,4,95000
It was a backspace key.,key,key,It was a key backspace., backspace key, key backspace,backspace,True,-24.67449188232422,-24.301132202148438,-0.37335968017578125,14067712,EleutherAI/pythia-14m,step95000,seed4,4,95000
They liked the friendly lamb.,lamb,lamb,They liked the lamb friendly., friendly lamb, lamb friendly,friendly,False,-20.51788902282715,-25.397174835205078,4.87928581237793,14067712,EleutherAI/pythia-14m,step95000,seed4,4,95000
She had door locks.,lock,locks,She had locks door., door locks, locks door,door,True,-19.080440521240234,-22.672290802001953,3.5918502807617188,14067712,EleutherAI/pythia-14m,step95000,seed4,4,95000
They liked the women's lunch.,lunch,lunch,They liked the lunch women's., women's lunch, lunch women's,women,True,-21.848167419433594,-24.149354934692383,2.301187515258789,14067712,EleutherAI/pythia-14m,step95000,seed4,4,95000
He liked the stock market.,market,market,He liked the market stock., stock market, market stock,stock,True,-12.293774604797363,-15.179780960083008,2.8860063552856445,14067712,EleutherAI/pythia-14m,step95000,seed4,4,95000
It was a tennis match.,match,match,It was a match tennis., tennis match, match tennis,tennis,True,-14.790154457092285,-19.084020614624023,4.293866157531738,14067712,EleutherAI/pythia-14m,step95000,seed4,4,95000
It was veterinary medicine.,medicine,medicine,It was medicine veterinary., veterinary medicine, medicine veterinary,veterinary,False,-18.943954467773438,-24.251644134521484,5.307689666748047,14067712,EleutherAI/pythia-14m,step95000,seed4,4,95000
There was a clear message.,message,message,There was a message clear., clear message, message clear,clear,False,-13.984769821166992,-19.515277862548828,5.530508041381836,14067712,EleutherAI/pythia-14m,step95000,seed4,4,95000
It was a clay mold.,mold,mold,It was a mold clay., clay mold, mold clay,clay,True,-17.797943115234375,-22.391380310058594,4.593437194824219,14067712,EleutherAI/pythia-14m,step95000,seed4,4,95000
She saw the fast mole.,mole,mole,She saw the mole fast., fast mole, mole fast,fast,False,-20.611289978027344,-22.48300552368164,1.8717155456542969,14067712,EleutherAI/pythia-14m,step95000,seed4,4,95000
He liked the civil-rights movement.,movement,movement,He liked the movement civil-rights., civil-rights movement, movement civil-rights,civil-rights,False,-22.70785903930664,-32.575435638427734,9.867576599121094,14067712,EleutherAI/pythia-14m,step95000,seed4,4,95000
It was a shredded newspaper.,newspaper,newspaper,It was a newspaper shredded., shredded newspaper, newspaper shredded,shredded,False,-22.06427001953125,-23.65740966796875,1.5931396484375,14067712,EleutherAI/pythia-14m,step95000,seed4,4,95000
It was a reddish orange.,orange,orange,It was an orange reddish., reddish orange, orange reddish,reddish,False,-20.689090728759766,-15.636941909790039,-5.052148818969727,14067712,EleutherAI/pythia-14m,step95000,seed4,4,95000
He saw the ripped page.,page,page,He saw the page ripped., ripped page, page ripped,ripped,False,-21.59713363647461,-18.90487289428711,-2.6922607421875,14067712,EleutherAI/pythia-14m,step95000,seed4,4,95000
It was a tree palm.,palm,palm,It was a palm tree., tree palm, palm tree,tree,True,-18.406513214111328,-13.341438293457031,-5.065074920654297,14067712,EleutherAI/pythia-14m,step95000,seed4,4,95000
It was a consumer panel.,panel,panel,It was a panel consumer., consumer panel, panel consumer,consumer,True,-18.000038146972656,-20.172649383544922,2.1726112365722656,14067712,EleutherAI/pythia-14m,step95000,seed4,4,95000
It was a biblical passage.,passage,passage,It was a passage biblical., biblical passage, passage biblical,biblical,False,-18.537796020507812,-25.739946365356445,7.202150344848633,14067712,EleutherAI/pythia-14m,step95000,seed4,4,95000
It was a secure perch.,perch,perch,It was a perch secure., secure perch, perch secure,secure,False,-23.072988510131836,-22.616878509521484,-0.45611000061035156,14067712,EleutherAI/pythia-14m,step95000,seed4,4,95000
He saw the plastic pitcher.,pitcher,pitcher,He saw the pitcher plastic., plastic pitcher, pitcher plastic,plastic,True,-20.056564331054688,-25.37073516845703,5.314170837402344,14067712,EleutherAI/pythia-14m,step95000,seed4,4,95000
It was a sweet port.,port,port,It was a port sweet., sweet port, port sweet,sweet,False,-18.115982055664062,-22.461597442626953,4.345615386962891,14067712,EleutherAI/pythia-14m,step95000,seed4,4,95000
He was in a yoga position.,position,position,He was in a position yoga., yoga position, position yoga,yoga,True,-18.84796142578125,-19.849515914916992,1.0015544891357422,14067712,EleutherAI/pythia-14m,step95000,seed4,4,95000
It was a challenging post.,post,post,It was a post challenging., challenging post, post challenging,challenging,False,-16.85265350341797,-19.63262367248535,2.779970169067383,14067712,EleutherAI/pythia-14m,step95000,seed4,4,95000
He had the quickest punch.,punch,punch,He had the punch quickest., quickest punch, punch quickest,quickest,False,-19.000259399414062,-26.323993682861328,7.323734283447266,14067712,EleutherAI/pythia-14m,step95000,seed4,4,95000
She had a cloudy pupil.,pupil,pupil,She had a pupil cloudy., cloudy pupil, pupil cloudy,cloudy,False,-25.43507957458496,-24.954391479492188,-0.48068809509277344,14067712,EleutherAI/pythia-14m,step95000,seed4,4,95000
That was a tennis racket.,racket,racket,That was a racket tennis., tennis racket, racket tennis,tennis,True,-14.416363716125488,-21.228906631469727,6.812542915344238,14067712,EleutherAI/pythia-14m,step95000,seed4,4,95000
He liked granite rock.,rock,rock,He liked rock granite., granite rock, rock granite,granite,True,-20.297870635986328,-22.93359375,2.635723114013672,14067712,EleutherAI/pythia-14m,step95000,seed4,4,95000
He saw the bushy sage.,sage,sage,He saw the sage bushy., bushy sage, sage bushy,bushy,False,-27.949771881103516,-29.277225494384766,1.32745361328125,14067712,EleutherAI/pythia-14m,step95000,seed4,4,95000
It was a major scale.,scale,scale,It was a scale major., major scale, scale major,major,False,-12.166810989379883,-18.63067626953125,6.463865280151367,14067712,EleutherAI/pythia-14m,step95000,seed4,4,95000
It was a panoramic scene.,scene,scene,It was a scene panoramic., panoramic scene, scene panoramic,panoramic,False,-21.672199249267578,-24.00786781311035,2.3356685638427734,14067712,EleutherAI/pythia-14m,step95000,seed4,4,95000
It was a trained seal.,seal,seal,It was a seal trained., trained seal, seal trained,trained,False,-20.400314331054688,-23.946422576904297,3.5461082458496094,14067712,EleutherAI/pythia-14m,step95000,seed4,4,95000
He used the video tape.,tape,tape,He used the tape video., video tape, tape video,video,True,-15.137393951416016,-17.070663452148438,1.9332695007324219,14067712,EleutherAI/pythia-14m,step95000,seed4,4,95000
It was a technical term.,term,term,It was a term technical., technical term, term technical,technical,False,-14.186718940734863,-19.276290893554688,5.089571952819824,14067712,EleutherAI/pythia-14m,step95000,seed4,4,95000
It was a diseased tick.,tick,tick,It was a tick diseased., diseased tick, tick diseased,diseased,False,-22.16069793701172,-23.869068145751953,1.7083702087402344,14067712,EleutherAI/pythia-14m,step95000,seed4,4,95000
It was a finger tip.,tip,tip,It was a tip finger., finger tip, tip finger,finger,True,-17.99614715576172,-18.328706741333008,0.33255958557128906,14067712,EleutherAI/pythia-14m,step95000,seed4,4,95000
She liked the professional title.,title,title,She liked the title professional., professional title, title professional,professional,False,-17.29310417175293,-19.38962173461914,2.096517562866211,14067712,EleutherAI/pythia-14m,step95000,seed4,4,95000
It was a bell toll.,toll,toll,It was a toll bell., bell toll, toll bell,bell,True,-21.35902976989746,-22.710494995117188,1.3514652252197266,14067712,EleutherAI/pythia-14m,step95000,seed4,4,95000
She saw the snowshoe tracks.,track,tracks,She saw the tracks snowshoe., snowshoe tracks, tracks snowshoe,snowshoe,True,-29.198413848876953,-31.861780166625977,2.6633663177490234,14067712,EleutherAI/pythia-14m,step95000,seed4,4,95000
They were cluttered yards.,yard,yards,They were yards cluttered., cluttered yards, yards cluttered,cluttered,False,-25.799531936645508,-27.884498596191406,2.0849666595458984,14067712,EleutherAI/pythia-14m,step95000,seed4,4,95000
