sentence,word,string,reversed_sentence,mod_np,reversed_mod,disambiguating_word,non_adjective,original_logprob,reversed_logprob,ratio,n_params,mpath,revision,seed_name,seed,step
It was a social function.,function,function,It was a function social., social function, function social,social,False,-16.038440704345703,-21.34209442138672,5.303653717041016,14067712,EleutherAI/pythia-14m,step29000,seed7,7,29000
He was on the firm ground.,ground,ground,He was on the ground firm., firm ground, ground firm,firm,False,-15.846973419189453,-19.254671096801758,3.4076976776123047,14067712,EleutherAI/pythia-14m,step29000,seed7,7,29000
He was on the frozen ground.,ground,ground,He was on the ground frozen., frozen ground, ground frozen,frozen,False,-15.374255180358887,-19.632125854492188,4.257870674133301,14067712,EleutherAI/pythia-14m,step29000,seed7,7,29000
He was on the camp ground.,ground,ground,He was on the ground camp., camp ground, ground camp,camp,True,-19.61109733581543,-15.218465805053711,-4.392631530761719,14067712,EleutherAI/pythia-14m,step29000,seed7,7,29000
They liked the night guard.,guard,guard,They liked the guard night., night guard, guard night,night,True,-17.46646499633789,-18.23737144470215,0.7709064483642578,14067712,EleutherAI/pythia-14m,step29000,seed7,7,29000
They liked the security guard.,guard,guard,They liked the guard security., security guard, guard security,security,True,-14.598175048828125,-18.65057945251465,4.052404403686523,14067712,EleutherAI/pythia-14m,step29000,seed7,7,29000
They liked the coast guard.,guard,guard,They liked the guard coast., coast guard, guard coast,coast,True,-19.717479705810547,-24.477848052978516,4.760368347167969,14067712,EleutherAI/pythia-14m,step29000,seed7,7,29000
He had an assembly guide.,guide,guide,He had an guide assembly., assembly guide, guide assembly,assembly,True,-19.024314880371094,-25.283443450927734,6.259128570556641,14067712,EleutherAI/pythia-14m,step29000,seed7,7,29000
He had a TV guide.,guide,guide,He had a guide TV., TV guide, guide TV,TV,True,-18.855567932128906,-22.547508239746094,3.6919403076171875,14067712,EleutherAI/pythia-14m,step29000,seed7,7,29000
He had a talkative guide.,guide,guide,He had a guide talkative., talkative guide, guide talkative,talkative,False,-22.051597595214844,-26.267667770385742,4.216070175170898,14067712,EleutherAI/pythia-14m,step29000,seed7,7,29000
It was a summer home.,home,home,It was a home summer., summer home, home summer,summer,True,-12.627346992492676,-18.623207092285156,5.9958600997924805,14067712,EleutherAI/pythia-14m,step29000,seed7,7,29000
It was a childhood home.,home,home,It was a home childhood., childhood home, home childhood,childhood,True,-13.475217819213867,-21.2132625579834,7.738044738769531,14067712,EleutherAI/pythia-14m,step29000,seed7,7,29000
It was a funeral home.,home,home,It was a home funeral., funeral home, home funeral,funeral,False,-14.27877426147461,-21.023357391357422,6.7445831298828125,14067712,EleutherAI/pythia-14m,step29000,seed7,7,29000
They had natural intelligence.,intelligence,intelligence,They had intelligence natural., natural intelligence, intelligence natural,natural,False,-16.22826385498047,-21.776552200317383,5.548288345336914,14067712,EleutherAI/pythia-14m,step29000,seed7,7,29000
They had innate intelligence.,intelligence,intelligence,They had intelligence innate., innate intelligence, intelligence innate,innate,False,-17.04281997680664,-24.431978225708008,7.389158248901367,14067712,EleutherAI/pythia-14m,step29000,seed7,7,29000
They had classified intelligence.,intelligence,intelligence,They had intelligence classified., classified intelligence, intelligence classified,classified,False,-17.98581314086914,-19.97056770324707,1.9847545623779297,14067712,EleutherAI/pythia-14m,step29000,seed7,7,29000
It was a sensitive issue.,issue,issue,It was an issue sensitive., sensitive issue, issue sensitive,sensitive,False,-16.07735252380371,-20.8692684173584,4.7919158935546875,14067712,EleutherAI/pythia-14m,step29000,seed7,7,29000
It was a political issue.,issue,issue,It was an issue political., political issue, issue political,political,False,-13.093137741088867,-16.698646545410156,3.605508804321289,14067712,EleutherAI/pythia-14m,step29000,seed7,7,29000
It was a weekly issue.,issue,issue,It was an issue weekly., weekly issue, issue weekly,weekly,False,-17.816211700439453,-20.79693603515625,2.980724334716797,14067712,EleutherAI/pythia-14m,step29000,seed7,7,29000
It was a blackberry jam.,jam,jam,It was a jam blackberry., blackberry jam, jam blackberry,blackberry,True,-19.172040939331055,-27.80350685119629,8.631465911865234,14067712,EleutherAI/pythia-14m,step29000,seed7,7,29000
It was a peach jam.,jam,jam,It was a jam peach., peach jam, jam peach,peach,False,-23.887126922607422,-24.043994903564453,0.15686798095703125,14067712,EleutherAI/pythia-14m,step29000,seed7,7,29000
It was a traffic jam.,jam,jam,It was a jam traffic., traffic jam, jam traffic,traffic,True,-15.591180801391602,-22.06593894958496,6.474758148193359,14067712,EleutherAI/pythia-14m,step29000,seed7,7,29000
It was a duplicate key.,key,key,It was a key duplicate., duplicate key, key duplicate,duplicate,False,-17.32269287109375,-16.543519973754883,-0.7791728973388672,14067712,EleutherAI/pythia-14m,step29000,seed7,7,29000
It was a master key.,key,key,It was a key master., master key, key master,master,True,-16.337913513183594,-15.177597045898438,-1.1603164672851562,14067712,EleutherAI/pythia-14m,step29000,seed7,7,29000
It was a delete key.,key,key,It was a key delete., delete key, key delete,delete,False,-22.021968841552734,-18.83441162109375,-3.1875572204589844,14067712,EleutherAI/pythia-14m,step29000,seed7,7,29000
They liked the marinated lamb.,lamb,lamb,They liked the lamb marinated., marinated lamb, lamb marinated,marinated,True,-27.489866256713867,-29.997589111328125,2.507722854614258,14067712,EleutherAI/pythia-14m,step29000,seed7,7,29000
They liked the grilled lamb.,lamb,lamb,They liked the lamb grilled., grilled lamb, lamb grilled,grilled,False,-17.842342376708984,-23.38460922241211,5.542266845703125,14067712,EleutherAI/pythia-14m,step29000,seed7,7,29000
They liked the cute lamb.,lamb,lamb,They liked the lamb cute., cute lamb, lamb cute,cute,False,-19.829280853271484,-22.892074584960938,3.062793731689453,14067712,EleutherAI/pythia-14m,step29000,seed7,7,29000
She had curly locks.,lock,locks,She had locks curly., curly locks, locks curly,curly,False,-20.869983673095703,-26.552875518798828,5.682891845703125,14067712,EleutherAI/pythia-14m,step29000,seed7,7,29000
She had brown locks.,lock,locks,She had locks brown., brown locks, locks brown,brown,False,-20.755718231201172,-25.044506072998047,4.288787841796875,14067712,EleutherAI/pythia-14m,step29000,seed7,7,29000
She had window locks.,lock,locks,She had locks window., window locks, locks window,window,True,-23.392539978027344,-24.021453857421875,0.6289138793945312,14067712,EleutherAI/pythia-14m,step29000,seed7,7,29000
They liked the hot lunch.,lunch,lunch,They liked the lunch hot., hot lunch, lunch hot,hot,False,-14.953973770141602,-19.92025375366211,4.966279983520508,14067712,EleutherAI/pythia-14m,step29000,seed7,7,29000
They liked the sandwich lunch.,lunch,lunch,They liked the lunch sandwich., sandwich lunch, lunch sandwich,sandwich,True,-19.067066192626953,-18.574878692626953,-0.4921875,14067712,EleutherAI/pythia-14m,step29000,seed7,7,29000
They liked the afternoon lunch.,lunch,lunch,They liked the lunch afternoon., afternoon lunch, lunch afternoon,afternoon,True,-14.315624237060547,-18.395414352416992,4.079790115356445,14067712,EleutherAI/pythia-14m,step29000,seed7,7,29000
He liked the flea market.,market,market,He liked the market flea., flea market, market flea,flea,True,-21.188047409057617,-21.455127716064453,0.26708030700683594,14067712,EleutherAI/pythia-14m,step29000,seed7,7,29000
He liked the fish market.,market,market,He liked the market fish., fish market, market fish,fish,True,-17.268028259277344,-18.731372833251953,1.4633445739746094,14067712,EleutherAI/pythia-14m,step29000,seed7,7,29000
He liked the housing market.,market,market,He liked the market housing., housing market, market housing,housing,True,-15.15086841583252,-17.31108856201172,2.160220146179199,14067712,EleutherAI/pythia-14m,step29000,seed7,7,29000
It was a lit match.,match,match,It was a match lit., lit match, match lit,lit,False,-22.127792358398438,-21.04302978515625,-1.0847625732421875,14067712,EleutherAI/pythia-14m,step29000,seed7,7,29000
It was a burning match.,match,match,It was a match burning., burning match, match burning,burning,False,-19.39201545715332,-22.5743408203125,3.1823253631591797,14067712,EleutherAI/pythia-14m,step29000,seed7,7,29000
It was a soccer match.,match,match,It was a match soccer., soccer match, match soccer,soccer,True,-15.692802429199219,-22.08843994140625,6.395637512207031,14067712,EleutherAI/pythia-14m,step29000,seed7,7,29000
It was cough medicine.,medicine,medicine,It was medicine cough., cough medicine, medicine cough,cough,True,-18.985708236694336,-23.573963165283203,4.588254928588867,14067712,EleutherAI/pythia-14m,step29000,seed7,7,29000
It was prescription medicine.,medicine,medicine,It was medicine prescription., prescription medicine, medicine prescription,prescription,True,-17.411346435546875,-20.122882843017578,2.711536407470703,14067712,EleutherAI/pythia-14m,step29000,seed7,7,29000
It was orthopedic medicine.,medicine,medicine,It was medicine orthopedic., orthopedic medicine, medicine orthopedic,orthopedic,False,-21.718212127685547,-24.878013610839844,3.159801483154297,14067712,EleutherAI/pythia-14m,step29000,seed7,7,29000
There was a phone message.,message,message,There was a message phone., phone message, message phone,phone,True,-13.799419403076172,-17.687381744384766,3.8879623413085938,14067712,EleutherAI/pythia-14m,step29000,seed7,7,29000
There was a computer message.,message,message,There was a message computer., computer message, message computer,computer,True,-16.78948211669922,-19.150508880615234,2.3610267639160156,14067712,EleutherAI/pythia-14m,step29000,seed7,7,29000
There was an urgent message.,message,message,There was an message urgent., urgent message, message urgent,urgent,False,-12.22215461730957,-24.45595932006836,12.233804702758789,14067712,EleutherAI/pythia-14m,step29000,seed7,7,29000
It was a fungal mold.,mold,mold,It was a mold fungal., fungal mold, mold fungal,fungal,False,-20.163631439208984,-23.385013580322266,3.2213821411132812,14067712,EleutherAI/pythia-14m,step29000,seed7,7,29000
It was a harmful mold.,mold,mold,It was a mold harmful., harmful mold, mold harmful,harmful,False,-20.665849685668945,-21.95431900024414,1.2884693145751953,14067712,EleutherAI/pythia-14m,step29000,seed7,7,29000
It was a rubber mold.,mold,mold,It was a mold rubber., rubber mold, mold rubber,rubber,True,-16.61821937561035,-21.008731842041016,4.390512466430664,14067712,EleutherAI/pythia-14m,step29000,seed7,7,29000
She saw the cancerous mole.,mole,mole,She saw the mole cancerous., cancerous mole, mole cancerous,cancerous,False,-25.873600006103516,-28.487957000732422,2.6143569946289062,14067712,EleutherAI/pythia-14m,step29000,seed7,7,29000
She saw the raised mole.,mole,mole,She saw the mole raised., raised mole, mole raised,raised,False,-21.28668212890625,-18.854379653930664,-2.432302474975586,14067712,EleutherAI/pythia-14m,step29000,seed7,7,29000
She saw the cute mole.,mole,mole,She saw the mole cute., cute mole, mole cute,cute,False,-19.525705337524414,-22.844959259033203,3.319253921508789,14067712,EleutherAI/pythia-14m,step29000,seed7,7,29000
He liked the rhythmic movement.,movement,movement,He liked the movement rhythmic., rhythmic movement, movement rhythmic,rhythmic,False,-18.920284271240234,-22.584598541259766,3.6643142700195312,14067712,EleutherAI/pythia-14m,step29000,seed7,7,29000
He liked the graceful movement.,movement,movement,He liked the movement graceful., graceful movement, movement graceful,graceful,False,-18.613235473632812,-23.27745819091797,4.664222717285156,14067712,EleutherAI/pythia-14m,step29000,seed7,7,29000
He liked the feminist movement.,movement,movement,He liked the movement feminist., feminist movement, movement feminist,feminist,True,-16.213682174682617,-23.617000579833984,7.403318405151367,14067712,EleutherAI/pythia-14m,step29000,seed7,7,29000
It was a national newspaper.,newspaper,newspaper,It was a newspaper national., national newspaper, newspaper national,national,False,-15.269596099853516,-19.34612464904785,4.076528549194336,14067712,EleutherAI/pythia-14m,step29000,seed7,7,29000
It was a daily newspaper.,newspaper,newspaper,It was a newspaper daily., daily newspaper, newspaper daily,daily,False,-15.000455856323242,-18.255435943603516,3.2549800872802734,14067712,EleutherAI/pythia-14m,step29000,seed7,7,29000
It was a faded newspaper.,newspaper,newspaper,It was a newspaper faded., faded newspaper, newspaper faded,faded,False,-19.929039001464844,-20.81403350830078,0.8849945068359375,14067712,EleutherAI/pythia-14m,step29000,seed7,7,29000
It was a juicy orange.,orange,orange,It was an orange juicy., juicy orange, orange juicy,juicy,False,-20.133337020874023,-19.707149505615234,-0.42618751525878906,14067712,EleutherAI/pythia-14m,step29000,seed7,7,29000
It was a ripe orange.,orange,orange,It was an orange ripe., ripe orange, orange ripe,ripe,False,-19.973186492919922,-19.11933135986328,-0.8538551330566406,14067712,EleutherAI/pythia-14m,step29000,seed7,7,29000
It was a bright orange.,orange,orange,It was an orange bright., bright orange, orange bright,bright,False,-13.070465087890625,-16.810245513916016,3.7397804260253906,14067712,EleutherAI/pythia-14m,step29000,seed7,7,29000
He saw the young page.,page,page,He saw the page young., young page, page young,young,False,-18.3269100189209,-21.327503204345703,3.0005931854248047,14067712,EleutherAI/pythia-14m,step29000,seed7,7,29000
He saw the loyal page.,page,page,He saw the page loyal., loyal page, page loyal,loyal,False,-22.922405242919922,-22.704214096069336,-0.21819114685058594,14067712,EleutherAI/pythia-14m,step29000,seed7,7,29000
He saw the blank page.,page,page,He saw the page blank., blank page, page blank,blank,False,-16.078338623046875,-17.330650329589844,1.2523117065429688,14067712,EleutherAI/pythia-14m,step29000,seed7,7,29000
It was a calloused palm.,palm,palm,It was a palm calloused., calloused palm, palm calloused,calloused,False,-27.507190704345703,-31.442644119262695,3.935453414916992,14067712,EleutherAI/pythia-14m,step29000,seed7,7,29000
It was a wrinkled palm.,palm,palm,It was a palm wrinkled., wrinkled palm, palm wrinkled,wrinkled,False,-21.34833526611328,-23.262510299682617,1.914175033569336,14067712,EleutherAI/pythia-14m,step29000,seed7,7,29000
It was a tropical palm.,palm,palm,It was a palm tropical., tropical palm, palm tropical,tropical,False,-20.204830169677734,-24.99503517150879,4.790205001831055,14067712,EleutherAI/pythia-14m,step29000,seed7,7,29000
It was a control panel.,panel,panel,It was a panel control., control panel, panel control,control,True,-15.760767936706543,-18.920372009277344,3.159604072570801,14067712,EleutherAI/pythia-14m,step29000,seed7,7,29000
It was an instrument panel.,panel,panel,It was an panel instrument., instrument panel, panel instrument,instrument,False,-18.65371322631836,-25.30974578857422,6.656032562255859,14067712,EleutherAI/pythia-14m,step29000,seed7,7,29000
It was an advisory panel.,panel,panel,It was an panel advisory., advisory panel, panel advisory,advisory,False,-20.526531219482422,-26.551868438720703,6.025337219238281,14067712,EleutherAI/pythia-14m,step29000,seed7,7,29000
It was a secret passage.,passage,passage,It was a passage secret., secret passage, passage secret,secret,False,-16.895977020263672,-21.15826416015625,4.262287139892578,14067712,EleutherAI/pythia-14m,step29000,seed7,7,29000
It was a narrow passage.,passage,passage,It was a passage narrow., narrow passage, passage narrow,narrow,False,-15.103093147277832,-22.940155029296875,7.837061882019043,14067712,EleutherAI/pythia-14m,step29000,seed7,7,29000
It was a literary passage.,passage,passage,It was a passage literary., literary passage, passage literary,literary,False,-18.093887329101562,-23.019474029541016,4.925586700439453,14067712,EleutherAI/pythia-14m,step29000,seed7,7,29000
It was a tasty perch.,perch,perch,It was a perch tasty., tasty perch, perch tasty,tasty,False,-20.641820907592773,-26.606002807617188,5.964181900024414,14067712,EleutherAI/pythia-14m,step29000,seed7,7,29000
It was a freshwater perch.,perch,perch,It was a perch freshwater., freshwater perch, perch freshwater,freshwater,True,-24.880268096923828,-27.700912475585938,2.8206443786621094,14067712,EleutherAI/pythia-14m,step29000,seed7,7,29000
It was a lofty perch.,perch,perch,It was a perch lofty., lofty perch, perch lofty,lofty,False,-24.263154983520508,-27.94214630126953,3.6789913177490234,14067712,EleutherAI/pythia-14m,step29000,seed7,7,29000
He saw the fast pitcher.,pitcher,pitcher,He saw the pitcher fast., fast pitcher, pitcher fast,fast,False,-19.921356201171875,-21.64316177368164,1.7218055725097656,14067712,EleutherAI/pythia-14m,step29000,seed7,7,29000
He saw the right-handed pitcher.,pitcher,pitcher,He saw the pitcher right-handed., right-handed pitcher, pitcher right-handed,right-handed,False,-20.324661254882812,-26.656177520751953,6.331516265869141,14067712,EleutherAI/pythia-14m,step29000,seed7,7,29000
He saw the glass pitcher.,pitcher,pitcher,He saw the pitcher glass., glass pitcher, pitcher glass,glass,True,-20.2529296875,-23.136653900146484,2.8837242126464844,14067712,EleutherAI/pythia-14m,step29000,seed7,7,29000
It was a windy port.,port,port,It was a port windy., windy port, port windy,windy,False,-22.276763916015625,-27.2260799407959,4.949316024780273,14067712,EleutherAI/pythia-14m,step29000,seed7,7,29000
It was a seaside port.,port,port,It was a port seaside., seaside port, port seaside,seaside,True,-20.131603240966797,-26.529144287109375,6.397541046142578,14067712,EleutherAI/pythia-14m,step29000,seed7,7,29000
It was a delicious port.,port,port,It was a port delicious., delicious port, port delicious,delicious,False,-18.84208106994629,-26.181968688964844,7.339887619018555,14067712,EleutherAI/pythia-14m,step29000,seed7,7,29000
He was in a distinguished position.,position,position,He was in a position distinguished., distinguished position, position distinguished,distinguished,False,-15.815174102783203,-19.603609085083008,3.7884349822998047,14067712,EleutherAI/pythia-14m,step29000,seed7,7,29000
He was in a prominent position.,position,position,He was in a position prominent., prominent position, position prominent,prominent,False,-11.686172485351562,-19.055561065673828,7.369388580322266,14067712,EleutherAI/pythia-14m,step29000,seed7,7,29000
He was in a fetal position.,position,position,He was in a position fetal., fetal position, position fetal,fetal,False,-17.891721725463867,-24.208866119384766,6.317144393920898,14067712,EleutherAI/pythia-14m,step29000,seed7,7,29000
It was a wooden post.,post,post,It was a post wooden., wooden post, post wooden,wooden,False,-17.73527717590332,-21.651260375976562,3.915983200073242,14067712,EleutherAI/pythia-14m,step29000,seed7,7,29000
It was a fence post.,post,post,It was a post fence., fence post, post fence,fence,True,-19.23719024658203,-19.686552047729492,0.44936180114746094,14067712,EleutherAI/pythia-14m,step29000,seed7,7,29000
It was a teaching post.,post,post,It was a post teaching., teaching post, post teaching,teaching,True,-18.304018020629883,-17.215213775634766,-1.0888042449951172,14067712,EleutherAI/pythia-14m,step29000,seed7,7,29000
He had the alcoholic punch.,punch,punch,He had the punch alcoholic., alcoholic punch, punch alcoholic,alcoholic,False,-20.565717697143555,-26.353286743164062,5.787569046020508,14067712,EleutherAI/pythia-14m,step29000,seed7,7,29000
He had the fruit punch.,punch,punch,He had the punch fruit., fruit punch, punch fruit,fruit,True,-21.245885848999023,-22.73488998413086,1.489004135131836,14067712,EleutherAI/pythia-14m,step29000,seed7,7,29000
He had the strongest punch.,punch,punch,He had the punch strongest., strongest punch, punch strongest,strongest,False,-16.720947265625,-24.69569206237793,7.97474479675293,14067712,EleutherAI/pythia-14m,step29000,seed7,7,29000
She had a brilliant pupil.,pupil,pupil,She had a pupil brilliant., brilliant pupil, pupil brilliant,brilliant,False,-16.765907287597656,-24.314773559570312,7.548866271972656,14067712,EleutherAI/pythia-14m,step29000,seed7,7,29000
She had an interested pupil.,pupil,pupil,She had an pupil interested., interested pupil, pupil interested,interested,False,-18.446550369262695,-26.019309997558594,7.572759628295898,14067712,EleutherAI/pythia-14m,step29000,seed7,7,29000
She had a dilated pupil.,pupil,pupil,She had a pupil dilated., dilated pupil, pupil dilated,dilated,False,-18.323347091674805,-22.233551025390625,3.9102039337158203,14067712,EleutherAI/pythia-14m,step29000,seed7,7,29000
That was a loud racket.,racket,racket,That was a racket loud., loud racket, racket loud,loud,False,-17.89228057861328,-27.250558853149414,9.358278274536133,14067712,EleutherAI/pythia-14m,step29000,seed7,7,29000
That was an annoying racket.,racket,racket,That was an racket annoying., annoying racket, racket annoying,annoying,False,-17.231685638427734,-28.39046859741211,11.158782958984375,14067712,EleutherAI/pythia-14m,step29000,seed7,7,29000
That was a badminton racket.,racket,racket,That was a racket badminton., badminton racket, racket badminton,badminton,True,-28.130565643310547,-31.586715698242188,3.4561500549316406,14067712,EleutherAI/pythia-14m,step29000,seed7,7,29000
He liked electronic rock.,rock,rock,He liked rock electronic., electronic rock, rock electronic,electronic,False,-21.77353286743164,-22.918975830078125,1.1454429626464844,14067712,EleutherAI/pythia-14m,step29000,seed7,7,29000
He liked alternative rock.,rock,rock,He liked rock alternative., alternative rock, rock alternative,alternative,False,-21.570642471313477,-25.520612716674805,3.949970245361328,14067712,EleutherAI/pythia-14m,step29000,seed7,7,29000
He liked limestone rock.,rock,rock,He liked rock limestone., limestone rock, rock limestone,limestone,True,-22.571014404296875,-23.69635772705078,1.1253433227539062,14067712,EleutherAI/pythia-14m,step29000,seed7,7,29000
He saw the wise sage.,sage,sage,He saw the sage wise., wise sage, sage wise,wise,False,-19.95804214477539,-20.704435348510742,0.7463932037353516,14067712,EleutherAI/pythia-14m,step29000,seed7,7,29000
He saw the renowned sage.,sage,sage,He saw the sage renowned., renowned sage, sage renowned,renowned,False,-21.067291259765625,-23.886152267456055,2.8188610076904297,14067712,EleutherAI/pythia-14m,step29000,seed7,7,29000
He saw the fragrant sage.,sage,sage,He saw the sage fragrant., fragrant sage, sage fragrant,fragrant,False,-21.17681884765625,-20.758819580078125,-0.417999267578125,14067712,EleutherAI/pythia-14m,step29000,seed7,7,29000
It was a fish scale.,scale,scale,It was a scale fish., fish scale, scale fish,fish,True,-21.17000961303711,-22.41775894165039,1.2477493286132812,14067712,EleutherAI/pythia-14m,step29000,seed7,7,29000
It was a lizard scale.,scale,scale,It was a scale lizard., lizard scale, scale lizard,lizard,True,-23.599964141845703,-26.55743408203125,2.957469940185547,14067712,EleutherAI/pythia-14m,step29000,seed7,7,29000
It was a music scale.,scale,scale,It was a scale music., music scale, scale music,music,True,-19.027257919311523,-21.906082153320312,2.878824234008789,14067712,EleutherAI/pythia-14m,step29000,seed7,7,29000
It was a touching scene.,scene,scene,It was a scene touching., touching scene, scene touching,touching,False,-17.170019149780273,-18.621763229370117,1.4517440795898438,14067712,EleutherAI/pythia-14m,step29000,seed7,7,29000
It was a well-acted scene.,scene,scene,It was a scene well-acted., well-acted scene, scene well-acted,well-acted,False,-25.08836555480957,-28.44967269897461,3.361307144165039,14067712,EleutherAI/pythia-14m,step29000,seed7,7,29000
It was a nature scene.,scene,scene,It was a scene nature., nature scene, scene nature,nature,True,-17.124778747558594,-20.10304069519043,2.978261947631836,14067712,EleutherAI/pythia-14m,step29000,seed7,7,29000
It was a gold seal.,seal,seal,It was a seal gold., gold seal, seal gold,gold,True,-17.71990966796875,-21.90782356262207,4.18791389465332,14067712,EleutherAI/pythia-14m,step29000,seed7,7,29000
It was a certified seal.,seal,seal,It was a seal certified., certified seal, seal certified,certified,False,-19.595558166503906,-20.743349075317383,1.1477909088134766,14067712,EleutherAI/pythia-14m,step29000,seed7,7,29000
It was a circus seal.,seal,seal,It was a seal circus., circus seal, seal circus,circus,True,-23.193790435791016,-26.182003021240234,2.9882125854492188,14067712,EleutherAI/pythia-14m,step29000,seed7,7,29000
He used the scotch tape.,tape,tape,He used the tape scotch., scotch tape, tape scotch,scotch,True,-27.128093719482422,-29.496326446533203,2.3682327270507812,14067712,EleutherAI/pythia-14m,step29000,seed7,7,29000
He used the double-sided tape.,tape,tape,He used the tape double-sided., double-sided tape, tape double-sided,double-sided,False,-22.617919921875,-29.380329132080078,6.762409210205078,14067712,EleutherAI/pythia-14m,step29000,seed7,7,29000
He used the interview tape.,tape,tape,He used the tape interview., interview tape, tape interview,interview,True,-19.608444213867188,-19.941993713378906,0.33354949951171875,14067712,EleutherAI/pythia-14m,step29000,seed7,7,29000
It was a winter term.,term,term,It was a term winter., winter term, term winter,winter,True,-17.724811553955078,-22.36894416809082,4.644132614135742,14067712,EleutherAI/pythia-14m,step29000,seed7,7,29000
