sentence,word,string,reversed_sentence,mod_np,reversed_mod,disambiguating_word,non_adjective,original_logprob,reversed_logprob,ratio,n_params,mpath,revision,seed_name,seed,step
He used the interview tape.,tape,tape,He used the tape interview., interview tape, tape interview,interview,True,-18.996339797973633,-22.163883209228516,3.167543411254883,14067712,EleutherAI/pythia-14m,step104000,seed7,7,104000
It was a winter term.,term,term,It was a term winter., winter term, term winter,winter,True,-16.606367111206055,-20.03533935546875,3.4289722442626953,14067712,EleutherAI/pythia-14m,step104000,seed7,7,104000
It was a fall term.,term,term,It was a term fall., fall term, term fall,fall,True,-18.216594696044922,-18.24871826171875,0.032123565673828125,14067712,EleutherAI/pythia-14m,step104000,seed7,7,104000
It was a legal term.,term,term,It was a term legal., legal term, term legal,legal,False,-15.883157730102539,-18.00665283203125,2.123495101928711,14067712,EleutherAI/pythia-14m,step104000,seed7,7,104000
It was a clock tick.,tick,tick,It was a tick clock., clock tick, tick clock,clock,True,-14.211008071899414,-20.599483489990234,6.38847541809082,14067712,EleutherAI/pythia-14m,step104000,seed7,7,104000
It was an audible tick.,tick,tick,It was an tick audible., audible tick, tick audible,audible,False,-16.118070602416992,-30.017475128173828,13.899404525756836,14067712,EleutherAI/pythia-14m,step104000,seed7,7,104000
It was a parasitic tick.,tick,tick,It was a tick parasitic., parasitic tick, tick parasitic,parasitic,False,-20.31411361694336,-25.786006927490234,5.471893310546875,14067712,EleutherAI/pythia-14m,step104000,seed7,7,104000
It was a generous tip.,tip,tip,It was a tip generous., generous tip, tip generous,generous,False,-17.945892333984375,-22.609046936035156,4.663154602050781,14067712,EleutherAI/pythia-14m,step104000,seed7,7,104000
It was a stingy tip.,tip,tip,It was a tip stingy., stingy tip, tip stingy,stingy,False,-18.196224212646484,-23.45746421813965,5.261240005493164,14067712,EleutherAI/pythia-14m,step104000,seed7,7,104000
It was a pencil tip.,tip,tip,It was a tip pencil., pencil tip, tip pencil,pencil,True,-18.198406219482422,-19.099403381347656,0.9009971618652344,14067712,EleutherAI/pythia-14m,step104000,seed7,7,104000
She liked the essay title.,title,title,She liked the title essay., essay title, title essay,essay,True,-20.902164459228516,-16.506607055664062,-4.395557403564453,14067712,EleutherAI/pythia-14m,step104000,seed7,7,104000
She liked the poem title.,title,title,She liked the title poem., poem title, title poem,poem,True,-21.009822845458984,-17.415298461914062,-3.594524383544922,14067712,EleutherAI/pythia-14m,step104000,seed7,7,104000
She liked the academic title.,title,title,She liked the title academic., academic title, title academic,academic,False,-16.220657348632812,-17.388809204101562,1.16815185546875,14067712,EleutherAI/pythia-14m,step104000,seed7,7,104000
It was a costly toll.,toll,toll,It was a toll costly., costly toll, toll costly,costly,False,-20.67850685119629,-23.922985076904297,3.244478225708008,14067712,EleutherAI/pythia-14m,step104000,seed7,7,104000
It was a road toll.,toll,toll,It was a toll road., road toll, toll road,road,True,-19.996559143066406,-18.739513397216797,-1.2570457458496094,14067712,EleutherAI/pythia-14m,step104000,seed7,7,104000
It was a loud toll.,toll,toll,It was a toll loud., loud toll, toll loud,loud,False,-20.211076736450195,-23.343517303466797,3.1324405670166016,14067712,EleutherAI/pythia-14m,step104000,seed7,7,104000
She saw the train tracks.,track,tracks,She saw the tracks train., train tracks, tracks train,train,True,-16.582382202148438,-22.432022094726562,5.849639892578125,14067712,EleutherAI/pythia-14m,step104000,seed7,7,104000
She saw the trolley tracks.,track,tracks,She saw the tracks trolley., trolley tracks, tracks trolley,trolley,True,-25.500802993774414,-26.138025283813477,0.6372222900390625,14067712,EleutherAI/pythia-14m,step104000,seed7,7,104000
She saw the moose tracks.,track,tracks,She saw the tracks moose., moose tracks, tracks moose,moose,False,-25.95644187927246,-30.004779815673828,4.048337936401367,14067712,EleutherAI/pythia-14m,step104000,seed7,7,104000
It was five yards.,yard,yards,It was yards five., five yards, yards five,five,True,-16.073081970214844,-25.083568572998047,9.010486602783203,14067712,EleutherAI/pythia-14m,step104000,seed7,7,104000
It was ten yards.,yard,yards,It was yards ten., ten yards, yards ten,ten,True,-16.73674201965332,-25.362377166748047,8.625635147094727,14067712,EleutherAI/pythia-14m,step104000,seed7,7,104000
They were big yards.,yard,yards,They were yards big., big yards, yards big,big,False,-16.953556060791016,-23.719947814941406,6.766391754150391,14067712,EleutherAI/pythia-14m,step104000,seed7,7,104000
It was a comedic act.,act,act,It was an act comedic., comedic act, act comedic,comedic,False,-18.265670776367188,-20.476539611816406,2.2108688354492188,14067712,EleutherAI/pythia-14m,step104000,seed7,7,104000
He had a pending appeal.,appeal,appeal,He had an appeal pending., pending appeal, appeal pending,pending,False,-14.691547393798828,-15.918779373168945,1.2272319793701172,14067712,EleutherAI/pythia-14m,step104000,seed7,7,104000
It was a polluted atmosphere.,atmosphere,atmosphere,It was an atmosphere polluted., polluted atmosphere, atmosphere polluted,polluted,False,-23.068756103515625,-22.99204444885254,-0.07671165466308594,14067712,EleutherAI/pythia-14m,step104000,seed7,7,104000
It was a country band.,band,band,It was a band country., country band, band country,country,True,-18.600357055664062,-19.848236083984375,1.2478790283203125,14067712,EleutherAI/pythia-14m,step104000,seed7,7,104000
There was a religious barrier.,barrier,barrier,There was a barrier religious., religious barrier, barrier religious,religious,False,-18.240230560302734,-24.552467346191406,6.312236785888672,14067712,EleutherAI/pythia-14m,step104000,seed7,7,104000
He saw a baseball bat.,bat,bat,He saw a bat baseball., baseball bat, bat baseball,baseball,True,-8.996511459350586,-16.127300262451172,7.130788803100586,14067712,EleutherAI/pythia-14m,step104000,seed7,7,104000
He saw the balance beam.,beam,beam,He saw the beam balance., balance beam, beam balance,balance,True,-21.473350524902344,-20.59193229675293,-0.8814182281494141,14067712,EleutherAI/pythia-14m,step104000,seed7,7,104000
She had a writer's block.,block,block,She had a block writer's., writer's block, block writer's,writer,True,-25.09781265258789,-25.12700653076172,0.029193878173828125,14067712,EleutherAI/pythia-14m,step104000,seed7,7,104000
He has royal blood.,blood,blood,He has blood royal., royal blood, blood royal,royal,False,-19.953811645507812,-25.2142333984375,5.2604217529296875,14067712,EleutherAI/pythia-14m,step104000,seed7,7,104000
It was the school board.,board,board,It was the board school., school board, board school,school,True,-12.965576171875,-16.673625946044922,3.708049774169922,14067712,EleutherAI/pythia-14m,step104000,seed7,7,104000
He had a leather-bound book.,book,book,He had a book leather-bound., leather-bound book, book leather-bound,leather-bound,False,-25.5284423828125,-29.538604736328125,4.010162353515625,14067712,EleutherAI/pythia-14m,step104000,seed7,7,104000
They ate a lonely breakfast.,breakfast,breakfast,They ate a breakfast lonely., lonely breakfast, breakfast lonely,lonely,False,-13.636297225952148,-20.366783142089844,6.730485916137695,14067712,EleutherAI/pythia-14m,step104000,seed7,7,104000
It was an island cape.,cape,cape,It was an cape island., island cape, cape island,island,True,-20.589969635009766,-27.294801712036133,6.704832077026367,14067712,EleutherAI/pythia-14m,step104000,seed7,7,104000
It was a criminal case.,case,case,It was a case criminal., criminal case, case criminal,criminal,False,-9.789847373962402,-17.5302791595459,7.740431785583496,14067712,EleutherAI/pythia-14m,step104000,seed7,7,104000
It was a primary cause.,cause,cause,It was a cause primary., primary cause, cause primary,primary,False,-11.750402450561523,-22.21725082397461,10.466848373413086,14067712,EleutherAI/pythia-14m,step104000,seed7,7,104000
It was a jail cell.,cell,cell,It was a cell jail., jail cell, cell jail,jail,True,-16.150108337402344,-18.989910125732422,2.839801788330078,14067712,EleutherAI/pythia-14m,step104000,seed7,7,104000
She had a good-luck charm.,charm,charm,She had a charm good-luck., good-luck charm, charm good-luck,good-luck,False,-25.398584365844727,-31.072372436523438,5.673788070678711,14067712,EleutherAI/pythia-14m,step104000,seed7,7,104000
They liked the pet chicken.,chicken,chicken,They liked the chicken pet., pet chicken, chicken pet,pet,True,-19.24681854248047,-17.87769889831543,-1.369119644165039,14067712,EleutherAI/pythia-14m,step104000,seed7,7,104000
It was a stimulating class.,class,class,It was a class stimulating., stimulating class, class stimulating,stimulating,False,-18.642915725708008,-21.25305938720703,2.6101436614990234,14067712,EleutherAI/pythia-14m,step104000,seed7,7,104000
It was a metal clip.,clip,clip,It was a clip metal., metal clip, clip metal,metal,True,-18.541378021240234,-19.176944732666016,0.6355667114257812,14067712,EleutherAI/pythia-14m,step104000,seed7,7,104000
It was a common cold.,cold,cold,It was a cold common., common cold, cold common,common,False,-14.023985862731934,-19.873565673828125,5.849579811096191,14067712,EleutherAI/pythia-14m,step104000,seed7,7,104000
It was a marble column.,column,column,It was a column marble., marble column, column marble,marble,True,-19.13047218322754,-20.364885330200195,1.2344131469726562,14067712,EleutherAI/pythia-14m,step104000,seed7,7,104000
He liked the polite company.,company,company,He liked the company polite., polite company, company polite,polite,False,-18.40122413635254,-19.953582763671875,1.552358627319336,14067712,EleutherAI/pythia-14m,step104000,seed7,7,104000
It was a traffic cone.,cone,cone,It was a cone traffic., traffic cone, cone traffic,traffic,True,-20.49793243408203,-25.39665412902832,4.898721694946289,14067712,EleutherAI/pythia-14m,step104000,seed7,7,104000
He made a well-written contribution.,contribution,contribution,He made a contribution well-written., well-written contribution, contribution well-written,well-written,False,-20.295188903808594,-29.10803985595703,8.812850952148438,14067712,EleutherAI/pythia-14m,step104000,seed7,7,104000
That was the correct count.,count,count,That was the count correct., correct count, count correct,correct,False,-15.816200256347656,-21.246131896972656,5.429931640625,14067712,EleutherAI/pythia-14m,step104000,seed7,7,104000
It was a collision course.,course,course,It was a course collision., collision course, course collision,collision,True,-16.655738830566406,-20.00151252746582,3.345773696899414,14067712,EleutherAI/pythia-14m,step104000,seed7,7,104000
It was a historical date.,date,date,It was a date historical., historical date, date historical,historical,False,-15.912216186523438,-19.54637336730957,3.634157180786133,14067712,EleutherAI/pythia-14m,step104000,seed7,7,104000
It was about college degrees.,degree,degrees,It was about degrees college., college degrees, degrees college,college,True,-15.787445068359375,-21.97806167602539,6.190616607666016,14067712,EleutherAI/pythia-14m,step104000,seed7,7,104000
They liked the architectural design.,design,design,They liked the design architectural., architectural design, design architectural,architectural,False,-15.755115509033203,-20.313068389892578,4.557952880859375,14067712,EleutherAI/pythia-14m,step104000,seed7,7,104000
They liked the anniversary dinner.,dinner,dinner,They liked the dinner anniversary., anniversary dinner, dinner anniversary,anniversary,True,-17.868671417236328,-21.00469970703125,3.136028289794922,14067712,EleutherAI/pythia-14m,step104000,seed7,7,104000
He had a career dream.,dream,dream,He had a dream career., career dream, dream career,career,True,-16.34479522705078,-17.397789001464844,1.0529937744140625,14067712,EleutherAI/pythia-14m,step104000,seed7,7,104000
It was a battery-powered drill.,drill,drill,It was a drill battery-powered., battery-powered drill, drill battery-powered,battery-powered,False,-26.196285247802734,-29.74087905883789,3.5445938110351562,14067712,EleutherAI/pythia-14m,step104000,seed7,7,104000
It was a physical examination.,examination,examination,It was an examination physical., physical examination, examination physical,physical,False,-10.319685935974121,-17.63968849182129,7.320002555847168,14067712,EleutherAI/pythia-14m,step104000,seed7,7,104000
They had an enthusiastic fan.,fan,fan,They had an fan enthusiastic., enthusiastic fan, fan enthusiastic,enthusiastic,False,-15.672107696533203,-30.625465393066406,14.953357696533203,14067712,EleutherAI/pythia-14m,step104000,seed7,7,104000
She had a steel file.,file,file,She had a file steel., steel file, file steel,steel,True,-18.879789352416992,-24.146526336669922,5.26673698425293,14067712,EleutherAI/pythia-14m,step104000,seed7,7,104000
It was a plastic film.,film,film,It was a film plastic., plastic film, film plastic,plastic,False,-15.648880004882812,-19.941638946533203,4.292758941650391,14067712,EleutherAI/pythia-14m,step104000,seed7,7,104000
It was a concrete foundation.,foundation,foundation,It was a foundation concrete., concrete foundation, foundation concrete,concrete,False,-15.11864948272705,-20.5517520904541,5.433102607727051,14067712,EleutherAI/pythia-14m,step104000,seed7,7,104000
It was a business function.,function,function,It was a function business., business function, function business,business,True,-17.173282623291016,-19.607200622558594,2.433917999267578,14067712,EleutherAI/pythia-14m,step104000,seed7,7,104000
He was on the parade ground.,ground,ground,He was on the ground parade., parade ground, ground parade,parade,True,-18.331817626953125,-17.614885330200195,-0.7169322967529297,14067712,EleutherAI/pythia-14m,step104000,seed7,7,104000
They liked the national guard.,guard,guard,They liked the guard national., national guard, guard national,national,False,-17.097858428955078,-22.709720611572266,5.6118621826171875,14067712,EleutherAI/pythia-14m,step104000,seed7,7,104000
He had a friendly guide.,guide,guide,He had a guide friendly., friendly guide, guide friendly,friendly,False,-15.086463928222656,-21.22307586669922,6.1366119384765625,14067712,EleutherAI/pythia-14m,step104000,seed7,7,104000
It was a nursing home.,home,home,It was a home nursing., nursing home, home nursing,nursing,True,-10.009343147277832,-17.78536033630371,7.776017189025879,14067712,EleutherAI/pythia-14m,step104000,seed7,7,104000
They had military intelligence.,intelligence,intelligence,They had intelligence military., military intelligence, intelligence military,military,False,-17.76852035522461,-21.463050842285156,3.694530487060547,14067712,EleutherAI/pythia-14m,step104000,seed7,7,104000
It was a special issue.,issue,issue,It was an issue special., special issue, issue special,special,False,-10.909313201904297,-15.041757583618164,4.132444381713867,14067712,EleutherAI/pythia-14m,step104000,seed7,7,104000
It was a paper jam.,jam,jam,It was a jam paper., paper jam, jam paper,paper,True,-17.727962493896484,-20.11800193786621,2.3900394439697266,14067712,EleutherAI/pythia-14m,step104000,seed7,7,104000
It was a backspace key.,key,key,It was a key backspace., backspace key, key backspace,backspace,True,-26.456939697265625,-21.908145904541016,-4.548793792724609,14067712,EleutherAI/pythia-14m,step104000,seed7,7,104000
They liked the friendly lamb.,lamb,lamb,They liked the lamb friendly., friendly lamb, lamb friendly,friendly,False,-20.594263076782227,-19.825443267822266,-0.7688198089599609,14067712,EleutherAI/pythia-14m,step104000,seed7,7,104000
She had door locks.,lock,locks,She had locks door., door locks, locks door,door,True,-19.4000244140625,-21.340463638305664,1.940439224243164,14067712,EleutherAI/pythia-14m,step104000,seed7,7,104000
They liked the women's lunch.,lunch,lunch,They liked the lunch women's., women's lunch, lunch women's,women,True,-17.662744522094727,-24.152690887451172,6.489946365356445,14067712,EleutherAI/pythia-14m,step104000,seed7,7,104000
He liked the stock market.,market,market,He liked the market stock., stock market, market stock,stock,True,-16.39422607421875,-13.330377578735352,-3.0638484954833984,14067712,EleutherAI/pythia-14m,step104000,seed7,7,104000
It was a tennis match.,match,match,It was a match tennis., tennis match, match tennis,tennis,True,-15.540376663208008,-21.403579711914062,5.863203048706055,14067712,EleutherAI/pythia-14m,step104000,seed7,7,104000
It was veterinary medicine.,medicine,medicine,It was medicine veterinary., veterinary medicine, medicine veterinary,veterinary,False,-17.454090118408203,-21.431507110595703,3.9774169921875,14067712,EleutherAI/pythia-14m,step104000,seed7,7,104000
There was a clear message.,message,message,There was a message clear., clear message, message clear,clear,False,-9.834909439086914,-15.17909049987793,5.344181060791016,14067712,EleutherAI/pythia-14m,step104000,seed7,7,104000
It was a clay mold.,mold,mold,It was a mold clay., clay mold, mold clay,clay,True,-18.148183822631836,-21.783180236816406,3.6349964141845703,14067712,EleutherAI/pythia-14m,step104000,seed7,7,104000
She saw the fast mole.,mole,mole,She saw the mole fast., fast mole, mole fast,fast,False,-20.253219604492188,-22.351186752319336,2.0979671478271484,14067712,EleutherAI/pythia-14m,step104000,seed7,7,104000
He liked the civil-rights movement.,movement,movement,He liked the movement civil-rights., civil-rights movement, movement civil-rights,civil-rights,False,-21.952430725097656,-29.986942291259766,8.03451156616211,14067712,EleutherAI/pythia-14m,step104000,seed7,7,104000
It was a shredded newspaper.,newspaper,newspaper,It was a newspaper shredded., shredded newspaper, newspaper shredded,shredded,False,-21.956787109375,-21.423629760742188,-0.5331573486328125,14067712,EleutherAI/pythia-14m,step104000,seed7,7,104000
It was a reddish orange.,orange,orange,It was an orange reddish., reddish orange, orange reddish,reddish,False,-15.527070999145508,-17.571203231811523,2.0441322326660156,14067712,EleutherAI/pythia-14m,step104000,seed7,7,104000
He saw the ripped page.,page,page,He saw the page ripped., ripped page, page ripped,ripped,False,-24.33909034729004,-19.672222137451172,-4.666868209838867,14067712,EleutherAI/pythia-14m,step104000,seed7,7,104000
It was a tree palm.,palm,palm,It was a palm tree., tree palm, palm tree,tree,True,-21.136899948120117,-14.806913375854492,-6.329986572265625,14067712,EleutherAI/pythia-14m,step104000,seed7,7,104000
It was a consumer panel.,panel,panel,It was a panel consumer., consumer panel, panel consumer,consumer,True,-18.087421417236328,-20.260807037353516,2.1733856201171875,14067712,EleutherAI/pythia-14m,step104000,seed7,7,104000
It was a biblical passage.,passage,passage,It was a passage biblical., biblical passage, passage biblical,biblical,False,-16.789222717285156,-22.581016540527344,5.7917938232421875,14067712,EleutherAI/pythia-14m,step104000,seed7,7,104000
It was a secure perch.,perch,perch,It was a perch secure., secure perch, perch secure,secure,False,-26.031892776489258,-30.80807113647461,4.776178359985352,14067712,EleutherAI/pythia-14m,step104000,seed7,7,104000
He saw the plastic pitcher.,pitcher,pitcher,He saw the pitcher plastic., plastic pitcher, pitcher plastic,plastic,True,-20.01520538330078,-23.981975555419922,3.9667701721191406,14067712,EleutherAI/pythia-14m,step104000,seed7,7,104000
It was a sweet port.,port,port,It was a port sweet., sweet port, port sweet,sweet,False,-18.245391845703125,-21.417863845825195,3.1724720001220703,14067712,EleutherAI/pythia-14m,step104000,seed7,7,104000
He was in a yoga position.,position,position,He was in a position yoga., yoga position, position yoga,yoga,True,-14.865659713745117,-17.77145004272461,2.905790328979492,14067712,EleutherAI/pythia-14m,step104000,seed7,7,104000
It was a challenging post.,post,post,It was a post challenging., challenging post, post challenging,challenging,False,-15.438053131103516,-18.585628509521484,3.1475753784179688,14067712,EleutherAI/pythia-14m,step104000,seed7,7,104000
He had the quickest punch.,punch,punch,He had the punch quickest., quickest punch, punch quickest,quickest,False,-22.105022430419922,-25.48639678955078,3.3813743591308594,14067712,EleutherAI/pythia-14m,step104000,seed7,7,104000
She had a cloudy pupil.,pupil,pupil,She had a pupil cloudy., cloudy pupil, pupil cloudy,cloudy,False,-20.686506271362305,-25.78219985961914,5.095693588256836,14067712,EleutherAI/pythia-14m,step104000,seed7,7,104000
That was a tennis racket.,racket,racket,That was a racket tennis., tennis racket, racket tennis,tennis,True,-18.904708862304688,-29.80929183959961,10.904582977294922,14067712,EleutherAI/pythia-14m,step104000,seed7,7,104000
He liked granite rock.,rock,rock,He liked rock granite., granite rock, rock granite,granite,True,-22.050251007080078,-21.685714721679688,-0.3645362854003906,14067712,EleutherAI/pythia-14m,step104000,seed7,7,104000
He saw the bushy sage.,sage,sage,He saw the sage bushy., bushy sage, sage bushy,bushy,False,-25.843849182128906,-28.469655990600586,2.6258068084716797,14067712,EleutherAI/pythia-14m,step104000,seed7,7,104000
It was a major scale.,scale,scale,It was a scale major., major scale, scale major,major,False,-15.505594253540039,-22.13128662109375,6.625692367553711,14067712,EleutherAI/pythia-14m,step104000,seed7,7,104000
It was a panoramic scene.,scene,scene,It was a scene panoramic., panoramic scene, scene panoramic,panoramic,False,-20.446731567382812,-21.814834594726562,1.36810302734375,14067712,EleutherAI/pythia-14m,step104000,seed7,7,104000
It was a trained seal.,seal,seal,It was a seal trained., trained seal, seal trained,trained,False,-20.509733200073242,-23.906204223632812,3.3964710235595703,14067712,EleutherAI/pythia-14m,step104000,seed7,7,104000
He used the video tape.,tape,tape,He used the tape video., video tape, tape video,video,True,-15.654378890991211,-17.608097076416016,1.9537181854248047,14067712,EleutherAI/pythia-14m,step104000,seed7,7,104000
It was a technical term.,term,term,It was a term technical., technical term, term technical,technical,False,-18.08116340637207,-20.19390869140625,2.1127452850341797,14067712,EleutherAI/pythia-14m,step104000,seed7,7,104000
It was a diseased tick.,tick,tick,It was a tick diseased., diseased tick, tick diseased,diseased,False,-21.37085723876953,-26.860591888427734,5.489734649658203,14067712,EleutherAI/pythia-14m,step104000,seed7,7,104000
It was a finger tip.,tip,tip,It was a tip finger., finger tip, tip finger,finger,True,-18.41360092163086,-18.314002990722656,-0.09959793090820312,14067712,EleutherAI/pythia-14m,step104000,seed7,7,104000
She liked the professional title.,title,title,She liked the title professional., professional title, title professional,professional,False,-15.156696319580078,-16.588882446289062,1.4321861267089844,14067712,EleutherAI/pythia-14m,step104000,seed7,7,104000
It was a bell toll.,toll,toll,It was a toll bell., bell toll, toll bell,bell,True,-20.71759605407715,-20.667003631591797,-0.05059242248535156,14067712,EleutherAI/pythia-14m,step104000,seed7,7,104000
She saw the snowshoe tracks.,track,tracks,She saw the tracks snowshoe., snowshoe tracks, tracks snowshoe,snowshoe,True,-30.642601013183594,-33.29346466064453,2.6508636474609375,14067712,EleutherAI/pythia-14m,step104000,seed7,7,104000
They were cluttered yards.,yard,yards,They were yards cluttered., cluttered yards, yards cluttered,cluttered,False,-25.216930389404297,-28.529457092285156,3.3125267028808594,14067712,EleutherAI/pythia-14m,step104000,seed7,7,104000
