sentence,word,string,reversed_sentence,mod_np,reversed_mod,disambiguating_word,non_adjective,original_logprob,reversed_logprob,ratio,n_params,mpath,revision,seed_name,seed,step
It was a desperate act.,act,act,It was an act desperate., desperate act, act desperate,desperate,False,-14.09849739074707,-19.219287872314453,5.120790481567383,14067712,EleutherAI/pythia-14m,step98000,seed9,9,98000
It was a humane act.,act,act,It was an act humane., humane act, act humane,humane,False,-21.095714569091797,-22.48865509033203,1.3929405212402344,14067712,EleutherAI/pythia-14m,step98000,seed9,9,98000
It was a magic act.,act,act,It was an act magic., magic act, act magic,magic,False,-15.06094741821289,-18.724140167236328,3.6631927490234375,14067712,EleutherAI/pythia-14m,step98000,seed9,9,98000
He had a universal appeal.,appeal,appeal,He had an appeal universal., universal appeal, appeal universal,universal,False,-18.048229217529297,-23.105876922607422,5.057647705078125,14067712,EleutherAI/pythia-14m,step98000,seed9,9,98000
He had an undefinable appeal.,appeal,appeal,He had an appeal undefinable., undefinable appeal, appeal undefinable,undefinable,False,-23.25191307067871,-30.004785537719727,6.752872467041016,14067712,EleutherAI/pythia-14m,step98000,seed9,9,98000
He had a legal appeal.,appeal,appeal,He had an appeal legal., legal appeal, appeal legal,legal,False,-16.368316650390625,-17.335491180419922,0.9671745300292969,14067712,EleutherAI/pythia-14m,step98000,seed9,9,98000
It was a tense atmosphere.,atmosphere,atmosphere,It was an atmosphere tense., tense atmosphere, atmosphere tense,tense,False,-17.86396598815918,-20.852275848388672,2.988309860229492,14067712,EleutherAI/pythia-14m,step98000,seed9,9,98000
It was a hostile atmosphere.,atmosphere,atmosphere,It was an atmosphere hostile., hostile atmosphere, atmosphere hostile,hostile,False,-15.27457046508789,-19.925060272216797,4.650489807128906,14067712,EleutherAI/pythia-14m,step98000,seed9,9,98000
It was a gaseous atmosphere.,atmosphere,atmosphere,It was an atmosphere gaseous., gaseous atmosphere, atmosphere gaseous,gaseous,False,-15.997356414794922,-20.923961639404297,4.926605224609375,14067712,EleutherAI/pythia-14m,step98000,seed9,9,98000
It was a gold band.,band,band,It was a band gold., gold band, band gold,gold,True,-15.521950721740723,-19.426572799682617,3.9046220779418945,14067712,EleutherAI/pythia-14m,step98000,seed9,9,98000
It was a rubber band.,band,band,It was a band rubber., rubber band, band rubber,rubber,True,-13.763961791992188,-20.973814010620117,7.20985221862793,14067712,EleutherAI/pythia-14m,step98000,seed9,9,98000
It was a jazz band.,band,band,It was a band jazz., jazz band, band jazz,jazz,True,-12.718912124633789,-17.896146774291992,5.177234649658203,14067712,EleutherAI/pythia-14m,step98000,seed9,9,98000
There was a police barrier.,barrier,barrier,There was a barrier police., police barrier, barrier police,police,True,-16.79318618774414,-20.61891746520996,3.8257312774658203,14067712,EleutherAI/pythia-14m,step98000,seed9,9,98000
There was a concrete barrier.,barrier,barrier,There was a barrier concrete., concrete barrier, barrier concrete,concrete,False,-16.429851531982422,-20.255361557006836,3.825510025024414,14067712,EleutherAI/pythia-14m,step98000,seed9,9,98000
There was a language barrier.,barrier,barrier,There was a barrier language., language barrier, barrier language,language,True,-19.588043212890625,-19.83571434020996,0.24767112731933594,14067712,EleutherAI/pythia-14m,step98000,seed9,9,98000
He saw a furry bat.,bat,bat,He saw a bat furry., furry bat, bat furry,furry,False,-21.85030746459961,-27.876861572265625,6.026554107666016,14067712,EleutherAI/pythia-14m,step98000,seed9,9,98000
He saw a fruit bat.,bat,bat,He saw a bat fruit., fruit bat, bat fruit,fruit,True,-17.198020935058594,-22.63875961303711,5.440738677978516,14067712,EleutherAI/pythia-14m,step98000,seed9,9,98000
He saw a wooden bat.,bat,bat,He saw a bat wooden., wooden bat, bat wooden,wooden,False,-15.626039505004883,-20.933589935302734,5.307550430297852,14067712,EleutherAI/pythia-14m,step98000,seed9,9,98000
He saw the laser beam.,beam,beam,He saw the beam laser., laser beam, beam laser,laser,True,-12.963147163391113,-17.58179473876953,4.618647575378418,14067712,EleutherAI/pythia-14m,step98000,seed9,9,98000
He saw the bright beam.,beam,beam,He saw the beam bright., bright beam, beam bright,bright,False,-18.053508758544922,-19.593849182128906,1.5403404235839844,14067712,EleutherAI/pythia-14m,step98000,seed9,9,98000
He saw the wood beam.,beam,beam,He saw the beam wood., wood beam, beam wood,wood,True,-19.500873565673828,-20.56598663330078,1.0651130676269531,14067712,EleutherAI/pythia-14m,step98000,seed9,9,98000
She had a toy block.,block,block,She had a block toy., toy block, block toy,toy,True,-16.44281768798828,-20.500764846801758,4.057947158813477,14067712,EleutherAI/pythia-14m,step98000,seed9,9,98000
She had a wooden block.,block,block,She had a block wooden., wooden block, block wooden,wooden,False,-15.199682235717773,-21.204591751098633,6.004909515380859,14067712,EleutherAI/pythia-14m,step98000,seed9,9,98000
She had a mental block.,block,block,She had a block mental., mental block, block mental,mental,False,-14.292917251586914,-20.368715286254883,6.075798034667969,14067712,EleutherAI/pythia-14m,step98000,seed9,9,98000
He has coagulated blood.,blood,blood,He has blood coagulated., coagulated blood, blood coagulated,coagulated,True,-24.225908279418945,-29.541606903076172,5.315698623657227,14067712,EleutherAI/pythia-14m,step98000,seed9,9,98000
He has thin blood.,blood,blood,He has blood thin., thin blood, blood thin,thin,False,-18.554283142089844,-20.731792449951172,2.177509307861328,14067712,EleutherAI/pythia-14m,step98000,seed9,9,98000
He has noble blood.,blood,blood,He has blood noble., noble blood, blood noble,noble,False,-19.293787002563477,-26.370250701904297,7.07646369934082,14067712,EleutherAI/pythia-14m,step98000,seed9,9,98000
It was the ironing board.,board,board,It was the board ironing., ironing board, board ironing,ironing,False,-20.21180534362793,-21.366867065429688,1.1550617218017578,14067712,EleutherAI/pythia-14m,step98000,seed9,9,98000
It was the wooden board.,board,board,It was the board wooden., wooden board, board wooden,wooden,False,-13.721063613891602,-19.75602149963379,6.0349578857421875,14067712,EleutherAI/pythia-14m,step98000,seed9,9,98000
It was the executive board.,board,board,It was the board executive., executive board, board executive,executive,True,-15.013453483581543,-17.179941177368164,2.166487693786621,14067712,EleutherAI/pythia-14m,step98000,seed9,9,98000
He had a best-selling book.,book,book,He had a book best-selling., best-selling book, book best-selling,best-selling,False,-15.408013343811035,-21.90743637084961,6.499423027038574,14067712,EleutherAI/pythia-14m,step98000,seed9,9,98000
He had a popular book.,book,book,He had a book popular., popular book, book popular,popular,False,-16.266712188720703,-19.208024978637695,2.941312789916992,14067712,EleutherAI/pythia-14m,step98000,seed9,9,98000
He had a heavy book.,book,book,He had a book heavy., heavy book, book heavy,heavy,False,-17.793855667114258,-19.441545486450195,1.6476898193359375,14067712,EleutherAI/pythia-14m,step98000,seed9,9,98000
They ate a pancake breakfast.,breakfast,breakfast,They ate a breakfast pancake., pancake breakfast, breakfast pancake,pancake,True,-14.950883865356445,-19.774248123168945,4.8233642578125,14067712,EleutherAI/pythia-14m,step98000,seed9,9,98000
They ate a nutritious breakfast.,breakfast,breakfast,They ate a breakfast nutritious., nutritious breakfast, breakfast nutritious,nutritious,False,-19.210529327392578,-26.888002395629883,7.677473068237305,14067712,EleutherAI/pythia-14m,step98000,seed9,9,98000
They ate a family breakfast.,breakfast,breakfast,They ate a breakfast family., family breakfast, breakfast family,family,True,-13.142738342285156,-16.829160690307617,3.686422348022461,14067712,EleutherAI/pythia-14m,step98000,seed9,9,98000
It was a red cape.,cape,cape,It was a cape red., red cape, cape red,red,False,-17.516576766967773,-19.35604476928711,1.839468002319336,14067712,EleutherAI/pythia-14m,step98000,seed9,9,98000
It was a flowing cape.,cape,cape,It was a cape flowing., flowing cape, cape flowing,flowing,False,-22.915775299072266,-21.186946868896484,-1.7288284301757812,14067712,EleutherAI/pythia-14m,step98000,seed9,9,98000
It was a rocky cape.,cape,cape,It was a cape rocky., rocky cape, cape rocky,rocky,False,-20.4208984375,-23.312740325927734,2.8918418884277344,14067712,EleutherAI/pythia-14m,step98000,seed9,9,98000
It was a beer case.,case,case,It was a case beer., beer case, case beer,beer,True,-16.553497314453125,-19.347705841064453,2.794208526611328,14067712,EleutherAI/pythia-14m,step98000,seed9,9,98000
It was a display case.,case,case,It was a case display., display case, case display,display,True,-15.681941986083984,-18.622913360595703,2.9409713745117188,14067712,EleutherAI/pythia-14m,step98000,seed9,9,98000
It was a divorce case.,case,case,It was a case divorce., divorce case, case divorce,divorce,True,-14.797569274902344,-19.830280303955078,5.032711029052734,14067712,EleutherAI/pythia-14m,step98000,seed9,9,98000
It was a worthy cause.,cause,cause,It was a cause worthy., worthy cause, cause worthy,worthy,False,-14.373922348022461,-19.136066436767578,4.762144088745117,14067712,EleutherAI/pythia-14m,step98000,seed9,9,98000
It was a political cause.,cause,cause,It was a cause political., political cause, cause political,political,False,-14.669893264770508,-21.125232696533203,6.455339431762695,14067712,EleutherAI/pythia-14m,step98000,seed9,9,98000
It was a main cause.,cause,cause,It was a cause main., main cause, cause main,main,False,-13.896505355834961,-21.363178253173828,7.466672897338867,14067712,EleutherAI/pythia-14m,step98000,seed9,9,98000
It was a skin cell.,cell,cell,It was a cell skin., skin cell, cell skin,skin,True,-17.49341583251953,-18.159732818603516,0.6663169860839844,14067712,EleutherAI/pythia-14m,step98000,seed9,9,98000
It was a brain cell.,cell,cell,It was a cell brain., brain cell, cell brain,brain,True,-14.833127975463867,-18.53665542602539,3.7035274505615234,14067712,EleutherAI/pythia-14m,step98000,seed9,9,98000
It was a prison cell.,cell,cell,It was a cell prison., prison cell, cell prison,prison,True,-14.529351234436035,-16.63602066040039,2.1066694259643555,14067712,EleutherAI/pythia-14m,step98000,seed9,9,98000
She had a devilish charm.,charm,charm,She had a charm devilish., devilish charm, charm devilish,devilish,False,-20.300113677978516,-26.80925178527832,6.509138107299805,14067712,EleutherAI/pythia-14m,step98000,seed9,9,98000
She had a natural charm.,charm,charm,She had a charm natural., natural charm, charm natural,natural,False,-15.131253242492676,-21.558277130126953,6.427023887634277,14067712,EleutherAI/pythia-14m,step98000,seed9,9,98000
She had a gold charm.,charm,charm,She had a charm gold., gold charm, charm gold,gold,True,-17.434425354003906,-20.408557891845703,2.974132537841797,14067712,EleutherAI/pythia-14m,step98000,seed9,9,98000
They liked the juicy chicken.,chicken,chicken,They liked the chicken juicy., juicy chicken, chicken juicy,juicy,False,-18.366104125976562,-21.26603126525879,2.8999271392822266,14067712,EleutherAI/pythia-14m,step98000,seed9,9,98000
They liked the roasted chicken.,chicken,chicken,They liked the chicken roasted., roasted chicken, chicken roasted,roasted,False,-16.43735122680664,-19.45255470275879,3.0152034759521484,14067712,EleutherAI/pythia-14m,step98000,seed9,9,98000
They liked the clucking chicken.,chicken,chicken,They liked the chicken clucking., clucking chicken, chicken clucking,clucking,True,-22.761329650878906,-23.278371810913086,0.5170421600341797,14067712,EleutherAI/pythia-14m,step98000,seed9,9,98000
It was a perceptive class.,class,class,It was a class perceptive., perceptive class, class perceptive,perceptive,False,-20.311372756958008,-25.959196090698242,5.647823333740234,14067712,EleutherAI/pythia-14m,step98000,seed9,9,98000
It was a misbehaving class.,class,class,It was a class misbehaving., misbehaving class, class misbehaving,misbehaving,False,-25.454458236694336,-29.420377731323242,3.9659194946289062,14067712,EleutherAI/pythia-14m,step98000,seed9,9,98000
It was a boring class.,class,class,It was a class boring., boring class, class boring,boring,False,-16.44440460205078,-21.68832015991211,5.243915557861328,14067712,EleutherAI/pythia-14m,step98000,seed9,9,98000
It was a film clip.,clip,clip,It was a clip film., film clip, clip film,film,True,-16.144779205322266,-18.592456817626953,2.4476776123046875,14067712,EleutherAI/pythia-14m,step98000,seed9,9,98000
It was a video clip.,clip,clip,It was a clip video., video clip, clip video,video,True,-13.20533561706543,-20.066272735595703,6.860937118530273,14067712,EleutherAI/pythia-14m,step98000,seed9,9,98000
It was a hair clip.,clip,clip,It was a clip hair., hair clip, clip hair,hair,True,-19.052371978759766,-22.768177032470703,3.7158050537109375,14067712,EleutherAI/pythia-14m,step98000,seed9,9,98000
It was an icy cold.,cold,cold,It was an cold icy., icy cold, cold icy,icy,False,-12.448022842407227,-18.28583335876465,5.837810516357422,14067712,EleutherAI/pythia-14m,step98000,seed9,9,98000
It was a freezing cold.,cold,cold,It was a cold freezing., freezing cold, cold freezing,freezing,False,-14.461371421813965,-15.400642395019531,0.9392709732055664,14067712,EleutherAI/pythia-14m,step98000,seed9,9,98000
It was a chest cold.,cold,cold,It was a cold chest., chest cold, cold chest,chest,False,-17.142601013183594,-15.258552551269531,-1.8840484619140625,14067712,EleutherAI/pythia-14m,step98000,seed9,9,98000
It was a gossip column.,column,column,It was a column gossip., gossip column, column gossip,gossip,True,-19.213171005249023,-23.744125366210938,4.530954360961914,14067712,EleutherAI/pythia-14m,step98000,seed9,9,98000
It was a sports column.,column,column,It was a column sports., sports column, column sports,sports,True,-18.781557083129883,-23.553604125976562,4.77204704284668,14067712,EleutherAI/pythia-14m,step98000,seed9,9,98000
It was a concrete column.,column,column,It was a column concrete., concrete column, column concrete,concrete,False,-17.090635299682617,-21.334548950195312,4.243913650512695,14067712,EleutherAI/pythia-14m,step98000,seed9,9,98000
He liked the investment company.,company,company,He liked the company investment., investment company, company investment,investment,True,-14.904125213623047,-15.563529968261719,0.6594047546386719,14067712,EleutherAI/pythia-14m,step98000,seed9,9,98000
He liked the pharmaceutical company.,company,company,He liked the company pharmaceutical., pharmaceutical company, company pharmaceutical,pharmaceutical,False,-11.75641918182373,-17.557456970214844,5.801037788391113,14067712,EleutherAI/pythia-14m,step98000,seed9,9,98000
He liked the pleasant company.,company,company,He liked the company pleasant., pleasant company, company pleasant,pleasant,False,-18.589603424072266,-18.296226501464844,-0.2933769226074219,14067712,EleutherAI/pythia-14m,step98000,seed9,9,98000
It was a waffle cone.,cone,cone,It was a cone waffle., waffle cone, cone waffle,waffle,True,-27.696941375732422,-30.10371208190918,2.406770706176758,14067712,EleutherAI/pythia-14m,step98000,seed9,9,98000
It was a sugar cone.,cone,cone,It was a cone sugar., sugar cone, cone sugar,sugar,True,-18.98239517211914,-23.6945743560791,4.712179183959961,14067712,EleutherAI/pythia-14m,step98000,seed9,9,98000
It was an orange cone.,cone,cone,It was an cone orange., orange cone, cone orange,orange,False,-14.085002899169922,-23.385826110839844,9.300823211669922,14067712,EleutherAI/pythia-14m,step98000,seed9,9,98000
He made a charitable contribution.,contribution,contribution,He made a contribution charitable., charitable contribution, contribution charitable,charitable,False,-14.546459197998047,-24.76246452331543,10.216005325317383,14067712,EleutherAI/pythia-14m,step98000,seed9,9,98000
He made a voluntary contribution.,contribution,contribution,He made a contribution voluntary., voluntary contribution, contribution voluntary,voluntary,False,-14.472540855407715,-22.98682975769043,8.514288902282715,14067712,EleutherAI/pythia-14m,step98000,seed9,9,98000
He made a scholarly contribution.,contribution,contribution,He made a contribution scholarly., scholarly contribution, contribution scholarly,scholarly,False,-16.953227996826172,-23.22688102722168,6.273653030395508,14067712,EleutherAI/pythia-14m,step98000,seed9,9,98000
That was the noble count.,count,count,That was the count noble., noble count, count noble,noble,False,-18.869068145751953,-23.55182647705078,4.682758331298828,14067712,EleutherAI/pythia-14m,step98000,seed9,9,98000
That was the vengeful count.,count,count,That was the count vengeful., vengeful count, count vengeful,vengeful,False,-22.48305892944336,-26.101301193237305,3.6182422637939453,14067712,EleutherAI/pythia-14m,step98000,seed9,9,98000
That was the final count.,count,count,That was the count final., final count, count final,final,False,-13.656076431274414,-19.732521057128906,6.076444625854492,14067712,EleutherAI/pythia-14m,step98000,seed9,9,98000
It was an introductory course.,course,course,It was an course introductory., introductory course, course introductory,introductory,False,-12.440606117248535,-24.69809913635254,12.257493019104004,14067712,EleutherAI/pythia-14m,step98000,seed9,9,98000
It was a pass-fail course.,course,course,It was a course pass-fail., pass-fail course, course pass-fail,pass-fail,False,-28.3275203704834,-34.01041030883789,5.682889938354492,14067712,EleutherAI/pythia-14m,step98000,seed9,9,98000
It was a charted course.,course,course,It was a course charted., charted course, course charted,charted,False,-19.98431396484375,-22.771865844726562,2.7875518798828125,14067712,EleutherAI/pythia-14m,step98000,seed9,9,98000
It was a dinner date.,date,date,It was a date dinner., dinner date, date dinner,dinner,True,-18.359346389770508,-20.025447845458984,1.6661014556884766,14067712,EleutherAI/pythia-14m,step98000,seed9,9,98000
It was a blind date.,date,date,It was a date blind., blind date, date blind,blind,False,-18.96784210205078,-21.05587387084961,2.088031768798828,14067712,EleutherAI/pythia-14m,step98000,seed9,9,98000
It was an expiration date.,date,date,It was an date expiration., expiration date, date expiration,expiration,True,-13.068290710449219,-23.559799194335938,10.491508483886719,14067712,EleutherAI/pythia-14m,step98000,seed9,9,98000
It was about forty degrees.,degree,degrees,It was about degrees forty., forty degrees, degrees forty,forty,True,-13.93521499633789,-20.190582275390625,6.255367279052734,14067712,EleutherAI/pythia-14m,step98000,seed9,9,98000
It was about fifty degrees.,degree,degrees,It was about degrees fifty., fifty degrees, degrees fifty,fifty,True,-13.676133155822754,-20.247283935546875,6.571150779724121,14067712,EleutherAI/pythia-14m,step98000,seed9,9,98000
It was about associate degrees.,degree,degrees,It was about degrees associate., associate degrees, degrees associate,associate,False,-18.889469146728516,-23.049591064453125,4.160121917724609,14067712,EleutherAI/pythia-14m,step98000,seed9,9,98000
They liked the floral design.,design,design,They liked the design floral., floral design, design floral,floral,False,-16.55506134033203,-21.79458236694336,5.239521026611328,14067712,EleutherAI/pythia-14m,step98000,seed9,9,98000
They liked the geometric design.,design,design,They liked the design geometric., geometric design, design geometric,geometric,False,-16.8646240234375,-21.06777572631836,4.203151702880859,14067712,EleutherAI/pythia-14m,step98000,seed9,9,98000
They liked the product design.,design,design,They liked the design product., product design, design product,product,True,-15.396892547607422,-15.786404609680176,0.3895120620727539,14067712,EleutherAI/pythia-14m,step98000,seed9,9,98000
They liked the turkey dinner.,dinner,dinner,They liked the dinner turkey., turkey dinner, dinner turkey,turkey,True,-18.185932159423828,-18.74315643310547,0.5572242736816406,14067712,EleutherAI/pythia-14m,step98000,seed9,9,98000
They liked the light dinner.,dinner,dinner,They liked the dinner light., light dinner, dinner light,light,False,-18.311038970947266,-17.82646942138672,-0.4845695495605469,14067712,EleutherAI/pythia-14m,step98000,seed9,9,98000
They liked the formal dinner.,dinner,dinner,They liked the dinner formal., formal dinner, dinner formal,formal,False,-17.201858520507812,-20.57738494873047,3.3755264282226562,14067712,EleutherAI/pythia-14m,step98000,seed9,9,98000
He had a recurring dream.,dream,dream,He had a dream recurring., recurring dream, dream recurring,recurring,False,-16.56767463684082,-20.833715438842773,4.266040802001953,14067712,EleutherAI/pythia-14m,step98000,seed9,9,98000
He had a bad dream.,dream,dream,He had a dream bad., bad dream, dream bad,bad,False,-12.261979103088379,-16.969152450561523,4.7071733474731445,14067712,EleutherAI/pythia-14m,step98000,seed9,9,98000
He had a childhood dream.,dream,dream,He had a dream childhood., childhood dream, dream childhood,childhood,True,-13.648282051086426,-18.909032821655273,5.260750770568848,14067712,EleutherAI/pythia-14m,step98000,seed9,9,98000
It was a grueling drill.,drill,drill,It was a drill grueling., grueling drill, drill grueling,grueling,False,-21.226776123046875,-27.7081356048584,6.481359481811523,14067712,EleutherAI/pythia-14m,step98000,seed9,9,98000
It was a challenging drill.,drill,drill,It was a drill challenging., challenging drill, drill challenging,challenging,False,-17.448087692260742,-20.961105346679688,3.5130176544189453,14067712,EleutherAI/pythia-14m,step98000,seed9,9,98000
It was an electric drill.,drill,drill,It was an drill electric., electric drill, drill electric,electric,False,-13.760183334350586,-21.81979751586914,8.059614181518555,14067712,EleutherAI/pythia-14m,step98000,seed9,9,98000
It was a multiple-choice examination.,examination,examination,It was an examination multiple-choice., multiple-choice examination, examination multiple-choice,multiple-choice,False,-30.541149139404297,-36.42512893676758,5.883979797363281,14067712,EleutherAI/pythia-14m,step98000,seed9,9,98000
It was a difficult examination.,examination,examination,It was an examination difficult., difficult examination, examination difficult,difficult,False,-15.611743927001953,-20.102622985839844,4.490879058837891,14067712,EleutherAI/pythia-14m,step98000,seed9,9,98000
It was a prostate examination.,examination,examination,It was an examination prostate., prostate examination, examination prostate,prostate,True,-22.032773971557617,-25.15312957763672,3.1203556060791016,14067712,EleutherAI/pythia-14m,step98000,seed9,9,98000
They had an electric fan.,fan,fan,They had an fan electric., electric fan, fan electric,electric,False,-12.581550598144531,-23.343891143798828,10.762340545654297,14067712,EleutherAI/pythia-14m,step98000,seed9,9,98000
They had a ceiling fan.,fan,fan,They had a fan ceiling., ceiling fan, fan ceiling,ceiling,True,-19.028278350830078,-23.552013397216797,4.523735046386719,14067712,EleutherAI/pythia-14m,step98000,seed9,9,98000
They had a zealous fan.,fan,fan,They had a fan zealous., zealous fan, fan zealous,zealous,False,-24.20513153076172,-28.905559539794922,4.700428009033203,14067712,EleutherAI/pythia-14m,step98000,seed9,9,98000
She had a text file.,file,file,She had a file text., text file, file text,text,True,-13.944692611694336,-19.909168243408203,5.964475631713867,14067712,EleutherAI/pythia-14m,step98000,seed9,9,98000
She had a data file.,file,file,She had a file data., data file, file data,data,True,-15.90797233581543,-19.528675079345703,3.6207027435302734,14067712,EleutherAI/pythia-14m,step98000,seed9,9,98000
She had a nail file.,file,file,She had a file nail., nail file, file nail,nail,True,-19.440723419189453,-22.435108184814453,2.994384765625,14067712,EleutherAI/pythia-14m,step98000,seed9,9,98000
It was an action film.,film,film,It was an film action., action film, film action,action,True,-14.225156784057617,-17.822620391845703,3.597463607788086,14067712,EleutherAI/pythia-14m,step98000,seed9,9,98000
It was a censored film.,film,film,It was a film censored., censored film, film censored,censored,False,-22.038578033447266,-22.085668563842773,0.04709053039550781,14067712,EleutherAI/pythia-14m,step98000,seed9,9,98000
It was a transparent film.,film,film,It was a film transparent., transparent film, film transparent,transparent,False,-15.801483154296875,-19.706851959228516,3.9053688049316406,14067712,EleutherAI/pythia-14m,step98000,seed9,9,98000
It was a charitable foundation.,foundation,foundation,It was a foundation charitable., charitable foundation, foundation charitable,charitable,False,-14.694437026977539,-22.24251937866211,7.54808235168457,14067712,EleutherAI/pythia-14m,step98000,seed9,9,98000
It was an educational foundation.,foundation,foundation,It was an foundation educational., educational foundation, foundation educational,educational,False,-15.471874237060547,-23.32958221435547,7.857707977294922,14067712,EleutherAI/pythia-14m,step98000,seed9,9,98000
It was a wooden foundation.,foundation,foundation,It was a foundation wooden., wooden foundation, foundation wooden,wooden,False,-14.719587326049805,-20.24843978881836,5.528852462768555,14067712,EleutherAI/pythia-14m,step98000,seed9,9,98000
It was a mathematical function.,function,function,It was a function mathematical., mathematical function, function mathematical,mathematical,False,-14.731317520141602,-17.920120239257812,3.188802719116211,14067712,EleutherAI/pythia-14m,step98000,seed9,9,98000
It was a linear function.,function,function,It was a function linear., linear function, function linear,linear,False,-14.404159545898438,-20.170211791992188,5.76605224609375,14067712,EleutherAI/pythia-14m,step98000,seed9,9,98000
