sentence,word,string,reversed_sentence,mod_np,reversed_mod,disambiguating_word,non_adjective,original_logprob,reversed_logprob,ratio,n_params,mpath,revision,seed_name,seed,step
It was a desperate act.,act,act,It was an act desperate., desperate act, act desperate,desperate,False,-14.475634574890137,-19.418434143066406,4.9427995681762695,14067712,EleutherAI/pythia-14m,step142000,seed1,1,142000
It was a humane act.,act,act,It was an act humane., humane act, act humane,humane,False,-16.858123779296875,-19.239826202392578,2.381702423095703,14067712,EleutherAI/pythia-14m,step142000,seed1,1,142000
It was a magic act.,act,act,It was an act magic., magic act, act magic,magic,False,-15.093254089355469,-19.404151916503906,4.3108978271484375,14067712,EleutherAI/pythia-14m,step142000,seed1,1,142000
He had a universal appeal.,appeal,appeal,He had an appeal universal., universal appeal, appeal universal,universal,False,-19.175527572631836,-21.66455078125,2.489023208618164,14067712,EleutherAI/pythia-14m,step142000,seed1,1,142000
He had an undefinable appeal.,appeal,appeal,He had an appeal undefinable., undefinable appeal, appeal undefinable,undefinable,False,-23.078235626220703,-27.545204162597656,4.466968536376953,14067712,EleutherAI/pythia-14m,step142000,seed1,1,142000
He had a legal appeal.,appeal,appeal,He had an appeal legal., legal appeal, appeal legal,legal,False,-16.32316017150879,-17.0875244140625,0.7643642425537109,14067712,EleutherAI/pythia-14m,step142000,seed1,1,142000
It was a tense atmosphere.,atmosphere,atmosphere,It was an atmosphere tense., tense atmosphere, atmosphere tense,tense,False,-16.760698318481445,-20.910350799560547,4.149652481079102,14067712,EleutherAI/pythia-14m,step142000,seed1,1,142000
It was a hostile atmosphere.,atmosphere,atmosphere,It was an atmosphere hostile., hostile atmosphere, atmosphere hostile,hostile,False,-14.864862442016602,-20.693431854248047,5.828569412231445,14067712,EleutherAI/pythia-14m,step142000,seed1,1,142000
It was a gaseous atmosphere.,atmosphere,atmosphere,It was an atmosphere gaseous., gaseous atmosphere, atmosphere gaseous,gaseous,False,-18.000450134277344,-22.881053924560547,4.880603790283203,14067712,EleutherAI/pythia-14m,step142000,seed1,1,142000
It was a gold band.,band,band,It was a band gold., gold band, band gold,gold,True,-14.77380657196045,-19.204803466796875,4.430996894836426,14067712,EleutherAI/pythia-14m,step142000,seed1,1,142000
It was a rubber band.,band,band,It was a band rubber., rubber band, band rubber,rubber,True,-14.015909194946289,-21.742523193359375,7.726613998413086,14067712,EleutherAI/pythia-14m,step142000,seed1,1,142000
It was a jazz band.,band,band,It was a band jazz., jazz band, band jazz,jazz,True,-13.581205368041992,-16.637664794921875,3.056459426879883,14067712,EleutherAI/pythia-14m,step142000,seed1,1,142000
There was a police barrier.,barrier,barrier,There was a barrier police., police barrier, barrier police,police,True,-16.765769958496094,-18.471065521240234,1.7052955627441406,14067712,EleutherAI/pythia-14m,step142000,seed1,1,142000
There was a concrete barrier.,barrier,barrier,There was a barrier concrete., concrete barrier, barrier concrete,concrete,False,-14.65157699584961,-19.297603607177734,4.646026611328125,14067712,EleutherAI/pythia-14m,step142000,seed1,1,142000
There was a language barrier.,barrier,barrier,There was a barrier language., language barrier, barrier language,language,True,-18.439579010009766,-20.551265716552734,2.1116867065429688,14067712,EleutherAI/pythia-14m,step142000,seed1,1,142000
He saw a furry bat.,bat,bat,He saw a bat furry., furry bat, bat furry,furry,False,-22.117218017578125,-23.957286834716797,1.8400688171386719,14067712,EleutherAI/pythia-14m,step142000,seed1,1,142000
He saw a fruit bat.,bat,bat,He saw a bat fruit., fruit bat, bat fruit,fruit,True,-17.04852294921875,-19.367650985717773,2.3191280364990234,14067712,EleutherAI/pythia-14m,step142000,seed1,1,142000
He saw a wooden bat.,bat,bat,He saw a bat wooden., wooden bat, bat wooden,wooden,False,-14.06576156616211,-20.234106063842773,6.168344497680664,14067712,EleutherAI/pythia-14m,step142000,seed1,1,142000
He saw the laser beam.,beam,beam,He saw the beam laser., laser beam, beam laser,laser,True,-12.503878593444824,-18.20030403137207,5.696425437927246,14067712,EleutherAI/pythia-14m,step142000,seed1,1,142000
He saw the bright beam.,beam,beam,He saw the beam bright., bright beam, beam bright,bright,False,-17.054428100585938,-18.36302375793457,1.3085956573486328,14067712,EleutherAI/pythia-14m,step142000,seed1,1,142000
He saw the wood beam.,beam,beam,He saw the beam wood., wood beam, beam wood,wood,True,-18.375804901123047,-20.57042121887207,2.1946163177490234,14067712,EleutherAI/pythia-14m,step142000,seed1,1,142000
She had a toy block.,block,block,She had a block toy., toy block, block toy,toy,True,-17.723133087158203,-20.262012481689453,2.53887939453125,14067712,EleutherAI/pythia-14m,step142000,seed1,1,142000
She had a wooden block.,block,block,She had a block wooden., wooden block, block wooden,wooden,False,-16.345706939697266,-21.885791778564453,5.5400848388671875,14067712,EleutherAI/pythia-14m,step142000,seed1,1,142000
She had a mental block.,block,block,She had a block mental., mental block, block mental,mental,False,-17.637117385864258,-21.760547637939453,4.123430252075195,14067712,EleutherAI/pythia-14m,step142000,seed1,1,142000
He has coagulated blood.,blood,blood,He has blood coagulated., coagulated blood, blood coagulated,coagulated,True,-32.077728271484375,-33.013824462890625,0.93609619140625,14067712,EleutherAI/pythia-14m,step142000,seed1,1,142000
He has thin blood.,blood,blood,He has blood thin., thin blood, blood thin,thin,False,-18.657453536987305,-20.51880645751953,1.8613529205322266,14067712,EleutherAI/pythia-14m,step142000,seed1,1,142000
He has noble blood.,blood,blood,He has blood noble., noble blood, blood noble,noble,False,-20.186216354370117,-25.40088653564453,5.214670181274414,14067712,EleutherAI/pythia-14m,step142000,seed1,1,142000
It was the ironing board.,board,board,It was the board ironing., ironing board, board ironing,ironing,False,-21.86676025390625,-23.119169235229492,1.2524089813232422,14067712,EleutherAI/pythia-14m,step142000,seed1,1,142000
It was the wooden board.,board,board,It was the board wooden., wooden board, board wooden,wooden,False,-15.827503204345703,-20.64710235595703,4.819599151611328,14067712,EleutherAI/pythia-14m,step142000,seed1,1,142000
It was the executive board.,board,board,It was the board executive., executive board, board executive,executive,True,-15.06743049621582,-20.08032989501953,5.012899398803711,14067712,EleutherAI/pythia-14m,step142000,seed1,1,142000
He had a best-selling book.,book,book,He had a book best-selling., best-selling book, book best-selling,best-selling,False,-14.621682167053223,-21.471633911132812,6.84995174407959,14067712,EleutherAI/pythia-14m,step142000,seed1,1,142000
He had a popular book.,book,book,He had a book popular., popular book, book popular,popular,False,-15.229171752929688,-18.913150787353516,3.683979034423828,14067712,EleutherAI/pythia-14m,step142000,seed1,1,142000
He had a heavy book.,book,book,He had a book heavy., heavy book, book heavy,heavy,False,-15.343389511108398,-19.230899810791016,3.887510299682617,14067712,EleutherAI/pythia-14m,step142000,seed1,1,142000
They ate a pancake breakfast.,breakfast,breakfast,They ate a breakfast pancake., pancake breakfast, breakfast pancake,pancake,True,-12.940256118774414,-15.159955024719238,2.219698905944824,14067712,EleutherAI/pythia-14m,step142000,seed1,1,142000
They ate a nutritious breakfast.,breakfast,breakfast,They ate a breakfast nutritious., nutritious breakfast, breakfast nutritious,nutritious,False,-15.207120895385742,-18.9534912109375,3.746370315551758,14067712,EleutherAI/pythia-14m,step142000,seed1,1,142000
They ate a family breakfast.,breakfast,breakfast,They ate a breakfast family., family breakfast, breakfast family,family,True,-12.100111961364746,-14.211944580078125,2.111832618713379,14067712,EleutherAI/pythia-14m,step142000,seed1,1,142000
It was a red cape.,cape,cape,It was a cape red., red cape, cape red,red,False,-21.50483512878418,-24.587867736816406,3.0830326080322266,14067712,EleutherAI/pythia-14m,step142000,seed1,1,142000
It was a flowing cape.,cape,cape,It was a cape flowing., flowing cape, cape flowing,flowing,False,-24.650474548339844,-26.072486877441406,1.4220123291015625,14067712,EleutherAI/pythia-14m,step142000,seed1,1,142000
It was a rocky cape.,cape,cape,It was a cape rocky., rocky cape, cape rocky,rocky,False,-20.63905143737793,-27.496925354003906,6.857873916625977,14067712,EleutherAI/pythia-14m,step142000,seed1,1,142000
It was a beer case.,case,case,It was a case beer., beer case, case beer,beer,True,-15.081428527832031,-20.264883041381836,5.183454513549805,14067712,EleutherAI/pythia-14m,step142000,seed1,1,142000
It was a display case.,case,case,It was a case display., display case, case display,display,True,-14.158883094787598,-18.011831283569336,3.8529481887817383,14067712,EleutherAI/pythia-14m,step142000,seed1,1,142000
It was a divorce case.,case,case,It was a case divorce., divorce case, case divorce,divorce,True,-12.415142059326172,-19.844839096069336,7.429697036743164,14067712,EleutherAI/pythia-14m,step142000,seed1,1,142000
It was a worthy cause.,cause,cause,It was a cause worthy., worthy cause, cause worthy,worthy,False,-13.86678695678711,-19.20859718322754,5.34181022644043,14067712,EleutherAI/pythia-14m,step142000,seed1,1,142000
It was a political cause.,cause,cause,It was a cause political., political cause, cause political,political,False,-15.748371124267578,-19.67734718322754,3.928976058959961,14067712,EleutherAI/pythia-14m,step142000,seed1,1,142000
It was a main cause.,cause,cause,It was a cause main., main cause, cause main,main,False,-13.986812591552734,-20.97702980041504,6.990217208862305,14067712,EleutherAI/pythia-14m,step142000,seed1,1,142000
It was a skin cell.,cell,cell,It was a cell skin., skin cell, cell skin,skin,True,-17.59166717529297,-18.174428939819336,0.5827617645263672,14067712,EleutherAI/pythia-14m,step142000,seed1,1,142000
It was a brain cell.,cell,cell,It was a cell brain., brain cell, cell brain,brain,True,-15.938462257385254,-17.466421127319336,1.527958869934082,14067712,EleutherAI/pythia-14m,step142000,seed1,1,142000
It was a prison cell.,cell,cell,It was a cell prison., prison cell, cell prison,prison,True,-15.563005447387695,-19.849599838256836,4.286594390869141,14067712,EleutherAI/pythia-14m,step142000,seed1,1,142000
She had a devilish charm.,charm,charm,She had a charm devilish., devilish charm, charm devilish,devilish,False,-20.571979522705078,-29.485519409179688,8.91353988647461,14067712,EleutherAI/pythia-14m,step142000,seed1,1,142000
She had a natural charm.,charm,charm,She had a charm natural., natural charm, charm natural,natural,False,-15.052841186523438,-20.97089385986328,5.918052673339844,14067712,EleutherAI/pythia-14m,step142000,seed1,1,142000
She had a gold charm.,charm,charm,She had a charm gold., gold charm, charm gold,gold,True,-18.807044982910156,-20.20990753173828,1.402862548828125,14067712,EleutherAI/pythia-14m,step142000,seed1,1,142000
They liked the juicy chicken.,chicken,chicken,They liked the chicken juicy., juicy chicken, chicken juicy,juicy,False,-18.38751792907715,-22.527626037597656,4.140108108520508,14067712,EleutherAI/pythia-14m,step142000,seed1,1,142000
They liked the roasted chicken.,chicken,chicken,They liked the chicken roasted., roasted chicken, chicken roasted,roasted,False,-16.434326171875,-17.889163970947266,1.4548377990722656,14067712,EleutherAI/pythia-14m,step142000,seed1,1,142000
They liked the clucking chicken.,chicken,chicken,They liked the chicken clucking., clucking chicken, chicken clucking,clucking,True,-22.680498123168945,-23.76112937927246,1.0806312561035156,14067712,EleutherAI/pythia-14m,step142000,seed1,1,142000
It was a perceptive class.,class,class,It was a class perceptive., perceptive class, class perceptive,perceptive,False,-21.819095611572266,-25.522369384765625,3.7032737731933594,14067712,EleutherAI/pythia-14m,step142000,seed1,1,142000
It was a misbehaving class.,class,class,It was a class misbehaving., misbehaving class, class misbehaving,misbehaving,False,-22.32651138305664,-28.579761505126953,6.2532501220703125,14067712,EleutherAI/pythia-14m,step142000,seed1,1,142000
It was a boring class.,class,class,It was a class boring., boring class, class boring,boring,False,-16.418800354003906,-20.40186882019043,3.9830684661865234,14067712,EleutherAI/pythia-14m,step142000,seed1,1,142000
It was a film clip.,clip,clip,It was a clip film., film clip, clip film,film,True,-16.817583084106445,-18.934226989746094,2.1166439056396484,14067712,EleutherAI/pythia-14m,step142000,seed1,1,142000
It was a video clip.,clip,clip,It was a clip video., video clip, clip video,video,True,-12.942365646362305,-17.760154724121094,4.817789077758789,14067712,EleutherAI/pythia-14m,step142000,seed1,1,142000
It was a hair clip.,clip,clip,It was a clip hair., hair clip, clip hair,hair,True,-18.35243797302246,-23.950950622558594,5.598512649536133,14067712,EleutherAI/pythia-14m,step142000,seed1,1,142000
It was an icy cold.,cold,cold,It was an cold icy., icy cold, cold icy,icy,False,-12.045998573303223,-19.47846794128418,7.432469367980957,14067712,EleutherAI/pythia-14m,step142000,seed1,1,142000
It was a freezing cold.,cold,cold,It was a cold freezing., freezing cold, cold freezing,freezing,False,-13.362091064453125,-15.04538345336914,1.6832923889160156,14067712,EleutherAI/pythia-14m,step142000,seed1,1,142000
It was a chest cold.,cold,cold,It was a cold chest., chest cold, cold chest,chest,False,-16.53026008605957,-14.14365005493164,-2.3866100311279297,14067712,EleutherAI/pythia-14m,step142000,seed1,1,142000
It was a gossip column.,column,column,It was a column gossip., gossip column, column gossip,gossip,True,-20.80699920654297,-23.469682693481445,2.6626834869384766,14067712,EleutherAI/pythia-14m,step142000,seed1,1,142000
It was a sports column.,column,column,It was a column sports., sports column, column sports,sports,True,-20.328067779541016,-21.902055740356445,1.5739879608154297,14067712,EleutherAI/pythia-14m,step142000,seed1,1,142000
It was a concrete column.,column,column,It was a column concrete., concrete column, column concrete,concrete,False,-18.766923904418945,-21.015092849731445,2.2481689453125,14067712,EleutherAI/pythia-14m,step142000,seed1,1,142000
He liked the investment company.,company,company,He liked the company investment., investment company, company investment,investment,True,-15.726573944091797,-16.762569427490234,1.0359954833984375,14067712,EleutherAI/pythia-14m,step142000,seed1,1,142000
He liked the pharmaceutical company.,company,company,He liked the company pharmaceutical., pharmaceutical company, company pharmaceutical,pharmaceutical,False,-14.300015449523926,-19.050899505615234,4.750884056091309,14067712,EleutherAI/pythia-14m,step142000,seed1,1,142000
He liked the pleasant company.,company,company,He liked the company pleasant., pleasant company, company pleasant,pleasant,False,-18.878767013549805,-19.371212005615234,0.4924449920654297,14067712,EleutherAI/pythia-14m,step142000,seed1,1,142000
It was a waffle cone.,cone,cone,It was a cone waffle., waffle cone, cone waffle,waffle,True,-28.497730255126953,-28.609439849853516,0.1117095947265625,14067712,EleutherAI/pythia-14m,step142000,seed1,1,142000
It was a sugar cone.,cone,cone,It was a cone sugar., sugar cone, cone sugar,sugar,True,-20.885459899902344,-24.522682189941406,3.6372222900390625,14067712,EleutherAI/pythia-14m,step142000,seed1,1,142000
It was an orange cone.,cone,cone,It was an cone orange., orange cone, cone orange,orange,False,-17.651145935058594,-27.335859298706055,9.684713363647461,14067712,EleutherAI/pythia-14m,step142000,seed1,1,142000
He made a charitable contribution.,contribution,contribution,He made a contribution charitable., charitable contribution, contribution charitable,charitable,False,-16.537179946899414,-24.608125686645508,8.070945739746094,14067712,EleutherAI/pythia-14m,step142000,seed1,1,142000
He made a voluntary contribution.,contribution,contribution,He made a contribution voluntary., voluntary contribution, contribution voluntary,voluntary,False,-18.177959442138672,-23.969942092895508,5.791982650756836,14067712,EleutherAI/pythia-14m,step142000,seed1,1,142000
He made a scholarly contribution.,contribution,contribution,He made a contribution scholarly., scholarly contribution, contribution scholarly,scholarly,False,-19.85175132751465,-24.943696975708008,5.091945648193359,14067712,EleutherAI/pythia-14m,step142000,seed1,1,142000
That was the noble count.,count,count,That was the count noble., noble count, count noble,noble,False,-17.001541137695312,-24.53502655029297,7.533485412597656,14067712,EleutherAI/pythia-14m,step142000,seed1,1,142000
That was the vengeful count.,count,count,That was the count vengeful., vengeful count, count vengeful,vengeful,False,-25.382102966308594,-31.813072204589844,6.43096923828125,14067712,EleutherAI/pythia-14m,step142000,seed1,1,142000
That was the final count.,count,count,That was the count final., final count, count final,final,False,-12.723739624023438,-18.72985076904297,6.006111145019531,14067712,EleutherAI/pythia-14m,step142000,seed1,1,142000
It was an introductory course.,course,course,It was an course introductory., introductory course, course introductory,introductory,False,-14.382253646850586,-24.430469512939453,10.048215866088867,14067712,EleutherAI/pythia-14m,step142000,seed1,1,142000
It was a pass-fail course.,course,course,It was a course pass-fail., pass-fail course, course pass-fail,pass-fail,False,-28.8272647857666,-32.32939910888672,3.502134323120117,14067712,EleutherAI/pythia-14m,step142000,seed1,1,142000
It was a charted course.,course,course,It was a course charted., charted course, course charted,charted,False,-22.805727005004883,-25.00436019897461,2.1986331939697266,14067712,EleutherAI/pythia-14m,step142000,seed1,1,142000
It was a dinner date.,date,date,It was a date dinner., dinner date, date dinner,dinner,True,-15.856854438781738,-20.80596160888672,4.9491071701049805,14067712,EleutherAI/pythia-14m,step142000,seed1,1,142000
It was a blind date.,date,date,It was a date blind., blind date, date blind,blind,False,-18.621318817138672,-22.49834442138672,3.877025604248047,14067712,EleutherAI/pythia-14m,step142000,seed1,1,142000
It was an expiration date.,date,date,It was an date expiration., expiration date, date expiration,expiration,True,-11.781916618347168,-26.1704044342041,14.388487815856934,14067712,EleutherAI/pythia-14m,step142000,seed1,1,142000
It was about forty degrees.,degree,degrees,It was about degrees forty., forty degrees, degrees forty,forty,True,-16.53668212890625,-22.432649612426758,5.895967483520508,14067712,EleutherAI/pythia-14m,step142000,seed1,1,142000
It was about fifty degrees.,degree,degrees,It was about degrees fifty., fifty degrees, degrees fifty,fifty,True,-15.834161758422852,-22.478059768676758,6.643898010253906,14067712,EleutherAI/pythia-14m,step142000,seed1,1,142000
It was about associate degrees.,degree,degrees,It was about degrees associate., associate degrees, degrees associate,associate,False,-23.794225692749023,-25.378450393676758,1.5842247009277344,14067712,EleutherAI/pythia-14m,step142000,seed1,1,142000
They liked the floral design.,design,design,They liked the design floral., floral design, design floral,floral,False,-17.14625358581543,-20.9671630859375,3.8209095001220703,14067712,EleutherAI/pythia-14m,step142000,seed1,1,142000
They liked the geometric design.,design,design,They liked the design geometric., geometric design, design geometric,geometric,False,-16.451473236083984,-20.1259765625,3.6745033264160156,14067712,EleutherAI/pythia-14m,step142000,seed1,1,142000
They liked the product design.,design,design,They liked the design product., product design, design product,product,True,-16.33386993408203,-16.7977294921875,0.46385955810546875,14067712,EleutherAI/pythia-14m,step142000,seed1,1,142000
They liked the turkey dinner.,dinner,dinner,They liked the dinner turkey., turkey dinner, dinner turkey,turkey,True,-17.135860443115234,-18.842178344726562,1.7063179016113281,14067712,EleutherAI/pythia-14m,step142000,seed1,1,142000
They liked the light dinner.,dinner,dinner,They liked the dinner light., light dinner, dinner light,light,False,-17.77531623840332,-18.759780883789062,0.9844646453857422,14067712,EleutherAI/pythia-14m,step142000,seed1,1,142000
They liked the formal dinner.,dinner,dinner,They liked the dinner formal., formal dinner, dinner formal,formal,False,-17.02875328063965,-20.172256469726562,3.143503189086914,14067712,EleutherAI/pythia-14m,step142000,seed1,1,142000
He had a recurring dream.,dream,dream,He had a dream recurring., recurring dream, dream recurring,recurring,False,-15.2086181640625,-17.98434066772461,2.7757225036621094,14067712,EleutherAI/pythia-14m,step142000,seed1,1,142000
He had a bad dream.,dream,dream,He had a dream bad., bad dream, dream bad,bad,False,-11.367128372192383,-15.50472640991211,4.137598037719727,14067712,EleutherAI/pythia-14m,step142000,seed1,1,142000
He had a childhood dream.,dream,dream,He had a dream childhood., childhood dream, dream childhood,childhood,True,-14.156261444091797,-17.90389633178711,3.7476348876953125,14067712,EleutherAI/pythia-14m,step142000,seed1,1,142000
It was a grueling drill.,drill,drill,It was a drill grueling., grueling drill, drill grueling,grueling,False,-21.640920639038086,-24.68922233581543,3.0483016967773438,14067712,EleutherAI/pythia-14m,step142000,seed1,1,142000
It was a challenging drill.,drill,drill,It was a drill challenging., challenging drill, drill challenging,challenging,False,-18.568859100341797,-22.340965270996094,3.772106170654297,14067712,EleutherAI/pythia-14m,step142000,seed1,1,142000
It was an electric drill.,drill,drill,It was an drill electric., electric drill, drill electric,electric,False,-16.561128616333008,-24.723312377929688,8.16218376159668,14067712,EleutherAI/pythia-14m,step142000,seed1,1,142000
It was a multiple-choice examination.,examination,examination,It was an examination multiple-choice., multiple-choice examination, examination multiple-choice,multiple-choice,False,-27.512855529785156,-36.43128204345703,8.918426513671875,14067712,EleutherAI/pythia-14m,step142000,seed1,1,142000
It was a difficult examination.,examination,examination,It was an examination difficult., difficult examination, examination difficult,difficult,False,-13.798234939575195,-21.122989654541016,7.32475471496582,14067712,EleutherAI/pythia-14m,step142000,seed1,1,142000
It was a prostate examination.,examination,examination,It was an examination prostate., prostate examination, examination prostate,prostate,True,-22.90481185913086,-26.699893951416016,3.7950820922851562,14067712,EleutherAI/pythia-14m,step142000,seed1,1,142000
They had an electric fan.,fan,fan,They had an fan electric., electric fan, fan electric,electric,False,-11.921862602233887,-25.545522689819336,13.62366008758545,14067712,EleutherAI/pythia-14m,step142000,seed1,1,142000
They had a ceiling fan.,fan,fan,They had a fan ceiling., ceiling fan, fan ceiling,ceiling,True,-18.879114151000977,-22.11154556274414,3.232431411743164,14067712,EleutherAI/pythia-14m,step142000,seed1,1,142000
They had a zealous fan.,fan,fan,They had a fan zealous., zealous fan, fan zealous,zealous,False,-20.483783721923828,-25.01898956298828,4.535205841064453,14067712,EleutherAI/pythia-14m,step142000,seed1,1,142000
She had a text file.,file,file,She had a file text., text file, file text,text,True,-16.53011703491211,-21.029029846191406,4.498912811279297,14067712,EleutherAI/pythia-14m,step142000,seed1,1,142000
She had a data file.,file,file,She had a file data., data file, file data,data,True,-15.409184455871582,-21.755714416503906,6.346529960632324,14067712,EleutherAI/pythia-14m,step142000,seed1,1,142000
She had a nail file.,file,file,She had a file nail., nail file, file nail,nail,True,-16.977252960205078,-23.920143127441406,6.942890167236328,14067712,EleutherAI/pythia-14m,step142000,seed1,1,142000
It was an action film.,film,film,It was an film action., action film, film action,action,True,-15.704331398010254,-19.070951461791992,3.3666200637817383,14067712,EleutherAI/pythia-14m,step142000,seed1,1,142000
It was a censored film.,film,film,It was a film censored., censored film, film censored,censored,False,-19.181291580200195,-20.397104263305664,1.2158126831054688,14067712,EleutherAI/pythia-14m,step142000,seed1,1,142000
It was a transparent film.,film,film,It was a film transparent., transparent film, film transparent,transparent,False,-18.652475357055664,-21.222856521606445,2.5703811645507812,14067712,EleutherAI/pythia-14m,step142000,seed1,1,142000
It was a charitable foundation.,foundation,foundation,It was a foundation charitable., charitable foundation, foundation charitable,charitable,False,-15.767991065979004,-23.73260498046875,7.964613914489746,14067712,EleutherAI/pythia-14m,step142000,seed1,1,142000
It was an educational foundation.,foundation,foundation,It was an foundation educational., educational foundation, foundation educational,educational,False,-15.310733795166016,-26.950519561767578,11.639785766601562,14067712,EleutherAI/pythia-14m,step142000,seed1,1,142000
It was a wooden foundation.,foundation,foundation,It was a foundation wooden., wooden foundation, foundation wooden,wooden,False,-16.16187858581543,-24.09185791015625,7.92997932434082,14067712,EleutherAI/pythia-14m,step142000,seed1,1,142000
It was a mathematical function.,function,function,It was a function mathematical., mathematical function, function mathematical,mathematical,False,-17.35772705078125,-21.29387664794922,3.9361495971679688,14067712,EleutherAI/pythia-14m,step142000,seed1,1,142000
