sentence,word,string,reversed_sentence,mod_np,reversed_mod,disambiguating_word,non_adjective,original_logprob,reversed_logprob,ratio,n_params,mpath,revision,seed_name,seed,step
It was a desperate act.,act,act,It was an act desperate., desperate act, act desperate,desperate,False,-15.097330093383789,-18.307117462158203,3.209787368774414,14067712,EleutherAI/pythia-14m,step104000,seed8,8,104000
It was a humane act.,act,act,It was an act humane., humane act, act humane,humane,False,-19.45064353942871,-19.04678726196289,-0.4038562774658203,14067712,EleutherAI/pythia-14m,step104000,seed8,8,104000
It was a magic act.,act,act,It was an act magic., magic act, act magic,magic,False,-16.40471839904785,-19.019763946533203,2.6150455474853516,14067712,EleutherAI/pythia-14m,step104000,seed8,8,104000
He had a universal appeal.,appeal,appeal,He had an appeal universal., universal appeal, appeal universal,universal,False,-18.933887481689453,-21.027551651000977,2.0936641693115234,14067712,EleutherAI/pythia-14m,step104000,seed8,8,104000
He had an undefinable appeal.,appeal,appeal,He had an appeal undefinable., undefinable appeal, appeal undefinable,undefinable,False,-24.970611572265625,-26.345746994018555,1.3751354217529297,14067712,EleutherAI/pythia-14m,step104000,seed8,8,104000
He had a legal appeal.,appeal,appeal,He had an appeal legal., legal appeal, appeal legal,legal,False,-15.827088356018066,-17.377588272094727,1.5504999160766602,14067712,EleutherAI/pythia-14m,step104000,seed8,8,104000
It was a tense atmosphere.,atmosphere,atmosphere,It was an atmosphere tense., tense atmosphere, atmosphere tense,tense,False,-17.802621841430664,-19.583789825439453,1.781167984008789,14067712,EleutherAI/pythia-14m,step104000,seed8,8,104000
It was a hostile atmosphere.,atmosphere,atmosphere,It was an atmosphere hostile., hostile atmosphere, atmosphere hostile,hostile,False,-15.020811080932617,-18.787769317626953,3.766958236694336,14067712,EleutherAI/pythia-14m,step104000,seed8,8,104000
It was a gaseous atmosphere.,atmosphere,atmosphere,It was an atmosphere gaseous., gaseous atmosphere, atmosphere gaseous,gaseous,False,-17.206308364868164,-20.295276641845703,3.088968276977539,14067712,EleutherAI/pythia-14m,step104000,seed8,8,104000
It was a gold band.,band,band,It was a band gold., gold band, band gold,gold,True,-15.706913948059082,-20.948942184448242,5.24202823638916,14067712,EleutherAI/pythia-14m,step104000,seed8,8,104000
It was a rubber band.,band,band,It was a band rubber., rubber band, band rubber,rubber,True,-16.18433380126953,-24.366422653198242,8.182088851928711,14067712,EleutherAI/pythia-14m,step104000,seed8,8,104000
It was a jazz band.,band,band,It was a band jazz., jazz band, band jazz,jazz,True,-13.730134963989258,-21.807157516479492,8.077022552490234,14067712,EleutherAI/pythia-14m,step104000,seed8,8,104000
There was a police barrier.,barrier,barrier,There was a barrier police., police barrier, barrier police,police,True,-16.194778442382812,-19.338298797607422,3.1435203552246094,14067712,EleutherAI/pythia-14m,step104000,seed8,8,104000
There was a concrete barrier.,barrier,barrier,There was a barrier concrete., concrete barrier, barrier concrete,concrete,False,-14.981527328491211,-20.583354949951172,5.601827621459961,14067712,EleutherAI/pythia-14m,step104000,seed8,8,104000
There was a language barrier.,barrier,barrier,There was a barrier language., language barrier, barrier language,language,True,-19.403749465942383,-22.769390106201172,3.365640640258789,14067712,EleutherAI/pythia-14m,step104000,seed8,8,104000
He saw a furry bat.,bat,bat,He saw a bat furry., furry bat, bat furry,furry,False,-19.37002182006836,-22.712982177734375,3.3429603576660156,14067712,EleutherAI/pythia-14m,step104000,seed8,8,104000
He saw a fruit bat.,bat,bat,He saw a bat fruit., fruit bat, bat fruit,fruit,True,-19.13487434387207,-22.22130584716797,3.0864315032958984,14067712,EleutherAI/pythia-14m,step104000,seed8,8,104000
He saw a wooden bat.,bat,bat,He saw a bat wooden., wooden bat, bat wooden,wooden,False,-15.228708267211914,-22.74034881591797,7.511640548706055,14067712,EleutherAI/pythia-14m,step104000,seed8,8,104000
He saw the laser beam.,beam,beam,He saw the beam laser., laser beam, beam laser,laser,True,-11.352583885192871,-15.665077209472656,4.312493324279785,14067712,EleutherAI/pythia-14m,step104000,seed8,8,104000
He saw the bright beam.,beam,beam,He saw the beam bright., bright beam, beam bright,bright,False,-13.987604141235352,-17.238441467285156,3.2508373260498047,14067712,EleutherAI/pythia-14m,step104000,seed8,8,104000
He saw the wood beam.,beam,beam,He saw the beam wood., wood beam, beam wood,wood,True,-15.35562515258789,-18.394935607910156,3.0393104553222656,14067712,EleutherAI/pythia-14m,step104000,seed8,8,104000
She had a toy block.,block,block,She had a block toy., toy block, block toy,toy,True,-15.922866821289062,-20.41016387939453,4.487297058105469,14067712,EleutherAI/pythia-14m,step104000,seed8,8,104000
She had a wooden block.,block,block,She had a block wooden., wooden block, block wooden,wooden,False,-14.594040870666504,-23.53656768798828,8.942526817321777,14067712,EleutherAI/pythia-14m,step104000,seed8,8,104000
She had a mental block.,block,block,She had a block mental., mental block, block mental,mental,False,-14.34201717376709,-23.69165802001953,9.349640846252441,14067712,EleutherAI/pythia-14m,step104000,seed8,8,104000
He has coagulated blood.,blood,blood,He has blood coagulated., coagulated blood, blood coagulated,coagulated,True,-30.834436416625977,-32.13247299194336,1.2980365753173828,14067712,EleutherAI/pythia-14m,step104000,seed8,8,104000
He has thin blood.,blood,blood,He has blood thin., thin blood, blood thin,thin,False,-18.978784561157227,-21.75077247619629,2.7719879150390625,14067712,EleutherAI/pythia-14m,step104000,seed8,8,104000
He has noble blood.,blood,blood,He has blood noble., noble blood, blood noble,noble,False,-19.816879272460938,-25.37125587463379,5.554376602172852,14067712,EleutherAI/pythia-14m,step104000,seed8,8,104000
It was the ironing board.,board,board,It was the board ironing., ironing board, board ironing,ironing,False,-24.43393898010254,-24.29217529296875,-0.14176368713378906,14067712,EleutherAI/pythia-14m,step104000,seed8,8,104000
It was the wooden board.,board,board,It was the board wooden., wooden board, board wooden,wooden,False,-16.85904312133789,-22.313583374023438,5.454540252685547,14067712,EleutherAI/pythia-14m,step104000,seed8,8,104000
It was the executive board.,board,board,It was the board executive., executive board, board executive,executive,True,-16.00304412841797,-18.368942260742188,2.3658981323242188,14067712,EleutherAI/pythia-14m,step104000,seed8,8,104000
He had a best-selling book.,book,book,He had a book best-selling., best-selling book, book best-selling,best-selling,False,-15.23215103149414,-19.81067657470703,4.578525543212891,14067712,EleutherAI/pythia-14m,step104000,seed8,8,104000
He had a popular book.,book,book,He had a book popular., popular book, book popular,popular,False,-14.130989074707031,-17.273387908935547,3.1423988342285156,14067712,EleutherAI/pythia-14m,step104000,seed8,8,104000
He had a heavy book.,book,book,He had a book heavy., heavy book, book heavy,heavy,False,-16.313066482543945,-17.750804901123047,1.4377384185791016,14067712,EleutherAI/pythia-14m,step104000,seed8,8,104000
They ate a pancake breakfast.,breakfast,breakfast,They ate a breakfast pancake., pancake breakfast, breakfast pancake,pancake,True,-16.02127456665039,-17.45514678955078,1.4338722229003906,14067712,EleutherAI/pythia-14m,step104000,seed8,8,104000
They ate a nutritious breakfast.,breakfast,breakfast,They ate a breakfast nutritious., nutritious breakfast, breakfast nutritious,nutritious,False,-16.22199821472168,-22.992061614990234,6.770063400268555,14067712,EleutherAI/pythia-14m,step104000,seed8,8,104000
They ate a family breakfast.,breakfast,breakfast,They ate a breakfast family., family breakfast, breakfast family,family,True,-12.315791130065918,-15.498430252075195,3.1826391220092773,14067712,EleutherAI/pythia-14m,step104000,seed8,8,104000
It was a red cape.,cape,cape,It was a cape red., red cape, cape red,red,False,-18.212169647216797,-22.076631546020508,3.864461898803711,14067712,EleutherAI/pythia-14m,step104000,seed8,8,104000
It was a flowing cape.,cape,cape,It was a cape flowing., flowing cape, cape flowing,flowing,False,-23.665714263916016,-25.048614501953125,1.3829002380371094,14067712,EleutherAI/pythia-14m,step104000,seed8,8,104000
It was a rocky cape.,cape,cape,It was a cape rocky., rocky cape, cape rocky,rocky,False,-20.0113525390625,-26.036895751953125,6.025543212890625,14067712,EleutherAI/pythia-14m,step104000,seed8,8,104000
It was a beer case.,case,case,It was a case beer., beer case, case beer,beer,True,-15.933167457580566,-18.897607803344727,2.96444034576416,14067712,EleutherAI/pythia-14m,step104000,seed8,8,104000
It was a display case.,case,case,It was a case display., display case, case display,display,True,-17.788623809814453,-19.243738174438477,1.4551143646240234,14067712,EleutherAI/pythia-14m,step104000,seed8,8,104000
It was a divorce case.,case,case,It was a case divorce., divorce case, case divorce,divorce,True,-13.6543607711792,-18.870141983032227,5.215781211853027,14067712,EleutherAI/pythia-14m,step104000,seed8,8,104000
It was a worthy cause.,cause,cause,It was a cause worthy., worthy cause, cause worthy,worthy,False,-13.856714248657227,-19.878524780273438,6.021810531616211,14067712,EleutherAI/pythia-14m,step104000,seed8,8,104000
It was a political cause.,cause,cause,It was a cause political., political cause, cause political,political,False,-15.802104949951172,-21.137252807617188,5.335147857666016,14067712,EleutherAI/pythia-14m,step104000,seed8,8,104000
It was a main cause.,cause,cause,It was a cause main., main cause, cause main,main,False,-14.667989730834961,-19.269332885742188,4.601343154907227,14067712,EleutherAI/pythia-14m,step104000,seed8,8,104000
It was a skin cell.,cell,cell,It was a cell skin., skin cell, cell skin,skin,True,-16.559921264648438,-18.264019012451172,1.7040977478027344,14067712,EleutherAI/pythia-14m,step104000,seed8,8,104000
It was a brain cell.,cell,cell,It was a cell brain., brain cell, cell brain,brain,True,-13.185770034790039,-17.004619598388672,3.818849563598633,14067712,EleutherAI/pythia-14m,step104000,seed8,8,104000
It was a prison cell.,cell,cell,It was a cell prison., prison cell, cell prison,prison,True,-16.986339569091797,-20.789226531982422,3.802886962890625,14067712,EleutherAI/pythia-14m,step104000,seed8,8,104000
She had a devilish charm.,charm,charm,She had a charm devilish., devilish charm, charm devilish,devilish,False,-16.958396911621094,-23.062625885009766,6.104228973388672,14067712,EleutherAI/pythia-14m,step104000,seed8,8,104000
She had a natural charm.,charm,charm,She had a charm natural., natural charm, charm natural,natural,False,-14.540558815002441,-20.578102111816406,6.037543296813965,14067712,EleutherAI/pythia-14m,step104000,seed8,8,104000
She had a gold charm.,charm,charm,She had a charm gold., gold charm, charm gold,gold,True,-16.64158058166504,-20.588600158691406,3.947019577026367,14067712,EleutherAI/pythia-14m,step104000,seed8,8,104000
They liked the juicy chicken.,chicken,chicken,They liked the chicken juicy., juicy chicken, chicken juicy,juicy,False,-19.53912353515625,-21.821640014648438,2.2825164794921875,14067712,EleutherAI/pythia-14m,step104000,seed8,8,104000
They liked the roasted chicken.,chicken,chicken,They liked the chicken roasted., roasted chicken, chicken roasted,roasted,False,-16.617488861083984,-18.401691436767578,1.7842025756835938,14067712,EleutherAI/pythia-14m,step104000,seed8,8,104000
They liked the clucking chicken.,chicken,chicken,They liked the chicken clucking., clucking chicken, chicken clucking,clucking,True,-28.113101959228516,-23.639482498168945,-4.47361946105957,14067712,EleutherAI/pythia-14m,step104000,seed8,8,104000
It was a perceptive class.,class,class,It was a class perceptive., perceptive class, class perceptive,perceptive,False,-21.57229995727539,-24.945932388305664,3.3736324310302734,14067712,EleutherAI/pythia-14m,step104000,seed8,8,104000
It was a misbehaving class.,class,class,It was a class misbehaving., misbehaving class, class misbehaving,misbehaving,False,-21.534881591796875,-26.52564239501953,4.990760803222656,14067712,EleutherAI/pythia-14m,step104000,seed8,8,104000
It was a boring class.,class,class,It was a class boring., boring class, class boring,boring,False,-15.872091293334961,-19.334636688232422,3.462545394897461,14067712,EleutherAI/pythia-14m,step104000,seed8,8,104000
It was a film clip.,clip,clip,It was a clip film., film clip, clip film,film,True,-17.342660903930664,-18.673419952392578,1.330759048461914,14067712,EleutherAI/pythia-14m,step104000,seed8,8,104000
It was a video clip.,clip,clip,It was a clip video., video clip, clip video,video,True,-11.91231918334961,-17.626482009887695,5.714162826538086,14067712,EleutherAI/pythia-14m,step104000,seed8,8,104000
It was a hair clip.,clip,clip,It was a clip hair., hair clip, clip hair,hair,True,-18.43511390686035,-22.645587921142578,4.210474014282227,14067712,EleutherAI/pythia-14m,step104000,seed8,8,104000
It was an icy cold.,cold,cold,It was an cold icy., icy cold, cold icy,icy,False,-12.651175498962402,-19.98737335205078,7.336197853088379,14067712,EleutherAI/pythia-14m,step104000,seed8,8,104000
It was a freezing cold.,cold,cold,It was a cold freezing., freezing cold, cold freezing,freezing,False,-14.873543739318848,-16.61207389831543,1.738530158996582,14067712,EleutherAI/pythia-14m,step104000,seed8,8,104000
It was a chest cold.,cold,cold,It was a cold chest., chest cold, cold chest,chest,False,-19.00583267211914,-16.24690055847168,-2.758932113647461,14067712,EleutherAI/pythia-14m,step104000,seed8,8,104000
It was a gossip column.,column,column,It was a column gossip., gossip column, column gossip,gossip,True,-19.094276428222656,-23.64996910095215,4.555692672729492,14067712,EleutherAI/pythia-14m,step104000,seed8,8,104000
It was a sports column.,column,column,It was a column sports., sports column, column sports,sports,True,-19.486896514892578,-23.64777183532715,4.16087532043457,14067712,EleutherAI/pythia-14m,step104000,seed8,8,104000
It was a concrete column.,column,column,It was a column concrete., concrete column, column concrete,concrete,False,-17.83035659790039,-22.7169246673584,4.886568069458008,14067712,EleutherAI/pythia-14m,step104000,seed8,8,104000
He liked the investment company.,company,company,He liked the company investment., investment company, company investment,investment,True,-16.16632080078125,-16.02459144592285,-0.14172935485839844,14067712,EleutherAI/pythia-14m,step104000,seed8,8,104000
He liked the pharmaceutical company.,company,company,He liked the company pharmaceutical., pharmaceutical company, company pharmaceutical,pharmaceutical,False,-14.79811954498291,-19.4669132232666,4.668793678283691,14067712,EleutherAI/pythia-14m,step104000,seed8,8,104000
He liked the pleasant company.,company,company,He liked the company pleasant., pleasant company, company pleasant,pleasant,False,-17.906471252441406,-19.6083927154541,1.7019214630126953,14067712,EleutherAI/pythia-14m,step104000,seed8,8,104000
It was a waffle cone.,cone,cone,It was a cone waffle., waffle cone, cone waffle,waffle,True,-28.19536781311035,-30.52029037475586,2.324922561645508,14067712,EleutherAI/pythia-14m,step104000,seed8,8,104000
It was a sugar cone.,cone,cone,It was a cone sugar., sugar cone, cone sugar,sugar,True,-21.838741302490234,-25.896467208862305,4.05772590637207,14067712,EleutherAI/pythia-14m,step104000,seed8,8,104000
It was an orange cone.,cone,cone,It was an cone orange., orange cone, cone orange,orange,False,-15.664619445800781,-24.480121612548828,8.815502166748047,14067712,EleutherAI/pythia-14m,step104000,seed8,8,104000
He made a charitable contribution.,contribution,contribution,He made a contribution charitable., charitable contribution, contribution charitable,charitable,False,-14.785690307617188,-22.63946533203125,7.8537750244140625,14067712,EleutherAI/pythia-14m,step104000,seed8,8,104000
He made a voluntary contribution.,contribution,contribution,He made a contribution voluntary., voluntary contribution, contribution voluntary,voluntary,False,-16.499420166015625,-22.963010787963867,6.463590621948242,14067712,EleutherAI/pythia-14m,step104000,seed8,8,104000
He made a scholarly contribution.,contribution,contribution,He made a contribution scholarly., scholarly contribution, contribution scholarly,scholarly,False,-16.564693450927734,-22.991392135620117,6.426698684692383,14067712,EleutherAI/pythia-14m,step104000,seed8,8,104000
That was the noble count.,count,count,That was the count noble., noble count, count noble,noble,False,-19.423934936523438,-23.125675201416016,3.701740264892578,14067712,EleutherAI/pythia-14m,step104000,seed8,8,104000
That was the vengeful count.,count,count,That was the count vengeful., vengeful count, count vengeful,vengeful,False,-26.47329330444336,-29.305152893066406,2.831859588623047,14067712,EleutherAI/pythia-14m,step104000,seed8,8,104000
That was the final count.,count,count,That was the count final., final count, count final,final,False,-12.199203491210938,-18.963077545166016,6.763874053955078,14067712,EleutherAI/pythia-14m,step104000,seed8,8,104000
It was an introductory course.,course,course,It was an course introductory., introductory course, course introductory,introductory,False,-13.043867111206055,-25.066822052001953,12.022954940795898,14067712,EleutherAI/pythia-14m,step104000,seed8,8,104000
It was a pass-fail course.,course,course,It was a course pass-fail., pass-fail course, course pass-fail,pass-fail,False,-29.55704116821289,-33.83685302734375,4.279811859130859,14067712,EleutherAI/pythia-14m,step104000,seed8,8,104000
It was a charted course.,course,course,It was a course charted., charted course, course charted,charted,False,-21.870548248291016,-23.339269638061523,1.4687213897705078,14067712,EleutherAI/pythia-14m,step104000,seed8,8,104000
It was a dinner date.,date,date,It was a date dinner., dinner date, date dinner,dinner,True,-18.307418823242188,-19.88813591003418,1.5807170867919922,14067712,EleutherAI/pythia-14m,step104000,seed8,8,104000
It was a blind date.,date,date,It was a date blind., blind date, date blind,blind,False,-16.679412841796875,-19.65296745300293,2.9735546112060547,14067712,EleutherAI/pythia-14m,step104000,seed8,8,104000
It was an expiration date.,date,date,It was an date expiration., expiration date, date expiration,expiration,True,-10.740798950195312,-21.84333610534668,11.102537155151367,14067712,EleutherAI/pythia-14m,step104000,seed8,8,104000
It was about forty degrees.,degree,degrees,It was about degrees forty., forty degrees, degrees forty,forty,True,-15.205041885375977,-21.94098663330078,6.735944747924805,14067712,EleutherAI/pythia-14m,step104000,seed8,8,104000
It was about fifty degrees.,degree,degrees,It was about degrees fifty., fifty degrees, degrees fifty,fifty,True,-15.018842697143555,-22.28730010986328,7.268457412719727,14067712,EleutherAI/pythia-14m,step104000,seed8,8,104000
It was about associate degrees.,degree,degrees,It was about degrees associate., associate degrees, degrees associate,associate,False,-23.493629455566406,-25.82257843017578,2.328948974609375,14067712,EleutherAI/pythia-14m,step104000,seed8,8,104000
They liked the floral design.,design,design,They liked the design floral., floral design, design floral,floral,False,-16.401926040649414,-19.408050537109375,3.006124496459961,14067712,EleutherAI/pythia-14m,step104000,seed8,8,104000
They liked the geometric design.,design,design,They liked the design geometric., geometric design, design geometric,geometric,False,-16.298044204711914,-19.936248779296875,3.638204574584961,14067712,EleutherAI/pythia-14m,step104000,seed8,8,104000
They liked the product design.,design,design,They liked the design product., product design, design product,product,True,-14.638322830200195,-15.251371383666992,0.6130485534667969,14067712,EleutherAI/pythia-14m,step104000,seed8,8,104000
They liked the turkey dinner.,dinner,dinner,They liked the dinner turkey., turkey dinner, dinner turkey,turkey,True,-18.08687973022461,-20.4666805267334,2.379800796508789,14067712,EleutherAI/pythia-14m,step104000,seed8,8,104000
They liked the light dinner.,dinner,dinner,They liked the dinner light., light dinner, dinner light,light,False,-19.53317642211914,-18.39813804626465,-1.1350383758544922,14067712,EleutherAI/pythia-14m,step104000,seed8,8,104000
They liked the formal dinner.,dinner,dinner,They liked the dinner formal., formal dinner, dinner formal,formal,False,-19.07648468017578,-21.42706871032715,2.350584030151367,14067712,EleutherAI/pythia-14m,step104000,seed8,8,104000
He had a recurring dream.,dream,dream,He had a dream recurring., recurring dream, dream recurring,recurring,False,-14.511001586914062,-20.89267349243164,6.381671905517578,14067712,EleutherAI/pythia-14m,step104000,seed8,8,104000
He had a bad dream.,dream,dream,He had a dream bad., bad dream, dream bad,bad,False,-11.46345043182373,-16.163606643676758,4.700156211853027,14067712,EleutherAI/pythia-14m,step104000,seed8,8,104000
He had a childhood dream.,dream,dream,He had a dream childhood., childhood dream, dream childhood,childhood,True,-14.249311447143555,-19.320955276489258,5.071643829345703,14067712,EleutherAI/pythia-14m,step104000,seed8,8,104000
It was a grueling drill.,drill,drill,It was a drill grueling., grueling drill, drill grueling,grueling,False,-21.22533416748047,-24.499286651611328,3.2739524841308594,14067712,EleutherAI/pythia-14m,step104000,seed8,8,104000
It was a challenging drill.,drill,drill,It was a drill challenging., challenging drill, drill challenging,challenging,False,-19.048274993896484,-21.903642654418945,2.855367660522461,14067712,EleutherAI/pythia-14m,step104000,seed8,8,104000
It was an electric drill.,drill,drill,It was an drill electric., electric drill, drill electric,electric,False,-18.003101348876953,-25.924602508544922,7.921501159667969,14067712,EleutherAI/pythia-14m,step104000,seed8,8,104000
It was a multiple-choice examination.,examination,examination,It was an examination multiple-choice., multiple-choice examination, examination multiple-choice,multiple-choice,False,-25.301273345947266,-30.929243087768555,5.627969741821289,14067712,EleutherAI/pythia-14m,step104000,seed8,8,104000
It was a difficult examination.,examination,examination,It was an examination difficult., difficult examination, examination difficult,difficult,False,-13.928325653076172,-18.838748931884766,4.910423278808594,14067712,EleutherAI/pythia-14m,step104000,seed8,8,104000
It was a prostate examination.,examination,examination,It was an examination prostate., prostate examination, examination prostate,prostate,True,-21.569591522216797,-22.933292388916016,1.3637008666992188,14067712,EleutherAI/pythia-14m,step104000,seed8,8,104000
They had an electric fan.,fan,fan,They had an fan electric., electric fan, fan electric,electric,False,-11.919719696044922,-25.873455047607422,13.9537353515625,14067712,EleutherAI/pythia-14m,step104000,seed8,8,104000
They had a ceiling fan.,fan,fan,They had a fan ceiling., ceiling fan, fan ceiling,ceiling,True,-17.77794075012207,-19.948345184326172,2.1704044342041016,14067712,EleutherAI/pythia-14m,step104000,seed8,8,104000
They had a zealous fan.,fan,fan,They had a fan zealous., zealous fan, fan zealous,zealous,False,-19.549137115478516,-24.134288787841797,4.585151672363281,14067712,EleutherAI/pythia-14m,step104000,seed8,8,104000
She had a text file.,file,file,She had a file text., text file, file text,text,True,-12.837797164916992,-18.00595474243164,5.168157577514648,14067712,EleutherAI/pythia-14m,step104000,seed8,8,104000
She had a data file.,file,file,She had a file data., data file, file data,data,True,-14.144795417785645,-17.08841323852539,2.943617820739746,14067712,EleutherAI/pythia-14m,step104000,seed8,8,104000
She had a nail file.,file,file,She had a file nail., nail file, file nail,nail,True,-20.472015380859375,-25.19736099243164,4.725345611572266,14067712,EleutherAI/pythia-14m,step104000,seed8,8,104000
It was an action film.,film,film,It was an film action., action film, film action,action,True,-16.53856658935547,-17.2300968170166,0.6915302276611328,14067712,EleutherAI/pythia-14m,step104000,seed8,8,104000
It was a censored film.,film,film,It was a film censored., censored film, film censored,censored,False,-21.90355110168457,-20.39838409423828,-1.505167007446289,14067712,EleutherAI/pythia-14m,step104000,seed8,8,104000
It was a transparent film.,film,film,It was a film transparent., transparent film, film transparent,transparent,False,-16.368444442749023,-21.017892837524414,4.649448394775391,14067712,EleutherAI/pythia-14m,step104000,seed8,8,104000
It was a charitable foundation.,foundation,foundation,It was a foundation charitable., charitable foundation, foundation charitable,charitable,False,-15.320815086364746,-24.604833602905273,9.284018516540527,14067712,EleutherAI/pythia-14m,step104000,seed8,8,104000
It was an educational foundation.,foundation,foundation,It was an foundation educational., educational foundation, foundation educational,educational,False,-14.836847305297852,-25.109500885009766,10.272653579711914,14067712,EleutherAI/pythia-14m,step104000,seed8,8,104000
It was a wooden foundation.,foundation,foundation,It was a foundation wooden., wooden foundation, foundation wooden,wooden,False,-17.566150665283203,-23.877660751342773,6.31151008605957,14067712,EleutherAI/pythia-14m,step104000,seed8,8,104000
It was a mathematical function.,function,function,It was a function mathematical., mathematical function, function mathematical,mathematical,False,-16.820131301879883,-20.150531768798828,3.3304004669189453,14067712,EleutherAI/pythia-14m,step104000,seed8,8,104000
