sentence,word,string,reversed_sentence,mod_np,reversed_mod,disambiguating_word,non_adjective,original_logprob,reversed_logprob,ratio,n_params,mpath,revision,seed_name,seed,step
It was a linear function.,function,function,It was a function linear., linear function, function linear,linear,False,-14.45650863647461,-19.306249618530273,4.849740982055664,14067712,EleutherAI/pythia-14m,step137000,seed3,3,137000
It was a social function.,function,function,It was a function social., social function, function social,social,False,-17.434894561767578,-20.728979110717773,3.2940845489501953,14067712,EleutherAI/pythia-14m,step137000,seed3,3,137000
He was on the firm ground.,ground,ground,He was on the ground firm., firm ground, ground firm,firm,False,-16.060543060302734,-15.84136962890625,-0.21917343139648438,14067712,EleutherAI/pythia-14m,step137000,seed3,3,137000
He was on the frozen ground.,ground,ground,He was on the ground frozen., frozen ground, ground frozen,frozen,False,-14.221435546875,-16.43280029296875,2.21136474609375,14067712,EleutherAI/pythia-14m,step137000,seed3,3,137000
He was on the camp ground.,ground,ground,He was on the ground camp., camp ground, ground camp,camp,True,-16.98412322998047,-16.44451904296875,-0.5396041870117188,14067712,EleutherAI/pythia-14m,step137000,seed3,3,137000
They liked the night guard.,guard,guard,They liked the guard night., night guard, guard night,night,True,-18.02853012084961,-18.56449317932129,0.5359630584716797,14067712,EleutherAI/pythia-14m,step137000,seed3,3,137000
They liked the security guard.,guard,guard,They liked the guard security., security guard, guard security,security,True,-11.947847366333008,-18.388347625732422,6.440500259399414,14067712,EleutherAI/pythia-14m,step137000,seed3,3,137000
They liked the coast guard.,guard,guard,They liked the guard coast., coast guard, guard coast,coast,True,-17.00589370727539,-20.052288055419922,3.0463943481445312,14067712,EleutherAI/pythia-14m,step137000,seed3,3,137000
He had an assembly guide.,guide,guide,He had an guide assembly., assembly guide, guide assembly,assembly,True,-16.81796646118164,-23.917278289794922,7.099311828613281,14067712,EleutherAI/pythia-14m,step137000,seed3,3,137000
He had a TV guide.,guide,guide,He had a guide TV., TV guide, guide TV,TV,True,-17.16783332824707,-20.86399269104004,3.6961593627929688,14067712,EleutherAI/pythia-14m,step137000,seed3,3,137000
He had a talkative guide.,guide,guide,He had a guide talkative., talkative guide, guide talkative,talkative,False,-23.83887481689453,-28.625961303710938,4.787086486816406,14067712,EleutherAI/pythia-14m,step137000,seed3,3,137000
It was a summer home.,home,home,It was a home summer., summer home, home summer,summer,True,-13.840489387512207,-15.362687110900879,1.5221977233886719,14067712,EleutherAI/pythia-14m,step137000,seed3,3,137000
It was a childhood home.,home,home,It was a home childhood., childhood home, home childhood,childhood,True,-16.121356964111328,-15.970963478088379,-0.15039348602294922,14067712,EleutherAI/pythia-14m,step137000,seed3,3,137000
It was a funeral home.,home,home,It was a home funeral., funeral home, home funeral,funeral,False,-12.764503479003906,-15.238175392150879,2.4736719131469727,14067712,EleutherAI/pythia-14m,step137000,seed3,3,137000
They had natural intelligence.,intelligence,intelligence,They had intelligence natural., natural intelligence, intelligence natural,natural,False,-18.3712158203125,-22.850658416748047,4.479442596435547,14067712,EleutherAI/pythia-14m,step137000,seed3,3,137000
They had innate intelligence.,intelligence,intelligence,They had intelligence innate., innate intelligence, intelligence innate,innate,False,-19.068891525268555,-24.545848846435547,5.476957321166992,14067712,EleutherAI/pythia-14m,step137000,seed3,3,137000
They had classified intelligence.,intelligence,intelligence,They had intelligence classified., classified intelligence, intelligence classified,classified,False,-19.790496826171875,-21.820507049560547,2.030010223388672,14067712,EleutherAI/pythia-14m,step137000,seed3,3,137000
It was a sensitive issue.,issue,issue,It was an issue sensitive., sensitive issue, issue sensitive,sensitive,False,-16.146587371826172,-17.48006820678711,1.3334808349609375,14067712,EleutherAI/pythia-14m,step137000,seed3,3,137000
It was a political issue.,issue,issue,It was an issue political., political issue, issue political,political,False,-13.404566764831543,-16.59212875366211,3.1875619888305664,14067712,EleutherAI/pythia-14m,step137000,seed3,3,137000
It was a weekly issue.,issue,issue,It was an issue weekly., weekly issue, issue weekly,weekly,False,-17.655746459960938,-18.07320785522461,0.4174613952636719,14067712,EleutherAI/pythia-14m,step137000,seed3,3,137000
It was a blackberry jam.,jam,jam,It was a jam blackberry., blackberry jam, jam blackberry,blackberry,True,-19.876203536987305,-26.207551956176758,6.331348419189453,14067712,EleutherAI/pythia-14m,step137000,seed3,3,137000
It was a peach jam.,jam,jam,It was a jam peach., peach jam, jam peach,peach,False,-23.132854461669922,-24.138328552246094,1.0054740905761719,14067712,EleutherAI/pythia-14m,step137000,seed3,3,137000
It was a traffic jam.,jam,jam,It was a jam traffic., traffic jam, jam traffic,traffic,True,-16.983551025390625,-20.70627212524414,3.7227210998535156,14067712,EleutherAI/pythia-14m,step137000,seed3,3,137000
It was a duplicate key.,key,key,It was a key duplicate., duplicate key, key duplicate,duplicate,False,-18.4244441986084,-18.761409759521484,0.33696556091308594,14067712,EleutherAI/pythia-14m,step137000,seed3,3,137000
It was a master key.,key,key,It was a key master., master key, key master,master,True,-19.375301361083984,-17.836849212646484,-1.5384521484375,14067712,EleutherAI/pythia-14m,step137000,seed3,3,137000
It was a delete key.,key,key,It was a key delete., delete key, key delete,delete,False,-18.953292846679688,-19.257503509521484,0.3042106628417969,14067712,EleutherAI/pythia-14m,step137000,seed3,3,137000
They liked the marinated lamb.,lamb,lamb,They liked the lamb marinated., marinated lamb, lamb marinated,marinated,True,-23.983226776123047,-26.894794464111328,2.9115676879882812,14067712,EleutherAI/pythia-14m,step137000,seed3,3,137000
They liked the grilled lamb.,lamb,lamb,They liked the lamb grilled., grilled lamb, lamb grilled,grilled,False,-18.893672943115234,-21.739173889160156,2.845500946044922,14067712,EleutherAI/pythia-14m,step137000,seed3,3,137000
They liked the cute lamb.,lamb,lamb,They liked the lamb cute., cute lamb, lamb cute,cute,False,-18.972583770751953,-21.316078186035156,2.343494415283203,14067712,EleutherAI/pythia-14m,step137000,seed3,3,137000
She had curly locks.,lock,locks,She had locks curly., curly locks, locks curly,curly,False,-19.98465347290039,-24.66069984436035,4.676046371459961,14067712,EleutherAI/pythia-14m,step137000,seed3,3,137000
She had brown locks.,lock,locks,She had locks brown., brown locks, locks brown,brown,False,-20.949716567993164,-23.68255043029785,2.7328338623046875,14067712,EleutherAI/pythia-14m,step137000,seed3,3,137000
She had window locks.,lock,locks,She had locks window., window locks, locks window,window,True,-20.615861892700195,-22.57219696044922,1.9563350677490234,14067712,EleutherAI/pythia-14m,step137000,seed3,3,137000
They liked the hot lunch.,lunch,lunch,They liked the lunch hot., hot lunch, lunch hot,hot,False,-15.641538619995117,-20.561824798583984,4.920286178588867,14067712,EleutherAI/pythia-14m,step137000,seed3,3,137000
They liked the sandwich lunch.,lunch,lunch,They liked the lunch sandwich., sandwich lunch, lunch sandwich,sandwich,True,-17.852680206298828,-18.484922409057617,0.6322422027587891,14067712,EleutherAI/pythia-14m,step137000,seed3,3,137000
They liked the afternoon lunch.,lunch,lunch,They liked the lunch afternoon., afternoon lunch, lunch afternoon,afternoon,True,-18.96503448486328,-21.367366790771484,2.402332305908203,14067712,EleutherAI/pythia-14m,step137000,seed3,3,137000
He liked the flea market.,market,market,He liked the market flea., flea market, market flea,flea,True,-21.05064582824707,-21.779916763305664,0.7292709350585938,14067712,EleutherAI/pythia-14m,step137000,seed3,3,137000
He liked the fish market.,market,market,He liked the market fish., fish market, market fish,fish,True,-17.965747833251953,-19.52619743347168,1.5604496002197266,14067712,EleutherAI/pythia-14m,step137000,seed3,3,137000
He liked the housing market.,market,market,He liked the market housing., housing market, market housing,housing,True,-17.087520599365234,-18.50105094909668,1.4135303497314453,14067712,EleutherAI/pythia-14m,step137000,seed3,3,137000
It was a lit match.,match,match,It was a match lit., lit match, match lit,lit,False,-24.779197692871094,-20.44710922241211,-4.332088470458984,14067712,EleutherAI/pythia-14m,step137000,seed3,3,137000
It was a burning match.,match,match,It was a match burning., burning match, match burning,burning,False,-19.374889373779297,-20.58578109741211,1.2108917236328125,14067712,EleutherAI/pythia-14m,step137000,seed3,3,137000
It was a soccer match.,match,match,It was a match soccer., soccer match, match soccer,soccer,True,-15.422204971313477,-21.21590805053711,5.793703079223633,14067712,EleutherAI/pythia-14m,step137000,seed3,3,137000
It was cough medicine.,medicine,medicine,It was medicine cough., cough medicine, medicine cough,cough,True,-23.821590423583984,-24.08098602294922,0.2593955993652344,14067712,EleutherAI/pythia-14m,step137000,seed3,3,137000
It was prescription medicine.,medicine,medicine,It was medicine prescription., prescription medicine, medicine prescription,prescription,True,-18.72174835205078,-21.41545867919922,2.6937103271484375,14067712,EleutherAI/pythia-14m,step137000,seed3,3,137000
It was orthopedic medicine.,medicine,medicine,It was medicine orthopedic., orthopedic medicine, medicine orthopedic,orthopedic,False,-21.10149383544922,-24.957612991333008,3.856119155883789,14067712,EleutherAI/pythia-14m,step137000,seed3,3,137000
There was a phone message.,message,message,There was a message phone., phone message, message phone,phone,True,-13.271543502807617,-17.977447509765625,4.705904006958008,14067712,EleutherAI/pythia-14m,step137000,seed3,3,137000
There was a computer message.,message,message,There was a message computer., computer message, message computer,computer,True,-18.037433624267578,-19.307037353515625,1.2696037292480469,14067712,EleutherAI/pythia-14m,step137000,seed3,3,137000
There was an urgent message.,message,message,There was an message urgent., urgent message, message urgent,urgent,False,-13.819353103637695,-24.056137084960938,10.236783981323242,14067712,EleutherAI/pythia-14m,step137000,seed3,3,137000
It was a fungal mold.,mold,mold,It was a mold fungal., fungal mold, mold fungal,fungal,False,-21.90447998046875,-22.155120849609375,0.250640869140625,14067712,EleutherAI/pythia-14m,step137000,seed3,3,137000
It was a harmful mold.,mold,mold,It was a mold harmful., harmful mold, mold harmful,harmful,False,-21.057533264160156,-22.001434326171875,0.9439010620117188,14067712,EleutherAI/pythia-14m,step137000,seed3,3,137000
It was a rubber mold.,mold,mold,It was a mold rubber., rubber mold, mold rubber,rubber,True,-14.601417541503906,-17.899993896484375,3.2985763549804688,14067712,EleutherAI/pythia-14m,step137000,seed3,3,137000
She saw the cancerous mole.,mole,mole,She saw the mole cancerous., cancerous mole, mole cancerous,cancerous,False,-23.661130905151367,-25.09345245361328,1.432321548461914,14067712,EleutherAI/pythia-14m,step137000,seed3,3,137000
She saw the raised mole.,mole,mole,She saw the mole raised., raised mole, mole raised,raised,False,-19.89321517944336,-18.088777542114258,-1.8044376373291016,14067712,EleutherAI/pythia-14m,step137000,seed3,3,137000
She saw the cute mole.,mole,mole,She saw the mole cute., cute mole, mole cute,cute,False,-19.650365829467773,-20.482942581176758,0.8325767517089844,14067712,EleutherAI/pythia-14m,step137000,seed3,3,137000
He liked the rhythmic movement.,movement,movement,He liked the movement rhythmic., rhythmic movement, movement rhythmic,rhythmic,False,-16.675386428833008,-20.8697509765625,4.194364547729492,14067712,EleutherAI/pythia-14m,step137000,seed3,3,137000
He liked the graceful movement.,movement,movement,He liked the movement graceful., graceful movement, movement graceful,graceful,False,-16.058536529541016,-20.732282638549805,4.673746109008789,14067712,EleutherAI/pythia-14m,step137000,seed3,3,137000
He liked the feminist movement.,movement,movement,He liked the movement feminist., feminist movement, movement feminist,feminist,True,-15.308382034301758,-20.746564865112305,5.438182830810547,14067712,EleutherAI/pythia-14m,step137000,seed3,3,137000
It was a national newspaper.,newspaper,newspaper,It was a newspaper national., national newspaper, newspaper national,national,False,-14.357934951782227,-19.87192153930664,5.513986587524414,14067712,EleutherAI/pythia-14m,step137000,seed3,3,137000
It was a daily newspaper.,newspaper,newspaper,It was a newspaper daily., daily newspaper, newspaper daily,daily,False,-14.622398376464844,-18.02682876586914,3.404430389404297,14067712,EleutherAI/pythia-14m,step137000,seed3,3,137000
It was a faded newspaper.,newspaper,newspaper,It was a newspaper faded., faded newspaper, newspaper faded,faded,False,-18.976707458496094,-20.06125259399414,1.0845451354980469,14067712,EleutherAI/pythia-14m,step137000,seed3,3,137000
It was a juicy orange.,orange,orange,It was an orange juicy., juicy orange, orange juicy,juicy,False,-20.434663772583008,-19.48922348022461,-0.9454402923583984,14067712,EleutherAI/pythia-14m,step137000,seed3,3,137000
It was a ripe orange.,orange,orange,It was an orange ripe., ripe orange, orange ripe,ripe,False,-18.509294509887695,-16.568017959594727,-1.9412765502929688,14067712,EleutherAI/pythia-14m,step137000,seed3,3,137000
It was a bright orange.,orange,orange,It was an orange bright., bright orange, orange bright,bright,False,-12.579032897949219,-14.742578506469727,2.163545608520508,14067712,EleutherAI/pythia-14m,step137000,seed3,3,137000
He saw the young page.,page,page,He saw the page young., young page, page young,young,False,-17.545978546142578,-18.82863426208496,1.2826557159423828,14067712,EleutherAI/pythia-14m,step137000,seed3,3,137000
He saw the loyal page.,page,page,He saw the page loyal., loyal page, page loyal,loyal,False,-20.627866744995117,-20.56264305114746,-0.06522369384765625,14067712,EleutherAI/pythia-14m,step137000,seed3,3,137000
He saw the blank page.,page,page,He saw the page blank., blank page, page blank,blank,False,-14.513326644897461,-16.73207664489746,2.21875,14067712,EleutherAI/pythia-14m,step137000,seed3,3,137000
It was a calloused palm.,palm,palm,It was a palm calloused., calloused palm, palm calloused,calloused,False,-29.432483673095703,-30.618820190429688,1.1863365173339844,14067712,EleutherAI/pythia-14m,step137000,seed3,3,137000
It was a wrinkled palm.,palm,palm,It was a palm wrinkled., wrinkled palm, palm wrinkled,wrinkled,False,-20.559770584106445,-22.48554039001465,1.9257698059082031,14067712,EleutherAI/pythia-14m,step137000,seed3,3,137000
It was a tropical palm.,palm,palm,It was a palm tropical., tropical palm, palm tropical,tropical,False,-20.38958168029785,-23.002399444580078,2.6128177642822266,14067712,EleutherAI/pythia-14m,step137000,seed3,3,137000
It was a control panel.,panel,panel,It was a panel control., control panel, panel control,control,True,-13.648470878601074,-19.17963218688965,5.531161308288574,14067712,EleutherAI/pythia-14m,step137000,seed3,3,137000
It was an instrument panel.,panel,panel,It was an panel instrument., instrument panel, panel instrument,instrument,False,-15.723918914794922,-22.8094539642334,7.085535049438477,14067712,EleutherAI/pythia-14m,step137000,seed3,3,137000
It was an advisory panel.,panel,panel,It was an panel advisory., advisory panel, panel advisory,advisory,False,-13.70356273651123,-25.0675106048584,11.363947868347168,14067712,EleutherAI/pythia-14m,step137000,seed3,3,137000
It was a secret passage.,passage,passage,It was a passage secret., secret passage, passage secret,secret,False,-14.716496467590332,-19.683427810668945,4.966931343078613,14067712,EleutherAI/pythia-14m,step137000,seed3,3,137000
It was a narrow passage.,passage,passage,It was a passage narrow., narrow passage, passage narrow,narrow,False,-13.116722106933594,-20.252763748168945,7.136041641235352,14067712,EleutherAI/pythia-14m,step137000,seed3,3,137000
It was a literary passage.,passage,passage,It was a passage literary., literary passage, passage literary,literary,False,-17.75458526611328,-22.054643630981445,4.300058364868164,14067712,EleutherAI/pythia-14m,step137000,seed3,3,137000
It was a tasty perch.,perch,perch,It was a perch tasty., tasty perch, perch tasty,tasty,False,-22.022968292236328,-25.160736083984375,3.137767791748047,14067712,EleutherAI/pythia-14m,step137000,seed3,3,137000
It was a freshwater perch.,perch,perch,It was a perch freshwater., freshwater perch, perch freshwater,freshwater,True,-24.490957260131836,-26.653656005859375,2.162698745727539,14067712,EleutherAI/pythia-14m,step137000,seed3,3,137000
It was a lofty perch.,perch,perch,It was a perch lofty., lofty perch, perch lofty,lofty,False,-21.757904052734375,-24.8984375,3.140533447265625,14067712,EleutherAI/pythia-14m,step137000,seed3,3,137000
He saw the fast pitcher.,pitcher,pitcher,He saw the pitcher fast., fast pitcher, pitcher fast,fast,False,-17.96095085144043,-18.007488250732422,0.04653739929199219,14067712,EleutherAI/pythia-14m,step137000,seed3,3,137000
He saw the right-handed pitcher.,pitcher,pitcher,He saw the pitcher right-handed., right-handed pitcher, pitcher right-handed,right-handed,False,-21.040191650390625,-22.633663177490234,1.5934715270996094,14067712,EleutherAI/pythia-14m,step137000,seed3,3,137000
He saw the glass pitcher.,pitcher,pitcher,He saw the pitcher glass., glass pitcher, pitcher glass,glass,True,-19.488574981689453,-19.685832977294922,0.19725799560546875,14067712,EleutherAI/pythia-14m,step137000,seed3,3,137000
It was a windy port.,port,port,It was a port windy., windy port, port windy,windy,False,-19.452577590942383,-21.787202835083008,2.334625244140625,14067712,EleutherAI/pythia-14m,step137000,seed3,3,137000
It was a seaside port.,port,port,It was a port seaside., seaside port, port seaside,seaside,True,-16.872833251953125,-19.520139694213867,2.647306442260742,14067712,EleutherAI/pythia-14m,step137000,seed3,3,137000
It was a delicious port.,port,port,It was a port delicious., delicious port, port delicious,delicious,False,-17.16396713256836,-22.56507110595703,5.401103973388672,14067712,EleutherAI/pythia-14m,step137000,seed3,3,137000
He was in a distinguished position.,position,position,He was in a position distinguished., distinguished position, position distinguished,distinguished,False,-15.103296279907227,-18.025835037231445,2.9225387573242188,14067712,EleutherAI/pythia-14m,step137000,seed3,3,137000
He was in a prominent position.,position,position,He was in a position prominent., prominent position, position prominent,prominent,False,-13.692728042602539,-18.666704177856445,4.973976135253906,14067712,EleutherAI/pythia-14m,step137000,seed3,3,137000
He was in a fetal position.,position,position,He was in a position fetal., fetal position, position fetal,fetal,False,-17.784229278564453,-20.778032302856445,2.993803024291992,14067712,EleutherAI/pythia-14m,step137000,seed3,3,137000
It was a wooden post.,post,post,It was a post wooden., wooden post, post wooden,wooden,False,-18.607994079589844,-20.712299346923828,2.1043052673339844,14067712,EleutherAI/pythia-14m,step137000,seed3,3,137000
It was a fence post.,post,post,It was a post fence., fence post, post fence,fence,True,-19.675548553466797,-19.224750518798828,-0.45079803466796875,14067712,EleutherAI/pythia-14m,step137000,seed3,3,137000
It was a teaching post.,post,post,It was a post teaching., teaching post, post teaching,teaching,True,-17.103199005126953,-18.120868682861328,1.017669677734375,14067712,EleutherAI/pythia-14m,step137000,seed3,3,137000
He had the alcoholic punch.,punch,punch,He had the punch alcoholic., alcoholic punch, punch alcoholic,alcoholic,False,-22.395122528076172,-24.699913024902344,2.304790496826172,14067712,EleutherAI/pythia-14m,step137000,seed3,3,137000
He had the fruit punch.,punch,punch,He had the punch fruit., fruit punch, punch fruit,fruit,True,-20.095996856689453,-21.208580017089844,1.1125831604003906,14067712,EleutherAI/pythia-14m,step137000,seed3,3,137000
He had the strongest punch.,punch,punch,He had the punch strongest., strongest punch, punch strongest,strongest,False,-17.19801902770996,-23.300132751464844,6.102113723754883,14067712,EleutherAI/pythia-14m,step137000,seed3,3,137000
She had a brilliant pupil.,pupil,pupil,She had a pupil brilliant., brilliant pupil, pupil brilliant,brilliant,False,-17.435285568237305,-21.820236206054688,4.384950637817383,14067712,EleutherAI/pythia-14m,step137000,seed3,3,137000
She had an interested pupil.,pupil,pupil,She had an pupil interested., interested pupil, pupil interested,interested,False,-18.436786651611328,-21.17888641357422,2.7420997619628906,14067712,EleutherAI/pythia-14m,step137000,seed3,3,137000
She had a dilated pupil.,pupil,pupil,She had a pupil dilated., dilated pupil, pupil dilated,dilated,False,-19.134063720703125,-23.037033081054688,3.9029693603515625,14067712,EleutherAI/pythia-14m,step137000,seed3,3,137000
That was a loud racket.,racket,racket,That was a racket loud., loud racket, racket loud,loud,False,-18.68230438232422,-22.180099487304688,3.4977951049804688,14067712,EleutherAI/pythia-14m,step137000,seed3,3,137000
That was an annoying racket.,racket,racket,That was an racket annoying., annoying racket, racket annoying,annoying,False,-17.883686065673828,-24.3741512298584,6.49046516418457,14067712,EleutherAI/pythia-14m,step137000,seed3,3,137000
That was a badminton racket.,racket,racket,That was a racket badminton., badminton racket, racket badminton,badminton,True,-28.393043518066406,-30.56708335876465,2.174039840698242,14067712,EleutherAI/pythia-14m,step137000,seed3,3,137000
He liked electronic rock.,rock,rock,He liked rock electronic., electronic rock, rock electronic,electronic,False,-21.941186904907227,-24.109390258789062,2.168203353881836,14067712,EleutherAI/pythia-14m,step137000,seed3,3,137000
He liked alternative rock.,rock,rock,He liked rock alternative., alternative rock, rock alternative,alternative,False,-22.97110366821289,-24.300918579101562,1.3298149108886719,14067712,EleutherAI/pythia-14m,step137000,seed3,3,137000
He liked limestone rock.,rock,rock,He liked rock limestone., limestone rock, rock limestone,limestone,True,-21.174365997314453,-22.713394165039062,1.5390281677246094,14067712,EleutherAI/pythia-14m,step137000,seed3,3,137000
He saw the wise sage.,sage,sage,He saw the sage wise., wise sage, sage wise,wise,False,-19.632835388183594,-20.04711151123047,0.414276123046875,14067712,EleutherAI/pythia-14m,step137000,seed3,3,137000
He saw the renowned sage.,sage,sage,He saw the sage renowned., renowned sage, sage renowned,renowned,False,-20.298847198486328,-23.78099822998047,3.4821510314941406,14067712,EleutherAI/pythia-14m,step137000,seed3,3,137000
He saw the fragrant sage.,sage,sage,He saw the sage fragrant., fragrant sage, sage fragrant,fragrant,False,-20.039567947387695,-20.030616760253906,-0.008951187133789062,14067712,EleutherAI/pythia-14m,step137000,seed3,3,137000
It was a fish scale.,scale,scale,It was a scale fish., fish scale, scale fish,fish,True,-19.297147750854492,-22.286788940429688,2.9896411895751953,14067712,EleutherAI/pythia-14m,step137000,seed3,3,137000
It was a lizard scale.,scale,scale,It was a scale lizard., lizard scale, scale lizard,lizard,True,-22.630908966064453,-25.418025970458984,2.7871170043945312,14067712,EleutherAI/pythia-14m,step137000,seed3,3,137000
It was a music scale.,scale,scale,It was a scale music., music scale, scale music,music,True,-16.04170036315918,-20.433029174804688,4.391328811645508,14067712,EleutherAI/pythia-14m,step137000,seed3,3,137000
It was a touching scene.,scene,scene,It was a scene touching., touching scene, scene touching,touching,False,-16.020998001098633,-16.93630599975586,0.9153079986572266,14067712,EleutherAI/pythia-14m,step137000,seed3,3,137000
It was a well-acted scene.,scene,scene,It was a scene well-acted., well-acted scene, scene well-acted,well-acted,False,-22.431467056274414,-27.634143829345703,5.202676773071289,14067712,EleutherAI/pythia-14m,step137000,seed3,3,137000
It was a nature scene.,scene,scene,It was a scene nature., nature scene, scene nature,nature,True,-18.079681396484375,-20.15822982788086,2.0785484313964844,14067712,EleutherAI/pythia-14m,step137000,seed3,3,137000
It was a gold seal.,seal,seal,It was a seal gold., gold seal, seal gold,gold,True,-14.014754295349121,-19.801258087158203,5.786503791809082,14067712,EleutherAI/pythia-14m,step137000,seed3,3,137000
It was a certified seal.,seal,seal,It was a seal certified., certified seal, seal certified,certified,False,-19.678630828857422,-20.189075469970703,0.5104446411132812,14067712,EleutherAI/pythia-14m,step137000,seed3,3,137000
It was a circus seal.,seal,seal,It was a seal circus., circus seal, seal circus,circus,True,-21.45730972290039,-23.243885040283203,1.7865753173828125,14067712,EleutherAI/pythia-14m,step137000,seed3,3,137000
He used the scotch tape.,tape,tape,He used the tape scotch., scotch tape, tape scotch,scotch,True,-23.13714599609375,-24.03970718383789,0.9025611877441406,14067712,EleutherAI/pythia-14m,step137000,seed3,3,137000
He used the double-sided tape.,tape,tape,He used the tape double-sided., double-sided tape, tape double-sided,double-sided,False,-20.474563598632812,-25.5093936920166,5.034830093383789,14067712,EleutherAI/pythia-14m,step137000,seed3,3,137000
