sentence,word,string,reversed_sentence,mod_np,reversed_mod,disambiguating_word,non_adjective,original_logprob,reversed_logprob,ratio,n_params,mpath,revision,seed_name,seed,step
It was a desperate act.,act,act,It was an act desperate., desperate act, act desperate,desperate,False,-15.87224006652832,-20.095979690551758,4.2237396240234375,14067712,EleutherAI/pythia-14m,step95000,seed4,4,95000
It was a humane act.,act,act,It was an act humane., humane act, act humane,humane,False,-20.043317794799805,-17.554929733276367,-2.4883880615234375,14067712,EleutherAI/pythia-14m,step95000,seed4,4,95000
It was a magic act.,act,act,It was an act magic., magic act, act magic,magic,False,-14.95368766784668,-20.101001739501953,5.147314071655273,14067712,EleutherAI/pythia-14m,step95000,seed4,4,95000
He had a universal appeal.,appeal,appeal,He had an appeal universal., universal appeal, appeal universal,universal,False,-18.81130599975586,-23.63302230834961,4.82171630859375,14067712,EleutherAI/pythia-14m,step95000,seed4,4,95000
He had an undefinable appeal.,appeal,appeal,He had an appeal undefinable., undefinable appeal, appeal undefinable,undefinable,False,-22.786861419677734,-28.51410675048828,5.727245330810547,14067712,EleutherAI/pythia-14m,step95000,seed4,4,95000
He had a legal appeal.,appeal,appeal,He had an appeal legal., legal appeal, appeal legal,legal,False,-14.841663360595703,-19.42486000061035,4.583196640014648,14067712,EleutherAI/pythia-14m,step95000,seed4,4,95000
It was a tense atmosphere.,atmosphere,atmosphere,It was an atmosphere tense., tense atmosphere, atmosphere tense,tense,False,-16.537206649780273,-18.070980072021484,1.533773422241211,14067712,EleutherAI/pythia-14m,step95000,seed4,4,95000
It was a hostile atmosphere.,atmosphere,atmosphere,It was an atmosphere hostile., hostile atmosphere, atmosphere hostile,hostile,False,-17.107446670532227,-19.85958480834961,2.752138137817383,14067712,EleutherAI/pythia-14m,step95000,seed4,4,95000
It was a gaseous atmosphere.,atmosphere,atmosphere,It was an atmosphere gaseous., gaseous atmosphere, atmosphere gaseous,gaseous,False,-17.64398765563965,-21.06264877319336,3.418661117553711,14067712,EleutherAI/pythia-14m,step95000,seed4,4,95000
It was a gold band.,band,band,It was a band gold., gold band, band gold,gold,True,-14.91829776763916,-19.922077178955078,5.003779411315918,14067712,EleutherAI/pythia-14m,step95000,seed4,4,95000
It was a rubber band.,band,band,It was a band rubber., rubber band, band rubber,rubber,True,-14.284940719604492,-21.494823455810547,7.209882736206055,14067712,EleutherAI/pythia-14m,step95000,seed4,4,95000
It was a jazz band.,band,band,It was a band jazz., jazz band, band jazz,jazz,True,-14.987222671508789,-20.934673309326172,5.947450637817383,14067712,EleutherAI/pythia-14m,step95000,seed4,4,95000
There was a police barrier.,barrier,barrier,There was a barrier police., police barrier, barrier police,police,True,-19.224565505981445,-20.449527740478516,1.2249622344970703,14067712,EleutherAI/pythia-14m,step95000,seed4,4,95000
There was a concrete barrier.,barrier,barrier,There was a barrier concrete., concrete barrier, barrier concrete,concrete,False,-15.94805908203125,-20.006206512451172,4.058147430419922,14067712,EleutherAI/pythia-14m,step95000,seed4,4,95000
There was a language barrier.,barrier,barrier,There was a barrier language., language barrier, barrier language,language,True,-18.867008209228516,-22.80185317993164,3.934844970703125,14067712,EleutherAI/pythia-14m,step95000,seed4,4,95000
He saw a furry bat.,bat,bat,He saw a bat furry., furry bat, bat furry,furry,False,-21.008079528808594,-20.905349731445312,-0.10272979736328125,14067712,EleutherAI/pythia-14m,step95000,seed4,4,95000
He saw a fruit bat.,bat,bat,He saw a bat fruit., fruit bat, bat fruit,fruit,True,-18.61501693725586,-20.379188537597656,1.7641716003417969,14067712,EleutherAI/pythia-14m,step95000,seed4,4,95000
He saw a wooden bat.,bat,bat,He saw a bat wooden., wooden bat, bat wooden,wooden,False,-16.60434341430664,-22.19989013671875,5.595546722412109,14067712,EleutherAI/pythia-14m,step95000,seed4,4,95000
He saw the laser beam.,beam,beam,He saw the beam laser., laser beam, beam laser,laser,True,-11.06004810333252,-18.43910026550293,7.37905216217041,14067712,EleutherAI/pythia-14m,step95000,seed4,4,95000
He saw the bright beam.,beam,beam,He saw the beam bright., bright beam, beam bright,bright,False,-18.614009857177734,-18.62434196472168,0.010332107543945312,14067712,EleutherAI/pythia-14m,step95000,seed4,4,95000
He saw the wood beam.,beam,beam,He saw the beam wood., wood beam, beam wood,wood,True,-19.04366111755371,-21.251874923706055,2.2082138061523438,14067712,EleutherAI/pythia-14m,step95000,seed4,4,95000
She had a toy block.,block,block,She had a block toy., toy block, block toy,toy,True,-18.30811309814453,-22.117019653320312,3.8089065551757812,14067712,EleutherAI/pythia-14m,step95000,seed4,4,95000
She had a wooden block.,block,block,She had a block wooden., wooden block, block wooden,wooden,False,-15.496376037597656,-23.35266876220703,7.856292724609375,14067712,EleutherAI/pythia-14m,step95000,seed4,4,95000
She had a mental block.,block,block,She had a block mental., mental block, block mental,mental,False,-16.498220443725586,-22.856483459472656,6.35826301574707,14067712,EleutherAI/pythia-14m,step95000,seed4,4,95000
He has coagulated blood.,blood,blood,He has blood coagulated., coagulated blood, blood coagulated,coagulated,True,-29.43793487548828,-26.625070571899414,-2.812864303588867,14067712,EleutherAI/pythia-14m,step95000,seed4,4,95000
He has thin blood.,blood,blood,He has blood thin., thin blood, blood thin,thin,False,-20.325143814086914,-23.194608688354492,2.869464874267578,14067712,EleutherAI/pythia-14m,step95000,seed4,4,95000
He has noble blood.,blood,blood,He has blood noble., noble blood, blood noble,noble,False,-20.533119201660156,-27.99885368347168,7.465734481811523,14067712,EleutherAI/pythia-14m,step95000,seed4,4,95000
It was the ironing board.,board,board,It was the board ironing., ironing board, board ironing,ironing,False,-25.143463134765625,-25.657814025878906,0.5143508911132812,14067712,EleutherAI/pythia-14m,step95000,seed4,4,95000
It was the wooden board.,board,board,It was the board wooden., wooden board, board wooden,wooden,False,-13.905635833740234,-22.4570255279541,8.551389694213867,14067712,EleutherAI/pythia-14m,step95000,seed4,4,95000
It was the executive board.,board,board,It was the board executive., executive board, board executive,executive,True,-15.924535751342773,-18.586992263793945,2.662456512451172,14067712,EleutherAI/pythia-14m,step95000,seed4,4,95000
He had a best-selling book.,book,book,He had a book best-selling., best-selling book, book best-selling,best-selling,False,-15.198177337646484,-19.84856414794922,4.650386810302734,14067712,EleutherAI/pythia-14m,step95000,seed4,4,95000
He had a popular book.,book,book,He had a book popular., popular book, book popular,popular,False,-16.04737663269043,-18.659530639648438,2.612154006958008,14067712,EleutherAI/pythia-14m,step95000,seed4,4,95000
He had a heavy book.,book,book,He had a book heavy., heavy book, book heavy,heavy,False,-16.302536010742188,-19.09284210205078,2.7903060913085938,14067712,EleutherAI/pythia-14m,step95000,seed4,4,95000
They ate a pancake breakfast.,breakfast,breakfast,They ate a breakfast pancake., pancake breakfast, breakfast pancake,pancake,True,-15.542961120605469,-16.73309898376465,1.1901378631591797,14067712,EleutherAI/pythia-14m,step95000,seed4,4,95000
They ate a nutritious breakfast.,breakfast,breakfast,They ate a breakfast nutritious., nutritious breakfast, breakfast nutritious,nutritious,False,-17.133878707885742,-19.14630889892578,2.012430191040039,14067712,EleutherAI/pythia-14m,step95000,seed4,4,95000
They ate a family breakfast.,breakfast,breakfast,They ate a breakfast family., family breakfast, breakfast family,family,True,-10.054759979248047,-13.79609489440918,3.741334915161133,14067712,EleutherAI/pythia-14m,step95000,seed4,4,95000
It was a red cape.,cape,cape,It was a cape red., red cape, cape red,red,False,-18.76427459716797,-23.928335189819336,5.164060592651367,14067712,EleutherAI/pythia-14m,step95000,seed4,4,95000
It was a flowing cape.,cape,cape,It was a cape flowing., flowing cape, cape flowing,flowing,False,-24.096935272216797,-24.484189987182617,0.3872547149658203,14067712,EleutherAI/pythia-14m,step95000,seed4,4,95000
It was a rocky cape.,cape,cape,It was a cape rocky., rocky cape, cape rocky,rocky,False,-23.507909774780273,-28.090681076049805,4.582771301269531,14067712,EleutherAI/pythia-14m,step95000,seed4,4,95000
It was a beer case.,case,case,It was a case beer., beer case, case beer,beer,True,-20.052040100097656,-21.119033813476562,1.0669937133789062,14067712,EleutherAI/pythia-14m,step95000,seed4,4,95000
It was a display case.,case,case,It was a case display., display case, case display,display,True,-18.087182998657227,-19.01568603515625,0.9285030364990234,14067712,EleutherAI/pythia-14m,step95000,seed4,4,95000
It was a divorce case.,case,case,It was a case divorce., divorce case, case divorce,divorce,True,-14.364561080932617,-19.757247924804688,5.39268684387207,14067712,EleutherAI/pythia-14m,step95000,seed4,4,95000
It was a worthy cause.,cause,cause,It was a cause worthy., worthy cause, cause worthy,worthy,False,-15.783601760864258,-20.279367446899414,4.495765686035156,14067712,EleutherAI/pythia-14m,step95000,seed4,4,95000
It was a political cause.,cause,cause,It was a cause political., political cause, cause political,political,False,-16.952598571777344,-18.631868362426758,1.679269790649414,14067712,EleutherAI/pythia-14m,step95000,seed4,4,95000
It was a main cause.,cause,cause,It was a cause main., main cause, cause main,main,False,-12.113382339477539,-17.998064041137695,5.884681701660156,14067712,EleutherAI/pythia-14m,step95000,seed4,4,95000
It was a skin cell.,cell,cell,It was a cell skin., skin cell, cell skin,skin,True,-16.990358352661133,-19.244770050048828,2.2544116973876953,14067712,EleutherAI/pythia-14m,step95000,seed4,4,95000
It was a brain cell.,cell,cell,It was a cell brain., brain cell, cell brain,brain,True,-14.412303924560547,-18.38327407836914,3.9709701538085938,14067712,EleutherAI/pythia-14m,step95000,seed4,4,95000
It was a prison cell.,cell,cell,It was a cell prison., prison cell, cell prison,prison,True,-14.208822250366211,-20.14699935913086,5.938177108764648,14067712,EleutherAI/pythia-14m,step95000,seed4,4,95000
She had a devilish charm.,charm,charm,She had a charm devilish., devilish charm, charm devilish,devilish,False,-20.941726684570312,-26.228635787963867,5.286909103393555,14067712,EleutherAI/pythia-14m,step95000,seed4,4,95000
She had a natural charm.,charm,charm,She had a charm natural., natural charm, charm natural,natural,False,-15.749279022216797,-20.75201416015625,5.002735137939453,14067712,EleutherAI/pythia-14m,step95000,seed4,4,95000
She had a gold charm.,charm,charm,She had a charm gold., gold charm, charm gold,gold,True,-16.396347045898438,-20.27881622314453,3.8824691772460938,14067712,EleutherAI/pythia-14m,step95000,seed4,4,95000
They liked the juicy chicken.,chicken,chicken,They liked the chicken juicy., juicy chicken, chicken juicy,juicy,False,-18.542085647583008,-20.95506477355957,2.4129791259765625,14067712,EleutherAI/pythia-14m,step95000,seed4,4,95000
They liked the roasted chicken.,chicken,chicken,They liked the chicken roasted., roasted chicken, chicken roasted,roasted,False,-16.134323120117188,-19.397424697875977,3.263101577758789,14067712,EleutherAI/pythia-14m,step95000,seed4,4,95000
They liked the clucking chicken.,chicken,chicken,They liked the chicken clucking., clucking chicken, chicken clucking,clucking,True,-23.002727508544922,-25.224388122558594,2.221660614013672,14067712,EleutherAI/pythia-14m,step95000,seed4,4,95000
It was a perceptive class.,class,class,It was a class perceptive., perceptive class, class perceptive,perceptive,False,-19.835607528686523,-21.81317901611328,1.9775714874267578,14067712,EleutherAI/pythia-14m,step95000,seed4,4,95000
It was a misbehaving class.,class,class,It was a class misbehaving., misbehaving class, class misbehaving,misbehaving,False,-23.973430633544922,-26.29378318786621,2.320352554321289,14067712,EleutherAI/pythia-14m,step95000,seed4,4,95000
It was a boring class.,class,class,It was a class boring., boring class, class boring,boring,False,-16.008525848388672,-18.964242935180664,2.955717086791992,14067712,EleutherAI/pythia-14m,step95000,seed4,4,95000
It was a film clip.,clip,clip,It was a clip film., film clip, clip film,film,True,-17.651220321655273,-21.40260124206543,3.7513809204101562,14067712,EleutherAI/pythia-14m,step95000,seed4,4,95000
It was a video clip.,clip,clip,It was a clip video., video clip, clip video,video,True,-13.136102676391602,-20.768476486206055,7.632373809814453,14067712,EleutherAI/pythia-14m,step95000,seed4,4,95000
It was a hair clip.,clip,clip,It was a clip hair., hair clip, clip hair,hair,True,-20.02725601196289,-23.38422203063965,3.356966018676758,14067712,EleutherAI/pythia-14m,step95000,seed4,4,95000
It was an icy cold.,cold,cold,It was an cold icy., icy cold, cold icy,icy,False,-13.709526062011719,-18.02921485900879,4.31968879699707,14067712,EleutherAI/pythia-14m,step95000,seed4,4,95000
It was a freezing cold.,cold,cold,It was a cold freezing., freezing cold, cold freezing,freezing,False,-15.490856170654297,-15.819774627685547,0.32891845703125,14067712,EleutherAI/pythia-14m,step95000,seed4,4,95000
It was a chest cold.,cold,cold,It was a cold chest., chest cold, cold chest,chest,False,-18.819576263427734,-17.632633209228516,-1.1869430541992188,14067712,EleutherAI/pythia-14m,step95000,seed4,4,95000
It was a gossip column.,column,column,It was a column gossip., gossip column, column gossip,gossip,True,-20.313968658447266,-21.50274658203125,1.1887779235839844,14067712,EleutherAI/pythia-14m,step95000,seed4,4,95000
It was a sports column.,column,column,It was a column sports., sports column, column sports,sports,True,-15.719989776611328,-19.875389099121094,4.155399322509766,14067712,EleutherAI/pythia-14m,step95000,seed4,4,95000
It was a concrete column.,column,column,It was a column concrete., concrete column, column concrete,concrete,False,-16.375102996826172,-19.446609497070312,3.0715065002441406,14067712,EleutherAI/pythia-14m,step95000,seed4,4,95000
He liked the investment company.,company,company,He liked the company investment., investment company, company investment,investment,True,-16.0874080657959,-16.230083465576172,0.14267539978027344,14067712,EleutherAI/pythia-14m,step95000,seed4,4,95000
He liked the pharmaceutical company.,company,company,He liked the company pharmaceutical., pharmaceutical company, company pharmaceutical,pharmaceutical,False,-13.533900260925293,-20.46146011352539,6.927559852600098,14067712,EleutherAI/pythia-14m,step95000,seed4,4,95000
He liked the pleasant company.,company,company,He liked the company pleasant., pleasant company, company pleasant,pleasant,False,-18.97599220275879,-22.06838607788086,3.0923938751220703,14067712,EleutherAI/pythia-14m,step95000,seed4,4,95000
It was a waffle cone.,cone,cone,It was a cone waffle., waffle cone, cone waffle,waffle,True,-26.606840133666992,-26.77724266052246,0.17040252685546875,14067712,EleutherAI/pythia-14m,step95000,seed4,4,95000
It was a sugar cone.,cone,cone,It was a cone sugar., sugar cone, cone sugar,sugar,True,-18.762535095214844,-22.334800720214844,3.572265625,14067712,EleutherAI/pythia-14m,step95000,seed4,4,95000
It was an orange cone.,cone,cone,It was an cone orange., orange cone, cone orange,orange,False,-14.930156707763672,-22.524871826171875,7.594715118408203,14067712,EleutherAI/pythia-14m,step95000,seed4,4,95000
He made a charitable contribution.,contribution,contribution,He made a contribution charitable., charitable contribution, contribution charitable,charitable,False,-15.798389434814453,-23.032529830932617,7.234140396118164,14067712,EleutherAI/pythia-14m,step95000,seed4,4,95000
He made a voluntary contribution.,contribution,contribution,He made a contribution voluntary., voluntary contribution, contribution voluntary,voluntary,False,-15.787101745605469,-22.54963493347168,6.762533187866211,14067712,EleutherAI/pythia-14m,step95000,seed4,4,95000
He made a scholarly contribution.,contribution,contribution,He made a contribution scholarly., scholarly contribution, contribution scholarly,scholarly,False,-19.420591354370117,-24.7280330657959,5.307441711425781,14067712,EleutherAI/pythia-14m,step95000,seed4,4,95000
That was the noble count.,count,count,That was the count noble., noble count, count noble,noble,False,-19.0462703704834,-22.79401397705078,3.747743606567383,14067712,EleutherAI/pythia-14m,step95000,seed4,4,95000
That was the vengeful count.,count,count,That was the count vengeful., vengeful count, count vengeful,vengeful,False,-22.949626922607422,-25.4764404296875,2.526813507080078,14067712,EleutherAI/pythia-14m,step95000,seed4,4,95000
That was the final count.,count,count,That was the count final., final count, count final,final,False,-12.159841537475586,-18.76488494873047,6.605043411254883,14067712,EleutherAI/pythia-14m,step95000,seed4,4,95000
It was an introductory course.,course,course,It was an course introductory., introductory course, course introductory,introductory,False,-10.911821365356445,-22.074260711669922,11.162439346313477,14067712,EleutherAI/pythia-14m,step95000,seed4,4,95000
It was a pass-fail course.,course,course,It was a course pass-fail., pass-fail course, course pass-fail,pass-fail,False,-28.690216064453125,-31.519161224365234,2.8289451599121094,14067712,EleutherAI/pythia-14m,step95000,seed4,4,95000
It was a charted course.,course,course,It was a course charted., charted course, course charted,charted,False,-20.232624053955078,-22.39729118347168,2.1646671295166016,14067712,EleutherAI/pythia-14m,step95000,seed4,4,95000
It was a dinner date.,date,date,It was a date dinner., dinner date, date dinner,dinner,True,-16.901514053344727,-17.777347564697266,0.8758335113525391,14067712,EleutherAI/pythia-14m,step95000,seed4,4,95000
It was a blind date.,date,date,It was a date blind., blind date, date blind,blind,False,-16.386436462402344,-18.16091537475586,1.7744789123535156,14067712,EleutherAI/pythia-14m,step95000,seed4,4,95000
It was an expiration date.,date,date,It was an date expiration., expiration date, date expiration,expiration,True,-12.05881118774414,-20.27684783935547,8.218036651611328,14067712,EleutherAI/pythia-14m,step95000,seed4,4,95000
It was about forty degrees.,degree,degrees,It was about degrees forty., forty degrees, degrees forty,forty,True,-15.993921279907227,-22.205305099487305,6.211383819580078,14067712,EleutherAI/pythia-14m,step95000,seed4,4,95000
It was about fifty degrees.,degree,degrees,It was about degrees fifty., fifty degrees, degrees fifty,fifty,True,-16.559511184692383,-22.071683883666992,5.512172698974609,14067712,EleutherAI/pythia-14m,step95000,seed4,4,95000
It was about associate degrees.,degree,degrees,It was about degrees associate., associate degrees, degrees associate,associate,False,-22.81839370727539,-24.129484176635742,1.3110904693603516,14067712,EleutherAI/pythia-14m,step95000,seed4,4,95000
They liked the floral design.,design,design,They liked the design floral., floral design, design floral,floral,False,-16.570703506469727,-20.585857391357422,4.015153884887695,14067712,EleutherAI/pythia-14m,step95000,seed4,4,95000
They liked the geometric design.,design,design,They liked the design geometric., geometric design, design geometric,geometric,False,-17.894622802734375,-21.075672149658203,3.181049346923828,14067712,EleutherAI/pythia-14m,step95000,seed4,4,95000
They liked the product design.,design,design,They liked the design product., product design, design product,product,True,-15.26233196258545,-16.526203155517578,1.263871192932129,14067712,EleutherAI/pythia-14m,step95000,seed4,4,95000
They liked the turkey dinner.,dinner,dinner,They liked the dinner turkey., turkey dinner, dinner turkey,turkey,True,-20.148950576782227,-20.995418548583984,0.8464679718017578,14067712,EleutherAI/pythia-14m,step95000,seed4,4,95000
They liked the light dinner.,dinner,dinner,They liked the dinner light., light dinner, dinner light,light,False,-21.529569625854492,-21.288516998291016,-0.24105262756347656,14067712,EleutherAI/pythia-14m,step95000,seed4,4,95000
They liked the formal dinner.,dinner,dinner,They liked the dinner formal., formal dinner, dinner formal,formal,False,-18.780101776123047,-23.134632110595703,4.354530334472656,14067712,EleutherAI/pythia-14m,step95000,seed4,4,95000
He had a recurring dream.,dream,dream,He had a dream recurring., recurring dream, dream recurring,recurring,False,-16.048707962036133,-18.775272369384766,2.726564407348633,14067712,EleutherAI/pythia-14m,step95000,seed4,4,95000
He had a bad dream.,dream,dream,He had a dream bad., bad dream, dream bad,bad,False,-13.18642807006836,-15.434855461120605,2.248427391052246,14067712,EleutherAI/pythia-14m,step95000,seed4,4,95000
He had a childhood dream.,dream,dream,He had a dream childhood., childhood dream, dream childhood,childhood,True,-13.411739349365234,-17.21487808227539,3.8031387329101562,14067712,EleutherAI/pythia-14m,step95000,seed4,4,95000
It was a grueling drill.,drill,drill,It was a drill grueling., grueling drill, drill grueling,grueling,False,-21.759475708007812,-23.571264266967773,1.811788558959961,14067712,EleutherAI/pythia-14m,step95000,seed4,4,95000
It was a challenging drill.,drill,drill,It was a drill challenging., challenging drill, drill challenging,challenging,False,-20.460899353027344,-22.636356353759766,2.175457000732422,14067712,EleutherAI/pythia-14m,step95000,seed4,4,95000
It was an electric drill.,drill,drill,It was an drill electric., electric drill, drill electric,electric,False,-16.031986236572266,-21.09404182434082,5.062055587768555,14067712,EleutherAI/pythia-14m,step95000,seed4,4,95000
It was a multiple-choice examination.,examination,examination,It was an examination multiple-choice., multiple-choice examination, examination multiple-choice,multiple-choice,False,-23.95638656616211,-28.53738021850586,4.58099365234375,14067712,EleutherAI/pythia-14m,step95000,seed4,4,95000
It was a difficult examination.,examination,examination,It was an examination difficult., difficult examination, examination difficult,difficult,False,-16.492713928222656,-17.43403434753418,0.9413204193115234,14067712,EleutherAI/pythia-14m,step95000,seed4,4,95000
It was a prostate examination.,examination,examination,It was an examination prostate., prostate examination, examination prostate,prostate,True,-20.15533447265625,-21.833349227905273,1.6780147552490234,14067712,EleutherAI/pythia-14m,step95000,seed4,4,95000
They had an electric fan.,fan,fan,They had an fan electric., electric fan, fan electric,electric,False,-14.481847763061523,-22.2193603515625,7.737512588500977,14067712,EleutherAI/pythia-14m,step95000,seed4,4,95000
They had a ceiling fan.,fan,fan,They had a fan ceiling., ceiling fan, fan ceiling,ceiling,True,-16.072834014892578,-21.041973114013672,4.969139099121094,14067712,EleutherAI/pythia-14m,step95000,seed4,4,95000
They had a zealous fan.,fan,fan,They had a fan zealous., zealous fan, fan zealous,zealous,False,-21.042255401611328,-24.692651748657227,3.6503963470458984,14067712,EleutherAI/pythia-14m,step95000,seed4,4,95000
She had a text file.,file,file,She had a file text., text file, file text,text,True,-15.209630012512207,-18.286245346069336,3.076615333557129,14067712,EleutherAI/pythia-14m,step95000,seed4,4,95000
She had a data file.,file,file,She had a file data., data file, file data,data,True,-14.240062713623047,-18.44234275817871,4.202280044555664,14067712,EleutherAI/pythia-14m,step95000,seed4,4,95000
She had a nail file.,file,file,She had a file nail., nail file, file nail,nail,True,-17.796707153320312,-22.6774959564209,4.880788803100586,14067712,EleutherAI/pythia-14m,step95000,seed4,4,95000
It was an action film.,film,film,It was an film action., action film, film action,action,True,-14.57613468170166,-15.477867126464844,0.9017324447631836,14067712,EleutherAI/pythia-14m,step95000,seed4,4,95000
It was a censored film.,film,film,It was a film censored., censored film, film censored,censored,False,-20.81269073486328,-22.26968002319336,1.4569892883300781,14067712,EleutherAI/pythia-14m,step95000,seed4,4,95000
It was a transparent film.,film,film,It was a film transparent., transparent film, film transparent,transparent,False,-16.607746124267578,-21.029409408569336,4.421663284301758,14067712,EleutherAI/pythia-14m,step95000,seed4,4,95000
It was a charitable foundation.,foundation,foundation,It was a foundation charitable., charitable foundation, foundation charitable,charitable,False,-14.992546081542969,-21.88105010986328,6.8885040283203125,14067712,EleutherAI/pythia-14m,step95000,seed4,4,95000
It was an educational foundation.,foundation,foundation,It was an foundation educational., educational foundation, foundation educational,educational,False,-14.137409210205078,-21.30059051513672,7.163181304931641,14067712,EleutherAI/pythia-14m,step95000,seed4,4,95000
It was a wooden foundation.,foundation,foundation,It was a foundation wooden., wooden foundation, foundation wooden,wooden,False,-17.57866859436035,-20.80188751220703,3.2232189178466797,14067712,EleutherAI/pythia-14m,step95000,seed4,4,95000
It was a mathematical function.,function,function,It was a function mathematical., mathematical function, function mathematical,mathematical,False,-13.887166976928711,-19.869646072387695,5.982479095458984,14067712,EleutherAI/pythia-14m,step95000,seed4,4,95000
It was a linear function.,function,function,It was a function linear., linear function, function linear,linear,False,-13.687444686889648,-17.91631507873535,4.228870391845703,14067712,EleutherAI/pythia-14m,step95000,seed4,4,95000
