sentence,word,string,reversed_sentence,mod_np,reversed_mod,disambiguating_word,non_adjective,original_logprob,reversed_logprob,ratio,n_params,mpath,revision,seed_name,seed,step
It was a social function.,function,function,It was a function social., social function, function social,social,False,-15.183990478515625,-18.49578094482422,3.3117904663085938,14067712,EleutherAI/pythia-14m,step58000,seed2,2,58000
He was on the firm ground.,ground,ground,He was on the ground firm., firm ground, ground firm,firm,False,-16.63021469116211,-16.945398330688477,0.3151836395263672,14067712,EleutherAI/pythia-14m,step58000,seed2,2,58000
He was on the frozen ground.,ground,ground,He was on the ground frozen., frozen ground, ground frozen,frozen,False,-16.57697868347168,-18.050745010375977,1.4737663269042969,14067712,EleutherAI/pythia-14m,step58000,seed2,2,58000
He was on the camp ground.,ground,ground,He was on the ground camp., camp ground, ground camp,camp,True,-18.16552734375,-17.64188575744629,-0.5236415863037109,14067712,EleutherAI/pythia-14m,step58000,seed2,2,58000
They liked the night guard.,guard,guard,They liked the guard night., night guard, guard night,night,True,-18.660118103027344,-19.450225830078125,0.7901077270507812,14067712,EleutherAI/pythia-14m,step58000,seed2,2,58000
They liked the security guard.,guard,guard,They liked the guard security., security guard, guard security,security,True,-16.631454467773438,-20.48907470703125,3.8576202392578125,14067712,EleutherAI/pythia-14m,step58000,seed2,2,58000
They liked the coast guard.,guard,guard,They liked the guard coast., coast guard, guard coast,coast,True,-22.329402923583984,-24.618118286132812,2.288715362548828,14067712,EleutherAI/pythia-14m,step58000,seed2,2,58000
He had an assembly guide.,guide,guide,He had an guide assembly., assembly guide, guide assembly,assembly,True,-19.89853858947754,-22.613924026489258,2.7153854370117188,14067712,EleutherAI/pythia-14m,step58000,seed2,2,58000
He had a TV guide.,guide,guide,He had a guide TV., TV guide, guide TV,TV,True,-17.56714630126953,-21.121967315673828,3.554821014404297,14067712,EleutherAI/pythia-14m,step58000,seed2,2,58000
He had a talkative guide.,guide,guide,He had a guide talkative., talkative guide, guide talkative,talkative,False,-22.755874633789062,-27.8653507232666,5.109476089477539,14067712,EleutherAI/pythia-14m,step58000,seed2,2,58000
It was a summer home.,home,home,It was a home summer., summer home, home summer,summer,True,-14.524396896362305,-18.2149715423584,3.6905746459960938,14067712,EleutherAI/pythia-14m,step58000,seed2,2,58000
It was a childhood home.,home,home,It was a home childhood., childhood home, home childhood,childhood,True,-13.586233139038086,-17.19673728942871,3.610504150390625,14067712,EleutherAI/pythia-14m,step58000,seed2,2,58000
It was a funeral home.,home,home,It was a home funeral., funeral home, home funeral,funeral,False,-14.445347785949707,-16.36896324157715,1.9236154556274414,14067712,EleutherAI/pythia-14m,step58000,seed2,2,58000
They had natural intelligence.,intelligence,intelligence,They had intelligence natural., natural intelligence, intelligence natural,natural,False,-18.99315643310547,-22.369319915771484,3.3761634826660156,14067712,EleutherAI/pythia-14m,step58000,seed2,2,58000
They had innate intelligence.,intelligence,intelligence,They had intelligence innate., innate intelligence, intelligence innate,innate,False,-18.56374740600586,-23.986751556396484,5.423004150390625,14067712,EleutherAI/pythia-14m,step58000,seed2,2,58000
They had classified intelligence.,intelligence,intelligence,They had intelligence classified., classified intelligence, intelligence classified,classified,False,-20.368247985839844,-22.359432220458984,1.9911842346191406,14067712,EleutherAI/pythia-14m,step58000,seed2,2,58000
It was a sensitive issue.,issue,issue,It was an issue sensitive., sensitive issue, issue sensitive,sensitive,False,-17.182186126708984,-17.570980072021484,0.3887939453125,14067712,EleutherAI/pythia-14m,step58000,seed2,2,58000
It was a political issue.,issue,issue,It was an issue political., political issue, issue political,political,False,-14.60218620300293,-17.456539154052734,2.8543529510498047,14067712,EleutherAI/pythia-14m,step58000,seed2,2,58000
It was a weekly issue.,issue,issue,It was an issue weekly., weekly issue, issue weekly,weekly,False,-19.976093292236328,-17.585338592529297,-2.3907546997070312,14067712,EleutherAI/pythia-14m,step58000,seed2,2,58000
It was a blackberry jam.,jam,jam,It was a jam blackberry., blackberry jam, jam blackberry,blackberry,True,-19.29741096496582,-27.150484085083008,7.8530731201171875,14067712,EleutherAI/pythia-14m,step58000,seed2,2,58000
It was a peach jam.,jam,jam,It was a jam peach., peach jam, jam peach,peach,False,-25.89822769165039,-27.33506202697754,1.4368343353271484,14067712,EleutherAI/pythia-14m,step58000,seed2,2,58000
It was a traffic jam.,jam,jam,It was a jam traffic., traffic jam, jam traffic,traffic,True,-15.742546081542969,-21.72323989868164,5.980693817138672,14067712,EleutherAI/pythia-14m,step58000,seed2,2,58000
It was a duplicate key.,key,key,It was a key duplicate., duplicate key, key duplicate,duplicate,False,-18.329479217529297,-16.851274490356445,-1.4782047271728516,14067712,EleutherAI/pythia-14m,step58000,seed2,2,58000
It was a master key.,key,key,It was a key master., master key, key master,master,True,-17.854217529296875,-15.95628547668457,-1.8979320526123047,14067712,EleutherAI/pythia-14m,step58000,seed2,2,58000
It was a delete key.,key,key,It was a key delete., delete key, key delete,delete,False,-17.87847900390625,-17.67607307434082,-0.2024059295654297,14067712,EleutherAI/pythia-14m,step58000,seed2,2,58000
They liked the marinated lamb.,lamb,lamb,They liked the lamb marinated., marinated lamb, lamb marinated,marinated,True,-23.723255157470703,-25.758403778076172,2.0351486206054688,14067712,EleutherAI/pythia-14m,step58000,seed2,2,58000
They liked the grilled lamb.,lamb,lamb,They liked the lamb grilled., grilled lamb, lamb grilled,grilled,False,-17.921566009521484,-20.19300079345703,2.271434783935547,14067712,EleutherAI/pythia-14m,step58000,seed2,2,58000
They liked the cute lamb.,lamb,lamb,They liked the lamb cute., cute lamb, lamb cute,cute,False,-17.85572624206543,-21.860023498535156,4.004297256469727,14067712,EleutherAI/pythia-14m,step58000,seed2,2,58000
She had curly locks.,lock,locks,She had locks curly., curly locks, locks curly,curly,False,-21.37047576904297,-25.722030639648438,4.351554870605469,14067712,EleutherAI/pythia-14m,step58000,seed2,2,58000
She had brown locks.,lock,locks,She had locks brown., brown locks, locks brown,brown,False,-22.120983123779297,-22.946243286132812,0.8252601623535156,14067712,EleutherAI/pythia-14m,step58000,seed2,2,58000
She had window locks.,lock,locks,She had locks window., window locks, locks window,window,True,-23.11099624633789,-23.241500854492188,0.13050460815429688,14067712,EleutherAI/pythia-14m,step58000,seed2,2,58000
They liked the hot lunch.,lunch,lunch,They liked the lunch hot., hot lunch, lunch hot,hot,False,-14.856130599975586,-19.576353073120117,4.720222473144531,14067712,EleutherAI/pythia-14m,step58000,seed2,2,58000
They liked the sandwich lunch.,lunch,lunch,They liked the lunch sandwich., sandwich lunch, lunch sandwich,sandwich,True,-19.10559844970703,-18.95557975769043,-0.15001869201660156,14067712,EleutherAI/pythia-14m,step58000,seed2,2,58000
They liked the afternoon lunch.,lunch,lunch,They liked the lunch afternoon., afternoon lunch, lunch afternoon,afternoon,True,-17.41028594970703,-18.69575309753418,1.2854671478271484,14067712,EleutherAI/pythia-14m,step58000,seed2,2,58000
He liked the flea market.,market,market,He liked the market flea., flea market, market flea,flea,True,-21.716068267822266,-21.776275634765625,0.060207366943359375,14067712,EleutherAI/pythia-14m,step58000,seed2,2,58000
He liked the fish market.,market,market,He liked the market fish., fish market, market fish,fish,True,-16.71303939819336,-19.20438575744629,2.4913463592529297,14067712,EleutherAI/pythia-14m,step58000,seed2,2,58000
He liked the housing market.,market,market,He liked the market housing., housing market, market housing,housing,True,-17.230243682861328,-19.32395362854004,2.093709945678711,14067712,EleutherAI/pythia-14m,step58000,seed2,2,58000
It was a lit match.,match,match,It was a match lit., lit match, match lit,lit,False,-25.01175308227539,-20.433460235595703,-4.5782928466796875,14067712,EleutherAI/pythia-14m,step58000,seed2,2,58000
It was a burning match.,match,match,It was a match burning., burning match, match burning,burning,False,-21.111000061035156,-20.65140151977539,-0.4595985412597656,14067712,EleutherAI/pythia-14m,step58000,seed2,2,58000
It was a soccer match.,match,match,It was a match soccer., soccer match, match soccer,soccer,True,-15.240473747253418,-20.833805084228516,5.593331336975098,14067712,EleutherAI/pythia-14m,step58000,seed2,2,58000
It was cough medicine.,medicine,medicine,It was medicine cough., cough medicine, medicine cough,cough,True,-19.61916732788086,-19.810840606689453,0.19167327880859375,14067712,EleutherAI/pythia-14m,step58000,seed2,2,58000
It was prescription medicine.,medicine,medicine,It was medicine prescription., prescription medicine, medicine prescription,prescription,True,-16.119993209838867,-19.812335968017578,3.692342758178711,14067712,EleutherAI/pythia-14m,step58000,seed2,2,58000
It was orthopedic medicine.,medicine,medicine,It was medicine orthopedic., orthopedic medicine, medicine orthopedic,orthopedic,False,-24.081645965576172,-23.42046546936035,-0.6611804962158203,14067712,EleutherAI/pythia-14m,step58000,seed2,2,58000
There was a phone message.,message,message,There was a message phone., phone message, message phone,phone,True,-12.885141372680664,-17.725685119628906,4.840543746948242,14067712,EleutherAI/pythia-14m,step58000,seed2,2,58000
There was a computer message.,message,message,There was a message computer., computer message, message computer,computer,True,-17.392860412597656,-19.491905212402344,2.0990447998046875,14067712,EleutherAI/pythia-14m,step58000,seed2,2,58000
There was an urgent message.,message,message,There was an message urgent., urgent message, message urgent,urgent,False,-11.74373722076416,-21.169769287109375,9.426032066345215,14067712,EleutherAI/pythia-14m,step58000,seed2,2,58000
It was a fungal mold.,mold,mold,It was a mold fungal., fungal mold, mold fungal,fungal,False,-19.524349212646484,-21.47812271118164,1.9537734985351562,14067712,EleutherAI/pythia-14m,step58000,seed2,2,58000
It was a harmful mold.,mold,mold,It was a mold harmful., harmful mold, mold harmful,harmful,False,-18.556419372558594,-21.687122344970703,3.1307029724121094,14067712,EleutherAI/pythia-14m,step58000,seed2,2,58000
It was a rubber mold.,mold,mold,It was a mold rubber., rubber mold, mold rubber,rubber,True,-16.762617111206055,-18.171314239501953,1.4086971282958984,14067712,EleutherAI/pythia-14m,step58000,seed2,2,58000
She saw the cancerous mole.,mole,mole,She saw the mole cancerous., cancerous mole, mole cancerous,cancerous,False,-23.59170913696289,-26.341354370117188,2.749645233154297,14067712,EleutherAI/pythia-14m,step58000,seed2,2,58000
She saw the raised mole.,mole,mole,She saw the mole raised., raised mole, mole raised,raised,False,-22.16196632385254,-18.654462814331055,-3.5075035095214844,14067712,EleutherAI/pythia-14m,step58000,seed2,2,58000
She saw the cute mole.,mole,mole,She saw the mole cute., cute mole, mole cute,cute,False,-19.679386138916016,-21.686368942260742,2.0069828033447266,14067712,EleutherAI/pythia-14m,step58000,seed2,2,58000
He liked the rhythmic movement.,movement,movement,He liked the movement rhythmic., rhythmic movement, movement rhythmic,rhythmic,False,-16.930561065673828,-23.141889572143555,6.211328506469727,14067712,EleutherAI/pythia-14m,step58000,seed2,2,58000
He liked the graceful movement.,movement,movement,He liked the movement graceful., graceful movement, movement graceful,graceful,False,-19.251489639282227,-23.236309051513672,3.9848194122314453,14067712,EleutherAI/pythia-14m,step58000,seed2,2,58000
He liked the feminist movement.,movement,movement,He liked the movement feminist., feminist movement, movement feminist,feminist,True,-18.00146484375,-22.595287322998047,4.593822479248047,14067712,EleutherAI/pythia-14m,step58000,seed2,2,58000
It was a national newspaper.,newspaper,newspaper,It was a newspaper national., national newspaper, newspaper national,national,False,-12.821115493774414,-18.747955322265625,5.926839828491211,14067712,EleutherAI/pythia-14m,step58000,seed2,2,58000
It was a daily newspaper.,newspaper,newspaper,It was a newspaper daily., daily newspaper, newspaper daily,daily,False,-13.95284652709961,-17.292556762695312,3.339710235595703,14067712,EleutherAI/pythia-14m,step58000,seed2,2,58000
It was a faded newspaper.,newspaper,newspaper,It was a newspaper faded., faded newspaper, newspaper faded,faded,False,-19.639873504638672,-19.8834228515625,0.24354934692382812,14067712,EleutherAI/pythia-14m,step58000,seed2,2,58000
It was a juicy orange.,orange,orange,It was an orange juicy., juicy orange, orange juicy,juicy,False,-19.638364791870117,-19.36659049987793,-0.2717742919921875,14067712,EleutherAI/pythia-14m,step58000,seed2,2,58000
It was a ripe orange.,orange,orange,It was an orange ripe., ripe orange, orange ripe,ripe,False,-18.676713943481445,-19.004196166992188,0.3274822235107422,14067712,EleutherAI/pythia-14m,step58000,seed2,2,58000
It was a bright orange.,orange,orange,It was an orange bright., bright orange, orange bright,bright,False,-13.327569007873535,-15.489471435546875,2.16190242767334,14067712,EleutherAI/pythia-14m,step58000,seed2,2,58000
He saw the young page.,page,page,He saw the page young., young page, page young,young,False,-17.305999755859375,-22.08844566345215,4.782445907592773,14067712,EleutherAI/pythia-14m,step58000,seed2,2,58000
He saw the loyal page.,page,page,He saw the page loyal., loyal page, page loyal,loyal,False,-23.29610824584961,-24.778005599975586,1.4818973541259766,14067712,EleutherAI/pythia-14m,step58000,seed2,2,58000
He saw the blank page.,page,page,He saw the page blank., blank page, page blank,blank,False,-14.561359405517578,-19.32440757751465,4.76304817199707,14067712,EleutherAI/pythia-14m,step58000,seed2,2,58000
It was a calloused palm.,palm,palm,It was a palm calloused., calloused palm, palm calloused,calloused,False,-29.366968154907227,-32.046043395996094,2.679075241088867,14067712,EleutherAI/pythia-14m,step58000,seed2,2,58000
It was a wrinkled palm.,palm,palm,It was a palm wrinkled., wrinkled palm, palm wrinkled,wrinkled,False,-24.61478042602539,-24.148456573486328,-0.4663238525390625,14067712,EleutherAI/pythia-14m,step58000,seed2,2,58000
It was a tropical palm.,palm,palm,It was a palm tropical., tropical palm, palm tropical,tropical,False,-19.836528778076172,-21.74323844909668,1.9067096710205078,14067712,EleutherAI/pythia-14m,step58000,seed2,2,58000
It was a control panel.,panel,panel,It was a panel control., control panel, panel control,control,True,-14.575691223144531,-15.749031066894531,1.17333984375,14067712,EleutherAI/pythia-14m,step58000,seed2,2,58000
It was an instrument panel.,panel,panel,It was an panel instrument., instrument panel, panel instrument,instrument,False,-13.952667236328125,-19.543386459350586,5.590719223022461,14067712,EleutherAI/pythia-14m,step58000,seed2,2,58000
It was an advisory panel.,panel,panel,It was an panel advisory., advisory panel, panel advisory,advisory,False,-16.042400360107422,-22.39296531677246,6.350564956665039,14067712,EleutherAI/pythia-14m,step58000,seed2,2,58000
It was a secret passage.,passage,passage,It was a passage secret., secret passage, passage secret,secret,False,-16.29404067993164,-22.16298484802246,5.86894416809082,14067712,EleutherAI/pythia-14m,step58000,seed2,2,58000
It was a narrow passage.,passage,passage,It was a passage narrow., narrow passage, passage narrow,narrow,False,-15.992019653320312,-21.612417221069336,5.620397567749023,14067712,EleutherAI/pythia-14m,step58000,seed2,2,58000
It was a literary passage.,passage,passage,It was a passage literary., literary passage, passage literary,literary,False,-17.863201141357422,-22.79915428161621,4.935953140258789,14067712,EleutherAI/pythia-14m,step58000,seed2,2,58000
It was a tasty perch.,perch,perch,It was a perch tasty., tasty perch, perch tasty,tasty,False,-21.069217681884766,-25.049747467041016,3.98052978515625,14067712,EleutherAI/pythia-14m,step58000,seed2,2,58000
It was a freshwater perch.,perch,perch,It was a perch freshwater., freshwater perch, perch freshwater,freshwater,True,-21.128427505493164,-24.429767608642578,3.301340103149414,14067712,EleutherAI/pythia-14m,step58000,seed2,2,58000
It was a lofty perch.,perch,perch,It was a perch lofty., lofty perch, perch lofty,lofty,False,-24.51374053955078,-25.70702362060547,1.1932830810546875,14067712,EleutherAI/pythia-14m,step58000,seed2,2,58000
He saw the fast pitcher.,pitcher,pitcher,He saw the pitcher fast., fast pitcher, pitcher fast,fast,False,-21.46491813659668,-20.398122787475586,-1.0667953491210938,14067712,EleutherAI/pythia-14m,step58000,seed2,2,58000
He saw the right-handed pitcher.,pitcher,pitcher,He saw the pitcher right-handed., right-handed pitcher, pitcher right-handed,right-handed,False,-19.330078125,-23.957059860229492,4.626981735229492,14067712,EleutherAI/pythia-14m,step58000,seed2,2,58000
He saw the glass pitcher.,pitcher,pitcher,He saw the pitcher glass., glass pitcher, pitcher glass,glass,True,-19.024791717529297,-21.01686668395996,1.992074966430664,14067712,EleutherAI/pythia-14m,step58000,seed2,2,58000
It was a windy port.,port,port,It was a port windy., windy port, port windy,windy,False,-22.61931610107422,-24.78891372680664,2.169597625732422,14067712,EleutherAI/pythia-14m,step58000,seed2,2,58000
It was a seaside port.,port,port,It was a port seaside., seaside port, port seaside,seaside,True,-19.935766220092773,-23.200942993164062,3.265176773071289,14067712,EleutherAI/pythia-14m,step58000,seed2,2,58000
It was a delicious port.,port,port,It was a port delicious., delicious port, port delicious,delicious,False,-19.076202392578125,-24.62677764892578,5.550575256347656,14067712,EleutherAI/pythia-14m,step58000,seed2,2,58000
He was in a distinguished position.,position,position,He was in a position distinguished., distinguished position, position distinguished,distinguished,False,-13.54698371887207,-17.739091873168945,4.192108154296875,14067712,EleutherAI/pythia-14m,step58000,seed2,2,58000
He was in a prominent position.,position,position,He was in a position prominent., prominent position, position prominent,prominent,False,-12.5093412399292,-16.994386672973633,4.485045433044434,14067712,EleutherAI/pythia-14m,step58000,seed2,2,58000
He was in a fetal position.,position,position,He was in a position fetal., fetal position, position fetal,fetal,False,-17.816547393798828,-20.752016067504883,2.9354686737060547,14067712,EleutherAI/pythia-14m,step58000,seed2,2,58000
It was a wooden post.,post,post,It was a post wooden., wooden post, post wooden,wooden,False,-18.523624420166016,-20.69464111328125,2.1710166931152344,14067712,EleutherAI/pythia-14m,step58000,seed2,2,58000
It was a fence post.,post,post,It was a post fence., fence post, post fence,fence,True,-19.414796829223633,-21.59429931640625,2.179502487182617,14067712,EleutherAI/pythia-14m,step58000,seed2,2,58000
It was a teaching post.,post,post,It was a post teaching., teaching post, post teaching,teaching,True,-17.50342559814453,-19.253494262695312,1.7500686645507812,14067712,EleutherAI/pythia-14m,step58000,seed2,2,58000
He had the alcoholic punch.,punch,punch,He had the punch alcoholic., alcoholic punch, punch alcoholic,alcoholic,False,-21.505107879638672,-22.61269760131836,1.1075897216796875,14067712,EleutherAI/pythia-14m,step58000,seed2,2,58000
He had the fruit punch.,punch,punch,He had the punch fruit., fruit punch, punch fruit,fruit,True,-19.9266357421875,-21.444896697998047,1.5182609558105469,14067712,EleutherAI/pythia-14m,step58000,seed2,2,58000
He had the strongest punch.,punch,punch,He had the punch strongest., strongest punch, punch strongest,strongest,False,-17.951921463012695,-21.70608139038086,3.754159927368164,14067712,EleutherAI/pythia-14m,step58000,seed2,2,58000
She had a brilliant pupil.,pupil,pupil,She had a pupil brilliant., brilliant pupil, pupil brilliant,brilliant,False,-18.16793441772461,-20.645679473876953,2.4777450561523438,14067712,EleutherAI/pythia-14m,step58000,seed2,2,58000
She had an interested pupil.,pupil,pupil,She had an pupil interested., interested pupil, pupil interested,interested,False,-18.057594299316406,-19.833507537841797,1.7759132385253906,14067712,EleutherAI/pythia-14m,step58000,seed2,2,58000
She had a dilated pupil.,pupil,pupil,She had a pupil dilated., dilated pupil, pupil dilated,dilated,False,-19.963577270507812,-20.16812515258789,0.20454788208007812,14067712,EleutherAI/pythia-14m,step58000,seed2,2,58000
That was a loud racket.,racket,racket,That was a racket loud., loud racket, racket loud,loud,False,-16.995040893554688,-21.001195907592773,4.006155014038086,14067712,EleutherAI/pythia-14m,step58000,seed2,2,58000
That was an annoying racket.,racket,racket,That was an racket annoying., annoying racket, racket annoying,annoying,False,-18.383237838745117,-22.8740177154541,4.490779876708984,14067712,EleutherAI/pythia-14m,step58000,seed2,2,58000
That was a badminton racket.,racket,racket,That was a racket badminton., badminton racket, racket badminton,badminton,True,-27.408166885375977,-31.241376876831055,3.833209991455078,14067712,EleutherAI/pythia-14m,step58000,seed2,2,58000
He liked electronic rock.,rock,rock,He liked rock electronic., electronic rock, rock electronic,electronic,False,-20.366214752197266,-20.982532501220703,0.6163177490234375,14067712,EleutherAI/pythia-14m,step58000,seed2,2,58000
He liked alternative rock.,rock,rock,He liked rock alternative., alternative rock, rock alternative,alternative,False,-21.887619018554688,-21.907978057861328,0.020359039306640625,14067712,EleutherAI/pythia-14m,step58000,seed2,2,58000
He liked limestone rock.,rock,rock,He liked rock limestone., limestone rock, rock limestone,limestone,True,-20.94902229309082,-22.202030181884766,1.2530078887939453,14067712,EleutherAI/pythia-14m,step58000,seed2,2,58000
He saw the wise sage.,sage,sage,He saw the sage wise., wise sage, sage wise,wise,False,-20.77198600769043,-21.425992965698242,0.6540069580078125,14067712,EleutherAI/pythia-14m,step58000,seed2,2,58000
He saw the renowned sage.,sage,sage,He saw the sage renowned., renowned sage, sage renowned,renowned,False,-22.88878631591797,-22.904767990112305,0.015981674194335938,14067712,EleutherAI/pythia-14m,step58000,seed2,2,58000
He saw the fragrant sage.,sage,sage,He saw the sage fragrant., fragrant sage, sage fragrant,fragrant,False,-24.555105209350586,-25.800243377685547,1.245138168334961,14067712,EleutherAI/pythia-14m,step58000,seed2,2,58000
It was a fish scale.,scale,scale,It was a scale fish., fish scale, scale fish,fish,True,-17.117263793945312,-18.497846603393555,1.3805828094482422,14067712,EleutherAI/pythia-14m,step58000,seed2,2,58000
It was a lizard scale.,scale,scale,It was a scale lizard., lizard scale, scale lizard,lizard,True,-24.08611297607422,-21.4769344329834,-2.6091785430908203,14067712,EleutherAI/pythia-14m,step58000,seed2,2,58000
It was a music scale.,scale,scale,It was a scale music., music scale, scale music,music,True,-17.171964645385742,-16.265363693237305,-0.9066009521484375,14067712,EleutherAI/pythia-14m,step58000,seed2,2,58000
It was a touching scene.,scene,scene,It was a scene touching., touching scene, scene touching,touching,False,-17.089946746826172,-18.073083877563477,0.9831371307373047,14067712,EleutherAI/pythia-14m,step58000,seed2,2,58000
It was a well-acted scene.,scene,scene,It was a scene well-acted., well-acted scene, scene well-acted,well-acted,False,-22.30520248413086,-26.945831298828125,4.640628814697266,14067712,EleutherAI/pythia-14m,step58000,seed2,2,58000
It was a nature scene.,scene,scene,It was a scene nature., nature scene, scene nature,nature,True,-18.318098068237305,-19.372446060180664,1.0543479919433594,14067712,EleutherAI/pythia-14m,step58000,seed2,2,58000
It was a gold seal.,seal,seal,It was a seal gold., gold seal, seal gold,gold,True,-15.68992805480957,-22.03829002380371,6.348361968994141,14067712,EleutherAI/pythia-14m,step58000,seed2,2,58000
It was a certified seal.,seal,seal,It was a seal certified., certified seal, seal certified,certified,False,-17.23822784423828,-21.437780380249023,4.199552536010742,14067712,EleutherAI/pythia-14m,step58000,seed2,2,58000
It was a circus seal.,seal,seal,It was a seal circus., circus seal, seal circus,circus,True,-22.141361236572266,-25.370412826538086,3.2290515899658203,14067712,EleutherAI/pythia-14m,step58000,seed2,2,58000
He used the scotch tape.,tape,tape,He used the tape scotch., scotch tape, tape scotch,scotch,True,-23.72146987915039,-24.071619033813477,0.35014915466308594,14067712,EleutherAI/pythia-14m,step58000,seed2,2,58000
He used the double-sided tape.,tape,tape,He used the tape double-sided., double-sided tape, tape double-sided,double-sided,False,-23.647811889648438,-26.833227157592773,3.185415267944336,14067712,EleutherAI/pythia-14m,step58000,seed2,2,58000
He used the interview tape.,tape,tape,He used the tape interview., interview tape, tape interview,interview,True,-18.66387176513672,-18.279176712036133,-0.38469505310058594,14067712,EleutherAI/pythia-14m,step58000,seed2,2,58000
It was a winter term.,term,term,It was a term winter., winter term, term winter,winter,True,-16.0853271484375,-21.150169372558594,5.064842224121094,14067712,EleutherAI/pythia-14m,step58000,seed2,2,58000
