sentence,word,string,reversed_sentence,mod_np,reversed_mod,disambiguating_word,non_adjective,original_logprob,reversed_logprob,ratio,n_params,mpath,revision,seed_name,seed,step
It was a desperate act.,act,act,It was an act desperate., desperate act, act desperate,desperate,False,-13.979583740234375,-16.561914443969727,2.5823307037353516,14067712,EleutherAI/pythia-14m,step93000,seed8,8,93000
It was a humane act.,act,act,It was an act humane., humane act, act humane,humane,False,-18.046279907226562,-17.190670013427734,-0.8556098937988281,14067712,EleutherAI/pythia-14m,step93000,seed8,8,93000
It was a magic act.,act,act,It was an act magic., magic act, act magic,magic,False,-15.286324501037598,-18.065210342407227,2.778885841369629,14067712,EleutherAI/pythia-14m,step93000,seed8,8,93000
He had a universal appeal.,appeal,appeal,He had an appeal universal., universal appeal, appeal universal,universal,False,-18.518756866455078,-20.948532104492188,2.4297752380371094,14067712,EleutherAI/pythia-14m,step93000,seed8,8,93000
He had an undefinable appeal.,appeal,appeal,He had an appeal undefinable., undefinable appeal, appeal undefinable,undefinable,False,-25.820201873779297,-27.49437713623047,1.6741752624511719,14067712,EleutherAI/pythia-14m,step93000,seed8,8,93000
He had a legal appeal.,appeal,appeal,He had an appeal legal., legal appeal, appeal legal,legal,False,-17.048419952392578,-18.636459350585938,1.5880393981933594,14067712,EleutherAI/pythia-14m,step93000,seed8,8,93000
It was a tense atmosphere.,atmosphere,atmosphere,It was an atmosphere tense., tense atmosphere, atmosphere tense,tense,False,-15.799442291259766,-17.85334014892578,2.0538978576660156,14067712,EleutherAI/pythia-14m,step93000,seed8,8,93000
It was a hostile atmosphere.,atmosphere,atmosphere,It was an atmosphere hostile., hostile atmosphere, atmosphere hostile,hostile,False,-15.667236328125,-18.88996124267578,3.2227249145507812,14067712,EleutherAI/pythia-14m,step93000,seed8,8,93000
It was a gaseous atmosphere.,atmosphere,atmosphere,It was an atmosphere gaseous., gaseous atmosphere, atmosphere gaseous,gaseous,False,-18.252622604370117,-21.60626792907715,3.3536453247070312,14067712,EleutherAI/pythia-14m,step93000,seed8,8,93000
It was a gold band.,band,band,It was a band gold., gold band, band gold,gold,True,-15.568921089172363,-20.47272491455078,4.903803825378418,14067712,EleutherAI/pythia-14m,step93000,seed8,8,93000
It was a rubber band.,band,band,It was a band rubber., rubber band, band rubber,rubber,True,-15.919163703918457,-24.27051544189453,8.351351737976074,14067712,EleutherAI/pythia-14m,step93000,seed8,8,93000
It was a jazz band.,band,band,It was a band jazz., jazz band, band jazz,jazz,True,-13.512459754943848,-21.72150421142578,8.209044456481934,14067712,EleutherAI/pythia-14m,step93000,seed8,8,93000
There was a police barrier.,barrier,barrier,There was a barrier police., police barrier, barrier police,police,True,-17.87889862060547,-19.84368896484375,1.9647903442382812,14067712,EleutherAI/pythia-14m,step93000,seed8,8,93000
There was a concrete barrier.,barrier,barrier,There was a barrier concrete., concrete barrier, barrier concrete,concrete,False,-14.871233940124512,-20.5819091796875,5.710675239562988,14067712,EleutherAI/pythia-14m,step93000,seed8,8,93000
There was a language barrier.,barrier,barrier,There was a barrier language., language barrier, barrier language,language,True,-20.655733108520508,-24.38568115234375,3.729948043823242,14067712,EleutherAI/pythia-14m,step93000,seed8,8,93000
He saw a furry bat.,bat,bat,He saw a bat furry., furry bat, bat furry,furry,False,-20.96424102783203,-23.720951080322266,2.7567100524902344,14067712,EleutherAI/pythia-14m,step93000,seed8,8,93000
He saw a fruit bat.,bat,bat,He saw a bat fruit., fruit bat, bat fruit,fruit,True,-20.44460678100586,-23.63983917236328,3.195232391357422,14067712,EleutherAI/pythia-14m,step93000,seed8,8,93000
He saw a wooden bat.,bat,bat,He saw a bat wooden., wooden bat, bat wooden,wooden,False,-15.25,-23.96930694580078,8.719306945800781,14067712,EleutherAI/pythia-14m,step93000,seed8,8,93000
He saw the laser beam.,beam,beam,He saw the beam laser., laser beam, beam laser,laser,True,-11.607640266418457,-16.92839813232422,5.320757865905762,14067712,EleutherAI/pythia-14m,step93000,seed8,8,93000
He saw the bright beam.,beam,beam,He saw the beam bright., bright beam, beam bright,bright,False,-16.211383819580078,-18.58953094482422,2.3781471252441406,14067712,EleutherAI/pythia-14m,step93000,seed8,8,93000
He saw the wood beam.,beam,beam,He saw the beam wood., wood beam, beam wood,wood,True,-16.010845184326172,-19.18791961669922,3.177074432373047,14067712,EleutherAI/pythia-14m,step93000,seed8,8,93000
She had a toy block.,block,block,She had a block toy., toy block, block toy,toy,True,-16.046024322509766,-20.31258773803711,4.266563415527344,14067712,EleutherAI/pythia-14m,step93000,seed8,8,93000
She had a wooden block.,block,block,She had a block wooden., wooden block, block wooden,wooden,False,-15.272455215454102,-23.86458969116211,8.592134475708008,14067712,EleutherAI/pythia-14m,step93000,seed8,8,93000
She had a mental block.,block,block,She had a block mental., mental block, block mental,mental,False,-14.675945281982422,-23.15536117553711,8.479415893554688,14067712,EleutherAI/pythia-14m,step93000,seed8,8,93000
He has coagulated blood.,blood,blood,He has blood coagulated., coagulated blood, blood coagulated,coagulated,True,-32.685081481933594,-35.08650207519531,2.4014205932617188,14067712,EleutherAI/pythia-14m,step93000,seed8,8,93000
He has thin blood.,blood,blood,He has blood thin., thin blood, blood thin,thin,False,-18.476722717285156,-22.894699096679688,4.417976379394531,14067712,EleutherAI/pythia-14m,step93000,seed8,8,93000
He has noble blood.,blood,blood,He has blood noble., noble blood, blood noble,noble,False,-19.21773910522461,-25.188522338867188,5.970783233642578,14067712,EleutherAI/pythia-14m,step93000,seed8,8,93000
It was the ironing board.,board,board,It was the board ironing., ironing board, board ironing,ironing,False,-24.13985824584961,-21.313940048217773,-2.825918197631836,14067712,EleutherAI/pythia-14m,step93000,seed8,8,93000
It was the wooden board.,board,board,It was the board wooden., wooden board, board wooden,wooden,False,-16.121034622192383,-19.81873893737793,3.697704315185547,14067712,EleutherAI/pythia-14m,step93000,seed8,8,93000
It was the executive board.,board,board,It was the board executive., executive board, board executive,executive,True,-13.626962661743164,-15.58723258972168,1.9602699279785156,14067712,EleutherAI/pythia-14m,step93000,seed8,8,93000
He had a best-selling book.,book,book,He had a book best-selling., best-selling book, book best-selling,best-selling,False,-15.86128044128418,-19.628034591674805,3.766754150390625,14067712,EleutherAI/pythia-14m,step93000,seed8,8,93000
He had a popular book.,book,book,He had a book popular., popular book, book popular,popular,False,-14.287641525268555,-17.490449905395508,3.202808380126953,14067712,EleutherAI/pythia-14m,step93000,seed8,8,93000
He had a heavy book.,book,book,He had a book heavy., heavy book, book heavy,heavy,False,-16.82045555114746,-18.127168655395508,1.3067131042480469,14067712,EleutherAI/pythia-14m,step93000,seed8,8,93000
They ate a pancake breakfast.,breakfast,breakfast,They ate a breakfast pancake., pancake breakfast, breakfast pancake,pancake,True,-13.031852722167969,-14.926688194274902,1.8948354721069336,14067712,EleutherAI/pythia-14m,step93000,seed8,8,93000
They ate a nutritious breakfast.,breakfast,breakfast,They ate a breakfast nutritious., nutritious breakfast, breakfast nutritious,nutritious,False,-16.44159698486328,-23.202091217041016,6.760494232177734,14067712,EleutherAI/pythia-14m,step93000,seed8,8,93000
They ate a family breakfast.,breakfast,breakfast,They ate a breakfast family., family breakfast, breakfast family,family,True,-12.307586669921875,-15.619722366333008,3.312135696411133,14067712,EleutherAI/pythia-14m,step93000,seed8,8,93000
It was a red cape.,cape,cape,It was a cape red., red cape, cape red,red,False,-17.858203887939453,-21.71754264831543,3.8593387603759766,14067712,EleutherAI/pythia-14m,step93000,seed8,8,93000
It was a flowing cape.,cape,cape,It was a cape flowing., flowing cape, cape flowing,flowing,False,-22.54878807067871,-23.71406364440918,1.1652755737304688,14067712,EleutherAI/pythia-14m,step93000,seed8,8,93000
It was a rocky cape.,cape,cape,It was a cape rocky., rocky cape, cape rocky,rocky,False,-19.362634658813477,-25.28309440612793,5.920459747314453,14067712,EleutherAI/pythia-14m,step93000,seed8,8,93000
It was a beer case.,case,case,It was a case beer., beer case, case beer,beer,True,-16.625640869140625,-19.954627990722656,3.3289871215820312,14067712,EleutherAI/pythia-14m,step93000,seed8,8,93000
It was a display case.,case,case,It was a case display., display case, case display,display,True,-17.545761108398438,-19.113807678222656,1.5680465698242188,14067712,EleutherAI/pythia-14m,step93000,seed8,8,93000
It was a divorce case.,case,case,It was a case divorce., divorce case, case divorce,divorce,True,-13.155118942260742,-18.906349182128906,5.751230239868164,14067712,EleutherAI/pythia-14m,step93000,seed8,8,93000
It was a worthy cause.,cause,cause,It was a cause worthy., worthy cause, cause worthy,worthy,False,-14.043329238891602,-20.539993286132812,6.496664047241211,14067712,EleutherAI/pythia-14m,step93000,seed8,8,93000
It was a political cause.,cause,cause,It was a cause political., political cause, cause political,political,False,-16.22207260131836,-21.774917602539062,5.552845001220703,14067712,EleutherAI/pythia-14m,step93000,seed8,8,93000
It was a main cause.,cause,cause,It was a cause main., main cause, cause main,main,False,-14.519968032836914,-20.012710571289062,5.492742538452148,14067712,EleutherAI/pythia-14m,step93000,seed8,8,93000
It was a skin cell.,cell,cell,It was a cell skin., skin cell, cell skin,skin,True,-15.89492416381836,-17.790603637695312,1.8956794738769531,14067712,EleutherAI/pythia-14m,step93000,seed8,8,93000
It was a brain cell.,cell,cell,It was a cell brain., brain cell, cell brain,brain,True,-12.712644577026367,-16.998550415039062,4.285905838012695,14067712,EleutherAI/pythia-14m,step93000,seed8,8,93000
It was a prison cell.,cell,cell,It was a cell prison., prison cell, cell prison,prison,True,-17.04595947265625,-20.089553833007812,3.0435943603515625,14067712,EleutherAI/pythia-14m,step93000,seed8,8,93000
She had a devilish charm.,charm,charm,She had a charm devilish., devilish charm, charm devilish,devilish,False,-17.839717864990234,-24.05891227722168,6.219194412231445,14067712,EleutherAI/pythia-14m,step93000,seed8,8,93000
She had a natural charm.,charm,charm,She had a charm natural., natural charm, charm natural,natural,False,-14.985034942626953,-21.551464080810547,6.566429138183594,14067712,EleutherAI/pythia-14m,step93000,seed8,8,93000
She had a gold charm.,charm,charm,She had a charm gold., gold charm, charm gold,gold,True,-17.47896385192871,-21.203136444091797,3.724172592163086,14067712,EleutherAI/pythia-14m,step93000,seed8,8,93000
They liked the juicy chicken.,chicken,chicken,They liked the chicken juicy., juicy chicken, chicken juicy,juicy,False,-19.419471740722656,-20.854074478149414,1.4346027374267578,14067712,EleutherAI/pythia-14m,step93000,seed8,8,93000
They liked the roasted chicken.,chicken,chicken,They liked the chicken roasted., roasted chicken, chicken roasted,roasted,False,-17.400333404541016,-18.181442260742188,0.7811088562011719,14067712,EleutherAI/pythia-14m,step93000,seed8,8,93000
They liked the clucking chicken.,chicken,chicken,They liked the chicken clucking., clucking chicken, chicken clucking,clucking,True,-26.069686889648438,-22.17190170288086,-3.897785186767578,14067712,EleutherAI/pythia-14m,step93000,seed8,8,93000
It was a perceptive class.,class,class,It was a class perceptive., perceptive class, class perceptive,perceptive,False,-22.773075103759766,-24.843412399291992,2.0703372955322266,14067712,EleutherAI/pythia-14m,step93000,seed8,8,93000
It was a misbehaving class.,class,class,It was a class misbehaving., misbehaving class, class misbehaving,misbehaving,False,-22.837308883666992,-28.60576820373535,5.768459320068359,14067712,EleutherAI/pythia-14m,step93000,seed8,8,93000
It was a boring class.,class,class,It was a class boring., boring class, class boring,boring,False,-16.72795295715332,-20.008745193481445,3.280792236328125,14067712,EleutherAI/pythia-14m,step93000,seed8,8,93000
It was a film clip.,clip,clip,It was a clip film., film clip, clip film,film,True,-17.61444854736328,-18.430557250976562,0.8161087036132812,14067712,EleutherAI/pythia-14m,step93000,seed8,8,93000
It was a video clip.,clip,clip,It was a clip video., video clip, clip video,video,True,-12.964580535888672,-18.035598754882812,5.071018218994141,14067712,EleutherAI/pythia-14m,step93000,seed8,8,93000
It was a hair clip.,clip,clip,It was a clip hair., hair clip, clip hair,hair,True,-19.524158477783203,-23.123306274414062,3.5991477966308594,14067712,EleutherAI/pythia-14m,step93000,seed8,8,93000
It was an icy cold.,cold,cold,It was an cold icy., icy cold, cold icy,icy,False,-11.302312850952148,-20.058101654052734,8.755788803100586,14067712,EleutherAI/pythia-14m,step93000,seed8,8,93000
It was a freezing cold.,cold,cold,It was a cold freezing., freezing cold, cold freezing,freezing,False,-13.06118106842041,-14.472053527832031,1.410872459411621,14067712,EleutherAI/pythia-14m,step93000,seed8,8,93000
It was a chest cold.,cold,cold,It was a cold chest., chest cold, cold chest,chest,False,-17.713218688964844,-15.469673156738281,-2.2435455322265625,14067712,EleutherAI/pythia-14m,step93000,seed8,8,93000
It was a gossip column.,column,column,It was a column gossip., gossip column, column gossip,gossip,True,-21.682790756225586,-27.039703369140625,5.356912612915039,14067712,EleutherAI/pythia-14m,step93000,seed8,8,93000
It was a sports column.,column,column,It was a column sports., sports column, column sports,sports,True,-19.594362258911133,-24.120819091796875,4.526456832885742,14067712,EleutherAI/pythia-14m,step93000,seed8,8,93000
It was a concrete column.,column,column,It was a column concrete., concrete column, column concrete,concrete,False,-17.653827667236328,-23.353363037109375,5.699535369873047,14067712,EleutherAI/pythia-14m,step93000,seed8,8,93000
He liked the investment company.,company,company,He liked the company investment., investment company, company investment,investment,True,-15.497819900512695,-15.680852890014648,0.18303298950195312,14067712,EleutherAI/pythia-14m,step93000,seed8,8,93000
He liked the pharmaceutical company.,company,company,He liked the company pharmaceutical., pharmaceutical company, company pharmaceutical,pharmaceutical,False,-14.013474464416504,-19.0792293548584,5.0657548904418945,14067712,EleutherAI/pythia-14m,step93000,seed8,8,93000
He liked the pleasant company.,company,company,He liked the company pleasant., pleasant company, company pleasant,pleasant,False,-18.780000686645508,-18.42621421813965,-0.3537864685058594,14067712,EleutherAI/pythia-14m,step93000,seed8,8,93000
It was a waffle cone.,cone,cone,It was a cone waffle., waffle cone, cone waffle,waffle,True,-28.073305130004883,-28.59927749633789,0.5259723663330078,14067712,EleutherAI/pythia-14m,step93000,seed8,8,93000
It was a sugar cone.,cone,cone,It was a cone sugar., sugar cone, cone sugar,sugar,True,-22.791244506835938,-25.20876693725586,2.417522430419922,14067712,EleutherAI/pythia-14m,step93000,seed8,8,93000
It was an orange cone.,cone,cone,It was an cone orange., orange cone, cone orange,orange,False,-14.90139389038086,-24.072223663330078,9.170829772949219,14067712,EleutherAI/pythia-14m,step93000,seed8,8,93000
He made a charitable contribution.,contribution,contribution,He made a contribution charitable., charitable contribution, contribution charitable,charitable,False,-14.228460311889648,-21.99151611328125,7.763055801391602,14067712,EleutherAI/pythia-14m,step93000,seed8,8,93000
He made a voluntary contribution.,contribution,contribution,He made a contribution voluntary., voluntary contribution, contribution voluntary,voluntary,False,-15.490795135498047,-21.9737548828125,6.482959747314453,14067712,EleutherAI/pythia-14m,step93000,seed8,8,93000
He made a scholarly contribution.,contribution,contribution,He made a contribution scholarly., scholarly contribution, contribution scholarly,scholarly,False,-14.862370491027832,-21.12701416015625,6.264643669128418,14067712,EleutherAI/pythia-14m,step93000,seed8,8,93000
That was the noble count.,count,count,That was the count noble., noble count, count noble,noble,False,-17.76010513305664,-22.684856414794922,4.924751281738281,14067712,EleutherAI/pythia-14m,step93000,seed8,8,93000
That was the vengeful count.,count,count,That was the count vengeful., vengeful count, count vengeful,vengeful,False,-25.87295913696289,-30.00946617126465,4.136507034301758,14067712,EleutherAI/pythia-14m,step93000,seed8,8,93000
That was the final count.,count,count,That was the count final., final count, count final,final,False,-12.920723915100098,-19.816631317138672,6.895907402038574,14067712,EleutherAI/pythia-14m,step93000,seed8,8,93000
It was an introductory course.,course,course,It was an course introductory., introductory course, course introductory,introductory,False,-13.820550918579102,-26.03531837463379,12.214767456054688,14067712,EleutherAI/pythia-14m,step93000,seed8,8,93000
It was a pass-fail course.,course,course,It was a course pass-fail., pass-fail course, course pass-fail,pass-fail,False,-30.340547561645508,-35.219520568847656,4.878973007202148,14067712,EleutherAI/pythia-14m,step93000,seed8,8,93000
It was a charted course.,course,course,It was a course charted., charted course, course charted,charted,False,-21.347667694091797,-23.75562858581543,2.407960891723633,14067712,EleutherAI/pythia-14m,step93000,seed8,8,93000
It was a dinner date.,date,date,It was a date dinner., dinner date, date dinner,dinner,True,-18.115753173828125,-19.600492477416992,1.4847393035888672,14067712,EleutherAI/pythia-14m,step93000,seed8,8,93000
It was a blind date.,date,date,It was a date blind., blind date, date blind,blind,False,-15.849958419799805,-18.865140914916992,3.0151824951171875,14067712,EleutherAI/pythia-14m,step93000,seed8,8,93000
It was an expiration date.,date,date,It was an date expiration., expiration date, date expiration,expiration,True,-11.705690383911133,-22.56787109375,10.862180709838867,14067712,EleutherAI/pythia-14m,step93000,seed8,8,93000
It was about forty degrees.,degree,degrees,It was about degrees forty., forty degrees, degrees forty,forty,True,-14.533723831176758,-22.069217681884766,7.535493850708008,14067712,EleutherAI/pythia-14m,step93000,seed8,8,93000
It was about fifty degrees.,degree,degrees,It was about degrees fifty., fifty degrees, degrees fifty,fifty,True,-14.478790283203125,-22.280826568603516,7.802036285400391,14067712,EleutherAI/pythia-14m,step93000,seed8,8,93000
It was about associate degrees.,degree,degrees,It was about degrees associate., associate degrees, degrees associate,associate,False,-23.604511260986328,-26.116580963134766,2.5120697021484375,14067712,EleutherAI/pythia-14m,step93000,seed8,8,93000
They liked the floral design.,design,design,They liked the design floral., floral design, design floral,floral,False,-17.82752227783203,-20.517311096191406,2.689788818359375,14067712,EleutherAI/pythia-14m,step93000,seed8,8,93000
They liked the geometric design.,design,design,They liked the design geometric., geometric design, design geometric,geometric,False,-15.693099975585938,-20.259254455566406,4.566154479980469,14067712,EleutherAI/pythia-14m,step93000,seed8,8,93000
They liked the product design.,design,design,They liked the design product., product design, design product,product,True,-17.146434783935547,-17.160377502441406,0.013942718505859375,14067712,EleutherAI/pythia-14m,step93000,seed8,8,93000
They liked the turkey dinner.,dinner,dinner,They liked the dinner turkey., turkey dinner, dinner turkey,turkey,True,-16.7691650390625,-18.172100067138672,1.4029350280761719,14067712,EleutherAI/pythia-14m,step93000,seed8,8,93000
They liked the light dinner.,dinner,dinner,They liked the dinner light., light dinner, dinner light,light,False,-19.064077377319336,-18.203716278076172,-0.8603610992431641,14067712,EleutherAI/pythia-14m,step93000,seed8,8,93000
They liked the formal dinner.,dinner,dinner,They liked the dinner formal., formal dinner, dinner formal,formal,False,-17.47616195678711,-20.729045867919922,3.2528839111328125,14067712,EleutherAI/pythia-14m,step93000,seed8,8,93000
He had a recurring dream.,dream,dream,He had a dream recurring., recurring dream, dream recurring,recurring,False,-16.509599685668945,-22.7073917388916,6.197792053222656,14067712,EleutherAI/pythia-14m,step93000,seed8,8,93000
He had a bad dream.,dream,dream,He had a dream bad., bad dream, dream bad,bad,False,-12.639742851257324,-17.2907657623291,4.651022911071777,14067712,EleutherAI/pythia-14m,step93000,seed8,8,93000
He had a childhood dream.,dream,dream,He had a dream childhood., childhood dream, dream childhood,childhood,True,-15.979419708251953,-20.70061683654785,4.721197128295898,14067712,EleutherAI/pythia-14m,step93000,seed8,8,93000
It was a grueling drill.,drill,drill,It was a drill grueling., grueling drill, drill grueling,grueling,False,-20.53498077392578,-23.53458595275879,2.999605178833008,14067712,EleutherAI/pythia-14m,step93000,seed8,8,93000
It was a challenging drill.,drill,drill,It was a drill challenging., challenging drill, drill challenging,challenging,False,-18.740840911865234,-20.99148178100586,2.250640869140625,14067712,EleutherAI/pythia-14m,step93000,seed8,8,93000
It was an electric drill.,drill,drill,It was an drill electric., electric drill, drill electric,electric,False,-16.301544189453125,-25.37371063232422,9.072166442871094,14067712,EleutherAI/pythia-14m,step93000,seed8,8,93000
It was a multiple-choice examination.,examination,examination,It was an examination multiple-choice., multiple-choice examination, examination multiple-choice,multiple-choice,False,-25.361797332763672,-29.925174713134766,4.563377380371094,14067712,EleutherAI/pythia-14m,step93000,seed8,8,93000
It was a difficult examination.,examination,examination,It was an examination difficult., difficult examination, examination difficult,difficult,False,-14.994672775268555,-18.795146942138672,3.800474166870117,14067712,EleutherAI/pythia-14m,step93000,seed8,8,93000
It was a prostate examination.,examination,examination,It was an examination prostate., prostate examination, examination prostate,prostate,True,-25.50664520263672,-22.116985321044922,-3.389659881591797,14067712,EleutherAI/pythia-14m,step93000,seed8,8,93000
They had an electric fan.,fan,fan,They had an fan electric., electric fan, fan electric,electric,False,-12.75190544128418,-26.38971519470215,13.637809753417969,14067712,EleutherAI/pythia-14m,step93000,seed8,8,93000
They had a ceiling fan.,fan,fan,They had a fan ceiling., ceiling fan, fan ceiling,ceiling,True,-19.871009826660156,-21.880809783935547,2.0097999572753906,14067712,EleutherAI/pythia-14m,step93000,seed8,8,93000
They had a zealous fan.,fan,fan,They had a fan zealous., zealous fan, fan zealous,zealous,False,-21.47613525390625,-26.34781837463379,4.871683120727539,14067712,EleutherAI/pythia-14m,step93000,seed8,8,93000
She had a text file.,file,file,She had a file text., text file, file text,text,True,-12.198837280273438,-17.21892547607422,5.020088195800781,14067712,EleutherAI/pythia-14m,step93000,seed8,8,93000
She had a data file.,file,file,She had a file data., data file, file data,data,True,-14.76996898651123,-16.64568328857422,1.8757143020629883,14067712,EleutherAI/pythia-14m,step93000,seed8,8,93000
She had a nail file.,file,file,She had a file nail., nail file, file nail,nail,True,-20.182636260986328,-24.63030242919922,4.447666168212891,14067712,EleutherAI/pythia-14m,step93000,seed8,8,93000
It was an action film.,film,film,It was an film action., action film, film action,action,True,-16.349458694458008,-17.47446060180664,1.1250019073486328,14067712,EleutherAI/pythia-14m,step93000,seed8,8,93000
It was a censored film.,film,film,It was a film censored., censored film, film censored,censored,False,-22.261009216308594,-21.89753532409668,-0.36347389221191406,14067712,EleutherAI/pythia-14m,step93000,seed8,8,93000
It was a transparent film.,film,film,It was a film transparent., transparent film, film transparent,transparent,False,-16.242919921875,-20.91529083251953,4.672370910644531,14067712,EleutherAI/pythia-14m,step93000,seed8,8,93000
It was a charitable foundation.,foundation,foundation,It was a foundation charitable., charitable foundation, foundation charitable,charitable,False,-15.847923278808594,-24.999011993408203,9.15108871459961,14067712,EleutherAI/pythia-14m,step93000,seed8,8,93000
It was an educational foundation.,foundation,foundation,It was an foundation educational., educational foundation, foundation educational,educational,False,-14.232056617736816,-25.6491641998291,11.417107582092285,14067712,EleutherAI/pythia-14m,step93000,seed8,8,93000
It was a wooden foundation.,foundation,foundation,It was a foundation wooden., wooden foundation, foundation wooden,wooden,False,-16.819194793701172,-23.665454864501953,6.846260070800781,14067712,EleutherAI/pythia-14m,step93000,seed8,8,93000
It was a mathematical function.,function,function,It was a function mathematical., mathematical function, function mathematical,mathematical,False,-16.063846588134766,-19.645484924316406,3.5816383361816406,14067712,EleutherAI/pythia-14m,step93000,seed8,8,93000
It was a linear function.,function,function,It was a function linear., linear function, function linear,linear,False,-14.516327857971191,-19.578346252441406,5.062018394470215,14067712,EleutherAI/pythia-14m,step93000,seed8,8,93000
