sentence,word,string,reversed_sentence,mod_np,reversed_mod,disambiguating_word,non_adjective,original_logprob,reversed_logprob,ratio,n_params,mpath,revision,seed_name,seed,step
It was a desperate act.,act,act,It was an act desperate., desperate act, act desperate,desperate,False,-14.762481689453125,-18.494857788085938,3.7323760986328125,14067712,EleutherAI/pythia-14m,step45000,seed9,9,45000
It was a humane act.,act,act,It was an act humane., humane act, act humane,humane,False,-23.302772521972656,-22.515071868896484,-0.7877006530761719,14067712,EleutherAI/pythia-14m,step45000,seed9,9,45000
It was a magic act.,act,act,It was an act magic., magic act, act magic,magic,False,-15.0850830078125,-17.411495208740234,2.3264122009277344,14067712,EleutherAI/pythia-14m,step45000,seed9,9,45000
He had a universal appeal.,appeal,appeal,He had an appeal universal., universal appeal, appeal universal,universal,False,-19.970012664794922,-24.902729034423828,4.932716369628906,14067712,EleutherAI/pythia-14m,step45000,seed9,9,45000
He had an undefinable appeal.,appeal,appeal,He had an appeal undefinable., undefinable appeal, appeal undefinable,undefinable,False,-26.339740753173828,-29.89073944091797,3.5509986877441406,14067712,EleutherAI/pythia-14m,step45000,seed9,9,45000
He had a legal appeal.,appeal,appeal,He had an appeal legal., legal appeal, appeal legal,legal,False,-18.930049896240234,-19.087947845458984,0.15789794921875,14067712,EleutherAI/pythia-14m,step45000,seed9,9,45000
It was a tense atmosphere.,atmosphere,atmosphere,It was an atmosphere tense., tense atmosphere, atmosphere tense,tense,False,-17.419084548950195,-20.710060119628906,3.290975570678711,14067712,EleutherAI/pythia-14m,step45000,seed9,9,45000
It was a hostile atmosphere.,atmosphere,atmosphere,It was an atmosphere hostile., hostile atmosphere, atmosphere hostile,hostile,False,-16.793956756591797,-19.617046356201172,2.823089599609375,14067712,EleutherAI/pythia-14m,step45000,seed9,9,45000
It was a gaseous atmosphere.,atmosphere,atmosphere,It was an atmosphere gaseous., gaseous atmosphere, atmosphere gaseous,gaseous,False,-18.299205780029297,-21.288129806518555,2.988924026489258,14067712,EleutherAI/pythia-14m,step45000,seed9,9,45000
It was a gold band.,band,band,It was a band gold., gold band, band gold,gold,True,-13.835346221923828,-20.143421173095703,6.308074951171875,14067712,EleutherAI/pythia-14m,step45000,seed9,9,45000
It was a rubber band.,band,band,It was a band rubber., rubber band, band rubber,rubber,True,-13.94605541229248,-23.13826560974121,9.19221019744873,14067712,EleutherAI/pythia-14m,step45000,seed9,9,45000
It was a jazz band.,band,band,It was a band jazz., jazz band, band jazz,jazz,True,-13.53366470336914,-20.372554779052734,6.838890075683594,14067712,EleutherAI/pythia-14m,step45000,seed9,9,45000
There was a police barrier.,barrier,barrier,There was a barrier police., police barrier, barrier police,police,True,-16.390933990478516,-20.173519134521484,3.7825851440429688,14067712,EleutherAI/pythia-14m,step45000,seed9,9,45000
There was a concrete barrier.,barrier,barrier,There was a barrier concrete., concrete barrier, barrier concrete,concrete,False,-15.553661346435547,-21.375057220458984,5.8213958740234375,14067712,EleutherAI/pythia-14m,step45000,seed9,9,45000
There was a language barrier.,barrier,barrier,There was a barrier language., language barrier, barrier language,language,True,-18.15069580078125,-20.078596115112305,1.9279003143310547,14067712,EleutherAI/pythia-14m,step45000,seed9,9,45000
He saw a furry bat.,bat,bat,He saw a bat furry., furry bat, bat furry,furry,False,-22.358646392822266,-26.1585750579834,3.799928665161133,14067712,EleutherAI/pythia-14m,step45000,seed9,9,45000
He saw a fruit bat.,bat,bat,He saw a bat fruit., fruit bat, bat fruit,fruit,True,-16.464466094970703,-21.242408752441406,4.777942657470703,14067712,EleutherAI/pythia-14m,step45000,seed9,9,45000
He saw a wooden bat.,bat,bat,He saw a bat wooden., wooden bat, bat wooden,wooden,False,-15.866639137268066,-20.837390899658203,4.970751762390137,14067712,EleutherAI/pythia-14m,step45000,seed9,9,45000
He saw the laser beam.,beam,beam,He saw the beam laser., laser beam, beam laser,laser,True,-13.182698249816895,-16.90133285522461,3.718634605407715,14067712,EleutherAI/pythia-14m,step45000,seed9,9,45000
He saw the bright beam.,beam,beam,He saw the beam bright., bright beam, beam bright,bright,False,-17.87697982788086,-19.23550033569336,1.3585205078125,14067712,EleutherAI/pythia-14m,step45000,seed9,9,45000
He saw the wood beam.,beam,beam,He saw the beam wood., wood beam, beam wood,wood,True,-17.214595794677734,-20.217185974121094,3.0025901794433594,14067712,EleutherAI/pythia-14m,step45000,seed9,9,45000
She had a toy block.,block,block,She had a block toy., toy block, block toy,toy,True,-17.492570877075195,-23.326601028442383,5.8340301513671875,14067712,EleutherAI/pythia-14m,step45000,seed9,9,45000
She had a wooden block.,block,block,She had a block wooden., wooden block, block wooden,wooden,False,-16.033918380737305,-23.3758544921875,7.341936111450195,14067712,EleutherAI/pythia-14m,step45000,seed9,9,45000
She had a mental block.,block,block,She had a block mental., mental block, block mental,mental,False,-15.348760604858398,-22.80540657043457,7.456645965576172,14067712,EleutherAI/pythia-14m,step45000,seed9,9,45000
He has coagulated blood.,blood,blood,He has blood coagulated., coagulated blood, blood coagulated,coagulated,True,-25.921009063720703,-26.832414627075195,0.9114055633544922,14067712,EleutherAI/pythia-14m,step45000,seed9,9,45000
He has thin blood.,blood,blood,He has blood thin., thin blood, blood thin,thin,False,-17.550363540649414,-21.60431671142578,4.053953170776367,14067712,EleutherAI/pythia-14m,step45000,seed9,9,45000
He has noble blood.,blood,blood,He has blood noble., noble blood, blood noble,noble,False,-17.786449432373047,-24.4997615814209,6.713312149047852,14067712,EleutherAI/pythia-14m,step45000,seed9,9,45000
It was the ironing board.,board,board,It was the board ironing., ironing board, board ironing,ironing,False,-20.377275466918945,-22.9310245513916,2.5537490844726562,14067712,EleutherAI/pythia-14m,step45000,seed9,9,45000
It was the wooden board.,board,board,It was the board wooden., wooden board, board wooden,wooden,False,-15.133492469787598,-21.866342544555664,6.732850074768066,14067712,EleutherAI/pythia-14m,step45000,seed9,9,45000
It was the executive board.,board,board,It was the board executive., executive board, board executive,executive,True,-15.44526481628418,-18.450523376464844,3.005258560180664,14067712,EleutherAI/pythia-14m,step45000,seed9,9,45000
He had a best-selling book.,book,book,He had a book best-selling., best-selling book, book best-selling,best-selling,False,-19.602951049804688,-22.092117309570312,2.489166259765625,14067712,EleutherAI/pythia-14m,step45000,seed9,9,45000
He had a popular book.,book,book,He had a book popular., popular book, book popular,popular,False,-17.0130558013916,-19.471485137939453,2.4584293365478516,14067712,EleutherAI/pythia-14m,step45000,seed9,9,45000
He had a heavy book.,book,book,He had a book heavy., heavy book, book heavy,heavy,False,-17.917991638183594,-20.898757934570312,2.9807662963867188,14067712,EleutherAI/pythia-14m,step45000,seed9,9,45000
They ate a pancake breakfast.,breakfast,breakfast,They ate a breakfast pancake., pancake breakfast, breakfast pancake,pancake,True,-14.049774169921875,-18.46873664855957,4.418962478637695,14067712,EleutherAI/pythia-14m,step45000,seed9,9,45000
They ate a nutritious breakfast.,breakfast,breakfast,They ate a breakfast nutritious., nutritious breakfast, breakfast nutritious,nutritious,False,-18.671283721923828,-23.011438369750977,4.340154647827148,14067712,EleutherAI/pythia-14m,step45000,seed9,9,45000
They ate a family breakfast.,breakfast,breakfast,They ate a breakfast family., family breakfast, breakfast family,family,True,-12.897150039672852,-16.694616317749023,3.797466278076172,14067712,EleutherAI/pythia-14m,step45000,seed9,9,45000
It was a red cape.,cape,cape,It was a cape red., red cape, cape red,red,False,-17.008224487304688,-20.56145477294922,3.5532302856445312,14067712,EleutherAI/pythia-14m,step45000,seed9,9,45000
It was a flowing cape.,cape,cape,It was a cape flowing., flowing cape, cape flowing,flowing,False,-24.09012794494629,-22.20159149169922,-1.8885364532470703,14067712,EleutherAI/pythia-14m,step45000,seed9,9,45000
It was a rocky cape.,cape,cape,It was a cape rocky., rocky cape, cape rocky,rocky,False,-19.701505661010742,-25.438453674316406,5.736948013305664,14067712,EleutherAI/pythia-14m,step45000,seed9,9,45000
It was a beer case.,case,case,It was a case beer., beer case, case beer,beer,True,-17.327098846435547,-20.276851654052734,2.9497528076171875,14067712,EleutherAI/pythia-14m,step45000,seed9,9,45000
It was a display case.,case,case,It was a case display., display case, case display,display,True,-17.694061279296875,-18.38391876220703,0.6898574829101562,14067712,EleutherAI/pythia-14m,step45000,seed9,9,45000
It was a divorce case.,case,case,It was a case divorce., divorce case, case divorce,divorce,True,-16.366697311401367,-19.5694637298584,3.2027664184570312,14067712,EleutherAI/pythia-14m,step45000,seed9,9,45000
It was a worthy cause.,cause,cause,It was a cause worthy., worthy cause, cause worthy,worthy,False,-15.609495162963867,-19.487163543701172,3.8776683807373047,14067712,EleutherAI/pythia-14m,step45000,seed9,9,45000
It was a political cause.,cause,cause,It was a cause political., political cause, cause political,political,False,-14.730714797973633,-20.550273895263672,5.819559097290039,14067712,EleutherAI/pythia-14m,step45000,seed9,9,45000
It was a main cause.,cause,cause,It was a cause main., main cause, cause main,main,False,-14.25508975982666,-22.618654251098633,8.363564491271973,14067712,EleutherAI/pythia-14m,step45000,seed9,9,45000
It was a skin cell.,cell,cell,It was a cell skin., skin cell, cell skin,skin,True,-16.41546058654785,-19.002517700195312,2.587057113647461,14067712,EleutherAI/pythia-14m,step45000,seed9,9,45000
It was a brain cell.,cell,cell,It was a cell brain., brain cell, cell brain,brain,True,-13.278034210205078,-16.987804412841797,3.7097702026367188,14067712,EleutherAI/pythia-14m,step45000,seed9,9,45000
It was a prison cell.,cell,cell,It was a cell prison., prison cell, cell prison,prison,True,-13.126338958740234,-16.640872955322266,3.5145339965820312,14067712,EleutherAI/pythia-14m,step45000,seed9,9,45000
She had a devilish charm.,charm,charm,She had a charm devilish., devilish charm, charm devilish,devilish,False,-19.32859992980957,-25.475278854370117,6.146678924560547,14067712,EleutherAI/pythia-14m,step45000,seed9,9,45000
She had a natural charm.,charm,charm,She had a charm natural., natural charm, charm natural,natural,False,-17.381549835205078,-22.121238708496094,4.739688873291016,14067712,EleutherAI/pythia-14m,step45000,seed9,9,45000
She had a gold charm.,charm,charm,She had a charm gold., gold charm, charm gold,gold,True,-16.815778732299805,-18.59430503845215,1.7785263061523438,14067712,EleutherAI/pythia-14m,step45000,seed9,9,45000
They liked the juicy chicken.,chicken,chicken,They liked the chicken juicy., juicy chicken, chicken juicy,juicy,False,-18.729141235351562,-20.343210220336914,1.6140689849853516,14067712,EleutherAI/pythia-14m,step45000,seed9,9,45000
They liked the roasted chicken.,chicken,chicken,They liked the chicken roasted., roasted chicken, chicken roasted,roasted,False,-16.179445266723633,-18.004180908203125,1.8247356414794922,14067712,EleutherAI/pythia-14m,step45000,seed9,9,45000
They liked the clucking chicken.,chicken,chicken,They liked the chicken clucking., clucking chicken, chicken clucking,clucking,True,-21.44241714477539,-22.057159423828125,0.6147422790527344,14067712,EleutherAI/pythia-14m,step45000,seed9,9,45000
It was a perceptive class.,class,class,It was a class perceptive., perceptive class, class perceptive,perceptive,False,-18.456798553466797,-21.58856201171875,3.131763458251953,14067712,EleutherAI/pythia-14m,step45000,seed9,9,45000
It was a misbehaving class.,class,class,It was a class misbehaving., misbehaving class, class misbehaving,misbehaving,False,-24.079647064208984,-26.37574005126953,2.296092987060547,14067712,EleutherAI/pythia-14m,step45000,seed9,9,45000
It was a boring class.,class,class,It was a class boring., boring class, class boring,boring,False,-16.013065338134766,-18.419124603271484,2.4060592651367188,14067712,EleutherAI/pythia-14m,step45000,seed9,9,45000
It was a film clip.,clip,clip,It was a clip film., film clip, clip film,film,True,-15.531301498413086,-17.017593383789062,1.4862918853759766,14067712,EleutherAI/pythia-14m,step45000,seed9,9,45000
It was a video clip.,clip,clip,It was a clip video., video clip, clip video,video,True,-12.33738899230957,-17.45688247680664,5.11949348449707,14067712,EleutherAI/pythia-14m,step45000,seed9,9,45000
It was a hair clip.,clip,clip,It was a clip hair., hair clip, clip hair,hair,True,-17.072105407714844,-22.575634002685547,5.503528594970703,14067712,EleutherAI/pythia-14m,step45000,seed9,9,45000
It was an icy cold.,cold,cold,It was an cold icy., icy cold, cold icy,icy,False,-12.519205093383789,-19.348926544189453,6.829721450805664,14067712,EleutherAI/pythia-14m,step45000,seed9,9,45000
It was a freezing cold.,cold,cold,It was a cold freezing., freezing cold, cold freezing,freezing,False,-13.868247985839844,-16.33853530883789,2.470287322998047,14067712,EleutherAI/pythia-14m,step45000,seed9,9,45000
It was a chest cold.,cold,cold,It was a cold chest., chest cold, cold chest,chest,False,-16.269306182861328,-15.135784149169922,-1.1335220336914062,14067712,EleutherAI/pythia-14m,step45000,seed9,9,45000
It was a gossip column.,column,column,It was a column gossip., gossip column, column gossip,gossip,True,-20.550060272216797,-25.99152946472168,5.441469192504883,14067712,EleutherAI/pythia-14m,step45000,seed9,9,45000
It was a sports column.,column,column,It was a column sports., sports column, column sports,sports,True,-17.833736419677734,-23.959497451782227,6.125761032104492,14067712,EleutherAI/pythia-14m,step45000,seed9,9,45000
It was a concrete column.,column,column,It was a column concrete., concrete column, column concrete,concrete,False,-17.451671600341797,-22.385425567626953,4.933753967285156,14067712,EleutherAI/pythia-14m,step45000,seed9,9,45000
He liked the investment company.,company,company,He liked the company investment., investment company, company investment,investment,True,-14.641544342041016,-16.267911911010742,1.6263675689697266,14067712,EleutherAI/pythia-14m,step45000,seed9,9,45000
He liked the pharmaceutical company.,company,company,He liked the company pharmaceutical., pharmaceutical company, company pharmaceutical,pharmaceutical,False,-12.18036937713623,-18.747411727905273,6.567042350769043,14067712,EleutherAI/pythia-14m,step45000,seed9,9,45000
He liked the pleasant company.,company,company,He liked the company pleasant., pleasant company, company pleasant,pleasant,False,-18.64826774597168,-18.55204963684082,-0.09621810913085938,14067712,EleutherAI/pythia-14m,step45000,seed9,9,45000
It was a waffle cone.,cone,cone,It was a cone waffle., waffle cone, cone waffle,waffle,True,-25.9261531829834,-29.350114822387695,3.423961639404297,14067712,EleutherAI/pythia-14m,step45000,seed9,9,45000
It was a sugar cone.,cone,cone,It was a cone sugar., sugar cone, cone sugar,sugar,True,-17.79281234741211,-23.41391372680664,5.621101379394531,14067712,EleutherAI/pythia-14m,step45000,seed9,9,45000
It was an orange cone.,cone,cone,It was an cone orange., orange cone, cone orange,orange,False,-14.119880676269531,-23.270828247070312,9.150947570800781,14067712,EleutherAI/pythia-14m,step45000,seed9,9,45000
He made a charitable contribution.,contribution,contribution,He made a contribution charitable., charitable contribution, contribution charitable,charitable,False,-12.865199089050293,-23.600818634033203,10.73561954498291,14067712,EleutherAI/pythia-14m,step45000,seed9,9,45000
He made a voluntary contribution.,contribution,contribution,He made a contribution voluntary., voluntary contribution, contribution voluntary,voluntary,False,-15.246057510375977,-24.058910369873047,8.81285285949707,14067712,EleutherAI/pythia-14m,step45000,seed9,9,45000
He made a scholarly contribution.,contribution,contribution,He made a contribution scholarly., scholarly contribution, contribution scholarly,scholarly,False,-16.748661041259766,-24.565906524658203,7.8172454833984375,14067712,EleutherAI/pythia-14m,step45000,seed9,9,45000
That was the noble count.,count,count,That was the count noble., noble count, count noble,noble,False,-18.145492553710938,-23.21233367919922,5.066841125488281,14067712,EleutherAI/pythia-14m,step45000,seed9,9,45000
That was the vengeful count.,count,count,That was the count vengeful., vengeful count, count vengeful,vengeful,False,-23.421527862548828,-28.910329818725586,5.488801956176758,14067712,EleutherAI/pythia-14m,step45000,seed9,9,45000
That was the final count.,count,count,That was the count final., final count, count final,final,False,-14.224605560302734,-20.109596252441406,5.884990692138672,14067712,EleutherAI/pythia-14m,step45000,seed9,9,45000
It was an introductory course.,course,course,It was an course introductory., introductory course, course introductory,introductory,False,-11.20480728149414,-22.007610321044922,10.802803039550781,14067712,EleutherAI/pythia-14m,step45000,seed9,9,45000
It was a pass-fail course.,course,course,It was a course pass-fail., pass-fail course, course pass-fail,pass-fail,False,-30.806354522705078,-35.87308120727539,5.0667266845703125,14067712,EleutherAI/pythia-14m,step45000,seed9,9,45000
It was a charted course.,course,course,It was a course charted., charted course, course charted,charted,False,-19.74787712097168,-23.561120986938477,3.813243865966797,14067712,EleutherAI/pythia-14m,step45000,seed9,9,45000
It was a dinner date.,date,date,It was a date dinner., dinner date, date dinner,dinner,True,-17.979541778564453,-18.030410766601562,0.050868988037109375,14067712,EleutherAI/pythia-14m,step45000,seed9,9,45000
It was a blind date.,date,date,It was a date blind., blind date, date blind,blind,False,-18.62645721435547,-19.548410415649414,0.9219532012939453,14067712,EleutherAI/pythia-14m,step45000,seed9,9,45000
It was an expiration date.,date,date,It was an date expiration., expiration date, date expiration,expiration,True,-12.322402000427246,-23.65184211730957,11.329440116882324,14067712,EleutherAI/pythia-14m,step45000,seed9,9,45000
It was about forty degrees.,degree,degrees,It was about degrees forty., forty degrees, degrees forty,forty,True,-15.843164443969727,-22.455522537231445,6.612358093261719,14067712,EleutherAI/pythia-14m,step45000,seed9,9,45000
It was about fifty degrees.,degree,degrees,It was about degrees fifty., fifty degrees, degrees fifty,fifty,True,-16.439754486083984,-22.621715545654297,6.1819610595703125,14067712,EleutherAI/pythia-14m,step45000,seed9,9,45000
It was about associate degrees.,degree,degrees,It was about degrees associate., associate degrees, degrees associate,associate,False,-21.337127685546875,-24.624156951904297,3.287029266357422,14067712,EleutherAI/pythia-14m,step45000,seed9,9,45000
They liked the floral design.,design,design,They liked the design floral., floral design, design floral,floral,False,-16.362220764160156,-21.278547286987305,4.916326522827148,14067712,EleutherAI/pythia-14m,step45000,seed9,9,45000
They liked the geometric design.,design,design,They liked the design geometric., geometric design, design geometric,geometric,False,-18.36712646484375,-21.44617462158203,3.0790481567382812,14067712,EleutherAI/pythia-14m,step45000,seed9,9,45000
They liked the product design.,design,design,They liked the design product., product design, design product,product,True,-15.677566528320312,-15.184488296508789,-0.49307823181152344,14067712,EleutherAI/pythia-14m,step45000,seed9,9,45000
They liked the turkey dinner.,dinner,dinner,They liked the dinner turkey., turkey dinner, dinner turkey,turkey,True,-17.234722137451172,-18.657581329345703,1.4228591918945312,14067712,EleutherAI/pythia-14m,step45000,seed9,9,45000
They liked the light dinner.,dinner,dinner,They liked the dinner light., light dinner, dinner light,light,False,-17.300743103027344,-17.312280654907227,0.011537551879882812,14067712,EleutherAI/pythia-14m,step45000,seed9,9,45000
They liked the formal dinner.,dinner,dinner,They liked the dinner formal., formal dinner, dinner formal,formal,False,-17.395366668701172,-21.827648162841797,4.432281494140625,14067712,EleutherAI/pythia-14m,step45000,seed9,9,45000
He had a recurring dream.,dream,dream,He had a dream recurring., recurring dream, dream recurring,recurring,False,-16.919565200805664,-21.151063919067383,4.231498718261719,14067712,EleutherAI/pythia-14m,step45000,seed9,9,45000
He had a bad dream.,dream,dream,He had a dream bad., bad dream, dream bad,bad,False,-11.614665031433105,-17.277393341064453,5.662728309631348,14067712,EleutherAI/pythia-14m,step45000,seed9,9,45000
He had a childhood dream.,dream,dream,He had a dream childhood., childhood dream, dream childhood,childhood,True,-15.11189079284668,-17.182125091552734,2.0702342987060547,14067712,EleutherAI/pythia-14m,step45000,seed9,9,45000
It was a grueling drill.,drill,drill,It was a drill grueling., grueling drill, drill grueling,grueling,False,-20.077655792236328,-28.770973205566406,8.693317413330078,14067712,EleutherAI/pythia-14m,step45000,seed9,9,45000
It was a challenging drill.,drill,drill,It was a drill challenging., challenging drill, drill challenging,challenging,False,-18.70944595336914,-23.96567153930664,5.2562255859375,14067712,EleutherAI/pythia-14m,step45000,seed9,9,45000
It was an electric drill.,drill,drill,It was an drill electric., electric drill, drill electric,electric,False,-15.562076568603516,-22.982574462890625,7.420497894287109,14067712,EleutherAI/pythia-14m,step45000,seed9,9,45000
It was a multiple-choice examination.,examination,examination,It was an examination multiple-choice., multiple-choice examination, examination multiple-choice,multiple-choice,False,-31.042896270751953,-38.265071868896484,7.222175598144531,14067712,EleutherAI/pythia-14m,step45000,seed9,9,45000
It was a difficult examination.,examination,examination,It was an examination difficult., difficult examination, examination difficult,difficult,False,-16.803661346435547,-18.51241683959961,1.7087554931640625,14067712,EleutherAI/pythia-14m,step45000,seed9,9,45000
It was a prostate examination.,examination,examination,It was an examination prostate., prostate examination, examination prostate,prostate,True,-19.951637268066406,-24.952068328857422,5.000431060791016,14067712,EleutherAI/pythia-14m,step45000,seed9,9,45000
They had an electric fan.,fan,fan,They had an fan electric., electric fan, fan electric,electric,False,-15.737414360046387,-27.627517700195312,11.890103340148926,14067712,EleutherAI/pythia-14m,step45000,seed9,9,45000
They had a ceiling fan.,fan,fan,They had a fan ceiling., ceiling fan, fan ceiling,ceiling,True,-16.832780838012695,-21.209508895874023,4.376728057861328,14067712,EleutherAI/pythia-14m,step45000,seed9,9,45000
They had a zealous fan.,fan,fan,They had a fan zealous., zealous fan, fan zealous,zealous,False,-20.775772094726562,-26.88789939880371,6.112127304077148,14067712,EleutherAI/pythia-14m,step45000,seed9,9,45000
She had a text file.,file,file,She had a file text., text file, file text,text,True,-15.157976150512695,-19.161712646484375,4.00373649597168,14067712,EleutherAI/pythia-14m,step45000,seed9,9,45000
She had a data file.,file,file,She had a file data., data file, file data,data,True,-15.605823516845703,-20.575239181518555,4.969415664672852,14067712,EleutherAI/pythia-14m,step45000,seed9,9,45000
She had a nail file.,file,file,She had a file nail., nail file, file nail,nail,True,-17.96576690673828,-21.979225158691406,4.013458251953125,14067712,EleutherAI/pythia-14m,step45000,seed9,9,45000
It was an action film.,film,film,It was an film action., action film, film action,action,True,-13.229190826416016,-17.5417423248291,4.312551498413086,14067712,EleutherAI/pythia-14m,step45000,seed9,9,45000
It was a censored film.,film,film,It was a film censored., censored film, film censored,censored,False,-18.57742691040039,-19.25067138671875,0.6732444763183594,14067712,EleutherAI/pythia-14m,step45000,seed9,9,45000
It was a transparent film.,film,film,It was a film transparent., transparent film, film transparent,transparent,False,-15.282291412353516,-20.213340759277344,4.931049346923828,14067712,EleutherAI/pythia-14m,step45000,seed9,9,45000
It was a charitable foundation.,foundation,foundation,It was a foundation charitable., charitable foundation, foundation charitable,charitable,False,-16.105308532714844,-23.41692352294922,7.311614990234375,14067712,EleutherAI/pythia-14m,step45000,seed9,9,45000
It was an educational foundation.,foundation,foundation,It was an foundation educational., educational foundation, foundation educational,educational,False,-16.405033111572266,-25.188079833984375,8.78304672241211,14067712,EleutherAI/pythia-14m,step45000,seed9,9,45000
It was a wooden foundation.,foundation,foundation,It was a foundation wooden., wooden foundation, foundation wooden,wooden,False,-16.799169540405273,-22.2808837890625,5.481714248657227,14067712,EleutherAI/pythia-14m,step45000,seed9,9,45000
It was a mathematical function.,function,function,It was a function mathematical., mathematical function, function mathematical,mathematical,False,-15.993946075439453,-18.045438766479492,2.051492691040039,14067712,EleutherAI/pythia-14m,step45000,seed9,9,45000
It was a linear function.,function,function,It was a function linear., linear function, function linear,linear,False,-14.767156600952148,-19.07738494873047,4.31022834777832,14067712,EleutherAI/pythia-14m,step45000,seed9,9,45000
