sentence,word,string,reversed_sentence,mod_np,reversed_mod,disambiguating_word,non_adjective,original_logprob,reversed_logprob,ratio,n_params,mpath,revision,seed_name,seed,step
She liked the poem title.,title,title,She liked the title poem., poem title, title poem,poem,True,-22.418668746948242,-22.766666412353516,0.34799766540527344,14067712,EleutherAI/pythia-14m,step0,seed4,4,0
She liked the academic title.,title,title,She liked the title academic., academic title, title academic,academic,False,-22.708877563476562,-22.291732788085938,-0.417144775390625,14067712,EleutherAI/pythia-14m,step0,seed4,4,0
It was a costly toll.,toll,toll,It was a toll costly., costly toll, toll costly,costly,False,-22.246984481811523,-22.51906967163086,0.27208518981933594,14067712,EleutherAI/pythia-14m,step0,seed4,4,0
It was a road toll.,toll,toll,It was a toll road., road toll, toll road,road,True,-22.591495513916016,-21.670574188232422,-0.9209213256835938,14067712,EleutherAI/pythia-14m,step0,seed4,4,0
It was a loud toll.,toll,toll,It was a toll loud., loud toll, toll loud,loud,False,-23.286457061767578,-22.074848175048828,-1.21160888671875,14067712,EleutherAI/pythia-14m,step0,seed4,4,0
She saw the train tracks.,track,tracks,She saw the tracks train., train tracks, tracks train,train,True,-21.554407119750977,-21.29343032836914,-0.26097679138183594,14067712,EleutherAI/pythia-14m,step0,seed4,4,0
She saw the trolley tracks.,track,tracks,She saw the tracks trolley., trolley tracks, tracks trolley,trolley,True,-45.0546875,-44.393882751464844,-0.6608047485351562,14067712,EleutherAI/pythia-14m,step0,seed4,4,0
She saw the moose tracks.,track,tracks,She saw the tracks moose., moose tracks, tracks moose,moose,False,-32.87287521362305,-33.84511184692383,0.9722366333007812,14067712,EleutherAI/pythia-14m,step0,seed4,4,0
It was five yards.,yard,yards,It was yards five., five yards, yards five,five,True,-22.281848907470703,-21.18930435180664,-1.0925445556640625,14067712,EleutherAI/pythia-14m,step0,seed4,4,0
It was ten yards.,yard,yards,It was yards ten., ten yards, yards ten,ten,True,-22.57443618774414,-21.187191009521484,-1.3872451782226562,14067712,EleutherAI/pythia-14m,step0,seed4,4,0
They were big yards.,yard,yards,They were yards big., big yards, yards big,big,False,-22.22918128967285,-21.983386993408203,-0.24579429626464844,14067712,EleutherAI/pythia-14m,step0,seed4,4,0
It was a comedic act.,act,act,It was an act comedic., comedic act, act comedic,comedic,False,-32.456947326660156,-32.85392761230469,0.39698028564453125,14067712,EleutherAI/pythia-14m,step0,seed4,4,0
He had a pending appeal.,appeal,appeal,He had an appeal pending., pending appeal, appeal pending,pending,False,-20.382038116455078,-21.596385955810547,1.2143478393554688,14067712,EleutherAI/pythia-14m,step0,seed4,4,0
It was a polluted atmosphere.,atmosphere,atmosphere,It was an atmosphere polluted., polluted atmosphere, atmosphere polluted,polluted,False,-33.06157302856445,-32.730716705322266,-0.3308563232421875,14067712,EleutherAI/pythia-14m,step0,seed4,4,0
It was a country band.,band,band,It was a band country., country band, band country,country,True,-22.685012817382812,-21.84427261352539,-0.8407402038574219,14067712,EleutherAI/pythia-14m,step0,seed4,4,0
There was a religious barrier.,barrier,barrier,There was a barrier religious., religious barrier, barrier religious,religious,False,-22.019927978515625,-22.30840301513672,0.28847503662109375,14067712,EleutherAI/pythia-14m,step0,seed4,4,0
He saw a baseball bat.,bat,bat,He saw a bat baseball., baseball bat, bat baseball,baseball,True,-22.138225555419922,-22.06208038330078,-0.07614517211914062,14067712,EleutherAI/pythia-14m,step0,seed4,4,0
He saw the balance beam.,beam,beam,He saw the beam balance., balance beam, beam balance,balance,True,-21.968475341796875,-21.683666229248047,-0.2848091125488281,14067712,EleutherAI/pythia-14m,step0,seed4,4,0
She had a writer's block.,block,block,She had a block writer's., writer's block, block writer's,writer,True,-33.04794692993164,-30.771316528320312,-2.276630401611328,14067712,EleutherAI/pythia-14m,step0,seed4,4,0
He has royal blood.,blood,blood,He has blood royal., royal blood, blood royal,royal,False,-20.86252212524414,-21.91228675842285,1.049764633178711,14067712,EleutherAI/pythia-14m,step0,seed4,4,0
It was the school board.,board,board,It was the board school., school board, board school,school,True,-23.04117202758789,-21.237403869628906,-1.8037681579589844,14067712,EleutherAI/pythia-14m,step0,seed4,4,0
He had a leather-bound book.,book,book,He had a book leather-bound., leather-bound book, book leather-bound,leather-bound,False,-43.046024322509766,-42.65296936035156,-0.3930549621582031,14067712,EleutherAI/pythia-14m,step0,seed4,4,0
They ate a lonely breakfast.,breakfast,breakfast,They ate a breakfast lonely., lonely breakfast, breakfast lonely,lonely,False,-21.779361724853516,-21.945499420166016,0.1661376953125,14067712,EleutherAI/pythia-14m,step0,seed4,4,0
It was an island cape.,cape,cape,It was an cape island., island cape, cape island,island,True,-33.28068923950195,-34.5152473449707,1.23455810546875,14067712,EleutherAI/pythia-14m,step0,seed4,4,0
It was a criminal case.,case,case,It was a case criminal., criminal case, case criminal,criminal,False,-22.71347999572754,-22.84441566467285,0.1309356689453125,14067712,EleutherAI/pythia-14m,step0,seed4,4,0
It was a primary cause.,cause,cause,It was a cause primary., primary cause, cause primary,primary,False,-22.754798889160156,-23.337587356567383,0.5827884674072266,14067712,EleutherAI/pythia-14m,step0,seed4,4,0
It was a jail cell.,cell,cell,It was a cell jail., jail cell, cell jail,jail,True,-22.29376983642578,-21.6879940032959,-0.6057758331298828,14067712,EleutherAI/pythia-14m,step0,seed4,4,0
She had a good-luck charm.,charm,charm,She had a charm good-luck., good-luck charm, charm good-luck,good-luck,False,-52.580020904541016,-53.42573547363281,0.8457145690917969,14067712,EleutherAI/pythia-14m,step0,seed4,4,0
They liked the pet chicken.,chicken,chicken,They liked the chicken pet., pet chicken, chicken pet,pet,True,-22.849021911621094,-21.946685791015625,-0.9023361206054688,14067712,EleutherAI/pythia-14m,step0,seed4,4,0
It was a stimulating class.,class,class,It was a class stimulating., stimulating class, class stimulating,stimulating,False,-23.609375,-22.476932525634766,-1.1324424743652344,14067712,EleutherAI/pythia-14m,step0,seed4,4,0
It was a metal clip.,clip,clip,It was a clip metal., metal clip, clip metal,metal,True,-21.966995239257812,-22.83172607421875,0.8647308349609375,14067712,EleutherAI/pythia-14m,step0,seed4,4,0
It was a common cold.,cold,cold,It was a cold common., common cold, cold common,common,False,-20.812511444091797,-20.42056655883789,-0.39194488525390625,14067712,EleutherAI/pythia-14m,step0,seed4,4,0
It was a marble column.,column,column,It was a column marble., marble column, column marble,marble,True,-21.753517150878906,-21.47163963317871,-0.2818775177001953,14067712,EleutherAI/pythia-14m,step0,seed4,4,0
He liked the polite company.,company,company,He liked the company polite., polite company, company polite,polite,False,-23.738426208496094,-22.650869369506836,-1.0875568389892578,14067712,EleutherAI/pythia-14m,step0,seed4,4,0
It was a traffic cone.,cone,cone,It was a cone traffic., traffic cone, cone traffic,traffic,True,-20.767295837402344,-20.671058654785156,-0.0962371826171875,14067712,EleutherAI/pythia-14m,step0,seed4,4,0
He made a well-written contribution.,contribution,contribution,He made a contribution well-written., well-written contribution, contribution well-written,well-written,False,-44.17859649658203,-43.93185043334961,-0.24674606323242188,14067712,EleutherAI/pythia-14m,step0,seed4,4,0
That was the correct count.,count,count,That was the count correct., correct count, count correct,correct,False,-20.40389633178711,-20.60544204711914,0.20154571533203125,14067712,EleutherAI/pythia-14m,step0,seed4,4,0
It was a collision course.,course,course,It was a course collision., collision course, course collision,collision,True,-21.550344467163086,-22.164443969726562,0.6140995025634766,14067712,EleutherAI/pythia-14m,step0,seed4,4,0
It was a historical date.,date,date,It was a date historical., historical date, date historical,historical,False,-22.553497314453125,-22.240863800048828,-0.3126335144042969,14067712,EleutherAI/pythia-14m,step0,seed4,4,0
It was about college degrees.,degree,degrees,It was about degrees college., college degrees, degrees college,college,True,-21.95288848876953,-21.805850982666016,-0.14703750610351562,14067712,EleutherAI/pythia-14m,step0,seed4,4,0
They liked the architectural design.,design,design,They liked the design architectural., architectural design, design architectural,architectural,False,-22.038230895996094,-21.62886619567871,-0.4093647003173828,14067712,EleutherAI/pythia-14m,step0,seed4,4,0
They liked the anniversary dinner.,dinner,dinner,They liked the dinner anniversary., anniversary dinner, dinner anniversary,anniversary,True,-21.839447021484375,-21.36402130126953,-0.47542572021484375,14067712,EleutherAI/pythia-14m,step0,seed4,4,0
He had a career dream.,dream,dream,He had a dream career., career dream, dream career,career,True,-23.064651489257812,-22.840869903564453,-0.22378158569335938,14067712,EleutherAI/pythia-14m,step0,seed4,4,0
It was a battery-powered drill.,drill,drill,It was a drill battery-powered., battery-powered drill, drill battery-powered,battery-powered,False,-42.79386901855469,-43.50127029418945,0.7074012756347656,14067712,EleutherAI/pythia-14m,step0,seed4,4,0
It was a physical examination.,examination,examination,It was an examination physical., physical examination, examination physical,physical,False,-23.18519401550293,-21.865718841552734,-1.3194751739501953,14067712,EleutherAI/pythia-14m,step0,seed4,4,0
They had an enthusiastic fan.,fan,fan,They had an fan enthusiastic., enthusiastic fan, fan enthusiastic,enthusiastic,False,-20.623600006103516,-21.466018676757812,0.8424186706542969,14067712,EleutherAI/pythia-14m,step0,seed4,4,0
She had a steel file.,file,file,She had a file steel., steel file, file steel,steel,True,-21.091320037841797,-22.793386459350586,1.702066421508789,14067712,EleutherAI/pythia-14m,step0,seed4,4,0
It was a plastic film.,film,film,It was a film plastic., plastic film, film plastic,plastic,False,-22.84086799621582,-22.696605682373047,-0.14426231384277344,14067712,EleutherAI/pythia-14m,step0,seed4,4,0
It was a concrete foundation.,foundation,foundation,It was a foundation concrete., concrete foundation, foundation concrete,concrete,False,-23.15625762939453,-22.312267303466797,-0.8439903259277344,14067712,EleutherAI/pythia-14m,step0,seed4,4,0
It was a business function.,function,function,It was a function business., business function, function business,business,True,-20.93157386779785,-22.958812713623047,2.0272388458251953,14067712,EleutherAI/pythia-14m,step0,seed4,4,0
He was on the parade ground.,ground,ground,He was on the ground parade., parade ground, ground parade,parade,True,-22.43248748779297,-21.908931732177734,-0.5235557556152344,14067712,EleutherAI/pythia-14m,step0,seed4,4,0
They liked the national guard.,guard,guard,They liked the guard national., national guard, guard national,national,False,-22.040250778198242,-22.62866973876953,0.5884189605712891,14067712,EleutherAI/pythia-14m,step0,seed4,4,0
He had a friendly guide.,guide,guide,He had a guide friendly., friendly guide, guide friendly,friendly,False,-22.811805725097656,-22.139678955078125,-0.6721267700195312,14067712,EleutherAI/pythia-14m,step0,seed4,4,0
It was a nursing home.,home,home,It was a home nursing., nursing home, home nursing,nursing,True,-22.413860321044922,-21.593338012695312,-0.8205223083496094,14067712,EleutherAI/pythia-14m,step0,seed4,4,0
They had military intelligence.,intelligence,intelligence,They had intelligence military., military intelligence, intelligence military,military,False,-21.005542755126953,-20.03095817565918,-0.9745845794677734,14067712,EleutherAI/pythia-14m,step0,seed4,4,0
It was a special issue.,issue,issue,It was an issue special., special issue, issue special,special,False,-22.7994327545166,-22.708454132080078,-0.09097862243652344,14067712,EleutherAI/pythia-14m,step0,seed4,4,0
It was a paper jam.,jam,jam,It was a jam paper., paper jam, jam paper,paper,True,-21.64712905883789,-21.657339096069336,0.010210037231445312,14067712,EleutherAI/pythia-14m,step0,seed4,4,0
It was a backspace key.,key,key,It was a key backspace., backspace key, key backspace,backspace,True,-32.67401885986328,-31.38572120666504,-1.2882976531982422,14067712,EleutherAI/pythia-14m,step0,seed4,4,0
They liked the friendly lamb.,lamb,lamb,They liked the lamb friendly., friendly lamb, lamb friendly,friendly,False,-23.267377853393555,-24.16539764404297,0.8980197906494141,14067712,EleutherAI/pythia-14m,step0,seed4,4,0
She had door locks.,lock,locks,She had locks door., door locks, locks door,door,True,-22.980228424072266,-21.83953857421875,-1.1406898498535156,14067712,EleutherAI/pythia-14m,step0,seed4,4,0
They liked the women's lunch.,lunch,lunch,They liked the lunch women's., women's lunch, lunch women's,women,True,-32.32118225097656,-33.3681640625,1.0469818115234375,14067712,EleutherAI/pythia-14m,step0,seed4,4,0
He liked the stock market.,market,market,He liked the market stock., stock market, market stock,stock,True,-21.802688598632812,-22.698596954345703,0.8959083557128906,14067712,EleutherAI/pythia-14m,step0,seed4,4,0
It was a tennis match.,match,match,It was a match tennis., tennis match, match tennis,tennis,True,-21.381515502929688,-21.263641357421875,-0.1178741455078125,14067712,EleutherAI/pythia-14m,step0,seed4,4,0
It was veterinary medicine.,medicine,medicine,It was medicine veterinary., veterinary medicine, medicine veterinary,veterinary,False,-22.28947639465332,-21.2213191986084,-1.0681571960449219,14067712,EleutherAI/pythia-14m,step0,seed4,4,0
There was a clear message.,message,message,There was a message clear., clear message, message clear,clear,False,-20.891572952270508,-21.46593475341797,0.5743618011474609,14067712,EleutherAI/pythia-14m,step0,seed4,4,0
It was a clay mold.,mold,mold,It was a mold clay., clay mold, mold clay,clay,True,-22.48825454711914,-23.255054473876953,0.7667999267578125,14067712,EleutherAI/pythia-14m,step0,seed4,4,0
She saw the fast mole.,mole,mole,She saw the mole fast., fast mole, mole fast,fast,False,-21.037235260009766,-20.244203567504883,-0.7930316925048828,14067712,EleutherAI/pythia-14m,step0,seed4,4,0
He liked the civil-rights movement.,movement,movement,He liked the movement civil-rights., civil-rights movement, movement civil-rights,civil-rights,False,-42.58198547363281,-43.38926696777344,0.807281494140625,14067712,EleutherAI/pythia-14m,step0,seed4,4,0
It was a shredded newspaper.,newspaper,newspaper,It was a newspaper shredded., shredded newspaper, newspaper shredded,shredded,False,-22.114381790161133,-22.656545639038086,0.5421638488769531,14067712,EleutherAI/pythia-14m,step0,seed4,4,0
It was a reddish orange.,orange,orange,It was an orange reddish., reddish orange, orange reddish,reddish,False,-32.13581848144531,-32.3281364440918,0.19231796264648438,14067712,EleutherAI/pythia-14m,step0,seed4,4,0
He saw the ripped page.,page,page,He saw the page ripped., ripped page, page ripped,ripped,False,-21.006927490234375,-20.568458557128906,-0.43846893310546875,14067712,EleutherAI/pythia-14m,step0,seed4,4,0
It was a tree palm.,palm,palm,It was a palm tree., tree palm, palm tree,tree,True,-20.58319854736328,-22.597652435302734,2.014453887939453,14067712,EleutherAI/pythia-14m,step0,seed4,4,0
It was a consumer panel.,panel,panel,It was a panel consumer., consumer panel, panel consumer,consumer,True,-21.811492919921875,-22.53925323486328,0.7277603149414062,14067712,EleutherAI/pythia-14m,step0,seed4,4,0
It was a biblical passage.,passage,passage,It was a passage biblical., biblical passage, passage biblical,biblical,False,-21.15093231201172,-22.515615463256836,1.3646831512451172,14067712,EleutherAI/pythia-14m,step0,seed4,4,0
It was a secure perch.,perch,perch,It was a perch secure., secure perch, perch secure,secure,False,-33.62061309814453,-34.156856536865234,0.5362434387207031,14067712,EleutherAI/pythia-14m,step0,seed4,4,0
He saw the plastic pitcher.,pitcher,pitcher,He saw the pitcher plastic., plastic pitcher, pitcher plastic,plastic,True,-21.064393997192383,-20.821842193603516,-0.2425518035888672,14067712,EleutherAI/pythia-14m,step0,seed4,4,0
It was a sweet port.,port,port,It was a port sweet., sweet port, port sweet,sweet,False,-21.69219207763672,-21.512420654296875,-0.17977142333984375,14067712,EleutherAI/pythia-14m,step0,seed4,4,0
He was in a yoga position.,position,position,He was in a position yoga., yoga position, position yoga,yoga,True,-22.27896499633789,-21.526966094970703,-0.7519989013671875,14067712,EleutherAI/pythia-14m,step0,seed4,4,0
It was a challenging post.,post,post,It was a post challenging., challenging post, post challenging,challenging,False,-22.120059967041016,-21.83621597290039,-0.283843994140625,14067712,EleutherAI/pythia-14m,step0,seed4,4,0
He had the quickest punch.,punch,punch,He had the punch quickest., quickest punch, punch quickest,quickest,False,-33.782630920410156,-34.72328186035156,0.9406509399414062,14067712,EleutherAI/pythia-14m,step0,seed4,4,0
She had a cloudy pupil.,pupil,pupil,She had a pupil cloudy., cloudy pupil, pupil cloudy,cloudy,False,-33.94188690185547,-33.102149963378906,-0.8397369384765625,14067712,EleutherAI/pythia-14m,step0,seed4,4,0
That was a tennis racket.,racket,racket,That was a racket tennis., tennis racket, racket tennis,tennis,True,-21.61568832397461,-22.705106735229492,1.0894184112548828,14067712,EleutherAI/pythia-14m,step0,seed4,4,0
He liked granite rock.,rock,rock,He liked rock granite., granite rock, rock granite,granite,True,-22.685230255126953,-23.311050415039062,0.6258201599121094,14067712,EleutherAI/pythia-14m,step0,seed4,4,0
He saw the bushy sage.,sage,sage,He saw the sage bushy., bushy sage, sage bushy,bushy,False,-33.21346664428711,-33.56532287597656,0.3518562316894531,14067712,EleutherAI/pythia-14m,step0,seed4,4,0
It was a major scale.,scale,scale,It was a scale major., major scale, scale major,major,False,-22.687973022460938,-22.478271484375,-0.2097015380859375,14067712,EleutherAI/pythia-14m,step0,seed4,4,0
It was a panoramic scene.,scene,scene,It was a scene panoramic., panoramic scene, scene panoramic,panoramic,False,-33.699745178222656,-32.96654510498047,-0.7332000732421875,14067712,EleutherAI/pythia-14m,step0,seed4,4,0
It was a trained seal.,seal,seal,It was a seal trained., trained seal, seal trained,trained,False,-22.071685791015625,-22.119361877441406,0.04767608642578125,14067712,EleutherAI/pythia-14m,step0,seed4,4,0
He used the video tape.,tape,tape,He used the tape video., video tape, tape video,video,True,-22.17451286315918,-21.295570373535156,-0.8789424896240234,14067712,EleutherAI/pythia-14m,step0,seed4,4,0
It was a technical term.,term,term,It was a term technical., technical term, term technical,technical,False,-22.654239654541016,-22.207019805908203,-0.4472198486328125,14067712,EleutherAI/pythia-14m,step0,seed4,4,0
It was a diseased tick.,tick,tick,It was a tick diseased., diseased tick, tick diseased,diseased,False,-21.395854949951172,-22.558658599853516,1.1628036499023438,14067712,EleutherAI/pythia-14m,step0,seed4,4,0
It was a finger tip.,tip,tip,It was a tip finger., finger tip, tip finger,finger,True,-22.07754135131836,-21.14663314819336,-0.930908203125,14067712,EleutherAI/pythia-14m,step0,seed4,4,0
She liked the professional title.,title,title,She liked the title professional., professional title, title professional,professional,False,-21.362075805664062,-23.2171573638916,1.855081558227539,14067712,EleutherAI/pythia-14m,step0,seed4,4,0
It was a bell toll.,toll,toll,It was a toll bell., bell toll, toll bell,bell,True,-20.524219512939453,-21.42340087890625,0.8991813659667969,14067712,EleutherAI/pythia-14m,step0,seed4,4,0
She saw the snowshoe tracks.,track,tracks,She saw the tracks snowshoe., snowshoe tracks, tracks snowshoe,snowshoe,True,-45.31125259399414,-44.07445526123047,-1.2367973327636719,14067712,EleutherAI/pythia-14m,step0,seed4,4,0
They were cluttered yards.,yard,yards,They were yards cluttered., cluttered yards, yards cluttered,cluttered,False,-32.293235778808594,-32.42246627807617,0.12923049926757812,14067712,EleutherAI/pythia-14m,step0,seed4,4,0
