sentence,word,string,reversed_sentence,mod_np,reversed_mod,disambiguating_word,non_adjective,original_logprob,reversed_logprob,ratio,n_params,mpath,revision,seed_name,seed,step
It was a desperate act.,act,act,It was an act desperate., desperate act, act desperate,desperate,False,-15.658973693847656,-22.911285400390625,7.252311706542969,14067712,EleutherAI/pythia-14m,step62000,seed4,4,62000
It was a humane act.,act,act,It was an act humane., humane act, act humane,humane,False,-20.362016677856445,-19.70686912536621,-0.6551475524902344,14067712,EleutherAI/pythia-14m,step62000,seed4,4,62000
It was a magic act.,act,act,It was an act magic., magic act, act magic,magic,False,-14.959081649780273,-19.85936737060547,4.900285720825195,14067712,EleutherAI/pythia-14m,step62000,seed4,4,62000
He had a universal appeal.,appeal,appeal,He had an appeal universal., universal appeal, appeal universal,universal,False,-18.815914154052734,-22.406339645385742,3.590425491333008,14067712,EleutherAI/pythia-14m,step62000,seed4,4,62000
He had an undefinable appeal.,appeal,appeal,He had an appeal undefinable., undefinable appeal, appeal undefinable,undefinable,False,-22.89173698425293,-28.405363082885742,5.5136260986328125,14067712,EleutherAI/pythia-14m,step62000,seed4,4,62000
He had a legal appeal.,appeal,appeal,He had an appeal legal., legal appeal, appeal legal,legal,False,-14.752729415893555,-17.23607063293457,2.4833412170410156,14067712,EleutherAI/pythia-14m,step62000,seed4,4,62000
It was a tense atmosphere.,atmosphere,atmosphere,It was an atmosphere tense., tense atmosphere, atmosphere tense,tense,False,-16.84187889099121,-18.990650177001953,2.148771286010742,14067712,EleutherAI/pythia-14m,step62000,seed4,4,62000
It was a hostile atmosphere.,atmosphere,atmosphere,It was an atmosphere hostile., hostile atmosphere, atmosphere hostile,hostile,False,-17.38321876525879,-19.25389862060547,1.8706798553466797,14067712,EleutherAI/pythia-14m,step62000,seed4,4,62000
It was a gaseous atmosphere.,atmosphere,atmosphere,It was an atmosphere gaseous., gaseous atmosphere, atmosphere gaseous,gaseous,False,-17.534496307373047,-21.426822662353516,3.8923263549804688,14067712,EleutherAI/pythia-14m,step62000,seed4,4,62000
It was a gold band.,band,band,It was a band gold., gold band, band gold,gold,True,-14.520174026489258,-20.000198364257812,5.480024337768555,14067712,EleutherAI/pythia-14m,step62000,seed4,4,62000
It was a rubber band.,band,band,It was a band rubber., rubber band, band rubber,rubber,True,-14.741668701171875,-22.559959411621094,7.818290710449219,14067712,EleutherAI/pythia-14m,step62000,seed4,4,62000
It was a jazz band.,band,band,It was a band jazz., jazz band, band jazz,jazz,True,-14.534994125366211,-21.071632385253906,6.536638259887695,14067712,EleutherAI/pythia-14m,step62000,seed4,4,62000
There was a police barrier.,barrier,barrier,There was a barrier police., police barrier, barrier police,police,True,-19.612428665161133,-21.527748107910156,1.9153194427490234,14067712,EleutherAI/pythia-14m,step62000,seed4,4,62000
There was a concrete barrier.,barrier,barrier,There was a barrier concrete., concrete barrier, barrier concrete,concrete,False,-13.615793228149414,-20.98401641845703,7.368223190307617,14067712,EleutherAI/pythia-14m,step62000,seed4,4,62000
There was a language barrier.,barrier,barrier,There was a barrier language., language barrier, barrier language,language,True,-19.890047073364258,-23.861770629882812,3.9717235565185547,14067712,EleutherAI/pythia-14m,step62000,seed4,4,62000
He saw a furry bat.,bat,bat,He saw a bat furry., furry bat, bat furry,furry,False,-19.568021774291992,-20.146602630615234,0.5785808563232422,14067712,EleutherAI/pythia-14m,step62000,seed4,4,62000
He saw a fruit bat.,bat,bat,He saw a bat fruit., fruit bat, bat fruit,fruit,True,-17.29117202758789,-20.026968002319336,2.7357959747314453,14067712,EleutherAI/pythia-14m,step62000,seed4,4,62000
He saw a wooden bat.,bat,bat,He saw a bat wooden., wooden bat, bat wooden,wooden,False,-15.868085861206055,-22.681737899780273,6.813652038574219,14067712,EleutherAI/pythia-14m,step62000,seed4,4,62000
He saw the laser beam.,beam,beam,He saw the beam laser., laser beam, beam laser,laser,True,-11.66734790802002,-16.25495719909668,4.58760929107666,14067712,EleutherAI/pythia-14m,step62000,seed4,4,62000
He saw the bright beam.,beam,beam,He saw the beam bright., bright beam, beam bright,bright,False,-17.910381317138672,-18.193662643432617,0.2832813262939453,14067712,EleutherAI/pythia-14m,step62000,seed4,4,62000
He saw the wood beam.,beam,beam,He saw the beam wood., wood beam, beam wood,wood,True,-17.353790283203125,-19.983434677124023,2.6296443939208984,14067712,EleutherAI/pythia-14m,step62000,seed4,4,62000
She had a toy block.,block,block,She had a block toy., toy block, block toy,toy,True,-17.10302734375,-21.11920928955078,4.016181945800781,14067712,EleutherAI/pythia-14m,step62000,seed4,4,62000
She had a wooden block.,block,block,She had a block wooden., wooden block, block wooden,wooden,False,-15.79047966003418,-21.4573974609375,5.66691780090332,14067712,EleutherAI/pythia-14m,step62000,seed4,4,62000
She had a mental block.,block,block,She had a block mental., mental block, block mental,mental,False,-14.463706970214844,-21.897727966308594,7.43402099609375,14067712,EleutherAI/pythia-14m,step62000,seed4,4,62000
He has coagulated blood.,blood,blood,He has blood coagulated., coagulated blood, blood coagulated,coagulated,True,-28.92473602294922,-30.108171463012695,1.1834354400634766,14067712,EleutherAI/pythia-14m,step62000,seed4,4,62000
He has thin blood.,blood,blood,He has blood thin., thin blood, blood thin,thin,False,-19.499053955078125,-22.303783416748047,2.804729461669922,14067712,EleutherAI/pythia-14m,step62000,seed4,4,62000
He has noble blood.,blood,blood,He has blood noble., noble blood, blood noble,noble,False,-20.627744674682617,-28.574893951416016,7.947149276733398,14067712,EleutherAI/pythia-14m,step62000,seed4,4,62000
It was the ironing board.,board,board,It was the board ironing., ironing board, board ironing,ironing,False,-23.570770263671875,-23.315174102783203,-0.2555961608886719,14067712,EleutherAI/pythia-14m,step62000,seed4,4,62000
It was the wooden board.,board,board,It was the board wooden., wooden board, board wooden,wooden,False,-13.682263374328613,-20.51100730895996,6.828743934631348,14067712,EleutherAI/pythia-14m,step62000,seed4,4,62000
It was the executive board.,board,board,It was the board executive., executive board, board executive,executive,True,-14.442829132080078,-17.092405319213867,2.649576187133789,14067712,EleutherAI/pythia-14m,step62000,seed4,4,62000
He had a best-selling book.,book,book,He had a book best-selling., best-selling book, book best-selling,best-selling,False,-17.616491317749023,-21.428815841674805,3.8123245239257812,14067712,EleutherAI/pythia-14m,step62000,seed4,4,62000
He had a popular book.,book,book,He had a book popular., popular book, book popular,popular,False,-15.813976287841797,-18.986221313476562,3.1722450256347656,14067712,EleutherAI/pythia-14m,step62000,seed4,4,62000
He had a heavy book.,book,book,He had a book heavy., heavy book, book heavy,heavy,False,-16.20953369140625,-19.010852813720703,2.801319122314453,14067712,EleutherAI/pythia-14m,step62000,seed4,4,62000
They ate a pancake breakfast.,breakfast,breakfast,They ate a breakfast pancake., pancake breakfast, breakfast pancake,pancake,True,-15.084890365600586,-15.914323806762695,0.8294334411621094,14067712,EleutherAI/pythia-14m,step62000,seed4,4,62000
They ate a nutritious breakfast.,breakfast,breakfast,They ate a breakfast nutritious., nutritious breakfast, breakfast nutritious,nutritious,False,-20.178647994995117,-23.528305053710938,3.3496570587158203,14067712,EleutherAI/pythia-14m,step62000,seed4,4,62000
They ate a family breakfast.,breakfast,breakfast,They ate a breakfast family., family breakfast, breakfast family,family,True,-10.220603942871094,-14.773921012878418,4.553317070007324,14067712,EleutherAI/pythia-14m,step62000,seed4,4,62000
It was a red cape.,cape,cape,It was a cape red., red cape, cape red,red,False,-18.684677124023438,-22.177656173706055,3.492979049682617,14067712,EleutherAI/pythia-14m,step62000,seed4,4,62000
It was a flowing cape.,cape,cape,It was a cape flowing., flowing cape, cape flowing,flowing,False,-23.650251388549805,-24.53888511657715,0.8886337280273438,14067712,EleutherAI/pythia-14m,step62000,seed4,4,62000
It was a rocky cape.,cape,cape,It was a cape rocky., rocky cape, cape rocky,rocky,False,-23.963998794555664,-27.786897659301758,3.8228988647460938,14067712,EleutherAI/pythia-14m,step62000,seed4,4,62000
It was a beer case.,case,case,It was a case beer., beer case, case beer,beer,True,-18.91117286682129,-21.27303123474121,2.361858367919922,14067712,EleutherAI/pythia-14m,step62000,seed4,4,62000
It was a display case.,case,case,It was a case display., display case, case display,display,True,-17.9058837890625,-18.347055435180664,0.44117164611816406,14067712,EleutherAI/pythia-14m,step62000,seed4,4,62000
It was a divorce case.,case,case,It was a case divorce., divorce case, case divorce,divorce,True,-14.177846908569336,-18.467763900756836,4.2899169921875,14067712,EleutherAI/pythia-14m,step62000,seed4,4,62000
It was a worthy cause.,cause,cause,It was a cause worthy., worthy cause, cause worthy,worthy,False,-15.369894027709961,-19.93771743774414,4.56782341003418,14067712,EleutherAI/pythia-14m,step62000,seed4,4,62000
It was a political cause.,cause,cause,It was a cause political., political cause, cause political,political,False,-16.400619506835938,-20.641345977783203,4.240726470947266,14067712,EleutherAI/pythia-14m,step62000,seed4,4,62000
It was a main cause.,cause,cause,It was a cause main., main cause, cause main,main,False,-14.01710033416748,-21.19109344482422,7.173993110656738,14067712,EleutherAI/pythia-14m,step62000,seed4,4,62000
It was a skin cell.,cell,cell,It was a cell skin., skin cell, cell skin,skin,True,-17.24953842163086,-18.67679786682129,1.4272594451904297,14067712,EleutherAI/pythia-14m,step62000,seed4,4,62000
It was a brain cell.,cell,cell,It was a cell brain., brain cell, cell brain,brain,True,-13.854966163635254,-18.24830436706543,4.393338203430176,14067712,EleutherAI/pythia-14m,step62000,seed4,4,62000
It was a prison cell.,cell,cell,It was a cell prison., prison cell, cell prison,prison,True,-13.408503532409668,-22.08229637145996,8.673792839050293,14067712,EleutherAI/pythia-14m,step62000,seed4,4,62000
She had a devilish charm.,charm,charm,She had a charm devilish., devilish charm, charm devilish,devilish,False,-20.707115173339844,-25.284709930419922,4.577594757080078,14067712,EleutherAI/pythia-14m,step62000,seed4,4,62000
She had a natural charm.,charm,charm,She had a charm natural., natural charm, charm natural,natural,False,-15.854022979736328,-20.98432159423828,5.130298614501953,14067712,EleutherAI/pythia-14m,step62000,seed4,4,62000
She had a gold charm.,charm,charm,She had a charm gold., gold charm, charm gold,gold,True,-17.279945373535156,-19.597488403320312,2.3175430297851562,14067712,EleutherAI/pythia-14m,step62000,seed4,4,62000
They liked the juicy chicken.,chicken,chicken,They liked the chicken juicy., juicy chicken, chicken juicy,juicy,False,-20.252716064453125,-19.911060333251953,-0.3416557312011719,14067712,EleutherAI/pythia-14m,step62000,seed4,4,62000
They liked the roasted chicken.,chicken,chicken,They liked the chicken roasted., roasted chicken, chicken roasted,roasted,False,-15.662670135498047,-17.024185180664062,1.3615150451660156,14067712,EleutherAI/pythia-14m,step62000,seed4,4,62000
They liked the clucking chicken.,chicken,chicken,They liked the chicken clucking., clucking chicken, chicken clucking,clucking,True,-24.453277587890625,-22.550230026245117,-1.9030475616455078,14067712,EleutherAI/pythia-14m,step62000,seed4,4,62000
It was a perceptive class.,class,class,It was a class perceptive., perceptive class, class perceptive,perceptive,False,-17.980350494384766,-22.773515701293945,4.79316520690918,14067712,EleutherAI/pythia-14m,step62000,seed4,4,62000
It was a misbehaving class.,class,class,It was a class misbehaving., misbehaving class, class misbehaving,misbehaving,False,-21.979537963867188,-23.62890625,1.6493682861328125,14067712,EleutherAI/pythia-14m,step62000,seed4,4,62000
It was a boring class.,class,class,It was a class boring., boring class, class boring,boring,False,-16.240741729736328,-21.1116943359375,4.870952606201172,14067712,EleutherAI/pythia-14m,step62000,seed4,4,62000
It was a film clip.,clip,clip,It was a clip film., film clip, clip film,film,True,-17.076396942138672,-20.202747344970703,3.1263504028320312,14067712,EleutherAI/pythia-14m,step62000,seed4,4,62000
It was a video clip.,clip,clip,It was a clip video., video clip, clip video,video,True,-12.232307434082031,-18.555965423583984,6.323657989501953,14067712,EleutherAI/pythia-14m,step62000,seed4,4,62000
It was a hair clip.,clip,clip,It was a clip hair., hair clip, clip hair,hair,True,-19.713478088378906,-21.525074005126953,1.8115959167480469,14067712,EleutherAI/pythia-14m,step62000,seed4,4,62000
It was an icy cold.,cold,cold,It was an cold icy., icy cold, cold icy,icy,False,-13.469003677368164,-18.073299407958984,4.60429573059082,14067712,EleutherAI/pythia-14m,step62000,seed4,4,62000
It was a freezing cold.,cold,cold,It was a cold freezing., freezing cold, cold freezing,freezing,False,-14.030592918395996,-14.06911563873291,0.03852272033691406,14067712,EleutherAI/pythia-14m,step62000,seed4,4,62000
It was a chest cold.,cold,cold,It was a cold chest., chest cold, cold chest,chest,False,-18.059589385986328,-15.980862617492676,-2.0787267684936523,14067712,EleutherAI/pythia-14m,step62000,seed4,4,62000
It was a gossip column.,column,column,It was a column gossip., gossip column, column gossip,gossip,True,-20.53044891357422,-22.537662506103516,2.007213592529297,14067712,EleutherAI/pythia-14m,step62000,seed4,4,62000
It was a sports column.,column,column,It was a column sports., sports column, column sports,sports,True,-17.143943786621094,-21.716514587402344,4.57257080078125,14067712,EleutherAI/pythia-14m,step62000,seed4,4,62000
It was a concrete column.,column,column,It was a column concrete., concrete column, column concrete,concrete,False,-16.366954803466797,-20.159435272216797,3.79248046875,14067712,EleutherAI/pythia-14m,step62000,seed4,4,62000
He liked the investment company.,company,company,He liked the company investment., investment company, company investment,investment,True,-14.673137664794922,-16.492172241210938,1.8190345764160156,14067712,EleutherAI/pythia-14m,step62000,seed4,4,62000
He liked the pharmaceutical company.,company,company,He liked the company pharmaceutical., pharmaceutical company, company pharmaceutical,pharmaceutical,False,-13.897260665893555,-20.308666229248047,6.411405563354492,14067712,EleutherAI/pythia-14m,step62000,seed4,4,62000
He liked the pleasant company.,company,company,He liked the company pleasant., pleasant company, company pleasant,pleasant,False,-19.31032943725586,-22.306320190429688,2.995990753173828,14067712,EleutherAI/pythia-14m,step62000,seed4,4,62000
It was a waffle cone.,cone,cone,It was a cone waffle., waffle cone, cone waffle,waffle,True,-26.650543212890625,-26.782373428344727,0.13183021545410156,14067712,EleutherAI/pythia-14m,step62000,seed4,4,62000
It was a sugar cone.,cone,cone,It was a cone sugar., sugar cone, cone sugar,sugar,True,-19.604297637939453,-22.509923934936523,2.9056262969970703,14067712,EleutherAI/pythia-14m,step62000,seed4,4,62000
It was an orange cone.,cone,cone,It was an cone orange., orange cone, cone orange,orange,False,-14.478446960449219,-21.999813079833984,7.521366119384766,14067712,EleutherAI/pythia-14m,step62000,seed4,4,62000
He made a charitable contribution.,contribution,contribution,He made a contribution charitable., charitable contribution, contribution charitable,charitable,False,-16.922531127929688,-26.199634552001953,9.277103424072266,14067712,EleutherAI/pythia-14m,step62000,seed4,4,62000
He made a voluntary contribution.,contribution,contribution,He made a contribution voluntary., voluntary contribution, contribution voluntary,voluntary,False,-17.503185272216797,-25.713695526123047,8.21051025390625,14067712,EleutherAI/pythia-14m,step62000,seed4,4,62000
He made a scholarly contribution.,contribution,contribution,He made a contribution scholarly., scholarly contribution, contribution scholarly,scholarly,False,-21.678394317626953,-27.79277801513672,6.114383697509766,14067712,EleutherAI/pythia-14m,step62000,seed4,4,62000
That was the noble count.,count,count,That was the count noble., noble count, count noble,noble,False,-18.861623764038086,-22.856048583984375,3.994424819946289,14067712,EleutherAI/pythia-14m,step62000,seed4,4,62000
That was the vengeful count.,count,count,That was the count vengeful., vengeful count, count vengeful,vengeful,False,-22.519344329833984,-24.232973098754883,1.7136287689208984,14067712,EleutherAI/pythia-14m,step62000,seed4,4,62000
That was the final count.,count,count,That was the count final., final count, count final,final,False,-11.817020416259766,-18.813308715820312,6.996288299560547,14067712,EleutherAI/pythia-14m,step62000,seed4,4,62000
It was an introductory course.,course,course,It was an course introductory., introductory course, course introductory,introductory,False,-10.884347915649414,-22.335647583007812,11.451299667358398,14067712,EleutherAI/pythia-14m,step62000,seed4,4,62000
It was a pass-fail course.,course,course,It was a course pass-fail., pass-fail course, course pass-fail,pass-fail,False,-29.003402709960938,-32.346954345703125,3.3435516357421875,14067712,EleutherAI/pythia-14m,step62000,seed4,4,62000
It was a charted course.,course,course,It was a course charted., charted course, course charted,charted,False,-21.515560150146484,-25.282672882080078,3.7671127319335938,14067712,EleutherAI/pythia-14m,step62000,seed4,4,62000
It was a dinner date.,date,date,It was a date dinner., dinner date, date dinner,dinner,True,-16.43839454650879,-18.500993728637695,2.0625991821289062,14067712,EleutherAI/pythia-14m,step62000,seed4,4,62000
It was a blind date.,date,date,It was a date blind., blind date, date blind,blind,False,-18.170244216918945,-19.231809616088867,1.0615653991699219,14067712,EleutherAI/pythia-14m,step62000,seed4,4,62000
It was an expiration date.,date,date,It was an date expiration., expiration date, date expiration,expiration,True,-12.852895736694336,-22.589313507080078,9.736417770385742,14067712,EleutherAI/pythia-14m,step62000,seed4,4,62000
It was about forty degrees.,degree,degrees,It was about degrees forty., forty degrees, degrees forty,forty,True,-15.639506340026855,-20.44045639038086,4.800950050354004,14067712,EleutherAI/pythia-14m,step62000,seed4,4,62000
It was about fifty degrees.,degree,degrees,It was about degrees fifty., fifty degrees, degrees fifty,fifty,True,-16.420330047607422,-20.617725372314453,4.197395324707031,14067712,EleutherAI/pythia-14m,step62000,seed4,4,62000
It was about associate degrees.,degree,degrees,It was about degrees associate., associate degrees, degrees associate,associate,False,-20.03858184814453,-24.123687744140625,4.085105895996094,14067712,EleutherAI/pythia-14m,step62000,seed4,4,62000
They liked the floral design.,design,design,They liked the design floral., floral design, design floral,floral,False,-18.461090087890625,-24.100875854492188,5.6397857666015625,14067712,EleutherAI/pythia-14m,step62000,seed4,4,62000
They liked the geometric design.,design,design,They liked the design geometric., geometric design, design geometric,geometric,False,-17.87354278564453,-22.076190948486328,4.202648162841797,14067712,EleutherAI/pythia-14m,step62000,seed4,4,62000
They liked the product design.,design,design,They liked the design product., product design, design product,product,True,-14.778675079345703,-16.59244155883789,1.8137664794921875,14067712,EleutherAI/pythia-14m,step62000,seed4,4,62000
They liked the turkey dinner.,dinner,dinner,They liked the dinner turkey., turkey dinner, dinner turkey,turkey,True,-18.149343490600586,-19.296443939208984,1.1471004486083984,14067712,EleutherAI/pythia-14m,step62000,seed4,4,62000
They liked the light dinner.,dinner,dinner,They liked the dinner light., light dinner, dinner light,light,False,-22.021446228027344,-19.594337463378906,-2.4271087646484375,14067712,EleutherAI/pythia-14m,step62000,seed4,4,62000
They liked the formal dinner.,dinner,dinner,They liked the dinner formal., formal dinner, dinner formal,formal,False,-18.764904022216797,-22.32935333251953,3.5644493103027344,14067712,EleutherAI/pythia-14m,step62000,seed4,4,62000
He had a recurring dream.,dream,dream,He had a dream recurring., recurring dream, dream recurring,recurring,False,-16.904382705688477,-19.416500091552734,2.512117385864258,14067712,EleutherAI/pythia-14m,step62000,seed4,4,62000
He had a bad dream.,dream,dream,He had a dream bad., bad dream, dream bad,bad,False,-14.587576866149902,-15.813484191894531,1.225907325744629,14067712,EleutherAI/pythia-14m,step62000,seed4,4,62000
He had a childhood dream.,dream,dream,He had a dream childhood., childhood dream, dream childhood,childhood,True,-13.643566131591797,-17.580432891845703,3.9368667602539062,14067712,EleutherAI/pythia-14m,step62000,seed4,4,62000
It was a grueling drill.,drill,drill,It was a drill grueling., grueling drill, drill grueling,grueling,False,-21.917293548583984,-26.917484283447266,5.000190734863281,14067712,EleutherAI/pythia-14m,step62000,seed4,4,62000
It was a challenging drill.,drill,drill,It was a drill challenging., challenging drill, drill challenging,challenging,False,-18.579879760742188,-24.16600799560547,5.586128234863281,14067712,EleutherAI/pythia-14m,step62000,seed4,4,62000
It was an electric drill.,drill,drill,It was an drill electric., electric drill, drill electric,electric,False,-15.63430404663086,-19.52695083618164,3.8926467895507812,14067712,EleutherAI/pythia-14m,step62000,seed4,4,62000
It was a multiple-choice examination.,examination,examination,It was an examination multiple-choice., multiple-choice examination, examination multiple-choice,multiple-choice,False,-26.354225158691406,-31.030391693115234,4.676166534423828,14067712,EleutherAI/pythia-14m,step62000,seed4,4,62000
It was a difficult examination.,examination,examination,It was an examination difficult., difficult examination, examination difficult,difficult,False,-16.840465545654297,-18.382076263427734,1.5416107177734375,14067712,EleutherAI/pythia-14m,step62000,seed4,4,62000
It was a prostate examination.,examination,examination,It was an examination prostate., prostate examination, examination prostate,prostate,True,-22.734922409057617,-23.333621978759766,0.5986995697021484,14067712,EleutherAI/pythia-14m,step62000,seed4,4,62000
They had an electric fan.,fan,fan,They had an fan electric., electric fan, fan electric,electric,False,-15.305715560913086,-24.074283599853516,8.76856803894043,14067712,EleutherAI/pythia-14m,step62000,seed4,4,62000
They had a ceiling fan.,fan,fan,They had a fan ceiling., ceiling fan, fan ceiling,ceiling,True,-19.337581634521484,-24.512163162231445,5.174581527709961,14067712,EleutherAI/pythia-14m,step62000,seed4,4,62000
They had a zealous fan.,fan,fan,They had a fan zealous., zealous fan, fan zealous,zealous,False,-23.65011978149414,-27.248144149780273,3.598024368286133,14067712,EleutherAI/pythia-14m,step62000,seed4,4,62000
She had a text file.,file,file,She had a file text., text file, file text,text,True,-13.870887756347656,-16.393413543701172,2.5225257873535156,14067712,EleutherAI/pythia-14m,step62000,seed4,4,62000
She had a data file.,file,file,She had a file data., data file, file data,data,True,-13.847773551940918,-17.531394958496094,3.683621406555176,14067712,EleutherAI/pythia-14m,step62000,seed4,4,62000
She had a nail file.,file,file,She had a file nail., nail file, file nail,nail,True,-17.533496856689453,-21.267841339111328,3.734344482421875,14067712,EleutherAI/pythia-14m,step62000,seed4,4,62000
It was an action film.,film,film,It was an film action., action film, film action,action,True,-13.250640869140625,-15.962076187133789,2.711435317993164,14067712,EleutherAI/pythia-14m,step62000,seed4,4,62000
It was a censored film.,film,film,It was a film censored., censored film, film censored,censored,False,-20.118513107299805,-22.17552947998047,2.057016372680664,14067712,EleutherAI/pythia-14m,step62000,seed4,4,62000
It was a transparent film.,film,film,It was a film transparent., transparent film, film transparent,transparent,False,-16.511783599853516,-21.741985321044922,5.230201721191406,14067712,EleutherAI/pythia-14m,step62000,seed4,4,62000
It was a charitable foundation.,foundation,foundation,It was a foundation charitable., charitable foundation, foundation charitable,charitable,False,-14.85936164855957,-21.429569244384766,6.570207595825195,14067712,EleutherAI/pythia-14m,step62000,seed4,4,62000
It was an educational foundation.,foundation,foundation,It was an foundation educational., educational foundation, foundation educational,educational,False,-12.96027660369873,-21.472782135009766,8.512505531311035,14067712,EleutherAI/pythia-14m,step62000,seed4,4,62000
It was a wooden foundation.,foundation,foundation,It was a foundation wooden., wooden foundation, foundation wooden,wooden,False,-16.823806762695312,-20.636051177978516,3.812244415283203,14067712,EleutherAI/pythia-14m,step62000,seed4,4,62000
It was a mathematical function.,function,function,It was a function mathematical., mathematical function, function mathematical,mathematical,False,-12.834663391113281,-19.696319580078125,6.861656188964844,14067712,EleutherAI/pythia-14m,step62000,seed4,4,62000
It was a linear function.,function,function,It was a function linear., linear function, function linear,linear,False,-13.757025718688965,-18.81175994873047,5.054734230041504,14067712,EleutherAI/pythia-14m,step62000,seed4,4,62000
