sentence,word,string,reversed_sentence,mod_np,reversed_mod,disambiguating_word,non_adjective,original_logprob,reversed_logprob,ratio,n_params,mpath,revision,seed_name,seed,step
He used the interview tape.,tape,tape,He used the tape interview., interview tape, tape interview,interview,True,-18.37981414794922,-22.15297508239746,3.773160934448242,14067712,EleutherAI/pythia-14m,step109000,seed7,7,109000
It was a winter term.,term,term,It was a term winter., winter term, term winter,winter,True,-18.235183715820312,-21.49166488647461,3.256481170654297,14067712,EleutherAI/pythia-14m,step109000,seed7,7,109000
It was a fall term.,term,term,It was a term fall., fall term, term fall,fall,True,-19.27397918701172,-19.61886215209961,0.3448829650878906,14067712,EleutherAI/pythia-14m,step109000,seed7,7,109000
It was a legal term.,term,term,It was a term legal., legal term, term legal,legal,False,-15.12744426727295,-19.23128890991211,4.10384464263916,14067712,EleutherAI/pythia-14m,step109000,seed7,7,109000
It was a clock tick.,tick,tick,It was a tick clock., clock tick, tick clock,clock,True,-15.262704849243164,-19.48177719116211,4.219072341918945,14067712,EleutherAI/pythia-14m,step109000,seed7,7,109000
It was an audible tick.,tick,tick,It was an tick audible., audible tick, tick audible,audible,False,-16.95437240600586,-28.326751708984375,11.372379302978516,14067712,EleutherAI/pythia-14m,step109000,seed7,7,109000
It was a parasitic tick.,tick,tick,It was a tick parasitic., parasitic tick, tick parasitic,parasitic,False,-21.655086517333984,-24.78109359741211,3.126007080078125,14067712,EleutherAI/pythia-14m,step109000,seed7,7,109000
It was a generous tip.,tip,tip,It was a tip generous., generous tip, tip generous,generous,False,-17.686737060546875,-22.777650833129883,5.090913772583008,14067712,EleutherAI/pythia-14m,step109000,seed7,7,109000
It was a stingy tip.,tip,tip,It was a tip stingy., stingy tip, tip stingy,stingy,False,-18.932846069335938,-24.212369918823242,5.279523849487305,14067712,EleutherAI/pythia-14m,step109000,seed7,7,109000
It was a pencil tip.,tip,tip,It was a tip pencil., pencil tip, tip pencil,pencil,True,-19.08732795715332,-20.141298294067383,1.0539703369140625,14067712,EleutherAI/pythia-14m,step109000,seed7,7,109000
She liked the essay title.,title,title,She liked the title essay., essay title, title essay,essay,True,-20.611833572387695,-16.454734802246094,-4.157098770141602,14067712,EleutherAI/pythia-14m,step109000,seed7,7,109000
She liked the poem title.,title,title,She liked the title poem., poem title, title poem,poem,True,-20.674179077148438,-16.908348083496094,-3.7658309936523438,14067712,EleutherAI/pythia-14m,step109000,seed7,7,109000
She liked the academic title.,title,title,She liked the title academic., academic title, title academic,academic,False,-16.375530242919922,-17.704124450683594,1.3285942077636719,14067712,EleutherAI/pythia-14m,step109000,seed7,7,109000
It was a costly toll.,toll,toll,It was a toll costly., costly toll, toll costly,costly,False,-20.853168487548828,-23.720792770385742,2.867624282836914,14067712,EleutherAI/pythia-14m,step109000,seed7,7,109000
It was a road toll.,toll,toll,It was a toll road., road toll, toll road,road,True,-20.142494201660156,-18.775358200073242,-1.367136001586914,14067712,EleutherAI/pythia-14m,step109000,seed7,7,109000
It was a loud toll.,toll,toll,It was a toll loud., loud toll, toll loud,loud,False,-21.201499938964844,-23.827726364135742,2.6262264251708984,14067712,EleutherAI/pythia-14m,step109000,seed7,7,109000
She saw the train tracks.,track,tracks,She saw the tracks train., train tracks, tracks train,train,True,-16.879419326782227,-21.035541534423828,4.156122207641602,14067712,EleutherAI/pythia-14m,step109000,seed7,7,109000
She saw the trolley tracks.,track,tracks,She saw the tracks trolley., trolley tracks, tracks trolley,trolley,True,-24.952768325805664,-25.247093200683594,0.2943248748779297,14067712,EleutherAI/pythia-14m,step109000,seed7,7,109000
She saw the moose tracks.,track,tracks,She saw the tracks moose., moose tracks, tracks moose,moose,False,-23.702030181884766,-28.777278900146484,5.075248718261719,14067712,EleutherAI/pythia-14m,step109000,seed7,7,109000
It was five yards.,yard,yards,It was yards five., five yards, yards five,five,True,-15.085065841674805,-25.21070098876953,10.125635147094727,14067712,EleutherAI/pythia-14m,step109000,seed7,7,109000
It was ten yards.,yard,yards,It was yards ten., ten yards, yards ten,ten,True,-16.009204864501953,-25.27429962158203,9.265094757080078,14067712,EleutherAI/pythia-14m,step109000,seed7,7,109000
They were big yards.,yard,yards,They were yards big., big yards, yards big,big,False,-17.55029296875,-23.4295654296875,5.8792724609375,14067712,EleutherAI/pythia-14m,step109000,seed7,7,109000
It was a comedic act.,act,act,It was an act comedic., comedic act, act comedic,comedic,False,-17.97803497314453,-19.965404510498047,1.9873695373535156,14067712,EleutherAI/pythia-14m,step109000,seed7,7,109000
He had a pending appeal.,appeal,appeal,He had an appeal pending., pending appeal, appeal pending,pending,False,-14.736774444580078,-15.028151512145996,0.29137706756591797,14067712,EleutherAI/pythia-14m,step109000,seed7,7,109000
It was a polluted atmosphere.,atmosphere,atmosphere,It was an atmosphere polluted., polluted atmosphere, atmosphere polluted,polluted,False,-21.480329513549805,-21.07435417175293,-0.405975341796875,14067712,EleutherAI/pythia-14m,step109000,seed7,7,109000
It was a country band.,band,band,It was a band country., country band, band country,country,True,-18.907583236694336,-20.586681365966797,1.679098129272461,14067712,EleutherAI/pythia-14m,step109000,seed7,7,109000
There was a religious barrier.,barrier,barrier,There was a barrier religious., religious barrier, barrier religious,religious,False,-18.790035247802734,-24.7276611328125,5.937625885009766,14067712,EleutherAI/pythia-14m,step109000,seed7,7,109000
He saw a baseball bat.,bat,bat,He saw a bat baseball., baseball bat, bat baseball,baseball,True,-10.014141082763672,-16.306211471557617,6.292070388793945,14067712,EleutherAI/pythia-14m,step109000,seed7,7,109000
He saw the balance beam.,beam,beam,He saw the beam balance., balance beam, beam balance,balance,True,-21.503841400146484,-20.09857940673828,-1.4052619934082031,14067712,EleutherAI/pythia-14m,step109000,seed7,7,109000
She had a writer's block.,block,block,She had a block writer's., writer's block, block writer's,writer,True,-24.347591400146484,-24.663042068481445,0.31545066833496094,14067712,EleutherAI/pythia-14m,step109000,seed7,7,109000
He has royal blood.,blood,blood,He has blood royal., royal blood, blood royal,royal,False,-19.80445098876953,-24.789918899536133,4.985467910766602,14067712,EleutherAI/pythia-14m,step109000,seed7,7,109000
It was the school board.,board,board,It was the board school., school board, board school,school,True,-12.30420207977295,-15.918888092041016,3.6146860122680664,14067712,EleutherAI/pythia-14m,step109000,seed7,7,109000
He had a leather-bound book.,book,book,He had a book leather-bound., leather-bound book, book leather-bound,leather-bound,False,-25.102237701416016,-29.508358001708984,4.406120300292969,14067712,EleutherAI/pythia-14m,step109000,seed7,7,109000
They ate a lonely breakfast.,breakfast,breakfast,They ate a breakfast lonely., lonely breakfast, breakfast lonely,lonely,False,-14.249776840209961,-19.20245933532715,4.9526824951171875,14067712,EleutherAI/pythia-14m,step109000,seed7,7,109000
It was an island cape.,cape,cape,It was an cape island., island cape, cape island,island,True,-20.624637603759766,-28.337940216064453,7.7133026123046875,14067712,EleutherAI/pythia-14m,step109000,seed7,7,109000
It was a criminal case.,case,case,It was a case criminal., criminal case, case criminal,criminal,False,-9.324285507202148,-17.671836853027344,8.347551345825195,14067712,EleutherAI/pythia-14m,step109000,seed7,7,109000
It was a primary cause.,cause,cause,It was a cause primary., primary cause, cause primary,primary,False,-13.053403854370117,-23.073911666870117,10.0205078125,14067712,EleutherAI/pythia-14m,step109000,seed7,7,109000
It was a jail cell.,cell,cell,It was a cell jail., jail cell, cell jail,jail,True,-16.170166015625,-18.65412139892578,2.4839553833007812,14067712,EleutherAI/pythia-14m,step109000,seed7,7,109000
She had a good-luck charm.,charm,charm,She had a charm good-luck., good-luck charm, charm good-luck,good-luck,False,-26.53026008605957,-31.09754180908203,4.567281723022461,14067712,EleutherAI/pythia-14m,step109000,seed7,7,109000
They liked the pet chicken.,chicken,chicken,They liked the chicken pet., pet chicken, chicken pet,pet,True,-18.957748413085938,-17.82203483581543,-1.1357135772705078,14067712,EleutherAI/pythia-14m,step109000,seed7,7,109000
It was a stimulating class.,class,class,It was a class stimulating., stimulating class, class stimulating,stimulating,False,-17.802104949951172,-21.018157958984375,3.216053009033203,14067712,EleutherAI/pythia-14m,step109000,seed7,7,109000
It was a metal clip.,clip,clip,It was a clip metal., metal clip, clip metal,metal,True,-18.558517456054688,-19.38318634033203,0.8246688842773438,14067712,EleutherAI/pythia-14m,step109000,seed7,7,109000
It was a common cold.,cold,cold,It was a cold common., common cold, cold common,common,False,-14.971399307250977,-19.969680786132812,4.998281478881836,14067712,EleutherAI/pythia-14m,step109000,seed7,7,109000
It was a marble column.,column,column,It was a column marble., marble column, column marble,marble,True,-18.213848114013672,-20.30133819580078,2.0874900817871094,14067712,EleutherAI/pythia-14m,step109000,seed7,7,109000
He liked the polite company.,company,company,He liked the company polite., polite company, company polite,polite,False,-18.275840759277344,-19.324440002441406,1.0485992431640625,14067712,EleutherAI/pythia-14m,step109000,seed7,7,109000
It was a traffic cone.,cone,cone,It was a cone traffic., traffic cone, cone traffic,traffic,True,-20.364030838012695,-24.491748809814453,4.127717971801758,14067712,EleutherAI/pythia-14m,step109000,seed7,7,109000
He made a well-written contribution.,contribution,contribution,He made a contribution well-written., well-written contribution, contribution well-written,well-written,False,-20.01598358154297,-26.5753173828125,6.559333801269531,14067712,EleutherAI/pythia-14m,step109000,seed7,7,109000
That was the correct count.,count,count,That was the count correct., correct count, count correct,correct,False,-14.825681686401367,-20.776670455932617,5.95098876953125,14067712,EleutherAI/pythia-14m,step109000,seed7,7,109000
It was a collision course.,course,course,It was a course collision., collision course, course collision,collision,True,-17.102935791015625,-21.649269104003906,4.546333312988281,14067712,EleutherAI/pythia-14m,step109000,seed7,7,109000
It was a historical date.,date,date,It was a date historical., historical date, date historical,historical,False,-15.418879508972168,-20.421140670776367,5.002261161804199,14067712,EleutherAI/pythia-14m,step109000,seed7,7,109000
It was about college degrees.,degree,degrees,It was about degrees college., college degrees, degrees college,college,True,-15.283560752868652,-20.991825103759766,5.708264350891113,14067712,EleutherAI/pythia-14m,step109000,seed7,7,109000
They liked the architectural design.,design,design,They liked the design architectural., architectural design, design architectural,architectural,False,-13.570063591003418,-18.13343048095703,4.563366889953613,14067712,EleutherAI/pythia-14m,step109000,seed7,7,109000
They liked the anniversary dinner.,dinner,dinner,They liked the dinner anniversary., anniversary dinner, dinner anniversary,anniversary,True,-18.654056549072266,-20.860675811767578,2.2066192626953125,14067712,EleutherAI/pythia-14m,step109000,seed7,7,109000
He had a career dream.,dream,dream,He had a dream career., career dream, dream career,career,True,-16.961959838867188,-17.592288970947266,0.6303291320800781,14067712,EleutherAI/pythia-14m,step109000,seed7,7,109000
It was a battery-powered drill.,drill,drill,It was a drill battery-powered., battery-powered drill, drill battery-powered,battery-powered,False,-24.664897918701172,-27.220239639282227,2.5553417205810547,14067712,EleutherAI/pythia-14m,step109000,seed7,7,109000
It was a physical examination.,examination,examination,It was an examination physical., physical examination, examination physical,physical,False,-11.050859451293945,-17.659564971923828,6.608705520629883,14067712,EleutherAI/pythia-14m,step109000,seed7,7,109000
They had an enthusiastic fan.,fan,fan,They had an fan enthusiastic., enthusiastic fan, fan enthusiastic,enthusiastic,False,-15.066396713256836,-27.662269592285156,12.59587287902832,14067712,EleutherAI/pythia-14m,step109000,seed7,7,109000
She had a steel file.,file,file,She had a file steel., steel file, file steel,steel,True,-20.054006576538086,-24.24502182006836,4.191015243530273,14067712,EleutherAI/pythia-14m,step109000,seed7,7,109000
It was a plastic film.,film,film,It was a film plastic., plastic film, film plastic,plastic,False,-15.749188423156738,-19.39760971069336,3.648421287536621,14067712,EleutherAI/pythia-14m,step109000,seed7,7,109000
It was a concrete foundation.,foundation,foundation,It was a foundation concrete., concrete foundation, foundation concrete,concrete,False,-14.368633270263672,-19.266847610473633,4.898214340209961,14067712,EleutherAI/pythia-14m,step109000,seed7,7,109000
It was a business function.,function,function,It was a function business., business function, function business,business,True,-15.086770057678223,-19.29604721069336,4.209277153015137,14067712,EleutherAI/pythia-14m,step109000,seed7,7,109000
He was on the parade ground.,ground,ground,He was on the ground parade., parade ground, ground parade,parade,True,-17.996795654296875,-18.174633026123047,0.17783737182617188,14067712,EleutherAI/pythia-14m,step109000,seed7,7,109000
They liked the national guard.,guard,guard,They liked the guard national., national guard, guard national,national,False,-16.84273910522461,-21.78410530090332,4.941366195678711,14067712,EleutherAI/pythia-14m,step109000,seed7,7,109000
He had a friendly guide.,guide,guide,He had a guide friendly., friendly guide, guide friendly,friendly,False,-14.465219497680664,-19.769554138183594,5.30433464050293,14067712,EleutherAI/pythia-14m,step109000,seed7,7,109000
It was a nursing home.,home,home,It was a home nursing., nursing home, home nursing,nursing,True,-11.068323135375977,-18.154605865478516,7.086282730102539,14067712,EleutherAI/pythia-14m,step109000,seed7,7,109000
They had military intelligence.,intelligence,intelligence,They had intelligence military., military intelligence, intelligence military,military,False,-17.567432403564453,-20.812196731567383,3.2447643280029297,14067712,EleutherAI/pythia-14m,step109000,seed7,7,109000
It was a special issue.,issue,issue,It was an issue special., special issue, issue special,special,False,-11.532958984375,-15.189637184143066,3.6566781997680664,14067712,EleutherAI/pythia-14m,step109000,seed7,7,109000
It was a paper jam.,jam,jam,It was a jam paper., paper jam, jam paper,paper,True,-18.276973724365234,-20.396442413330078,2.1194686889648438,14067712,EleutherAI/pythia-14m,step109000,seed7,7,109000
It was a backspace key.,key,key,It was a key backspace., backspace key, key backspace,backspace,True,-23.53420639038086,-22.201160430908203,-1.3330459594726562,14067712,EleutherAI/pythia-14m,step109000,seed7,7,109000
They liked the friendly lamb.,lamb,lamb,They liked the lamb friendly., friendly lamb, lamb friendly,friendly,False,-19.508150100708008,-19.509841918945312,0.0016918182373046875,14067712,EleutherAI/pythia-14m,step109000,seed7,7,109000
She had door locks.,lock,locks,She had locks door., door locks, locks door,door,True,-19.560237884521484,-22.422119140625,2.8618812561035156,14067712,EleutherAI/pythia-14m,step109000,seed7,7,109000
They liked the women's lunch.,lunch,lunch,They liked the lunch women's., women's lunch, lunch women's,women,True,-17.79420280456543,-24.542724609375,6.74852180480957,14067712,EleutherAI/pythia-14m,step109000,seed7,7,109000
He liked the stock market.,market,market,He liked the market stock., stock market, market stock,stock,True,-15.019508361816406,-14.116296768188477,-0.9032115936279297,14067712,EleutherAI/pythia-14m,step109000,seed7,7,109000
It was a tennis match.,match,match,It was a match tennis., tennis match, match tennis,tennis,True,-14.853448867797852,-21.376232147216797,6.522783279418945,14067712,EleutherAI/pythia-14m,step109000,seed7,7,109000
It was veterinary medicine.,medicine,medicine,It was medicine veterinary., veterinary medicine, medicine veterinary,veterinary,False,-16.677326202392578,-20.235435485839844,3.5581092834472656,14067712,EleutherAI/pythia-14m,step109000,seed7,7,109000
There was a clear message.,message,message,There was a message clear., clear message, message clear,clear,False,-10.45217514038086,-15.802471160888672,5.3502960205078125,14067712,EleutherAI/pythia-14m,step109000,seed7,7,109000
It was a clay mold.,mold,mold,It was a mold clay., clay mold, mold clay,clay,True,-17.635377883911133,-20.484832763671875,2.849454879760742,14067712,EleutherAI/pythia-14m,step109000,seed7,7,109000
She saw the fast mole.,mole,mole,She saw the mole fast., fast mole, mole fast,fast,False,-21.41194725036621,-21.84610366821289,0.4341564178466797,14067712,EleutherAI/pythia-14m,step109000,seed7,7,109000
He liked the civil-rights movement.,movement,movement,He liked the movement civil-rights., civil-rights movement, movement civil-rights,civil-rights,False,-21.40841293334961,-27.996231079101562,6.587818145751953,14067712,EleutherAI/pythia-14m,step109000,seed7,7,109000
It was a shredded newspaper.,newspaper,newspaper,It was a newspaper shredded., shredded newspaper, newspaper shredded,shredded,False,-22.034709930419922,-22.587554931640625,0.5528450012207031,14067712,EleutherAI/pythia-14m,step109000,seed7,7,109000
It was a reddish orange.,orange,orange,It was an orange reddish., reddish orange, orange reddish,reddish,False,-14.946693420410156,-17.24414825439453,2.297454833984375,14067712,EleutherAI/pythia-14m,step109000,seed7,7,109000
He saw the ripped page.,page,page,He saw the page ripped., ripped page, page ripped,ripped,False,-21.89621925354004,-18.50611114501953,-3.390108108520508,14067712,EleutherAI/pythia-14m,step109000,seed7,7,109000
It was a tree palm.,palm,palm,It was a palm tree., tree palm, palm tree,tree,True,-21.869346618652344,-15.29771900177002,-6.571627616882324,14067712,EleutherAI/pythia-14m,step109000,seed7,7,109000
It was a consumer panel.,panel,panel,It was a panel consumer., consumer panel, panel consumer,consumer,True,-18.96014976501465,-20.701488494873047,1.7413387298583984,14067712,EleutherAI/pythia-14m,step109000,seed7,7,109000
It was a biblical passage.,passage,passage,It was a passage biblical., biblical passage, passage biblical,biblical,False,-16.620315551757812,-22.468360900878906,5.848045349121094,14067712,EleutherAI/pythia-14m,step109000,seed7,7,109000
It was a secure perch.,perch,perch,It was a perch secure., secure perch, perch secure,secure,False,-23.802066802978516,-28.352510452270508,4.550443649291992,14067712,EleutherAI/pythia-14m,step109000,seed7,7,109000
He saw the plastic pitcher.,pitcher,pitcher,He saw the pitcher plastic., plastic pitcher, pitcher plastic,plastic,True,-18.883190155029297,-22.95867919921875,4.075489044189453,14067712,EleutherAI/pythia-14m,step109000,seed7,7,109000
It was a sweet port.,port,port,It was a port sweet., sweet port, port sweet,sweet,False,-19.38939666748047,-21.92542266845703,2.5360260009765625,14067712,EleutherAI/pythia-14m,step109000,seed7,7,109000
He was in a yoga position.,position,position,He was in a position yoga., yoga position, position yoga,yoga,True,-15.456158638000488,-17.169292449951172,1.7131338119506836,14067712,EleutherAI/pythia-14m,step109000,seed7,7,109000
It was a challenging post.,post,post,It was a post challenging., challenging post, post challenging,challenging,False,-17.097335815429688,-18.879974365234375,1.7826385498046875,14067712,EleutherAI/pythia-14m,step109000,seed7,7,109000
He had the quickest punch.,punch,punch,He had the punch quickest., quickest punch, punch quickest,quickest,False,-18.877544403076172,-24.260772705078125,5.383228302001953,14067712,EleutherAI/pythia-14m,step109000,seed7,7,109000
She had a cloudy pupil.,pupil,pupil,She had a pupil cloudy., cloudy pupil, pupil cloudy,cloudy,False,-21.794763565063477,-25.240917205810547,3.4461536407470703,14067712,EleutherAI/pythia-14m,step109000,seed7,7,109000
That was a tennis racket.,racket,racket,That was a racket tennis., tennis racket, racket tennis,tennis,True,-17.812530517578125,-26.321218490600586,8.508687973022461,14067712,EleutherAI/pythia-14m,step109000,seed7,7,109000
He liked granite rock.,rock,rock,He liked rock granite., granite rock, rock granite,granite,True,-20.129140853881836,-20.909626007080078,0.7804851531982422,14067712,EleutherAI/pythia-14m,step109000,seed7,7,109000
He saw the bushy sage.,sage,sage,He saw the sage bushy., bushy sage, sage bushy,bushy,False,-27.348182678222656,-28.44655990600586,1.0983772277832031,14067712,EleutherAI/pythia-14m,step109000,seed7,7,109000
It was a major scale.,scale,scale,It was a scale major., major scale, scale major,major,False,-15.814370155334473,-22.0952091217041,6.280838966369629,14067712,EleutherAI/pythia-14m,step109000,seed7,7,109000
It was a panoramic scene.,scene,scene,It was a scene panoramic., panoramic scene, scene panoramic,panoramic,False,-19.800067901611328,-23.740989685058594,3.9409217834472656,14067712,EleutherAI/pythia-14m,step109000,seed7,7,109000
It was a trained seal.,seal,seal,It was a seal trained., trained seal, seal trained,trained,False,-20.511165618896484,-24.107177734375,3.5960121154785156,14067712,EleutherAI/pythia-14m,step109000,seed7,7,109000
He used the video tape.,tape,tape,He used the tape video., video tape, tape video,video,True,-16.06182289123535,-18.491966247558594,2.430143356323242,14067712,EleutherAI/pythia-14m,step109000,seed7,7,109000
It was a technical term.,term,term,It was a term technical., technical term, term technical,technical,False,-17.93368148803711,-21.10226058959961,3.1685791015625,14067712,EleutherAI/pythia-14m,step109000,seed7,7,109000
It was a diseased tick.,tick,tick,It was a tick diseased., diseased tick, tick diseased,diseased,False,-23.40964126586914,-27.43697738647461,4.027336120605469,14067712,EleutherAI/pythia-14m,step109000,seed7,7,109000
It was a finger tip.,tip,tip,It was a tip finger., finger tip, tip finger,finger,True,-17.753684997558594,-18.124818801879883,0.37113380432128906,14067712,EleutherAI/pythia-14m,step109000,seed7,7,109000
She liked the professional title.,title,title,She liked the title professional., professional title, title professional,professional,False,-16.32157325744629,-16.403709411621094,0.08213615417480469,14067712,EleutherAI/pythia-14m,step109000,seed7,7,109000
It was a bell toll.,toll,toll,It was a toll bell., bell toll, toll bell,bell,True,-20.98025894165039,-21.176725387573242,0.19646644592285156,14067712,EleutherAI/pythia-14m,step109000,seed7,7,109000
She saw the snowshoe tracks.,track,tracks,She saw the tracks snowshoe., snowshoe tracks, tracks snowshoe,snowshoe,True,-29.877628326416016,-32.41454315185547,2.536914825439453,14067712,EleutherAI/pythia-14m,step109000,seed7,7,109000
They were cluttered yards.,yard,yards,They were yards cluttered., cluttered yards, yards cluttered,cluttered,False,-25.0478515625,-28.045753479003906,2.9979019165039062,14067712,EleutherAI/pythia-14m,step109000,seed7,7,109000
