sentence,word,string,reversed_sentence,mod_np,reversed_mod,disambiguating_word,non_adjective,original_logprob,reversed_logprob,ratio,n_params,mpath,revision,seed_name,seed,step
It was a social function.,function,function,It was a function social., social function, function social,social,False,-16.192058563232422,-23.462726593017578,7.270668029785156,14067712,EleutherAI/pythia-14m,step28000,seed2,2,28000
He was on the firm ground.,ground,ground,He was on the ground firm., firm ground, ground firm,firm,False,-15.530614852905273,-15.391947746276855,-0.13866710662841797,14067712,EleutherAI/pythia-14m,step28000,seed2,2,28000
He was on the frozen ground.,ground,ground,He was on the ground frozen., frozen ground, ground frozen,frozen,False,-13.501664161682129,-17.43259048461914,3.9309263229370117,14067712,EleutherAI/pythia-14m,step28000,seed2,2,28000
He was on the camp ground.,ground,ground,He was on the ground camp., camp ground, ground camp,camp,True,-16.16630744934082,-14.852760314941406,-1.313547134399414,14067712,EleutherAI/pythia-14m,step28000,seed2,2,28000
They liked the night guard.,guard,guard,They liked the guard night., night guard, guard night,night,True,-18.480308532714844,-19.911941528320312,1.4316329956054688,14067712,EleutherAI/pythia-14m,step28000,seed2,2,28000
They liked the security guard.,guard,guard,They liked the guard security., security guard, guard security,security,True,-14.56404972076416,-20.427396774291992,5.863347053527832,14067712,EleutherAI/pythia-14m,step28000,seed2,2,28000
They liked the coast guard.,guard,guard,They liked the guard coast., coast guard, guard coast,coast,True,-18.500816345214844,-24.752727508544922,6.251911163330078,14067712,EleutherAI/pythia-14m,step28000,seed2,2,28000
He had an assembly guide.,guide,guide,He had an guide assembly., assembly guide, guide assembly,assembly,True,-21.123666763305664,-21.291011810302734,0.1673450469970703,14067712,EleutherAI/pythia-14m,step28000,seed2,2,28000
He had a TV guide.,guide,guide,He had a guide TV., TV guide, guide TV,TV,True,-17.96194076538086,-19.092418670654297,1.1304779052734375,14067712,EleutherAI/pythia-14m,step28000,seed2,2,28000
He had a talkative guide.,guide,guide,He had a guide talkative., talkative guide, guide talkative,talkative,False,-22.860363006591797,-26.873882293701172,4.013519287109375,14067712,EleutherAI/pythia-14m,step28000,seed2,2,28000
It was a summer home.,home,home,It was a home summer., summer home, home summer,summer,True,-12.724702835083008,-18.96971893310547,6.245016098022461,14067712,EleutherAI/pythia-14m,step28000,seed2,2,28000
It was a childhood home.,home,home,It was a home childhood., childhood home, home childhood,childhood,True,-13.16691780090332,-18.671663284301758,5.5047454833984375,14067712,EleutherAI/pythia-14m,step28000,seed2,2,28000
It was a funeral home.,home,home,It was a home funeral., funeral home, home funeral,funeral,False,-10.755879402160645,-17.235517501831055,6.47963809967041,14067712,EleutherAI/pythia-14m,step28000,seed2,2,28000
They had natural intelligence.,intelligence,intelligence,They had intelligence natural., natural intelligence, intelligence natural,natural,False,-19.097484588623047,-24.163333892822266,5.065849304199219,14067712,EleutherAI/pythia-14m,step28000,seed2,2,28000
They had innate intelligence.,intelligence,intelligence,They had intelligence innate., innate intelligence, intelligence innate,innate,False,-18.91402244567871,-25.723236083984375,6.809213638305664,14067712,EleutherAI/pythia-14m,step28000,seed2,2,28000
They had classified intelligence.,intelligence,intelligence,They had intelligence classified., classified intelligence, intelligence classified,classified,False,-19.68328094482422,-20.372135162353516,0.6888542175292969,14067712,EleutherAI/pythia-14m,step28000,seed2,2,28000
It was a sensitive issue.,issue,issue,It was an issue sensitive., sensitive issue, issue sensitive,sensitive,False,-16.95654296875,-18.638999938964844,1.6824569702148438,14067712,EleutherAI/pythia-14m,step28000,seed2,2,28000
It was a political issue.,issue,issue,It was an issue political., political issue, issue political,political,False,-13.667034149169922,-19.100563049316406,5.433528900146484,14067712,EleutherAI/pythia-14m,step28000,seed2,2,28000
It was a weekly issue.,issue,issue,It was an issue weekly., weekly issue, issue weekly,weekly,False,-19.96280860900879,-20.06584930419922,0.10304069519042969,14067712,EleutherAI/pythia-14m,step28000,seed2,2,28000
It was a blackberry jam.,jam,jam,It was a jam blackberry., blackberry jam, jam blackberry,blackberry,True,-19.419509887695312,-24.728307723999023,5.308797836303711,14067712,EleutherAI/pythia-14m,step28000,seed2,2,28000
It was a peach jam.,jam,jam,It was a jam peach., peach jam, jam peach,peach,False,-23.073532104492188,-22.11109161376953,-0.9624404907226562,14067712,EleutherAI/pythia-14m,step28000,seed2,2,28000
It was a traffic jam.,jam,jam,It was a jam traffic., traffic jam, jam traffic,traffic,True,-13.711421966552734,-20.223115921020508,6.511693954467773,14067712,EleutherAI/pythia-14m,step28000,seed2,2,28000
It was a duplicate key.,key,key,It was a key duplicate., duplicate key, key duplicate,duplicate,False,-19.120006561279297,-19.93707275390625,0.8170661926269531,14067712,EleutherAI/pythia-14m,step28000,seed2,2,28000
It was a master key.,key,key,It was a key master., master key, key master,master,True,-19.785808563232422,-18.785871505737305,-0.9999370574951172,14067712,EleutherAI/pythia-14m,step28000,seed2,2,28000
It was a delete key.,key,key,It was a key delete., delete key, key delete,delete,False,-21.175003051757812,-21.36214256286621,0.18713951110839844,14067712,EleutherAI/pythia-14m,step28000,seed2,2,28000
They liked the marinated lamb.,lamb,lamb,They liked the lamb marinated., marinated lamb, lamb marinated,marinated,True,-25.24806022644043,-27.880901336669922,2.632841110229492,14067712,EleutherAI/pythia-14m,step28000,seed2,2,28000
They liked the grilled lamb.,lamb,lamb,They liked the lamb grilled., grilled lamb, lamb grilled,grilled,False,-18.65537452697754,-22.65456199645996,3.999187469482422,14067712,EleutherAI/pythia-14m,step28000,seed2,2,28000
They liked the cute lamb.,lamb,lamb,They liked the lamb cute., cute lamb, lamb cute,cute,False,-18.75584602355957,-24.81713104248047,6.061285018920898,14067712,EleutherAI/pythia-14m,step28000,seed2,2,28000
She had curly locks.,lock,locks,She had locks curly., curly locks, locks curly,curly,False,-21.847862243652344,-28.565807342529297,6.717945098876953,14067712,EleutherAI/pythia-14m,step28000,seed2,2,28000
She had brown locks.,lock,locks,She had locks brown., brown locks, locks brown,brown,False,-21.50960922241211,-25.017902374267578,3.5082931518554688,14067712,EleutherAI/pythia-14m,step28000,seed2,2,28000
She had window locks.,lock,locks,She had locks window., window locks, locks window,window,True,-22.306591033935547,-24.330453872680664,2.023862838745117,14067712,EleutherAI/pythia-14m,step28000,seed2,2,28000
They liked the hot lunch.,lunch,lunch,They liked the lunch hot., hot lunch, lunch hot,hot,False,-15.787094116210938,-18.731908798217773,2.944814682006836,14067712,EleutherAI/pythia-14m,step28000,seed2,2,28000
They liked the sandwich lunch.,lunch,lunch,They liked the lunch sandwich., sandwich lunch, lunch sandwich,sandwich,True,-18.928476333618164,-16.71170425415039,-2.2167720794677734,14067712,EleutherAI/pythia-14m,step28000,seed2,2,28000
They liked the afternoon lunch.,lunch,lunch,They liked the lunch afternoon., afternoon lunch, lunch afternoon,afternoon,True,-16.036670684814453,-18.22480583190918,2.1881351470947266,14067712,EleutherAI/pythia-14m,step28000,seed2,2,28000
He liked the flea market.,market,market,He liked the market flea., flea market, market flea,flea,True,-20.435409545898438,-22.512128829956055,2.076719284057617,14067712,EleutherAI/pythia-14m,step28000,seed2,2,28000
He liked the fish market.,market,market,He liked the market fish., fish market, market fish,fish,True,-17.421390533447266,-17.24424934387207,-0.1771411895751953,14067712,EleutherAI/pythia-14m,step28000,seed2,2,28000
He liked the housing market.,market,market,He liked the market housing., housing market, market housing,housing,True,-13.977386474609375,-17.970779418945312,3.9933929443359375,14067712,EleutherAI/pythia-14m,step28000,seed2,2,28000
It was a lit match.,match,match,It was a match lit., lit match, match lit,lit,False,-22.20781135559082,-20.687767028808594,-1.5200443267822266,14067712,EleutherAI/pythia-14m,step28000,seed2,2,28000
It was a burning match.,match,match,It was a match burning., burning match, match burning,burning,False,-20.36927032470703,-20.845184326171875,0.47591400146484375,14067712,EleutherAI/pythia-14m,step28000,seed2,2,28000
It was a soccer match.,match,match,It was a match soccer., soccer match, match soccer,soccer,True,-13.147327423095703,-22.977035522460938,9.829708099365234,14067712,EleutherAI/pythia-14m,step28000,seed2,2,28000
It was cough medicine.,medicine,medicine,It was medicine cough., cough medicine, medicine cough,cough,True,-20.052356719970703,-21.63595962524414,1.5836029052734375,14067712,EleutherAI/pythia-14m,step28000,seed2,2,28000
It was prescription medicine.,medicine,medicine,It was medicine prescription., prescription medicine, medicine prescription,prescription,True,-18.640974044799805,-20.164398193359375,1.5234241485595703,14067712,EleutherAI/pythia-14m,step28000,seed2,2,28000
It was orthopedic medicine.,medicine,medicine,It was medicine orthopedic., orthopedic medicine, medicine orthopedic,orthopedic,False,-20.642250061035156,-25.935283660888672,5.293033599853516,14067712,EleutherAI/pythia-14m,step28000,seed2,2,28000
There was a phone message.,message,message,There was a message phone., phone message, message phone,phone,True,-12.15320873260498,-15.547744750976562,3.394536018371582,14067712,EleutherAI/pythia-14m,step28000,seed2,2,28000
There was a computer message.,message,message,There was a message computer., computer message, message computer,computer,True,-14.076762199401855,-18.165388107299805,4.088625907897949,14067712,EleutherAI/pythia-14m,step28000,seed2,2,28000
There was an urgent message.,message,message,There was an message urgent., urgent message, message urgent,urgent,False,-9.08742618560791,-21.74515151977539,12.65772533416748,14067712,EleutherAI/pythia-14m,step28000,seed2,2,28000
It was a fungal mold.,mold,mold,It was a mold fungal., fungal mold, mold fungal,fungal,False,-20.612812042236328,-23.45941925048828,2.846607208251953,14067712,EleutherAI/pythia-14m,step28000,seed2,2,28000
It was a harmful mold.,mold,mold,It was a mold harmful., harmful mold, mold harmful,harmful,False,-22.746440887451172,-22.399497985839844,-0.3469429016113281,14067712,EleutherAI/pythia-14m,step28000,seed2,2,28000
It was a rubber mold.,mold,mold,It was a mold rubber., rubber mold, mold rubber,rubber,True,-16.199485778808594,-21.445823669433594,5.246337890625,14067712,EleutherAI/pythia-14m,step28000,seed2,2,28000
She saw the cancerous mole.,mole,mole,She saw the mole cancerous., cancerous mole, mole cancerous,cancerous,False,-23.723852157592773,-28.707172393798828,4.983320236206055,14067712,EleutherAI/pythia-14m,step28000,seed2,2,28000
She saw the raised mole.,mole,mole,She saw the mole raised., raised mole, mole raised,raised,False,-22.373218536376953,-18.65706443786621,-3.716154098510742,14067712,EleutherAI/pythia-14m,step28000,seed2,2,28000
She saw the cute mole.,mole,mole,She saw the mole cute., cute mole, mole cute,cute,False,-18.138870239257812,-23.16238784790039,5.023517608642578,14067712,EleutherAI/pythia-14m,step28000,seed2,2,28000
He liked the rhythmic movement.,movement,movement,He liked the movement rhythmic., rhythmic movement, movement rhythmic,rhythmic,False,-16.970258712768555,-24.573410034179688,7.603151321411133,14067712,EleutherAI/pythia-14m,step28000,seed2,2,28000
He liked the graceful movement.,movement,movement,He liked the movement graceful., graceful movement, movement graceful,graceful,False,-16.420745849609375,-23.64266586303711,7.221920013427734,14067712,EleutherAI/pythia-14m,step28000,seed2,2,28000
He liked the feminist movement.,movement,movement,He liked the movement feminist., feminist movement, movement feminist,feminist,True,-14.953629493713379,-24.056758880615234,9.103129386901855,14067712,EleutherAI/pythia-14m,step28000,seed2,2,28000
It was a national newspaper.,newspaper,newspaper,It was a newspaper national., national newspaper, newspaper national,national,False,-13.944099426269531,-17.804847717285156,3.860748291015625,14067712,EleutherAI/pythia-14m,step28000,seed2,2,28000
It was a daily newspaper.,newspaper,newspaper,It was a newspaper daily., daily newspaper, newspaper daily,daily,False,-15.947370529174805,-16.24591636657715,0.29854583740234375,14067712,EleutherAI/pythia-14m,step28000,seed2,2,28000
It was a faded newspaper.,newspaper,newspaper,It was a newspaper faded., faded newspaper, newspaper faded,faded,False,-20.35965347290039,-19.929906845092773,-0.4297466278076172,14067712,EleutherAI/pythia-14m,step28000,seed2,2,28000
It was a juicy orange.,orange,orange,It was an orange juicy., juicy orange, orange juicy,juicy,False,-19.046581268310547,-17.487422943115234,-1.5591583251953125,14067712,EleutherAI/pythia-14m,step28000,seed2,2,28000
It was a ripe orange.,orange,orange,It was an orange ripe., ripe orange, orange ripe,ripe,False,-17.928815841674805,-19.006086349487305,1.0772705078125,14067712,EleutherAI/pythia-14m,step28000,seed2,2,28000
It was a bright orange.,orange,orange,It was an orange bright., bright orange, orange bright,bright,False,-13.314205169677734,-16.325647354125977,3.011442184448242,14067712,EleutherAI/pythia-14m,step28000,seed2,2,28000
He saw the young page.,page,page,He saw the page young., young page, page young,young,False,-17.078914642333984,-21.988374710083008,4.909460067749023,14067712,EleutherAI/pythia-14m,step28000,seed2,2,28000
He saw the loyal page.,page,page,He saw the page loyal., loyal page, page loyal,loyal,False,-23.13129425048828,-25.288650512695312,2.1573562622070312,14067712,EleutherAI/pythia-14m,step28000,seed2,2,28000
He saw the blank page.,page,page,He saw the page blank., blank page, page blank,blank,False,-15.147109985351562,-18.0174560546875,2.8703460693359375,14067712,EleutherAI/pythia-14m,step28000,seed2,2,28000
It was a calloused palm.,palm,palm,It was a palm calloused., calloused palm, palm calloused,calloused,False,-29.83835220336914,-31.212825775146484,1.3744735717773438,14067712,EleutherAI/pythia-14m,step28000,seed2,2,28000
It was a wrinkled palm.,palm,palm,It was a palm wrinkled., wrinkled palm, palm wrinkled,wrinkled,False,-21.71340560913086,-20.714599609375,-0.9988059997558594,14067712,EleutherAI/pythia-14m,step28000,seed2,2,28000
It was a tropical palm.,palm,palm,It was a palm tropical., tropical palm, palm tropical,tropical,False,-17.451133728027344,-21.58917808532715,4.138044357299805,14067712,EleutherAI/pythia-14m,step28000,seed2,2,28000
It was a control panel.,panel,panel,It was a panel control., control panel, panel control,control,True,-16.51532745361328,-19.194751739501953,2.679424285888672,14067712,EleutherAI/pythia-14m,step28000,seed2,2,28000
It was an instrument panel.,panel,panel,It was an panel instrument., instrument panel, panel instrument,instrument,False,-16.513181686401367,-24.980663299560547,8.46748161315918,14067712,EleutherAI/pythia-14m,step28000,seed2,2,28000
It was an advisory panel.,panel,panel,It was an panel advisory., advisory panel, panel advisory,advisory,False,-15.30207347869873,-26.376968383789062,11.074894905090332,14067712,EleutherAI/pythia-14m,step28000,seed2,2,28000
It was a secret passage.,passage,passage,It was a passage secret., secret passage, passage secret,secret,False,-16.357820510864258,-20.361881256103516,4.004060745239258,14067712,EleutherAI/pythia-14m,step28000,seed2,2,28000
It was a narrow passage.,passage,passage,It was a passage narrow., narrow passage, passage narrow,narrow,False,-13.294061660766602,-19.928714752197266,6.634653091430664,14067712,EleutherAI/pythia-14m,step28000,seed2,2,28000
It was a literary passage.,passage,passage,It was a passage literary., literary passage, passage literary,literary,False,-17.245960235595703,-22.913354873657227,5.667394638061523,14067712,EleutherAI/pythia-14m,step28000,seed2,2,28000
It was a tasty perch.,perch,perch,It was a perch tasty., tasty perch, perch tasty,tasty,False,-22.696449279785156,-26.175357818603516,3.4789085388183594,14067712,EleutherAI/pythia-14m,step28000,seed2,2,28000
It was a freshwater perch.,perch,perch,It was a perch freshwater., freshwater perch, perch freshwater,freshwater,True,-22.12510871887207,-26.126972198486328,4.001863479614258,14067712,EleutherAI/pythia-14m,step28000,seed2,2,28000
It was a lofty perch.,perch,perch,It was a perch lofty., lofty perch, perch lofty,lofty,False,-22.423152923583984,-25.37613296508789,2.9529800415039062,14067712,EleutherAI/pythia-14m,step28000,seed2,2,28000
He saw the fast pitcher.,pitcher,pitcher,He saw the pitcher fast., fast pitcher, pitcher fast,fast,False,-19.35602569580078,-21.24481201171875,1.8887863159179688,14067712,EleutherAI/pythia-14m,step28000,seed2,2,28000
He saw the right-handed pitcher.,pitcher,pitcher,He saw the pitcher right-handed., right-handed pitcher, pitcher right-handed,right-handed,False,-19.99051856994629,-29.027626037597656,9.037107467651367,14067712,EleutherAI/pythia-14m,step28000,seed2,2,28000
He saw the glass pitcher.,pitcher,pitcher,He saw the pitcher glass., glass pitcher, pitcher glass,glass,True,-20.408123016357422,-23.097801208496094,2.689678192138672,14067712,EleutherAI/pythia-14m,step28000,seed2,2,28000
It was a windy port.,port,port,It was a port windy., windy port, port windy,windy,False,-22.983524322509766,-25.721498489379883,2.737974166870117,14067712,EleutherAI/pythia-14m,step28000,seed2,2,28000
It was a seaside port.,port,port,It was a port seaside., seaside port, port seaside,seaside,True,-16.01038932800293,-23.232315063476562,7.221925735473633,14067712,EleutherAI/pythia-14m,step28000,seed2,2,28000
It was a delicious port.,port,port,It was a port delicious., delicious port, port delicious,delicious,False,-19.166515350341797,-23.324459075927734,4.1579437255859375,14067712,EleutherAI/pythia-14m,step28000,seed2,2,28000
He was in a distinguished position.,position,position,He was in a position distinguished., distinguished position, position distinguished,distinguished,False,-12.658672332763672,-19.694957733154297,7.036285400390625,14067712,EleutherAI/pythia-14m,step28000,seed2,2,28000
He was in a prominent position.,position,position,He was in a position prominent., prominent position, position prominent,prominent,False,-12.50098991394043,-19.908164978027344,7.407175064086914,14067712,EleutherAI/pythia-14m,step28000,seed2,2,28000
He was in a fetal position.,position,position,He was in a position fetal., fetal position, position fetal,fetal,False,-18.083478927612305,-24.362844467163086,6.279365539550781,14067712,EleutherAI/pythia-14m,step28000,seed2,2,28000
It was a wooden post.,post,post,It was a post wooden., wooden post, post wooden,wooden,False,-16.178421020507812,-21.398181915283203,5.219760894775391,14067712,EleutherAI/pythia-14m,step28000,seed2,2,28000
It was a fence post.,post,post,It was a post fence., fence post, post fence,fence,True,-19.793067932128906,-21.275196075439453,1.4821281433105469,14067712,EleutherAI/pythia-14m,step28000,seed2,2,28000
It was a teaching post.,post,post,It was a post teaching., teaching post, post teaching,teaching,True,-17.547245025634766,-17.4920597076416,-0.05518531799316406,14067712,EleutherAI/pythia-14m,step28000,seed2,2,28000
He had the alcoholic punch.,punch,punch,He had the punch alcoholic., alcoholic punch, punch alcoholic,alcoholic,False,-21.33962631225586,-25.71310043334961,4.37347412109375,14067712,EleutherAI/pythia-14m,step28000,seed2,2,28000
He had the fruit punch.,punch,punch,He had the punch fruit., fruit punch, punch fruit,fruit,True,-19.92917251586914,-21.583759307861328,1.6545867919921875,14067712,EleutherAI/pythia-14m,step28000,seed2,2,28000
He had the strongest punch.,punch,punch,He had the punch strongest., strongest punch, punch strongest,strongest,False,-16.968050003051758,-23.686779022216797,6.718729019165039,14067712,EleutherAI/pythia-14m,step28000,seed2,2,28000
She had a brilliant pupil.,pupil,pupil,She had a pupil brilliant., brilliant pupil, pupil brilliant,brilliant,False,-16.351085662841797,-23.395524978637695,7.044439315795898,14067712,EleutherAI/pythia-14m,step28000,seed2,2,28000
She had an interested pupil.,pupil,pupil,She had an pupil interested., interested pupil, pupil interested,interested,False,-19.72809600830078,-19.762008666992188,0.03391265869140625,14067712,EleutherAI/pythia-14m,step28000,seed2,2,28000
She had a dilated pupil.,pupil,pupil,She had a pupil dilated., dilated pupil, pupil dilated,dilated,False,-18.957414627075195,-21.104934692382812,2.147520065307617,14067712,EleutherAI/pythia-14m,step28000,seed2,2,28000
That was a loud racket.,racket,racket,That was a racket loud., loud racket, racket loud,loud,False,-17.57235336303711,-22.183351516723633,4.610998153686523,14067712,EleutherAI/pythia-14m,step28000,seed2,2,28000
That was an annoying racket.,racket,racket,That was an racket annoying., annoying racket, racket annoying,annoying,False,-17.505104064941406,-27.279781341552734,9.774677276611328,14067712,EleutherAI/pythia-14m,step28000,seed2,2,28000
That was a badminton racket.,racket,racket,That was a racket badminton., badminton racket, racket badminton,badminton,True,-22.794750213623047,-28.348234176635742,5.553483963012695,14067712,EleutherAI/pythia-14m,step28000,seed2,2,28000
He liked electronic rock.,rock,rock,He liked rock electronic., electronic rock, rock electronic,electronic,False,-20.82437515258789,-23.63979721069336,2.8154220581054688,14067712,EleutherAI/pythia-14m,step28000,seed2,2,28000
He liked alternative rock.,rock,rock,He liked rock alternative., alternative rock, rock alternative,alternative,False,-21.99605369567871,-25.777700424194336,3.781646728515625,14067712,EleutherAI/pythia-14m,step28000,seed2,2,28000
He liked limestone rock.,rock,rock,He liked rock limestone., limestone rock, rock limestone,limestone,True,-20.326919555664062,-23.475051879882812,3.14813232421875,14067712,EleutherAI/pythia-14m,step28000,seed2,2,28000
He saw the wise sage.,sage,sage,He saw the sage wise., wise sage, sage wise,wise,False,-20.144601821899414,-23.08631134033203,2.941709518432617,14067712,EleutherAI/pythia-14m,step28000,seed2,2,28000
He saw the renowned sage.,sage,sage,He saw the sage renowned., renowned sage, sage renowned,renowned,False,-21.29983901977539,-24.871898651123047,3.5720596313476562,14067712,EleutherAI/pythia-14m,step28000,seed2,2,28000
He saw the fragrant sage.,sage,sage,He saw the sage fragrant., fragrant sage, sage fragrant,fragrant,False,-25.108367919921875,-23.20449447631836,-1.9038734436035156,14067712,EleutherAI/pythia-14m,step28000,seed2,2,28000
It was a fish scale.,scale,scale,It was a scale fish., fish scale, scale fish,fish,True,-18.139450073242188,-19.666547775268555,1.5270977020263672,14067712,EleutherAI/pythia-14m,step28000,seed2,2,28000
It was a lizard scale.,scale,scale,It was a scale lizard., lizard scale, scale lizard,lizard,True,-24.722272872924805,-24.042400360107422,-0.6798725128173828,14067712,EleutherAI/pythia-14m,step28000,seed2,2,28000
It was a music scale.,scale,scale,It was a scale music., music scale, scale music,music,True,-17.747533798217773,-19.556209564208984,1.808675765991211,14067712,EleutherAI/pythia-14m,step28000,seed2,2,28000
It was a touching scene.,scene,scene,It was a scene touching., touching scene, scene touching,touching,False,-19.278520584106445,-18.01865005493164,-1.2598705291748047,14067712,EleutherAI/pythia-14m,step28000,seed2,2,28000
It was a well-acted scene.,scene,scene,It was a scene well-acted., well-acted scene, scene well-acted,well-acted,False,-25.737987518310547,-27.96761703491211,2.2296295166015625,14067712,EleutherAI/pythia-14m,step28000,seed2,2,28000
It was a nature scene.,scene,scene,It was a scene nature., nature scene, scene nature,nature,True,-20.27397918701172,-20.780315399169922,0.5063362121582031,14067712,EleutherAI/pythia-14m,step28000,seed2,2,28000
It was a gold seal.,seal,seal,It was a seal gold., gold seal, seal gold,gold,True,-15.036506652832031,-21.210613250732422,6.174106597900391,14067712,EleutherAI/pythia-14m,step28000,seed2,2,28000
It was a certified seal.,seal,seal,It was a seal certified., certified seal, seal certified,certified,False,-18.876657485961914,-21.446929931640625,2.570272445678711,14067712,EleutherAI/pythia-14m,step28000,seed2,2,28000
It was a circus seal.,seal,seal,It was a seal circus., circus seal, seal circus,circus,True,-22.431520462036133,-24.869701385498047,2.438180923461914,14067712,EleutherAI/pythia-14m,step28000,seed2,2,28000
He used the scotch tape.,tape,tape,He used the tape scotch., scotch tape, tape scotch,scotch,True,-24.905014038085938,-26.00321388244629,1.0981998443603516,14067712,EleutherAI/pythia-14m,step28000,seed2,2,28000
He used the double-sided tape.,tape,tape,He used the tape double-sided., double-sided tape, tape double-sided,double-sided,False,-21.037933349609375,-28.356182098388672,7.318248748779297,14067712,EleutherAI/pythia-14m,step28000,seed2,2,28000
He used the interview tape.,tape,tape,He used the tape interview., interview tape, tape interview,interview,True,-19.362995147705078,-21.42662811279297,2.0636329650878906,14067712,EleutherAI/pythia-14m,step28000,seed2,2,28000
It was a winter term.,term,term,It was a term winter., winter term, term winter,winter,True,-15.599166870117188,-21.06049346923828,5.461326599121094,14067712,EleutherAI/pythia-14m,step28000,seed2,2,28000
