sentence,word,string,reversed_sentence,mod_np,reversed_mod,disambiguating_word,non_adjective,original_logprob,reversed_logprob,ratio,n_params,mpath,revision,seed_name,seed,step
He used the interview tape.,tape,tape,He used the tape interview., interview tape, tape interview,interview,True,-16.57774543762207,-17.452011108398438,0.8742656707763672,14067712,EleutherAI/pythia-14m,step135000,seed6,6,135000
It was a winter term.,term,term,It was a term winter., winter term, term winter,winter,True,-17.7969970703125,-22.21877670288086,4.421779632568359,14067712,EleutherAI/pythia-14m,step135000,seed6,6,135000
It was a fall term.,term,term,It was a term fall., fall term, term fall,fall,True,-17.83431625366211,-21.18117904663086,3.34686279296875,14067712,EleutherAI/pythia-14m,step135000,seed6,6,135000
It was a legal term.,term,term,It was a term legal., legal term, term legal,legal,False,-17.447486877441406,-18.75442123413086,1.3069343566894531,14067712,EleutherAI/pythia-14m,step135000,seed6,6,135000
It was a clock tick.,tick,tick,It was a tick clock., clock tick, tick clock,clock,True,-16.84621810913086,-21.886280059814453,5.040061950683594,14067712,EleutherAI/pythia-14m,step135000,seed6,6,135000
It was an audible tick.,tick,tick,It was an tick audible., audible tick, tick audible,audible,False,-19.266847610473633,-24.62911605834961,5.362268447875977,14067712,EleutherAI/pythia-14m,step135000,seed6,6,135000
It was a parasitic tick.,tick,tick,It was a tick parasitic., parasitic tick, tick parasitic,parasitic,False,-20.532682418823242,-25.328662872314453,4.795980453491211,14067712,EleutherAI/pythia-14m,step135000,seed6,6,135000
It was a generous tip.,tip,tip,It was a tip generous., generous tip, tip generous,generous,False,-19.019615173339844,-22.743507385253906,3.7238922119140625,14067712,EleutherAI/pythia-14m,step135000,seed6,6,135000
It was a stingy tip.,tip,tip,It was a tip stingy., stingy tip, tip stingy,stingy,False,-22.76971435546875,-26.31645393371582,3.5467395782470703,14067712,EleutherAI/pythia-14m,step135000,seed6,6,135000
It was a pencil tip.,tip,tip,It was a tip pencil., pencil tip, tip pencil,pencil,True,-20.27574920654297,-20.684425354003906,0.4086761474609375,14067712,EleutherAI/pythia-14m,step135000,seed6,6,135000
She liked the essay title.,title,title,She liked the title essay., essay title, title essay,essay,True,-21.50201416015625,-18.402116775512695,-3.0998973846435547,14067712,EleutherAI/pythia-14m,step135000,seed6,6,135000
She liked the poem title.,title,title,She liked the title poem., poem title, title poem,poem,True,-19.496192932128906,-18.703874588012695,-0.7923183441162109,14067712,EleutherAI/pythia-14m,step135000,seed6,6,135000
She liked the academic title.,title,title,She liked the title academic., academic title, title academic,academic,False,-17.7427978515625,-19.287858963012695,1.5450611114501953,14067712,EleutherAI/pythia-14m,step135000,seed6,6,135000
It was a costly toll.,toll,toll,It was a toll costly., costly toll, toll costly,costly,False,-20.712059020996094,-23.125225067138672,2.413166046142578,14067712,EleutherAI/pythia-14m,step135000,seed6,6,135000
It was a road toll.,toll,toll,It was a toll road., road toll, toll road,road,True,-17.571455001831055,-18.861555099487305,1.29010009765625,14067712,EleutherAI/pythia-14m,step135000,seed6,6,135000
It was a loud toll.,toll,toll,It was a toll loud., loud toll, toll loud,loud,False,-20.778940200805664,-23.379375457763672,2.600435256958008,14067712,EleutherAI/pythia-14m,step135000,seed6,6,135000
She saw the train tracks.,track,tracks,She saw the tracks train., train tracks, tracks train,train,True,-15.221807479858398,-19.254859924316406,4.033052444458008,14067712,EleutherAI/pythia-14m,step135000,seed6,6,135000
She saw the trolley tracks.,track,tracks,She saw the tracks trolley., trolley tracks, tracks trolley,trolley,True,-24.838054656982422,-24.83965492248535,0.0016002655029296875,14067712,EleutherAI/pythia-14m,step135000,seed6,6,135000
She saw the moose tracks.,track,tracks,She saw the tracks moose., moose tracks, tracks moose,moose,False,-23.588031768798828,-23.335580825805664,-0.25245094299316406,14067712,EleutherAI/pythia-14m,step135000,seed6,6,135000
It was five yards.,yard,yards,It was yards five., five yards, yards five,five,True,-17.021800994873047,-24.622116088867188,7.600315093994141,14067712,EleutherAI/pythia-14m,step135000,seed6,6,135000
It was ten yards.,yard,yards,It was yards ten., ten yards, yards ten,ten,True,-19.98733901977539,-25.634321212768555,5.646982192993164,14067712,EleutherAI/pythia-14m,step135000,seed6,6,135000
They were big yards.,yard,yards,They were yards big., big yards, yards big,big,False,-17.167495727539062,-21.423564910888672,4.256069183349609,14067712,EleutherAI/pythia-14m,step135000,seed6,6,135000
It was a comedic act.,act,act,It was an act comedic., comedic act, act comedic,comedic,False,-16.825729370117188,-22.175992965698242,5.350263595581055,14067712,EleutherAI/pythia-14m,step135000,seed6,6,135000
He had a pending appeal.,appeal,appeal,He had an appeal pending., pending appeal, appeal pending,pending,False,-17.620376586914062,-13.53495979309082,-4.085416793823242,14067712,EleutherAI/pythia-14m,step135000,seed6,6,135000
It was a polluted atmosphere.,atmosphere,atmosphere,It was an atmosphere polluted., polluted atmosphere, atmosphere polluted,polluted,False,-23.486251831054688,-26.509929656982422,3.0236778259277344,14067712,EleutherAI/pythia-14m,step135000,seed6,6,135000
It was a country band.,band,band,It was a band country., country band, band country,country,True,-17.227548599243164,-18.97921371459961,1.7516651153564453,14067712,EleutherAI/pythia-14m,step135000,seed6,6,135000
There was a religious barrier.,barrier,barrier,There was a barrier religious., religious barrier, barrier religious,religious,False,-18.123043060302734,-23.20672607421875,5.083683013916016,14067712,EleutherAI/pythia-14m,step135000,seed6,6,135000
He saw a baseball bat.,bat,bat,He saw a bat baseball., baseball bat, bat baseball,baseball,True,-11.549919128417969,-15.526782989501953,3.9768638610839844,14067712,EleutherAI/pythia-14m,step135000,seed6,6,135000
He saw the balance beam.,beam,beam,He saw the beam balance., balance beam, beam balance,balance,True,-21.862037658691406,-21.360332489013672,-0.5017051696777344,14067712,EleutherAI/pythia-14m,step135000,seed6,6,135000
She had a writer's block.,block,block,She had a block writer's., writer's block, block writer's,writer,True,-21.955501556396484,-24.136058807373047,2.1805572509765625,14067712,EleutherAI/pythia-14m,step135000,seed6,6,135000
He has royal blood.,blood,blood,He has blood royal., royal blood, blood royal,royal,False,-19.683773040771484,-23.359756469726562,3.675983428955078,14067712,EleutherAI/pythia-14m,step135000,seed6,6,135000
It was the school board.,board,board,It was the board school., school board, board school,school,True,-13.266240119934082,-18.61595916748047,5.349719047546387,14067712,EleutherAI/pythia-14m,step135000,seed6,6,135000
He had a leather-bound book.,book,book,He had a book leather-bound., leather-bound book, book leather-bound,leather-bound,False,-26.830570220947266,-27.96978759765625,1.1392173767089844,14067712,EleutherAI/pythia-14m,step135000,seed6,6,135000
They ate a lonely breakfast.,breakfast,breakfast,They ate a breakfast lonely., lonely breakfast, breakfast lonely,lonely,False,-14.421126365661621,-19.224918365478516,4.8037919998168945,14067712,EleutherAI/pythia-14m,step135000,seed6,6,135000
It was an island cape.,cape,cape,It was an cape island., island cape, cape island,island,True,-22.146108627319336,-23.13386344909668,0.9877548217773438,14067712,EleutherAI/pythia-14m,step135000,seed6,6,135000
It was a criminal case.,case,case,It was a case criminal., criminal case, case criminal,criminal,False,-10.933682441711426,-15.847463607788086,4.91378116607666,14067712,EleutherAI/pythia-14m,step135000,seed6,6,135000
It was a primary cause.,cause,cause,It was a cause primary., primary cause, cause primary,primary,False,-12.370524406433105,-21.16189193725586,8.791367530822754,14067712,EleutherAI/pythia-14m,step135000,seed6,6,135000
It was a jail cell.,cell,cell,It was a cell jail., jail cell, cell jail,jail,True,-19.04071044921875,-20.560457229614258,1.5197467803955078,14067712,EleutherAI/pythia-14m,step135000,seed6,6,135000
She had a good-luck charm.,charm,charm,She had a charm good-luck., good-luck charm, charm good-luck,good-luck,False,-27.306995391845703,-29.225936889648438,1.9189414978027344,14067712,EleutherAI/pythia-14m,step135000,seed6,6,135000
They liked the pet chicken.,chicken,chicken,They liked the chicken pet., pet chicken, chicken pet,pet,True,-18.032869338989258,-17.048370361328125,-0.9844989776611328,14067712,EleutherAI/pythia-14m,step135000,seed6,6,135000
It was a stimulating class.,class,class,It was a class stimulating., stimulating class, class stimulating,stimulating,False,-19.514692306518555,-21.463638305664062,1.9489459991455078,14067712,EleutherAI/pythia-14m,step135000,seed6,6,135000
It was a metal clip.,clip,clip,It was a clip metal., metal clip, clip metal,metal,True,-19.110580444335938,-20.078548431396484,0.9679679870605469,14067712,EleutherAI/pythia-14m,step135000,seed6,6,135000
It was a common cold.,cold,cold,It was a cold common., common cold, cold common,common,False,-16.22095489501953,-18.987808227539062,2.7668533325195312,14067712,EleutherAI/pythia-14m,step135000,seed6,6,135000
It was a marble column.,column,column,It was a column marble., marble column, column marble,marble,True,-17.322168350219727,-20.449649810791016,3.127481460571289,14067712,EleutherAI/pythia-14m,step135000,seed6,6,135000
He liked the polite company.,company,company,He liked the company polite., polite company, company polite,polite,False,-19.27749252319336,-20.275588989257812,0.9980964660644531,14067712,EleutherAI/pythia-14m,step135000,seed6,6,135000
It was a traffic cone.,cone,cone,It was a cone traffic., traffic cone, cone traffic,traffic,True,-19.41106414794922,-23.85921859741211,4.448154449462891,14067712,EleutherAI/pythia-14m,step135000,seed6,6,135000
He made a well-written contribution.,contribution,contribution,He made a contribution well-written., well-written contribution, contribution well-written,well-written,False,-22.777406692504883,-28.1419734954834,5.364566802978516,14067712,EleutherAI/pythia-14m,step135000,seed6,6,135000
That was the correct count.,count,count,That was the count correct., correct count, count correct,correct,False,-16.433483123779297,-21.264400482177734,4.8309173583984375,14067712,EleutherAI/pythia-14m,step135000,seed6,6,135000
It was a collision course.,course,course,It was a course collision., collision course, course collision,collision,True,-17.48998260498047,-19.440773010253906,1.9507904052734375,14067712,EleutherAI/pythia-14m,step135000,seed6,6,135000
It was a historical date.,date,date,It was a date historical., historical date, date historical,historical,False,-16.034015655517578,-19.795007705688477,3.7609920501708984,14067712,EleutherAI/pythia-14m,step135000,seed6,6,135000
It was about college degrees.,degree,degrees,It was about degrees college., college degrees, degrees college,college,True,-18.322052001953125,-22.44818687438965,4.126134872436523,14067712,EleutherAI/pythia-14m,step135000,seed6,6,135000
They liked the architectural design.,design,design,They liked the design architectural., architectural design, design architectural,architectural,False,-12.657461166381836,-17.762508392333984,5.105047225952148,14067712,EleutherAI/pythia-14m,step135000,seed6,6,135000
They liked the anniversary dinner.,dinner,dinner,They liked the dinner anniversary., anniversary dinner, dinner anniversary,anniversary,True,-17.223804473876953,-17.836380004882812,0.6125755310058594,14067712,EleutherAI/pythia-14m,step135000,seed6,6,135000
He had a career dream.,dream,dream,He had a dream career., career dream, dream career,career,True,-16.889995574951172,-14.835613250732422,-2.05438232421875,14067712,EleutherAI/pythia-14m,step135000,seed6,6,135000
It was a battery-powered drill.,drill,drill,It was a drill battery-powered., battery-powered drill, drill battery-powered,battery-powered,False,-27.36153793334961,-30.314037322998047,2.9524993896484375,14067712,EleutherAI/pythia-14m,step135000,seed6,6,135000
It was a physical examination.,examination,examination,It was an examination physical., physical examination, examination physical,physical,False,-13.82611083984375,-19.991161346435547,6.165050506591797,14067712,EleutherAI/pythia-14m,step135000,seed6,6,135000
They had an enthusiastic fan.,fan,fan,They had an fan enthusiastic., enthusiastic fan, fan enthusiastic,enthusiastic,False,-15.807347297668457,-22.699480056762695,6.892132759094238,14067712,EleutherAI/pythia-14m,step135000,seed6,6,135000
She had a steel file.,file,file,She had a file steel., steel file, file steel,steel,True,-18.24715805053711,-22.85167694091797,4.604518890380859,14067712,EleutherAI/pythia-14m,step135000,seed6,6,135000
It was a plastic film.,film,film,It was a film plastic., plastic film, film plastic,plastic,False,-13.965115547180176,-20.88882064819336,6.923705101013184,14067712,EleutherAI/pythia-14m,step135000,seed6,6,135000
It was a concrete foundation.,foundation,foundation,It was a foundation concrete., concrete foundation, foundation concrete,concrete,False,-14.339040756225586,-18.63736343383789,4.298322677612305,14067712,EleutherAI/pythia-14m,step135000,seed6,6,135000
It was a business function.,function,function,It was a function business., business function, function business,business,True,-14.10965347290039,-17.79073715209961,3.6810836791992188,14067712,EleutherAI/pythia-14m,step135000,seed6,6,135000
He was on the parade ground.,ground,ground,He was on the ground parade., parade ground, ground parade,parade,True,-16.235837936401367,-16.328102111816406,0.09226417541503906,14067712,EleutherAI/pythia-14m,step135000,seed6,6,135000
They liked the national guard.,guard,guard,They liked the guard national., national guard, guard national,national,False,-18.020095825195312,-21.309606552124023,3.289510726928711,14067712,EleutherAI/pythia-14m,step135000,seed6,6,135000
He had a friendly guide.,guide,guide,He had a guide friendly., friendly guide, guide friendly,friendly,False,-14.666994094848633,-19.830726623535156,5.163732528686523,14067712,EleutherAI/pythia-14m,step135000,seed6,6,135000
It was a nursing home.,home,home,It was a home nursing., nursing home, home nursing,nursing,True,-13.107969284057617,-17.05656623840332,3.948596954345703,14067712,EleutherAI/pythia-14m,step135000,seed6,6,135000
They had military intelligence.,intelligence,intelligence,They had intelligence military., military intelligence, intelligence military,military,False,-15.222805976867676,-22.65855598449707,7.4357500076293945,14067712,EleutherAI/pythia-14m,step135000,seed6,6,135000
It was a special issue.,issue,issue,It was an issue special., special issue, issue special,special,False,-13.250484466552734,-17.564838409423828,4.314353942871094,14067712,EleutherAI/pythia-14m,step135000,seed6,6,135000
It was a paper jam.,jam,jam,It was a jam paper., paper jam, jam paper,paper,True,-21.11435890197754,-22.45256996154785,1.3382110595703125,14067712,EleutherAI/pythia-14m,step135000,seed6,6,135000
It was a backspace key.,key,key,It was a key backspace., backspace key, key backspace,backspace,True,-29.15607452392578,-27.456645965576172,-1.6994285583496094,14067712,EleutherAI/pythia-14m,step135000,seed6,6,135000
They liked the friendly lamb.,lamb,lamb,They liked the lamb friendly., friendly lamb, lamb friendly,friendly,False,-18.679523468017578,-20.77208709716797,2.0925636291503906,14067712,EleutherAI/pythia-14m,step135000,seed6,6,135000
She had door locks.,lock,locks,She had locks door., door locks, locks door,door,True,-16.82992172241211,-18.866531372070312,2.036609649658203,14067712,EleutherAI/pythia-14m,step135000,seed6,6,135000
They liked the women's lunch.,lunch,lunch,They liked the lunch women's., women's lunch, lunch women's,women,True,-17.478790283203125,-22.98629379272461,5.507503509521484,14067712,EleutherAI/pythia-14m,step135000,seed6,6,135000
He liked the stock market.,market,market,He liked the market stock., stock market, market stock,stock,True,-14.122293472290039,-17.510921478271484,3.3886280059814453,14067712,EleutherAI/pythia-14m,step135000,seed6,6,135000
It was a tennis match.,match,match,It was a match tennis., tennis match, match tennis,tennis,True,-15.421478271484375,-21.69042205810547,6.268943786621094,14067712,EleutherAI/pythia-14m,step135000,seed6,6,135000
It was veterinary medicine.,medicine,medicine,It was medicine veterinary., veterinary medicine, medicine veterinary,veterinary,False,-18.103431701660156,-25.973724365234375,7.870292663574219,14067712,EleutherAI/pythia-14m,step135000,seed6,6,135000
There was a clear message.,message,message,There was a message clear., clear message, message clear,clear,False,-13.543160438537598,-18.14866065979004,4.605500221252441,14067712,EleutherAI/pythia-14m,step135000,seed6,6,135000
It was a clay mold.,mold,mold,It was a mold clay., clay mold, mold clay,clay,True,-19.48703384399414,-21.904272079467773,2.417238235473633,14067712,EleutherAI/pythia-14m,step135000,seed6,6,135000
She saw the fast mole.,mole,mole,She saw the mole fast., fast mole, mole fast,fast,False,-22.046180725097656,-20.598424911499023,-1.4477558135986328,14067712,EleutherAI/pythia-14m,step135000,seed6,6,135000
He liked the civil-rights movement.,movement,movement,He liked the movement civil-rights., civil-rights movement, movement civil-rights,civil-rights,False,-20.44987678527832,-29.95191764831543,9.50204086303711,14067712,EleutherAI/pythia-14m,step135000,seed6,6,135000
It was a shredded newspaper.,newspaper,newspaper,It was a newspaper shredded., shredded newspaper, newspaper shredded,shredded,False,-22.398298263549805,-23.32693099975586,0.9286327362060547,14067712,EleutherAI/pythia-14m,step135000,seed6,6,135000
It was a reddish orange.,orange,orange,It was an orange reddish., reddish orange, orange reddish,reddish,False,-19.065210342407227,-17.550085067749023,-1.5151252746582031,14067712,EleutherAI/pythia-14m,step135000,seed6,6,135000
He saw the ripped page.,page,page,He saw the page ripped., ripped page, page ripped,ripped,False,-21.923011779785156,-18.883869171142578,-3.039142608642578,14067712,EleutherAI/pythia-14m,step135000,seed6,6,135000
It was a tree palm.,palm,palm,It was a palm tree., tree palm, palm tree,tree,True,-20.522293090820312,-14.549234390258789,-5.973058700561523,14067712,EleutherAI/pythia-14m,step135000,seed6,6,135000
It was a consumer panel.,panel,panel,It was a panel consumer., consumer panel, panel consumer,consumer,True,-18.713958740234375,-21.597043991088867,2.883085250854492,14067712,EleutherAI/pythia-14m,step135000,seed6,6,135000
It was a biblical passage.,passage,passage,It was a passage biblical., biblical passage, passage biblical,biblical,False,-18.297487258911133,-22.774221420288086,4.476734161376953,14067712,EleutherAI/pythia-14m,step135000,seed6,6,135000
It was a secure perch.,perch,perch,It was a perch secure., secure perch, perch secure,secure,False,-24.077251434326172,-25.122573852539062,1.0453224182128906,14067712,EleutherAI/pythia-14m,step135000,seed6,6,135000
He saw the plastic pitcher.,pitcher,pitcher,He saw the pitcher plastic., plastic pitcher, pitcher plastic,plastic,True,-19.76569938659668,-23.418190002441406,3.6524906158447266,14067712,EleutherAI/pythia-14m,step135000,seed6,6,135000
It was a sweet port.,port,port,It was a port sweet., sweet port, port sweet,sweet,False,-19.56442642211914,-22.710063934326172,3.1456375122070312,14067712,EleutherAI/pythia-14m,step135000,seed6,6,135000
He was in a yoga position.,position,position,He was in a position yoga., yoga position, position yoga,yoga,True,-18.14283561706543,-19.153606414794922,1.0107707977294922,14067712,EleutherAI/pythia-14m,step135000,seed6,6,135000
It was a challenging post.,post,post,It was a post challenging., challenging post, post challenging,challenging,False,-16.724348068237305,-17.41504669189453,0.6906986236572266,14067712,EleutherAI/pythia-14m,step135000,seed6,6,135000
He had the quickest punch.,punch,punch,He had the punch quickest., quickest punch, punch quickest,quickest,False,-20.389053344726562,-26.057605743408203,5.668552398681641,14067712,EleutherAI/pythia-14m,step135000,seed6,6,135000
She had a cloudy pupil.,pupil,pupil,She had a pupil cloudy., cloudy pupil, pupil cloudy,cloudy,False,-21.415363311767578,-23.556652069091797,2.1412887573242188,14067712,EleutherAI/pythia-14m,step135000,seed6,6,135000
That was a tennis racket.,racket,racket,That was a racket tennis., tennis racket, racket tennis,tennis,True,-20.22449493408203,-24.20726776123047,3.9827728271484375,14067712,EleutherAI/pythia-14m,step135000,seed6,6,135000
He liked granite rock.,rock,rock,He liked rock granite., granite rock, rock granite,granite,True,-20.083759307861328,-22.112628936767578,2.02886962890625,14067712,EleutherAI/pythia-14m,step135000,seed6,6,135000
He saw the bushy sage.,sage,sage,He saw the sage bushy., bushy sage, sage bushy,bushy,False,-27.064571380615234,-28.60767364501953,1.5431022644042969,14067712,EleutherAI/pythia-14m,step135000,seed6,6,135000
It was a major scale.,scale,scale,It was a scale major., major scale, scale major,major,False,-14.27095890045166,-20.177322387695312,5.906363487243652,14067712,EleutherAI/pythia-14m,step135000,seed6,6,135000
It was a panoramic scene.,scene,scene,It was a scene panoramic., panoramic scene, scene panoramic,panoramic,False,-19.0977725982666,-25.36908531188965,6.271312713623047,14067712,EleutherAI/pythia-14m,step135000,seed6,6,135000
It was a trained seal.,seal,seal,It was a seal trained., trained seal, seal trained,trained,False,-22.519855499267578,-22.861553192138672,0.34169769287109375,14067712,EleutherAI/pythia-14m,step135000,seed6,6,135000
He used the video tape.,tape,tape,He used the tape video., video tape, tape video,video,True,-13.560432434082031,-15.007185935974121,1.4467535018920898,14067712,EleutherAI/pythia-14m,step135000,seed6,6,135000
It was a technical term.,term,term,It was a term technical., technical term, term technical,technical,False,-17.84001922607422,-20.11477279663086,2.2747535705566406,14067712,EleutherAI/pythia-14m,step135000,seed6,6,135000
It was a diseased tick.,tick,tick,It was a tick diseased., diseased tick, tick diseased,diseased,False,-22.537738800048828,-26.160938262939453,3.623199462890625,14067712,EleutherAI/pythia-14m,step135000,seed6,6,135000
It was a finger tip.,tip,tip,It was a tip finger., finger tip, tip finger,finger,True,-21.097888946533203,-20.519142150878906,-0.5787467956542969,14067712,EleutherAI/pythia-14m,step135000,seed6,6,135000
She liked the professional title.,title,title,She liked the title professional., professional title, title professional,professional,False,-16.138423919677734,-18.944108963012695,2.805685043334961,14067712,EleutherAI/pythia-14m,step135000,seed6,6,135000
It was a bell toll.,toll,toll,It was a toll bell., bell toll, toll bell,bell,True,-21.694427490234375,-23.104475021362305,1.4100475311279297,14067712,EleutherAI/pythia-14m,step135000,seed6,6,135000
She saw the snowshoe tracks.,track,tracks,She saw the tracks snowshoe., snowshoe tracks, tracks snowshoe,snowshoe,True,-30.26961326599121,-31.45145606994629,1.1818428039550781,14067712,EleutherAI/pythia-14m,step135000,seed6,6,135000
They were cluttered yards.,yard,yards,They were yards cluttered., cluttered yards, yards cluttered,cluttered,False,-23.76828384399414,-26.31743812561035,2.549154281616211,14067712,EleutherAI/pythia-14m,step135000,seed6,6,135000
