sentence,word,string,reversed_sentence,mod_np,reversed_mod,disambiguating_word,non_adjective,original_logprob,reversed_logprob,ratio,n_params,mpath,revision,seed_name,seed,step
It was a desperate act.,act,act,It was an act desperate., desperate act, act desperate,desperate,False,-15.431229591369629,-18.31557846069336,2.8843488693237305,14067712,EleutherAI/pythia-14m,step68000,seed5,5,68000
It was a humane act.,act,act,It was an act humane., humane act, act humane,humane,False,-19.181421279907227,-21.26124382019043,2.079822540283203,14067712,EleutherAI/pythia-14m,step68000,seed5,5,68000
It was a magic act.,act,act,It was an act magic., magic act, act magic,magic,False,-15.897102355957031,-18.20217514038086,2.305072784423828,14067712,EleutherAI/pythia-14m,step68000,seed5,5,68000
He had a universal appeal.,appeal,appeal,He had an appeal universal., universal appeal, appeal universal,universal,False,-19.685081481933594,-20.67691421508789,0.9918327331542969,14067712,EleutherAI/pythia-14m,step68000,seed5,5,68000
He had an undefinable appeal.,appeal,appeal,He had an appeal undefinable., undefinable appeal, appeal undefinable,undefinable,False,-23.032333374023438,-26.2294864654541,3.197153091430664,14067712,EleutherAI/pythia-14m,step68000,seed5,5,68000
He had a legal appeal.,appeal,appeal,He had an appeal legal., legal appeal, appeal legal,legal,False,-13.509170532226562,-16.819950103759766,3.310779571533203,14067712,EleutherAI/pythia-14m,step68000,seed5,5,68000
It was a tense atmosphere.,atmosphere,atmosphere,It was an atmosphere tense., tense atmosphere, atmosphere tense,tense,False,-16.948829650878906,-20.857158660888672,3.9083290100097656,14067712,EleutherAI/pythia-14m,step68000,seed5,5,68000
It was a hostile atmosphere.,atmosphere,atmosphere,It was an atmosphere hostile., hostile atmosphere, atmosphere hostile,hostile,False,-17.732908248901367,-20.761348724365234,3.028440475463867,14067712,EleutherAI/pythia-14m,step68000,seed5,5,68000
It was a gaseous atmosphere.,atmosphere,atmosphere,It was an atmosphere gaseous., gaseous atmosphere, atmosphere gaseous,gaseous,False,-18.712486267089844,-23.594173431396484,4.881687164306641,14067712,EleutherAI/pythia-14m,step68000,seed5,5,68000
It was a gold band.,band,band,It was a band gold., gold band, band gold,gold,True,-13.867744445800781,-18.090274810791016,4.222530364990234,14067712,EleutherAI/pythia-14m,step68000,seed5,5,68000
It was a rubber band.,band,band,It was a band rubber., rubber band, band rubber,rubber,True,-13.96435546875,-19.427570343017578,5.463214874267578,14067712,EleutherAI/pythia-14m,step68000,seed5,5,68000
It was a jazz band.,band,band,It was a band jazz., jazz band, band jazz,jazz,True,-14.30129337310791,-18.893009185791016,4.5917158126831055,14067712,EleutherAI/pythia-14m,step68000,seed5,5,68000
There was a police barrier.,barrier,barrier,There was a barrier police., police barrier, barrier police,police,True,-20.534900665283203,-20.011428833007812,-0.5234718322753906,14067712,EleutherAI/pythia-14m,step68000,seed5,5,68000
There was a concrete barrier.,barrier,barrier,There was a barrier concrete., concrete barrier, barrier concrete,concrete,False,-15.645805358886719,-19.8087158203125,4.162910461425781,14067712,EleutherAI/pythia-14m,step68000,seed5,5,68000
There was a language barrier.,barrier,barrier,There was a barrier language., language barrier, barrier language,language,True,-19.072219848632812,-19.941619873046875,0.8694000244140625,14067712,EleutherAI/pythia-14m,step68000,seed5,5,68000
He saw a furry bat.,bat,bat,He saw a bat furry., furry bat, bat furry,furry,False,-19.386573791503906,-24.02849769592285,4.641923904418945,14067712,EleutherAI/pythia-14m,step68000,seed5,5,68000
He saw a fruit bat.,bat,bat,He saw a bat fruit., fruit bat, bat fruit,fruit,True,-17.832279205322266,-20.90044403076172,3.068164825439453,14067712,EleutherAI/pythia-14m,step68000,seed5,5,68000
He saw a wooden bat.,bat,bat,He saw a bat wooden., wooden bat, bat wooden,wooden,False,-16.651622772216797,-24.15380096435547,7.502178192138672,14067712,EleutherAI/pythia-14m,step68000,seed5,5,68000
He saw the laser beam.,beam,beam,He saw the beam laser., laser beam, beam laser,laser,True,-11.313756942749023,-16.033153533935547,4.719396591186523,14067712,EleutherAI/pythia-14m,step68000,seed5,5,68000
He saw the bright beam.,beam,beam,He saw the beam bright., bright beam, beam bright,bright,False,-16.785560607910156,-16.947383880615234,0.16182327270507812,14067712,EleutherAI/pythia-14m,step68000,seed5,5,68000
He saw the wood beam.,beam,beam,He saw the beam wood., wood beam, beam wood,wood,True,-17.589561462402344,-20.296138763427734,2.7065773010253906,14067712,EleutherAI/pythia-14m,step68000,seed5,5,68000
She had a toy block.,block,block,She had a block toy., toy block, block toy,toy,True,-15.84052848815918,-18.119298934936523,2.2787704467773438,14067712,EleutherAI/pythia-14m,step68000,seed5,5,68000
She had a wooden block.,block,block,She had a block wooden., wooden block, block wooden,wooden,False,-15.459066390991211,-21.843849182128906,6.384782791137695,14067712,EleutherAI/pythia-14m,step68000,seed5,5,68000
She had a mental block.,block,block,She had a block mental., mental block, block mental,mental,False,-14.11886978149414,-20.444435119628906,6.325565338134766,14067712,EleutherAI/pythia-14m,step68000,seed5,5,68000
He has coagulated blood.,blood,blood,He has blood coagulated., coagulated blood, blood coagulated,coagulated,True,-26.572980880737305,-26.438875198364258,-0.13410568237304688,14067712,EleutherAI/pythia-14m,step68000,seed5,5,68000
He has thin blood.,blood,blood,He has blood thin., thin blood, blood thin,thin,False,-18.1455078125,-19.47666358947754,1.331155776977539,14067712,EleutherAI/pythia-14m,step68000,seed5,5,68000
He has noble blood.,blood,blood,He has blood noble., noble blood, blood noble,noble,False,-20.320926666259766,-22.920053482055664,2.5991268157958984,14067712,EleutherAI/pythia-14m,step68000,seed5,5,68000
It was the ironing board.,board,board,It was the board ironing., ironing board, board ironing,ironing,False,-24.748767852783203,-23.281862258911133,-1.4669055938720703,14067712,EleutherAI/pythia-14m,step68000,seed5,5,68000
It was the wooden board.,board,board,It was the board wooden., wooden board, board wooden,wooden,False,-15.042688369750977,-21.116802215576172,6.074113845825195,14067712,EleutherAI/pythia-14m,step68000,seed5,5,68000
It was the executive board.,board,board,It was the board executive., executive board, board executive,executive,True,-15.483039855957031,-17.100597381591797,1.6175575256347656,14067712,EleutherAI/pythia-14m,step68000,seed5,5,68000
He had a best-selling book.,book,book,He had a book best-selling., best-selling book, book best-selling,best-selling,False,-16.5579833984375,-21.94025421142578,5.382270812988281,14067712,EleutherAI/pythia-14m,step68000,seed5,5,68000
He had a popular book.,book,book,He had a book popular., popular book, book popular,popular,False,-15.164817810058594,-18.862716674804688,3.6978988647460938,14067712,EleutherAI/pythia-14m,step68000,seed5,5,68000
He had a heavy book.,book,book,He had a book heavy., heavy book, book heavy,heavy,False,-15.439310073852539,-18.206863403320312,2.7675533294677734,14067712,EleutherAI/pythia-14m,step68000,seed5,5,68000
They ate a pancake breakfast.,breakfast,breakfast,They ate a breakfast pancake., pancake breakfast, breakfast pancake,pancake,True,-16.296852111816406,-17.328229904174805,1.0313777923583984,14067712,EleutherAI/pythia-14m,step68000,seed5,5,68000
They ate a nutritious breakfast.,breakfast,breakfast,They ate a breakfast nutritious., nutritious breakfast, breakfast nutritious,nutritious,False,-19.626789093017578,-24.869487762451172,5.242698669433594,14067712,EleutherAI/pythia-14m,step68000,seed5,5,68000
They ate a family breakfast.,breakfast,breakfast,They ate a breakfast family., family breakfast, breakfast family,family,True,-14.600996017456055,-14.764324188232422,0.1633281707763672,14067712,EleutherAI/pythia-14m,step68000,seed5,5,68000
It was a red cape.,cape,cape,It was a cape red., red cape, cape red,red,False,-19.348918914794922,-20.878156661987305,1.5292377471923828,14067712,EleutherAI/pythia-14m,step68000,seed5,5,68000
It was a flowing cape.,cape,cape,It was a cape flowing., flowing cape, cape flowing,flowing,False,-23.91845703125,-25.39704704284668,1.4785900115966797,14067712,EleutherAI/pythia-14m,step68000,seed5,5,68000
It was a rocky cape.,cape,cape,It was a cape rocky., rocky cape, cape rocky,rocky,False,-21.023900985717773,-27.224836349487305,6.200935363769531,14067712,EleutherAI/pythia-14m,step68000,seed5,5,68000
It was a beer case.,case,case,It was a case beer., beer case, case beer,beer,True,-16.90070343017578,-20.057714462280273,3.157011032104492,14067712,EleutherAI/pythia-14m,step68000,seed5,5,68000
It was a display case.,case,case,It was a case display., display case, case display,display,True,-16.676437377929688,-17.56476402282715,0.8883266448974609,14067712,EleutherAI/pythia-14m,step68000,seed5,5,68000
It was a divorce case.,case,case,It was a case divorce., divorce case, case divorce,divorce,True,-13.652496337890625,-19.50789451599121,5.855398178100586,14067712,EleutherAI/pythia-14m,step68000,seed5,5,68000
It was a worthy cause.,cause,cause,It was a cause worthy., worthy cause, cause worthy,worthy,False,-14.050464630126953,-18.91560935974121,4.865144729614258,14067712,EleutherAI/pythia-14m,step68000,seed5,5,68000
It was a political cause.,cause,cause,It was a cause political., political cause, cause political,political,False,-15.345231056213379,-20.5166072845459,5.1713762283325195,14067712,EleutherAI/pythia-14m,step68000,seed5,5,68000
It was a main cause.,cause,cause,It was a cause main., main cause, cause main,main,False,-11.933534622192383,-20.90863609313965,8.975101470947266,14067712,EleutherAI/pythia-14m,step68000,seed5,5,68000
It was a skin cell.,cell,cell,It was a cell skin., skin cell, cell skin,skin,True,-18.427499771118164,-19.375816345214844,0.9483165740966797,14067712,EleutherAI/pythia-14m,step68000,seed5,5,68000
It was a brain cell.,cell,cell,It was a cell brain., brain cell, cell brain,brain,True,-14.128335952758789,-17.615333557128906,3.486997604370117,14067712,EleutherAI/pythia-14m,step68000,seed5,5,68000
It was a prison cell.,cell,cell,It was a cell prison., prison cell, cell prison,prison,True,-14.315534591674805,-16.02465057373047,1.709115982055664,14067712,EleutherAI/pythia-14m,step68000,seed5,5,68000
She had a devilish charm.,charm,charm,She had a charm devilish., devilish charm, charm devilish,devilish,False,-20.432340621948242,-27.359355926513672,6.92701530456543,14067712,EleutherAI/pythia-14m,step68000,seed5,5,68000
She had a natural charm.,charm,charm,She had a charm natural., natural charm, charm natural,natural,False,-15.761326789855957,-20.59933090209961,4.838004112243652,14067712,EleutherAI/pythia-14m,step68000,seed5,5,68000
She had a gold charm.,charm,charm,She had a charm gold., gold charm, charm gold,gold,True,-17.46157455444336,-20.208492279052734,2.746917724609375,14067712,EleutherAI/pythia-14m,step68000,seed5,5,68000
They liked the juicy chicken.,chicken,chicken,They liked the chicken juicy., juicy chicken, chicken juicy,juicy,False,-18.05390167236328,-21.661420822143555,3.6075191497802734,14067712,EleutherAI/pythia-14m,step68000,seed5,5,68000
They liked the roasted chicken.,chicken,chicken,They liked the chicken roasted., roasted chicken, chicken roasted,roasted,False,-16.189647674560547,-17.971172332763672,1.781524658203125,14067712,EleutherAI/pythia-14m,step68000,seed5,5,68000
They liked the clucking chicken.,chicken,chicken,They liked the chicken clucking., clucking chicken, chicken clucking,clucking,True,-24.760278701782227,-24.721220016479492,-0.039058685302734375,14067712,EleutherAI/pythia-14m,step68000,seed5,5,68000
It was a perceptive class.,class,class,It was a class perceptive., perceptive class, class perceptive,perceptive,False,-20.85202407836914,-25.473365783691406,4.621341705322266,14067712,EleutherAI/pythia-14m,step68000,seed5,5,68000
It was a misbehaving class.,class,class,It was a class misbehaving., misbehaving class, class misbehaving,misbehaving,False,-24.02778434753418,-27.503820419311523,3.4760360717773438,14067712,EleutherAI/pythia-14m,step68000,seed5,5,68000
It was a boring class.,class,class,It was a class boring., boring class, class boring,boring,False,-15.701377868652344,-17.928192138671875,2.2268142700195312,14067712,EleutherAI/pythia-14m,step68000,seed5,5,68000
It was a film clip.,clip,clip,It was a clip film., film clip, clip film,film,True,-17.732362747192383,-19.628435134887695,1.8960723876953125,14067712,EleutherAI/pythia-14m,step68000,seed5,5,68000
It was a video clip.,clip,clip,It was a clip video., video clip, clip video,video,True,-11.686626434326172,-18.236650466918945,6.550024032592773,14067712,EleutherAI/pythia-14m,step68000,seed5,5,68000
It was a hair clip.,clip,clip,It was a clip hair., hair clip, clip hair,hair,True,-16.8148250579834,-21.072359085083008,4.257534027099609,14067712,EleutherAI/pythia-14m,step68000,seed5,5,68000
It was an icy cold.,cold,cold,It was an cold icy., icy cold, cold icy,icy,False,-12.560697555541992,-19.9370059967041,7.376308441162109,14067712,EleutherAI/pythia-14m,step68000,seed5,5,68000
It was a freezing cold.,cold,cold,It was a cold freezing., freezing cold, cold freezing,freezing,False,-14.158590316772461,-15.700790405273438,1.5422000885009766,14067712,EleutherAI/pythia-14m,step68000,seed5,5,68000
It was a chest cold.,cold,cold,It was a cold chest., chest cold, cold chest,chest,False,-17.777015686035156,-16.338592529296875,-1.4384231567382812,14067712,EleutherAI/pythia-14m,step68000,seed5,5,68000
It was a gossip column.,column,column,It was a column gossip., gossip column, column gossip,gossip,True,-19.840564727783203,-22.301326751708984,2.4607620239257812,14067712,EleutherAI/pythia-14m,step68000,seed5,5,68000
It was a sports column.,column,column,It was a column sports., sports column, column sports,sports,True,-17.832731246948242,-21.779720306396484,3.946989059448242,14067712,EleutherAI/pythia-14m,step68000,seed5,5,68000
It was a concrete column.,column,column,It was a column concrete., concrete column, column concrete,concrete,False,-17.329607009887695,-21.66653060913086,4.336923599243164,14067712,EleutherAI/pythia-14m,step68000,seed5,5,68000
He liked the investment company.,company,company,He liked the company investment., investment company, company investment,investment,True,-14.304654121398926,-13.830777168273926,-0.473876953125,14067712,EleutherAI/pythia-14m,step68000,seed5,5,68000
He liked the pharmaceutical company.,company,company,He liked the company pharmaceutical., pharmaceutical company, company pharmaceutical,pharmaceutical,False,-13.045343399047852,-16.05874252319336,3.013399124145508,14067712,EleutherAI/pythia-14m,step68000,seed5,5,68000
He liked the pleasant company.,company,company,He liked the company pleasant., pleasant company, company pleasant,pleasant,False,-18.181352615356445,-17.740230560302734,-0.44112205505371094,14067712,EleutherAI/pythia-14m,step68000,seed5,5,68000
It was a waffle cone.,cone,cone,It was a cone waffle., waffle cone, cone waffle,waffle,True,-22.78278350830078,-25.763010025024414,2.980226516723633,14067712,EleutherAI/pythia-14m,step68000,seed5,5,68000
It was a sugar cone.,cone,cone,It was a cone sugar., sugar cone, cone sugar,sugar,True,-19.770933151245117,-23.461008071899414,3.690074920654297,14067712,EleutherAI/pythia-14m,step68000,seed5,5,68000
It was an orange cone.,cone,cone,It was an cone orange., orange cone, cone orange,orange,False,-14.224252700805664,-26.570087432861328,12.345834732055664,14067712,EleutherAI/pythia-14m,step68000,seed5,5,68000
He made a charitable contribution.,contribution,contribution,He made a contribution charitable., charitable contribution, contribution charitable,charitable,False,-15.218024253845215,-23.492111206054688,8.274086952209473,14067712,EleutherAI/pythia-14m,step68000,seed5,5,68000
He made a voluntary contribution.,contribution,contribution,He made a contribution voluntary., voluntary contribution, contribution voluntary,voluntary,False,-16.29512596130371,-22.915328979492188,6.620203018188477,14067712,EleutherAI/pythia-14m,step68000,seed5,5,68000
He made a scholarly contribution.,contribution,contribution,He made a contribution scholarly., scholarly contribution, contribution scholarly,scholarly,False,-19.316492080688477,-25.884933471679688,6.568441390991211,14067712,EleutherAI/pythia-14m,step68000,seed5,5,68000
That was the noble count.,count,count,That was the count noble., noble count, count noble,noble,False,-19.599897384643555,-23.02667808532715,3.4267807006835938,14067712,EleutherAI/pythia-14m,step68000,seed5,5,68000
That was the vengeful count.,count,count,That was the count vengeful., vengeful count, count vengeful,vengeful,False,-23.528892517089844,-29.28955841064453,5.7606658935546875,14067712,EleutherAI/pythia-14m,step68000,seed5,5,68000
That was the final count.,count,count,That was the count final., final count, count final,final,False,-15.083897590637207,-21.9561824798584,6.872284889221191,14067712,EleutherAI/pythia-14m,step68000,seed5,5,68000
It was an introductory course.,course,course,It was an course introductory., introductory course, course introductory,introductory,False,-12.176932334899902,-25.769454956054688,13.592522621154785,14067712,EleutherAI/pythia-14m,step68000,seed5,5,68000
It was a pass-fail course.,course,course,It was a course pass-fail., pass-fail course, course pass-fail,pass-fail,False,-28.647891998291016,-32.340599060058594,3.692707061767578,14067712,EleutherAI/pythia-14m,step68000,seed5,5,68000
It was a charted course.,course,course,It was a course charted., charted course, course charted,charted,False,-23.599990844726562,-23.636390686035156,0.03639984130859375,14067712,EleutherAI/pythia-14m,step68000,seed5,5,68000
It was a dinner date.,date,date,It was a date dinner., dinner date, date dinner,dinner,True,-16.9713077545166,-20.223907470703125,3.2525997161865234,14067712,EleutherAI/pythia-14m,step68000,seed5,5,68000
It was a blind date.,date,date,It was a date blind., blind date, date blind,blind,False,-16.819122314453125,-20.493133544921875,3.67401123046875,14067712,EleutherAI/pythia-14m,step68000,seed5,5,68000
It was an expiration date.,date,date,It was an date expiration., expiration date, date expiration,expiration,True,-13.337307929992676,-27.500734329223633,14.163426399230957,14067712,EleutherAI/pythia-14m,step68000,seed5,5,68000
It was about forty degrees.,degree,degrees,It was about degrees forty., forty degrees, degrees forty,forty,True,-14.406144142150879,-25.85043716430664,11.444293022155762,14067712,EleutherAI/pythia-14m,step68000,seed5,5,68000
It was about fifty degrees.,degree,degrees,It was about degrees fifty., fifty degrees, degrees fifty,fifty,True,-13.824858665466309,-26.124652862548828,12.29979419708252,14067712,EleutherAI/pythia-14m,step68000,seed5,5,68000
It was about associate degrees.,degree,degrees,It was about degrees associate., associate degrees, degrees associate,associate,False,-25.531780242919922,-26.346729278564453,0.8149490356445312,14067712,EleutherAI/pythia-14m,step68000,seed5,5,68000
They liked the floral design.,design,design,They liked the design floral., floral design, design floral,floral,False,-16.13629722595215,-19.476333618164062,3.340036392211914,14067712,EleutherAI/pythia-14m,step68000,seed5,5,68000
They liked the geometric design.,design,design,They liked the design geometric., geometric design, design geometric,geometric,False,-16.149219512939453,-20.580474853515625,4.431255340576172,14067712,EleutherAI/pythia-14m,step68000,seed5,5,68000
They liked the product design.,design,design,They liked the design product., product design, design product,product,True,-14.19332504272461,-14.924470901489258,0.7311458587646484,14067712,EleutherAI/pythia-14m,step68000,seed5,5,68000
They liked the turkey dinner.,dinner,dinner,They liked the dinner turkey., turkey dinner, dinner turkey,turkey,True,-18.056129455566406,-20.300315856933594,2.2441864013671875,14067712,EleutherAI/pythia-14m,step68000,seed5,5,68000
They liked the light dinner.,dinner,dinner,They liked the dinner light., light dinner, dinner light,light,False,-18.467483520507812,-19.20818328857422,0.7406997680664062,14067712,EleutherAI/pythia-14m,step68000,seed5,5,68000
They liked the formal dinner.,dinner,dinner,They liked the dinner formal., formal dinner, dinner formal,formal,False,-19.04764175415039,-21.539024353027344,2.491382598876953,14067712,EleutherAI/pythia-14m,step68000,seed5,5,68000
He had a recurring dream.,dream,dream,He had a dream recurring., recurring dream, dream recurring,recurring,False,-14.83811092376709,-21.000028610229492,6.161917686462402,14067712,EleutherAI/pythia-14m,step68000,seed5,5,68000
He had a bad dream.,dream,dream,He had a dream bad., bad dream, dream bad,bad,False,-11.952400207519531,-16.768186569213867,4.815786361694336,14067712,EleutherAI/pythia-14m,step68000,seed5,5,68000
He had a childhood dream.,dream,dream,He had a dream childhood., childhood dream, dream childhood,childhood,True,-16.784683227539062,-18.621732711791992,1.8370494842529297,14067712,EleutherAI/pythia-14m,step68000,seed5,5,68000
It was a grueling drill.,drill,drill,It was a drill grueling., grueling drill, drill grueling,grueling,False,-22.667724609375,-26.13578987121582,3.4680652618408203,14067712,EleutherAI/pythia-14m,step68000,seed5,5,68000
It was a challenging drill.,drill,drill,It was a drill challenging., challenging drill, drill challenging,challenging,False,-19.353120803833008,-22.12086296081543,2.767742156982422,14067712,EleutherAI/pythia-14m,step68000,seed5,5,68000
It was an electric drill.,drill,drill,It was an drill electric., electric drill, drill electric,electric,False,-17.467124938964844,-26.298072814941406,8.830947875976562,14067712,EleutherAI/pythia-14m,step68000,seed5,5,68000
It was a multiple-choice examination.,examination,examination,It was an examination multiple-choice., multiple-choice examination, examination multiple-choice,multiple-choice,False,-23.654821395874023,-29.660568237304688,6.005746841430664,14067712,EleutherAI/pythia-14m,step68000,seed5,5,68000
It was a difficult examination.,examination,examination,It was an examination difficult., difficult examination, examination difficult,difficult,False,-14.634355545043945,-18.537315368652344,3.9029598236083984,14067712,EleutherAI/pythia-14m,step68000,seed5,5,68000
It was a prostate examination.,examination,examination,It was an examination prostate., prostate examination, examination prostate,prostate,True,-19.824264526367188,-24.26287078857422,4.438606262207031,14067712,EleutherAI/pythia-14m,step68000,seed5,5,68000
They had an electric fan.,fan,fan,They had an fan electric., electric fan, fan electric,electric,False,-15.174789428710938,-25.685754776000977,10.510965347290039,14067712,EleutherAI/pythia-14m,step68000,seed5,5,68000
They had a ceiling fan.,fan,fan,They had a fan ceiling., ceiling fan, fan ceiling,ceiling,True,-18.043190002441406,-19.504947662353516,1.4617576599121094,14067712,EleutherAI/pythia-14m,step68000,seed5,5,68000
They had a zealous fan.,fan,fan,They had a fan zealous., zealous fan, fan zealous,zealous,False,-27.390674591064453,-30.071500778198242,2.680826187133789,14067712,EleutherAI/pythia-14m,step68000,seed5,5,68000
She had a text file.,file,file,She had a file text., text file, file text,text,True,-11.10550594329834,-16.632495880126953,5.526989936828613,14067712,EleutherAI/pythia-14m,step68000,seed5,5,68000
She had a data file.,file,file,She had a file data., data file, file data,data,True,-13.10591983795166,-15.945377349853516,2.8394575119018555,14067712,EleutherAI/pythia-14m,step68000,seed5,5,68000
She had a nail file.,file,file,She had a file nail., nail file, file nail,nail,True,-18.11074447631836,-19.510456085205078,1.3997116088867188,14067712,EleutherAI/pythia-14m,step68000,seed5,5,68000
It was an action film.,film,film,It was an film action., action film, film action,action,True,-15.167288780212402,-20.558238983154297,5.3909502029418945,14067712,EleutherAI/pythia-14m,step68000,seed5,5,68000
It was a censored film.,film,film,It was a film censored., censored film, film censored,censored,False,-22.175071716308594,-23.737163543701172,1.5620918273925781,14067712,EleutherAI/pythia-14m,step68000,seed5,5,68000
It was a transparent film.,film,film,It was a film transparent., transparent film, film transparent,transparent,False,-15.236213684082031,-18.739870071411133,3.5036563873291016,14067712,EleutherAI/pythia-14m,step68000,seed5,5,68000
It was a charitable foundation.,foundation,foundation,It was a foundation charitable., charitable foundation, foundation charitable,charitable,False,-13.580949783325195,-20.52109146118164,6.940141677856445,14067712,EleutherAI/pythia-14m,step68000,seed5,5,68000
It was an educational foundation.,foundation,foundation,It was an foundation educational., educational foundation, foundation educational,educational,False,-14.014411926269531,-23.701045989990234,9.686634063720703,14067712,EleutherAI/pythia-14m,step68000,seed5,5,68000
It was a wooden foundation.,foundation,foundation,It was a foundation wooden., wooden foundation, foundation wooden,wooden,False,-16.465469360351562,-22.031070709228516,5.565601348876953,14067712,EleutherAI/pythia-14m,step68000,seed5,5,68000
It was a mathematical function.,function,function,It was a function mathematical., mathematical function, function mathematical,mathematical,False,-13.414443969726562,-18.96722412109375,5.5527801513671875,14067712,EleutherAI/pythia-14m,step68000,seed5,5,68000
It was a linear function.,function,function,It was a function linear., linear function, function linear,linear,False,-13.334044456481934,-18.681015014648438,5.346970558166504,14067712,EleutherAI/pythia-14m,step68000,seed5,5,68000
